AMERICANA,DEPUTADO FEDERAL,ADHEMAR DE BARROS FILHO,ADHEMAR DE BARROS FILHO,SUPLENTE,PP,PARTIDO PROGRESSISTA,12
AMERICANA,DEPUTADO FEDERAL,LAYRTON INFANTE,LAYRTON INFANTE,SUPLENTE,PP,PARTIDO PROGRESSISTA,2
AMERICANA,DEPUTADO FEDERAL,MOURAD,MOHAMAD SAID MOURAD,SUPLENTE,PP,PARTIDO PROGRESSISTA,4
AMERICANA,DEPUTADO FEDERAL,CABO WILSON,WILSON DE OLIVEIRA MORAIS,SUPLENTE,PP,PARTIDO PROGRESSISTA,2
AMERICANA,DEPUTADO FEDERAL,MISSIONÁRIO JOSÉ OLIMPIO,JOSÉ OLIMPIO SILVEIRA MORAES,ELEITO,PP,PARTIDO PROGRESSISTA,386
AMERICANA,DEPUTADO FEDERAL,FERNANDO STANCATTI,FERNANDO CESAR STANCATTI MARQUES,SUPLENTE,PP,PARTIDO PROGRESSISTA,23
AMERICANA,DEPUTADO FEDERAL,MAURICIO HAKA,MAURICIO APARECIDO HAKA,SUPLENTE,PP,PARTIDO PROGRESSISTA,2
AMERICANA,DEPUTADO FEDERAL,ERIVAN,FRANCISCO ERIVAN PEREIRA,SUPLENTE,PP,PARTIDO PROGRESSISTA,3
AMERICANA,DEPUTADO FEDERAL,DR NECHAR,SERGIO ANTONIO NECHAR,SUPLENTE,PP,PARTIDO PROGRESSISTA,5
AMERICANA,DEPUTADO FEDERAL,NETO BELUCI,ALCIDES BELUCI NETO,SUPLENTE,PP,PARTIDO PROGRESSISTA,1
AMERICANA,DEPUTADO FEDERAL,PRICILA MENIN,LETEIA PRICILA GOMES,SUPLENTE,PP,PARTIDO PROGRESSISTA,1
AMERICANA,DEPUTADO FEDERAL,JORGE WILSON,JORGE WILSON GONÇALVES DE MATTOS,SUPLENTE,PP,PARTIDO PROGRESSISTA,1
AMERICANA,DEPUTADO FEDERAL,CAPITÃO CRIVELARI,LUIZ ANTONIO CRIVELARI,SUPLENTE,PP,PARTIDO PROGRESSISTA,1647
AMERICANA,DEPUTADO FEDERAL,DR LÉO KAHN,LEO JUVENAL KAHN DA SILVEIRA,SUPLENTE,PP,PARTIDO PROGRESSISTA,1
AMERICANA,DEPUTADO FEDERAL,VADÃO,ETIVALDO VADAO GOMES,SUPLENTE,PP,PARTIDO PROGRESSISTA,42
AMERICANA,DEPUTADO FEDERAL,PH,PAULO HENRIQUE RIBEIRO SANTANA,SUPLENTE,PDT,PARTIDO DEMOCRÁTICO TRABALHISTA,4
AMERICANA,DEPUTADO FEDERAL,KIM,MARCO ANTONIO ALVES JORGE,SUPLENTE,PDT,PARTIDO DEMOCRÁTICO TRABALHISTA,4554
AMERICANA,DEPUTADO FEDERAL,SARGENTO DARCY,DARCY RODRIGUES,SUPLENTE,PDT,PARTIDO DEMOCRÁTICO TRABALHISTA,9
AMERICANA,DEPUTADO FEDERAL,CARLITO VIANA,CARLITO VIANA SOARES,SUPLENTE,PDT,PARTIDO DEMOCRÁTICO TRABALHISTA,1
AMERICANA,DEPUTADO FEDERAL,NHA NHA,VALTER BERGAMINI,SUPLENTE,PDT,PARTIDO DEMOCRÁTICO TRABALHISTA,3
AMERICANA,DEPUTADO FEDERAL,ERLON CHAVES,ERLON CHAVES DE CASTRO,SUPLENTE,PDT,PARTIDO DEMOCRÁTICO TRABALHISTA,1
AMERICANA,DEPUTADO FEDERAL,JOÃO DADO,JOÃO EDUARDO DADO LEITE DE CARVALHO,ELEITO,PDT,PARTIDO DEMOCRÁTICO TRABALHISTA,52
AMERICANA,DEPUTADO FEDERAL,PAULINHO DA FORÇA,PAULO PEREIRA DA SILVA,ELEITO,PDT,PARTIDO DEMOCRÁTICO TRABALHISTA,179
AMERICANA,DEPUTADO FEDERAL,ELISEU DANIEL,ELISEU DANIEL DOS SANTOS,SUPLENTE,PDT,PARTIDO DEMOCRÁTICO TRABALHISTA,27
AMERICANA,DEPUTADO FEDERAL,ARMANDO HENRIQUE,ARMANDO HENRIQUE,SUPLENTE,PDT,PARTIDO DEMOCRÁTICO TRABALHISTA,5
AMERICANA,DEPUTADO FEDERAL,MARTAN,MARCELO MARTIN,SUPLENTE,PDT,PARTIDO DEMOCRÁTICO TRABALHISTA,2
AMERICANA,DEPUTADO FEDERAL,BOAVENTURA,BOAVENTURA PEREIRA SANTOS,SUPLENTE,PDT,PARTIDO DEMOCRÁTICO TRABALHISTA,2
AMERICANA,DEPUTADO FEDERAL,KAREN HEINS,KAREN MAYELLEN TONIM HEINS,SUPLENTE,PDT,PARTIDO DEMOCRÁTICO TRABALHISTA,559
AMERICANA,DEPUTADO FEDERAL,PEDRO BAPTISTINI,PEDRO ANTONIO BAPTISTINI,SUPLENTE,PDT,PARTIDO DEMOCRÁTICO TRABALHISTA,18
AMERICANA,DEPUTADO FEDERAL,SAULO GOES,SAULO GOES DE ALBUQUERQUE,SUPLENTE,PDT,PARTIDO DEMOCRÁTICO TRABALHISTA,4
AMERICANA,DEPUTADO FEDERAL,MEDEIROS,LUIZ ANTONIO DE MEDEIROS NETO,SUPLENTE,PDT,PARTIDO DEMOCRÁTICO TRABALHISTA,135
AMERICANA,DEPUTADO FEDERAL,GILBERTO BENZI,GILBERTO BENZI,SUPLENTE,PDT,PARTIDO DEMOCRÁTICO TRABALHISTA,3
AMERICANA,DEPUTADO FEDERAL,EDUARDO NASCIMENTO,EDUARDO DUARTE DO NASCIMENTO,SUPLENTE,PDT,PARTIDO DEMOCRÁTICO TRABALHISTA,9
AMERICANA,DEPUTADO FEDERAL,DR LUIZ CHIAPARINE,LUIZ CARLOS CHIAPARINE,SUPLENTE,PDT,PARTIDO DEMOCRÁTICO TRABALHISTA,27
AMERICANA,DEPUTADO FEDERAL,NELSINHO DA BAHIA,NELSON FRANCISCO DOS SANTOS,SUPLENTE,PDT,PARTIDO DEMOCRÁTICO TRABALHISTA,5
AMERICANA,DEPUTADO FEDERAL,MANOEL ANTUNES,MANOEL ANTUNES,SUPLENTE,PDT,PARTIDO DEMOCRÁTICO TRABALHISTA,6
AMERICANA,DEPUTADO FEDERAL,PILOTO,AGRIPINO BARBOSA MACEDO,SUPLENTE,PDT,PARTIDO DEMOCRÁTICO TRABALHISTA,1
AMERICANA,DEPUTADO FEDERAL,CARLOS HENRIQUE,CARLOS HENRIQUE PINTO,SUPLENTE,PDT,PARTIDO DEMOCRÁTICO TRABALHISTA,32
AMERICANA,DEPUTADO FEDERAL,MAURICIO SOARES JUNIOR,MAURICIO SOARES DE ALMEIDA JUNIOR,SUPLENTE,PDT,PARTIDO DEMOCRÁTICO TRABALHISTA,2
AMERICANA,DEPUTADO FEDERAL,DRA DEBORA,DEBORA MARIA MARAGNI PEREIRA DE ABREU,SUPLENTE,PDT,PARTIDO DEMOCRÁTICO TRABALHISTA,4
AMERICANA,DEPUTADO FEDERAL,ISMAEL NICACIO,ISMAEL JUDÁ DOS SANTOS NICÁCIO,SUPLENTE,PDT,PARTIDO DEMOCRÁTICO TRABALHISTA,1
AMERICANA,DEPUTADO FEDERAL,SALVADOR ZIMBALDI,SALVADOR ZIMBALDI FILHO,MÉDIA,PDT,PARTIDO DEMOCRÁTICO TRABALHISTA,229
AMERICANA,DEPUTADO FEDERAL,DRA ZIRVA,ZIRVA DAS GRAÇAS PIRES PEREIRA,SUPLENTE,PDT,PARTIDO DEMOCRÁTICO TRABALHISTA,1
AMERICANA,DEPUTADO FEDERAL,LINDOLFO DOS SANTOS,LINDOLFO LUIZ DOS SANTOS NETO,SUPLENTE,PDT,PARTIDO DEMOCRÁTICO TRABALHISTA,12
AMERICANA,DEPUTADO FEDERAL,FERNANDO CHIARELLI,FERNANDO CHIARELLI,SUPLENTE,PDT,PARTIDO DEMOCRÁTICO TRABALHISTA,3
AMERICANA,DEPUTADO FEDERAL,ITAMAR ALVES,ITAMAR ALVES DE OLIVEIRA,SUPLENTE,PDT,PARTIDO DEMOCRÁTICO TRABALHISTA,1
AMERICANA,DEPUTADO FEDERAL,IVANIO BATISTA,IVANIO BATISTA DA SILVA,SUPLENTE,PT,JUNTOS POR SÃO PAULO,4
AMERICANA,DEPUTADO FEDERAL,VICENTE CANDIDO,VICENTE CANDIDO DA SILVA,ELEITO,PT,JUNTOS POR SÃO PAULO,20
AMERICANA,DEPUTADO FEDERAL,PROFESSOR JAIR BALESTRA,JAIR DONIZETI BALESTRA,SUPLENTE,PT,JUNTOS POR SÃO PAULO,3
AMERICANA,DEPUTADO FEDERAL,MARQUINHOS OLÍVIO,MARCOS OLIVIO CONCEIÇÃO,SUPLENTE,PT,JUNTOS POR SÃO PAULO,2
AMERICANA,DEPUTADO FEDERAL,TOM,SEBASTIÃO SERAFIM DE MOURA SOBRINHO,SUPLENTE,PT,JUNTOS POR SÃO PAULO,1
AMERICANA,DEPUTADO FEDERAL,IARA BERNARDI,IARA BERNARDI,SUPLENTE,PT,JUNTOS POR SÃO PAULO,7
AMERICANA,DEPUTADO FEDERAL,LARGUESA,LUIS VANDERLEI LARGUESA,SUPLENTE,PT,JUNTOS POR SÃO PAULO,411
AMERICANA,DEPUTADO FEDERAL,VACCAREZZA,CANDIDO ELPIDIO DE SOUZA VACCAREZZA,ELEITO,PT,JUNTOS POR SÃO PAULO,20
AMERICANA,DEPUTADO FEDERAL,GENOINO,JOSÉ GENOÍNO NETO,SUPLENTE,PT,JUNTOS POR SÃO PAULO,101
AMERICANA,DEPUTADO FEDERAL,OSMAR LOPES,OSMAR LOPES,SUPLENTE,PT,JUNTOS POR SÃO PAULO,27
AMERICANA,DEPUTADO FEDERAL,HELCIO SILVA,HELCIO ANTONIO DA SILVA,SUPLENTE,PT,JUNTOS POR SÃO PAULO,4
AMERICANA,DEPUTADO FEDERAL,CARLINHOS ALMEIDA,CARLOS JOSE DE ALMEIDA,ELEITO,PT,JUNTOS POR SÃO PAULO,4
AMERICANA,DEPUTADO FEDERAL,MISA BOITO,MARIA EMILIA SEDEH BOITO,SUPLENTE,PT,JUNTOS POR SÃO PAULO,2
AMERICANA,DEPUTADO FEDERAL,NEWTON LIMA NETO,NEWTON LIMA NETO,ELEITO,PT,JUNTOS POR SÃO PAULO,53
AMERICANA,DEPUTADO FEDERAL,TEREZINHA RONDELLI,MARIA TEREZINHA RONDELLI,SUPLENTE,PT,JUNTOS POR SÃO PAULO,1333
AMERICANA,DEPUTADO FEDERAL,FILIPPI,JOSÉ DE FILIPPI JÚNIOR,ELEITO,PT,JUNTOS POR SÃO PAULO,58
AMERICANA,DEPUTADO FEDERAL,ARLINDO CHINAGLIA,ARLINDO CHIGNALIA JUNIOR,ELEITO,PT,JUNTOS POR SÃO PAULO,31
AMERICANA,DEPUTADO FEDERAL,JOÃO PAULO CUNHA,JOÃO PAULO CUNHA,ELEITO,PT,JUNTOS POR SÃO PAULO,9
AMERICANA,DEPUTADO FEDERAL,ROQUE FERREIRA,ROQUE JOSÉ FERREIRA,SUPLENTE,PT,JUNTOS POR SÃO PAULO,1
AMERICANA,DEPUTADO FEDERAL,JOÃO BATISTA,JOÃO BATISTA DA SILVA,SUPLENTE,PT,JUNTOS POR SÃO PAULO,1
AMERICANA,DEPUTADO FEDERAL,PIVATTO,JOSÉ PIVATTO,SUPLENTE,PT,JUNTOS POR SÃO PAULO,45
AMERICANA,DEPUTADO FEDERAL,RICARDO BERZOINI,RICARDO JOSE RIBEIRO BERZOINI,ELEITO,PT,JUNTOS POR SÃO PAULO,26
AMERICANA,DEPUTADO FEDERAL,JOSÉ MENTOR,JOSÉ MENTOR GUILHERME DE MELLO NETTO,ELEITO,PT,JUNTOS POR SÃO PAULO,6336
AMERICANA,DEPUTADO FEDERAL,PROF. CARLÃO RAMIRO,CARLOS RAMIRO CASTRO,SUPLENTE,PT,JUNTOS POR SÃO PAULO,87
AMERICANA,DEPUTADO FEDERAL,FÉLIX SAHÃO,FÉLIX SAHÃO JÚNIOR,SUPLENTE,PT,JUNTOS POR SÃO PAULO,7
AMERICANA,DEPUTADO FEDERAL,ROGÉRIO PINTO,ROGÉRIO PINTO FERNANDES,SUPLENTE,PT,JUNTOS POR SÃO PAULO,3
AMERICANA,DEPUTADO FEDERAL,RODRIGO VALVERDE,JORGE RODRIGO VALVERDE SANTANA,SUPLENTE,PT,JUNTOS POR SÃO PAULO,1
AMERICANA,DEPUTADO FEDERAL,VANDERLEI SIRAQUE,VANDERLEI SIRAQUE,SUPLENTE,PT,JUNTOS POR SÃO PAULO,18
AMERICANA,DEPUTADO FEDERAL,LUIZ CARLOS GOMES,LUIZ CARLOS GOMES,SUPLENTE,PT,JUNTOS POR SÃO PAULO,2
AMERICANA,DEPUTADO FEDERAL,JILMAR TATTO,JILMAR AUGUSTINHO TATTO,ELEITO,PT,JUNTOS POR SÃO PAULO,20
AMERICANA,DEPUTADO FEDERAL,DURVAL ORLATO,DURVAL LOPES ORLATO,SUPLENTE,PT,JUNTOS POR SÃO PAULO,3
AMERICANA,DEPUTADO FEDERAL,EDSON DA PAZ (O CANTOR),EDSON DA PAZ,SUPLENTE,PT,JUNTOS POR SÃO PAULO,4
AMERICANA,DEPUTADO FEDERAL,JANIO RIBEIRO,JANIO RIBEIRO,SUPLENTE,PT,JUNTOS POR SÃO PAULO,1
AMERICANA,DEPUTADO FEDERAL,RUBINHO BASTOS,RUBENS BASTOS DO NASCIMENTO,SUPLENTE,PT,JUNTOS POR SÃO PAULO,2
AMERICANA,DEPUTADO FEDERAL,REGINALDO PERNAMBUCANO,REGINALDO CARNEIRO DE MOURA,SUPLENTE,PT,JUNTOS POR SÃO PAULO,2
AMERICANA,DEPUTADO FEDERAL,CARLOS AQUINO,JOSÉ CARLOS DE AQUINO,SUPLENTE,PT,JUNTOS POR SÃO PAULO,1
AMERICANA,DEPUTADO FEDERAL,RENATO SIMÕES,RENATO SIMÕES,SUPLENTE,PT,JUNTOS POR SÃO PAULO,260
AMERICANA,DEPUTADO FEDERAL,DEVANIR RIBEIRO,DEVANIR RIBEIRO,ELEITO,PT,JUNTOS POR SÃO PAULO,5
AMERICANA,DEPUTADO FEDERAL,ZARATTINI,CARLOS ALBERTO ROLIM ZARATTINI,ELEITO,PT,JUNTOS POR SÃO PAULO,131
AMERICANA,DEPUTADO FEDERAL,DR RONALDO BRESCIANI,RONALDO JOSÉ BRESCIANI,SUPLENTE,PT,JUNTOS POR SÃO PAULO,1
AMERICANA,DEPUTADO FEDERAL,MARIA LUCIA PRANDI,MARIA LUCIA PRANDI GOMES,SUPLENTE,PT,JUNTOS POR SÃO PAULO,3
AMERICANA,DEPUTADO FEDERAL,ANGELO BARRETO,ANGELO RAFAEL BARRETO,SUPLENTE,PT,JUNTOS POR SÃO PAULO,2
AMERICANA,DEPUTADO FEDERAL,JANETE PIETÁ,JANETE ROCHA PIETÁ,ELEITO,PT,JUNTOS POR SÃO PAULO,9
AMERICANA,DEPUTADO FEDERAL,VICENTINHO,VICENTE PAULO DA SILVA,ELEITO,PT,JUNTOS POR SÃO PAULO,12
AMERICANA,DEPUTADO FEDERAL,PAULO TEIXEIRA,LUIZ PAULO TEIXEIRA FERREIRA,ELEITO,PT,JUNTOS POR SÃO PAULO,123
AMERICANA,DEPUTADO FEDERAL,CLAURY,CLAURY SANTOS ALVES DA SILVA,SUPLENTE,PTB,PARTIDO TRABALHISTA BRASILEIRO,6
AMERICANA,DEPUTADO FEDERAL,CORONEL GOULART,ANTONIO CARLOS GOULART,SUPLENTE,PTB,PARTIDO TRABALHISTA BRASILEIRO,2
AMERICANA,DEPUTADO FEDERAL,VAMPETA,MARCOS ANDRE BATISTA SANTOS,SUPLENTE,PTB,PARTIDO TRABALHISTA BRASILEIRO,7
AMERICANA,DEPUTADO FEDERAL,WANDA CORRÊA,VANDERLEIA APARECIDA CORREA,SUPLENTE,PTB,PARTIDO TRABALHISTA BRASILEIRO,1
AMERICANA,DEPUTADO FEDERAL,NADUR,ADALBERTO NADUR,SUPLENTE,PTB,PARTIDO TRABALHISTA BRASILEIRO,3
AMERICANA,DEPUTADO FEDERAL,SANTANA,JOSE SANTANA DE ABREU,SUPLENTE,PTB,PARTIDO TRABALHISTA BRASILEIRO,3
AMERICANA,DEPUTADO FEDERAL,PIRU,CLAUDIO AFFONSO,SUPLENTE,PTB,PARTIDO TRABALHISTA BRASILEIRO,1
AMERICANA,DEPUTADO FEDERAL,ESTER,ESTER DA SILVA,SUPLENTE,PTB,PARTIDO TRABALHISTA BRASILEIRO,1
AMERICANA,DEPUTADO FEDERAL,ROBSON TUMA,ROBSON TUMA,SUPLENTE,PTB,PARTIDO TRABALHISTA BRASILEIRO,14
AMERICANA,DEPUTADO FEDERAL,CARLINHOS SARAIVA,CARLOS HENRIQUE DA FONSECA,SUPLENTE,PTB,PARTIDO TRABALHISTA BRASILEIRO,8
AMERICANA,DEPUTADO FEDERAL,DR SILNEY BERALDO,SILNEY MARCOS BERALDO,SUPLENTE,PTB,PARTIDO TRABALHISTA BRASILEIRO,473
AMERICANA,DEPUTADO FEDERAL,TICO DO TRANSPORTE ESCOLAR,ALBERTO GOMES BARBOSA,SUPLENTE,PTB,PARTIDO TRABALHISTA BRASILEIRO,1
AMERICANA,DEPUTADO FEDERAL,CLEOMENES JUNIOR,CLEOMENES ANTUNES JUNIOR,SUPLENTE,PTB,PARTIDO TRABALHISTA BRASILEIRO,1
AMERICANA,DEPUTADO FEDERAL,AMIRAH SABA DA METROPOLITANAFM,AMIRAH SABA,SUPLENTE,PTB,PARTIDO TRABALHISTA BRASILEIRO,1
AMERICANA,DEPUTADO FEDERAL,SINVAL DORIGON,SINVAL ROBERTO DORIGON,SUPLENTE,PTB,PARTIDO TRABALHISTA BRASILEIRO,24
AMERICANA,DEPUTADO FEDERAL,NELSON MARQUEZELLI,NELSON MARQUEZELLI,ELEITO,PTB,PARTIDO TRABALHISTA BRASILEIRO,75
AMERICANA,DEPUTADO FEDERAL,CARLOS BURGHI,CARLOS ALBERTO EBERT BURGHI,SUPLENTE,PTB,PARTIDO TRABALHISTA BRASILEIRO,2
AMERICANA,DEPUTADO FEDERAL,WALDOMIRO RAMOS,WALDOMIRO CARLOS RAMOS,SUPLENTE,PTB,PARTIDO TRABALHISTA BRASILEIRO,1
AMERICANA,DEPUTADO FEDERAL,DR MOYSES,JOAO MOYSES ABUJADI,SUPLENTE,PTB,PARTIDO TRABALHISTA BRASILEIRO,3
AMERICANA,DEPUTADO FEDERAL,SATURNINO DE BRITO,SATURNINO DE SALES SANTOS,SUPLENTE,PTB,PARTIDO TRABALHISTA BRASILEIRO,1
AMERICANA,DEPUTADO FEDERAL,MALU PARISI,LUIZA FAUSTINO PEREIRA PARI,SUPLENTE,PTB,PARTIDO TRABALHISTA BRASILEIRO,1
AMERICANA,DEPUTADO FEDERAL,BRESSAN,ANTONIO BRESSAN FILHO,SUPLENTE,PTB,PARTIDO TRABALHISTA BRASILEIRO,2
AMERICANA,DEPUTADO FEDERAL,IRMÃO TIÃOZINHO SOLDADOR,SEBASTIÃO FABIANO FERREIRA DA CRUZ,SUPLENTE,PTB,PARTIDO TRABALHISTA BRASILEIRO,2
AMERICANA,DEPUTADO FEDERAL,CIGANA,GISELA DOS SANTOS,SUPLENTE,PTB,PARTIDO TRABALHISTA BRASILEIRO,1
AMERICANA,DEPUTADO FEDERAL,SONIA CRISTIANO,SONIA REGINA CRISTIANO,SUPLENTE,PTB,PARTIDO TRABALHISTA BRASILEIRO,3
AMERICANA,DEPUTADO FEDERAL,ARNALDO FARIA DE SÁ,ARNALDO FARIA DE SÁ,ELEITO,PTB,PARTIDO TRABALHISTA BRASILEIRO,129
AMERICANA,DEPUTADO FEDERAL,TIM,ADILSON FERNANDES VARELA,SUPLENTE,PTB,PARTIDO TRABALHISTA BRASILEIRO,1
AMERICANA,DEPUTADO FEDERAL,CLAUDIA SARTORI,CLAUDIA SARTORI DONATTI DE SOUZA,SUPLENTE,PTB,PARTIDO TRABALHISTA BRASILEIRO,4
AMERICANA,DEPUTADO FEDERAL,CAJAI,ISRAEL MARQUES CAJAI,SUPLENTE,PTB,PARTIDO TRABALHISTA BRASILEIRO,2
AMERICANA,DEPUTADO FEDERAL,PASTORA SUELY LOPES,SUELY CARNEIRO LOPES,SUPLENTE,PTB,PARTIDO TRABALHISTA BRASILEIRO,1
AMERICANA,DEPUTADO FEDERAL,WALTER CAVEANHA,WALTER CAVEANHA,SUPLENTE,PTB,PARTIDO TRABALHISTA BRASILEIRO,2
AMERICANA,DEPUTADO FEDERAL,TEREZINHA DE JESUS,TEREZA CARDOSO NEVES,SUPLENTE,PTB,PARTIDO TRABALHISTA BRASILEIRO,2
AMERICANA,DEPUTADO FEDERAL,FRANK AGUIAR,FRANCINETO LUZ DE AGUIAR,SUPLENTE,PTB,PARTIDO TRABALHISTA BRASILEIRO,15
AMERICANA,DEPUTADO FEDERAL,PASTOR JOAO ALMEIDA,JOAO ALMEIDA DOS SANTOS,SUPLENTE,PTB,PARTIDO TRABALHISTA BRASILEIRO,2
AMERICANA,DEPUTADO FEDERAL,DR ANDRE ROCHA,ANDRE LUIS ROCHA,SUPLENTE,PTB,PARTIDO TRABALHISTA BRASILEIRO,86
AMERICANA,DEPUTADO FEDERAL,PADRE FERNANDO,LAUDINEY FERNANDO SILVA FRAGA,SUPLENTE,PTB,PARTIDO TRABALHISTA BRASILEIRO,40
AMERICANA,DEPUTADO FEDERAL,EMELLY OLIVEIRA,EMELLY PAGLIARI CARDOSO ALVES DE OLIVEIRA,SUPLENTE,PTB,PARTIDO TRABALHISTA BRASILEIRO,1
AMERICANA,DEPUTADO FEDERAL,REIZINHO,MAURICIO DE JESUS CALISTO,SUPLENTE,PTB,PARTIDO TRABALHISTA BRASILEIRO,1
AMERICANA,DEPUTADO FEDERAL,IVAN GUALBERTO,VANTUIL VIEIRA GUALBERTO,SUPLENTE,PTB,PARTIDO TRABALHISTA BRASILEIRO,1
AMERICANA,DEPUTADO FEDERAL,CORREA NETO,ARNALDO CORREA NETO,SUPLENTE,PTB,PARTIDO TRABALHISTA BRASILEIRO,1
AMERICANA,DEPUTADO FEDERAL,PAULO LIMA,PAULO CESAR DE OLIVEIRA LIMA,SUPLENTE,PMDB,PARTIDO DO MOVIMENTO DEMOCRÁTICO BRASILEIRO,22
AMERICANA,DEPUTADO FEDERAL,CARVALHO SALES,JEFFERSON CARVALHO SALES,SUPLENTE,PMDB,PARTIDO DO MOVIMENTO DEMOCRÁTICO BRASILEIRO,2
AMERICANA,DEPUTADO FEDERAL,VANDERLEI JUELI,VANDERLEI JUELI,SUPLENTE,PMDB,PARTIDO DO MOVIMENTO DEMOCRÁTICO BRASILEIRO,5
AMERICANA,DEPUTADO FEDERAL,DR. ALMÉRIO,ALMÉRIO AGUIAR MELO FILHO,SUPLENTE,PMDB,PARTIDO DO MOVIMENTO DEMOCRÁTICO BRASILEIRO,3
AMERICANA,DEPUTADO FEDERAL,NENÊ RÉSTIO,ANGELO ROBERTO RESTIO,SUPLENTE,PMDB,PARTIDO DO MOVIMENTO DEMOCRÁTICO BRASILEIRO,90
AMERICANA,DEPUTADO FEDERAL,BONFÁ,ALVARO BONFA JUNIOR,SUPLENTE,PMDB,PARTIDO DO MOVIMENTO DEMOCRÁTICO BRASILEIRO,1
AMERICANA,DEPUTADO FEDERAL,EDUARDO COELHO,EDUARDO JOSÉ PEREIRA COELHO,SUPLENTE,PMDB,PARTIDO DO MOVIMENTO DEMOCRÁTICO BRASILEIRO,67
AMERICANA,DEPUTADO FEDERAL,EDINHO ARAUJO,EDSON EDINHO COELHO ARAUJO,ELEITO,PMDB,PARTIDO DO MOVIMENTO DEMOCRÁTICO BRASILEIRO,24
AMERICANA,DEPUTADO FEDERAL,SERGIO KOBRA,SERGIO MARTINS DOS SANTOS JUNIOR,SUPLENTE,PMDB,PARTIDO DO MOVIMENTO DEMOCRÁTICO BRASILEIRO,3
AMERICANA,DEPUTADO FEDERAL,DR. AJURICABA,AJURICABA DE SOUZA MENEZES,SUPLENTE,PMDB,PARTIDO DO MOVIMENTO DEMOCRÁTICO BRASILEIRO,2
AMERICANA,DEPUTADO FEDERAL,ROLEMBERG,ROLANDO BELTRAMINE ROLEMBERG,SUPLENTE,PMDB,PARTIDO DO MOVIMENTO DEMOCRÁTICO BRASILEIRO,1
AMERICANA,DEPUTADO FEDERAL,REGA,ALBERTO REGA,SUPLENTE,PMDB,PARTIDO DO MOVIMENTO DEMOCRÁTICO BRASILEIRO,8
AMERICANA,DEPUTADO FEDERAL,LEONARDO HENRIQUE,LEONARDO HENRIQUE CRAVO,SUPLENTE,PMDB,PARTIDO DO MOVIMENTO DEMOCRÁTICO BRASILEIRO,1
AMERICANA,DEPUTADO FEDERAL,LÉO OLIVEIRA,OCIMAR DONIZETI LEO OLIVEIRA,SUPLENTE,PMDB,PARTIDO DO MOVIMENTO DEMOCRÁTICO BRASILEIRO,3
AMERICANA,DEPUTADO FEDERAL,CLERISTON VALLE,CLERISTON PEREIRA DO VALLE,SUPLENTE,PMDB,PARTIDO DO MOVIMENTO DEMOCRÁTICO BRASILEIRO,1
AMERICANA,DEPUTADO FEDERAL,MAIRÁ,MARIA DE JESUS MATIAS,SUPLENTE,PMDB,PARTIDO DO MOVIMENTO DEMOCRÁTICO BRASILEIRO,1
AMERICANA,DEPUTADO FEDERAL,JB SILVA,JOÃO BATISTA SILVA,SUPLENTE,PMDB,PARTIDO DO MOVIMENTO DEMOCRÁTICO BRASILEIRO,1
AMERICANA,DEPUTADO FEDERAL,JOÃO DA FARMÁCIA,JOÃO LUIZ ROMANINI,SUPLENTE,PMDB,PARTIDO DO MOVIMENTO DEMOCRÁTICO BRASILEIRO,1
AMERICANA,DEPUTADO FEDERAL,DR. CÉSAR,LUIZ CESAR REGINATO,SUPLENTE,PMDB,PARTIDO DO MOVIMENTO DEMOCRÁTICO BRASILEIRO,1
AMERICANA,DEPUTADO FEDERAL,VALDO DOMINGOS,ADEVALDO DOMINGOS,SUPLENTE,PMDB,PARTIDO DO MOVIMENTO DEMOCRÁTICO BRASILEIRO,1
AMERICANA,DEPUTADO FEDERAL,PABLIO REBESSI,PABLIO JOSÉ REBESSI,SUPLENTE,PMDB,PARTIDO DO MOVIMENTO DEMOCRÁTICO BRASILEIRO,1
AMERICANA,DEPUTADO FEDERAL,A. TRIUNFO AVELLAR,AGUINALDO TRIUMPHO AVELLAR,SUPLENTE,PMDB,PARTIDO DO MOVIMENTO DEMOCRÁTICO BRASILEIRO,1
AMERICANA,DEPUTADO FEDERAL,JOSÉ CARLOS,JOSÉ CARLOS DA SILVA,SUPLENTE,PMDB,PARTIDO DO MOVIMENTO DEMOCRÁTICO BRASILEIRO,3
AMERICANA,DEPUTADO FEDERAL,DR. SAMIR NASSBINE,SAMIR ASSAD NASSBINE,SUPLENTE,PMDB,PARTIDO DO MOVIMENTO DEMOCRÁTICO BRASILEIRO,3
AMERICANA,DEPUTADO FEDERAL,DANIEL CALDEIRA,DANIEL CALDEIRA MATEUS,SUPLENTE,PSL,PRESTE ATENÇÃO SÃO PAULO,4
AMERICANA,DEPUTADO FEDERAL,JANETE ARAUJO,JANETE ARAUJO LIRA,SUPLENTE,PSL,PRESTE ATENÇÃO SÃO PAULO,1
AMERICANA,DEPUTADO FEDERAL,PROFESSOR MIGUEL,MIGUEL DA SILVA,SUPLENTE,PSL,PRESTE ATENÇÃO SÃO PAULO,5
AMERICANA,DEPUTADO FEDERAL,RUDY GATOLIN,RUDY GATOLIN,SUPLENTE,PSL,PRESTE ATENÇÃO SÃO PAULO,1
AMERICANA,DEPUTADO FEDERAL,SARGENTO SEVERO,LUCIANO APARECIDO SEVERO,SUPLENTE,PSL,PRESTE ATENÇÃO SÃO PAULO,9
AMERICANA,DEPUTADO FEDERAL,LINDALVA MARIA,LINDALVA MARIA DIAS DE JESUS,SUPLENTE,PSL,PRESTE ATENÇÃO SÃO PAULO,3
AMERICANA,DEPUTADO FEDERAL,TATIANA QUEIROZ,MARIA TATIANA QUEIROZ,SUPLENTE,PSL,PRESTE ATENÇÃO SÃO PAULO,2
AMERICANA,DEPUTADO FEDERAL,ROBERTO SIQUEIRA,ROBERTO SIQUEIRA GOMES,SUPLENTE,PSL,PRESTE ATENÇÃO SÃO PAULO,48
AMERICANA,DEPUTADO FEDERAL,CORONEL GILSON LOPES,GILSON LOPES DA SILVA,SUPLENTE,PSC,HUMANISTA CRISTÃO ,5
AMERICANA,DEPUTADO FEDERAL,MISSIONARIA NAZARE,MARIA NAZARE DOS SANTOS SORRILLO,SUPLENTE,PSC,HUMANISTA CRISTÃO ,12
AMERICANA,DEPUTADO FEDERAL,CLEBER DELALIBERA,CLEBER DE MOURA DELALIBERA,SUPLENTE,PSC,HUMANISTA CRISTÃO ,1
AMERICANA,DEPUTADO FEDERAL,MARCO FELICIANO,MARCO ANTONIO FELICIANO,ELEITO,PSC,HUMANISTA CRISTÃO ,464
AMERICANA,DEPUTADO FEDERAL,MARCELO AGUIAR,MARCELO THEODORO DE AGUIAR,ELEITO,PSC,HUMANISTA CRISTÃO ,204
AMERICANA,DEPUTADO FEDERAL,CHICO NETO,FRANCISCO DA COSTA NETO,SUPLENTE,PSC,HUMANISTA CRISTÃO ,10
AMERICANA,DEPUTADO FEDERAL,GISON SOARES,GISON ALVES SOARES,SUPLENTE,PSC,HUMANISTA CRISTÃO ,1
AMERICANA,DEPUTADO FEDERAL,TENENTE ORLANDO,ORLANDO BENEDITO DE LIMA,SUPLENTE,PSC,HUMANISTA CRISTÃO ,1
AMERICANA,DEPUTADO FEDERAL,REGIS DE OLIVEIRA,REGIS FERNANDES DE OLIVEIRA,SUPLENTE,PSC,HUMANISTA CRISTÃO ,76
AMERICANA,DEPUTADO FEDERAL,SILVIA PALMA,SILVIA ELIANA PALMA,SUPLENTE,PSC,HUMANISTA CRISTÃO ,7
AMERICANA,DEPUTADO FEDERAL,NEY SANTOS,CLAUDINEI ALVES DOS SANTOS,SUPLENTE,PSC,HUMANISTA CRISTÃO ,75
AMERICANA,DEPUTADO FEDERAL,WAGNER FIOROTTO,WAGNER MONTEIRO FIOROTTO,SUPLENTE,PSC,HUMANISTA CRISTÃO ,1
AMERICANA,DEPUTADO FEDERAL,DALVAN,JOÃO GOMES DE ALMEIDA,SUPLENTE,PSC,HUMANISTA CRISTÃO ,46
AMERICANA,DEPUTADO FEDERAL,DUDA VILELA,CARLOS EDUARDO VILELA,SUPLENTE,PSC,HUMANISTA CRISTÃO ,1
AMERICANA,DEPUTADO FEDERAL,CICERO FERNANDES,JOSE CICERO FERNANDES DA SILVA,SUPLENTE,PSC,HUMANISTA CRISTÃO ,7
AMERICANA,DEPUTADO FEDERAL,PR. LUIZ LEMOS,LUIZ CARLOS LEMOS,SUPLENTE,PSC,HUMANISTA CRISTÃO ,2
AMERICANA,DEPUTADO FEDERAL,DANILO MIKILIM,DANILO JOSE DE TOLEDO,SUPLENTE,PSC,HUMANISTA CRISTÃO ,1
AMERICANA,DEPUTADO FEDERAL,MAURÃO,JOSE MAURO PEREIRA DE BARROS,SUPLENTE,PSC,HUMANISTA CRISTÃO ,1
AMERICANA,DEPUTADO FEDERAL,MIRO FERNANDES,ALDOMIRO FERNANDES,SUPLENTE,PSC,HUMANISTA CRISTÃO ,1
AMERICANA,DEPUTADO FEDERAL,BUCK,BENEDITO BUCK,SUPLENTE,PSC,HUMANISTA CRISTÃO ,1
AMERICANA,DEPUTADO FEDERAL,OMAR,OMAR ADOLFO CHOUMAN,SUPLENTE,PSC,HUMANISTA CRISTÃO ,2
AMERICANA,DEPUTADO FEDERAL,PRICILA LEME,PRICILA HELENA MOYSES LEME,SUPLENTE,PSC,HUMANISTA CRISTÃO ,13
AMERICANA,DEPUTADO FEDERAL,DR. SANDOVAL,SANDOVAL DE CASTRO DOURADO,SUPLENTE,PSC,HUMANISTA CRISTÃO ,1
AMERICANA,DEPUTADO FEDERAL,TONINHO CORREDOR,ANTONIO CICERO DA SILVA,SUPLENTE,PSC,HUMANISTA CRISTÃO ,1
AMERICANA,DEPUTADO FEDERAL,RENE DO RAP,RENE ROSA,SUPLENTE,PSC,HUMANISTA CRISTÃO ,2
AMERICANA,DEPUTADO FEDERAL,DOUTORA SUZANA GOMES,SUZANA ELIZABETH FERNANDES GOMES,SUPLENTE,PSC,HUMANISTA CRISTÃO ,1
AMERICANA,DEPUTADO FEDERAL,MANOEL GASPAR,MANOEL FERREIRA DE SOUZA GASPAR,SUPLENTE,PSC,HUMANISTA CRISTÃO ,1
AMERICANA,DEPUTADO FEDERAL,MOACYR FERNANDES,MOACYR RODRIGUES FERNANDES,SUPLENTE,PSC,HUMANISTA CRISTÃO ,1
AMERICANA,DEPUTADO FEDERAL,JUCA CHAVES,JURANDYR CZACZKES CHAVES,SUPLENTE,PR,JUNTOS POR SÃO PAULO,9
AMERICANA,DEPUTADO FEDERAL,AGNALDO TIMOTEO,AGUINALDO TIMOTEO PEREIRA,SUPLENTE,PR,JUNTOS POR SÃO PAULO,12
AMERICANA,DEPUTADO FEDERAL,TIRIRICA,FRANCISCO EVERARDO OLIVEIRA SILVA,ELEITO,PR,JUNTOS POR SÃO PAULO,2363
AMERICANA,DEPUTADO FEDERAL,PR PAULO FREIRE,PAULO ROBERTO FREIRE DA COSTA,ELEITO,PR,JUNTOS POR SÃO PAULO,492
AMERICANA,DEPUTADO FEDERAL,LUCIANA COSTA,LUCIANA DE ALMEIDA COSTA,SUPLENTE,PR,JUNTOS POR SÃO PAULO,10
AMERICANA,DEPUTADO FEDERAL,MILTON MONTI,MILTON ANTONIO CASQUEL MONTI,ELEITO,PR,JUNTOS POR SÃO PAULO,2
AMERICANA,DEPUTADO FEDERAL,VALDEMAR COSTA NETO,VALDEMAR COSTA NETO,ELEITO,PR,JUNTOS POR SÃO PAULO,43
AMERICANA,DEPUTADO FEDERAL,CAIO,CAIO GORENTZVAIG,SUPLENTE,PPS,PSDB/DEM/PPS,2
AMERICANA,DEPUTADO FEDERAL,WILLIAM WOO,WILLIAM BOSS WOO,SUPLENTE,PPS,PSDB/DEM/PPS,9
AMERICANA,DEPUTADO FEDERAL,ROBERTO FREIRE,ROBERTO JOAO PEREIRA FREIRE,ELEITO,PPS,PSDB/DEM/PPS,90
AMERICANA,DEPUTADO FEDERAL,CORONEL EDSON SARDANO,EDSON DE JESUS SARDANO,SUPLENTE,PPS,PSDB/DEM/PPS,9
AMERICANA,DEPUTADO FEDERAL,DIMAS RAMALHO,DIMAS EDUARDO RAMALHO,ELEITO,PPS,PSDB/DEM/PPS,12
AMERICANA,DEPUTADO FEDERAL,ARI FRIEDENBACH,ARI FRIEDENBACH,SUPLENTE,PPS,PSDB/DEM/PPS,67
AMERICANA,DEPUTADO FEDERAL,JOSE ONERIO,JOSE ONERIO DA SILVA,SUPLENTE,PPS,PSDB/DEM/PPS,96
AMERICANA,DEPUTADO FEDERAL,PAULINHO LARISSA SPOSITO,PAULO ROGERIO SPOSITO,SUPLENTE,PPS,PSDB/DEM/PPS,4
AMERICANA,DEPUTADO FEDERAL,ARNALDO JARDIM,ARNALDO CALIL PEREIRA JARDIM,ELEITO,PPS,PSDB/DEM/PPS,131
AMERICANA,DEPUTADO FEDERAL,PROF POLLYANA GAMA,POLLYANA FATIMA GAMA SANTOS,SUPLENTE,PPS,PSDB/DEM/PPS,3
AMERICANA,DEPUTADO FEDERAL,ANTENOR TOKO,ANTENOR DOS SANTOS TOKO,SUPLENTE,PPS,PSDB/DEM/PPS,1
AMERICANA,DEPUTADO FEDERAL,DOUTOR LIMA,FRANCISCO ALVES DE LIMA,SUPLENTE,PPS,PSDB/DEM/PPS,1
AMERICANA,DEPUTADO FEDERAL,JORGE TADEU,JORGE TADEU MUDALEN,ELEITO,DEM,PSDB/DEM/PPS,132
AMERICANA,DEPUTADO FEDERAL,JORGINHO MALULY,JORGE DE FARIA MALULY,SUPLENTE,DEM,PSDB/DEM/PPS,10
AMERICANA,DEPUTADO FEDERAL,ALEXANDRE LEITE,ALEXANDRE LEITE DA SILVA,MÉDIA,DEM,PSDB/DEM/PPS,5
AMERICANA,DEPUTADO FEDERAL,PROFESSOR BENJAMIN,BENJAMIN RIBEIRO DA SILVA,SUPLENTE,DEM,PSDB/DEM/PPS,8
AMERICANA,DEPUTADO FEDERAL,KIKO DO KLB,FRANCO FINATO SCORNAVACCA,SUPLENTE,DEM,PSDB/DEM/PPS,37
AMERICANA,DEPUTADO FEDERAL,CRESPO,JOSE ANTONIO CALDINI CRESPO,SUPLENTE,DEM,PSDB/DEM/PPS,1
AMERICANA,DEPUTADO FEDERAL,RODRIGO GARCIA,RODRIGO GARCIA,ELEITO,DEM,PSDB/DEM/PPS,23
AMERICANA,DEPUTADO FEDERAL,MARCELO PALINKAS,MARCELO PALINKAS,SUPLENTE,DEM,PSDB/DEM/PPS,2
AMERICANA,DEPUTADO FEDERAL,ZULAIÊ COBRA,ZULAIE COBRA RIBEIRO,SUPLENTE,DEM,PSDB/DEM/PPS,32
AMERICANA,DEPUTADO FEDERAL,LUCIANO ARTIOLI,LUCIANO ARTIOLI MOREIRA,SUPLENTE,DEM,PSDB/DEM/PPS,21
AMERICANA,DEPUTADO FEDERAL,RAUL GIL JR,RAUL GIL JUNIOR,SUPLENTE,DEM,PSDB/DEM/PPS,20
AMERICANA,DEPUTADO FEDERAL,CHICO PELUCIO,FRANCISCO PELUCIO,SUPLENTE,DEM,PSDB/DEM/PPS,23
AMERICANA,DEPUTADO FEDERAL,JUNJI ABE,JUNJI ABE,ELEITO,DEM,PSDB/DEM/PPS,3
AMERICANA,DEPUTADO FEDERAL,ODECIO BRAGA,ODECIO BRAGA DE LOUREDO FILHO,SUPLENTE,DEM,PSDB/DEM/PPS,1
AMERICANA,DEPUTADO FEDERAL,MANDIC,ALEKSANDAR CARLOS MANDIC,SUPLENTE,DEM,PSDB/DEM/PPS,5
AMERICANA,DEPUTADO FEDERAL,CASCIONE,VICENTE FERNANDES CASCIONE,SUPLENTE,DEM,PSDB/DEM/PPS,4
AMERICANA,DEPUTADO FEDERAL,HELIO SECCO,HELIO RODRIGUES SECCO,SUPLENTE,DEM,PSDB/DEM/PPS,4
AMERICANA,DEPUTADO FEDERAL,ELI CORREA FILHO,ADRIANO ELI CORREA,ELEITO,DEM,PSDB/DEM/PPS,1
AMERICANA,DEPUTADO FEDERAL,DR ELEUSES PAIVA,ELEUSES VIEIRA DE PAIVA,SUPLENTE,DEM,PSDB/DEM/PPS,38
AMERICANA,DEPUTADO FEDERAL,GUILHERME CAMPOS,GUILHERME CAMPOS JUNIOR,MÉDIA,DEM,PSDB/DEM/PPS,81
AMERICANA,DEPUTADO FEDERAL,WALTER IHOSHI,WALTER SHINDI IIHOSHI,SUPLENTE,DEM,PSDB/DEM/PPS,7
AMERICANA,DEPUTADO FEDERAL,DR ANAMARIA HIRAKAWA,ANAMARIA YAECO HIRAKAWA,SUPLENTE,PHS,HUMANISTA CRISTÃO ,4
AMERICANA,DEPUTADO FEDERAL,IRMÃO DARCY,DARCY FIGUEIRA DOS SANTOS JUNIOR,SUPLENTE,PHS,HUMANISTA CRISTÃO ,1
AMERICANA,DEPUTADO FEDERAL,MALUCO BELEZA,OLAIR PRADO DE OLIVEIRA,SUPLENTE,PHS,HUMANISTA CRISTÃO ,1
AMERICANA,DEPUTADO FEDERAL,TICIANO NEVES,TICIANO NEVES TAVARES,SUPLENTE,PHS,HUMANISTA CRISTÃO ,1
AMERICANA,DEPUTADO FEDERAL,CACIQUE DARÃ,ANTONISIO LULU,SUPLENTE,PHS,HUMANISTA CRISTÃO ,3
AMERICANA,DEPUTADO FEDERAL,PROF HERMES,HERMES RODRIGUES NERY,SUPLENTE,PHS,HUMANISTA CRISTÃO ,3
AMERICANA,DEPUTADO FEDERAL,DEBORA GODOI,DÉBORA ANDREA BATISTA GODOI,SUPLENTE,PHS,HUMANISTA CRISTÃO ,19
AMERICANA,DEPUTADO FEDERAL,JONAS DONIZETTE,JONAS DONIZETTE FERREIRA,ELEITO,PSB,PRESTE ATENÇÃO SÃO PAULO,197
AMERICANA,DEPUTADO FEDERAL,MÁRCIA LIMA,APARECIDO BARBOSA LIMA,SUPLENTE,PSB,PRESTE ATENÇÃO SÃO PAULO,1
AMERICANA,DEPUTADO FEDERAL,ROGÉRIO EMÍLIO,ROGÉRIO EMÍLIO DE ANDRADE,SUPLENTE,PSB,PRESTE ATENÇÃO SÃO PAULO,2
AMERICANA,DEPUTADO FEDERAL,DENNYS SERRANO,DENNYS HADDAD SERRANO,SUPLENTE,PSB,PRESTE ATENÇÃO SÃO PAULO,1
AMERICANA,DEPUTADO FEDERAL,MARCELINHO CARIOCA,MARCELO PEREIRA SURCIN,SUPLENTE,PSB,PRESTE ATENÇÃO SÃO PAULO,74
AMERICANA,DEPUTADO FEDERAL,MARCOS DE PAULA,MARCOS DE PAULA,SUPLENTE,PSB,PRESTE ATENÇÃO SÃO PAULO,28
AMERICANA,DEPUTADO FEDERAL,GUSTAVO HERRMANN,GUSTAVO RANZANI HERRMANN,SUPLENTE,PSB,PRESTE ATENÇÃO SÃO PAULO,23
