TATUÍ,DEPUTADO FEDERAL,DEBORA GODOI,DÉBORA ANDREA BATISTA GODOI,SUPLENTE,PHS,HUMANISTA CRISTÃO ,1
TATUÍ,DEPUTADO FEDERAL,DÉ,DENIVALDO DE SOUZA CARVALHO,SUPLENTE,PHS,HUMANISTA CRISTÃO ,31
TATUÍ,DEPUTADO FEDERAL,MARCOS NEBLINA,MARCOS ANDRÉ SILVA,SUPLENTE,PHS,HUMANISTA CRISTÃO ,5
TATUÍ,DEPUTADO FEDERAL,JONAS DONIZETTE,JONAS DONIZETTE FERREIRA,ELEITO,PSB,PRESTE ATENÇÃO SÃO PAULO,11
TATUÍ,DEPUTADO FEDERAL,ROGÉRIO EMÍLIO,ROGÉRIO EMÍLIO DE ANDRADE,SUPLENTE,PSB,PRESTE ATENÇÃO SÃO PAULO,4
TATUÍ,DEPUTADO FEDERAL,DENNYS SERRANO,DENNYS HADDAD SERRANO,SUPLENTE,PSB,PRESTE ATENÇÃO SÃO PAULO,1
TATUÍ,DEPUTADO FEDERAL,MARCELINHO CARIOCA,MARCELO PEREIRA SURCIN,SUPLENTE,PSB,PRESTE ATENÇÃO SÃO PAULO,196
TATUÍ,DEPUTADO FEDERAL,MARCOS DE PAULA,MARCOS DE PAULA,SUPLENTE,PSB,PRESTE ATENÇÃO SÃO PAULO,1
TATUÍ,DEPUTADO FEDERAL,GUSTAVO HERRMANN,GUSTAVO RANZANI HERRMANN,SUPLENTE,PSB,PRESTE ATENÇÃO SÃO PAULO,3
TATUÍ,DEPUTADO FEDERAL,SARGENTO FERNANDO,FERNANDO ALCÂNTARA DE FIGUEIREDO,SUPLENTE,PSB,PRESTE ATENÇÃO SÃO PAULO,1
TATUÍ,DEPUTADO FEDERAL,ELISEU GABRIEL,ELISEU GABRIEL DE PIERI,SUPLENTE,PSB,PRESTE ATENÇÃO SÃO PAULO,15
TATUÍ,DEPUTADO FEDERAL,DR. ANTONIO BUSSOLETTI,ANTONIO GOTARDI BUSSOLETTI,SUPLENTE,PSB,PRESTE ATENÇÃO SÃO PAULO,2
TATUÍ,DEPUTADO FEDERAL,CAPITÃO AUGUSTO,JOSÉ AUGUSTO ROSA,SUPLENTE,PSB,PRESTE ATENÇÃO SÃO PAULO,75
TATUÍ,DEPUTADO FEDERAL,LUIZA ERUNDINA,LUIZA ERUNDINA DE SOUSA,ELEITO,PSB,PRESTE ATENÇÃO SÃO PAULO,63
TATUÍ,DEPUTADO FEDERAL,TIO DO DOCE,MANOEL CARDOSO DA SILVA,SUPLENTE,PSB,PRESTE ATENÇÃO SÃO PAULO,2
TATUÍ,DEPUTADO FEDERAL,CHINELO,JOSÉ AVELINO PEREIRA,SUPLENTE,PSB,PRESTE ATENÇÃO SÃO PAULO,2
TATUÍ,DEPUTADO FEDERAL,TORINO,PAULO SERGIO TORINO,SUPLENTE,PSB,PRESTE ATENÇÃO SÃO PAULO,11
TATUÍ,DEPUTADO FEDERAL,GABRIEL CHALITA,GABRIEL BENEDITO ISSAAC CHALITA,ELEITO,PSB,PRESTE ATENÇÃO SÃO PAULO,2222
TATUÍ,DEPUTADO FEDERAL,PAULO ROGÉRIO MARTINS,PAULO ROGÉRIO MARTINS,SUPLENTE,PSB,PRESTE ATENÇÃO SÃO PAULO,6
TATUÍ,DEPUTADO FEDERAL,MÁRCIO FRANÇA,MÁRCIO LUIZ FRANÇA GOMES,ELEITO,PSB,PRESTE ATENÇÃO SÃO PAULO,19
TATUÍ,DEPUTADO FEDERAL,CORAUCI,VALDEMAR CORAUCI SOBRINHO,SUPLENTE,PSB,PRESTE ATENÇÃO SÃO PAULO,1
TATUÍ,DEPUTADO FEDERAL,ENGENHEIRO CLÁUDIO,CLÁUDIO DA SILVEIRA FARIA,SUPLENTE,PSB,PRESTE ATENÇÃO SÃO PAULO,1
TATUÍ,DEPUTADO FEDERAL,RUBINHO CAI CAI,RUBENS ESTEVES ROQUE,SUPLENTE,PSB,PRESTE ATENÇÃO SÃO PAULO,4
TATUÍ,DEPUTADO FEDERAL,DR. ALEXANDRE,ALEXANDRE SÉRGIO DE OLIVEIRA AZOUBEL,SUPLENTE,PSB,PRESTE ATENÇÃO SÃO PAULO,19
TATUÍ,DEPUTADO FEDERAL,DRA. ROSIANE FARIAS,ROSIANE MACIEL DE FARIAS,SUPLENTE,PSB,PRESTE ATENÇÃO SÃO PAULO,36
TATUÍ,DEPUTADO FEDERAL,JOSÉ LEAL,JOSÉ MARTINS LEAL,SUPLENTE,PSB,PRESTE ATENÇÃO SÃO PAULO,4
TATUÍ,DEPUTADO FEDERAL,TONINHO GARMS,ANTONIO CARLOS GARMS,SUPLENTE,PSB,PRESTE ATENÇÃO SÃO PAULO,4
TATUÍ,DEPUTADO FEDERAL,VALDIR ALVARENGA,VALDIR DE ALVARENGA,SUPLENTE,PSB,PRESTE ATENÇÃO SÃO PAULO,1
TATUÍ,DEPUTADO FEDERAL,WALTER SANDRO,WALTER SANDRO PEREIRA DA SILVA,SUPLENTE,PSB,PRESTE ATENÇÃO SÃO PAULO,14
TATUÍ,DEPUTADO FEDERAL,DRA. ELAINE,ELAINE APARECIDA BELLONI ABISSAMRA,SUPLENTE,PSB,PRESTE ATENÇÃO SÃO PAULO,1
TATUÍ,DEPUTADO FEDERAL,UNALDO SANTOS,UNALDO FLORES SANTOS,SUPLENTE,PSB,PRESTE ATENÇÃO SÃO PAULO,1
TATUÍ,DEPUTADO FEDERAL,VANDIR MOGNON,VANDIR MOGNON,SUPLENTE,PSB,PRESTE ATENÇÃO SÃO PAULO,4
TATUÍ,DEPUTADO FEDERAL,NILZÃO ART,ERISVALDO GOMES PEREIRA,SUPLENTE,PSB,PRESTE ATENÇÃO SÃO PAULO,3
TATUÍ,DEPUTADO FEDERAL,ABELARDO CAMARINHA,JOSE ABELARDO GUIMARAES CAMARINHA,MÉDIA,PSB,PRESTE ATENÇÃO SÃO PAULO,11
TATUÍ,DEPUTADO FEDERAL,MÍRIAM MARTINS,EDNÉIA MIRIAM PEDRO,SUPLENTE,PSB,PRESTE ATENÇÃO SÃO PAULO,1
TATUÍ,DEPUTADO FEDERAL,JEFFERSON CAMPOS,JEFFERSON ALVES DE CAMPOS,ELEITO,PSB,PRESTE ATENÇÃO SÃO PAULO,1020
TATUÍ,DEPUTADO FEDERAL,GRAÇA,MARIA DAS GRAÇAS GONÇALVES OLIVEIRA,SUPLENTE,PSB,PRESTE ATENÇÃO SÃO PAULO,1
TATUÍ,DEPUTADO FEDERAL,DR. UBIALI,MARCO AURÉLIO UBIALI,SUPLENTE,PSB,PRESTE ATENÇÃO SÃO PAULO,36
TATUÍ,DEPUTADO FEDERAL,VICENTE CAPRINO,VICENTE ANTONIO CAPRINO,SUPLENTE,PSB,PRESTE ATENÇÃO SÃO PAULO,1
TATUÍ,DEPUTADO FEDERAL,OTA,IOLANDA KEIKO MIASHIRO OTA,ELEITO,PSB,PRESTE ATENÇÃO SÃO PAULO,75
TATUÍ,DEPUTADO FEDERAL,GUILHERME MUSSI,GUILHERME MUSSI FERREIRA,ELEITO,PV,PARTIDO VERDE,878
TATUÍ,DEPUTADO FEDERAL,GILBERTO ABREU,GILBERTO ANDRADE DE ABREU,SUPLENTE,PV,PARTIDO VERDE,5
TATUÍ,DEPUTADO FEDERAL,WALTER GONZALIS,WALTER GONZALIS,SUPLENTE,PV,PARTIDO VERDE,3
TATUÍ,DEPUTADO FEDERAL,DR. NEVTON OLIVEIRA ROCHA,NEVTON OLIVEIRA ROCHA,SUPLENTE,PV,PARTIDO VERDE,2
TATUÍ,DEPUTADO FEDERAL,DR TALMIR,TALMIR RODRIGUES,SUPLENTE,PV,PARTIDO VERDE,5
TATUÍ,DEPUTADO FEDERAL,VICENTE DA UPA,VICENTE CARVALHO E SILVA,SUPLENTE,PV,PARTIDO VERDE,63
TATUÍ,DEPUTADO FEDERAL,EDNA MARTINS,EDNA SANDRA MARTINS,SUPLENTE,PV,PARTIDO VERDE,4
TATUÍ,DEPUTADO FEDERAL,RAÍ,RAIMUNDO SOUZA TEIXEIRA,SUPLENTE,PV,PARTIDO VERDE,1
TATUÍ,DEPUTADO FEDERAL,DANIEL MARINS,DANIEL MARINS ALESSI,SUPLENTE,PV,PARTIDO VERDE,28
TATUÍ,DEPUTADO FEDERAL,JULIO CASTILHO,JULIO CESAR CASTILHO,SUPLENTE,PV,PARTIDO VERDE,5
TATUÍ,DEPUTADO FEDERAL,ROBERTO SANTIAGO,JOSE ROBERTO SANTIAGO GOMES,ELEITO,PV,PARTIDO VERDE,12
TATUÍ,DEPUTADO FEDERAL,DR INDIO,ALMIR SANTOS,SUPLENTE,PV,PARTIDO VERDE,2
TATUÍ,DEPUTADO FEDERAL,SAMBIASE,LUIZ FERNANDO FILIPPI SAMBIASE,SUPLENTE,PV,PARTIDO VERDE,2
TATUÍ,DEPUTADO FEDERAL,CESAR CORTEZ,ANTONIO CESAR CORTEZ,SUPLENTE,PV,PARTIDO VERDE,2
TATUÍ,DEPUTADO FEDERAL,ZICA,EUSTAQUIO LUCIANO ZICA,SUPLENTE,PV,PARTIDO VERDE,7
TATUÍ,DEPUTADO FEDERAL,CHICO SANTA RITA,FRANCISCO JOSE DE SANTA RITA BEHR,SUPLENTE,PV,PARTIDO VERDE,2
TATUÍ,DEPUTADO FEDERAL,PEDRO MANHÃES,PEDRO MANHÃES DE OLIVEIRA,SUPLENTE,PV,PARTIDO VERDE,38
TATUÍ,DEPUTADO FEDERAL,NUBIA SENNA,NUBIA DE SENA CARNEIRO,SUPLENTE,PV,PARTIDO VERDE,2
TATUÍ,DEPUTADO FEDERAL,ENG PAULINHO,PAULO HENRIQUE DO NASCIMENTO,SUPLENTE,PV,PARTIDO VERDE,5
TATUÍ,DEPUTADO FEDERAL,HELIVANE BOTELHO DA SILVEIRA,HELIVANE MARIA BOTELHO DA SILVEIRA MORAES,SUPLENTE,PV,PARTIDO VERDE,2
TATUÍ,DEPUTADO FEDERAL,DEUSDEDIT JR,DEUSDEDIT DE PAULA MIQUELINO JUNIOR,SUPLENTE,PV,PARTIDO VERDE,1
TATUÍ,DEPUTADO FEDERAL,MARIA DOLORES,MARIA DOLORES RODRIGUES JORDAN ORFEI ABE,SUPLENTE,PV,PARTIDO VERDE,3
TATUÍ,DEPUTADO FEDERAL,JAIME ROCHA,JAIME BARTOLOMEU DA ROCHA,SUPLENTE,PV,PARTIDO VERDE,1
TATUÍ,DEPUTADO FEDERAL,MARTA MACIEL,MARTA FERREIRA MACIEL,SUPLENTE,PV,PARTIDO VERDE,1
TATUÍ,DEPUTADO FEDERAL,JOVINO CÂNDIDO,JOVINO CÂNDIDO DA SILVA,SUPLENTE,PV,PARTIDO VERDE,13
TATUÍ,DEPUTADO FEDERAL,ANA PAULA JUNQUEIRA,ANA PAULA GUIMARAES DE AZEVEDO JUNQUEIRA,SUPLENTE,PV,PARTIDO VERDE,14
TATUÍ,DEPUTADO FEDERAL,MARINO BONACCHI,MARINO MARTINI BONACCHI,SUPLENTE,PV,PARTIDO VERDE,1
TATUÍ,DEPUTADO FEDERAL,EVANDRO GUSSI,EVANDRO HERRERA BERTONE GUSSI,SUPLENTE,PV,PARTIDO VERDE,9
TATUÍ,DEPUTADO FEDERAL,TOFFANO,JOSE PAULO TOFFANO,SUPLENTE,PV,PARTIDO VERDE,85
TATUÍ,DEPUTADO FEDERAL,FAUSTO LOPES,FAUSTO LOPES FILHO,SUPLENTE,PV,PARTIDO VERDE,3
TATUÍ,DEPUTADO FEDERAL,ALE YOUSSEF,ALEXANDRE DE ALMEIDA YOUSSEF,SUPLENTE,PV,PARTIDO VERDE,24
TATUÍ,DEPUTADO FEDERAL,MARCELO ORTIZ,FRANCISCO MARCELO ORTIZ FILHO,SUPLENTE,PV,PARTIDO VERDE,6
TATUÍ,DEPUTADO FEDERAL,PENNA,JOSÉ LUIZ DE FRANÇA PENNA,ELEITO,PV,PARTIDO VERDE,108
TATUÍ,DEPUTADO FEDERAL,ROBERTO DE LUCENA,ROBERTO ALVES DE LUCENA,ELEITO,PV,PARTIDO VERDE,1297
TATUÍ,DEPUTADO FEDERAL,DR. ÂNGELO,ANGELO DOMINGOS NUCCI,SUPLENTE,PV,PARTIDO VERDE,7
TATUÍ,DEPUTADO FEDERAL,PROFESSORA LALA TAVARES,IRAIDES TAVARES DE ALMEIDA,SUPLENTE,PV,PARTIDO VERDE,1
TATUÍ,DEPUTADO FEDERAL,NATAN SOIHET,NATAN SOIHET,SUPLENTE,PV,PARTIDO VERDE,5
TATUÍ,DEPUTADO FEDERAL,ANA MARIA RODRIGUES,ANA MARIA RODRIGUES DE OLIVEIRA,SUPLENTE,PV,PARTIDO VERDE,1
TATUÍ,DEPUTADO FEDERAL,ALTAIR DA ASSOCIACAO,ALTAIR BARBOSA GOUVEIA,SUPLENTE,PV,PARTIDO VERDE,4
TATUÍ,DEPUTADO FEDERAL,PAMPA,ANDRE FELIPPE FALBO FERREIRA,SUPLENTE,PV,PARTIDO VERDE,11
TATUÍ,DEPUTADO FEDERAL,WALTER FELIX,WALTER FÉLIX,SUPLENTE,PV,PARTIDO VERDE,1
TATUÍ,DEPUTADO FEDERAL,JOSÉ ALEXANDRE RIBEIRO,JOSE ALEXANDRE RIBEIRO,SUPLENTE,PV,PARTIDO VERDE,3
TATUÍ,DEPUTADO FEDERAL,DONIZETI PEREIRA,APARECIDO DONIZETI PEREIRA,SUPLENTE,PV,PARTIDO VERDE,1
TATUÍ,DEPUTADO FEDERAL,DEKKA,JOSÉ SALVADOR DA SILVA,SUPLENTE,PV,PARTIDO VERDE,13
TATUÍ,DEPUTADO FEDERAL,DRA LAURISA,LAURISA MARIA CORTELLAZZI GARCIA,SUPLENTE,PV,PARTIDO VERDE,7
TATUÍ,DEPUTADO FEDERAL,CARLINHOS SILVA,ANTONIO CARLOS ALVES DA SILVA,SUPLENTE,PV,PARTIDO VERDE,46
TATUÍ,DEPUTADO FEDERAL,PATRICIA DO MADA,PATRICIA ALVES DE MATOS,SUPLENTE,PV,PARTIDO VERDE,2
TATUÍ,DEPUTADO FEDERAL,RICARDO IZAR,RICARDO IZAR JUNIOR,ELEITO,PV,PARTIDO VERDE,25
TATUÍ,DEPUTADO FEDERAL,TERESA JAPONESA,TERESA KIYOKO ARAGAKI,SUPLENTE,PV,PARTIDO VERDE,2
TATUÍ,DEPUTADO FEDERAL,REGINA LAURA,REGINA LAURA DE MORAIS SANTOS E MARINHO DE FARIA,SUPLENTE,PV,PARTIDO VERDE,8
TATUÍ,DEPUTADO FEDERAL,LAERTE MOLLETA,LAERTE AMERICO MOLLETA,SUPLENTE,PV,PARTIDO VERDE,27
TATUÍ,DEPUTADO FEDERAL,LUIZA ELUF,LUIZA NAGIB ELUF,SUPLENTE,PV,PARTIDO VERDE,17
TATUÍ,DEPUTADO FEDERAL,TECO,MARCOS FERREIRA GODOY,SUPLENTE,PV,PARTIDO VERDE,3
TATUÍ,DEPUTADO FEDERAL,MARCOS TIBURCIO,MARCOS VALES TIBURCIO,SUPLENTE,PV,PARTIDO VERDE,1
TATUÍ,DEPUTADO FEDERAL,VILSON ALVES,VILSON OSCHIN ALVES,SUPLENTE,PV,PARTIDO VERDE,1
TATUÍ,DEPUTADO FEDERAL,ANDERSON MENDONCA,ANDERSON APARECIDO MENDONCA,SUPLENTE,PV,PARTIDO VERDE,2
TATUÍ,DEPUTADO FEDERAL,SIDNEI ARANHA,SIDNEI ARANHA,SUPLENTE,PV,PARTIDO VERDE,1
TATUÍ,DEPUTADO FEDERAL,DR. SAULO,VESPASIANO SAULO DA COSTA E SILVA,SUPLENTE,PV,PARTIDO VERDE,3
TATUÍ,DEPUTADO FEDERAL,JOSE SILVÉRIO,JOSÉ SILVÉRIO GOMES DOMINGOS,SUPLENTE,PV,PARTIDO VERDE,1
TATUÍ,DEPUTADO FEDERAL,PROFESSOR EVERALDO,EVERALDO SOUZA DOS SANTOS,SUPLENTE,PV,PARTIDO VERDE,1
TATUÍ,DEPUTADO FEDERAL,AMAURY CAMARGO MONICO,AMAURY CAMARGO MONACO,SUPLENTE,PV,PARTIDO VERDE,4
TATUÍ,DEPUTADO FEDERAL,VERA MOTTA,VERA LÚCIA DA MOTTA,SUPLENTE,PV,PARTIDO VERDE,3
TATUÍ,DEPUTADO FEDERAL,CARLOS SAMPAIO,CARLOS HENRIQUE FOCESI SAMPAIO,ELEITO,PSDB,PSDB/DEM/PPS,52
TATUÍ,DEPUTADO FEDERAL,POPPI,JOÃO HENRIQUE GONÇALVES MARCICANO POPPI,SUPLENTE,PSDB,PSDB/DEM/PPS,4
TATUÍ,DEPUTADO FEDERAL,WALTER MELLO,WALTER CASTRO DE MELLO,SUPLENTE,PSDB,PSDB/DEM/PPS,1
TATUÍ,DEPUTADO FEDERAL,JOSE LUIZ,JOSE LUIZ SILVA BRUNO,SUPLENTE,PSDB,PSDB/DEM/PPS,1
TATUÍ,DEPUTADO FEDERAL,STANGARLINI,JOSE CARLOS STANGARLINI,SUPLENTE,PSDB,PSDB/DEM/PPS,131
TATUÍ,DEPUTADO FEDERAL,RAUL CHRISTIANO,RAUL CHRISTIANO DE OLIVEIRA SANCHEZ,SUPLENTE,PSDB,PSDB/DEM/PPS,23
TATUÍ,DEPUTADO FEDERAL,LOBBE NETO,ANTONIO ADOLPHO LOBBE NETO,SUPLENTE,PSDB,PSDB/DEM/PPS,46
TATUÍ,DEPUTADO FEDERAL,FELICIDADE,FELICIDADE LOPES PONTES,SUPLENTE,PSDB,PSDB/DEM/PPS,8
TATUÍ,DEPUTADO FEDERAL,MANOEL MARCOS (MANÉ),MANOEL MARCOS DE JESUS FERREIRA,SUPLENTE,PSDB,PSDB/DEM/PPS,9
TATUÍ,DEPUTADO FEDERAL,EMANUEL FERNANDES,EMANUEL FERNANDES,ELEITO,PSDB,PSDB/DEM/PPS,20
TATUÍ,DEPUTADO FEDERAL,MARA GABRILLI,MARA CRISTINA GABRILLI,ELEITO,PSDB,PSDB/DEM/PPS,82
TATUÍ,DEPUTADO FEDERAL,JOÃO PAULO FERRARESSO,JOÃO PAULO CORSETTI FERRARESSO,SUPLENTE,PSDB,PSDB/DEM/PPS,5
TATUÍ,DEPUTADO FEDERAL,MARCOS ARAUJO,MARCOS ROSA DE ARAUJO,SUPLENTE,PSDB,PSDB/DEM/PPS,4
TATUÍ,DEPUTADO FEDERAL,CARLOS BRAGA,CARLOS EDUARDO FARACO BRAGA,SUPLENTE,PSDB,PSDB/DEM/PPS,15
TATUÍ,DEPUTADO FEDERAL,LELIS DA ROCHA,LELIS DA ROCHA,SUPLENTE,PSDB,PSDB/DEM/PPS,30
TATUÍ,DEPUTADO FEDERAL,CARLOS ROBERTO,CARLOS ROBERTO DE CAMPOS,SUPLENTE,PSDB,PSDB/DEM/PPS,33
TATUÍ,DEPUTADO FEDERAL,DIB,WILLIAM DIB,ELEITO,PSDB,PSDB/DEM/PPS,39
TATUÍ,DEPUTADO FEDERAL,PANNUNZIO,ANTONIO CARLOS PANNUNZIO,SUPLENTE,PSDB,PSDB/DEM/PPS,6299
TATUÍ,DEPUTADO FEDERAL,LUCIA SANTUCCI,LUCIA MARIA SANTUCCI,SUPLENTE,PSDB,PSDB/DEM/PPS,9
TATUÍ,DEPUTADO FEDERAL,ALBERTO MOURAO,ALBERTO PEREIRA MOURAO,SUPLENTE,PSDB,PSDB/DEM/PPS,69
TATUÍ,DEPUTADO FEDERAL,RENATO AMARY,RENATO FAUVEL AMARY,SUPLENTE,PSDB,PSDB/DEM/PPS,5135
TATUÍ,DEPUTADO FEDERAL,DR ANDRE SACCO,ANDRE SACCO JUNIOR,SUPLENTE,PSDB,PSDB/DEM/PPS,7
TATUÍ,DEPUTADO FEDERAL,SILVIO TORRES,SILVIO FRANÇA TORRES,SUPLENTE,PSDB,PSDB/DEM/PPS,3
TATUÍ,DEPUTADO FEDERAL,TIRSO MEIRELLES,TIRSO DE SALLES MEIRELLES,SUPLENTE,PSDB,PSDB/DEM/PPS,113
TATUÍ,DEPUTADO FEDERAL,TERESA SERRANO,MARIA TERESA SERRANO AFONSO,SUPLENTE,PSDB,PSDB/DEM/PPS,3
TATUÍ,DEPUTADO FEDERAL,EDSON APARECIDO,EDSON APARECIDO DOS SANTOS,ELEITO,PSDB,PSDB/DEM/PPS,102
TATUÍ,DEPUTADO FEDERAL,RICARDO MONTORO,JOSE RICARDO FRANCO MONTORO,SUPLENTE,PSDB,PSDB/DEM/PPS,11
TATUÍ,DEPUTADO FEDERAL,LUIZ FERNANDO MACHADO,LUIZ FERNANDO ARANTES MACHADO,ELEITO,PSDB,PSDB/DEM/PPS,15
TATUÍ,DEPUTADO FEDERAL,DR. MARCELO,MARCELO CHEHADE,SUPLENTE,PSDB,PSDB/DEM/PPS,4
TATUÍ,DEPUTADO FEDERAL,VANDERLEI MACRIS,VANDERLEI MACRIS,SUPLENTE,PSDB,PSDB/DEM/PPS,454
TATUÍ,DEPUTADO FEDERAL,DUARTE NOGUEIRA,ANTONIO DUARTE NOGUEIRA JUNIOR,ELEITO,PSDB,PSDB/DEM/PPS,18
TATUÍ,DEPUTADO FEDERAL,JULIO SEMEGHINI,JULIO FRACISCO SEMEGHINI NETO,ELEITO,PSDB,PSDB/DEM/PPS,72
TATUÍ,DEPUTADO FEDERAL,RAFAEL ABUD,RAFAEL ANGELO ABUD,SUPLENTE,PSDB,PSDB/DEM/PPS,2
TATUÍ,DEPUTADO FEDERAL,GIVALDO VIEIRA,GIVALDO RODRIGUES VIEIRA,SUPLENTE,PSDB,PSDB/DEM/PPS,13
TATUÍ,DEPUTADO FEDERAL,TRIPOLI,JOSÉ RICARDO ALVARENGA TRIPOLI,ELEITO,PSDB,PSDB/DEM/PPS,87
TATUÍ,DEPUTADO FEDERAL,FERNANDO FUAD CHUCRE,FERNANDO BARRANCOS CHUCRE,SUPLENTE,PSDB,PSDB/DEM/PPS,10
TATUÍ,DEPUTADO FEDERAL,VAZ DE LIMA,JOSÉ CARLOS VAZ DE LIMA,ELEITO,PSDB,PSDB/DEM/PPS,121
TATUÍ,DEPUTADO FEDERAL,ALEMÃO DA SÁUDE,CLAUDEMIR SERENO,SUPLENTE,PSDB,PSDB/DEM/PPS,7
TATUÍ,DEPUTADO FEDERAL,TIÃO,SEBASTIÃO FERRES ARSENE,SUPLENTE,PSDB,PSDB/DEM/PPS,3
TATUÍ,DEPUTADO FEDERAL,WALTER FELDMAN,WALTER MEYER FELDMAN,SUPLENTE,PSDB,PSDB/DEM/PPS,15
TATUÍ,DEPUTADO FEDERAL,THAME,ANTONIO CARLOS DE MENDES THAME,ELEITO,PSDB,PSDB/DEM/PPS,47
TATUÍ,DEPUTADO FEDERAL,ARNALDO MADEIRA,ARNALDO DE ABREU MADEIRA,SUPLENTE,PSDB,PSDB/DEM/PPS,5009
TATUÍ,DEPUTADO FEDERAL,BRUNA FURLAN,BRUNA DIAS FURLAN,ELEITO,PSDB,PSDB/DEM/PPS,145
TATUÍ,DEPUTADO FEDERAL,JOSÉ ANIBAL,JOSÉ ANIBAL PERES DE PONTES,ELEITO,PSDB,PSDB/DEM/PPS,2533
TATUÍ,DEPUTADO FEDERAL,NELSON BUGALHO,NELSON ROBERTO BUGALHO,SUPLENTE,PSDB,PSDB/DEM/PPS,10
TATUÍ,DEPUTADO FEDERAL,GILBERTO BORJA,GILBERTO BORJA PINTO,SUPLENTE,PSDB,PSDB/DEM/PPS,13
TATUÍ,DEPUTADO FEDERAL,SIRINEU BARBOSA,JOSÉ SIRINEU FILGUEIRAS BARBOSA,SUPLENTE,PSDB,PSDB/DEM/PPS,3
TATUÍ,DEPUTADO FEDERAL,RAFAEL MOYA,RAFAEL DUARTE MOYA,SUPLENTE,PSOL,PARTIDO SOCIALISMO E LIBERDADE,1
TATUÍ,DEPUTADO FEDERAL,PROFESSOR SAULO CARVALHO,SAULO RODRIGUES DE CARVALHO,SUPLENTE,PSOL,PARTIDO SOCIALISMO E LIBERDADE,3
TATUÍ,DEPUTADO FEDERAL,RODRIGO CHIZOLINI,RODRIGO PINTO CHIZOLINI,SUPLENTE,PSOL,PARTIDO SOCIALISMO E LIBERDADE,4
TATUÍ,DEPUTADO FEDERAL,TERESA COSTA,TERESA COSTA,SUPLENTE,PSOL,PARTIDO SOCIALISMO E LIBERDADE,2
TATUÍ,DEPUTADO FEDERAL,AKIKO AKI,AKIKO AKIYAMA,SUPLENTE,PSOL,PARTIDO SOCIALISMO E LIBERDADE,2
TATUÍ,DEPUTADO FEDERAL,CICERO DO POSTO,CICERO SEVERINO DE LIMA,SUPLENTE,PSOL,PARTIDO SOCIALISMO E LIBERDADE,3
TATUÍ,DEPUTADO FEDERAL,PROF. NETO,DACIO VIEIRA DE CAMARGO NETO,SUPLENTE,PSOL,PARTIDO SOCIALISMO E LIBERDADE,334
TATUÍ,DEPUTADO FEDERAL,IVAN VALENTE,IVAN VALENTE,ELEITO,PSOL,PARTIDO SOCIALISMO E LIBERDADE,264
TATUÍ,DEPUTADO FEDERAL,JOHN KENNEDY,JOHN KENNEDY FERREIRA,SUPLENTE,PSOL,PARTIDO SOCIALISMO E LIBERDADE,1
TATUÍ,DEPUTADO FEDERAL,PROFESSORA MÁRCIA TAVARES,MÁRCIA TAVARES DO NASCIMENTO,SUPLENTE,PSOL,PARTIDO SOCIALISMO E LIBERDADE,2
TATUÍ,DEPUTADO FEDERAL,MARZENI,MARZENI PEREIRA DA SILVA,SUPLENTE,PSOL,PARTIDO SOCIALISMO E LIBERDADE,1
TATUÍ,DEPUTADO FEDERAL,RAMALHAO,MOMÉDIO DE SOUZA RAMALHO,SUPLENTE,PSOL,PARTIDO SOCIALISMO E LIBERDADE,6
TATUÍ,DEPUTADO FEDERAL,MARIO CONCEIÇÃO,MARIO CONCEIÇÃO,SUPLENTE,PSOL,PARTIDO SOCIALISMO E LIBERDADE,5
TATUÍ,DEPUTADO FEDERAL,MARIANA CONTI,MARIANA CONTI TAKAHASHI,SUPLENTE,PSOL,PARTIDO SOCIALISMO E LIBERDADE,2
TATUÍ,DEPUTADO FEDERAL,NOBEL SOARES DE OLIVEIRA,NOBEL SOARES DE OLIVEIRA,SUPLENTE,PSOL,PARTIDO SOCIALISMO E LIBERDADE,2
TATUÍ,DEPUTADO FEDERAL,RAIMUNDO FE,RAIMUNDO DE CARVALHO FE,SUPLENTE,PSOL,PARTIDO SOCIALISMO E LIBERDADE,1
TATUÍ,DEPUTADO FEDERAL,DR. ABELHA,CARLOS FERNANDO LOPES ABELHA,SUPLENTE,PC DO B,JUNTOS POR SÃO PAULO,25
TATUÍ,DEPUTADO FEDERAL,GUSTAVO PETTA,GUSTAVO LEMOS PETTA,SUPLENTE,PC DO B,JUNTOS POR SÃO PAULO,19
TATUÍ,DEPUTADO FEDERAL,SIDNEI MARTINS,SIDNEI ALVES MARTINS,SUPLENTE,PC DO B,JUNTOS POR SÃO PAULO,1
TATUÍ,DEPUTADO FEDERAL,CÉLIO TURINO,CÉLIO ROBERTO TURINO DE MIRANDA,SUPLENTE,PC DO B,JUNTOS POR SÃO PAULO,5
TATUÍ,DEPUTADO FEDERAL,ALDO REBELO,JOSÉ ALDO REBELO FIGUEIREDO,ELEITO,PC DO B,JUNTOS POR SÃO PAULO,65
TATUÍ,DEPUTADO FEDERAL,DELEGADO PROTÓGENES,PROTÓGENES PINHEIRO DE QUEIROZ,MÉDIA,PC DO B,JUNTOS POR SÃO PAULO,153
TATUÍ,DEPUTADO FEDERAL,JOAO ARAUJO,JOAO LUIS ARAUJO NETO,SUPLENTE,PT DO B,JUNTOS POR SÃO PAULO,20
TATUÍ,DEPUTADO FEDERAL,DR MARCAO DA MANCHA,MARCO ANTONIO NOTARI,SUPLENTE,PT DO B,JUNTOS POR SÃO PAULO,14
TATUÍ,DEPUTADO ESTADUAL,GERSON DEZEMBRO,GERSON DONIZETI DEZEMBRO,SUPLENTE,PRB,SOMOS MAIS SÃO PAULO,3
TATUÍ,DEPUTADO ESTADUAL,VALDIR OLIVEIRA,VALDIR OLIVEIRA SANTOS,SUPLENTE,PRB,SOMOS MAIS SÃO PAULO,3
TATUÍ,DEPUTADO ESTADUAL,CORINTHIANO,RODRIGO GHIRALDELLI,SUPLENTE,PRB,SOMOS MAIS SÃO PAULO,2
TATUÍ,DEPUTADO ESTADUAL,GILMACI SANTOS,GILMACI DOS SANTOS BARBOSA,ELEITO,PRB,SOMOS MAIS SÃO PAULO,10
TATUÍ,DEPUTADO ESTADUAL,DR. MARCELO MACHADO,MARCELO PINTO MACHADO,SUPLENTE,PRB,SOMOS MAIS SÃO PAULO,1
TATUÍ,DEPUTADO ESTADUAL,SEBASTIÃO SANTOS,SEBASTIÃO DOS SANTOS FILHO,ELEITO,PRB,SOMOS MAIS SÃO PAULO,536
TATUÍ,DEPUTADO ESTADUAL,HAVANIR,HAVANIR TAVARES DE ALMEIDA NIMTZ,SUPLENTE,PRB,SOMOS MAIS SÃO PAULO,21
TATUÍ,DEPUTADO ESTADUAL,RICARDO SARAVALLI,RICARDO SARAVALLI,SUPLENTE,PP,PARTIDO PROGRESSISTA,1
TATUÍ,DEPUTADO ESTADUAL,MARCÃO SIGA BEM,MARCO ANTONIO FERREIRA,SUPLENTE,PP,PARTIDO PROGRESSISTA,1
TATUÍ,DEPUTADO ESTADUAL,MALEK,ROBSON MALEK,SUPLENTE,PP,PARTIDO PROGRESSISTA,18
TATUÍ,DEPUTADO ESTADUAL,QUATI,ANTONIO DOS SANTOS BARBOSA,SUPLENTE,PP,PARTIDO PROGRESSISTA,1
TATUÍ,DEPUTADO ESTADUAL,CURIATI,ANTONIO SALIM CURIATI,ELEITO,PP,PARTIDO PROGRESSISTA,403
TATUÍ,DEPUTADO ESTADUAL,VALDIR DA SILVA,VALDIR DA SILVA,SUPLENTE,PP,PARTIDO PROGRESSISTA,1
TATUÍ,DEPUTADO ESTADUAL,DR. SERGIO CHEBEL,SERGIO CABRAL CHEBEL,SUPLENTE,PP,PARTIDO PROGRESSISTA,2
TATUÍ,DEPUTADO ESTADUAL,JOSE MENINO NETO,JOSE MENINO NETO,SUPLENTE,PP,PARTIDO PROGRESSISTA,2
TATUÍ,DEPUTADO ESTADUAL,SIMONY,SIMONY BENELLI GALASSO,SUPLENTE,PP,PARTIDO PROGRESSISTA,23
TATUÍ,DEPUTADO ESTADUAL,MAJOR ROLIM,JOÃO PAULO ROLIM MARQUES,SUPLENTE,PP,PARTIDO PROGRESSISTA,16
TATUÍ,DEPUTADO ESTADUAL,CELSO LEITE,CELSO MARCELINO LEITE,SUPLENTE,PP,PARTIDO PROGRESSISTA,3
TATUÍ,DEPUTADO ESTADUAL,DIOGO TICLY,DIOGO GAZZE TICLY,SUPLENTE,PP,PARTIDO PROGRESSISTA,3
TATUÍ,DEPUTADO ESTADUAL,JOSE DIAS,JOSE DIAS DA SILVA,SUPLENTE,PP,PARTIDO PROGRESSISTA,9
TATUÍ,DEPUTADO ESTADUAL,DR. IRINEU,IRINEU CARDOSO DOS SANTOS,SUPLENTE,PP,PARTIDO PROGRESSISTA,6
TATUÍ,DEPUTADO ESTADUAL,FARIA JR,WALDEMAR ALVES FARIA JUNIOR,SUPLENTE,PP,PARTIDO PROGRESSISTA,3
TATUÍ,DEPUTADO ESTADUAL,MARIA CLEMENTINA,MARIA CLEMENTINO DE SOUSA,SUPLENTE,PP,PARTIDO PROGRESSISTA,1
TATUÍ,DEPUTADO ESTADUAL,RAFA ZIMBALDI,RAFAEL FERNANDO ZIMBALDI,SUPLENTE,PP,PARTIDO PROGRESSISTA,27
TATUÍ,DEPUTADO ESTADUAL,NELSON MANDELA,ADOLPHINO ROSARIO CRUZ,SUPLENTE,PP,PARTIDO PROGRESSISTA,1
TATUÍ,DEPUTADO ESTADUAL,RUSSOMANNO,MOZART ABAETE PERUIBE RUSSOMANNO,SUPLENTE,PP,PARTIDO PROGRESSISTA,9
TATUÍ,DEPUTADO ESTADUAL,MIL DE LIMA,EDMIMILSON APARECIDO DE LIMA,SUPLENTE,PP,PARTIDO PROGRESSISTA,1
TATUÍ,DEPUTADO ESTADUAL,PAULERA,PAULO ROBERTO AMBROSIO,SUPLENTE,PP,PARTIDO PROGRESSISTA,3
TATUÍ,DEPUTADO ESTADUAL,AURELIO,AURELIO JOSE CLAUDIO,SUPLENTE,PDT,PARTIDO DEMOCRÁTICO TRABALHISTA,3
TATUÍ,DEPUTADO ESTADUAL,CASSOLA,JAIR CASSOLA,SUPLENTE,PDT,PARTIDO DEMOCRÁTICO TRABALHISTA,21
TATUÍ,DEPUTADO ESTADUAL,LUIS YABIKU,LUIS MOKITI YABIKU,SUPLENTE,PDT,PARTIDO DEMOCRÁTICO TRABALHISTA,4
TATUÍ,DEPUTADO ESTADUAL,DINEI,CLAUDINEI ALEXANDRE PIRES,SUPLENTE,PDT,PARTIDO DEMOCRÁTICO TRABALHISTA,74
TATUÍ,DEPUTADO ESTADUAL,GILBERTO DOURADO,GILBERTO RODRIGUES DOURADO,SUPLENTE,PDT,PARTIDO DEMOCRÁTICO TRABALHISTA,3
TATUÍ,DEPUTADO ESTADUAL,ROGERIO NOGUEIRA,ROGERIO NOGUEIRA LOPES CRUZ,ELEITO,PDT,PARTIDO DEMOCRÁTICO TRABALHISTA,1216
TATUÍ,DEPUTADO ESTADUAL,CAPITAO LUCAS,AURO LUCAS,SUPLENTE,PDT,PARTIDO DEMOCRÁTICO TRABALHISTA,1
TATUÍ,DEPUTADO ESTADUAL,LUIZ ARRAES,LUIZ DE SOUZA ARRAES,SUPLENTE,PDT,PARTIDO DEMOCRÁTICO TRABALHISTA,1
TATUÍ,DEPUTADO ESTADUAL,JOSE BITTENCOURT,JOSE DOMINGOS BITTENCOURT,ELEITO,PDT,PARTIDO DEMOCRÁTICO TRABALHISTA,48
TATUÍ,DEPUTADO ESTADUAL,PASTOR MAURO FERREIRA,MAURO FERREIRA DE SOUZA,SUPLENTE,PDT,PARTIDO DEMOCRÁTICO TRABALHISTA,10
TATUÍ,DEPUTADO ESTADUAL,MAJOR OLIMPIO,SERGIO OLIMPIO GOMES,ELEITO,PDT,PARTIDO DEMOCRÁTICO TRABALHISTA,217
TATUÍ,DEPUTADO ESTADUAL,THIAGO RODRIGUES,THIAGO RODRIGUES DA COSTA,SUPLENTE,PDT,PARTIDO DEMOCRÁTICO TRABALHISTA,2
TATUÍ,DEPUTADO ESTADUAL,CARLAO MOTORISTA,ANTONIO CARLOS RIBEIRO,SUPLENTE,PDT,PARTIDO DEMOCRÁTICO TRABALHISTA,4
TATUÍ,DEPUTADO ESTADUAL,MARCOS BERNARDELLI,MARCOS JOSÉ BERNARDELLI,SUPLENTE,PDT,PARTIDO DEMOCRÁTICO TRABALHISTA,1
TATUÍ,DEPUTADO ESTADUAL,JOCA VASCONCELOS,JOAO CARLOS MONTE CLARO VASCONCELOS,SUPLENTE,PDT,PARTIDO DEMOCRÁTICO TRABALHISTA,72
TATUÍ,DEPUTADO ESTADUAL,CARLOS HERNANDES,JOSÉ CARLOS SANCHES HERNANDES,SUPLENTE,PDT,PARTIDO DEMOCRÁTICO TRABALHISTA,2
TATUÍ,DEPUTADO ESTADUAL,NICOLACI,RONALD LUIZ NICOLACI FINCATTI,SUPLENTE,PDT,PARTIDO DEMOCRÁTICO TRABALHISTA,4
TATUÍ,DEPUTADO ESTADUAL,BRUZAROSCO,APARECIDO DE JESUS BRUZAROSCO,SUPLENTE,PDT,PARTIDO DEMOCRÁTICO TRABALHISTA,9
TATUÍ,DEPUTADO ESTADUAL,RAFAEL SILVA,RAFAEL ANTONIO DA SILVA,ELEITO,PDT,PARTIDO DEMOCRÁTICO TRABALHISTA,44
TATUÍ,DEPUTADO ESTADUAL,MAURICIO SIQUEIRA,MAURICIO SIQUEIRA,SUPLENTE,PDT,PARTIDO DEMOCRÁTICO TRABALHISTA,1
TATUÍ,DEPUTADO ESTADUAL,NICANOR,NICANOR JOSE DA SILVA,SUPLENTE,PDT,PARTIDO DEMOCRÁTICO TRABALHISTA,1
TATUÍ,DEPUTADO ESTADUAL,TOLOI,LUIZ CARLOS TOLOI JUNIOR,SUPLENTE,PDT,PARTIDO DEMOCRÁTICO TRABALHISTA,4
TATUÍ,DEPUTADO ESTADUAL,TADEU MORAIS,TADEU MORAIS DE SOUSA,SUPLENTE,PDT,PARTIDO DEMOCRÁTICO TRABALHISTA,11
TATUÍ,DEPUTADO ESTADUAL,PROFESSOR VENANCIO,ANTONIO CARLOS VENANCIO,SUPLENTE,PDT,PARTIDO DEMOCRÁTICO TRABALHISTA,2
TATUÍ,DEPUTADO ESTADUAL,LEONICE DA PAZ,LEONICE ALVES DA PAZ,SUPLENTE,PDT,PARTIDO DEMOCRÁTICO TRABALHISTA,54
TATUÍ,DEPUTADO ESTADUAL,HELIO BASTOS,HELIO DE ALMEIDA BASTOS,SUPLENTE,PDT,PARTIDO DEMOCRÁTICO TRABALHISTA,2
TATUÍ,DEPUTADO ESTADUAL,MYRYAM ATHIE,MIRIAM ATHIE,SUPLENTE,PDT,PARTIDO DEMOCRÁTICO TRABALHISTA,3
TATUÍ,DEPUTADO ESTADUAL,TONHÃO SOM DE CRISTAL,ANTONIO DELBUCIO NETO,SUPLENTE,PDT,PARTIDO DEMOCRÁTICO TRABALHISTA,4
TATUÍ,DEPUTADO ESTADUAL,VALDIR SANTOS,VALDIR SOUZA DOS SANTOS,SUPLENTE,PDT,PARTIDO DEMOCRÁTICO TRABALHISTA,2
TATUÍ,DEPUTADO ESTADUAL,ZEZINHO DA RADIO,JOSE MARIA FERNANDES DE MACEDO,SUPLENTE,PDT,PARTIDO DEMOCRÁTICO TRABALHISTA,1
TATUÍ,DEPUTADO ESTADUAL,WENDEL ALVES,WENDEL ALVES DE SOUSA,SUPLENTE,PDT,PARTIDO DEMOCRÁTICO TRABALHISTA,1
TATUÍ,DEPUTADO ESTADUAL,CONSTANCIA FELIX,CONSTANCIA BERBERT DUTRA DA SILVA,SUPLENTE,PDT,PARTIDO DEMOCRÁTICO TRABALHISTA,15
TATUÍ,DEPUTADO ESTADUAL,MARCO BRASIL,MARCO AURÉLIO RIBEIRO,SUPLENTE,PDT,PARTIDO DEMOCRÁTICO TRABALHISTA,17
TATUÍ,DEPUTADO ESTADUAL,JOÃO ELIAS,JOÃO ELIAS PEREIRA,SUPLENTE,PDT,PARTIDO DEMOCRÁTICO TRABALHISTA,27
TATUÍ,DEPUTADO ESTADUAL,ANDERSON SILVA,ANDERSON DOMINGOS DA SILVA,SUPLENTE,PT,SOMOS MAIS SÃO PAULO,4
TATUÍ,DEPUTADO ESTADUAL,DR. JORGE PARADA,JORGE EDUARDO PARADA HURTADO,SUPLENTE,PT,SOMOS MAIS SÃO PAULO,2
TATUÍ,DEPUTADO ESTADUAL,TELMA DE SOUZA,TELMA SANDRA AUGUSTO DE SOUZA,ELEITO,PT,SOMOS MAIS SÃO PAULO,43
TATUÍ,DEPUTADO ESTADUAL,WAGNER BALIEIRO,WAGNER OCIMAR BALIEIRO,SUPLENTE,PT,SOMOS MAIS SÃO PAULO,7
TATUÍ,DEPUTADO ESTADUAL,VALMIR PRASCIDELLI,VALMIR PRASCIDELLI,SUPLENTE,PT,SOMOS MAIS SÃO PAULO,33
TATUÍ,DEPUTADO ESTADUAL,PAULO MARTINS (GAÚCHO),PAULO CESAR GOMES MARTINS,SUPLENTE,PT,SOMOS MAIS SÃO PAULO,1
TATUÍ,DEPUTADO ESTADUAL,JURA,JURACY FRANCISCO DE JESUS,SUPLENTE,PT,SOMOS MAIS SÃO PAULO,3
TATUÍ,DEPUTADO ESTADUAL,GERSON BITTENCOURT,GERSON LUIS BITTENCOURT,ELEITO,PT,SOMOS MAIS SÃO PAULO,2
TATUÍ,DEPUTADO ESTADUAL,EDINHO SILVA,EDSON ANTONIO EDINHO DA SILVA,ELEITO,PT,SOMOS MAIS SÃO PAULO,212
TATUÍ,DEPUTADO ESTADUAL,ENIO TATTO,ENIO FRANCISCO TATTO,ELEITO,PT,SOMOS MAIS SÃO PAULO,4
TATUÍ,DEPUTADO ESTADUAL,RAFAEL MARINHO,RAFAEL DE FIGUEIREDO MARINHO,SUPLENTE,PT,SOMOS MAIS SÃO PAULO,2
TATUÍ,DEPUTADO ESTADUAL,ANA PERUGINI,ANA LUCIA LIPPAUS PERUGINI,ELEITO,PT,SOMOS MAIS SÃO PAULO,7
TATUÍ,DEPUTADO ESTADUAL,TONINHO DO PT,ANTONIO AMARAL JUNIOR,SUPLENTE,PT,SOMOS MAIS SÃO PAULO,1
TATUÍ,DEPUTADO ESTADUAL,ZICO,JOSÉ PRADO DE ANDRADE,MÉDIA,PT,SOMOS MAIS SÃO PAULO,16
TATUÍ,DEPUTADO ESTADUAL,SALETE CAMPARI,FRANCISCO DE SALES RODRIGUES,SUPLENTE,PT,SOMOS MAIS SÃO PAULO,59
TATUÍ,DEPUTADO ESTADUAL,WILSON SANTOS,WILSON SANTOS PEREIRA,SUPLENTE,PT,SOMOS MAIS SÃO PAULO,2
TATUÍ,DEPUTADO ESTADUAL,MARCO AURÉLIO DE SOUZA,MARCO AURÉLIO DE SOUZA,MÉDIA,PT,SOMOS MAIS SÃO PAULO,3
TATUÍ,DEPUTADO ESTADUAL,MARCOS MARTINS,MARCOS LOPES MARTINS,ELEITO,PT,SOMOS MAIS SÃO PAULO,34
TATUÍ,DEPUTADO ESTADUAL,DR. LUIZINHO,LUIS CARLOS LAURINDO,SUPLENTE,PT,SOMOS MAIS SÃO PAULO,1
TATUÍ,DEPUTADO ESTADUAL,ELI TEODORO,ELI TEODORO,SUPLENTE,PT,SOMOS MAIS SÃO PAULO,9
TATUÍ,DEPUTADO ESTADUAL,SIMÃO PEDRO,SIMÃO PEDRO CHIOVETTI,ELEITO,PT,SOMOS MAIS SÃO PAULO,22
TATUÍ,DEPUTADO ESTADUAL,GERALDO CRUZ,GERALDO LEITE DA CRUZ,ELEITO,PT,SOMOS MAIS SÃO PAULO,3
TATUÍ,DEPUTADO ESTADUAL,RUI FALCÃO,RUI GOETHE DA COSTA FALCÃO,ELEITO,PT,SOMOS MAIS SÃO PAULO,10
TATUÍ,DEPUTADO ESTADUAL,ÉMERSON TAUYL,EMERSON LIMA TAUYL,SUPLENTE,PT,SOMOS MAIS SÃO PAULO,2
TATUÍ,DEPUTADO ESTADUAL,ANTONIO MENTOR,ANTONIO MENTOR DE MELLO SOBRINHO,ELEITO,PT,SOMOS MAIS SÃO PAULO,9
TATUÍ,DEPUTADO ESTADUAL,CRISTINA DA USP,CRISTINA SIMOES,SUPLENTE,PT,SOMOS MAIS SÃO PAULO,3
