AMERICANA,DEPUTADO ESTADUAL,EMERSON LEAL,EMERSON PIRES LEAL,SUPLENTE,PDT,PARTIDO DEMOCRÁTICO TRABALHISTA,31
AMERICANA,DEPUTADO ESTADUAL,RAFAEL SILVA,RAFAEL ANTONIO DA SILVA,ELEITO,PDT,PARTIDO DEMOCRÁTICO TRABALHISTA,52
AMERICANA,DEPUTADO ESTADUAL,NICANOR,NICANOR JOSE DA SILVA,SUPLENTE,PDT,PARTIDO DEMOCRÁTICO TRABALHISTA,1
AMERICANA,DEPUTADO ESTADUAL,TOLOI,LUIZ CARLOS TOLOI JUNIOR,SUPLENTE,PDT,PARTIDO DEMOCRÁTICO TRABALHISTA,14
AMERICANA,DEPUTADO ESTADUAL,TADEU MORAIS,TADEU MORAIS DE SOUSA,SUPLENTE,PDT,PARTIDO DEMOCRÁTICO TRABALHISTA,13
AMERICANA,DEPUTADO ESTADUAL,LEONICE DA PAZ,LEONICE ALVES DA PAZ,SUPLENTE,PDT,PARTIDO DEMOCRÁTICO TRABALHISTA,11
AMERICANA,DEPUTADO ESTADUAL,HELIO BASTOS,HELIO DE ALMEIDA BASTOS,SUPLENTE,PDT,PARTIDO DEMOCRÁTICO TRABALHISTA,2
AMERICANA,DEPUTADO ESTADUAL,VALDIR SANTOS,VALDIR SOUZA DOS SANTOS,SUPLENTE,PDT,PARTIDO DEMOCRÁTICO TRABALHISTA,1
AMERICANA,DEPUTADO ESTADUAL,ZEZINHO DA RADIO,JOSE MARIA FERNANDES DE MACEDO,SUPLENTE,PDT,PARTIDO DEMOCRÁTICO TRABALHISTA,1
AMERICANA,DEPUTADO ESTADUAL,WENDEL ALVES,WENDEL ALVES DE SOUSA,SUPLENTE,PDT,PARTIDO DEMOCRÁTICO TRABALHISTA,1
AMERICANA,DEPUTADO ESTADUAL,ZE DIAS,JOSE CARLOS FERREIRA DIAS,SUPLENTE,PDT,PARTIDO DEMOCRÁTICO TRABALHISTA,1
AMERICANA,DEPUTADO ESTADUAL,CONSTANCIA FELIX,CONSTANCIA BERBERT DUTRA DA SILVA,SUPLENTE,PDT,PARTIDO DEMOCRÁTICO TRABALHISTA,345
AMERICANA,DEPUTADO ESTADUAL,SILAS FARIA,SILAS FARIA DE SOUZA,SUPLENTE,PDT,PARTIDO DEMOCRÁTICO TRABALHISTA,3
AMERICANA,DEPUTADO ESTADUAL,VITROLINHA,EUVALDO REIS DOS SANTOS MENEZES,SUPLENTE,PDT,PARTIDO DEMOCRÁTICO TRABALHISTA,1
AMERICANA,DEPUTADO ESTADUAL,MARCO BRASIL,MARCO AURÉLIO RIBEIRO,SUPLENTE,PDT,PARTIDO DEMOCRÁTICO TRABALHISTA,20
AMERICANA,DEPUTADO ESTADUAL,JOÃO ELIAS,JOÃO ELIAS PEREIRA,SUPLENTE,PDT,PARTIDO DEMOCRÁTICO TRABALHISTA,2
AMERICANA,DEPUTADO ESTADUAL,ANDERSON SILVA,ANDERSON DOMINGOS DA SILVA,SUPLENTE,PT,SOMOS MAIS SÃO PAULO,6
AMERICANA,DEPUTADO ESTADUAL,DR. JORGE PARADA,JORGE EDUARDO PARADA HURTADO,SUPLENTE,PT,SOMOS MAIS SÃO PAULO,1
AMERICANA,DEPUTADO ESTADUAL,TELMA DE SOUZA,TELMA SANDRA AUGUSTO DE SOUZA,ELEITO,PT,SOMOS MAIS SÃO PAULO,2
AMERICANA,DEPUTADO ESTADUAL,PEDRO BIANGULI,PEDRO CARLOS BIANGULI DE FARIA,SUPLENTE,PT,SOMOS MAIS SÃO PAULO,1
AMERICANA,DEPUTADO ESTADUAL,VALMIR PRASCIDELLI,VALMIR PRASCIDELLI,SUPLENTE,PT,SOMOS MAIS SÃO PAULO,1
AMERICANA,DEPUTADO ESTADUAL,ENGª MÔNICA BOMBONATO,MÔNICA ESTELA BOMBONATO,SUPLENTE,PT,SOMOS MAIS SÃO PAULO,13
AMERICANA,DEPUTADO ESTADUAL,JURA,JURACY FRANCISCO DE JESUS,SUPLENTE,PT,SOMOS MAIS SÃO PAULO,11
AMERICANA,DEPUTADO ESTADUAL,GERSON BITTENCOURT,GERSON LUIS BITTENCOURT,ELEITO,PT,SOMOS MAIS SÃO PAULO,51
AMERICANA,DEPUTADO ESTADUAL,EDINHO SILVA,EDSON ANTONIO EDINHO DA SILVA,ELEITO,PT,SOMOS MAIS SÃO PAULO,103
AMERICANA,DEPUTADO ESTADUAL,ENIO TATTO,ENIO FRANCISCO TATTO,ELEITO,PT,SOMOS MAIS SÃO PAULO,4
AMERICANA,DEPUTADO ESTADUAL,RAFAEL MARINHO,RAFAEL DE FIGUEIREDO MARINHO,SUPLENTE,PT,SOMOS MAIS SÃO PAULO,7
AMERICANA,DEPUTADO ESTADUAL,ANA PERUGINI,ANA LUCIA LIPPAUS PERUGINI,ELEITO,PT,SOMOS MAIS SÃO PAULO,51
AMERICANA,DEPUTADO ESTADUAL,TONINHO DO PT,ANTONIO AMARAL JUNIOR,SUPLENTE,PT,SOMOS MAIS SÃO PAULO,2
AMERICANA,DEPUTADO ESTADUAL,ZICO,JOSÉ PRADO DE ANDRADE,MÉDIA,PT,SOMOS MAIS SÃO PAULO,123
AMERICANA,DEPUTADO ESTADUAL,SALETE CAMPARI,FRANCISCO DE SALES RODRIGUES,SUPLENTE,PT,SOMOS MAIS SÃO PAULO,4
AMERICANA,DEPUTADO ESTADUAL,WILSON SANTOS,WILSON SANTOS PEREIRA,SUPLENTE,PT,SOMOS MAIS SÃO PAULO,2
AMERICANA,DEPUTADO ESTADUAL,MARCO AURÉLIO DE SOUZA,MARCO AURÉLIO DE SOUZA,MÉDIA,PT,SOMOS MAIS SÃO PAULO,2
AMERICANA,DEPUTADO ESTADUAL,MARCOS MARTINS,MARCOS LOPES MARTINS,ELEITO,PT,SOMOS MAIS SÃO PAULO,12
AMERICANA,DEPUTADO ESTADUAL,DR. LUIZINHO,LUIS CARLOS LAURINDO,SUPLENTE,PT,SOMOS MAIS SÃO PAULO,4
AMERICANA,DEPUTADO ESTADUAL,ELI TEODORO,ELI TEODORO,SUPLENTE,PT,SOMOS MAIS SÃO PAULO,10
AMERICANA,DEPUTADO ESTADUAL,SIMÃO PEDRO,SIMÃO PEDRO CHIOVETTI,ELEITO,PT,SOMOS MAIS SÃO PAULO,75
AMERICANA,DEPUTADO ESTADUAL,GERALDO CRUZ,GERALDO LEITE DA CRUZ,ELEITO,PT,SOMOS MAIS SÃO PAULO,3
AMERICANA,DEPUTADO ESTADUAL,RUI FALCÃO,RUI GOETHE DA COSTA FALCÃO,ELEITO,PT,SOMOS MAIS SÃO PAULO,3
AMERICANA,DEPUTADO ESTADUAL,JUSTINO CAMPO BELO,JUSTINO DA SILVA,SUPLENTE,PT,SOMOS MAIS SÃO PAULO,6
AMERICANA,DEPUTADO ESTADUAL,DUDU BOLITO,AMARILDO DUDU BOLITO,SUPLENTE,PT,SOMOS MAIS SÃO PAULO,4
AMERICANA,DEPUTADO ESTADUAL,ÉMERSON TAUYL,EMERSON LIMA TAUYL,SUPLENTE,PT,SOMOS MAIS SÃO PAULO,14
AMERICANA,DEPUTADO ESTADUAL,ANTONIO MENTOR,ANTONIO MENTOR DE MELLO SOBRINHO,ELEITO,PT,SOMOS MAIS SÃO PAULO,8300
AMERICANA,DEPUTADO ESTADUAL,PADRE JUZEMILDO,JUZEMILDO ALBINO DA SILVA,SUPLENTE,PT,SOMOS MAIS SÃO PAULO,1
AMERICANA,DEPUTADO ESTADUAL,ADRIANO DIOGO,ADRIANO DIOGO,ELEITO,PT,SOMOS MAIS SÃO PAULO,5
AMERICANA,DEPUTADO ESTADUAL,ESTELA ALMAGRO,ESTELA ALEXANDRE ALMAGRO,SUPLENTE,PT,SOMOS MAIS SÃO PAULO,1
AMERICANA,DEPUTADO ESTADUAL,HAMILTON PEREIRA,HAMILTON PEREIRA,ELEITO,PT,SOMOS MAIS SÃO PAULO,4
AMERICANA,DEPUTADO ESTADUAL,LUIZ CLAUDIO MARCOLINO,LUIZ CLAUDIO MARCOLINO,ELEITO,PT,SOMOS MAIS SÃO PAULO,1
AMERICANA,DEPUTADO ESTADUAL,RENATO DO GEB,RENATO MORENI AIRES DA SILVA,SUPLENTE,PT,SOMOS MAIS SÃO PAULO,3
AMERICANA,DEPUTADO ESTADUAL,DENISE ERBELLA,DENISE ELOÁ CUSTÓDIO ERBELLA DE CASTRO,SUPLENTE,PT,SOMOS MAIS SÃO PAULO,2
AMERICANA,DEPUTADO ESTADUAL,NATIVIDADE,MARIA DA NATIVIDADE PEREIRA LIMA,SUPLENTE,PT,SOMOS MAIS SÃO PAULO,7
AMERICANA,DEPUTADO ESTADUAL,ROBERTO FELICIO,ROBERTO FELICIO,SUPLENTE,PT,SOMOS MAIS SÃO PAULO,126
AMERICANA,DEPUTADO ESTADUAL,RAFAEL AGOSTINI,RAFAEL LUNARDELLI AGOSTINI,SUPLENTE,PT,SOMOS MAIS SÃO PAULO,4
AMERICANA,DEPUTADO ESTADUAL,BETH SAHAO,ELISABETH SAHÃO,SUPLENTE,PT,SOMOS MAIS SÃO PAULO,6
AMERICANA,DEPUTADO ESTADUAL,ADINAN ORTOLAN,JOSÉ ADINAN ORTOLAN,SUPLENTE,PT,SOMOS MAIS SÃO PAULO,9
AMERICANA,DEPUTADO ESTADUAL,LELO PAGANI,LUIZ AURELIO PAGANI,SUPLENTE,PT,SOMOS MAIS SÃO PAULO,2
AMERICANA,DEPUTADO ESTADUAL,ALENCAR,ALENCAR SANTANA BRAGA,ELEITO,PT,SOMOS MAIS SÃO PAULO,2
AMERICANA,DEPUTADO ESTADUAL,TIÃOZINHO,SEBASTIÃO MOREIREA ARCANJO,SUPLENTE,PT,SOMOS MAIS SÃO PAULO,25
AMERICANA,DEPUTADO ESTADUAL,VERA SABA,VERA LÚCIA SANTOS SABA,SUPLENTE,PT,SOMOS MAIS SÃO PAULO,3
AMERICANA,DEPUTADO ESTADUAL,PROFESSOR AGNERIO,AGNERIO NERI FERREIRA,SUPLENTE,PT,SOMOS MAIS SÃO PAULO,3
AMERICANA,DEPUTADO ESTADUAL,ISAC REIS,ISAC FRANCO DOS REIS,ELEITO,PT,SOMOS MAIS SÃO PAULO,22
AMERICANA,DEPUTADO ESTADUAL,BRENO CORTELLA,BRENO ZANONI CORTELLA,SUPLENTE,PT,SOMOS MAIS SÃO PAULO,4
AMERICANA,DEPUTADO ESTADUAL,JOÃO PAULO RILLO,JOÃO PAULO RILLO,ELEITO,PT,SOMOS MAIS SÃO PAULO,2
AMERICANA,DEPUTADO ESTADUAL,MIRANDA,JOSÉ CARLOS MIRANDA,SUPLENTE,PT,SOMOS MAIS SÃO PAULO,4
AMERICANA,DEPUTADO ESTADUAL,JOSÉ CANDIDO,JOSÉ DE SOUZA CÂNDIDO,MÉDIA,PT,SOMOS MAIS SÃO PAULO,3
AMERICANA,DEPUTADO ESTADUAL,JOÃO ANTONIO,JOAO ANTONIO DA SILVA FILHO,ELEITO,PT,SOMOS MAIS SÃO PAULO,1
AMERICANA,DEPUTADO ESTADUAL,GALLO,JURANDIR GALLO,SUPLENTE,PT,SOMOS MAIS SÃO PAULO,2
AMERICANA,DEPUTADO ESTADUAL,LINEU NAVARRO,LUIZ ANTONIO NAVARRO MAGALHÃES LUZ,SUPLENTE,PT,SOMOS MAIS SÃO PAULO,3
AMERICANA,DEPUTADO ESTADUAL,IRENE,IRENE DOS SANTOS,SUPLENTE,PT,SOMOS MAIS SÃO PAULO,2
AMERICANA,DEPUTADO ESTADUAL,MÁRCIO CHAVES,MÁRCIO CHAVES PIRES,SUPLENTE,PT,SOMOS MAIS SÃO PAULO,6
AMERICANA,DEPUTADO ESTADUAL,ZÉ ARISTEIA,JOSÉ ARISTEIA PEREIRA,SUPLENTE,PT,SOMOS MAIS SÃO PAULO,5
AMERICANA,DEPUTADO ESTADUAL,SÉRGIO DESIDERÁ,SÉRGIO DESIDERÁ,SUPLENTE,PT,SOMOS MAIS SÃO PAULO,7
AMERICANA,DEPUTADO ESTADUAL,CARLOS GRANA,CARLOS ALBERTO GRANA,ELEITO,PT,SOMOS MAIS SÃO PAULO,8
AMERICANA,DEPUTADO ESTADUAL,ZÉ ANTÔNIO,JOSÉ ANTONIO DA SILVA,SUPLENTE,PT,SOMOS MAIS SÃO PAULO,37
AMERICANA,DEPUTADO ESTADUAL,ELISEU COSTA,ELISEU SILVA COSTA,SUPLENTE,PT,SOMOS MAIS SÃO PAULO,2
AMERICANA,DEPUTADO ESTADUAL,MIRIAN SILVA,MIRIAN MARIA SILVA GOTTZENT,SUPLENTE,PT,SOMOS MAIS SÃO PAULO,1
AMERICANA,DEPUTADO ESTADUAL,TITO,FRANCISCO DE ASSIS PEREIRA DE CAMPOS,SUPLENTE,PT,SOMOS MAIS SÃO PAULO,147
AMERICANA,DEPUTADO ESTADUAL,LUIZ MOURA,LUIZ DE MOURA PEREIRA,ELEITO,PT,SOMOS MAIS SÃO PAULO,5
AMERICANA,DEPUTADO ESTADUAL,PROFESSOR HERCULANO,JOSÉ HERCULANO DA SILVA,SUPLENTE,PT,SOMOS MAIS SÃO PAULO,3
AMERICANA,DEPUTADO ESTADUAL,DONISETE BRAGA,DONISETE PEREIRA BRAGA,ELEITO,PT,SOMOS MAIS SÃO PAULO,4
AMERICANA,DEPUTADO ESTADUAL,EDUARDO SIMAO,EDUARDO SIMAO DIAS,SUPLENTE,PT,SOMOS MAIS SÃO PAULO,1
AMERICANA,DEPUTADO ESTADUAL,CARLOS NEDER,CARLOS ALBERTO PLETZ NEDER,SUPLENTE,PT,SOMOS MAIS SÃO PAULO,15
AMERICANA,DEPUTADO ESTADUAL,PROF PROSPERINA,PROSPERINA GOMES DA CRUZ,SUPLENTE,PTB,PARTIDO TRABALHISTA BRASILEIRO,1
AMERICANA,DEPUTADO ESTADUAL,JOTA SILVA,JOAO JORGE FERREIRA DA SILVA,SUPLENTE,PTB,PARTIDO TRABALHISTA BRASILEIRO,4
AMERICANA,DEPUTADO ESTADUAL,LÉO ÁQUILLA,JADSON MENDES DE LIMA,SUPLENTE,PTB,PARTIDO TRABALHISTA BRASILEIRO,43
AMERICANA,DEPUTADO ESTADUAL,DR GARDEZAN,JOSE ROBERTO GARDEZAN,SUPLENTE,PTB,PARTIDO TRABALHISTA BRASILEIRO,1
AMERICANA,DEPUTADO ESTADUAL,DANIEL LOBO,DANIEL RIBEIRO LOBO,SUPLENTE,PTB,PARTIDO TRABALHISTA BRASILEIRO,1
AMERICANA,DEPUTADO ESTADUAL,EMILIO CARLOS,EMILIO CARLOS TENAGLIA,SUPLENTE,PTB,PARTIDO TRABALHISTA BRASILEIRO,1
AMERICANA,DEPUTADO ESTADUAL,CEBOLINHA,JOAO VIANELLE PINTO,SUPLENTE,PTB,PARTIDO TRABALHISTA BRASILEIRO,1
AMERICANA,DEPUTADO ESTADUAL,KLEBER LEITE,CLEVERSON SPERBER,SUPLENTE,PTB,PARTIDO TRABALHISTA BRASILEIRO,68
AMERICANA,DEPUTADO ESTADUAL,AMARO MARIANO DA SILVA,AMARO MARIANO DA SILVA,SUPLENTE,PTB,PARTIDO TRABALHISTA BRASILEIRO,1
AMERICANA,DEPUTADO ESTADUAL,CONTE LOPES,ROBERVAL CONTE LOPES LIMA,SUPLENTE,PTB,PARTIDO TRABALHISTA BRASILEIRO,24
AMERICANA,DEPUTADO ESTADUAL,CAMPOS MACHADO,ANTONIO CARLOS DE CAMPOS MACHADO,ELEITO,PTB,PARTIDO TRABALHISTA BRASILEIRO,150
AMERICANA,DEPUTADO ESTADUAL,VANDO,ORVANDO DA SILVA,SUPLENTE,PTB,PARTIDO TRABALHISTA BRASILEIRO,3
AMERICANA,DEPUTADO ESTADUAL,JUVENCIO MARQUES,JUVENCIO MARQUES DE ALCANTARA,SUPLENTE,PTB,PARTIDO TRABALHISTA BRASILEIRO,1
AMERICANA,DEPUTADO ESTADUAL,ROQUE BARBIERE - ROQUINHO,ROQUE BARBIERE,ELEITO,PTB,PARTIDO TRABALHISTA BRASILEIRO,7
AMERICANA,DEPUTADO ESTADUAL,HEROILMA SOARES TAVARES,HEROILMA SOARES TAVARES,MÉDIA,PTB,PARTIDO TRABALHISTA BRASILEIRO,1
AMERICANA,DEPUTADO ESTADUAL,MOISES DA FUNERARIA,MOISES ANTONIO DE LIMA,SUPLENTE,PTB,PARTIDO TRABALHISTA BRASILEIRO,4
AMERICANA,DEPUTADO ESTADUAL,CORONEL EDSON FERRARINI,EDSON FERRARINI,ELEITO,PTB,PARTIDO TRABALHISTA BRASILEIRO,36
AMERICANA,DEPUTADO ESTADUAL,FATIMA ARAUJO,MARIA DE FATIMA COSTA DE ARAUJO,SUPLENTE,PTB,PARTIDO TRABALHISTA BRASILEIRO,1
AMERICANA,DEPUTADO ESTADUAL,PROFESSOR MARCELO,MARCELO MIYAZAKI,SUPLENTE,PTB,PARTIDO TRABALHISTA BRASILEIRO,2
AMERICANA,DEPUTADO ESTADUAL,GERSINHO ROMERO,GERSON MOREIRA ROMERO,SUPLENTE,PTB,PARTIDO TRABALHISTA BRASILEIRO,3
AMERICANA,DEPUTADO ESTADUAL,VAL,ENIVALDO RAMOS DE FREITAS,SUPLENTE,PTB,PARTIDO TRABALHISTA BRASILEIRO,11
AMERICANA,DEPUTADO ESTADUAL,TARDELLI,ROBERTO TARDELLI,SUPLENTE,PTB,PARTIDO TRABALHISTA BRASILEIRO,2
AMERICANA,DEPUTADO ESTADUAL,CIDO ESPANHA,APARECIDO ESPANHA,SUPLENTE,PTB,PARTIDO TRABALHISTA BRASILEIRO,1
AMERICANA,DEPUTADO ESTADUAL,MARCELO MINGRONE,MARCELO SALVADOR MINGRONE,SUPLENTE,PTB,PARTIDO TRABALHISTA BRASILEIRO,1
AMERICANA,DEPUTADO ESTADUAL,PROFESSORA ALBA LUCENA,ALBA LUCENA FERNANDES GANDIA,SUPLENTE,PTB,PARTIDO TRABALHISTA BRASILEIRO,1
AMERICANA,DEPUTADO ESTADUAL,WALDIR AGNELLO,WALDIR AGNELLO,SUPLENTE,PTB,PARTIDO TRABALHISTA BRASILEIRO,23
AMERICANA,DEPUTADO ESTADUAL,BALEIA ROSSI,LUIZ FELIPE BALEIA TENUTO ROSSI,ELEITO,PMDB,PARTIDO DO MOVIMENTO DEMOCRÁTICO BRASILEIRO,90
AMERICANA,DEPUTADO ESTADUAL,DRA ADRIANA,ADRIANA DI NARDO SILVA,SUPLENTE,PMDB,PARTIDO DO MOVIMENTO DEMOCRÁTICO BRASILEIRO,22
AMERICANA,DEPUTADO ESTADUAL,BEBETTO,ALBERTO FELIPPE HADDAD FILHO,SUPLENTE,PMDB,PARTIDO DO MOVIMENTO DEMOCRÁTICO BRASILEIRO,5
AMERICANA,DEPUTADO ESTADUAL,SARGENTO PRIETO,MARIANO PRIETO,SUPLENTE,PMDB,PARTIDO DO MOVIMENTO DEMOCRÁTICO BRASILEIRO,1
AMERICANA,DEPUTADO ESTADUAL,THIAGO FERRARI,THIAGO DE MORAES FERRARI,SUPLENTE,PMDB,PARTIDO DO MOVIMENTO DEMOCRÁTICO BRASILEIRO,113
AMERICANA,DEPUTADO ESTADUAL,DU TONIN,EDUARDO TONIN,SUPLENTE,PMDB,PARTIDO DO MOVIMENTO DEMOCRÁTICO BRASILEIRO,13
AMERICANA,DEPUTADO ESTADUAL,IBRAIM,IBRAIM ANTONIO ABOU JOKH,SUPLENTE,PMDB,PARTIDO DO MOVIMENTO DEMOCRÁTICO BRASILEIRO,1
AMERICANA,DEPUTADO ESTADUAL,CARUSO,JORGE LUIS CARUSO,ELEITO,PMDB,PARTIDO DO MOVIMENTO DEMOCRÁTICO BRASILEIRO,23
AMERICANA,DEPUTADO ESTADUAL,FABIO BELLO,FABIO BELLO DE OLIVEIRA,SUPLENTE,PMDB,PARTIDO DO MOVIMENTO DEMOCRÁTICO BRASILEIRO,1
AMERICANA,DEPUTADO ESTADUAL,SERGIO BERGAMASCO,ANTONIO SERGIO PIRES BERGAMASCO,SUPLENTE,PMDB,PARTIDO DO MOVIMENTO DEMOCRÁTICO BRASILEIRO,2
AMERICANA,DEPUTADO ESTADUAL,VANESSA DAMO,VANESSA DAMO OROSCO,ELEITO,PMDB,PARTIDO DO MOVIMENTO DEMOCRÁTICO BRASILEIRO,6
AMERICANA,DEPUTADO ESTADUAL,CHICO DA ADEGA,FRANCISCO PEREIRA GOMES,SUPLENTE,PMDB,PARTIDO DO MOVIMENTO DEMOCRÁTICO BRASILEIRO,1
AMERICANA,DEPUTADO ESTADUAL,GILBERTO FRANÇA,GILBERTO CAETANO DE FRANÇA,SUPLENTE,PMDB,PARTIDO DO MOVIMENTO DEMOCRÁTICO BRASILEIRO,3
AMERICANA,DEPUTADO ESTADUAL,CAMARGO,DOMINGOS FERREIRA DE CAMARGO,SUPLENTE,PMDB,PARTIDO DO MOVIMENTO DEMOCRÁTICO BRASILEIRO,1
AMERICANA,DEPUTADO ESTADUAL,UEBE REZECK,UEBE REZECK,SUPLENTE,PMDB,PARTIDO DO MOVIMENTO DEMOCRÁTICO BRASILEIRO,12
AMERICANA,DEPUTADO ESTADUAL,HABIB,GEORGES HABIB JARROUGE,SUPLENTE,PMDB,PARTIDO DO MOVIMENTO DEMOCRÁTICO BRASILEIRO,12
AMERICANA,DEPUTADO ESTADUAL,DANILO GARCIA,CICERO DANILO GARCIA SANTANA,SUPLENTE,PMDB,PARTIDO DO MOVIMENTO DEMOCRÁTICO BRASILEIRO,2
AMERICANA,DEPUTADO ESTADUAL,CHICÃO SERRA TALHADA,FRANCISCO BEZERRA DOS SANTOS,SUPLENTE,PMDB,PARTIDO DO MOVIMENTO DEMOCRÁTICO BRASILEIRO,1
AMERICANA,DEPUTADO ESTADUAL,ITAMAR BORGES,ITAMAR FRANCISCO MACHADO BORGES,MÉDIA,PMDB,PARTIDO DO MOVIMENTO DEMOCRÁTICO BRASILEIRO,77
AMERICANA,DEPUTADO ESTADUAL,JONAS,JONAS PEREIRA DE LIMA,SUPLENTE,PMDB,PARTIDO DO MOVIMENTO DEMOCRÁTICO BRASILEIRO,1
AMERICANA,DEPUTADO ESTADUAL,DITINHO MATHEUS,BENEDITO MATHEUS FILHO,SUPLENTE,PMDB,PARTIDO DO MOVIMENTO DEMOCRÁTICO BRASILEIRO,4
AMERICANA,DEPUTADO ESTADUAL,MARIA DO CARMO GUILHERME,MARIA DO CARMO GUILHERME,SUPLENTE,PMDB,PARTIDO DO MOVIMENTO DEMOCRÁTICO BRASILEIRO,7
AMERICANA,DEPUTADO ESTADUAL,JOOJI HATO,JOOJI HATO,ELEITO,PMDB,PARTIDO DO MOVIMENTO DEMOCRÁTICO BRASILEIRO,7
AMERICANA,DEPUTADO ESTADUAL,TARCILIO BOSCO,TARCILIO BOSCO,SUPLENTE,PMDB,PARTIDO DO MOVIMENTO DEMOCRÁTICO BRASILEIRO,1
AMERICANA,DEPUTADO ESTADUAL,TUNICO VIEIRA,ANTONIO JOSÉ VIEIRA JUNIOR,SUPLENTE,PMDB,PARTIDO DO MOVIMENTO DEMOCRÁTICO BRASILEIRO,2
AMERICANA,DEPUTADO ESTADUAL,REGINA MARIANO,MARIA REGINA LEAL MARIANO,SUPLENTE,PMDB,PARTIDO DO MOVIMENTO DEMOCRÁTICO BRASILEIRO,2
AMERICANA,DEPUTADO ESTADUAL,ANA PAULA ROSSI,ANA PAULA ROSSI DE ALMEIDA MAGDESIAN,SUPLENTE,PMDB,PARTIDO DO MOVIMENTO DEMOCRÁTICO BRASILEIRO,5
AMERICANA,DEPUTADO ESTADUAL,DR. JEFERSON RODRIGUES,JEFERSON RODRIGUES,SUPLENTE,PMDB,PARTIDO DO MOVIMENTO DEMOCRÁTICO BRASILEIRO,3
AMERICANA,DEPUTADO ESTADUAL,OLIVEIRA JUNIOR,ELIO APARECIDO DE OLIVEIRA,SUPLENTE,PSC,HUMANISTA CRISTÃO ,2
AMERICANA,DEPUTADO ESTADUAL,CELSO NASCIMENTO,CELSO BRAZ DO NASCIMENTO,SUPLENTE,PSC,HUMANISTA CRISTÃO ,21
AMERICANA,DEPUTADO ESTADUAL,IVAN MELO,IVAN DE BARROS MELO,SUPLENTE,PSC,HUMANISTA CRISTÃO ,1
AMERICANA,DEPUTADO ESTADUAL,JAAN TAMMERIK,JAAN FRANCISCO ROMERA TAMMERIK,SUPLENTE,PSC,HUMANISTA CRISTÃO ,4
AMERICANA,DEPUTADO ESTADUAL,APOSTOLO EURIPEDES,EURIPEDES LUIZ DE SOUSA,SUPLENTE,PSC,HUMANISTA CRISTÃO ,96
AMERICANA,DEPUTADO ESTADUAL,ALAN NETO,ANTONIO CARLOS BARBOSA NEVES,SUPLENTE,PSC,HUMANISTA CRISTÃO ,2
AMERICANA,DEPUTADO ESTADUAL,DR. CLAUDIO MIRANDA,CLAUDIO ERNANI MARCONDES DE MIRANDA,SUPLENTE,PSC,HUMANISTA CRISTÃO ,6
AMERICANA,DEPUTADO ESTADUAL,LELIS TRAJANO,LELIS JOSE TRAJANO,SUPLENTE,PSC,HUMANISTA CRISTÃO ,23
AMERICANA,DEPUTADO ESTADUAL,SIMONE HIEDA,SIMONE MICHICO GAVA HIEDA,SUPLENTE,PSC,HUMANISTA CRISTÃO ,1
AMERICANA,DEPUTADO ESTADUAL,LEANDRO AMARAL,LEANDRO GODINES DO AMARAL,SUPLENTE,PSC,HUMANISTA CRISTÃO ,2
AMERICANA,DEPUTADO ESTADUAL,PASTOR VIEIRA ROCHA,JOSE VIEIRA ROCHA,SUPLENTE,PSC,HUMANISTA CRISTÃO ,50
AMERICANA,DEPUTADO ESTADUAL,PR. CARLOS CEZAR,CARLOS CEZAR DA SILVA,ELEITO,PSC,HUMANISTA CRISTÃO ,495
AMERICANA,DEPUTADO ESTADUAL,JAIMINHO,JAIME DONIZETE PEREIRA,SUPLENTE,PSC,HUMANISTA CRISTÃO ,26
AMERICANA,DEPUTADO ESTADUAL,MARTA LIVIA SUPLICY,MARTA LIVIA BARRAGANA FERNANDES SUPLICY,SUPLENTE,PSC,HUMANISTA CRISTÃO ,1
AMERICANA,DEPUTADO ESTADUAL,LUIZ LAURO,LUIZ LAURO FERREIRA,SUPLENTE,PSC,HUMANISTA CRISTÃO ,51
AMERICANA,DEPUTADO ESTADUAL,LUIZ BUENO,LUIZ CARLOS BUENO DA SILVA JUNIOR,SUPLENTE,PSC,HUMANISTA CRISTÃO ,1
AMERICANA,DEPUTADO ESTADUAL,SARDINHA,GLEDSON SILVA SARDINHA,SUPLENTE,PSC,HUMANISTA CRISTÃO ,1
AMERICANA,DEPUTADO ESTADUAL,ADILSON ROSSI,ADILSON ROSSI,ELEITO,PSC,HUMANISTA CRISTÃO ,5
AMERICANA,DEPUTADO ESTADUAL,RENATO PUPO,RENATO PUPO DE PAULA,SUPLENTE,PSC,HUMANISTA CRISTÃO ,5
AMERICANA,DEPUTADO ESTADUAL,JOÃO BINATO,JOÃO ANTONIO BINATO,SUPLENTE,PSC,HUMANISTA CRISTÃO ,48
AMERICANA,DEPUTADO ESTADUAL,PASTOR JOÃO LUIZ NETO,JOÃO LUIZ NETO,SUPLENTE,PSC,HUMANISTA CRISTÃO ,79
AMERICANA,DEPUTADO ESTADUAL,PAULO CHOCOLATE,PAULO SERGIO VIEIRA NEVES,SUPLENTE,PSC,HUMANISTA CRISTÃO ,1584
AMERICANA,DEPUTADO ESTADUAL,PROF. ANTONIO NEME,ANTONIO DIAS NEME,SUPLENTE,PSC,HUMANISTA CRISTÃO ,1
AMERICANA,DEPUTADO ESTADUAL,ANTONIO CARLOS DE LIMA,ANTONIO CARLOS DE LIMA,SUPLENTE,PSC,HUMANISTA CRISTÃO ,2
AMERICANA,DEPUTADO ESTADUAL,CLAUDIO RANA,CLAUDIO RANA,SUPLENTE,PSC,HUMANISTA CRISTÃO ,2
AMERICANA,DEPUTADO ESTADUAL,MARIA DO CARMO PIUNTI,MARIA DO CARMO THOMAZ PIUNTI,SUPLENTE,PSC,HUMANISTA CRISTÃO ,3
AMERICANA,DEPUTADO ESTADUAL,KÁTIA GUERREIRA,KATIA VALERIA SILVA SANTOS NASCIMENTO,SUPLENTE,PSC,HUMANISTA CRISTÃO ,1
AMERICANA,DEPUTADO ESTADUAL,ATALAIA,JOSE ROBERTO DE OLIVEIRA,SUPLENTE,PSC,HUMANISTA CRISTÃO ,1
AMERICANA,DEPUTADO ESTADUAL,CANDIDO,JOELSON CANDIDO DE OLIVEIRA,SUPLENTE,PSC,HUMANISTA CRISTÃO ,3
AMERICANA,DEPUTADO ESTADUAL,GUSTAVO POZZI,GUSTAVO CAETANO POZZI DA CUNHA,SUPLENTE,PSC,HUMANISTA CRISTÃO ,7
AMERICANA,DEPUTADO ESTADUAL,SAID MOURAD,AHMAD SAID MOURAD,SUPLENTE,PSC,HUMANISTA CRISTÃO ,33
AMERICANA,DEPUTADO ESTADUAL,RODRIGO MORAES,RODRIGO AUGUSTO MORAES,ELEITO,PSC,HUMANISTA CRISTÃO ,285
AMERICANA,DEPUTADO ESTADUAL,BRAZ PASSARINHEIRO,BRAZ ANASTACIO DA SILVA,SUPLENTE,PSC,HUMANISTA CRISTÃO ,16
AMERICANA,DEPUTADO ESTADUAL,IVONE,IVONE APARECIDA LUCIA SILVA,SUPLENTE,PSC,HUMANISTA CRISTÃO ,2
AMERICANA,DEPUTADO ESTADUAL,MISSIONARIA ZEZA,MARIA JOSE DA SILVA,SUPLENTE,PSC,HUMANISTA CRISTÃO ,3
AMERICANA,DEPUTADO ESTADUAL,NELSON FERNANDES,JOSE NELSON AGUIAR FERNANDES,SUPLENTE,PSC,HUMANISTA CRISTÃO ,2
AMERICANA,DEPUTADO ESTADUAL,WALTER GOMES,WALTER GOMES DE OLIVEIRA,SUPLENTE,PR,SOMOS MAIS SÃO PAULO,2
AMERICANA,DEPUTADO ESTADUAL,PAULO CORREA,PAULO HENRIQUE CORREA,SUPLENTE,PR,SOMOS MAIS SÃO PAULO,3
AMERICANA,DEPUTADO ESTADUAL,JOSUE ROBERTO,JOSUE ROBERTO DA SILVA,SUPLENTE,PR,SOMOS MAIS SÃO PAULO,1
AMERICANA,DEPUTADO ESTADUAL,ZE PEDRO,JOSE PEDRO LEITE DA SILVA,SUPLENTE,PR,SOMOS MAIS SÃO PAULO,78
AMERICANA,DEPUTADO ESTADUAL,LILI AIMAR,LILIANA MEDEIROS DE ALMEIDA AYMAR BECHARA,SUPLENTE,PR,SOMOS MAIS SÃO PAULO,3
AMERICANA,DEPUTADO ESTADUAL,ALEXANDRE DA FARMACIA,ALEXANDRE JOSE DA CUNHA,SUPLENTE,PR,SOMOS MAIS SÃO PAULO,19
AMERICANA,DEPUTADO ESTADUAL,PATRICIA LIMA,PATRICIA FREITAS LIMA,SUPLENTE,PR,SOMOS MAIS SÃO PAULO,9
AMERICANA,DEPUTADO ESTADUAL,JOSIAS DINIZ,JOSIAS ANTONIO DINIZ,SUPLENTE,PR,SOMOS MAIS SÃO PAULO,1
AMERICANA,DEPUTADO ESTADUAL,ROY NELSON,ROY NELSON PINTO,SUPLENTE,PR,SOMOS MAIS SÃO PAULO,2
AMERICANA,DEPUTADO ESTADUAL,KAKA,ANTONIO CARLOS COSTA ANJOS,SUPLENTE,PR,SOMOS MAIS SÃO PAULO,1
AMERICANA,DEPUTADO ESTADUAL,TONINHO PAIVA,ANTONIO DE PAIVA MONTEIRO FILHO,SUPLENTE,PR,SOMOS MAIS SÃO PAULO,3
AMERICANA,DEPUTADO ESTADUAL,OSVALDO VERGINIO,OSVALDO VERGINIO DA SILVA,SUPLENTE,PR,SOMOS MAIS SÃO PAULO,22
AMERICANA,DEPUTADO ESTADUAL,JOSE JANTALIA,JOSE ANTONIO JANTALIA,SUPLENTE,PR,SOMOS MAIS SÃO PAULO,4
AMERICANA,DEPUTADO ESTADUAL,ANDRE DO PRADO,ANDRE LUIS DO PRADO,ELEITO,PR,SOMOS MAIS SÃO PAULO,21
AMERICANA,DEPUTADO ESTADUAL,EDUARDO REZEK,EDUARDO PEDROSO REZEK,SUPLENTE,PPS,PARTIDO POPULAR SOCIALISTA,6
AMERICANA,DEPUTADO ESTADUAL,JOSE CARLOS SOARES,JOSE CARLOS SOARES,SUPLENTE,PPS,PARTIDO POPULAR SOCIALISTA,10
AMERICANA,DEPUTADO ESTADUAL,PROFESSOR OSMIR PETRINI,OSMIR ANTONIO PETRINI,SUPLENTE,PPS,PARTIDO POPULAR SOCIALISTA,3
AMERICANA,DEPUTADO ESTADUAL,MAURICIO MIYA,MAURICIO MIYAZAKI,SUPLENTE,PPS,PARTIDO POPULAR SOCIALISTA,12
AMERICANA,DEPUTADO ESTADUAL,BRAZ,BRAZ ANTUNES MATTOS NETO,SUPLENTE,PPS,PARTIDO POPULAR SOCIALISTA,7
AMERICANA,DEPUTADO ESTADUAL,ADEMIR DA GUIA,ADEMIR DA GUIA,SUPLENTE,PPS,PARTIDO POPULAR SOCIALISTA,29
AMERICANA,DEPUTADO ESTADUAL,VERA DIAS,VERA LUCIA ROSA DIAS,SUPLENTE,PPS,PARTIDO POPULAR SOCIALISTA,2
AMERICANA,DEPUTADO ESTADUAL,DAVI ZAIA,DAVID ZAIA,MÉDIA,PPS,PARTIDO POPULAR SOCIALISTA,299
AMERICANA,DEPUTADO ESTADUAL,JOSE MESSINA,JOSE DE LORENZO MESSINA,SUPLENTE,PPS,PARTIDO POPULAR SOCIALISTA,4
AMERICANA,DEPUTADO ESTADUAL,DR. MILTON FERREIRA,MILTON FERREIRA DA SILVA,SUPLENTE,PPS,PARTIDO POPULAR SOCIALISTA,5
AMERICANA,DEPUTADO ESTADUAL,MARCOS CHIEN,CHIEN CHIN HUEI,SUPLENTE,PPS,PARTIDO POPULAR SOCIALISTA,1
AMERICANA,DEPUTADO ESTADUAL,ROBSON O BELLO,ROBSON LUIZ CARDOSO,SUPLENTE,PPS,PARTIDO POPULAR SOCIALISTA,1
AMERICANA,DEPUTADO ESTADUAL,DR. TÚLIO,TULIO JOSE TOMASS DO COUTO,SUPLENTE,PPS,PARTIDO POPULAR SOCIALISTA,3
AMERICANA,DEPUTADO ESTADUAL,VERONEZZI,JOSE CARLOS VERONEZZI,SUPLENTE,PPS,PARTIDO POPULAR SOCIALISTA,1
AMERICANA,DEPUTADO ESTADUAL,PROF. NELSON SUSSUMU SHIKICIMA,NELSON SUSSUMU SHIKICIMA,SUPLENTE,PPS,PARTIDO POPULAR SOCIALISTA,8
AMERICANA,DEPUTADO ESTADUAL,PALHACINHO PIMPAO,VAGNER LUIZ PIMPAO BERSA,SUPLENTE,PPS,PARTIDO POPULAR SOCIALISTA,1
AMERICANA,DEPUTADO ESTADUAL,JOAO OTAVIO BASTOS,JOAO OTAVIO BASTOS JUNQUEIRA,SUPLENTE,PPS,PARTIDO POPULAR SOCIALISTA,3
AMERICANA,DEPUTADO ESTADUAL,VITOR SAPIENZA,VITOR SAPIENZA,SUPLENTE,PPS,PARTIDO POPULAR SOCIALISTA,19
AMERICANA,DEPUTADO ESTADUAL,ISABEL CUNHA,ISABEL CHRISTINA CUNHA,SUPLENTE,PPS,PARTIDO POPULAR SOCIALISTA,1
AMERICANA,DEPUTADO ESTADUAL,ALEX MANENTE,ALEX SPINELLI MANENTE,ELEITO,PPS,PARTIDO POPULAR SOCIALISTA,3
AMERICANA,DEPUTADO ESTADUAL,CICERO FELIX,CICERO FELIX DE SOUZA,SUPLENTE,PPS,PARTIDO POPULAR SOCIALISTA,3
AMERICANA,DEPUTADO ESTADUAL,DIRCEU DALBEN,ANTONIO DIRCEU DALBEN,SUPLENTE,PPS,PARTIDO POPULAR SOCIALISTA,42
AMERICANA,DEPUTADO ESTADUAL,GONDIM,LUIZ CARLOS GONDIM TEIXEIRA,ELEITO,PPS,PARTIDO POPULAR SOCIALISTA,4
AMERICANA,DEPUTADO ESTADUAL,BARROS,ANTONIO CARLOS BARROS,SUPLENTE,PPS,PARTIDO POPULAR SOCIALISTA,1
AMERICANA,DEPUTADO ESTADUAL,ESTEVÃO,STEVEN ERIKSEN BINNIE,SUPLENTE,PPS,PARTIDO POPULAR SOCIALISTA,6
AMERICANA,DEPUTADO ESTADUAL,PROFESSOR ZE MARIA,JOSE MARIA CANCELLIERO,SUPLENTE,PPS,PARTIDO POPULAR SOCIALISTA,105
AMERICANA,DEPUTADO ESTADUAL,MYRIAM ALCKMIN,MYRIAM ALCKMIN RAMOS NOGUEIRA,SUPLENTE,PPS,PARTIDO POPULAR SOCIALISTA,5
AMERICANA,DEPUTADO ESTADUAL,MARCELO CYPRIANO,MARCELO DA SILVA CYPRIANO,SUPLENTE,PPS,PARTIDO POPULAR SOCIALISTA,1
AMERICANA,DEPUTADO ESTADUAL,ROBERTO MORAIS,ROBERTO TURCHI DE MORAIS,ELEITO,PPS,PARTIDO POPULAR SOCIALISTA,81
AMERICANA,DEPUTADO ESTADUAL,AZUAITE,AZUAITE MARTINS DE FRANÇA,SUPLENTE,PPS,PARTIDO POPULAR SOCIALISTA,1
AMERICANA,DEPUTADO ESTADUAL,ELZO SIGUETA,ELZO SIGUETA,SUPLENTE,PPS,PARTIDO POPULAR SOCIALISTA,6
AMERICANA,DEPUTADO ESTADUAL,ALBERT GAUSS,ALBERT GAUSS,SUPLENTE,PPS,PARTIDO POPULAR SOCIALISTA,1
AMERICANA,DEPUTADO ESTADUAL,SERGIO BOCALINI,SERGIO DOS SANTOS BOCALINI,SUPLENTE,PPS,PARTIDO POPULAR SOCIALISTA,5
AMERICANA,DEPUTADO ESTADUAL,DARIO SAADI,DARIO JORGE GIOLO SAADI,SUPLENTE,DEM,PSDB/DEM,28
AMERICANA,DEPUTADO ESTADUAL,MARCOS FERRAZ,ANTONIO MARCOS MARCONDES FERRAZ,SUPLENTE,DEM,PSDB/DEM,2
AMERICANA,DEPUTADO ESTADUAL,ANDRE SOARES,ANDRE BEZERRA RIBEIRO SOARES,ELEITO,DEM,PSDB/DEM,155
AMERICANA,DEPUTADO ESTADUAL,GILSON DE SOUZA,GILSON DE SOUZA,ELEITO,DEM,PSDB/DEM,12
AMERICANA,DEPUTADO ESTADUAL,MURINGA AMORIM,SHIRLEY PEREJON AMORIM,SUPLENTE,DEM,PSDB/DEM,1
AMERICANA,DEPUTADO ESTADUAL,RICARDO MUTRAN,RICARDO JORGE MUTRAN,SUPLENTE,DEM,PSDB/DEM,3
AMERICANA,DEPUTADO ESTADUAL,ULISSES SALES,ULISSES ROBERTO CORNAZZANI SALES,SUPLENTE,DEM,PSDB/DEM,7
AMERICANA,DEPUTADO ESTADUAL,EDMIR CHEDID,EDMIR JOSE ABI CHEDID,ELEITO,DEM,PSDB/DEM,11
AMERICANA,DEPUTADO ESTADUAL,ALDO DEMARCHI,JOSE ALDO DEMARCHI,ELEITO,DEM,PSDB/DEM,64
AMERICANA,DEPUTADO ESTADUAL,JOAO MELLAO NETO,JOAO MELLAO NETO,SUPLENTE,DEM,PSDB/DEM,70
AMERICANA,DEPUTADO ESTADUAL,FERNANDO LUCAS,LUIZ FERNANDO AMARAL LUCAS,SUPLENTE,DEM,PSDB/DEM,138
AMERICANA,DEPUTADO ESTADUAL,MACEDO BASTOS,CARLOS ALBERTO MACEDO BASTOS,SUPLENTE,DEM,PSDB/DEM,1
AMERICANA,DEPUTADO ESTADUAL,ESTEVAM GALVAO,ESTEVAM GALVAO DE OLIVEIRA,ELEITO,DEM,PSDB/DEM,10
AMERICANA,DEPUTADO ESTADUAL,RICARDO SALLES,RICARDO DE AQUINO SALLES,SUPLENTE,DEM,PSDB/DEM,19
AMERICANA,DEPUTADO ESTADUAL,TOMAZELLA,GERALDO TOMAZELA FILHO,SUPLENTE,DEM,PSDB/DEM,1
AMERICANA,DEPUTADO ESTADUAL,MILTON LEITE FILHO,MILTON LEITE DA SILVA FILHO,ELEITO,DEM,PSDB/DEM,2
AMERICANA,DEPUTADO ESTADUAL,SALLES,RAIMUNDO TARASKEVICIUS SALES,SUPLENTE,DEM,PSDB/DEM,21
AMERICANA,DEPUTADO ESTADUAL,GIL ARANTES,GILBERTO MACEDO GIL ARANTES,ELEITO,DEM,PSDB/DEM,10
AMERICANA,DEPUTADO ESTADUAL,ZE LOUQUINHO,JOSE LUIZ RODRIGUES,SUPLENTE,DEM,PSDB/DEM,1
AMERICANA,DEPUTADO ESTADUAL,LEANDRO DO KLB,LEANDRO FINATO SCORNAVACCA,SUPLENTE,DEM,PSDB/DEM,47
AMERICANA,DEPUTADO ESTADUAL,PAULO HADICH,PAULO CEZAR JUNQUEIRA HADICH,SUPLENTE,PSB,PARTIDO SOCIALISTA BRASILEIRO,36
AMERICANA,DEPUTADO ESTADUAL,ROBERTO,ROBERTO FREIDENSON,SUPLENTE,PSB,PARTIDO SOCIALISTA BRASILEIRO,2
AMERICANA,DEPUTADO ESTADUAL,BOLÇONE,ORLANDO JOSE BOLÇONE,SUPLENTE,PSB,PARTIDO SOCIALISTA BRASILEIRO,4
AMERICANA,DEPUTADO ESTADUAL,DR. GENNARI,MARCELO GENNARI BORATTO,SUPLENTE,PSB,PARTIDO SOCIALISTA BRASILEIRO,1
AMERICANA,DEPUTADO ESTADUAL,VALDECIR FONSECA,JOSÉ VALDECIR DA FONSECA,SUPLENTE,PSB,PARTIDO SOCIALISTA BRASILEIRO,3
