TEODORO SAMPAIO,DEPUTADO ESTADUAL,TONINHO DO PT,ANTONIO AMARAL JUNIOR,SUPLENTE,PT,SOMOS MAIS SÃO PAULO,1
TEODORO SAMPAIO,DEPUTADO ESTADUAL,ZICO,JOSÉ PRADO DE ANDRADE,MÉDIA,PT,SOMOS MAIS SÃO PAULO,3
TEODORO SAMPAIO,DEPUTADO ESTADUAL,MARCOS MARTINS,MARCOS LOPES MARTINS,ELEITO,PT,SOMOS MAIS SÃO PAULO,3
TEODORO SAMPAIO,DEPUTADO ESTADUAL,DR. LUIZINHO,LUIS CARLOS LAURINDO,SUPLENTE,PT,SOMOS MAIS SÃO PAULO,1
TEODORO SAMPAIO,DEPUTADO ESTADUAL,ELI TEODORO,ELI TEODORO,SUPLENTE,PT,SOMOS MAIS SÃO PAULO,3
TEODORO SAMPAIO,DEPUTADO ESTADUAL,SIMÃO PEDRO,SIMÃO PEDRO CHIOVETTI,ELEITO,PT,SOMOS MAIS SÃO PAULO,51
TEODORO SAMPAIO,DEPUTADO ESTADUAL,PADRE JUZEMILDO,JUZEMILDO ALBINO DA SILVA,SUPLENTE,PT,SOMOS MAIS SÃO PAULO,2
TEODORO SAMPAIO,DEPUTADO ESTADUAL,ADRIANO DIOGO,ADRIANO DIOGO,ELEITO,PT,SOMOS MAIS SÃO PAULO,2
TEODORO SAMPAIO,DEPUTADO ESTADUAL,ESTELA ALMAGRO,ESTELA ALEXANDRE ALMAGRO,SUPLENTE,PT,SOMOS MAIS SÃO PAULO,9
TEODORO SAMPAIO,DEPUTADO ESTADUAL,EUVANILDE,EUVANILDE RODRIGUES DA SILVA,SUPLENTE,PT,SOMOS MAIS SÃO PAULO,3
TEODORO SAMPAIO,DEPUTADO ESTADUAL,RENATO DO GEB,RENATO MORENI AIRES DA SILVA,SUPLENTE,PT,SOMOS MAIS SÃO PAULO,1
TEODORO SAMPAIO,DEPUTADO ESTADUAL,DENISE ERBELLA,DENISE ELOÁ CUSTÓDIO ERBELLA DE CASTRO,SUPLENTE,PT,SOMOS MAIS SÃO PAULO,325
TEODORO SAMPAIO,DEPUTADO ESTADUAL,NATIVIDADE,MARIA DA NATIVIDADE PEREIRA LIMA,SUPLENTE,PT,SOMOS MAIS SÃO PAULO,9
TEODORO SAMPAIO,DEPUTADO ESTADUAL,ROBERTO FELICIO,ROBERTO FELICIO,SUPLENTE,PT,SOMOS MAIS SÃO PAULO,33
TEODORO SAMPAIO,DEPUTADO ESTADUAL,MARCIONILA,MARCIONILA APARECIDA DOS SANTOS,SUPLENTE,PT,SOMOS MAIS SÃO PAULO,1
TEODORO SAMPAIO,DEPUTADO ESTADUAL,BETH SAHAO,ELISABETH SAHÃO,SUPLENTE,PT,SOMOS MAIS SÃO PAULO,36
TEODORO SAMPAIO,DEPUTADO ESTADUAL,ALENCAR,ALENCAR SANTANA BRAGA,ELEITO,PT,SOMOS MAIS SÃO PAULO,18
TEODORO SAMPAIO,DEPUTADO ESTADUAL,BRENO CORTELLA,BRENO ZANONI CORTELLA,SUPLENTE,PT,SOMOS MAIS SÃO PAULO,7
TEODORO SAMPAIO,DEPUTADO ESTADUAL,JOSÉ CANDIDO,JOSÉ DE SOUZA CÂNDIDO,MÉDIA,PT,SOMOS MAIS SÃO PAULO,6
TEODORO SAMPAIO,DEPUTADO ESTADUAL,JOÃO ANTONIO,JOAO ANTONIO DA SILVA FILHO,ELEITO,PT,SOMOS MAIS SÃO PAULO,136
TEODORO SAMPAIO,DEPUTADO ESTADUAL,GALLO,JURANDIR GALLO,SUPLENTE,PT,SOMOS MAIS SÃO PAULO,1
TEODORO SAMPAIO,DEPUTADO ESTADUAL,TITO,FRANCISCO DE ASSIS PEREIRA DE CAMPOS,SUPLENTE,PT,SOMOS MAIS SÃO PAULO,122
TEODORO SAMPAIO,DEPUTADO ESTADUAL,DONISETE BRAGA,DONISETE PEREIRA BRAGA,ELEITO,PT,SOMOS MAIS SÃO PAULO,296
TEODORO SAMPAIO,DEPUTADO ESTADUAL,LÉO ÁQUILLA,JADSON MENDES DE LIMA,SUPLENTE,PTB,PARTIDO TRABALHISTA BRASILEIRO,2
TEODORO SAMPAIO,DEPUTADO ESTADUAL,CEBOLINHA,JOAO VIANELLE PINTO,SUPLENTE,PTB,PARTIDO TRABALHISTA BRASILEIRO,1
TEODORO SAMPAIO,DEPUTADO ESTADUAL,CONTE LOPES,ROBERVAL CONTE LOPES LIMA,SUPLENTE,PTB,PARTIDO TRABALHISTA BRASILEIRO,2
TEODORO SAMPAIO,DEPUTADO ESTADUAL,CAMPOS MACHADO,ANTONIO CARLOS DE CAMPOS MACHADO,ELEITO,PTB,PARTIDO TRABALHISTA BRASILEIRO,406
TEODORO SAMPAIO,DEPUTADO ESTADUAL,VANDO,ORVANDO DA SILVA,SUPLENTE,PTB,PARTIDO TRABALHISTA BRASILEIRO,4
TEODORO SAMPAIO,DEPUTADO ESTADUAL,JUVENCIO MARQUES,JUVENCIO MARQUES DE ALCANTARA,SUPLENTE,PTB,PARTIDO TRABALHISTA BRASILEIRO,1
TEODORO SAMPAIO,DEPUTADO ESTADUAL,ROQUE BARBIERE - ROQUINHO,ROQUE BARBIERE,ELEITO,PTB,PARTIDO TRABALHISTA BRASILEIRO,2
TEODORO SAMPAIO,DEPUTADO ESTADUAL,VAL,ENIVALDO RAMOS DE FREITAS,SUPLENTE,PTB,PARTIDO TRABALHISTA BRASILEIRO,88
TEODORO SAMPAIO,DEPUTADO ESTADUAL,CIDO ESPANHA,APARECIDO ESPANHA,SUPLENTE,PTB,PARTIDO TRABALHISTA BRASILEIRO,1
TEODORO SAMPAIO,DEPUTADO ESTADUAL,PROFESSORA ALBA LUCENA,ALBA LUCENA FERNANDES GANDIA,SUPLENTE,PTB,PARTIDO TRABALHISTA BRASILEIRO,10
TEODORO SAMPAIO,DEPUTADO ESTADUAL,BALEIA ROSSI,LUIZ FELIPE BALEIA TENUTO ROSSI,ELEITO,PMDB,PARTIDO DO MOVIMENTO DEMOCRÁTICO BRASILEIRO,21
TEODORO SAMPAIO,DEPUTADO ESTADUAL,REGINALDO NUNES,REGINALDO NUNES BEZERRA,SUPLENTE,PMDB,PARTIDO DO MOVIMENTO DEMOCRÁTICO BRASILEIRO,7
TEODORO SAMPAIO,DEPUTADO ESTADUAL,BEBETTO,ALBERTO FELIPPE HADDAD FILHO,SUPLENTE,PMDB,PARTIDO DO MOVIMENTO DEMOCRÁTICO BRASILEIRO,1
TEODORO SAMPAIO,DEPUTADO ESTADUAL,DU TONIN,EDUARDO TONIN,SUPLENTE,PMDB,PARTIDO DO MOVIMENTO DEMOCRÁTICO BRASILEIRO,1
TEODORO SAMPAIO,DEPUTADO ESTADUAL,CARUSO,JORGE LUIS CARUSO,ELEITO,PMDB,PARTIDO DO MOVIMENTO DEMOCRÁTICO BRASILEIRO,268
TEODORO SAMPAIO,DEPUTADO ESTADUAL,FABIO BELLO,FABIO BELLO DE OLIVEIRA,SUPLENTE,PMDB,PARTIDO DO MOVIMENTO DEMOCRÁTICO BRASILEIRO,3
TEODORO SAMPAIO,DEPUTADO ESTADUAL,SERGIO BERGAMASCO,ANTONIO SERGIO PIRES BERGAMASCO,SUPLENTE,PMDB,PARTIDO DO MOVIMENTO DEMOCRÁTICO BRASILEIRO,1
TEODORO SAMPAIO,DEPUTADO ESTADUAL,VANESSA DAMO,VANESSA DAMO OROSCO,ELEITO,PMDB,PARTIDO DO MOVIMENTO DEMOCRÁTICO BRASILEIRO,1
TEODORO SAMPAIO,DEPUTADO ESTADUAL,CHICO DA ADEGA,FRANCISCO PEREIRA GOMES,SUPLENTE,PMDB,PARTIDO DO MOVIMENTO DEMOCRÁTICO BRASILEIRO,1
TEODORO SAMPAIO,DEPUTADO ESTADUAL,ITAMAR BORGES,ITAMAR FRANCISCO MACHADO BORGES,MÉDIA,PMDB,PARTIDO DO MOVIMENTO DEMOCRÁTICO BRASILEIRO,1
TEODORO SAMPAIO,DEPUTADO ESTADUAL,JONAS,JONAS PEREIRA DE LIMA,SUPLENTE,PMDB,PARTIDO DO MOVIMENTO DEMOCRÁTICO BRASILEIRO,1
TEODORO SAMPAIO,DEPUTADO ESTADUAL,JOOJI HATO,JOOJI HATO,ELEITO,PMDB,PARTIDO DO MOVIMENTO DEMOCRÁTICO BRASILEIRO,1
TEODORO SAMPAIO,DEPUTADO ESTADUAL,ANA PAULA ROSSI,ANA PAULA ROSSI DE ALMEIDA MAGDESIAN,SUPLENTE,PMDB,PARTIDO DO MOVIMENTO DEMOCRÁTICO BRASILEIRO,1
TEODORO SAMPAIO,DEPUTADO ESTADUAL,CELSO NASCIMENTO,CELSO BRAZ DO NASCIMENTO,SUPLENTE,PSC,HUMANISTA CRISTÃO ,38
TEODORO SAMPAIO,DEPUTADO ESTADUAL,PASTOR VIEIRA ROCHA,JOSE VIEIRA ROCHA,SUPLENTE,PSC,HUMANISTA CRISTÃO ,1
TEODORO SAMPAIO,DEPUTADO ESTADUAL,PR. CARLOS CEZAR,CARLOS CEZAR DA SILVA,ELEITO,PSC,HUMANISTA CRISTÃO ,1
TEODORO SAMPAIO,DEPUTADO ESTADUAL,JAIMINHO,JAIME DONIZETE PEREIRA,SUPLENTE,PSC,HUMANISTA CRISTÃO ,131
TEODORO SAMPAIO,DEPUTADO ESTADUAL,ADILSON ROSSI,ADILSON ROSSI,ELEITO,PSC,HUMANISTA CRISTÃO ,25
TEODORO SAMPAIO,DEPUTADO ESTADUAL,MARIA CLELIA MARIN,MARIA CLELIA DILCIA CAPRILES MARIM,SUPLENTE,PSC,HUMANISTA CRISTÃO ,1
TEODORO SAMPAIO,DEPUTADO ESTADUAL,RENATO PUPO,RENATO PUPO DE PAULA,SUPLENTE,PSC,HUMANISTA CRISTÃO ,1
TEODORO SAMPAIO,DEPUTADO ESTADUAL,JOÃO BINATO,JOÃO ANTONIO BINATO,SUPLENTE,PSC,HUMANISTA CRISTÃO ,86
TEODORO SAMPAIO,DEPUTADO ESTADUAL,TANIA GEROLI,TANIA CRISTINA DE SOUZA GEROTI,SUPLENTE,PSC,HUMANISTA CRISTÃO ,5
TEODORO SAMPAIO,DEPUTADO ESTADUAL,RODRIGO MORAES,RODRIGO AUGUSTO MORAES,ELEITO,PSC,HUMANISTA CRISTÃO ,77
TEODORO SAMPAIO,DEPUTADO ESTADUAL,MARCOS NEVES,MARCO AURELIO DOS SANTOS NEVES,ELEITO,PSC,HUMANISTA CRISTÃO ,1
TEODORO SAMPAIO,DEPUTADO ESTADUAL,BRAZ PASSARINHEIRO,BRAZ ANASTACIO DA SILVA,SUPLENTE,PSC,HUMANISTA CRISTÃO ,1
TEODORO SAMPAIO,DEPUTADO ESTADUAL,ZE PEDRO,JOSE PEDRO LEITE DA SILVA,SUPLENTE,PR,SOMOS MAIS SÃO PAULO,10
TEODORO SAMPAIO,DEPUTADO ESTADUAL,PATRICIA LIMA,PATRICIA FREITAS LIMA,SUPLENTE,PR,SOMOS MAIS SÃO PAULO,3
TEODORO SAMPAIO,DEPUTADO ESTADUAL,ANDRE DO PRADO,ANDRE LUIS DO PRADO,ELEITO,PR,SOMOS MAIS SÃO PAULO,1
TEODORO SAMPAIO,DEPUTADO ESTADUAL,EDUARDO REZEK,EDUARDO PEDROSO REZEK,SUPLENTE,PPS,PARTIDO POPULAR SOCIALISTA,15
TEODORO SAMPAIO,DEPUTADO ESTADUAL,ADEMIR DA GUIA,ADEMIR DA GUIA,SUPLENTE,PPS,PARTIDO POPULAR SOCIALISTA,2
TEODORO SAMPAIO,DEPUTADO ESTADUAL,DAVI ZAIA,DAVID ZAIA,MÉDIA,PPS,PARTIDO POPULAR SOCIALISTA,7
TEODORO SAMPAIO,DEPUTADO ESTADUAL,PROF. NELSON SUSSUMU SHIKICIMA,NELSON SUSSUMU SHIKICIMA,SUPLENTE,PPS,PARTIDO POPULAR SOCIALISTA,1
TEODORO SAMPAIO,DEPUTADO ESTADUAL,VITOR SAPIENZA,VITOR SAPIENZA,SUPLENTE,PPS,PARTIDO POPULAR SOCIALISTA,3
TEODORO SAMPAIO,DEPUTADO ESTADUAL,CICERO FELIX,CICERO FELIX DE SOUZA,SUPLENTE,PPS,PARTIDO POPULAR SOCIALISTA,25
TEODORO SAMPAIO,DEPUTADO ESTADUAL,JORGE MATOS,JORGE DONIZETTI RIBEIRO DE MATOS,SUPLENTE,PPS,PARTIDO POPULAR SOCIALISTA,21
TEODORO SAMPAIO,DEPUTADO ESTADUAL,ESTEVÃO,STEVEN ERIKSEN BINNIE,SUPLENTE,PPS,PARTIDO POPULAR SOCIALISTA,1
TEODORO SAMPAIO,DEPUTADO ESTADUAL,PROFESSOR ZE MARIA,JOSE MARIA CANCELLIERO,SUPLENTE,PPS,PARTIDO POPULAR SOCIALISTA,1
TEODORO SAMPAIO,DEPUTADO ESTADUAL,MYRIAM ALCKMIN,MYRIAM ALCKMIN RAMOS NOGUEIRA,SUPLENTE,PPS,PARTIDO POPULAR SOCIALISTA,1
TEODORO SAMPAIO,DEPUTADO ESTADUAL,ROBERTO MORAIS,ROBERTO TURCHI DE MORAIS,ELEITO,PPS,PARTIDO POPULAR SOCIALISTA,1
TEODORO SAMPAIO,DEPUTADO ESTADUAL,ANDRE SOARES,ANDRE BEZERRA RIBEIRO SOARES,ELEITO,DEM,PSDB/DEM,11
TEODORO SAMPAIO,DEPUTADO ESTADUAL,GILSON DE SOUZA,GILSON DE SOUZA,ELEITO,DEM,PSDB/DEM,1
TEODORO SAMPAIO,DEPUTADO ESTADUAL,ALDO DEMARCHI,JOSE ALDO DEMARCHI,ELEITO,DEM,PSDB/DEM,1
TEODORO SAMPAIO,DEPUTADO ESTADUAL,JOAO MELLAO NETO,JOAO MELLAO NETO,SUPLENTE,DEM,PSDB/DEM,2
TEODORO SAMPAIO,DEPUTADO ESTADUAL,FERNANDO LUCAS,LUIZ FERNANDO AMARAL LUCAS,SUPLENTE,DEM,PSDB/DEM,5
TEODORO SAMPAIO,DEPUTADO ESTADUAL,ESTEVAM GALVAO,ESTEVAM GALVAO DE OLIVEIRA,ELEITO,DEM,PSDB/DEM,1
TEODORO SAMPAIO,DEPUTADO ESTADUAL,RICARDO SALLES,RICARDO DE AQUINO SALLES,SUPLENTE,DEM,PSDB/DEM,1
TEODORO SAMPAIO,DEPUTADO ESTADUAL,MILTON VIEIRA,MILTON VIEIRA PINTO,ELEITO,DEM,PSDB/DEM,2
TEODORO SAMPAIO,DEPUTADO ESTADUAL,GIL ARANTES,GILBERTO MACEDO GIL ARANTES,ELEITO,DEM,PSDB/DEM,11
TEODORO SAMPAIO,DEPUTADO ESTADUAL,LEANDRO DO KLB,LEANDRO FINATO SCORNAVACCA,SUPLENTE,DEM,PSDB/DEM,11
TEODORO SAMPAIO,DEPUTADO ESTADUAL,PAULO HADICH,PAULO CEZAR JUNQUEIRA HADICH,SUPLENTE,PSB,PARTIDO SOCIALISTA BRASILEIRO,1
TEODORO SAMPAIO,DEPUTADO ESTADUAL,ED THOMAS,EDSON TOMAZINI,ELEITO,PSB,PARTIDO SOCIALISTA BRASILEIRO,319
TEODORO SAMPAIO,DEPUTADO ESTADUAL,FAETI,LAFAIETE RAMOS DE NOVAES,SUPLENTE,PSB,PARTIDO SOCIALISTA BRASILEIRO,1
TEODORO SAMPAIO,DEPUTADO ESTADUAL,IRMÃO OZELITO,OZELITO JOSE BENEDITO,SUPLENTE,PSB,PARTIDO SOCIALISTA BRASILEIRO,1
TEODORO SAMPAIO,DEPUTADO ESTADUAL,DR. ANTONIO COSTA,ANTONIO JOSÉ DA COSTA JÚNIOR,SUPLENTE,PSB,PARTIDO SOCIALISTA BRASILEIRO,1
TEODORO SAMPAIO,DEPUTADO ESTADUAL,HILKIAS,HILKIAS DE OLIVEIRA,SUPLENTE,PSB,PARTIDO SOCIALISTA BRASILEIRO,4
TEODORO SAMPAIO,DEPUTADO ESTADUAL,DR. JOSÉ RICARDO,JOSÉ RICARDO DIAS,SUPLENTE,PSB,PARTIDO SOCIALISTA BRASILEIRO,7
TEODORO SAMPAIO,DEPUTADO ESTADUAL,YVONE BARREIROS,YVONE BARREIROS MOREIRA,SUPLENTE,PSB,PARTIDO SOCIALISTA BRASILEIRO,1
TEODORO SAMPAIO,DEPUTADO ESTADUAL,VINICIUS CAMARINHA,VINICIUS ALMEIDA CAMARINHA,ELEITO,PSB,PARTIDO SOCIALISTA BRASILEIRO,265
TEODORO SAMPAIO,DEPUTADO ESTADUAL,GENTIL,ALEXANDRE MARIANO GENTIL,SUPLENTE,PV,PARTIDO VERDE,1
TEODORO SAMPAIO,DEPUTADO ESTADUAL,GIRIBONI,EDSON DE OLIVEIRA GIRIBONI,ELEITO,PV,PARTIDO VERDE,4
TEODORO SAMPAIO,DEPUTADO ESTADUAL,ARTUR DIAN,ARTUR JOSE DIAN,SUPLENTE,PV,PARTIDO VERDE,2
TEODORO SAMPAIO,DEPUTADO ESTADUAL,ADRIANA RODRIGUES,ADRIANA LARIO RAMALHO RODRIGUES,SUPLENTE,PV,PARTIDO VERDE,55
TEODORO SAMPAIO,DEPUTADO ESTADUAL,FELICIANO,FELICIANO NAHIMY FILHO,ELEITO,PV,PARTIDO VERDE,1
TEODORO SAMPAIO,DEPUTADO ESTADUAL,PAULLO VIEIRA,PAULO ROBERTO AMARAL VIEIRA,SUPLENTE,PV,PARTIDO VERDE,1
TEODORO SAMPAIO,DEPUTADO ESTADUAL,ELÔ,MARIA ELOISA PEREIRA,SUPLENTE,PV,PARTIDO VERDE,1
TEODORO SAMPAIO,DEPUTADO ESTADUAL,PROFESSORA FREIRE,MARIA FREIRE LEITE,SUPLENTE,PV,PARTIDO VERDE,1
TEODORO SAMPAIO,DEPUTADO ESTADUAL,RICARDO CASTILHO,RICARDO RODRIGUES DE CASTILHO,SUPLENTE,PV,PARTIDO VERDE,1
TEODORO SAMPAIO,DEPUTADO ESTADUAL,CAMILO GAVA,JOSÉ CAMILO GAVA NETO,SUPLENTE,PV,PARTIDO VERDE,419
TEODORO SAMPAIO,DEPUTADO ESTADUAL,DR PAULO DE TARSO,PAULO DE TARSO NUNES CHIODE,SUPLENTE,PV,PARTIDO VERDE,1
TEODORO SAMPAIO,DEPUTADO ESTADUAL,BRAZ ALBERTINI,BRAZ AGOSTINHO ALBERTINI,SUPLENTE,PV,PARTIDO VERDE,10
TEODORO SAMPAIO,DEPUTADO ESTADUAL,FERNANDO MARREY FERREIRA,FERNANDO MARREY FERREIRA,SUPLENTE,PV,PARTIDO VERDE,6
TEODORO SAMPAIO,DEPUTADO ESTADUAL,MÁRCIA MONTEZ,MÁRCIA REGINA MONTEZ HALASZ,SUPLENTE,PV,PARTIDO VERDE,1
TEODORO SAMPAIO,DEPUTADO ESTADUAL,DR. ULYSSES,ULYSSES MARIO TASSINARI,MÉDIA,PV,PARTIDO VERDE,1
TEODORO SAMPAIO,DEPUTADO ESTADUAL,BETO GONZALES,ROBERTO BARROS GONZALES,SUPLENTE,PV,PARTIDO VERDE,1
TEODORO SAMPAIO,DEPUTADO ESTADUAL,REINALDO ALGUZ,REINALDO DE SOUZA ALGUZ,ELEITO,PV,PARTIDO VERDE,82
TEODORO SAMPAIO,DEPUTADO ESTADUAL,PROFESSOR RONALDO,JOSÉ RONALDO ALONSO MATHIAS,SUPLENTE,PV,PARTIDO VERDE,1
TEODORO SAMPAIO,DEPUTADO ESTADUAL,REGINA GONÇALVES,MARIA REGINA GONÇALVES,SUPLENTE,PV,PARTIDO VERDE,2
TEODORO SAMPAIO,DEPUTADO ESTADUAL,PASTOR DILMO DOS SANTOS,DILMO DOS SANTOS,ELEITO,PV,PARTIDO VERDE,11
TEODORO SAMPAIO,DEPUTADO ESTADUAL,RODRIGO XANDE,RODRIGO XANDE NUNES,SUPLENTE,PV,PARTIDO VERDE,1
TEODORO SAMPAIO,DEPUTADO ESTADUAL,DENIS MARICATO,DENIS MAURILIO MARICATO,SUPLENTE,PV,PARTIDO VERDE,2
TEODORO SAMPAIO,DEPUTADO ESTADUAL,DR FLAVIO,FLAVIO ISAIAS RODRIGUES,SUPLENTE,PV,PARTIDO VERDE,1
TEODORO SAMPAIO,DEPUTADO ESTADUAL,HELIO RUBENS,HELIO RUBENS GONÇALVES FIGUEIREDO,SUPLENTE,PSDB,PSDB/DEM,124
TEODORO SAMPAIO,DEPUTADO ESTADUAL,UBIRAJARA GUIMARÃES,UBIRAJARA PEREIRA GUIMARÃES,SUPLENTE,PSDB,PSDB/DEM,24
TEODORO SAMPAIO,DEPUTADO ESTADUAL,MARIA ZEFERINA BALDAIA,MARIA ZEFERINA RODRIGUES BALDAIA,SUPLENTE,PSDB,PSDB/DEM,2
TEODORO SAMPAIO,DEPUTADO ESTADUAL,PEDRO TOBIAS,PEDRO TOBIAS,ELEITO,PSDB,PSDB/DEM,7
TEODORO SAMPAIO,DEPUTADO ESTADUAL,GERALDO VINHOLI,GERALDO ANTONIO VINHOLI,SUPLENTE,PSDB,PSDB/DEM,1
TEODORO SAMPAIO,DEPUTADO ESTADUAL,TÂNIA FERRAZ,TÂNIA MARIA FERRAZ MARGONI,SUPLENTE,PSDB,PSDB/DEM,1
TEODORO SAMPAIO,DEPUTADO ESTADUAL,HEITOR SERTAO,HEITOR SERTÃO,SUPLENTE,PSDB,PSDB/DEM,2
TEODORO SAMPAIO,DEPUTADO ESTADUAL,RAMALHO DA CONSTRUCAO,ANTONIO DE SOUSA RAMALHO,SUPLENTE,PSDB,PSDB/DEM,11
TEODORO SAMPAIO,DEPUTADO ESTADUAL,WELSON GASPARINI,WELSON GASPARINI,SUPLENTE,PSDB,PSDB/DEM,31
TEODORO SAMPAIO,DEPUTADO ESTADUAL,MAURO BRAGATO,MAURO BRAGATO,ELEITO,PSDB,PSDB/DEM,3237
TEODORO SAMPAIO,DEPUTADO ESTADUAL,DR. RICARDO MARTINS,RICARDO MARTINS DE SÃO JOSÉ JUNIOR,SUPLENTE,PSDB,PSDB/DEM,1
TEODORO SAMPAIO,DEPUTADO ESTADUAL,JOÃO CARAMEZ,JOÃO CARLOS CARAMEZ,ELEITO,PSDB,PSDB/DEM,4
TEODORO SAMPAIO,DEPUTADO ESTADUAL,BRUNO COVAS,BRUNO COVAS LOPES,ELEITO,PSDB,PSDB/DEM,7
TEODORO SAMPAIO,DEPUTADO ESTADUAL,BERNARDO ORTIZ JR,JOSE BERNARDO ORTIZ MONTEIRO JUNIOR,SUPLENTE,PSDB,PSDB/DEM,16
TEODORO SAMPAIO,DEPUTADO ESTADUAL,CORONEL ERNESTO,ERNESTO CARLOS DA COSTA,SUPLENTE,PSDB,PSDB/DEM,1
TEODORO SAMPAIO,DEPUTADO ESTADUAL,JOSE BORANGA,JOSE AURELIO BORANGA,SUPLENTE,PSDB,PSDB/DEM,78
TEODORO SAMPAIO,DEPUTADO ESTADUAL,BORELI,OSWALDO LUIZ OLIVEIRA BORRELLI,SUPLENTE,PSDB,PSDB/DEM,2
TEODORO SAMPAIO,DEPUTADO ESTADUAL,DILADOR BORGES,DILADOR BORGES DAMASCENO,SUPLENTE,PSDB,PSDB/DEM,28
TEODORO SAMPAIO,DEPUTADO ESTADUAL,FELIPE AUGUSTO,FELIPE AUGUSTO,SUPLENTE,PSDB,PSDB/DEM,1
TEODORO SAMPAIO,DEPUTADO ESTADUAL,CAUÊ MACRIS,CAUÊ CASEIRO MACRIS,MÉDIA,PSDB,PSDB/DEM,4
TEODORO SAMPAIO,DEPUTADO ESTADUAL,EDISON CANDIDO,EDISON APARECIDO CANDIDO,SUPLENTE,PSDB,PSDB/DEM,1
TEODORO SAMPAIO,DEPUTADO ESTADUAL,VICTOR KOBAYASHI,VICTOR KOBAYASHI,SUPLENTE,PSDB,PSDB/DEM,18
TEODORO SAMPAIO,DEPUTADO ESTADUAL,BARROS MUNHOZ,JOSE ANTONIO BARROS MUNHOZ,ELEITO,PSDB,PSDB/DEM,3
TEODORO SAMPAIO,DEPUTADO ESTADUAL,FARID,JORGE FARID BOULOS BOU CHEBL,SUPLENTE,PSDB,PSDB/DEM,1
TEODORO SAMPAIO,DEPUTADO ESTADUAL,HELIO NISHIMOTO,HELIO NISHIMOTO,ELEITO,PSDB,PSDB/DEM,1
TEODORO SAMPAIO,DEPUTADO ESTADUAL,PAULO ALEXANDRE BARBOSA,PAULO ALEXANDRE PEREIRA BARBOSA,ELEITO,PSDB,PSDB/DEM,7
TEODORO SAMPAIO,DEPUTADO ESTADUAL,ORLANDO MORANDO,ORLANDO MORANDO JUNIOR,ELEITO,PSDB,PSDB/DEM,1
TEODORO SAMPAIO,DEPUTADO ESTADUAL,FERNANDO CAPEZ,FERNANDO CAPEZ,ELEITO,PSDB,PSDB/DEM,5
TEODORO SAMPAIO,DEPUTADO ESTADUAL,MILTON DALLARI,JOSÉ MILTON DALLARI SOARES,SUPLENTE,PSDB,PSDB/DEM,51
TEODORO SAMPAIO,DEPUTADO ESTADUAL,RAUL MARCELO,RAUL MARCELO DE SOUZA,SUPLENTE,PSOL,PARTIDO SOCIALISMO E LIBERDADE,3
TEODORO SAMPAIO,DEPUTADO ESTADUAL,CARLOS GIANNAZI,CARLOS ALBERTO GIANNASI,ELEITO,PSOL,PARTIDO SOCIALISMO E LIBERDADE,15
TEODORO SAMPAIO,DEPUTADO ESTADUAL,WANDER,WANDER DE OLIVEIRA VILLALBA,SUPLENTE,PC DO B,PARTIDO COMUNISTA DO BRASIL,7
TEODORO SAMPAIO,DEPUTADO ESTADUAL,ERLEI ALIADO,ERLEI ROBERTO DE MELO,SUPLENTE,PC DO B,PARTIDO COMUNISTA DO BRASIL,1
TEODORO SAMPAIO,DEPUTADO ESTADUAL,SARAH MUNHOZ,SARAH MUNHOZ,SUPLENTE,PC DO B,PARTIDO COMUNISTA DO BRASIL,5
TEODORO SAMPAIO,DEPUTADO ESTADUAL,ALCIDES AMAZONAS,ALCIDES ARAUJO DOS SANTOS,SUPLENTE,PC DO B,PARTIDO COMUNISTA DO BRASIL,1
TEODORO SAMPAIO,DEPUTADO ESTADUAL,PEDRO BIGARDI,PEDRO ANTONIO BIGARDI,ELEITO,PC DO B,PARTIDO COMUNISTA DO BRASIL,2
TEODORO SAMPAIO,DEPUTADO ESTADUAL,DAVI RAMOS,DAVI GONÇALVES RAMOS,SUPLENTE,PC DO B,PARTIDO COMUNISTA DO BRASIL,12
TEODORO SAMPAIO,DEPUTADO ESTADUAL,BRENO FARIA DO KATINGUELÊ,BRENO APARECIDO FONSECA DE FARIA,SUPLENTE,PC DO B,PARTIDO COMUNISTA DO BRASIL,2
TEODORO SAMPAIO,DEPUTADO ESTADUAL,CAJU,RICARDO ALVES DA SILVA,SUPLENTE,PC DO B,PARTIDO COMUNISTA DO BRASIL,1
TEODORO SAMPAIO,DEPUTADO ESTADUAL,PROFESSOR FLAVIO DELMANTO,FLAVIO DELMANTO,SUPLENTE,PC DO B,PARTIDO COMUNISTA DO BRASIL,2
TEODORO SAMPAIO,DEPUTADO ESTADUAL,TAVARES,JOSÉ WALTER TAVARES,SUPLENTE,PC DO B,PARTIDO COMUNISTA DO BRASIL,1
TEODORO SAMPAIO,DEPUTADO ESTADUAL,HELIFAX,HELIFAX PINTO DE SOUZA,SUPLENTE,PC DO B,PARTIDO COMUNISTA DO BRASIL,2
