ESTIVA GERBI,DEPUTADO ESTADUAL,PR. CARLOS CEZAR,CARLOS CEZAR DA SILVA,ELEITO,PSC,HUMANISTA CRISTÃO ,72
ESTIVA GERBI,DEPUTADO ESTADUAL,LUIZ LAURO,LUIZ LAURO FERREIRA,SUPLENTE,PSC,HUMANISTA CRISTÃO ,3
ESTIVA GERBI,DEPUTADO ESTADUAL,JOÃO BINATO,JOÃO ANTONIO BINATO,SUPLENTE,PSC,HUMANISTA CRISTÃO ,33
ESTIVA GERBI,DEPUTADO ESTADUAL,PAULO CHOCOLATE,PAULO SERGIO VIEIRA NEVES,SUPLENTE,PSC,HUMANISTA CRISTÃO ,1
ESTIVA GERBI,DEPUTADO ESTADUAL,ATALAIA,JOSE ROBERTO DE OLIVEIRA,SUPLENTE,PSC,HUMANISTA CRISTÃO ,3
ESTIVA GERBI,DEPUTADO ESTADUAL,RODRIGO MORAES,RODRIGO AUGUSTO MORAES,ELEITO,PSC,HUMANISTA CRISTÃO ,23
ESTIVA GERBI,DEPUTADO ESTADUAL,WALTER GOMES,WALTER GOMES DE OLIVEIRA,SUPLENTE,PR,SOMOS MAIS SÃO PAULO,1
ESTIVA GERBI,DEPUTADO ESTADUAL,ZE PEDRO,JOSE PEDRO LEITE DA SILVA,SUPLENTE,PR,SOMOS MAIS SÃO PAULO,6
ESTIVA GERBI,DEPUTADO ESTADUAL,PATRICIA LIMA,PATRICIA FREITAS LIMA,SUPLENTE,PR,SOMOS MAIS SÃO PAULO,3
ESTIVA GERBI,DEPUTADO ESTADUAL,TONINHO PAIVA,ANTONIO DE PAIVA MONTEIRO FILHO,SUPLENTE,PR,SOMOS MAIS SÃO PAULO,3
ESTIVA GERBI,DEPUTADO ESTADUAL,DAVI ZAIA,DAVID ZAIA,MÉDIA,PPS,PARTIDO POPULAR SOCIALISTA,82
ESTIVA GERBI,DEPUTADO ESTADUAL,ELIAS CARVALHO,ELIAS FERNANDES DE CARVALHO,SUPLENTE,PPS,PARTIDO POPULAR SOCIALISTA,54
ESTIVA GERBI,DEPUTADO ESTADUAL,JOAO OTAVIO BASTOS,JOAO OTAVIO BASTOS JUNQUEIRA,SUPLENTE,PPS,PARTIDO POPULAR SOCIALISTA,13
ESTIVA GERBI,DEPUTADO ESTADUAL,VITOR SAPIENZA,VITOR SAPIENZA,SUPLENTE,PPS,PARTIDO POPULAR SOCIALISTA,65
ESTIVA GERBI,DEPUTADO ESTADUAL,GONDIM,LUIZ CARLOS GONDIM TEIXEIRA,ELEITO,PPS,PARTIDO POPULAR SOCIALISTA,2
ESTIVA GERBI,DEPUTADO ESTADUAL,ROBERTO MORAIS,ROBERTO TURCHI DE MORAIS,ELEITO,PPS,PARTIDO POPULAR SOCIALISTA,2
ESTIVA GERBI,DEPUTADO ESTADUAL,AZUAITE,AZUAITE MARTINS DE FRANÇA,SUPLENTE,PPS,PARTIDO POPULAR SOCIALISTA,1
ESTIVA GERBI,DEPUTADO ESTADUAL,DARIO SAADI,DARIO JORGE GIOLO SAADI,SUPLENTE,DEM,PSDB/DEM,3
ESTIVA GERBI,DEPUTADO ESTADUAL,MARCOS FERRAZ,ANTONIO MARCOS MARCONDES FERRAZ,SUPLENTE,DEM,PSDB/DEM,1
ESTIVA GERBI,DEPUTADO ESTADUAL,ANDRE SOARES,ANDRE BEZERRA RIBEIRO SOARES,ELEITO,DEM,PSDB/DEM,22
ESTIVA GERBI,DEPUTADO ESTADUAL,EDMIR CHEDID,EDMIR JOSE ABI CHEDID,ELEITO,DEM,PSDB/DEM,124
ESTIVA GERBI,DEPUTADO ESTADUAL,ALDO DEMARCHI,JOSE ALDO DEMARCHI,ELEITO,DEM,PSDB/DEM,11
ESTIVA GERBI,DEPUTADO ESTADUAL,SALLES,RAIMUNDO TARASKEVICIUS SALES,SUPLENTE,DEM,PSDB/DEM,1
ESTIVA GERBI,DEPUTADO ESTADUAL,GIL ARANTES,GILBERTO MACEDO GIL ARANTES,ELEITO,DEM,PSDB/DEM,8
ESTIVA GERBI,DEPUTADO ESTADUAL,LEANDRO DO KLB,LEANDRO FINATO SCORNAVACCA,SUPLENTE,DEM,PSDB/DEM,13
ESTIVA GERBI,DEPUTADO ESTADUAL,IRMÃO OZELITO,OZELITO JOSE BENEDITO,SUPLENTE,PSB,PARTIDO SOCIALISTA BRASILEIRO,6
ESTIVA GERBI,DEPUTADO ESTADUAL,ARLY DE LARA ROMEO,ARLY DE LARA ROMEO,SUPLENTE,PSB,PARTIDO SOCIALISTA BRASILEIRO,18
ESTIVA GERBI,DEPUTADO ESTADUAL,GENTIL,ALEXANDRE MARIANO GENTIL,SUPLENTE,PV,PARTIDO VERDE,1
ESTIVA GERBI,DEPUTADO ESTADUAL,FELICIANO,FELICIANO NAHIMY FILHO,ELEITO,PV,PARTIDO VERDE,8
ESTIVA GERBI,DEPUTADO ESTADUAL,PAULLO VIEIRA,PAULO ROBERTO AMARAL VIEIRA,SUPLENTE,PV,PARTIDO VERDE,1
ESTIVA GERBI,DEPUTADO ESTADUAL,LAIS LATORRE,LAIS MENDES LATORRE SOARES,SUPLENTE,PV,PARTIDO VERDE,1
ESTIVA GERBI,DEPUTADO ESTADUAL,DR PAULO CÉSAR (PC),PAULO CESAR DA SILVA FERREIRA,SUPLENTE,PV,PARTIDO VERDE,1
ESTIVA GERBI,DEPUTADO ESTADUAL,ELÔ,MARIA ELOISA PEREIRA,SUPLENTE,PV,PARTIDO VERDE,4
ESTIVA GERBI,DEPUTADO ESTADUAL,PROFESSORA FREIRE,MARIA FREIRE LEITE,SUPLENTE,PV,PARTIDO VERDE,1
ESTIVA GERBI,DEPUTADO ESTADUAL,SANDRA BARROS,SANDRA MARA BENITES DE BARROS,SUPLENTE,PV,PARTIDO VERDE,586
ESTIVA GERBI,DEPUTADO ESTADUAL,CHICO SARDELLI,FRANCISCO ANTONIO SARDELLI,ELEITO,PV,PARTIDO VERDE,2
ESTIVA GERBI,DEPUTADO ESTADUAL,JOAO SOAREZ,JOAO CARLOS RIBEIRO SOARES,SUPLENTE,PV,PARTIDO VERDE,1
ESTIVA GERBI,DEPUTADO ESTADUAL,CLAUDINHO GASPAR,CLAUDIO GASPAR DOTTORI,SUPLENTE,PV,PARTIDO VERDE,1
ESTIVA GERBI,DEPUTADO ESTADUAL,ROSSINI,LUIZ CARLOS ROSSINI,SUPLENTE,PV,PARTIDO VERDE,1
ESTIVA GERBI,DEPUTADO ESTADUAL,RITA PASSOS,RITA DE CASSIA TRINCA PASSOS,ELEITO,PV,PARTIDO VERDE,4
ESTIVA GERBI,DEPUTADO ESTADUAL,NAVAL PELA GUARDA MUNICIPAL,MAURICIO DOMINGUES DA SILVA,SUPLENTE,PV,PARTIDO VERDE,5
ESTIVA GERBI,DEPUTADO ESTADUAL,BETO TRICOLI,JOSE ROBERTO TRICOLI,ELEITO,PV,PARTIDO VERDE,1
ESTIVA GERBI,DEPUTADO ESTADUAL,MIGUEL,ANDRÉ MIGUEL,SUPLENTE,PV,PARTIDO VERDE,1
ESTIVA GERBI,DEPUTADO ESTADUAL,PASTOR DILMO DOS SANTOS,DILMO DOS SANTOS,ELEITO,PV,PARTIDO VERDE,78
ESTIVA GERBI,DEPUTADO ESTADUAL,JOELMA OLIVEIRA,JOELMA ALVES DE OLIVEIRA,SUPLENTE,PV,PARTIDO VERDE,2
ESTIVA GERBI,DEPUTADO ESTADUAL,HELIO RUBENS,HELIO RUBENS GONÇALVES FIGUEIREDO,SUPLENTE,PSDB,PSDB/DEM,1
ESTIVA GERBI,DEPUTADO ESTADUAL,RAMALHO DA CONSTRUCAO,ANTONIO DE SOUSA RAMALHO,SUPLENTE,PSDB,PSDB/DEM,36
ESTIVA GERBI,DEPUTADO ESTADUAL,WELSON GASPARINI,WELSON GASPARINI,SUPLENTE,PSDB,PSDB/DEM,4
ESTIVA GERBI,DEPUTADO ESTADUAL,BERNARDO ORTIZ JR,JOSE BERNARDO ORTIZ MONTEIRO JUNIOR,SUPLENTE,PSDB,PSDB/DEM,11
ESTIVA GERBI,DEPUTADO ESTADUAL,ROBERTO ENGLER,ROBERTO CARVALHO ENGLER PINTO,ELEITO,PSDB,PSDB/DEM,1
ESTIVA GERBI,DEPUTADO ESTADUAL,CELINO,JUSCELINO CARDOSO DE SÁ,ELEITO,PSDB,PSDB/DEM,1
ESTIVA GERBI,DEPUTADO ESTADUAL,CÉLIA LEÃO,CÉLIA CAMARGO LEÃO EDELMUTH,ELEITO,PSDB,PSDB/DEM,620
ESTIVA GERBI,DEPUTADO ESTADUAL,BUCK JACINTHO,ANTONIO JOÃO COIMBRA JACINTHO,SUPLENTE,PSDB,PSDB/DEM,1
ESTIVA GERBI,DEPUTADO ESTADUAL,CARLÃO PIGNATARI,CARLOS EDUARDO PIGNATARI,ELEITO,PSDB,PSDB/DEM,1
ESTIVA GERBI,DEPUTADO ESTADUAL,FORDINHO,ANTONIO CARLOS DE FARIA,SUPLENTE,PSDB,PSDB/DEM,1
ESTIVA GERBI,DEPUTADO ESTADUAL,SAMUEL MOREIRA,SAMUEL MOREIRA DA SILVA JÚNIOR,ELEITO,PSDB,PSDB/DEM,2
ESTIVA GERBI,DEPUTADO ESTADUAL,CASSIO NAVARRO,CASSIO DE CASTRO NAVARRO,SUPLENTE,PSDB,PSDB/DEM,1
ESTIVA GERBI,DEPUTADO ESTADUAL,FELIPE AUGUSTO,FELIPE AUGUSTO,SUPLENTE,PSDB,PSDB/DEM,1
ESTIVA GERBI,DEPUTADO ESTADUAL,THIAGO LOBO,THIAGO ANTUNES CAVALCA REIS LOBO,SUPLENTE,PSDB,PSDB/DEM,1
ESTIVA GERBI,DEPUTADO ESTADUAL,CAUÊ MACRIS,CAUÊ CASEIRO MACRIS,MÉDIA,PSDB,PSDB/DEM,65
ESTIVA GERBI,DEPUTADO ESTADUAL,EDISON CANDIDO,EDISON APARECIDO CANDIDO,SUPLENTE,PSDB,PSDB/DEM,2
ESTIVA GERBI,DEPUTADO ESTADUAL,CONCCI MARCO,ELIANE CONCEIÇÃO SILVA MENDES,SUPLENTE,PSDB,PSDB/DEM,2
ESTIVA GERBI,DEPUTADO ESTADUAL,JOÃO SANZOVO,JOÃO SANZOVO NETO,SUPLENTE,PSDB,PSDB/DEM,1
ESTIVA GERBI,DEPUTADO ESTADUAL,BARROS MUNHOZ,JOSE ANTONIO BARROS MUNHOZ,ELEITO,PSDB,PSDB/DEM,559
ESTIVA GERBI,DEPUTADO ESTADUAL,FARID,JORGE FARID BOULOS BOU CHEBL,SUPLENTE,PSDB,PSDB/DEM,1
ESTIVA GERBI,DEPUTADO ESTADUAL,PAULO ALEXANDRE BARBOSA,PAULO ALEXANDRE PEREIRA BARBOSA,ELEITO,PSDB,PSDB/DEM,121
ESTIVA GERBI,DEPUTADO ESTADUAL,JOÃO NILTON DO UNIÃO SERV,JOÃO NILTON GONÇALVES,SUPLENTE,PSDB,PSDB/DEM,36
ESTIVA GERBI,DEPUTADO ESTADUAL,JOSÉ LUIZ RIBEIRO,JOSÉ LUIZ RIBEIRO,SUPLENTE,PSDB,PSDB/DEM,2
ESTIVA GERBI,DEPUTADO ESTADUAL,MILTON DALLARI,JOSÉ MILTON DALLARI SOARES,SUPLENTE,PSDB,PSDB/DEM,2
ESTIVA GERBI,DEPUTADO ESTADUAL,MARCELO,MARCELO SEBASTIÃO FIORI LINO DE SOUZA,SUPLENTE,PSOL,PARTIDO SOCIALISMO E LIBERDADE,1
ESTIVA GERBI,DEPUTADO ESTADUAL,RAUL MARCELO,RAUL MARCELO DE SOUZA,SUPLENTE,PSOL,PARTIDO SOCIALISMO E LIBERDADE,2
ESTIVA GERBI,DEPUTADO ESTADUAL,CARLOS GIANNAZI,CARLOS ALBERTO GIANNASI,ELEITO,PSOL,PARTIDO SOCIALISMO E LIBERDADE,2
ESTIVA GERBI,DEPUTADO ESTADUAL,LECI BRANDÃO,LECI BRANDAO DA SILVA,ELEITO,PC DO B,PARTIDO COMUNISTA DO BRASIL,3
ESTIVA GERBI,DEPUTADO ESTADUAL,GILSON MENDES,GILSON PEREIRA MENDES,SUPLENTE,PC DO B,PARTIDO COMUNISTA DO BRASIL,1
