RANCHARIA,PRESIDENTE,DILMA,DILMA VANA ROUSSEFF,2º TURNO,PT,PARA O BRASIL SEGUIR MUDANDO,5656
RANCHARIA,PRESIDENTE,JOSÉ SERRA,JOSÉ SERRA,2º TURNO,PSDB,O BRASIL PODE MAIS,8304
RANCHARIA,GOVERNADOR,GERALDO ALCKMIN,GERALDO JOSE RODRIGUES ALCKMIN FILHO,ELEITO,PSDB,UNIDOS POR SÃO PAULO,10003
RANCHARIA,SENADOR,MARTA SUPLICY,MARTA SUPLICY,ELEITO,PT,UNIÃO PARA MUDAR,4785
RANCHARIA,SENADOR,ALOYSIO NUNES,ALOYSIO NUNES FERREIRA FILHO,ELEITO,PSDB,UNIDOS POR SÃO PAULO,10125
RANCHARIA,DEPUTADO FEDERAL,DR. ELIEZER COSTA,ELIEZER NASCIMENTO DA COSTA,SUPLENTE,PRB,JUNTOS POR SÃO PAULO,2
RANCHARIA,DEPUTADO FEDERAL,ANTONIO BULHÕES,ANTONIO CARLOS MARTINS DE BULHÕES,ELEITO,PRB,JUNTOS POR SÃO PAULO,6
RANCHARIA,DEPUTADO FEDERAL,OTONIEL LIMA,OTONIEL CARLOS DE LIMA,MÉDIA,PRB,JUNTOS POR SÃO PAULO,194
RANCHARIA,DEPUTADO FEDERAL,DURVAL MORELLI,DURVAL MORELLI NETO,SUPLENTE,PP,PARTIDO PROGRESSISTA,3
RANCHARIA,DEPUTADO FEDERAL,MISSIONÁRIA CICERA BEZERRA,CICERA MARIA BEZERRA DA SILVA,SUPLENTE,PP,PARTIDO PROGRESSISTA,1
RANCHARIA,DEPUTADO FEDERAL,MALUF,PAULO SALIM MALUF,ELEITO,PP,PARTIDO PROGRESSISTA,117
RANCHARIA,DEPUTADO FEDERAL,ANGINHO DOS TECLADOS,ANGELO MARINHO DE ALMEIDA,SUPLENTE,PP,PARTIDO PROGRESSISTA,2
RANCHARIA,DEPUTADO FEDERAL,CARLOS OCTAVIANI,JOSÉ CARLOS OCTAVIANI,SUPLENTE,PP,PARTIDO PROGRESSISTA,21
RANCHARIA,DEPUTADO FEDERAL,LALO,JOSÉ CARLOS TALDIVO,SUPLENTE,PP,PARTIDO PROGRESSISTA,1
RANCHARIA,DEPUTADO FEDERAL,RENATO AMORIM,RENATO AMORIM NOGUEIRA,SUPLENTE,PP,PARTIDO PROGRESSISTA,1
RANCHARIA,DEPUTADO FEDERAL,LAURINDO BARNARDES,LAURINDO BERNARDES DE SOUZA,SUPLENTE,PP,PARTIDO PROGRESSISTA,2
RANCHARIA,DEPUTADO FEDERAL,PEDRINHO BARACAT,ASSAD NACLE BARACAT,SUPLENTE,PP,PARTIDO PROGRESSISTA,1
RANCHARIA,DEPUTADO FEDERAL,ALINE CORREA,ALINE LEMOS CORREA DE OLIVEIRA ANDRADE,ELEITO,PP,PARTIDO PROGRESSISTA,3
RANCHARIA,DEPUTADO FEDERAL,PAULO BASSOLI,PAULO SERGIO BONGATER BASSOLI,SUPLENTE,PP,PARTIDO PROGRESSISTA,6
RANCHARIA,DEPUTADO FEDERAL,PASTOR MARCOS MOTOLO,MARCOS CINTAS MOTOLO,SUPLENTE,PP,PARTIDO PROGRESSISTA,1
RANCHARIA,DEPUTADO FEDERAL,MARCELO CORREIA,MARCELO CORREIA DE SOUZA,SUPLENTE,PP,PARTIDO PROGRESSISTA,1
RANCHARIA,DEPUTADO FEDERAL,BETO MANSUR,PAULO ROBERTO GOMES MANSUR,ELEITO,PP,PARTIDO PROGRESSISTA,1
RANCHARIA,DEPUTADO FEDERAL,ADHEMAR DE BARROS FILHO,ADHEMAR DE BARROS FILHO,SUPLENTE,PP,PARTIDO PROGRESSISTA,6
RANCHARIA,DEPUTADO FEDERAL,MAURICIO TCHÊ DA TORRE,MAURICIO EDUARDO MELLO PEREIRA,SUPLENTE,PP,PARTIDO PROGRESSISTA,1
RANCHARIA,DEPUTADO FEDERAL,CABO WILSON,WILSON DE OLIVEIRA MORAIS,SUPLENTE,PP,PARTIDO PROGRESSISTA,20
RANCHARIA,DEPUTADO FEDERAL,MISSIONÁRIO JOSÉ OLIMPIO,JOSÉ OLIMPIO SILVEIRA MORAES,ELEITO,PP,PARTIDO PROGRESSISTA,170
RANCHARIA,DEPUTADO FEDERAL,DR NECHAR,SERGIO ANTONIO NECHAR,SUPLENTE,PP,PARTIDO PROGRESSISTA,168
RANCHARIA,DEPUTADO FEDERAL,DELEGADA GRACIELA,GRACIELA DE LOURDES DAVID AMBROSIO,SUPLENTE,PP,PARTIDO PROGRESSISTA,1
RANCHARIA,DEPUTADO FEDERAL,VADÃO,ETIVALDO VADAO GOMES,SUPLENTE,PP,PARTIDO PROGRESSISTA,1
RANCHARIA,DEPUTADO FEDERAL,JOÃO DADO,JOÃO EDUARDO DADO LEITE DE CARVALHO,ELEITO,PDT,PARTIDO DEMOCRÁTICO TRABALHISTA,14
RANCHARIA,DEPUTADO FEDERAL,PAULINHO DA FORÇA,PAULO PEREIRA DA SILVA,ELEITO,PDT,PARTIDO DEMOCRÁTICO TRABALHISTA,43
RANCHARIA,DEPUTADO FEDERAL,ELISEU DANIEL,ELISEU DANIEL DOS SANTOS,SUPLENTE,PDT,PARTIDO DEMOCRÁTICO TRABALHISTA,4
RANCHARIA,DEPUTADO FEDERAL,GUSTAVO STUPP,LUIZ GUSTAVO ANTUNES STUPP,SUPLENTE,PDT,PARTIDO DEMOCRÁTICO TRABALHISTA,1
RANCHARIA,DEPUTADO FEDERAL,MARTAN,MARCELO MARTIN,SUPLENTE,PDT,PARTIDO DEMOCRÁTICO TRABALHISTA,2
RANCHARIA,DEPUTADO FEDERAL,PEDRO BAPTISTINI,PEDRO ANTONIO BAPTISTINI,SUPLENTE,PDT,PARTIDO DEMOCRÁTICO TRABALHISTA,1
RANCHARIA,DEPUTADO FEDERAL,SAULO GOES,SAULO GOES DE ALBUQUERQUE,SUPLENTE,PDT,PARTIDO DEMOCRÁTICO TRABALHISTA,1
RANCHARIA,DEPUTADO FEDERAL,MEDEIROS,LUIZ ANTONIO DE MEDEIROS NETO,SUPLENTE,PDT,PARTIDO DEMOCRÁTICO TRABALHISTA,4
RANCHARIA,DEPUTADO FEDERAL,EDUARDO NASCIMENTO,EDUARDO DUARTE DO NASCIMENTO,SUPLENTE,PDT,PARTIDO DEMOCRÁTICO TRABALHISTA,1
RANCHARIA,DEPUTADO FEDERAL,DR LUIZ CHIAPARINE,LUIZ CARLOS CHIAPARINE,SUPLENTE,PDT,PARTIDO DEMOCRÁTICO TRABALHISTA,10
RANCHARIA,DEPUTADO FEDERAL,NELSINHO DA BAHIA,NELSON FRANCISCO DOS SANTOS,SUPLENTE,PDT,PARTIDO DEMOCRÁTICO TRABALHISTA,1
RANCHARIA,DEPUTADO FEDERAL,MANOEL ANTUNES,MANOEL ANTUNES,SUPLENTE,PDT,PARTIDO DEMOCRÁTICO TRABALHISTA,3
RANCHARIA,DEPUTADO FEDERAL,CARLOS HENRIQUE,CARLOS HENRIQUE PINTO,SUPLENTE,PDT,PARTIDO DEMOCRÁTICO TRABALHISTA,4
RANCHARIA,DEPUTADO FEDERAL,DRA DEBORA,DEBORA MARIA MARAGNI PEREIRA DE ABREU,SUPLENTE,PDT,PARTIDO DEMOCRÁTICO TRABALHISTA,2
RANCHARIA,DEPUTADO FEDERAL,SALVADOR ZIMBALDI,SALVADOR ZIMBALDI FILHO,MÉDIA,PDT,PARTIDO DEMOCRÁTICO TRABALHISTA,20
RANCHARIA,DEPUTADO FEDERAL,FERNANDO CHIARELLI,FERNANDO CHIARELLI,SUPLENTE,PDT,PARTIDO DEMOCRÁTICO TRABALHISTA,1
RANCHARIA,DEPUTADO FEDERAL,WILSON COELHO,WILSON DE SOUZA COELHO,SUPLENTE,PDT,PARTIDO DEMOCRÁTICO TRABALHISTA,3
RANCHARIA,DEPUTADO FEDERAL,JOSUE TOPA TUDO,JOSUÉ MOREIRA,SUPLENTE,PDT,PARTIDO DEMOCRÁTICO TRABALHISTA,7
RANCHARIA,DEPUTADO FEDERAL,IVANIO BATISTA,IVANIO BATISTA DA SILVA,SUPLENTE,PT,JUNTOS POR SÃO PAULO,3
RANCHARIA,DEPUTADO FEDERAL,VICENTE CANDIDO,VICENTE CANDIDO DA SILVA,ELEITO,PT,JUNTOS POR SÃO PAULO,2
RANCHARIA,DEPUTADO FEDERAL,IARA BERNARDI,IARA BERNARDI,SUPLENTE,PT,JUNTOS POR SÃO PAULO,2
RANCHARIA,DEPUTADO FEDERAL,LARGUESA,LUIS VANDERLEI LARGUESA,SUPLENTE,PT,JUNTOS POR SÃO PAULO,2
RANCHARIA,DEPUTADO FEDERAL,VACCAREZZA,CANDIDO ELPIDIO DE SOUZA VACCAREZZA,ELEITO,PT,JUNTOS POR SÃO PAULO,60
RANCHARIA,DEPUTADO FEDERAL,GENOINO,JOSÉ GENOÍNO NETO,SUPLENTE,PT,JUNTOS POR SÃO PAULO,22
RANCHARIA,DEPUTADO FEDERAL,HELCIO SILVA,HELCIO ANTONIO DA SILVA,SUPLENTE,PT,JUNTOS POR SÃO PAULO,2
RANCHARIA,DEPUTADO FEDERAL,CARLINHOS ALMEIDA,CARLOS JOSE DE ALMEIDA,ELEITO,PT,JUNTOS POR SÃO PAULO,1
RANCHARIA,DEPUTADO FEDERAL,NEWTON LIMA NETO,NEWTON LIMA NETO,ELEITO,PT,JUNTOS POR SÃO PAULO,2
RANCHARIA,DEPUTADO FEDERAL,FILIPPI,JOSÉ DE FILIPPI JÚNIOR,ELEITO,PT,JUNTOS POR SÃO PAULO,2
RANCHARIA,DEPUTADO FEDERAL,ARLINDO CHINAGLIA,ARLINDO CHIGNALIA JUNIOR,ELEITO,PT,JUNTOS POR SÃO PAULO,66
RANCHARIA,DEPUTADO FEDERAL,JOÃO PAULO CUNHA,JOÃO PAULO CUNHA,ELEITO,PT,JUNTOS POR SÃO PAULO,19
RANCHARIA,DEPUTADO FEDERAL,ROQUE FERREIRA,ROQUE JOSÉ FERREIRA,SUPLENTE,PT,JUNTOS POR SÃO PAULO,2
RANCHARIA,DEPUTADO FEDERAL,PIVATTO,JOSÉ PIVATTO,SUPLENTE,PT,JUNTOS POR SÃO PAULO,1
RANCHARIA,DEPUTADO FEDERAL,RICARDO BERZOINI,RICARDO JOSE RIBEIRO BERZOINI,ELEITO,PT,JUNTOS POR SÃO PAULO,39
RANCHARIA,DEPUTADO FEDERAL,JOSÉ MENTOR,JOSÉ MENTOR GUILHERME DE MELLO NETTO,ELEITO,PT,JUNTOS POR SÃO PAULO,31
RANCHARIA,DEPUTADO FEDERAL,PROF. CARLÃO RAMIRO,CARLOS RAMIRO CASTRO,SUPLENTE,PT,JUNTOS POR SÃO PAULO,23
RANCHARIA,DEPUTADO FEDERAL,FÉLIX SAHÃO,FÉLIX SAHÃO JÚNIOR,SUPLENTE,PT,JUNTOS POR SÃO PAULO,314
RANCHARIA,DEPUTADO FEDERAL,ROGÉRIO PINTO,ROGÉRIO PINTO FERNANDES,SUPLENTE,PT,JUNTOS POR SÃO PAULO,1
RANCHARIA,DEPUTADO FEDERAL,RODRIGO VALVERDE,JORGE RODRIGO VALVERDE SANTANA,SUPLENTE,PT,JUNTOS POR SÃO PAULO,2
RANCHARIA,DEPUTADO FEDERAL,VANDERLEI SIRAQUE,VANDERLEI SIRAQUE,SUPLENTE,PT,JUNTOS POR SÃO PAULO,16
RANCHARIA,DEPUTADO FEDERAL,LUIZ CARLOS GOMES,LUIZ CARLOS GOMES,SUPLENTE,PT,JUNTOS POR SÃO PAULO,1
RANCHARIA,DEPUTADO FEDERAL,JILMAR TATTO,JILMAR AUGUSTINHO TATTO,ELEITO,PT,JUNTOS POR SÃO PAULO,4
RANCHARIA,DEPUTADO FEDERAL,DURVAL ORLATO,DURVAL LOPES ORLATO,SUPLENTE,PT,JUNTOS POR SÃO PAULO,1
RANCHARIA,DEPUTADO FEDERAL,EDSON DA PAZ (O CANTOR),EDSON DA PAZ,SUPLENTE,PT,JUNTOS POR SÃO PAULO,1
RANCHARIA,DEPUTADO FEDERAL,ARCELINO ARAUJO,ARCELINO ARAUJO RIBEIRO,SUPLENTE,PT,JUNTOS POR SÃO PAULO,2
RANCHARIA,DEPUTADO FEDERAL,RENATO SIMÕES,RENATO SIMÕES,SUPLENTE,PT,JUNTOS POR SÃO PAULO,54
RANCHARIA,DEPUTADO FEDERAL,DEVANIR RIBEIRO,DEVANIR RIBEIRO,ELEITO,PT,JUNTOS POR SÃO PAULO,29
RANCHARIA,DEPUTADO FEDERAL,ZARATTINI,CARLOS ALBERTO ROLIM ZARATTINI,ELEITO,PT,JUNTOS POR SÃO PAULO,6
RANCHARIA,DEPUTADO FEDERAL,ANGELO BARRETO,ANGELO RAFAEL BARRETO,SUPLENTE,PT,JUNTOS POR SÃO PAULO,3
RANCHARIA,DEPUTADO FEDERAL,VICENTINHO,VICENTE PAULO DA SILVA,ELEITO,PT,JUNTOS POR SÃO PAULO,18
RANCHARIA,DEPUTADO FEDERAL,PAULO TEIXEIRA,LUIZ PAULO TEIXEIRA FERREIRA,ELEITO,PT,JUNTOS POR SÃO PAULO,2
RANCHARIA,DEPUTADO FEDERAL,CLAURY,CLAURY SANTOS ALVES DA SILVA,SUPLENTE,PTB,PARTIDO TRABALHISTA BRASILEIRO,2
RANCHARIA,DEPUTADO FEDERAL,ALEXANDRE COSTA,ALEXANDRE COSTA,SUPLENTE,PTB,PARTIDO TRABALHISTA BRASILEIRO,1
RANCHARIA,DEPUTADO FEDERAL,NADUR,ADALBERTO NADUR,SUPLENTE,PTB,PARTIDO TRABALHISTA BRASILEIRO,1
RANCHARIA,DEPUTADO FEDERAL,PIRU,CLAUDIO AFFONSO,SUPLENTE,PTB,PARTIDO TRABALHISTA BRASILEIRO,1
RANCHARIA,DEPUTADO FEDERAL,ROBSON TUMA,ROBSON TUMA,SUPLENTE,PTB,PARTIDO TRABALHISTA BRASILEIRO,4
RANCHARIA,DEPUTADO FEDERAL,RICARDO OLIVEIRA,RICARDO JOSE DE OLIVEIRA,SUPLENTE,PTB,PARTIDO TRABALHISTA BRASILEIRO,3
RANCHARIA,DEPUTADO FEDERAL,TICO DO TRANSPORTE ESCOLAR,ALBERTO GOMES BARBOSA,SUPLENTE,PTB,PARTIDO TRABALHISTA BRASILEIRO,1
RANCHARIA,DEPUTADO FEDERAL,SINVAL DORIGON,SINVAL ROBERTO DORIGON,SUPLENTE,PTB,PARTIDO TRABALHISTA BRASILEIRO,1
RANCHARIA,DEPUTADO FEDERAL,NELSON MARQUEZELLI,NELSON MARQUEZELLI,ELEITO,PTB,PARTIDO TRABALHISTA BRASILEIRO,460
RANCHARIA,DEPUTADO FEDERAL,CARLOS BURGHI,CARLOS ALBERTO EBERT BURGHI,SUPLENTE,PTB,PARTIDO TRABALHISTA BRASILEIRO,1
RANCHARIA,DEPUTADO FEDERAL,WALDOMIRO RAMOS,WALDOMIRO CARLOS RAMOS,SUPLENTE,PTB,PARTIDO TRABALHISTA BRASILEIRO,1
RANCHARIA,DEPUTADO FEDERAL,BRESSAN,ANTONIO BRESSAN FILHO,SUPLENTE,PTB,PARTIDO TRABALHISTA BRASILEIRO,1
RANCHARIA,DEPUTADO FEDERAL,ARNALDO FARIA DE SÁ,ARNALDO FARIA DE SÁ,ELEITO,PTB,PARTIDO TRABALHISTA BRASILEIRO,46
RANCHARIA,DEPUTADO FEDERAL,CELIO DINIZ,CELIO FRANCISCO DINIZ,SUPLENTE,PTB,PARTIDO TRABALHISTA BRASILEIRO,12
RANCHARIA,DEPUTADO FEDERAL,CAJAI,ISRAEL MARQUES CAJAI,SUPLENTE,PTB,PARTIDO TRABALHISTA BRASILEIRO,2
RANCHARIA,DEPUTADO FEDERAL,FRANK AGUIAR,FRANCINETO LUZ DE AGUIAR,SUPLENTE,PTB,PARTIDO TRABALHISTA BRASILEIRO,2
RANCHARIA,DEPUTADO FEDERAL,SONIA GARCIA,MARIA SONIA REIS LIMA,SUPLENTE,PTB,PARTIDO TRABALHISTA BRASILEIRO,1
RANCHARIA,DEPUTADO FEDERAL,PASTOR JOAO ALMEIDA,JOAO ALMEIDA DOS SANTOS,SUPLENTE,PTB,PARTIDO TRABALHISTA BRASILEIRO,2
RANCHARIA,DEPUTADO FEDERAL,DR ANDRE ROCHA,ANDRE LUIS ROCHA,SUPLENTE,PTB,PARTIDO TRABALHISTA BRASILEIRO,8
RANCHARIA,DEPUTADO FEDERAL,PADRE FERNANDO,LAUDINEY FERNANDO SILVA FRAGA,SUPLENTE,PTB,PARTIDO TRABALHISTA BRASILEIRO,1
RANCHARIA,DEPUTADO FEDERAL,EMELLY OLIVEIRA,EMELLY PAGLIARI CARDOSO ALVES DE OLIVEIRA,SUPLENTE,PTB,PARTIDO TRABALHISTA BRASILEIRO,1
RANCHARIA,DEPUTADO FEDERAL,PAULO LIMA,PAULO CESAR DE OLIVEIRA LIMA,SUPLENTE,PMDB,PARTIDO DO MOVIMENTO DEMOCRÁTICO BRASILEIRO,1599
RANCHARIA,DEPUTADO FEDERAL,VANDERLEI JUELI,VANDERLEI JUELI,SUPLENTE,PMDB,PARTIDO DO MOVIMENTO DEMOCRÁTICO BRASILEIRO,2
RANCHARIA,DEPUTADO FEDERAL,MARCOS TENÓRIO,MARCOS ANTÔNIO FERREIRA TENÓRIO,SUPLENTE,PMDB,PARTIDO DO MOVIMENTO DEMOCRÁTICO BRASILEIRO,18
RANCHARIA,DEPUTADO FEDERAL,PAULINHO SOBRAL,PAULO MENDES SOBRAL,SUPLENTE,PMDB,PARTIDO DO MOVIMENTO DEMOCRÁTICO BRASILEIRO,9
RANCHARIA,DEPUTADO FEDERAL,BONFÁ,ALVARO BONFA JUNIOR,SUPLENTE,PMDB,PARTIDO DO MOVIMENTO DEMOCRÁTICO BRASILEIRO,4
RANCHARIA,DEPUTADO FEDERAL,EDUARDO COELHO,EDUARDO JOSÉ PEREIRA COELHO,SUPLENTE,PMDB,PARTIDO DO MOVIMENTO DEMOCRÁTICO BRASILEIRO,1
RANCHARIA,DEPUTADO FEDERAL,DIEGO MARTINS,DIEGO OLIVEIRA MARTINS,SUPLENTE,PMDB,PARTIDO DO MOVIMENTO DEMOCRÁTICO BRASILEIRO,1
RANCHARIA,DEPUTADO FEDERAL,SINIVAL,SINIVAL JOSE INACIO,SUPLENTE,PMDB,PARTIDO DO MOVIMENTO DEMOCRÁTICO BRASILEIRO,2
RANCHARIA,DEPUTADO FEDERAL,LIMA JUNIOR,JULIO CEZAR DA SILVA LIMA JUNIOR,SUPLENTE,PMDB,PARTIDO DO MOVIMENTO DEMOCRÁTICO BRASILEIRO,1
RANCHARIA,DEPUTADO FEDERAL,LÉO OLIVEIRA,OCIMAR DONIZETI LEO OLIVEIRA,SUPLENTE,PMDB,PARTIDO DO MOVIMENTO DEMOCRÁTICO BRASILEIRO,12
RANCHARIA,DEPUTADO FEDERAL,CLERISTON VALLE,CLERISTON PEREIRA DO VALLE,SUPLENTE,PMDB,PARTIDO DO MOVIMENTO DEMOCRÁTICO BRASILEIRO,1
RANCHARIA,DEPUTADO FEDERAL,MORATO,JOSÉ ANTONIO MORATO,SUPLENTE,PMDB,PARTIDO DO MOVIMENTO DEMOCRÁTICO BRASILEIRO,1
RANCHARIA,DEPUTADO FEDERAL,DANIEL CALDEIRA,DANIEL CALDEIRA MATEUS,SUPLENTE,PSL,PRESTE ATENÇÃO SÃO PAULO,9
RANCHARIA,DEPUTADO FEDERAL,SARGENTO SEVERO,LUCIANO APARECIDO SEVERO,SUPLENTE,PSL,PRESTE ATENÇÃO SÃO PAULO,3
RANCHARIA,DEPUTADO FEDERAL,APOSTOLO LEO,LEONILDIO LIMA DE OLIVEIRA,SUPLENTE,PSL,PRESTE ATENÇÃO SÃO PAULO,1
RANCHARIA,DEPUTADO FEDERAL,ROBERTO SIQUEIRA,ROBERTO SIQUEIRA GOMES,SUPLENTE,PSL,PRESTE ATENÇÃO SÃO PAULO,1
RANCHARIA,DEPUTADO FEDERAL,MISSIONARIA NAZARE,MARIA NAZARE DOS SANTOS SORRILLO,SUPLENTE,PSC,HUMANISTA CRISTÃO ,7
RANCHARIA,DEPUTADO FEDERAL,CLEBER DELALIBERA,CLEBER DE MOURA DELALIBERA,SUPLENTE,PSC,HUMANISTA CRISTÃO ,4
RANCHARIA,DEPUTADO FEDERAL,MARCO FELICIANO,MARCO ANTONIO FELICIANO,ELEITO,PSC,HUMANISTA CRISTÃO ,198
RANCHARIA,DEPUTADO FEDERAL,MARCELO AGUIAR,MARCELO THEODORO DE AGUIAR,ELEITO,PSC,HUMANISTA CRISTÃO ,3
RANCHARIA,DEPUTADO FEDERAL,TENENTE ORLANDO,ORLANDO BENEDITO DE LIMA,SUPLENTE,PSC,HUMANISTA CRISTÃO ,1
RANCHARIA,DEPUTADO FEDERAL,REGIS DE OLIVEIRA,REGIS FERNANDES DE OLIVEIRA,SUPLENTE,PSC,HUMANISTA CRISTÃO ,11
RANCHARIA,DEPUTADO FEDERAL,SILVIA PALMA,SILVIA ELIANA PALMA,SUPLENTE,PSC,HUMANISTA CRISTÃO ,4
RANCHARIA,DEPUTADO FEDERAL,NEY SANTOS,CLAUDINEI ALVES DOS SANTOS,SUPLENTE,PSC,HUMANISTA CRISTÃO ,4
RANCHARIA,DEPUTADO FEDERAL,PAULA CASTRO,ANA PAULA MACHADO DE CASTRO,SUPLENTE,PSC,HUMANISTA CRISTÃO ,1
RANCHARIA,DEPUTADO FEDERAL,JOÃO LOCO,JOÃO LOCO BATISTA DE SIQUEIRA,SUPLENTE,PSC,HUMANISTA CRISTÃO ,1
RANCHARIA,DEPUTADO FEDERAL,DALVAN,JOÃO GOMES DE ALMEIDA,SUPLENTE,PSC,HUMANISTA CRISTÃO ,2
RANCHARIA,DEPUTADO FEDERAL,PR. LUIZ LEMOS,LUIZ CARLOS LEMOS,SUPLENTE,PSC,HUMANISTA CRISTÃO ,7
RANCHARIA,DEPUTADO FEDERAL,PRICILA LEME,PRICILA HELENA MOYSES LEME,SUPLENTE,PSC,HUMANISTA CRISTÃO ,2
RANCHARIA,DEPUTADO FEDERAL,DR. CARALAMBOS,CARALAMBOS CONSTANTINO SOTIROPOULOS,SUPLENTE,PSC,HUMANISTA CRISTÃO ,3
RANCHARIA,DEPUTADO FEDERAL,TONINHO CORREDOR,ANTONIO CICERO DA SILVA,SUPLENTE,PSC,HUMANISTA CRISTÃO ,1
RANCHARIA,DEPUTADO FEDERAL,MANOEL GASPAR,MANOEL FERREIRA DE SOUZA GASPAR,SUPLENTE,PSC,HUMANISTA CRISTÃO ,45
RANCHARIA,DEPUTADO FEDERAL,JUCA CHAVES,JURANDYR CZACZKES CHAVES,SUPLENTE,PR,JUNTOS POR SÃO PAULO,7
RANCHARIA,DEPUTADO FEDERAL,AGNALDO TIMOTEO,AGUINALDO TIMOTEO PEREIRA,SUPLENTE,PR,JUNTOS POR SÃO PAULO,7
RANCHARIA,DEPUTADO FEDERAL,TIRIRICA,FRANCISCO EVERARDO OLIVEIRA SILVA,ELEITO,PR,JUNTOS POR SÃO PAULO,693
RANCHARIA,DEPUTADO FEDERAL,PR PAULO FREIRE,PAULO ROBERTO FREIRE DA COSTA,ELEITO,PR,JUNTOS POR SÃO PAULO,77
RANCHARIA,DEPUTADO FEDERAL,LUCIANA COSTA,LUCIANA DE ALMEIDA COSTA,SUPLENTE,PR,JUNTOS POR SÃO PAULO,8
RANCHARIA,DEPUTADO FEDERAL,MILTON MONTI,MILTON ANTONIO CASQUEL MONTI,ELEITO,PR,JUNTOS POR SÃO PAULO,23
RANCHARIA,DEPUTADO FEDERAL,VALDEMAR COSTA NETO,VALDEMAR COSTA NETO,ELEITO,PR,JUNTOS POR SÃO PAULO,3
RANCHARIA,DEPUTADO FEDERAL,WILLIAM WOO,WILLIAM BOSS WOO,SUPLENTE,PPS,PSDB/DEM/PPS,2
RANCHARIA,DEPUTADO FEDERAL,ROBERTO FREIRE,ROBERTO JOAO PEREIRA FREIRE,ELEITO,PPS,PSDB/DEM/PPS,22
RANCHARIA,DEPUTADO FEDERAL,CORONEL EDSON SARDANO,EDSON DE JESUS SARDANO,SUPLENTE,PPS,PSDB/DEM/PPS,4
RANCHARIA,DEPUTADO FEDERAL,DIMAS RAMALHO,DIMAS EDUARDO RAMALHO,ELEITO,PPS,PSDB/DEM/PPS,6
RANCHARIA,DEPUTADO FEDERAL,ARI FRIEDENBACH,ARI FRIEDENBACH,SUPLENTE,PPS,PSDB/DEM/PPS,2
RANCHARIA,DEPUTADO FEDERAL,JOSE ONERIO,JOSE ONERIO DA SILVA,SUPLENTE,PPS,PSDB/DEM/PPS,11
RANCHARIA,DEPUTADO FEDERAL,ARNALDO JARDIM,ARNALDO CALIL PEREIRA JARDIM,ELEITO,PPS,PSDB/DEM/PPS,4
RANCHARIA,DEPUTADO FEDERAL,JORGE TADEU,JORGE TADEU MUDALEN,ELEITO,DEM,PSDB/DEM/PPS,26
RANCHARIA,DEPUTADO FEDERAL,SAMPAIO,ANTONIO SAMPAIO TEIXEIRA,SUPLENTE,DEM,PSDB/DEM/PPS,2
RANCHARIA,DEPUTADO FEDERAL,JORGINHO MALULY,JORGE DE FARIA MALULY,SUPLENTE,DEM,PSDB/DEM/PPS,208
RANCHARIA,DEPUTADO FEDERAL,ALEXANDRE LEITE,ALEXANDRE LEITE DA SILVA,MÉDIA,DEM,PSDB/DEM/PPS,446
RANCHARIA,DEPUTADO FEDERAL,PROFESSOR BENJAMIN,BENJAMIN RIBEIRO DA SILVA,SUPLENTE,DEM,PSDB/DEM/PPS,1776
RANCHARIA,DEPUTADO FEDERAL,KIKO DO KLB,FRANCO FINATO SCORNAVACCA,SUPLENTE,DEM,PSDB/DEM/PPS,9
RANCHARIA,DEPUTADO FEDERAL,CRESPO,JOSE ANTONIO CALDINI CRESPO,SUPLENTE,DEM,PSDB/DEM/PPS,1
RANCHARIA,DEPUTADO FEDERAL,RODRIGO GARCIA,RODRIGO GARCIA,ELEITO,DEM,PSDB/DEM/PPS,36
RANCHARIA,DEPUTADO FEDERAL,ZULAIÊ COBRA,ZULAIE COBRA RIBEIRO,SUPLENTE,DEM,PSDB/DEM/PPS,13
RANCHARIA,DEPUTADO FEDERAL,RAUL GIL JR,RAUL GIL JUNIOR,SUPLENTE,DEM,PSDB/DEM/PPS,7
RANCHARIA,DEPUTADO FEDERAL,CHICO PELUCIO,FRANCISCO PELUCIO,SUPLENTE,DEM,PSDB/DEM/PPS,4
RANCHARIA,DEPUTADO FEDERAL,JUNJI ABE,JUNJI ABE,ELEITO,DEM,PSDB/DEM/PPS,32
RANCHARIA,DEPUTADO FEDERAL,SALIM REIS,ANTONIO CARLOS DOS REIS,SUPLENTE,DEM,PSDB/DEM/PPS,1
RANCHARIA,DEPUTADO FEDERAL,ODECIO BRAGA,ODECIO BRAGA DE LOUREDO FILHO,SUPLENTE,DEM,PSDB/DEM/PPS,1
RANCHARIA,DEPUTADO FEDERAL,HIRAM JR,HIRAM AYRES MONTEIRO JUNIOR,SUPLENTE,DEM,PSDB/DEM/PPS,1
RANCHARIA,DEPUTADO FEDERAL,ELI CORREA FILHO,ADRIANO ELI CORREA,ELEITO,DEM,PSDB/DEM/PPS,13
RANCHARIA,DEPUTADO FEDERAL,DR ELEUSES PAIVA,ELEUSES VIEIRA DE PAIVA,SUPLENTE,DEM,PSDB/DEM/PPS,3667
RANCHARIA,DEPUTADO FEDERAL,WALTER IHOSHI,WALTER SHINDI IIHOSHI,SUPLENTE,DEM,PSDB/DEM/PPS,62
RANCHARIA,DEPUTADO FEDERAL,DONIZETI,BENEDITO DONIZETI ALVES,SUPLENTE,PHS,HUMANISTA CRISTÃO ,1
RANCHARIA,DEPUTADO FEDERAL,MIGUEL SILVA,MIGUEL BERTO DA SILVA,SUPLENTE,PHS,HUMANISTA CRISTÃO ,1
RANCHARIA,DEPUTADO FEDERAL,DENNYS SERRANO,DENNYS HADDAD SERRANO,SUPLENTE,PSB,PRESTE ATENÇÃO SÃO PAULO,1
RANCHARIA,DEPUTADO FEDERAL,EDSON PENNA,EDSON PENNA FRANCISCO,SUPLENTE,PSB,PRESTE ATENÇÃO SÃO PAULO,1
RANCHARIA,DEPUTADO FEDERAL,MARCELINHO CARIOCA,MARCELO PEREIRA SURCIN,SUPLENTE,PSB,PRESTE ATENÇÃO SÃO PAULO,23
RANCHARIA,DEPUTADO FEDERAL,ELISEU GABRIEL,ELISEU GABRIEL DE PIERI,SUPLENTE,PSB,PRESTE ATENÇÃO SÃO PAULO,11
RANCHARIA,DEPUTADO FEDERAL,DR. ANTONIO BUSSOLETTI,ANTONIO GOTARDI BUSSOLETTI,SUPLENTE,PSB,PRESTE ATENÇÃO SÃO PAULO,1
RANCHARIA,DEPUTADO FEDERAL,ADÃO LIMA,ADÃO TIMÓTEO DE LIMA,SUPLENTE,PSB,PRESTE ATENÇÃO SÃO PAULO,33
RANCHARIA,DEPUTADO FEDERAL,CAPITÃO AUGUSTO,JOSÉ AUGUSTO ROSA,SUPLENTE,PSB,PRESTE ATENÇÃO SÃO PAULO,42
RANCHARIA,DEPUTADO FEDERAL,LUIZA ERUNDINA,LUIZA ERUNDINA DE SOUSA,ELEITO,PSB,PRESTE ATENÇÃO SÃO PAULO,7
RANCHARIA,DEPUTADO FEDERAL,CHINELO,JOSÉ AVELINO PEREIRA,SUPLENTE,PSB,PRESTE ATENÇÃO SÃO PAULO,1
RANCHARIA,DEPUTADO FEDERAL,GABRIEL CHALITA,GABRIEL BENEDITO ISSAAC CHALITA,ELEITO,PSB,PRESTE ATENÇÃO SÃO PAULO,204
RANCHARIA,DEPUTADO FEDERAL,MÁRCIO FRANÇA,MÁRCIO LUIZ FRANÇA GOMES,ELEITO,PSB,PRESTE ATENÇÃO SÃO PAULO,6
RANCHARIA,DEPUTADO FEDERAL,DR. ALEXANDRE,ALEXANDRE SÉRGIO DE OLIVEIRA AZOUBEL,SUPLENTE,PSB,PRESTE ATENÇÃO SÃO PAULO,5
RANCHARIA,DEPUTADO FEDERAL,JOSÉ LEAL,JOSÉ MARTINS LEAL,SUPLENTE,PSB,PRESTE ATENÇÃO SÃO PAULO,2
RANCHARIA,DEPUTADO FEDERAL,CIDÃO EVANGELISTA,APARECIDO LOURENÇO,SUPLENTE,PSB,PRESTE ATENÇÃO SÃO PAULO,1
RANCHARIA,DEPUTADO FEDERAL,TONINHO GARMS,ANTONIO CARLOS GARMS,SUPLENTE,PSB,PRESTE ATENÇÃO SÃO PAULO,1
RANCHARIA,DEPUTADO FEDERAL,DRA. ELAINE,ELAINE APARECIDA BELLONI ABISSAMRA,SUPLENTE,PSB,PRESTE ATENÇÃO SÃO PAULO,2
RANCHARIA,DEPUTADO FEDERAL,ABELARDO CAMARINHA,JOSE ABELARDO GUIMARAES CAMARINHA,MÉDIA,PSB,PRESTE ATENÇÃO SÃO PAULO,320
RANCHARIA,DEPUTADO FEDERAL,MÍRIAM MARTINS,EDNÉIA MIRIAM PEDRO,SUPLENTE,PSB,PRESTE ATENÇÃO SÃO PAULO,1
RANCHARIA,DEPUTADO FEDERAL,JEFFERSON CAMPOS,JEFFERSON ALVES DE CAMPOS,ELEITO,PSB,PRESTE ATENÇÃO SÃO PAULO,680
RANCHARIA,DEPUTADO FEDERAL,GRAÇA,MARIA DAS GRAÇAS GONÇALVES OLIVEIRA,SUPLENTE,PSB,PRESTE ATENÇÃO SÃO PAULO,1
RANCHARIA,DEPUTADO FEDERAL,GETÚLIO DUARTE,GETÚLIO DUARTE FERREIRA,SUPLENTE,PSB,PRESTE ATENÇÃO SÃO PAULO,13
RANCHARIA,DEPUTADO FEDERAL,NEIDE TAMEIRÃO,NEIDE APARECIDA TAMEIRÃO COSER,SUPLENTE,PSB,PRESTE ATENÇÃO SÃO PAULO,3
RANCHARIA,DEPUTADO FEDERAL,DR. UBIALI,MARCO AURÉLIO UBIALI,SUPLENTE,PSB,PRESTE ATENÇÃO SÃO PAULO,27
RANCHARIA,DEPUTADO FEDERAL,ZÉ AMIGUINHO,JOSÉ WANDERLEY DE ANDRADE,SUPLENTE,PSB,PRESTE ATENÇÃO SÃO PAULO,1
RANCHARIA,DEPUTADO FEDERAL,DANILO DE SAÚDE,DANILO AUGUSTO BIGESCHI,SUPLENTE,PSB,PRESTE ATENÇÃO SÃO PAULO,3
RANCHARIA,DEPUTADO FEDERAL,OTA,IOLANDA KEIKO MIASHIRO OTA,ELEITO,PSB,PRESTE ATENÇÃO SÃO PAULO,3
RANCHARIA,DEPUTADO FEDERAL,GUILHERME MUSSI,GUILHERME MUSSI FERREIRA,ELEITO,PV,PARTIDO VERDE,11
RANCHARIA,DEPUTADO FEDERAL,GILBERTO ABREU,GILBERTO ANDRADE DE ABREU,SUPLENTE,PV,PARTIDO VERDE,9
RANCHARIA,DEPUTADO FEDERAL,DR. NEVTON OLIVEIRA ROCHA,NEVTON OLIVEIRA ROCHA,SUPLENTE,PV,PARTIDO VERDE,4
RANCHARIA,DEPUTADO FEDERAL,DR TALMIR,TALMIR RODRIGUES,SUPLENTE,PV,PARTIDO VERDE,140
RANCHARIA,DEPUTADO FEDERAL,DANIEL MARINS,DANIEL MARINS ALESSI,SUPLENTE,PV,PARTIDO VERDE,1
RANCHARIA,DEPUTADO FEDERAL,JULIO CASTILHO,JULIO CESAR CASTILHO,SUPLENTE,PV,PARTIDO VERDE,16
RANCHARIA,DEPUTADO FEDERAL,ROBERTO SANTIAGO,JOSE ROBERTO SANTIAGO GOMES,ELEITO,PV,PARTIDO VERDE,5
RANCHARIA,DEPUTADO FEDERAL,CHICO SANTA RITA,FRANCISCO JOSE DE SANTA RITA BEHR,SUPLENTE,PV,PARTIDO VERDE,1
RANCHARIA,DEPUTADO FEDERAL,JOVINO CÂNDIDO,JOVINO CÂNDIDO DA SILVA,SUPLENTE,PV,PARTIDO VERDE,1
RANCHARIA,DEPUTADO FEDERAL,ANA PAULA JUNQUEIRA,ANA PAULA GUIMARAES DE AZEVEDO JUNQUEIRA,SUPLENTE,PV,PARTIDO VERDE,3
RANCHARIA,DEPUTADO FEDERAL,MARINO BONACCHI,MARINO MARTINI BONACCHI,SUPLENTE,PV,PARTIDO VERDE,1
RANCHARIA,DEPUTADO FEDERAL,EVANDRO GUSSI,EVANDRO HERRERA BERTONE GUSSI,SUPLENTE,PV,PARTIDO VERDE,167
RANCHARIA,DEPUTADO FEDERAL,MARCELO ORTIZ,FRANCISCO MARCELO ORTIZ FILHO,SUPLENTE,PV,PARTIDO VERDE,1
RANCHARIA,DEPUTADO FEDERAL,PENNA,JOSÉ LUIZ DE FRANÇA PENNA,ELEITO,PV,PARTIDO VERDE,5
RANCHARIA,DEPUTADO FEDERAL,ROBERTO DE LUCENA,ROBERTO ALVES DE LUCENA,ELEITO,PV,PARTIDO VERDE,19
RANCHARIA,DEPUTADO FEDERAL,DR. ÂNGELO,ANGELO DOMINGOS NUCCI,SUPLENTE,PV,PARTIDO VERDE,4
RANCHARIA,DEPUTADO FEDERAL,NATAN SOIHET,NATAN SOIHET,SUPLENTE,PV,PARTIDO VERDE,1
RANCHARIA,DEPUTADO FEDERAL,JOSÉ ALEXANDRE RIBEIRO,JOSE ALEXANDRE RIBEIRO,SUPLENTE,PV,PARTIDO VERDE,1
RANCHARIA,DEPUTADO FEDERAL,J FARIA,JOSE JESUS APARECIDO DE FARIA,SUPLENTE,PV,PARTIDO VERDE,2
RANCHARIA,DEPUTADO FEDERAL,DONIZETI PEREIRA,APARECIDO DONIZETI PEREIRA,SUPLENTE,PV,PARTIDO VERDE,1
RANCHARIA,DEPUTADO FEDERAL,CARLINHOS SILVA,ANTONIO CARLOS ALVES DA SILVA,SUPLENTE,PV,PARTIDO VERDE,30
RANCHARIA,DEPUTADO FEDERAL,RICARDO IZAR,RICARDO IZAR JUNIOR,ELEITO,PV,PARTIDO VERDE,6
RANCHARIA,DEPUTADO FEDERAL,LUIZA ELUF,LUIZA NAGIB ELUF,SUPLENTE,PV,PARTIDO VERDE,4
RANCHARIA,DEPUTADO FEDERAL,VILSON ALVES,VILSON OSCHIN ALVES,SUPLENTE,PV,PARTIDO VERDE,1
RANCHARIA,DEPUTADO FEDERAL,AMAURY CAMARGO MONICO,AMAURY CAMARGO MONACO,SUPLENTE,PV,PARTIDO VERDE,1
RANCHARIA,DEPUTADO FEDERAL,EDUARDO PALHARES,EDUARDO SANTOS PALHARES,SUPLENTE,PV,PARTIDO VERDE,6
RANCHARIA,DEPUTADO FEDERAL,CARLOS SAMPAIO,CARLOS HENRIQUE FOCESI SAMPAIO,ELEITO,PSDB,PSDB/DEM/PPS,2
RANCHARIA,DEPUTADO FEDERAL,POPPI,JOÃO HENRIQUE GONÇALVES MARCICANO POPPI,SUPLENTE,PSDB,PSDB/DEM/PPS,1
RANCHARIA,DEPUTADO FEDERAL,STANGARLINI,JOSE CARLOS STANGARLINI,SUPLENTE,PSDB,PSDB/DEM/PPS,6
RANCHARIA,DEPUTADO FEDERAL,RAUL CHRISTIANO,RAUL CHRISTIANO DE OLIVEIRA SANCHEZ,SUPLENTE,PSDB,PSDB/DEM/PPS,6
RANCHARIA,DEPUTADO FEDERAL,LOBBE NETO,ANTONIO ADOLPHO LOBBE NETO,SUPLENTE,PSDB,PSDB/DEM/PPS,75
RANCHARIA,DEPUTADO FEDERAL,FELICIDADE,FELICIDADE LOPES PONTES,SUPLENTE,PSDB,PSDB/DEM/PPS,3
RANCHARIA,DEPUTADO FEDERAL,MANOEL MARCOS (MANÉ),MANOEL MARCOS DE JESUS FERREIRA,SUPLENTE,PSDB,PSDB/DEM/PPS,5
RANCHARIA,DEPUTADO FEDERAL,EMANUEL FERNANDES,EMANUEL FERNANDES,ELEITO,PSDB,PSDB/DEM/PPS,8
RANCHARIA,DEPUTADO FEDERAL,MARA GABRILLI,MARA CRISTINA GABRILLI,ELEITO,PSDB,PSDB/DEM/PPS,6
RANCHARIA,DEPUTADO FEDERAL,LELIS DA ROCHA,LELIS DA ROCHA,SUPLENTE,PSDB,PSDB/DEM/PPS,1
RANCHARIA,DEPUTADO FEDERAL,CARLOS ROBERTO,CARLOS ROBERTO DE CAMPOS,SUPLENTE,PSDB,PSDB/DEM/PPS,5
RANCHARIA,DEPUTADO FEDERAL,DIB,WILLIAM DIB,ELEITO,PSDB,PSDB/DEM/PPS,7
RANCHARIA,DEPUTADO FEDERAL,ALBERTO MOURAO,ALBERTO PEREIRA MOURAO,SUPLENTE,PSDB,PSDB/DEM/PPS,3
RANCHARIA,DEPUTADO FEDERAL,DR ANDRE SACCO,ANDRE SACCO JUNIOR,SUPLENTE,PSDB,PSDB/DEM/PPS,1
RANCHARIA,DEPUTADO FEDERAL,SILVIO TORRES,SILVIO FRANÇA TORRES,SUPLENTE,PSDB,PSDB/DEM/PPS,698
RANCHARIA,DEPUTADO FEDERAL,TIRSO MEIRELLES,TIRSO DE SALLES MEIRELLES,SUPLENTE,PSDB,PSDB/DEM/PPS,37
RANCHARIA,DEPUTADO FEDERAL,EDSON APARECIDO,EDSON APARECIDO DOS SANTOS,ELEITO,PSDB,PSDB/DEM/PPS,400
RANCHARIA,DEPUTADO FEDERAL,RICARDO MONTORO,JOSE RICARDO FRANCO MONTORO,SUPLENTE,PSDB,PSDB/DEM/PPS,7
RANCHARIA,DEPUTADO FEDERAL,DR. MARCELO,MARCELO CHEHADE,SUPLENTE,PSDB,PSDB/DEM/PPS,2
RANCHARIA,DEPUTADO FEDERAL,VANDERLEI MACRIS,VANDERLEI MACRIS,SUPLENTE,PSDB,PSDB/DEM/PPS,4
RANCHARIA,DEPUTADO FEDERAL,DUARTE NOGUEIRA,ANTONIO DUARTE NOGUEIRA JUNIOR,ELEITO,PSDB,PSDB/DEM/PPS,15
RANCHARIA,DEPUTADO FEDERAL,RAFAEL ABUD,RAFAEL ANGELO ABUD,SUPLENTE,PSDB,PSDB/DEM/PPS,1
RANCHARIA,DEPUTADO FEDERAL,TRIPOLI,JOSÉ RICARDO ALVARENGA TRIPOLI,ELEITO,PSDB,PSDB/DEM/PPS,4
RANCHARIA,DEPUTADO FEDERAL,FERNANDO FUAD CHUCRE,FERNANDO BARRANCOS CHUCRE,SUPLENTE,PSDB,PSDB/DEM/PPS,5
RANCHARIA,DEPUTADO FEDERAL,VAZ DE LIMA,JOSÉ CARLOS VAZ DE LIMA,ELEITO,PSDB,PSDB/DEM/PPS,172
RANCHARIA,DEPUTADO FEDERAL,WALTER FELDMAN,WALTER MEYER FELDMAN,SUPLENTE,PSDB,PSDB/DEM/PPS,6
RANCHARIA,DEPUTADO FEDERAL,THAME,ANTONIO CARLOS DE MENDES THAME,ELEITO,PSDB,PSDB/DEM/PPS,13
RANCHARIA,DEPUTADO FEDERAL,ARNALDO MADEIRA,ARNALDO DE ABREU MADEIRA,SUPLENTE,PSDB,PSDB/DEM/PPS,1
RANCHARIA,DEPUTADO FEDERAL,BRUNA FURLAN,BRUNA DIAS FURLAN,ELEITO,PSDB,PSDB/DEM/PPS,4
RANCHARIA,DEPUTADO FEDERAL,JOSÉ ANIBAL,JOSÉ ANIBAL PERES DE PONTES,ELEITO,PSDB,PSDB/DEM/PPS,94
RANCHARIA,DEPUTADO FEDERAL,NELSON BUGALHO,NELSON ROBERTO BUGALHO,SUPLENTE,PSDB,PSDB/DEM/PPS,381
RANCHARIA,DEPUTADO FEDERAL,FABIO DO PSOL,FABIO ANTONIO FERREIRA DA SILVA,SUPLENTE,PSOL,PARTIDO SOCIALISMO E LIBERDADE,1
RANCHARIA,DEPUTADO FEDERAL,IVAN VALENTE,IVAN VALENTE,ELEITO,PSOL,PARTIDO SOCIALISMO E LIBERDADE,41
RANCHARIA,DEPUTADO FEDERAL,RICARDO ALVAREZ,RICARDO ALVAREZ,SUPLENTE,PSOL,PARTIDO SOCIALISMO E LIBERDADE,1
