INDIAPORÃ,PRESIDENTE,DILMA,DILMA VANA ROUSSEFF,2º TURNO,PT,PARA O BRASIL SEGUIR MUDANDO,1129
INDIAPORÃ,PRESIDENTE,JOSÉ SERRA,JOSÉ SERRA,2º TURNO,PSDB,O BRASIL PODE MAIS,974
INDIAPORÃ,GOVERNADOR,GERALDO ALCKMIN,GERALDO JOSE RODRIGUES ALCKMIN FILHO,ELEITO,PSDB,UNIDOS POR SÃO PAULO,1243
INDIAPORÃ,SENADOR,MARTA SUPLICY,MARTA SUPLICY,ELEITO,PT,UNIÃO PARA MUDAR,807
INDIAPORÃ,SENADOR,ALOYSIO NUNES,ALOYSIO NUNES FERREIRA FILHO,ELEITO,PSDB,UNIDOS POR SÃO PAULO,1346
INDIAPORÃ,DEPUTADO FEDERAL,ANTONIO BULHÕES,ANTONIO CARLOS MARTINS DE BULHÕES,ELEITO,PRB,JUNTOS POR SÃO PAULO,8
INDIAPORÃ,DEPUTADO FEDERAL,MALUF,PAULO SALIM MALUF,ELEITO,PP,PARTIDO PROGRESSISTA,1
INDIAPORÃ,DEPUTADO FEDERAL,CARLOS OCTAVIANI,JOSÉ CARLOS OCTAVIANI,SUPLENTE,PP,PARTIDO PROGRESSISTA,1
INDIAPORÃ,DEPUTADO FEDERAL,BATORÉ,IVANILDO GOMES NOGUEIRA,SUPLENTE,PP,PARTIDO PROGRESSISTA,1
INDIAPORÃ,DEPUTADO FEDERAL,MANOEL MOREIRA,MANOEL MOREIRA DE ARAUJO FILHO,SUPLENTE,PP,PARTIDO PROGRESSISTA,1
INDIAPORÃ,DEPUTADO FEDERAL,LIBERATO DE VALENTIM GENTIL,LIBERATO ROCHA CALDEIRA,SUPLENTE,PP,PARTIDO PROGRESSISTA,22
INDIAPORÃ,DEPUTADO FEDERAL,LAURINDO BARNARDES,LAURINDO BERNARDES DE SOUZA,SUPLENTE,PP,PARTIDO PROGRESSISTA,60
INDIAPORÃ,DEPUTADO FEDERAL,ALINE CORREA,ALINE LEMOS CORREA DE OLIVEIRA ANDRADE,ELEITO,PP,PARTIDO PROGRESSISTA,2
INDIAPORÃ,DEPUTADO FEDERAL,BETO MANSUR,PAULO ROBERTO GOMES MANSUR,ELEITO,PP,PARTIDO PROGRESSISTA,3
INDIAPORÃ,DEPUTADO FEDERAL,MOURAD,MOHAMAD SAID MOURAD,SUPLENTE,PP,PARTIDO PROGRESSISTA,1
INDIAPORÃ,DEPUTADO FEDERAL,MISSIONÁRIO JOSÉ OLIMPIO,JOSÉ OLIMPIO SILVEIRA MORAES,ELEITO,PP,PARTIDO PROGRESSISTA,28
INDIAPORÃ,DEPUTADO FEDERAL,VADÃO,ETIVALDO VADAO GOMES,SUPLENTE,PP,PARTIDO PROGRESSISTA,171
INDIAPORÃ,DEPUTADO FEDERAL,JOÃO DADO,JOÃO EDUARDO DADO LEITE DE CARVALHO,ELEITO,PDT,PARTIDO DEMOCRÁTICO TRABALHISTA,264
INDIAPORÃ,DEPUTADO FEDERAL,PAULINHO DA FORÇA,PAULO PEREIRA DA SILVA,ELEITO,PDT,PARTIDO DEMOCRÁTICO TRABALHISTA,1
INDIAPORÃ,DEPUTADO FEDERAL,GILBERTO BENZI,GILBERTO BENZI,SUPLENTE,PDT,PARTIDO DEMOCRÁTICO TRABALHISTA,9
INDIAPORÃ,DEPUTADO FEDERAL,DR LUIZ CHIAPARINE,LUIZ CARLOS CHIAPARINE,SUPLENTE,PDT,PARTIDO DEMOCRÁTICO TRABALHISTA,3
INDIAPORÃ,DEPUTADO FEDERAL,MANOEL ANTUNES,MANOEL ANTUNES,SUPLENTE,PDT,PARTIDO DEMOCRÁTICO TRABALHISTA,9
INDIAPORÃ,DEPUTADO FEDERAL,SALVADOR ZIMBALDI,SALVADOR ZIMBALDI FILHO,MÉDIA,PDT,PARTIDO DEMOCRÁTICO TRABALHISTA,4
INDIAPORÃ,DEPUTADO FEDERAL,VALDEVAN NOVENTA,JOSE VALDEVAM DE JESUS SANTOS,SUPLENTE,PDT,PARTIDO DEMOCRÁTICO TRABALHISTA,1
INDIAPORÃ,DEPUTADO FEDERAL,IVANIO BATISTA,IVANIO BATISTA DA SILVA,SUPLENTE,PT,JUNTOS POR SÃO PAULO,1
INDIAPORÃ,DEPUTADO FEDERAL,IARA BERNARDI,IARA BERNARDI,SUPLENTE,PT,JUNTOS POR SÃO PAULO,2
INDIAPORÃ,DEPUTADO FEDERAL,LARGUESA,LUIS VANDERLEI LARGUESA,SUPLENTE,PT,JUNTOS POR SÃO PAULO,1
INDIAPORÃ,DEPUTADO FEDERAL,VACCAREZZA,CANDIDO ELPIDIO DE SOUZA VACCAREZZA,ELEITO,PT,JUNTOS POR SÃO PAULO,2
INDIAPORÃ,DEPUTADO FEDERAL,GENOINO,JOSÉ GENOÍNO NETO,SUPLENTE,PT,JUNTOS POR SÃO PAULO,4
INDIAPORÃ,DEPUTADO FEDERAL,FILIPPI,JOSÉ DE FILIPPI JÚNIOR,ELEITO,PT,JUNTOS POR SÃO PAULO,1
INDIAPORÃ,DEPUTADO FEDERAL,ARLINDO CHINAGLIA,ARLINDO CHIGNALIA JUNIOR,ELEITO,PT,JUNTOS POR SÃO PAULO,21
INDIAPORÃ,DEPUTADO FEDERAL,JOÃO PAULO CUNHA,JOÃO PAULO CUNHA,ELEITO,PT,JUNTOS POR SÃO PAULO,1
INDIAPORÃ,DEPUTADO FEDERAL,RICARDO BERZOINI,RICARDO JOSE RIBEIRO BERZOINI,ELEITO,PT,JUNTOS POR SÃO PAULO,3
INDIAPORÃ,DEPUTADO FEDERAL,JOSÉ MENTOR,JOSÉ MENTOR GUILHERME DE MELLO NETTO,ELEITO,PT,JUNTOS POR SÃO PAULO,68
INDIAPORÃ,DEPUTADO FEDERAL,PROF. CARLÃO RAMIRO,CARLOS RAMIRO CASTRO,SUPLENTE,PT,JUNTOS POR SÃO PAULO,3
INDIAPORÃ,DEPUTADO FEDERAL,VANDERLEI SIRAQUE,VANDERLEI SIRAQUE,SUPLENTE,PT,JUNTOS POR SÃO PAULO,1
INDIAPORÃ,DEPUTADO FEDERAL,REGINALDO PERNAMBUCANO,REGINALDO CARNEIRO DE MOURA,SUPLENTE,PT,JUNTOS POR SÃO PAULO,5
INDIAPORÃ,DEPUTADO FEDERAL,DEVANIR RIBEIRO,DEVANIR RIBEIRO,ELEITO,PT,JUNTOS POR SÃO PAULO,53
INDIAPORÃ,DEPUTADO FEDERAL,MARIA LUCIA PRANDI,MARIA LUCIA PRANDI GOMES,SUPLENTE,PT,JUNTOS POR SÃO PAULO,1
INDIAPORÃ,DEPUTADO FEDERAL,VICENTINHO,VICENTE PAULO DA SILVA,ELEITO,PT,JUNTOS POR SÃO PAULO,125
INDIAPORÃ,DEPUTADO FEDERAL,SANTANA,JOSE SANTANA DE ABREU,SUPLENTE,PTB,PARTIDO TRABALHISTA BRASILEIRO,2
INDIAPORÃ,DEPUTADO FEDERAL,SINVAL DORIGON,SINVAL ROBERTO DORIGON,SUPLENTE,PTB,PARTIDO TRABALHISTA BRASILEIRO,1
INDIAPORÃ,DEPUTADO FEDERAL,NELSON MARQUEZELLI,NELSON MARQUEZELLI,ELEITO,PTB,PARTIDO TRABALHISTA BRASILEIRO,79
INDIAPORÃ,DEPUTADO FEDERAL,CAJAI,ISRAEL MARQUES CAJAI,SUPLENTE,PTB,PARTIDO TRABALHISTA BRASILEIRO,1
INDIAPORÃ,DEPUTADO FEDERAL,FRANK AGUIAR,FRANCINETO LUZ DE AGUIAR,SUPLENTE,PTB,PARTIDO TRABALHISTA BRASILEIRO,3
INDIAPORÃ,DEPUTADO FEDERAL,DR ANDRE ROCHA,ANDRE LUIS ROCHA,SUPLENTE,PTB,PARTIDO TRABALHISTA BRASILEIRO,4
INDIAPORÃ,DEPUTADO FEDERAL,PAULINHO SOBRAL,PAULO MENDES SOBRAL,SUPLENTE,PMDB,PARTIDO DO MOVIMENTO DEMOCRÁTICO BRASILEIRO,1
INDIAPORÃ,DEPUTADO FEDERAL,EDUARDO COELHO,EDUARDO JOSÉ PEREIRA COELHO,SUPLENTE,PMDB,PARTIDO DO MOVIMENTO DEMOCRÁTICO BRASILEIRO,16
INDIAPORÃ,DEPUTADO FEDERAL,EDINHO ARAUJO,EDSON EDINHO COELHO ARAUJO,ELEITO,PMDB,PARTIDO DO MOVIMENTO DEMOCRÁTICO BRASILEIRO,36
INDIAPORÃ,DEPUTADO FEDERAL,LIMA JUNIOR,JULIO CEZAR DA SILVA LIMA JUNIOR,SUPLENTE,PMDB,PARTIDO DO MOVIMENTO DEMOCRÁTICO BRASILEIRO,1
INDIAPORÃ,DEPUTADO FEDERAL,DANIEL CALDEIRA,DANIEL CALDEIRA MATEUS,SUPLENTE,PSL,PRESTE ATENÇÃO SÃO PAULO,3
INDIAPORÃ,DEPUTADO FEDERAL,MARCO FELICIANO,MARCO ANTONIO FELICIANO,ELEITO,PSC,HUMANISTA CRISTÃO ,2
INDIAPORÃ,DEPUTADO FEDERAL,MARCELO AGUIAR,MARCELO THEODORO DE AGUIAR,ELEITO,PSC,HUMANISTA CRISTÃO ,1
INDIAPORÃ,DEPUTADO FEDERAL,REGIS DE OLIVEIRA,REGIS FERNANDES DE OLIVEIRA,SUPLENTE,PSC,HUMANISTA CRISTÃO ,7
INDIAPORÃ,DEPUTADO FEDERAL,DALVAN,JOÃO GOMES DE ALMEIDA,SUPLENTE,PSC,HUMANISTA CRISTÃO ,1
INDIAPORÃ,DEPUTADO FEDERAL,PRICILA LEME,PRICILA HELENA MOYSES LEME,SUPLENTE,PSC,HUMANISTA CRISTÃO ,1
INDIAPORÃ,DEPUTADO FEDERAL,TIRIRICA,FRANCISCO EVERARDO OLIVEIRA SILVA,ELEITO,PR,JUNTOS POR SÃO PAULO,20
INDIAPORÃ,DEPUTADO FEDERAL,PR PAULO FREIRE,PAULO ROBERTO FREIRE DA COSTA,ELEITO,PR,JUNTOS POR SÃO PAULO,21
INDIAPORÃ,DEPUTADO FEDERAL,DIMAS RAMALHO,DIMAS EDUARDO RAMALHO,ELEITO,PPS,PSDB/DEM/PPS,8
INDIAPORÃ,DEPUTADO FEDERAL,JOSE ONERIO,JOSE ONERIO DA SILVA,SUPLENTE,PPS,PSDB/DEM/PPS,1
INDIAPORÃ,DEPUTADO FEDERAL,ARNALDO JARDIM,ARNALDO CALIL PEREIRA JARDIM,ELEITO,PPS,PSDB/DEM/PPS,23
INDIAPORÃ,DEPUTADO FEDERAL,JORGE TADEU,JORGE TADEU MUDALEN,ELEITO,DEM,PSDB/DEM/PPS,11
INDIAPORÃ,DEPUTADO FEDERAL,ALEXANDRE LEITE,ALEXANDRE LEITE DA SILVA,MÉDIA,DEM,PSDB/DEM/PPS,1
INDIAPORÃ,DEPUTADO FEDERAL,PROFESSOR BENJAMIN,BENJAMIN RIBEIRO DA SILVA,SUPLENTE,DEM,PSDB/DEM/PPS,1
INDIAPORÃ,DEPUTADO FEDERAL,KIKO DO KLB,FRANCO FINATO SCORNAVACCA,SUPLENTE,DEM,PSDB/DEM/PPS,1
INDIAPORÃ,DEPUTADO FEDERAL,RODRIGO GARCIA,RODRIGO GARCIA,ELEITO,DEM,PSDB/DEM/PPS,153
INDIAPORÃ,DEPUTADO FEDERAL,DR ELEUSES PAIVA,ELEUSES VIEIRA DE PAIVA,SUPLENTE,DEM,PSDB/DEM/PPS,41
INDIAPORÃ,DEPUTADO FEDERAL,CAPITÃO AUGUSTO,JOSÉ AUGUSTO ROSA,SUPLENTE,PSB,PRESTE ATENÇÃO SÃO PAULO,2
INDIAPORÃ,DEPUTADO FEDERAL,LUIZA ERUNDINA,LUIZA ERUNDINA DE SOUSA,ELEITO,PSB,PRESTE ATENÇÃO SÃO PAULO,3
INDIAPORÃ,DEPUTADO FEDERAL,GABRIEL CHALITA,GABRIEL BENEDITO ISSAAC CHALITA,ELEITO,PSB,PRESTE ATENÇÃO SÃO PAULO,13
INDIAPORÃ,DEPUTADO FEDERAL,CIDÃO EVANGELISTA,APARECIDO LOURENÇO,SUPLENTE,PSB,PRESTE ATENÇÃO SÃO PAULO,1
INDIAPORÃ,DEPUTADO FEDERAL,DR. UBIALI,MARCO AURÉLIO UBIALI,SUPLENTE,PSB,PRESTE ATENÇÃO SÃO PAULO,4
INDIAPORÃ,DEPUTADO FEDERAL,GUILHERME MUSSI,GUILHERME MUSSI FERREIRA,ELEITO,PV,PARTIDO VERDE,3
INDIAPORÃ,DEPUTADO FEDERAL,EDNA MARTINS,EDNA SANDRA MARTINS,SUPLENTE,PV,PARTIDO VERDE,1
INDIAPORÃ,DEPUTADO FEDERAL,DR. SINVAL MALHEIROS,SINVAL MALHEIROS PINTO JÚNIOR,SUPLENTE,PV,PARTIDO VERDE,18
INDIAPORÃ,DEPUTADO FEDERAL,HELIVANE BOTELHO DA SILVEIRA,HELIVANE MARIA BOTELHO DA SILVEIRA MORAES,SUPLENTE,PV,PARTIDO VERDE,1
INDIAPORÃ,DEPUTADO FEDERAL,EVANDRO GUSSI,EVANDRO HERRERA BERTONE GUSSI,SUPLENTE,PV,PARTIDO VERDE,1
INDIAPORÃ,DEPUTADO FEDERAL,J FARIA,JOSE JESUS APARECIDO DE FARIA,SUPLENTE,PV,PARTIDO VERDE,3
INDIAPORÃ,DEPUTADO FEDERAL,RICARDO IZAR,RICARDO IZAR JUNIOR,ELEITO,PV,PARTIDO VERDE,1
INDIAPORÃ,DEPUTADO FEDERAL,REGINA LAURA,REGINA LAURA DE MORAIS SANTOS E MARINHO DE FARIA,SUPLENTE,PV,PARTIDO VERDE,1
INDIAPORÃ,DEPUTADO FEDERAL,CARLOS SAMPAIO,CARLOS HENRIQUE FOCESI SAMPAIO,ELEITO,PSDB,PSDB/DEM/PPS,2
INDIAPORÃ,DEPUTADO FEDERAL,POPPI,JOÃO HENRIQUE GONÇALVES MARCICANO POPPI,SUPLENTE,PSDB,PSDB/DEM/PPS,3
INDIAPORÃ,DEPUTADO FEDERAL,MANOEL MARCOS (MANÉ),MANOEL MARCOS DE JESUS FERREIRA,SUPLENTE,PSDB,PSDB/DEM/PPS,1
INDIAPORÃ,DEPUTADO FEDERAL,EMANUEL FERNANDES,EMANUEL FERNANDES,ELEITO,PSDB,PSDB/DEM/PPS,4
INDIAPORÃ,DEPUTADO FEDERAL,SILVIO TORRES,SILVIO FRANÇA TORRES,SUPLENTE,PSDB,PSDB/DEM/PPS,4
INDIAPORÃ,DEPUTADO FEDERAL,TIRSO MEIRELLES,TIRSO DE SALLES MEIRELLES,SUPLENTE,PSDB,PSDB/DEM/PPS,4
INDIAPORÃ,DEPUTADO FEDERAL,EDSON APARECIDO,EDSON APARECIDO DOS SANTOS,ELEITO,PSDB,PSDB/DEM/PPS,16
INDIAPORÃ,DEPUTADO FEDERAL,JULIO SEMEGHINI,JULIO FRACISCO SEMEGHINI NETO,ELEITO,PSDB,PSDB/DEM/PPS,603
INDIAPORÃ,DEPUTADO FEDERAL,RAFAEL ABUD,RAFAEL ANGELO ABUD,SUPLENTE,PSDB,PSDB/DEM/PPS,1
INDIAPORÃ,DEPUTADO FEDERAL,TRIPOLI,JOSÉ RICARDO ALVARENGA TRIPOLI,ELEITO,PSDB,PSDB/DEM/PPS,1
INDIAPORÃ,DEPUTADO FEDERAL,VAZ DE LIMA,JOSÉ CARLOS VAZ DE LIMA,ELEITO,PSDB,PSDB/DEM/PPS,194
INDIAPORÃ,DEPUTADO FEDERAL,ALEMÃO DA SÁUDE,CLAUDEMIR SERENO,SUPLENTE,PSDB,PSDB/DEM/PPS,1
INDIAPORÃ,DEPUTADO FEDERAL,IVAN VALENTE,IVAN VALENTE,ELEITO,PSOL,PARTIDO SOCIALISMO E LIBERDADE,5
INDIAPORÃ,DEPUTADO FEDERAL,ALDO REBELO,JOSÉ ALDO REBELO FIGUEIREDO,ELEITO,PC DO B,JUNTOS POR SÃO PAULO,8
INDIAPORÃ,DEPUTADO FEDERAL,DELEGADO PROTÓGENES,PROTÓGENES PINHEIRO DE QUEIROZ,MÉDIA,PC DO B,JUNTOS POR SÃO PAULO,2
INDIAPORÃ,DEPUTADO ESTADUAL,SEBASTIÃO SANTOS,SEBASTIÃO DOS SANTOS FILHO,ELEITO,PRB,SOMOS MAIS SÃO PAULO,7
INDIAPORÃ,DEPUTADO ESTADUAL,RICARDO SARAVALLI,RICARDO SARAVALLI,SUPLENTE,PP,PARTIDO PROGRESSISTA,3
INDIAPORÃ,DEPUTADO ESTADUAL,VALDIR PINHEIRO,VALDIR PINHEIRO,SUPLENTE,PP,PARTIDO PROGRESSISTA,4
INDIAPORÃ,DEPUTADO ESTADUAL,CURIATI,ANTONIO SALIM CURIATI,ELEITO,PP,PARTIDO PROGRESSISTA,3
INDIAPORÃ,DEPUTADO ESTADUAL,DR. SERGIO CHEBEL,SERGIO CABRAL CHEBEL,SUPLENTE,PP,PARTIDO PROGRESSISTA,1
INDIAPORÃ,DEPUTADO ESTADUAL,RAFA ZIMBALDI,RAFAEL FERNANDO ZIMBALDI,SUPLENTE,PP,PARTIDO PROGRESSISTA,2
INDIAPORÃ,DEPUTADO ESTADUAL,AURELIO,AURELIO JOSE CLAUDIO,SUPLENTE,PDT,PARTIDO DEMOCRÁTICO TRABALHISTA,11
INDIAPORÃ,DEPUTADO ESTADUAL,MAJOR OLIMPIO,SERGIO OLIMPIO GOMES,ELEITO,PDT,PARTIDO DEMOCRÁTICO TRABALHISTA,1
INDIAPORÃ,DEPUTADO ESTADUAL,AMON VIOLEIRO,AMOMM HEBROM DA HORA DE DEUS SOUZA,SUPLENTE,PDT,PARTIDO DEMOCRÁTICO TRABALHISTA,1
INDIAPORÃ,DEPUTADO ESTADUAL,RAFAEL SILVA,RAFAEL ANTONIO DA SILVA,ELEITO,PDT,PARTIDO DEMOCRÁTICO TRABALHISTA,3
INDIAPORÃ,DEPUTADO ESTADUAL,CONSTANCIA FELIX,CONSTANCIA BERBERT DUTRA DA SILVA,SUPLENTE,PDT,PARTIDO DEMOCRÁTICO TRABALHISTA,3
INDIAPORÃ,DEPUTADO ESTADUAL,ANDERSON SILVA,ANDERSON DOMINGOS DA SILVA,SUPLENTE,PT,SOMOS MAIS SÃO PAULO,1
INDIAPORÃ,DEPUTADO ESTADUAL,TELMA DE SOUZA,TELMA SANDRA AUGUSTO DE SOUZA,ELEITO,PT,SOMOS MAIS SÃO PAULO,1
INDIAPORÃ,DEPUTADO ESTADUAL,ANA PERUGINI,ANA LUCIA LIPPAUS PERUGINI,ELEITO,PT,SOMOS MAIS SÃO PAULO,118
INDIAPORÃ,DEPUTADO ESTADUAL,TONINHO DO PT,ANTONIO AMARAL JUNIOR,SUPLENTE,PT,SOMOS MAIS SÃO PAULO,1
INDIAPORÃ,DEPUTADO ESTADUAL,ZICO,JOSÉ PRADO DE ANDRADE,MÉDIA,PT,SOMOS MAIS SÃO PAULO,66
INDIAPORÃ,DEPUTADO ESTADUAL,DR. LUIZINHO,LUIS CARLOS LAURINDO,SUPLENTE,PT,SOMOS MAIS SÃO PAULO,2
INDIAPORÃ,DEPUTADO ESTADUAL,ELI TEODORO,ELI TEODORO,SUPLENTE,PT,SOMOS MAIS SÃO PAULO,1
INDIAPORÃ,DEPUTADO ESTADUAL,DUDU BOLITO,AMARILDO DUDU BOLITO,SUPLENTE,PT,SOMOS MAIS SÃO PAULO,1
INDIAPORÃ,DEPUTADO ESTADUAL,LUIZ CLAUDIO MARCOLINO,LUIZ CLAUDIO MARCOLINO,ELEITO,PT,SOMOS MAIS SÃO PAULO,10
INDIAPORÃ,DEPUTADO ESTADUAL,ROBERTO FELICIO,ROBERTO FELICIO,SUPLENTE,PT,SOMOS MAIS SÃO PAULO,1
INDIAPORÃ,DEPUTADO ESTADUAL,BETH SAHAO,ELISABETH SAHÃO,SUPLENTE,PT,SOMOS MAIS SÃO PAULO,20
INDIAPORÃ,DEPUTADO ESTADUAL,ADINAN ORTOLAN,JOSÉ ADINAN ORTOLAN,SUPLENTE,PT,SOMOS MAIS SÃO PAULO,2
INDIAPORÃ,DEPUTADO ESTADUAL,ISAC REIS,ISAC FRANCO DOS REIS,ELEITO,PT,SOMOS MAIS SÃO PAULO,1
INDIAPORÃ,DEPUTADO ESTADUAL,JOÃO PAULO RILLO,JOÃO PAULO RILLO,ELEITO,PT,SOMOS MAIS SÃO PAULO,128
INDIAPORÃ,DEPUTADO ESTADUAL,TITO,FRANCISCO DE ASSIS PEREIRA DE CAMPOS,SUPLENTE,PT,SOMOS MAIS SÃO PAULO,3
INDIAPORÃ,DEPUTADO ESTADUAL,DONISETE BRAGA,DONISETE PEREIRA BRAGA,ELEITO,PT,SOMOS MAIS SÃO PAULO,1
INDIAPORÃ,DEPUTADO ESTADUAL,MARILIA,AMARILIA ISABEL VIEIRA,SUPLENTE,PTB,PARTIDO TRABALHISTA BRASILEIRO,1
INDIAPORÃ,DEPUTADO ESTADUAL,CAMPOS MACHADO,ANTONIO CARLOS DE CAMPOS MACHADO,ELEITO,PTB,PARTIDO TRABALHISTA BRASILEIRO,20
INDIAPORÃ,DEPUTADO ESTADUAL,CORONEL EDSON FERRARINI,EDSON FERRARINI,ELEITO,PTB,PARTIDO TRABALHISTA BRASILEIRO,1
INDIAPORÃ,DEPUTADO ESTADUAL,WALDIR AGNELLO,WALDIR AGNELLO,SUPLENTE,PTB,PARTIDO TRABALHISTA BRASILEIRO,138
INDIAPORÃ,DEPUTADO ESTADUAL,BENJAMIM,BENJAMIM DOS SANTOS CARVALHO,SUPLENTE,PTB,PARTIDO TRABALHISTA BRASILEIRO,1
INDIAPORÃ,DEPUTADO ESTADUAL,DRA ADRIANA,ADRIANA DI NARDO SILVA,SUPLENTE,PMDB,PARTIDO DO MOVIMENTO DEMOCRÁTICO BRASILEIRO,1
INDIAPORÃ,DEPUTADO ESTADUAL,THIAGO FERRARI,THIAGO DE MORAES FERRARI,SUPLENTE,PMDB,PARTIDO DO MOVIMENTO DEMOCRÁTICO BRASILEIRO,13
INDIAPORÃ,DEPUTADO ESTADUAL,CAMARGO,DOMINGOS FERREIRA DE CAMARGO,SUPLENTE,PMDB,PARTIDO DO MOVIMENTO DEMOCRÁTICO BRASILEIRO,2
INDIAPORÃ,DEPUTADO ESTADUAL,VALDOMIRO,VALDOMIRO FRANCISCO DE OLIVEIRA,SUPLENTE,PMDB,PARTIDO DO MOVIMENTO DEMOCRÁTICO BRASILEIRO,3
INDIAPORÃ,DEPUTADO ESTADUAL,UEBE REZECK,UEBE REZECK,SUPLENTE,PMDB,PARTIDO DO MOVIMENTO DEMOCRÁTICO BRASILEIRO,372
INDIAPORÃ,DEPUTADO ESTADUAL,ITAMAR BORGES,ITAMAR FRANCISCO MACHADO BORGES,MÉDIA,PMDB,PARTIDO DO MOVIMENTO DEMOCRÁTICO BRASILEIRO,28
INDIAPORÃ,DEPUTADO ESTADUAL,JOOJI HATO,JOOJI HATO,ELEITO,PMDB,PARTIDO DO MOVIMENTO DEMOCRÁTICO BRASILEIRO,1
INDIAPORÃ,DEPUTADO ESTADUAL,ANA PAULA ROSSI,ANA PAULA ROSSI DE ALMEIDA MAGDESIAN,SUPLENTE,PMDB,PARTIDO DO MOVIMENTO DEMOCRÁTICO BRASILEIRO,1
INDIAPORÃ,DEPUTADO ESTADUAL,DR. CLAUDIO MIRANDA,CLAUDIO ERNANI MARCONDES DE MIRANDA,SUPLENTE,PSC,HUMANISTA CRISTÃO ,1
INDIAPORÃ,DEPUTADO ESTADUAL,RENATO PUPO,RENATO PUPO DE PAULA,SUPLENTE,PSC,HUMANISTA CRISTÃO ,20
INDIAPORÃ,DEPUTADO ESTADUAL,DR. JONAS,JONAS GREB,SUPLENTE,PSC,HUMANISTA CRISTÃO ,1
INDIAPORÃ,DEPUTADO ESTADUAL,RODRIGO MORAES,RODRIGO AUGUSTO MORAES,ELEITO,PSC,HUMANISTA CRISTÃO ,23
INDIAPORÃ,DEPUTADO ESTADUAL,ZE PEDRO,JOSE PEDRO LEITE DA SILVA,SUPLENTE,PR,SOMOS MAIS SÃO PAULO,1
INDIAPORÃ,DEPUTADO ESTADUAL,JOSE CARLOS SOARES,JOSE CARLOS SOARES,SUPLENTE,PPS,PARTIDO POPULAR SOCIALISTA,2
INDIAPORÃ,DEPUTADO ESTADUAL,DAVI ZAIA,DAVID ZAIA,MÉDIA,PPS,PARTIDO POPULAR SOCIALISTA,35
INDIAPORÃ,DEPUTADO ESTADUAL,DR TEDESCHI,ETEVALDO VIANA TEDESCHI,SUPLENTE,PPS,PARTIDO POPULAR SOCIALISTA,1
INDIAPORÃ,DEPUTADO ESTADUAL,VITOR SAPIENZA,VITOR SAPIENZA,SUPLENTE,PPS,PARTIDO POPULAR SOCIALISTA,10
INDIAPORÃ,DEPUTADO ESTADUAL,PROFESSOR ZE MARIA,JOSE MARIA CANCELLIERO,SUPLENTE,PPS,PARTIDO POPULAR SOCIALISTA,1
INDIAPORÃ,DEPUTADO ESTADUAL,ANDRE SOARES,ANDRE BEZERRA RIBEIRO SOARES,ELEITO,DEM,PSDB/DEM,10
INDIAPORÃ,DEPUTADO ESTADUAL,EDMIR CHEDID,EDMIR JOSE ABI CHEDID,ELEITO,DEM,PSDB/DEM,1
INDIAPORÃ,DEPUTADO ESTADUAL,ALDO DEMARCHI,JOSE ALDO DEMARCHI,ELEITO,DEM,PSDB/DEM,73
INDIAPORÃ,DEPUTADO ESTADUAL,FERNANDO LUCAS,LUIZ FERNANDO AMARAL LUCAS,SUPLENTE,DEM,PSDB/DEM,1
INDIAPORÃ,DEPUTADO ESTADUAL,JOAO PERETTO,JOAO PEDRO PERETTO,SUPLENTE,DEM,PSDB/DEM,1
INDIAPORÃ,DEPUTADO ESTADUAL,ESTEVAM GALVAO,ESTEVAM GALVAO DE OLIVEIRA,ELEITO,DEM,PSDB/DEM,46
INDIAPORÃ,DEPUTADO ESTADUAL,MILTON LEITE FILHO,MILTON LEITE DA SILVA FILHO,ELEITO,DEM,PSDB/DEM,8
INDIAPORÃ,DEPUTADO ESTADUAL,LEANDRO DO KLB,LEANDRO FINATO SCORNAVACCA,SUPLENTE,DEM,PSDB/DEM,1
INDIAPORÃ,DEPUTADO ESTADUAL,BOLÇONE,ORLANDO JOSE BOLÇONE,SUPLENTE,PSB,PARTIDO SOCIALISTA BRASILEIRO,13
INDIAPORÃ,DEPUTADO ESTADUAL,VALDECIR FONSECA,JOSÉ VALDECIR DA FONSECA,SUPLENTE,PSB,PARTIDO SOCIALISTA BRASILEIRO,1
INDIAPORÃ,DEPUTADO ESTADUAL,HILKIAS,HILKIAS DE OLIVEIRA,SUPLENTE,PSB,PARTIDO SOCIALISTA BRASILEIRO,1
INDIAPORÃ,DEPUTADO ESTADUAL,DR. JULIANO PRANDI,JULIANO CARMINE PRANDI,SUPLENTE,PSB,PARTIDO SOCIALISTA BRASILEIRO,2
INDIAPORÃ,DEPUTADO ESTADUAL,DR. PAULO MARIANI,PAULO CEZAR MARIANI,SUPLENTE,PSB,PARTIDO SOCIALISTA BRASILEIRO,7
INDIAPORÃ,DEPUTADO ESTADUAL,GENTIL,ALEXANDRE MARIANO GENTIL,SUPLENTE,PV,PARTIDO VERDE,1
INDIAPORÃ,DEPUTADO ESTADUAL,CAMILO GAVA,JOSÉ CAMILO GAVA NETO,SUPLENTE,PV,PARTIDO VERDE,2
INDIAPORÃ,DEPUTADO ESTADUAL,RITA PASSOS,RITA DE CASSIA TRINCA PASSOS,ELEITO,PV,PARTIDO VERDE,3
INDIAPORÃ,DEPUTADO ESTADUAL,ROBERTO SOBRAL,ROBERTO GONZAGA SOBRAL,SUPLENTE,PV,PARTIDO VERDE,1
INDIAPORÃ,DEPUTADO ESTADUAL,REINALDO ALGUZ,REINALDO DE SOUZA ALGUZ,ELEITO,PV,PARTIDO VERDE,1
INDIAPORÃ,DEPUTADO ESTADUAL,FLAVIO OLIVEIRA,FLAVIO HENRIQUE TEIXEIRA DE OLIVEIRA,SUPLENTE,PV,PARTIDO VERDE,1
INDIAPORÃ,DEPUTADO ESTADUAL,SÉRGIO CONTENTE,SERGIO CONTENTE,SUPLENTE,PV,PARTIDO VERDE,2
INDIAPORÃ,DEPUTADO ESTADUAL,HELIO RUBENS,HELIO RUBENS GONÇALVES FIGUEIREDO,SUPLENTE,PSDB,PSDB/DEM,4
INDIAPORÃ,DEPUTADO ESTADUAL,UBIRAJARA GUIMARÃES,UBIRAJARA PEREIRA GUIMARÃES,SUPLENTE,PSDB,PSDB/DEM,7
INDIAPORÃ,DEPUTADO ESTADUAL,PEDRO TOBIAS,PEDRO TOBIAS,ELEITO,PSDB,PSDB/DEM,1
INDIAPORÃ,DEPUTADO ESTADUAL,JOÃO CARAMEZ,JOÃO CARLOS CARAMEZ,ELEITO,PSDB,PSDB/DEM,6
INDIAPORÃ,DEPUTADO ESTADUAL,BERNARDO ORTIZ JR,JOSE BERNARDO ORTIZ MONTEIRO JUNIOR,SUPLENTE,PSDB,PSDB/DEM,1
INDIAPORÃ,DEPUTADO ESTADUAL,CLOVIS CHAVES,CLOVIS LUIZ CHAVES,SUPLENTE,PSDB,PSDB/DEM,307
INDIAPORÃ,DEPUTADO ESTADUAL,ROBERTO ENGLER,ROBERTO CARVALHO ENGLER PINTO,ELEITO,PSDB,PSDB/DEM,1
INDIAPORÃ,DEPUTADO ESTADUAL,CELINO,JUSCELINO CARDOSO DE SÁ,ELEITO,PSDB,PSDB/DEM,2
INDIAPORÃ,DEPUTADO ESTADUAL,JOSE BORANGA,JOSE AURELIO BORANGA,SUPLENTE,PSDB,PSDB/DEM,9
INDIAPORÃ,DEPUTADO ESTADUAL,CARLÃO PIGNATARI,CARLOS EDUARDO PIGNATARI,ELEITO,PSDB,PSDB/DEM,66
INDIAPORÃ,DEPUTADO ESTADUAL,CASSIO NAVARRO,CASSIO DE CASTRO NAVARRO,SUPLENTE,PSDB,PSDB/DEM,1
INDIAPORÃ,DEPUTADO ESTADUAL,ANALICE FERNANDES,ANALICE FERNANDES,ELEITO,PSDB,PSDB/DEM,364
INDIAPORÃ,DEPUTADO ESTADUAL,CAUÊ MACRIS,CAUÊ CASEIRO MACRIS,MÉDIA,PSDB,PSDB/DEM,2
INDIAPORÃ,DEPUTADO ESTADUAL,EDISON CANDIDO,EDISON APARECIDO CANDIDO,SUPLENTE,PSDB,PSDB/DEM,1
INDIAPORÃ,DEPUTADO ESTADUAL,ZÉ AILTON,JOSE AILTON RIBEIRO,SUPLENTE,PSDB,PSDB/DEM,3
INDIAPORÃ,DEPUTADO ESTADUAL,VICTOR KOBAYASHI,VICTOR KOBAYASHI,SUPLENTE,PSDB,PSDB/DEM,4
INDIAPORÃ,DEPUTADO ESTADUAL,BARROS MUNHOZ,JOSE ANTONIO BARROS MUNHOZ,ELEITO,PSDB,PSDB/DEM,8
INDIAPORÃ,DEPUTADO ESTADUAL,CELSO GIGLIO,CELSO ANTONIO GIGLIO,ELEITO,PSDB,PSDB/DEM,2
INDIAPORÃ,DEPUTADO ESTADUAL,PAULO ALEXANDRE BARBOSA,PAULO ALEXANDRE PEREIRA BARBOSA,ELEITO,PSDB,PSDB/DEM,31
INDIAPORÃ,DEPUTADO ESTADUAL,GILSON BARRETO,GILSON ALMEIDA BARRETO,SUPLENTE,PSDB,PSDB/DEM,2
INDIAPORÃ,DEPUTADO ESTADUAL,ORLANDO MORANDO,ORLANDO MORANDO JUNIOR,ELEITO,PSDB,PSDB/DEM,14
INDIAPORÃ,DEPUTADO ESTADUAL,FERNANDO CAPEZ,FERNANDO CAPEZ,ELEITO,PSDB,PSDB/DEM,3
INDIAPORÃ,DEPUTADO ESTADUAL,MILTON DALLARI,JOSÉ MILTON DALLARI SOARES,SUPLENTE,PSDB,PSDB/DEM,3
INDIAPORÃ,DEPUTADO ESTADUAL,CARLOS GIANNAZI,CARLOS ALBERTO GIANNASI,ELEITO,PSOL,PARTIDO SOCIALISMO E LIBERDADE,2
INDIAPORÃ,DEPUTADO ESTADUAL,SARAH MUNHOZ,SARAH MUNHOZ,SUPLENTE,PC DO B,PARTIDO COMUNISTA DO BRASIL,3
INDIAPORÃ,DEPUTADO ESTADUAL,HELIFAX,HELIFAX PINTO DE SOUZA,SUPLENTE,PC DO B,PARTIDO COMUNISTA DO BRASIL,3
