ILHABELA,DEPUTADO FEDERAL,GUSTAVO PETTA,GUSTAVO LEMOS PETTA,SUPLENTE,PC DO B,JUNTOS POR SÃO PAULO,2
ILHABELA,DEPUTADO FEDERAL,CÉLIO TURINO,CÉLIO ROBERTO TURINO DE MIRANDA,SUPLENTE,PC DO B,JUNTOS POR SÃO PAULO,7
ILHABELA,DEPUTADO FEDERAL,DR. PAULO POLO,PAULO ROBERTO POLO,SUPLENTE,PC DO B,JUNTOS POR SÃO PAULO,2
ILHABELA,DEPUTADO FEDERAL,PADRE PEDRO,PEDRO CÉLIO DAUDT,SUPLENTE,PC DO B,JUNTOS POR SÃO PAULO,1
ILHABELA,DEPUTADO FEDERAL,ALDO REBELO,JOSÉ ALDO REBELO FIGUEIREDO,ELEITO,PC DO B,JUNTOS POR SÃO PAULO,13
ILHABELA,DEPUTADO FEDERAL,DELEGADO PROTÓGENES,PROTÓGENES PINHEIRO DE QUEIROZ,MÉDIA,PC DO B,JUNTOS POR SÃO PAULO,94
ILHABELA,DEPUTADO FEDERAL,DR MARCAO DA MANCHA,MARCO ANTONIO NOTARI,SUPLENTE,PT DO B,JUNTOS POR SÃO PAULO,1
ILHABELA,DEPUTADO ESTADUAL,GILMACI SANTOS,GILMACI DOS SANTOS BARBOSA,ELEITO,PRB,SOMOS MAIS SÃO PAULO,2
ILHABELA,DEPUTADO ESTADUAL,HAVANIR,HAVANIR TAVARES DE ALMEIDA NIMTZ,SUPLENTE,PRB,SOMOS MAIS SÃO PAULO,6
ILHABELA,DEPUTADO ESTADUAL,ITHAMAR DABRIUS,ITHAMAR DABRIUS JUNIOR,SUPLENTE,PRB,SOMOS MAIS SÃO PAULO,2
ILHABELA,DEPUTADO ESTADUAL,DR. FERRUCIO,FERRUCIO DALL AGLIO,SUPLENTE,PP,PARTIDO PROGRESSISTA,1
ILHABELA,DEPUTADO ESTADUAL,MARCELO DE BARROS,MARCELO DE BARROS MARTINS,SUPLENTE,PP,PARTIDO PROGRESSISTA,4
ILHABELA,DEPUTADO ESTADUAL,CURIATI,ANTONIO SALIM CURIATI,ELEITO,PP,PARTIDO PROGRESSISTA,17
ILHABELA,DEPUTADO ESTADUAL,SIMONY,SIMONY BENELLI GALASSO,SUPLENTE,PP,PARTIDO PROGRESSISTA,2
ILHABELA,DEPUTADO ESTADUAL,DIOGO TICLY,DIOGO GAZZE TICLY,SUPLENTE,PP,PARTIDO PROGRESSISTA,2
ILHABELA,DEPUTADO ESTADUAL,FARIA JR,WALDEMAR ALVES FARIA JUNIOR,SUPLENTE,PP,PARTIDO PROGRESSISTA,2
ILHABELA,DEPUTADO ESTADUAL,MARIA CLEMENTINA,MARIA CLEMENTINO DE SOUSA,SUPLENTE,PP,PARTIDO PROGRESSISTA,2
ILHABELA,DEPUTADO ESTADUAL,PRADO,ALEXANDRE DO PRADO,SUPLENTE,PP,PARTIDO PROGRESSISTA,2
ILHABELA,DEPUTADO ESTADUAL,ANDRÉ RAFAEL,ANDRE LUIZ DOS SANTOS,SUPLENTE,PP,PARTIDO PROGRESSISTA,5
ILHABELA,DEPUTADO ESTADUAL,RUSSOMANNO,MOZART ABAETE PERUIBE RUSSOMANNO,SUPLENTE,PP,PARTIDO PROGRESSISTA,24
ILHABELA,DEPUTADO ESTADUAL,DINEI,CLAUDINEI ALEXANDRE PIRES,SUPLENTE,PDT,PARTIDO DEMOCRÁTICO TRABALHISTA,9
ILHABELA,DEPUTADO ESTADUAL,ROGERIO NOGUEIRA,ROGERIO NOGUEIRA LOPES CRUZ,ELEITO,PDT,PARTIDO DEMOCRÁTICO TRABALHISTA,1
ILHABELA,DEPUTADO ESTADUAL,CAPITAO LUCAS,AURO LUCAS,SUPLENTE,PDT,PARTIDO DEMOCRÁTICO TRABALHISTA,1
ILHABELA,DEPUTADO ESTADUAL,JOSE BITTENCOURT,JOSE DOMINGOS BITTENCOURT,ELEITO,PDT,PARTIDO DEMOCRÁTICO TRABALHISTA,65
ILHABELA,DEPUTADO ESTADUAL,MAJOR OLIMPIO,SERGIO OLIMPIO GOMES,ELEITO,PDT,PARTIDO DEMOCRÁTICO TRABALHISTA,502
ILHABELA,DEPUTADO ESTADUAL,THIAGO RODRIGUES,THIAGO RODRIGUES DA COSTA,SUPLENTE,PDT,PARTIDO DEMOCRÁTICO TRABALHISTA,1
ILHABELA,DEPUTADO ESTADUAL,JOCA VASCONCELOS,JOAO CARLOS MONTE CLARO VASCONCELOS,SUPLENTE,PDT,PARTIDO DEMOCRÁTICO TRABALHISTA,3
ILHABELA,DEPUTADO ESTADUAL,BRUZAROSCO,APARECIDO DE JESUS BRUZAROSCO,SUPLENTE,PDT,PARTIDO DEMOCRÁTICO TRABALHISTA,3
ILHABELA,DEPUTADO ESTADUAL,RAFAEL SILVA,RAFAEL ANTONIO DA SILVA,ELEITO,PDT,PARTIDO DEMOCRÁTICO TRABALHISTA,7
ILHABELA,DEPUTADO ESTADUAL,TOLOI,LUIZ CARLOS TOLOI JUNIOR,SUPLENTE,PDT,PARTIDO DEMOCRÁTICO TRABALHISTA,1
ILHABELA,DEPUTADO ESTADUAL,TADEU MORAIS,TADEU MORAIS DE SOUSA,SUPLENTE,PDT,PARTIDO DEMOCRÁTICO TRABALHISTA,2
ILHABELA,DEPUTADO ESTADUAL,JOÃO ELIAS,JOÃO ELIAS PEREIRA,SUPLENTE,PDT,PARTIDO DEMOCRÁTICO TRABALHISTA,1
ILHABELA,DEPUTADO ESTADUAL,PAULO BARBOSA,PAULO ROBERTO BARBOSA,SUPLENTE,PDT,PARTIDO DEMOCRÁTICO TRABALHISTA,1
ILHABELA,DEPUTADO ESTADUAL,CIDINHO,APARECIDO RODRIGUES DOS SANTOS,SUPLENTE,PDT,PARTIDO DEMOCRÁTICO TRABALHISTA,1
ILHABELA,DEPUTADO ESTADUAL,ANDERSON SILVA,ANDERSON DOMINGOS DA SILVA,SUPLENTE,PT,SOMOS MAIS SÃO PAULO,5
ILHABELA,DEPUTADO ESTADUAL,DR. JORGE PARADA,JORGE EDUARDO PARADA HURTADO,SUPLENTE,PT,SOMOS MAIS SÃO PAULO,1
ILHABELA,DEPUTADO ESTADUAL,TELMA DE SOUZA,TELMA SANDRA AUGUSTO DE SOUZA,ELEITO,PT,SOMOS MAIS SÃO PAULO,40
ILHABELA,DEPUTADO ESTADUAL,BETO COELHO,PAULO ROBERTO CABRAL COELHO,SUPLENTE,PT,SOMOS MAIS SÃO PAULO,1
ILHABELA,DEPUTADO ESTADUAL,WAGNER BALIEIRO,WAGNER OCIMAR BALIEIRO,SUPLENTE,PT,SOMOS MAIS SÃO PAULO,9
ILHABELA,DEPUTADO ESTADUAL,GALENO AMORIM,GALENO DE AMORIM JUNIOR,SUPLENTE,PT,SOMOS MAIS SÃO PAULO,1
ILHABELA,DEPUTADO ESTADUAL,PORTUGUÊS,REINALDO FARTO NUNES,SUPLENTE,PT,SOMOS MAIS SÃO PAULO,2
ILHABELA,DEPUTADO ESTADUAL,JURA,JURACY FRANCISCO DE JESUS,SUPLENTE,PT,SOMOS MAIS SÃO PAULO,1
ILHABELA,DEPUTADO ESTADUAL,GERSON BITTENCOURT,GERSON LUIS BITTENCOURT,ELEITO,PT,SOMOS MAIS SÃO PAULO,3
ILHABELA,DEPUTADO ESTADUAL,EDINHO SILVA,EDSON ANTONIO EDINHO DA SILVA,ELEITO,PT,SOMOS MAIS SÃO PAULO,4
ILHABELA,DEPUTADO ESTADUAL,ENIO TATTO,ENIO FRANCISCO TATTO,ELEITO,PT,SOMOS MAIS SÃO PAULO,2
ILHABELA,DEPUTADO ESTADUAL,RAFAEL MARINHO,RAFAEL DE FIGUEIREDO MARINHO,SUPLENTE,PT,SOMOS MAIS SÃO PAULO,2
ILHABELA,DEPUTADO ESTADUAL,ANA PERUGINI,ANA LUCIA LIPPAUS PERUGINI,ELEITO,PT,SOMOS MAIS SÃO PAULO,3
ILHABELA,DEPUTADO ESTADUAL,ZICO,JOSÉ PRADO DE ANDRADE,MÉDIA,PT,SOMOS MAIS SÃO PAULO,3
ILHABELA,DEPUTADO ESTADUAL,WILSON SANTOS,WILSON SANTOS PEREIRA,SUPLENTE,PT,SOMOS MAIS SÃO PAULO,1
ILHABELA,DEPUTADO ESTADUAL,MARCO AURÉLIO DE SOUZA,MARCO AURÉLIO DE SOUZA,MÉDIA,PT,SOMOS MAIS SÃO PAULO,279
ILHABELA,DEPUTADO ESTADUAL,MARCOS MARTINS,MARCOS LOPES MARTINS,ELEITO,PT,SOMOS MAIS SÃO PAULO,163
ILHABELA,DEPUTADO ESTADUAL,ELI TEODORO,ELI TEODORO,SUPLENTE,PT,SOMOS MAIS SÃO PAULO,3
ILHABELA,DEPUTADO ESTADUAL,SIMÃO PEDRO,SIMÃO PEDRO CHIOVETTI,ELEITO,PT,SOMOS MAIS SÃO PAULO,1
ILHABELA,DEPUTADO ESTADUAL,RUI FALCÃO,RUI GOETHE DA COSTA FALCÃO,ELEITO,PT,SOMOS MAIS SÃO PAULO,3
ILHABELA,DEPUTADO ESTADUAL,ÉMERSON TAUYL,EMERSON LIMA TAUYL,SUPLENTE,PT,SOMOS MAIS SÃO PAULO,2
ILHABELA,DEPUTADO ESTADUAL,ADRIANO DIOGO,ADRIANO DIOGO,ELEITO,PT,SOMOS MAIS SÃO PAULO,4
ILHABELA,DEPUTADO ESTADUAL,HAMILTON PEREIRA,HAMILTON PEREIRA,ELEITO,PT,SOMOS MAIS SÃO PAULO,1
ILHABELA,DEPUTADO ESTADUAL,NATIVIDADE,MARIA DA NATIVIDADE PEREIRA LIMA,SUPLENTE,PT,SOMOS MAIS SÃO PAULO,2
ILHABELA,DEPUTADO ESTADUAL,ROBERTO FELICIO,ROBERTO FELICIO,SUPLENTE,PT,SOMOS MAIS SÃO PAULO,14
ILHABELA,DEPUTADO ESTADUAL,RAFAEL AGOSTINI,RAFAEL LUNARDELLI AGOSTINI,SUPLENTE,PT,SOMOS MAIS SÃO PAULO,1
ILHABELA,DEPUTADO ESTADUAL,ROSANA GASPAR,ROSANA EMILIA GASPAR,SUPLENTE,PT,SOMOS MAIS SÃO PAULO,1
ILHABELA,DEPUTADO ESTADUAL,ADINAN ORTOLAN,JOSÉ ADINAN ORTOLAN,SUPLENTE,PT,SOMOS MAIS SÃO PAULO,3
ILHABELA,DEPUTADO ESTADUAL,ALENCAR,ALENCAR SANTANA BRAGA,ELEITO,PT,SOMOS MAIS SÃO PAULO,36
ILHABELA,DEPUTADO ESTADUAL,VERA SABA,VERA LÚCIA SANTOS SABA,SUPLENTE,PT,SOMOS MAIS SÃO PAULO,12
ILHABELA,DEPUTADO ESTADUAL,ISAC REIS,ISAC FRANCO DOS REIS,ELEITO,PT,SOMOS MAIS SÃO PAULO,15
ILHABELA,DEPUTADO ESTADUAL,BRENO CORTELLA,BRENO ZANONI CORTELLA,SUPLENTE,PT,SOMOS MAIS SÃO PAULO,29
ILHABELA,DEPUTADO ESTADUAL,ANA DO CARMO,ANA MARIA DO CARMO ROSSETO,ELEITO,PT,SOMOS MAIS SÃO PAULO,8
ILHABELA,DEPUTADO ESTADUAL,JOSÉ CANDIDO,JOSÉ DE SOUZA CÂNDIDO,MÉDIA,PT,SOMOS MAIS SÃO PAULO,1
ILHABELA,DEPUTADO ESTADUAL,JOÃO ANTONIO,JOAO ANTONIO DA SILVA FILHO,ELEITO,PT,SOMOS MAIS SÃO PAULO,3
ILHABELA,DEPUTADO ESTADUAL,GALLO,JURANDIR GALLO,SUPLENTE,PT,SOMOS MAIS SÃO PAULO,1
ILHABELA,DEPUTADO ESTADUAL,PROF. ROMAZZINI,LUIS CARLOS ROMAZZINI,SUPLENTE,PT,SOMOS MAIS SÃO PAULO,4
ILHABELA,DEPUTADO ESTADUAL,CARLOS GRANA,CARLOS ALBERTO GRANA,ELEITO,PT,SOMOS MAIS SÃO PAULO,5
ILHABELA,DEPUTADO ESTADUAL,FAUSTO FIGUEIRA,FAUSTO FIGUEIRA DE MELLO JUNIOR,SUPLENTE,PT,SOMOS MAIS SÃO PAULO,180
ILHABELA,DEPUTADO ESTADUAL,TOFFOLI,JOSÉ TICIANO DIAS TOFFOLI,SUPLENTE,PT,SOMOS MAIS SÃO PAULO,20
ILHABELA,DEPUTADO ESTADUAL,LUIZ MOURA,LUIZ DE MOURA PEREIRA,ELEITO,PT,SOMOS MAIS SÃO PAULO,92
ILHABELA,DEPUTADO ESTADUAL,DONISETE BRAGA,DONISETE PEREIRA BRAGA,ELEITO,PT,SOMOS MAIS SÃO PAULO,1
ILHABELA,DEPUTADO ESTADUAL,EDUARDO SIMAO,EDUARDO SIMAO DIAS,SUPLENTE,PT,SOMOS MAIS SÃO PAULO,1
ILHABELA,DEPUTADO ESTADUAL,CARLOS NEDER,CARLOS ALBERTO PLETZ NEDER,SUPLENTE,PT,SOMOS MAIS SÃO PAULO,8
ILHABELA,DEPUTADO ESTADUAL,CONTE LOPES,ROBERVAL CONTE LOPES LIMA,SUPLENTE,PTB,PARTIDO TRABALHISTA BRASILEIRO,11
ILHABELA,DEPUTADO ESTADUAL,CAMPOS MACHADO,ANTONIO CARLOS DE CAMPOS MACHADO,ELEITO,PTB,PARTIDO TRABALHISTA BRASILEIRO,83
ILHABELA,DEPUTADO ESTADUAL,VANDO,ORVANDO DA SILVA,SUPLENTE,PTB,PARTIDO TRABALHISTA BRASILEIRO,1
ILHABELA,DEPUTADO ESTADUAL,JUVENCIO MARQUES,JUVENCIO MARQUES DE ALCANTARA,SUPLENTE,PTB,PARTIDO TRABALHISTA BRASILEIRO,2
ILHABELA,DEPUTADO ESTADUAL,ROQUE BARBIERE - ROQUINHO,ROQUE BARBIERE,ELEITO,PTB,PARTIDO TRABALHISTA BRASILEIRO,2
ILHABELA,DEPUTADO ESTADUAL,CORONEL EDSON FERRARINI,EDSON FERRARINI,ELEITO,PTB,PARTIDO TRABALHISTA BRASILEIRO,11
ILHABELA,DEPUTADO ESTADUAL,VAL,ENIVALDO RAMOS DE FREITAS,SUPLENTE,PTB,PARTIDO TRABALHISTA BRASILEIRO,2
ILHABELA,DEPUTADO ESTADUAL,TARDELLI,ROBERTO TARDELLI,SUPLENTE,PTB,PARTIDO TRABALHISTA BRASILEIRO,4
ILHABELA,DEPUTADO ESTADUAL,WALDIR AGNELLO,WALDIR AGNELLO,SUPLENTE,PTB,PARTIDO TRABALHISTA BRASILEIRO,186
ILHABELA,DEPUTADO ESTADUAL,PALHACO PIROLETA,WILSON ARAUJO DE FARIA,SUPLENTE,PTB,PARTIDO TRABALHISTA BRASILEIRO,1
ILHABELA,DEPUTADO ESTADUAL,BALEIA ROSSI,LUIZ FELIPE BALEIA TENUTO ROSSI,ELEITO,PMDB,PARTIDO DO MOVIMENTO DEMOCRÁTICO BRASILEIRO,21
ILHABELA,DEPUTADO ESTADUAL,DRA ADRIANA,ADRIANA DI NARDO SILVA,SUPLENTE,PMDB,PARTIDO DO MOVIMENTO DEMOCRÁTICO BRASILEIRO,2
ILHABELA,DEPUTADO ESTADUAL,BEBETTO,ALBERTO FELIPPE HADDAD FILHO,SUPLENTE,PMDB,PARTIDO DO MOVIMENTO DEMOCRÁTICO BRASILEIRO,7
ILHABELA,DEPUTADO ESTADUAL,DR. ITAMAR,ITAMAR COPPIO,SUPLENTE,PMDB,PARTIDO DO MOVIMENTO DEMOCRÁTICO BRASILEIRO,17
ILHABELA,DEPUTADO ESTADUAL,DU TONIN,EDUARDO TONIN,SUPLENTE,PMDB,PARTIDO DO MOVIMENTO DEMOCRÁTICO BRASILEIRO,2
ILHABELA,DEPUTADO ESTADUAL,IBRAIM,IBRAIM ANTONIO ABOU JOKH,SUPLENTE,PMDB,PARTIDO DO MOVIMENTO DEMOCRÁTICO BRASILEIRO,1
ILHABELA,DEPUTADO ESTADUAL,CARUSO,JORGE LUIS CARUSO,ELEITO,PMDB,PARTIDO DO MOVIMENTO DEMOCRÁTICO BRASILEIRO,357
ILHABELA,DEPUTADO ESTADUAL,VANESSA DAMO,VANESSA DAMO OROSCO,ELEITO,PMDB,PARTIDO DO MOVIMENTO DEMOCRÁTICO BRASILEIRO,4
ILHABELA,DEPUTADO ESTADUAL,PROF. CANDIDO,CANDIDO GARCIA ALONSO,SUPLENTE,PMDB,PARTIDO DO MOVIMENTO DEMOCRÁTICO BRASILEIRO,11
ILHABELA,DEPUTADO ESTADUAL,UEBE REZECK,UEBE REZECK,SUPLENTE,PMDB,PARTIDO DO MOVIMENTO DEMOCRÁTICO BRASILEIRO,2
ILHABELA,DEPUTADO ESTADUAL,HABIB,GEORGES HABIB JARROUGE,SUPLENTE,PMDB,PARTIDO DO MOVIMENTO DEMOCRÁTICO BRASILEIRO,1
ILHABELA,DEPUTADO ESTADUAL,ITAMAR BORGES,ITAMAR FRANCISCO MACHADO BORGES,MÉDIA,PMDB,PARTIDO DO MOVIMENTO DEMOCRÁTICO BRASILEIRO,2
ILHABELA,DEPUTADO ESTADUAL,DRA SILVANA,SILVANA CASSIA RIBEIRO BAPTISTA,SUPLENTE,PMDB,PARTIDO DO MOVIMENTO DEMOCRÁTICO BRASILEIRO,3
ILHABELA,DEPUTADO ESTADUAL,JOOJI HATO,JOOJI HATO,ELEITO,PMDB,PARTIDO DO MOVIMENTO DEMOCRÁTICO BRASILEIRO,232
ILHABELA,DEPUTADO ESTADUAL,ALEXANDRE CUNHA,ALEXANDRE EVARISTO CUNHA,SUPLENTE,PMDB,PARTIDO DO MOVIMENTO DEMOCRÁTICO BRASILEIRO,1
ILHABELA,DEPUTADO ESTADUAL,ALAN NETO,ANTONIO CARLOS BARBOSA NEVES,SUPLENTE,PSC,HUMANISTA CRISTÃO ,2
ILHABELA,DEPUTADO ESTADUAL,LELIS TRAJANO,LELIS JOSE TRAJANO,SUPLENTE,PSC,HUMANISTA CRISTÃO ,2
ILHABELA,DEPUTADO ESTADUAL,PR. PAGLIARIN,HIDERALDO PAGLIARIN,SUPLENTE,PSC,HUMANISTA CRISTÃO ,7
ILHABELA,DEPUTADO ESTADUAL,LEANDRO AMARAL,LEANDRO GODINES DO AMARAL,SUPLENTE,PSC,HUMANISTA CRISTÃO ,5
ILHABELA,DEPUTADO ESTADUAL,PASTOR VIEIRA ROCHA,JOSE VIEIRA ROCHA,SUPLENTE,PSC,HUMANISTA CRISTÃO ,57
ILHABELA,DEPUTADO ESTADUAL,PR. CARLOS CEZAR,CARLOS CEZAR DA SILVA,ELEITO,PSC,HUMANISTA CRISTÃO ,5
ILHABELA,DEPUTADO ESTADUAL,MARTA LIVIA SUPLICY,MARTA LIVIA BARRAGANA FERNANDES SUPLICY,SUPLENTE,PSC,HUMANISTA CRISTÃO ,3
ILHABELA,DEPUTADO ESTADUAL,RENATO PUPO,RENATO PUPO DE PAULA,SUPLENTE,PSC,HUMANISTA CRISTÃO ,1
ILHABELA,DEPUTADO ESTADUAL,WALTER CORDONI,WALTER CORDONI FILHO,SUPLENTE,PSC,HUMANISTA CRISTÃO ,14
ILHABELA,DEPUTADO ESTADUAL,ATALAIA,JOSE ROBERTO DE OLIVEIRA,SUPLENTE,PSC,HUMANISTA CRISTÃO ,3
ILHABELA,DEPUTADO ESTADUAL,SAID MOURAD,AHMAD SAID MOURAD,SUPLENTE,PSC,HUMANISTA CRISTÃO ,38
ILHABELA,DEPUTADO ESTADUAL,CESAR NASCIMENTO-RADIO CAPITAL,SEBASTIÃO PEREIRA NASCIMENTO,SUPLENTE,PSC,HUMANISTA CRISTÃO ,2
ILHABELA,DEPUTADO ESTADUAL,RODRIGO MORAES,RODRIGO AUGUSTO MORAES,ELEITO,PSC,HUMANISTA CRISTÃO ,22
ILHABELA,DEPUTADO ESTADUAL,MARCOS NEVES,MARCO AURELIO DOS SANTOS NEVES,ELEITO,PSC,HUMANISTA CRISTÃO ,2
ILHABELA,DEPUTADO ESTADUAL,NEUSA COCHHIERI,NEUSA COCCHIERI,SUPLENTE,PSC,HUMANISTA CRISTÃO ,1
ILHABELA,DEPUTADO ESTADUAL,LEONARDO QUEIROZ,LEONARDO SANTOS QUEIROZ,SUPLENTE,PSC,HUMANISTA CRISTÃO ,1
ILHABELA,DEPUTADO ESTADUAL,NELSON FERNANDES,JOSE NELSON AGUIAR FERNANDES,SUPLENTE,PSC,HUMANISTA CRISTÃO ,16
ILHABELA,DEPUTADO ESTADUAL,PRIMO,PRIMO ALEXANDRE MANGIALARGO,SUPLENTE,PSC,HUMANISTA CRISTÃO ,3
ILHABELA,DEPUTADO ESTADUAL,WALTER GOMES,WALTER GOMES DE OLIVEIRA,SUPLENTE,PR,SOMOS MAIS SÃO PAULO,2
ILHABELA,DEPUTADO ESTADUAL,PAULO CORREA,PAULO HENRIQUE CORREA,SUPLENTE,PR,SOMOS MAIS SÃO PAULO,3
ILHABELA,DEPUTADO ESTADUAL,ZE PEDRO,JOSE PEDRO LEITE DA SILVA,SUPLENTE,PR,SOMOS MAIS SÃO PAULO,8
ILHABELA,DEPUTADO ESTADUAL,LILI AIMAR,LILIANA MEDEIROS DE ALMEIDA AYMAR BECHARA,SUPLENTE,PR,SOMOS MAIS SÃO PAULO,2
ILHABELA,DEPUTADO ESTADUAL,ALEXANDRE DA FARMACIA,ALEXANDRE JOSE DA CUNHA,SUPLENTE,PR,SOMOS MAIS SÃO PAULO,235
ILHABELA,DEPUTADO ESTADUAL,PATRICIA LIMA,PATRICIA FREITAS LIMA,SUPLENTE,PR,SOMOS MAIS SÃO PAULO,76
ILHABELA,DEPUTADO ESTADUAL,JOSIAS DINIZ,JOSIAS ANTONIO DINIZ,SUPLENTE,PR,SOMOS MAIS SÃO PAULO,5
ILHABELA,DEPUTADO ESTADUAL,TONINHO PAIVA,ANTONIO DE PAIVA MONTEIRO FILHO,SUPLENTE,PR,SOMOS MAIS SÃO PAULO,1
ILHABELA,DEPUTADO ESTADUAL,OSVALDO VERGINIO,OSVALDO VERGINIO DA SILVA,SUPLENTE,PR,SOMOS MAIS SÃO PAULO,2
ILHABELA,DEPUTADO ESTADUAL,CLAUDIO SOROCABA I,GERVINO GONCALVES,SUPLENTE,PR,SOMOS MAIS SÃO PAULO,1
ILHABELA,DEPUTADO ESTADUAL,ANDRE DO PRADO,ANDRE LUIS DO PRADO,ELEITO,PR,SOMOS MAIS SÃO PAULO,1
ILHABELA,DEPUTADO ESTADUAL,BRAZ,BRAZ ANTUNES MATTOS NETO,SUPLENTE,PPS,PARTIDO POPULAR SOCIALISTA,5
ILHABELA,DEPUTADO ESTADUAL,ADEMIR DA GUIA,ADEMIR DA GUIA,SUPLENTE,PPS,PARTIDO POPULAR SOCIALISTA,13
ILHABELA,DEPUTADO ESTADUAL,CONCEIÇÃO DUARTE,CONCEIÇÃO FOGLIO DUARTE FIGUEIREDO,SUPLENTE,PPS,PARTIDO POPULAR SOCIALISTA,2
ILHABELA,DEPUTADO ESTADUAL,DAVI ZAIA,DAVID ZAIA,MÉDIA,PPS,PARTIDO POPULAR SOCIALISTA,523
ILHABELA,DEPUTADO ESTADUAL,JOSE MESSINA,JOSE DE LORENZO MESSINA,SUPLENTE,PPS,PARTIDO POPULAR SOCIALISTA,3
ILHABELA,DEPUTADO ESTADUAL,SARGENTO DAMIAO,VILSON NUNES DAMIAO,SUPLENTE,PPS,PARTIDO POPULAR SOCIALISTA,1
ILHABELA,DEPUTADO ESTADUAL,ROBSON O BELLO,ROBSON LUIZ CARDOSO,SUPLENTE,PPS,PARTIDO POPULAR SOCIALISTA,1
ILHABELA,DEPUTADO ESTADUAL,VERONEZZI,JOSE CARLOS VERONEZZI,SUPLENTE,PPS,PARTIDO POPULAR SOCIALISTA,5
ILHABELA,DEPUTADO ESTADUAL,PROF DIMAS NOVAIS,DIMAS NOVAIS DE OLIVEIRA,SUPLENTE,PPS,PARTIDO POPULAR SOCIALISTA,1
ILHABELA,DEPUTADO ESTADUAL,JOAO OTAVIO BASTOS,JOAO OTAVIO BASTOS JUNQUEIRA,SUPLENTE,PPS,PARTIDO POPULAR SOCIALISTA,2
ILHABELA,DEPUTADO ESTADUAL,VITOR SAPIENZA,VITOR SAPIENZA,SUPLENTE,PPS,PARTIDO POPULAR SOCIALISTA,6
ILHABELA,DEPUTADO ESTADUAL,ALEX MANENTE,ALEX SPINELLI MANENTE,ELEITO,PPS,PARTIDO POPULAR SOCIALISTA,7
ILHABELA,DEPUTADO ESTADUAL,JORGE MATOS,JORGE DONIZETTI RIBEIRO DE MATOS,SUPLENTE,PPS,PARTIDO POPULAR SOCIALISTA,1
ILHABELA,DEPUTADO ESTADUAL,GONDIM,LUIZ CARLOS GONDIM TEIXEIRA,ELEITO,PPS,PARTIDO POPULAR SOCIALISTA,9
ILHABELA,DEPUTADO ESTADUAL,ESTEVÃO,STEVEN ERIKSEN BINNIE,SUPLENTE,PPS,PARTIDO POPULAR SOCIALISTA,2
ILHABELA,DEPUTADO ESTADUAL,PROFESSOR ZE MARIA,JOSE MARIA CANCELLIERO,SUPLENTE,PPS,PARTIDO POPULAR SOCIALISTA,6
ILHABELA,DEPUTADO ESTADUAL,MYRIAM ALCKMIN,MYRIAM ALCKMIN RAMOS NOGUEIRA,SUPLENTE,PPS,PARTIDO POPULAR SOCIALISTA,10
ILHABELA,DEPUTADO ESTADUAL,MARCELO CYPRIANO,MARCELO DA SILVA CYPRIANO,SUPLENTE,PPS,PARTIDO POPULAR SOCIALISTA,1
ILHABELA,DEPUTADO ESTADUAL,GENESIO JUSTO,GENESIO JUSTO SILLES,SUPLENTE,PPS,PARTIDO POPULAR SOCIALISTA,1
ILHABELA,DEPUTADO ESTADUAL,EURIPINHO ARTILHEIRO DO POVO,OLIMPIO JORGE NABEN,SUPLENTE,PPS,PARTIDO POPULAR SOCIALISTA,2
ILHABELA,DEPUTADO ESTADUAL,ROBERTO MORAIS,ROBERTO TURCHI DE MORAIS,ELEITO,PPS,PARTIDO POPULAR SOCIALISTA,3
ILHABELA,DEPUTADO ESTADUAL,AZUAITE,AZUAITE MARTINS DE FRANÇA,SUPLENTE,PPS,PARTIDO POPULAR SOCIALISTA,3
ILHABELA,DEPUTADO ESTADUAL,ELZO SIGUETA,ELZO SIGUETA,SUPLENTE,PPS,PARTIDO POPULAR SOCIALISTA,3
ILHABELA,DEPUTADO ESTADUAL,NICOLAU AMARAL,NICOLAU LIMA DO AMARAL,SUPLENTE,PPS,PARTIDO POPULAR SOCIALISTA,1
ILHABELA,DEPUTADO ESTADUAL,KIKO SAWAYA,JOAO FRANCISCO SAWAYA DE LIMA,SUPLENTE,PPS,PARTIDO POPULAR SOCIALISTA,2
ILHABELA,DEPUTADO ESTADUAL,DARIO SAADI,DARIO JORGE GIOLO SAADI,SUPLENTE,DEM,PSDB/DEM,20
ILHABELA,DEPUTADO ESTADUAL,ANDRE SOARES,ANDRE BEZERRA RIBEIRO SOARES,ELEITO,DEM,PSDB/DEM,50
ILHABELA,DEPUTADO ESTADUAL,GILSON DE SOUZA,GILSON DE SOUZA,ELEITO,DEM,PSDB/DEM,2
ILHABELA,DEPUTADO ESTADUAL,RICARDO MUTRAN,RICARDO JORGE MUTRAN,SUPLENTE,DEM,PSDB/DEM,18
ILHABELA,DEPUTADO ESTADUAL,ULISSES SALES,ULISSES ROBERTO CORNAZZANI SALES,SUPLENTE,DEM,PSDB/DEM,16
ILHABELA,DEPUTADO ESTADUAL,EDMIR CHEDID,EDMIR JOSE ABI CHEDID,ELEITO,DEM,PSDB/DEM,25
ILHABELA,DEPUTADO ESTADUAL,ALDO DEMARCHI,JOSE ALDO DEMARCHI,ELEITO,DEM,PSDB/DEM,2
ILHABELA,DEPUTADO ESTADUAL,JOAO MELLAO NETO,JOAO MELLAO NETO,SUPLENTE,DEM,PSDB/DEM,46
ILHABELA,DEPUTADO ESTADUAL,MACEDO BASTOS,CARLOS ALBERTO MACEDO BASTOS,SUPLENTE,DEM,PSDB/DEM,10
ILHABELA,DEPUTADO ESTADUAL,ESTEVAM GALVAO,ESTEVAM GALVAO DE OLIVEIRA,ELEITO,DEM,PSDB/DEM,5
ILHABELA,DEPUTADO ESTADUAL,RICARDO SALLES,RICARDO DE AQUINO SALLES,SUPLENTE,DEM,PSDB/DEM,24
ILHABELA,DEPUTADO ESTADUAL,MILTON LEITE FILHO,MILTON LEITE DA SILVA FILHO,ELEITO,DEM,PSDB/DEM,6
ILHABELA,DEPUTADO ESTADUAL,MILTON VIEIRA,MILTON VIEIRA PINTO,ELEITO,DEM,PSDB/DEM,193
ILHABELA,DEPUTADO ESTADUAL,JOAO BARBOSA,JOAO BARBOSA DE CARVALHO,SUPLENTE,DEM,PSDB/DEM,8
ILHABELA,DEPUTADO ESTADUAL,SALLES,RAIMUNDO TARASKEVICIUS SALES,SUPLENTE,DEM,PSDB/DEM,16
ILHABELA,DEPUTADO ESTADUAL,GIL ARANTES,GILBERTO MACEDO GIL ARANTES,ELEITO,DEM,PSDB/DEM,442
ILHABELA,DEPUTADO ESTADUAL,ZE TURIN,JOSE ARIVALDO RODRIGUES,SUPLENTE,DEM,PSDB/DEM,4
ILHABELA,DEPUTADO ESTADUAL,ZE LOUQUINHO,JOSE LUIZ RODRIGUES,SUPLENTE,DEM,PSDB/DEM,15
ILHABELA,DEPUTADO ESTADUAL,LEANDRO DO KLB,LEANDRO FINATO SCORNAVACCA,SUPLENTE,DEM,PSDB/DEM,43
ILHABELA,DEPUTADO ESTADUAL,RONALDO ILHABELA,RONALDO ELIAS MARIANO,SUPLENTE,PHS,HUMANISTA CRISTÃO ,207
ILHABELA,DEPUTADO ESTADUAL,MARCELINHO ENGRAXATE,ADVALDO MARQUES FLAUZINO,SUPLENTE,PHS,HUMANISTA CRISTÃO ,1
ILHABELA,DEPUTADO ESTADUAL,EDUARDO BETTIN,CARLOS EDUARDO DA FONSECA BETTIN,SUPLENTE,PHS,HUMANISTA CRISTÃO ,2
ILHABELA,DEPUTADO ESTADUAL,PAULO HADICH,PAULO CEZAR JUNQUEIRA HADICH,SUPLENTE,PSB,PARTIDO SOCIALISTA BRASILEIRO,1
ILHABELA,DEPUTADO ESTADUAL,DR. GENNARI,MARCELO GENNARI BORATTO,SUPLENTE,PSB,PARTIDO SOCIALISTA BRASILEIRO,1
ILHABELA,DEPUTADO ESTADUAL,VALDECIR FONSECA,JOSÉ VALDECIR DA FONSECA,SUPLENTE,PSB,PARTIDO SOCIALISTA BRASILEIRO,1
ILHABELA,DEPUTADO ESTADUAL,MARIÂNGELA DUARTE,MARIANGELA DE ARAÚJO GAMA DUARTE,SUPLENTE,PSB,PARTIDO SOCIALISTA BRASILEIRO,3
ILHABELA,DEPUTADO ESTADUAL,SANDRO PATRIOTA,SANDRO PATRIOTA BASSIQUETTE,SUPLENTE,PSB,PARTIDO SOCIALISTA BRASILEIRO,4
ILHABELA,DEPUTADO ESTADUAL,ED THOMAS,EDSON TOMAZINI,ELEITO,PSB,PARTIDO SOCIALISTA BRASILEIRO,2
ILHABELA,DEPUTADO ESTADUAL,DR. JOSÉ RICARDO,JOSÉ RICARDO DIAS,SUPLENTE,PSB,PARTIDO SOCIALISTA BRASILEIRO,7
ILHABELA,DEPUTADO ESTADUAL,YVONE BARREIROS,YVONE BARREIROS MOREIRA,SUPLENTE,PSB,PARTIDO SOCIALISTA BRASILEIRO,7
ILHABELA,DEPUTADO ESTADUAL,LUCIANO BATISTA,LUCIANO BATISTA,ELEITO,PSB,PARTIDO SOCIALISTA BRASILEIRO,226
ILHABELA,DEPUTADO ESTADUAL,GUILHERME NONATO,GUILHERME DE SÁ CAVALCANTE,SUPLENTE,PSB,PARTIDO SOCIALISTA BRASILEIRO,1
ILHABELA,DEPUTADO ESTADUAL,LEVI MENDES,ANTONIO LEVI MENDES,SUPLENTE,PSB,PARTIDO SOCIALISTA BRASILEIRO,1
ILHABELA,DEPUTADO ESTADUAL,DRA. NEIDE SALES,NEIDE APARECIDA SALES BISCUOLA,SUPLENTE,PSB,PARTIDO SOCIALISTA BRASILEIRO,2
ILHABELA,DEPUTADO ESTADUAL,GENTIL,ALEXANDRE MARIANO GENTIL,SUPLENTE,PV,PARTIDO VERDE,15
ILHABELA,DEPUTADO ESTADUAL,ARTUR DIAN,ARTUR JOSE DIAN,SUPLENTE,PV,PARTIDO VERDE,2
ILHABELA,DEPUTADO ESTADUAL,ADRIANA RODRIGUES,ADRIANA LARIO RAMALHO RODRIGUES,SUPLENTE,PV,PARTIDO VERDE,2
ILHABELA,DEPUTADO ESTADUAL,FELICIANO,FELICIANO NAHIMY FILHO,ELEITO,PV,PARTIDO VERDE,22
ILHABELA,DEPUTADO ESTADUAL,HENRIQUE CONTI,JOSE HENRIQUE CONTI,SUPLENTE,PV,PARTIDO VERDE,3
ILHABELA,DEPUTADO ESTADUAL,PAULLO VIEIRA,PAULO ROBERTO AMARAL VIEIRA,SUPLENTE,PV,PARTIDO VERDE,7
ILHABELA,DEPUTADO ESTADUAL,LAIS LATORRE,LAIS MENDES LATORRE SOARES,SUPLENTE,PV,PARTIDO VERDE,1
ILHABELA,DEPUTADO ESTADUAL,RICARDO CASTILHO,RICARDO RODRIGUES DE CASTILHO,SUPLENTE,PV,PARTIDO VERDE,2
ILHABELA,DEPUTADO ESTADUAL,RICARDO SILVA,RICARDO DE OLIVEIRA SILVA,SUPLENTE,PV,PARTIDO VERDE,1
ILHABELA,DEPUTADO ESTADUAL,ROSE FIGUEIRA,ROSEMEIRE APARECIDA ARAÚJO FIGUEIRA LEMES,SUPLENTE,PV,PARTIDO VERDE,2
ILHABELA,DEPUTADO ESTADUAL,DR PAULO DE TARSO,PAULO DE TARSO NUNES CHIODE,SUPLENTE,PV,PARTIDO VERDE,2
ILHABELA,DEPUTADO ESTADUAL,CLEIA MORAES,CLEIA GALIZIO BUENO DE MORAES,SUPLENTE,PV,PARTIDO VERDE,1
ILHABELA,DEPUTADO ESTADUAL,RITA PASSOS,RITA DE CASSIA TRINCA PASSOS,ELEITO,PV,PARTIDO VERDE,145
ILHABELA,DEPUTADO ESTADUAL,PADRE AFONSO,JOSÉ AFONSO LOBATO,ELEITO,PV,PARTIDO VERDE,134
ILHABELA,DEPUTADO ESTADUAL,NAVAL PELA GUARDA MUNICIPAL,MAURICIO DOMINGUES DA SILVA,SUPLENTE,PV,PARTIDO VERDE,1
ILHABELA,DEPUTADO ESTADUAL,BETO TRICOLI,JOSE ROBERTO TRICOLI,ELEITO,PV,PARTIDO VERDE,1
ILHABELA,DEPUTADO ESTADUAL,CABO ELIAS SOARES,ELIAS LOPES SOARES,SUPLENTE,PV,PARTIDO VERDE,1
ILHABELA,DEPUTADO ESTADUAL,BRAZ ALBERTINI,BRAZ AGOSTINHO ALBERTINI,SUPLENTE,PV,PARTIDO VERDE,1
ILHABELA,DEPUTADO ESTADUAL,FERNANDO MARREY FERREIRA,FERNANDO MARREY FERREIRA,SUPLENTE,PV,PARTIDO VERDE,5
ILHABELA,DEPUTADO ESTADUAL,MÁRCIA MONTEZ,MÁRCIA REGINA MONTEZ HALASZ,SUPLENTE,PV,PARTIDO VERDE,2
ILHABELA,DEPUTADO ESTADUAL,DECIO CLEMENTE,DECIO COUTO CLEMENTE,SUPLENTE,PV,PARTIDO VERDE,1
ILHABELA,DEPUTADO ESTADUAL,REINALDO ALGUZ,REINALDO DE SOUZA ALGUZ,ELEITO,PV,PARTIDO VERDE,115
ILHABELA,DEPUTADO ESTADUAL,PROFESSOR RONALDO,JOSÉ RONALDO ALONSO MATHIAS,SUPLENTE,PV,PARTIDO VERDE,1
ILHABELA,DEPUTADO ESTADUAL,JUNIOR RAAD,ANTONIOS YOUSSIF RAAD JUNIOR,SUPLENTE,PV,PARTIDO VERDE,12
ILHABELA,DEPUTADO ESTADUAL,SERGIO GEGERS,SERGIO DE CARVALHO GEGERS,SUPLENTE,PV,PARTIDO VERDE,1
ILHABELA,DEPUTADO ESTADUAL,REGINA GONÇALVES,MARIA REGINA GONÇALVES,SUPLENTE,PV,PARTIDO VERDE,208
ILHABELA,DEPUTADO ESTADUAL,DOUGLAS SILVA,DOUGLAS DE OLIVEIRA SILVA,SUPLENTE,PV,PARTIDO VERDE,1
ILHABELA,DEPUTADO ESTADUAL,PROFESSOR EMERSON LIMA,EMERSON LIMA DOS SANTOS,SUPLENTE,PV,PARTIDO VERDE,1
ILHABELA,DEPUTADO ESTADUAL,PASTOR DILMO DOS SANTOS,DILMO DOS SANTOS,ELEITO,PV,PARTIDO VERDE,34
ILHABELA,DEPUTADO ESTADUAL,FOZ DO PV,LUIZ CARLOS FERNANDES FOZ,SUPLENTE,PV,PARTIDO VERDE,5
ILHABELA,DEPUTADO ESTADUAL,ADENOR SILVA,ADENOR FERREIRA DA SILVA,SUPLENTE,PV,PARTIDO VERDE,1
ILHABELA,DEPUTADO ESTADUAL,DENIS MARICATO,DENIS MAURILIO MARICATO,SUPLENTE,PV,PARTIDO VERDE,2
ILHABELA,DEPUTADO ESTADUAL,DEBORAH VERISSIMO,DEBORAH ESTER VERISSIMO CAMARGO,SUPLENTE,PV,PARTIDO VERDE,1
ILHABELA,DEPUTADO ESTADUAL,DR FLAVIO,FLAVIO ISAIAS RODRIGUES,SUPLENTE,PV,PARTIDO VERDE,2
ILHABELA,DEPUTADO ESTADUAL,HÉLIO PROENÇA,HÉLIO PROENÇA GONÇALVES,SUPLENTE,PV,PARTIDO VERDE,2
ILHABELA,DEPUTADO ESTADUAL,DRA. MARIA DE JESUS,MARIA ALMEIDA DANTAS,SUPLENTE,PV,PARTIDO VERDE,4
ILHABELA,DEPUTADO ESTADUAL,HELIO RUBENS,HELIO RUBENS GONÇALVES FIGUEIREDO,SUPLENTE,PSDB,PSDB/DEM,38
ILHABELA,DEPUTADO ESTADUAL,PROFESSOR BETO VARUSSA,JOSÉ ROBERTO VARUSSA,SUPLENTE,PSDB,PSDB/DEM,3
ILHABELA,DEPUTADO ESTADUAL,PROF MENEZES,NIVALDO COSTA MENEZES,SUPLENTE,PSDB,PSDB/DEM,1
ILHABELA,DEPUTADO ESTADUAL,UBIRAJARA GUIMARÃES,UBIRAJARA PEREIRA GUIMARÃES,SUPLENTE,PSDB,PSDB/DEM,11
ILHABELA,DEPUTADO ESTADUAL,DR ENIO SANTINELLI,ENIO SANTINELLI,SUPLENTE,PSDB,PSDB/DEM,1
ILHABELA,DEPUTADO ESTADUAL,MARCONES,MARCONES EDSON VICTOR,SUPLENTE,PSDB,PSDB/DEM,1
ILHABELA,DEPUTADO ESTADUAL,PEDRO TOBIAS,PEDRO TOBIAS,ELEITO,PSDB,PSDB/DEM,3
ILHABELA,DEPUTADO ESTADUAL,MILTON FLAVIO,MILTON FLAVIO MARQUES LAUTENSCHLAGER,SUPLENTE,PSDB,PSDB/DEM,3
ILHABELA,DEPUTADO ESTADUAL,GERALDO VINHOLI,GERALDO ANTONIO VINHOLI,SUPLENTE,PSDB,PSDB/DEM,3
ILHABELA,DEPUTADO ESTADUAL,PROF. ADEMIR,JOSÉ ADEMIR DA SILVA,SUPLENTE,PSDB,PSDB/DEM,2
ILHABELA,DEPUTADO ESTADUAL,MARIA LÚCIA AMARY,MARIA LÚCIA CARDOSO PINTO AMARY,MÉDIA,PSDB,PSDB/DEM,3
ILHABELA,DEPUTADO ESTADUAL,RAMALHO DA CONSTRUCAO,ANTONIO DE SOUSA RAMALHO,SUPLENTE,PSDB,PSDB/DEM,7
ILHABELA,DEPUTADO ESTADUAL,WELSON GASPARINI,WELSON GASPARINI,SUPLENTE,PSDB,PSDB/DEM,15
ILHABELA,DEPUTADO ESTADUAL,MAURO BRAGATO,MAURO BRAGATO,ELEITO,PSDB,PSDB/DEM,1
ILHABELA,DEPUTADO ESTADUAL,DR. RICARDO MARTINS,RICARDO MARTINS DE SÃO JOSÉ JUNIOR,SUPLENTE,PSDB,PSDB/DEM,2
ILHABELA,DEPUTADO ESTADUAL,JOÃO CARAMEZ,JOÃO CARLOS CARAMEZ,ELEITO,PSDB,PSDB/DEM,1756
ILHABELA,DEPUTADO ESTADUAL,BRUNO COVAS,BRUNO COVAS LOPES,ELEITO,PSDB,PSDB/DEM,79
ILHABELA,DEPUTADO ESTADUAL,BERNARDO ORTIZ JR,JOSE BERNARDO ORTIZ MONTEIRO JUNIOR,SUPLENTE,PSDB,PSDB/DEM,190
ILHABELA,DEPUTADO ESTADUAL,CLOVIS CHAVES,CLOVIS LUIZ CHAVES,SUPLENTE,PSDB,PSDB/DEM,3
ILHABELA,DEPUTADO ESTADUAL,ROBERTO ENGLER,ROBERTO CARVALHO ENGLER PINTO,ELEITO,PSDB,PSDB/DEM,4
ILHABELA,DEPUTADO ESTADUAL,CELINO,JUSCELINO CARDOSO DE SÁ,ELEITO,PSDB,PSDB/DEM,10
ILHABELA,DEPUTADO ESTADUAL,ARY FOSSEN,ARY FOSSEN,ELEITO,PSDB,PSDB/DEM,1
ILHABELA,DEPUTADO ESTADUAL,CORONEL ERNESTO,ERNESTO CARLOS DA COSTA,SUPLENTE,PSDB,PSDB/DEM,3
ILHABELA,DEPUTADO ESTADUAL,CORONEL JAIR PACA,JAIR PACA DE LIMA,SUPLENTE,PSDB,PSDB/DEM,1
ILHABELA,DEPUTADO ESTADUAL,RICARDO TEIXEIRA,RICARDO TEIXEIRA,SUPLENTE,PSDB,PSDB/DEM,6
ILHABELA,DEPUTADO ESTADUAL,JOSE BORANGA,JOSE AURELIO BORANGA,SUPLENTE,PSDB,PSDB/DEM,4
ILHABELA,DEPUTADO ESTADUAL,WILMA MALTA,WILMA DE FREITAS MALTA,SUPLENTE,PSDB,PSDB/DEM,1
ILHABELA,DEPUTADO ESTADUAL,CÉLIA LEÃO,CÉLIA CAMARGO LEÃO EDELMUTH,ELEITO,PSDB,PSDB/DEM,15
ILHABELA,DEPUTADO ESTADUAL,BUCK JACINTHO,ANTONIO JOÃO COIMBRA JACINTHO,SUPLENTE,PSDB,PSDB/DEM,1
