VÁRZEA PAULISTA,PRESIDENTE,DILMA,DILMA VANA ROUSSEFF,2º TURNO,PT,PARA O BRASIL SEGUIR MUDANDO,28859
VÁRZEA PAULISTA,PRESIDENTE,JOSÉ SERRA,JOSÉ SERRA,2º TURNO,PSDB,O BRASIL PODE MAIS,14823
VÁRZEA PAULISTA,GOVERNADOR,GERALDO ALCKMIN,GERALDO JOSE RODRIGUES ALCKMIN FILHO,ELEITO,PSDB,UNIDOS POR SÃO PAULO,21117
VÁRZEA PAULISTA,SENADOR,MARTA SUPLICY,MARTA SUPLICY,ELEITO,PT,UNIÃO PARA MUDAR,25005
VÁRZEA PAULISTA,SENADOR,ALOYSIO NUNES,ALOYSIO NUNES FERREIRA FILHO,ELEITO,PSDB,UNIDOS POR SÃO PAULO,21674
VÁRZEA PAULISTA,DEPUTADO FEDERAL,DR. ELIEZER COSTA,ELIEZER NASCIMENTO DA COSTA,SUPLENTE,PRB,JUNTOS POR SÃO PAULO,2
VÁRZEA PAULISTA,DEPUTADO FEDERAL,ANTONIO BULHÕES,ANTONIO CARLOS MARTINS DE BULHÕES,ELEITO,PRB,JUNTOS POR SÃO PAULO,8
VÁRZEA PAULISTA,DEPUTADO FEDERAL,ALESSANDER VIGNA,ALESSANDER BARREIRA VIGNA,SUPLENTE,PRB,JUNTOS POR SÃO PAULO,3
VÁRZEA PAULISTA,DEPUTADO FEDERAL,ELCIO AMANCIO,ELCIO AMÂNCIO,SUPLENTE,PRB,JUNTOS POR SÃO PAULO,1
VÁRZEA PAULISTA,DEPUTADO FEDERAL,OTONIEL LIMA,OTONIEL CARLOS DE LIMA,MÉDIA,PRB,JUNTOS POR SÃO PAULO,514
VÁRZEA PAULISTA,DEPUTADO FEDERAL,RATINHO,SEBASTIÃO MARTINS DE AZEVEDO,SUPLENTE,PRB,JUNTOS POR SÃO PAULO,1
VÁRZEA PAULISTA,DEPUTADO FEDERAL,LUIZ SOARES,LUIZ SOARES TEIXEIRA,SUPLENTE,PRB,JUNTOS POR SÃO PAULO,3
VÁRZEA PAULISTA,DEPUTADO FEDERAL,JEFERSON CAMILLO,JEFERSON CAMILLO DE OLIVEIRA,SUPLENTE,PP,PARTIDO PROGRESSISTA,3
VÁRZEA PAULISTA,DEPUTADO FEDERAL,MISSIONÁRIA CICERA BEZERRA,CICERA MARIA BEZERRA DA SILVA,SUPLENTE,PP,PARTIDO PROGRESSISTA,1
VÁRZEA PAULISTA,DEPUTADO FEDERAL,AUREA PARANHOS,AUREA APARECIDA ALVES PARANHOS,SUPLENTE,PP,PARTIDO PROGRESSISTA,1
VÁRZEA PAULISTA,DEPUTADO FEDERAL,PAULA AGUIAR,PAULA APARECIDA RODRIGUES DE AGUIAR,SUPLENTE,PP,PARTIDO PROGRESSISTA,1
VÁRZEA PAULISTA,DEPUTADO FEDERAL,MALUF,PAULO SALIM MALUF,ELEITO,PP,PARTIDO PROGRESSISTA,439
VÁRZEA PAULISTA,DEPUTADO FEDERAL,RUBENEUTON OLIVEIRA LIMA,RUBENEUTON OLIVEIRA LIMA,SUPLENTE,PP,PARTIDO PROGRESSISTA,12
VÁRZEA PAULISTA,DEPUTADO FEDERAL,ANGINHO DOS TECLADOS,ANGELO MARINHO DE ALMEIDA,SUPLENTE,PP,PARTIDO PROGRESSISTA,2
VÁRZEA PAULISTA,DEPUTADO FEDERAL,CARLOS OCTAVIANI,JOSÉ CARLOS OCTAVIANI,SUPLENTE,PP,PARTIDO PROGRESSISTA,3
VÁRZEA PAULISTA,DEPUTADO FEDERAL,LALO,JOSÉ CARLOS TALDIVO,SUPLENTE,PP,PARTIDO PROGRESSISTA,2
VÁRZEA PAULISTA,DEPUTADO FEDERAL,RENATO REICHANN,RUY RENATO REICHMANN,SUPLENTE,PP,PARTIDO PROGRESSISTA,1
VÁRZEA PAULISTA,DEPUTADO FEDERAL,BATORÉ,IVANILDO GOMES NOGUEIRA,SUPLENTE,PP,PARTIDO PROGRESSISTA,29
VÁRZEA PAULISTA,DEPUTADO FEDERAL,MANOEL MOREIRA,MANOEL MOREIRA DE ARAUJO FILHO,SUPLENTE,PP,PARTIDO PROGRESSISTA,2
VÁRZEA PAULISTA,DEPUTADO FEDERAL,ADELINA ALCANTARA MACHADO,ADELINA PEREIRA DA SILVEIRA DE ALCANTARA MACHADO,SUPLENTE,PP,PARTIDO PROGRESSISTA,1
VÁRZEA PAULISTA,DEPUTADO FEDERAL,LIBERATO DE VALENTIM GENTIL,LIBERATO ROCHA CALDEIRA,SUPLENTE,PP,PARTIDO PROGRESSISTA,18
VÁRZEA PAULISTA,DEPUTADO FEDERAL,LAURINDO BARNARDES,LAURINDO BERNARDES DE SOUZA,SUPLENTE,PP,PARTIDO PROGRESSISTA,5
VÁRZEA PAULISTA,DEPUTADO FEDERAL,MAURICIO MARTINS,MAURICIO LUIS MARTINS,SUPLENTE,PP,PARTIDO PROGRESSISTA,4
VÁRZEA PAULISTA,DEPUTADO FEDERAL,PEDRINHO BARACAT,ASSAD NACLE BARACAT,SUPLENTE,PP,PARTIDO PROGRESSISTA,1
VÁRZEA PAULISTA,DEPUTADO FEDERAL,ALINE CORREA,ALINE LEMOS CORREA DE OLIVEIRA ANDRADE,ELEITO,PP,PARTIDO PROGRESSISTA,13
VÁRZEA PAULISTA,DEPUTADO FEDERAL,PASTOR MARCOS MOTOLO,MARCOS CINTAS MOTOLO,SUPLENTE,PP,PARTIDO PROGRESSISTA,1
VÁRZEA PAULISTA,DEPUTADO FEDERAL,TELLES,DOMINGOS TELLES SANCHES,SUPLENTE,PP,PARTIDO PROGRESSISTA,2
VÁRZEA PAULISTA,DEPUTADO FEDERAL,MARCELO CORREIA,MARCELO CORREIA DE SOUZA,SUPLENTE,PP,PARTIDO PROGRESSISTA,2
VÁRZEA PAULISTA,DEPUTADO FEDERAL,CATARINA RIGINIK,CATARINA BEATRIZ GASPAROTTO RIGINIK,SUPLENTE,PP,PARTIDO PROGRESSISTA,76
VÁRZEA PAULISTA,DEPUTADO FEDERAL,BETO MANSUR,PAULO ROBERTO GOMES MANSUR,ELEITO,PP,PARTIDO PROGRESSISTA,7
VÁRZEA PAULISTA,DEPUTADO FEDERAL,ADHEMAR DE BARROS FILHO,ADHEMAR DE BARROS FILHO,SUPLENTE,PP,PARTIDO PROGRESSISTA,3
VÁRZEA PAULISTA,DEPUTADO FEDERAL,LAYRTON INFANTE,LAYRTON INFANTE,SUPLENTE,PP,PARTIDO PROGRESSISTA,1
VÁRZEA PAULISTA,DEPUTADO FEDERAL,MAURICIO TCHÊ DA TORRE,MAURICIO EDUARDO MELLO PEREIRA,SUPLENTE,PP,PARTIDO PROGRESSISTA,1
VÁRZEA PAULISTA,DEPUTADO FEDERAL,CABO WILSON,WILSON DE OLIVEIRA MORAIS,SUPLENTE,PP,PARTIDO PROGRESSISTA,2
VÁRZEA PAULISTA,DEPUTADO FEDERAL,MISSIONÁRIO JOSÉ OLIMPIO,JOSÉ OLIMPIO SILVEIRA MORAES,ELEITO,PP,PARTIDO PROGRESSISTA,588
VÁRZEA PAULISTA,DEPUTADO FEDERAL,FERNANDO STANCATTI,FERNANDO CESAR STANCATTI MARQUES,SUPLENTE,PP,PARTIDO PROGRESSISTA,13
VÁRZEA PAULISTA,DEPUTADO FEDERAL,DR NECHAR,SERGIO ANTONIO NECHAR,SUPLENTE,PP,PARTIDO PROGRESSISTA,41
VÁRZEA PAULISTA,DEPUTADO FEDERAL,MARIO YAMASHITA,JOSÉ MARIO YAMASHITA,SUPLENTE,PP,PARTIDO PROGRESSISTA,4
VÁRZEA PAULISTA,DEPUTADO FEDERAL,NETO BELUCI,ALCIDES BELUCI NETO,SUPLENTE,PP,PARTIDO PROGRESSISTA,10
VÁRZEA PAULISTA,DEPUTADO FEDERAL,PRICILA MENIN,LETEIA PRICILA GOMES,SUPLENTE,PP,PARTIDO PROGRESSISTA,12
VÁRZEA PAULISTA,DEPUTADO FEDERAL,JORGE WILSON,JORGE WILSON GONÇALVES DE MATTOS,SUPLENTE,PP,PARTIDO PROGRESSISTA,4
VÁRZEA PAULISTA,DEPUTADO FEDERAL,CAPITÃO CRIVELARI,LUIZ ANTONIO CRIVELARI,SUPLENTE,PP,PARTIDO PROGRESSISTA,3
VÁRZEA PAULISTA,DEPUTADO FEDERAL,MARCELO MARIANO,MARCELO RICARDO MARIANO,SUPLENTE,PP,PARTIDO PROGRESSISTA,1
VÁRZEA PAULISTA,DEPUTADO FEDERAL,VADÃO,ETIVALDO VADAO GOMES,SUPLENTE,PP,PARTIDO PROGRESSISTA,11
VÁRZEA PAULISTA,DEPUTADO FEDERAL,PH,PAULO HENRIQUE RIBEIRO SANTANA,SUPLENTE,PDT,PARTIDO DEMOCRÁTICO TRABALHISTA,3
VÁRZEA PAULISTA,DEPUTADO FEDERAL,CARLITO VIANA,CARLITO VIANA SOARES,SUPLENTE,PDT,PARTIDO DEMOCRÁTICO TRABALHISTA,1
VÁRZEA PAULISTA,DEPUTADO FEDERAL,JOÃO DADO,JOÃO EDUARDO DADO LEITE DE CARVALHO,ELEITO,PDT,PARTIDO DEMOCRÁTICO TRABALHISTA,12
VÁRZEA PAULISTA,DEPUTADO FEDERAL,PAULINHO DA FORÇA,PAULO PEREIRA DA SILVA,ELEITO,PDT,PARTIDO DEMOCRÁTICO TRABALHISTA,382
VÁRZEA PAULISTA,DEPUTADO FEDERAL,ELISEU DANIEL,ELISEU DANIEL DOS SANTOS,SUPLENTE,PDT,PARTIDO DEMOCRÁTICO TRABALHISTA,4
VÁRZEA PAULISTA,DEPUTADO FEDERAL,ARMANDO HENRIQUE,ARMANDO HENRIQUE,SUPLENTE,PDT,PARTIDO DEMOCRÁTICO TRABALHISTA,2
VÁRZEA PAULISTA,DEPUTADO FEDERAL,MARTAN,MARCELO MARTIN,SUPLENTE,PDT,PARTIDO DEMOCRÁTICO TRABALHISTA,1
VÁRZEA PAULISTA,DEPUTADO FEDERAL,BOAVENTURA,BOAVENTURA PEREIRA SANTOS,SUPLENTE,PDT,PARTIDO DEMOCRÁTICO TRABALHISTA,1
VÁRZEA PAULISTA,DEPUTADO FEDERAL,KAREN HEINS,KAREN MAYELLEN TONIM HEINS,SUPLENTE,PDT,PARTIDO DEMOCRÁTICO TRABALHISTA,4
VÁRZEA PAULISTA,DEPUTADO FEDERAL,PEDRO BAPTISTINI,PEDRO ANTONIO BAPTISTINI,SUPLENTE,PDT,PARTIDO DEMOCRÁTICO TRABALHISTA,1
VÁRZEA PAULISTA,DEPUTADO FEDERAL,SAULO GOES,SAULO GOES DE ALBUQUERQUE,SUPLENTE,PDT,PARTIDO DEMOCRÁTICO TRABALHISTA,6
VÁRZEA PAULISTA,DEPUTADO FEDERAL,MEDEIROS,LUIZ ANTONIO DE MEDEIROS NETO,SUPLENTE,PDT,PARTIDO DEMOCRÁTICO TRABALHISTA,2
VÁRZEA PAULISTA,DEPUTADO FEDERAL,GILBERTO BENZI,GILBERTO BENZI,SUPLENTE,PDT,PARTIDO DEMOCRÁTICO TRABALHISTA,3
VÁRZEA PAULISTA,DEPUTADO FEDERAL,EDUARDO NASCIMENTO,EDUARDO DUARTE DO NASCIMENTO,SUPLENTE,PDT,PARTIDO DEMOCRÁTICO TRABALHISTA,2
VÁRZEA PAULISTA,DEPUTADO FEDERAL,DR LUIZ CHIAPARINE,LUIZ CARLOS CHIAPARINE,SUPLENTE,PDT,PARTIDO DEMOCRÁTICO TRABALHISTA,16
VÁRZEA PAULISTA,DEPUTADO FEDERAL,NELSINHO DA BAHIA,NELSON FRANCISCO DOS SANTOS,SUPLENTE,PDT,PARTIDO DEMOCRÁTICO TRABALHISTA,7
VÁRZEA PAULISTA,DEPUTADO FEDERAL,MANOEL ANTUNES,MANOEL ANTUNES,SUPLENTE,PDT,PARTIDO DEMOCRÁTICO TRABALHISTA,5
VÁRZEA PAULISTA,DEPUTADO FEDERAL,DEF.BIODIESEL-SILASEDUARDOINKE,SILAS EDUARDO INKE,SUPLENTE,PDT,PARTIDO DEMOCRÁTICO TRABALHISTA,5
VÁRZEA PAULISTA,DEPUTADO FEDERAL,PILOTO,AGRIPINO BARBOSA MACEDO,SUPLENTE,PDT,PARTIDO DEMOCRÁTICO TRABALHISTA,5
VÁRZEA PAULISTA,DEPUTADO FEDERAL,CARLOS HENRIQUE,CARLOS HENRIQUE PINTO,SUPLENTE,PDT,PARTIDO DEMOCRÁTICO TRABALHISTA,2
VÁRZEA PAULISTA,DEPUTADO FEDERAL,MAURICIO SOARES JUNIOR,MAURICIO SOARES DE ALMEIDA JUNIOR,SUPLENTE,PDT,PARTIDO DEMOCRÁTICO TRABALHISTA,2
VÁRZEA PAULISTA,DEPUTADO FEDERAL,DRA DEBORA,DEBORA MARIA MARAGNI PEREIRA DE ABREU,SUPLENTE,PDT,PARTIDO DEMOCRÁTICO TRABALHISTA,1
VÁRZEA PAULISTA,DEPUTADO FEDERAL,SALVADOR ZIMBALDI,SALVADOR ZIMBALDI FILHO,MÉDIA,PDT,PARTIDO DEMOCRÁTICO TRABALHISTA,91
VÁRZEA PAULISTA,DEPUTADO FEDERAL,DRA ZIRVA,ZIRVA DAS GRAÇAS PIRES PEREIRA,SUPLENTE,PDT,PARTIDO DEMOCRÁTICO TRABALHISTA,2
VÁRZEA PAULISTA,DEPUTADO FEDERAL,LINDOLFO DOS SANTOS,LINDOLFO LUIZ DOS SANTOS NETO,SUPLENTE,PDT,PARTIDO DEMOCRÁTICO TRABALHISTA,3
VÁRZEA PAULISTA,DEPUTADO FEDERAL,FERNANDO CHIARELLI,FERNANDO CHIARELLI,SUPLENTE,PDT,PARTIDO DEMOCRÁTICO TRABALHISTA,3
VÁRZEA PAULISTA,DEPUTADO FEDERAL,GILBERTO LOPES,GILBERTO FERREIRA LOPES,SUPLENTE,PDT,PARTIDO DEMOCRÁTICO TRABALHISTA,1
VÁRZEA PAULISTA,DEPUTADO FEDERAL,NEI,RODNEI OLIVEIRA DA SILVA,SUPLENTE,PDT,PARTIDO DEMOCRÁTICO TRABALHISTA,1
VÁRZEA PAULISTA,DEPUTADO FEDERAL,SARGENTO ERNALDO,ERNALDO CESAR MARCONDES,SUPLENTE,PDT,PARTIDO DEMOCRÁTICO TRABALHISTA,2
VÁRZEA PAULISTA,DEPUTADO FEDERAL,VALDEVAN NOVENTA,JOSE VALDEVAM DE JESUS SANTOS,SUPLENTE,PDT,PARTIDO DEMOCRÁTICO TRABALHISTA,3
VÁRZEA PAULISTA,DEPUTADO FEDERAL,IVANIO BATISTA,IVANIO BATISTA DA SILVA,SUPLENTE,PT,JUNTOS POR SÃO PAULO,18
VÁRZEA PAULISTA,DEPUTADO FEDERAL,VICENTE CANDIDO,VICENTE CANDIDO DA SILVA,ELEITO,PT,JUNTOS POR SÃO PAULO,512
VÁRZEA PAULISTA,DEPUTADO FEDERAL,PROFESSOR JAIR BALESTRA,JAIR DONIZETI BALESTRA,SUPLENTE,PT,JUNTOS POR SÃO PAULO,4
VÁRZEA PAULISTA,DEPUTADO FEDERAL,MARQUINHOS OLÍVIO,MARCOS OLIVIO CONCEIÇÃO,SUPLENTE,PT,JUNTOS POR SÃO PAULO,4
VÁRZEA PAULISTA,DEPUTADO FEDERAL,TUNAI,MARCO SOARES FERNANDES,SUPLENTE,PT,JUNTOS POR SÃO PAULO,3
VÁRZEA PAULISTA,DEPUTADO FEDERAL,IARA BERNARDI,IARA BERNARDI,SUPLENTE,PT,JUNTOS POR SÃO PAULO,143
VÁRZEA PAULISTA,DEPUTADO FEDERAL,LARGUESA,LUIS VANDERLEI LARGUESA,SUPLENTE,PT,JUNTOS POR SÃO PAULO,47
VÁRZEA PAULISTA,DEPUTADO FEDERAL,VACCAREZZA,CANDIDO ELPIDIO DE SOUZA VACCAREZZA,ELEITO,PT,JUNTOS POR SÃO PAULO,14
VÁRZEA PAULISTA,DEPUTADO FEDERAL,GENOINO,JOSÉ GENOÍNO NETO,SUPLENTE,PT,JUNTOS POR SÃO PAULO,280
VÁRZEA PAULISTA,DEPUTADO FEDERAL,OSMAR LOPES,OSMAR LOPES,SUPLENTE,PT,JUNTOS POR SÃO PAULO,2
VÁRZEA PAULISTA,DEPUTADO FEDERAL,HELCIO SILVA,HELCIO ANTONIO DA SILVA,SUPLENTE,PT,JUNTOS POR SÃO PAULO,11
VÁRZEA PAULISTA,DEPUTADO FEDERAL,MISA BOITO,MARIA EMILIA SEDEH BOITO,SUPLENTE,PT,JUNTOS POR SÃO PAULO,1
VÁRZEA PAULISTA,DEPUTADO FEDERAL,NEWTON LIMA NETO,NEWTON LIMA NETO,ELEITO,PT,JUNTOS POR SÃO PAULO,575
VÁRZEA PAULISTA,DEPUTADO FEDERAL,TEREZINHA RONDELLI,MARIA TEREZINHA RONDELLI,SUPLENTE,PT,JUNTOS POR SÃO PAULO,7
VÁRZEA PAULISTA,DEPUTADO FEDERAL,GERSON SARTORI,GERSON HENRIQUE SARTORI,SUPLENTE,PT,JUNTOS POR SÃO PAULO,3753
VÁRZEA PAULISTA,DEPUTADO FEDERAL,FILIPPI,JOSÉ DE FILIPPI JÚNIOR,ELEITO,PT,JUNTOS POR SÃO PAULO,10
VÁRZEA PAULISTA,DEPUTADO FEDERAL,ARLINDO CHINAGLIA,ARLINDO CHIGNALIA JUNIOR,ELEITO,PT,JUNTOS POR SÃO PAULO,523
VÁRZEA PAULISTA,DEPUTADO FEDERAL,JOÃO PAULO CUNHA,JOÃO PAULO CUNHA,ELEITO,PT,JUNTOS POR SÃO PAULO,146
VÁRZEA PAULISTA,DEPUTADO FEDERAL,ROQUE FERREIRA,ROQUE JOSÉ FERREIRA,SUPLENTE,PT,JUNTOS POR SÃO PAULO,8
VÁRZEA PAULISTA,DEPUTADO FEDERAL,JOÃO BATISTA,JOÃO BATISTA DA SILVA,SUPLENTE,PT,JUNTOS POR SÃO PAULO,1
VÁRZEA PAULISTA,DEPUTADO FEDERAL,PIVATTO,JOSÉ PIVATTO,SUPLENTE,PT,JUNTOS POR SÃO PAULO,10
VÁRZEA PAULISTA,DEPUTADO FEDERAL,RICARDO BERZOINI,RICARDO JOSE RIBEIRO BERZOINI,ELEITO,PT,JUNTOS POR SÃO PAULO,349
VÁRZEA PAULISTA,DEPUTADO FEDERAL,JOSÉ MENTOR,JOSÉ MENTOR GUILHERME DE MELLO NETTO,ELEITO,PT,JUNTOS POR SÃO PAULO,200
VÁRZEA PAULISTA,DEPUTADO FEDERAL,PROF. CARLÃO RAMIRO,CARLOS RAMIRO CASTRO,SUPLENTE,PT,JUNTOS POR SÃO PAULO,28
VÁRZEA PAULISTA,DEPUTADO FEDERAL,FÉLIX SAHÃO,FÉLIX SAHÃO JÚNIOR,SUPLENTE,PT,JUNTOS POR SÃO PAULO,7
VÁRZEA PAULISTA,DEPUTADO FEDERAL,ROGÉRIO PINTO,ROGÉRIO PINTO FERNANDES,SUPLENTE,PT,JUNTOS POR SÃO PAULO,15
VÁRZEA PAULISTA,DEPUTADO FEDERAL,TENENTE PAZ,FRANCISCO JESUS DA PAZ,SUPLENTE,PT,JUNTOS POR SÃO PAULO,5
VÁRZEA PAULISTA,DEPUTADO FEDERAL,RODRIGO VALVERDE,JORGE RODRIGO VALVERDE SANTANA,SUPLENTE,PT,JUNTOS POR SÃO PAULO,2
VÁRZEA PAULISTA,DEPUTADO FEDERAL,VANDERLEI SIRAQUE,VANDERLEI SIRAQUE,SUPLENTE,PT,JUNTOS POR SÃO PAULO,22
VÁRZEA PAULISTA,DEPUTADO FEDERAL,REINALDO,REINALDO SANTOS RAMOS,SUPLENTE,PT,JUNTOS POR SÃO PAULO,3
VÁRZEA PAULISTA,DEPUTADO FEDERAL,LUIZ CARLOS GOMES,LUIZ CARLOS GOMES,SUPLENTE,PT,JUNTOS POR SÃO PAULO,14
VÁRZEA PAULISTA,DEPUTADO FEDERAL,JILMAR TATTO,JILMAR AUGUSTINHO TATTO,ELEITO,PT,JUNTOS POR SÃO PAULO,502
VÁRZEA PAULISTA,DEPUTADO FEDERAL,DURVAL ORLATO,DURVAL LOPES ORLATO,SUPLENTE,PT,JUNTOS POR SÃO PAULO,3317
VÁRZEA PAULISTA,DEPUTADO FEDERAL,EDSON DA PAZ (O CANTOR),EDSON DA PAZ,SUPLENTE,PT,JUNTOS POR SÃO PAULO,5
VÁRZEA PAULISTA,DEPUTADO FEDERAL,JANIO RIBEIRO,JANIO RIBEIRO,SUPLENTE,PT,JUNTOS POR SÃO PAULO,8
VÁRZEA PAULISTA,DEPUTADO FEDERAL,RUBINHO BASTOS,RUBENS BASTOS DO NASCIMENTO,SUPLENTE,PT,JUNTOS POR SÃO PAULO,2
VÁRZEA PAULISTA,DEPUTADO FEDERAL,REGINALDO PERNAMBUCANO,REGINALDO CARNEIRO DE MOURA,SUPLENTE,PT,JUNTOS POR SÃO PAULO,1
VÁRZEA PAULISTA,DEPUTADO FEDERAL,CARLOS AQUINO,JOSÉ CARLOS DE AQUINO,SUPLENTE,PT,JUNTOS POR SÃO PAULO,1
VÁRZEA PAULISTA,DEPUTADO FEDERAL,RENATO SIMÕES,RENATO SIMÕES,SUPLENTE,PT,JUNTOS POR SÃO PAULO,479
VÁRZEA PAULISTA,DEPUTADO FEDERAL,DEVANIR RIBEIRO,DEVANIR RIBEIRO,ELEITO,PT,JUNTOS POR SÃO PAULO,3
VÁRZEA PAULISTA,DEPUTADO FEDERAL,ZARATTINI,CARLOS ALBERTO ROLIM ZARATTINI,ELEITO,PT,JUNTOS POR SÃO PAULO,235
VÁRZEA PAULISTA,DEPUTADO FEDERAL,DR RONALDO BRESCIANI,RONALDO JOSÉ BRESCIANI,SUPLENTE,PT,JUNTOS POR SÃO PAULO,1
VÁRZEA PAULISTA,DEPUTADO FEDERAL,ANGELO BARRETO,ANGELO RAFAEL BARRETO,SUPLENTE,PT,JUNTOS POR SÃO PAULO,6
VÁRZEA PAULISTA,DEPUTADO FEDERAL,JANETE PIETÁ,JANETE ROCHA PIETÁ,ELEITO,PT,JUNTOS POR SÃO PAULO,135
VÁRZEA PAULISTA,DEPUTADO FEDERAL,VALDECI CHIRANHA,VALDECI FERREIRA DA SILVA,SUPLENTE,PT,JUNTOS POR SÃO PAULO,3
VÁRZEA PAULISTA,DEPUTADO FEDERAL,VICENTINHO,VICENTE PAULO DA SILVA,ELEITO,PT,JUNTOS POR SÃO PAULO,1829
VÁRZEA PAULISTA,DEPUTADO FEDERAL,DOUGLAS MOREIRA,DOUGLAS SIMAS MOREIRA,SUPLENTE,PT,JUNTOS POR SÃO PAULO,1
VÁRZEA PAULISTA,DEPUTADO FEDERAL,PAULO TEIXEIRA,LUIZ PAULO TEIXEIRA FERREIRA,ELEITO,PT,JUNTOS POR SÃO PAULO,297
VÁRZEA PAULISTA,DEPUTADO FEDERAL,CLAURY,CLAURY SANTOS ALVES DA SILVA,SUPLENTE,PTB,PARTIDO TRABALHISTA BRASILEIRO,1
VÁRZEA PAULISTA,DEPUTADO FEDERAL,VAMPETA,MARCOS ANDRE BATISTA SANTOS,SUPLENTE,PTB,PARTIDO TRABALHISTA BRASILEIRO,15
VÁRZEA PAULISTA,DEPUTADO FEDERAL,NADUR,ADALBERTO NADUR,SUPLENTE,PTB,PARTIDO TRABALHISTA BRASILEIRO,1
VÁRZEA PAULISTA,DEPUTADO FEDERAL,SANTANA,JOSE SANTANA DE ABREU,SUPLENTE,PTB,PARTIDO TRABALHISTA BRASILEIRO,3
VÁRZEA PAULISTA,DEPUTADO FEDERAL,ESTER,ESTER DA SILVA,SUPLENTE,PTB,PARTIDO TRABALHISTA BRASILEIRO,9
VÁRZEA PAULISTA,DEPUTADO FEDERAL,ROBSON TUMA,ROBSON TUMA,SUPLENTE,PTB,PARTIDO TRABALHISTA BRASILEIRO,10
VÁRZEA PAULISTA,DEPUTADO FEDERAL,RICARDO OLIVEIRA,RICARDO JOSE DE OLIVEIRA,SUPLENTE,PTB,PARTIDO TRABALHISTA BRASILEIRO,1
VÁRZEA PAULISTA,DEPUTADO FEDERAL,VITOR DO SUPER JOSÉ,VITOR FRANCISCO DA SILVA,SUPLENTE,PTB,PARTIDO TRABALHISTA BRASILEIRO,1
VÁRZEA PAULISTA,DEPUTADO FEDERAL,AMIRAH SABA DA METROPOLITANAFM,AMIRAH SABA,SUPLENTE,PTB,PARTIDO TRABALHISTA BRASILEIRO,1
VÁRZEA PAULISTA,DEPUTADO FEDERAL,SINVAL DORIGON,SINVAL ROBERTO DORIGON,SUPLENTE,PTB,PARTIDO TRABALHISTA BRASILEIRO,2
VÁRZEA PAULISTA,DEPUTADO FEDERAL,NELSON MARQUEZELLI,NELSON MARQUEZELLI,ELEITO,PTB,PARTIDO TRABALHISTA BRASILEIRO,17
VÁRZEA PAULISTA,DEPUTADO FEDERAL,FRANCISCO MESQUITA,FRANCISCO CICERO MESQUITA,SUPLENTE,PTB,PARTIDO TRABALHISTA BRASILEIRO,1
VÁRZEA PAULISTA,DEPUTADO FEDERAL,WALDOMIRO RAMOS,WALDOMIRO CARLOS RAMOS,SUPLENTE,PTB,PARTIDO TRABALHISTA BRASILEIRO,10
VÁRZEA PAULISTA,DEPUTADO FEDERAL,DR MOYSES,JOAO MOYSES ABUJADI,SUPLENTE,PTB,PARTIDO TRABALHISTA BRASILEIRO,2
VÁRZEA PAULISTA,DEPUTADO FEDERAL,LUIZ MIELLI,JOSÉ FERNANDO DE SOUSA MIELLI,SUPLENTE,PTB,PARTIDO TRABALHISTA BRASILEIRO,1
VÁRZEA PAULISTA,DEPUTADO FEDERAL,BRESSAN,ANTONIO BRESSAN FILHO,SUPLENTE,PTB,PARTIDO TRABALHISTA BRASILEIRO,1
VÁRZEA PAULISTA,DEPUTADO FEDERAL,ARNALDO FARIA DE SÁ,ARNALDO FARIA DE SÁ,ELEITO,PTB,PARTIDO TRABALHISTA BRASILEIRO,179
VÁRZEA PAULISTA,DEPUTADO FEDERAL,CELIO DINIZ,CELIO FRANCISCO DINIZ,SUPLENTE,PTB,PARTIDO TRABALHISTA BRASILEIRO,1
VÁRZEA PAULISTA,DEPUTADO FEDERAL,CLAUDIA SARTORI,CLAUDIA SARTORI DONATTI DE SOUZA,SUPLENTE,PTB,PARTIDO TRABALHISTA BRASILEIRO,2
VÁRZEA PAULISTA,DEPUTADO FEDERAL,MADONNAKÁ É KATIA THOMÉ,KATIA REGINA TOMÉ,SUPLENTE,PTB,PARTIDO TRABALHISTA BRASILEIRO,1
VÁRZEA PAULISTA,DEPUTADO FEDERAL,FRANK AGUIAR,FRANCINETO LUZ DE AGUIAR,SUPLENTE,PTB,PARTIDO TRABALHISTA BRASILEIRO,14
VÁRZEA PAULISTA,DEPUTADO FEDERAL,PASTOR JOAO ALMEIDA,JOAO ALMEIDA DOS SANTOS,SUPLENTE,PTB,PARTIDO TRABALHISTA BRASILEIRO,1
VÁRZEA PAULISTA,DEPUTADO FEDERAL,PADRE FERNANDO,LAUDINEY FERNANDO SILVA FRAGA,SUPLENTE,PTB,PARTIDO TRABALHISTA BRASILEIRO,14
VÁRZEA PAULISTA,DEPUTADO FEDERAL,DR SEGURA,JOSE APARECIDO SEGURA RUIZ,SUPLENTE,PTB,PARTIDO TRABALHISTA BRASILEIRO,1
VÁRZEA PAULISTA,DEPUTADO FEDERAL,PAULO LIMA,PAULO CESAR DE OLIVEIRA LIMA,SUPLENTE,PMDB,PARTIDO DO MOVIMENTO DEMOCRÁTICO BRASILEIRO,7
VÁRZEA PAULISTA,DEPUTADO FEDERAL,CARVALHO SALES,JEFFERSON CARVALHO SALES,SUPLENTE,PMDB,PARTIDO DO MOVIMENTO DEMOCRÁTICO BRASILEIRO,10
VÁRZEA PAULISTA,DEPUTADO FEDERAL,VANDERLEI JUELI,VANDERLEI JUELI,SUPLENTE,PMDB,PARTIDO DO MOVIMENTO DEMOCRÁTICO BRASILEIRO,4
VÁRZEA PAULISTA,DEPUTADO FEDERAL,ANA CRISTINA,ANA CRISTINA FERNANDES GIAMPIETRO,SUPLENTE,PMDB,PARTIDO DO MOVIMENTO DEMOCRÁTICO BRASILEIRO,6
VÁRZEA PAULISTA,DEPUTADO FEDERAL,NENÊ MONTANHER,ALCIDES MONTANHER FILHO,SUPLENTE,PMDB,PARTIDO DO MOVIMENTO DEMOCRÁTICO BRASILEIRO,3
VÁRZEA PAULISTA,DEPUTADO FEDERAL,MARCOS TENÓRIO,MARCOS ANTÔNIO FERREIRA TENÓRIO,SUPLENTE,PMDB,PARTIDO DO MOVIMENTO DEMOCRÁTICO BRASILEIRO,2
VÁRZEA PAULISTA,DEPUTADO FEDERAL,PAULINHO SOBRAL,PAULO MENDES SOBRAL,SUPLENTE,PMDB,PARTIDO DO MOVIMENTO DEMOCRÁTICO BRASILEIRO,11
VÁRZEA PAULISTA,DEPUTADO FEDERAL,BONFÁ,ALVARO BONFA JUNIOR,SUPLENTE,PMDB,PARTIDO DO MOVIMENTO DEMOCRÁTICO BRASILEIRO,2
VÁRZEA PAULISTA,DEPUTADO FEDERAL,TONY JUPSSON,TONY JUPSSON SANTOS,SUPLENTE,PMDB,PARTIDO DO MOVIMENTO DEMOCRÁTICO BRASILEIRO,2
VÁRZEA PAULISTA,DEPUTADO FEDERAL,EDUARDO COELHO,EDUARDO JOSÉ PEREIRA COELHO,SUPLENTE,PMDB,PARTIDO DO MOVIMENTO DEMOCRÁTICO BRASILEIRO,16
VÁRZEA PAULISTA,DEPUTADO FEDERAL,DIEGO MARTINS,DIEGO OLIVEIRA MARTINS,SUPLENTE,PMDB,PARTIDO DO MOVIMENTO DEMOCRÁTICO BRASILEIRO,1
VÁRZEA PAULISTA,DEPUTADO FEDERAL,CASTANHO,GULHERME DE MELLO CASTANHO,SUPLENTE,PMDB,PARTIDO DO MOVIMENTO DEMOCRÁTICO BRASILEIRO,2
VÁRZEA PAULISTA,DEPUTADO FEDERAL,SINIVAL,SINIVAL JOSE INACIO,SUPLENTE,PMDB,PARTIDO DO MOVIMENTO DEMOCRÁTICO BRASILEIRO,1
VÁRZEA PAULISTA,DEPUTADO FEDERAL,EDINHO ARAUJO,EDSON EDINHO COELHO ARAUJO,ELEITO,PMDB,PARTIDO DO MOVIMENTO DEMOCRÁTICO BRASILEIRO,11
VÁRZEA PAULISTA,DEPUTADO FEDERAL,LIMA JUNIOR,JULIO CEZAR DA SILVA LIMA JUNIOR,SUPLENTE,PMDB,PARTIDO DO MOVIMENTO DEMOCRÁTICO BRASILEIRO,1
VÁRZEA PAULISTA,DEPUTADO FEDERAL,LAZARO,JOSE LAZARO MELO,SUPLENTE,PMDB,PARTIDO DO MOVIMENTO DEMOCRÁTICO BRASILEIRO,1
VÁRZEA PAULISTA,DEPUTADO FEDERAL,SERGIO KOBRA,SERGIO MARTINS DOS SANTOS JUNIOR,SUPLENTE,PMDB,PARTIDO DO MOVIMENTO DEMOCRÁTICO BRASILEIRO,1
VÁRZEA PAULISTA,DEPUTADO FEDERAL,DR. AJURICABA,AJURICABA DE SOUZA MENEZES,SUPLENTE,PMDB,PARTIDO DO MOVIMENTO DEMOCRÁTICO BRASILEIRO,1
VÁRZEA PAULISTA,DEPUTADO FEDERAL,LEONEL NA HORA,LEONEL HERNANDEZ JUNIOR,SUPLENTE,PMDB,PARTIDO DO MOVIMENTO DEMOCRÁTICO BRASILEIRO,2
VÁRZEA PAULISTA,DEPUTADO FEDERAL,ANTONIO MARTINS DA COSTA,ANTONIO MARTINS DA COSTA,SUPLENTE,PMDB,PARTIDO DO MOVIMENTO DEMOCRÁTICO BRASILEIRO,7
VÁRZEA PAULISTA,DEPUTADO FEDERAL,CORONEL EX GAMA SANTOS,FERDNAN GAMA SANTOS,SUPLENTE,PMDB,PARTIDO DO MOVIMENTO DEMOCRÁTICO BRASILEIRO,1
VÁRZEA PAULISTA,DEPUTADO FEDERAL,REGA,ALBERTO REGA,SUPLENTE,PMDB,PARTIDO DO MOVIMENTO DEMOCRÁTICO BRASILEIRO,1
VÁRZEA PAULISTA,DEPUTADO FEDERAL,LÉO OLIVEIRA,OCIMAR DONIZETI LEO OLIVEIRA,SUPLENTE,PMDB,PARTIDO DO MOVIMENTO DEMOCRÁTICO BRASILEIRO,1
VÁRZEA PAULISTA,DEPUTADO FEDERAL,CLERISTON VALLE,CLERISTON PEREIRA DO VALLE,SUPLENTE,PMDB,PARTIDO DO MOVIMENTO DEMOCRÁTICO BRASILEIRO,16
VÁRZEA PAULISTA,DEPUTADO FEDERAL,MAIRÁ,MARIA DE JESUS MATIAS,SUPLENTE,PMDB,PARTIDO DO MOVIMENTO DEMOCRÁTICO BRASILEIRO,1
VÁRZEA PAULISTA,DEPUTADO FEDERAL,JB SILVA,JOÃO BATISTA SILVA,SUPLENTE,PMDB,PARTIDO DO MOVIMENTO DEMOCRÁTICO BRASILEIRO,1
VÁRZEA PAULISTA,DEPUTADO FEDERAL,RINALDO,RINALDO ALVES PEREIRA,SUPLENTE,PMDB,PARTIDO DO MOVIMENTO DEMOCRÁTICO BRASILEIRO,1
VÁRZEA PAULISTA,DEPUTADO FEDERAL,JOÃO DA FARMÁCIA,JOÃO LUIZ ROMANINI,SUPLENTE,PMDB,PARTIDO DO MOVIMENTO DEMOCRÁTICO BRASILEIRO,2
VÁRZEA PAULISTA,DEPUTADO FEDERAL,DR. CÉSAR,LUIZ CESAR REGINATO,SUPLENTE,PMDB,PARTIDO DO MOVIMENTO DEMOCRÁTICO BRASILEIRO,1
VÁRZEA PAULISTA,DEPUTADO FEDERAL,MORATO,JOSÉ ANTONIO MORATO,SUPLENTE,PMDB,PARTIDO DO MOVIMENTO DEMOCRÁTICO BRASILEIRO,1
VÁRZEA PAULISTA,DEPUTADO FEDERAL,GERALDÃO,GERALDO TOMAZ AUGUSTO,SUPLENTE,PMDB,PARTIDO DO MOVIMENTO DEMOCRÁTICO BRASILEIRO,3
VÁRZEA PAULISTA,DEPUTADO FEDERAL,RICARDO HOLZ,RICARDO HOLZ VIDAL DOS SANTOS,SUPLENTE,PMDB,PARTIDO DO MOVIMENTO DEMOCRÁTICO BRASILEIRO,1
VÁRZEA PAULISTA,DEPUTADO FEDERAL,A. TRIUNFO AVELLAR,AGUINALDO TRIUMPHO AVELLAR,SUPLENTE,PMDB,PARTIDO DO MOVIMENTO DEMOCRÁTICO BRASILEIRO,1
VÁRZEA PAULISTA,DEPUTADO FEDERAL,EVANDRO MEIRA,EVANDRO ANTONIO DE MEIRA,SUPLENTE,PMDB,PARTIDO DO MOVIMENTO DEMOCRÁTICO BRASILEIRO,2
VÁRZEA PAULISTA,DEPUTADO FEDERAL,DR. SAMIR NASSBINE,SAMIR ASSAD NASSBINE,SUPLENTE,PMDB,PARTIDO DO MOVIMENTO DEMOCRÁTICO BRASILEIRO,5
VÁRZEA PAULISTA,DEPUTADO FEDERAL,SARGENTO SEVERO,LUCIANO APARECIDO SEVERO,SUPLENTE,PSL,PRESTE ATENÇÃO SÃO PAULO,22
VÁRZEA PAULISTA,DEPUTADO FEDERAL,CAMILA FERNANDA,CAMILA FERNANDA DOS SANTOS,SUPLENTE,PSL,PRESTE ATENÇÃO SÃO PAULO,1
VÁRZEA PAULISTA,DEPUTADO FEDERAL,MISSIONÁRIA NÉIA SANCHES,EDNEIA GOMES SANCHES,SUPLENTE,PSL,PRESTE ATENÇÃO SÃO PAULO,7
VÁRZEA PAULISTA,DEPUTADO FEDERAL,CANTORA LEA DE ARAUJO,LEA DE ARAUJO,SUPLENTE,PSL,PRESTE ATENÇÃO SÃO PAULO,1
VÁRZEA PAULISTA,DEPUTADO FEDERAL,ROBERTO SIQUEIRA,ROBERTO SIQUEIRA GOMES,SUPLENTE,PSL,PRESTE ATENÇÃO SÃO PAULO,23
VÁRZEA PAULISTA,DEPUTADO FEDERAL,CORONEL GILSON LOPES,GILSON LOPES DA SILVA,SUPLENTE,PSC,HUMANISTA CRISTÃO ,2
VÁRZEA PAULISTA,DEPUTADO FEDERAL,MISSIONARIA NAZARE,MARIA NAZARE DOS SANTOS SORRILLO,SUPLENTE,PSC,HUMANISTA CRISTÃO ,357
VÁRZEA PAULISTA,DEPUTADO FEDERAL,CLEBER DELALIBERA,CLEBER DE MOURA DELALIBERA,SUPLENTE,PSC,HUMANISTA CRISTÃO ,4
VÁRZEA PAULISTA,DEPUTADO FEDERAL,MARCO FELICIANO,MARCO ANTONIO FELICIANO,ELEITO,PSC,HUMANISTA CRISTÃO ,365
VÁRZEA PAULISTA,DEPUTADO FEDERAL,MARCELO AGUIAR,MARCELO THEODORO DE AGUIAR,ELEITO,PSC,HUMANISTA CRISTÃO ,153
VÁRZEA PAULISTA,DEPUTADO FEDERAL,CHICO NETO,FRANCISCO DA COSTA NETO,SUPLENTE,PSC,HUMANISTA CRISTÃO ,6
VÁRZEA PAULISTA,DEPUTADO FEDERAL,ARI BARCELLOS,JOSE DE ARIMATHEA BARCELLOS,SUPLENTE,PSC,HUMANISTA CRISTÃO ,3
VÁRZEA PAULISTA,DEPUTADO FEDERAL,GISON SOARES,GISON ALVES SOARES,SUPLENTE,PSC,HUMANISTA CRISTÃO ,1
VÁRZEA PAULISTA,DEPUTADO FEDERAL,REGIS DE OLIVEIRA,REGIS FERNANDES DE OLIVEIRA,SUPLENTE,PSC,HUMANISTA CRISTÃO ,162
VÁRZEA PAULISTA,DEPUTADO FEDERAL,SILVIA PALMA,SILVIA ELIANA PALMA,SUPLENTE,PSC,HUMANISTA CRISTÃO ,1
VÁRZEA PAULISTA,DEPUTADO FEDERAL,NEY SANTOS,CLAUDINEI ALVES DOS SANTOS,SUPLENTE,PSC,HUMANISTA CRISTÃO ,7
VÁRZEA PAULISTA,DEPUTADO FEDERAL,DALVAN,JOÃO GOMES DE ALMEIDA,SUPLENTE,PSC,HUMANISTA CRISTÃO ,33
VÁRZEA PAULISTA,DEPUTADO FEDERAL,DUDA VILELA,CARLOS EDUARDO VILELA,SUPLENTE,PSC,HUMANISTA CRISTÃO ,10
VÁRZEA PAULISTA,DEPUTADO FEDERAL,CICERO FERNANDES,JOSE CICERO FERNANDES DA SILVA,SUPLENTE,PSC,HUMANISTA CRISTÃO ,4
VÁRZEA PAULISTA,DEPUTADO FEDERAL,PR. LUIZ LEMOS,LUIZ CARLOS LEMOS,SUPLENTE,PSC,HUMANISTA CRISTÃO ,16
VÁRZEA PAULISTA,DEPUTADO FEDERAL,DANILO MIKILIM,DANILO JOSE DE TOLEDO,SUPLENTE,PSC,HUMANISTA CRISTÃO ,1
VÁRZEA PAULISTA,DEPUTADO FEDERAL,MAURÃO,JOSE MAURO PEREIRA DE BARROS,SUPLENTE,PSC,HUMANISTA CRISTÃO ,1
VÁRZEA PAULISTA,DEPUTADO FEDERAL,PRICILA LEME,PRICILA HELENA MOYSES LEME,SUPLENTE,PSC,HUMANISTA CRISTÃO ,13
VÁRZEA PAULISTA,DEPUTADO FEDERAL,MAURO SANTOS,WILSON MORAL MARTOS,SUPLENTE,PSC,HUMANISTA CRISTÃO ,1
VÁRZEA PAULISTA,DEPUTADO FEDERAL,TONINHO CORREDOR,ANTONIO CICERO DA SILVA,SUPLENTE,PSC,HUMANISTA CRISTÃO ,1
VÁRZEA PAULISTA,DEPUTADO FEDERAL,JUCA CHAVES,JURANDYR CZACZKES CHAVES,SUPLENTE,PR,JUNTOS POR SÃO PAULO,12
VÁRZEA PAULISTA,DEPUTADO FEDERAL,AGNALDO TIMOTEO,AGUINALDO TIMOTEO PEREIRA,SUPLENTE,PR,JUNTOS POR SÃO PAULO,13
VÁRZEA PAULISTA,DEPUTADO FEDERAL,TIRIRICA,FRANCISCO EVERARDO OLIVEIRA SILVA,ELEITO,PR,JUNTOS POR SÃO PAULO,2957
VÁRZEA PAULISTA,DEPUTADO FEDERAL,PR PAULO FREIRE,PAULO ROBERTO FREIRE DA COSTA,ELEITO,PR,JUNTOS POR SÃO PAULO,2378
VÁRZEA PAULISTA,DEPUTADO FEDERAL,LUCIANA COSTA,LUCIANA DE ALMEIDA COSTA,SUPLENTE,PR,JUNTOS POR SÃO PAULO,8
VÁRZEA PAULISTA,DEPUTADO FEDERAL,MILTON MONTI,MILTON ANTONIO CASQUEL MONTI,ELEITO,PR,JUNTOS POR SÃO PAULO,5
VÁRZEA PAULISTA,DEPUTADO FEDERAL,VALDEMAR COSTA NETO,VALDEMAR COSTA NETO,ELEITO,PR,JUNTOS POR SÃO PAULO,128
VÁRZEA PAULISTA,DEPUTADO FEDERAL,WILLIAM WOO,WILLIAM BOSS WOO,SUPLENTE,PPS,PSDB/DEM/PPS,1
VÁRZEA PAULISTA,DEPUTADO FEDERAL,VALDEMAR ANFRISIO,VALDEMAR ANFRISIO DOS SANTOS,SUPLENTE,PPS,PSDB/DEM/PPS,1
VÁRZEA PAULISTA,DEPUTADO FEDERAL,ROBERTO FREIRE,ROBERTO JOAO PEREIRA FREIRE,ELEITO,PPS,PSDB/DEM/PPS,39
VÁRZEA PAULISTA,DEPUTADO FEDERAL,CORONEL EDSON SARDANO,EDSON DE JESUS SARDANO,SUPLENTE,PPS,PSDB/DEM/PPS,5
VÁRZEA PAULISTA,DEPUTADO FEDERAL,DIMAS RAMALHO,DIMAS EDUARDO RAMALHO,ELEITO,PPS,PSDB/DEM/PPS,1
VÁRZEA PAULISTA,DEPUTADO FEDERAL,MARCOS DA FOTO,SIUSAKU HIRASHIMA,SUPLENTE,PPS,PSDB/DEM/PPS,1
VÁRZEA PAULISTA,DEPUTADO FEDERAL,ARI FRIEDENBACH,ARI FRIEDENBACH,SUPLENTE,PPS,PSDB/DEM/PPS,19
