ILHABELA,DEPUTADO ESTADUAL,ADOLFO QUINTAS,ADOLFO QUINTAS GONÇALVES NETO,SUPLENTE,PSDB,PSDB/DEM,4
ILHABELA,DEPUTADO ESTADUAL,BORELI,OSWALDO LUIZ OLIVEIRA BORRELLI,SUPLENTE,PSDB,PSDB/DEM,4
ILHABELA,DEPUTADO ESTADUAL,FORDINHO,ANTONIO CARLOS DE FARIA,SUPLENTE,PSDB,PSDB/DEM,1
ILHABELA,DEPUTADO ESTADUAL,SAMUEL MOREIRA,SAMUEL MOREIRA DA SILVA JÚNIOR,ELEITO,PSDB,PSDB/DEM,651
ILHABELA,DEPUTADO ESTADUAL,ADMIR FERRO,ADMIR DONIZETI FERRO,SUPLENTE,PSDB,PSDB/DEM,4
ILHABELA,DEPUTADO ESTADUAL,CASSIO NAVARRO,CASSIO DE CASTRO NAVARRO,SUPLENTE,PSDB,PSDB/DEM,131
ILHABELA,DEPUTADO ESTADUAL,CARLOS BEZERRA JR.,CARLOS ALBERTO DE QUADROS BEZERRA JUNIOR,ELEITO,PSDB,PSDB/DEM,7
ILHABELA,DEPUTADO ESTADUAL,CARLOS ALBERTO SANTOS,CARLOS ALBERTO DE OLIVEIRA SANTOS,SUPLENTE,PSDB,PSDB/DEM,1
ILHABELA,DEPUTADO ESTADUAL,MAURICIO PINTERICH,MAURICIO DE OLIVEIRA PINTERICH,SUPLENTE,PSDB,PSDB/DEM,3
ILHABELA,DEPUTADO ESTADUAL,ANALICE FERNANDES,ANALICE FERNANDES,ELEITO,PSDB,PSDB/DEM,1
ILHABELA,DEPUTADO ESTADUAL,DRA MARY,MARY LUCIA FRANCISCO,SUPLENTE,PSDB,PSDB/DEM,2
ILHABELA,DEPUTADO ESTADUAL,FELIPE AUGUSTO,FELIPE AUGUSTO,SUPLENTE,PSDB,PSDB/DEM,113
ILHABELA,DEPUTADO ESTADUAL,THIAGO LOBO,THIAGO ANTUNES CAVALCA REIS LOBO,SUPLENTE,PSDB,PSDB/DEM,8
ILHABELA,DEPUTADO ESTADUAL,CAUÊ MACRIS,CAUÊ CASEIRO MACRIS,MÉDIA,PSDB,PSDB/DEM,4
ILHABELA,DEPUTADO ESTADUAL,EDISON CANDIDO,EDISON APARECIDO CANDIDO,SUPLENTE,PSDB,PSDB/DEM,5
ILHABELA,DEPUTADO ESTADUAL,CONCCI MARCO,ELIANE CONCEIÇÃO SILVA MENDES,SUPLENTE,PSDB,PSDB/DEM,4
ILHABELA,DEPUTADO ESTADUAL,JOÃO SANZOVO,JOÃO SANZOVO NETO,SUPLENTE,PSDB,PSDB/DEM,3
ILHABELA,DEPUTADO ESTADUAL,VALÉRIA,VALÉRIA CRISTINA MIGLIORANCI,SUPLENTE,PSDB,PSDB/DEM,1
ILHABELA,DEPUTADO ESTADUAL,ZÉ AILTON,JOSE AILTON RIBEIRO,SUPLENTE,PSDB,PSDB/DEM,2
ILHABELA,DEPUTADO ESTADUAL,VICTOR KOBAYASHI,VICTOR KOBAYASHI,SUPLENTE,PSDB,PSDB/DEM,17
ILHABELA,DEPUTADO ESTADUAL,OLAVO DONATO,JOÃO OLAVO DE DONATO,SUPLENTE,PSDB,PSDB/DEM,2
ILHABELA,DEPUTADO ESTADUAL,BARROS MUNHOZ,JOSE ANTONIO BARROS MUNHOZ,ELEITO,PSDB,PSDB/DEM,4
ILHABELA,DEPUTADO ESTADUAL,CELSO GIGLIO,CELSO ANTONIO GIGLIO,ELEITO,PSDB,PSDB/DEM,7
ILHABELA,DEPUTADO ESTADUAL,HELIO NISHIMOTO,HELIO NISHIMOTO,ELEITO,PSDB,PSDB/DEM,7
ILHABELA,DEPUTADO ESTADUAL,KATIA SOLIS,KATIA CRISTINA BELISARIO SOLIS,SUPLENTE,PSDB,PSDB/DEM,4
ILHABELA,DEPUTADO ESTADUAL,PAULO ALEXANDRE BARBOSA,PAULO ALEXANDRE PEREIRA BARBOSA,ELEITO,PSDB,PSDB/DEM,30
ILHABELA,DEPUTADO ESTADUAL,ARTUR ORSI,ARTUR CASSEB ORSI,SUPLENTE,PSDB,PSDB/DEM,6
ILHABELA,DEPUTADO ESTADUAL,GILSON BARRETO,GILSON ALMEIDA BARRETO,SUPLENTE,PSDB,PSDB/DEM,5
ILHABELA,DEPUTADO ESTADUAL,JOÃO NILTON DO UNIÃO SERV,JOÃO NILTON GONÇALVES,SUPLENTE,PSDB,PSDB/DEM,2
ILHABELA,DEPUTADO ESTADUAL,JOSE AUGUSTO,JOSE AUGUSTO DA SILVA RAMOS,SUPLENTE,PSDB,PSDB/DEM,4
ILHABELA,DEPUTADO ESTADUAL,ORLANDO MORANDO,ORLANDO MORANDO JUNIOR,ELEITO,PSDB,PSDB/DEM,4
ILHABELA,DEPUTADO ESTADUAL,FERNANDO CAPEZ,FERNANDO CAPEZ,ELEITO,PSDB,PSDB/DEM,97
ILHABELA,DEPUTADO ESTADUAL,MARCUS NAZARETH PEÇANHA,MARCUS NAZARETH PEÇANHA,SUPLENTE,PSDB,PSDB/DEM,1
ILHABELA,DEPUTADO ESTADUAL,JOSÉ LUIZ RIBEIRO,JOSÉ LUIZ RIBEIRO,SUPLENTE,PSDB,PSDB/DEM,27
ILHABELA,DEPUTADO ESTADUAL,MARCOS ZERBINI,MARCOS ANTONIO ZERBINI,ELEITO,PSDB,PSDB/DEM,1
ILHABELA,DEPUTADO ESTADUAL,MILTON DALLARI,JOSÉ MILTON DALLARI SOARES,SUPLENTE,PSDB,PSDB/DEM,12
ILHABELA,DEPUTADO ESTADUAL,DIOBEL DA DIDOL'S,DIOBEL DE LIMA FERNANDES,SUPLENTE,PSDB,PSDB/DEM,2
ILHABELA,DEPUTADO ESTADUAL,PROFª ROSANA,MARIA ROSANA FERRARI NASSAR,SUPLENTE,PSDB,PSDB/DEM,2
ILHABELA,DEPUTADO ESTADUAL,DR RUBENS,RUBENS YOSHIDA,SUPLENTE,PSDB,PSDB/DEM,1
ILHABELA,DEPUTADO ESTADUAL,CLÁUDIO FURQUIM,CLÁUDIO SIMÕES FURQUIM LEITE JÚNIOR,SUPLENTE,PSDB,PSDB/DEM,1
ILHABELA,DEPUTADO ESTADUAL,MARCELO REINA,MARCELO REINA SILIANO,SUPLENTE,PSOL,PARTIDO SOCIALISMO E LIBERDADE,5
ILHABELA,DEPUTADO ESTADUAL,JORGE NELSON,JORGE NELSON DA SILVA AMARAL,SUPLENTE,PSOL,PARTIDO SOCIALISMO E LIBERDADE,2
ILHABELA,DEPUTADO ESTADUAL,ANA CAROLINA CORREIA,ANA CAROLINA CORREIA,SUPLENTE,PSOL,PARTIDO SOCIALISMO E LIBERDADE,2
ILHABELA,DEPUTADO ESTADUAL,LUIZ DO CHURRASCO,LUIZ ADEMIR MARQUES,SUPLENTE,PSOL,PARTIDO SOCIALISMO E LIBERDADE,1
ILHABELA,DEPUTADO ESTADUAL,JOÃO AMORIM,JOÃO MIGUEL DE AMORIM,SUPLENTE,PSOL,PARTIDO SOCIALISMO E LIBERDADE,30
ILHABELA,DEPUTADO ESTADUAL,LAIRTON SANTOS,LAIRTON LUIS DOS SANTOS,SUPLENTE,PSOL,PARTIDO SOCIALISMO E LIBERDADE,1
ILHABELA,DEPUTADO ESTADUAL,MARCELO,MARCELO SEBASTIÃO FIORI LINO DE SOUZA,SUPLENTE,PSOL,PARTIDO SOCIALISMO E LIBERDADE,1
ILHABELA,DEPUTADO ESTADUAL,RAUL MARCELO,RAUL MARCELO DE SOUZA,SUPLENTE,PSOL,PARTIDO SOCIALISMO E LIBERDADE,5
ILHABELA,DEPUTADO ESTADUAL,EDUARDO AMARAL,EDUARDO GARCIA CARVALHO DO AMARAL,SUPLENTE,PSOL,PARTIDO SOCIALISMO E LIBERDADE,1
ILHABELA,DEPUTADO ESTADUAL,CARLOS GIANNAZI,CARLOS ALBERTO GIANNASI,ELEITO,PSOL,PARTIDO SOCIALISMO E LIBERDADE,26
ILHABELA,DEPUTADO ESTADUAL,WANDER,WANDER DE OLIVEIRA VILLALBA,SUPLENTE,PC DO B,PARTIDO COMUNISTA DO BRASIL,2
ILHABELA,DEPUTADO ESTADUAL,ERLEI ALIADO,ERLEI ROBERTO DE MELO,SUPLENTE,PC DO B,PARTIDO COMUNISTA DO BRASIL,11
ILHABELA,DEPUTADO ESTADUAL,LECI BRANDÃO,LECI BRANDAO DA SILVA,ELEITO,PC DO B,PARTIDO COMUNISTA DO BRASIL,22
ILHABELA,DEPUTADO ESTADUAL,SARAH MUNHOZ,SARAH MUNHOZ,SUPLENTE,PC DO B,PARTIDO COMUNISTA DO BRASIL,1
ILHABELA,DEPUTADO ESTADUAL,ADIB,ADIB ABDOUNI,SUPLENTE,PC DO B,PARTIDO COMUNISTA DO BRASIL,1
ILHABELA,DEPUTADO ESTADUAL,ALCIDES AMAZONAS,ALCIDES ARAUJO DOS SANTOS,SUPLENTE,PC DO B,PARTIDO COMUNISTA DO BRASIL,1
ILHABELA,DEPUTADO ESTADUAL,DAVI RAMOS,DAVI GONÇALVES RAMOS,SUPLENTE,PC DO B,PARTIDO COMUNISTA DO BRASIL,5
ILHABELA,DEPUTADO ESTADUAL,GABRIEL BITENCOURT,GABRIEL CESAR BITENCOURT,SUPLENTE,PC DO B,PARTIDO COMUNISTA DO BRASIL,3
ILHABELA,DEPUTADO ESTADUAL,CAJU,RICARDO ALVES DA SILVA,SUPLENTE,PC DO B,PARTIDO COMUNISTA DO BRASIL,2
ILHABELA,DEPUTADO ESTADUAL,PROFESSOR FLAVIO DELMANTO,FLAVIO DELMANTO,SUPLENTE,PC DO B,PARTIDO COMUNISTA DO BRASIL,4
ILHABELA,DEPUTADO ESTADUAL,GERCI MOREIRA,GERCI MOREIRA,SUPLENTE,PC DO B,PARTIDO COMUNISTA DO BRASIL,1
ILHABELA,DEPUTADO ESTADUAL,PEDRINHO BENTIVOGLIO,PEDRO RODOLFO MINARI BENTIVOGLIO,SUPLENTE,PC DO B,PARTIDO COMUNISTA DO BRASIL,3
ILHABELA,DEPUTADO ESTADUAL,HELIFAX,HELIFAX PINTO DE SOUZA,SUPLENTE,PC DO B,PARTIDO COMUNISTA DO BRASIL,3
ILHABELA,DEPUTADO ESTADUAL,DITO LEITE,SILVIO ROBERTO PACHECO,SUPLENTE,PC DO B,PARTIDO COMUNISTA DO BRASIL,1
ILHABELA,DEPUTADO ESTADUAL,NICANOR BARBOSA,NICANOR OLIVEIRA BARBOSA,SUPLENTE,PT DO B,SOMOS MAIS SÃO PAULO,1
ILHABELA,DEPUTADO ESTADUAL,TOTA,EDIVALDO GOMES DE OLIVEIRA,SUPLENTE,PT DO B,SOMOS MAIS SÃO PAULO,1
ILHABELA,DEPUTADO ESTADUAL,PAULO CORRÊA JR,PAULO ALVES CORRÊA JUNIOR,SUPLENTE,PT DO B,SOMOS MAIS SÃO PAULO,804
ILHABELA,DEPUTADO ESTADUAL,MAYRA TELES,MAYRA MARA TELES DA COSTA,SUPLENTE,PT DO B,SOMOS MAIS SÃO PAULO,3
