PRESIDENTE PRUDENTE,DEPUTADO ESTADUAL,JOÃO ELIAS,JOÃO ELIAS PEREIRA,SUPLENTE,PDT,PARTIDO DEMOCRÁTICO TRABALHISTA,3
PRESIDENTE PRUDENTE,DEPUTADO ESTADUAL,JOSE DE ALMEIDA,JOSE MALVINEITE DE ALMEIDA,SUPLENTE,PDT,PARTIDO DEMOCRÁTICO TRABALHISTA,2
PRESIDENTE PRUDENTE,DEPUTADO ESTADUAL,ANDERSON SILVA,ANDERSON DOMINGOS DA SILVA,SUPLENTE,PT,SOMOS MAIS SÃO PAULO,5
PRESIDENTE PRUDENTE,DEPUTADO ESTADUAL,TELMA DE SOUZA,TELMA SANDRA AUGUSTO DE SOUZA,ELEITO,PT,SOMOS MAIS SÃO PAULO,3
PRESIDENTE PRUDENTE,DEPUTADO ESTADUAL,DR. JOÃO CARLOS,JOÃO CARLOS FRANÇA DE PAULA SANTOS,SUPLENTE,PT,SOMOS MAIS SÃO PAULO,2
PRESIDENTE PRUDENTE,DEPUTADO ESTADUAL,PEDRO BIANGULI,PEDRO CARLOS BIANGULI DE FARIA,SUPLENTE,PT,SOMOS MAIS SÃO PAULO,3
PRESIDENTE PRUDENTE,DEPUTADO ESTADUAL,GALENO AMORIM,GALENO DE AMORIM JUNIOR,SUPLENTE,PT,SOMOS MAIS SÃO PAULO,24
PRESIDENTE PRUDENTE,DEPUTADO ESTADUAL,VALMIR PRASCIDELLI,VALMIR PRASCIDELLI,SUPLENTE,PT,SOMOS MAIS SÃO PAULO,32
PRESIDENTE PRUDENTE,DEPUTADO ESTADUAL,ENGª MÔNICA BOMBONATO,MÔNICA ESTELA BOMBONATO,SUPLENTE,PT,SOMOS MAIS SÃO PAULO,1
PRESIDENTE PRUDENTE,DEPUTADO ESTADUAL,PORTUGUÊS,REINALDO FARTO NUNES,SUPLENTE,PT,SOMOS MAIS SÃO PAULO,9
PRESIDENTE PRUDENTE,DEPUTADO ESTADUAL,PAULO MARTINS (GAÚCHO),PAULO CESAR GOMES MARTINS,SUPLENTE,PT,SOMOS MAIS SÃO PAULO,2
PRESIDENTE PRUDENTE,DEPUTADO ESTADUAL,EDINHO SILVA,EDSON ANTONIO EDINHO DA SILVA,ELEITO,PT,SOMOS MAIS SÃO PAULO,64
PRESIDENTE PRUDENTE,DEPUTADO ESTADUAL,ENIO TATTO,ENIO FRANCISCO TATTO,ELEITO,PT,SOMOS MAIS SÃO PAULO,39
PRESIDENTE PRUDENTE,DEPUTADO ESTADUAL,RAFAEL MARINHO,RAFAEL DE FIGUEIREDO MARINHO,SUPLENTE,PT,SOMOS MAIS SÃO PAULO,3
PRESIDENTE PRUDENTE,DEPUTADO ESTADUAL,ANA PERUGINI,ANA LUCIA LIPPAUS PERUGINI,ELEITO,PT,SOMOS MAIS SÃO PAULO,5
PRESIDENTE PRUDENTE,DEPUTADO ESTADUAL,TONINHO DO PT,ANTONIO AMARAL JUNIOR,SUPLENTE,PT,SOMOS MAIS SÃO PAULO,7
PRESIDENTE PRUDENTE,DEPUTADO ESTADUAL,ZICO,JOSÉ PRADO DE ANDRADE,MÉDIA,PT,SOMOS MAIS SÃO PAULO,10
PRESIDENTE PRUDENTE,DEPUTADO ESTADUAL,SALETE CAMPARI,FRANCISCO DE SALES RODRIGUES,SUPLENTE,PT,SOMOS MAIS SÃO PAULO,1
PRESIDENTE PRUDENTE,DEPUTADO ESTADUAL,WILSON SANTOS,WILSON SANTOS PEREIRA,SUPLENTE,PT,SOMOS MAIS SÃO PAULO,13
PRESIDENTE PRUDENTE,DEPUTADO ESTADUAL,MARCO AURÉLIO DE SOUZA,MARCO AURÉLIO DE SOUZA,MÉDIA,PT,SOMOS MAIS SÃO PAULO,1
PRESIDENTE PRUDENTE,DEPUTADO ESTADUAL,MARCOS MARTINS,MARCOS LOPES MARTINS,ELEITO,PT,SOMOS MAIS SÃO PAULO,10
PRESIDENTE PRUDENTE,DEPUTADO ESTADUAL,ELI TEODORO,ELI TEODORO,SUPLENTE,PT,SOMOS MAIS SÃO PAULO,7
PRESIDENTE PRUDENTE,DEPUTADO ESTADUAL,SIMÃO PEDRO,SIMÃO PEDRO CHIOVETTI,ELEITO,PT,SOMOS MAIS SÃO PAULO,18
PRESIDENTE PRUDENTE,DEPUTADO ESTADUAL,IVANETE VIEIRA,IVANETE APARECIDA DOS SANTOS,SUPLENTE,PT,SOMOS MAIS SÃO PAULO,1
PRESIDENTE PRUDENTE,DEPUTADO ESTADUAL,GERALDO CRUZ,GERALDO LEITE DA CRUZ,ELEITO,PT,SOMOS MAIS SÃO PAULO,3
PRESIDENTE PRUDENTE,DEPUTADO ESTADUAL,RUI FALCÃO,RUI GOETHE DA COSTA FALCÃO,ELEITO,PT,SOMOS MAIS SÃO PAULO,1
PRESIDENTE PRUDENTE,DEPUTADO ESTADUAL,DUDU BOLITO,AMARILDO DUDU BOLITO,SUPLENTE,PT,SOMOS MAIS SÃO PAULO,35
PRESIDENTE PRUDENTE,DEPUTADO ESTADUAL,ANTONIO MENTOR,ANTONIO MENTOR DE MELLO SOBRINHO,ELEITO,PT,SOMOS MAIS SÃO PAULO,1
PRESIDENTE PRUDENTE,DEPUTADO ESTADUAL,ADRIANO DIOGO,ADRIANO DIOGO,ELEITO,PT,SOMOS MAIS SÃO PAULO,4
PRESIDENTE PRUDENTE,DEPUTADO ESTADUAL,PROFESSOR MATIAS VIEIRA,MATIAS VIEIRA,SUPLENTE,PT,SOMOS MAIS SÃO PAULO,1
PRESIDENTE PRUDENTE,DEPUTADO ESTADUAL,ESTELA ALMAGRO,ESTELA ALEXANDRE ALMAGRO,SUPLENTE,PT,SOMOS MAIS SÃO PAULO,164
PRESIDENTE PRUDENTE,DEPUTADO ESTADUAL,HAMILTON PEREIRA,HAMILTON PEREIRA,ELEITO,PT,SOMOS MAIS SÃO PAULO,16
PRESIDENTE PRUDENTE,DEPUTADO ESTADUAL,LUIZ CLAUDIO MARCOLINO,LUIZ CLAUDIO MARCOLINO,ELEITO,PT,SOMOS MAIS SÃO PAULO,146
PRESIDENTE PRUDENTE,DEPUTADO ESTADUAL,RENATO DO GEB,RENATO MORENI AIRES DA SILVA,SUPLENTE,PT,SOMOS MAIS SÃO PAULO,5
PRESIDENTE PRUDENTE,DEPUTADO ESTADUAL,DENISE ERBELLA,DENISE ELOÁ CUSTÓDIO ERBELLA DE CASTRO,SUPLENTE,PT,SOMOS MAIS SÃO PAULO,387
PRESIDENTE PRUDENTE,DEPUTADO ESTADUAL,NATIVIDADE,MARIA DA NATIVIDADE PEREIRA LIMA,SUPLENTE,PT,SOMOS MAIS SÃO PAULO,13
PRESIDENTE PRUDENTE,DEPUTADO ESTADUAL,ROBERTO FELICIO,ROBERTO FELICIO,SUPLENTE,PT,SOMOS MAIS SÃO PAULO,58
PRESIDENTE PRUDENTE,DEPUTADO ESTADUAL,ROSANA GASPAR,ROSANA EMILIA GASPAR,SUPLENTE,PT,SOMOS MAIS SÃO PAULO,2
PRESIDENTE PRUDENTE,DEPUTADO ESTADUAL,BETH SAHAO,ELISABETH SAHÃO,SUPLENTE,PT,SOMOS MAIS SÃO PAULO,18
PRESIDENTE PRUDENTE,DEPUTADO ESTADUAL,ADINAN ORTOLAN,JOSÉ ADINAN ORTOLAN,SUPLENTE,PT,SOMOS MAIS SÃO PAULO,3
PRESIDENTE PRUDENTE,DEPUTADO ESTADUAL,FRANCISCO FRANÇA,FRANCISCO FRANÇA DA SILVA,SUPLENTE,PT,SOMOS MAIS SÃO PAULO,40
PRESIDENTE PRUDENTE,DEPUTADO ESTADUAL,LELO PAGANI,LUIZ AURELIO PAGANI,SUPLENTE,PT,SOMOS MAIS SÃO PAULO,5
PRESIDENTE PRUDENTE,DEPUTADO ESTADUAL,ALENCAR,ALENCAR SANTANA BRAGA,ELEITO,PT,SOMOS MAIS SÃO PAULO,454
PRESIDENTE PRUDENTE,DEPUTADO ESTADUAL,TIÃOZINHO,SEBASTIÃO MOREIREA ARCANJO,SUPLENTE,PT,SOMOS MAIS SÃO PAULO,1
PRESIDENTE PRUDENTE,DEPUTADO ESTADUAL,ISAC REIS,ISAC FRANCO DOS REIS,ELEITO,PT,SOMOS MAIS SÃO PAULO,1
PRESIDENTE PRUDENTE,DEPUTADO ESTADUAL,BRENO CORTELLA,BRENO ZANONI CORTELLA,SUPLENTE,PT,SOMOS MAIS SÃO PAULO,35
PRESIDENTE PRUDENTE,DEPUTADO ESTADUAL,JOÃO PAULO RILLO,JOÃO PAULO RILLO,ELEITO,PT,SOMOS MAIS SÃO PAULO,44
PRESIDENTE PRUDENTE,DEPUTADO ESTADUAL,ANA DO CARMO,ANA MARIA DO CARMO ROSSETO,ELEITO,PT,SOMOS MAIS SÃO PAULO,1
PRESIDENTE PRUDENTE,DEPUTADO ESTADUAL,MIRANDA,JOSÉ CARLOS MIRANDA,SUPLENTE,PT,SOMOS MAIS SÃO PAULO,1
PRESIDENTE PRUDENTE,DEPUTADO ESTADUAL,JOSÉ CANDIDO,JOSÉ DE SOUZA CÂNDIDO,MÉDIA,PT,SOMOS MAIS SÃO PAULO,10
PRESIDENTE PRUDENTE,DEPUTADO ESTADUAL,JOÃO ANTONIO,JOAO ANTONIO DA SILVA FILHO,ELEITO,PT,SOMOS MAIS SÃO PAULO,136
PRESIDENTE PRUDENTE,DEPUTADO ESTADUAL,GALLO,JURANDIR GALLO,SUPLENTE,PT,SOMOS MAIS SÃO PAULO,1
PRESIDENTE PRUDENTE,DEPUTADO ESTADUAL,IRENE,IRENE DOS SANTOS,SUPLENTE,PT,SOMOS MAIS SÃO PAULO,2
PRESIDENTE PRUDENTE,DEPUTADO ESTADUAL,MÁRCIO CHAVES,MÁRCIO CHAVES PIRES,SUPLENTE,PT,SOMOS MAIS SÃO PAULO,2
PRESIDENTE PRUDENTE,DEPUTADO ESTADUAL,PROF. ROMAZZINI,LUIS CARLOS ROMAZZINI,SUPLENTE,PT,SOMOS MAIS SÃO PAULO,3
PRESIDENTE PRUDENTE,DEPUTADO ESTADUAL,CARLOS GRANA,CARLOS ALBERTO GRANA,ELEITO,PT,SOMOS MAIS SÃO PAULO,3
PRESIDENTE PRUDENTE,DEPUTADO ESTADUAL,TARCÍSIO,JOSÉ TARCÍSIO DE OLIVEIRA,SUPLENTE,PT,SOMOS MAIS SÃO PAULO,2
PRESIDENTE PRUDENTE,DEPUTADO ESTADUAL,FAUSTO FIGUEIRA,FAUSTO FIGUEIRA DE MELLO JUNIOR,SUPLENTE,PT,SOMOS MAIS SÃO PAULO,5
PRESIDENTE PRUDENTE,DEPUTADO ESTADUAL,ZÉ ANTÔNIO,JOSÉ ANTONIO DA SILVA,SUPLENTE,PT,SOMOS MAIS SÃO PAULO,1
PRESIDENTE PRUDENTE,DEPUTADO ESTADUAL,ELISEU COSTA,ELISEU SILVA COSTA,SUPLENTE,PT,SOMOS MAIS SÃO PAULO,10
PRESIDENTE PRUDENTE,DEPUTADO ESTADUAL,VERA GOULART,VERA LUCIA GOULART GONÇALVES,SUPLENTE,PT,SOMOS MAIS SÃO PAULO,1
PRESIDENTE PRUDENTE,DEPUTADO ESTADUAL,MIRIAN SILVA,MIRIAN MARIA SILVA GOTTZENT,SUPLENTE,PT,SOMOS MAIS SÃO PAULO,1
PRESIDENTE PRUDENTE,DEPUTADO ESTADUAL,TITO,FRANCISCO DE ASSIS PEREIRA DE CAMPOS,SUPLENTE,PT,SOMOS MAIS SÃO PAULO,21
PRESIDENTE PRUDENTE,DEPUTADO ESTADUAL,GILSON PELIZARO,GILSON DONIZETE PELIZARO,SUPLENTE,PT,SOMOS MAIS SÃO PAULO,1
PRESIDENTE PRUDENTE,DEPUTADO ESTADUAL,DONISETE BRAGA,DONISETE PEREIRA BRAGA,ELEITO,PT,SOMOS MAIS SÃO PAULO,2
PRESIDENTE PRUDENTE,DEPUTADO ESTADUAL,CARLOS NEDER,CARLOS ALBERTO PLETZ NEDER,SUPLENTE,PT,SOMOS MAIS SÃO PAULO,26
PRESIDENTE PRUDENTE,DEPUTADO ESTADUAL,DRA NEVES,MARIA DAS NEVES DUARTE,SUPLENTE,PTB,PARTIDO TRABALHISTA BRASILEIRO,1
PRESIDENTE PRUDENTE,DEPUTADO ESTADUAL,PROFª MARA CIDINHA,MARIA APARECIDA BATISTA LEITE,SUPLENTE,PTB,PARTIDO TRABALHISTA BRASILEIRO,1
PRESIDENTE PRUDENTE,DEPUTADO ESTADUAL,ZULEIKA AKYELUZ,ZULEIKA RAMOS,SUPLENTE,PTB,PARTIDO TRABALHISTA BRASILEIRO,4
PRESIDENTE PRUDENTE,DEPUTADO ESTADUAL,LÉO ÁQUILLA,JADSON MENDES DE LIMA,SUPLENTE,PTB,PARTIDO TRABALHISTA BRASILEIRO,22
PRESIDENTE PRUDENTE,DEPUTADO ESTADUAL,TATIANA,TATIANA GULIAEFF,SUPLENTE,PTB,PARTIDO TRABALHISTA BRASILEIRO,3
PRESIDENTE PRUDENTE,DEPUTADO ESTADUAL,DIONE TAVARES,DIONE TAVARES DE MORAES,SUPLENTE,PTB,PARTIDO TRABALHISTA BRASILEIRO,4
PRESIDENTE PRUDENTE,DEPUTADO ESTADUAL,CEBOLINHA,JOAO VIANELLE PINTO,SUPLENTE,PTB,PARTIDO TRABALHISTA BRASILEIRO,1
PRESIDENTE PRUDENTE,DEPUTADO ESTADUAL,JOSÉ THEO DE SOUZA,JOSÉ THEODORO DE SOUZA,SUPLENTE,PTB,PARTIDO TRABALHISTA BRASILEIRO,1
PRESIDENTE PRUDENTE,DEPUTADO ESTADUAL,EVANDRO COSTA NETO,EVANDRO COSTA NETO,SUPLENTE,PTB,PARTIDO TRABALHISTA BRASILEIRO,7
PRESIDENTE PRUDENTE,DEPUTADO ESTADUAL,VENCESLAU ALENCAR LEITE,VENCESLAU ALENCAR LEITE,SUPLENTE,PTB,PARTIDO TRABALHISTA BRASILEIRO,1
PRESIDENTE PRUDENTE,DEPUTADO ESTADUAL,AMARO MARIANO DA SILVA,AMARO MARIANO DA SILVA,SUPLENTE,PTB,PARTIDO TRABALHISTA BRASILEIRO,2
PRESIDENTE PRUDENTE,DEPUTADO ESTADUAL,CONTE LOPES,ROBERVAL CONTE LOPES LIMA,SUPLENTE,PTB,PARTIDO TRABALHISTA BRASILEIRO,34
PRESIDENTE PRUDENTE,DEPUTADO ESTADUAL,CAMPOS MACHADO,ANTONIO CARLOS DE CAMPOS MACHADO,ELEITO,PTB,PARTIDO TRABALHISTA BRASILEIRO,214
PRESIDENTE PRUDENTE,DEPUTADO ESTADUAL,ROQUE BARBIERE - ROQUINHO,ROQUE BARBIERE,ELEITO,PTB,PARTIDO TRABALHISTA BRASILEIRO,13
PRESIDENTE PRUDENTE,DEPUTADO ESTADUAL,SIDNEY DO PQ DO CARMO,SIDNEY DA SILVA,SUPLENTE,PTB,PARTIDO TRABALHISTA BRASILEIRO,1
PRESIDENTE PRUDENTE,DEPUTADO ESTADUAL,HEROILMA SOARES TAVARES,HEROILMA SOARES TAVARES,MÉDIA,PTB,PARTIDO TRABALHISTA BRASILEIRO,3
PRESIDENTE PRUDENTE,DEPUTADO ESTADUAL,MOISES DA FUNERARIA,MOISES ANTONIO DE LIMA,SUPLENTE,PTB,PARTIDO TRABALHISTA BRASILEIRO,1
PRESIDENTE PRUDENTE,DEPUTADO ESTADUAL,CORONEL EDSON FERRARINI,EDSON FERRARINI,ELEITO,PTB,PARTIDO TRABALHISTA BRASILEIRO,39
PRESIDENTE PRUDENTE,DEPUTADO ESTADUAL,DR ANTONIO KHOURI,ANTONIO JOSE SADER KHOURI,SUPLENTE,PTB,PARTIDO TRABALHISTA BRASILEIRO,2
PRESIDENTE PRUDENTE,DEPUTADO ESTADUAL,PROFESSOR MARCELO,MARCELO MIYAZAKI,SUPLENTE,PTB,PARTIDO TRABALHISTA BRASILEIRO,74
PRESIDENTE PRUDENTE,DEPUTADO ESTADUAL,VAL,ENIVALDO RAMOS DE FREITAS,SUPLENTE,PTB,PARTIDO TRABALHISTA BRASILEIRO,10
PRESIDENTE PRUDENTE,DEPUTADO ESTADUAL,TARDELLI,ROBERTO TARDELLI,SUPLENTE,PTB,PARTIDO TRABALHISTA BRASILEIRO,5
PRESIDENTE PRUDENTE,DEPUTADO ESTADUAL,ARNOU VIANA,ARNOU GONCALVES VIANA,SUPLENTE,PTB,PARTIDO TRABALHISTA BRASILEIRO,2
PRESIDENTE PRUDENTE,DEPUTADO ESTADUAL,MARCELO MINGRONE,MARCELO SALVADOR MINGRONE,SUPLENTE,PTB,PARTIDO TRABALHISTA BRASILEIRO,1
PRESIDENTE PRUDENTE,DEPUTADO ESTADUAL,PROFESSORA ALBA LUCENA,ALBA LUCENA FERNANDES GANDIA,SUPLENTE,PTB,PARTIDO TRABALHISTA BRASILEIRO,1938
PRESIDENTE PRUDENTE,DEPUTADO ESTADUAL,WALDIR AGNELLO,WALDIR AGNELLO,SUPLENTE,PTB,PARTIDO TRABALHISTA BRASILEIRO,8
PRESIDENTE PRUDENTE,DEPUTADO ESTADUAL,GILBERTO DO PRIMAVERA,GILBERTO WACHTLER,SUPLENTE,PTB,PARTIDO TRABALHISTA BRASILEIRO,1
PRESIDENTE PRUDENTE,DEPUTADO ESTADUAL,CABO DALMIR E LARANJA,DALMIR MARCIO MARÇAL,SUPLENTE,PTB,PARTIDO TRABALHISTA BRASILEIRO,24
PRESIDENTE PRUDENTE,DEPUTADO ESTADUAL,BALEIA ROSSI,LUIZ FELIPE BALEIA TENUTO ROSSI,ELEITO,PMDB,PARTIDO DO MOVIMENTO DEMOCRÁTICO BRASILEIRO,186
PRESIDENTE PRUDENTE,DEPUTADO ESTADUAL,DRA ADRIANA,ADRIANA DI NARDO SILVA,SUPLENTE,PMDB,PARTIDO DO MOVIMENTO DEMOCRÁTICO BRASILEIRO,12
PRESIDENTE PRUDENTE,DEPUTADO ESTADUAL,REGINALDO NUNES,REGINALDO NUNES BEZERRA,SUPLENTE,PMDB,PARTIDO DO MOVIMENTO DEMOCRÁTICO BRASILEIRO,3286
PRESIDENTE PRUDENTE,DEPUTADO ESTADUAL,HILDA,AMENAILDE DA SILVA OLIVEIRA,SUPLENTE,PMDB,PARTIDO DO MOVIMENTO DEMOCRÁTICO BRASILEIRO,1
PRESIDENTE PRUDENTE,DEPUTADO ESTADUAL,MISTER BAL,GILBERTO FRANCISCO BORGES,SUPLENTE,PMDB,PARTIDO DO MOVIMENTO DEMOCRÁTICO BRASILEIRO,1
PRESIDENTE PRUDENTE,DEPUTADO ESTADUAL,BEBETTO,ALBERTO FELIPPE HADDAD FILHO,SUPLENTE,PMDB,PARTIDO DO MOVIMENTO DEMOCRÁTICO BRASILEIRO,3
PRESIDENTE PRUDENTE,DEPUTADO ESTADUAL,THIAGO FERRARI,THIAGO DE MORAES FERRARI,SUPLENTE,PMDB,PARTIDO DO MOVIMENTO DEMOCRÁTICO BRASILEIRO,7
PRESIDENTE PRUDENTE,DEPUTADO ESTADUAL,DU TONIN,EDUARDO TONIN,SUPLENTE,PMDB,PARTIDO DO MOVIMENTO DEMOCRÁTICO BRASILEIRO,4
PRESIDENTE PRUDENTE,DEPUTADO ESTADUAL,MARCO ANTONIO,MARCO ANTONIO CAMPOS,SUPLENTE,PMDB,PARTIDO DO MOVIMENTO DEMOCRÁTICO BRASILEIRO,1
PRESIDENTE PRUDENTE,DEPUTADO ESTADUAL,CARUSO,JORGE LUIS CARUSO,ELEITO,PMDB,PARTIDO DO MOVIMENTO DEMOCRÁTICO BRASILEIRO,4
PRESIDENTE PRUDENTE,DEPUTADO ESTADUAL,FABIO BELLO,FABIO BELLO DE OLIVEIRA,SUPLENTE,PMDB,PARTIDO DO MOVIMENTO DEMOCRÁTICO BRASILEIRO,394
PRESIDENTE PRUDENTE,DEPUTADO ESTADUAL,SERGIO BERGAMASCO,ANTONIO SERGIO PIRES BERGAMASCO,SUPLENTE,PMDB,PARTIDO DO MOVIMENTO DEMOCRÁTICO BRASILEIRO,3
PRESIDENTE PRUDENTE,DEPUTADO ESTADUAL,MARQUINHOS SKALA,MARCOS DA SILVA MARQUES,SUPLENTE,PMDB,PARTIDO DO MOVIMENTO DEMOCRÁTICO BRASILEIRO,8
PRESIDENTE PRUDENTE,DEPUTADO ESTADUAL,VANESSA DAMO,VANESSA DAMO OROSCO,ELEITO,PMDB,PARTIDO DO MOVIMENTO DEMOCRÁTICO BRASILEIRO,25
PRESIDENTE PRUDENTE,DEPUTADO ESTADUAL,CAMARGO,DOMINGOS FERREIRA DE CAMARGO,SUPLENTE,PMDB,PARTIDO DO MOVIMENTO DEMOCRÁTICO BRASILEIRO,2
PRESIDENTE PRUDENTE,DEPUTADO ESTADUAL,VALDOMIRO,VALDOMIRO FRANCISCO DE OLIVEIRA,SUPLENTE,PMDB,PARTIDO DO MOVIMENTO DEMOCRÁTICO BRASILEIRO,9
PRESIDENTE PRUDENTE,DEPUTADO ESTADUAL,UEBE REZECK,UEBE REZECK,SUPLENTE,PMDB,PARTIDO DO MOVIMENTO DEMOCRÁTICO BRASILEIRO,5
PRESIDENTE PRUDENTE,DEPUTADO ESTADUAL,HABIB,GEORGES HABIB JARROUGE,SUPLENTE,PMDB,PARTIDO DO MOVIMENTO DEMOCRÁTICO BRASILEIRO,5
PRESIDENTE PRUDENTE,DEPUTADO ESTADUAL,CHICÃO SERRA TALHADA,FRANCISCO BEZERRA DOS SANTOS,SUPLENTE,PMDB,PARTIDO DO MOVIMENTO DEMOCRÁTICO BRASILEIRO,3
PRESIDENTE PRUDENTE,DEPUTADO ESTADUAL,ITAMAR BORGES,ITAMAR FRANCISCO MACHADO BORGES,MÉDIA,PMDB,PARTIDO DO MOVIMENTO DEMOCRÁTICO BRASILEIRO,33
PRESIDENTE PRUDENTE,DEPUTADO ESTADUAL,JONAS,JONAS PEREIRA DE LIMA,SUPLENTE,PMDB,PARTIDO DO MOVIMENTO DEMOCRÁTICO BRASILEIRO,6
PRESIDENTE PRUDENTE,DEPUTADO ESTADUAL,DRA SILVANA,SILVANA CASSIA RIBEIRO BAPTISTA,SUPLENTE,PMDB,PARTIDO DO MOVIMENTO DEMOCRÁTICO BRASILEIRO,2
PRESIDENTE PRUDENTE,DEPUTADO ESTADUAL,MARIA DO CARMO GUILHERME,MARIA DO CARMO GUILHERME,SUPLENTE,PMDB,PARTIDO DO MOVIMENTO DEMOCRÁTICO BRASILEIRO,5
PRESIDENTE PRUDENTE,DEPUTADO ESTADUAL,JOOJI HATO,JOOJI HATO,ELEITO,PMDB,PARTIDO DO MOVIMENTO DEMOCRÁTICO BRASILEIRO,33
PRESIDENTE PRUDENTE,DEPUTADO ESTADUAL,JÂNIO,JÂNIO GONÇALVES DE OLIVEIRA,SUPLENTE,PMDB,PARTIDO DO MOVIMENTO DEMOCRÁTICO BRASILEIRO,4
PRESIDENTE PRUDENTE,DEPUTADO ESTADUAL,BARLETTA,ROBERTO BARLETTA,SUPLENTE,PMDB,PARTIDO DO MOVIMENTO DEMOCRÁTICO BRASILEIRO,1
PRESIDENTE PRUDENTE,DEPUTADO ESTADUAL,DRA VIVI FERNANDES,VIVIANI FERNANDES DE OLIVEIRA,SUPLENTE,PMDB,PARTIDO DO MOVIMENTO DEMOCRÁTICO BRASILEIRO,5
PRESIDENTE PRUDENTE,DEPUTADO ESTADUAL,DR. JEFERSON RODRIGUES,JEFERSON RODRIGUES,SUPLENTE,PMDB,PARTIDO DO MOVIMENTO DEMOCRÁTICO BRASILEIRO,1
PRESIDENTE PRUDENTE,DEPUTADO ESTADUAL,COUTINHO JUNIOR,OSWALDO BARBOSA COUTINHO JUNIOR,SUPLENTE,PMDB,PARTIDO DO MOVIMENTO DEMOCRÁTICO BRASILEIRO,1
PRESIDENTE PRUDENTE,DEPUTADO ESTADUAL,OLIVEIRA JUNIOR,ELIO APARECIDO DE OLIVEIRA,SUPLENTE,PSC,HUMANISTA CRISTÃO ,3
PRESIDENTE PRUDENTE,DEPUTADO ESTADUAL,REINALDO BRICOLA,REINALDO BRICOLA,SUPLENTE,PSC,HUMANISTA CRISTÃO ,4
PRESIDENTE PRUDENTE,DEPUTADO ESTADUAL,CELSO NASCIMENTO,CELSO BRAZ DO NASCIMENTO,SUPLENTE,PSC,HUMANISTA CRISTÃO ,109
PRESIDENTE PRUDENTE,DEPUTADO ESTADUAL,APOSTOLO EURIPEDES,EURIPEDES LUIZ DE SOUSA,SUPLENTE,PSC,HUMANISTA CRISTÃO ,23
PRESIDENTE PRUDENTE,DEPUTADO ESTADUAL,ALAN NETO,ANTONIO CARLOS BARBOSA NEVES,SUPLENTE,PSC,HUMANISTA CRISTÃO ,2
PRESIDENTE PRUDENTE,DEPUTADO ESTADUAL,PR. PAGLIARIN,HIDERALDO PAGLIARIN,SUPLENTE,PSC,HUMANISTA CRISTÃO ,1
PRESIDENTE PRUDENTE,DEPUTADO ESTADUAL,LEANDRO AMARAL,LEANDRO GODINES DO AMARAL,SUPLENTE,PSC,HUMANISTA CRISTÃO ,70
PRESIDENTE PRUDENTE,DEPUTADO ESTADUAL,PASTOR VIEIRA ROCHA,JOSE VIEIRA ROCHA,SUPLENTE,PSC,HUMANISTA CRISTÃO ,41
PRESIDENTE PRUDENTE,DEPUTADO ESTADUAL,MARTA LIVIA SUPLICY,MARTA LIVIA BARRAGANA FERNANDES SUPLICY,SUPLENTE,PSC,HUMANISTA CRISTÃO ,2
PRESIDENTE PRUDENTE,DEPUTADO ESTADUAL,JOSÉ ROOSEVELT,JOSÉ ROOSEVELT MARTOS,SUPLENTE,PSC,HUMANISTA CRISTÃO ,1
PRESIDENTE PRUDENTE,DEPUTADO ESTADUAL,ADILSON ROSSI,ADILSON ROSSI,ELEITO,PSC,HUMANISTA CRISTÃO ,15
PRESIDENTE PRUDENTE,DEPUTADO ESTADUAL,RENATO PUPO,RENATO PUPO DE PAULA,SUPLENTE,PSC,HUMANISTA CRISTÃO ,5
PRESIDENTE PRUDENTE,DEPUTADO ESTADUAL,JOÃO BINATO,JOÃO ANTONIO BINATO,SUPLENTE,PSC,HUMANISTA CRISTÃO ,304
PRESIDENTE PRUDENTE,DEPUTADO ESTADUAL,PAULO CHOCOLATE,PAULO SERGIO VIEIRA NEVES,SUPLENTE,PSC,HUMANISTA CRISTÃO ,1
PRESIDENTE PRUDENTE,DEPUTADO ESTADUAL,ELVIO BARRETO,ELVIO BARRETO DOS SANTOS,SUPLENTE,PSC,HUMANISTA CRISTÃO ,1
PRESIDENTE PRUDENTE,DEPUTADO ESTADUAL,DR. JORGE LUIZ,JORGE LUIZ FERREIRA,SUPLENTE,PSC,HUMANISTA CRISTÃO ,1
PRESIDENTE PRUDENTE,DEPUTADO ESTADUAL,TANIA GEROLI,TANIA CRISTINA DE SOUZA GEROTI,SUPLENTE,PSC,HUMANISTA CRISTÃO ,189
PRESIDENTE PRUDENTE,DEPUTADO ESTADUAL,LINO BARROS,CRISTALINO JOSE DE ARRUDA BARROS,SUPLENTE,PSC,HUMANISTA CRISTÃO ,3
PRESIDENTE PRUDENTE,DEPUTADO ESTADUAL,MARIA DO CARMO PIUNTI,MARIA DO CARMO THOMAZ PIUNTI,SUPLENTE,PSC,HUMANISTA CRISTÃO ,1
PRESIDENTE PRUDENTE,DEPUTADO ESTADUAL,ATALAIA,JOSE ROBERTO DE OLIVEIRA,SUPLENTE,PSC,HUMANISTA CRISTÃO ,2
PRESIDENTE PRUDENTE,DEPUTADO ESTADUAL,CANDIDO,JOELSON CANDIDO DE OLIVEIRA,SUPLENTE,PSC,HUMANISTA CRISTÃO ,3
PRESIDENTE PRUDENTE,DEPUTADO ESTADUAL,SAID MOURAD,AHMAD SAID MOURAD,SUPLENTE,PSC,HUMANISTA CRISTÃO ,2
PRESIDENTE PRUDENTE,DEPUTADO ESTADUAL,RODRIGO MORAES,RODRIGO AUGUSTO MORAES,ELEITO,PSC,HUMANISTA CRISTÃO ,106
PRESIDENTE PRUDENTE,DEPUTADO ESTADUAL,BRAZ PASSARINHEIRO,BRAZ ANASTACIO DA SILVA,SUPLENTE,PSC,HUMANISTA CRISTÃO ,5
PRESIDENTE PRUDENTE,DEPUTADO ESTADUAL,ABEL FOTOGRAFO,ABEL DE OLIVEIRA,SUPLENTE,PSC,HUMANISTA CRISTÃO ,4
PRESIDENTE PRUDENTE,DEPUTADO ESTADUAL,NELSON RODRIGUES,NELSON DOS SANTOS RODRIGUES,SUPLENTE,PSC,HUMANISTA CRISTÃO ,45
PRESIDENTE PRUDENTE,DEPUTADO ESTADUAL,NELSON FERNANDES,JOSE NELSON AGUIAR FERNANDES,SUPLENTE,PSC,HUMANISTA CRISTÃO ,2
PRESIDENTE PRUDENTE,DEPUTADO ESTADUAL,PRIMO,PRIMO ALEXANDRE MANGIALARGO,SUPLENTE,PSC,HUMANISTA CRISTÃO ,5
PRESIDENTE PRUDENTE,DEPUTADO ESTADUAL,WALTER GOMES,WALTER GOMES DE OLIVEIRA,SUPLENTE,PR,SOMOS MAIS SÃO PAULO,3
PRESIDENTE PRUDENTE,DEPUTADO ESTADUAL,PAULO CORREA,PAULO HENRIQUE CORREA,SUPLENTE,PR,SOMOS MAIS SÃO PAULO,3
PRESIDENTE PRUDENTE,DEPUTADO ESTADUAL,JOSUE ROBERTO,JOSUE ROBERTO DA SILVA,SUPLENTE,PR,SOMOS MAIS SÃO PAULO,1
PRESIDENTE PRUDENTE,DEPUTADO ESTADUAL,ZE PEDRO,JOSE PEDRO LEITE DA SILVA,SUPLENTE,PR,SOMOS MAIS SÃO PAULO,56
PRESIDENTE PRUDENTE,DEPUTADO ESTADUAL,PATRICIA LIMA,PATRICIA FREITAS LIMA,SUPLENTE,PR,SOMOS MAIS SÃO PAULO,30
PRESIDENTE PRUDENTE,DEPUTADO ESTADUAL,JOSIAS DINIZ,JOSIAS ANTONIO DINIZ,SUPLENTE,PR,SOMOS MAIS SÃO PAULO,1
PRESIDENTE PRUDENTE,DEPUTADO ESTADUAL,ROY NELSON,ROY NELSON PINTO,SUPLENTE,PR,SOMOS MAIS SÃO PAULO,1
PRESIDENTE PRUDENTE,DEPUTADO ESTADUAL,TONINHO PAIVA,ANTONIO DE PAIVA MONTEIRO FILHO,SUPLENTE,PR,SOMOS MAIS SÃO PAULO,8
PRESIDENTE PRUDENTE,DEPUTADO ESTADUAL,OSVALDO VERGINIO,OSVALDO VERGINIO DA SILVA,SUPLENTE,PR,SOMOS MAIS SÃO PAULO,15
PRESIDENTE PRUDENTE,DEPUTADO ESTADUAL,ANDRE DO PRADO,ANDRE LUIS DO PRADO,ELEITO,PR,SOMOS MAIS SÃO PAULO,260
PRESIDENTE PRUDENTE,DEPUTADO ESTADUAL,EDUARDO REZEK,EDUARDO PEDROSO REZEK,SUPLENTE,PPS,PARTIDO POPULAR SOCIALISTA,10
PRESIDENTE PRUDENTE,DEPUTADO ESTADUAL,JOSE CARLOS SOARES,JOSE CARLOS SOARES,SUPLENTE,PPS,PARTIDO POPULAR SOCIALISTA,1
PRESIDENTE PRUDENTE,DEPUTADO ESTADUAL,MAURICIO MIYA,MAURICIO MIYAZAKI,SUPLENTE,PPS,PARTIDO POPULAR SOCIALISTA,7
PRESIDENTE PRUDENTE,DEPUTADO ESTADUAL,BRAZ,BRAZ ANTUNES MATTOS NETO,SUPLENTE,PPS,PARTIDO POPULAR SOCIALISTA,7
PRESIDENTE PRUDENTE,DEPUTADO ESTADUAL,TONINHO ALEIXO,ANTONIO ALEIXO DA COSTA,SUPLENTE,PPS,PARTIDO POPULAR SOCIALISTA,2
PRESIDENTE PRUDENTE,DEPUTADO ESTADUAL,ADEMIR DA GUIA,ADEMIR DA GUIA,SUPLENTE,PPS,PARTIDO POPULAR SOCIALISTA,25
PRESIDENTE PRUDENTE,DEPUTADO ESTADUAL,JOSE ANN,JOSE AN,SUPLENTE,PPS,PARTIDO POPULAR SOCIALISTA,1
PRESIDENTE PRUDENTE,DEPUTADO ESTADUAL,DAVI ZAIA,DAVID ZAIA,MÉDIA,PPS,PARTIDO POPULAR SOCIALISTA,27
PRESIDENTE PRUDENTE,DEPUTADO ESTADUAL,JOSE MESSINA,JOSE DE LORENZO MESSINA,SUPLENTE,PPS,PARTIDO POPULAR SOCIALISTA,9
PRESIDENTE PRUDENTE,DEPUTADO ESTADUAL,MARCOS CHIEN,CHIEN CHIN HUEI,SUPLENTE,PPS,PARTIDO POPULAR SOCIALISTA,1
PRESIDENTE PRUDENTE,DEPUTADO ESTADUAL,DR. TÚLIO,TULIO JOSE TOMASS DO COUTO,SUPLENTE,PPS,PARTIDO POPULAR SOCIALISTA,2
PRESIDENTE PRUDENTE,DEPUTADO ESTADUAL,PALHACINHO PIMPAO,VAGNER LUIZ PIMPAO BERSA,SUPLENTE,PPS,PARTIDO POPULAR SOCIALISTA,1
PRESIDENTE PRUDENTE,DEPUTADO ESTADUAL,JOAO OTAVIO BASTOS,JOAO OTAVIO BASTOS JUNQUEIRA,SUPLENTE,PPS,PARTIDO POPULAR SOCIALISTA,1
PRESIDENTE PRUDENTE,DEPUTADO ESTADUAL,VITOR SAPIENZA,VITOR SAPIENZA,SUPLENTE,PPS,PARTIDO POPULAR SOCIALISTA,99
PRESIDENTE PRUDENTE,DEPUTADO ESTADUAL,ALEX MANENTE,ALEX SPINELLI MANENTE,ELEITO,PPS,PARTIDO POPULAR SOCIALISTA,6
PRESIDENTE PRUDENTE,DEPUTADO ESTADUAL,CICERO FELIX,CICERO FELIX DE SOUZA,SUPLENTE,PPS,PARTIDO POPULAR SOCIALISTA,306
PRESIDENTE PRUDENTE,DEPUTADO ESTADUAL,JORGE MATOS,JORGE DONIZETTI RIBEIRO DE MATOS,SUPLENTE,PPS,PARTIDO POPULAR SOCIALISTA,2
PRESIDENTE PRUDENTE,DEPUTADO ESTADUAL,GONDIM,LUIZ CARLOS GONDIM TEIXEIRA,ELEITO,PPS,PARTIDO POPULAR SOCIALISTA,8
PRESIDENTE PRUDENTE,DEPUTADO ESTADUAL,ESTEVÃO,STEVEN ERIKSEN BINNIE,SUPLENTE,PPS,PARTIDO POPULAR SOCIALISTA,5
PRESIDENTE PRUDENTE,DEPUTADO ESTADUAL,PROFESSOR ZE MARIA,JOSE MARIA CANCELLIERO,SUPLENTE,PPS,PARTIDO POPULAR SOCIALISTA,147
PRESIDENTE PRUDENTE,DEPUTADO ESTADUAL,MYRIAM ALCKMIN,MYRIAM ALCKMIN RAMOS NOGUEIRA,SUPLENTE,PPS,PARTIDO POPULAR SOCIALISTA,5
PRESIDENTE PRUDENTE,DEPUTADO ESTADUAL,ROBERTO MORAIS,ROBERTO TURCHI DE MORAIS,ELEITO,PPS,PARTIDO POPULAR SOCIALISTA,1
PRESIDENTE PRUDENTE,DEPUTADO ESTADUAL,AZUAITE,AZUAITE MARTINS DE FRANÇA,SUPLENTE,PPS,PARTIDO POPULAR SOCIALISTA,5
PRESIDENTE PRUDENTE,DEPUTADO ESTADUAL,ELZO SIGUETA,ELZO SIGUETA,SUPLENTE,PPS,PARTIDO POPULAR SOCIALISTA,70
PRESIDENTE PRUDENTE,DEPUTADO ESTADUAL,DR REYNALDO DE BARROS,REYNALDO DE BARROS FRESCA JUNIOR,SUPLENTE,PPS,PARTIDO POPULAR SOCIALISTA,2
PRESIDENTE PRUDENTE,DEPUTADO ESTADUAL,SERGIO BOCALINI,SERGIO DOS SANTOS BOCALINI,SUPLENTE,PPS,PARTIDO POPULAR SOCIALISTA,4
PRESIDENTE PRUDENTE,DEPUTADO ESTADUAL,OSMAR SANTOS,OSMAR PINHEIRO DOS SANTOS,SUPLENTE,PPS,PARTIDO POPULAR SOCIALISTA,1
PRESIDENTE PRUDENTE,DEPUTADO ESTADUAL,DARIO SAADI,DARIO JORGE GIOLO SAADI,SUPLENTE,DEM,PSDB/DEM,7
PRESIDENTE PRUDENTE,DEPUTADO ESTADUAL,ANDRE SOARES,ANDRE BEZERRA RIBEIRO SOARES,ELEITO,DEM,PSDB/DEM,193
PRESIDENTE PRUDENTE,DEPUTADO ESTADUAL,GILSON DE SOUZA,GILSON DE SOUZA,ELEITO,DEM,PSDB/DEM,6
PRESIDENTE PRUDENTE,DEPUTADO ESTADUAL,RICARDO MUTRAN,RICARDO JORGE MUTRAN,SUPLENTE,DEM,PSDB/DEM,2
PRESIDENTE PRUDENTE,DEPUTADO ESTADUAL,ULISSES SALES,ULISSES ROBERTO CORNAZZANI SALES,SUPLENTE,DEM,PSDB/DEM,2
PRESIDENTE PRUDENTE,DEPUTADO ESTADUAL,EDMIR CHEDID,EDMIR JOSE ABI CHEDID,ELEITO,DEM,PSDB/DEM,51
PRESIDENTE PRUDENTE,DEPUTADO ESTADUAL,ALDO DEMARCHI,JOSE ALDO DEMARCHI,ELEITO,DEM,PSDB/DEM,17
PRESIDENTE PRUDENTE,DEPUTADO ESTADUAL,JOAO MELLAO NETO,JOAO MELLAO NETO,SUPLENTE,DEM,PSDB/DEM,76
PRESIDENTE PRUDENTE,DEPUTADO ESTADUAL,FERNANDO LUCAS,LUIZ FERNANDO AMARAL LUCAS,SUPLENTE,DEM,PSDB/DEM,15
PRESIDENTE PRUDENTE,DEPUTADO ESTADUAL,ESTEVAM GALVAO,ESTEVAM GALVAO DE OLIVEIRA,ELEITO,DEM,PSDB/DEM,50
PRESIDENTE PRUDENTE,DEPUTADO ESTADUAL,RICARDO SALLES,RICARDO DE AQUINO SALLES,SUPLENTE,DEM,PSDB/DEM,49
PRESIDENTE PRUDENTE,DEPUTADO ESTADUAL,MILTON LEITE FILHO,MILTON LEITE DA SILVA FILHO,ELEITO,DEM,PSDB/DEM,147
PRESIDENTE PRUDENTE,DEPUTADO ESTADUAL,MILTON VIEIRA,MILTON VIEIRA PINTO,ELEITO,DEM,PSDB/DEM,1
PRESIDENTE PRUDENTE,DEPUTADO ESTADUAL,PAULO BARBOZA FILHO,PAULO EUGENIO MACHADO BARBOZA,SUPLENTE,DEM,PSDB/DEM,1
PRESIDENTE PRUDENTE,DEPUTADO ESTADUAL,JAIRO PINTO,JAIRO BALDERRAMA PINTO,SUPLENTE,DEM,PSDB/DEM,1
PRESIDENTE PRUDENTE,DEPUTADO ESTADUAL,SALLES,RAIMUNDO TARASKEVICIUS SALES,SUPLENTE,DEM,PSDB/DEM,3
PRESIDENTE PRUDENTE,DEPUTADO ESTADUAL,GIL ARANTES,GILBERTO MACEDO GIL ARANTES,ELEITO,DEM,PSDB/DEM,30
PRESIDENTE PRUDENTE,DEPUTADO ESTADUAL,ZE TURIN,JOSE ARIVALDO RODRIGUES,SUPLENTE,DEM,PSDB/DEM,7
PRESIDENTE PRUDENTE,DEPUTADO ESTADUAL,ZE LOUQUINHO,JOSE LUIZ RODRIGUES,SUPLENTE,DEM,PSDB/DEM,2
PRESIDENTE PRUDENTE,DEPUTADO ESTADUAL,LEANDRO DO KLB,LEANDRO FINATO SCORNAVACCA,SUPLENTE,DEM,PSDB/DEM,61
PRESIDENTE PRUDENTE,DEPUTADO ESTADUAL,EDUARDO BETTIN,CARLOS EDUARDO DA FONSECA BETTIN,SUPLENTE,PHS,HUMANISTA CRISTÃO ,2
PRESIDENTE PRUDENTE,DEPUTADO ESTADUAL,CHIQUINHO TEXAS,FRANCISCO DANTAS DE LIMA,SUPLENTE,PHS,HUMANISTA CRISTÃO ,1
PRESIDENTE PRUDENTE,DEPUTADO ESTADUAL,PELÉ DA CANDIDA,PAULO CESAR DIAS DOS REIS,SUPLENTE,PHS,HUMANISTA CRISTÃO ,1
PRESIDENTE PRUDENTE,DEPUTADO ESTADUAL,PAULO HADICH,PAULO CEZAR JUNQUEIRA HADICH,SUPLENTE,PSB,PARTIDO SOCIALISTA BRASILEIRO,5
PRESIDENTE PRUDENTE,DEPUTADO ESTADUAL,ESCRITOR RONALDO DURAN,RONALDO DE JESUS DA SILVA,SUPLENTE,PSB,PARTIDO SOCIALISTA BRASILEIRO,1
PRESIDENTE PRUDENTE,DEPUTADO ESTADUAL,BOLÇONE,ORLANDO JOSE BOLÇONE,SUPLENTE,PSB,PARTIDO SOCIALISTA BRASILEIRO,1
PRESIDENTE PRUDENTE,DEPUTADO ESTADUAL,MARIÂNGELA DUARTE,MARIANGELA DE ARAÚJO GAMA DUARTE,SUPLENTE,PSB,PARTIDO SOCIALISTA BRASILEIRO,1
PRESIDENTE PRUDENTE,DEPUTADO ESTADUAL,PEROBA,OSMAR PEROBA OLIVEIRA LINS,SUPLENTE,PSB,PARTIDO SOCIALISTA BRASILEIRO,1
PRESIDENTE PRUDENTE,DEPUTADO ESTADUAL,PAULO BRIGLIADORI,PAULO JOSÉ BRIGLIADORI,SUPLENTE,PSB,PARTIDO SOCIALISTA BRASILEIRO,1
PRESIDENTE PRUDENTE,DEPUTADO ESTADUAL,CASSIO HONORIO,CASSIO APARECIDO HONORIO DE ALMEIDA,SUPLENTE,PSB,PARTIDO SOCIALISTA BRASILEIRO,3
PRESIDENTE PRUDENTE,DEPUTADO ESTADUAL,SANDRO PATRIOTA,SANDRO PATRIOTA BASSIQUETTE,SUPLENTE,PSB,PARTIDO SOCIALISTA BRASILEIRO,12
PRESIDENTE PRUDENTE,DEPUTADO ESTADUAL,ED THOMAS,EDSON TOMAZINI,ELEITO,PSB,PARTIDO SOCIALISTA BRASILEIRO,12727
PRESIDENTE PRUDENTE,DEPUTADO ESTADUAL,FAETI,LAFAIETE RAMOS DE NOVAES,SUPLENTE,PSB,PARTIDO SOCIALISTA BRASILEIRO,49
PRESIDENTE PRUDENTE,DEPUTADO ESTADUAL,IRMÃO OZELITO,OZELITO JOSE BENEDITO,SUPLENTE,PSB,PARTIDO SOCIALISTA BRASILEIRO,13
