TATUÍ,DEPUTADO ESTADUAL,PADRE JUZEMILDO,JUZEMILDO ALBINO DA SILVA,SUPLENTE,PT,SOMOS MAIS SÃO PAULO,1
TATUÍ,DEPUTADO ESTADUAL,ADRIANO DIOGO,ADRIANO DIOGO,ELEITO,PT,SOMOS MAIS SÃO PAULO,20
TATUÍ,DEPUTADO ESTADUAL,ESTELA ALMAGRO,ESTELA ALEXANDRE ALMAGRO,SUPLENTE,PT,SOMOS MAIS SÃO PAULO,1
TATUÍ,DEPUTADO ESTADUAL,HAMILTON PEREIRA,HAMILTON PEREIRA,ELEITO,PT,SOMOS MAIS SÃO PAULO,2520
TATUÍ,DEPUTADO ESTADUAL,LUIZ CLAUDIO MARCOLINO,LUIZ CLAUDIO MARCOLINO,ELEITO,PT,SOMOS MAIS SÃO PAULO,37
TATUÍ,DEPUTADO ESTADUAL,RENATO DO GEB,RENATO MORENI AIRES DA SILVA,SUPLENTE,PT,SOMOS MAIS SÃO PAULO,1
TATUÍ,DEPUTADO ESTADUAL,NATIVIDADE,MARIA DA NATIVIDADE PEREIRA LIMA,SUPLENTE,PT,SOMOS MAIS SÃO PAULO,8
TATUÍ,DEPUTADO ESTADUAL,ROBERTO FELICIO,ROBERTO FELICIO,SUPLENTE,PT,SOMOS MAIS SÃO PAULO,12
TATUÍ,DEPUTADO ESTADUAL,RAFAEL AGOSTINI,RAFAEL LUNARDELLI AGOSTINI,SUPLENTE,PT,SOMOS MAIS SÃO PAULO,9
TATUÍ,DEPUTADO ESTADUAL,BETH SAHAO,ELISABETH SAHÃO,SUPLENTE,PT,SOMOS MAIS SÃO PAULO,3
TATUÍ,DEPUTADO ESTADUAL,ADINAN ORTOLAN,JOSÉ ADINAN ORTOLAN,SUPLENTE,PT,SOMOS MAIS SÃO PAULO,4
TATUÍ,DEPUTADO ESTADUAL,FRANCISCO FRANÇA,FRANCISCO FRANÇA DA SILVA,SUPLENTE,PT,SOMOS MAIS SÃO PAULO,1314
TATUÍ,DEPUTADO ESTADUAL,LELO PAGANI,LUIZ AURELIO PAGANI,SUPLENTE,PT,SOMOS MAIS SÃO PAULO,1
TATUÍ,DEPUTADO ESTADUAL,ALENCAR,ALENCAR SANTANA BRAGA,ELEITO,PT,SOMOS MAIS SÃO PAULO,15
TATUÍ,DEPUTADO ESTADUAL,TIÃOZINHO,SEBASTIÃO MOREIREA ARCANJO,SUPLENTE,PT,SOMOS MAIS SÃO PAULO,5
TATUÍ,DEPUTADO ESTADUAL,VERA SABA,VERA LÚCIA SANTOS SABA,SUPLENTE,PT,SOMOS MAIS SÃO PAULO,1
TATUÍ,DEPUTADO ESTADUAL,PROFESSOR AGNERIO,AGNERIO NERI FERREIRA,SUPLENTE,PT,SOMOS MAIS SÃO PAULO,1
TATUÍ,DEPUTADO ESTADUAL,ISAC REIS,ISAC FRANCO DOS REIS,ELEITO,PT,SOMOS MAIS SÃO PAULO,14
TATUÍ,DEPUTADO ESTADUAL,BRENO CORTELLA,BRENO ZANONI CORTELLA,SUPLENTE,PT,SOMOS MAIS SÃO PAULO,1
TATUÍ,DEPUTADO ESTADUAL,BETO CANGUSSU,LUIZ ROBERTO ALVES CANGUSSU,SUPLENTE,PT,SOMOS MAIS SÃO PAULO,1
TATUÍ,DEPUTADO ESTADUAL,JOSÉ CANDIDO,JOSÉ DE SOUZA CÂNDIDO,MÉDIA,PT,SOMOS MAIS SÃO PAULO,1
TATUÍ,DEPUTADO ESTADUAL,JOÃO ANTONIO,JOAO ANTONIO DA SILVA FILHO,ELEITO,PT,SOMOS MAIS SÃO PAULO,12
TATUÍ,DEPUTADO ESTADUAL,GALLO,JURANDIR GALLO,SUPLENTE,PT,SOMOS MAIS SÃO PAULO,4
TATUÍ,DEPUTADO ESTADUAL,MÁRCIO CHAVES,MÁRCIO CHAVES PIRES,SUPLENTE,PT,SOMOS MAIS SÃO PAULO,2
TATUÍ,DEPUTADO ESTADUAL,ZÉ ARISTEIA,JOSÉ ARISTEIA PEREIRA,SUPLENTE,PT,SOMOS MAIS SÃO PAULO,5
TATUÍ,DEPUTADO ESTADUAL,PROF. ROMAZZINI,LUIS CARLOS ROMAZZINI,SUPLENTE,PT,SOMOS MAIS SÃO PAULO,1
TATUÍ,DEPUTADO ESTADUAL,SÉRGIO DESIDERÁ,SÉRGIO DESIDERÁ,SUPLENTE,PT,SOMOS MAIS SÃO PAULO,1
TATUÍ,DEPUTADO ESTADUAL,CARLOS GRANA,CARLOS ALBERTO GRANA,ELEITO,PT,SOMOS MAIS SÃO PAULO,8
TATUÍ,DEPUTADO ESTADUAL,JOEL FONSECA,JOEL FONSECA COSTA,SUPLENTE,PT,SOMOS MAIS SÃO PAULO,1
TATUÍ,DEPUTADO ESTADUAL,TARCÍSIO,JOSÉ TARCÍSIO DE OLIVEIRA,SUPLENTE,PT,SOMOS MAIS SÃO PAULO,5
TATUÍ,DEPUTADO ESTADUAL,FAUSTO FIGUEIRA,FAUSTO FIGUEIRA DE MELLO JUNIOR,SUPLENTE,PT,SOMOS MAIS SÃO PAULO,2
TATUÍ,DEPUTADO ESTADUAL,ZÉ ANTÔNIO,JOSÉ ANTONIO DA SILVA,SUPLENTE,PT,SOMOS MAIS SÃO PAULO,2
TATUÍ,DEPUTADO ESTADUAL,ELISEU COSTA,ELISEU SILVA COSTA,SUPLENTE,PT,SOMOS MAIS SÃO PAULO,515
TATUÍ,DEPUTADO ESTADUAL,VERA GOULART,VERA LUCIA GOULART GONÇALVES,SUPLENTE,PT,SOMOS MAIS SÃO PAULO,1
TATUÍ,DEPUTADO ESTADUAL,TOFFOLI,JOSÉ TICIANO DIAS TOFFOLI,SUPLENTE,PT,SOMOS MAIS SÃO PAULO,2
TATUÍ,DEPUTADO ESTADUAL,GILSON PELIZARO,GILSON DONIZETE PELIZARO,SUPLENTE,PT,SOMOS MAIS SÃO PAULO,1
TATUÍ,DEPUTADO ESTADUAL,DONISETE BRAGA,DONISETE PEREIRA BRAGA,ELEITO,PT,SOMOS MAIS SÃO PAULO,1115
TATUÍ,DEPUTADO ESTADUAL,CARLOS NEDER,CARLOS ALBERTO PLETZ NEDER,SUPLENTE,PT,SOMOS MAIS SÃO PAULO,31
TATUÍ,DEPUTADO ESTADUAL,LÉO ÁQUILLA,JADSON MENDES DE LIMA,SUPLENTE,PTB,PARTIDO TRABALHISTA BRASILEIRO,38
TATUÍ,DEPUTADO ESTADUAL,MARILIA,AMARILIA ISABEL VIEIRA,SUPLENTE,PTB,PARTIDO TRABALHISTA BRASILEIRO,1
TATUÍ,DEPUTADO ESTADUAL,EVANDRO COSTA NETO,EVANDRO COSTA NETO,SUPLENTE,PTB,PARTIDO TRABALHISTA BRASILEIRO,1
TATUÍ,DEPUTADO ESTADUAL,AMARO MARIANO DA SILVA,AMARO MARIANO DA SILVA,SUPLENTE,PTB,PARTIDO TRABALHISTA BRASILEIRO,1
TATUÍ,DEPUTADO ESTADUAL,CONTE LOPES,ROBERVAL CONTE LOPES LIMA,SUPLENTE,PTB,PARTIDO TRABALHISTA BRASILEIRO,47
TATUÍ,DEPUTADO ESTADUAL,CAMPOS MACHADO,ANTONIO CARLOS DE CAMPOS MACHADO,ELEITO,PTB,PARTIDO TRABALHISTA BRASILEIRO,209
TATUÍ,DEPUTADO ESTADUAL,GIL FONSECA,GILDO APARECIDO FONSECA,SUPLENTE,PTB,PARTIDO TRABALHISTA BRASILEIRO,1
TATUÍ,DEPUTADO ESTADUAL,HEROILMA SOARES TAVARES,HEROILMA SOARES TAVARES,MÉDIA,PTB,PARTIDO TRABALHISTA BRASILEIRO,4
TATUÍ,DEPUTADO ESTADUAL,CORONEL EDSON FERRARINI,EDSON FERRARINI,ELEITO,PTB,PARTIDO TRABALHISTA BRASILEIRO,152
TATUÍ,DEPUTADO ESTADUAL,DANIEL OLIVEIRA,DANIEL DA SILVA OLIVEIRA,SUPLENTE,PTB,PARTIDO TRABALHISTA BRASILEIRO,1
TATUÍ,DEPUTADO ESTADUAL,DR ANTONIO KHOURI,ANTONIO JOSE SADER KHOURI,SUPLENTE,PTB,PARTIDO TRABALHISTA BRASILEIRO,1
TATUÍ,DEPUTADO ESTADUAL,GERSINHO ROMERO,GERSON MOREIRA ROMERO,SUPLENTE,PTB,PARTIDO TRABALHISTA BRASILEIRO,1
TATUÍ,DEPUTADO ESTADUAL,RODRIGO MENDES,RODRIGO CLAUDIONOR MENDES,SUPLENTE,PTB,PARTIDO TRABALHISTA BRASILEIRO,13
TATUÍ,DEPUTADO ESTADUAL,VAL,ENIVALDO RAMOS DE FREITAS,SUPLENTE,PTB,PARTIDO TRABALHISTA BRASILEIRO,1
TATUÍ,DEPUTADO ESTADUAL,TARDELLI,ROBERTO TARDELLI,SUPLENTE,PTB,PARTIDO TRABALHISTA BRASILEIRO,27
TATUÍ,DEPUTADO ESTADUAL,PROFESSOR LEANDRO MOU,LEANDRO TADEU CAZARROTTI,SUPLENTE,PTB,PARTIDO TRABALHISTA BRASILEIRO,1
TATUÍ,DEPUTADO ESTADUAL,WANESSA BOMFIM,WANESSA SOUSA BOMFIM,SUPLENTE,PTB,PARTIDO TRABALHISTA BRASILEIRO,1
TATUÍ,DEPUTADO ESTADUAL,WALDIR AGNELLO,WALDIR AGNELLO,SUPLENTE,PTB,PARTIDO TRABALHISTA BRASILEIRO,221
TATUÍ,DEPUTADO ESTADUAL,ITALO RENE,ITALO RENE CORREA,SUPLENTE,PTB,PARTIDO TRABALHISTA BRASILEIRO,1
TATUÍ,DEPUTADO ESTADUAL,CABO DALMIR E LARANJA,DALMIR MARCIO MARÇAL,SUPLENTE,PTB,PARTIDO TRABALHISTA BRASILEIRO,2
TATUÍ,DEPUTADO ESTADUAL,BALEIA ROSSI,LUIZ FELIPE BALEIA TENUTO ROSSI,ELEITO,PMDB,PARTIDO DO MOVIMENTO DEMOCRÁTICO BRASILEIRO,7
TATUÍ,DEPUTADO ESTADUAL,DRA ADRIANA,ADRIANA DI NARDO SILVA,SUPLENTE,PMDB,PARTIDO DO MOVIMENTO DEMOCRÁTICO BRASILEIRO,15
TATUÍ,DEPUTADO ESTADUAL,BEBETTO,ALBERTO FELIPPE HADDAD FILHO,SUPLENTE,PMDB,PARTIDO DO MOVIMENTO DEMOCRÁTICO BRASILEIRO,7
TATUÍ,DEPUTADO ESTADUAL,DR. ITAMAR,ITAMAR COPPIO,SUPLENTE,PMDB,PARTIDO DO MOVIMENTO DEMOCRÁTICO BRASILEIRO,9
TATUÍ,DEPUTADO ESTADUAL,DU TONIN,EDUARDO TONIN,SUPLENTE,PMDB,PARTIDO DO MOVIMENTO DEMOCRÁTICO BRASILEIRO,3
TATUÍ,DEPUTADO ESTADUAL,IBRAIM,IBRAIM ANTONIO ABOU JOKH,SUPLENTE,PMDB,PARTIDO DO MOVIMENTO DEMOCRÁTICO BRASILEIRO,25
TATUÍ,DEPUTADO ESTADUAL,CARUSO,JORGE LUIS CARUSO,ELEITO,PMDB,PARTIDO DO MOVIMENTO DEMOCRÁTICO BRASILEIRO,22
TATUÍ,DEPUTADO ESTADUAL,FABIO BELLO,FABIO BELLO DE OLIVEIRA,SUPLENTE,PMDB,PARTIDO DO MOVIMENTO DEMOCRÁTICO BRASILEIRO,7
TATUÍ,DEPUTADO ESTADUAL,SERGIO BERGAMASCO,ANTONIO SERGIO PIRES BERGAMASCO,SUPLENTE,PMDB,PARTIDO DO MOVIMENTO DEMOCRÁTICO BRASILEIRO,4
TATUÍ,DEPUTADO ESTADUAL,VANESSA DAMO,VANESSA DAMO OROSCO,ELEITO,PMDB,PARTIDO DO MOVIMENTO DEMOCRÁTICO BRASILEIRO,28
TATUÍ,DEPUTADO ESTADUAL,GILBERTO FRANÇA,GILBERTO CAETANO DE FRANÇA,SUPLENTE,PMDB,PARTIDO DO MOVIMENTO DEMOCRÁTICO BRASILEIRO,2
TATUÍ,DEPUTADO ESTADUAL,HABIB,GEORGES HABIB JARROUGE,SUPLENTE,PMDB,PARTIDO DO MOVIMENTO DEMOCRÁTICO BRASILEIRO,1
TATUÍ,DEPUTADO ESTADUAL,CHICÃO SERRA TALHADA,FRANCISCO BEZERRA DOS SANTOS,SUPLENTE,PMDB,PARTIDO DO MOVIMENTO DEMOCRÁTICO BRASILEIRO,6
TATUÍ,DEPUTADO ESTADUAL,ITAMAR BORGES,ITAMAR FRANCISCO MACHADO BORGES,MÉDIA,PMDB,PARTIDO DO MOVIMENTO DEMOCRÁTICO BRASILEIRO,11
TATUÍ,DEPUTADO ESTADUAL,JONAS,JONAS PEREIRA DE LIMA,SUPLENTE,PMDB,PARTIDO DO MOVIMENTO DEMOCRÁTICO BRASILEIRO,1
TATUÍ,DEPUTADO ESTADUAL,DRA SILVANA,SILVANA CASSIA RIBEIRO BAPTISTA,SUPLENTE,PMDB,PARTIDO DO MOVIMENTO DEMOCRÁTICO BRASILEIRO,8
TATUÍ,DEPUTADO ESTADUAL,MARIA DO CARMO GUILHERME,MARIA DO CARMO GUILHERME,SUPLENTE,PMDB,PARTIDO DO MOVIMENTO DEMOCRÁTICO BRASILEIRO,3
TATUÍ,DEPUTADO ESTADUAL,ANGELA RAMALHO,ANGELA MARIA ANTUNES DE CARVALHO TAVARES,SUPLENTE,PMDB,PARTIDO DO MOVIMENTO DEMOCRÁTICO BRASILEIRO,108
TATUÍ,DEPUTADO ESTADUAL,JOOJI HATO,JOOJI HATO,ELEITO,PMDB,PARTIDO DO MOVIMENTO DEMOCRÁTICO BRASILEIRO,13
TATUÍ,DEPUTADO ESTADUAL,JÂNIO,JÂNIO GONÇALVES DE OLIVEIRA,SUPLENTE,PMDB,PARTIDO DO MOVIMENTO DEMOCRÁTICO BRASILEIRO,116
TATUÍ,DEPUTADO ESTADUAL,TUNICO VIEIRA,ANTONIO JOSÉ VIEIRA JUNIOR,SUPLENTE,PMDB,PARTIDO DO MOVIMENTO DEMOCRÁTICO BRASILEIRO,4
TATUÍ,DEPUTADO ESTADUAL,ALEXANDRE CUNHA,ALEXANDRE EVARISTO CUNHA,SUPLENTE,PMDB,PARTIDO DO MOVIMENTO DEMOCRÁTICO BRASILEIRO,2
TATUÍ,DEPUTADO ESTADUAL,CIDA FERREIRA,MARIA APARECIDA FERREIRA,SUPLENTE,PMDB,PARTIDO DO MOVIMENTO DEMOCRÁTICO BRASILEIRO,4
TATUÍ,DEPUTADO ESTADUAL,ANA PAULA ROSSI,ANA PAULA ROSSI DE ALMEIDA MAGDESIAN,SUPLENTE,PMDB,PARTIDO DO MOVIMENTO DEMOCRÁTICO BRASILEIRO,5
TATUÍ,DEPUTADO ESTADUAL,DR. JEFERSON RODRIGUES,JEFERSON RODRIGUES,SUPLENTE,PMDB,PARTIDO DO MOVIMENTO DEMOCRÁTICO BRASILEIRO,10
TATUÍ,DEPUTADO ESTADUAL,COUTINHO JUNIOR,OSWALDO BARBOSA COUTINHO JUNIOR,SUPLENTE,PMDB,PARTIDO DO MOVIMENTO DEMOCRÁTICO BRASILEIRO,2
TATUÍ,DEPUTADO ESTADUAL,OLIVEIRA JUNIOR,ELIO APARECIDO DE OLIVEIRA,SUPLENTE,PSC,HUMANISTA CRISTÃO ,1
TATUÍ,DEPUTADO ESTADUAL,CELSO NASCIMENTO,CELSO BRAZ DO NASCIMENTO,SUPLENTE,PSC,HUMANISTA CRISTÃO ,14
TATUÍ,DEPUTADO ESTADUAL,LELIS TRAJANO,LELIS JOSE TRAJANO,SUPLENTE,PSC,HUMANISTA CRISTÃO ,17
TATUÍ,DEPUTADO ESTADUAL,EDSON PÃO DE MINAS,EDSON VANDER RIBEIRO DAVID,SUPLENTE,PSC,HUMANISTA CRISTÃO ,1
TATUÍ,DEPUTADO ESTADUAL,PR. PAGLIARIN,HIDERALDO PAGLIARIN,SUPLENTE,PSC,HUMANISTA CRISTÃO ,11
TATUÍ,DEPUTADO ESTADUAL,JOAQUIM RUESCAS,JOAQUIM RUESCAS NETO,SUPLENTE,PSC,HUMANISTA CRISTÃO ,2
TATUÍ,DEPUTADO ESTADUAL,LEANDRO AMARAL,LEANDRO GODINES DO AMARAL,SUPLENTE,PSC,HUMANISTA CRISTÃO ,3
TATUÍ,DEPUTADO ESTADUAL,PASTOR VIEIRA ROCHA,JOSE VIEIRA ROCHA,SUPLENTE,PSC,HUMANISTA CRISTÃO ,18
TATUÍ,DEPUTADO ESTADUAL,PR. CARLOS CEZAR,CARLOS CEZAR DA SILVA,ELEITO,PSC,HUMANISTA CRISTÃO ,1051
TATUÍ,DEPUTADO ESTADUAL,VANDERLEI GOES,VANDERLEI DE GOES,SUPLENTE,PSC,HUMANISTA CRISTÃO ,1
TATUÍ,DEPUTADO ESTADUAL,GUIMARÃES,WALTER GUIMARÃES RODRIGUES,SUPLENTE,PSC,HUMANISTA CRISTÃO ,1
TATUÍ,DEPUTADO ESTADUAL,JAIMINHO,JAIME DONIZETE PEREIRA,SUPLENTE,PSC,HUMANISTA CRISTÃO ,1
TATUÍ,DEPUTADO ESTADUAL,MARTA LIVIA SUPLICY,MARTA LIVIA BARRAGANA FERNANDES SUPLICY,SUPLENTE,PSC,HUMANISTA CRISTÃO ,3
TATUÍ,DEPUTADO ESTADUAL,LUIZ LAURO,LUIZ LAURO FERREIRA,SUPLENTE,PSC,HUMANISTA CRISTÃO ,340
TATUÍ,DEPUTADO ESTADUAL,FRANCISCO NINJA,FRANCISCO JOÃO RODRIGUES,SUPLENTE,PSC,HUMANISTA CRISTÃO ,1
TATUÍ,DEPUTADO ESTADUAL,ZE INDIO,JOSE FERREIRA DO NASCIMENTO,SUPLENTE,PSC,HUMANISTA CRISTÃO ,1
TATUÍ,DEPUTADO ESTADUAL,CAPITÃO LIDIO,LIDIO GUARIGLIA COSTA JUNIOR,SUPLENTE,PSC,HUMANISTA CRISTÃO ,1
TATUÍ,DEPUTADO ESTADUAL,ADILSON ROSSI,ADILSON ROSSI,ELEITO,PSC,HUMANISTA CRISTÃO ,3
TATUÍ,DEPUTADO ESTADUAL,DR. PAULO DUARTE,PAULO FERNANDES DUARTE,SUPLENTE,PSC,HUMANISTA CRISTÃO ,2
TATUÍ,DEPUTADO ESTADUAL,JOÃO BINATO,JOÃO ANTONIO BINATO,SUPLENTE,PSC,HUMANISTA CRISTÃO ,52
TATUÍ,DEPUTADO ESTADUAL,WALTER CORDONI,WALTER CORDONI FILHO,SUPLENTE,PSC,HUMANISTA CRISTÃO ,2
TATUÍ,DEPUTADO ESTADUAL,PAULO CHOCOLATE,PAULO SERGIO VIEIRA NEVES,SUPLENTE,PSC,HUMANISTA CRISTÃO ,74
TATUÍ,DEPUTADO ESTADUAL,MATEUS SANTANA,MATEUS DE SOUZA SANTANA,SUPLENTE,PSC,HUMANISTA CRISTÃO ,3
TATUÍ,DEPUTADO ESTADUAL,PROF. ANTONIO NEME,ANTONIO DIAS NEME,SUPLENTE,PSC,HUMANISTA CRISTÃO ,3
TATUÍ,DEPUTADO ESTADUAL,RENATO LOPES,RENATO LOPES DA SILVA,SUPLENTE,PSC,HUMANISTA CRISTÃO ,1
TATUÍ,DEPUTADO ESTADUAL,MARIA DO CARMO PIUNTI,MARIA DO CARMO THOMAZ PIUNTI,SUPLENTE,PSC,HUMANISTA CRISTÃO ,143
TATUÍ,DEPUTADO ESTADUAL,GUSTAVO POZZI,GUSTAVO CAETANO POZZI DA CUNHA,SUPLENTE,PSC,HUMANISTA CRISTÃO ,22
TATUÍ,DEPUTADO ESTADUAL,SAID MOURAD,AHMAD SAID MOURAD,SUPLENTE,PSC,HUMANISTA CRISTÃO ,52
TATUÍ,DEPUTADO ESTADUAL,RODRIGO MORAES,RODRIGO AUGUSTO MORAES,ELEITO,PSC,HUMANISTA CRISTÃO ,127
TATUÍ,DEPUTADO ESTADUAL,EDUARDO MARTINS,EDUARDO MARTINS BATISTA,SUPLENTE,PSC,HUMANISTA CRISTÃO ,1
TATUÍ,DEPUTADO ESTADUAL,BRAZ PASSARINHEIRO,BRAZ ANASTACIO DA SILVA,SUPLENTE,PSC,HUMANISTA CRISTÃO ,2
TATUÍ,DEPUTADO ESTADUAL,LEONARDO QUEIROZ,LEONARDO SANTOS QUEIROZ,SUPLENTE,PSC,HUMANISTA CRISTÃO ,6
TATUÍ,DEPUTADO ESTADUAL,DE MARCO,JOSE APARECIDO DE MARCO,SUPLENTE,PSC,HUMANISTA CRISTÃO ,1
TATUÍ,DEPUTADO ESTADUAL,IVONE,IVONE APARECIDA LUCIA SILVA,SUPLENTE,PSC,HUMANISTA CRISTÃO ,1
TATUÍ,DEPUTADO ESTADUAL,ABEL FOTOGRAFO,ABEL DE OLIVEIRA,SUPLENTE,PSC,HUMANISTA CRISTÃO ,1
TATUÍ,DEPUTADO ESTADUAL,WALTER GOMES,WALTER GOMES DE OLIVEIRA,SUPLENTE,PR,SOMOS MAIS SÃO PAULO,11
TATUÍ,DEPUTADO ESTADUAL,PAULO CORREA,PAULO HENRIQUE CORREA,SUPLENTE,PR,SOMOS MAIS SÃO PAULO,2
TATUÍ,DEPUTADO ESTADUAL,ZE PEDRO,JOSE PEDRO LEITE DA SILVA,SUPLENTE,PR,SOMOS MAIS SÃO PAULO,100
TATUÍ,DEPUTADO ESTADUAL,LILI AIMAR,LILIANA MEDEIROS DE ALMEIDA AYMAR BECHARA,SUPLENTE,PR,SOMOS MAIS SÃO PAULO,1
TATUÍ,DEPUTADO ESTADUAL,ALEXANDRE DA FARMACIA,ALEXANDRE JOSE DA CUNHA,SUPLENTE,PR,SOMOS MAIS SÃO PAULO,2
TATUÍ,DEPUTADO ESTADUAL,PATRICIA LIMA,PATRICIA FREITAS LIMA,SUPLENTE,PR,SOMOS MAIS SÃO PAULO,52
TATUÍ,DEPUTADO ESTADUAL,TONINHO PAIVA,ANTONIO DE PAIVA MONTEIRO FILHO,SUPLENTE,PR,SOMOS MAIS SÃO PAULO,4
TATUÍ,DEPUTADO ESTADUAL,OSVALDO VERGINIO,OSVALDO VERGINIO DA SILVA,SUPLENTE,PR,SOMOS MAIS SÃO PAULO,13
TATUÍ,DEPUTADO ESTADUAL,CLAUDIO SOROCABA I,GERVINO GONCALVES,SUPLENTE,PR,SOMOS MAIS SÃO PAULO,189
TATUÍ,DEPUTADO ESTADUAL,JOSE JANTALIA,JOSE ANTONIO JANTALIA,SUPLENTE,PR,SOMOS MAIS SÃO PAULO,14
TATUÍ,DEPUTADO ESTADUAL,ANDRE DO PRADO,ANDRE LUIS DO PRADO,ELEITO,PR,SOMOS MAIS SÃO PAULO,3
TATUÍ,DEPUTADO ESTADUAL,EDUARDO REZEK,EDUARDO PEDROSO REZEK,SUPLENTE,PPS,PARTIDO POPULAR SOCIALISTA,1
TATUÍ,DEPUTADO ESTADUAL,JOSE CARLOS SOARES,JOSE CARLOS SOARES,SUPLENTE,PPS,PARTIDO POPULAR SOCIALISTA,3
TATUÍ,DEPUTADO ESTADUAL,SERGIO MORETTI,SERGIO MORETTI,SUPLENTE,PPS,PARTIDO POPULAR SOCIALISTA,1
TATUÍ,DEPUTADO ESTADUAL,MAURICIO MIYA,MAURICIO MIYAZAKI,SUPLENTE,PPS,PARTIDO POPULAR SOCIALISTA,5
TATUÍ,DEPUTADO ESTADUAL,BRAZ,BRAZ ANTUNES MATTOS NETO,SUPLENTE,PPS,PARTIDO POPULAR SOCIALISTA,9
TATUÍ,DEPUTADO ESTADUAL,LIVALDO CAMPANA,LIVALDO CAMPANA,SUPLENTE,PPS,PARTIDO POPULAR SOCIALISTA,4
TATUÍ,DEPUTADO ESTADUAL,OSCAR RIBEIRO,OSCAR APARECIDO RIBEIRO,SUPLENTE,PPS,PARTIDO POPULAR SOCIALISTA,1
TATUÍ,DEPUTADO ESTADUAL,ADEMIR DA GUIA,ADEMIR DA GUIA,SUPLENTE,PPS,PARTIDO POPULAR SOCIALISTA,36
TATUÍ,DEPUTADO ESTADUAL,LINDINALVO,LINDINALVO ALVES DA CONCEIÇÃO,SUPLENTE,PPS,PARTIDO POPULAR SOCIALISTA,1
TATUÍ,DEPUTADO ESTADUAL,JOSE ANN,JOSE AN,SUPLENTE,PPS,PARTIDO POPULAR SOCIALISTA,3
TATUÍ,DEPUTADO ESTADUAL,DAVI ZAIA,DAVID ZAIA,MÉDIA,PPS,PARTIDO POPULAR SOCIALISTA,33
TATUÍ,DEPUTADO ESTADUAL,OSMAR UNGARI FILHO MEDICO CAPI,OSMAR UNGARI FILHO,SUPLENTE,PPS,PARTIDO POPULAR SOCIALISTA,1
TATUÍ,DEPUTADO ESTADUAL,DR. MILTON FERREIRA,MILTON FERREIRA DA SILVA,SUPLENTE,PPS,PARTIDO POPULAR SOCIALISTA,3
TATUÍ,DEPUTADO ESTADUAL,MARCOS CHIEN,CHIEN CHIN HUEI,SUPLENTE,PPS,PARTIDO POPULAR SOCIALISTA,2
TATUÍ,DEPUTADO ESTADUAL,JAMILZINHO,JAMIL MARQUES,SUPLENTE,PPS,PARTIDO POPULAR SOCIALISTA,1
TATUÍ,DEPUTADO ESTADUAL,PROF DIMAS NOVAIS,DIMAS NOVAIS DE OLIVEIRA,SUPLENTE,PPS,PARTIDO POPULAR SOCIALISTA,4
TATUÍ,DEPUTADO ESTADUAL,PROF. NELSON SUSSUMU SHIKICIMA,NELSON SUSSUMU SHIKICIMA,SUPLENTE,PPS,PARTIDO POPULAR SOCIALISTA,11
TATUÍ,DEPUTADO ESTADUAL,PALHACINHO PIMPAO,VAGNER LUIZ PIMPAO BERSA,SUPLENTE,PPS,PARTIDO POPULAR SOCIALISTA,1
TATUÍ,DEPUTADO ESTADUAL,JOAO OTAVIO BASTOS,JOAO OTAVIO BASTOS JUNQUEIRA,SUPLENTE,PPS,PARTIDO POPULAR SOCIALISTA,5
TATUÍ,DEPUTADO ESTADUAL,VITOR SAPIENZA,VITOR SAPIENZA,SUPLENTE,PPS,PARTIDO POPULAR SOCIALISTA,148
TATUÍ,DEPUTADO ESTADUAL,ALEX MANENTE,ALEX SPINELLI MANENTE,ELEITO,PPS,PARTIDO POPULAR SOCIALISTA,22
TATUÍ,DEPUTADO ESTADUAL,GUILHERME GAZZOLA,GUILHERME DOS REIS GAZZOLA,SUPLENTE,PPS,PARTIDO POPULAR SOCIALISTA,3
TATUÍ,DEPUTADO ESTADUAL,JORGE MATOS,JORGE DONIZETTI RIBEIRO DE MATOS,SUPLENTE,PPS,PARTIDO POPULAR SOCIALISTA,1
TATUÍ,DEPUTADO ESTADUAL,DIRCEU DALBEN,ANTONIO DIRCEU DALBEN,SUPLENTE,PPS,PARTIDO POPULAR SOCIALISTA,3
TATUÍ,DEPUTADO ESTADUAL,GONDIM,LUIZ CARLOS GONDIM TEIXEIRA,ELEITO,PPS,PARTIDO POPULAR SOCIALISTA,35
TATUÍ,DEPUTADO ESTADUAL,PROFESSOR ALVARO CAETANO,ALVARO CAETANO DE ALMEIDA,SUPLENTE,PPS,PARTIDO POPULAR SOCIALISTA,2
TATUÍ,DEPUTADO ESTADUAL,ESTEVÃO,STEVEN ERIKSEN BINNIE,SUPLENTE,PPS,PARTIDO POPULAR SOCIALISTA,14
TATUÍ,DEPUTADO ESTADUAL,PROFESSOR ZE MARIA,JOSE MARIA CANCELLIERO,SUPLENTE,PPS,PARTIDO POPULAR SOCIALISTA,239
TATUÍ,DEPUTADO ESTADUAL,JOSE CLAUDIO,JOSE CLAUDIO DE SOUZA,SUPLENTE,PPS,PARTIDO POPULAR SOCIALISTA,3
TATUÍ,DEPUTADO ESTADUAL,MYRIAM ALCKMIN,MYRIAM ALCKMIN RAMOS NOGUEIRA,SUPLENTE,PPS,PARTIDO POPULAR SOCIALISTA,2
TATUÍ,DEPUTADO ESTADUAL,MARCELO CYPRIANO,MARCELO DA SILVA CYPRIANO,SUPLENTE,PPS,PARTIDO POPULAR SOCIALISTA,1
TATUÍ,DEPUTADO ESTADUAL,ROBERTO MORAIS,ROBERTO TURCHI DE MORAIS,ELEITO,PPS,PARTIDO POPULAR SOCIALISTA,30
TATUÍ,DEPUTADO ESTADUAL,AZUAITE,AZUAITE MARTINS DE FRANÇA,SUPLENTE,PPS,PARTIDO POPULAR SOCIALISTA,8
TATUÍ,DEPUTADO ESTADUAL,MARCOS SHIMABUKURO,MARCOS AKIRA SHIMABUKURO,SUPLENTE,PPS,PARTIDO POPULAR SOCIALISTA,2
TATUÍ,DEPUTADO ESTADUAL,ELZO SIGUETA,ELZO SIGUETA,SUPLENTE,PPS,PARTIDO POPULAR SOCIALISTA,77
TATUÍ,DEPUTADO ESTADUAL,DR REYNALDO DE BARROS,REYNALDO DE BARROS FRESCA JUNIOR,SUPLENTE,PPS,PARTIDO POPULAR SOCIALISTA,4
TATUÍ,DEPUTADO ESTADUAL,SERGIO BOCALINI,SERGIO DOS SANTOS BOCALINI,SUPLENTE,PPS,PARTIDO POPULAR SOCIALISTA,10
TATUÍ,DEPUTADO ESTADUAL,KITO JUNQUEIRA,HERACLITO GOMES PIZANO,SUPLENTE,PPS,PARTIDO POPULAR SOCIALISTA,8
TATUÍ,DEPUTADO ESTADUAL,OSMAR SANTOS,OSMAR PINHEIRO DOS SANTOS,SUPLENTE,PPS,PARTIDO POPULAR SOCIALISTA,1
TATUÍ,DEPUTADO ESTADUAL,DARIO SAADI,DARIO JORGE GIOLO SAADI,SUPLENTE,DEM,PSDB/DEM,13
TATUÍ,DEPUTADO ESTADUAL,MARCOS FERRAZ,ANTONIO MARCOS MARCONDES FERRAZ,SUPLENTE,DEM,PSDB/DEM,4
TATUÍ,DEPUTADO ESTADUAL,ANDRE SOARES,ANDRE BEZERRA RIBEIRO SOARES,ELEITO,DEM,PSDB/DEM,180
TATUÍ,DEPUTADO ESTADUAL,RICARDO MUTRAN,RICARDO JORGE MUTRAN,SUPLENTE,DEM,PSDB/DEM,1
TATUÍ,DEPUTADO ESTADUAL,ULISSES SALES,ULISSES ROBERTO CORNAZZANI SALES,SUPLENTE,DEM,PSDB/DEM,18
TATUÍ,DEPUTADO ESTADUAL,EDMIR CHEDID,EDMIR JOSE ABI CHEDID,ELEITO,DEM,PSDB/DEM,19
TATUÍ,DEPUTADO ESTADUAL,ALDO DEMARCHI,JOSE ALDO DEMARCHI,ELEITO,DEM,PSDB/DEM,46
TATUÍ,DEPUTADO ESTADUAL,JOAO MELLAO NETO,JOAO MELLAO NETO,SUPLENTE,DEM,PSDB/DEM,195
TATUÍ,DEPUTADO ESTADUAL,FERNANDO LUCAS,LUIZ FERNANDO AMARAL LUCAS,SUPLENTE,DEM,PSDB/DEM,3
TATUÍ,DEPUTADO ESTADUAL,MACEDO BASTOS,CARLOS ALBERTO MACEDO BASTOS,SUPLENTE,DEM,PSDB/DEM,4
TATUÍ,DEPUTADO ESTADUAL,ESTEVAM GALVAO,ESTEVAM GALVAO DE OLIVEIRA,ELEITO,DEM,PSDB/DEM,6
TATUÍ,DEPUTADO ESTADUAL,RICARDO SALLES,RICARDO DE AQUINO SALLES,SUPLENTE,DEM,PSDB/DEM,22
TATUÍ,DEPUTADO ESTADUAL,TOMAZELLA,GERALDO TOMAZELA FILHO,SUPLENTE,DEM,PSDB/DEM,27
TATUÍ,DEPUTADO ESTADUAL,MILTON LEITE FILHO,MILTON LEITE DA SILVA FILHO,ELEITO,DEM,PSDB/DEM,17
TATUÍ,DEPUTADO ESTADUAL,GIL ARANTES,GILBERTO MACEDO GIL ARANTES,ELEITO,DEM,PSDB/DEM,48
TATUÍ,DEPUTADO ESTADUAL,ZE TURIN,JOSE ARIVALDO RODRIGUES,SUPLENTE,DEM,PSDB/DEM,2
TATUÍ,DEPUTADO ESTADUAL,ZE LOUQUINHO,JOSE LUIZ RODRIGUES,SUPLENTE,DEM,PSDB/DEM,1
TATUÍ,DEPUTADO ESTADUAL,PROFESSORA VIVIAN PIN,VIVIAN LIGIA PIN,SUPLENTE,DEM,PSDB/DEM,1
TATUÍ,DEPUTADO ESTADUAL,LEANDRO DO KLB,LEANDRO FINATO SCORNAVACCA,SUPLENTE,DEM,PSDB/DEM,189
TATUÍ,DEPUTADO ESTADUAL,EDUARDO BETTIN,CARLOS EDUARDO DA FONSECA BETTIN,SUPLENTE,PHS,HUMANISTA CRISTÃO ,49
TATUÍ,DEPUTADO ESTADUAL,PAULO HADICH,PAULO CEZAR JUNQUEIRA HADICH,SUPLENTE,PSB,PARTIDO SOCIALISTA BRASILEIRO,2
TATUÍ,DEPUTADO ESTADUAL,BAHIA DA ACADEMIA,ALMIRANDO FERREIRA DO NASCIMENTO,SUPLENTE,PSB,PARTIDO SOCIALISTA BRASILEIRO,3
TATUÍ,DEPUTADO ESTADUAL,TADEU,IROAN TADEU PORTO DE LIMA,SUPLENTE,PSB,PARTIDO SOCIALISTA BRASILEIRO,5
TATUÍ,DEPUTADO ESTADUAL,GERALDO NÓBREGA,GERALDO ANTONIO DA NOBREGA,SUPLENTE,PSB,PARTIDO SOCIALISTA BRASILEIRO,4
TATUÍ,DEPUTADO ESTADUAL,DR. VLAMIR,VLAMIR SÉRGIO D'EMILIO LANDUCCI,SUPLENTE,PSB,PARTIDO SOCIALISTA BRASILEIRO,4
TATUÍ,DEPUTADO ESTADUAL,ESCRITOR RONALDO DURAN,RONALDO DE JESUS DA SILVA,SUPLENTE,PSB,PARTIDO SOCIALISTA BRASILEIRO,2
TATUÍ,DEPUTADO ESTADUAL,NILTON CESAR,NILTON CESAR DOS SANTOS,SUPLENTE,PSB,PARTIDO SOCIALISTA BRASILEIRO,1
TATUÍ,DEPUTADO ESTADUAL,DR. GENNARI,MARCELO GENNARI BORATTO,SUPLENTE,PSB,PARTIDO SOCIALISTA BRASILEIRO,6
TATUÍ,DEPUTADO ESTADUAL,MARIÂNGELA DUARTE,MARIANGELA DE ARAÚJO GAMA DUARTE,SUPLENTE,PSB,PARTIDO SOCIALISTA BRASILEIRO,1
TATUÍ,DEPUTADO ESTADUAL,JANAINA MARTINS,JANAINA PEREIRA MARTINS,SUPLENTE,PSB,PARTIDO SOCIALISTA BRASILEIRO,1
TATUÍ,DEPUTADO ESTADUAL,PEROBA,OSMAR PEROBA OLIVEIRA LINS,SUPLENTE,PSB,PARTIDO SOCIALISTA BRASILEIRO,1
TATUÍ,DEPUTADO ESTADUAL,JEFFERSON CABRAL,JEFFERSON FERNANDO RIBEIRO CABRAL,SUPLENTE,PSB,PARTIDO SOCIALISTA BRASILEIRO,3
TATUÍ,DEPUTADO ESTADUAL,WALTER HAYASHI,WALTER KATSUNORI HAYASHI,SUPLENTE,PSB,PARTIDO SOCIALISTA BRASILEIRO,3
TATUÍ,DEPUTADO ESTADUAL,TEREZINHA DA PAULINA,TEREZINHA DE JESUS MORAIS VASCONCELOS SILVA,SUPLENTE,PSB,PARTIDO SOCIALISTA BRASILEIRO,33
TATUÍ,DEPUTADO ESTADUAL,ED THOMAS,EDSON TOMAZINI,ELEITO,PSB,PARTIDO SOCIALISTA BRASILEIRO,7
TATUÍ,DEPUTADO ESTADUAL,PROF. MARIO LUIZ GUIDE,MARIO LUIZ GUIDE,SUPLENTE,PSB,PARTIDO SOCIALISTA BRASILEIRO,5
TATUÍ,DEPUTADO ESTADUAL,UILSON LEITE,UILSON ROBERTO LEITE,SUPLENTE,PSB,PARTIDO SOCIALISTA BRASILEIRO,1
TATUÍ,DEPUTADO ESTADUAL,SARGENTO OHNO,NELSON MASSOMI OHNO,SUPLENTE,PSB,PARTIDO SOCIALISTA BRASILEIRO,3
TATUÍ,DEPUTADO ESTADUAL,HILKIAS,HILKIAS DE OLIVEIRA,SUPLENTE,PSB,PARTIDO SOCIALISTA BRASILEIRO,37
TATUÍ,DEPUTADO ESTADUAL,MESTRE,CARLOS EDUARDO JESUS,SUPLENTE,PSB,PARTIDO SOCIALISTA BRASILEIRO,2
TATUÍ,DEPUTADO ESTADUAL,EDINHO SANTANA,EDSON FRANCISCO DE SANTANA,SUPLENTE,PSB,PARTIDO SOCIALISTA BRASILEIRO,2
TATUÍ,DEPUTADO ESTADUAL,FRANCÉ JUNIOR,ANTONIO FRANCÉ JUNIOR,SUPLENTE,PSB,PARTIDO SOCIALISTA BRASILEIRO,1
TATUÍ,DEPUTADO ESTADUAL,DR. JOSÉ RICARDO,JOSÉ RICARDO DIAS,SUPLENTE,PSB,PARTIDO SOCIALISTA BRASILEIRO,289
TATUÍ,DEPUTADO ESTADUAL,YVONE BARREIROS,YVONE BARREIROS MOREIRA,SUPLENTE,PSB,PARTIDO SOCIALISTA BRASILEIRO,6
TATUÍ,DEPUTADO ESTADUAL,FRANKLIN CANGUSSU,FRANKLIN CANGUSSU SAMPAIO,SUPLENTE,PSB,PARTIDO SOCIALISTA BRASILEIRO,1
TATUÍ,DEPUTADO ESTADUAL,ELIAS CANDEIAS,ELIAS GARCIA CANDEIAS,SUPLENTE,PSB,PARTIDO SOCIALISTA BRASILEIRO,10
TATUÍ,DEPUTADO ESTADUAL,AGUINALDO FERREIRA,AGUINALDO FERREIRA,SUPLENTE,PSB,PARTIDO SOCIALISTA BRASILEIRO,8
TATUÍ,DEPUTADO ESTADUAL,ALCEU GIRALDI,ALCEU GIRALDI,SUPLENTE,PSB,PARTIDO SOCIALISTA BRASILEIRO,1
TATUÍ,DEPUTADO ESTADUAL,ARLY DE LARA ROMEO,ARLY DE LARA ROMEO,SUPLENTE,PSB,PARTIDO SOCIALISTA BRASILEIRO,1
TATUÍ,DEPUTADO ESTADUAL,LEVI MENDES,ANTONIO LEVI MENDES,SUPLENTE,PSB,PARTIDO SOCIALISTA BRASILEIRO,5
TATUÍ,DEPUTADO ESTADUAL,PASTOR IVANILDO,IVANILDO FREIRE DE SANTANA,SUPLENTE,PSB,PARTIDO SOCIALISTA BRASILEIRO,3
TATUÍ,DEPUTADO ESTADUAL,MALU VIEIRA - BAISA,MARIA LUISA VIEIRA,SUPLENTE,PSB,PARTIDO SOCIALISTA BRASILEIRO,1
TATUÍ,DEPUTADO ESTADUAL,ROMUALDO,ROMUALDO CONSTANTINO MAGRO JUNIOR,SUPLENTE,PSB,PARTIDO SOCIALISTA BRASILEIRO,1
TATUÍ,DEPUTADO ESTADUAL,VINICIUS CAMARINHA,VINICIUS ALMEIDA CAMARINHA,ELEITO,PSB,PARTIDO SOCIALISTA BRASILEIRO,10
TATUÍ,DEPUTADO ESTADUAL,PROF. MICHELETTI,ROGERIO JACOMO MICHELETTI,SUPLENTE,PSB,PARTIDO SOCIALISTA BRASILEIRO,1
TATUÍ,DEPUTADO ESTADUAL,DRA. NEIDE SALES,NEIDE APARECIDA SALES BISCUOLA,SUPLENTE,PSB,PARTIDO SOCIALISTA BRASILEIRO,2
TATUÍ,DEPUTADO ESTADUAL,MAURO DARTIBALE,MAURO DARTIBALE,SUPLENTE,PSB,PARTIDO SOCIALISTA BRASILEIRO,1
TATUÍ,DEPUTADO ESTADUAL,DR. PAULO MARIANI,PAULO CEZAR MARIANI,SUPLENTE,PSB,PARTIDO SOCIALISTA BRASILEIRO,1
TATUÍ,DEPUTADO ESTADUAL,GENTIL,ALEXANDRE MARIANO GENTIL,SUPLENTE,PV,PARTIDO VERDE,39
TATUÍ,DEPUTADO ESTADUAL,GIRIBONI,EDSON DE OLIVEIRA GIRIBONI,ELEITO,PV,PARTIDO VERDE,1385
TATUÍ,DEPUTADO ESTADUAL,ARTUR DIAN,ARTUR JOSE DIAN,SUPLENTE,PV,PARTIDO VERDE,2
TATUÍ,DEPUTADO ESTADUAL,FIDEL BUSTAMANTE,FIDEL BUSTAMANTE,SUPLENTE,PV,PARTIDO VERDE,17
TATUÍ,DEPUTADO ESTADUAL,ENGENHEIRO MÁRCIO,MARCIO MEDEIROS,SUPLENTE,PV,PARTIDO VERDE,3831
TATUÍ,DEPUTADO ESTADUAL,GERALDO NASCIMENTO NANÁ,GERALDO JANUARIO DO NASCIMENTO,SUPLENTE,PV,PARTIDO VERDE,3
TATUÍ,DEPUTADO ESTADUAL,ADRIANA RODRIGUES,ADRIANA LARIO RAMALHO RODRIGUES,SUPLENTE,PV,PARTIDO VERDE,15
TATUÍ,DEPUTADO ESTADUAL,FELICIANO,FELICIANO NAHIMY FILHO,ELEITO,PV,PARTIDO VERDE,139
TATUÍ,DEPUTADO ESTADUAL,HENRIQUE CONTI,JOSE HENRIQUE CONTI,SUPLENTE,PV,PARTIDO VERDE,1
TATUÍ,DEPUTADO ESTADUAL,RAUL FELIX,RAUL SOARES FELIX,SUPLENTE,PV,PARTIDO VERDE,2
TATUÍ,DEPUTADO ESTADUAL,PAULLO VIEIRA,PAULO ROBERTO AMARAL VIEIRA,SUPLENTE,PV,PARTIDO VERDE,74
TATUÍ,DEPUTADO ESTADUAL,LAIS LATORRE,LAIS MENDES LATORRE SOARES,SUPLENTE,PV,PARTIDO VERDE,3
TATUÍ,DEPUTADO ESTADUAL,DR PAULO CÉSAR (PC),PAULO CESAR DA SILVA FERREIRA,SUPLENTE,PV,PARTIDO VERDE,3
TATUÍ,DEPUTADO ESTADUAL,CLEVERSON SILVA,CLEVERSON ALVES DA SILVA,SUPLENTE,PV,PARTIDO VERDE,3
TATUÍ,DEPUTADO ESTADUAL,DRA BETE,MARIA ELISABETE MARCONDES GUIMARAES,SUPLENTE,PV,PARTIDO VERDE,2
TATUÍ,DEPUTADO ESTADUAL,PROFESSORA EUGENIA,EUGENIA HERALDA DE BARROS SILVA,SUPLENTE,PV,PARTIDO VERDE,2
TATUÍ,DEPUTADO ESTADUAL,DORA,DORACI RIBEIRO DE FARIAS,SUPLENTE,PV,PARTIDO VERDE,1
TATUÍ,DEPUTADO ESTADUAL,CHICO SARDELLI,FRANCISCO ANTONIO SARDELLI,ELEITO,PV,PARTIDO VERDE,102
TATUÍ,DEPUTADO ESTADUAL,CLEBER GAÚCHO,CLEBER DA ROSA MOREIRA,SUPLENTE,PV,PARTIDO VERDE,1
TATUÍ,DEPUTADO ESTADUAL,PAULINHO ZACCARIOTTO,PAULO SERGIO ZACCARIOTTO,SUPLENTE,PV,PARTIDO VERDE,1
TATUÍ,DEPUTADO ESTADUAL,PAULINHO DO PV,PAULO CARDOSO FILHO,SUPLENTE,PV,PARTIDO VERDE,2
TATUÍ,DEPUTADO ESTADUAL,RICARDO CASTILHO,RICARDO RODRIGUES DE CASTILHO,SUPLENTE,PV,PARTIDO VERDE,58
TATUÍ,DEPUTADO ESTADUAL,CAMILO GAVA,JOSÉ CAMILO GAVA NETO,SUPLENTE,PV,PARTIDO VERDE,63
