AMPARO,PRESIDENTE,DILMA,DILMA VANA ROUSSEFF,2º TURNO,PT,PARA O BRASIL SEGUIR MUDANDO,9556
AMPARO,PRESIDENTE,JOSÉ SERRA,JOSÉ SERRA,2º TURNO,PSDB,O BRASIL PODE MAIS,23116
AMPARO,GOVERNADOR,GERALDO ALCKMIN,GERALDO JOSE RODRIGUES ALCKMIN FILHO,ELEITO,PSDB,UNIDOS POR SÃO PAULO,23793
AMPARO,SENADOR,MARTA SUPLICY,MARTA SUPLICY,ELEITO,PT,UNIÃO PARA MUDAR,8661
AMPARO,SENADOR,ALOYSIO NUNES,ALOYSIO NUNES FERREIRA FILHO,ELEITO,PSDB,UNIDOS POR SÃO PAULO,22964
AMPARO,DEPUTADO FEDERAL,DR. ELIEZER COSTA,ELIEZER NASCIMENTO DA COSTA,SUPLENTE,PRB,JUNTOS POR SÃO PAULO,1
AMPARO,DEPUTADO FEDERAL,ANTONIO BULHÕES,ANTONIO CARLOS MARTINS DE BULHÕES,ELEITO,PRB,JUNTOS POR SÃO PAULO,6
AMPARO,DEPUTADO FEDERAL,JOSÉ TEOFILO,JOSÉ TEOFILO ALVES CORREA DE OLIVEIRA,SUPLENTE,PRB,JUNTOS POR SÃO PAULO,1
AMPARO,DEPUTADO FEDERAL,ALESSANDER VIGNA,ALESSANDER BARREIRA VIGNA,SUPLENTE,PRB,JUNTOS POR SÃO PAULO,8
AMPARO,DEPUTADO FEDERAL,ELCIO AMANCIO,ELCIO AMÂNCIO,SUPLENTE,PRB,JUNTOS POR SÃO PAULO,1
AMPARO,DEPUTADO FEDERAL,OTONIEL LIMA,OTONIEL CARLOS DE LIMA,MÉDIA,PRB,JUNTOS POR SÃO PAULO,165
AMPARO,DEPUTADO FEDERAL,RATINHO,SEBASTIÃO MARTINS DE AZEVEDO,SUPLENTE,PRB,JUNTOS POR SÃO PAULO,1
AMPARO,DEPUTADO FEDERAL,MALUF,PAULO SALIM MALUF,ELEITO,PP,PARTIDO PROGRESSISTA,485
AMPARO,DEPUTADO FEDERAL,RUBENEUTON OLIVEIRA LIMA,RUBENEUTON OLIVEIRA LIMA,SUPLENTE,PP,PARTIDO PROGRESSISTA,5
AMPARO,DEPUTADO FEDERAL,ANGINHO DOS TECLADOS,ANGELO MARINHO DE ALMEIDA,SUPLENTE,PP,PARTIDO PROGRESSISTA,1
AMPARO,DEPUTADO FEDERAL,CARLOS OCTAVIANI,JOSÉ CARLOS OCTAVIANI,SUPLENTE,PP,PARTIDO PROGRESSISTA,2
AMPARO,DEPUTADO FEDERAL,CAPITÃO GOMES,CARLOS GOMES DA SILVA,SUPLENTE,PP,PARTIDO PROGRESSISTA,11
AMPARO,DEPUTADO FEDERAL,BATORÉ,IVANILDO GOMES NOGUEIRA,SUPLENTE,PP,PARTIDO PROGRESSISTA,4
AMPARO,DEPUTADO FEDERAL,MANOEL MOREIRA,MANOEL MOREIRA DE ARAUJO FILHO,SUPLENTE,PP,PARTIDO PROGRESSISTA,1
AMPARO,DEPUTADO FEDERAL,ADELINA ALCANTARA MACHADO,ADELINA PEREIRA DA SILVEIRA DE ALCANTARA MACHADO,SUPLENTE,PP,PARTIDO PROGRESSISTA,1
AMPARO,DEPUTADO FEDERAL,LIBERATO DE VALENTIM GENTIL,LIBERATO ROCHA CALDEIRA,SUPLENTE,PP,PARTIDO PROGRESSISTA,3
AMPARO,DEPUTADO FEDERAL,MAURICIO MARTINS,MAURICIO LUIS MARTINS,SUPLENTE,PP,PARTIDO PROGRESSISTA,5
AMPARO,DEPUTADO FEDERAL,PEDRINHO BARACAT,ASSAD NACLE BARACAT,SUPLENTE,PP,PARTIDO PROGRESSISTA,16
AMPARO,DEPUTADO FEDERAL,ALINE CORREA,ALINE LEMOS CORREA DE OLIVEIRA ANDRADE,ELEITO,PP,PARTIDO PROGRESSISTA,5
AMPARO,DEPUTADO FEDERAL,PAULO BASSOLI,PAULO SERGIO BONGATER BASSOLI,SUPLENTE,PP,PARTIDO PROGRESSISTA,1
AMPARO,DEPUTADO FEDERAL,PASTOR MARCOS MOTOLO,MARCOS CINTAS MOTOLO,SUPLENTE,PP,PARTIDO PROGRESSISTA,3
AMPARO,DEPUTADO FEDERAL,CATARINA RIGINIK,CATARINA BEATRIZ GASPAROTTO RIGINIK,SUPLENTE,PP,PARTIDO PROGRESSISTA,2
AMPARO,DEPUTADO FEDERAL,BETO MANSUR,PAULO ROBERTO GOMES MANSUR,ELEITO,PP,PARTIDO PROGRESSISTA,15
AMPARO,DEPUTADO FEDERAL,ADHEMAR DE BARROS FILHO,ADHEMAR DE BARROS FILHO,SUPLENTE,PP,PARTIDO PROGRESSISTA,5
AMPARO,DEPUTADO FEDERAL,MOURAD,MOHAMAD SAID MOURAD,SUPLENTE,PP,PARTIDO PROGRESSISTA,3
AMPARO,DEPUTADO FEDERAL,CABO WILSON,WILSON DE OLIVEIRA MORAIS,SUPLENTE,PP,PARTIDO PROGRESSISTA,5
AMPARO,DEPUTADO FEDERAL,MISSIONÁRIO JOSÉ OLIMPIO,JOSÉ OLIMPIO SILVEIRA MORAES,ELEITO,PP,PARTIDO PROGRESSISTA,129
AMPARO,DEPUTADO FEDERAL,CARLÃO FELIPE,JOÃO CARLOS FELIPE,SUPLENTE,PP,PARTIDO PROGRESSISTA,1
AMPARO,DEPUTADO FEDERAL,PRICILA MENIN,LETEIA PRICILA GOMES,SUPLENTE,PP,PARTIDO PROGRESSISTA,1
AMPARO,DEPUTADO FEDERAL,JORGE WILSON,JORGE WILSON GONÇALVES DE MATTOS,SUPLENTE,PP,PARTIDO PROGRESSISTA,14
AMPARO,DEPUTADO FEDERAL,CAPITÃO CRIVELARI,LUIZ ANTONIO CRIVELARI,SUPLENTE,PP,PARTIDO PROGRESSISTA,6
AMPARO,DEPUTADO FEDERAL,FARIA LIMA,JOSE ROBERTO FARIA LIMA,SUPLENTE,PP,PARTIDO PROGRESSISTA,2
AMPARO,DEPUTADO FEDERAL,VADÃO,ETIVALDO VADAO GOMES,SUPLENTE,PP,PARTIDO PROGRESSISTA,12
AMPARO,DEPUTADO FEDERAL,PH,PAULO HENRIQUE RIBEIRO SANTANA,SUPLENTE,PDT,PARTIDO DEMOCRÁTICO TRABALHISTA,5
AMPARO,DEPUTADO FEDERAL,DR MARIO,MARIO AUGUSTO SANTOS TEIXEIRA,SUPLENTE,PDT,PARTIDO DEMOCRÁTICO TRABALHISTA,1
AMPARO,DEPUTADO FEDERAL,ERLON CHAVES,ERLON CHAVES DE CASTRO,SUPLENTE,PDT,PARTIDO DEMOCRÁTICO TRABALHISTA,1
AMPARO,DEPUTADO FEDERAL,JOÃO DADO,JOÃO EDUARDO DADO LEITE DE CARVALHO,ELEITO,PDT,PARTIDO DEMOCRÁTICO TRABALHISTA,45
AMPARO,DEPUTADO FEDERAL,PAULINHO DA FORÇA,PAULO PEREIRA DA SILVA,ELEITO,PDT,PARTIDO DEMOCRÁTICO TRABALHISTA,125
AMPARO,DEPUTADO FEDERAL,ELISEU DANIEL,ELISEU DANIEL DOS SANTOS,SUPLENTE,PDT,PARTIDO DEMOCRÁTICO TRABALHISTA,9
AMPARO,DEPUTADO FEDERAL,BARBOSA,ANTONIO CARLOS BARBOSA,SUPLENTE,PDT,PARTIDO DEMOCRÁTICO TRABALHISTA,1
AMPARO,DEPUTADO FEDERAL,GUSTAVO STUPP,LUIZ GUSTAVO ANTUNES STUPP,SUPLENTE,PDT,PARTIDO DEMOCRÁTICO TRABALHISTA,3
AMPARO,DEPUTADO FEDERAL,ARMANDO HENRIQUE,ARMANDO HENRIQUE,SUPLENTE,PDT,PARTIDO DEMOCRÁTICO TRABALHISTA,3
AMPARO,DEPUTADO FEDERAL,PEDRO BAPTISTINI,PEDRO ANTONIO BAPTISTINI,SUPLENTE,PDT,PARTIDO DEMOCRÁTICO TRABALHISTA,7
AMPARO,DEPUTADO FEDERAL,SAULO GOES,SAULO GOES DE ALBUQUERQUE,SUPLENTE,PDT,PARTIDO DEMOCRÁTICO TRABALHISTA,2
AMPARO,DEPUTADO FEDERAL,MEDEIROS,LUIZ ANTONIO DE MEDEIROS NETO,SUPLENTE,PDT,PARTIDO DEMOCRÁTICO TRABALHISTA,8
AMPARO,DEPUTADO FEDERAL,GILBERTO BENZI,GILBERTO BENZI,SUPLENTE,PDT,PARTIDO DEMOCRÁTICO TRABALHISTA,1
AMPARO,DEPUTADO FEDERAL,DR LUIZ CHIAPARINE,LUIZ CARLOS CHIAPARINE,SUPLENTE,PDT,PARTIDO DEMOCRÁTICO TRABALHISTA,14
AMPARO,DEPUTADO FEDERAL,NELSINHO DA BAHIA,NELSON FRANCISCO DOS SANTOS,SUPLENTE,PDT,PARTIDO DEMOCRÁTICO TRABALHISTA,7
AMPARO,DEPUTADO FEDERAL,MANOEL ANTUNES,MANOEL ANTUNES,SUPLENTE,PDT,PARTIDO DEMOCRÁTICO TRABALHISTA,2
AMPARO,DEPUTADO FEDERAL,CARLOS HENRIQUE,CARLOS HENRIQUE PINTO,SUPLENTE,PDT,PARTIDO DEMOCRÁTICO TRABALHISTA,257
AMPARO,DEPUTADO FEDERAL,DRA DEBORA,DEBORA MARIA MARAGNI PEREIRA DE ABREU,SUPLENTE,PDT,PARTIDO DEMOCRÁTICO TRABALHISTA,3
AMPARO,DEPUTADO FEDERAL,ISMAEL NICACIO,ISMAEL JUDÁ DOS SANTOS NICÁCIO,SUPLENTE,PDT,PARTIDO DEMOCRÁTICO TRABALHISTA,1
AMPARO,DEPUTADO FEDERAL,SALVADOR ZIMBALDI,SALVADOR ZIMBALDI FILHO,MÉDIA,PDT,PARTIDO DEMOCRÁTICO TRABALHISTA,178
AMPARO,DEPUTADO FEDERAL,DRA ZIRVA,ZIRVA DAS GRAÇAS PIRES PEREIRA,SUPLENTE,PDT,PARTIDO DEMOCRÁTICO TRABALHISTA,3
AMPARO,DEPUTADO FEDERAL,ITAMAR ALVES,ITAMAR ALVES DE OLIVEIRA,SUPLENTE,PDT,PARTIDO DEMOCRÁTICO TRABALHISTA,1
AMPARO,DEPUTADO FEDERAL,INDIO TERENA,RUBENS MAMEDE,SUPLENTE,PDT,PARTIDO DEMOCRÁTICO TRABALHISTA,1
AMPARO,DEPUTADO FEDERAL,NEI,RODNEI OLIVEIRA DA SILVA,SUPLENTE,PDT,PARTIDO DEMOCRÁTICO TRABALHISTA,1
AMPARO,DEPUTADO FEDERAL,SARGENTO ERNALDO,ERNALDO CESAR MARCONDES,SUPLENTE,PDT,PARTIDO DEMOCRÁTICO TRABALHISTA,1
AMPARO,DEPUTADO FEDERAL,VALDEVAN NOVENTA,JOSE VALDEVAM DE JESUS SANTOS,SUPLENTE,PDT,PARTIDO DEMOCRÁTICO TRABALHISTA,1
AMPARO,DEPUTADO FEDERAL,ACIR FILÓ,ACIR DOS SANTOS,SUPLENTE,PDT,PARTIDO DEMOCRÁTICO TRABALHISTA,2
AMPARO,DEPUTADO FEDERAL,IVANIO BATISTA,IVANIO BATISTA DA SILVA,SUPLENTE,PT,JUNTOS POR SÃO PAULO,16
AMPARO,DEPUTADO FEDERAL,VICENTE CANDIDO,VICENTE CANDIDO DA SILVA,ELEITO,PT,JUNTOS POR SÃO PAULO,1
AMPARO,DEPUTADO FEDERAL,PROFESSOR JAIR BALESTRA,JAIR DONIZETI BALESTRA,SUPLENTE,PT,JUNTOS POR SÃO PAULO,2
AMPARO,DEPUTADO FEDERAL,MARQUINHOS OLÍVIO,MARCOS OLIVIO CONCEIÇÃO,SUPLENTE,PT,JUNTOS POR SÃO PAULO,2
AMPARO,DEPUTADO FEDERAL,TUNAI,MARCO SOARES FERNANDES,SUPLENTE,PT,JUNTOS POR SÃO PAULO,1
AMPARO,DEPUTADO FEDERAL,IARA BERNARDI,IARA BERNARDI,SUPLENTE,PT,JUNTOS POR SÃO PAULO,5
AMPARO,DEPUTADO FEDERAL,LARGUESA,LUIS VANDERLEI LARGUESA,SUPLENTE,PT,JUNTOS POR SÃO PAULO,2
AMPARO,DEPUTADO FEDERAL,VACCAREZZA,CANDIDO ELPIDIO DE SOUZA VACCAREZZA,ELEITO,PT,JUNTOS POR SÃO PAULO,99
AMPARO,DEPUTADO FEDERAL,GENOINO,JOSÉ GENOÍNO NETO,SUPLENTE,PT,JUNTOS POR SÃO PAULO,72
AMPARO,DEPUTADO FEDERAL,OSMAR LOPES,OSMAR LOPES,SUPLENTE,PT,JUNTOS POR SÃO PAULO,2
AMPARO,DEPUTADO FEDERAL,HELCIO SILVA,HELCIO ANTONIO DA SILVA,SUPLENTE,PT,JUNTOS POR SÃO PAULO,4
AMPARO,DEPUTADO FEDERAL,CARLINHOS ALMEIDA,CARLOS JOSE DE ALMEIDA,ELEITO,PT,JUNTOS POR SÃO PAULO,3
AMPARO,DEPUTADO FEDERAL,MISA BOITO,MARIA EMILIA SEDEH BOITO,SUPLENTE,PT,JUNTOS POR SÃO PAULO,2
AMPARO,DEPUTADO FEDERAL,NEWTON LIMA NETO,NEWTON LIMA NETO,ELEITO,PT,JUNTOS POR SÃO PAULO,174
AMPARO,DEPUTADO FEDERAL,TEREZINHA RONDELLI,MARIA TEREZINHA RONDELLI,SUPLENTE,PT,JUNTOS POR SÃO PAULO,4
AMPARO,DEPUTADO FEDERAL,GERSON SARTORI,GERSON HENRIQUE SARTORI,SUPLENTE,PT,JUNTOS POR SÃO PAULO,10
AMPARO,DEPUTADO FEDERAL,FILIPPI,JOSÉ DE FILIPPI JÚNIOR,ELEITO,PT,JUNTOS POR SÃO PAULO,13
AMPARO,DEPUTADO FEDERAL,ARLINDO CHINAGLIA,ARLINDO CHIGNALIA JUNIOR,ELEITO,PT,JUNTOS POR SÃO PAULO,797
AMPARO,DEPUTADO FEDERAL,JOÃO PAULO CUNHA,JOÃO PAULO CUNHA,ELEITO,PT,JUNTOS POR SÃO PAULO,15
AMPARO,DEPUTADO FEDERAL,JOÃO BATISTA,JOÃO BATISTA DA SILVA,SUPLENTE,PT,JUNTOS POR SÃO PAULO,1
AMPARO,DEPUTADO FEDERAL,PIVATTO,JOSÉ PIVATTO,SUPLENTE,PT,JUNTOS POR SÃO PAULO,305
AMPARO,DEPUTADO FEDERAL,RICARDO BERZOINI,RICARDO JOSE RIBEIRO BERZOINI,ELEITO,PT,JUNTOS POR SÃO PAULO,6
AMPARO,DEPUTADO FEDERAL,JOSÉ MENTOR,JOSÉ MENTOR GUILHERME DE MELLO NETTO,ELEITO,PT,JUNTOS POR SÃO PAULO,12
AMPARO,DEPUTADO FEDERAL,PROF. CARLÃO RAMIRO,CARLOS RAMIRO CASTRO,SUPLENTE,PT,JUNTOS POR SÃO PAULO,43
AMPARO,DEPUTADO FEDERAL,FÉLIX SAHÃO,FÉLIX SAHÃO JÚNIOR,SUPLENTE,PT,JUNTOS POR SÃO PAULO,9
AMPARO,DEPUTADO FEDERAL,VANDERLEI SIRAQUE,VANDERLEI SIRAQUE,SUPLENTE,PT,JUNTOS POR SÃO PAULO,6
AMPARO,DEPUTADO FEDERAL,PAULO AFONSO,PAULO AFONSO RIBEIRO,SUPLENTE,PT,JUNTOS POR SÃO PAULO,2
AMPARO,DEPUTADO FEDERAL,LUIZ CARLOS GOMES,LUIZ CARLOS GOMES,SUPLENTE,PT,JUNTOS POR SÃO PAULO,2
AMPARO,DEPUTADO FEDERAL,DRA. SONIA DARCH,SONIA DARCH DE BRITO,SUPLENTE,PT,JUNTOS POR SÃO PAULO,2
AMPARO,DEPUTADO FEDERAL,JILMAR TATTO,JILMAR AUGUSTINHO TATTO,ELEITO,PT,JUNTOS POR SÃO PAULO,9
AMPARO,DEPUTADO FEDERAL,DURVAL ORLATO,DURVAL LOPES ORLATO,SUPLENTE,PT,JUNTOS POR SÃO PAULO,19
AMPARO,DEPUTADO FEDERAL,EDSON DA PAZ (O CANTOR),EDSON DA PAZ,SUPLENTE,PT,JUNTOS POR SÃO PAULO,3
AMPARO,DEPUTADO FEDERAL,RUBINHO BASTOS,RUBENS BASTOS DO NASCIMENTO,SUPLENTE,PT,JUNTOS POR SÃO PAULO,1
AMPARO,DEPUTADO FEDERAL,ARCELINO ARAUJO,ARCELINO ARAUJO RIBEIRO,SUPLENTE,PT,JUNTOS POR SÃO PAULO,4
AMPARO,DEPUTADO FEDERAL,CARLOS AQUINO,JOSÉ CARLOS DE AQUINO,SUPLENTE,PT,JUNTOS POR SÃO PAULO,2
AMPARO,DEPUTADO FEDERAL,RENATO SIMÕES,RENATO SIMÕES,SUPLENTE,PT,JUNTOS POR SÃO PAULO,326
AMPARO,DEPUTADO FEDERAL,DEVANIR RIBEIRO,DEVANIR RIBEIRO,ELEITO,PT,JUNTOS POR SÃO PAULO,2
AMPARO,DEPUTADO FEDERAL,ZARATTINI,CARLOS ALBERTO ROLIM ZARATTINI,ELEITO,PT,JUNTOS POR SÃO PAULO,1180
AMPARO,DEPUTADO FEDERAL,MARIA LUCIA PRANDI,MARIA LUCIA PRANDI GOMES,SUPLENTE,PT,JUNTOS POR SÃO PAULO,9
AMPARO,DEPUTADO FEDERAL,ANGELO BARRETO,ANGELO RAFAEL BARRETO,SUPLENTE,PT,JUNTOS POR SÃO PAULO,1
AMPARO,DEPUTADO FEDERAL,JANETE PIETÁ,JANETE ROCHA PIETÁ,ELEITO,PT,JUNTOS POR SÃO PAULO,41
AMPARO,DEPUTADO FEDERAL,VICENTINHO,VICENTE PAULO DA SILVA,ELEITO,PT,JUNTOS POR SÃO PAULO,24
AMPARO,DEPUTADO FEDERAL,PAULO TEIXEIRA,LUIZ PAULO TEIXEIRA FERREIRA,ELEITO,PT,JUNTOS POR SÃO PAULO,14
AMPARO,DEPUTADO FEDERAL,CLAURY,CLAURY SANTOS ALVES DA SILVA,SUPLENTE,PTB,PARTIDO TRABALHISTA BRASILEIRO,1
AMPARO,DEPUTADO FEDERAL,GERALDO MAGELA QUADROS,GERALDO MAGELA MENDES QUADROS,SUPLENTE,PTB,PARTIDO TRABALHISTA BRASILEIRO,1
AMPARO,DEPUTADO FEDERAL,VAMPETA,MARCOS ANDRE BATISTA SANTOS,SUPLENTE,PTB,PARTIDO TRABALHISTA BRASILEIRO,6
AMPARO,DEPUTADO FEDERAL,NADUR,ADALBERTO NADUR,SUPLENTE,PTB,PARTIDO TRABALHISTA BRASILEIRO,1
AMPARO,DEPUTADO FEDERAL,ROBSON TUMA,ROBSON TUMA,SUPLENTE,PTB,PARTIDO TRABALHISTA BRASILEIRO,9
AMPARO,DEPUTADO FEDERAL,OBAMA BRASIL,ANANIAS RODRIGUES DA SILVA,SUPLENTE,PTB,PARTIDO TRABALHISTA BRASILEIRO,1
AMPARO,DEPUTADO FEDERAL,AMIRAH SABA DA METROPOLITANAFM,AMIRAH SABA,SUPLENTE,PTB,PARTIDO TRABALHISTA BRASILEIRO,3
AMPARO,DEPUTADO FEDERAL,SINVAL DORIGON,SINVAL ROBERTO DORIGON,SUPLENTE,PTB,PARTIDO TRABALHISTA BRASILEIRO,3
AMPARO,DEPUTADO FEDERAL,NELSON MARQUEZELLI,NELSON MARQUEZELLI,ELEITO,PTB,PARTIDO TRABALHISTA BRASILEIRO,270
AMPARO,DEPUTADO FEDERAL,FRANCISCO MESQUITA,FRANCISCO CICERO MESQUITA,SUPLENTE,PTB,PARTIDO TRABALHISTA BRASILEIRO,1
AMPARO,DEPUTADO FEDERAL,WALDOMIRO RAMOS,WALDOMIRO CARLOS RAMOS,SUPLENTE,PTB,PARTIDO TRABALHISTA BRASILEIRO,90
AMPARO,DEPUTADO FEDERAL,SONIA CRISTIANO,SONIA REGINA CRISTIANO,SUPLENTE,PTB,PARTIDO TRABALHISTA BRASILEIRO,2
AMPARO,DEPUTADO FEDERAL,ARNALDO FARIA DE SÁ,ARNALDO FARIA DE SÁ,ELEITO,PTB,PARTIDO TRABALHISTA BRASILEIRO,114
AMPARO,DEPUTADO FEDERAL,TIM,ADILSON FERNANDES VARELA,SUPLENTE,PTB,PARTIDO TRABALHISTA BRASILEIRO,1
AMPARO,DEPUTADO FEDERAL,CLAUDIA SARTORI,CLAUDIA SARTORI DONATTI DE SOUZA,SUPLENTE,PTB,PARTIDO TRABALHISTA BRASILEIRO,1
AMPARO,DEPUTADO FEDERAL,WALTER CAVEANHA,WALTER CAVEANHA,SUPLENTE,PTB,PARTIDO TRABALHISTA BRASILEIRO,7
AMPARO,DEPUTADO FEDERAL,ATOR PABLO CIVITELLA,PABLO CIVITELLA,SUPLENTE,PTB,PARTIDO TRABALHISTA BRASILEIRO,9
AMPARO,DEPUTADO FEDERAL,FRANK AGUIAR,FRANCINETO LUZ DE AGUIAR,SUPLENTE,PTB,PARTIDO TRABALHISTA BRASILEIRO,7
AMPARO,DEPUTADO FEDERAL,PASTOR JOAO ALMEIDA,JOAO ALMEIDA DOS SANTOS,SUPLENTE,PTB,PARTIDO TRABALHISTA BRASILEIRO,2
AMPARO,DEPUTADO FEDERAL,DR BENTO MACHADO,BENTO FRANCISCO MACHADO,SUPLENTE,PTB,PARTIDO TRABALHISTA BRASILEIRO,1
AMPARO,DEPUTADO FEDERAL,PADRE FERNANDO,LAUDINEY FERNANDO SILVA FRAGA,SUPLENTE,PTB,PARTIDO TRABALHISTA BRASILEIRO,2
AMPARO,DEPUTADO FEDERAL,EMELLY OLIVEIRA,EMELLY PAGLIARI CARDOSO ALVES DE OLIVEIRA,SUPLENTE,PTB,PARTIDO TRABALHISTA BRASILEIRO,2
AMPARO,DEPUTADO FEDERAL,PAULO LIMA,PAULO CESAR DE OLIVEIRA LIMA,SUPLENTE,PMDB,PARTIDO DO MOVIMENTO DEMOCRÁTICO BRASILEIRO,99
AMPARO,DEPUTADO FEDERAL,ANA CRISTINA,ANA CRISTINA FERNANDES GIAMPIETRO,SUPLENTE,PMDB,PARTIDO DO MOVIMENTO DEMOCRÁTICO BRASILEIRO,1
AMPARO,DEPUTADO FEDERAL,MARCOS TENÓRIO,MARCOS ANTÔNIO FERREIRA TENÓRIO,SUPLENTE,PMDB,PARTIDO DO MOVIMENTO DEMOCRÁTICO BRASILEIRO,4
AMPARO,DEPUTADO FEDERAL,PAULINHO SOBRAL,PAULO MENDES SOBRAL,SUPLENTE,PMDB,PARTIDO DO MOVIMENTO DEMOCRÁTICO BRASILEIRO,1
AMPARO,DEPUTADO FEDERAL,BONFÁ,ALVARO BONFA JUNIOR,SUPLENTE,PMDB,PARTIDO DO MOVIMENTO DEMOCRÁTICO BRASILEIRO,1
AMPARO,DEPUTADO FEDERAL,TONY JUPSSON,TONY JUPSSON SANTOS,SUPLENTE,PMDB,PARTIDO DO MOVIMENTO DEMOCRÁTICO BRASILEIRO,1
AMPARO,DEPUTADO FEDERAL,EDUARDO COELHO,EDUARDO JOSÉ PEREIRA COELHO,SUPLENTE,PMDB,PARTIDO DO MOVIMENTO DEMOCRÁTICO BRASILEIRO,215
AMPARO,DEPUTADO FEDERAL,EDINHO ARAUJO,EDSON EDINHO COELHO ARAUJO,ELEITO,PMDB,PARTIDO DO MOVIMENTO DEMOCRÁTICO BRASILEIRO,3
AMPARO,DEPUTADO FEDERAL,LAZARO,JOSE LAZARO MELO,SUPLENTE,PMDB,PARTIDO DO MOVIMENTO DEMOCRÁTICO BRASILEIRO,1
AMPARO,DEPUTADO FEDERAL,SERGIO KOBRA,SERGIO MARTINS DOS SANTOS JUNIOR,SUPLENTE,PMDB,PARTIDO DO MOVIMENTO DEMOCRÁTICO BRASILEIRO,4
AMPARO,DEPUTADO FEDERAL,DR. AJURICABA,AJURICABA DE SOUZA MENEZES,SUPLENTE,PMDB,PARTIDO DO MOVIMENTO DEMOCRÁTICO BRASILEIRO,3
AMPARO,DEPUTADO FEDERAL,LEONEL NA HORA,LEONEL HERNANDEZ JUNIOR,SUPLENTE,PMDB,PARTIDO DO MOVIMENTO DEMOCRÁTICO BRASILEIRO,1
AMPARO,DEPUTADO FEDERAL,ROLEMBERG,ROLANDO BELTRAMINE ROLEMBERG,SUPLENTE,PMDB,PARTIDO DO MOVIMENTO DEMOCRÁTICO BRASILEIRO,1
AMPARO,DEPUTADO FEDERAL,BOCA NERVOSA,EDMAR MARQUES SILVA,SUPLENTE,PMDB,PARTIDO DO MOVIMENTO DEMOCRÁTICO BRASILEIRO,2
AMPARO,DEPUTADO FEDERAL,DR. CÉSAR,LUIZ CESAR REGINATO,SUPLENTE,PMDB,PARTIDO DO MOVIMENTO DEMOCRÁTICO BRASILEIRO,4
AMPARO,DEPUTADO FEDERAL,JUAREZ COSTA SANTOS,JOARÊS PAULINO DA COSTA,SUPLENTE,PMDB,PARTIDO DO MOVIMENTO DEMOCRÁTICO BRASILEIRO,1
AMPARO,DEPUTADO FEDERAL,GERALDÃO,GERALDO TOMAZ AUGUSTO,SUPLENTE,PMDB,PARTIDO DO MOVIMENTO DEMOCRÁTICO BRASILEIRO,1
AMPARO,DEPUTADO FEDERAL,RICARDO HOLZ,RICARDO HOLZ VIDAL DOS SANTOS,SUPLENTE,PMDB,PARTIDO DO MOVIMENTO DEMOCRÁTICO BRASILEIRO,1
AMPARO,DEPUTADO FEDERAL,A. TRIUNFO AVELLAR,AGUINALDO TRIUMPHO AVELLAR,SUPLENTE,PMDB,PARTIDO DO MOVIMENTO DEMOCRÁTICO BRASILEIRO,1
AMPARO,DEPUTADO FEDERAL,VALÉRIA,VALÉRIA BENTO,SUPLENTE,PMDB,PARTIDO DO MOVIMENTO DEMOCRÁTICO BRASILEIRO,1
AMPARO,DEPUTADO FEDERAL,DR. SAMIR NASSBINE,SAMIR ASSAD NASSBINE,SUPLENTE,PMDB,PARTIDO DO MOVIMENTO DEMOCRÁTICO BRASILEIRO,1
AMPARO,DEPUTADO FEDERAL,JANETE ARAUJO,JANETE ARAUJO LIRA,SUPLENTE,PSL,PRESTE ATENÇÃO SÃO PAULO,2
AMPARO,DEPUTADO FEDERAL,PAULO DONATO,PAULO ROBERTO DONATO,SUPLENTE,PSL,PRESTE ATENÇÃO SÃO PAULO,3
AMPARO,DEPUTADO FEDERAL,APOSTOLO LEO,LEONILDIO LIMA DE OLIVEIRA,SUPLENTE,PSL,PRESTE ATENÇÃO SÃO PAULO,1
AMPARO,DEPUTADO FEDERAL,CORONEL GILSON LOPES,GILSON LOPES DA SILVA,SUPLENTE,PSC,HUMANISTA CRISTÃO ,1
AMPARO,DEPUTADO FEDERAL,MISSIONARIA NAZARE,MARIA NAZARE DOS SANTOS SORRILLO,SUPLENTE,PSC,HUMANISTA CRISTÃO ,2
AMPARO,DEPUTADO FEDERAL,CLEBER DELALIBERA,CLEBER DE MOURA DELALIBERA,SUPLENTE,PSC,HUMANISTA CRISTÃO ,4
AMPARO,DEPUTADO FEDERAL,MARCO FELICIANO,MARCO ANTONIO FELICIANO,ELEITO,PSC,HUMANISTA CRISTÃO ,318
AMPARO,DEPUTADO FEDERAL,MARCELO AGUIAR,MARCELO THEODORO DE AGUIAR,ELEITO,PSC,HUMANISTA CRISTÃO ,1
AMPARO,DEPUTADO FEDERAL,CHICO NETO,FRANCISCO DA COSTA NETO,SUPLENTE,PSC,HUMANISTA CRISTÃO ,2
AMPARO,DEPUTADO FEDERAL,ARI BARCELLOS,JOSE DE ARIMATHEA BARCELLOS,SUPLENTE,PSC,HUMANISTA CRISTÃO ,2
AMPARO,DEPUTADO FEDERAL,GISON SOARES,GISON ALVES SOARES,SUPLENTE,PSC,HUMANISTA CRISTÃO ,1
AMPARO,DEPUTADO FEDERAL,REGIS DE OLIVEIRA,REGIS FERNANDES DE OLIVEIRA,SUPLENTE,PSC,HUMANISTA CRISTÃO ,207
AMPARO,DEPUTADO FEDERAL,SILVIA PALMA,SILVIA ELIANA PALMA,SUPLENTE,PSC,HUMANISTA CRISTÃO ,3
AMPARO,DEPUTADO FEDERAL,NEY SANTOS,CLAUDINEI ALVES DOS SANTOS,SUPLENTE,PSC,HUMANISTA CRISTÃO ,2
AMPARO,DEPUTADO FEDERAL,DR.CARLOS FARIA,CARLOS EDUARDO DA SILVA FARIA,SUPLENTE,PSC,HUMANISTA CRISTÃO ,1
AMPARO,DEPUTADO FEDERAL,JOÃO LOCO,JOÃO LOCO BATISTA DE SIQUEIRA,SUPLENTE,PSC,HUMANISTA CRISTÃO ,2
AMPARO,DEPUTADO FEDERAL,DALVAN,JOÃO GOMES DE ALMEIDA,SUPLENTE,PSC,HUMANISTA CRISTÃO ,2
AMPARO,DEPUTADO FEDERAL,MAURÃO,JOSE MAURO PEREIRA DE BARROS,SUPLENTE,PSC,HUMANISTA CRISTÃO ,1
AMPARO,DEPUTADO FEDERAL,PRICILA LEME,PRICILA HELENA MOYSES LEME,SUPLENTE,PSC,HUMANISTA CRISTÃO ,2
AMPARO,DEPUTADO FEDERAL,ANTONIO BUGALU,ANTONIO CARLOS NUNES DE MATTOS,SUPLENTE,PSC,HUMANISTA CRISTÃO ,2
AMPARO,DEPUTADO FEDERAL,DR. CARALAMBOS,CARALAMBOS CONSTANTINO SOTIROPOULOS,SUPLENTE,PSC,HUMANISTA CRISTÃO ,5
AMPARO,DEPUTADO FEDERAL,DRª. CARLA CASALE,CARLA ISOLA CASALE,SUPLENTE,PSC,HUMANISTA CRISTÃO ,1
AMPARO,DEPUTADO FEDERAL,TONINHO CORREDOR,ANTONIO CICERO DA SILVA,SUPLENTE,PSC,HUMANISTA CRISTÃO ,1
AMPARO,DEPUTADO FEDERAL,ALEXANDRE DUARTE,LUIS ALEXANDRE DUARTE,SUPLENTE,PSC,HUMANISTA CRISTÃO ,1
AMPARO,DEPUTADO FEDERAL,JUCA CHAVES,JURANDYR CZACZKES CHAVES,SUPLENTE,PR,JUNTOS POR SÃO PAULO,27
AMPARO,DEPUTADO FEDERAL,AGNALDO TIMOTEO,AGUINALDO TIMOTEO PEREIRA,SUPLENTE,PR,JUNTOS POR SÃO PAULO,11
AMPARO,DEPUTADO FEDERAL,TIRIRICA,FRANCISCO EVERARDO OLIVEIRA SILVA,ELEITO,PR,JUNTOS POR SÃO PAULO,1580
AMPARO,DEPUTADO FEDERAL,PR PAULO FREIRE,PAULO ROBERTO FREIRE DA COSTA,ELEITO,PR,JUNTOS POR SÃO PAULO,540
AMPARO,DEPUTADO FEDERAL,LUCIANA COSTA,LUCIANA DE ALMEIDA COSTA,SUPLENTE,PR,JUNTOS POR SÃO PAULO,9
AMPARO,DEPUTADO FEDERAL,MILTON MONTI,MILTON ANTONIO CASQUEL MONTI,ELEITO,PR,JUNTOS POR SÃO PAULO,8
AMPARO,DEPUTADO FEDERAL,VALDEMAR COSTA NETO,VALDEMAR COSTA NETO,ELEITO,PR,JUNTOS POR SÃO PAULO,66
AMPARO,DEPUTADO FEDERAL,SONRISAL,MAURICIO BONATTI,SUPLENTE,PPS,PSDB/DEM/PPS,3
AMPARO,DEPUTADO FEDERAL,LINDOMAR DE OLIVEIRA,LINDOMAR CUSTODIA DE OLIVEIRA,SUPLENTE,PPS,PSDB/DEM/PPS,2
AMPARO,DEPUTADO FEDERAL,WILLIAM WOO,WILLIAM BOSS WOO,SUPLENTE,PPS,PSDB/DEM/PPS,4
AMPARO,DEPUTADO FEDERAL,VALDEMAR ANFRISIO,VALDEMAR ANFRISIO DOS SANTOS,SUPLENTE,PPS,PSDB/DEM/PPS,2
AMPARO,DEPUTADO FEDERAL,ROBERTO FREIRE,ROBERTO JOAO PEREIRA FREIRE,ELEITO,PPS,PSDB/DEM/PPS,193
AMPARO,DEPUTADO FEDERAL,CORONEL EDSON SARDANO,EDSON DE JESUS SARDANO,SUPLENTE,PPS,PSDB/DEM/PPS,5
AMPARO,DEPUTADO FEDERAL,DIMAS RAMALHO,DIMAS EDUARDO RAMALHO,ELEITO,PPS,PSDB/DEM/PPS,1830
AMPARO,DEPUTADO FEDERAL,DIRCE,DIRCE JEREMIAS,SUPLENTE,PPS,PSDB/DEM/PPS,1
AMPARO,DEPUTADO FEDERAL,ARI FRIEDENBACH,ARI FRIEDENBACH,SUPLENTE,PPS,PSDB/DEM/PPS,90
AMPARO,DEPUTADO FEDERAL,JOSE ONERIO,JOSE ONERIO DA SILVA,SUPLENTE,PPS,PSDB/DEM/PPS,28
AMPARO,DEPUTADO FEDERAL,ARNALDO JARDIM,ARNALDO CALIL PEREIRA JARDIM,ELEITO,PPS,PSDB/DEM/PPS,409
AMPARO,DEPUTADO FEDERAL,ANTENOR TOKO,ANTENOR DOS SANTOS TOKO,SUPLENTE,PPS,PSDB/DEM/PPS,2
AMPARO,DEPUTADO FEDERAL,JORGE TADEU,JORGE TADEU MUDALEN,ELEITO,DEM,PSDB/DEM/PPS,155
AMPARO,DEPUTADO FEDERAL,SAMPAIO,ANTONIO SAMPAIO TEIXEIRA,SUPLENTE,DEM,PSDB/DEM/PPS,1
AMPARO,DEPUTADO FEDERAL,RENATO GALENDI,RENATO APARECIDO GALENDI,SUPLENTE,DEM,PSDB/DEM/PPS,1
AMPARO,DEPUTADO FEDERAL,JORGINHO MALULY,JORGE DE FARIA MALULY,SUPLENTE,DEM,PSDB/DEM/PPS,50
AMPARO,DEPUTADO FEDERAL,ALEXANDRE LEITE,ALEXANDRE LEITE DA SILVA,MÉDIA,DEM,PSDB/DEM/PPS,145
AMPARO,DEPUTADO FEDERAL,PROFESSOR BENJAMIN,BENJAMIN RIBEIRO DA SILVA,SUPLENTE,DEM,PSDB/DEM/PPS,7
AMPARO,DEPUTADO FEDERAL,KIKO DO KLB,FRANCO FINATO SCORNAVACCA,SUPLENTE,DEM,PSDB/DEM/PPS,58
AMPARO,DEPUTADO FEDERAL,CRESPO,JOSE ANTONIO CALDINI CRESPO,SUPLENTE,DEM,PSDB/DEM/PPS,2
AMPARO,DEPUTADO FEDERAL,RODRIGO GARCIA,RODRIGO GARCIA,ELEITO,DEM,PSDB/DEM/PPS,292
AMPARO,DEPUTADO FEDERAL,ZULAIÊ COBRA,ZULAIE COBRA RIBEIRO,SUPLENTE,DEM,PSDB/DEM/PPS,45
AMPARO,DEPUTADO FEDERAL,LUCIANO ARTIOLI,LUCIANO ARTIOLI MOREIRA,SUPLENTE,DEM,PSDB/DEM/PPS,31
AMPARO,DEPUTADO FEDERAL,RAUL GIL JR,RAUL GIL JUNIOR,SUPLENTE,DEM,PSDB/DEM/PPS,25
AMPARO,DEPUTADO FEDERAL,CHICO PELUCIO,FRANCISCO PELUCIO,SUPLENTE,DEM,PSDB/DEM/PPS,15
AMPARO,DEPUTADO FEDERAL,JUNJI ABE,JUNJI ABE,ELEITO,DEM,PSDB/DEM/PPS,5
AMPARO,DEPUTADO FEDERAL,MANDIC,ALEKSANDAR CARLOS MANDIC,SUPLENTE,DEM,PSDB/DEM/PPS,7
AMPARO,DEPUTADO FEDERAL,HIRAM JR,HIRAM AYRES MONTEIRO JUNIOR,SUPLENTE,DEM,PSDB/DEM/PPS,3
AMPARO,DEPUTADO FEDERAL,CASCIONE,VICENTE FERNANDES CASCIONE,SUPLENTE,DEM,PSDB/DEM/PPS,10
AMPARO,DEPUTADO FEDERAL,HELIO SECCO,HELIO RODRIGUES SECCO,SUPLENTE,DEM,PSDB/DEM/PPS,20
AMPARO,DEPUTADO FEDERAL,ELI CORREA FILHO,ADRIANO ELI CORREA,ELEITO,DEM,PSDB/DEM/PPS,14
AMPARO,DEPUTADO FEDERAL,DR ELEUSES PAIVA,ELEUSES VIEIRA DE PAIVA,SUPLENTE,DEM,PSDB/DEM/PPS,91
AMPARO,DEPUTADO FEDERAL,GUILHERME CAMPOS,GUILHERME CAMPOS JUNIOR,MÉDIA,DEM,PSDB/DEM/PPS,3326
AMPARO,DEPUTADO FEDERAL,WALTER IHOSHI,WALTER SHINDI IIHOSHI,SUPLENTE,DEM,PSDB/DEM/PPS,32
AMPARO,DEPUTADO FEDERAL,PROF HERMES,HERMES RODRIGUES NERY,SUPLENTE,PHS,HUMANISTA CRISTÃO ,2
AMPARO,DEPUTADO FEDERAL,DEBORA GODOI,DÉBORA ANDREA BATISTA GODOI,SUPLENTE,PHS,HUMANISTA CRISTÃO ,1
AMPARO,DEPUTADO FEDERAL,MARIO VIEIRA,MARIO LUIZ VIEIRA,SUPLENTE,PHS,HUMANISTA CRISTÃO ,1
AMPARO,DEPUTADO FEDERAL,PROFESSOR RODRIGO,RODRIGO BARROS PINHEIRO DE SOUZA,SUPLENTE,PHS,HUMANISTA CRISTÃO ,1
AMPARO,DEPUTADO FEDERAL,JONAS DONIZETTE,JONAS DONIZETTE FERREIRA,ELEITO,PSB,PRESTE ATENÇÃO SÃO PAULO,3704
AMPARO,DEPUTADO FEDERAL,MÁRCIA LIMA,APARECIDO BARBOSA LIMA,SUPLENTE,PSB,PRESTE ATENÇÃO SÃO PAULO,1
AMPARO,DEPUTADO FEDERAL,ROGÉRIO EMÍLIO,ROGÉRIO EMÍLIO DE ANDRADE,SUPLENTE,PSB,PRESTE ATENÇÃO SÃO PAULO,1
AMPARO,DEPUTADO FEDERAL,MARCELINHO CARIOCA,MARCELO PEREIRA SURCIN,SUPLENTE,PSB,PRESTE ATENÇÃO SÃO PAULO,138
AMPARO,DEPUTADO FEDERAL,MARCOS DE PAULA,MARCOS DE PAULA,SUPLENTE,PSB,PRESTE ATENÇÃO SÃO PAULO,3
AMPARO,DEPUTADO FEDERAL,SARGENTO FERNANDO,FERNANDO ALCÂNTARA DE FIGUEIREDO,SUPLENTE,PSB,PRESTE ATENÇÃO SÃO PAULO,3
AMPARO,DEPUTADO FEDERAL,ELISEU GABRIEL,ELISEU GABRIEL DE PIERI,SUPLENTE,PSB,PRESTE ATENÇÃO SÃO PAULO,19
AMPARO,DEPUTADO FEDERAL,CAPITÃO AUGUSTO,JOSÉ AUGUSTO ROSA,SUPLENTE,PSB,PRESTE ATENÇÃO SÃO PAULO,67
AMPARO,DEPUTADO FEDERAL,LUIZA ERUNDINA,LUIZA ERUNDINA DE SOUSA,ELEITO,PSB,PRESTE ATENÇÃO SÃO PAULO,60
AMPARO,DEPUTADO FEDERAL,CHINELO,JOSÉ AVELINO PEREIRA,SUPLENTE,PSB,PRESTE ATENÇÃO SÃO PAULO,4
AMPARO,DEPUTADO FEDERAL,TORINO,PAULO SERGIO TORINO,SUPLENTE,PSB,PRESTE ATENÇÃO SÃO PAULO,2
AMPARO,DEPUTADO FEDERAL,GABRIEL CHALITA,GABRIEL BENEDITO ISSAAC CHALITA,ELEITO,PSB,PRESTE ATENÇÃO SÃO PAULO,1002
AMPARO,DEPUTADO FEDERAL,PAULO ROGÉRIO MARTINS,PAULO ROGÉRIO MARTINS,SUPLENTE,PSB,PRESTE ATENÇÃO SÃO PAULO,1
AMPARO,DEPUTADO FEDERAL,MARIO SHIBATA,MARIO REGIO,SUPLENTE,PSB,PRESTE ATENÇÃO SÃO PAULO,1
AMPARO,DEPUTADO FEDERAL,MÁRCIO FRANÇA,MÁRCIO LUIZ FRANÇA GOMES,ELEITO,PSB,PRESTE ATENÇÃO SÃO PAULO,13
AMPARO,DEPUTADO FEDERAL,CORAUCI,VALDEMAR CORAUCI SOBRINHO,SUPLENTE,PSB,PRESTE ATENÇÃO SÃO PAULO,1
AMPARO,DEPUTADO FEDERAL,RUBINHO CAI CAI,RUBENS ESTEVES ROQUE,SUPLENTE,PSB,PRESTE ATENÇÃO SÃO PAULO,1
AMPARO,DEPUTADO FEDERAL,MILTON JOAQUIM SILVA,MILTON JOAQUIM SILVA,SUPLENTE,PSB,PRESTE ATENÇÃO SÃO PAULO,1
AMPARO,DEPUTADO FEDERAL,DRA. ELAINE,ELAINE APARECIDA BELLONI ABISSAMRA,SUPLENTE,PSB,PRESTE ATENÇÃO SÃO PAULO,3
AMPARO,DEPUTADO FEDERAL,UNALDO SANTOS,UNALDO FLORES SANTOS,SUPLENTE,PSB,PRESTE ATENÇÃO SÃO PAULO,2
AMPARO,DEPUTADO FEDERAL,VANDIR MOGNON,VANDIR MOGNON,SUPLENTE,PSB,PRESTE ATENÇÃO SÃO PAULO,2
AMPARO,DEPUTADO FEDERAL,RAMIRO,CAMILO CANDIDO DA SILVA,SUPLENTE,PSB,PRESTE ATENÇÃO SÃO PAULO,6
AMPARO,DEPUTADO FEDERAL,ABELARDO CAMARINHA,JOSE ABELARDO GUIMARAES CAMARINHA,MÉDIA,PSB,PRESTE ATENÇÃO SÃO PAULO,1
AMPARO,DEPUTADO FEDERAL,JEFFERSON CAMPOS,JEFFERSON ALVES DE CAMPOS,ELEITO,PSB,PRESTE ATENÇÃO SÃO PAULO,32
AMPARO,DEPUTADO FEDERAL,DR. UBIALI,MARCO AURÉLIO UBIALI,SUPLENTE,PSB,PRESTE ATENÇÃO SÃO PAULO,19
AMPARO,DEPUTADO FEDERAL,OTA,IOLANDA KEIKO MIASHIRO OTA,ELEITO,PSB,PRESTE ATENÇÃO SÃO PAULO,101
AMPARO,DEPUTADO FEDERAL,GUILHERME MUSSI,GUILHERME MUSSI FERREIRA,ELEITO,PV,PARTIDO VERDE,53
AMPARO,DEPUTADO FEDERAL,GILBERTO ABREU,GILBERTO ANDRADE DE ABREU,SUPLENTE,PV,PARTIDO VERDE,10
AMPARO,DEPUTADO FEDERAL,WALTER GONZALIS,WALTER GONZALIS,SUPLENTE,PV,PARTIDO VERDE,11
AMPARO,DEPUTADO FEDERAL,DR. NEVTON OLIVEIRA ROCHA,NEVTON OLIVEIRA ROCHA,SUPLENTE,PV,PARTIDO VERDE,2
AMPARO,DEPUTADO FEDERAL,DR TALMIR,TALMIR RODRIGUES,SUPLENTE,PV,PARTIDO VERDE,54
AMPARO,DEPUTADO FEDERAL,VICENTE DA UPA,VICENTE CARVALHO E SILVA,SUPLENTE,PV,PARTIDO VERDE,845
AMPARO,DEPUTADO FEDERAL,EDNA MARTINS,EDNA SANDRA MARTINS,SUPLENTE,PV,PARTIDO VERDE,3
AMPARO,DEPUTADO FEDERAL,ELIANE BOSIO,ELIANE TEREZINHA DOS SANTOS BOSIO,SUPLENTE,PV,PARTIDO VERDE,1
