CASTILHO,PRESIDENTE,DILMA,DILMA VANA ROUSSEFF,2º TURNO,PT,PARA O BRASIL SEGUIR MUDANDO,5437
CASTILHO,PRESIDENTE,JOSÉ SERRA,JOSÉ SERRA,2º TURNO,PSDB,O BRASIL PODE MAIS,2660
CASTILHO,GOVERNADOR,GERALDO ALCKMIN,GERALDO JOSE RODRIGUES ALCKMIN FILHO,ELEITO,PSDB,UNIDOS POR SÃO PAULO,4093
CASTILHO,SENADOR,MARTA SUPLICY,MARTA SUPLICY,ELEITO,PT,UNIÃO PARA MUDAR,4572
CASTILHO,SENADOR,ALOYSIO NUNES,ALOYSIO NUNES FERREIRA FILHO,ELEITO,PSDB,UNIDOS POR SÃO PAULO,3388
CASTILHO,DEPUTADO FEDERAL,ANTONIO BULHÕES,ANTONIO CARLOS MARTINS DE BULHÕES,ELEITO,PRB,JUNTOS POR SÃO PAULO,2
CASTILHO,DEPUTADO FEDERAL,OTONIEL LIMA,OTONIEL CARLOS DE LIMA,MÉDIA,PRB,JUNTOS POR SÃO PAULO,2
CASTILHO,DEPUTADO FEDERAL,MALUF,PAULO SALIM MALUF,ELEITO,PP,PARTIDO PROGRESSISTA,44
CASTILHO,DEPUTADO FEDERAL,ANGINHO DOS TECLADOS,ANGELO MARINHO DE ALMEIDA,SUPLENTE,PP,PARTIDO PROGRESSISTA,6
CASTILHO,DEPUTADO FEDERAL,MANOEL MOREIRA,MANOEL MOREIRA DE ARAUJO FILHO,SUPLENTE,PP,PARTIDO PROGRESSISTA,1
CASTILHO,DEPUTADO FEDERAL,LIBERATO DE VALENTIM GENTIL,LIBERATO ROCHA CALDEIRA,SUPLENTE,PP,PARTIDO PROGRESSISTA,1
CASTILHO,DEPUTADO FEDERAL,PEDRINHO BARACAT,ASSAD NACLE BARACAT,SUPLENTE,PP,PARTIDO PROGRESSISTA,2
CASTILHO,DEPUTADO FEDERAL,ALINE CORREA,ALINE LEMOS CORREA DE OLIVEIRA ANDRADE,ELEITO,PP,PARTIDO PROGRESSISTA,822
CASTILHO,DEPUTADO FEDERAL,TELLES,DOMINGOS TELLES SANCHES,SUPLENTE,PP,PARTIDO PROGRESSISTA,2
CASTILHO,DEPUTADO FEDERAL,BETO MANSUR,PAULO ROBERTO GOMES MANSUR,ELEITO,PP,PARTIDO PROGRESSISTA,1
CASTILHO,DEPUTADO FEDERAL,LAYRTON INFANTE,LAYRTON INFANTE,SUPLENTE,PP,PARTIDO PROGRESSISTA,2
CASTILHO,DEPUTADO FEDERAL,CABO WILSON,WILSON DE OLIVEIRA MORAIS,SUPLENTE,PP,PARTIDO PROGRESSISTA,13
CASTILHO,DEPUTADO FEDERAL,MISSIONÁRIO JOSÉ OLIMPIO,JOSÉ OLIMPIO SILVEIRA MORAES,ELEITO,PP,PARTIDO PROGRESSISTA,49
CASTILHO,DEPUTADO FEDERAL,FERNANDO STANCATTI,FERNANDO CESAR STANCATTI MARQUES,SUPLENTE,PP,PARTIDO PROGRESSISTA,2
CASTILHO,DEPUTADO FEDERAL,DELEGADA GRACIELA,GRACIELA DE LOURDES DAVID AMBROSIO,SUPLENTE,PP,PARTIDO PROGRESSISTA,1
CASTILHO,DEPUTADO FEDERAL,JORGE WILSON,JORGE WILSON GONÇALVES DE MATTOS,SUPLENTE,PP,PARTIDO PROGRESSISTA,1
CASTILHO,DEPUTADO FEDERAL,MARCELO MARIANO,MARCELO RICARDO MARIANO,SUPLENTE,PP,PARTIDO PROGRESSISTA,172
CASTILHO,DEPUTADO FEDERAL,VADÃO,ETIVALDO VADAO GOMES,SUPLENTE,PP,PARTIDO PROGRESSISTA,51
CASTILHO,DEPUTADO FEDERAL,PH,PAULO HENRIQUE RIBEIRO SANTANA,SUPLENTE,PDT,PARTIDO DEMOCRÁTICO TRABALHISTA,2
CASTILHO,DEPUTADO FEDERAL,KIM,MARCO ANTONIO ALVES JORGE,SUPLENTE,PDT,PARTIDO DEMOCRÁTICO TRABALHISTA,1
CASTILHO,DEPUTADO FEDERAL,JOÃO DADO,JOÃO EDUARDO DADO LEITE DE CARVALHO,ELEITO,PDT,PARTIDO DEMOCRÁTICO TRABALHISTA,26
CASTILHO,DEPUTADO FEDERAL,PAULINHO DA FORÇA,PAULO PEREIRA DA SILVA,ELEITO,PDT,PARTIDO DEMOCRÁTICO TRABALHISTA,20
CASTILHO,DEPUTADO FEDERAL,GUSTAVO STUPP,LUIZ GUSTAVO ANTUNES STUPP,SUPLENTE,PDT,PARTIDO DEMOCRÁTICO TRABALHISTA,1
CASTILHO,DEPUTADO FEDERAL,MARTAN,MARCELO MARTIN,SUPLENTE,PDT,PARTIDO DEMOCRÁTICO TRABALHISTA,1
CASTILHO,DEPUTADO FEDERAL,MEDEIROS,LUIZ ANTONIO DE MEDEIROS NETO,SUPLENTE,PDT,PARTIDO DEMOCRÁTICO TRABALHISTA,3
CASTILHO,DEPUTADO FEDERAL,DR LUIZ CHIAPARINE,LUIZ CARLOS CHIAPARINE,SUPLENTE,PDT,PARTIDO DEMOCRÁTICO TRABALHISTA,2
CASTILHO,DEPUTADO FEDERAL,NELSINHO DA BAHIA,NELSON FRANCISCO DOS SANTOS,SUPLENTE,PDT,PARTIDO DEMOCRÁTICO TRABALHISTA,2
CASTILHO,DEPUTADO FEDERAL,SALVADOR ZIMBALDI,SALVADOR ZIMBALDI FILHO,MÉDIA,PDT,PARTIDO DEMOCRÁTICO TRABALHISTA,9
CASTILHO,DEPUTADO FEDERAL,JOSUE TOPA TUDO,JOSUÉ MOREIRA,SUPLENTE,PDT,PARTIDO DEMOCRÁTICO TRABALHISTA,15
CASTILHO,DEPUTADO FEDERAL,IVANIO BATISTA,IVANIO BATISTA DA SILVA,SUPLENTE,PT,JUNTOS POR SÃO PAULO,5
CASTILHO,DEPUTADO FEDERAL,PROFESSOR JAIR BALESTRA,JAIR DONIZETI BALESTRA,SUPLENTE,PT,JUNTOS POR SÃO PAULO,39
CASTILHO,DEPUTADO FEDERAL,MARQUINHOS OLÍVIO,MARCOS OLIVIO CONCEIÇÃO,SUPLENTE,PT,JUNTOS POR SÃO PAULO,1
CASTILHO,DEPUTADO FEDERAL,LARGUESA,LUIS VANDERLEI LARGUESA,SUPLENTE,PT,JUNTOS POR SÃO PAULO,6
CASTILHO,DEPUTADO FEDERAL,VACCAREZZA,CANDIDO ELPIDIO DE SOUZA VACCAREZZA,ELEITO,PT,JUNTOS POR SÃO PAULO,127
CASTILHO,DEPUTADO FEDERAL,GENOINO,JOSÉ GENOÍNO NETO,SUPLENTE,PT,JUNTOS POR SÃO PAULO,29
CASTILHO,DEPUTADO FEDERAL,CARLINHOS ALMEIDA,CARLOS JOSE DE ALMEIDA,ELEITO,PT,JUNTOS POR SÃO PAULO,1
CASTILHO,DEPUTADO FEDERAL,NEWTON LIMA NETO,NEWTON LIMA NETO,ELEITO,PT,JUNTOS POR SÃO PAULO,9
CASTILHO,DEPUTADO FEDERAL,TEREZINHA RONDELLI,MARIA TEREZINHA RONDELLI,SUPLENTE,PT,JUNTOS POR SÃO PAULO,3
CASTILHO,DEPUTADO FEDERAL,GERSON SARTORI,GERSON HENRIQUE SARTORI,SUPLENTE,PT,JUNTOS POR SÃO PAULO,1
CASTILHO,DEPUTADO FEDERAL,FILIPPI,JOSÉ DE FILIPPI JÚNIOR,ELEITO,PT,JUNTOS POR SÃO PAULO,2
CASTILHO,DEPUTADO FEDERAL,ARLINDO CHINAGLIA,ARLINDO CHIGNALIA JUNIOR,ELEITO,PT,JUNTOS POR SÃO PAULO,747
CASTILHO,DEPUTADO FEDERAL,JOÃO PAULO CUNHA,JOÃO PAULO CUNHA,ELEITO,PT,JUNTOS POR SÃO PAULO,40
CASTILHO,DEPUTADO FEDERAL,ROQUE FERREIRA,ROQUE JOSÉ FERREIRA,SUPLENTE,PT,JUNTOS POR SÃO PAULO,4
CASTILHO,DEPUTADO FEDERAL,PIVATTO,JOSÉ PIVATTO,SUPLENTE,PT,JUNTOS POR SÃO PAULO,1
CASTILHO,DEPUTADO FEDERAL,RICARDO BERZOINI,RICARDO JOSE RIBEIRO BERZOINI,ELEITO,PT,JUNTOS POR SÃO PAULO,12
CASTILHO,DEPUTADO FEDERAL,JOSÉ MENTOR,JOSÉ MENTOR GUILHERME DE MELLO NETTO,ELEITO,PT,JUNTOS POR SÃO PAULO,70
CASTILHO,DEPUTADO FEDERAL,PROF. CARLÃO RAMIRO,CARLOS RAMIRO CASTRO,SUPLENTE,PT,JUNTOS POR SÃO PAULO,44
CASTILHO,DEPUTADO FEDERAL,FÉLIX SAHÃO,FÉLIX SAHÃO JÚNIOR,SUPLENTE,PT,JUNTOS POR SÃO PAULO,1
CASTILHO,DEPUTADO FEDERAL,JILMAR TATTO,JILMAR AUGUSTINHO TATTO,ELEITO,PT,JUNTOS POR SÃO PAULO,1
CASTILHO,DEPUTADO FEDERAL,CARLOS AQUINO,JOSÉ CARLOS DE AQUINO,SUPLENTE,PT,JUNTOS POR SÃO PAULO,2
CASTILHO,DEPUTADO FEDERAL,RENATO SIMÕES,RENATO SIMÕES,SUPLENTE,PT,JUNTOS POR SÃO PAULO,115
CASTILHO,DEPUTADO FEDERAL,ZARATTINI,CARLOS ALBERTO ROLIM ZARATTINI,ELEITO,PT,JUNTOS POR SÃO PAULO,1
CASTILHO,DEPUTADO FEDERAL,MARIA LUCIA PRANDI,MARIA LUCIA PRANDI GOMES,SUPLENTE,PT,JUNTOS POR SÃO PAULO,4
CASTILHO,DEPUTADO FEDERAL,VALDECI CHIRANHA,VALDECI FERREIRA DA SILVA,SUPLENTE,PT,JUNTOS POR SÃO PAULO,1
CASTILHO,DEPUTADO FEDERAL,VICENTINHO,VICENTE PAULO DA SILVA,ELEITO,PT,JUNTOS POR SÃO PAULO,89
CASTILHO,DEPUTADO FEDERAL,PAULO TEIXEIRA,LUIZ PAULO TEIXEIRA FERREIRA,ELEITO,PT,JUNTOS POR SÃO PAULO,320
CASTILHO,DEPUTADO FEDERAL,ALEXANDRE COSTA,ALEXANDRE COSTA,SUPLENTE,PTB,PARTIDO TRABALHISTA BRASILEIRO,2
CASTILHO,DEPUTADO FEDERAL,ROBSON TUMA,ROBSON TUMA,SUPLENTE,PTB,PARTIDO TRABALHISTA BRASILEIRO,2
CASTILHO,DEPUTADO FEDERAL,RICARDO OLIVEIRA,RICARDO JOSE DE OLIVEIRA,SUPLENTE,PTB,PARTIDO TRABALHISTA BRASILEIRO,2
CASTILHO,DEPUTADO FEDERAL,JORGE MARINGOLO,JORGE ANTONIO MARINGOLO PEREIRA,SUPLENTE,PTB,PARTIDO TRABALHISTA BRASILEIRO,2
CASTILHO,DEPUTADO FEDERAL,NELSON MARQUEZELLI,NELSON MARQUEZELLI,ELEITO,PTB,PARTIDO TRABALHISTA BRASILEIRO,25
CASTILHO,DEPUTADO FEDERAL,WALDOMIRO RAMOS,WALDOMIRO CARLOS RAMOS,SUPLENTE,PTB,PARTIDO TRABALHISTA BRASILEIRO,3
CASTILHO,DEPUTADO FEDERAL,ARNALDO FARIA DE SÁ,ARNALDO FARIA DE SÁ,ELEITO,PTB,PARTIDO TRABALHISTA BRASILEIRO,19
CASTILHO,DEPUTADO FEDERAL,FRANK AGUIAR,FRANCINETO LUZ DE AGUIAR,SUPLENTE,PTB,PARTIDO TRABALHISTA BRASILEIRO,1
CASTILHO,DEPUTADO FEDERAL,PAULO LIMA,PAULO CESAR DE OLIVEIRA LIMA,SUPLENTE,PMDB,PARTIDO DO MOVIMENTO DEMOCRÁTICO BRASILEIRO,253
CASTILHO,DEPUTADO FEDERAL,CARVALHO SALES,JEFFERSON CARVALHO SALES,SUPLENTE,PMDB,PARTIDO DO MOVIMENTO DEMOCRÁTICO BRASILEIRO,1
CASTILHO,DEPUTADO FEDERAL,CARMELITA TOLEDANO,CARMELITA RODRIGUES DA COSTA ESCUDERO TOLEDANO,SUPLENTE,PMDB,PARTIDO DO MOVIMENTO DEMOCRÁTICO BRASILEIRO,1
CASTILHO,DEPUTADO FEDERAL,BONFÁ,ALVARO BONFA JUNIOR,SUPLENTE,PMDB,PARTIDO DO MOVIMENTO DEMOCRÁTICO BRASILEIRO,1
CASTILHO,DEPUTADO FEDERAL,EDUARDO COELHO,EDUARDO JOSÉ PEREIRA COELHO,SUPLENTE,PMDB,PARTIDO DO MOVIMENTO DEMOCRÁTICO BRASILEIRO,11
CASTILHO,DEPUTADO FEDERAL,EDINHO ARAUJO,EDSON EDINHO COELHO ARAUJO,ELEITO,PMDB,PARTIDO DO MOVIMENTO DEMOCRÁTICO BRASILEIRO,18
CASTILHO,DEPUTADO FEDERAL,LIMA JUNIOR,JULIO CEZAR DA SILVA LIMA JUNIOR,SUPLENTE,PMDB,PARTIDO DO MOVIMENTO DEMOCRÁTICO BRASILEIRO,1
CASTILHO,DEPUTADO FEDERAL,SERGIO KOBRA,SERGIO MARTINS DOS SANTOS JUNIOR,SUPLENTE,PMDB,PARTIDO DO MOVIMENTO DEMOCRÁTICO BRASILEIRO,3
CASTILHO,DEPUTADO FEDERAL,ROLEMBERG,ROLANDO BELTRAMINE ROLEMBERG,SUPLENTE,PMDB,PARTIDO DO MOVIMENTO DEMOCRÁTICO BRASILEIRO,1
CASTILHO,DEPUTADO FEDERAL,LÉO OLIVEIRA,OCIMAR DONIZETI LEO OLIVEIRA,SUPLENTE,PMDB,PARTIDO DO MOVIMENTO DEMOCRÁTICO BRASILEIRO,1
CASTILHO,DEPUTADO FEDERAL,DR. SAMIR NASSBINE,SAMIR ASSAD NASSBINE,SUPLENTE,PMDB,PARTIDO DO MOVIMENTO DEMOCRÁTICO BRASILEIRO,1
CASTILHO,DEPUTADO FEDERAL,DANIEL CALDEIRA,DANIEL CALDEIRA MATEUS,SUPLENTE,PSL,PRESTE ATENÇÃO SÃO PAULO,1
CASTILHO,DEPUTADO FEDERAL,JANETE ARAUJO,JANETE ARAUJO LIRA,SUPLENTE,PSL,PRESTE ATENÇÃO SÃO PAULO,1
CASTILHO,DEPUTADO FEDERAL,EVANGELISTA MACEDO,EVANGELISTA PINTO MACEDO,SUPLENTE,PSL,PRESTE ATENÇÃO SÃO PAULO,6
CASTILHO,DEPUTADO FEDERAL,CORONEL GILSON LOPES,GILSON LOPES DA SILVA,SUPLENTE,PSC,HUMANISTA CRISTÃO ,1
CASTILHO,DEPUTADO FEDERAL,MISSIONARIA NAZARE,MARIA NAZARE DOS SANTOS SORRILLO,SUPLENTE,PSC,HUMANISTA CRISTÃO ,4
CASTILHO,DEPUTADO FEDERAL,MARCO FELICIANO,MARCO ANTONIO FELICIANO,ELEITO,PSC,HUMANISTA CRISTÃO ,79
CASTILHO,DEPUTADO FEDERAL,MARCELO AGUIAR,MARCELO THEODORO DE AGUIAR,ELEITO,PSC,HUMANISTA CRISTÃO ,2
CASTILHO,DEPUTADO FEDERAL,REGIS DE OLIVEIRA,REGIS FERNANDES DE OLIVEIRA,SUPLENTE,PSC,HUMANISTA CRISTÃO ,1938
CASTILHO,DEPUTADO FEDERAL,SILVIA PALMA,SILVIA ELIANA PALMA,SUPLENTE,PSC,HUMANISTA CRISTÃO ,2
CASTILHO,DEPUTADO FEDERAL,WAGNER FIOROTTO,WAGNER MONTEIRO FIOROTTO,SUPLENTE,PSC,HUMANISTA CRISTÃO ,2
CASTILHO,DEPUTADO FEDERAL,PR. LUIZ LEMOS,LUIZ CARLOS LEMOS,SUPLENTE,PSC,HUMANISTA CRISTÃO ,29
CASTILHO,DEPUTADO FEDERAL,DANILO MIKILIM,DANILO JOSE DE TOLEDO,SUPLENTE,PSC,HUMANISTA CRISTÃO ,1
CASTILHO,DEPUTADO FEDERAL,MIRO FERNANDES,ALDOMIRO FERNANDES,SUPLENTE,PSC,HUMANISTA CRISTÃO ,1
CASTILHO,DEPUTADO FEDERAL,PRICILA LEME,PRICILA HELENA MOYSES LEME,SUPLENTE,PSC,HUMANISTA CRISTÃO ,1
CASTILHO,DEPUTADO FEDERAL,MANOEL GASPAR,MANOEL FERREIRA DE SOUZA GASPAR,SUPLENTE,PSC,HUMANISTA CRISTÃO ,17
CASTILHO,DEPUTADO FEDERAL,AGNALDO TIMOTEO,AGUINALDO TIMOTEO PEREIRA,SUPLENTE,PR,JUNTOS POR SÃO PAULO,2
CASTILHO,DEPUTADO FEDERAL,TIRIRICA,FRANCISCO EVERARDO OLIVEIRA SILVA,ELEITO,PR,JUNTOS POR SÃO PAULO,440
CASTILHO,DEPUTADO FEDERAL,PR PAULO FREIRE,PAULO ROBERTO FREIRE DA COSTA,ELEITO,PR,JUNTOS POR SÃO PAULO,111
CASTILHO,DEPUTADO FEDERAL,LUCIANA COSTA,LUCIANA DE ALMEIDA COSTA,SUPLENTE,PR,JUNTOS POR SÃO PAULO,3
CASTILHO,DEPUTADO FEDERAL,MILTON MONTI,MILTON ANTONIO CASQUEL MONTI,ELEITO,PR,JUNTOS POR SÃO PAULO,2
CASTILHO,DEPUTADO FEDERAL,VALDEMAR COSTA NETO,VALDEMAR COSTA NETO,ELEITO,PR,JUNTOS POR SÃO PAULO,1
CASTILHO,DEPUTADO FEDERAL,SONRISAL,MAURICIO BONATTI,SUPLENTE,PPS,PSDB/DEM/PPS,3
CASTILHO,DEPUTADO FEDERAL,WILLIAM WOO,WILLIAM BOSS WOO,SUPLENTE,PPS,PSDB/DEM/PPS,10
CASTILHO,DEPUTADO FEDERAL,ROBERTO FREIRE,ROBERTO JOAO PEREIRA FREIRE,ELEITO,PPS,PSDB/DEM/PPS,6
CASTILHO,DEPUTADO FEDERAL,DIMAS RAMALHO,DIMAS EDUARDO RAMALHO,ELEITO,PPS,PSDB/DEM/PPS,4
CASTILHO,DEPUTADO FEDERAL,ARI FRIEDENBACH,ARI FRIEDENBACH,SUPLENTE,PPS,PSDB/DEM/PPS,5
CASTILHO,DEPUTADO FEDERAL,JOSE ONERIO,JOSE ONERIO DA SILVA,SUPLENTE,PPS,PSDB/DEM/PPS,12
CASTILHO,DEPUTADO FEDERAL,ARNALDO JARDIM,ARNALDO CALIL PEREIRA JARDIM,ELEITO,PPS,PSDB/DEM/PPS,1
CASTILHO,DEPUTADO FEDERAL,JORGE TADEU,JORGE TADEU MUDALEN,ELEITO,DEM,PSDB/DEM/PPS,58
CASTILHO,DEPUTADO FEDERAL,SAMPAIO,ANTONIO SAMPAIO TEIXEIRA,SUPLENTE,DEM,PSDB/DEM/PPS,1
CASTILHO,DEPUTADO FEDERAL,JORGINHO MALULY,JORGE DE FARIA MALULY,SUPLENTE,DEM,PSDB/DEM/PPS,522
CASTILHO,DEPUTADO FEDERAL,ALEXANDRE LEITE,ALEXANDRE LEITE DA SILVA,MÉDIA,DEM,PSDB/DEM/PPS,22
CASTILHO,DEPUTADO FEDERAL,KIKO DO KLB,FRANCO FINATO SCORNAVACCA,SUPLENTE,DEM,PSDB/DEM/PPS,3
CASTILHO,DEPUTADO FEDERAL,CRESPO,JOSE ANTONIO CALDINI CRESPO,SUPLENTE,DEM,PSDB/DEM/PPS,3
CASTILHO,DEPUTADO FEDERAL,RODRIGO GARCIA,RODRIGO GARCIA,ELEITO,DEM,PSDB/DEM/PPS,39
CASTILHO,DEPUTADO FEDERAL,ODECIO BRAGA,ODECIO BRAGA DE LOUREDO FILHO,SUPLENTE,DEM,PSDB/DEM/PPS,1
CASTILHO,DEPUTADO FEDERAL,ELI CORREA FILHO,ADRIANO ELI CORREA,ELEITO,DEM,PSDB/DEM/PPS,2
CASTILHO,DEPUTADO FEDERAL,DR ELEUSES PAIVA,ELEUSES VIEIRA DE PAIVA,SUPLENTE,DEM,PSDB/DEM/PPS,35
CASTILHO,DEPUTADO FEDERAL,WALTER IHOSHI,WALTER SHINDI IIHOSHI,SUPLENTE,DEM,PSDB/DEM/PPS,2
CASTILHO,DEPUTADO FEDERAL,PROF HERMES,HERMES RODRIGUES NERY,SUPLENTE,PHS,HUMANISTA CRISTÃO ,2
CASTILHO,DEPUTADO FEDERAL,MARCELINHO CARIOCA,MARCELO PEREIRA SURCIN,SUPLENTE,PSB,PRESTE ATENÇÃO SÃO PAULO,11
CASTILHO,DEPUTADO FEDERAL,ELISEU GABRIEL,ELISEU GABRIEL DE PIERI,SUPLENTE,PSB,PRESTE ATENÇÃO SÃO PAULO,1
CASTILHO,DEPUTADO FEDERAL,DR. ANTONIO BUSSOLETTI,ANTONIO GOTARDI BUSSOLETTI,SUPLENTE,PSB,PRESTE ATENÇÃO SÃO PAULO,4
CASTILHO,DEPUTADO FEDERAL,CAPITÃO AUGUSTO,JOSÉ AUGUSTO ROSA,SUPLENTE,PSB,PRESTE ATENÇÃO SÃO PAULO,19
CASTILHO,DEPUTADO FEDERAL,LUIZA ERUNDINA,LUIZA ERUNDINA DE SOUSA,ELEITO,PSB,PRESTE ATENÇÃO SÃO PAULO,3
CASTILHO,DEPUTADO FEDERAL,CHINELO,JOSÉ AVELINO PEREIRA,SUPLENTE,PSB,PRESTE ATENÇÃO SÃO PAULO,192
CASTILHO,DEPUTADO FEDERAL,GABRIEL CHALITA,GABRIEL BENEDITO ISSAAC CHALITA,ELEITO,PSB,PRESTE ATENÇÃO SÃO PAULO,56
CASTILHO,DEPUTADO FEDERAL,MÁRCIO FRANÇA,MÁRCIO LUIZ FRANÇA GOMES,ELEITO,PSB,PRESTE ATENÇÃO SÃO PAULO,2
CASTILHO,DEPUTADO FEDERAL,RUBINHO CAI CAI,RUBENS ESTEVES ROQUE,SUPLENTE,PSB,PRESTE ATENÇÃO SÃO PAULO,1
CASTILHO,DEPUTADO FEDERAL,DRA. ROSIANE FARIAS,ROSIANE MACIEL DE FARIAS,SUPLENTE,PSB,PRESTE ATENÇÃO SÃO PAULO,2
CASTILHO,DEPUTADO FEDERAL,TONINHO GARMS,ANTONIO CARLOS GARMS,SUPLENTE,PSB,PRESTE ATENÇÃO SÃO PAULO,1
CASTILHO,DEPUTADO FEDERAL,VALDIR ALVARENGA,VALDIR DE ALVARENGA,SUPLENTE,PSB,PRESTE ATENÇÃO SÃO PAULO,1
CASTILHO,DEPUTADO FEDERAL,WALTER SANDRO,WALTER SANDRO PEREIRA DA SILVA,SUPLENTE,PSB,PRESTE ATENÇÃO SÃO PAULO,4
CASTILHO,DEPUTADO FEDERAL,ABELARDO CAMARINHA,JOSE ABELARDO GUIMARAES CAMARINHA,MÉDIA,PSB,PRESTE ATENÇÃO SÃO PAULO,2
CASTILHO,DEPUTADO FEDERAL,JEFFERSON CAMPOS,JEFFERSON ALVES DE CAMPOS,ELEITO,PSB,PRESTE ATENÇÃO SÃO PAULO,41
CASTILHO,DEPUTADO FEDERAL,OTA,IOLANDA KEIKO MIASHIRO OTA,ELEITO,PSB,PRESTE ATENÇÃO SÃO PAULO,4
CASTILHO,DEPUTADO FEDERAL,GUILHERME MUSSI,GUILHERME MUSSI FERREIRA,ELEITO,PV,PARTIDO VERDE,8
CASTILHO,DEPUTADO FEDERAL,GILBERTO ABREU,GILBERTO ANDRADE DE ABREU,SUPLENTE,PV,PARTIDO VERDE,1
CASTILHO,DEPUTADO FEDERAL,DR TALMIR,TALMIR RODRIGUES,SUPLENTE,PV,PARTIDO VERDE,1
CASTILHO,DEPUTADO FEDERAL,VICENTE DA UPA,VICENTE CARVALHO E SILVA,SUPLENTE,PV,PARTIDO VERDE,1
CASTILHO,DEPUTADO FEDERAL,EDNA MARTINS,EDNA SANDRA MARTINS,SUPLENTE,PV,PARTIDO VERDE,1
CASTILHO,DEPUTADO FEDERAL,JULIO CASTILHO,JULIO CESAR CASTILHO,SUPLENTE,PV,PARTIDO VERDE,5
CASTILHO,DEPUTADO FEDERAL,ANA PAULA JUNQUEIRA,ANA PAULA GUIMARAES DE AZEVEDO JUNQUEIRA,SUPLENTE,PV,PARTIDO VERDE,1
CASTILHO,DEPUTADO FEDERAL,EVANDRO GUSSI,EVANDRO HERRERA BERTONE GUSSI,SUPLENTE,PV,PARTIDO VERDE,131
CASTILHO,DEPUTADO FEDERAL,ALE YOUSSEF,ALEXANDRE DE ALMEIDA YOUSSEF,SUPLENTE,PV,PARTIDO VERDE,5
CASTILHO,DEPUTADO FEDERAL,PENNA,JOSÉ LUIZ DE FRANÇA PENNA,ELEITO,PV,PARTIDO VERDE,4
CASTILHO,DEPUTADO FEDERAL,ROBERTO DE LUCENA,ROBERTO ALVES DE LUCENA,ELEITO,PV,PARTIDO VERDE,6
CASTILHO,DEPUTADO FEDERAL,RICARDO IZAR,RICARDO IZAR JUNIOR,ELEITO,PV,PARTIDO VERDE,1
CASTILHO,DEPUTADO FEDERAL,EDUARDO PALHARES,EDUARDO SANTOS PALHARES,SUPLENTE,PV,PARTIDO VERDE,1
CASTILHO,DEPUTADO FEDERAL,CARLOS SAMPAIO,CARLOS HENRIQUE FOCESI SAMPAIO,ELEITO,PSDB,PSDB/DEM/PPS,2
CASTILHO,DEPUTADO FEDERAL,STANGARLINI,JOSE CARLOS STANGARLINI,SUPLENTE,PSDB,PSDB/DEM/PPS,1
CASTILHO,DEPUTADO FEDERAL,RAUL CHRISTIANO,RAUL CHRISTIANO DE OLIVEIRA SANCHEZ,SUPLENTE,PSDB,PSDB/DEM/PPS,4
CASTILHO,DEPUTADO FEDERAL,LOBBE NETO,ANTONIO ADOLPHO LOBBE NETO,SUPLENTE,PSDB,PSDB/DEM/PPS,13
CASTILHO,DEPUTADO FEDERAL,FELICIDADE,FELICIDADE LOPES PONTES,SUPLENTE,PSDB,PSDB/DEM/PPS,3
CASTILHO,DEPUTADO FEDERAL,MANOEL MARCOS (MANÉ),MANOEL MARCOS DE JESUS FERREIRA,SUPLENTE,PSDB,PSDB/DEM/PPS,1
CASTILHO,DEPUTADO FEDERAL,EMANUEL FERNANDES,EMANUEL FERNANDES,ELEITO,PSDB,PSDB/DEM/PPS,4
CASTILHO,DEPUTADO FEDERAL,MARA GABRILLI,MARA CRISTINA GABRILLI,ELEITO,PSDB,PSDB/DEM/PPS,3
CASTILHO,DEPUTADO FEDERAL,MARCOS ARAUJO,MARCOS ROSA DE ARAUJO,SUPLENTE,PSDB,PSDB/DEM/PPS,2
CASTILHO,DEPUTADO FEDERAL,CARLOS ROBERTO,CARLOS ROBERTO DE CAMPOS,SUPLENTE,PSDB,PSDB/DEM/PPS,2
CASTILHO,DEPUTADO FEDERAL,DR ANDRE SACCO,ANDRE SACCO JUNIOR,SUPLENTE,PSDB,PSDB/DEM/PPS,1
CASTILHO,DEPUTADO FEDERAL,SILVIO TORRES,SILVIO FRANÇA TORRES,SUPLENTE,PSDB,PSDB/DEM/PPS,2
CASTILHO,DEPUTADO FEDERAL,EDSON APARECIDO,EDSON APARECIDO DOS SANTOS,ELEITO,PSDB,PSDB/DEM/PPS,1163
CASTILHO,DEPUTADO FEDERAL,RICARDO MONTORO,JOSE RICARDO FRANCO MONTORO,SUPLENTE,PSDB,PSDB/DEM/PPS,1
CASTILHO,DEPUTADO FEDERAL,VANDERLEI MACRIS,VANDERLEI MACRIS,SUPLENTE,PSDB,PSDB/DEM/PPS,1
CASTILHO,DEPUTADO FEDERAL,JULIO SEMEGHINI,JULIO FRACISCO SEMEGHINI NETO,ELEITO,PSDB,PSDB/DEM/PPS,95
CASTILHO,DEPUTADO FEDERAL,GIVALDO VIEIRA,GIVALDO RODRIGUES VIEIRA,SUPLENTE,PSDB,PSDB/DEM/PPS,1
CASTILHO,DEPUTADO FEDERAL,TRIPOLI,JOSÉ RICARDO ALVARENGA TRIPOLI,ELEITO,PSDB,PSDB/DEM/PPS,1
CASTILHO,DEPUTADO FEDERAL,FERNANDO FUAD CHUCRE,FERNANDO BARRANCOS CHUCRE,SUPLENTE,PSDB,PSDB/DEM/PPS,4
CASTILHO,DEPUTADO FEDERAL,VAZ DE LIMA,JOSÉ CARLOS VAZ DE LIMA,ELEITO,PSDB,PSDB/DEM/PPS,30
CASTILHO,DEPUTADO FEDERAL,WALTER FELDMAN,WALTER MEYER FELDMAN,SUPLENTE,PSDB,PSDB/DEM/PPS,1
CASTILHO,DEPUTADO FEDERAL,THAME,ANTONIO CARLOS DE MENDES THAME,ELEITO,PSDB,PSDB/DEM/PPS,4
CASTILHO,DEPUTADO FEDERAL,BRUNA FURLAN,BRUNA DIAS FURLAN,ELEITO,PSDB,PSDB/DEM/PPS,13
CASTILHO,DEPUTADO FEDERAL,JOSÉ ANIBAL,JOSÉ ANIBAL PERES DE PONTES,ELEITO,PSDB,PSDB/DEM/PPS,9
CASTILHO,DEPUTADO FEDERAL,NELSON BUGALHO,NELSON ROBERTO BUGALHO,SUPLENTE,PSDB,PSDB/DEM/PPS,78
CASTILHO,DEPUTADO FEDERAL,IVAN VALENTE,IVAN VALENTE,ELEITO,PSOL,PARTIDO SOCIALISMO E LIBERDADE,7
CASTILHO,DEPUTADO FEDERAL,RICARDO DUTRA,RICARDO DUTRA RUBES,SUPLENTE,PSOL,PARTIDO SOCIALISMO E LIBERDADE,1
CASTILHO,DEPUTADO FEDERAL,EDSON MACIEL,EDSON GENARO MACIEL,SUPLENTE,PSOL,PARTIDO SOCIALISMO E LIBERDADE,1
CASTILHO,DEPUTADO FEDERAL,NEIDE REGES,NEIDE REGES LIMA,SUPLENTE,PSOL,PARTIDO SOCIALISMO E LIBERDADE,12
CASTILHO,DEPUTADO FEDERAL,DR. ABELHA,CARLOS FERNANDO LOPES ABELHA,SUPLENTE,PC DO B,JUNTOS POR SÃO PAULO,1
CASTILHO,DEPUTADO FEDERAL,GUSTAVO PETTA,GUSTAVO LEMOS PETTA,SUPLENTE,PC DO B,JUNTOS POR SÃO PAULO,19
CASTILHO,DEPUTADO FEDERAL,SIDNEI MARTINS,SIDNEI ALVES MARTINS,SUPLENTE,PC DO B,JUNTOS POR SÃO PAULO,1
CASTILHO,DEPUTADO FEDERAL,CÉLIO TURINO,CÉLIO ROBERTO TURINO DE MIRANDA,SUPLENTE,PC DO B,JUNTOS POR SÃO PAULO,1
CASTILHO,DEPUTADO FEDERAL,ALDO REBELO,JOSÉ ALDO REBELO FIGUEIREDO,ELEITO,PC DO B,JUNTOS POR SÃO PAULO,11
CASTILHO,DEPUTADO FEDERAL,DELEGADO PROTÓGENES,PROTÓGENES PINHEIRO DE QUEIROZ,MÉDIA,PC DO B,JUNTOS POR SÃO PAULO,11
CASTILHO,DEPUTADO FEDERAL,JOAO ARAUJO,JOAO LUIS ARAUJO NETO,SUPLENTE,PT DO B,JUNTOS POR SÃO PAULO,1
CASTILHO,DEPUTADO ESTADUAL,GERSON DEZEMBRO,GERSON DONIZETI DEZEMBRO,SUPLENTE,PRB,SOMOS MAIS SÃO PAULO,1
CASTILHO,DEPUTADO ESTADUAL,SEBASTIÃO SANTOS,SEBASTIÃO DOS SANTOS FILHO,ELEITO,PRB,SOMOS MAIS SÃO PAULO,1
CASTILHO,DEPUTADO ESTADUAL,CURIATI,ANTONIO SALIM CURIATI,ELEITO,PP,PARTIDO PROGRESSISTA,5
CASTILHO,DEPUTADO ESTADUAL,S. MIRANDA,SILVIA HELENA MIRANDA DE SALLES,SUPLENTE,PP,PARTIDO PROGRESSISTA,1
CASTILHO,DEPUTADO ESTADUAL,SIMONY,SIMONY BENELLI GALASSO,SUPLENTE,PP,PARTIDO PROGRESSISTA,4
CASTILHO,DEPUTADO ESTADUAL,JOÃO ARAUJO,JOÃO ANTONIO DE ARAUJO,SUPLENTE,PP,PARTIDO PROGRESSISTA,1
CASTILHO,DEPUTADO ESTADUAL,DR. IRINEU,IRINEU CARDOSO DOS SANTOS,SUPLENTE,PP,PARTIDO PROGRESSISTA,1
CASTILHO,DEPUTADO ESTADUAL,MARIA CLEMENTINA,MARIA CLEMENTINO DE SOUSA,SUPLENTE,PP,PARTIDO PROGRESSISTA,2
CASTILHO,DEPUTADO ESTADUAL,MAURICIO DO AVESTRUZ,MAURICIO CARLOS LUPIFIERI,SUPLENTE,PP,PARTIDO PROGRESSISTA,36
CASTILHO,DEPUTADO ESTADUAL,RAFA ZIMBALDI,RAFAEL FERNANDO ZIMBALDI,SUPLENTE,PP,PARTIDO PROGRESSISTA,6
CASTILHO,DEPUTADO ESTADUAL,RUSSOMANNO,MOZART ABAETE PERUIBE RUSSOMANNO,SUPLENTE,PP,PARTIDO PROGRESSISTA,47
CASTILHO,DEPUTADO ESTADUAL,PEREIRA METALURGICO,JOSÉ PEREIRA DOS SANTOS,SUPLENTE,PDT,PARTIDO DEMOCRÁTICO TRABALHISTA,2
CASTILHO,DEPUTADO ESTADUAL,CARLOS BALADO,CARLOS GARCIA BALADO,SUPLENTE,PDT,PARTIDO DEMOCRÁTICO TRABALHISTA,1
CASTILHO,DEPUTADO ESTADUAL,DINEI,CLAUDINEI ALEXANDRE PIRES,SUPLENTE,PDT,PARTIDO DEMOCRÁTICO TRABALHISTA,4
CASTILHO,DEPUTADO ESTADUAL,JOSE BITTENCOURT,JOSE DOMINGOS BITTENCOURT,ELEITO,PDT,PARTIDO DEMOCRÁTICO TRABALHISTA,69
CASTILHO,DEPUTADO ESTADUAL,MAJOR OLIMPIO,SERGIO OLIMPIO GOMES,ELEITO,PDT,PARTIDO DEMOCRÁTICO TRABALHISTA,43
CASTILHO,DEPUTADO ESTADUAL,CARLAO MOTORISTA,ANTONIO CARLOS RIBEIRO,SUPLENTE,PDT,PARTIDO DEMOCRÁTICO TRABALHISTA,1
CASTILHO,DEPUTADO ESTADUAL,JOCA VASCONCELOS,JOAO CARLOS MONTE CLARO VASCONCELOS,SUPLENTE,PDT,PARTIDO DEMOCRÁTICO TRABALHISTA,1
CASTILHO,DEPUTADO ESTADUAL,CARLOS HERNANDES,JOSÉ CARLOS SANCHES HERNANDES,SUPLENTE,PDT,PARTIDO DEMOCRÁTICO TRABALHISTA,29
CASTILHO,DEPUTADO ESTADUAL,NICOLACI,RONALD LUIZ NICOLACI FINCATTI,SUPLENTE,PDT,PARTIDO DEMOCRÁTICO TRABALHISTA,1
CASTILHO,DEPUTADO ESTADUAL,EMERSON LEAL,EMERSON PIRES LEAL,SUPLENTE,PDT,PARTIDO DEMOCRÁTICO TRABALHISTA,7
CASTILHO,DEPUTADO ESTADUAL,RAFAEL SILVA,RAFAEL ANTONIO DA SILVA,ELEITO,PDT,PARTIDO DEMOCRÁTICO TRABALHISTA,4
CASTILHO,DEPUTADO ESTADUAL,NICANOR,NICANOR JOSE DA SILVA,SUPLENTE,PDT,PARTIDO DEMOCRÁTICO TRABALHISTA,1
CASTILHO,DEPUTADO ESTADUAL,TOLOI,LUIZ CARLOS TOLOI JUNIOR,SUPLENTE,PDT,PARTIDO DEMOCRÁTICO TRABALHISTA,12
CASTILHO,DEPUTADO ESTADUAL,TADEU MORAIS,TADEU MORAIS DE SOUSA,SUPLENTE,PDT,PARTIDO DEMOCRÁTICO TRABALHISTA,1
CASTILHO,DEPUTADO ESTADUAL,MARCO BRASIL,MARCO AURÉLIO RIBEIRO,SUPLENTE,PDT,PARTIDO DEMOCRÁTICO TRABALHISTA,481
CASTILHO,DEPUTADO ESTADUAL,TELMA DE SOUZA,TELMA SANDRA AUGUSTO DE SOUZA,ELEITO,PT,SOMOS MAIS SÃO PAULO,1
CASTILHO,DEPUTADO ESTADUAL,VALMIR PRASCIDELLI,VALMIR PRASCIDELLI,SUPLENTE,PT,SOMOS MAIS SÃO PAULO,1
CASTILHO,DEPUTADO ESTADUAL,JURA,JURACY FRANCISCO DE JESUS,SUPLENTE,PT,SOMOS MAIS SÃO PAULO,3
CASTILHO,DEPUTADO ESTADUAL,GERSON BITTENCOURT,GERSON LUIS BITTENCOURT,ELEITO,PT,SOMOS MAIS SÃO PAULO,125
CASTILHO,DEPUTADO ESTADUAL,EDINHO SILVA,EDSON ANTONIO EDINHO DA SILVA,ELEITO,PT,SOMOS MAIS SÃO PAULO,45
CASTILHO,DEPUTADO ESTADUAL,ENIO TATTO,ENIO FRANCISCO TATTO,ELEITO,PT,SOMOS MAIS SÃO PAULO,2
CASTILHO,DEPUTADO ESTADUAL,ANA PERUGINI,ANA LUCIA LIPPAUS PERUGINI,ELEITO,PT,SOMOS MAIS SÃO PAULO,620
CASTILHO,DEPUTADO ESTADUAL,TONINHO DO PT,ANTONIO AMARAL JUNIOR,SUPLENTE,PT,SOMOS MAIS SÃO PAULO,7
CASTILHO,DEPUTADO ESTADUAL,ZICO,JOSÉ PRADO DE ANDRADE,MÉDIA,PT,SOMOS MAIS SÃO PAULO,68
CASTILHO,DEPUTADO ESTADUAL,MARCO AURÉLIO DE SOUZA,MARCO AURÉLIO DE SOUZA,MÉDIA,PT,SOMOS MAIS SÃO PAULO,1
CASTILHO,DEPUTADO ESTADUAL,MARCOS MARTINS,MARCOS LOPES MARTINS,ELEITO,PT,SOMOS MAIS SÃO PAULO,6
CASTILHO,DEPUTADO ESTADUAL,ELI TEODORO,ELI TEODORO,SUPLENTE,PT,SOMOS MAIS SÃO PAULO,4
CASTILHO,DEPUTADO ESTADUAL,SIMÃO PEDRO,SIMÃO PEDRO CHIOVETTI,ELEITO,PT,SOMOS MAIS SÃO PAULO,467
CASTILHO,DEPUTADO ESTADUAL,ÉMERSON TAUYL,EMERSON LIMA TAUYL,SUPLENTE,PT,SOMOS MAIS SÃO PAULO,1
CASTILHO,DEPUTADO ESTADUAL,ANTONIO MENTOR,ANTONIO MENTOR DE MELLO SOBRINHO,ELEITO,PT,SOMOS MAIS SÃO PAULO,26
CASTILHO,DEPUTADO ESTADUAL,PADRE JUZEMILDO,JUZEMILDO ALBINO DA SILVA,SUPLENTE,PT,SOMOS MAIS SÃO PAULO,3
CASTILHO,DEPUTADO ESTADUAL,ADRIANO DIOGO,ADRIANO DIOGO,ELEITO,PT,SOMOS MAIS SÃO PAULO,5
CASTILHO,DEPUTADO ESTADUAL,ESTELA ALMAGRO,ESTELA ALEXANDRE ALMAGRO,SUPLENTE,PT,SOMOS MAIS SÃO PAULO,2
CASTILHO,DEPUTADO ESTADUAL,EUVANILDE,EUVANILDE RODRIGUES DA SILVA,SUPLENTE,PT,SOMOS MAIS SÃO PAULO,1
CASTILHO,DEPUTADO ESTADUAL,LUIZ CLAUDIO MARCOLINO,LUIZ CLAUDIO MARCOLINO,ELEITO,PT,SOMOS MAIS SÃO PAULO,1
CASTILHO,DEPUTADO ESTADUAL,RENATO DO GEB,RENATO MORENI AIRES DA SILVA,SUPLENTE,PT,SOMOS MAIS SÃO PAULO,1
CASTILHO,DEPUTADO ESTADUAL,DENISE ERBELLA,DENISE ELOÁ CUSTÓDIO ERBELLA DE CASTRO,SUPLENTE,PT,SOMOS MAIS SÃO PAULO,1
CASTILHO,DEPUTADO ESTADUAL,NATIVIDADE,MARIA DA NATIVIDADE PEREIRA LIMA,SUPLENTE,PT,SOMOS MAIS SÃO PAULO,1
CASTILHO,DEPUTADO ESTADUAL,ROBERTO FELICIO,ROBERTO FELICIO,SUPLENTE,PT,SOMOS MAIS SÃO PAULO,26
CASTILHO,DEPUTADO ESTADUAL,BETH SAHAO,ELISABETH SAHÃO,SUPLENTE,PT,SOMOS MAIS SÃO PAULO,42
CASTILHO,DEPUTADO ESTADUAL,TIÃOZINHO,SEBASTIÃO MOREIREA ARCANJO,SUPLENTE,PT,SOMOS MAIS SÃO PAULO,1
CASTILHO,DEPUTADO ESTADUAL,JOÃO PAULO RILLO,JOÃO PAULO RILLO,ELEITO,PT,SOMOS MAIS SÃO PAULO,8
CASTILHO,DEPUTADO ESTADUAL,MIRANDA,JOSÉ CARLOS MIRANDA,SUPLENTE,PT,SOMOS MAIS SÃO PAULO,1
CASTILHO,DEPUTADO ESTADUAL,JOSÉ CANDIDO,JOSÉ DE SOUZA CÂNDIDO,MÉDIA,PT,SOMOS MAIS SÃO PAULO,7
CASTILHO,DEPUTADO ESTADUAL,JOÃO ANTONIO,JOAO ANTONIO DA SILVA FILHO,ELEITO,PT,SOMOS MAIS SÃO PAULO,117
CASTILHO,DEPUTADO ESTADUAL,FERNANDO ESCODEIRO,LUIZ FERNANDO ESCODEIRO,SUPLENTE,PT,SOMOS MAIS SÃO PAULO,8
CASTILHO,DEPUTADO ESTADUAL,MÁRCIO CHAVES,MÁRCIO CHAVES PIRES,SUPLENTE,PT,SOMOS MAIS SÃO PAULO,6
CASTILHO,DEPUTADO ESTADUAL,TITO,FRANCISCO DE ASSIS PEREIRA DE CAMPOS,SUPLENTE,PT,SOMOS MAIS SÃO PAULO,56
CASTILHO,DEPUTADO ESTADUAL,DONISETE BRAGA,DONISETE PEREIRA BRAGA,ELEITO,PT,SOMOS MAIS SÃO PAULO,38
CASTILHO,DEPUTADO ESTADUAL,EDUARDO SIMAO,EDUARDO SIMAO DIAS,SUPLENTE,PT,SOMOS MAIS SÃO PAULO,2
CASTILHO,DEPUTADO ESTADUAL,LÉO ÁQUILLA,JADSON MENDES DE LIMA,SUPLENTE,PTB,PARTIDO TRABALHISTA BRASILEIRO,2
CASTILHO,DEPUTADO ESTADUAL,CONTE LOPES,ROBERVAL CONTE LOPES LIMA,SUPLENTE,PTB,PARTIDO TRABALHISTA BRASILEIRO,2
CASTILHO,DEPUTADO ESTADUAL,CAMPOS MACHADO,ANTONIO CARLOS DE CAMPOS MACHADO,ELEITO,PTB,PARTIDO TRABALHISTA BRASILEIRO,33
CASTILHO,DEPUTADO ESTADUAL,ROQUE BARBIERE - ROQUINHO,ROQUE BARBIERE,ELEITO,PTB,PARTIDO TRABALHISTA BRASILEIRO,27
CASTILHO,DEPUTADO ESTADUAL,VAL,ENIVALDO RAMOS DE FREITAS,SUPLENTE,PTB,PARTIDO TRABALHISTA BRASILEIRO,75
CASTILHO,DEPUTADO ESTADUAL,PROFESSORA ALBA LUCENA,ALBA LUCENA FERNANDES GANDIA,SUPLENTE,PTB,PARTIDO TRABALHISTA BRASILEIRO,1
