PIRASSUNUNGA,DEPUTADO FEDERAL,CARLOS ROBERTO,CARLOS ROBERTO DE CAMPOS,SUPLENTE,PSDB,PSDB/DEM/PPS,3
PIRASSUNUNGA,DEPUTADO FEDERAL,PANNUNZIO,ANTONIO CARLOS PANNUNZIO,SUPLENTE,PSDB,PSDB/DEM/PPS,1
PIRASSUNUNGA,DEPUTADO FEDERAL,ALBERTO MOURAO,ALBERTO PEREIRA MOURAO,SUPLENTE,PSDB,PSDB/DEM/PPS,3
PIRASSUNUNGA,DEPUTADO FEDERAL,RENATO AMARY,RENATO FAUVEL AMARY,SUPLENTE,PSDB,PSDB/DEM/PPS,1
PIRASSUNUNGA,DEPUTADO FEDERAL,SILVIO TORRES,SILVIO FRANÇA TORRES,SUPLENTE,PSDB,PSDB/DEM/PPS,12
PIRASSUNUNGA,DEPUTADO FEDERAL,TIRSO MEIRELLES,TIRSO DE SALLES MEIRELLES,SUPLENTE,PSDB,PSDB/DEM/PPS,12
PIRASSUNUNGA,DEPUTADO FEDERAL,TERESA SERRANO,MARIA TERESA SERRANO AFONSO,SUPLENTE,PSDB,PSDB/DEM/PPS,3
PIRASSUNUNGA,DEPUTADO FEDERAL,EDSON APARECIDO,EDSON APARECIDO DOS SANTOS,ELEITO,PSDB,PSDB/DEM/PPS,33
PIRASSUNUNGA,DEPUTADO FEDERAL,RICARDO MONTORO,JOSE RICARDO FRANCO MONTORO,SUPLENTE,PSDB,PSDB/DEM/PPS,6
PIRASSUNUNGA,DEPUTADO FEDERAL,LUIZ FERNANDO MACHADO,LUIZ FERNANDO ARANTES MACHADO,ELEITO,PSDB,PSDB/DEM/PPS,11
PIRASSUNUNGA,DEPUTADO FEDERAL,DR. MARCELO,MARCELO CHEHADE,SUPLENTE,PSDB,PSDB/DEM/PPS,2
PIRASSUNUNGA,DEPUTADO FEDERAL,VANDERLEI MACRIS,VANDERLEI MACRIS,SUPLENTE,PSDB,PSDB/DEM/PPS,1919
PIRASSUNUNGA,DEPUTADO FEDERAL,DUARTE NOGUEIRA,ANTONIO DUARTE NOGUEIRA JUNIOR,ELEITO,PSDB,PSDB/DEM/PPS,25
PIRASSUNUNGA,DEPUTADO FEDERAL,JULIO SEMEGHINI,JULIO FRACISCO SEMEGHINI NETO,ELEITO,PSDB,PSDB/DEM/PPS,13
PIRASSUNUNGA,DEPUTADO FEDERAL,GIVALDO VIEIRA,GIVALDO RODRIGUES VIEIRA,SUPLENTE,PSDB,PSDB/DEM/PPS,2
PIRASSUNUNGA,DEPUTADO FEDERAL,TRIPOLI,JOSÉ RICARDO ALVARENGA TRIPOLI,ELEITO,PSDB,PSDB/DEM/PPS,34
PIRASSUNUNGA,DEPUTADO FEDERAL,FERNANDO FUAD CHUCRE,FERNANDO BARRANCOS CHUCRE,SUPLENTE,PSDB,PSDB/DEM/PPS,1
PIRASSUNUNGA,DEPUTADO FEDERAL,VAZ DE LIMA,JOSÉ CARLOS VAZ DE LIMA,ELEITO,PSDB,PSDB/DEM/PPS,78
PIRASSUNUNGA,DEPUTADO FEDERAL,ALEMÃO DA SÁUDE,CLAUDEMIR SERENO,SUPLENTE,PSDB,PSDB/DEM/PPS,2
PIRASSUNUNGA,DEPUTADO FEDERAL,WALTER FELDMAN,WALTER MEYER FELDMAN,SUPLENTE,PSDB,PSDB/DEM/PPS,19
PIRASSUNUNGA,DEPUTADO FEDERAL,THAME,ANTONIO CARLOS DE MENDES THAME,ELEITO,PSDB,PSDB/DEM/PPS,24
PIRASSUNUNGA,DEPUTADO FEDERAL,ARNALDO MADEIRA,ARNALDO DE ABREU MADEIRA,SUPLENTE,PSDB,PSDB/DEM/PPS,10
PIRASSUNUNGA,DEPUTADO FEDERAL,BRUNA FURLAN,BRUNA DIAS FURLAN,ELEITO,PSDB,PSDB/DEM/PPS,9
PIRASSUNUNGA,DEPUTADO FEDERAL,JOSÉ ANIBAL,JOSÉ ANIBAL PERES DE PONTES,ELEITO,PSDB,PSDB/DEM/PPS,13
PIRASSUNUNGA,DEPUTADO FEDERAL,NELSON BUGALHO,NELSON ROBERTO BUGALHO,SUPLENTE,PSDB,PSDB/DEM/PPS,2
PIRASSUNUNGA,DEPUTADO FEDERAL,GILBERTO BORJA,GILBERTO BORJA PINTO,SUPLENTE,PSDB,PSDB/DEM/PPS,2
PIRASSUNUNGA,DEPUTADO FEDERAL,PROFª Mª DOLORES,MARIA DOLORES FORTES ALVES,SUPLENTE,PSOL,PARTIDO SOCIALISMO E LIBERDADE,1
PIRASSUNUNGA,DEPUTADO FEDERAL,IVAN VALENTE,IVAN VALENTE,ELEITO,PSOL,PARTIDO SOCIALISMO E LIBERDADE,156
PIRASSUNUNGA,DEPUTADO FEDERAL,VALDEMAR VALENTIN,VALDEMAR ANTONIO VALENTIN,SUPLENTE,PSOL,PARTIDO SOCIALISMO E LIBERDADE,1
PIRASSUNUNGA,DEPUTADO FEDERAL,PROFESSORA MÁRCIA TAVARES,MÁRCIA TAVARES DO NASCIMENTO,SUPLENTE,PSOL,PARTIDO SOCIALISMO E LIBERDADE,1
PIRASSUNUNGA,DEPUTADO FEDERAL,MARIO CONCEIÇÃO,MARIO CONCEIÇÃO,SUPLENTE,PSOL,PARTIDO SOCIALISMO E LIBERDADE,7
PIRASSUNUNGA,DEPUTADO FEDERAL,DR. ABELHA,CARLOS FERNANDO LOPES ABELHA,SUPLENTE,PC DO B,JUNTOS POR SÃO PAULO,1
PIRASSUNUNGA,DEPUTADO FEDERAL,GUSTAVO PETTA,GUSTAVO LEMOS PETTA,SUPLENTE,PC DO B,JUNTOS POR SÃO PAULO,6
PIRASSUNUNGA,DEPUTADO FEDERAL,CÉLIO TURINO,CÉLIO ROBERTO TURINO DE MIRANDA,SUPLENTE,PC DO B,JUNTOS POR SÃO PAULO,1
PIRASSUNUNGA,DEPUTADO FEDERAL,BENEH SANTOS,BENEDITO HERNELIO DOS SANTOS,SUPLENTE,PC DO B,JUNTOS POR SÃO PAULO,1
PIRASSUNUNGA,DEPUTADO FEDERAL,ALDO REBELO,JOSÉ ALDO REBELO FIGUEIREDO,ELEITO,PC DO B,JUNTOS POR SÃO PAULO,87
PIRASSUNUNGA,DEPUTADO FEDERAL,DELEGADO PROTÓGENES,PROTÓGENES PINHEIRO DE QUEIROZ,MÉDIA,PC DO B,JUNTOS POR SÃO PAULO,70
PIRASSUNUNGA,DEPUTADO FEDERAL,JOAO ARAUJO,JOAO LUIS ARAUJO NETO,SUPLENTE,PT DO B,JUNTOS POR SÃO PAULO,1
PIRASSUNUNGA,DEPUTADO ESTADUAL,GERSON DEZEMBRO,GERSON DONIZETI DEZEMBRO,SUPLENTE,PRB,SOMOS MAIS SÃO PAULO,2
PIRASSUNUNGA,DEPUTADO ESTADUAL,GILMACI SANTOS,GILMACI DOS SANTOS BARBOSA,ELEITO,PRB,SOMOS MAIS SÃO PAULO,5
PIRASSUNUNGA,DEPUTADO ESTADUAL,SEBASTIÃO SANTOS,SEBASTIÃO DOS SANTOS FILHO,ELEITO,PRB,SOMOS MAIS SÃO PAULO,98
PIRASSUNUNGA,DEPUTADO ESTADUAL,HAVANIR,HAVANIR TAVARES DE ALMEIDA NIMTZ,SUPLENTE,PRB,SOMOS MAIS SÃO PAULO,3
PIRASSUNUNGA,DEPUTADO ESTADUAL,ITHAMAR DABRIUS,ITHAMAR DABRIUS JUNIOR,SUPLENTE,PRB,SOMOS MAIS SÃO PAULO,1
PIRASSUNUNGA,DEPUTADO ESTADUAL,RICARDO SARAVALLI,RICARDO SARAVALLI,SUPLENTE,PP,PARTIDO PROGRESSISTA,3
PIRASSUNUNGA,DEPUTADO ESTADUAL,ALMEIDA,CLESIO VOLDENEI DE OLIVEIRA ALMEIDA,SUPLENTE,PP,PARTIDO PROGRESSISTA,156
PIRASSUNUNGA,DEPUTADO ESTADUAL,COBRADOR CABEÇA,ROBERTO ANTONIO ALVES,SUPLENTE,PP,PARTIDO PROGRESSISTA,1
PIRASSUNUNGA,DEPUTADO ESTADUAL,DR. FERRUCIO,FERRUCIO DALL AGLIO,SUPLENTE,PP,PARTIDO PROGRESSISTA,1
PIRASSUNUNGA,DEPUTADO ESTADUAL,ORLANDO GONÇALVES,ORLANDO GONÇALVES DOS ANJOS,SUPLENTE,PP,PARTIDO PROGRESSISTA,1
PIRASSUNUNGA,DEPUTADO ESTADUAL,BARROS PIAUÍ,JUVENAL DE SOUSA BARROS,SUPLENTE,PP,PARTIDO PROGRESSISTA,1
PIRASSUNUNGA,DEPUTADO ESTADUAL,CURIATI,ANTONIO SALIM CURIATI,ELEITO,PP,PARTIDO PROGRESSISTA,47
PIRASSUNUNGA,DEPUTADO ESTADUAL,CIMATTI NETO,MILTON CIMATTI NETO,SUPLENTE,PP,PARTIDO PROGRESSISTA,1
PIRASSUNUNGA,DEPUTADO ESTADUAL,HALEPLIAN,SYLVIO HALEPLIAN FILHO,SUPLENTE,PP,PARTIDO PROGRESSISTA,5
PIRASSUNUNGA,DEPUTADO ESTADUAL,SARGENTO REIS,MARIO JOSÉ DOS REIS,SUPLENTE,PP,PARTIDO PROGRESSISTA,12
PIRASSUNUNGA,DEPUTADO ESTADUAL,SIMONY,SIMONY BENELLI GALASSO,SUPLENTE,PP,PARTIDO PROGRESSISTA,5
PIRASSUNUNGA,DEPUTADO ESTADUAL,RAIMUNDO DA AÇÃO,RAIMUNDO SILISTRO DE OLIVEIRA,SUPLENTE,PP,PARTIDO PROGRESSISTA,4
PIRASSUNUNGA,DEPUTADO ESTADUAL,FIALA,FRANCISCO TOMAS FIALA,SUPLENTE,PP,PARTIDO PROGRESSISTA,1
PIRASSUNUNGA,DEPUTADO ESTADUAL,DR. EDUARDO,EDUARDO DE MORAES,SUPLENTE,PP,PARTIDO PROGRESSISTA,5
PIRASSUNUNGA,DEPUTADO ESTADUAL,FARIA JR,WALDEMAR ALVES FARIA JUNIOR,SUPLENTE,PP,PARTIDO PROGRESSISTA,1
PIRASSUNUNGA,DEPUTADO ESTADUAL,MARIA CLEMENTINA,MARIA CLEMENTINO DE SOUSA,SUPLENTE,PP,PARTIDO PROGRESSISTA,1
PIRASSUNUNGA,DEPUTADO ESTADUAL,ELIAS CAMARGO,ELIAS CAMARGO,SUPLENTE,PP,PARTIDO PROGRESSISTA,1
PIRASSUNUNGA,DEPUTADO ESTADUAL,MAURICIO DO AVESTRUZ,MAURICIO CARLOS LUPIFIERI,SUPLENTE,PP,PARTIDO PROGRESSISTA,1
PIRASSUNUNGA,DEPUTADO ESTADUAL,RAFA ZIMBALDI,RAFAEL FERNANDO ZIMBALDI,SUPLENTE,PP,PARTIDO PROGRESSISTA,9
PIRASSUNUNGA,DEPUTADO ESTADUAL,NELSON MANDELA,ADOLPHINO ROSARIO CRUZ,SUPLENTE,PP,PARTIDO PROGRESSISTA,1
PIRASSUNUNGA,DEPUTADO ESTADUAL,RUSSOMANNO,MOZART ABAETE PERUIBE RUSSOMANNO,SUPLENTE,PP,PARTIDO PROGRESSISTA,595
PIRASSUNUNGA,DEPUTADO ESTADUAL,CELSO LIMA,CELSO LIMA,SUPLENTE,PP,PARTIDO PROGRESSISTA,11
PIRASSUNUNGA,DEPUTADO ESTADUAL,AURELIO,AURELIO JOSE CLAUDIO,SUPLENTE,PDT,PARTIDO DEMOCRÁTICO TRABALHISTA,198
PIRASSUNUNGA,DEPUTADO ESTADUAL,PERESSIM,CLAUDIO PERESSIM,SUPLENTE,PDT,PARTIDO DEMOCRÁTICO TRABALHISTA,1
PIRASSUNUNGA,DEPUTADO ESTADUAL,LUIS YABIKU,LUIS MOKITI YABIKU,SUPLENTE,PDT,PARTIDO DEMOCRÁTICO TRABALHISTA,13
PIRASSUNUNGA,DEPUTADO ESTADUAL,DINEI,CLAUDINEI ALEXANDRE PIRES,SUPLENTE,PDT,PARTIDO DEMOCRÁTICO TRABALHISTA,10
PIRASSUNUNGA,DEPUTADO ESTADUAL,GILBERTO DOURADO,GILBERTO RODRIGUES DOURADO,SUPLENTE,PDT,PARTIDO DEMOCRÁTICO TRABALHISTA,1
PIRASSUNUNGA,DEPUTADO ESTADUAL,ROGERIO NOGUEIRA,ROGERIO NOGUEIRA LOPES CRUZ,ELEITO,PDT,PARTIDO DEMOCRÁTICO TRABALHISTA,5
PIRASSUNUNGA,DEPUTADO ESTADUAL,JOSE BITTENCOURT,JOSE DOMINGOS BITTENCOURT,ELEITO,PDT,PARTIDO DEMOCRÁTICO TRABALHISTA,45
PIRASSUNUNGA,DEPUTADO ESTADUAL,MAJOR OLIMPIO,SERGIO OLIMPIO GOMES,ELEITO,PDT,PARTIDO DEMOCRÁTICO TRABALHISTA,177
PIRASSUNUNGA,DEPUTADO ESTADUAL,THIAGO RODRIGUES,THIAGO RODRIGUES DA COSTA,SUPLENTE,PDT,PARTIDO DEMOCRÁTICO TRABALHISTA,2
PIRASSUNUNGA,DEPUTADO ESTADUAL,CARLAO MOTORISTA,ANTONIO CARLOS RIBEIRO,SUPLENTE,PDT,PARTIDO DEMOCRÁTICO TRABALHISTA,1
PIRASSUNUNGA,DEPUTADO ESTADUAL,MARCOS BERNARDELLI,MARCOS JOSÉ BERNARDELLI,SUPLENTE,PDT,PARTIDO DEMOCRÁTICO TRABALHISTA,3
PIRASSUNUNGA,DEPUTADO ESTADUAL,JOCA VASCONCELOS,JOAO CARLOS MONTE CLARO VASCONCELOS,SUPLENTE,PDT,PARTIDO DEMOCRÁTICO TRABALHISTA,7
PIRASSUNUNGA,DEPUTADO ESTADUAL,CARLOS HERNANDES,JOSÉ CARLOS SANCHES HERNANDES,SUPLENTE,PDT,PARTIDO DEMOCRÁTICO TRABALHISTA,2
PIRASSUNUNGA,DEPUTADO ESTADUAL,NICOLACI,RONALD LUIZ NICOLACI FINCATTI,SUPLENTE,PDT,PARTIDO DEMOCRÁTICO TRABALHISTA,2
PIRASSUNUNGA,DEPUTADO ESTADUAL,BRUZAROSCO,APARECIDO DE JESUS BRUZAROSCO,SUPLENTE,PDT,PARTIDO DEMOCRÁTICO TRABALHISTA,1
PIRASSUNUNGA,DEPUTADO ESTADUAL,EMERSON LEAL,EMERSON PIRES LEAL,SUPLENTE,PDT,PARTIDO DEMOCRÁTICO TRABALHISTA,6
PIRASSUNUNGA,DEPUTADO ESTADUAL,RAFAEL SILVA,RAFAEL ANTONIO DA SILVA,ELEITO,PDT,PARTIDO DEMOCRÁTICO TRABALHISTA,33
PIRASSUNUNGA,DEPUTADO ESTADUAL,TOLOI,LUIZ CARLOS TOLOI JUNIOR,SUPLENTE,PDT,PARTIDO DEMOCRÁTICO TRABALHISTA,18
PIRASSUNUNGA,DEPUTADO ESTADUAL,LEONICE DA PAZ,LEONICE ALVES DA PAZ,SUPLENTE,PDT,PARTIDO DEMOCRÁTICO TRABALHISTA,1
PIRASSUNUNGA,DEPUTADO ESTADUAL,HELIO BASTOS,HELIO DE ALMEIDA BASTOS,SUPLENTE,PDT,PARTIDO DEMOCRÁTICO TRABALHISTA,1
PIRASSUNUNGA,DEPUTADO ESTADUAL,MYRYAM ATHIE,MIRIAM ATHIE,SUPLENTE,PDT,PARTIDO DEMOCRÁTICO TRABALHISTA,3
PIRASSUNUNGA,DEPUTADO ESTADUAL,ZEZINHO DA RADIO,JOSE MARIA FERNANDES DE MACEDO,SUPLENTE,PDT,PARTIDO DEMOCRÁTICO TRABALHISTA,2
PIRASSUNUNGA,DEPUTADO ESTADUAL,WENDEL ALVES,WENDEL ALVES DE SOUSA,SUPLENTE,PDT,PARTIDO DEMOCRÁTICO TRABALHISTA,3
PIRASSUNUNGA,DEPUTADO ESTADUAL,CONSTANCIA FELIX,CONSTANCIA BERBERT DUTRA DA SILVA,SUPLENTE,PDT,PARTIDO DEMOCRÁTICO TRABALHISTA,152
PIRASSUNUNGA,DEPUTADO ESTADUAL,RICARDO BORGES,RICARDO BRANCO BORGES,SUPLENTE,PDT,PARTIDO DEMOCRÁTICO TRABALHISTA,1
PIRASSUNUNGA,DEPUTADO ESTADUAL,SILAS FARIA,SILAS FARIA DE SOUZA,SUPLENTE,PDT,PARTIDO DEMOCRÁTICO TRABALHISTA,1
PIRASSUNUNGA,DEPUTADO ESTADUAL,MARCO BRASIL,MARCO AURÉLIO RIBEIRO,SUPLENTE,PDT,PARTIDO DEMOCRÁTICO TRABALHISTA,1
PIRASSUNUNGA,DEPUTADO ESTADUAL,ANDERSON SILVA,ANDERSON DOMINGOS DA SILVA,SUPLENTE,PT,SOMOS MAIS SÃO PAULO,3
PIRASSUNUNGA,DEPUTADO ESTADUAL,DR. JORGE PARADA,JORGE EDUARDO PARADA HURTADO,SUPLENTE,PT,SOMOS MAIS SÃO PAULO,3
PIRASSUNUNGA,DEPUTADO ESTADUAL,TELMA DE SOUZA,TELMA SANDRA AUGUSTO DE SOUZA,ELEITO,PT,SOMOS MAIS SÃO PAULO,4
PIRASSUNUNGA,DEPUTADO ESTADUAL,DR. JOÃO CARLOS,JOÃO CARLOS FRANÇA DE PAULA SANTOS,SUPLENTE,PT,SOMOS MAIS SÃO PAULO,2
PIRASSUNUNGA,DEPUTADO ESTADUAL,WAGNER BALIEIRO,WAGNER OCIMAR BALIEIRO,SUPLENTE,PT,SOMOS MAIS SÃO PAULO,1
PIRASSUNUNGA,DEPUTADO ESTADUAL,PROFESSOR CLEITON GOMES,CLEITON GOMES DA SILVA,SUPLENTE,PT,SOMOS MAIS SÃO PAULO,7
PIRASSUNUNGA,DEPUTADO ESTADUAL,GALENO AMORIM,GALENO DE AMORIM JUNIOR,SUPLENTE,PT,SOMOS MAIS SÃO PAULO,20
PIRASSUNUNGA,DEPUTADO ESTADUAL,VALMIR PRASCIDELLI,VALMIR PRASCIDELLI,SUPLENTE,PT,SOMOS MAIS SÃO PAULO,25
PIRASSUNUNGA,DEPUTADO ESTADUAL,PORTUGUÊS,REINALDO FARTO NUNES,SUPLENTE,PT,SOMOS MAIS SÃO PAULO,2
PIRASSUNUNGA,DEPUTADO ESTADUAL,JURA,JURACY FRANCISCO DE JESUS,SUPLENTE,PT,SOMOS MAIS SÃO PAULO,6
PIRASSUNUNGA,DEPUTADO ESTADUAL,GERSON BITTENCOURT,GERSON LUIS BITTENCOURT,ELEITO,PT,SOMOS MAIS SÃO PAULO,2
PIRASSUNUNGA,DEPUTADO ESTADUAL,EDINHO SILVA,EDSON ANTONIO EDINHO DA SILVA,ELEITO,PT,SOMOS MAIS SÃO PAULO,502
PIRASSUNUNGA,DEPUTADO ESTADUAL,ENIO TATTO,ENIO FRANCISCO TATTO,ELEITO,PT,SOMOS MAIS SÃO PAULO,104
PIRASSUNUNGA,DEPUTADO ESTADUAL,ANA PERUGINI,ANA LUCIA LIPPAUS PERUGINI,ELEITO,PT,SOMOS MAIS SÃO PAULO,22
PIRASSUNUNGA,DEPUTADO ESTADUAL,ZICO,JOSÉ PRADO DE ANDRADE,MÉDIA,PT,SOMOS MAIS SÃO PAULO,3
PIRASSUNUNGA,DEPUTADO ESTADUAL,MARCO AURÉLIO DE SOUZA,MARCO AURÉLIO DE SOUZA,MÉDIA,PT,SOMOS MAIS SÃO PAULO,3
PIRASSUNUNGA,DEPUTADO ESTADUAL,MARCOS MARTINS,MARCOS LOPES MARTINS,ELEITO,PT,SOMOS MAIS SÃO PAULO,17
PIRASSUNUNGA,DEPUTADO ESTADUAL,ELI TEODORO,ELI TEODORO,SUPLENTE,PT,SOMOS MAIS SÃO PAULO,12
PIRASSUNUNGA,DEPUTADO ESTADUAL,SIMÃO PEDRO,SIMÃO PEDRO CHIOVETTI,ELEITO,PT,SOMOS MAIS SÃO PAULO,127
PIRASSUNUNGA,DEPUTADO ESTADUAL,RUI FALCÃO,RUI GOETHE DA COSTA FALCÃO,ELEITO,PT,SOMOS MAIS SÃO PAULO,1
PIRASSUNUNGA,DEPUTADO ESTADUAL,DUDU BOLITO,AMARILDO DUDU BOLITO,SUPLENTE,PT,SOMOS MAIS SÃO PAULO,21
PIRASSUNUNGA,DEPUTADO ESTADUAL,ÉMERSON TAUYL,EMERSON LIMA TAUYL,SUPLENTE,PT,SOMOS MAIS SÃO PAULO,1
PIRASSUNUNGA,DEPUTADO ESTADUAL,ANTONIO MENTOR,ANTONIO MENTOR DE MELLO SOBRINHO,ELEITO,PT,SOMOS MAIS SÃO PAULO,61
PIRASSUNUNGA,DEPUTADO ESTADUAL,CRISTINA DA USP,CRISTINA SIMOES,SUPLENTE,PT,SOMOS MAIS SÃO PAULO,2
PIRASSUNUNGA,DEPUTADO ESTADUAL,PADRE JUZEMILDO,JUZEMILDO ALBINO DA SILVA,SUPLENTE,PT,SOMOS MAIS SÃO PAULO,6
PIRASSUNUNGA,DEPUTADO ESTADUAL,ADRIANO DIOGO,ADRIANO DIOGO,ELEITO,PT,SOMOS MAIS SÃO PAULO,4
PIRASSUNUNGA,DEPUTADO ESTADUAL,PROFESSOR MATIAS VIEIRA,MATIAS VIEIRA,SUPLENTE,PT,SOMOS MAIS SÃO PAULO,1
PIRASSUNUNGA,DEPUTADO ESTADUAL,ESTELA ALMAGRO,ESTELA ALEXANDRE ALMAGRO,SUPLENTE,PT,SOMOS MAIS SÃO PAULO,16
PIRASSUNUNGA,DEPUTADO ESTADUAL,LUIZ CLAUDIO MARCOLINO,LUIZ CLAUDIO MARCOLINO,ELEITO,PT,SOMOS MAIS SÃO PAULO,2
PIRASSUNUNGA,DEPUTADO ESTADUAL,NATIVIDADE,MARIA DA NATIVIDADE PEREIRA LIMA,SUPLENTE,PT,SOMOS MAIS SÃO PAULO,2
PIRASSUNUNGA,DEPUTADO ESTADUAL,ROBERTO FELICIO,ROBERTO FELICIO,SUPLENTE,PT,SOMOS MAIS SÃO PAULO,48
PIRASSUNUNGA,DEPUTADO ESTADUAL,MARCIONILA,MARCIONILA APARECIDA DOS SANTOS,SUPLENTE,PT,SOMOS MAIS SÃO PAULO,1
PIRASSUNUNGA,DEPUTADO ESTADUAL,BETH SAHAO,ELISABETH SAHÃO,SUPLENTE,PT,SOMOS MAIS SÃO PAULO,49
PIRASSUNUNGA,DEPUTADO ESTADUAL,ADINAN ORTOLAN,JOSÉ ADINAN ORTOLAN,SUPLENTE,PT,SOMOS MAIS SÃO PAULO,8
PIRASSUNUNGA,DEPUTADO ESTADUAL,LELO PAGANI,LUIZ AURELIO PAGANI,SUPLENTE,PT,SOMOS MAIS SÃO PAULO,3
PIRASSUNUNGA,DEPUTADO ESTADUAL,TIÃOZINHO,SEBASTIÃO MOREIREA ARCANJO,SUPLENTE,PT,SOMOS MAIS SÃO PAULO,6
PIRASSUNUNGA,DEPUTADO ESTADUAL,VERA SABA,VERA LÚCIA SANTOS SABA,SUPLENTE,PT,SOMOS MAIS SÃO PAULO,1
PIRASSUNUNGA,DEPUTADO ESTADUAL,ISAC REIS,ISAC FRANCO DOS REIS,ELEITO,PT,SOMOS MAIS SÃO PAULO,3
PIRASSUNUNGA,DEPUTADO ESTADUAL,BRENO CORTELLA,BRENO ZANONI CORTELLA,SUPLENTE,PT,SOMOS MAIS SÃO PAULO,91
PIRASSUNUNGA,DEPUTADO ESTADUAL,ANA DO CARMO,ANA MARIA DO CARMO ROSSETO,ELEITO,PT,SOMOS MAIS SÃO PAULO,2
PIRASSUNUNGA,DEPUTADO ESTADUAL,MIRANDA,JOSÉ CARLOS MIRANDA,SUPLENTE,PT,SOMOS MAIS SÃO PAULO,1
PIRASSUNUNGA,DEPUTADO ESTADUAL,BETO CANGUSSU,LUIZ ROBERTO ALVES CANGUSSU,SUPLENTE,PT,SOMOS MAIS SÃO PAULO,1
PIRASSUNUNGA,DEPUTADO ESTADUAL,JOSÉ CANDIDO,JOSÉ DE SOUZA CÂNDIDO,MÉDIA,PT,SOMOS MAIS SÃO PAULO,25
PIRASSUNUNGA,DEPUTADO ESTADUAL,JOÃO ANTONIO,JOAO ANTONIO DA SILVA FILHO,ELEITO,PT,SOMOS MAIS SÃO PAULO,6
PIRASSUNUNGA,DEPUTADO ESTADUAL,GALLO,JURANDIR GALLO,SUPLENTE,PT,SOMOS MAIS SÃO PAULO,2
PIRASSUNUNGA,DEPUTADO ESTADUAL,LINEU NAVARRO,LUIZ ANTONIO NAVARRO MAGALHÃES LUZ,SUPLENTE,PT,SOMOS MAIS SÃO PAULO,76
PIRASSUNUNGA,DEPUTADO ESTADUAL,ZÉ ARISTEIA,JOSÉ ARISTEIA PEREIRA,SUPLENTE,PT,SOMOS MAIS SÃO PAULO,2
PIRASSUNUNGA,DEPUTADO ESTADUAL,SÉRGIO DESIDERÁ,SÉRGIO DESIDERÁ,SUPLENTE,PT,SOMOS MAIS SÃO PAULO,1
PIRASSUNUNGA,DEPUTADO ESTADUAL,ELISEU COSTA,ELISEU SILVA COSTA,SUPLENTE,PT,SOMOS MAIS SÃO PAULO,4
PIRASSUNUNGA,DEPUTADO ESTADUAL,TOFFOLI,JOSÉ TICIANO DIAS TOFFOLI,SUPLENTE,PT,SOMOS MAIS SÃO PAULO,1
PIRASSUNUNGA,DEPUTADO ESTADUAL,LUIZ MOURA,LUIZ DE MOURA PEREIRA,ELEITO,PT,SOMOS MAIS SÃO PAULO,2
PIRASSUNUNGA,DEPUTADO ESTADUAL,GILSON PELIZARO,GILSON DONIZETE PELIZARO,SUPLENTE,PT,SOMOS MAIS SÃO PAULO,1
PIRASSUNUNGA,DEPUTADO ESTADUAL,CARLOS NEDER,CARLOS ALBERTO PLETZ NEDER,SUPLENTE,PT,SOMOS MAIS SÃO PAULO,4
PIRASSUNUNGA,DEPUTADO ESTADUAL,MIOTTO,SEBASTIAO MIOTTO FILHO,SUPLENTE,PTB,PARTIDO TRABALHISTA BRASILEIRO,3
PIRASSUNUNGA,DEPUTADO ESTADUAL,JOTA SILVA,JOAO JORGE FERREIRA DA SILVA,SUPLENTE,PTB,PARTIDO TRABALHISTA BRASILEIRO,4
PIRASSUNUNGA,DEPUTADO ESTADUAL,LÉO ÁQUILLA,JADSON MENDES DE LIMA,SUPLENTE,PTB,PARTIDO TRABALHISTA BRASILEIRO,19
PIRASSUNUNGA,DEPUTADO ESTADUAL,EDSON VICTOR,EDSON RIOS VICTOR,SUPLENTE,PTB,PARTIDO TRABALHISTA BRASILEIRO,1
PIRASSUNUNGA,DEPUTADO ESTADUAL,LUIZ LAZARINI,LUIZ CARLOS LAZARINI,SUPLENTE,PTB,PARTIDO TRABALHISTA BRASILEIRO,2
PIRASSUNUNGA,DEPUTADO ESTADUAL,DR ANEZIO,ANEZIO VIEIRA DA SILVA,SUPLENTE,PTB,PARTIDO TRABALHISTA BRASILEIRO,38
PIRASSUNUNGA,DEPUTADO ESTADUAL,KLEBER LEITE,CLEVERSON SPERBER,SUPLENTE,PTB,PARTIDO TRABALHISTA BRASILEIRO,2
PIRASSUNUNGA,DEPUTADO ESTADUAL,EVANDRO COSTA NETO,EVANDRO COSTA NETO,SUPLENTE,PTB,PARTIDO TRABALHISTA BRASILEIRO,1
PIRASSUNUNGA,DEPUTADO ESTADUAL,CONTE LOPES,ROBERVAL CONTE LOPES LIMA,SUPLENTE,PTB,PARTIDO TRABALHISTA BRASILEIRO,19
PIRASSUNUNGA,DEPUTADO ESTADUAL,CAMPOS MACHADO,ANTONIO CARLOS DE CAMPOS MACHADO,ELEITO,PTB,PARTIDO TRABALHISTA BRASILEIRO,982
PIRASSUNUNGA,DEPUTADO ESTADUAL,VANDO,ORVANDO DA SILVA,SUPLENTE,PTB,PARTIDO TRABALHISTA BRASILEIRO,11
PIRASSUNUNGA,DEPUTADO ESTADUAL,GIL FONSECA,GILDO APARECIDO FONSECA,SUPLENTE,PTB,PARTIDO TRABALHISTA BRASILEIRO,1
PIRASSUNUNGA,DEPUTADO ESTADUAL,ROQUE BARBIERE - ROQUINHO,ROQUE BARBIERE,ELEITO,PTB,PARTIDO TRABALHISTA BRASILEIRO,13
PIRASSUNUNGA,DEPUTADO ESTADUAL,MOISES DA FUNERARIA,MOISES ANTONIO DE LIMA,SUPLENTE,PTB,PARTIDO TRABALHISTA BRASILEIRO,1
PIRASSUNUNGA,DEPUTADO ESTADUAL,CORONEL EDSON FERRARINI,EDSON FERRARINI,ELEITO,PTB,PARTIDO TRABALHISTA BRASILEIRO,18
PIRASSUNUNGA,DEPUTADO ESTADUAL,DANIEL OLIVEIRA,DANIEL DA SILVA OLIVEIRA,SUPLENTE,PTB,PARTIDO TRABALHISTA BRASILEIRO,1
PIRASSUNUNGA,DEPUTADO ESTADUAL,PROFESSOR MARCELO,MARCELO MIYAZAKI,SUPLENTE,PTB,PARTIDO TRABALHISTA BRASILEIRO,2
PIRASSUNUNGA,DEPUTADO ESTADUAL,PEDRO LIMA,PEDRO FERREIRA DE LIMA,SUPLENTE,PTB,PARTIDO TRABALHISTA BRASILEIRO,3
PIRASSUNUNGA,DEPUTADO ESTADUAL,RODRIGO MENDES,RODRIGO CLAUDIONOR MENDES,SUPLENTE,PTB,PARTIDO TRABALHISTA BRASILEIRO,5
PIRASSUNUNGA,DEPUTADO ESTADUAL,VAL,ENIVALDO RAMOS DE FREITAS,SUPLENTE,PTB,PARTIDO TRABALHISTA BRASILEIRO,2
PIRASSUNUNGA,DEPUTADO ESTADUAL,TARDELLI,ROBERTO TARDELLI,SUPLENTE,PTB,PARTIDO TRABALHISTA BRASILEIRO,106
PIRASSUNUNGA,DEPUTADO ESTADUAL,CIDO ESPANHA,APARECIDO ESPANHA,SUPLENTE,PTB,PARTIDO TRABALHISTA BRASILEIRO,4
PIRASSUNUNGA,DEPUTADO ESTADUAL,RUTHINEA CARVALHO,RUTHINEA DE CARVALHO,SUPLENTE,PTB,PARTIDO TRABALHISTA BRASILEIRO,3
PIRASSUNUNGA,DEPUTADO ESTADUAL,MARCELO MINGRONE,MARCELO SALVADOR MINGRONE,SUPLENTE,PTB,PARTIDO TRABALHISTA BRASILEIRO,1
PIRASSUNUNGA,DEPUTADO ESTADUAL,CELSO ITAROTI,CELSO ITAROTI CANCELIERI CERVA,SUPLENTE,PTB,PARTIDO TRABALHISTA BRASILEIRO,43
PIRASSUNUNGA,DEPUTADO ESTADUAL,WANESSA BOMFIM,WANESSA SOUSA BOMFIM,SUPLENTE,PTB,PARTIDO TRABALHISTA BRASILEIRO,2
PIRASSUNUNGA,DEPUTADO ESTADUAL,MAURICIO LUDOVICO,MAURICIO LUDOVICO DOS SANTOS,SUPLENTE,PTB,PARTIDO TRABALHISTA BRASILEIRO,58
PIRASSUNUNGA,DEPUTADO ESTADUAL,WALDIR AGNELLO,WALDIR AGNELLO,SUPLENTE,PTB,PARTIDO TRABALHISTA BRASILEIRO,44
PIRASSUNUNGA,DEPUTADO ESTADUAL,GILBERTO DO PRIMAVERA,GILBERTO WACHTLER,SUPLENTE,PTB,PARTIDO TRABALHISTA BRASILEIRO,19
PIRASSUNUNGA,DEPUTADO ESTADUAL,BALEIA ROSSI,LUIZ FELIPE BALEIA TENUTO ROSSI,ELEITO,PMDB,PARTIDO DO MOVIMENTO DEMOCRÁTICO BRASILEIRO,185
PIRASSUNUNGA,DEPUTADO ESTADUAL,DRA ADRIANA,ADRIANA DI NARDO SILVA,SUPLENTE,PMDB,PARTIDO DO MOVIMENTO DEMOCRÁTICO BRASILEIRO,8
PIRASSUNUNGA,DEPUTADO ESTADUAL,SARGENTO PRIETO,MARIANO PRIETO,SUPLENTE,PMDB,PARTIDO DO MOVIMENTO DEMOCRÁTICO BRASILEIRO,1
PIRASSUNUNGA,DEPUTADO ESTADUAL,THIAGO FERRARI,THIAGO DE MORAES FERRARI,SUPLENTE,PMDB,PARTIDO DO MOVIMENTO DEMOCRÁTICO BRASILEIRO,7
PIRASSUNUNGA,DEPUTADO ESTADUAL,DU TONIN,EDUARDO TONIN,SUPLENTE,PMDB,PARTIDO DO MOVIMENTO DEMOCRÁTICO BRASILEIRO,1
PIRASSUNUNGA,DEPUTADO ESTADUAL,IBRAIM,IBRAIM ANTONIO ABOU JOKH,SUPLENTE,PMDB,PARTIDO DO MOVIMENTO DEMOCRÁTICO BRASILEIRO,2
PIRASSUNUNGA,DEPUTADO ESTADUAL,CARUSO,JORGE LUIS CARUSO,ELEITO,PMDB,PARTIDO DO MOVIMENTO DEMOCRÁTICO BRASILEIRO,2
PIRASSUNUNGA,DEPUTADO ESTADUAL,SERGIO BERGAMASCO,ANTONIO SERGIO PIRES BERGAMASCO,SUPLENTE,PMDB,PARTIDO DO MOVIMENTO DEMOCRÁTICO BRASILEIRO,2
PIRASSUNUNGA,DEPUTADO ESTADUAL,MARQUINHOS SKALA,MARCOS DA SILVA MARQUES,SUPLENTE,PMDB,PARTIDO DO MOVIMENTO DEMOCRÁTICO BRASILEIRO,2
PIRASSUNUNGA,DEPUTADO ESTADUAL,VANESSA DAMO,VANESSA DAMO OROSCO,ELEITO,PMDB,PARTIDO DO MOVIMENTO DEMOCRÁTICO BRASILEIRO,5
PIRASSUNUNGA,DEPUTADO ESTADUAL,GILBERTO FRANÇA,GILBERTO CAETANO DE FRANÇA,SUPLENTE,PMDB,PARTIDO DO MOVIMENTO DEMOCRÁTICO BRASILEIRO,1
PIRASSUNUNGA,DEPUTADO ESTADUAL,CAMARGO,DOMINGOS FERREIRA DE CAMARGO,SUPLENTE,PMDB,PARTIDO DO MOVIMENTO DEMOCRÁTICO BRASILEIRO,2
PIRASSUNUNGA,DEPUTADO ESTADUAL,UEBE REZECK,UEBE REZECK,SUPLENTE,PMDB,PARTIDO DO MOVIMENTO DEMOCRÁTICO BRASILEIRO,8
PIRASSUNUNGA,DEPUTADO ESTADUAL,ITAMAR BORGES,ITAMAR FRANCISCO MACHADO BORGES,MÉDIA,PMDB,PARTIDO DO MOVIMENTO DEMOCRÁTICO BRASILEIRO,33
PIRASSUNUNGA,DEPUTADO ESTADUAL,JONAS,JONAS PEREIRA DE LIMA,SUPLENTE,PMDB,PARTIDO DO MOVIMENTO DEMOCRÁTICO BRASILEIRO,1
PIRASSUNUNGA,DEPUTADO ESTADUAL,DITINHO MATHEUS,BENEDITO MATHEUS FILHO,SUPLENTE,PMDB,PARTIDO DO MOVIMENTO DEMOCRÁTICO BRASILEIRO,4
PIRASSUNUNGA,DEPUTADO ESTADUAL,MARIA DO CARMO GUILHERME,MARIA DO CARMO GUILHERME,SUPLENTE,PMDB,PARTIDO DO MOVIMENTO DEMOCRÁTICO BRASILEIRO,8
PIRASSUNUNGA,DEPUTADO ESTADUAL,SOUZA VIGILANTE,JOSÉ CLAUDIVAM DOS SANTOS SOUZA,SUPLENTE,PMDB,PARTIDO DO MOVIMENTO DEMOCRÁTICO BRASILEIRO,1
PIRASSUNUNGA,DEPUTADO ESTADUAL,JOOJI HATO,JOOJI HATO,ELEITO,PMDB,PARTIDO DO MOVIMENTO DEMOCRÁTICO BRASILEIRO,8
PIRASSUNUNGA,DEPUTADO ESTADUAL,DR. HENRIQUE CARVALHO,HENRIQUE SIMÕES MARTINS DE CARVALHO,SUPLENTE,PMDB,PARTIDO DO MOVIMENTO DEMOCRÁTICO BRASILEIRO,15
PIRASSUNUNGA,DEPUTADO ESTADUAL,REGINA MARIANO,MARIA REGINA LEAL MARIANO,SUPLENTE,PMDB,PARTIDO DO MOVIMENTO DEMOCRÁTICO BRASILEIRO,1
PIRASSUNUNGA,DEPUTADO ESTADUAL,ANA PAULA ROSSI,ANA PAULA ROSSI DE ALMEIDA MAGDESIAN,SUPLENTE,PMDB,PARTIDO DO MOVIMENTO DEMOCRÁTICO BRASILEIRO,1
PIRASSUNUNGA,DEPUTADO ESTADUAL,COUTINHO JUNIOR,OSWALDO BARBOSA COUTINHO JUNIOR,SUPLENTE,PMDB,PARTIDO DO MOVIMENTO DEMOCRÁTICO BRASILEIRO,4
PIRASSUNUNGA,DEPUTADO ESTADUAL,OLIVEIRA JUNIOR,ELIO APARECIDO DE OLIVEIRA,SUPLENTE,PSC,HUMANISTA CRISTÃO ,4
PIRASSUNUNGA,DEPUTADO ESTADUAL,APOSTOLO EURIPEDES,EURIPEDES LUIZ DE SOUSA,SUPLENTE,PSC,HUMANISTA CRISTÃO ,4
PIRASSUNUNGA,DEPUTADO ESTADUAL,ALAN NETO,ANTONIO CARLOS BARBOSA NEVES,SUPLENTE,PSC,HUMANISTA CRISTÃO ,9
PIRASSUNUNGA,DEPUTADO ESTADUAL,DR. CLAUDIO MIRANDA,CLAUDIO ERNANI MARCONDES DE MIRANDA,SUPLENTE,PSC,HUMANISTA CRISTÃO ,4
PIRASSUNUNGA,DEPUTADO ESTADUAL,DR. CALE,CARLOS EDUARDO ANTUNES DE OLIVEIRA,SUPLENTE,PSC,HUMANISTA CRISTÃO ,3
PIRASSUNUNGA,DEPUTADO ESTADUAL,LELIS TRAJANO,LELIS JOSE TRAJANO,SUPLENTE,PSC,HUMANISTA CRISTÃO ,34
PIRASSUNUNGA,DEPUTADO ESTADUAL,SIMONE HIEDA,SIMONE MICHICO GAVA HIEDA,SUPLENTE,PSC,HUMANISTA CRISTÃO ,1
PIRASSUNUNGA,DEPUTADO ESTADUAL,PASTOR VIEIRA ROCHA,JOSE VIEIRA ROCHA,SUPLENTE,PSC,HUMANISTA CRISTÃO ,8
PIRASSUNUNGA,DEPUTADO ESTADUAL,PR. CARLOS CEZAR,CARLOS CEZAR DA SILVA,ELEITO,PSC,HUMANISTA CRISTÃO ,4
PIRASSUNUNGA,DEPUTADO ESTADUAL,MARTA LIVIA SUPLICY,MARTA LIVIA BARRAGANA FERNANDES SUPLICY,SUPLENTE,PSC,HUMANISTA CRISTÃO ,3
PIRASSUNUNGA,DEPUTADO ESTADUAL,LUIZ LAURO,LUIZ LAURO FERREIRA,SUPLENTE,PSC,HUMANISTA CRISTÃO ,3
PIRASSUNUNGA,DEPUTADO ESTADUAL,CARLINHOS BOMBEIRO,ANTONIO CARLOS ALVES,SUPLENTE,PSC,HUMANISTA CRISTÃO ,1
PIRASSUNUNGA,DEPUTADO ESTADUAL,ADILSON ROSSI,ADILSON ROSSI,ELEITO,PSC,HUMANISTA CRISTÃO ,9
PIRASSUNUNGA,DEPUTADO ESTADUAL,RENATO PUPO,RENATO PUPO DE PAULA,SUPLENTE,PSC,HUMANISTA CRISTÃO ,11
PIRASSUNUNGA,DEPUTADO ESTADUAL,PASTOR JOÃO LUIZ NETO,JOÃO LUIZ NETO,SUPLENTE,PSC,HUMANISTA CRISTÃO ,1
PIRASSUNUNGA,DEPUTADO ESTADUAL,MARIA DO CARMO PIUNTI,MARIA DO CARMO THOMAZ PIUNTI,SUPLENTE,PSC,HUMANISTA CRISTÃO ,5
PIRASSUNUNGA,DEPUTADO ESTADUAL,CANDIDO,JOELSON CANDIDO DE OLIVEIRA,SUPLENTE,PSC,HUMANISTA CRISTÃO ,1
PIRASSUNUNGA,DEPUTADO ESTADUAL,GUSTAVO POZZI,GUSTAVO CAETANO POZZI DA CUNHA,SUPLENTE,PSC,HUMANISTA CRISTÃO ,4
PIRASSUNUNGA,DEPUTADO ESTADUAL,SAID MOURAD,AHMAD SAID MOURAD,SUPLENTE,PSC,HUMANISTA CRISTÃO ,18
PIRASSUNUNGA,DEPUTADO ESTADUAL,RODRIGO MORAES,RODRIGO AUGUSTO MORAES,ELEITO,PSC,HUMANISTA CRISTÃO ,57
PIRASSUNUNGA,DEPUTADO ESTADUAL,EDUARDO MARTINS,EDUARDO MARTINS BATISTA,SUPLENTE,PSC,HUMANISTA CRISTÃO ,1
PIRASSUNUNGA,DEPUTADO ESTADUAL,BRAZ PASSARINHEIRO,BRAZ ANASTACIO DA SILVA,SUPLENTE,PSC,HUMANISTA CRISTÃO ,5
PIRASSUNUNGA,DEPUTADO ESTADUAL,LEONARDO QUEIROZ,LEONARDO SANTOS QUEIROZ,SUPLENTE,PSC,HUMANISTA CRISTÃO ,16
PIRASSUNUNGA,DEPUTADO ESTADUAL,ABEL FOTOGRAFO,ABEL DE OLIVEIRA,SUPLENTE,PSC,HUMANISTA CRISTÃO ,3
PIRASSUNUNGA,DEPUTADO ESTADUAL,NELSON RODRIGUES,NELSON DOS SANTOS RODRIGUES,SUPLENTE,PSC,HUMANISTA CRISTÃO ,1
PIRASSUNUNGA,DEPUTADO ESTADUAL,PRIMO,PRIMO ALEXANDRE MANGIALARGO,SUPLENTE,PSC,HUMANISTA CRISTÃO ,1
PIRASSUNUNGA,DEPUTADO ESTADUAL,WALTER GOMES,WALTER GOMES DE OLIVEIRA,SUPLENTE,PR,SOMOS MAIS SÃO PAULO,16
PIRASSUNUNGA,DEPUTADO ESTADUAL,PAULO CORREA,PAULO HENRIQUE CORREA,SUPLENTE,PR,SOMOS MAIS SÃO PAULO,4
PIRASSUNUNGA,DEPUTADO ESTADUAL,ZE PEDRO,JOSE PEDRO LEITE DA SILVA,SUPLENTE,PR,SOMOS MAIS SÃO PAULO,27
PIRASSUNUNGA,DEPUTADO ESTADUAL,LILI AIMAR,LILIANA MEDEIROS DE ALMEIDA AYMAR BECHARA,SUPLENTE,PR,SOMOS MAIS SÃO PAULO,3
PIRASSUNUNGA,DEPUTADO ESTADUAL,ALEXANDRE DA FARMACIA,ALEXANDRE JOSE DA CUNHA,SUPLENTE,PR,SOMOS MAIS SÃO PAULO,1
PIRASSUNUNGA,DEPUTADO ESTADUAL,PATRICIA LIMA,PATRICIA FREITAS LIMA,SUPLENTE,PR,SOMOS MAIS SÃO PAULO,14
PIRASSUNUNGA,DEPUTADO ESTADUAL,TONINHO PAIVA,ANTONIO DE PAIVA MONTEIRO FILHO,SUPLENTE,PR,SOMOS MAIS SÃO PAULO,1
PIRASSUNUNGA,DEPUTADO ESTADUAL,OSVALDO VERGINIO,OSVALDO VERGINIO DA SILVA,SUPLENTE,PR,SOMOS MAIS SÃO PAULO,3
PIRASSUNUNGA,DEPUTADO ESTADUAL,JOSE JANTALIA,JOSE ANTONIO JANTALIA,SUPLENTE,PR,SOMOS MAIS SÃO PAULO,1
PIRASSUNUNGA,DEPUTADO ESTADUAL,ANDRE DO PRADO,ANDRE LUIS DO PRADO,ELEITO,PR,SOMOS MAIS SÃO PAULO,3
PIRASSUNUNGA,DEPUTADO ESTADUAL,JOSE CARLOS SOARES,JOSE CARLOS SOARES,SUPLENTE,PPS,PARTIDO POPULAR SOCIALISTA,10
PIRASSUNUNGA,DEPUTADO ESTADUAL,EDUARDO NATALI,EDUARDO NANTES NATALI,SUPLENTE,PPS,PARTIDO POPULAR SOCIALISTA,2
PIRASSUNUNGA,DEPUTADO ESTADUAL,DOLIVAL DIOGENES,DOLIVAL DIOGENES SAMPAIO ANTONACIO,SUPLENTE,PPS,PARTIDO POPULAR SOCIALISTA,1
