BARIRI,PRESIDENTE,DILMA,DILMA VANA ROUSSEFF,2º TURNO,PT,PARA O BRASIL SEGUIR MUDANDO,3841
BARIRI,PRESIDENTE,JOSÉ SERRA,JOSÉ SERRA,2º TURNO,PSDB,O BRASIL PODE MAIS,9455
BARIRI,GOVERNADOR,GERALDO ALCKMIN,GERALDO JOSE RODRIGUES ALCKMIN FILHO,ELEITO,PSDB,UNIDOS POR SÃO PAULO,10554
BARIRI,SENADOR,MARTA SUPLICY,MARTA SUPLICY,ELEITO,PT,UNIÃO PARA MUDAR,3342
BARIRI,SENADOR,ALOYSIO NUNES,ALOYSIO NUNES FERREIRA FILHO,ELEITO,PSDB,UNIDOS POR SÃO PAULO,10369
BARIRI,DEPUTADO FEDERAL,DR. ELIEZER COSTA,ELIEZER NASCIMENTO DA COSTA,SUPLENTE,PRB,JUNTOS POR SÃO PAULO,2
BARIRI,DEPUTADO FEDERAL,CÉSAR CRUZ GARCIA,CESAR CRUZ GARCIA,SUPLENTE,PRB,JUNTOS POR SÃO PAULO,2
BARIRI,DEPUTADO FEDERAL,ANTONIO BULHÕES,ANTONIO CARLOS MARTINS DE BULHÕES,ELEITO,PRB,JUNTOS POR SÃO PAULO,5
BARIRI,DEPUTADO FEDERAL,OTONIEL LIMA,OTONIEL CARLOS DE LIMA,MÉDIA,PRB,JUNTOS POR SÃO PAULO,55
BARIRI,DEPUTADO FEDERAL,ERO,EROALDO DE OLIVEIRA MOURÃO,SUPLENTE,PRB,JUNTOS POR SÃO PAULO,1
BARIRI,DEPUTADO FEDERAL,JEFERSON CAMILLO,JEFERSON CAMILLO DE OLIVEIRA,SUPLENTE,PP,PARTIDO PROGRESSISTA,3
BARIRI,DEPUTADO FEDERAL,DR JOSÉ CLAUDIO,JOSE CLAUDIO MANCILHA DE FARIA BARBOSA,SUPLENTE,PP,PARTIDO PROGRESSISTA,2
BARIRI,DEPUTADO FEDERAL,MALUF,PAULO SALIM MALUF,ELEITO,PP,PARTIDO PROGRESSISTA,171
BARIRI,DEPUTADO FEDERAL,RUBENEUTON OLIVEIRA LIMA,RUBENEUTON OLIVEIRA LIMA,SUPLENTE,PP,PARTIDO PROGRESSISTA,1
BARIRI,DEPUTADO FEDERAL,CARLOS OCTAVIANI,JOSÉ CARLOS OCTAVIANI,SUPLENTE,PP,PARTIDO PROGRESSISTA,88
BARIRI,DEPUTADO FEDERAL,SANAZAR,EDUARDO SANASSAR FONSECA,SUPLENTE,PP,PARTIDO PROGRESSISTA,1
BARIRI,DEPUTADO FEDERAL,CAPITÃO GOMES,CARLOS GOMES DA SILVA,SUPLENTE,PP,PARTIDO PROGRESSISTA,2
BARIRI,DEPUTADO FEDERAL,RENATO REICHANN,RUY RENATO REICHMANN,SUPLENTE,PP,PARTIDO PROGRESSISTA,1
BARIRI,DEPUTADO FEDERAL,MAURICIO MARTINS,MAURICIO LUIS MARTINS,SUPLENTE,PP,PARTIDO PROGRESSISTA,1
BARIRI,DEPUTADO FEDERAL,PEDRINHO BARACAT,ASSAD NACLE BARACAT,SUPLENTE,PP,PARTIDO PROGRESSISTA,1
BARIRI,DEPUTADO FEDERAL,ALINE CORREA,ALINE LEMOS CORREA DE OLIVEIRA ANDRADE,ELEITO,PP,PARTIDO PROGRESSISTA,2
BARIRI,DEPUTADO FEDERAL,PAULO BASSOLI,PAULO SERGIO BONGATER BASSOLI,SUPLENTE,PP,PARTIDO PROGRESSISTA,3
BARIRI,DEPUTADO FEDERAL,TELLES,DOMINGOS TELLES SANCHES,SUPLENTE,PP,PARTIDO PROGRESSISTA,2
BARIRI,DEPUTADO FEDERAL,DRA ADRIANA DA COSTA,ADRIANA ALVARES DA COSTA DE PAULA ALVES,SUPLENTE,PP,PARTIDO PROGRESSISTA,2
BARIRI,DEPUTADO FEDERAL,BETO MANSUR,PAULO ROBERTO GOMES MANSUR,ELEITO,PP,PARTIDO PROGRESSISTA,4
BARIRI,DEPUTADO FEDERAL,ADHEMAR DE BARROS FILHO,ADHEMAR DE BARROS FILHO,SUPLENTE,PP,PARTIDO PROGRESSISTA,3
BARIRI,DEPUTADO FEDERAL,MISSIONÁRIO JOSÉ OLIMPIO,JOSÉ OLIMPIO SILVEIRA MORAES,ELEITO,PP,PARTIDO PROGRESSISTA,88
BARIRI,DEPUTADO FEDERAL,FERNANDO STANCATTI,FERNANDO CESAR STANCATTI MARQUES,SUPLENTE,PP,PARTIDO PROGRESSISTA,1
BARIRI,DEPUTADO FEDERAL,DR NECHAR,SERGIO ANTONIO NECHAR,SUPLENTE,PP,PARTIDO PROGRESSISTA,3
BARIRI,DEPUTADO FEDERAL,JOÃO DADO,JOÃO EDUARDO DADO LEITE DE CARVALHO,ELEITO,PDT,PARTIDO DEMOCRÁTICO TRABALHISTA,12
BARIRI,DEPUTADO FEDERAL,PAULINHO DA FORÇA,PAULO PEREIRA DA SILVA,ELEITO,PDT,PARTIDO DEMOCRÁTICO TRABALHISTA,30
BARIRI,DEPUTADO FEDERAL,ELISEU DANIEL,ELISEU DANIEL DOS SANTOS,SUPLENTE,PDT,PARTIDO DEMOCRÁTICO TRABALHISTA,1
BARIRI,DEPUTADO FEDERAL,GUSTAVO STUPP,LUIZ GUSTAVO ANTUNES STUPP,SUPLENTE,PDT,PARTIDO DEMOCRÁTICO TRABALHISTA,1
BARIRI,DEPUTADO FEDERAL,KAREN HEINS,KAREN MAYELLEN TONIM HEINS,SUPLENTE,PDT,PARTIDO DEMOCRÁTICO TRABALHISTA,1
BARIRI,DEPUTADO FEDERAL,PEDRO BAPTISTINI,PEDRO ANTONIO BAPTISTINI,SUPLENTE,PDT,PARTIDO DEMOCRÁTICO TRABALHISTA,2
BARIRI,DEPUTADO FEDERAL,MEDEIROS,LUIZ ANTONIO DE MEDEIROS NETO,SUPLENTE,PDT,PARTIDO DEMOCRÁTICO TRABALHISTA,2
BARIRI,DEPUTADO FEDERAL,DR LUIZ CHIAPARINE,LUIZ CARLOS CHIAPARINE,SUPLENTE,PDT,PARTIDO DEMOCRÁTICO TRABALHISTA,13
BARIRI,DEPUTADO FEDERAL,MANOEL ANTUNES,MANOEL ANTUNES,SUPLENTE,PDT,PARTIDO DEMOCRÁTICO TRABALHISTA,2
BARIRI,DEPUTADO FEDERAL,DEF.BIODIESEL-SILASEDUARDOINKE,SILAS EDUARDO INKE,SUPLENTE,PDT,PARTIDO DEMOCRÁTICO TRABALHISTA,1
BARIRI,DEPUTADO FEDERAL,CARLOS HENRIQUE,CARLOS HENRIQUE PINTO,SUPLENTE,PDT,PARTIDO DEMOCRÁTICO TRABALHISTA,2
BARIRI,DEPUTADO FEDERAL,DRA DEBORA,DEBORA MARIA MARAGNI PEREIRA DE ABREU,SUPLENTE,PDT,PARTIDO DEMOCRÁTICO TRABALHISTA,3
BARIRI,DEPUTADO FEDERAL,SALVADOR ZIMBALDI,SALVADOR ZIMBALDI FILHO,MÉDIA,PDT,PARTIDO DEMOCRÁTICO TRABALHISTA,42
BARIRI,DEPUTADO FEDERAL,LINDOLFO DOS SANTOS,LINDOLFO LUIZ DOS SANTOS NETO,SUPLENTE,PDT,PARTIDO DEMOCRÁTICO TRABALHISTA,2
BARIRI,DEPUTADO FEDERAL,MAGAIVER,EDILSON MAGAIVER FERREIRA DA SILVA,SUPLENTE,PDT,PARTIDO DEMOCRÁTICO TRABALHISTA,1
BARIRI,DEPUTADO FEDERAL,IVANIO BATISTA,IVANIO BATISTA DA SILVA,SUPLENTE,PT,JUNTOS POR SÃO PAULO,1
BARIRI,DEPUTADO FEDERAL,VICENTE CANDIDO,VICENTE CANDIDO DA SILVA,ELEITO,PT,JUNTOS POR SÃO PAULO,7
BARIRI,DEPUTADO FEDERAL,GERALDINHO O ILUMINADO,GERALDO ALVES DIONISIO,SUPLENTE,PT,JUNTOS POR SÃO PAULO,2
BARIRI,DEPUTADO FEDERAL,IARA BERNARDI,IARA BERNARDI,SUPLENTE,PT,JUNTOS POR SÃO PAULO,4
BARIRI,DEPUTADO FEDERAL,LARGUESA,LUIS VANDERLEI LARGUESA,SUPLENTE,PT,JUNTOS POR SÃO PAULO,13
BARIRI,DEPUTADO FEDERAL,VACCAREZZA,CANDIDO ELPIDIO DE SOUZA VACCAREZZA,ELEITO,PT,JUNTOS POR SÃO PAULO,125
BARIRI,DEPUTADO FEDERAL,GENOINO,JOSÉ GENOÍNO NETO,SUPLENTE,PT,JUNTOS POR SÃO PAULO,70
BARIRI,DEPUTADO FEDERAL,HELCIO SILVA,HELCIO ANTONIO DA SILVA,SUPLENTE,PT,JUNTOS POR SÃO PAULO,1
BARIRI,DEPUTADO FEDERAL,MISA BOITO,MARIA EMILIA SEDEH BOITO,SUPLENTE,PT,JUNTOS POR SÃO PAULO,6
BARIRI,DEPUTADO FEDERAL,NEWTON LIMA NETO,NEWTON LIMA NETO,ELEITO,PT,JUNTOS POR SÃO PAULO,7
BARIRI,DEPUTADO FEDERAL,FILIPPI,JOSÉ DE FILIPPI JÚNIOR,ELEITO,PT,JUNTOS POR SÃO PAULO,2
BARIRI,DEPUTADO FEDERAL,ARLINDO CHINAGLIA,ARLINDO CHIGNALIA JUNIOR,ELEITO,PT,JUNTOS POR SÃO PAULO,152
BARIRI,DEPUTADO FEDERAL,JOÃO PAULO CUNHA,JOÃO PAULO CUNHA,ELEITO,PT,JUNTOS POR SÃO PAULO,9
BARIRI,DEPUTADO FEDERAL,ROQUE FERREIRA,ROQUE JOSÉ FERREIRA,SUPLENTE,PT,JUNTOS POR SÃO PAULO,16
BARIRI,DEPUTADO FEDERAL,PIVATTO,JOSÉ PIVATTO,SUPLENTE,PT,JUNTOS POR SÃO PAULO,1
BARIRI,DEPUTADO FEDERAL,RICARDO BERZOINI,RICARDO JOSE RIBEIRO BERZOINI,ELEITO,PT,JUNTOS POR SÃO PAULO,14
BARIRI,DEPUTADO FEDERAL,PROF. CARLÃO RAMIRO,CARLOS RAMIRO CASTRO,SUPLENTE,PT,JUNTOS POR SÃO PAULO,3
BARIRI,DEPUTADO FEDERAL,FÉLIX SAHÃO,FÉLIX SAHÃO JÚNIOR,SUPLENTE,PT,JUNTOS POR SÃO PAULO,6
BARIRI,DEPUTADO FEDERAL,ROGÉRIO PINTO,ROGÉRIO PINTO FERNANDES,SUPLENTE,PT,JUNTOS POR SÃO PAULO,1
BARIRI,DEPUTADO FEDERAL,VANDERLEI SIRAQUE,VANDERLEI SIRAQUE,SUPLENTE,PT,JUNTOS POR SÃO PAULO,3
BARIRI,DEPUTADO FEDERAL,JILMAR TATTO,JILMAR AUGUSTINHO TATTO,ELEITO,PT,JUNTOS POR SÃO PAULO,1
BARIRI,DEPUTADO FEDERAL,EDSON DA PAZ (O CANTOR),EDSON DA PAZ,SUPLENTE,PT,JUNTOS POR SÃO PAULO,1
BARIRI,DEPUTADO FEDERAL,RUBINHO BASTOS,RUBENS BASTOS DO NASCIMENTO,SUPLENTE,PT,JUNTOS POR SÃO PAULO,3
BARIRI,DEPUTADO FEDERAL,CARLOS AQUINO,JOSÉ CARLOS DE AQUINO,SUPLENTE,PT,JUNTOS POR SÃO PAULO,1
BARIRI,DEPUTADO FEDERAL,RENATO SIMÕES,RENATO SIMÕES,SUPLENTE,PT,JUNTOS POR SÃO PAULO,2
BARIRI,DEPUTADO FEDERAL,DEVANIR RIBEIRO,DEVANIR RIBEIRO,ELEITO,PT,JUNTOS POR SÃO PAULO,280
BARIRI,DEPUTADO FEDERAL,ZARATTINI,CARLOS ALBERTO ROLIM ZARATTINI,ELEITO,PT,JUNTOS POR SÃO PAULO,2
BARIRI,DEPUTADO FEDERAL,DR RONALDO BRESCIANI,RONALDO JOSÉ BRESCIANI,SUPLENTE,PT,JUNTOS POR SÃO PAULO,1
BARIRI,DEPUTADO FEDERAL,JANETE PIETÁ,JANETE ROCHA PIETÁ,ELEITO,PT,JUNTOS POR SÃO PAULO,1
BARIRI,DEPUTADO FEDERAL,VICENTINHO,VICENTE PAULO DA SILVA,ELEITO,PT,JUNTOS POR SÃO PAULO,335
BARIRI,DEPUTADO FEDERAL,DOUGLAS MOREIRA,DOUGLAS SIMAS MOREIRA,SUPLENTE,PT,JUNTOS POR SÃO PAULO,1
BARIRI,DEPUTADO FEDERAL,PAULO TEIXEIRA,LUIZ PAULO TEIXEIRA FERREIRA,ELEITO,PT,JUNTOS POR SÃO PAULO,3
BARIRI,DEPUTADO FEDERAL,CLAURY,CLAURY SANTOS ALVES DA SILVA,SUPLENTE,PTB,PARTIDO TRABALHISTA BRASILEIRO,2
BARIRI,DEPUTADO FEDERAL,VAMPETA,MARCOS ANDRE BATISTA SANTOS,SUPLENTE,PTB,PARTIDO TRABALHISTA BRASILEIRO,4
BARIRI,DEPUTADO FEDERAL,WANDA CORRÊA,VANDERLEIA APARECIDA CORREA,SUPLENTE,PTB,PARTIDO TRABALHISTA BRASILEIRO,1
BARIRI,DEPUTADO FEDERAL,NADUR,ADALBERTO NADUR,SUPLENTE,PTB,PARTIDO TRABALHISTA BRASILEIRO,2
BARIRI,DEPUTADO FEDERAL,SANTANA,JOSE SANTANA DE ABREU,SUPLENTE,PTB,PARTIDO TRABALHISTA BRASILEIRO,2
BARIRI,DEPUTADO FEDERAL,PIRU,CLAUDIO AFFONSO,SUPLENTE,PTB,PARTIDO TRABALHISTA BRASILEIRO,2
BARIRI,DEPUTADO FEDERAL,ROBSON TUMA,ROBSON TUMA,SUPLENTE,PTB,PARTIDO TRABALHISTA BRASILEIRO,307
BARIRI,DEPUTADO FEDERAL,RICARDO OLIVEIRA,RICARDO JOSE DE OLIVEIRA,SUPLENTE,PTB,PARTIDO TRABALHISTA BRASILEIRO,6
BARIRI,DEPUTADO FEDERAL,EDNA REGINA,EDNA REGINA RUCCIRETA EMERENCIANO,SUPLENTE,PTB,PARTIDO TRABALHISTA BRASILEIRO,1
BARIRI,DEPUTADO FEDERAL,DR SILNEY BERALDO,SILNEY MARCOS BERALDO,SUPLENTE,PTB,PARTIDO TRABALHISTA BRASILEIRO,2
BARIRI,DEPUTADO FEDERAL,NELSON MARQUEZELLI,NELSON MARQUEZELLI,ELEITO,PTB,PARTIDO TRABALHISTA BRASILEIRO,64
BARIRI,DEPUTADO FEDERAL,CELSO MENDES,CELSO MENDES CÚTALO,SUPLENTE,PTB,PARTIDO TRABALHISTA BRASILEIRO,1
BARIRI,DEPUTADO FEDERAL,WALDOMIRO RAMOS,WALDOMIRO CARLOS RAMOS,SUPLENTE,PTB,PARTIDO TRABALHISTA BRASILEIRO,3
BARIRI,DEPUTADO FEDERAL,DR MOYSES,JOAO MOYSES ABUJADI,SUPLENTE,PTB,PARTIDO TRABALHISTA BRASILEIRO,2
BARIRI,DEPUTADO FEDERAL,CIDA ALVES,MARIA APARECIDA ALVES DA ROCHA,SUPLENTE,PTB,PARTIDO TRABALHISTA BRASILEIRO,1
BARIRI,DEPUTADO FEDERAL,MALU PARISI,LUIZA FAUSTINO PEREIRA PARI,SUPLENTE,PTB,PARTIDO TRABALHISTA BRASILEIRO,1
BARIRI,DEPUTADO FEDERAL,IRMÃO TIÃOZINHO SOLDADOR,SEBASTIÃO FABIANO FERREIRA DA CRUZ,SUPLENTE,PTB,PARTIDO TRABALHISTA BRASILEIRO,1
BARIRI,DEPUTADO FEDERAL,ARNALDO FARIA DE SÁ,ARNALDO FARIA DE SÁ,ELEITO,PTB,PARTIDO TRABALHISTA BRASILEIRO,63
BARIRI,DEPUTADO FEDERAL,CELIO DINIZ,CELIO FRANCISCO DINIZ,SUPLENTE,PTB,PARTIDO TRABALHISTA BRASILEIRO,1
BARIRI,DEPUTADO FEDERAL,CHARLES CAVALCANTE,FRANCISCO CARLOS BARROS CAVALCANTE,SUPLENTE,PTB,PARTIDO TRABALHISTA BRASILEIRO,1
BARIRI,DEPUTADO FEDERAL,PASTORA SUELY LOPES,SUELY CARNEIRO LOPES,SUPLENTE,PTB,PARTIDO TRABALHISTA BRASILEIRO,1
BARIRI,DEPUTADO FEDERAL,FRANK AGUIAR,FRANCINETO LUZ DE AGUIAR,SUPLENTE,PTB,PARTIDO TRABALHISTA BRASILEIRO,9
BARIRI,DEPUTADO FEDERAL,PASTOR JOAO ALMEIDA,JOAO ALMEIDA DOS SANTOS,SUPLENTE,PTB,PARTIDO TRABALHISTA BRASILEIRO,2
BARIRI,DEPUTADO FEDERAL,PADRE FERNANDO,LAUDINEY FERNANDO SILVA FRAGA,SUPLENTE,PTB,PARTIDO TRABALHISTA BRASILEIRO,6
BARIRI,DEPUTADO FEDERAL,DR SEGURA,JOSE APARECIDO SEGURA RUIZ,SUPLENTE,PTB,PARTIDO TRABALHISTA BRASILEIRO,28
BARIRI,DEPUTADO FEDERAL,CORREA NETO,ARNALDO CORREA NETO,SUPLENTE,PTB,PARTIDO TRABALHISTA BRASILEIRO,1
BARIRI,DEPUTADO FEDERAL,NENÊ RÉSTIO,ANGELO ROBERTO RESTIO,SUPLENTE,PMDB,PARTIDO DO MOVIMENTO DEMOCRÁTICO BRASILEIRO,1
BARIRI,DEPUTADO FEDERAL,PAULINHO SOBRAL,PAULO MENDES SOBRAL,SUPLENTE,PMDB,PARTIDO DO MOVIMENTO DEMOCRÁTICO BRASILEIRO,1
BARIRI,DEPUTADO FEDERAL,BONFÁ,ALVARO BONFA JUNIOR,SUPLENTE,PMDB,PARTIDO DO MOVIMENTO DEMOCRÁTICO BRASILEIRO,1
BARIRI,DEPUTADO FEDERAL,EDUARDO COELHO,EDUARDO JOSÉ PEREIRA COELHO,SUPLENTE,PMDB,PARTIDO DO MOVIMENTO DEMOCRÁTICO BRASILEIRO,6
BARIRI,DEPUTADO FEDERAL,PILTON RIOS,PILTON RIOS DE BARROS FELIX PEREIRA,SUPLENTE,PMDB,PARTIDO DO MOVIMENTO DEMOCRÁTICO BRASILEIRO,4
BARIRI,DEPUTADO FEDERAL,SINIVAL,SINIVAL JOSE INACIO,SUPLENTE,PMDB,PARTIDO DO MOVIMENTO DEMOCRÁTICO BRASILEIRO,1
BARIRI,DEPUTADO FEDERAL,EDINHO ARAUJO,EDSON EDINHO COELHO ARAUJO,ELEITO,PMDB,PARTIDO DO MOVIMENTO DEMOCRÁTICO BRASILEIRO,17
BARIRI,DEPUTADO FEDERAL,CLERISTON VALLE,CLERISTON PEREIRA DO VALLE,SUPLENTE,PMDB,PARTIDO DO MOVIMENTO DEMOCRÁTICO BRASILEIRO,1
BARIRI,DEPUTADO FEDERAL,MORATO,JOSÉ ANTONIO MORATO,SUPLENTE,PMDB,PARTIDO DO MOVIMENTO DEMOCRÁTICO BRASILEIRO,1
BARIRI,DEPUTADO FEDERAL,PABLIO REBESSI,PABLIO JOSÉ REBESSI,SUPLENTE,PMDB,PARTIDO DO MOVIMENTO DEMOCRÁTICO BRASILEIRO,1
BARIRI,DEPUTADO FEDERAL,DR. SAMIR NASSBINE,SAMIR ASSAD NASSBINE,SUPLENTE,PMDB,PARTIDO DO MOVIMENTO DEMOCRÁTICO BRASILEIRO,1
BARIRI,DEPUTADO FEDERAL,SARGENTO SEVERO,LUCIANO APARECIDO SEVERO,SUPLENTE,PSL,PRESTE ATENÇÃO SÃO PAULO,1
BARIRI,DEPUTADO FEDERAL,EDER B2,EDER ALBERTO RAMOS MAXIMO,SUPLENTE,PSL,PRESTE ATENÇÃO SÃO PAULO,1
BARIRI,DEPUTADO FEDERAL,ROBERTO SIQUEIRA,ROBERTO SIQUEIRA GOMES,SUPLENTE,PSL,PRESTE ATENÇÃO SÃO PAULO,7
BARIRI,DEPUTADO FEDERAL,CORONEL GILSON LOPES,GILSON LOPES DA SILVA,SUPLENTE,PSC,HUMANISTA CRISTÃO ,2
BARIRI,DEPUTADO FEDERAL,CLEBER DELALIBERA,CLEBER DE MOURA DELALIBERA,SUPLENTE,PSC,HUMANISTA CRISTÃO ,176
BARIRI,DEPUTADO FEDERAL,MARCO FELICIANO,MARCO ANTONIO FELICIANO,ELEITO,PSC,HUMANISTA CRISTÃO ,265
BARIRI,DEPUTADO FEDERAL,MARCELO AGUIAR,MARCELO THEODORO DE AGUIAR,ELEITO,PSC,HUMANISTA CRISTÃO ,13
BARIRI,DEPUTADO FEDERAL,ARI BARCELLOS,JOSE DE ARIMATHEA BARCELLOS,SUPLENTE,PSC,HUMANISTA CRISTÃO ,1
BARIRI,DEPUTADO FEDERAL,GISON SOARES,GISON ALVES SOARES,SUPLENTE,PSC,HUMANISTA CRISTÃO ,1
BARIRI,DEPUTADO FEDERAL,REGIS DE OLIVEIRA,REGIS FERNANDES DE OLIVEIRA,SUPLENTE,PSC,HUMANISTA CRISTÃO ,97
BARIRI,DEPUTADO FEDERAL,NEY SANTOS,CLAUDINEI ALVES DOS SANTOS,SUPLENTE,PSC,HUMANISTA CRISTÃO ,2
BARIRI,DEPUTADO FEDERAL,DR.CARLOS FARIA,CARLOS EDUARDO DA SILVA FARIA,SUPLENTE,PSC,HUMANISTA CRISTÃO ,1
BARIRI,DEPUTADO FEDERAL,WAGNER FIOROTTO,WAGNER MONTEIRO FIOROTTO,SUPLENTE,PSC,HUMANISTA CRISTÃO ,1
BARIRI,DEPUTADO FEDERAL,DALVAN,JOÃO GOMES DE ALMEIDA,SUPLENTE,PSC,HUMANISTA CRISTÃO ,1
BARIRI,DEPUTADO FEDERAL,PR. LUIZ LEMOS,LUIZ CARLOS LEMOS,SUPLENTE,PSC,HUMANISTA CRISTÃO ,1
BARIRI,DEPUTADO FEDERAL,MAURÃO,JOSE MAURO PEREIRA DE BARROS,SUPLENTE,PSC,HUMANISTA CRISTÃO ,1
BARIRI,DEPUTADO FEDERAL,LEO,LEONARDO LEANDRO FRANÇA DE OLIVEIRA,SUPLENTE,PSC,HUMANISTA CRISTÃO ,1
BARIRI,DEPUTADO FEDERAL,PRICILA LEME,PRICILA HELENA MOYSES LEME,SUPLENTE,PSC,HUMANISTA CRISTÃO ,5
BARIRI,DEPUTADO FEDERAL,DR. CARALAMBOS,CARALAMBOS CONSTANTINO SOTIROPOULOS,SUPLENTE,PSC,HUMANISTA CRISTÃO ,3
BARIRI,DEPUTADO FEDERAL,TEO CHINAIA,TEO CHINAIA,SUPLENTE,PSC,HUMANISTA CRISTÃO ,1
BARIRI,DEPUTADO FEDERAL,MANOEL GASPAR,MANOEL FERREIRA DE SOUZA GASPAR,SUPLENTE,PSC,HUMANISTA CRISTÃO ,22
BARIRI,DEPUTADO FEDERAL,MAISENA,ROBINSON LUIZ DAMAS,SUPLENTE,PSC,HUMANISTA CRISTÃO ,3
BARIRI,DEPUTADO FEDERAL,JUCA CHAVES,JURANDYR CZACZKES CHAVES,SUPLENTE,PR,JUNTOS POR SÃO PAULO,6
BARIRI,DEPUTADO FEDERAL,AGNALDO TIMOTEO,AGUINALDO TIMOTEO PEREIRA,SUPLENTE,PR,JUNTOS POR SÃO PAULO,4
BARIRI,DEPUTADO FEDERAL,TIRIRICA,FRANCISCO EVERARDO OLIVEIRA SILVA,ELEITO,PR,JUNTOS POR SÃO PAULO,658
BARIRI,DEPUTADO FEDERAL,PR PAULO FREIRE,PAULO ROBERTO FREIRE DA COSTA,ELEITO,PR,JUNTOS POR SÃO PAULO,108
BARIRI,DEPUTADO FEDERAL,LUCIANA COSTA,LUCIANA DE ALMEIDA COSTA,SUPLENTE,PR,JUNTOS POR SÃO PAULO,4
BARIRI,DEPUTADO FEDERAL,MILTON MONTI,MILTON ANTONIO CASQUEL MONTI,ELEITO,PR,JUNTOS POR SÃO PAULO,187
BARIRI,DEPUTADO FEDERAL,VALDEMAR COSTA NETO,VALDEMAR COSTA NETO,ELEITO,PR,JUNTOS POR SÃO PAULO,6
BARIRI,DEPUTADO FEDERAL,LINDOMAR DE OLIVEIRA,LINDOMAR CUSTODIA DE OLIVEIRA,SUPLENTE,PPS,PSDB/DEM/PPS,1
BARIRI,DEPUTADO FEDERAL,WILLIAM WOO,WILLIAM BOSS WOO,SUPLENTE,PPS,PSDB/DEM/PPS,1
BARIRI,DEPUTADO FEDERAL,ROBERTO FREIRE,ROBERTO JOAO PEREIRA FREIRE,ELEITO,PPS,PSDB/DEM/PPS,40
BARIRI,DEPUTADO FEDERAL,CORONEL EDSON SARDANO,EDSON DE JESUS SARDANO,SUPLENTE,PPS,PSDB/DEM/PPS,2
BARIRI,DEPUTADO FEDERAL,DIMAS RAMALHO,DIMAS EDUARDO RAMALHO,ELEITO,PPS,PSDB/DEM/PPS,186
BARIRI,DEPUTADO FEDERAL,ARI FRIEDENBACH,ARI FRIEDENBACH,SUPLENTE,PPS,PSDB/DEM/PPS,15
BARIRI,DEPUTADO FEDERAL,JOSE ONERIO,JOSE ONERIO DA SILVA,SUPLENTE,PPS,PSDB/DEM/PPS,6
BARIRI,DEPUTADO FEDERAL,ARNALDO JARDIM,ARNALDO CALIL PEREIRA JARDIM,ELEITO,PPS,PSDB/DEM/PPS,3642
BARIRI,DEPUTADO FEDERAL,PROF POLLYANA GAMA,POLLYANA FATIMA GAMA SANTOS,SUPLENTE,PPS,PSDB/DEM/PPS,26
BARIRI,DEPUTADO FEDERAL,ANTENOR TOKO,ANTENOR DOS SANTOS TOKO,SUPLENTE,PPS,PSDB/DEM/PPS,2
BARIRI,DEPUTADO FEDERAL,JORGE TADEU,JORGE TADEU MUDALEN,ELEITO,DEM,PSDB/DEM/PPS,28
BARIRI,DEPUTADO FEDERAL,JORGINHO MALULY,JORGE DE FARIA MALULY,SUPLENTE,DEM,PSDB/DEM/PPS,19
BARIRI,DEPUTADO FEDERAL,KIKO DO KLB,FRANCO FINATO SCORNAVACCA,SUPLENTE,DEM,PSDB/DEM/PPS,24
BARIRI,DEPUTADO FEDERAL,CRESPO,JOSE ANTONIO CALDINI CRESPO,SUPLENTE,DEM,PSDB/DEM/PPS,1
BARIRI,DEPUTADO FEDERAL,RODRIGO GARCIA,RODRIGO GARCIA,ELEITO,DEM,PSDB/DEM/PPS,79
BARIRI,DEPUTADO FEDERAL,MARCELO PALINKAS,MARCELO PALINKAS,SUPLENTE,DEM,PSDB/DEM/PPS,1
BARIRI,DEPUTADO FEDERAL,ZULAIÊ COBRA,ZULAIE COBRA RIBEIRO,SUPLENTE,DEM,PSDB/DEM/PPS,9
BARIRI,DEPUTADO FEDERAL,LUCIANO ARTIOLI,LUCIANO ARTIOLI MOREIRA,SUPLENTE,DEM,PSDB/DEM/PPS,4
BARIRI,DEPUTADO FEDERAL,RAUL GIL JR,RAUL GIL JUNIOR,SUPLENTE,DEM,PSDB/DEM/PPS,3
BARIRI,DEPUTADO FEDERAL,CHICO PELUCIO,FRANCISCO PELUCIO,SUPLENTE,DEM,PSDB/DEM/PPS,10
BARIRI,DEPUTADO FEDERAL,JUNJI ABE,JUNJI ABE,ELEITO,DEM,PSDB/DEM/PPS,6
BARIRI,DEPUTADO FEDERAL,ODECIO BRAGA,ODECIO BRAGA DE LOUREDO FILHO,SUPLENTE,DEM,PSDB/DEM/PPS,1
BARIRI,DEPUTADO FEDERAL,DR ELEUSES PAIVA,ELEUSES VIEIRA DE PAIVA,SUPLENTE,DEM,PSDB/DEM/PPS,21
BARIRI,DEPUTADO FEDERAL,GUILHERME CAMPOS,GUILHERME CAMPOS JUNIOR,MÉDIA,DEM,PSDB/DEM/PPS,3
BARIRI,DEPUTADO FEDERAL,WALTER IHOSHI,WALTER SHINDI IIHOSHI,SUPLENTE,DEM,PSDB/DEM/PPS,7
BARIRI,DEPUTADO FEDERAL,DR ANAMARIA HIRAKAWA,ANAMARIA YAECO HIRAKAWA,SUPLENTE,PHS,HUMANISTA CRISTÃO ,1
BARIRI,DEPUTADO FEDERAL,MALUCO BELEZA,OLAIR PRADO DE OLIVEIRA,SUPLENTE,PHS,HUMANISTA CRISTÃO ,2
BARIRI,DEPUTADO FEDERAL,CACIQUE DARÃ,ANTONISIO LULU,SUPLENTE,PHS,HUMANISTA CRISTÃO ,1
BARIRI,DEPUTADO FEDERAL,PROF HERMES,HERMES RODRIGUES NERY,SUPLENTE,PHS,HUMANISTA CRISTÃO ,2
BARIRI,DEPUTADO FEDERAL,JONAS DONIZETTE,JONAS DONIZETTE FERREIRA,ELEITO,PSB,PRESTE ATENÇÃO SÃO PAULO,3
BARIRI,DEPUTADO FEDERAL,ROGÉRIO EMÍLIO,ROGÉRIO EMÍLIO DE ANDRADE,SUPLENTE,PSB,PRESTE ATENÇÃO SÃO PAULO,1
BARIRI,DEPUTADO FEDERAL,MARCELINHO CARIOCA,MARCELO PEREIRA SURCIN,SUPLENTE,PSB,PRESTE ATENÇÃO SÃO PAULO,46
BARIRI,DEPUTADO FEDERAL,SARGENTO FERNANDO,FERNANDO ALCÂNTARA DE FIGUEIREDO,SUPLENTE,PSB,PRESTE ATENÇÃO SÃO PAULO,1
BARIRI,DEPUTADO FEDERAL,ELISEU GABRIEL,ELISEU GABRIEL DE PIERI,SUPLENTE,PSB,PRESTE ATENÇÃO SÃO PAULO,3
BARIRI,DEPUTADO FEDERAL,DR. ANTONIO BUSSOLETTI,ANTONIO GOTARDI BUSSOLETTI,SUPLENTE,PSB,PRESTE ATENÇÃO SÃO PAULO,2
BARIRI,DEPUTADO FEDERAL,RENATO KRONKA,RENATO KRONKA FILHO,SUPLENTE,PSB,PRESTE ATENÇÃO SÃO PAULO,24
BARIRI,DEPUTADO FEDERAL,CAPITÃO AUGUSTO,JOSÉ AUGUSTO ROSA,SUPLENTE,PSB,PRESTE ATENÇÃO SÃO PAULO,109
BARIRI,DEPUTADO FEDERAL,LUIZA ERUNDINA,LUIZA ERUNDINA DE SOUSA,ELEITO,PSB,PRESTE ATENÇÃO SÃO PAULO,17
BARIRI,DEPUTADO FEDERAL,TORINO,PAULO SERGIO TORINO,SUPLENTE,PSB,PRESTE ATENÇÃO SÃO PAULO,6
BARIRI,DEPUTADO FEDERAL,GABRIEL CHALITA,GABRIEL BENEDITO ISSAAC CHALITA,ELEITO,PSB,PRESTE ATENÇÃO SÃO PAULO,669
BARIRI,DEPUTADO FEDERAL,PAULO ROGÉRIO MARTINS,PAULO ROGÉRIO MARTINS,SUPLENTE,PSB,PRESTE ATENÇÃO SÃO PAULO,1
BARIRI,DEPUTADO FEDERAL,MÁRCIO FRANÇA,MÁRCIO LUIZ FRANÇA GOMES,ELEITO,PSB,PRESTE ATENÇÃO SÃO PAULO,17
BARIRI,DEPUTADO FEDERAL,DR. ALEXANDRE,ALEXANDRE SÉRGIO DE OLIVEIRA AZOUBEL,SUPLENTE,PSB,PRESTE ATENÇÃO SÃO PAULO,109
BARIRI,DEPUTADO FEDERAL,TONINHO GARMS,ANTONIO CARLOS GARMS,SUPLENTE,PSB,PRESTE ATENÇÃO SÃO PAULO,29
BARIRI,DEPUTADO FEDERAL,DRA. ELAINE,ELAINE APARECIDA BELLONI ABISSAMRA,SUPLENTE,PSB,PRESTE ATENÇÃO SÃO PAULO,2
BARIRI,DEPUTADO FEDERAL,UNALDO SANTOS,UNALDO FLORES SANTOS,SUPLENTE,PSB,PRESTE ATENÇÃO SÃO PAULO,4
BARIRI,DEPUTADO FEDERAL,VANDIR MOGNON,VANDIR MOGNON,SUPLENTE,PSB,PRESTE ATENÇÃO SÃO PAULO,1
BARIRI,DEPUTADO FEDERAL,NILZÃO ART,ERISVALDO GOMES PEREIRA,SUPLENTE,PSB,PRESTE ATENÇÃO SÃO PAULO,1
BARIRI,DEPUTADO FEDERAL,ABELARDO CAMARINHA,JOSE ABELARDO GUIMARAES CAMARINHA,MÉDIA,PSB,PRESTE ATENÇÃO SÃO PAULO,50
BARIRI,DEPUTADO FEDERAL,JEFFERSON CAMPOS,JEFFERSON ALVES DE CAMPOS,ELEITO,PSB,PRESTE ATENÇÃO SÃO PAULO,4
BARIRI,DEPUTADO FEDERAL,GRAÇA,MARIA DAS GRAÇAS GONÇALVES OLIVEIRA,SUPLENTE,PSB,PRESTE ATENÇÃO SÃO PAULO,1
BARIRI,DEPUTADO FEDERAL,DR. UBIALI,MARCO AURÉLIO UBIALI,SUPLENTE,PSB,PRESTE ATENÇÃO SÃO PAULO,58
BARIRI,DEPUTADO FEDERAL,ZÉ AMIGUINHO,JOSÉ WANDERLEY DE ANDRADE,SUPLENTE,PSB,PRESTE ATENÇÃO SÃO PAULO,1
BARIRI,DEPUTADO FEDERAL,JOÃO DE SOUZA,JOÃO CARLOS DE SOUZA,SUPLENTE,PSB,PRESTE ATENÇÃO SÃO PAULO,1
BARIRI,DEPUTADO FEDERAL,OTA,IOLANDA KEIKO MIASHIRO OTA,ELEITO,PSB,PRESTE ATENÇÃO SÃO PAULO,56
BARIRI,DEPUTADO FEDERAL,MIGUEL SAMPAIO,MIGUEL SAMPAIO JUNIOR,SUPLENTE,PSB,PRESTE ATENÇÃO SÃO PAULO,1
BARIRI,DEPUTADO FEDERAL,GUILHERME MUSSI,GUILHERME MUSSI FERREIRA,ELEITO,PV,PARTIDO VERDE,5
BARIRI,DEPUTADO FEDERAL,GILBERTO ABREU,GILBERTO ANDRADE DE ABREU,SUPLENTE,PV,PARTIDO VERDE,2
BARIRI,DEPUTADO FEDERAL,WALTER GONZALIS,WALTER GONZALIS,SUPLENTE,PV,PARTIDO VERDE,3
BARIRI,DEPUTADO FEDERAL,DR. NEVTON OLIVEIRA ROCHA,NEVTON OLIVEIRA ROCHA,SUPLENTE,PV,PARTIDO VERDE,1
BARIRI,DEPUTADO FEDERAL,DR TALMIR,TALMIR RODRIGUES,SUPLENTE,PV,PARTIDO VERDE,1
BARIRI,DEPUTADO FEDERAL,VICENTE DA UPA,VICENTE CARVALHO E SILVA,SUPLENTE,PV,PARTIDO VERDE,8
BARIRI,DEPUTADO FEDERAL,EDNA MARTINS,EDNA SANDRA MARTINS,SUPLENTE,PV,PARTIDO VERDE,537
BARIRI,DEPUTADO FEDERAL,RAÍ,RAIMUNDO SOUZA TEIXEIRA,SUPLENTE,PV,PARTIDO VERDE,1
BARIRI,DEPUTADO FEDERAL,DR. SINVAL MALHEIROS,SINVAL MALHEIROS PINTO JÚNIOR,SUPLENTE,PV,PARTIDO VERDE,1
BARIRI,DEPUTADO FEDERAL,DANIEL MARINS,DANIEL MARINS ALESSI,SUPLENTE,PV,PARTIDO VERDE,18
BARIRI,DEPUTADO FEDERAL,JULIO CASTILHO,JULIO CESAR CASTILHO,SUPLENTE,PV,PARTIDO VERDE,1
BARIRI,DEPUTADO FEDERAL,ROBERTO SANTIAGO,JOSE ROBERTO SANTIAGO GOMES,ELEITO,PV,PARTIDO VERDE,6
BARIRI,DEPUTADO FEDERAL,SAMBIASE,LUIZ FERNANDO FILIPPI SAMBIASE,SUPLENTE,PV,PARTIDO VERDE,1
BARIRI,DEPUTADO FEDERAL,CESAR CORTEZ,ANTONIO CESAR CORTEZ,SUPLENTE,PV,PARTIDO VERDE,1
BARIRI,DEPUTADO FEDERAL,ZICA,EUSTAQUIO LUCIANO ZICA,SUPLENTE,PV,PARTIDO VERDE,5
BARIRI,DEPUTADO FEDERAL,PEDRO MANHÃES,PEDRO MANHÃES DE OLIVEIRA,SUPLENTE,PV,PARTIDO VERDE,3
BARIRI,DEPUTADO FEDERAL,ENG PAULINHO,PAULO HENRIQUE DO NASCIMENTO,SUPLENTE,PV,PARTIDO VERDE,1
BARIRI,DEPUTADO FEDERAL,DEUSDEDIT JR,DEUSDEDIT DE PAULA MIQUELINO JUNIOR,SUPLENTE,PV,PARTIDO VERDE,2
BARIRI,DEPUTADO FEDERAL,MARIA DOLORES,MARIA DOLORES RODRIGUES JORDAN ORFEI ABE,SUPLENTE,PV,PARTIDO VERDE,2
BARIRI,DEPUTADO FEDERAL,JAIME ROCHA,JAIME BARTOLOMEU DA ROCHA,SUPLENTE,PV,PARTIDO VERDE,4
BARIRI,DEPUTADO FEDERAL,JOVINO CÂNDIDO,JOVINO CÂNDIDO DA SILVA,SUPLENTE,PV,PARTIDO VERDE,9
BARIRI,DEPUTADO FEDERAL,ANA PAULA JUNQUEIRA,ANA PAULA GUIMARAES DE AZEVEDO JUNQUEIRA,SUPLENTE,PV,PARTIDO VERDE,8
BARIRI,DEPUTADO FEDERAL,EVANDRO GUSSI,EVANDRO HERRERA BERTONE GUSSI,SUPLENTE,PV,PARTIDO VERDE,2
BARIRI,DEPUTADO FEDERAL,TOFFANO,JOSE PAULO TOFFANO,SUPLENTE,PV,PARTIDO VERDE,1528
BARIRI,DEPUTADO FEDERAL,ALE YOUSSEF,ALEXANDRE DE ALMEIDA YOUSSEF,SUPLENTE,PV,PARTIDO VERDE,6
BARIRI,DEPUTADO FEDERAL,PENNA,JOSÉ LUIZ DE FRANÇA PENNA,ELEITO,PV,PARTIDO VERDE,10
BARIRI,DEPUTADO FEDERAL,ROBERTO DE LUCENA,ROBERTO ALVES DE LUCENA,ELEITO,PV,PARTIDO VERDE,1
BARIRI,DEPUTADO FEDERAL,DR. ÂNGELO,ANGELO DOMINGOS NUCCI,SUPLENTE,PV,PARTIDO VERDE,2
BARIRI,DEPUTADO FEDERAL,NATAN SOIHET,NATAN SOIHET,SUPLENTE,PV,PARTIDO VERDE,5
BARIRI,DEPUTADO FEDERAL,PAMPA,ANDRE FELIPPE FALBO FERREIRA,SUPLENTE,PV,PARTIDO VERDE,2
BARIRI,DEPUTADO FEDERAL,JOSÉ ALEXANDRE RIBEIRO,JOSE ALEXANDRE RIBEIRO,SUPLENTE,PV,PARTIDO VERDE,2
BARIRI,DEPUTADO FEDERAL,DONIZETI PEREIRA,APARECIDO DONIZETI PEREIRA,SUPLENTE,PV,PARTIDO VERDE,1
BARIRI,DEPUTADO FEDERAL,DEKKA,JOSÉ SALVADOR DA SILVA,SUPLENTE,PV,PARTIDO VERDE,1
BARIRI,DEPUTADO FEDERAL,NICE SOU A DIARISTA,EUNICE SANTANA SANTOS,SUPLENTE,PV,PARTIDO VERDE,3
BARIRI,DEPUTADO FEDERAL,RICARDO IZAR,RICARDO IZAR JUNIOR,ELEITO,PV,PARTIDO VERDE,6
BARIRI,DEPUTADO FEDERAL,TERESA JAPONESA,TERESA KIYOKO ARAGAKI,SUPLENTE,PV,PARTIDO VERDE,8
BARIRI,DEPUTADO FEDERAL,DR. RAUL,RAUL APARECIDO GONÇALVES PAULA,SUPLENTE,PV,PARTIDO VERDE,19
BARIRI,DEPUTADO FEDERAL,VILSON ALVES,VILSON OSCHIN ALVES,SUPLENTE,PV,PARTIDO VERDE,1
BARIRI,DEPUTADO FEDERAL,DR. SAULO,VESPASIANO SAULO DA COSTA E SILVA,SUPLENTE,PV,PARTIDO VERDE,1
BARIRI,DEPUTADO FEDERAL,PROFESSOR EVERALDO,EVERALDO SOUZA DOS SANTOS,SUPLENTE,PV,PARTIDO VERDE,4
BARIRI,DEPUTADO FEDERAL,EDUARDO PALHARES,EDUARDO SANTOS PALHARES,SUPLENTE,PV,PARTIDO VERDE,5
BARIRI,DEPUTADO FEDERAL,HENRIQUE NUNES,HENRIQUE ANTONIO PAIVA NUNES,SUPLENTE,PV,PARTIDO VERDE,4
BARIRI,DEPUTADO FEDERAL,CARLOS SAMPAIO,CARLOS HENRIQUE FOCESI SAMPAIO,ELEITO,PSDB,PSDB/DEM/PPS,24
BARIRI,DEPUTADO FEDERAL,STANGARLINI,JOSE CARLOS STANGARLINI,SUPLENTE,PSDB,PSDB/DEM/PPS,98
BARIRI,DEPUTADO FEDERAL,RAUL CHRISTIANO,RAUL CHRISTIANO DE OLIVEIRA SANCHEZ,SUPLENTE,PSDB,PSDB/DEM/PPS,9
BARIRI,DEPUTADO FEDERAL,LOBBE NETO,ANTONIO ADOLPHO LOBBE NETO,SUPLENTE,PSDB,PSDB/DEM/PPS,1710
BARIRI,DEPUTADO FEDERAL,FELICIDADE,FELICIDADE LOPES PONTES,SUPLENTE,PSDB,PSDB/DEM/PPS,3
BARIRI,DEPUTADO FEDERAL,MANOEL MARCOS (MANÉ),MANOEL MARCOS DE JESUS FERREIRA,SUPLENTE,PSDB,PSDB/DEM/PPS,3
BARIRI,DEPUTADO FEDERAL,EMANUEL FERNANDES,EMANUEL FERNANDES,ELEITO,PSDB,PSDB/DEM/PPS,3
BARIRI,DEPUTADO FEDERAL,MARA GABRILLI,MARA CRISTINA GABRILLI,ELEITO,PSDB,PSDB/DEM/PPS,14
BARIRI,DEPUTADO FEDERAL,MARCOS ARAUJO,MARCOS ROSA DE ARAUJO,SUPLENTE,PSDB,PSDB/DEM/PPS,2
BARIRI,DEPUTADO FEDERAL,CARLOS BRAGA,CARLOS EDUARDO FARACO BRAGA,SUPLENTE,PSDB,PSDB/DEM/PPS,89
BARIRI,DEPUTADO FEDERAL,LELIS DA ROCHA,LELIS DA ROCHA,SUPLENTE,PSDB,PSDB/DEM/PPS,4
BARIRI,DEPUTADO FEDERAL,CARLOS ROBERTO,CARLOS ROBERTO DE CAMPOS,SUPLENTE,PSDB,PSDB/DEM/PPS,14
BARIRI,DEPUTADO FEDERAL,DIB,WILLIAM DIB,ELEITO,PSDB,PSDB/DEM/PPS,1
BARIRI,DEPUTADO FEDERAL,PANNUNZIO,ANTONIO CARLOS PANNUNZIO,SUPLENTE,PSDB,PSDB/DEM/PPS,4
BARIRI,DEPUTADO FEDERAL,ALBERTO MOURAO,ALBERTO PEREIRA MOURAO,SUPLENTE,PSDB,PSDB/DEM/PPS,4
BARIRI,DEPUTADO FEDERAL,RENATO AMARY,RENATO FAUVEL AMARY,SUPLENTE,PSDB,PSDB/DEM/PPS,2
BARIRI,DEPUTADO FEDERAL,DR ANDRE SACCO,ANDRE SACCO JUNIOR,SUPLENTE,PSDB,PSDB/DEM/PPS,1
BARIRI,DEPUTADO FEDERAL,SILVIO TORRES,SILVIO FRANÇA TORRES,SUPLENTE,PSDB,PSDB/DEM/PPS,2
BARIRI,DEPUTADO FEDERAL,TIRSO MEIRELLES,TIRSO DE SALLES MEIRELLES,SUPLENTE,PSDB,PSDB/DEM/PPS,43
BARIRI,DEPUTADO FEDERAL,TERESA SERRANO,MARIA TERESA SERRANO AFONSO,SUPLENTE,PSDB,PSDB/DEM/PPS,2
