PALMITAL,PRESIDENTE,DILMA,DILMA VANA ROUSSEFF,2º TURNO,PT,PARA O BRASIL SEGUIR MUDANDO,3931
PALMITAL,PRESIDENTE,JOSÉ SERRA,JOSÉ SERRA,2º TURNO,PSDB,O BRASIL PODE MAIS,6064
PALMITAL,GOVERNADOR,GERALDO ALCKMIN,GERALDO JOSE RODRIGUES ALCKMIN FILHO,ELEITO,PSDB,UNIDOS POR SÃO PAULO,7328
PALMITAL,SENADOR,MARTA SUPLICY,MARTA SUPLICY,ELEITO,PT,UNIÃO PARA MUDAR,3219
PALMITAL,SENADOR,ALOYSIO NUNES,ALOYSIO NUNES FERREIRA FILHO,ELEITO,PSDB,UNIDOS POR SÃO PAULO,6356
PALMITAL,DEPUTADO FEDERAL,ANTONIO BULHÕES,ANTONIO CARLOS MARTINS DE BULHÕES,ELEITO,PRB,JUNTOS POR SÃO PAULO,3
PALMITAL,DEPUTADO FEDERAL,OTONIEL LIMA,OTONIEL CARLOS DE LIMA,MÉDIA,PRB,JUNTOS POR SÃO PAULO,19
PALMITAL,DEPUTADO FEDERAL,DURVAL MORELLI,DURVAL MORELLI NETO,SUPLENTE,PP,PARTIDO PROGRESSISTA,5
PALMITAL,DEPUTADO FEDERAL,MALUF,PAULO SALIM MALUF,ELEITO,PP,PARTIDO PROGRESSISTA,90
PALMITAL,DEPUTADO FEDERAL,RUBENEUTON OLIVEIRA LIMA,RUBENEUTON OLIVEIRA LIMA,SUPLENTE,PP,PARTIDO PROGRESSISTA,5
PALMITAL,DEPUTADO FEDERAL,CARLOS OCTAVIANI,JOSÉ CARLOS OCTAVIANI,SUPLENTE,PP,PARTIDO PROGRESSISTA,3
PALMITAL,DEPUTADO FEDERAL,BATORÉ,IVANILDO GOMES NOGUEIRA,SUPLENTE,PP,PARTIDO PROGRESSISTA,1
PALMITAL,DEPUTADO FEDERAL,ELIAS BITENCOURT,ELIAS DOS SANTOS BITENCOURT,SUPLENTE,PP,PARTIDO PROGRESSISTA,2
PALMITAL,DEPUTADO FEDERAL,CABO WILSON,WILSON DE OLIVEIRA MORAIS,SUPLENTE,PP,PARTIDO PROGRESSISTA,1
PALMITAL,DEPUTADO FEDERAL,MISSIONÁRIO JOSÉ OLIMPIO,JOSÉ OLIMPIO SILVEIRA MORAES,ELEITO,PP,PARTIDO PROGRESSISTA,92
PALMITAL,DEPUTADO FEDERAL,FERNANDO STANCATTI,FERNANDO CESAR STANCATTI MARQUES,SUPLENTE,PP,PARTIDO PROGRESSISTA,1
PALMITAL,DEPUTADO FEDERAL,DR NECHAR,SERGIO ANTONIO NECHAR,SUPLENTE,PP,PARTIDO PROGRESSISTA,6
PALMITAL,DEPUTADO FEDERAL,CARLÃO FELIPE,JOÃO CARLOS FELIPE,SUPLENTE,PP,PARTIDO PROGRESSISTA,2
PALMITAL,DEPUTADO FEDERAL,VADÃO,ETIVALDO VADAO GOMES,SUPLENTE,PP,PARTIDO PROGRESSISTA,12
PALMITAL,DEPUTADO FEDERAL,KIM,MARCO ANTONIO ALVES JORGE,SUPLENTE,PDT,PARTIDO DEMOCRÁTICO TRABALHISTA,1
PALMITAL,DEPUTADO FEDERAL,JOÃO DADO,JOÃO EDUARDO DADO LEITE DE CARVALHO,ELEITO,PDT,PARTIDO DEMOCRÁTICO TRABALHISTA,11
PALMITAL,DEPUTADO FEDERAL,PAULINHO DA FORÇA,PAULO PEREIRA DA SILVA,ELEITO,PDT,PARTIDO DEMOCRÁTICO TRABALHISTA,22
PALMITAL,DEPUTADO FEDERAL,KAREN HEINS,KAREN MAYELLEN TONIM HEINS,SUPLENTE,PDT,PARTIDO DEMOCRÁTICO TRABALHISTA,1
PALMITAL,DEPUTADO FEDERAL,PEDRO BAPTISTINI,PEDRO ANTONIO BAPTISTINI,SUPLENTE,PDT,PARTIDO DEMOCRÁTICO TRABALHISTA,1
PALMITAL,DEPUTADO FEDERAL,SAULO GOES,SAULO GOES DE ALBUQUERQUE,SUPLENTE,PDT,PARTIDO DEMOCRÁTICO TRABALHISTA,1
PALMITAL,DEPUTADO FEDERAL,MEDEIROS,LUIZ ANTONIO DE MEDEIROS NETO,SUPLENTE,PDT,PARTIDO DEMOCRÁTICO TRABALHISTA,2
PALMITAL,DEPUTADO FEDERAL,GILBERTO BENZI,GILBERTO BENZI,SUPLENTE,PDT,PARTIDO DEMOCRÁTICO TRABALHISTA,6
PALMITAL,DEPUTADO FEDERAL,DR LUIZ CHIAPARINE,LUIZ CARLOS CHIAPARINE,SUPLENTE,PDT,PARTIDO DEMOCRÁTICO TRABALHISTA,6
PALMITAL,DEPUTADO FEDERAL,NELSINHO DA BAHIA,NELSON FRANCISCO DOS SANTOS,SUPLENTE,PDT,PARTIDO DEMOCRÁTICO TRABALHISTA,1
PALMITAL,DEPUTADO FEDERAL,MANOEL ANTUNES,MANOEL ANTUNES,SUPLENTE,PDT,PARTIDO DEMOCRÁTICO TRABALHISTA,2
PALMITAL,DEPUTADO FEDERAL,DEF.BIODIESEL-SILASEDUARDOINKE,SILAS EDUARDO INKE,SUPLENTE,PDT,PARTIDO DEMOCRÁTICO TRABALHISTA,1
PALMITAL,DEPUTADO FEDERAL,DRA DEBORA,DEBORA MARIA MARAGNI PEREIRA DE ABREU,SUPLENTE,PDT,PARTIDO DEMOCRÁTICO TRABALHISTA,2
PALMITAL,DEPUTADO FEDERAL,SALVADOR ZIMBALDI,SALVADOR ZIMBALDI FILHO,MÉDIA,PDT,PARTIDO DEMOCRÁTICO TRABALHISTA,11
PALMITAL,DEPUTADO FEDERAL,DRA ZIRVA,ZIRVA DAS GRAÇAS PIRES PEREIRA,SUPLENTE,PDT,PARTIDO DEMOCRÁTICO TRABALHISTA,1
PALMITAL,DEPUTADO FEDERAL,LINDOLFO DOS SANTOS,LINDOLFO LUIZ DOS SANTOS NETO,SUPLENTE,PDT,PARTIDO DEMOCRÁTICO TRABALHISTA,1
PALMITAL,DEPUTADO FEDERAL,FERNANDO CHIARELLI,FERNANDO CHIARELLI,SUPLENTE,PDT,PARTIDO DEMOCRÁTICO TRABALHISTA,2
PALMITAL,DEPUTADO FEDERAL,WILSON COELHO,WILSON DE SOUZA COELHO,SUPLENTE,PDT,PARTIDO DEMOCRÁTICO TRABALHISTA,71
PALMITAL,DEPUTADO FEDERAL,JOSUE TOPA TUDO,JOSUÉ MOREIRA,SUPLENTE,PDT,PARTIDO DEMOCRÁTICO TRABALHISTA,2
PALMITAL,DEPUTADO FEDERAL,IVANIO BATISTA,IVANIO BATISTA DA SILVA,SUPLENTE,PT,JUNTOS POR SÃO PAULO,2
PALMITAL,DEPUTADO FEDERAL,VICENTE CANDIDO,VICENTE CANDIDO DA SILVA,ELEITO,PT,JUNTOS POR SÃO PAULO,5
PALMITAL,DEPUTADO FEDERAL,IARA BERNARDI,IARA BERNARDI,SUPLENTE,PT,JUNTOS POR SÃO PAULO,2
PALMITAL,DEPUTADO FEDERAL,LARGUESA,LUIS VANDERLEI LARGUESA,SUPLENTE,PT,JUNTOS POR SÃO PAULO,10
PALMITAL,DEPUTADO FEDERAL,VACCAREZZA,CANDIDO ELPIDIO DE SOUZA VACCAREZZA,ELEITO,PT,JUNTOS POR SÃO PAULO,2
PALMITAL,DEPUTADO FEDERAL,GENOINO,JOSÉ GENOÍNO NETO,SUPLENTE,PT,JUNTOS POR SÃO PAULO,20
PALMITAL,DEPUTADO FEDERAL,OSMAR LOPES,OSMAR LOPES,SUPLENTE,PT,JUNTOS POR SÃO PAULO,1
PALMITAL,DEPUTADO FEDERAL,HELCIO SILVA,HELCIO ANTONIO DA SILVA,SUPLENTE,PT,JUNTOS POR SÃO PAULO,1
PALMITAL,DEPUTADO FEDERAL,FILIPPI,JOSÉ DE FILIPPI JÚNIOR,ELEITO,PT,JUNTOS POR SÃO PAULO,1
PALMITAL,DEPUTADO FEDERAL,ARLINDO CHINAGLIA,ARLINDO CHIGNALIA JUNIOR,ELEITO,PT,JUNTOS POR SÃO PAULO,61
PALMITAL,DEPUTADO FEDERAL,JOÃO PAULO CUNHA,JOÃO PAULO CUNHA,ELEITO,PT,JUNTOS POR SÃO PAULO,16
PALMITAL,DEPUTADO FEDERAL,ROQUE FERREIRA,ROQUE JOSÉ FERREIRA,SUPLENTE,PT,JUNTOS POR SÃO PAULO,1
PALMITAL,DEPUTADO FEDERAL,RICARDO BERZOINI,RICARDO JOSE RIBEIRO BERZOINI,ELEITO,PT,JUNTOS POR SÃO PAULO,15
PALMITAL,DEPUTADO FEDERAL,PROF. CARLÃO RAMIRO,CARLOS RAMIRO CASTRO,SUPLENTE,PT,JUNTOS POR SÃO PAULO,19
PALMITAL,DEPUTADO FEDERAL,FÉLIX SAHÃO,FÉLIX SAHÃO JÚNIOR,SUPLENTE,PT,JUNTOS POR SÃO PAULO,13
PALMITAL,DEPUTADO FEDERAL,ROGÉRIO PINTO,ROGÉRIO PINTO FERNANDES,SUPLENTE,PT,JUNTOS POR SÃO PAULO,4
PALMITAL,DEPUTADO FEDERAL,RODRIGO VALVERDE,JORGE RODRIGO VALVERDE SANTANA,SUPLENTE,PT,JUNTOS POR SÃO PAULO,1
PALMITAL,DEPUTADO FEDERAL,VANDERLEI SIRAQUE,VANDERLEI SIRAQUE,SUPLENTE,PT,JUNTOS POR SÃO PAULO,38
PALMITAL,DEPUTADO FEDERAL,JILMAR TATTO,JILMAR AUGUSTINHO TATTO,ELEITO,PT,JUNTOS POR SÃO PAULO,710
PALMITAL,DEPUTADO FEDERAL,DURVAL ORLATO,DURVAL LOPES ORLATO,SUPLENTE,PT,JUNTOS POR SÃO PAULO,2
PALMITAL,DEPUTADO FEDERAL,EDSON DA PAZ (O CANTOR),EDSON DA PAZ,SUPLENTE,PT,JUNTOS POR SÃO PAULO,2
PALMITAL,DEPUTADO FEDERAL,RUBINHO BASTOS,RUBENS BASTOS DO NASCIMENTO,SUPLENTE,PT,JUNTOS POR SÃO PAULO,1
PALMITAL,DEPUTADO FEDERAL,ARCELINO ARAUJO,ARCELINO ARAUJO RIBEIRO,SUPLENTE,PT,JUNTOS POR SÃO PAULO,1
PALMITAL,DEPUTADO FEDERAL,RENATO SIMÕES,RENATO SIMÕES,SUPLENTE,PT,JUNTOS POR SÃO PAULO,5
PALMITAL,DEPUTADO FEDERAL,DEVANIR RIBEIRO,DEVANIR RIBEIRO,ELEITO,PT,JUNTOS POR SÃO PAULO,2
PALMITAL,DEPUTADO FEDERAL,ZARATTINI,CARLOS ALBERTO ROLIM ZARATTINI,ELEITO,PT,JUNTOS POR SÃO PAULO,3
PALMITAL,DEPUTADO FEDERAL,MARIA LUCIA PRANDI,MARIA LUCIA PRANDI GOMES,SUPLENTE,PT,JUNTOS POR SÃO PAULO,2
PALMITAL,DEPUTADO FEDERAL,PAULO TEIXEIRA,LUIZ PAULO TEIXEIRA FERREIRA,ELEITO,PT,JUNTOS POR SÃO PAULO,1
PALMITAL,DEPUTADO FEDERAL,CLAURY,CLAURY SANTOS ALVES DA SILVA,SUPLENTE,PTB,PARTIDO TRABALHISTA BRASILEIRO,131
PALMITAL,DEPUTADO FEDERAL,VAMPETA,MARCOS ANDRE BATISTA SANTOS,SUPLENTE,PTB,PARTIDO TRABALHISTA BRASILEIRO,7
PALMITAL,DEPUTADO FEDERAL,NADUR,ADALBERTO NADUR,SUPLENTE,PTB,PARTIDO TRABALHISTA BRASILEIRO,1
PALMITAL,DEPUTADO FEDERAL,ROBSON TUMA,ROBSON TUMA,SUPLENTE,PTB,PARTIDO TRABALHISTA BRASILEIRO,11
PALMITAL,DEPUTADO FEDERAL,RICARDO OLIVEIRA,RICARDO JOSE DE OLIVEIRA,SUPLENTE,PTB,PARTIDO TRABALHISTA BRASILEIRO,4
PALMITAL,DEPUTADO FEDERAL,OBAMA BRASIL,ANANIAS RODRIGUES DA SILVA,SUPLENTE,PTB,PARTIDO TRABALHISTA BRASILEIRO,2
PALMITAL,DEPUTADO FEDERAL,SINVAL DORIGON,SINVAL ROBERTO DORIGON,SUPLENTE,PTB,PARTIDO TRABALHISTA BRASILEIRO,1
PALMITAL,DEPUTADO FEDERAL,NELSON MARQUEZELLI,NELSON MARQUEZELLI,ELEITO,PTB,PARTIDO TRABALHISTA BRASILEIRO,382
PALMITAL,DEPUTADO FEDERAL,CARLOS BURGHI,CARLOS ALBERTO EBERT BURGHI,SUPLENTE,PTB,PARTIDO TRABALHISTA BRASILEIRO,2
PALMITAL,DEPUTADO FEDERAL,MARCOS CRIPPA,MARCOS ANTONIO CRIPPA,SUPLENTE,PTB,PARTIDO TRABALHISTA BRASILEIRO,1
PALMITAL,DEPUTADO FEDERAL,WALDOMIRO RAMOS,WALDOMIRO CARLOS RAMOS,SUPLENTE,PTB,PARTIDO TRABALHISTA BRASILEIRO,2
PALMITAL,DEPUTADO FEDERAL,SATURNINO DE BRITO,SATURNINO DE SALES SANTOS,SUPLENTE,PTB,PARTIDO TRABALHISTA BRASILEIRO,2
PALMITAL,DEPUTADO FEDERAL,ARNALDO FARIA DE SÁ,ARNALDO FARIA DE SÁ,ELEITO,PTB,PARTIDO TRABALHISTA BRASILEIRO,37
PALMITAL,DEPUTADO FEDERAL,CELIO DINIZ,CELIO FRANCISCO DINIZ,SUPLENTE,PTB,PARTIDO TRABALHISTA BRASILEIRO,39
PALMITAL,DEPUTADO FEDERAL,ISRAEL LACERDA,ISRAEL SAMPAIO DE LACERDA FILHO,SUPLENTE,PTB,PARTIDO TRABALHISTA BRASILEIRO,1
PALMITAL,DEPUTADO FEDERAL,FRANK AGUIAR,FRANCINETO LUZ DE AGUIAR,SUPLENTE,PTB,PARTIDO TRABALHISTA BRASILEIRO,2
PALMITAL,DEPUTADO FEDERAL,DR ANDRE ROCHA,ANDRE LUIS ROCHA,SUPLENTE,PTB,PARTIDO TRABALHISTA BRASILEIRO,1
PALMITAL,DEPUTADO FEDERAL,WALTER TEODORO / ASP,WALTER DE ARAUJO TEODORO DE SOUZA,SUPLENTE,PTB,PARTIDO TRABALHISTA BRASILEIRO,1
PALMITAL,DEPUTADO FEDERAL,PAULO LIMA,PAULO CESAR DE OLIVEIRA LIMA,SUPLENTE,PMDB,PARTIDO DO MOVIMENTO DEMOCRÁTICO BRASILEIRO,253
PALMITAL,DEPUTADO FEDERAL,CARVALHO SALES,JEFFERSON CARVALHO SALES,SUPLENTE,PMDB,PARTIDO DO MOVIMENTO DEMOCRÁTICO BRASILEIRO,1
PALMITAL,DEPUTADO FEDERAL,DR. ALMÉRIO,ALMÉRIO AGUIAR MELO FILHO,SUPLENTE,PMDB,PARTIDO DO MOVIMENTO DEMOCRÁTICO BRASILEIRO,1
PALMITAL,DEPUTADO FEDERAL,MARCOS TENÓRIO,MARCOS ANTÔNIO FERREIRA TENÓRIO,SUPLENTE,PMDB,PARTIDO DO MOVIMENTO DEMOCRÁTICO BRASILEIRO,3
PALMITAL,DEPUTADO FEDERAL,PAULINHO SOBRAL,PAULO MENDES SOBRAL,SUPLENTE,PMDB,PARTIDO DO MOVIMENTO DEMOCRÁTICO BRASILEIRO,2
PALMITAL,DEPUTADO FEDERAL,TONY JUPSSON,TONY JUPSSON SANTOS,SUPLENTE,PMDB,PARTIDO DO MOVIMENTO DEMOCRÁTICO BRASILEIRO,1
PALMITAL,DEPUTADO FEDERAL,PILTON RIOS,PILTON RIOS DE BARROS FELIX PEREIRA,SUPLENTE,PMDB,PARTIDO DO MOVIMENTO DEMOCRÁTICO BRASILEIRO,1
PALMITAL,DEPUTADO FEDERAL,EDINHO ARAUJO,EDSON EDINHO COELHO ARAUJO,ELEITO,PMDB,PARTIDO DO MOVIMENTO DEMOCRÁTICO BRASILEIRO,1
PALMITAL,DEPUTADO FEDERAL,LIMA JUNIOR,JULIO CEZAR DA SILVA LIMA JUNIOR,SUPLENTE,PMDB,PARTIDO DO MOVIMENTO DEMOCRÁTICO BRASILEIRO,1
PALMITAL,DEPUTADO FEDERAL,SERGIO KOBRA,SERGIO MARTINS DOS SANTOS JUNIOR,SUPLENTE,PMDB,PARTIDO DO MOVIMENTO DEMOCRÁTICO BRASILEIRO,1
PALMITAL,DEPUTADO FEDERAL,DR. JAIR,JAIR CESAR DAMATO,SUPLENTE,PMDB,PARTIDO DO MOVIMENTO DEMOCRÁTICO BRASILEIRO,1
PALMITAL,DEPUTADO FEDERAL,INDIA,FATIMA APARECIDA FERREIRA,SUPLENTE,PMDB,PARTIDO DO MOVIMENTO DEMOCRÁTICO BRASILEIRO,1
PALMITAL,DEPUTADO FEDERAL,BOCA NERVOSA,EDMAR MARQUES SILVA,SUPLENTE,PMDB,PARTIDO DO MOVIMENTO DEMOCRÁTICO BRASILEIRO,1
PALMITAL,DEPUTADO FEDERAL,LEONARDO HENRIQUE,LEONARDO HENRIQUE CRAVO,SUPLENTE,PMDB,PARTIDO DO MOVIMENTO DEMOCRÁTICO BRASILEIRO,1
PALMITAL,DEPUTADO FEDERAL,GERALDÃO,GERALDO TOMAZ AUGUSTO,SUPLENTE,PMDB,PARTIDO DO MOVIMENTO DEMOCRÁTICO BRASILEIRO,1
PALMITAL,DEPUTADO FEDERAL,A. TRIUNFO AVELLAR,AGUINALDO TRIUMPHO AVELLAR,SUPLENTE,PMDB,PARTIDO DO MOVIMENTO DEMOCRÁTICO BRASILEIRO,1
PALMITAL,DEPUTADO FEDERAL,DR. SAMIR NASSBINE,SAMIR ASSAD NASSBINE,SUPLENTE,PMDB,PARTIDO DO MOVIMENTO DEMOCRÁTICO BRASILEIRO,2
PALMITAL,DEPUTADO FEDERAL,DANIEL CALDEIRA,DANIEL CALDEIRA MATEUS,SUPLENTE,PSL,PRESTE ATENÇÃO SÃO PAULO,4
PALMITAL,DEPUTADO FEDERAL,SARGENTO SEVERO,LUCIANO APARECIDO SEVERO,SUPLENTE,PSL,PRESTE ATENÇÃO SÃO PAULO,19
PALMITAL,DEPUTADO FEDERAL,ROBERTO SIQUEIRA,ROBERTO SIQUEIRA GOMES,SUPLENTE,PSL,PRESTE ATENÇÃO SÃO PAULO,1
PALMITAL,DEPUTADO FEDERAL,MISSIONARIA NAZARE,MARIA NAZARE DOS SANTOS SORRILLO,SUPLENTE,PSC,HUMANISTA CRISTÃO ,3
PALMITAL,DEPUTADO FEDERAL,CLEBER DELALIBERA,CLEBER DE MOURA DELALIBERA,SUPLENTE,PSC,HUMANISTA CRISTÃO ,2
PALMITAL,DEPUTADO FEDERAL,MARCO FELICIANO,MARCO ANTONIO FELICIANO,ELEITO,PSC,HUMANISTA CRISTÃO ,36
PALMITAL,DEPUTADO FEDERAL,MARCELO AGUIAR,MARCELO THEODORO DE AGUIAR,ELEITO,PSC,HUMANISTA CRISTÃO ,6
PALMITAL,DEPUTADO FEDERAL,REGIS DE OLIVEIRA,REGIS FERNANDES DE OLIVEIRA,SUPLENTE,PSC,HUMANISTA CRISTÃO ,16
PALMITAL,DEPUTADO FEDERAL,SILVIA PALMA,SILVIA ELIANA PALMA,SUPLENTE,PSC,HUMANISTA CRISTÃO ,24
PALMITAL,DEPUTADO FEDERAL,NEY SANTOS,CLAUDINEI ALVES DOS SANTOS,SUPLENTE,PSC,HUMANISTA CRISTÃO ,1
PALMITAL,DEPUTADO FEDERAL,DR.CARLOS FARIA,CARLOS EDUARDO DA SILVA FARIA,SUPLENTE,PSC,HUMANISTA CRISTÃO ,1
PALMITAL,DEPUTADO FEDERAL,DALVAN,JOÃO GOMES DE ALMEIDA,SUPLENTE,PSC,HUMANISTA CRISTÃO ,1
PALMITAL,DEPUTADO FEDERAL,CICERO FERNANDES,JOSE CICERO FERNANDES DA SILVA,SUPLENTE,PSC,HUMANISTA CRISTÃO ,1
PALMITAL,DEPUTADO FEDERAL,LEO,LEONARDO LEANDRO FRANÇA DE OLIVEIRA,SUPLENTE,PSC,HUMANISTA CRISTÃO ,1
PALMITAL,DEPUTADO FEDERAL,PRICILA LEME,PRICILA HELENA MOYSES LEME,SUPLENTE,PSC,HUMANISTA CRISTÃO ,3
PALMITAL,DEPUTADO FEDERAL,TONINHO CORREDOR,ANTONIO CICERO DA SILVA,SUPLENTE,PSC,HUMANISTA CRISTÃO ,1
PALMITAL,DEPUTADO FEDERAL,ALEXANDRE DUARTE,LUIS ALEXANDRE DUARTE,SUPLENTE,PSC,HUMANISTA CRISTÃO ,1
PALMITAL,DEPUTADO FEDERAL,MANOEL GASPAR,MANOEL FERREIRA DE SOUZA GASPAR,SUPLENTE,PSC,HUMANISTA CRISTÃO ,9
PALMITAL,DEPUTADO FEDERAL,JUCA CHAVES,JURANDYR CZACZKES CHAVES,SUPLENTE,PR,JUNTOS POR SÃO PAULO,1
PALMITAL,DEPUTADO FEDERAL,AGNALDO TIMOTEO,AGUINALDO TIMOTEO PEREIRA,SUPLENTE,PR,JUNTOS POR SÃO PAULO,5
PALMITAL,DEPUTADO FEDERAL,TIRIRICA,FRANCISCO EVERARDO OLIVEIRA SILVA,ELEITO,PR,JUNTOS POR SÃO PAULO,361
PALMITAL,DEPUTADO FEDERAL,PR PAULO FREIRE,PAULO ROBERTO FREIRE DA COSTA,ELEITO,PR,JUNTOS POR SÃO PAULO,238
PALMITAL,DEPUTADO FEDERAL,LUCIANA COSTA,LUCIANA DE ALMEIDA COSTA,SUPLENTE,PR,JUNTOS POR SÃO PAULO,1
PALMITAL,DEPUTADO FEDERAL,MILTON MONTI,MILTON ANTONIO CASQUEL MONTI,ELEITO,PR,JUNTOS POR SÃO PAULO,648
PALMITAL,DEPUTADO FEDERAL,VALDEMAR COSTA NETO,VALDEMAR COSTA NETO,ELEITO,PR,JUNTOS POR SÃO PAULO,67
PALMITAL,DEPUTADO FEDERAL,LINDOMAR DE OLIVEIRA,LINDOMAR CUSTODIA DE OLIVEIRA,SUPLENTE,PPS,PSDB/DEM/PPS,1
PALMITAL,DEPUTADO FEDERAL,WILLIAM WOO,WILLIAM BOSS WOO,SUPLENTE,PPS,PSDB/DEM/PPS,1
PALMITAL,DEPUTADO FEDERAL,ROBERTO FREIRE,ROBERTO JOAO PEREIRA FREIRE,ELEITO,PPS,PSDB/DEM/PPS,79
PALMITAL,DEPUTADO FEDERAL,DIMAS RAMALHO,DIMAS EDUARDO RAMALHO,ELEITO,PPS,PSDB/DEM/PPS,20
PALMITAL,DEPUTADO FEDERAL,ARI FRIEDENBACH,ARI FRIEDENBACH,SUPLENTE,PPS,PSDB/DEM/PPS,2
PALMITAL,DEPUTADO FEDERAL,JOSE ONERIO,JOSE ONERIO DA SILVA,SUPLENTE,PPS,PSDB/DEM/PPS,16
PALMITAL,DEPUTADO FEDERAL,ARNALDO JARDIM,ARNALDO CALIL PEREIRA JARDIM,ELEITO,PPS,PSDB/DEM/PPS,5
PALMITAL,DEPUTADO FEDERAL,PROFESSOR VALDIR VERISSIMO,VALDIR VERISSIMO DE ASSUNÇÃO,SUPLENTE,PPS,PSDB/DEM/PPS,1
PALMITAL,DEPUTADO FEDERAL,JORGE TADEU,JORGE TADEU MUDALEN,ELEITO,DEM,PSDB/DEM/PPS,22
PALMITAL,DEPUTADO FEDERAL,JORGINHO MALULY,JORGE DE FARIA MALULY,SUPLENTE,DEM,PSDB/DEM/PPS,69
PALMITAL,DEPUTADO FEDERAL,PROFESSOR BENJAMIN,BENJAMIN RIBEIRO DA SILVA,SUPLENTE,DEM,PSDB/DEM/PPS,16
PALMITAL,DEPUTADO FEDERAL,KIKO DO KLB,FRANCO FINATO SCORNAVACCA,SUPLENTE,DEM,PSDB/DEM/PPS,7
PALMITAL,DEPUTADO FEDERAL,RODRIGO GARCIA,RODRIGO GARCIA,ELEITO,DEM,PSDB/DEM/PPS,9
PALMITAL,DEPUTADO FEDERAL,ZULAIÊ COBRA,ZULAIE COBRA RIBEIRO,SUPLENTE,DEM,PSDB/DEM/PPS,17
PALMITAL,DEPUTADO FEDERAL,RAUL GIL JR,RAUL GIL JUNIOR,SUPLENTE,DEM,PSDB/DEM/PPS,7
PALMITAL,DEPUTADO FEDERAL,JUNJI ABE,JUNJI ABE,ELEITO,DEM,PSDB/DEM/PPS,1
PALMITAL,DEPUTADO FEDERAL,MANDIC,ALEKSANDAR CARLOS MANDIC,SUPLENTE,DEM,PSDB/DEM/PPS,5
PALMITAL,DEPUTADO FEDERAL,CASCIONE,VICENTE FERNANDES CASCIONE,SUPLENTE,DEM,PSDB/DEM/PPS,1
PALMITAL,DEPUTADO FEDERAL,ELI CORREA FILHO,ADRIANO ELI CORREA,ELEITO,DEM,PSDB/DEM/PPS,7
PALMITAL,DEPUTADO FEDERAL,DR ELEUSES PAIVA,ELEUSES VIEIRA DE PAIVA,SUPLENTE,DEM,PSDB/DEM/PPS,14
PALMITAL,DEPUTADO FEDERAL,WALTER IHOSHI,WALTER SHINDI IIHOSHI,SUPLENTE,DEM,PSDB/DEM/PPS,785
PALMITAL,DEPUTADO FEDERAL,PROF HERMES,HERMES RODRIGUES NERY,SUPLENTE,PHS,HUMANISTA CRISTÃO ,1
PALMITAL,DEPUTADO FEDERAL,MARCELINHO CARIOCA,MARCELO PEREIRA SURCIN,SUPLENTE,PSB,PRESTE ATENÇÃO SÃO PAULO,24
PALMITAL,DEPUTADO FEDERAL,SARGENTO FERNANDO,FERNANDO ALCÂNTARA DE FIGUEIREDO,SUPLENTE,PSB,PRESTE ATENÇÃO SÃO PAULO,2
PALMITAL,DEPUTADO FEDERAL,ADÃO LIMA,ADÃO TIMÓTEO DE LIMA,SUPLENTE,PSB,PRESTE ATENÇÃO SÃO PAULO,5
PALMITAL,DEPUTADO FEDERAL,CAPITÃO AUGUSTO,JOSÉ AUGUSTO ROSA,SUPLENTE,PSB,PRESTE ATENÇÃO SÃO PAULO,95
PALMITAL,DEPUTADO FEDERAL,LUIZA ERUNDINA,LUIZA ERUNDINA DE SOUSA,ELEITO,PSB,PRESTE ATENÇÃO SÃO PAULO,17
PALMITAL,DEPUTADO FEDERAL,TIO DO DOCE,MANOEL CARDOSO DA SILVA,SUPLENTE,PSB,PRESTE ATENÇÃO SÃO PAULO,1
PALMITAL,DEPUTADO FEDERAL,GABRIEL CHALITA,GABRIEL BENEDITO ISSAAC CHALITA,ELEITO,PSB,PRESTE ATENÇÃO SÃO PAULO,177
PALMITAL,DEPUTADO FEDERAL,MÁRCIO FRANÇA,MÁRCIO LUIZ FRANÇA GOMES,ELEITO,PSB,PRESTE ATENÇÃO SÃO PAULO,5
PALMITAL,DEPUTADO FEDERAL,DR. ALEXANDRE,ALEXANDRE SÉRGIO DE OLIVEIRA AZOUBEL,SUPLENTE,PSB,PRESTE ATENÇÃO SÃO PAULO,208
PALMITAL,DEPUTADO FEDERAL,DRA. ROSIANE FARIAS,ROSIANE MACIEL DE FARIAS,SUPLENTE,PSB,PRESTE ATENÇÃO SÃO PAULO,21
PALMITAL,DEPUTADO FEDERAL,DRA. ELAINE,ELAINE APARECIDA BELLONI ABISSAMRA,SUPLENTE,PSB,PRESTE ATENÇÃO SÃO PAULO,7
PALMITAL,DEPUTADO FEDERAL,ABELARDO CAMARINHA,JOSE ABELARDO GUIMARAES CAMARINHA,MÉDIA,PSB,PRESTE ATENÇÃO SÃO PAULO,164
PALMITAL,DEPUTADO FEDERAL,JEFFERSON CAMPOS,JEFFERSON ALVES DE CAMPOS,ELEITO,PSB,PRESTE ATENÇÃO SÃO PAULO,146
PALMITAL,DEPUTADO FEDERAL,GRAÇA,MARIA DAS GRAÇAS GONÇALVES OLIVEIRA,SUPLENTE,PSB,PRESTE ATENÇÃO SÃO PAULO,1
PALMITAL,DEPUTADO FEDERAL,GETÚLIO DUARTE,GETÚLIO DUARTE FERREIRA,SUPLENTE,PSB,PRESTE ATENÇÃO SÃO PAULO,3
PALMITAL,DEPUTADO FEDERAL,DR. UBIALI,MARCO AURÉLIO UBIALI,SUPLENTE,PSB,PRESTE ATENÇÃO SÃO PAULO,78
PALMITAL,DEPUTADO FEDERAL,OTA,IOLANDA KEIKO MIASHIRO OTA,ELEITO,PSB,PRESTE ATENÇÃO SÃO PAULO,8
PALMITAL,DEPUTADO FEDERAL,GUILHERME MUSSI,GUILHERME MUSSI FERREIRA,ELEITO,PV,PARTIDO VERDE,2
PALMITAL,DEPUTADO FEDERAL,DR. NEVTON OLIVEIRA ROCHA,NEVTON OLIVEIRA ROCHA,SUPLENTE,PV,PARTIDO VERDE,4
PALMITAL,DEPUTADO FEDERAL,DR TALMIR,TALMIR RODRIGUES,SUPLENTE,PV,PARTIDO VERDE,19
PALMITAL,DEPUTADO FEDERAL,DR. SINVAL MALHEIROS,SINVAL MALHEIROS PINTO JÚNIOR,SUPLENTE,PV,PARTIDO VERDE,12
PALMITAL,DEPUTADO FEDERAL,JULIO CASTILHO,JULIO CESAR CASTILHO,SUPLENTE,PV,PARTIDO VERDE,1
PALMITAL,DEPUTADO FEDERAL,ROBERTO SANTIAGO,JOSE ROBERTO SANTIAGO GOMES,ELEITO,PV,PARTIDO VERDE,5
PALMITAL,DEPUTADO FEDERAL,ENG PAULINHO,PAULO HENRIQUE DO NASCIMENTO,SUPLENTE,PV,PARTIDO VERDE,1
PALMITAL,DEPUTADO FEDERAL,MARIA DOLORES,MARIA DOLORES RODRIGUES JORDAN ORFEI ABE,SUPLENTE,PV,PARTIDO VERDE,1
PALMITAL,DEPUTADO FEDERAL,JOVINO CÂNDIDO,JOVINO CÂNDIDO DA SILVA,SUPLENTE,PV,PARTIDO VERDE,3
PALMITAL,DEPUTADO FEDERAL,ANA PAULA JUNQUEIRA,ANA PAULA GUIMARAES DE AZEVEDO JUNQUEIRA,SUPLENTE,PV,PARTIDO VERDE,14
PALMITAL,DEPUTADO FEDERAL,EVANDRO GUSSI,EVANDRO HERRERA BERTONE GUSSI,SUPLENTE,PV,PARTIDO VERDE,108
PALMITAL,DEPUTADO FEDERAL,TOFFANO,JOSE PAULO TOFFANO,SUPLENTE,PV,PARTIDO VERDE,2
PALMITAL,DEPUTADO FEDERAL,ALE YOUSSEF,ALEXANDRE DE ALMEIDA YOUSSEF,SUPLENTE,PV,PARTIDO VERDE,3
PALMITAL,DEPUTADO FEDERAL,MARCELO ORTIZ,FRANCISCO MARCELO ORTIZ FILHO,SUPLENTE,PV,PARTIDO VERDE,1
PALMITAL,DEPUTADO FEDERAL,PENNA,JOSÉ LUIZ DE FRANÇA PENNA,ELEITO,PV,PARTIDO VERDE,4
PALMITAL,DEPUTADO FEDERAL,ROBERTO DE LUCENA,ROBERTO ALVES DE LUCENA,ELEITO,PV,PARTIDO VERDE,1
PALMITAL,DEPUTADO FEDERAL,JOSÉ ALEXANDRE RIBEIRO,JOSE ALEXANDRE RIBEIRO,SUPLENTE,PV,PARTIDO VERDE,1
PALMITAL,DEPUTADO FEDERAL,DONIZETI PEREIRA,APARECIDO DONIZETI PEREIRA,SUPLENTE,PV,PARTIDO VERDE,2
PALMITAL,DEPUTADO FEDERAL,NICE SOU A DIARISTA,EUNICE SANTANA SANTOS,SUPLENTE,PV,PARTIDO VERDE,1
PALMITAL,DEPUTADO FEDERAL,RICARDO IZAR,RICARDO IZAR JUNIOR,ELEITO,PV,PARTIDO VERDE,51
PALMITAL,DEPUTADO FEDERAL,DR. RAUL,RAUL APARECIDO GONÇALVES PAULA,SUPLENTE,PV,PARTIDO VERDE,1
PALMITAL,DEPUTADO FEDERAL,LUIZA ELUF,LUIZA NAGIB ELUF,SUPLENTE,PV,PARTIDO VERDE,4
PALMITAL,DEPUTADO FEDERAL,DENADAI,EUCLIDES DENADAI FILHO,SUPLENTE,PV,PARTIDO VERDE,1
PALMITAL,DEPUTADO FEDERAL,EDUARDO PALHARES,EDUARDO SANTOS PALHARES,SUPLENTE,PV,PARTIDO VERDE,1
PALMITAL,DEPUTADO FEDERAL,CARLOS SAMPAIO,CARLOS HENRIQUE FOCESI SAMPAIO,ELEITO,PSDB,PSDB/DEM/PPS,18
PALMITAL,DEPUTADO FEDERAL,STANGARLINI,JOSE CARLOS STANGARLINI,SUPLENTE,PSDB,PSDB/DEM/PPS,3
PALMITAL,DEPUTADO FEDERAL,RAUL CHRISTIANO,RAUL CHRISTIANO DE OLIVEIRA SANCHEZ,SUPLENTE,PSDB,PSDB/DEM/PPS,7
PALMITAL,DEPUTADO FEDERAL,LOBBE NETO,ANTONIO ADOLPHO LOBBE NETO,SUPLENTE,PSDB,PSDB/DEM/PPS,65
PALMITAL,DEPUTADO FEDERAL,FELICIDADE,FELICIDADE LOPES PONTES,SUPLENTE,PSDB,PSDB/DEM/PPS,1
PALMITAL,DEPUTADO FEDERAL,EMANUEL FERNANDES,EMANUEL FERNANDES,ELEITO,PSDB,PSDB/DEM/PPS,1
PALMITAL,DEPUTADO FEDERAL,MARA GABRILLI,MARA CRISTINA GABRILLI,ELEITO,PSDB,PSDB/DEM/PPS,2
PALMITAL,DEPUTADO FEDERAL,CARLOS ROBERTO,CARLOS ROBERTO DE CAMPOS,SUPLENTE,PSDB,PSDB/DEM/PPS,1
PALMITAL,DEPUTADO FEDERAL,DIB,WILLIAM DIB,ELEITO,PSDB,PSDB/DEM/PPS,5
PALMITAL,DEPUTADO FEDERAL,LUCIA SANTUCCI,LUCIA MARIA SANTUCCI,SUPLENTE,PSDB,PSDB/DEM/PPS,1
PALMITAL,DEPUTADO FEDERAL,ALBERTO MOURAO,ALBERTO PEREIRA MOURAO,SUPLENTE,PSDB,PSDB/DEM/PPS,1
PALMITAL,DEPUTADO FEDERAL,RENATO AMARY,RENATO FAUVEL AMARY,SUPLENTE,PSDB,PSDB/DEM/PPS,1
PALMITAL,DEPUTADO FEDERAL,DR ANDRE SACCO,ANDRE SACCO JUNIOR,SUPLENTE,PSDB,PSDB/DEM/PPS,7
PALMITAL,DEPUTADO FEDERAL,SILVIO TORRES,SILVIO FRANÇA TORRES,SUPLENTE,PSDB,PSDB/DEM/PPS,459
PALMITAL,DEPUTADO FEDERAL,TIRSO MEIRELLES,TIRSO DE SALLES MEIRELLES,SUPLENTE,PSDB,PSDB/DEM/PPS,24
PALMITAL,DEPUTADO FEDERAL,EDSON APARECIDO,EDSON APARECIDO DOS SANTOS,ELEITO,PSDB,PSDB/DEM/PPS,974
PALMITAL,DEPUTADO FEDERAL,RICARDO MONTORO,JOSE RICARDO FRANCO MONTORO,SUPLENTE,PSDB,PSDB/DEM/PPS,15
PALMITAL,DEPUTADO FEDERAL,LUIZ FERNANDO MACHADO,LUIZ FERNANDO ARANTES MACHADO,ELEITO,PSDB,PSDB/DEM/PPS,1
PALMITAL,DEPUTADO FEDERAL,VANDERLEI MACRIS,VANDERLEI MACRIS,SUPLENTE,PSDB,PSDB/DEM/PPS,3
PALMITAL,DEPUTADO FEDERAL,DUARTE NOGUEIRA,ANTONIO DUARTE NOGUEIRA JUNIOR,ELEITO,PSDB,PSDB/DEM/PPS,20
PALMITAL,DEPUTADO FEDERAL,JULIO SEMEGHINI,JULIO FRACISCO SEMEGHINI NETO,ELEITO,PSDB,PSDB/DEM/PPS,2
PALMITAL,DEPUTADO FEDERAL,TRIPOLI,JOSÉ RICARDO ALVARENGA TRIPOLI,ELEITO,PSDB,PSDB/DEM/PPS,13
PALMITAL,DEPUTADO FEDERAL,FERNANDO FUAD CHUCRE,FERNANDO BARRANCOS CHUCRE,SUPLENTE,PSDB,PSDB/DEM/PPS,2
PALMITAL,DEPUTADO FEDERAL,VAZ DE LIMA,JOSÉ CARLOS VAZ DE LIMA,ELEITO,PSDB,PSDB/DEM/PPS,13
PALMITAL,DEPUTADO FEDERAL,TIÃO,SEBASTIÃO FERRES ARSENE,SUPLENTE,PSDB,PSDB/DEM/PPS,1
PALMITAL,DEPUTADO FEDERAL,WALTER FELDMAN,WALTER MEYER FELDMAN,SUPLENTE,PSDB,PSDB/DEM/PPS,1
PALMITAL,DEPUTADO FEDERAL,THAME,ANTONIO CARLOS DE MENDES THAME,ELEITO,PSDB,PSDB/DEM/PPS,105
PALMITAL,DEPUTADO FEDERAL,ARNALDO MADEIRA,ARNALDO DE ABREU MADEIRA,SUPLENTE,PSDB,PSDB/DEM/PPS,4
PALMITAL,DEPUTADO FEDERAL,BRUNA FURLAN,BRUNA DIAS FURLAN,ELEITO,PSDB,PSDB/DEM/PPS,40
PALMITAL,DEPUTADO FEDERAL,JOSÉ ANIBAL,JOSÉ ANIBAL PERES DE PONTES,ELEITO,PSDB,PSDB/DEM/PPS,18
PALMITAL,DEPUTADO FEDERAL,NELSON BUGALHO,NELSON ROBERTO BUGALHO,SUPLENTE,PSDB,PSDB/DEM/PPS,4
PALMITAL,DEPUTADO FEDERAL,SIRINEU BARBOSA,JOSÉ SIRINEU FILGUEIRAS BARBOSA,SUPLENTE,PSDB,PSDB/DEM/PPS,2
PALMITAL,DEPUTADO FEDERAL,JAMIL PRUDENCIANO,JAMIL PAULO PRUDENCIANO,SUPLENTE,PSOL,PARTIDO SOCIALISMO E LIBERDADE,1
PALMITAL,DEPUTADO FEDERAL,IVAN VALENTE,IVAN VALENTE,ELEITO,PSOL,PARTIDO SOCIALISMO E LIBERDADE,25
PALMITAL,DEPUTADO FEDERAL,PROFESSORA MÁRCIA TAVARES,MÁRCIA TAVARES DO NASCIMENTO,SUPLENTE,PSOL,PARTIDO SOCIALISMO E LIBERDADE,1
PALMITAL,DEPUTADO FEDERAL,HELTON BASTOS,HELTON SARAGOR DE SOUZA,SUPLENTE,PSOL,PARTIDO SOCIALISMO E LIBERDADE,1
PALMITAL,DEPUTADO FEDERAL,DR. ABELHA,CARLOS FERNANDO LOPES ABELHA,SUPLENTE,PC DO B,JUNTOS POR SÃO PAULO,2
PALMITAL,DEPUTADO FEDERAL,SIDNEI MARTINS,SIDNEI ALVES MARTINS,SUPLENTE,PC DO B,JUNTOS POR SÃO PAULO,1
PALMITAL,DEPUTADO FEDERAL,PADRE PEDRO,PEDRO CÉLIO DAUDT,SUPLENTE,PC DO B,JUNTOS POR SÃO PAULO,1
PALMITAL,DEPUTADO FEDERAL,ALDO REBELO,JOSÉ ALDO REBELO FIGUEIREDO,ELEITO,PC DO B,JUNTOS POR SÃO PAULO,2337
PALMITAL,DEPUTADO FEDERAL,DELEGADO PROTÓGENES,PROTÓGENES PINHEIRO DE QUEIROZ,MÉDIA,PC DO B,JUNTOS POR SÃO PAULO,28
PALMITAL,DEPUTADO FEDERAL,JOAO ARAUJO,JOAO LUIS ARAUJO NETO,SUPLENTE,PT DO B,JUNTOS POR SÃO PAULO,115
PALMITAL,DEPUTADO ESTADUAL,DR. MARCELO MACHADO,MARCELO PINTO MACHADO,SUPLENTE,PRB,SOMOS MAIS SÃO PAULO,1
PALMITAL,DEPUTADO ESTADUAL,SEBASTIÃO SANTOS,SEBASTIÃO DOS SANTOS FILHO,ELEITO,PRB,SOMOS MAIS SÃO PAULO,19
PALMITAL,DEPUTADO ESTADUAL,CURIATI,ANTONIO SALIM CURIATI,ELEITO,PP,PARTIDO PROGRESSISTA,23
PALMITAL,DEPUTADO ESTADUAL,CIMATTI NETO,MILTON CIMATTI NETO,SUPLENTE,PP,PARTIDO PROGRESSISTA,1
PALMITAL,DEPUTADO ESTADUAL,DR. SERGIO CHEBEL,SERGIO CABRAL CHEBEL,SUPLENTE,PP,PARTIDO PROGRESSISTA,2
PALMITAL,DEPUTADO ESTADUAL,SARGENTO REIS,MARIO JOSÉ DOS REIS,SUPLENTE,PP,PARTIDO PROGRESSISTA,1
PALMITAL,DEPUTADO ESTADUAL,SIMONY,SIMONY BENELLI GALASSO,SUPLENTE,PP,PARTIDO PROGRESSISTA,1
PALMITAL,DEPUTADO ESTADUAL,DR. IRINEU,IRINEU CARDOSO DOS SANTOS,SUPLENTE,PP,PARTIDO PROGRESSISTA,5
PALMITAL,DEPUTADO ESTADUAL,MARIA CLEMENTINA,MARIA CLEMENTINO DE SOUSA,SUPLENTE,PP,PARTIDO PROGRESSISTA,1
PALMITAL,DEPUTADO ESTADUAL,LAZARO TAVARES CUNHA,LAZARO TAVARES DA CUNHA,SUPLENTE,PP,PARTIDO PROGRESSISTA,4
PALMITAL,DEPUTADO ESTADUAL,VALDIR MARIN,VALDIR SILVEIRA MARIN,SUPLENTE,PP,PARTIDO PROGRESSISTA,42
PALMITAL,DEPUTADO ESTADUAL,PRADO,ALEXANDRE DO PRADO,SUPLENTE,PP,PARTIDO PROGRESSISTA,2
PALMITAL,DEPUTADO ESTADUAL,AURELIO,AURELIO JOSE CLAUDIO,SUPLENTE,PDT,PARTIDO DEMOCRÁTICO TRABALHISTA,1
PALMITAL,DEPUTADO ESTADUAL,KLAUDIO CÓFFANI,KLAUDIO COFFANI NUNES,SUPLENTE,PDT,PARTIDO DEMOCRÁTICO TRABALHISTA,2
PALMITAL,DEPUTADO ESTADUAL,DINEI,CLAUDINEI ALEXANDRE PIRES,SUPLENTE,PDT,PARTIDO DEMOCRÁTICO TRABALHISTA,10
PALMITAL,DEPUTADO ESTADUAL,GILBERTO DOURADO,GILBERTO RODRIGUES DOURADO,SUPLENTE,PDT,PARTIDO DEMOCRÁTICO TRABALHISTA,2
PALMITAL,DEPUTADO ESTADUAL,ROGERIO NOGUEIRA,ROGERIO NOGUEIRA LOPES CRUZ,ELEITO,PDT,PARTIDO DEMOCRÁTICO TRABALHISTA,1
PALMITAL,DEPUTADO ESTADUAL,LUIZ ARRAES,LUIZ DE SOUZA ARRAES,SUPLENTE,PDT,PARTIDO DEMOCRÁTICO TRABALHISTA,1
PALMITAL,DEPUTADO ESTADUAL,MAJOR OLIMPIO,SERGIO OLIMPIO GOMES,ELEITO,PDT,PARTIDO DEMOCRÁTICO TRABALHISTA,56
PALMITAL,DEPUTADO ESTADUAL,JOCA VASCONCELOS,JOAO CARLOS MONTE CLARO VASCONCELOS,SUPLENTE,PDT,PARTIDO DEMOCRÁTICO TRABALHISTA,1
