PIRASSUNUNGA,PRESIDENTE,DILMA,DILMA VANA ROUSSEFF,2º TURNO,PT,PARA O BRASIL SEGUIR MUDANDO,5239
PIRASSUNUNGA,PRESIDENTE,JOSÉ SERRA,JOSÉ SERRA,2º TURNO,PSDB,O BRASIL PODE MAIS,9455
PIRASSUNUNGA,GOVERNADOR,GERALDO ALCKMIN,GERALDO JOSE RODRIGUES ALCKMIN FILHO,ELEITO,PSDB,UNIDOS POR SÃO PAULO,10616
PIRASSUNUNGA,SENADOR,MARTA SUPLICY,MARTA SUPLICY,ELEITO,PT,UNIÃO PARA MUDAR,4809
PIRASSUNUNGA,SENADOR,ALOYSIO NUNES,ALOYSIO NUNES FERREIRA FILHO,ELEITO,PSDB,UNIDOS POR SÃO PAULO,10660
PIRASSUNUNGA,DEPUTADO FEDERAL,DR. ELIEZER COSTA,ELIEZER NASCIMENTO DA COSTA,SUPLENTE,PRB,JUNTOS POR SÃO PAULO,2
PIRASSUNUNGA,DEPUTADO FEDERAL,CÉSAR CRUZ GARCIA,CESAR CRUZ GARCIA,SUPLENTE,PRB,JUNTOS POR SÃO PAULO,1
PIRASSUNUNGA,DEPUTADO FEDERAL,ANTONIO BULHÕES,ANTONIO CARLOS MARTINS DE BULHÕES,ELEITO,PRB,JUNTOS POR SÃO PAULO,3
PIRASSUNUNGA,DEPUTADO FEDERAL,ELCIO AMANCIO,ELCIO AMÂNCIO,SUPLENTE,PRB,JUNTOS POR SÃO PAULO,1
PIRASSUNUNGA,DEPUTADO FEDERAL,OTONIEL LIMA,OTONIEL CARLOS DE LIMA,MÉDIA,PRB,JUNTOS POR SÃO PAULO,74
PIRASSUNUNGA,DEPUTADO FEDERAL,RATINHO,SEBASTIÃO MARTINS DE AZEVEDO,SUPLENTE,PRB,JUNTOS POR SÃO PAULO,8
PIRASSUNUNGA,DEPUTADO FEDERAL,DURVAL MORELLI,DURVAL MORELLI NETO,SUPLENTE,PP,PARTIDO PROGRESSISTA,3
PIRASSUNUNGA,DEPUTADO FEDERAL,DR JOSÉ CLAUDIO,JOSE CLAUDIO MANCILHA DE FARIA BARBOSA,SUPLENTE,PP,PARTIDO PROGRESSISTA,1
PIRASSUNUNGA,DEPUTADO FEDERAL,TCEL JULIO LEMOS,JÚLIO FERNANDO PINHEIRO DE LEMOS,SUPLENTE,PP,PARTIDO PROGRESSISTA,29
PIRASSUNUNGA,DEPUTADO FEDERAL,MALUF,PAULO SALIM MALUF,ELEITO,PP,PARTIDO PROGRESSISTA,119
PIRASSUNUNGA,DEPUTADO FEDERAL,RUBENEUTON OLIVEIRA LIMA,RUBENEUTON OLIVEIRA LIMA,SUPLENTE,PP,PARTIDO PROGRESSISTA,1
PIRASSUNUNGA,DEPUTADO FEDERAL,CAPITÃO GOMES,CARLOS GOMES DA SILVA,SUPLENTE,PP,PARTIDO PROGRESSISTA,213
PIRASSUNUNGA,DEPUTADO FEDERAL,LALO,JOSÉ CARLOS TALDIVO,SUPLENTE,PP,PARTIDO PROGRESSISTA,6
PIRASSUNUNGA,DEPUTADO FEDERAL,BATORÉ,IVANILDO GOMES NOGUEIRA,SUPLENTE,PP,PARTIDO PROGRESSISTA,6
PIRASSUNUNGA,DEPUTADO FEDERAL,MANOEL MOREIRA,MANOEL MOREIRA DE ARAUJO FILHO,SUPLENTE,PP,PARTIDO PROGRESSISTA,4
PIRASSUNUNGA,DEPUTADO FEDERAL,LAURINDO BARNARDES,LAURINDO BERNARDES DE SOUZA,SUPLENTE,PP,PARTIDO PROGRESSISTA,1
PIRASSUNUNGA,DEPUTADO FEDERAL,MAURICIO MARTINS,MAURICIO LUIS MARTINS,SUPLENTE,PP,PARTIDO PROGRESSISTA,1
PIRASSUNUNGA,DEPUTADO FEDERAL,ALINE CORREA,ALINE LEMOS CORREA DE OLIVEIRA ANDRADE,ELEITO,PP,PARTIDO PROGRESSISTA,48
PIRASSUNUNGA,DEPUTADO FEDERAL,ELIAS BITENCOURT,ELIAS DOS SANTOS BITENCOURT,SUPLENTE,PP,PARTIDO PROGRESSISTA,3
PIRASSUNUNGA,DEPUTADO FEDERAL,CATARINA RIGINIK,CATARINA BEATRIZ GASPAROTTO RIGINIK,SUPLENTE,PP,PARTIDO PROGRESSISTA,2
PIRASSUNUNGA,DEPUTADO FEDERAL,CLAUDIO SABINO,CLAUDIO SABINO,SUPLENTE,PP,PARTIDO PROGRESSISTA,1
PIRASSUNUNGA,DEPUTADO FEDERAL,DRA ADRIANA DA COSTA,ADRIANA ALVARES DA COSTA DE PAULA ALVES,SUPLENTE,PP,PARTIDO PROGRESSISTA,3
PIRASSUNUNGA,DEPUTADO FEDERAL,BETO MANSUR,PAULO ROBERTO GOMES MANSUR,ELEITO,PP,PARTIDO PROGRESSISTA,5
PIRASSUNUNGA,DEPUTADO FEDERAL,ADHEMAR DE BARROS FILHO,ADHEMAR DE BARROS FILHO,SUPLENTE,PP,PARTIDO PROGRESSISTA,5
PIRASSUNUNGA,DEPUTADO FEDERAL,MAURICIO TCHÊ DA TORRE,MAURICIO EDUARDO MELLO PEREIRA,SUPLENTE,PP,PARTIDO PROGRESSISTA,1
PIRASSUNUNGA,DEPUTADO FEDERAL,CABO WILSON,WILSON DE OLIVEIRA MORAIS,SUPLENTE,PP,PARTIDO PROGRESSISTA,3
PIRASSUNUNGA,DEPUTADO FEDERAL,MISSIONÁRIO JOSÉ OLIMPIO,JOSÉ OLIMPIO SILVEIRA MORAES,ELEITO,PP,PARTIDO PROGRESSISTA,51
PIRASSUNUNGA,DEPUTADO FEDERAL,DR NECHAR,SERGIO ANTONIO NECHAR,SUPLENTE,PP,PARTIDO PROGRESSISTA,1
PIRASSUNUNGA,DEPUTADO FEDERAL,DELEGADA GRACIELA,GRACIELA DE LOURDES DAVID AMBROSIO,SUPLENTE,PP,PARTIDO PROGRESSISTA,2
PIRASSUNUNGA,DEPUTADO FEDERAL,CARLÃO FELIPE,JOÃO CARLOS FELIPE,SUPLENTE,PP,PARTIDO PROGRESSISTA,1
PIRASSUNUNGA,DEPUTADO FEDERAL,NETO BELUCI,ALCIDES BELUCI NETO,SUPLENTE,PP,PARTIDO PROGRESSISTA,2
PIRASSUNUNGA,DEPUTADO FEDERAL,PRICILA MENIN,LETEIA PRICILA GOMES,SUPLENTE,PP,PARTIDO PROGRESSISTA,1
PIRASSUNUNGA,DEPUTADO FEDERAL,JORGE WILSON,JORGE WILSON GONÇALVES DE MATTOS,SUPLENTE,PP,PARTIDO PROGRESSISTA,13
PIRASSUNUNGA,DEPUTADO FEDERAL,CAPITÃO CRIVELARI,LUIZ ANTONIO CRIVELARI,SUPLENTE,PP,PARTIDO PROGRESSISTA,2
PIRASSUNUNGA,DEPUTADO FEDERAL,VADÃO,ETIVALDO VADAO GOMES,SUPLENTE,PP,PARTIDO PROGRESSISTA,4
PIRASSUNUNGA,DEPUTADO FEDERAL,PH,PAULO HENRIQUE RIBEIRO SANTANA,SUPLENTE,PDT,PARTIDO DEMOCRÁTICO TRABALHISTA,5
PIRASSUNUNGA,DEPUTADO FEDERAL,KIM,MARCO ANTONIO ALVES JORGE,SUPLENTE,PDT,PARTIDO DEMOCRÁTICO TRABALHISTA,1
PIRASSUNUNGA,DEPUTADO FEDERAL,CARLITO VIANA,CARLITO VIANA SOARES,SUPLENTE,PDT,PARTIDO DEMOCRÁTICO TRABALHISTA,1
PIRASSUNUNGA,DEPUTADO FEDERAL,JOÃO DADO,JOÃO EDUARDO DADO LEITE DE CARVALHO,ELEITO,PDT,PARTIDO DEMOCRÁTICO TRABALHISTA,73
PIRASSUNUNGA,DEPUTADO FEDERAL,PAULINHO DA FORÇA,PAULO PEREIRA DA SILVA,ELEITO,PDT,PARTIDO DEMOCRÁTICO TRABALHISTA,72
PIRASSUNUNGA,DEPUTADO FEDERAL,ELISEU DANIEL,ELISEU DANIEL DOS SANTOS,SUPLENTE,PDT,PARTIDO DEMOCRÁTICO TRABALHISTA,218
PIRASSUNUNGA,DEPUTADO FEDERAL,BARBOSA,ANTONIO CARLOS BARBOSA,SUPLENTE,PDT,PARTIDO DEMOCRÁTICO TRABALHISTA,1
PIRASSUNUNGA,DEPUTADO FEDERAL,ARMANDO HENRIQUE,ARMANDO HENRIQUE,SUPLENTE,PDT,PARTIDO DEMOCRÁTICO TRABALHISTA,1
PIRASSUNUNGA,DEPUTADO FEDERAL,SAULO GOES,SAULO GOES DE ALBUQUERQUE,SUPLENTE,PDT,PARTIDO DEMOCRÁTICO TRABALHISTA,1
PIRASSUNUNGA,DEPUTADO FEDERAL,MEDEIROS,LUIZ ANTONIO DE MEDEIROS NETO,SUPLENTE,PDT,PARTIDO DEMOCRÁTICO TRABALHISTA,8
PIRASSUNUNGA,DEPUTADO FEDERAL,GILBERTO BENZI,GILBERTO BENZI,SUPLENTE,PDT,PARTIDO DEMOCRÁTICO TRABALHISTA,1
PIRASSUNUNGA,DEPUTADO FEDERAL,DR LUIZ CHIAPARINE,LUIZ CARLOS CHIAPARINE,SUPLENTE,PDT,PARTIDO DEMOCRÁTICO TRABALHISTA,16
PIRASSUNUNGA,DEPUTADO FEDERAL,NELSINHO DA BAHIA,NELSON FRANCISCO DOS SANTOS,SUPLENTE,PDT,PARTIDO DEMOCRÁTICO TRABALHISTA,2
PIRASSUNUNGA,DEPUTADO FEDERAL,MANOEL ANTUNES,MANOEL ANTUNES,SUPLENTE,PDT,PARTIDO DEMOCRÁTICO TRABALHISTA,4
PIRASSUNUNGA,DEPUTADO FEDERAL,CARLOS HENRIQUE,CARLOS HENRIQUE PINTO,SUPLENTE,PDT,PARTIDO DEMOCRÁTICO TRABALHISTA,21
PIRASSUNUNGA,DEPUTADO FEDERAL,MAURICIO SOARES JUNIOR,MAURICIO SOARES DE ALMEIDA JUNIOR,SUPLENTE,PDT,PARTIDO DEMOCRÁTICO TRABALHISTA,2
PIRASSUNUNGA,DEPUTADO FEDERAL,ISMAEL NICACIO,ISMAEL JUDÁ DOS SANTOS NICÁCIO,SUPLENTE,PDT,PARTIDO DEMOCRÁTICO TRABALHISTA,1
PIRASSUNUNGA,DEPUTADO FEDERAL,SALVADOR ZIMBALDI,SALVADOR ZIMBALDI FILHO,MÉDIA,PDT,PARTIDO DEMOCRÁTICO TRABALHISTA,309
PIRASSUNUNGA,DEPUTADO FEDERAL,DRA ZIRVA,ZIRVA DAS GRAÇAS PIRES PEREIRA,SUPLENTE,PDT,PARTIDO DEMOCRÁTICO TRABALHISTA,1
PIRASSUNUNGA,DEPUTADO FEDERAL,LINDOLFO DOS SANTOS,LINDOLFO LUIZ DOS SANTOS NETO,SUPLENTE,PDT,PARTIDO DEMOCRÁTICO TRABALHISTA,2
PIRASSUNUNGA,DEPUTADO FEDERAL,FERNANDO CHIARELLI,FERNANDO CHIARELLI,SUPLENTE,PDT,PARTIDO DEMOCRÁTICO TRABALHISTA,3
PIRASSUNUNGA,DEPUTADO FEDERAL,MAGAIVER,EDILSON MAGAIVER FERREIRA DA SILVA,SUPLENTE,PDT,PARTIDO DEMOCRÁTICO TRABALHISTA,1
PIRASSUNUNGA,DEPUTADO FEDERAL,ACIR FILÓ,ACIR DOS SANTOS,SUPLENTE,PDT,PARTIDO DEMOCRÁTICO TRABALHISTA,1
PIRASSUNUNGA,DEPUTADO FEDERAL,FADUL,OSWALDO DOS SANTOS,SUPLENTE,PDT,PARTIDO DEMOCRÁTICO TRABALHISTA,1
PIRASSUNUNGA,DEPUTADO FEDERAL,IVANIO BATISTA,IVANIO BATISTA DA SILVA,SUPLENTE,PT,JUNTOS POR SÃO PAULO,2
PIRASSUNUNGA,DEPUTADO FEDERAL,VICENTE CANDIDO,VICENTE CANDIDO DA SILVA,ELEITO,PT,JUNTOS POR SÃO PAULO,5
PIRASSUNUNGA,DEPUTADO FEDERAL,LARGUESA,LUIS VANDERLEI LARGUESA,SUPLENTE,PT,JUNTOS POR SÃO PAULO,3
PIRASSUNUNGA,DEPUTADO FEDERAL,VACCAREZZA,CANDIDO ELPIDIO DE SOUZA VACCAREZZA,ELEITO,PT,JUNTOS POR SÃO PAULO,5
PIRASSUNUNGA,DEPUTADO FEDERAL,GENOINO,JOSÉ GENOÍNO NETO,SUPLENTE,PT,JUNTOS POR SÃO PAULO,33
PIRASSUNUNGA,DEPUTADO FEDERAL,OSMAR LOPES,OSMAR LOPES,SUPLENTE,PT,JUNTOS POR SÃO PAULO,4
PIRASSUNUNGA,DEPUTADO FEDERAL,CARLINHOS ALMEIDA,CARLOS JOSE DE ALMEIDA,ELEITO,PT,JUNTOS POR SÃO PAULO,3
PIRASSUNUNGA,DEPUTADO FEDERAL,MISA BOITO,MARIA EMILIA SEDEH BOITO,SUPLENTE,PT,JUNTOS POR SÃO PAULO,10
PIRASSUNUNGA,DEPUTADO FEDERAL,NEWTON LIMA NETO,NEWTON LIMA NETO,ELEITO,PT,JUNTOS POR SÃO PAULO,242
PIRASSUNUNGA,DEPUTADO FEDERAL,TEREZINHA RONDELLI,MARIA TEREZINHA RONDELLI,SUPLENTE,PT,JUNTOS POR SÃO PAULO,12
PIRASSUNUNGA,DEPUTADO FEDERAL,ARLINDO CHINAGLIA,ARLINDO CHIGNALIA JUNIOR,ELEITO,PT,JUNTOS POR SÃO PAULO,73
PIRASSUNUNGA,DEPUTADO FEDERAL,JOÃO PAULO CUNHA,JOÃO PAULO CUNHA,ELEITO,PT,JUNTOS POR SÃO PAULO,53
PIRASSUNUNGA,DEPUTADO FEDERAL,JOÃO BATISTA,JOÃO BATISTA DA SILVA,SUPLENTE,PT,JUNTOS POR SÃO PAULO,1
PIRASSUNUNGA,DEPUTADO FEDERAL,PIVATTO,JOSÉ PIVATTO,SUPLENTE,PT,JUNTOS POR SÃO PAULO,1
PIRASSUNUNGA,DEPUTADO FEDERAL,RICARDO BERZOINI,RICARDO JOSE RIBEIRO BERZOINI,ELEITO,PT,JUNTOS POR SÃO PAULO,27
PIRASSUNUNGA,DEPUTADO FEDERAL,JOSÉ MENTOR,JOSÉ MENTOR GUILHERME DE MELLO NETTO,ELEITO,PT,JUNTOS POR SÃO PAULO,21
PIRASSUNUNGA,DEPUTADO FEDERAL,PROF. CARLÃO RAMIRO,CARLOS RAMIRO CASTRO,SUPLENTE,PT,JUNTOS POR SÃO PAULO,14
PIRASSUNUNGA,DEPUTADO FEDERAL,FÉLIX SAHÃO,FÉLIX SAHÃO JÚNIOR,SUPLENTE,PT,JUNTOS POR SÃO PAULO,39
PIRASSUNUNGA,DEPUTADO FEDERAL,ROGÉRIO PINTO,ROGÉRIO PINTO FERNANDES,SUPLENTE,PT,JUNTOS POR SÃO PAULO,1
PIRASSUNUNGA,DEPUTADO FEDERAL,TENENTE PAZ,FRANCISCO JESUS DA PAZ,SUPLENTE,PT,JUNTOS POR SÃO PAULO,3
PIRASSUNUNGA,DEPUTADO FEDERAL,VANDERLEI SIRAQUE,VANDERLEI SIRAQUE,SUPLENTE,PT,JUNTOS POR SÃO PAULO,8
PIRASSUNUNGA,DEPUTADO FEDERAL,PAULO AFONSO,PAULO AFONSO RIBEIRO,SUPLENTE,PT,JUNTOS POR SÃO PAULO,1
PIRASSUNUNGA,DEPUTADO FEDERAL,EDSON DA PAZ (O CANTOR),EDSON DA PAZ,SUPLENTE,PT,JUNTOS POR SÃO PAULO,1
PIRASSUNUNGA,DEPUTADO FEDERAL,RUBINHO BASTOS,RUBENS BASTOS DO NASCIMENTO,SUPLENTE,PT,JUNTOS POR SÃO PAULO,1
PIRASSUNUNGA,DEPUTADO FEDERAL,CARLOS AQUINO,JOSÉ CARLOS DE AQUINO,SUPLENTE,PT,JUNTOS POR SÃO PAULO,1
PIRASSUNUNGA,DEPUTADO FEDERAL,RENATO SIMÕES,RENATO SIMÕES,SUPLENTE,PT,JUNTOS POR SÃO PAULO,7
PIRASSUNUNGA,DEPUTADO FEDERAL,DEVANIR RIBEIRO,DEVANIR RIBEIRO,ELEITO,PT,JUNTOS POR SÃO PAULO,569
PIRASSUNUNGA,DEPUTADO FEDERAL,ZARATTINI,CARLOS ALBERTO ROLIM ZARATTINI,ELEITO,PT,JUNTOS POR SÃO PAULO,3
PIRASSUNUNGA,DEPUTADO FEDERAL,MARIA LUCIA PRANDI,MARIA LUCIA PRANDI GOMES,SUPLENTE,PT,JUNTOS POR SÃO PAULO,5
PIRASSUNUNGA,DEPUTADO FEDERAL,ANGELO BARRETO,ANGELO RAFAEL BARRETO,SUPLENTE,PT,JUNTOS POR SÃO PAULO,22
PIRASSUNUNGA,DEPUTADO FEDERAL,VICENTINHO,VICENTE PAULO DA SILVA,ELEITO,PT,JUNTOS POR SÃO PAULO,8
PIRASSUNUNGA,DEPUTADO FEDERAL,PAULO TEIXEIRA,LUIZ PAULO TEIXEIRA FERREIRA,ELEITO,PT,JUNTOS POR SÃO PAULO,173
PIRASSUNUNGA,DEPUTADO FEDERAL,CLAURY,CLAURY SANTOS ALVES DA SILVA,SUPLENTE,PTB,PARTIDO TRABALHISTA BRASILEIRO,1
PIRASSUNUNGA,DEPUTADO FEDERAL,VAMPETA,MARCOS ANDRE BATISTA SANTOS,SUPLENTE,PTB,PARTIDO TRABALHISTA BRASILEIRO,2
PIRASSUNUNGA,DEPUTADO FEDERAL,NADUR,ADALBERTO NADUR,SUPLENTE,PTB,PARTIDO TRABALHISTA BRASILEIRO,1
PIRASSUNUNGA,DEPUTADO FEDERAL,SANTANA,JOSE SANTANA DE ABREU,SUPLENTE,PTB,PARTIDO TRABALHISTA BRASILEIRO,1
PIRASSUNUNGA,DEPUTADO FEDERAL,PIRU,CLAUDIO AFFONSO,SUPLENTE,PTB,PARTIDO TRABALHISTA BRASILEIRO,3
PIRASSUNUNGA,DEPUTADO FEDERAL,ESTER,ESTER DA SILVA,SUPLENTE,PTB,PARTIDO TRABALHISTA BRASILEIRO,3
PIRASSUNUNGA,DEPUTADO FEDERAL,ROBSON TUMA,ROBSON TUMA,SUPLENTE,PTB,PARTIDO TRABALHISTA BRASILEIRO,28
PIRASSUNUNGA,DEPUTADO FEDERAL,RICARDO OLIVEIRA,RICARDO JOSE DE OLIVEIRA,SUPLENTE,PTB,PARTIDO TRABALHISTA BRASILEIRO,1
PIRASSUNUNGA,DEPUTADO FEDERAL,TICO DO TRANSPORTE ESCOLAR,ALBERTO GOMES BARBOSA,SUPLENTE,PTB,PARTIDO TRABALHISTA BRASILEIRO,1
PIRASSUNUNGA,DEPUTADO FEDERAL,OBAMA BRASIL,ANANIAS RODRIGUES DA SILVA,SUPLENTE,PTB,PARTIDO TRABALHISTA BRASILEIRO,2
PIRASSUNUNGA,DEPUTADO FEDERAL,PROF CLAUDIO ZANUTIM,CLAUDIO ZANUTIM MORAES,SUPLENTE,PTB,PARTIDO TRABALHISTA BRASILEIRO,1
PIRASSUNUNGA,DEPUTADO FEDERAL,AMIRAH SABA DA METROPOLITANAFM,AMIRAH SABA,SUPLENTE,PTB,PARTIDO TRABALHISTA BRASILEIRO,2
PIRASSUNUNGA,DEPUTADO FEDERAL,SINVAL DORIGON,SINVAL ROBERTO DORIGON,SUPLENTE,PTB,PARTIDO TRABALHISTA BRASILEIRO,5
PIRASSUNUNGA,DEPUTADO FEDERAL,NELSON MARQUEZELLI,NELSON MARQUEZELLI,ELEITO,PTB,PARTIDO TRABALHISTA BRASILEIRO,7739
PIRASSUNUNGA,DEPUTADO FEDERAL,CARLOS BURGHI,CARLOS ALBERTO EBERT BURGHI,SUPLENTE,PTB,PARTIDO TRABALHISTA BRASILEIRO,8
PIRASSUNUNGA,DEPUTADO FEDERAL,MARCOS CRIPPA,MARCOS ANTONIO CRIPPA,SUPLENTE,PTB,PARTIDO TRABALHISTA BRASILEIRO,5
PIRASSUNUNGA,DEPUTADO FEDERAL,FRANCISCO MESQUITA,FRANCISCO CICERO MESQUITA,SUPLENTE,PTB,PARTIDO TRABALHISTA BRASILEIRO,3
PIRASSUNUNGA,DEPUTADO FEDERAL,CELSO MENDES,CELSO MENDES CÚTALO,SUPLENTE,PTB,PARTIDO TRABALHISTA BRASILEIRO,1
PIRASSUNUNGA,DEPUTADO FEDERAL,AUREA RODRIGUES,AUREA RODRIGUES MADEIRO,SUPLENTE,PTB,PARTIDO TRABALHISTA BRASILEIRO,2
PIRASSUNUNGA,DEPUTADO FEDERAL,WALDOMIRO RAMOS,WALDOMIRO CARLOS RAMOS,SUPLENTE,PTB,PARTIDO TRABALHISTA BRASILEIRO,3
PIRASSUNUNGA,DEPUTADO FEDERAL,LUIZ MIELLI,JOSÉ FERNANDO DE SOUSA MIELLI,SUPLENTE,PTB,PARTIDO TRABALHISTA BRASILEIRO,13
PIRASSUNUNGA,DEPUTADO FEDERAL,SATURNINO DE BRITO,SATURNINO DE SALES SANTOS,SUPLENTE,PTB,PARTIDO TRABALHISTA BRASILEIRO,2
PIRASSUNUNGA,DEPUTADO FEDERAL,BRESSAN,ANTONIO BRESSAN FILHO,SUPLENTE,PTB,PARTIDO TRABALHISTA BRASILEIRO,2
PIRASSUNUNGA,DEPUTADO FEDERAL,IRMÃO TIÃOZINHO SOLDADOR,SEBASTIÃO FABIANO FERREIRA DA CRUZ,SUPLENTE,PTB,PARTIDO TRABALHISTA BRASILEIRO,2
PIRASSUNUNGA,DEPUTADO FEDERAL,CIGANA,GISELA DOS SANTOS,SUPLENTE,PTB,PARTIDO TRABALHISTA BRASILEIRO,1
PIRASSUNUNGA,DEPUTADO FEDERAL,ARNALDO FARIA DE SÁ,ARNALDO FARIA DE SÁ,ELEITO,PTB,PARTIDO TRABALHISTA BRASILEIRO,72
PIRASSUNUNGA,DEPUTADO FEDERAL,TIM,ADILSON FERNANDES VARELA,SUPLENTE,PTB,PARTIDO TRABALHISTA BRASILEIRO,1
PIRASSUNUNGA,DEPUTADO FEDERAL,CELIO DINIZ,CELIO FRANCISCO DINIZ,SUPLENTE,PTB,PARTIDO TRABALHISTA BRASILEIRO,7
PIRASSUNUNGA,DEPUTADO FEDERAL,CLAUDIA SARTORI,CLAUDIA SARTORI DONATTI DE SOUZA,SUPLENTE,PTB,PARTIDO TRABALHISTA BRASILEIRO,1
PIRASSUNUNGA,DEPUTADO FEDERAL,SAITO-SAN,EDUARDO TSUNEO SAITO,SUPLENTE,PTB,PARTIDO TRABALHISTA BRASILEIRO,2
PIRASSUNUNGA,DEPUTADO FEDERAL,WALTER CAVEANHA,WALTER CAVEANHA,SUPLENTE,PTB,PARTIDO TRABALHISTA BRASILEIRO,1
PIRASSUNUNGA,DEPUTADO FEDERAL,FRANK AGUIAR,FRANCINETO LUZ DE AGUIAR,SUPLENTE,PTB,PARTIDO TRABALHISTA BRASILEIRO,3
PIRASSUNUNGA,DEPUTADO FEDERAL,DR ANDRE ROCHA,ANDRE LUIS ROCHA,SUPLENTE,PTB,PARTIDO TRABALHISTA BRASILEIRO,1
PIRASSUNUNGA,DEPUTADO FEDERAL,PADRE FERNANDO,LAUDINEY FERNANDO SILVA FRAGA,SUPLENTE,PTB,PARTIDO TRABALHISTA BRASILEIRO,175
PIRASSUNUNGA,DEPUTADO FEDERAL,PAULO LIMA,PAULO CESAR DE OLIVEIRA LIMA,SUPLENTE,PMDB,PARTIDO DO MOVIMENTO DEMOCRÁTICO BRASILEIRO,9
PIRASSUNUNGA,DEPUTADO FEDERAL,CARVALHO SALES,JEFFERSON CARVALHO SALES,SUPLENTE,PMDB,PARTIDO DO MOVIMENTO DEMOCRÁTICO BRASILEIRO,4
PIRASSUNUNGA,DEPUTADO FEDERAL,VANDERLEI JUELI,VANDERLEI JUELI,SUPLENTE,PMDB,PARTIDO DO MOVIMENTO DEMOCRÁTICO BRASILEIRO,2
PIRASSUNUNGA,DEPUTADO FEDERAL,NENÊ MONTANHER,ALCIDES MONTANHER FILHO,SUPLENTE,PMDB,PARTIDO DO MOVIMENTO DEMOCRÁTICO BRASILEIRO,1
PIRASSUNUNGA,DEPUTADO FEDERAL,EDUARDO COELHO,EDUARDO JOSÉ PEREIRA COELHO,SUPLENTE,PMDB,PARTIDO DO MOVIMENTO DEMOCRÁTICO BRASILEIRO,10
PIRASSUNUNGA,DEPUTADO FEDERAL,PILTON RIOS,PILTON RIOS DE BARROS FELIX PEREIRA,SUPLENTE,PMDB,PARTIDO DO MOVIMENTO DEMOCRÁTICO BRASILEIRO,3
PIRASSUNUNGA,DEPUTADO FEDERAL,CASTANHO,GULHERME DE MELLO CASTANHO,SUPLENTE,PMDB,PARTIDO DO MOVIMENTO DEMOCRÁTICO BRASILEIRO,1
PIRASSUNUNGA,DEPUTADO FEDERAL,SINIVAL,SINIVAL JOSE INACIO,SUPLENTE,PMDB,PARTIDO DO MOVIMENTO DEMOCRÁTICO BRASILEIRO,1
PIRASSUNUNGA,DEPUTADO FEDERAL,EDINHO ARAUJO,EDSON EDINHO COELHO ARAUJO,ELEITO,PMDB,PARTIDO DO MOVIMENTO DEMOCRÁTICO BRASILEIRO,9
PIRASSUNUNGA,DEPUTADO FEDERAL,SERGIO KOBRA,SERGIO MARTINS DOS SANTOS JUNIOR,SUPLENTE,PMDB,PARTIDO DO MOVIMENTO DEMOCRÁTICO BRASILEIRO,2
PIRASSUNUNGA,DEPUTADO FEDERAL,ROLEMBERG,ROLANDO BELTRAMINE ROLEMBERG,SUPLENTE,PMDB,PARTIDO DO MOVIMENTO DEMOCRÁTICO BRASILEIRO,1
PIRASSUNUNGA,DEPUTADO FEDERAL,CORONEL EX GAMA SANTOS,FERDNAN GAMA SANTOS,SUPLENTE,PMDB,PARTIDO DO MOVIMENTO DEMOCRÁTICO BRASILEIRO,1
PIRASSUNUNGA,DEPUTADO FEDERAL,BOCA NERVOSA,EDMAR MARQUES SILVA,SUPLENTE,PMDB,PARTIDO DO MOVIMENTO DEMOCRÁTICO BRASILEIRO,1
PIRASSUNUNGA,DEPUTADO FEDERAL,REGA,ALBERTO REGA,SUPLENTE,PMDB,PARTIDO DO MOVIMENTO DEMOCRÁTICO BRASILEIRO,1
PIRASSUNUNGA,DEPUTADO FEDERAL,LEONARDO HENRIQUE,LEONARDO HENRIQUE CRAVO,SUPLENTE,PMDB,PARTIDO DO MOVIMENTO DEMOCRÁTICO BRASILEIRO,1
PIRASSUNUNGA,DEPUTADO FEDERAL,LÉO OLIVEIRA,OCIMAR DONIZETI LEO OLIVEIRA,SUPLENTE,PMDB,PARTIDO DO MOVIMENTO DEMOCRÁTICO BRASILEIRO,38
PIRASSUNUNGA,DEPUTADO FEDERAL,DR. CÉSAR,LUIZ CESAR REGINATO,SUPLENTE,PMDB,PARTIDO DO MOVIMENTO DEMOCRÁTICO BRASILEIRO,1
PIRASSUNUNGA,DEPUTADO FEDERAL,PABLIO REBESSI,PABLIO JOSÉ REBESSI,SUPLENTE,PMDB,PARTIDO DO MOVIMENTO DEMOCRÁTICO BRASILEIRO,15
PIRASSUNUNGA,DEPUTADO FEDERAL,JUAREZ COSTA SANTOS,JOARÊS PAULINO DA COSTA,SUPLENTE,PMDB,PARTIDO DO MOVIMENTO DEMOCRÁTICO BRASILEIRO,1
PIRASSUNUNGA,DEPUTADO FEDERAL,APOSTOLO LEO,LEONILDIO LIMA DE OLIVEIRA,SUPLENTE,PSL,PRESTE ATENÇÃO SÃO PAULO,1
PIRASSUNUNGA,DEPUTADO FEDERAL,ROBERTO SIQUEIRA,ROBERTO SIQUEIRA GOMES,SUPLENTE,PSL,PRESTE ATENÇÃO SÃO PAULO,14
PIRASSUNUNGA,DEPUTADO FEDERAL,CORONEL GILSON LOPES,GILSON LOPES DA SILVA,SUPLENTE,PSC,HUMANISTA CRISTÃO ,2
PIRASSUNUNGA,DEPUTADO FEDERAL,MISSIONARIA NAZARE,MARIA NAZARE DOS SANTOS SORRILLO,SUPLENTE,PSC,HUMANISTA CRISTÃO ,10
PIRASSUNUNGA,DEPUTADO FEDERAL,MARCO FELICIANO,MARCO ANTONIO FELICIANO,ELEITO,PSC,HUMANISTA CRISTÃO ,53
PIRASSUNUNGA,DEPUTADO FEDERAL,MARCELO AGUIAR,MARCELO THEODORO DE AGUIAR,ELEITO,PSC,HUMANISTA CRISTÃO ,6
PIRASSUNUNGA,DEPUTADO FEDERAL,CHICO NETO,FRANCISCO DA COSTA NETO,SUPLENTE,PSC,HUMANISTA CRISTÃO ,1
PIRASSUNUNGA,DEPUTADO FEDERAL,ARI BARCELLOS,JOSE DE ARIMATHEA BARCELLOS,SUPLENTE,PSC,HUMANISTA CRISTÃO ,4
PIRASSUNUNGA,DEPUTADO FEDERAL,REGIS DE OLIVEIRA,REGIS FERNANDES DE OLIVEIRA,SUPLENTE,PSC,HUMANISTA CRISTÃO ,29
PIRASSUNUNGA,DEPUTADO FEDERAL,NEY SANTOS,CLAUDINEI ALVES DOS SANTOS,SUPLENTE,PSC,HUMANISTA CRISTÃO ,2
PIRASSUNUNGA,DEPUTADO FEDERAL,PR. LUIZ LEMOS,LUIZ CARLOS LEMOS,SUPLENTE,PSC,HUMANISTA CRISTÃO ,10
PIRASSUNUNGA,DEPUTADO FEDERAL,MANOEL GASPAR,MANOEL FERREIRA DE SOUZA GASPAR,SUPLENTE,PSC,HUMANISTA CRISTÃO ,1
PIRASSUNUNGA,DEPUTADO FEDERAL,JUCA CHAVES,JURANDYR CZACZKES CHAVES,SUPLENTE,PR,JUNTOS POR SÃO PAULO,18
PIRASSUNUNGA,DEPUTADO FEDERAL,AGNALDO TIMOTEO,AGUINALDO TIMOTEO PEREIRA,SUPLENTE,PR,JUNTOS POR SÃO PAULO,19
PIRASSUNUNGA,DEPUTADO FEDERAL,TIRIRICA,FRANCISCO EVERARDO OLIVEIRA SILVA,ELEITO,PR,JUNTOS POR SÃO PAULO,709
PIRASSUNUNGA,DEPUTADO FEDERAL,PR PAULO FREIRE,PAULO ROBERTO FREIRE DA COSTA,ELEITO,PR,JUNTOS POR SÃO PAULO,25
PIRASSUNUNGA,DEPUTADO FEDERAL,LUCIANA COSTA,LUCIANA DE ALMEIDA COSTA,SUPLENTE,PR,JUNTOS POR SÃO PAULO,11
PIRASSUNUNGA,DEPUTADO FEDERAL,MILTON MONTI,MILTON ANTONIO CASQUEL MONTI,ELEITO,PR,JUNTOS POR SÃO PAULO,19
PIRASSUNUNGA,DEPUTADO FEDERAL,VALDEMAR COSTA NETO,VALDEMAR COSTA NETO,ELEITO,PR,JUNTOS POR SÃO PAULO,1
PIRASSUNUNGA,DEPUTADO FEDERAL,WILLIAM WOO,WILLIAM BOSS WOO,SUPLENTE,PPS,PSDB/DEM/PPS,8
PIRASSUNUNGA,DEPUTADO FEDERAL,ROBERTO FREIRE,ROBERTO JOAO PEREIRA FREIRE,ELEITO,PPS,PSDB/DEM/PPS,34
PIRASSUNUNGA,DEPUTADO FEDERAL,DIMAS RAMALHO,DIMAS EDUARDO RAMALHO,ELEITO,PPS,PSDB/DEM/PPS,6
PIRASSUNUNGA,DEPUTADO FEDERAL,ARI FRIEDENBACH,ARI FRIEDENBACH,SUPLENTE,PPS,PSDB/DEM/PPS,22
PIRASSUNUNGA,DEPUTADO FEDERAL,JOSE ONERIO,JOSE ONERIO DA SILVA,SUPLENTE,PPS,PSDB/DEM/PPS,16
PIRASSUNUNGA,DEPUTADO FEDERAL,ARNALDO JARDIM,ARNALDO CALIL PEREIRA JARDIM,ELEITO,PPS,PSDB/DEM/PPS,168
PIRASSUNUNGA,DEPUTADO FEDERAL,DOUTOR LIMA,FRANCISCO ALVES DE LIMA,SUPLENTE,PPS,PSDB/DEM/PPS,7
PIRASSUNUNGA,DEPUTADO FEDERAL,JORGE TADEU,JORGE TADEU MUDALEN,ELEITO,DEM,PSDB/DEM/PPS,204
PIRASSUNUNGA,DEPUTADO FEDERAL,JORGINHO MALULY,JORGE DE FARIA MALULY,SUPLENTE,DEM,PSDB/DEM/PPS,2
PIRASSUNUNGA,DEPUTADO FEDERAL,PROFESSOR BENJAMIN,BENJAMIN RIBEIRO DA SILVA,SUPLENTE,DEM,PSDB/DEM/PPS,1
PIRASSUNUNGA,DEPUTADO FEDERAL,KIKO DO KLB,FRANCO FINATO SCORNAVACCA,SUPLENTE,DEM,PSDB/DEM/PPS,26
PIRASSUNUNGA,DEPUTADO FEDERAL,RODRIGO GARCIA,RODRIGO GARCIA,ELEITO,DEM,PSDB/DEM/PPS,10
PIRASSUNUNGA,DEPUTADO FEDERAL,MARCELO PALINKAS,MARCELO PALINKAS,SUPLENTE,DEM,PSDB/DEM/PPS,1
PIRASSUNUNGA,DEPUTADO FEDERAL,ZULAIÊ COBRA,ZULAIE COBRA RIBEIRO,SUPLENTE,DEM,PSDB/DEM/PPS,5
PIRASSUNUNGA,DEPUTADO FEDERAL,LUCIANO ARTIOLI,LUCIANO ARTIOLI MOREIRA,SUPLENTE,DEM,PSDB/DEM/PPS,10
PIRASSUNUNGA,DEPUTADO FEDERAL,RAUL GIL JR,RAUL GIL JUNIOR,SUPLENTE,DEM,PSDB/DEM/PPS,6
PIRASSUNUNGA,DEPUTADO FEDERAL,JUNJI ABE,JUNJI ABE,ELEITO,DEM,PSDB/DEM/PPS,4
PIRASSUNUNGA,DEPUTADO FEDERAL,SALIM REIS,ANTONIO CARLOS DOS REIS,SUPLENTE,DEM,PSDB/DEM/PPS,1
PIRASSUNUNGA,DEPUTADO FEDERAL,MANDIC,ALEKSANDAR CARLOS MANDIC,SUPLENTE,DEM,PSDB/DEM/PPS,3
PIRASSUNUNGA,DEPUTADO FEDERAL,HELIO SECCO,HELIO RODRIGUES SECCO,SUPLENTE,DEM,PSDB/DEM/PPS,6
PIRASSUNUNGA,DEPUTADO FEDERAL,ELI CORREA FILHO,ADRIANO ELI CORREA,ELEITO,DEM,PSDB/DEM/PPS,5
PIRASSUNUNGA,DEPUTADO FEDERAL,DR ELEUSES PAIVA,ELEUSES VIEIRA DE PAIVA,SUPLENTE,DEM,PSDB/DEM/PPS,15
PIRASSUNUNGA,DEPUTADO FEDERAL,GUILHERME CAMPOS,GUILHERME CAMPOS JUNIOR,MÉDIA,DEM,PSDB/DEM/PPS,133
PIRASSUNUNGA,DEPUTADO FEDERAL,WALTER IHOSHI,WALTER SHINDI IIHOSHI,SUPLENTE,DEM,PSDB/DEM/PPS,1
PIRASSUNUNGA,DEPUTADO FEDERAL,CACIQUE DARÃ,ANTONISIO LULU,SUPLENTE,PHS,HUMANISTA CRISTÃO ,1
PIRASSUNUNGA,DEPUTADO FEDERAL,PROF HERMES,HERMES RODRIGUES NERY,SUPLENTE,PHS,HUMANISTA CRISTÃO ,1
PIRASSUNUNGA,DEPUTADO FEDERAL,JONAS DONIZETTE,JONAS DONIZETTE FERREIRA,ELEITO,PSB,PRESTE ATENÇÃO SÃO PAULO,10
PIRASSUNUNGA,DEPUTADO FEDERAL,MÁRCIA LIMA,APARECIDO BARBOSA LIMA,SUPLENTE,PSB,PRESTE ATENÇÃO SÃO PAULO,1
PIRASSUNUNGA,DEPUTADO FEDERAL,DENNYS SERRANO,DENNYS HADDAD SERRANO,SUPLENTE,PSB,PRESTE ATENÇÃO SÃO PAULO,1
PIRASSUNUNGA,DEPUTADO FEDERAL,MARCELINHO CARIOCA,MARCELO PEREIRA SURCIN,SUPLENTE,PSB,PRESTE ATENÇÃO SÃO PAULO,31
PIRASSUNUNGA,DEPUTADO FEDERAL,MARCOS DE PAULA,MARCOS DE PAULA,SUPLENTE,PSB,PRESTE ATENÇÃO SÃO PAULO,2
PIRASSUNUNGA,DEPUTADO FEDERAL,GUSTAVO HERRMANN,GUSTAVO RANZANI HERRMANN,SUPLENTE,PSB,PRESTE ATENÇÃO SÃO PAULO,1
PIRASSUNUNGA,DEPUTADO FEDERAL,SARGENTO FERNANDO,FERNANDO ALCÂNTARA DE FIGUEIREDO,SUPLENTE,PSB,PRESTE ATENÇÃO SÃO PAULO,2
PIRASSUNUNGA,DEPUTADO FEDERAL,ELISEU GABRIEL,ELISEU GABRIEL DE PIERI,SUPLENTE,PSB,PRESTE ATENÇÃO SÃO PAULO,10
PIRASSUNUNGA,DEPUTADO FEDERAL,CAPITÃO AUGUSTO,JOSÉ AUGUSTO ROSA,SUPLENTE,PSB,PRESTE ATENÇÃO SÃO PAULO,50
PIRASSUNUNGA,DEPUTADO FEDERAL,LUIZA ERUNDINA,LUIZA ERUNDINA DE SOUSA,ELEITO,PSB,PRESTE ATENÇÃO SÃO PAULO,24
PIRASSUNUNGA,DEPUTADO FEDERAL,CHINELO,JOSÉ AVELINO PEREIRA,SUPLENTE,PSB,PRESTE ATENÇÃO SÃO PAULO,2
PIRASSUNUNGA,DEPUTADO FEDERAL,GABRIEL CHALITA,GABRIEL BENEDITO ISSAAC CHALITA,ELEITO,PSB,PRESTE ATENÇÃO SÃO PAULO,290
PIRASSUNUNGA,DEPUTADO FEDERAL,MÁRCIO FRANÇA,MÁRCIO LUIZ FRANÇA GOMES,ELEITO,PSB,PRESTE ATENÇÃO SÃO PAULO,11
PIRASSUNUNGA,DEPUTADO FEDERAL,CORAUCI,VALDEMAR CORAUCI SOBRINHO,SUPLENTE,PSB,PRESTE ATENÇÃO SÃO PAULO,5
PIRASSUNUNGA,DEPUTADO FEDERAL,RUBINHO CAI CAI,RUBENS ESTEVES ROQUE,SUPLENTE,PSB,PRESTE ATENÇÃO SÃO PAULO,1
PIRASSUNUNGA,DEPUTADO FEDERAL,DR. ALEXANDRE,ALEXANDRE SÉRGIO DE OLIVEIRA AZOUBEL,SUPLENTE,PSB,PRESTE ATENÇÃO SÃO PAULO,7
PIRASSUNUNGA,DEPUTADO FEDERAL,DRA. ELAINE,ELAINE APARECIDA BELLONI ABISSAMRA,SUPLENTE,PSB,PRESTE ATENÇÃO SÃO PAULO,1
PIRASSUNUNGA,DEPUTADO FEDERAL,SILENE DE ALMEIDA,SILENE ALVES DE ALMEIDA SOUZA,SUPLENTE,PSB,PRESTE ATENÇÃO SÃO PAULO,1
PIRASSUNUNGA,DEPUTADO FEDERAL,VANDIR MOGNON,VANDIR MOGNON,SUPLENTE,PSB,PRESTE ATENÇÃO SÃO PAULO,1
PIRASSUNUNGA,DEPUTADO FEDERAL,JEFFERSON CAMPOS,JEFFERSON ALVES DE CAMPOS,ELEITO,PSB,PRESTE ATENÇÃO SÃO PAULO,43
PIRASSUNUNGA,DEPUTADO FEDERAL,DR. UBIALI,MARCO AURÉLIO UBIALI,SUPLENTE,PSB,PRESTE ATENÇÃO SÃO PAULO,49
PIRASSUNUNGA,DEPUTADO FEDERAL,OTA,IOLANDA KEIKO MIASHIRO OTA,ELEITO,PSB,PRESTE ATENÇÃO SÃO PAULO,21
PIRASSUNUNGA,DEPUTADO FEDERAL,MIGUEL SAMPAIO,MIGUEL SAMPAIO JUNIOR,SUPLENTE,PSB,PRESTE ATENÇÃO SÃO PAULO,2
PIRASSUNUNGA,DEPUTADO FEDERAL,GUILHERME MUSSI,GUILHERME MUSSI FERREIRA,ELEITO,PV,PARTIDO VERDE,269
PIRASSUNUNGA,DEPUTADO FEDERAL,GILBERTO ABREU,GILBERTO ANDRADE DE ABREU,SUPLENTE,PV,PARTIDO VERDE,1
PIRASSUNUNGA,DEPUTADO FEDERAL,WALTER GONZALIS,WALTER GONZALIS,SUPLENTE,PV,PARTIDO VERDE,2
PIRASSUNUNGA,DEPUTADO FEDERAL,DR TALMIR,TALMIR RODRIGUES,SUPLENTE,PV,PARTIDO VERDE,11
PIRASSUNUNGA,DEPUTADO FEDERAL,VICENTE DA UPA,VICENTE CARVALHO E SILVA,SUPLENTE,PV,PARTIDO VERDE,49
PIRASSUNUNGA,DEPUTADO FEDERAL,EDNA MARTINS,EDNA SANDRA MARTINS,SUPLENTE,PV,PARTIDO VERDE,1
PIRASSUNUNGA,DEPUTADO FEDERAL,JULIO CASTILHO,JULIO CESAR CASTILHO,SUPLENTE,PV,PARTIDO VERDE,5
PIRASSUNUNGA,DEPUTADO FEDERAL,ROBERTO SANTIAGO,JOSE ROBERTO SANTIAGO GOMES,ELEITO,PV,PARTIDO VERDE,6
PIRASSUNUNGA,DEPUTADO FEDERAL,DR INDIO,ALMIR SANTOS,SUPLENTE,PV,PARTIDO VERDE,1
PIRASSUNUNGA,DEPUTADO FEDERAL,CESAR CORTEZ,ANTONIO CESAR CORTEZ,SUPLENTE,PV,PARTIDO VERDE,18
PIRASSUNUNGA,DEPUTADO FEDERAL,ZICA,EUSTAQUIO LUCIANO ZICA,SUPLENTE,PV,PARTIDO VERDE,7
PIRASSUNUNGA,DEPUTADO FEDERAL,CHICO SANTA RITA,FRANCISCO JOSE DE SANTA RITA BEHR,SUPLENTE,PV,PARTIDO VERDE,1
PIRASSUNUNGA,DEPUTADO FEDERAL,PEDRO MANHÃES,PEDRO MANHÃES DE OLIVEIRA,SUPLENTE,PV,PARTIDO VERDE,4
PIRASSUNUNGA,DEPUTADO FEDERAL,ENG PAULINHO,PAULO HENRIQUE DO NASCIMENTO,SUPLENTE,PV,PARTIDO VERDE,6
PIRASSUNUNGA,DEPUTADO FEDERAL,JAIME ROCHA,JAIME BARTOLOMEU DA ROCHA,SUPLENTE,PV,PARTIDO VERDE,1
PIRASSUNUNGA,DEPUTADO FEDERAL,JOVINO CÂNDIDO,JOVINO CÂNDIDO DA SILVA,SUPLENTE,PV,PARTIDO VERDE,2
PIRASSUNUNGA,DEPUTADO FEDERAL,ANA PAULA JUNQUEIRA,ANA PAULA GUIMARAES DE AZEVEDO JUNQUEIRA,SUPLENTE,PV,PARTIDO VERDE,58
PIRASSUNUNGA,DEPUTADO FEDERAL,EVANDRO GUSSI,EVANDRO HERRERA BERTONE GUSSI,SUPLENTE,PV,PARTIDO VERDE,6
PIRASSUNUNGA,DEPUTADO FEDERAL,SUELY SILVA,SUELY DOS ANJOS DA SILVA GARCIA,SUPLENTE,PV,PARTIDO VERDE,2
PIRASSUNUNGA,DEPUTADO FEDERAL,ALE YOUSSEF,ALEXANDRE DE ALMEIDA YOUSSEF,SUPLENTE,PV,PARTIDO VERDE,9
PIRASSUNUNGA,DEPUTADO FEDERAL,MARCELO ORTIZ,FRANCISCO MARCELO ORTIZ FILHO,SUPLENTE,PV,PARTIDO VERDE,3
PIRASSUNUNGA,DEPUTADO FEDERAL,PENNA,JOSÉ LUIZ DE FRANÇA PENNA,ELEITO,PV,PARTIDO VERDE,9
PIRASSUNUNGA,DEPUTADO FEDERAL,ROBERTO DE LUCENA,ROBERTO ALVES DE LUCENA,ELEITO,PV,PARTIDO VERDE,4
