RIO DAS PEDRAS,DEPUTADO ESTADUAL,PEDRO TOBIAS,PEDRO TOBIAS,ELEITO,PSDB,PSDB/DEM,2
RIO DAS PEDRAS,DEPUTADO ESTADUAL,MILTON FLAVIO,MILTON FLAVIO MARQUES LAUTENSCHLAGER,SUPLENTE,PSDB,PSDB/DEM,7
RIO DAS PEDRAS,DEPUTADO ESTADUAL,GERALDO VINHOLI,GERALDO ANTONIO VINHOLI,SUPLENTE,PSDB,PSDB/DEM,1
RIO DAS PEDRAS,DEPUTADO ESTADUAL,RAMALHO DA CONSTRUCAO,ANTONIO DE SOUSA RAMALHO,SUPLENTE,PSDB,PSDB/DEM,1
RIO DAS PEDRAS,DEPUTADO ESTADUAL,WELSON GASPARINI,WELSON GASPARINI,SUPLENTE,PSDB,PSDB/DEM,2
RIO DAS PEDRAS,DEPUTADO ESTADUAL,MAURO BRAGATO,MAURO BRAGATO,ELEITO,PSDB,PSDB/DEM,1
RIO DAS PEDRAS,DEPUTADO ESTADUAL,JOÃO CARAMEZ,JOÃO CARLOS CARAMEZ,ELEITO,PSDB,PSDB/DEM,2
RIO DAS PEDRAS,DEPUTADO ESTADUAL,BRUNO COVAS,BRUNO COVAS LOPES,ELEITO,PSDB,PSDB/DEM,13
RIO DAS PEDRAS,DEPUTADO ESTADUAL,BERNARDO ORTIZ JR,JOSE BERNARDO ORTIZ MONTEIRO JUNIOR,SUPLENTE,PSDB,PSDB/DEM,2
RIO DAS PEDRAS,DEPUTADO ESTADUAL,CELINO,JUSCELINO CARDOSO DE SÁ,ELEITO,PSDB,PSDB/DEM,2
RIO DAS PEDRAS,DEPUTADO ESTADUAL,JOSE BORANGA,JOSE AURELIO BORANGA,SUPLENTE,PSDB,PSDB/DEM,7
RIO DAS PEDRAS,DEPUTADO ESTADUAL,WILMA MALTA,WILMA DE FREITAS MALTA,SUPLENTE,PSDB,PSDB/DEM,1
RIO DAS PEDRAS,DEPUTADO ESTADUAL,CÉLIA LEÃO,CÉLIA CAMARGO LEÃO EDELMUTH,ELEITO,PSDB,PSDB/DEM,23
RIO DAS PEDRAS,DEPUTADO ESTADUAL,BUCK JACINTHO,ANTONIO JOÃO COIMBRA JACINTHO,SUPLENTE,PSDB,PSDB/DEM,1
RIO DAS PEDRAS,DEPUTADO ESTADUAL,ADOLFO QUINTAS,ADOLFO QUINTAS GONÇALVES NETO,SUPLENTE,PSDB,PSDB/DEM,1
RIO DAS PEDRAS,DEPUTADO ESTADUAL,DILADOR BORGES,DILADOR BORGES DAMASCENO,SUPLENTE,PSDB,PSDB/DEM,1
RIO DAS PEDRAS,DEPUTADO ESTADUAL,SAMUEL MOREIRA,SAMUEL MOREIRA DA SILVA JÚNIOR,ELEITO,PSDB,PSDB/DEM,2
RIO DAS PEDRAS,DEPUTADO ESTADUAL,ADMIR FERRO,ADMIR DONIZETI FERRO,SUPLENTE,PSDB,PSDB/DEM,2
RIO DAS PEDRAS,DEPUTADO ESTADUAL,CASSIO NAVARRO,CASSIO DE CASTRO NAVARRO,SUPLENTE,PSDB,PSDB/DEM,7
RIO DAS PEDRAS,DEPUTADO ESTADUAL,CARLOS BEZERRA JR.,CARLOS ALBERTO DE QUADROS BEZERRA JUNIOR,ELEITO,PSDB,PSDB/DEM,3
RIO DAS PEDRAS,DEPUTADO ESTADUAL,CARLOS ALBERTO SANTOS,CARLOS ALBERTO DE OLIVEIRA SANTOS,SUPLENTE,PSDB,PSDB/DEM,1
RIO DAS PEDRAS,DEPUTADO ESTADUAL,MAURICIO PINTERICH,MAURICIO DE OLIVEIRA PINTERICH,SUPLENTE,PSDB,PSDB/DEM,12
RIO DAS PEDRAS,DEPUTADO ESTADUAL,DRA MARY,MARY LUCIA FRANCISCO,SUPLENTE,PSDB,PSDB/DEM,1
RIO DAS PEDRAS,DEPUTADO ESTADUAL,CAUÊ MACRIS,CAUÊ CASEIRO MACRIS,MÉDIA,PSDB,PSDB/DEM,26
RIO DAS PEDRAS,DEPUTADO ESTADUAL,EDISON CANDIDO,EDISON APARECIDO CANDIDO,SUPLENTE,PSDB,PSDB/DEM,1
RIO DAS PEDRAS,DEPUTADO ESTADUAL,CONCCI MARCO,ELIANE CONCEIÇÃO SILVA MENDES,SUPLENTE,PSDB,PSDB/DEM,2
RIO DAS PEDRAS,DEPUTADO ESTADUAL,JOÃO SANZOVO,JOÃO SANZOVO NETO,SUPLENTE,PSDB,PSDB/DEM,1
RIO DAS PEDRAS,DEPUTADO ESTADUAL,VALÉRIA,VALÉRIA CRISTINA MIGLIORANCI,SUPLENTE,PSDB,PSDB/DEM,1
RIO DAS PEDRAS,DEPUTADO ESTADUAL,ROBERTO MASSAFERA,ROBERTO MASSAFERA,ELEITO,PSDB,PSDB/DEM,2
RIO DAS PEDRAS,DEPUTADO ESTADUAL,BARROS MUNHOZ,JOSE ANTONIO BARROS MUNHOZ,ELEITO,PSDB,PSDB/DEM,4
RIO DAS PEDRAS,DEPUTADO ESTADUAL,PAULO ALEXANDRE BARBOSA,PAULO ALEXANDRE PEREIRA BARBOSA,ELEITO,PSDB,PSDB/DEM,65
RIO DAS PEDRAS,DEPUTADO ESTADUAL,GILSON BARRETO,GILSON ALMEIDA BARRETO,SUPLENTE,PSDB,PSDB/DEM,2
RIO DAS PEDRAS,DEPUTADO ESTADUAL,ORLANDO MORANDO,ORLANDO MORANDO JUNIOR,ELEITO,PSDB,PSDB/DEM,2
RIO DAS PEDRAS,DEPUTADO ESTADUAL,FERNANDO CAPEZ,FERNANDO CAPEZ,ELEITO,PSDB,PSDB/DEM,21
RIO DAS PEDRAS,DEPUTADO ESTADUAL,JOSÉ LUIZ RIBEIRO,JOSÉ LUIZ RIBEIRO,SUPLENTE,PSDB,PSDB/DEM,1480
RIO DAS PEDRAS,DEPUTADO ESTADUAL,LUIZINHO DA FAVELA,LUIZ JOÃO DE SOUZA,SUPLENTE,PSOL,PARTIDO SOCIALISMO E LIBERDADE,1
RIO DAS PEDRAS,DEPUTADO ESTADUAL,RAUL MARCELO,RAUL MARCELO DE SOUZA,SUPLENTE,PSOL,PARTIDO SOCIALISMO E LIBERDADE,3
RIO DAS PEDRAS,DEPUTADO ESTADUAL,RAQUEL GUZZO,RAQUEL SOUZA LOBO GUZZO,SUPLENTE,PSOL,PARTIDO SOCIALISMO E LIBERDADE,2
RIO DAS PEDRAS,DEPUTADO ESTADUAL,CARLOS GIANNAZI,CARLOS ALBERTO GIANNASI,ELEITO,PSOL,PARTIDO SOCIALISMO E LIBERDADE,28
RIO DAS PEDRAS,DEPUTADO ESTADUAL,WANDER,WANDER DE OLIVEIRA VILLALBA,SUPLENTE,PC DO B,PARTIDO COMUNISTA DO BRASIL,3
RIO DAS PEDRAS,DEPUTADO ESTADUAL,JOSELITO,JOSELITO DE SOUSA LIMA,SUPLENTE,PC DO B,PARTIDO COMUNISTA DO BRASIL,1
RIO DAS PEDRAS,DEPUTADO ESTADUAL,ERLEI ALIADO,ERLEI ROBERTO DE MELO,SUPLENTE,PC DO B,PARTIDO COMUNISTA DO BRASIL,1
RIO DAS PEDRAS,DEPUTADO ESTADUAL,LECI BRANDÃO,LECI BRANDAO DA SILVA,ELEITO,PC DO B,PARTIDO COMUNISTA DO BRASIL,8
RIO DAS PEDRAS,DEPUTADO ESTADUAL,SARAH MUNHOZ,SARAH MUNHOZ,SUPLENTE,PC DO B,PARTIDO COMUNISTA DO BRASIL,19
RIO DAS PEDRAS,DEPUTADO ESTADUAL,PEDRO BIGARDI,PEDRO ANTONIO BIGARDI,ELEITO,PC DO B,PARTIDO COMUNISTA DO BRASIL,1
RIO DAS PEDRAS,DEPUTADO ESTADUAL,DAVI RAMOS,DAVI GONÇALVES RAMOS,SUPLENTE,PC DO B,PARTIDO COMUNISTA DO BRASIL,27
RIO DAS PEDRAS,DEPUTADO ESTADUAL,NIRALDO SIQUEIRA,NIRALDO FERREIRA DE SIQUEIRA,SUPLENTE,PC DO B,PARTIDO COMUNISTA DO BRASIL,3
RIO DAS PEDRAS,DEPUTADO ESTADUAL,LAURO FABIANO,LAURO FABIANO DE SOUZA CARVALHO,SUPLENTE,PC DO B,PARTIDO COMUNISTA DO BRASIL,1
RIO DAS PEDRAS,DEPUTADO ESTADUAL,PROFESSOR FLAVIO DELMANTO,FLAVIO DELMANTO,SUPLENTE,PC DO B,PARTIDO COMUNISTA DO BRASIL,1
RIO DAS PEDRAS,DEPUTADO ESTADUAL,ABEL ALMEIDA,ABEL OLIVEIRA DE ALMEIDA,SUPLENTE,PT DO B,SOMOS MAIS SÃO PAULO,1
