CARAPICUÍBA,DEPUTADO ESTADUAL,FARIA JR,WALDEMAR ALVES FARIA JUNIOR,SUPLENTE,PP,PARTIDO PROGRESSISTA,92
CARAPICUÍBA,DEPUTADO ESTADUAL,MARIA CLEMENTINA,MARIA CLEMENTINO DE SOUSA,SUPLENTE,PP,PARTIDO PROGRESSISTA,13
CARAPICUÍBA,DEPUTADO ESTADUAL,LAZARO TAVARES CUNHA,LAZARO TAVARES DA CUNHA,SUPLENTE,PP,PARTIDO PROGRESSISTA,1
CARAPICUÍBA,DEPUTADO ESTADUAL,ANDERSON GRECCO,ANDERSON RODRIGUES GRECCO,SUPLENTE,PP,PARTIDO PROGRESSISTA,1
CARAPICUÍBA,DEPUTADO ESTADUAL,VALDIR MARIN,VALDIR SILVEIRA MARIN,SUPLENTE,PP,PARTIDO PROGRESSISTA,4
CARAPICUÍBA,DEPUTADO ESTADUAL,RAFA ZIMBALDI,RAFAEL FERNANDO ZIMBALDI,SUPLENTE,PP,PARTIDO PROGRESSISTA,14
CARAPICUÍBA,DEPUTADO ESTADUAL,ANDRÉ RAFAEL,ANDRE LUIZ DOS SANTOS,SUPLENTE,PP,PARTIDO PROGRESSISTA,2
CARAPICUÍBA,DEPUTADO ESTADUAL,EDINHO,EDSON JOAQUIM DE FREITAS,SUPLENTE,PP,PARTIDO PROGRESSISTA,15
CARAPICUÍBA,DEPUTADO ESTADUAL,NELSON MANDELA,ADOLPHINO ROSARIO CRUZ,SUPLENTE,PP,PARTIDO PROGRESSISTA,1
CARAPICUÍBA,DEPUTADO ESTADUAL,RUSSOMANNO,MOZART ABAETE PERUIBE RUSSOMANNO,SUPLENTE,PP,PARTIDO PROGRESSISTA,17
CARAPICUÍBA,DEPUTADO ESTADUAL,AURELIO,AURELIO JOSE CLAUDIO,SUPLENTE,PDT,PARTIDO DEMOCRÁTICO TRABALHISTA,1
CARAPICUÍBA,DEPUTADO ESTADUAL,PEREIRA METALURGICO,JOSÉ PEREIRA DOS SANTOS,SUPLENTE,PDT,PARTIDO DEMOCRÁTICO TRABALHISTA,7
CARAPICUÍBA,DEPUTADO ESTADUAL,ROGERIO ESPERANÇA,ROGERIO ANTONIO ESPERANCA,SUPLENTE,PDT,PARTIDO DEMOCRÁTICO TRABALHISTA,1
CARAPICUÍBA,DEPUTADO ESTADUAL,OLEGARIO CAYRES,OLEGARIO JOAQUIM CAYRES NETO,SUPLENTE,PDT,PARTIDO DEMOCRÁTICO TRABALHISTA,2
CARAPICUÍBA,DEPUTADO ESTADUAL,CASSOLA,JAIR CASSOLA,SUPLENTE,PDT,PARTIDO DEMOCRÁTICO TRABALHISTA,3
CARAPICUÍBA,DEPUTADO ESTADUAL,KLAUDIO CÓFFANI,KLAUDIO COFFANI NUNES,SUPLENTE,PDT,PARTIDO DEMOCRÁTICO TRABALHISTA,1
CARAPICUÍBA,DEPUTADO ESTADUAL,LUIZ ANTONIO PIRACAIA,LUIZ ANTONIO DA SILVA SOUZA,SUPLENTE,PDT,PARTIDO DEMOCRÁTICO TRABALHISTA,2
CARAPICUÍBA,DEPUTADO ESTADUAL,LUIS YABIKU,LUIS MOKITI YABIKU,SUPLENTE,PDT,PARTIDO DEMOCRÁTICO TRABALHISTA,10
CARAPICUÍBA,DEPUTADO ESTADUAL,DR JUSTINO,LUIZ CARLOS JUSTINO,SUPLENTE,PDT,PARTIDO DEMOCRÁTICO TRABALHISTA,7
CARAPICUÍBA,DEPUTADO ESTADUAL,DINEI,CLAUDINEI ALEXANDRE PIRES,SUPLENTE,PDT,PARTIDO DEMOCRÁTICO TRABALHISTA,56
CARAPICUÍBA,DEPUTADO ESTADUAL,AUREO PRETO,AUREO RODRIGUES DE SOUZA,SUPLENTE,PDT,PARTIDO DEMOCRÁTICO TRABALHISTA,2
CARAPICUÍBA,DEPUTADO ESTADUAL,FRANCISCO JUNIOR,FRANCISCO PEREIRA COSTA JUNIOR,SUPLENTE,PDT,PARTIDO DEMOCRÁTICO TRABALHISTA,1
CARAPICUÍBA,DEPUTADO ESTADUAL,GILBERTO DOURADO,GILBERTO RODRIGUES DOURADO,SUPLENTE,PDT,PARTIDO DEMOCRÁTICO TRABALHISTA,8
CARAPICUÍBA,DEPUTADO ESTADUAL,ROGERIO NOGUEIRA,ROGERIO NOGUEIRA LOPES CRUZ,ELEITO,PDT,PARTIDO DEMOCRÁTICO TRABALHISTA,7
CARAPICUÍBA,DEPUTADO ESTADUAL,CAPITAO LUCAS,AURO LUCAS,SUPLENTE,PDT,PARTIDO DEMOCRÁTICO TRABALHISTA,4
CARAPICUÍBA,DEPUTADO ESTADUAL,LUIZ ARRAES,LUIZ DE SOUZA ARRAES,SUPLENTE,PDT,PARTIDO DEMOCRÁTICO TRABALHISTA,104
CARAPICUÍBA,DEPUTADO ESTADUAL,JOSE BITTENCOURT,JOSE DOMINGOS BITTENCOURT,ELEITO,PDT,PARTIDO DEMOCRÁTICO TRABALHISTA,243
CARAPICUÍBA,DEPUTADO ESTADUAL,PASTOR MAURO FERREIRA,MAURO FERREIRA DE SOUZA,SUPLENTE,PDT,PARTIDO DEMOCRÁTICO TRABALHISTA,4
CARAPICUÍBA,DEPUTADO ESTADUAL,MAJOR OLIMPIO,SERGIO OLIMPIO GOMES,ELEITO,PDT,PARTIDO DEMOCRÁTICO TRABALHISTA,382
CARAPICUÍBA,DEPUTADO ESTADUAL,EVARISTO AFRICA,EVARISTO DOS SANTOS PINTO,SUPLENTE,PDT,PARTIDO DEMOCRÁTICO TRABALHISTA,1
CARAPICUÍBA,DEPUTADO ESTADUAL,CARLAO MOTORISTA,ANTONIO CARLOS RIBEIRO,SUPLENTE,PDT,PARTIDO DEMOCRÁTICO TRABALHISTA,6
CARAPICUÍBA,DEPUTADO ESTADUAL,MARCOS BERNARDELLI,MARCOS JOSÉ BERNARDELLI,SUPLENTE,PDT,PARTIDO DEMOCRÁTICO TRABALHISTA,2
CARAPICUÍBA,DEPUTADO ESTADUAL,JOCA VASCONCELOS,JOAO CARLOS MONTE CLARO VASCONCELOS,SUPLENTE,PDT,PARTIDO DEMOCRÁTICO TRABALHISTA,16
CARAPICUÍBA,DEPUTADO ESTADUAL,BRIZOLA,KARIUM DE ALMEIDA BRIZOLLA,SUPLENTE,PDT,PARTIDO DEMOCRÁTICO TRABALHISTA,3
CARAPICUÍBA,DEPUTADO ESTADUAL,AMON VIOLEIRO,AMOMM HEBROM DA HORA DE DEUS SOUZA,SUPLENTE,PDT,PARTIDO DEMOCRÁTICO TRABALHISTA,28
CARAPICUÍBA,DEPUTADO ESTADUAL,CARLOS HERNANDES,JOSÉ CARLOS SANCHES HERNANDES,SUPLENTE,PDT,PARTIDO DEMOCRÁTICO TRABALHISTA,5
CARAPICUÍBA,DEPUTADO ESTADUAL,NICOLACI,RONALD LUIZ NICOLACI FINCATTI,SUPLENTE,PDT,PARTIDO DEMOCRÁTICO TRABALHISTA,2
CARAPICUÍBA,DEPUTADO ESTADUAL,BRUZAROSCO,APARECIDO DE JESUS BRUZAROSCO,SUPLENTE,PDT,PARTIDO DEMOCRÁTICO TRABALHISTA,5
CARAPICUÍBA,DEPUTADO ESTADUAL,EMERSON LEAL,EMERSON PIRES LEAL,SUPLENTE,PDT,PARTIDO DEMOCRÁTICO TRABALHISTA,6
CARAPICUÍBA,DEPUTADO ESTADUAL,RAFAEL SILVA,RAFAEL ANTONIO DA SILVA,ELEITO,PDT,PARTIDO DEMOCRÁTICO TRABALHISTA,43
CARAPICUÍBA,DEPUTADO ESTADUAL,NICANOR,NICANOR JOSE DA SILVA,SUPLENTE,PDT,PARTIDO DEMOCRÁTICO TRABALHISTA,4
CARAPICUÍBA,DEPUTADO ESTADUAL,TOLOI,LUIZ CARLOS TOLOI JUNIOR,SUPLENTE,PDT,PARTIDO DEMOCRÁTICO TRABALHISTA,20
CARAPICUÍBA,DEPUTADO ESTADUAL,TADEU MORAIS,TADEU MORAIS DE SOUSA,SUPLENTE,PDT,PARTIDO DEMOCRÁTICO TRABALHISTA,1059
CARAPICUÍBA,DEPUTADO ESTADUAL,LEONICE DA PAZ,LEONICE ALVES DA PAZ,SUPLENTE,PDT,PARTIDO DEMOCRÁTICO TRABALHISTA,24
CARAPICUÍBA,DEPUTADO ESTADUAL,HELIO BASTOS,HELIO DE ALMEIDA BASTOS,SUPLENTE,PDT,PARTIDO DEMOCRÁTICO TRABALHISTA,5
CARAPICUÍBA,DEPUTADO ESTADUAL,MYRYAM ATHIE,MIRIAM ATHIE,SUPLENTE,PDT,PARTIDO DEMOCRÁTICO TRABALHISTA,6
CARAPICUÍBA,DEPUTADO ESTADUAL,ZEZINHO DA RADIO,JOSE MARIA FERNANDES DE MACEDO,SUPLENTE,PDT,PARTIDO DEMOCRÁTICO TRABALHISTA,1
CARAPICUÍBA,DEPUTADO ESTADUAL,CONSTANCIA FELIX,CONSTANCIA BERBERT DUTRA DA SILVA,SUPLENTE,PDT,PARTIDO DEMOCRÁTICO TRABALHISTA,13
CARAPICUÍBA,DEPUTADO ESTADUAL,RICARDO BORGES,RICARDO BRANCO BORGES,SUPLENTE,PDT,PARTIDO DEMOCRÁTICO TRABALHISTA,56
CARAPICUÍBA,DEPUTADO ESTADUAL,SILAS FARIA,SILAS FARIA DE SOUZA,SUPLENTE,PDT,PARTIDO DEMOCRÁTICO TRABALHISTA,2
CARAPICUÍBA,DEPUTADO ESTADUAL,VITROLINHA,EUVALDO REIS DOS SANTOS MENEZES,SUPLENTE,PDT,PARTIDO DEMOCRÁTICO TRABALHISTA,3
CARAPICUÍBA,DEPUTADO ESTADUAL,DR SAMUEL SIQUEIRA,SAMUEL SIQUEIRA,SUPLENTE,PDT,PARTIDO DEMOCRÁTICO TRABALHISTA,2
CARAPICUÍBA,DEPUTADO ESTADUAL,MARCO BRASIL,MARCO AURÉLIO RIBEIRO,SUPLENTE,PDT,PARTIDO DEMOCRÁTICO TRABALHISTA,5
CARAPICUÍBA,DEPUTADO ESTADUAL,RUBENS ITO,RUBENS MASSASHI ITO,SUPLENTE,PDT,PARTIDO DEMOCRÁTICO TRABALHISTA,2
CARAPICUÍBA,DEPUTADO ESTADUAL,JOÃO ELIAS,JOÃO ELIAS PEREIRA,SUPLENTE,PDT,PARTIDO DEMOCRÁTICO TRABALHISTA,6
CARAPICUÍBA,DEPUTADO ESTADUAL,JOSE DE ALMEIDA,JOSE MALVINEITE DE ALMEIDA,SUPLENTE,PDT,PARTIDO DEMOCRÁTICO TRABALHISTA,1
CARAPICUÍBA,DEPUTADO ESTADUAL,ANDERSON SILVA,ANDERSON DOMINGOS DA SILVA,SUPLENTE,PT,SOMOS MAIS SÃO PAULO,10
CARAPICUÍBA,DEPUTADO ESTADUAL,DR. JORGE PARADA,JORGE EDUARDO PARADA HURTADO,SUPLENTE,PT,SOMOS MAIS SÃO PAULO,1
CARAPICUÍBA,DEPUTADO ESTADUAL,TELMA DE SOUZA,TELMA SANDRA AUGUSTO DE SOUZA,ELEITO,PT,SOMOS MAIS SÃO PAULO,3
CARAPICUÍBA,DEPUTADO ESTADUAL,PEDRO BIANGULI,PEDRO CARLOS BIANGULI DE FARIA,SUPLENTE,PT,SOMOS MAIS SÃO PAULO,3
CARAPICUÍBA,DEPUTADO ESTADUAL,CLAUDILSON PEZAO,CLAUDILSON LEITE PEREIRA,SUPLENTE,PT,SOMOS MAIS SÃO PAULO,11
CARAPICUÍBA,DEPUTADO ESTADUAL,WAGNER BALIEIRO,WAGNER OCIMAR BALIEIRO,SUPLENTE,PT,SOMOS MAIS SÃO PAULO,3
CARAPICUÍBA,DEPUTADO ESTADUAL,PROFESSOR CLEITON GOMES,CLEITON GOMES DA SILVA,SUPLENTE,PT,SOMOS MAIS SÃO PAULO,4
CARAPICUÍBA,DEPUTADO ESTADUAL,GALENO AMORIM,GALENO DE AMORIM JUNIOR,SUPLENTE,PT,SOMOS MAIS SÃO PAULO,3
CARAPICUÍBA,DEPUTADO ESTADUAL,VALMIR PRASCIDELLI,VALMIR PRASCIDELLI,SUPLENTE,PT,SOMOS MAIS SÃO PAULO,542
CARAPICUÍBA,DEPUTADO ESTADUAL,PORTUGUÊS,REINALDO FARTO NUNES,SUPLENTE,PT,SOMOS MAIS SÃO PAULO,1
CARAPICUÍBA,DEPUTADO ESTADUAL,PAULO MARTINS (GAÚCHO),PAULO CESAR GOMES MARTINS,SUPLENTE,PT,SOMOS MAIS SÃO PAULO,1
CARAPICUÍBA,DEPUTADO ESTADUAL,JURA,JURACY FRANCISCO DE JESUS,SUPLENTE,PT,SOMOS MAIS SÃO PAULO,40
CARAPICUÍBA,DEPUTADO ESTADUAL,GERSON BITTENCOURT,GERSON LUIS BITTENCOURT,ELEITO,PT,SOMOS MAIS SÃO PAULO,13
CARAPICUÍBA,DEPUTADO ESTADUAL,EDINHO SILVA,EDSON ANTONIO EDINHO DA SILVA,ELEITO,PT,SOMOS MAIS SÃO PAULO,255
CARAPICUÍBA,DEPUTADO ESTADUAL,ENIO TATTO,ENIO FRANCISCO TATTO,ELEITO,PT,SOMOS MAIS SÃO PAULO,730
CARAPICUÍBA,DEPUTADO ESTADUAL,RAFAEL MARINHO,RAFAEL DE FIGUEIREDO MARINHO,SUPLENTE,PT,SOMOS MAIS SÃO PAULO,1
CARAPICUÍBA,DEPUTADO ESTADUAL,ANA PERUGINI,ANA LUCIA LIPPAUS PERUGINI,ELEITO,PT,SOMOS MAIS SÃO PAULO,6
CARAPICUÍBA,DEPUTADO ESTADUAL,TONINHO DO PT,ANTONIO AMARAL JUNIOR,SUPLENTE,PT,SOMOS MAIS SÃO PAULO,4
CARAPICUÍBA,DEPUTADO ESTADUAL,ZICO,JOSÉ PRADO DE ANDRADE,MÉDIA,PT,SOMOS MAIS SÃO PAULO,20
CARAPICUÍBA,DEPUTADO ESTADUAL,SALETE CAMPARI,FRANCISCO DE SALES RODRIGUES,SUPLENTE,PT,SOMOS MAIS SÃO PAULO,8
CARAPICUÍBA,DEPUTADO ESTADUAL,WILSON SANTOS,WILSON SANTOS PEREIRA,SUPLENTE,PT,SOMOS MAIS SÃO PAULO,38
CARAPICUÍBA,DEPUTADO ESTADUAL,MARCO AURÉLIO DE SOUZA,MARCO AURÉLIO DE SOUZA,MÉDIA,PT,SOMOS MAIS SÃO PAULO,10
CARAPICUÍBA,DEPUTADO ESTADUAL,MARCOS MARTINS,MARCOS LOPES MARTINS,ELEITO,PT,SOMOS MAIS SÃO PAULO,883
CARAPICUÍBA,DEPUTADO ESTADUAL,DR. LUIZINHO,LUIS CARLOS LAURINDO,SUPLENTE,PT,SOMOS MAIS SÃO PAULO,23
CARAPICUÍBA,DEPUTADO ESTADUAL,ELI TEODORO,ELI TEODORO,SUPLENTE,PT,SOMOS MAIS SÃO PAULO,45
CARAPICUÍBA,DEPUTADO ESTADUAL,SIMÃO PEDRO,SIMÃO PEDRO CHIOVETTI,ELEITO,PT,SOMOS MAIS SÃO PAULO,35
CARAPICUÍBA,DEPUTADO ESTADUAL,IVANETE VIEIRA,IVANETE APARECIDA DOS SANTOS,SUPLENTE,PT,SOMOS MAIS SÃO PAULO,5
CARAPICUÍBA,DEPUTADO ESTADUAL,GERALDO CRUZ,GERALDO LEITE DA CRUZ,ELEITO,PT,SOMOS MAIS SÃO PAULO,314
CARAPICUÍBA,DEPUTADO ESTADUAL,CLEUSA QUILOMBOLA,CLEUSA SAMPAIO,SUPLENTE,PT,SOMOS MAIS SÃO PAULO,3
CARAPICUÍBA,DEPUTADO ESTADUAL,RUI FALCÃO,RUI GOETHE DA COSTA FALCÃO,ELEITO,PT,SOMOS MAIS SÃO PAULO,389
CARAPICUÍBA,DEPUTADO ESTADUAL,JUSTINO CAMPO BELO,JUSTINO DA SILVA,SUPLENTE,PT,SOMOS MAIS SÃO PAULO,5
CARAPICUÍBA,DEPUTADO ESTADUAL,ÉMERSON TAUYL,EMERSON LIMA TAUYL,SUPLENTE,PT,SOMOS MAIS SÃO PAULO,1
CARAPICUÍBA,DEPUTADO ESTADUAL,ANTONIO MENTOR,ANTONIO MENTOR DE MELLO SOBRINHO,ELEITO,PT,SOMOS MAIS SÃO PAULO,112
CARAPICUÍBA,DEPUTADO ESTADUAL,CRISTINA DA USP,CRISTINA SIMOES,SUPLENTE,PT,SOMOS MAIS SÃO PAULO,2
CARAPICUÍBA,DEPUTADO ESTADUAL,PADRE JUZEMILDO,JUZEMILDO ALBINO DA SILVA,SUPLENTE,PT,SOMOS MAIS SÃO PAULO,6
CARAPICUÍBA,DEPUTADO ESTADUAL,ADRIANO DIOGO,ADRIANO DIOGO,ELEITO,PT,SOMOS MAIS SÃO PAULO,27
CARAPICUÍBA,DEPUTADO ESTADUAL,PROFESSOR MATIAS VIEIRA,MATIAS VIEIRA,SUPLENTE,PT,SOMOS MAIS SÃO PAULO,4
CARAPICUÍBA,DEPUTADO ESTADUAL,ESTELA ALMAGRO,ESTELA ALEXANDRE ALMAGRO,SUPLENTE,PT,SOMOS MAIS SÃO PAULO,139
CARAPICUÍBA,DEPUTADO ESTADUAL,HAMILTON PEREIRA,HAMILTON PEREIRA,ELEITO,PT,SOMOS MAIS SÃO PAULO,8
CARAPICUÍBA,DEPUTADO ESTADUAL,EUVANILDE,EUVANILDE RODRIGUES DA SILVA,SUPLENTE,PT,SOMOS MAIS SÃO PAULO,6
CARAPICUÍBA,DEPUTADO ESTADUAL,LUIZ CLAUDIO MARCOLINO,LUIZ CLAUDIO MARCOLINO,ELEITO,PT,SOMOS MAIS SÃO PAULO,1659
CARAPICUÍBA,DEPUTADO ESTADUAL,RENATO DO GEB,RENATO MORENI AIRES DA SILVA,SUPLENTE,PT,SOMOS MAIS SÃO PAULO,11
CARAPICUÍBA,DEPUTADO ESTADUAL,DENISE ERBELLA,DENISE ELOÁ CUSTÓDIO ERBELLA DE CASTRO,SUPLENTE,PT,SOMOS MAIS SÃO PAULO,19
CARAPICUÍBA,DEPUTADO ESTADUAL,NATIVIDADE,MARIA DA NATIVIDADE PEREIRA LIMA,SUPLENTE,PT,SOMOS MAIS SÃO PAULO,26
CARAPICUÍBA,DEPUTADO ESTADUAL,ROBERTO FELICIO,ROBERTO FELICIO,SUPLENTE,PT,SOMOS MAIS SÃO PAULO,19
CARAPICUÍBA,DEPUTADO ESTADUAL,ROSANA GASPAR,ROSANA EMILIA GASPAR,SUPLENTE,PT,SOMOS MAIS SÃO PAULO,1
CARAPICUÍBA,DEPUTADO ESTADUAL,BETH SAHAO,ELISABETH SAHÃO,SUPLENTE,PT,SOMOS MAIS SÃO PAULO,86
CARAPICUÍBA,DEPUTADO ESTADUAL,PAULINHO MARQUES,PAULO MARQUES DE OLIVEIRA,SUPLENTE,PT,SOMOS MAIS SÃO PAULO,3
CARAPICUÍBA,DEPUTADO ESTADUAL,ADINAN ORTOLAN,JOSÉ ADINAN ORTOLAN,SUPLENTE,PT,SOMOS MAIS SÃO PAULO,1
CARAPICUÍBA,DEPUTADO ESTADUAL,FRANCISCO FRANÇA,FRANCISCO FRANÇA DA SILVA,SUPLENTE,PT,SOMOS MAIS SÃO PAULO,10
CARAPICUÍBA,DEPUTADO ESTADUAL,LELO PAGANI,LUIZ AURELIO PAGANI,SUPLENTE,PT,SOMOS MAIS SÃO PAULO,4
CARAPICUÍBA,DEPUTADO ESTADUAL,ALENCAR,ALENCAR SANTANA BRAGA,ELEITO,PT,SOMOS MAIS SÃO PAULO,309
CARAPICUÍBA,DEPUTADO ESTADUAL,TIÃOZINHO,SEBASTIÃO MOREIREA ARCANJO,SUPLENTE,PT,SOMOS MAIS SÃO PAULO,2
CARAPICUÍBA,DEPUTADO ESTADUAL,VERA SABA,VERA LÚCIA SANTOS SABA,SUPLENTE,PT,SOMOS MAIS SÃO PAULO,3
CARAPICUÍBA,DEPUTADO ESTADUAL,PROFESSOR AGNERIO,AGNERIO NERI FERREIRA,SUPLENTE,PT,SOMOS MAIS SÃO PAULO,83
CARAPICUÍBA,DEPUTADO ESTADUAL,ISAC REIS,ISAC FRANCO DOS REIS,ELEITO,PT,SOMOS MAIS SÃO PAULO,40003
CARAPICUÍBA,DEPUTADO ESTADUAL,BRENO CORTELLA,BRENO ZANONI CORTELLA,SUPLENTE,PT,SOMOS MAIS SÃO PAULO,19
CARAPICUÍBA,DEPUTADO ESTADUAL,JOÃO PAULO RILLO,JOÃO PAULO RILLO,ELEITO,PT,SOMOS MAIS SÃO PAULO,10
CARAPICUÍBA,DEPUTADO ESTADUAL,ANA DO CARMO,ANA MARIA DO CARMO ROSSETO,ELEITO,PT,SOMOS MAIS SÃO PAULO,10
CARAPICUÍBA,DEPUTADO ESTADUAL,MIRANDA,JOSÉ CARLOS MIRANDA,SUPLENTE,PT,SOMOS MAIS SÃO PAULO,9
CARAPICUÍBA,DEPUTADO ESTADUAL,BETO CANGUSSU,LUIZ ROBERTO ALVES CANGUSSU,SUPLENTE,PT,SOMOS MAIS SÃO PAULO,3
CARAPICUÍBA,DEPUTADO ESTADUAL,JOSÉ CANDIDO,JOSÉ DE SOUZA CÂNDIDO,MÉDIA,PT,SOMOS MAIS SÃO PAULO,9
CARAPICUÍBA,DEPUTADO ESTADUAL,JOÃO ANTONIO,JOAO ANTONIO DA SILVA FILHO,ELEITO,PT,SOMOS MAIS SÃO PAULO,20
CARAPICUÍBA,DEPUTADO ESTADUAL,GALLO,JURANDIR GALLO,SUPLENTE,PT,SOMOS MAIS SÃO PAULO,22
CARAPICUÍBA,DEPUTADO ESTADUAL,LINEU NAVARRO,LUIZ ANTONIO NAVARRO MAGALHÃES LUZ,SUPLENTE,PT,SOMOS MAIS SÃO PAULO,5
CARAPICUÍBA,DEPUTADO ESTADUAL,IRENE,IRENE DOS SANTOS,SUPLENTE,PT,SOMOS MAIS SÃO PAULO,4
CARAPICUÍBA,DEPUTADO ESTADUAL,FERNANDO ESCODEIRO,LUIZ FERNANDO ESCODEIRO,SUPLENTE,PT,SOMOS MAIS SÃO PAULO,3
CARAPICUÍBA,DEPUTADO ESTADUAL,MÁRCIO CHAVES,MÁRCIO CHAVES PIRES,SUPLENTE,PT,SOMOS MAIS SÃO PAULO,3
CARAPICUÍBA,DEPUTADO ESTADUAL,ZÉ ARISTEIA,JOSÉ ARISTEIA PEREIRA,SUPLENTE,PT,SOMOS MAIS SÃO PAULO,8
CARAPICUÍBA,DEPUTADO ESTADUAL,SÉRGIO DESIDERÁ,SÉRGIO DESIDERÁ,SUPLENTE,PT,SOMOS MAIS SÃO PAULO,5
CARAPICUÍBA,DEPUTADO ESTADUAL,CARLOS GRANA,CARLOS ALBERTO GRANA,ELEITO,PT,SOMOS MAIS SÃO PAULO,20
CARAPICUÍBA,DEPUTADO ESTADUAL,JOEL FONSECA,JOEL FONSECA COSTA,SUPLENTE,PT,SOMOS MAIS SÃO PAULO,3
CARAPICUÍBA,DEPUTADO ESTADUAL,TARCÍSIO,JOSÉ TARCÍSIO DE OLIVEIRA,SUPLENTE,PT,SOMOS MAIS SÃO PAULO,3
CARAPICUÍBA,DEPUTADO ESTADUAL,FAUSTO FIGUEIRA,FAUSTO FIGUEIRA DE MELLO JUNIOR,SUPLENTE,PT,SOMOS MAIS SÃO PAULO,4
CARAPICUÍBA,DEPUTADO ESTADUAL,ELISEU COSTA,ELISEU SILVA COSTA,SUPLENTE,PT,SOMOS MAIS SÃO PAULO,5
CARAPICUÍBA,DEPUTADO ESTADUAL,VERA GOULART,VERA LUCIA GOULART GONÇALVES,SUPLENTE,PT,SOMOS MAIS SÃO PAULO,3
CARAPICUÍBA,DEPUTADO ESTADUAL,TITO,FRANCISCO DE ASSIS PEREIRA DE CAMPOS,SUPLENTE,PT,SOMOS MAIS SÃO PAULO,116
CARAPICUÍBA,DEPUTADO ESTADUAL,TOFFOLI,JOSÉ TICIANO DIAS TOFFOLI,SUPLENTE,PT,SOMOS MAIS SÃO PAULO,1
CARAPICUÍBA,DEPUTADO ESTADUAL,LUIZ MOURA,LUIZ DE MOURA PEREIRA,ELEITO,PT,SOMOS MAIS SÃO PAULO,56
CARAPICUÍBA,DEPUTADO ESTADUAL,GILSON PELIZARO,GILSON DONIZETE PELIZARO,SUPLENTE,PT,SOMOS MAIS SÃO PAULO,1
CARAPICUÍBA,DEPUTADO ESTADUAL,PROFESSOR HERCULANO,JOSÉ HERCULANO DA SILVA,SUPLENTE,PT,SOMOS MAIS SÃO PAULO,1
CARAPICUÍBA,DEPUTADO ESTADUAL,DONISETE BRAGA,DONISETE PEREIRA BRAGA,ELEITO,PT,SOMOS MAIS SÃO PAULO,109
CARAPICUÍBA,DEPUTADO ESTADUAL,CARLOS NEDER,CARLOS ALBERTO PLETZ NEDER,SUPLENTE,PT,SOMOS MAIS SÃO PAULO,313
CARAPICUÍBA,DEPUTADO ESTADUAL,MUG,EVERALDO ERNESTO DOS SANTOS,SUPLENTE,PTB,PARTIDO TRABALHISTA BRASILEIRO,5
CARAPICUÍBA,DEPUTADO ESTADUAL,SERGIO FERREIRA,ANTONIO SERGIO FERREIRA,SUPLENTE,PTB,PARTIDO TRABALHISTA BRASILEIRO,1
CARAPICUÍBA,DEPUTADO ESTADUAL,PROFª MARA CIDINHA,MARIA APARECIDA BATISTA LEITE,SUPLENTE,PTB,PARTIDO TRABALHISTA BRASILEIRO,1
CARAPICUÍBA,DEPUTADO ESTADUAL,ADONIAS,ADONIAS FACIO,SUPLENTE,PTB,PARTIDO TRABALHISTA BRASILEIRO,3
CARAPICUÍBA,DEPUTADO ESTADUAL,LÉO ÁQUILLA,JADSON MENDES DE LIMA,SUPLENTE,PTB,PARTIDO TRABALHISTA BRASILEIRO,51
CARAPICUÍBA,DEPUTADO ESTADUAL,NEY CARLOS,NEI CARLOS DOS SANTOS,SUPLENTE,PTB,PARTIDO TRABALHISTA BRASILEIRO,1
CARAPICUÍBA,DEPUTADO ESTADUAL,VERA LUCIA,VERA LUCIA PEREIRA ALVES,SUPLENTE,PTB,PARTIDO TRABALHISTA BRASILEIRO,11
CARAPICUÍBA,DEPUTADO ESTADUAL,LUIZ LAZARINI,LUIZ CARLOS LAZARINI,SUPLENTE,PTB,PARTIDO TRABALHISTA BRASILEIRO,1
CARAPICUÍBA,DEPUTADO ESTADUAL,PASTOR LEBA,JOSE LAERCIO LUCAS CORREA,SUPLENTE,PTB,PARTIDO TRABALHISTA BRASILEIRO,2
CARAPICUÍBA,DEPUTADO ESTADUAL,ANDRE FORLIN,ANDRE LUIS MARTINS FORLIN,SUPLENTE,PTB,PARTIDO TRABALHISTA BRASILEIRO,2
CARAPICUÍBA,DEPUTADO ESTADUAL,CEBOLINHA,JOAO VIANELLE PINTO,SUPLENTE,PTB,PARTIDO TRABALHISTA BRASILEIRO,1
CARAPICUÍBA,DEPUTADO ESTADUAL,MARILIA,AMARILIA ISABEL VIEIRA,SUPLENTE,PTB,PARTIDO TRABALHISTA BRASILEIRO,20
CARAPICUÍBA,DEPUTADO ESTADUAL,JOSÉ THEO DE SOUZA,JOSÉ THEODORO DE SOUZA,SUPLENTE,PTB,PARTIDO TRABALHISTA BRASILEIRO,1
CARAPICUÍBA,DEPUTADO ESTADUAL,CONTE LOPES,ROBERVAL CONTE LOPES LIMA,SUPLENTE,PTB,PARTIDO TRABALHISTA BRASILEIRO,167
CARAPICUÍBA,DEPUTADO ESTADUAL,CAMPOS MACHADO,ANTONIO CARLOS DE CAMPOS MACHADO,ELEITO,PTB,PARTIDO TRABALHISTA BRASILEIRO,532
CARAPICUÍBA,DEPUTADO ESTADUAL,VANDO,ORVANDO DA SILVA,SUPLENTE,PTB,PARTIDO TRABALHISTA BRASILEIRO,2
CARAPICUÍBA,DEPUTADO ESTADUAL,JUVENCIO MARQUES,JUVENCIO MARQUES DE ALCANTARA,SUPLENTE,PTB,PARTIDO TRABALHISTA BRASILEIRO,1
CARAPICUÍBA,DEPUTADO ESTADUAL,DANIEL MACEDO AZEVEDO,DANIEL MACEDO DE AZEVEDO,SUPLENTE,PTB,PARTIDO TRABALHISTA BRASILEIRO,1
CARAPICUÍBA,DEPUTADO ESTADUAL,ROQUE BARBIERE - ROQUINHO,ROQUE BARBIERE,ELEITO,PTB,PARTIDO TRABALHISTA BRASILEIRO,12
CARAPICUÍBA,DEPUTADO ESTADUAL,MATRIX,SAMUEL DOS SANTOS PARREIRA GABRIEL,SUPLENTE,PTB,PARTIDO TRABALHISTA BRASILEIRO,3
CARAPICUÍBA,DEPUTADO ESTADUAL,HEROILMA SOARES TAVARES,HEROILMA SOARES TAVARES,MÉDIA,PTB,PARTIDO TRABALHISTA BRASILEIRO,9
CARAPICUÍBA,DEPUTADO ESTADUAL,MOISES DA FUNERARIA,MOISES ANTONIO DE LIMA,SUPLENTE,PTB,PARTIDO TRABALHISTA BRASILEIRO,1
CARAPICUÍBA,DEPUTADO ESTADUAL,CORONEL EDSON FERRARINI,EDSON FERRARINI,ELEITO,PTB,PARTIDO TRABALHISTA BRASILEIRO,94
CARAPICUÍBA,DEPUTADO ESTADUAL,DANIEL OLIVEIRA,DANIEL DA SILVA OLIVEIRA,SUPLENTE,PTB,PARTIDO TRABALHISTA BRASILEIRO,1
CARAPICUÍBA,DEPUTADO ESTADUAL,PASTOR DARCY,DARCY ELIAS DOS SANTOS,SUPLENTE,PTB,PARTIDO TRABALHISTA BRASILEIRO,1
CARAPICUÍBA,DEPUTADO ESTADUAL,MIGUELZINHO,MIGUEL PEREIRA DE SOUZA,SUPLENTE,PTB,PARTIDO TRABALHISTA BRASILEIRO,1
CARAPICUÍBA,DEPUTADO ESTADUAL,JOSE FERRO,JOSE FERREIRA FERRO DA SILVA,SUPLENTE,PTB,PARTIDO TRABALHISTA BRASILEIRO,2
CARAPICUÍBA,DEPUTADO ESTADUAL,FATIMA ARAUJO,MARIA DE FATIMA COSTA DE ARAUJO,SUPLENTE,PTB,PARTIDO TRABALHISTA BRASILEIRO,1
CARAPICUÍBA,DEPUTADO ESTADUAL,GERSINHO ROMERO,GERSON MOREIRA ROMERO,SUPLENTE,PTB,PARTIDO TRABALHISTA BRASILEIRO,77
CARAPICUÍBA,DEPUTADO ESTADUAL,VAL,ENIVALDO RAMOS DE FREITAS,SUPLENTE,PTB,PARTIDO TRABALHISTA BRASILEIRO,136
CARAPICUÍBA,DEPUTADO ESTADUAL,ADMAR LUIZ - MARGARIDA,ADMAR LUIZ FERREIRA,SUPLENTE,PTB,PARTIDO TRABALHISTA BRASILEIRO,1
CARAPICUÍBA,DEPUTADO ESTADUAL,SIVALDO FAISCA,SIVALDO RODRIGUES DE OLIVEIRA,SUPLENTE,PTB,PARTIDO TRABALHISTA BRASILEIRO,1
CARAPICUÍBA,DEPUTADO ESTADUAL,TARDELLI,ROBERTO TARDELLI,SUPLENTE,PTB,PARTIDO TRABALHISTA BRASILEIRO,8
CARAPICUÍBA,DEPUTADO ESTADUAL,PROFESSOR LEANDRO MOU,LEANDRO TADEU CAZARROTTI,SUPLENTE,PTB,PARTIDO TRABALHISTA BRASILEIRO,35
CARAPICUÍBA,DEPUTADO ESTADUAL,MARCELO MINGRONE,MARCELO SALVADOR MINGRONE,SUPLENTE,PTB,PARTIDO TRABALHISTA BRASILEIRO,7
CARAPICUÍBA,DEPUTADO ESTADUAL,CELSO ITAROTI,CELSO ITAROTI CANCELIERI CERVA,SUPLENTE,PTB,PARTIDO TRABALHISTA BRASILEIRO,1
CARAPICUÍBA,DEPUTADO ESTADUAL,WANESSA BOMFIM,WANESSA SOUSA BOMFIM,SUPLENTE,PTB,PARTIDO TRABALHISTA BRASILEIRO,1
CARAPICUÍBA,DEPUTADO ESTADUAL,PROFESSORA ALBA LUCENA,ALBA LUCENA FERNANDES GANDIA,SUPLENTE,PTB,PARTIDO TRABALHISTA BRASILEIRO,1
CARAPICUÍBA,DEPUTADO ESTADUAL,WALDIR AGNELLO,WALDIR AGNELLO,SUPLENTE,PTB,PARTIDO TRABALHISTA BRASILEIRO,443
CARAPICUÍBA,DEPUTADO ESTADUAL,AMELITO FIDELIS,AMELITO FIDELIS DOS SANTOS,SUPLENTE,PTB,PARTIDO TRABALHISTA BRASILEIRO,1
CARAPICUÍBA,DEPUTADO ESTADUAL,ITALO RENE,ITALO RENE CORREA,SUPLENTE,PTB,PARTIDO TRABALHISTA BRASILEIRO,2
CARAPICUÍBA,DEPUTADO ESTADUAL,PALHACO PIROLETA,WILSON ARAUJO DE FARIA,SUPLENTE,PTB,PARTIDO TRABALHISTA BRASILEIRO,2
CARAPICUÍBA,DEPUTADO ESTADUAL,PASTOR BELARMINO,MOISES BELARMINO,SUPLENTE,PTB,PARTIDO TRABALHISTA BRASILEIRO,1
CARAPICUÍBA,DEPUTADO ESTADUAL,GILBERTO DO PRIMAVERA,GILBERTO WACHTLER,SUPLENTE,PTB,PARTIDO TRABALHISTA BRASILEIRO,2
CARAPICUÍBA,DEPUTADO ESTADUAL,CABO DALMIR E LARANJA,DALMIR MARCIO MARÇAL,SUPLENTE,PTB,PARTIDO TRABALHISTA BRASILEIRO,2
CARAPICUÍBA,DEPUTADO ESTADUAL,BALEIA ROSSI,LUIZ FELIPE BALEIA TENUTO ROSSI,ELEITO,PMDB,PARTIDO DO MOVIMENTO DEMOCRÁTICO BRASILEIRO,7
CARAPICUÍBA,DEPUTADO ESTADUAL,DRA ADRIANA,ADRIANA DI NARDO SILVA,SUPLENTE,PMDB,PARTIDO DO MOVIMENTO DEMOCRÁTICO BRASILEIRO,5
CARAPICUÍBA,DEPUTADO ESTADUAL,REGINALDO NUNES,REGINALDO NUNES BEZERRA,SUPLENTE,PMDB,PARTIDO DO MOVIMENTO DEMOCRÁTICO BRASILEIRO,1
CARAPICUÍBA,DEPUTADO ESTADUAL,BEBETTO,ALBERTO FELIPPE HADDAD FILHO,SUPLENTE,PMDB,PARTIDO DO MOVIMENTO DEMOCRÁTICO BRASILEIRO,9
CARAPICUÍBA,DEPUTADO ESTADUAL,SARGENTO PRIETO,MARIANO PRIETO,SUPLENTE,PMDB,PARTIDO DO MOVIMENTO DEMOCRÁTICO BRASILEIRO,5
CARAPICUÍBA,DEPUTADO ESTADUAL,THIAGO FERRARI,THIAGO DE MORAES FERRARI,SUPLENTE,PMDB,PARTIDO DO MOVIMENTO DEMOCRÁTICO BRASILEIRO,2
CARAPICUÍBA,DEPUTADO ESTADUAL,DU TONIN,EDUARDO TONIN,SUPLENTE,PMDB,PARTIDO DO MOVIMENTO DEMOCRÁTICO BRASILEIRO,1
CARAPICUÍBA,DEPUTADO ESTADUAL,MARCO ANTONIO,MARCO ANTONIO CAMPOS,SUPLENTE,PMDB,PARTIDO DO MOVIMENTO DEMOCRÁTICO BRASILEIRO,1
CARAPICUÍBA,DEPUTADO ESTADUAL,IBRAIM,IBRAIM ANTONIO ABOU JOKH,SUPLENTE,PMDB,PARTIDO DO MOVIMENTO DEMOCRÁTICO BRASILEIRO,66
CARAPICUÍBA,DEPUTADO ESTADUAL,CARUSO,JORGE LUIS CARUSO,ELEITO,PMDB,PARTIDO DO MOVIMENTO DEMOCRÁTICO BRASILEIRO,31
CARAPICUÍBA,DEPUTADO ESTADUAL,FABIO BELLO,FABIO BELLO DE OLIVEIRA,SUPLENTE,PMDB,PARTIDO DO MOVIMENTO DEMOCRÁTICO BRASILEIRO,28
CARAPICUÍBA,DEPUTADO ESTADUAL,DR. ARNALDO,ARNALDO DONIZETTI DANTAS,SUPLENTE,PMDB,PARTIDO DO MOVIMENTO DEMOCRÁTICO BRASILEIRO,1
CARAPICUÍBA,DEPUTADO ESTADUAL,VANESSA DAMO,VANESSA DAMO OROSCO,ELEITO,PMDB,PARTIDO DO MOVIMENTO DEMOCRÁTICO BRASILEIRO,18
CARAPICUÍBA,DEPUTADO ESTADUAL,GILBERTO FRANÇA,GILBERTO CAETANO DE FRANÇA,SUPLENTE,PMDB,PARTIDO DO MOVIMENTO DEMOCRÁTICO BRASILEIRO,2
CARAPICUÍBA,DEPUTADO ESTADUAL,PROF. CANDIDO,CANDIDO GARCIA ALONSO,SUPLENTE,PMDB,PARTIDO DO MOVIMENTO DEMOCRÁTICO BRASILEIRO,1
CARAPICUÍBA,DEPUTADO ESTADUAL,VALDOMIRO,VALDOMIRO FRANCISCO DE OLIVEIRA,SUPLENTE,PMDB,PARTIDO DO MOVIMENTO DEMOCRÁTICO BRASILEIRO,2
CARAPICUÍBA,DEPUTADO ESTADUAL,UEBE REZECK,UEBE REZECK,SUPLENTE,PMDB,PARTIDO DO MOVIMENTO DEMOCRÁTICO BRASILEIRO,1
CARAPICUÍBA,DEPUTADO ESTADUAL,HABIB,GEORGES HABIB JARROUGE,SUPLENTE,PMDB,PARTIDO DO MOVIMENTO DEMOCRÁTICO BRASILEIRO,1
CARAPICUÍBA,DEPUTADO ESTADUAL,CHICÃO SERRA TALHADA,FRANCISCO BEZERRA DOS SANTOS,SUPLENTE,PMDB,PARTIDO DO MOVIMENTO DEMOCRÁTICO BRASILEIRO,3
CARAPICUÍBA,DEPUTADO ESTADUAL,ITAMAR BORGES,ITAMAR FRANCISCO MACHADO BORGES,MÉDIA,PMDB,PARTIDO DO MOVIMENTO DEMOCRÁTICO BRASILEIRO,18
CARAPICUÍBA,DEPUTADO ESTADUAL,DILSON DIAS,DILSON DIAS RIBEIRO,SUPLENTE,PMDB,PARTIDO DO MOVIMENTO DEMOCRÁTICO BRASILEIRO,1
CARAPICUÍBA,DEPUTADO ESTADUAL,JONAS,JONAS PEREIRA DE LIMA,SUPLENTE,PMDB,PARTIDO DO MOVIMENTO DEMOCRÁTICO BRASILEIRO,1
CARAPICUÍBA,DEPUTADO ESTADUAL,MARIA TERESA,MARIA TERESA DA SILVA,SUPLENTE,PMDB,PARTIDO DO MOVIMENTO DEMOCRÁTICO BRASILEIRO,1
CARAPICUÍBA,DEPUTADO ESTADUAL,MARIA DO CARMO GUILHERME,MARIA DO CARMO GUILHERME,SUPLENTE,PMDB,PARTIDO DO MOVIMENTO DEMOCRÁTICO BRASILEIRO,6
CARAPICUÍBA,DEPUTADO ESTADUAL,SOUZA VIGILANTE,JOSÉ CLAUDIVAM DOS SANTOS SOUZA,SUPLENTE,PMDB,PARTIDO DO MOVIMENTO DEMOCRÁTICO BRASILEIRO,6
CARAPICUÍBA,DEPUTADO ESTADUAL,ANGELA RAMALHO,ANGELA MARIA ANTUNES DE CARVALHO TAVARES,SUPLENTE,PMDB,PARTIDO DO MOVIMENTO DEMOCRÁTICO BRASILEIRO,4
CARAPICUÍBA,DEPUTADO ESTADUAL,JOOJI HATO,JOOJI HATO,ELEITO,PMDB,PARTIDO DO MOVIMENTO DEMOCRÁTICO BRASILEIRO,46
CARAPICUÍBA,DEPUTADO ESTADUAL,TARCILIO BOSCO,TARCILIO BOSCO,SUPLENTE,PMDB,PARTIDO DO MOVIMENTO DEMOCRÁTICO BRASILEIRO,1
CARAPICUÍBA,DEPUTADO ESTADUAL,JÂNIO,JÂNIO GONÇALVES DE OLIVEIRA,SUPLENTE,PMDB,PARTIDO DO MOVIMENTO DEMOCRÁTICO BRASILEIRO,425
CARAPICUÍBA,DEPUTADO ESTADUAL,TUNICO VIEIRA,ANTONIO JOSÉ VIEIRA JUNIOR,SUPLENTE,PMDB,PARTIDO DO MOVIMENTO DEMOCRÁTICO BRASILEIRO,4
CARAPICUÍBA,DEPUTADO ESTADUAL,ALEXANDRE CUNHA,ALEXANDRE EVARISTO CUNHA,SUPLENTE,PMDB,PARTIDO DO MOVIMENTO DEMOCRÁTICO BRASILEIRO,4
CARAPICUÍBA,DEPUTADO ESTADUAL,DRA VIVI FERNANDES,VIVIANI FERNANDES DE OLIVEIRA,SUPLENTE,PMDB,PARTIDO DO MOVIMENTO DEMOCRÁTICO BRASILEIRO,5
CARAPICUÍBA,DEPUTADO ESTADUAL,MOURA ANDRADE,JOAQUIM VICENTE DE MOURA ANDRADE JUNIOR,SUPLENTE,PMDB,PARTIDO DO MOVIMENTO DEMOCRÁTICO BRASILEIRO,1
CARAPICUÍBA,DEPUTADO ESTADUAL,REGINA MARIANO,MARIA REGINA LEAL MARIANO,SUPLENTE,PMDB,PARTIDO DO MOVIMENTO DEMOCRÁTICO BRASILEIRO,6
CARAPICUÍBA,DEPUTADO ESTADUAL,PESTANA,WAGNER DE OLIVEIRA PESTANA,SUPLENTE,PMDB,PARTIDO DO MOVIMENTO DEMOCRÁTICO BRASILEIRO,7
CARAPICUÍBA,DEPUTADO ESTADUAL,ANA PAULA ROSSI,ANA PAULA ROSSI DE ALMEIDA MAGDESIAN,SUPLENTE,PMDB,PARTIDO DO MOVIMENTO DEMOCRÁTICO BRASILEIRO,173
CARAPICUÍBA,DEPUTADO ESTADUAL,COUTINHO JUNIOR,OSWALDO BARBOSA COUTINHO JUNIOR,SUPLENTE,PMDB,PARTIDO DO MOVIMENTO DEMOCRÁTICO BRASILEIRO,3
CARAPICUÍBA,DEPUTADO ESTADUAL,OLIVEIRA JUNIOR,ELIO APARECIDO DE OLIVEIRA,SUPLENTE,PSC,HUMANISTA CRISTÃO ,2
CARAPICUÍBA,DEPUTADO ESTADUAL,REINALDO BRICOLA,REINALDO BRICOLA,SUPLENTE,PSC,HUMANISTA CRISTÃO ,3
CARAPICUÍBA,DEPUTADO ESTADUAL,CELSO NASCIMENTO,CELSO BRAZ DO NASCIMENTO,SUPLENTE,PSC,HUMANISTA CRISTÃO ,18
CARAPICUÍBA,DEPUTADO ESTADUAL,JAAN TAMMERIK,JAAN FRANCISCO ROMERA TAMMERIK,SUPLENTE,PSC,HUMANISTA CRISTÃO ,1
CARAPICUÍBA,DEPUTADO ESTADUAL,APOSTOLO EURIPEDES,EURIPEDES LUIZ DE SOUSA,SUPLENTE,PSC,HUMANISTA CRISTÃO ,76
CARAPICUÍBA,DEPUTADO ESTADUAL,ALAN NETO,ANTONIO CARLOS BARBOSA NEVES,SUPLENTE,PSC,HUMANISTA CRISTÃO ,4
