VÁRZEA PAULISTA,DEPUTADO ESTADUAL,MYRYAM ATHIE,MIRIAM ATHIE,SUPLENTE,PDT,PARTIDO DEMOCRÁTICO TRABALHISTA,3
VÁRZEA PAULISTA,DEPUTADO ESTADUAL,WENDEL ALVES,WENDEL ALVES DE SOUSA,SUPLENTE,PDT,PARTIDO DEMOCRÁTICO TRABALHISTA,1
VÁRZEA PAULISTA,DEPUTADO ESTADUAL,ZE DIAS,JOSE CARLOS FERREIRA DIAS,SUPLENTE,PDT,PARTIDO DEMOCRÁTICO TRABALHISTA,213
VÁRZEA PAULISTA,DEPUTADO ESTADUAL,CONSTANCIA FELIX,CONSTANCIA BERBERT DUTRA DA SILVA,SUPLENTE,PDT,PARTIDO DEMOCRÁTICO TRABALHISTA,4
VÁRZEA PAULISTA,DEPUTADO ESTADUAL,LUCINHA DA NOCA,ANA LUCIA BARBOSA DOS SANTOS,SUPLENTE,PDT,PARTIDO DEMOCRÁTICO TRABALHISTA,1
VÁRZEA PAULISTA,DEPUTADO ESTADUAL,RICARDO BORGES,RICARDO BRANCO BORGES,SUPLENTE,PDT,PARTIDO DEMOCRÁTICO TRABALHISTA,1
VÁRZEA PAULISTA,DEPUTADO ESTADUAL,MARCO BRASIL,MARCO AURÉLIO RIBEIRO,SUPLENTE,PDT,PARTIDO DEMOCRÁTICO TRABALHISTA,13
VÁRZEA PAULISTA,DEPUTADO ESTADUAL,ANDERSON SILVA,ANDERSON DOMINGOS DA SILVA,SUPLENTE,PT,SOMOS MAIS SÃO PAULO,14
VÁRZEA PAULISTA,DEPUTADO ESTADUAL,PEDRO BIANGULI,PEDRO CARLOS BIANGULI DE FARIA,SUPLENTE,PT,SOMOS MAIS SÃO PAULO,4
VÁRZEA PAULISTA,DEPUTADO ESTADUAL,PROFESSOR CLEITON GOMES,CLEITON GOMES DA SILVA,SUPLENTE,PT,SOMOS MAIS SÃO PAULO,1
VÁRZEA PAULISTA,DEPUTADO ESTADUAL,GALENO AMORIM,GALENO DE AMORIM JUNIOR,SUPLENTE,PT,SOMOS MAIS SÃO PAULO,1
VÁRZEA PAULISTA,DEPUTADO ESTADUAL,VALMIR PRASCIDELLI,VALMIR PRASCIDELLI,SUPLENTE,PT,SOMOS MAIS SÃO PAULO,12
VÁRZEA PAULISTA,DEPUTADO ESTADUAL,JURA,JURACY FRANCISCO DE JESUS,SUPLENTE,PT,SOMOS MAIS SÃO PAULO,34
VÁRZEA PAULISTA,DEPUTADO ESTADUAL,GERSON BITTENCOURT,GERSON LUIS BITTENCOURT,ELEITO,PT,SOMOS MAIS SÃO PAULO,998
VÁRZEA PAULISTA,DEPUTADO ESTADUAL,EDINHO SILVA,EDSON ANTONIO EDINHO DA SILVA,ELEITO,PT,SOMOS MAIS SÃO PAULO,1338
VÁRZEA PAULISTA,DEPUTADO ESTADUAL,ENIO TATTO,ENIO FRANCISCO TATTO,ELEITO,PT,SOMOS MAIS SÃO PAULO,1
VÁRZEA PAULISTA,DEPUTADO ESTADUAL,RAFAEL MARINHO,RAFAEL DE FIGUEIREDO MARINHO,SUPLENTE,PT,SOMOS MAIS SÃO PAULO,5
VÁRZEA PAULISTA,DEPUTADO ESTADUAL,ANA PERUGINI,ANA LUCIA LIPPAUS PERUGINI,ELEITO,PT,SOMOS MAIS SÃO PAULO,46
VÁRZEA PAULISTA,DEPUTADO ESTADUAL,TONINHO DO PT,ANTONIO AMARAL JUNIOR,SUPLENTE,PT,SOMOS MAIS SÃO PAULO,8
VÁRZEA PAULISTA,DEPUTADO ESTADUAL,ZICO,JOSÉ PRADO DE ANDRADE,MÉDIA,PT,SOMOS MAIS SÃO PAULO,13
VÁRZEA PAULISTA,DEPUTADO ESTADUAL,SALETE CAMPARI,FRANCISCO DE SALES RODRIGUES,SUPLENTE,PT,SOMOS MAIS SÃO PAULO,9
VÁRZEA PAULISTA,DEPUTADO ESTADUAL,WILSON SANTOS,WILSON SANTOS PEREIRA,SUPLENTE,PT,SOMOS MAIS SÃO PAULO,1
VÁRZEA PAULISTA,DEPUTADO ESTADUAL,MARCO AURÉLIO DE SOUZA,MARCO AURÉLIO DE SOUZA,MÉDIA,PT,SOMOS MAIS SÃO PAULO,1
VÁRZEA PAULISTA,DEPUTADO ESTADUAL,MARCOS MARTINS,MARCOS LOPES MARTINS,ELEITO,PT,SOMOS MAIS SÃO PAULO,565
VÁRZEA PAULISTA,DEPUTADO ESTADUAL,DR. LUIZINHO,LUIS CARLOS LAURINDO,SUPLENTE,PT,SOMOS MAIS SÃO PAULO,128
VÁRZEA PAULISTA,DEPUTADO ESTADUAL,ELI TEODORO,ELI TEODORO,SUPLENTE,PT,SOMOS MAIS SÃO PAULO,26
VÁRZEA PAULISTA,DEPUTADO ESTADUAL,SIMÃO PEDRO,SIMÃO PEDRO CHIOVETTI,ELEITO,PT,SOMOS MAIS SÃO PAULO,332
VÁRZEA PAULISTA,DEPUTADO ESTADUAL,IVANETE VIEIRA,IVANETE APARECIDA DOS SANTOS,SUPLENTE,PT,SOMOS MAIS SÃO PAULO,2
VÁRZEA PAULISTA,DEPUTADO ESTADUAL,GERALDO CRUZ,GERALDO LEITE DA CRUZ,ELEITO,PT,SOMOS MAIS SÃO PAULO,3
VÁRZEA PAULISTA,DEPUTADO ESTADUAL,CLEUSA QUILOMBOLA,CLEUSA SAMPAIO,SUPLENTE,PT,SOMOS MAIS SÃO PAULO,1
VÁRZEA PAULISTA,DEPUTADO ESTADUAL,RUI FALCÃO,RUI GOETHE DA COSTA FALCÃO,ELEITO,PT,SOMOS MAIS SÃO PAULO,8
VÁRZEA PAULISTA,DEPUTADO ESTADUAL,JUSTINO CAMPO BELO,JUSTINO DA SILVA,SUPLENTE,PT,SOMOS MAIS SÃO PAULO,9
VÁRZEA PAULISTA,DEPUTADO ESTADUAL,ÉMERSON TAUYL,EMERSON LIMA TAUYL,SUPLENTE,PT,SOMOS MAIS SÃO PAULO,2
VÁRZEA PAULISTA,DEPUTADO ESTADUAL,ANTONIO MENTOR,ANTONIO MENTOR DE MELLO SOBRINHO,ELEITO,PT,SOMOS MAIS SÃO PAULO,461
VÁRZEA PAULISTA,DEPUTADO ESTADUAL,CRISTINA DA USP,CRISTINA SIMOES,SUPLENTE,PT,SOMOS MAIS SÃO PAULO,10
VÁRZEA PAULISTA,DEPUTADO ESTADUAL,PADRE JUZEMILDO,JUZEMILDO ALBINO DA SILVA,SUPLENTE,PT,SOMOS MAIS SÃO PAULO,7
VÁRZEA PAULISTA,DEPUTADO ESTADUAL,ADRIANO DIOGO,ADRIANO DIOGO,ELEITO,PT,SOMOS MAIS SÃO PAULO,19
VÁRZEA PAULISTA,DEPUTADO ESTADUAL,ESTELA ALMAGRO,ESTELA ALEXANDRE ALMAGRO,SUPLENTE,PT,SOMOS MAIS SÃO PAULO,30
VÁRZEA PAULISTA,DEPUTADO ESTADUAL,LUIZ CLAUDIO MARCOLINO,LUIZ CLAUDIO MARCOLINO,ELEITO,PT,SOMOS MAIS SÃO PAULO,482
VÁRZEA PAULISTA,DEPUTADO ESTADUAL,RENATO DO GEB,RENATO MORENI AIRES DA SILVA,SUPLENTE,PT,SOMOS MAIS SÃO PAULO,6
VÁRZEA PAULISTA,DEPUTADO ESTADUAL,DENISE ERBELLA,DENISE ELOÁ CUSTÓDIO ERBELLA DE CASTRO,SUPLENTE,PT,SOMOS MAIS SÃO PAULO,1
VÁRZEA PAULISTA,DEPUTADO ESTADUAL,NATIVIDADE,MARIA DA NATIVIDADE PEREIRA LIMA,SUPLENTE,PT,SOMOS MAIS SÃO PAULO,8
VÁRZEA PAULISTA,DEPUTADO ESTADUAL,ROBERTO FELICIO,ROBERTO FELICIO,SUPLENTE,PT,SOMOS MAIS SÃO PAULO,35
VÁRZEA PAULISTA,DEPUTADO ESTADUAL,MARCIONILA,MARCIONILA APARECIDA DOS SANTOS,SUPLENTE,PT,SOMOS MAIS SÃO PAULO,1
VÁRZEA PAULISTA,DEPUTADO ESTADUAL,ROSANA GASPAR,ROSANA EMILIA GASPAR,SUPLENTE,PT,SOMOS MAIS SÃO PAULO,1
VÁRZEA PAULISTA,DEPUTADO ESTADUAL,BETH SAHAO,ELISABETH SAHÃO,SUPLENTE,PT,SOMOS MAIS SÃO PAULO,5
VÁRZEA PAULISTA,DEPUTADO ESTADUAL,PAULINHO MARQUES,PAULO MARQUES DE OLIVEIRA,SUPLENTE,PT,SOMOS MAIS SÃO PAULO,1
VÁRZEA PAULISTA,DEPUTADO ESTADUAL,ADINAN ORTOLAN,JOSÉ ADINAN ORTOLAN,SUPLENTE,PT,SOMOS MAIS SÃO PAULO,153
VÁRZEA PAULISTA,DEPUTADO ESTADUAL,FRANCISCO FRANÇA,FRANCISCO FRANÇA DA SILVA,SUPLENTE,PT,SOMOS MAIS SÃO PAULO,32
VÁRZEA PAULISTA,DEPUTADO ESTADUAL,LELO PAGANI,LUIZ AURELIO PAGANI,SUPLENTE,PT,SOMOS MAIS SÃO PAULO,9
VÁRZEA PAULISTA,DEPUTADO ESTADUAL,ALENCAR,ALENCAR SANTANA BRAGA,ELEITO,PT,SOMOS MAIS SÃO PAULO,20
VÁRZEA PAULISTA,DEPUTADO ESTADUAL,TIÃOZINHO,SEBASTIÃO MOREIREA ARCANJO,SUPLENTE,PT,SOMOS MAIS SÃO PAULO,124
VÁRZEA PAULISTA,DEPUTADO ESTADUAL,VERA SABA,VERA LÚCIA SANTOS SABA,SUPLENTE,PT,SOMOS MAIS SÃO PAULO,1
VÁRZEA PAULISTA,DEPUTADO ESTADUAL,PROFESSOR AGNERIO,AGNERIO NERI FERREIRA,SUPLENTE,PT,SOMOS MAIS SÃO PAULO,1
VÁRZEA PAULISTA,DEPUTADO ESTADUAL,ISAC REIS,ISAC FRANCO DOS REIS,ELEITO,PT,SOMOS MAIS SÃO PAULO,6
VÁRZEA PAULISTA,DEPUTADO ESTADUAL,BRENO CORTELLA,BRENO ZANONI CORTELLA,SUPLENTE,PT,SOMOS MAIS SÃO PAULO,5
VÁRZEA PAULISTA,DEPUTADO ESTADUAL,JOÃO PAULO RILLO,JOÃO PAULO RILLO,ELEITO,PT,SOMOS MAIS SÃO PAULO,4
VÁRZEA PAULISTA,DEPUTADO ESTADUAL,ANA DO CARMO,ANA MARIA DO CARMO ROSSETO,ELEITO,PT,SOMOS MAIS SÃO PAULO,2
VÁRZEA PAULISTA,DEPUTADO ESTADUAL,MIRANDA,JOSÉ CARLOS MIRANDA,SUPLENTE,PT,SOMOS MAIS SÃO PAULO,7
VÁRZEA PAULISTA,DEPUTADO ESTADUAL,JOSÉ CANDIDO,JOSÉ DE SOUZA CÂNDIDO,MÉDIA,PT,SOMOS MAIS SÃO PAULO,2
VÁRZEA PAULISTA,DEPUTADO ESTADUAL,JOÃO ANTONIO,JOAO ANTONIO DA SILVA FILHO,ELEITO,PT,SOMOS MAIS SÃO PAULO,25
VÁRZEA PAULISTA,DEPUTADO ESTADUAL,GALLO,JURANDIR GALLO,SUPLENTE,PT,SOMOS MAIS SÃO PAULO,9
VÁRZEA PAULISTA,DEPUTADO ESTADUAL,LINEU NAVARRO,LUIZ ANTONIO NAVARRO MAGALHÃES LUZ,SUPLENTE,PT,SOMOS MAIS SÃO PAULO,1
VÁRZEA PAULISTA,DEPUTADO ESTADUAL,MÁRCIO CHAVES,MÁRCIO CHAVES PIRES,SUPLENTE,PT,SOMOS MAIS SÃO PAULO,1
VÁRZEA PAULISTA,DEPUTADO ESTADUAL,ZÉ ARISTEIA,JOSÉ ARISTEIA PEREIRA,SUPLENTE,PT,SOMOS MAIS SÃO PAULO,2
VÁRZEA PAULISTA,DEPUTADO ESTADUAL,CARLOS GRANA,CARLOS ALBERTO GRANA,ELEITO,PT,SOMOS MAIS SÃO PAULO,5
VÁRZEA PAULISTA,DEPUTADO ESTADUAL,FAUSTO FIGUEIRA,FAUSTO FIGUEIRA DE MELLO JUNIOR,SUPLENTE,PT,SOMOS MAIS SÃO PAULO,2
VÁRZEA PAULISTA,DEPUTADO ESTADUAL,ZÉ ANTÔNIO,JOSÉ ANTONIO DA SILVA,SUPLENTE,PT,SOMOS MAIS SÃO PAULO,1
VÁRZEA PAULISTA,DEPUTADO ESTADUAL,ELISEU COSTA,ELISEU SILVA COSTA,SUPLENTE,PT,SOMOS MAIS SÃO PAULO,10461
VÁRZEA PAULISTA,DEPUTADO ESTADUAL,VERA GOULART,VERA LUCIA GOULART GONÇALVES,SUPLENTE,PT,SOMOS MAIS SÃO PAULO,2
VÁRZEA PAULISTA,DEPUTADO ESTADUAL,MIRIAN SILVA,MIRIAN MARIA SILVA GOTTZENT,SUPLENTE,PT,SOMOS MAIS SÃO PAULO,1
VÁRZEA PAULISTA,DEPUTADO ESTADUAL,TITO,FRANCISCO DE ASSIS PEREIRA DE CAMPOS,SUPLENTE,PT,SOMOS MAIS SÃO PAULO,4
VÁRZEA PAULISTA,DEPUTADO ESTADUAL,TOFFOLI,JOSÉ TICIANO DIAS TOFFOLI,SUPLENTE,PT,SOMOS MAIS SÃO PAULO,5
VÁRZEA PAULISTA,DEPUTADO ESTADUAL,LUIZ MOURA,LUIZ DE MOURA PEREIRA,ELEITO,PT,SOMOS MAIS SÃO PAULO,2
VÁRZEA PAULISTA,DEPUTADO ESTADUAL,PROFESSOR HERCULANO,JOSÉ HERCULANO DA SILVA,SUPLENTE,PT,SOMOS MAIS SÃO PAULO,1
VÁRZEA PAULISTA,DEPUTADO ESTADUAL,DONISETE BRAGA,DONISETE PEREIRA BRAGA,ELEITO,PT,SOMOS MAIS SÃO PAULO,7
VÁRZEA PAULISTA,DEPUTADO ESTADUAL,EDUARDO SIMAO,EDUARDO SIMAO DIAS,SUPLENTE,PT,SOMOS MAIS SÃO PAULO,2
VÁRZEA PAULISTA,DEPUTADO ESTADUAL,CARLOS NEDER,CARLOS ALBERTO PLETZ NEDER,SUPLENTE,PT,SOMOS MAIS SÃO PAULO,97
VÁRZEA PAULISTA,DEPUTADO ESTADUAL,DRA NEVES,MARIA DAS NEVES DUARTE,SUPLENTE,PTB,PARTIDO TRABALHISTA BRASILEIRO,1
VÁRZEA PAULISTA,DEPUTADO ESTADUAL,PROFª MARA CIDINHA,MARIA APARECIDA BATISTA LEITE,SUPLENTE,PTB,PARTIDO TRABALHISTA BRASILEIRO,1
VÁRZEA PAULISTA,DEPUTADO ESTADUAL,ZULEIKA AKYELUZ,ZULEIKA RAMOS,SUPLENTE,PTB,PARTIDO TRABALHISTA BRASILEIRO,1
VÁRZEA PAULISTA,DEPUTADO ESTADUAL,JOTA SILVA,JOAO JORGE FERREIRA DA SILVA,SUPLENTE,PTB,PARTIDO TRABALHISTA BRASILEIRO,13
VÁRZEA PAULISTA,DEPUTADO ESTADUAL,LÉO ÁQUILLA,JADSON MENDES DE LIMA,SUPLENTE,PTB,PARTIDO TRABALHISTA BRASILEIRO,16
VÁRZEA PAULISTA,DEPUTADO ESTADUAL,KLEBER LEITE,CLEVERSON SPERBER,SUPLENTE,PTB,PARTIDO TRABALHISTA BRASILEIRO,1
VÁRZEA PAULISTA,DEPUTADO ESTADUAL,MARILIA,AMARILIA ISABEL VIEIRA,SUPLENTE,PTB,PARTIDO TRABALHISTA BRASILEIRO,1
VÁRZEA PAULISTA,DEPUTADO ESTADUAL,CONTE LOPES,ROBERVAL CONTE LOPES LIMA,SUPLENTE,PTB,PARTIDO TRABALHISTA BRASILEIRO,25
VÁRZEA PAULISTA,DEPUTADO ESTADUAL,CAMPOS MACHADO,ANTONIO CARLOS DE CAMPOS MACHADO,ELEITO,PTB,PARTIDO TRABALHISTA BRASILEIRO,342
VÁRZEA PAULISTA,DEPUTADO ESTADUAL,VANDO,ORVANDO DA SILVA,SUPLENTE,PTB,PARTIDO TRABALHISTA BRASILEIRO,5
VÁRZEA PAULISTA,DEPUTADO ESTADUAL,ROQUE BARBIERE - ROQUINHO,ROQUE BARBIERE,ELEITO,PTB,PARTIDO TRABALHISTA BRASILEIRO,1
VÁRZEA PAULISTA,DEPUTADO ESTADUAL,HEROILMA SOARES TAVARES,HEROILMA SOARES TAVARES,MÉDIA,PTB,PARTIDO TRABALHISTA BRASILEIRO,4
VÁRZEA PAULISTA,DEPUTADO ESTADUAL,CORONEL EDSON FERRARINI,EDSON FERRARINI,ELEITO,PTB,PARTIDO TRABALHISTA BRASILEIRO,11
VÁRZEA PAULISTA,DEPUTADO ESTADUAL,GERSINHO ROMERO,GERSON MOREIRA ROMERO,SUPLENTE,PTB,PARTIDO TRABALHISTA BRASILEIRO,12
VÁRZEA PAULISTA,DEPUTADO ESTADUAL,VAL,ENIVALDO RAMOS DE FREITAS,SUPLENTE,PTB,PARTIDO TRABALHISTA BRASILEIRO,819
VÁRZEA PAULISTA,DEPUTADO ESTADUAL,SIVALDO FAISCA,SIVALDO RODRIGUES DE OLIVEIRA,SUPLENTE,PTB,PARTIDO TRABALHISTA BRASILEIRO,24
VÁRZEA PAULISTA,DEPUTADO ESTADUAL,TARDELLI,ROBERTO TARDELLI,SUPLENTE,PTB,PARTIDO TRABALHISTA BRASILEIRO,5
VÁRZEA PAULISTA,DEPUTADO ESTADUAL,PROFESSOR LEANDRO MOU,LEANDRO TADEU CAZARROTTI,SUPLENTE,PTB,PARTIDO TRABALHISTA BRASILEIRO,5
VÁRZEA PAULISTA,DEPUTADO ESTADUAL,RUTHINEA CARVALHO,RUTHINEA DE CARVALHO,SUPLENTE,PTB,PARTIDO TRABALHISTA BRASILEIRO,1
VÁRZEA PAULISTA,DEPUTADO ESTADUAL,WALDIR AGNELLO,WALDIR AGNELLO,SUPLENTE,PTB,PARTIDO TRABALHISTA BRASILEIRO,46
VÁRZEA PAULISTA,DEPUTADO ESTADUAL,ITALO RENE,ITALO RENE CORREA,SUPLENTE,PTB,PARTIDO TRABALHISTA BRASILEIRO,3
VÁRZEA PAULISTA,DEPUTADO ESTADUAL,BALEIA ROSSI,LUIZ FELIPE BALEIA TENUTO ROSSI,ELEITO,PMDB,PARTIDO DO MOVIMENTO DEMOCRÁTICO BRASILEIRO,16
VÁRZEA PAULISTA,DEPUTADO ESTADUAL,DRA ADRIANA,ADRIANA DI NARDO SILVA,SUPLENTE,PMDB,PARTIDO DO MOVIMENTO DEMOCRÁTICO BRASILEIRO,8
VÁRZEA PAULISTA,DEPUTADO ESTADUAL,BEBETTO,ALBERTO FELIPPE HADDAD FILHO,SUPLENTE,PMDB,PARTIDO DO MOVIMENTO DEMOCRÁTICO BRASILEIRO,17
VÁRZEA PAULISTA,DEPUTADO ESTADUAL,SARGENTO PRIETO,MARIANO PRIETO,SUPLENTE,PMDB,PARTIDO DO MOVIMENTO DEMOCRÁTICO BRASILEIRO,2
VÁRZEA PAULISTA,DEPUTADO ESTADUAL,THIAGO FERRARI,THIAGO DE MORAES FERRARI,SUPLENTE,PMDB,PARTIDO DO MOVIMENTO DEMOCRÁTICO BRASILEIRO,8
VÁRZEA PAULISTA,DEPUTADO ESTADUAL,DU TONIN,EDUARDO TONIN,SUPLENTE,PMDB,PARTIDO DO MOVIMENTO DEMOCRÁTICO BRASILEIRO,7
VÁRZEA PAULISTA,DEPUTADO ESTADUAL,IBRAIM,IBRAIM ANTONIO ABOU JOKH,SUPLENTE,PMDB,PARTIDO DO MOVIMENTO DEMOCRÁTICO BRASILEIRO,3
VÁRZEA PAULISTA,DEPUTADO ESTADUAL,CARUSO,JORGE LUIS CARUSO,ELEITO,PMDB,PARTIDO DO MOVIMENTO DEMOCRÁTICO BRASILEIRO,107
VÁRZEA PAULISTA,DEPUTADO ESTADUAL,VANESSA DAMO,VANESSA DAMO OROSCO,ELEITO,PMDB,PARTIDO DO MOVIMENTO DEMOCRÁTICO BRASILEIRO,12
VÁRZEA PAULISTA,DEPUTADO ESTADUAL,CHICO DA ADEGA,FRANCISCO PEREIRA GOMES,SUPLENTE,PMDB,PARTIDO DO MOVIMENTO DEMOCRÁTICO BRASILEIRO,1
VÁRZEA PAULISTA,DEPUTADO ESTADUAL,UEBE REZECK,UEBE REZECK,SUPLENTE,PMDB,PARTIDO DO MOVIMENTO DEMOCRÁTICO BRASILEIRO,4
VÁRZEA PAULISTA,DEPUTADO ESTADUAL,CHICÃO SERRA TALHADA,FRANCISCO BEZERRA DOS SANTOS,SUPLENTE,PMDB,PARTIDO DO MOVIMENTO DEMOCRÁTICO BRASILEIRO,1
VÁRZEA PAULISTA,DEPUTADO ESTADUAL,ITAMAR BORGES,ITAMAR FRANCISCO MACHADO BORGES,MÉDIA,PMDB,PARTIDO DO MOVIMENTO DEMOCRÁTICO BRASILEIRO,21
VÁRZEA PAULISTA,DEPUTADO ESTADUAL,JONAS,JONAS PEREIRA DE LIMA,SUPLENTE,PMDB,PARTIDO DO MOVIMENTO DEMOCRÁTICO BRASILEIRO,3
VÁRZEA PAULISTA,DEPUTADO ESTADUAL,DRA SILVANA,SILVANA CASSIA RIBEIRO BAPTISTA,SUPLENTE,PMDB,PARTIDO DO MOVIMENTO DEMOCRÁTICO BRASILEIRO,300
VÁRZEA PAULISTA,DEPUTADO ESTADUAL,MARIA DO CARMO GUILHERME,MARIA DO CARMO GUILHERME,SUPLENTE,PMDB,PARTIDO DO MOVIMENTO DEMOCRÁTICO BRASILEIRO,1
VÁRZEA PAULISTA,DEPUTADO ESTADUAL,JOOJI HATO,JOOJI HATO,ELEITO,PMDB,PARTIDO DO MOVIMENTO DEMOCRÁTICO BRASILEIRO,10
VÁRZEA PAULISTA,DEPUTADO ESTADUAL,TARCILIO BOSCO,TARCILIO BOSCO,SUPLENTE,PMDB,PARTIDO DO MOVIMENTO DEMOCRÁTICO BRASILEIRO,1
VÁRZEA PAULISTA,DEPUTADO ESTADUAL,JÂNIO,JÂNIO GONÇALVES DE OLIVEIRA,SUPLENTE,PMDB,PARTIDO DO MOVIMENTO DEMOCRÁTICO BRASILEIRO,2
VÁRZEA PAULISTA,DEPUTADO ESTADUAL,TUNICO VIEIRA,ANTONIO JOSÉ VIEIRA JUNIOR,SUPLENTE,PMDB,PARTIDO DO MOVIMENTO DEMOCRÁTICO BRASILEIRO,3
VÁRZEA PAULISTA,DEPUTADO ESTADUAL,CIDA FERREIRA,MARIA APARECIDA FERREIRA,SUPLENTE,PMDB,PARTIDO DO MOVIMENTO DEMOCRÁTICO BRASILEIRO,3
VÁRZEA PAULISTA,DEPUTADO ESTADUAL,OLIVEIRA JUNIOR,ELIO APARECIDO DE OLIVEIRA,SUPLENTE,PSC,HUMANISTA CRISTÃO ,6
VÁRZEA PAULISTA,DEPUTADO ESTADUAL,CELSO NASCIMENTO,CELSO BRAZ DO NASCIMENTO,SUPLENTE,PSC,HUMANISTA CRISTÃO ,2
VÁRZEA PAULISTA,DEPUTADO ESTADUAL,IVAN MELO,IVAN DE BARROS MELO,SUPLENTE,PSC,HUMANISTA CRISTÃO ,1
VÁRZEA PAULISTA,DEPUTADO ESTADUAL,APOSTOLO EURIPEDES,EURIPEDES LUIZ DE SOUSA,SUPLENTE,PSC,HUMANISTA CRISTÃO ,3
VÁRZEA PAULISTA,DEPUTADO ESTADUAL,DR. CLAUDIO MIRANDA,CLAUDIO ERNANI MARCONDES DE MIRANDA,SUPLENTE,PSC,HUMANISTA CRISTÃO ,9450
VÁRZEA PAULISTA,DEPUTADO ESTADUAL,DR. CALE,CARLOS EDUARDO ANTUNES DE OLIVEIRA,SUPLENTE,PSC,HUMANISTA CRISTÃO ,17
VÁRZEA PAULISTA,DEPUTADO ESTADUAL,LELIS TRAJANO,LELIS JOSE TRAJANO,SUPLENTE,PSC,HUMANISTA CRISTÃO ,9
VÁRZEA PAULISTA,DEPUTADO ESTADUAL,SIMONE HIEDA,SIMONE MICHICO GAVA HIEDA,SUPLENTE,PSC,HUMANISTA CRISTÃO ,1
VÁRZEA PAULISTA,DEPUTADO ESTADUAL,MERCIDES JUNIOR,MERCIDES FRANC PEREIRA DO CARMO,SUPLENTE,PSC,HUMANISTA CRISTÃO ,10
VÁRZEA PAULISTA,DEPUTADO ESTADUAL,PR. PAGLIARIN,HIDERALDO PAGLIARIN,SUPLENTE,PSC,HUMANISTA CRISTÃO ,12
VÁRZEA PAULISTA,DEPUTADO ESTADUAL,LEANDRO AMARAL,LEANDRO GODINES DO AMARAL,SUPLENTE,PSC,HUMANISTA CRISTÃO ,3
VÁRZEA PAULISTA,DEPUTADO ESTADUAL,PASTOR VIEIRA ROCHA,JOSE VIEIRA ROCHA,SUPLENTE,PSC,HUMANISTA CRISTÃO ,13
VÁRZEA PAULISTA,DEPUTADO ESTADUAL,PR. CARLOS CEZAR,CARLOS CEZAR DA SILVA,ELEITO,PSC,HUMANISTA CRISTÃO ,370
VÁRZEA PAULISTA,DEPUTADO ESTADUAL,VANDERLEI GOES,VANDERLEI DE GOES,SUPLENTE,PSC,HUMANISTA CRISTÃO ,1
VÁRZEA PAULISTA,DEPUTADO ESTADUAL,LUIZ LAURO,LUIZ LAURO FERREIRA,SUPLENTE,PSC,HUMANISTA CRISTÃO ,148
VÁRZEA PAULISTA,DEPUTADO ESTADUAL,ADILSON ROSSI,ADILSON ROSSI,ELEITO,PSC,HUMANISTA CRISTÃO ,24
VÁRZEA PAULISTA,DEPUTADO ESTADUAL,MARIA CLELIA MARIN,MARIA CLELIA DILCIA CAPRILES MARIM,SUPLENTE,PSC,HUMANISTA CRISTÃO ,3
VÁRZEA PAULISTA,DEPUTADO ESTADUAL,RENATO PUPO,RENATO PUPO DE PAULA,SUPLENTE,PSC,HUMANISTA CRISTÃO ,7
VÁRZEA PAULISTA,DEPUTADO ESTADUAL,JOÃO BINATO,JOÃO ANTONIO BINATO,SUPLENTE,PSC,HUMANISTA CRISTÃO ,17
VÁRZEA PAULISTA,DEPUTADO ESTADUAL,PASTOR JOÃO LUIZ NETO,JOÃO LUIZ NETO,SUPLENTE,PSC,HUMANISTA CRISTÃO ,1
VÁRZEA PAULISTA,DEPUTADO ESTADUAL,WALTER CORDONI,WALTER CORDONI FILHO,SUPLENTE,PSC,HUMANISTA CRISTÃO ,5
VÁRZEA PAULISTA,DEPUTADO ESTADUAL,PAULO CHOCOLATE,PAULO SERGIO VIEIRA NEVES,SUPLENTE,PSC,HUMANISTA CRISTÃO ,18
VÁRZEA PAULISTA,DEPUTADO ESTADUAL,CELSO PACHECO,CELSO PACHECO FERRO,SUPLENTE,PSC,HUMANISTA CRISTÃO ,1
VÁRZEA PAULISTA,DEPUTADO ESTADUAL,MARIA DO CARMO PIUNTI,MARIA DO CARMO THOMAZ PIUNTI,SUPLENTE,PSC,HUMANISTA CRISTÃO ,3
VÁRZEA PAULISTA,DEPUTADO ESTADUAL,ATALAIA,JOSE ROBERTO DE OLIVEIRA,SUPLENTE,PSC,HUMANISTA CRISTÃO ,3
VÁRZEA PAULISTA,DEPUTADO ESTADUAL,CANDIDO,JOELSON CANDIDO DE OLIVEIRA,SUPLENTE,PSC,HUMANISTA CRISTÃO ,26
VÁRZEA PAULISTA,DEPUTADO ESTADUAL,CESAR NASCIMENTO-RADIO CAPITAL,SEBASTIÃO PEREIRA NASCIMENTO,SUPLENTE,PSC,HUMANISTA CRISTÃO ,2
VÁRZEA PAULISTA,DEPUTADO ESTADUAL,RODRIGO MORAES,RODRIGO AUGUSTO MORAES,ELEITO,PSC,HUMANISTA CRISTÃO ,490
VÁRZEA PAULISTA,DEPUTADO ESTADUAL,BRAZ PASSARINHEIRO,BRAZ ANASTACIO DA SILVA,SUPLENTE,PSC,HUMANISTA CRISTÃO ,1
VÁRZEA PAULISTA,DEPUTADO ESTADUAL,LEONARDO QUEIROZ,LEONARDO SANTOS QUEIROZ,SUPLENTE,PSC,HUMANISTA CRISTÃO ,4
VÁRZEA PAULISTA,DEPUTADO ESTADUAL,WALTER GOMES,WALTER GOMES DE OLIVEIRA,SUPLENTE,PR,SOMOS MAIS SÃO PAULO,1
VÁRZEA PAULISTA,DEPUTADO ESTADUAL,JOSUE ROBERTO,JOSUE ROBERTO DA SILVA,SUPLENTE,PR,SOMOS MAIS SÃO PAULO,3
VÁRZEA PAULISTA,DEPUTADO ESTADUAL,ZE PEDRO,JOSE PEDRO LEITE DA SILVA,SUPLENTE,PR,SOMOS MAIS SÃO PAULO,69
VÁRZEA PAULISTA,DEPUTADO ESTADUAL,LILI AIMAR,LILIANA MEDEIROS DE ALMEIDA AYMAR BECHARA,SUPLENTE,PR,SOMOS MAIS SÃO PAULO,7
VÁRZEA PAULISTA,DEPUTADO ESTADUAL,PATRICIA LIMA,PATRICIA FREITAS LIMA,SUPLENTE,PR,SOMOS MAIS SÃO PAULO,10
VÁRZEA PAULISTA,DEPUTADO ESTADUAL,JOSIAS DINIZ,JOSIAS ANTONIO DINIZ,SUPLENTE,PR,SOMOS MAIS SÃO PAULO,6
VÁRZEA PAULISTA,DEPUTADO ESTADUAL,FURLAN,JULIO CEZAR FURLAN,SUPLENTE,PR,SOMOS MAIS SÃO PAULO,4
VÁRZEA PAULISTA,DEPUTADO ESTADUAL,TONINHO PAIVA,ANTONIO DE PAIVA MONTEIRO FILHO,SUPLENTE,PR,SOMOS MAIS SÃO PAULO,1
VÁRZEA PAULISTA,DEPUTADO ESTADUAL,OSVALDO VERGINIO,OSVALDO VERGINIO DA SILVA,SUPLENTE,PR,SOMOS MAIS SÃO PAULO,1
VÁRZEA PAULISTA,DEPUTADO ESTADUAL,ANDRE DO PRADO,ANDRE LUIS DO PRADO,ELEITO,PR,SOMOS MAIS SÃO PAULO,150
VÁRZEA PAULISTA,DEPUTADO ESTADUAL,EDUARDO REZEK,EDUARDO PEDROSO REZEK,SUPLENTE,PPS,PARTIDO POPULAR SOCIALISTA,2
VÁRZEA PAULISTA,DEPUTADO ESTADUAL,JOSE CARLOS SOARES,JOSE CARLOS SOARES,SUPLENTE,PPS,PARTIDO POPULAR SOCIALISTA,1
VÁRZEA PAULISTA,DEPUTADO ESTADUAL,EDUARDO NATALI,EDUARDO NANTES NATALI,SUPLENTE,PPS,PARTIDO POPULAR SOCIALISTA,1
VÁRZEA PAULISTA,DEPUTADO ESTADUAL,SERGIO MORETTI,SERGIO MORETTI,SUPLENTE,PPS,PARTIDO POPULAR SOCIALISTA,12
VÁRZEA PAULISTA,DEPUTADO ESTADUAL,MAURICIO MIYA,MAURICIO MIYAZAKI,SUPLENTE,PPS,PARTIDO POPULAR SOCIALISTA,1
VÁRZEA PAULISTA,DEPUTADO ESTADUAL,PAULO CAINÉ,PAULO CAINÉ DOS SANTOS SILVA,SUPLENTE,PPS,PARTIDO POPULAR SOCIALISTA,12
VÁRZEA PAULISTA,DEPUTADO ESTADUAL,BRAZ,BRAZ ANTUNES MATTOS NETO,SUPLENTE,PPS,PARTIDO POPULAR SOCIALISTA,1
VÁRZEA PAULISTA,DEPUTADO ESTADUAL,OSCAR RIBEIRO,OSCAR APARECIDO RIBEIRO,SUPLENTE,PPS,PARTIDO POPULAR SOCIALISTA,1
VÁRZEA PAULISTA,DEPUTADO ESTADUAL,ADEMIR DA GUIA,ADEMIR DA GUIA,SUPLENTE,PPS,PARTIDO POPULAR SOCIALISTA,13
VÁRZEA PAULISTA,DEPUTADO ESTADUAL,EDMILSON MORATO,EDMILSON GONCALVES,SUPLENTE,PPS,PARTIDO POPULAR SOCIALISTA,1
VÁRZEA PAULISTA,DEPUTADO ESTADUAL,DAVI ZAIA,DAVID ZAIA,MÉDIA,PPS,PARTIDO POPULAR SOCIALISTA,47
VÁRZEA PAULISTA,DEPUTADO ESTADUAL,DR. MILTON FERREIRA,MILTON FERREIRA DA SILVA,SUPLENTE,PPS,PARTIDO POPULAR SOCIALISTA,4
VÁRZEA PAULISTA,DEPUTADO ESTADUAL,DR. TÚLIO,TULIO JOSE TOMASS DO COUTO,SUPLENTE,PPS,PARTIDO POPULAR SOCIALISTA,4
VÁRZEA PAULISTA,DEPUTADO ESTADUAL,PROF. NELSON SUSSUMU SHIKICIMA,NELSON SUSSUMU SHIKICIMA,SUPLENTE,PPS,PARTIDO POPULAR SOCIALISTA,6
VÁRZEA PAULISTA,DEPUTADO ESTADUAL,PALHACINHO PIMPAO,VAGNER LUIZ PIMPAO BERSA,SUPLENTE,PPS,PARTIDO POPULAR SOCIALISTA,2
VÁRZEA PAULISTA,DEPUTADO ESTADUAL,JOAO OTAVIO BASTOS,JOAO OTAVIO BASTOS JUNQUEIRA,SUPLENTE,PPS,PARTIDO POPULAR SOCIALISTA,1
VÁRZEA PAULISTA,DEPUTADO ESTADUAL,VITOR SAPIENZA,VITOR SAPIENZA,SUPLENTE,PPS,PARTIDO POPULAR SOCIALISTA,677
VÁRZEA PAULISTA,DEPUTADO ESTADUAL,ALEX MANENTE,ALEX SPINELLI MANENTE,ELEITO,PPS,PARTIDO POPULAR SOCIALISTA,4
VÁRZEA PAULISTA,DEPUTADO ESTADUAL,GUILHERME GAZZOLA,GUILHERME DOS REIS GAZZOLA,SUPLENTE,PPS,PARTIDO POPULAR SOCIALISTA,1
VÁRZEA PAULISTA,DEPUTADO ESTADUAL,DIRCEU DALBEN,ANTONIO DIRCEU DALBEN,SUPLENTE,PPS,PARTIDO POPULAR SOCIALISTA,3
VÁRZEA PAULISTA,DEPUTADO ESTADUAL,GONDIM,LUIZ CARLOS GONDIM TEIXEIRA,ELEITO,PPS,PARTIDO POPULAR SOCIALISTA,2
VÁRZEA PAULISTA,DEPUTADO ESTADUAL,ESTEVÃO,STEVEN ERIKSEN BINNIE,SUPLENTE,PPS,PARTIDO POPULAR SOCIALISTA,4
VÁRZEA PAULISTA,DEPUTADO ESTADUAL,PROFESSOR ZE MARIA,JOSE MARIA CANCELLIERO,SUPLENTE,PPS,PARTIDO POPULAR SOCIALISTA,11
VÁRZEA PAULISTA,DEPUTADO ESTADUAL,MYRIAM ALCKMIN,MYRIAM ALCKMIN RAMOS NOGUEIRA,SUPLENTE,PPS,PARTIDO POPULAR SOCIALISTA,3
VÁRZEA PAULISTA,DEPUTADO ESTADUAL,MARCELO CYPRIANO,MARCELO DA SILVA CYPRIANO,SUPLENTE,PPS,PARTIDO POPULAR SOCIALISTA,8
VÁRZEA PAULISTA,DEPUTADO ESTADUAL,ZEZINHO DA COHAB,JOSE MARTINS DOS SANTOS,SUPLENTE,PPS,PARTIDO POPULAR SOCIALISTA,1
VÁRZEA PAULISTA,DEPUTADO ESTADUAL,ULISSES MENEGUIM,ULISSES MENEGUIM,SUPLENTE,PPS,PARTIDO POPULAR SOCIALISTA,1
VÁRZEA PAULISTA,DEPUTADO ESTADUAL,SERGIO BOCALINI,SERGIO DOS SANTOS BOCALINI,SUPLENTE,PPS,PARTIDO POPULAR SOCIALISTA,5
VÁRZEA PAULISTA,DEPUTADO ESTADUAL,DARIO SAADI,DARIO JORGE GIOLO SAADI,SUPLENTE,DEM,PSDB/DEM,10
VÁRZEA PAULISTA,DEPUTADO ESTADUAL,ANDRE SOARES,ANDRE BEZERRA RIBEIRO SOARES,ELEITO,DEM,PSDB/DEM,207
VÁRZEA PAULISTA,DEPUTADO ESTADUAL,MURINGA AMORIM,SHIRLEY PEREJON AMORIM,SUPLENTE,DEM,PSDB/DEM,1
VÁRZEA PAULISTA,DEPUTADO ESTADUAL,EDMIR CHEDID,EDMIR JOSE ABI CHEDID,ELEITO,DEM,PSDB/DEM,64
VÁRZEA PAULISTA,DEPUTADO ESTADUAL,ALDO DEMARCHI,JOSE ALDO DEMARCHI,ELEITO,DEM,PSDB/DEM,5
VÁRZEA PAULISTA,DEPUTADO ESTADUAL,JOAO MELLAO NETO,JOAO MELLAO NETO,SUPLENTE,DEM,PSDB/DEM,6
VÁRZEA PAULISTA,DEPUTADO ESTADUAL,FERNANDO LUCAS,LUIZ FERNANDO AMARAL LUCAS,SUPLENTE,DEM,PSDB/DEM,3
VÁRZEA PAULISTA,DEPUTADO ESTADUAL,RICARDO SALLES,RICARDO DE AQUINO SALLES,SUPLENTE,DEM,PSDB/DEM,6
VÁRZEA PAULISTA,DEPUTADO ESTADUAL,MILTON VIEIRA,MILTON VIEIRA PINTO,ELEITO,DEM,PSDB/DEM,1
VÁRZEA PAULISTA,DEPUTADO ESTADUAL,ROBERTO CACCIARI,ROBERTO CACCIARI,SUPLENTE,DEM,PSDB/DEM,2
VÁRZEA PAULISTA,DEPUTADO ESTADUAL,SALLES,RAIMUNDO TARASKEVICIUS SALES,SUPLENTE,DEM,PSDB/DEM,1
VÁRZEA PAULISTA,DEPUTADO ESTADUAL,GIL ARANTES,GILBERTO MACEDO GIL ARANTES,ELEITO,DEM,PSDB/DEM,154
VÁRZEA PAULISTA,DEPUTADO ESTADUAL,ZE LOUQUINHO,JOSE LUIZ RODRIGUES,SUPLENTE,DEM,PSDB/DEM,1
VÁRZEA PAULISTA,DEPUTADO ESTADUAL,JERONIMO MORENO,JERONIMO DE LA CRUZ MORENO,SUPLENTE,DEM,PSDB/DEM,3
VÁRZEA PAULISTA,DEPUTADO ESTADUAL,LEANDRO DO KLB,LEANDRO FINATO SCORNAVACCA,SUPLENTE,DEM,PSDB/DEM,96
VÁRZEA PAULISTA,DEPUTADO ESTADUAL,IVAN TESOURINHA STRINGHI,IVAN STRINGHI,SUPLENTE,DEM,PSDB/DEM,2
VÁRZEA PAULISTA,DEPUTADO ESTADUAL,CLAUDINEI PATO BRANCO,CLAUDINEI LUIZ TEIXEIRA,SUPLENTE,PHS,HUMANISTA CRISTÃO ,2
VÁRZEA PAULISTA,DEPUTADO ESTADUAL,PAULO HADICH,PAULO CEZAR JUNQUEIRA HADICH,SUPLENTE,PSB,PARTIDO SOCIALISTA BRASILEIRO,2
VÁRZEA PAULISTA,DEPUTADO ESTADUAL,GERALDO NÓBREGA,GERALDO ANTONIO DA NOBREGA,SUPLENTE,PSB,PARTIDO SOCIALISTA BRASILEIRO,1
VÁRZEA PAULISTA,DEPUTADO ESTADUAL,DR. VLAMIR,VLAMIR SÉRGIO D'EMILIO LANDUCCI,SUPLENTE,PSB,PARTIDO SOCIALISTA BRASILEIRO,1
VÁRZEA PAULISTA,DEPUTADO ESTADUAL,MARCIA KI,MARCIA FRANZOSI KISHIMOTO,SUPLENTE,PSB,PARTIDO SOCIALISTA BRASILEIRO,1
VÁRZEA PAULISTA,DEPUTADO ESTADUAL,ESCRITOR RONALDO DURAN,RONALDO DE JESUS DA SILVA,SUPLENTE,PSB,PARTIDO SOCIALISTA BRASILEIRO,8
VÁRZEA PAULISTA,DEPUTADO ESTADUAL,BOLÇONE,ORLANDO JOSE BOLÇONE,SUPLENTE,PSB,PARTIDO SOCIALISTA BRASILEIRO,2
VÁRZEA PAULISTA,DEPUTADO ESTADUAL,DR. GENNARI,MARCELO GENNARI BORATTO,SUPLENTE,PSB,PARTIDO SOCIALISTA BRASILEIRO,18
VÁRZEA PAULISTA,DEPUTADO ESTADUAL,VALDECIR FONSECA,JOSÉ VALDECIR DA FONSECA,SUPLENTE,PSB,PARTIDO SOCIALISTA BRASILEIRO,8
VÁRZEA PAULISTA,DEPUTADO ESTADUAL,ZEZÉ,MARIA JOSÉ DOS SANTOS CHAVES,SUPLENTE,PSB,PARTIDO SOCIALISTA BRASILEIRO,2
VÁRZEA PAULISTA,DEPUTADO ESTADUAL,JANAINA MARTINS,JANAINA PEREIRA MARTINS,SUPLENTE,PSB,PARTIDO SOCIALISTA BRASILEIRO,1
VÁRZEA PAULISTA,DEPUTADO ESTADUAL,WALTER HAYASHI,WALTER KATSUNORI HAYASHI,SUPLENTE,PSB,PARTIDO SOCIALISTA BRASILEIRO,1
VÁRZEA PAULISTA,DEPUTADO ESTADUAL,ED THOMAS,EDSON TOMAZINI,ELEITO,PSB,PARTIDO SOCIALISTA BRASILEIRO,7
VÁRZEA PAULISTA,DEPUTADO ESTADUAL,IRMÃO OZELITO,OZELITO JOSE BENEDITO,SUPLENTE,PSB,PARTIDO SOCIALISTA BRASILEIRO,9
VÁRZEA PAULISTA,DEPUTADO ESTADUAL,PROF. MARIO LUIZ GUIDE,MARIO LUIZ GUIDE,SUPLENTE,PSB,PARTIDO SOCIALISTA BRASILEIRO,1
VÁRZEA PAULISTA,DEPUTADO ESTADUAL,UILSON LEITE,UILSON ROBERTO LEITE,SUPLENTE,PSB,PARTIDO SOCIALISTA BRASILEIRO,1
VÁRZEA PAULISTA,DEPUTADO ESTADUAL,ZEQUINHA ADVOGADO,JOSE PEDRO RAMOS,SUPLENTE,PSB,PARTIDO SOCIALISTA BRASILEIRO,1404
VÁRZEA PAULISTA,DEPUTADO ESTADUAL,ALEXANDRE OLIVEIRA,ALEXANDRE OLIVEIRA,SUPLENTE,PSB,PARTIDO SOCIALISTA BRASILEIRO,3
VÁRZEA PAULISTA,DEPUTADO ESTADUAL,CHICO BEZERRA,FRANCISCO MOACIR BEZERRA DE MELO FILHO,SUPLENTE,PSB,PARTIDO SOCIALISTA BRASILEIRO,1
VÁRZEA PAULISTA,DEPUTADO ESTADUAL,DR. ALEXANDRE DEPIERI,ALEXANDRE BITTENCOURT DEPIERI,SUPLENTE,PSB,PARTIDO SOCIALISTA BRASILEIRO,1
VÁRZEA PAULISTA,DEPUTADO ESTADUAL,REGINA D'EWÁ,REGINA PACCINI,SUPLENTE,PSB,PARTIDO SOCIALISTA BRASILEIRO,1
VÁRZEA PAULISTA,DEPUTADO ESTADUAL,FRANCÉ JUNIOR,ANTONIO FRANCÉ JUNIOR,SUPLENTE,PSB,PARTIDO SOCIALISTA BRASILEIRO,1
VÁRZEA PAULISTA,DEPUTADO ESTADUAL,DR. JOSÉ RICARDO,JOSÉ RICARDO DIAS,SUPLENTE,PSB,PARTIDO SOCIALISTA BRASILEIRO,4
VÁRZEA PAULISTA,DEPUTADO ESTADUAL,YVONE BARREIROS,YVONE BARREIROS MOREIRA,SUPLENTE,PSB,PARTIDO SOCIALISTA BRASILEIRO,3
VÁRZEA PAULISTA,DEPUTADO ESTADUAL,DAVID BUENO,DAVID JOSE BUENO GOMES,SUPLENTE,PSB,PARTIDO SOCIALISTA BRASILEIRO,8
