PRESIDENTE PRUDENTE,PRESIDENTE,DILMA,DILMA VANA ROUSSEFF,2º TURNO,PT,PARA O BRASIL SEGUIR MUDANDO,16062
PRESIDENTE PRUDENTE,PRESIDENTE,JOSÉ SERRA,JOSÉ SERRA,2º TURNO,PSDB,O BRASIL PODE MAIS,26632
PRESIDENTE PRUDENTE,GOVERNADOR,GERALDO ALCKMIN,GERALDO JOSE RODRIGUES ALCKMIN FILHO,ELEITO,PSDB,UNIDOS POR SÃO PAULO,28603
PRESIDENTE PRUDENTE,SENADOR,MARTA SUPLICY,MARTA SUPLICY,ELEITO,PT,UNIÃO PARA MUDAR,14287
PRESIDENTE PRUDENTE,SENADOR,ALOYSIO NUNES,ALOYSIO NUNES FERREIRA FILHO,ELEITO,PSDB,UNIDOS POR SÃO PAULO,32447
PRESIDENTE PRUDENTE,DEPUTADO FEDERAL,DR. ELIEZER COSTA,ELIEZER NASCIMENTO DA COSTA,SUPLENTE,PRB,JUNTOS POR SÃO PAULO,2
PRESIDENTE PRUDENTE,DEPUTADO FEDERAL,CÉSAR CRUZ GARCIA,CESAR CRUZ GARCIA,SUPLENTE,PRB,JUNTOS POR SÃO PAULO,3
PRESIDENTE PRUDENTE,DEPUTADO FEDERAL,ANTONIO BULHÕES,ANTONIO CARLOS MARTINS DE BULHÕES,ELEITO,PRB,JUNTOS POR SÃO PAULO,14
PRESIDENTE PRUDENTE,DEPUTADO FEDERAL,ALESSANDER VIGNA,ALESSANDER BARREIRA VIGNA,SUPLENTE,PRB,JUNTOS POR SÃO PAULO,4
PRESIDENTE PRUDENTE,DEPUTADO FEDERAL,OTONIEL LIMA,OTONIEL CARLOS DE LIMA,MÉDIA,PRB,JUNTOS POR SÃO PAULO,426
PRESIDENTE PRUDENTE,DEPUTADO FEDERAL,LUIZ SOARES,LUIZ SOARES TEIXEIRA,SUPLENTE,PRB,JUNTOS POR SÃO PAULO,2
PRESIDENTE PRUDENTE,DEPUTADO FEDERAL,DURVAL MORELLI,DURVAL MORELLI NETO,SUPLENTE,PP,PARTIDO PROGRESSISTA,2
PRESIDENTE PRUDENTE,DEPUTADO FEDERAL,JEFERSON CAMILLO,JEFERSON CAMILLO DE OLIVEIRA,SUPLENTE,PP,PARTIDO PROGRESSISTA,2
PRESIDENTE PRUDENTE,DEPUTADO FEDERAL,DR JOSÉ CLAUDIO,JOSE CLAUDIO MANCILHA DE FARIA BARBOSA,SUPLENTE,PP,PARTIDO PROGRESSISTA,5
PRESIDENTE PRUDENTE,DEPUTADO FEDERAL,MAURO SIGA BEM,MAURO DONIZETTI FERREIRA,SUPLENTE,PP,PARTIDO PROGRESSISTA,1
PRESIDENTE PRUDENTE,DEPUTADO FEDERAL,TCEL JULIO LEMOS,JÚLIO FERNANDO PINHEIRO DE LEMOS,SUPLENTE,PP,PARTIDO PROGRESSISTA,2
PRESIDENTE PRUDENTE,DEPUTADO FEDERAL,NATAL SOARES,NATALINO JOSE SOARES,SUPLENTE,PP,PARTIDO PROGRESSISTA,12
PRESIDENTE PRUDENTE,DEPUTADO FEDERAL,MALUF,PAULO SALIM MALUF,ELEITO,PP,PARTIDO PROGRESSISTA,832
PRESIDENTE PRUDENTE,DEPUTADO FEDERAL,RUBENEUTON OLIVEIRA LIMA,RUBENEUTON OLIVEIRA LIMA,SUPLENTE,PP,PARTIDO PROGRESSISTA,25
PRESIDENTE PRUDENTE,DEPUTADO FEDERAL,ANGINHO DOS TECLADOS,ANGELO MARINHO DE ALMEIDA,SUPLENTE,PP,PARTIDO PROGRESSISTA,1
PRESIDENTE PRUDENTE,DEPUTADO FEDERAL,CARLOS OCTAVIANI,JOSÉ CARLOS OCTAVIANI,SUPLENTE,PP,PARTIDO PROGRESSISTA,3
PRESIDENTE PRUDENTE,DEPUTADO FEDERAL,CAPITÃO GOMES,CARLOS GOMES DA SILVA,SUPLENTE,PP,PARTIDO PROGRESSISTA,12
PRESIDENTE PRUDENTE,DEPUTADO FEDERAL,LALO,JOSÉ CARLOS TALDIVO,SUPLENTE,PP,PARTIDO PROGRESSISTA,9
PRESIDENTE PRUDENTE,DEPUTADO FEDERAL,RENATO REICHANN,RUY RENATO REICHMANN,SUPLENTE,PP,PARTIDO PROGRESSISTA,1
PRESIDENTE PRUDENTE,DEPUTADO FEDERAL,BATORÉ,IVANILDO GOMES NOGUEIRA,SUPLENTE,PP,PARTIDO PROGRESSISTA,7
PRESIDENTE PRUDENTE,DEPUTADO FEDERAL,MANOEL MOREIRA,MANOEL MOREIRA DE ARAUJO FILHO,SUPLENTE,PP,PARTIDO PROGRESSISTA,1
PRESIDENTE PRUDENTE,DEPUTADO FEDERAL,ADELINA ALCANTARA MACHADO,ADELINA PEREIRA DA SILVEIRA DE ALCANTARA MACHADO,SUPLENTE,PP,PARTIDO PROGRESSISTA,1
PRESIDENTE PRUDENTE,DEPUTADO FEDERAL,LIBERATO DE VALENTIM GENTIL,LIBERATO ROCHA CALDEIRA,SUPLENTE,PP,PARTIDO PROGRESSISTA,1
PRESIDENTE PRUDENTE,DEPUTADO FEDERAL,LAURINDO BARNARDES,LAURINDO BERNARDES DE SOUZA,SUPLENTE,PP,PARTIDO PROGRESSISTA,2
PRESIDENTE PRUDENTE,DEPUTADO FEDERAL,MAURICIO MARTINS,MAURICIO LUIS MARTINS,SUPLENTE,PP,PARTIDO PROGRESSISTA,3
PRESIDENTE PRUDENTE,DEPUTADO FEDERAL,ALINE CORREA,ALINE LEMOS CORREA DE OLIVEIRA ANDRADE,ELEITO,PP,PARTIDO PROGRESSISTA,1
PRESIDENTE PRUDENTE,DEPUTADO FEDERAL,ELIAS BITENCOURT,ELIAS DOS SANTOS BITENCOURT,SUPLENTE,PP,PARTIDO PROGRESSISTA,4
PRESIDENTE PRUDENTE,DEPUTADO FEDERAL,DRA ADRIANA DA COSTA,ADRIANA ALVARES DA COSTA DE PAULA ALVES,SUPLENTE,PP,PARTIDO PROGRESSISTA,1
PRESIDENTE PRUDENTE,DEPUTADO FEDERAL,BETO MANSUR,PAULO ROBERTO GOMES MANSUR,ELEITO,PP,PARTIDO PROGRESSISTA,5
PRESIDENTE PRUDENTE,DEPUTADO FEDERAL,ADHEMAR DE BARROS FILHO,ADHEMAR DE BARROS FILHO,SUPLENTE,PP,PARTIDO PROGRESSISTA,20
PRESIDENTE PRUDENTE,DEPUTADO FEDERAL,MAURICIO TCHÊ DA TORRE,MAURICIO EDUARDO MELLO PEREIRA,SUPLENTE,PP,PARTIDO PROGRESSISTA,3
PRESIDENTE PRUDENTE,DEPUTADO FEDERAL,CABO WILSON,WILSON DE OLIVEIRA MORAIS,SUPLENTE,PP,PARTIDO PROGRESSISTA,52
PRESIDENTE PRUDENTE,DEPUTADO FEDERAL,MISSIONÁRIO JOSÉ OLIMPIO,JOSÉ OLIMPIO SILVEIRA MORAES,ELEITO,PP,PARTIDO PROGRESSISTA,122
PRESIDENTE PRUDENTE,DEPUTADO FEDERAL,FERNANDO STANCATTI,FERNANDO CESAR STANCATTI MARQUES,SUPLENTE,PP,PARTIDO PROGRESSISTA,10
PRESIDENTE PRUDENTE,DEPUTADO FEDERAL,ERIVAN,FRANCISCO ERIVAN PEREIRA,SUPLENTE,PP,PARTIDO PROGRESSISTA,11
PRESIDENTE PRUDENTE,DEPUTADO FEDERAL,TUCÃO,JULIO CESAR THEODORO,SUPLENTE,PP,PARTIDO PROGRESSISTA,7
PRESIDENTE PRUDENTE,DEPUTADO FEDERAL,DR NECHAR,SERGIO ANTONIO NECHAR,SUPLENTE,PP,PARTIDO PROGRESSISTA,5
PRESIDENTE PRUDENTE,DEPUTADO FEDERAL,DELEGADA GRACIELA,GRACIELA DE LOURDES DAVID AMBROSIO,SUPLENTE,PP,PARTIDO PROGRESSISTA,2
PRESIDENTE PRUDENTE,DEPUTADO FEDERAL,PRICILA MENIN,LETEIA PRICILA GOMES,SUPLENTE,PP,PARTIDO PROGRESSISTA,2
PRESIDENTE PRUDENTE,DEPUTADO FEDERAL,DR LÉO KAHN,LEO JUVENAL KAHN DA SILVEIRA,SUPLENTE,PP,PARTIDO PROGRESSISTA,3
PRESIDENTE PRUDENTE,DEPUTADO FEDERAL,MARCELO MARIANO,MARCELO RICARDO MARIANO,SUPLENTE,PP,PARTIDO PROGRESSISTA,9
PRESIDENTE PRUDENTE,DEPUTADO FEDERAL,VADÃO,ETIVALDO VADAO GOMES,SUPLENTE,PP,PARTIDO PROGRESSISTA,24
PRESIDENTE PRUDENTE,DEPUTADO FEDERAL,PH,PAULO HENRIQUE RIBEIRO SANTANA,SUPLENTE,PDT,PARTIDO DEMOCRÁTICO TRABALHISTA,5
PRESIDENTE PRUDENTE,DEPUTADO FEDERAL,SARGENTO DARCY,DARCY RODRIGUES,SUPLENTE,PDT,PARTIDO DEMOCRÁTICO TRABALHISTA,3
PRESIDENTE PRUDENTE,DEPUTADO FEDERAL,JOÃO DADO,JOÃO EDUARDO DADO LEITE DE CARVALHO,ELEITO,PDT,PARTIDO DEMOCRÁTICO TRABALHISTA,159
PRESIDENTE PRUDENTE,DEPUTADO FEDERAL,PAULINHO DA FORÇA,PAULO PEREIRA DA SILVA,ELEITO,PDT,PARTIDO DEMOCRÁTICO TRABALHISTA,604
PRESIDENTE PRUDENTE,DEPUTADO FEDERAL,ELISEU DANIEL,ELISEU DANIEL DOS SANTOS,SUPLENTE,PDT,PARTIDO DEMOCRÁTICO TRABALHISTA,8
PRESIDENTE PRUDENTE,DEPUTADO FEDERAL,GUSTAVO STUPP,LUIZ GUSTAVO ANTUNES STUPP,SUPLENTE,PDT,PARTIDO DEMOCRÁTICO TRABALHISTA,1
PRESIDENTE PRUDENTE,DEPUTADO FEDERAL,ARMANDO HENRIQUE,ARMANDO HENRIQUE,SUPLENTE,PDT,PARTIDO DEMOCRÁTICO TRABALHISTA,19
PRESIDENTE PRUDENTE,DEPUTADO FEDERAL,MARTAN,MARCELO MARTIN,SUPLENTE,PDT,PARTIDO DEMOCRÁTICO TRABALHISTA,9
PRESIDENTE PRUDENTE,DEPUTADO FEDERAL,KAREN HEINS,KAREN MAYELLEN TONIM HEINS,SUPLENTE,PDT,PARTIDO DEMOCRÁTICO TRABALHISTA,2
PRESIDENTE PRUDENTE,DEPUTADO FEDERAL,PEDRO BAPTISTINI,PEDRO ANTONIO BAPTISTINI,SUPLENTE,PDT,PARTIDO DEMOCRÁTICO TRABALHISTA,4
PRESIDENTE PRUDENTE,DEPUTADO FEDERAL,SAULO GOES,SAULO GOES DE ALBUQUERQUE,SUPLENTE,PDT,PARTIDO DEMOCRÁTICO TRABALHISTA,2
PRESIDENTE PRUDENTE,DEPUTADO FEDERAL,MEDEIROS,LUIZ ANTONIO DE MEDEIROS NETO,SUPLENTE,PDT,PARTIDO DEMOCRÁTICO TRABALHISTA,21
PRESIDENTE PRUDENTE,DEPUTADO FEDERAL,GILBERTO BENZI,GILBERTO BENZI,SUPLENTE,PDT,PARTIDO DEMOCRÁTICO TRABALHISTA,2
PRESIDENTE PRUDENTE,DEPUTADO FEDERAL,EDUARDO NASCIMENTO,EDUARDO DUARTE DO NASCIMENTO,SUPLENTE,PDT,PARTIDO DEMOCRÁTICO TRABALHISTA,2
PRESIDENTE PRUDENTE,DEPUTADO FEDERAL,DR LUIZ CHIAPARINE,LUIZ CARLOS CHIAPARINE,SUPLENTE,PDT,PARTIDO DEMOCRÁTICO TRABALHISTA,15
PRESIDENTE PRUDENTE,DEPUTADO FEDERAL,NELSINHO DA BAHIA,NELSON FRANCISCO DOS SANTOS,SUPLENTE,PDT,PARTIDO DEMOCRÁTICO TRABALHISTA,4
PRESIDENTE PRUDENTE,DEPUTADO FEDERAL,MANOEL ANTUNES,MANOEL ANTUNES,SUPLENTE,PDT,PARTIDO DEMOCRÁTICO TRABALHISTA,11
PRESIDENTE PRUDENTE,DEPUTADO FEDERAL,DEF.BIODIESEL-SILASEDUARDOINKE,SILAS EDUARDO INKE,SUPLENTE,PDT,PARTIDO DEMOCRÁTICO TRABALHISTA,1
PRESIDENTE PRUDENTE,DEPUTADO FEDERAL,CARLOS HENRIQUE,CARLOS HENRIQUE PINTO,SUPLENTE,PDT,PARTIDO DEMOCRÁTICO TRABALHISTA,1
PRESIDENTE PRUDENTE,DEPUTADO FEDERAL,DRA DEBORA,DEBORA MARIA MARAGNI PEREIRA DE ABREU,SUPLENTE,PDT,PARTIDO DEMOCRÁTICO TRABALHISTA,2
PRESIDENTE PRUDENTE,DEPUTADO FEDERAL,SALVADOR ZIMBALDI,SALVADOR ZIMBALDI FILHO,MÉDIA,PDT,PARTIDO DEMOCRÁTICO TRABALHISTA,58
PRESIDENTE PRUDENTE,DEPUTADO FEDERAL,LINDOLFO DOS SANTOS,LINDOLFO LUIZ DOS SANTOS NETO,SUPLENTE,PDT,PARTIDO DEMOCRÁTICO TRABALHISTA,1
PRESIDENTE PRUDENTE,DEPUTADO FEDERAL,ITAMAR ALVES,ITAMAR ALVES DE OLIVEIRA,SUPLENTE,PDT,PARTIDO DEMOCRÁTICO TRABALHISTA,1
PRESIDENTE PRUDENTE,DEPUTADO FEDERAL,JOSUE TOPA TUDO,JOSUÉ MOREIRA,SUPLENTE,PDT,PARTIDO DEMOCRÁTICO TRABALHISTA,1
PRESIDENTE PRUDENTE,DEPUTADO FEDERAL,MAGAIVER,EDILSON MAGAIVER FERREIRA DA SILVA,SUPLENTE,PDT,PARTIDO DEMOCRÁTICO TRABALHISTA,1
PRESIDENTE PRUDENTE,DEPUTADO FEDERAL,FADUL,OSWALDO DOS SANTOS,SUPLENTE,PDT,PARTIDO DEMOCRÁTICO TRABALHISTA,1
PRESIDENTE PRUDENTE,DEPUTADO FEDERAL,IVANIO BATISTA,IVANIO BATISTA DA SILVA,SUPLENTE,PT,JUNTOS POR SÃO PAULO,16
PRESIDENTE PRUDENTE,DEPUTADO FEDERAL,VICENTE CANDIDO,VICENTE CANDIDO DA SILVA,ELEITO,PT,JUNTOS POR SÃO PAULO,2
PRESIDENTE PRUDENTE,DEPUTADO FEDERAL,PROFESSOR JAIR BALESTRA,JAIR DONIZETI BALESTRA,SUPLENTE,PT,JUNTOS POR SÃO PAULO,2
PRESIDENTE PRUDENTE,DEPUTADO FEDERAL,MARQUINHOS OLÍVIO,MARCOS OLIVIO CONCEIÇÃO,SUPLENTE,PT,JUNTOS POR SÃO PAULO,1
PRESIDENTE PRUDENTE,DEPUTADO FEDERAL,TOM,SEBASTIÃO SERAFIM DE MOURA SOBRINHO,SUPLENTE,PT,JUNTOS POR SÃO PAULO,1
PRESIDENTE PRUDENTE,DEPUTADO FEDERAL,IARA BERNARDI,IARA BERNARDI,SUPLENTE,PT,JUNTOS POR SÃO PAULO,34
PRESIDENTE PRUDENTE,DEPUTADO FEDERAL,LARGUESA,LUIS VANDERLEI LARGUESA,SUPLENTE,PT,JUNTOS POR SÃO PAULO,8
PRESIDENTE PRUDENTE,DEPUTADO FEDERAL,VACCAREZZA,CANDIDO ELPIDIO DE SOUZA VACCAREZZA,ELEITO,PT,JUNTOS POR SÃO PAULO,502
PRESIDENTE PRUDENTE,DEPUTADO FEDERAL,GENOINO,JOSÉ GENOÍNO NETO,SUPLENTE,PT,JUNTOS POR SÃO PAULO,128
PRESIDENTE PRUDENTE,DEPUTADO FEDERAL,OSMAR LOPES,OSMAR LOPES,SUPLENTE,PT,JUNTOS POR SÃO PAULO,1
PRESIDENTE PRUDENTE,DEPUTADO FEDERAL,HELCIO SILVA,HELCIO ANTONIO DA SILVA,SUPLENTE,PT,JUNTOS POR SÃO PAULO,2
PRESIDENTE PRUDENTE,DEPUTADO FEDERAL,CARLINHOS ALMEIDA,CARLOS JOSE DE ALMEIDA,ELEITO,PT,JUNTOS POR SÃO PAULO,2
PRESIDENTE PRUDENTE,DEPUTADO FEDERAL,MISA BOITO,MARIA EMILIA SEDEH BOITO,SUPLENTE,PT,JUNTOS POR SÃO PAULO,5
PRESIDENTE PRUDENTE,DEPUTADO FEDERAL,NEWTON LIMA NETO,NEWTON LIMA NETO,ELEITO,PT,JUNTOS POR SÃO PAULO,8
PRESIDENTE PRUDENTE,DEPUTADO FEDERAL,GERSON SARTORI,GERSON HENRIQUE SARTORI,SUPLENTE,PT,JUNTOS POR SÃO PAULO,35
PRESIDENTE PRUDENTE,DEPUTADO FEDERAL,FILIPPI,JOSÉ DE FILIPPI JÚNIOR,ELEITO,PT,JUNTOS POR SÃO PAULO,3
PRESIDENTE PRUDENTE,DEPUTADO FEDERAL,ARLINDO CHINAGLIA,ARLINDO CHIGNALIA JUNIOR,ELEITO,PT,JUNTOS POR SÃO PAULO,113
PRESIDENTE PRUDENTE,DEPUTADO FEDERAL,JOÃO PAULO CUNHA,JOÃO PAULO CUNHA,ELEITO,PT,JUNTOS POR SÃO PAULO,112
PRESIDENTE PRUDENTE,DEPUTADO FEDERAL,ROQUE FERREIRA,ROQUE JOSÉ FERREIRA,SUPLENTE,PT,JUNTOS POR SÃO PAULO,3
PRESIDENTE PRUDENTE,DEPUTADO FEDERAL,PIVATTO,JOSÉ PIVATTO,SUPLENTE,PT,JUNTOS POR SÃO PAULO,2
PRESIDENTE PRUDENTE,DEPUTADO FEDERAL,RICARDO BERZOINI,RICARDO JOSE RIBEIRO BERZOINI,ELEITO,PT,JUNTOS POR SÃO PAULO,265
PRESIDENTE PRUDENTE,DEPUTADO FEDERAL,JOSÉ MENTOR,JOSÉ MENTOR GUILHERME DE MELLO NETTO,ELEITO,PT,JUNTOS POR SÃO PAULO,102
PRESIDENTE PRUDENTE,DEPUTADO FEDERAL,PROF. CARLÃO RAMIRO,CARLOS RAMIRO CASTRO,SUPLENTE,PT,JUNTOS POR SÃO PAULO,62
PRESIDENTE PRUDENTE,DEPUTADO FEDERAL,FÉLIX SAHÃO,FÉLIX SAHÃO JÚNIOR,SUPLENTE,PT,JUNTOS POR SÃO PAULO,288
PRESIDENTE PRUDENTE,DEPUTADO FEDERAL,ROGÉRIO PINTO,ROGÉRIO PINTO FERNANDES,SUPLENTE,PT,JUNTOS POR SÃO PAULO,2
PRESIDENTE PRUDENTE,DEPUTADO FEDERAL,TENENTE PAZ,FRANCISCO JESUS DA PAZ,SUPLENTE,PT,JUNTOS POR SÃO PAULO,2
PRESIDENTE PRUDENTE,DEPUTADO FEDERAL,VANDERLEI SIRAQUE,VANDERLEI SIRAQUE,SUPLENTE,PT,JUNTOS POR SÃO PAULO,4
PRESIDENTE PRUDENTE,DEPUTADO FEDERAL,PAULO AFONSO,PAULO AFONSO RIBEIRO,SUPLENTE,PT,JUNTOS POR SÃO PAULO,1
PRESIDENTE PRUDENTE,DEPUTADO FEDERAL,ELIANA MORAES,ELIANA ALVES DE MORAES,SUPLENTE,PT,JUNTOS POR SÃO PAULO,5
PRESIDENTE PRUDENTE,DEPUTADO FEDERAL,REINALDO,REINALDO SANTOS RAMOS,SUPLENTE,PT,JUNTOS POR SÃO PAULO,1
PRESIDENTE PRUDENTE,DEPUTADO FEDERAL,LUIZ CARLOS GOMES,LUIZ CARLOS GOMES,SUPLENTE,PT,JUNTOS POR SÃO PAULO,2
PRESIDENTE PRUDENTE,DEPUTADO FEDERAL,JILMAR TATTO,JILMAR AUGUSTINHO TATTO,ELEITO,PT,JUNTOS POR SÃO PAULO,4
PRESIDENTE PRUDENTE,DEPUTADO FEDERAL,DURVAL ORLATO,DURVAL LOPES ORLATO,SUPLENTE,PT,JUNTOS POR SÃO PAULO,2
PRESIDENTE PRUDENTE,DEPUTADO FEDERAL,EDSON DA PAZ (O CANTOR),EDSON DA PAZ,SUPLENTE,PT,JUNTOS POR SÃO PAULO,2
PRESIDENTE PRUDENTE,DEPUTADO FEDERAL,JANIO RIBEIRO,JANIO RIBEIRO,SUPLENTE,PT,JUNTOS POR SÃO PAULO,2
PRESIDENTE PRUDENTE,DEPUTADO FEDERAL,RUBINHO BASTOS,RUBENS BASTOS DO NASCIMENTO,SUPLENTE,PT,JUNTOS POR SÃO PAULO,3
PRESIDENTE PRUDENTE,DEPUTADO FEDERAL,ARCELINO ARAUJO,ARCELINO ARAUJO RIBEIRO,SUPLENTE,PT,JUNTOS POR SÃO PAULO,1
PRESIDENTE PRUDENTE,DEPUTADO FEDERAL,CARLOS AQUINO,JOSÉ CARLOS DE AQUINO,SUPLENTE,PT,JUNTOS POR SÃO PAULO,5
PRESIDENTE PRUDENTE,DEPUTADO FEDERAL,RENATO SIMÕES,RENATO SIMÕES,SUPLENTE,PT,JUNTOS POR SÃO PAULO,20
PRESIDENTE PRUDENTE,DEPUTADO FEDERAL,DEVANIR RIBEIRO,DEVANIR RIBEIRO,ELEITO,PT,JUNTOS POR SÃO PAULO,177
PRESIDENTE PRUDENTE,DEPUTADO FEDERAL,ZARATTINI,CARLOS ALBERTO ROLIM ZARATTINI,ELEITO,PT,JUNTOS POR SÃO PAULO,5
PRESIDENTE PRUDENTE,DEPUTADO FEDERAL,MARIA LUCIA PRANDI,MARIA LUCIA PRANDI GOMES,SUPLENTE,PT,JUNTOS POR SÃO PAULO,2
PRESIDENTE PRUDENTE,DEPUTADO FEDERAL,ANGELO BARRETO,ANGELO RAFAEL BARRETO,SUPLENTE,PT,JUNTOS POR SÃO PAULO,8
PRESIDENTE PRUDENTE,DEPUTADO FEDERAL,JANETE PIETÁ,JANETE ROCHA PIETÁ,ELEITO,PT,JUNTOS POR SÃO PAULO,1
PRESIDENTE PRUDENTE,DEPUTADO FEDERAL,VALDECI CHIRANHA,VALDECI FERREIRA DA SILVA,SUPLENTE,PT,JUNTOS POR SÃO PAULO,1
PRESIDENTE PRUDENTE,DEPUTADO FEDERAL,VICENTINHO,VICENTE PAULO DA SILVA,ELEITO,PT,JUNTOS POR SÃO PAULO,31
PRESIDENTE PRUDENTE,DEPUTADO FEDERAL,PAULO TEIXEIRA,LUIZ PAULO TEIXEIRA FERREIRA,ELEITO,PT,JUNTOS POR SÃO PAULO,10
PRESIDENTE PRUDENTE,DEPUTADO FEDERAL,CLAURY,CLAURY SANTOS ALVES DA SILVA,SUPLENTE,PTB,PARTIDO TRABALHISTA BRASILEIRO,33
PRESIDENTE PRUDENTE,DEPUTADO FEDERAL,CORONEL GOULART,ANTONIO CARLOS GOULART,SUPLENTE,PTB,PARTIDO TRABALHISTA BRASILEIRO,3
PRESIDENTE PRUDENTE,DEPUTADO FEDERAL,VAMPETA,MARCOS ANDRE BATISTA SANTOS,SUPLENTE,PTB,PARTIDO TRABALHISTA BRASILEIRO,13
PRESIDENTE PRUDENTE,DEPUTADO FEDERAL,NADUR,ADALBERTO NADUR,SUPLENTE,PTB,PARTIDO TRABALHISTA BRASILEIRO,4
PRESIDENTE PRUDENTE,DEPUTADO FEDERAL,SANTANA,JOSE SANTANA DE ABREU,SUPLENTE,PTB,PARTIDO TRABALHISTA BRASILEIRO,1
PRESIDENTE PRUDENTE,DEPUTADO FEDERAL,PIRU,CLAUDIO AFFONSO,SUPLENTE,PTB,PARTIDO TRABALHISTA BRASILEIRO,4
PRESIDENTE PRUDENTE,DEPUTADO FEDERAL,ROBSON TUMA,ROBSON TUMA,SUPLENTE,PTB,PARTIDO TRABALHISTA BRASILEIRO,10
PRESIDENTE PRUDENTE,DEPUTADO FEDERAL,RICARDO OLIVEIRA,RICARDO JOSE DE OLIVEIRA,SUPLENTE,PTB,PARTIDO TRABALHISTA BRASILEIRO,5
PRESIDENTE PRUDENTE,DEPUTADO FEDERAL,JORGE MARINGOLO,JORGE ANTONIO MARINGOLO PEREIRA,SUPLENTE,PTB,PARTIDO TRABALHISTA BRASILEIRO,1
PRESIDENTE PRUDENTE,DEPUTADO FEDERAL,CARLINHOS SARAIVA,CARLOS HENRIQUE DA FONSECA,SUPLENTE,PTB,PARTIDO TRABALHISTA BRASILEIRO,2
PRESIDENTE PRUDENTE,DEPUTADO FEDERAL,DR SILNEY BERALDO,SILNEY MARCOS BERALDO,SUPLENTE,PTB,PARTIDO TRABALHISTA BRASILEIRO,3
PRESIDENTE PRUDENTE,DEPUTADO FEDERAL,TICO DO TRANSPORTE ESCOLAR,ALBERTO GOMES BARBOSA,SUPLENTE,PTB,PARTIDO TRABALHISTA BRASILEIRO,11
PRESIDENTE PRUDENTE,DEPUTADO FEDERAL,AMIRAH SABA DA METROPOLITANAFM,AMIRAH SABA,SUPLENTE,PTB,PARTIDO TRABALHISTA BRASILEIRO,3
PRESIDENTE PRUDENTE,DEPUTADO FEDERAL,SINVAL DORIGON,SINVAL ROBERTO DORIGON,SUPLENTE,PTB,PARTIDO TRABALHISTA BRASILEIRO,8
PRESIDENTE PRUDENTE,DEPUTADO FEDERAL,NELSON MARQUEZELLI,NELSON MARQUEZELLI,ELEITO,PTB,PARTIDO TRABALHISTA BRASILEIRO,390
PRESIDENTE PRUDENTE,DEPUTADO FEDERAL,SATURNINO DE BRITO,SATURNINO DE SALES SANTOS,SUPLENTE,PTB,PARTIDO TRABALHISTA BRASILEIRO,1
PRESIDENTE PRUDENTE,DEPUTADO FEDERAL,CIGANA,GISELA DOS SANTOS,SUPLENTE,PTB,PARTIDO TRABALHISTA BRASILEIRO,1
PRESIDENTE PRUDENTE,DEPUTADO FEDERAL,SONIA CRISTIANO,SONIA REGINA CRISTIANO,SUPLENTE,PTB,PARTIDO TRABALHISTA BRASILEIRO,2
PRESIDENTE PRUDENTE,DEPUTADO FEDERAL,ARNALDO FARIA DE SÁ,ARNALDO FARIA DE SÁ,ELEITO,PTB,PARTIDO TRABALHISTA BRASILEIRO,278
PRESIDENTE PRUDENTE,DEPUTADO FEDERAL,CELIO DINIZ,CELIO FRANCISCO DINIZ,SUPLENTE,PTB,PARTIDO TRABALHISTA BRASILEIRO,2
PRESIDENTE PRUDENTE,DEPUTADO FEDERAL,MADONNAKÁ É KATIA THOMÉ,KATIA REGINA TOMÉ,SUPLENTE,PTB,PARTIDO TRABALHISTA BRASILEIRO,1
PRESIDENTE PRUDENTE,DEPUTADO FEDERAL,CARLOS JUNG,CARLOS ALBERTO JUNG SANTOS,SUPLENTE,PTB,PARTIDO TRABALHISTA BRASILEIRO,2
PRESIDENTE PRUDENTE,DEPUTADO FEDERAL,FRANK AGUIAR,FRANCINETO LUZ DE AGUIAR,SUPLENTE,PTB,PARTIDO TRABALHISTA BRASILEIRO,5
PRESIDENTE PRUDENTE,DEPUTADO FEDERAL,SONIA GARCIA,MARIA SONIA REIS LIMA,SUPLENTE,PTB,PARTIDO TRABALHISTA BRASILEIRO,23
PRESIDENTE PRUDENTE,DEPUTADO FEDERAL,DR ANDRE ROCHA,ANDRE LUIS ROCHA,SUPLENTE,PTB,PARTIDO TRABALHISTA BRASILEIRO,3
PRESIDENTE PRUDENTE,DEPUTADO FEDERAL,PADRE FERNANDO,LAUDINEY FERNANDO SILVA FRAGA,SUPLENTE,PTB,PARTIDO TRABALHISTA BRASILEIRO,10
PRESIDENTE PRUDENTE,DEPUTADO FEDERAL,VERONICA TAVARES,MARIA VERONICA TAVARES,SUPLENTE,PTB,PARTIDO TRABALHISTA BRASILEIRO,1
PRESIDENTE PRUDENTE,DEPUTADO FEDERAL,DR SEGURA,JOSE APARECIDO SEGURA RUIZ,SUPLENTE,PTB,PARTIDO TRABALHISTA BRASILEIRO,2
PRESIDENTE PRUDENTE,DEPUTADO FEDERAL,NICE DA CHINELA,ELENICE MADALENA DOS SANTOS,SUPLENTE,PTB,PARTIDO TRABALHISTA BRASILEIRO,1
PRESIDENTE PRUDENTE,DEPUTADO FEDERAL,PAULO LIMA,PAULO CESAR DE OLIVEIRA LIMA,SUPLENTE,PMDB,PARTIDO DO MOVIMENTO DEMOCRÁTICO BRASILEIRO,11221
PRESIDENTE PRUDENTE,DEPUTADO FEDERAL,CARVALHO SALES,JEFFERSON CARVALHO SALES,SUPLENTE,PMDB,PARTIDO DO MOVIMENTO DEMOCRÁTICO BRASILEIRO,3
PRESIDENTE PRUDENTE,DEPUTADO FEDERAL,VANDERLEI JUELI,VANDERLEI JUELI,SUPLENTE,PMDB,PARTIDO DO MOVIMENTO DEMOCRÁTICO BRASILEIRO,10
PRESIDENTE PRUDENTE,DEPUTADO FEDERAL,DR. ALMÉRIO,ALMÉRIO AGUIAR MELO FILHO,SUPLENTE,PMDB,PARTIDO DO MOVIMENTO DEMOCRÁTICO BRASILEIRO,1
PRESIDENTE PRUDENTE,DEPUTADO FEDERAL,ANA CRISTINA,ANA CRISTINA FERNANDES GIAMPIETRO,SUPLENTE,PMDB,PARTIDO DO MOVIMENTO DEMOCRÁTICO BRASILEIRO,1
PRESIDENTE PRUDENTE,DEPUTADO FEDERAL,CELSO GUEDES,CELSO DA LUZ GUEDES,SUPLENTE,PMDB,PARTIDO DO MOVIMENTO DEMOCRÁTICO BRASILEIRO,3
PRESIDENTE PRUDENTE,DEPUTADO FEDERAL,NENÊ MONTANHER,ALCIDES MONTANHER FILHO,SUPLENTE,PMDB,PARTIDO DO MOVIMENTO DEMOCRÁTICO BRASILEIRO,2
PRESIDENTE PRUDENTE,DEPUTADO FEDERAL,NENÊ RÉSTIO,ANGELO ROBERTO RESTIO,SUPLENTE,PMDB,PARTIDO DO MOVIMENTO DEMOCRÁTICO BRASILEIRO,1
PRESIDENTE PRUDENTE,DEPUTADO FEDERAL,MARCOS TENÓRIO,MARCOS ANTÔNIO FERREIRA TENÓRIO,SUPLENTE,PMDB,PARTIDO DO MOVIMENTO DEMOCRÁTICO BRASILEIRO,9
PRESIDENTE PRUDENTE,DEPUTADO FEDERAL,PAULINHO SOBRAL,PAULO MENDES SOBRAL,SUPLENTE,PMDB,PARTIDO DO MOVIMENTO DEMOCRÁTICO BRASILEIRO,2
PRESIDENTE PRUDENTE,DEPUTADO FEDERAL,TONY JUPSSON,TONY JUPSSON SANTOS,SUPLENTE,PMDB,PARTIDO DO MOVIMENTO DEMOCRÁTICO BRASILEIRO,1
PRESIDENTE PRUDENTE,DEPUTADO FEDERAL,EDUARDO COELHO,EDUARDO JOSÉ PEREIRA COELHO,SUPLENTE,PMDB,PARTIDO DO MOVIMENTO DEMOCRÁTICO BRASILEIRO,13
PRESIDENTE PRUDENTE,DEPUTADO FEDERAL,PILTON RIOS,PILTON RIOS DE BARROS FELIX PEREIRA,SUPLENTE,PMDB,PARTIDO DO MOVIMENTO DEMOCRÁTICO BRASILEIRO,4
PRESIDENTE PRUDENTE,DEPUTADO FEDERAL,CASTANHO,GULHERME DE MELLO CASTANHO,SUPLENTE,PMDB,PARTIDO DO MOVIMENTO DEMOCRÁTICO BRASILEIRO,3
PRESIDENTE PRUDENTE,DEPUTADO FEDERAL,EDINHO ARAUJO,EDSON EDINHO COELHO ARAUJO,ELEITO,PMDB,PARTIDO DO MOVIMENTO DEMOCRÁTICO BRASILEIRO,16
PRESIDENTE PRUDENTE,DEPUTADO FEDERAL,SERGIO KOBRA,SERGIO MARTINS DOS SANTOS JUNIOR,SUPLENTE,PMDB,PARTIDO DO MOVIMENTO DEMOCRÁTICO BRASILEIRO,1
PRESIDENTE PRUDENTE,DEPUTADO FEDERAL,DR. AJURICABA,AJURICABA DE SOUZA MENEZES,SUPLENTE,PMDB,PARTIDO DO MOVIMENTO DEMOCRÁTICO BRASILEIRO,1
PRESIDENTE PRUDENTE,DEPUTADO FEDERAL,LEONEL NA HORA,LEONEL HERNANDEZ JUNIOR,SUPLENTE,PMDB,PARTIDO DO MOVIMENTO DEMOCRÁTICO BRASILEIRO,1
PRESIDENTE PRUDENTE,DEPUTADO FEDERAL,ROLEMBERG,ROLANDO BELTRAMINE ROLEMBERG,SUPLENTE,PMDB,PARTIDO DO MOVIMENTO DEMOCRÁTICO BRASILEIRO,1
PRESIDENTE PRUDENTE,DEPUTADO FEDERAL,BOCA NERVOSA,EDMAR MARQUES SILVA,SUPLENTE,PMDB,PARTIDO DO MOVIMENTO DEMOCRÁTICO BRASILEIRO,5
PRESIDENTE PRUDENTE,DEPUTADO FEDERAL,LÉO OLIVEIRA,OCIMAR DONIZETI LEO OLIVEIRA,SUPLENTE,PMDB,PARTIDO DO MOVIMENTO DEMOCRÁTICO BRASILEIRO,6
PRESIDENTE PRUDENTE,DEPUTADO FEDERAL,CLERISTON VALLE,CLERISTON PEREIRA DO VALLE,SUPLENTE,PMDB,PARTIDO DO MOVIMENTO DEMOCRÁTICO BRASILEIRO,1
PRESIDENTE PRUDENTE,DEPUTADO FEDERAL,MAIRÁ,MARIA DE JESUS MATIAS,SUPLENTE,PMDB,PARTIDO DO MOVIMENTO DEMOCRÁTICO BRASILEIRO,1
PRESIDENTE PRUDENTE,DEPUTADO FEDERAL,MORATO,JOSÉ ANTONIO MORATO,SUPLENTE,PMDB,PARTIDO DO MOVIMENTO DEMOCRÁTICO BRASILEIRO,4
PRESIDENTE PRUDENTE,DEPUTADO FEDERAL,RICARDO HOLZ,RICARDO HOLZ VIDAL DOS SANTOS,SUPLENTE,PMDB,PARTIDO DO MOVIMENTO DEMOCRÁTICO BRASILEIRO,1
PRESIDENTE PRUDENTE,DEPUTADO FEDERAL,JOÃO SARACENI,JOÃO SARACENI,SUPLENTE,PMDB,PARTIDO DO MOVIMENTO DEMOCRÁTICO BRASILEIRO,3
PRESIDENTE PRUDENTE,DEPUTADO FEDERAL,A. TRIUNFO AVELLAR,AGUINALDO TRIUMPHO AVELLAR,SUPLENTE,PMDB,PARTIDO DO MOVIMENTO DEMOCRÁTICO BRASILEIRO,1
PRESIDENTE PRUDENTE,DEPUTADO FEDERAL,PAULINHO DO GUINCHO,AUDALIO PAULO DA SILVA,SUPLENTE,PMDB,PARTIDO DO MOVIMENTO DEMOCRÁTICO BRASILEIRO,1
PRESIDENTE PRUDENTE,DEPUTADO FEDERAL,DR. SAMIR NASSBINE,SAMIR ASSAD NASSBINE,SUPLENTE,PMDB,PARTIDO DO MOVIMENTO DEMOCRÁTICO BRASILEIRO,4
PRESIDENTE PRUDENTE,DEPUTADO FEDERAL,DANIEL CALDEIRA,DANIEL CALDEIRA MATEUS,SUPLENTE,PSL,PRESTE ATENÇÃO SÃO PAULO,38
PRESIDENTE PRUDENTE,DEPUTADO FEDERAL,RUDY GATOLIN,RUDY GATOLIN,SUPLENTE,PSL,PRESTE ATENÇÃO SÃO PAULO,1
PRESIDENTE PRUDENTE,DEPUTADO FEDERAL,SARGENTO SEVERO,LUCIANO APARECIDO SEVERO,SUPLENTE,PSL,PRESTE ATENÇÃO SÃO PAULO,13
PRESIDENTE PRUDENTE,DEPUTADO FEDERAL,APOSTOLO LEO,LEONILDIO LIMA DE OLIVEIRA,SUPLENTE,PSL,PRESTE ATENÇÃO SÃO PAULO,8
PRESIDENTE PRUDENTE,DEPUTADO FEDERAL,ROBERTO SIQUEIRA,ROBERTO SIQUEIRA GOMES,SUPLENTE,PSL,PRESTE ATENÇÃO SÃO PAULO,1
PRESIDENTE PRUDENTE,DEPUTADO FEDERAL,CORONEL GILSON LOPES,GILSON LOPES DA SILVA,SUPLENTE,PSC,HUMANISTA CRISTÃO ,11
PRESIDENTE PRUDENTE,DEPUTADO FEDERAL,MISSIONARIA NAZARE,MARIA NAZARE DOS SANTOS SORRILLO,SUPLENTE,PSC,HUMANISTA CRISTÃO ,7
PRESIDENTE PRUDENTE,DEPUTADO FEDERAL,CLEBER DELALIBERA,CLEBER DE MOURA DELALIBERA,SUPLENTE,PSC,HUMANISTA CRISTÃO ,2
PRESIDENTE PRUDENTE,DEPUTADO FEDERAL,MARCO FELICIANO,MARCO ANTONIO FELICIANO,ELEITO,PSC,HUMANISTA CRISTÃO ,394
PRESIDENTE PRUDENTE,DEPUTADO FEDERAL,MARCELO AGUIAR,MARCELO THEODORO DE AGUIAR,ELEITO,PSC,HUMANISTA CRISTÃO ,18
PRESIDENTE PRUDENTE,DEPUTADO FEDERAL,GISON SOARES,GISON ALVES SOARES,SUPLENTE,PSC,HUMANISTA CRISTÃO ,1
PRESIDENTE PRUDENTE,DEPUTADO FEDERAL,TENENTE ORLANDO,ORLANDO BENEDITO DE LIMA,SUPLENTE,PSC,HUMANISTA CRISTÃO ,1
PRESIDENTE PRUDENTE,DEPUTADO FEDERAL,REGIS DE OLIVEIRA,REGIS FERNANDES DE OLIVEIRA,SUPLENTE,PSC,HUMANISTA CRISTÃO ,182
PRESIDENTE PRUDENTE,DEPUTADO FEDERAL,SILVIA PALMA,SILVIA ELIANA PALMA,SUPLENTE,PSC,HUMANISTA CRISTÃO ,5
PRESIDENTE PRUDENTE,DEPUTADO FEDERAL,NEY SANTOS,CLAUDINEI ALVES DOS SANTOS,SUPLENTE,PSC,HUMANISTA CRISTÃO ,1
PRESIDENTE PRUDENTE,DEPUTADO FEDERAL,DR.CARLOS FARIA,CARLOS EDUARDO DA SILVA FARIA,SUPLENTE,PSC,HUMANISTA CRISTÃO ,1
PRESIDENTE PRUDENTE,DEPUTADO FEDERAL,WAGNER FIOROTTO,WAGNER MONTEIRO FIOROTTO,SUPLENTE,PSC,HUMANISTA CRISTÃO ,1
PRESIDENTE PRUDENTE,DEPUTADO FEDERAL,DALVAN,JOÃO GOMES DE ALMEIDA,SUPLENTE,PSC,HUMANISTA CRISTÃO ,6
PRESIDENTE PRUDENTE,DEPUTADO FEDERAL,MARCOS CUNHA,MARCOS DE ALMEIDA CUNHA,SUPLENTE,PSC,HUMANISTA CRISTÃO ,2
PRESIDENTE PRUDENTE,DEPUTADO FEDERAL,PR. LUIZ LEMOS,LUIZ CARLOS LEMOS,SUPLENTE,PSC,HUMANISTA CRISTÃO ,1
PRESIDENTE PRUDENTE,DEPUTADO FEDERAL,QUEIROZ PIRIQUITA,LUIS CARLOS DE QUEIROZ,SUPLENTE,PSC,HUMANISTA CRISTÃO ,1
PRESIDENTE PRUDENTE,DEPUTADO FEDERAL,MAURÃO,JOSE MAURO PEREIRA DE BARROS,SUPLENTE,PSC,HUMANISTA CRISTÃO ,8
PRESIDENTE PRUDENTE,DEPUTADO FEDERAL,PRICILA LEME,PRICILA HELENA MOYSES LEME,SUPLENTE,PSC,HUMANISTA CRISTÃO ,4
PRESIDENTE PRUDENTE,DEPUTADO FEDERAL,DR. CARALAMBOS,CARALAMBOS CONSTANTINO SOTIROPOULOS,SUPLENTE,PSC,HUMANISTA CRISTÃO ,1
PRESIDENTE PRUDENTE,DEPUTADO FEDERAL,TONINHO CORREDOR,ANTONIO CICERO DA SILVA,SUPLENTE,PSC,HUMANISTA CRISTÃO ,2
PRESIDENTE PRUDENTE,DEPUTADO FEDERAL,TONHO BAIANO,JOSE ANTONIO OLIVEIRA DOS SANTOS,SUPLENTE,PSC,HUMANISTA CRISTÃO ,4
PRESIDENTE PRUDENTE,DEPUTADO FEDERAL,MANOEL GASPAR,MANOEL FERREIRA DE SOUZA GASPAR,SUPLENTE,PSC,HUMANISTA CRISTÃO ,68
PRESIDENTE PRUDENTE,DEPUTADO FEDERAL,JUCA CHAVES,JURANDYR CZACZKES CHAVES,SUPLENTE,PR,JUNTOS POR SÃO PAULO,18
PRESIDENTE PRUDENTE,DEPUTADO FEDERAL,AGNALDO TIMOTEO,AGUINALDO TIMOTEO PEREIRA,SUPLENTE,PR,JUNTOS POR SÃO PAULO,4
PRESIDENTE PRUDENTE,DEPUTADO FEDERAL,TIRIRICA,FRANCISCO EVERARDO OLIVEIRA SILVA,ELEITO,PR,JUNTOS POR SÃO PAULO,2642
PRESIDENTE PRUDENTE,DEPUTADO FEDERAL,PR PAULO FREIRE,PAULO ROBERTO FREIRE DA COSTA,ELEITO,PR,JUNTOS POR SÃO PAULO,548
PRESIDENTE PRUDENTE,DEPUTADO FEDERAL,LUCIANA COSTA,LUCIANA DE ALMEIDA COSTA,SUPLENTE,PR,JUNTOS POR SÃO PAULO,20
PRESIDENTE PRUDENTE,DEPUTADO FEDERAL,MILTON MONTI,MILTON ANTONIO CASQUEL MONTI,ELEITO,PR,JUNTOS POR SÃO PAULO,63
PRESIDENTE PRUDENTE,DEPUTADO FEDERAL,VALDEMAR COSTA NETO,VALDEMAR COSTA NETO,ELEITO,PR,JUNTOS POR SÃO PAULO,322
PRESIDENTE PRUDENTE,DEPUTADO FEDERAL,CAIO,CAIO GORENTZVAIG,SUPLENTE,PPS,PSDB/DEM/PPS,1
PRESIDENTE PRUDENTE,DEPUTADO FEDERAL,WILLIAM WOO,WILLIAM BOSS WOO,SUPLENTE,PPS,PSDB/DEM/PPS,49
PRESIDENTE PRUDENTE,DEPUTADO FEDERAL,VALDEMAR ANFRISIO,VALDEMAR ANFRISIO DOS SANTOS,SUPLENTE,PPS,PSDB/DEM/PPS,1
PRESIDENTE PRUDENTE,DEPUTADO FEDERAL,ROBERTO FREIRE,ROBERTO JOAO PEREIRA FREIRE,ELEITO,PPS,PSDB/DEM/PPS,149
PRESIDENTE PRUDENTE,DEPUTADO FEDERAL,CORONEL EDSON SARDANO,EDSON DE JESUS SARDANO,SUPLENTE,PPS,PSDB/DEM/PPS,10
PRESIDENTE PRUDENTE,DEPUTADO FEDERAL,DIMAS RAMALHO,DIMAS EDUARDO RAMALHO,ELEITO,PPS,PSDB/DEM/PPS,83
PRESIDENTE PRUDENTE,DEPUTADO FEDERAL,ARI FRIEDENBACH,ARI FRIEDENBACH,SUPLENTE,PPS,PSDB/DEM/PPS,89
PRESIDENTE PRUDENTE,DEPUTADO FEDERAL,JOSE ONERIO,JOSE ONERIO DA SILVA,SUPLENTE,PPS,PSDB/DEM/PPS,237
