PIRANGI,PRESIDENTE,DILMA,DILMA VANA ROUSSEFF,2º TURNO,PT,PARA O BRASIL SEGUIR MUDANDO,1760
PIRANGI,PRESIDENTE,JOSÉ SERRA,JOSÉ SERRA,2º TURNO,PSDB,O BRASIL PODE MAIS,3064
PIRANGI,GOVERNADOR,GERALDO ALCKMIN,GERALDO JOSE RODRIGUES ALCKMIN FILHO,ELEITO,PSDB,UNIDOS POR SÃO PAULO,3344
PIRANGI,SENADOR,MARTA SUPLICY,MARTA SUPLICY,ELEITO,PT,UNIÃO PARA MUDAR,1524
PIRANGI,SENADOR,ALOYSIO NUNES,ALOYSIO NUNES FERREIRA FILHO,ELEITO,PSDB,UNIDOS POR SÃO PAULO,3152
PIRANGI,DEPUTADO FEDERAL,ANTONIO BULHÕES,ANTONIO CARLOS MARTINS DE BULHÕES,ELEITO,PRB,JUNTOS POR SÃO PAULO,31
PIRANGI,DEPUTADO FEDERAL,ALESSANDER VIGNA,ALESSANDER BARREIRA VIGNA,SUPLENTE,PRB,JUNTOS POR SÃO PAULO,1
PIRANGI,DEPUTADO FEDERAL,OTONIEL LIMA,OTONIEL CARLOS DE LIMA,MÉDIA,PRB,JUNTOS POR SÃO PAULO,3
PIRANGI,DEPUTADO FEDERAL,MALUF,PAULO SALIM MALUF,ELEITO,PP,PARTIDO PROGRESSISTA,32
PIRANGI,DEPUTADO FEDERAL,CAPITÃO GOMES,CARLOS GOMES DA SILVA,SUPLENTE,PP,PARTIDO PROGRESSISTA,3
PIRANGI,DEPUTADO FEDERAL,MANOEL MOREIRA,MANOEL MOREIRA DE ARAUJO FILHO,SUPLENTE,PP,PARTIDO PROGRESSISTA,1
PIRANGI,DEPUTADO FEDERAL,ADELINA ALCANTARA MACHADO,ADELINA PEREIRA DA SILVEIRA DE ALCANTARA MACHADO,SUPLENTE,PP,PARTIDO PROGRESSISTA,1
PIRANGI,DEPUTADO FEDERAL,LIBERATO DE VALENTIM GENTIL,LIBERATO ROCHA CALDEIRA,SUPLENTE,PP,PARTIDO PROGRESSISTA,10
PIRANGI,DEPUTADO FEDERAL,LAURINDO BARNARDES,LAURINDO BERNARDES DE SOUZA,SUPLENTE,PP,PARTIDO PROGRESSISTA,3
PIRANGI,DEPUTADO FEDERAL,ALINE CORREA,ALINE LEMOS CORREA DE OLIVEIRA ANDRADE,ELEITO,PP,PARTIDO PROGRESSISTA,2
PIRANGI,DEPUTADO FEDERAL,ELIAS BITENCOURT,ELIAS DOS SANTOS BITENCOURT,SUPLENTE,PP,PARTIDO PROGRESSISTA,1
PIRANGI,DEPUTADO FEDERAL,TELLES,DOMINGOS TELLES SANCHES,SUPLENTE,PP,PARTIDO PROGRESSISTA,2
PIRANGI,DEPUTADO FEDERAL,DRA ADRIANA DA COSTA,ADRIANA ALVARES DA COSTA DE PAULA ALVES,SUPLENTE,PP,PARTIDO PROGRESSISTA,1
PIRANGI,DEPUTADO FEDERAL,LAYRTON INFANTE,LAYRTON INFANTE,SUPLENTE,PP,PARTIDO PROGRESSISTA,92
PIRANGI,DEPUTADO FEDERAL,MISSIONÁRIO JOSÉ OLIMPIO,JOSÉ OLIMPIO SILVEIRA MORAES,ELEITO,PP,PARTIDO PROGRESSISTA,42
PIRANGI,DEPUTADO FEDERAL,SILVIA MARIA,SILVIA MARIA DOS SANTOS PEREIRA,SUPLENTE,PP,PARTIDO PROGRESSISTA,1
PIRANGI,DEPUTADO FEDERAL,DR NECHAR,SERGIO ANTONIO NECHAR,SUPLENTE,PP,PARTIDO PROGRESSISTA,3
PIRANGI,DEPUTADO FEDERAL,VADÃO,ETIVALDO VADAO GOMES,SUPLENTE,PP,PARTIDO PROGRESSISTA,58
PIRANGI,DEPUTADO FEDERAL,PH,PAULO HENRIQUE RIBEIRO SANTANA,SUPLENTE,PDT,PARTIDO DEMOCRÁTICO TRABALHISTA,2
PIRANGI,DEPUTADO FEDERAL,JOÃO DADO,JOÃO EDUARDO DADO LEITE DE CARVALHO,ELEITO,PDT,PARTIDO DEMOCRÁTICO TRABALHISTA,3
PIRANGI,DEPUTADO FEDERAL,PAULINHO DA FORÇA,PAULO PEREIRA DA SILVA,ELEITO,PDT,PARTIDO DEMOCRÁTICO TRABALHISTA,22
PIRANGI,DEPUTADO FEDERAL,ELISEU DANIEL,ELISEU DANIEL DOS SANTOS,SUPLENTE,PDT,PARTIDO DEMOCRÁTICO TRABALHISTA,27
PIRANGI,DEPUTADO FEDERAL,GUSTAVO STUPP,LUIZ GUSTAVO ANTUNES STUPP,SUPLENTE,PDT,PARTIDO DEMOCRÁTICO TRABALHISTA,1
PIRANGI,DEPUTADO FEDERAL,MARTAN,MARCELO MARTIN,SUPLENTE,PDT,PARTIDO DEMOCRÁTICO TRABALHISTA,1
PIRANGI,DEPUTADO FEDERAL,SAULO GOES,SAULO GOES DE ALBUQUERQUE,SUPLENTE,PDT,PARTIDO DEMOCRÁTICO TRABALHISTA,1
PIRANGI,DEPUTADO FEDERAL,MEDEIROS,LUIZ ANTONIO DE MEDEIROS NETO,SUPLENTE,PDT,PARTIDO DEMOCRÁTICO TRABALHISTA,2
PIRANGI,DEPUTADO FEDERAL,GILBERTO BENZI,GILBERTO BENZI,SUPLENTE,PDT,PARTIDO DEMOCRÁTICO TRABALHISTA,24
PIRANGI,DEPUTADO FEDERAL,DR LUIZ CHIAPARINE,LUIZ CARLOS CHIAPARINE,SUPLENTE,PDT,PARTIDO DEMOCRÁTICO TRABALHISTA,4
PIRANGI,DEPUTADO FEDERAL,NELSINHO DA BAHIA,NELSON FRANCISCO DOS SANTOS,SUPLENTE,PDT,PARTIDO DEMOCRÁTICO TRABALHISTA,1
PIRANGI,DEPUTADO FEDERAL,MANOEL ANTUNES,MANOEL ANTUNES,SUPLENTE,PDT,PARTIDO DEMOCRÁTICO TRABALHISTA,3
PIRANGI,DEPUTADO FEDERAL,DEF.BIODIESEL-SILASEDUARDOINKE,SILAS EDUARDO INKE,SUPLENTE,PDT,PARTIDO DEMOCRÁTICO TRABALHISTA,1
PIRANGI,DEPUTADO FEDERAL,CARLOS HENRIQUE,CARLOS HENRIQUE PINTO,SUPLENTE,PDT,PARTIDO DEMOCRÁTICO TRABALHISTA,5
PIRANGI,DEPUTADO FEDERAL,MAURICIO SOARES JUNIOR,MAURICIO SOARES DE ALMEIDA JUNIOR,SUPLENTE,PDT,PARTIDO DEMOCRÁTICO TRABALHISTA,1
PIRANGI,DEPUTADO FEDERAL,SALVADOR ZIMBALDI,SALVADOR ZIMBALDI FILHO,MÉDIA,PDT,PARTIDO DEMOCRÁTICO TRABALHISTA,53
PIRANGI,DEPUTADO FEDERAL,FERNANDO CHIARELLI,FERNANDO CHIARELLI,SUPLENTE,PDT,PARTIDO DEMOCRÁTICO TRABALHISTA,18
PIRANGI,DEPUTADO FEDERAL,JOSUE TOPA TUDO,JOSUÉ MOREIRA,SUPLENTE,PDT,PARTIDO DEMOCRÁTICO TRABALHISTA,1
PIRANGI,DEPUTADO FEDERAL,VICENTE CANDIDO,VICENTE CANDIDO DA SILVA,ELEITO,PT,JUNTOS POR SÃO PAULO,3
PIRANGI,DEPUTADO FEDERAL,MARQUINHOS OLÍVIO,MARCOS OLIVIO CONCEIÇÃO,SUPLENTE,PT,JUNTOS POR SÃO PAULO,2
PIRANGI,DEPUTADO FEDERAL,LARGUESA,LUIS VANDERLEI LARGUESA,SUPLENTE,PT,JUNTOS POR SÃO PAULO,2
PIRANGI,DEPUTADO FEDERAL,VACCAREZZA,CANDIDO ELPIDIO DE SOUZA VACCAREZZA,ELEITO,PT,JUNTOS POR SÃO PAULO,11
PIRANGI,DEPUTADO FEDERAL,GENOINO,JOSÉ GENOÍNO NETO,SUPLENTE,PT,JUNTOS POR SÃO PAULO,5
PIRANGI,DEPUTADO FEDERAL,NEWTON LIMA NETO,NEWTON LIMA NETO,ELEITO,PT,JUNTOS POR SÃO PAULO,2
PIRANGI,DEPUTADO FEDERAL,TEREZINHA RONDELLI,MARIA TEREZINHA RONDELLI,SUPLENTE,PT,JUNTOS POR SÃO PAULO,2
PIRANGI,DEPUTADO FEDERAL,ARLINDO CHINAGLIA,ARLINDO CHIGNALIA JUNIOR,ELEITO,PT,JUNTOS POR SÃO PAULO,93
PIRANGI,DEPUTADO FEDERAL,JOÃO PAULO CUNHA,JOÃO PAULO CUNHA,ELEITO,PT,JUNTOS POR SÃO PAULO,2
PIRANGI,DEPUTADO FEDERAL,PIVATTO,JOSÉ PIVATTO,SUPLENTE,PT,JUNTOS POR SÃO PAULO,1
PIRANGI,DEPUTADO FEDERAL,RICARDO BERZOINI,RICARDO JOSE RIBEIRO BERZOINI,ELEITO,PT,JUNTOS POR SÃO PAULO,1
PIRANGI,DEPUTADO FEDERAL,JOSÉ MENTOR,JOSÉ MENTOR GUILHERME DE MELLO NETTO,ELEITO,PT,JUNTOS POR SÃO PAULO,235
PIRANGI,DEPUTADO FEDERAL,PROF. CARLÃO RAMIRO,CARLOS RAMIRO CASTRO,SUPLENTE,PT,JUNTOS POR SÃO PAULO,10
PIRANGI,DEPUTADO FEDERAL,FÉLIX SAHÃO,FÉLIX SAHÃO JÚNIOR,SUPLENTE,PT,JUNTOS POR SÃO PAULO,308
PIRANGI,DEPUTADO FEDERAL,TENENTE PAZ,FRANCISCO JESUS DA PAZ,SUPLENTE,PT,JUNTOS POR SÃO PAULO,3
PIRANGI,DEPUTADO FEDERAL,RODRIGO VALVERDE,JORGE RODRIGO VALVERDE SANTANA,SUPLENTE,PT,JUNTOS POR SÃO PAULO,1
PIRANGI,DEPUTADO FEDERAL,VANDERLEI SIRAQUE,VANDERLEI SIRAQUE,SUPLENTE,PT,JUNTOS POR SÃO PAULO,9
PIRANGI,DEPUTADO FEDERAL,LUIZ CARLOS GOMES,LUIZ CARLOS GOMES,SUPLENTE,PT,JUNTOS POR SÃO PAULO,1
PIRANGI,DEPUTADO FEDERAL,EDSON DA PAZ (O CANTOR),EDSON DA PAZ,SUPLENTE,PT,JUNTOS POR SÃO PAULO,1
PIRANGI,DEPUTADO FEDERAL,RUBINHO BASTOS,RUBENS BASTOS DO NASCIMENTO,SUPLENTE,PT,JUNTOS POR SÃO PAULO,1
PIRANGI,DEPUTADO FEDERAL,REGINALDO PERNAMBUCANO,REGINALDO CARNEIRO DE MOURA,SUPLENTE,PT,JUNTOS POR SÃO PAULO,1
PIRANGI,DEPUTADO FEDERAL,RENATO SIMÕES,RENATO SIMÕES,SUPLENTE,PT,JUNTOS POR SÃO PAULO,1
PIRANGI,DEPUTADO FEDERAL,ZARATTINI,CARLOS ALBERTO ROLIM ZARATTINI,ELEITO,PT,JUNTOS POR SÃO PAULO,31
PIRANGI,DEPUTADO FEDERAL,MARIA LUCIA PRANDI,MARIA LUCIA PRANDI GOMES,SUPLENTE,PT,JUNTOS POR SÃO PAULO,3
PIRANGI,DEPUTADO FEDERAL,VICENTINHO,VICENTE PAULO DA SILVA,ELEITO,PT,JUNTOS POR SÃO PAULO,106
PIRANGI,DEPUTADO FEDERAL,PAULO TEIXEIRA,LUIZ PAULO TEIXEIRA FERREIRA,ELEITO,PT,JUNTOS POR SÃO PAULO,1
PIRANGI,DEPUTADO FEDERAL,WANDA CORRÊA,VANDERLEIA APARECIDA CORREA,SUPLENTE,PTB,PARTIDO TRABALHISTA BRASILEIRO,1
PIRANGI,DEPUTADO FEDERAL,SANTANA,JOSE SANTANA DE ABREU,SUPLENTE,PTB,PARTIDO TRABALHISTA BRASILEIRO,1
PIRANGI,DEPUTADO FEDERAL,ROBSON TUMA,ROBSON TUMA,SUPLENTE,PTB,PARTIDO TRABALHISTA BRASILEIRO,1
PIRANGI,DEPUTADO FEDERAL,SINVAL DORIGON,SINVAL ROBERTO DORIGON,SUPLENTE,PTB,PARTIDO TRABALHISTA BRASILEIRO,2
PIRANGI,DEPUTADO FEDERAL,NELSON MARQUEZELLI,NELSON MARQUEZELLI,ELEITO,PTB,PARTIDO TRABALHISTA BRASILEIRO,2
PIRANGI,DEPUTADO FEDERAL,MARCOS CRIPPA,MARCOS ANTONIO CRIPPA,SUPLENTE,PTB,PARTIDO TRABALHISTA BRASILEIRO,6
PIRANGI,DEPUTADO FEDERAL,ARNALDO FARIA DE SÁ,ARNALDO FARIA DE SÁ,ELEITO,PTB,PARTIDO TRABALHISTA BRASILEIRO,18
PIRANGI,DEPUTADO FEDERAL,CLAUDIA SARTORI,CLAUDIA SARTORI DONATTI DE SOUZA,SUPLENTE,PTB,PARTIDO TRABALHISTA BRASILEIRO,1
PIRANGI,DEPUTADO FEDERAL,PADRE FERNANDO,LAUDINEY FERNANDO SILVA FRAGA,SUPLENTE,PTB,PARTIDO TRABALHISTA BRASILEIRO,1
PIRANGI,DEPUTADO FEDERAL,PAULO LIMA,PAULO CESAR DE OLIVEIRA LIMA,SUPLENTE,PMDB,PARTIDO DO MOVIMENTO DEMOCRÁTICO BRASILEIRO,4
PIRANGI,DEPUTADO FEDERAL,DR. ALMÉRIO,ALMÉRIO AGUIAR MELO FILHO,SUPLENTE,PMDB,PARTIDO DO MOVIMENTO DEMOCRÁTICO BRASILEIRO,1
PIRANGI,DEPUTADO FEDERAL,MARCOS TENÓRIO,MARCOS ANTÔNIO FERREIRA TENÓRIO,SUPLENTE,PMDB,PARTIDO DO MOVIMENTO DEMOCRÁTICO BRASILEIRO,1
PIRANGI,DEPUTADO FEDERAL,EDUARDO COELHO,EDUARDO JOSÉ PEREIRA COELHO,SUPLENTE,PMDB,PARTIDO DO MOVIMENTO DEMOCRÁTICO BRASILEIRO,13
PIRANGI,DEPUTADO FEDERAL,PILTON RIOS,PILTON RIOS DE BARROS FELIX PEREIRA,SUPLENTE,PMDB,PARTIDO DO MOVIMENTO DEMOCRÁTICO BRASILEIRO,1
PIRANGI,DEPUTADO FEDERAL,DIEGO MARTINS,DIEGO OLIVEIRA MARTINS,SUPLENTE,PMDB,PARTIDO DO MOVIMENTO DEMOCRÁTICO BRASILEIRO,1
PIRANGI,DEPUTADO FEDERAL,SINIVAL,SINIVAL JOSE INACIO,SUPLENTE,PMDB,PARTIDO DO MOVIMENTO DEMOCRÁTICO BRASILEIRO,1
PIRANGI,DEPUTADO FEDERAL,EDINHO ARAUJO,EDSON EDINHO COELHO ARAUJO,ELEITO,PMDB,PARTIDO DO MOVIMENTO DEMOCRÁTICO BRASILEIRO,94
PIRANGI,DEPUTADO FEDERAL,ROLEMBERG,ROLANDO BELTRAMINE ROLEMBERG,SUPLENTE,PMDB,PARTIDO DO MOVIMENTO DEMOCRÁTICO BRASILEIRO,1
PIRANGI,DEPUTADO FEDERAL,REGA,ALBERTO REGA,SUPLENTE,PMDB,PARTIDO DO MOVIMENTO DEMOCRÁTICO BRASILEIRO,1
PIRANGI,DEPUTADO FEDERAL,LÉO OLIVEIRA,OCIMAR DONIZETI LEO OLIVEIRA,SUPLENTE,PMDB,PARTIDO DO MOVIMENTO DEMOCRÁTICO BRASILEIRO,236
PIRANGI,DEPUTADO FEDERAL,CLERISTON VALLE,CLERISTON PEREIRA DO VALLE,SUPLENTE,PMDB,PARTIDO DO MOVIMENTO DEMOCRÁTICO BRASILEIRO,2
PIRANGI,DEPUTADO FEDERAL,PAULINHO DO GUINCHO,AUDALIO PAULO DA SILVA,SUPLENTE,PMDB,PARTIDO DO MOVIMENTO DEMOCRÁTICO BRASILEIRO,1
PIRANGI,DEPUTADO FEDERAL,DR. SAMIR NASSBINE,SAMIR ASSAD NASSBINE,SUPLENTE,PMDB,PARTIDO DO MOVIMENTO DEMOCRÁTICO BRASILEIRO,41
PIRANGI,DEPUTADO FEDERAL,DANIEL CALDEIRA,DANIEL CALDEIRA MATEUS,SUPLENTE,PSL,PRESTE ATENÇÃO SÃO PAULO,19
PIRANGI,DEPUTADO FEDERAL,CORONEL GILSON LOPES,GILSON LOPES DA SILVA,SUPLENTE,PSC,HUMANISTA CRISTÃO ,1
PIRANGI,DEPUTADO FEDERAL,CLEBER DELALIBERA,CLEBER DE MOURA DELALIBERA,SUPLENTE,PSC,HUMANISTA CRISTÃO ,1
PIRANGI,DEPUTADO FEDERAL,MARCO FELICIANO,MARCO ANTONIO FELICIANO,ELEITO,PSC,HUMANISTA CRISTÃO ,29
PIRANGI,DEPUTADO FEDERAL,REGIS DE OLIVEIRA,REGIS FERNANDES DE OLIVEIRA,SUPLENTE,PSC,HUMANISTA CRISTÃO ,2
PIRANGI,DEPUTADO FEDERAL,SILVIA PALMA,SILVIA ELIANA PALMA,SUPLENTE,PSC,HUMANISTA CRISTÃO ,1
PIRANGI,DEPUTADO FEDERAL,CICERO FERNANDES,JOSE CICERO FERNANDES DA SILVA,SUPLENTE,PSC,HUMANISTA CRISTÃO ,1
PIRANGI,DEPUTADO FEDERAL,BUCK,BENEDITO BUCK,SUPLENTE,PSC,HUMANISTA CRISTÃO ,10
PIRANGI,DEPUTADO FEDERAL,PRICILA LEME,PRICILA HELENA MOYSES LEME,SUPLENTE,PSC,HUMANISTA CRISTÃO ,1
PIRANGI,DEPUTADO FEDERAL,MANOEL GASPAR,MANOEL FERREIRA DE SOUZA GASPAR,SUPLENTE,PSC,HUMANISTA CRISTÃO ,5
PIRANGI,DEPUTADO FEDERAL,TIRIRICA,FRANCISCO EVERARDO OLIVEIRA SILVA,ELEITO,PR,JUNTOS POR SÃO PAULO,143
PIRANGI,DEPUTADO FEDERAL,PR PAULO FREIRE,PAULO ROBERTO FREIRE DA COSTA,ELEITO,PR,JUNTOS POR SÃO PAULO,42
PIRANGI,DEPUTADO FEDERAL,LUCIANA COSTA,LUCIANA DE ALMEIDA COSTA,SUPLENTE,PR,JUNTOS POR SÃO PAULO,10
PIRANGI,DEPUTADO FEDERAL,VALDEMAR COSTA NETO,VALDEMAR COSTA NETO,ELEITO,PR,JUNTOS POR SÃO PAULO,3
PIRANGI,DEPUTADO FEDERAL,SONRISAL,MAURICIO BONATTI,SUPLENTE,PPS,PSDB/DEM/PPS,1
PIRANGI,DEPUTADO FEDERAL,ROBERTO FREIRE,ROBERTO JOAO PEREIRA FREIRE,ELEITO,PPS,PSDB/DEM/PPS,5
PIRANGI,DEPUTADO FEDERAL,DIMAS RAMALHO,DIMAS EDUARDO RAMALHO,ELEITO,PPS,PSDB/DEM/PPS,69
PIRANGI,DEPUTADO FEDERAL,MARCOS DA FOTO,SIUSAKU HIRASHIMA,SUPLENTE,PPS,PSDB/DEM/PPS,2
PIRANGI,DEPUTADO FEDERAL,ARI FRIEDENBACH,ARI FRIEDENBACH,SUPLENTE,PPS,PSDB/DEM/PPS,1
PIRANGI,DEPUTADO FEDERAL,JOSE ONERIO,JOSE ONERIO DA SILVA,SUPLENTE,PPS,PSDB/DEM/PPS,2
PIRANGI,DEPUTADO FEDERAL,ARNALDO JARDIM,ARNALDO CALIL PEREIRA JARDIM,ELEITO,PPS,PSDB/DEM/PPS,4
PIRANGI,DEPUTADO FEDERAL,JORGE TADEU,JORGE TADEU MUDALEN,ELEITO,DEM,PSDB/DEM/PPS,6
PIRANGI,DEPUTADO FEDERAL,ALEXANDRE LEITE,ALEXANDRE LEITE DA SILVA,MÉDIA,DEM,PSDB/DEM/PPS,7
PIRANGI,DEPUTADO FEDERAL,KIKO DO KLB,FRANCO FINATO SCORNAVACCA,SUPLENTE,DEM,PSDB/DEM/PPS,2
PIRANGI,DEPUTADO FEDERAL,CRESPO,JOSE ANTONIO CALDINI CRESPO,SUPLENTE,DEM,PSDB/DEM/PPS,2
PIRANGI,DEPUTADO FEDERAL,RODRIGO GARCIA,RODRIGO GARCIA,ELEITO,DEM,PSDB/DEM/PPS,53
PIRANGI,DEPUTADO FEDERAL,MARCELO PALINKAS,MARCELO PALINKAS,SUPLENTE,DEM,PSDB/DEM/PPS,25
PIRANGI,DEPUTADO FEDERAL,LUCIANO ARTIOLI,LUCIANO ARTIOLI MOREIRA,SUPLENTE,DEM,PSDB/DEM/PPS,6
PIRANGI,DEPUTADO FEDERAL,JUNJI ABE,JUNJI ABE,ELEITO,DEM,PSDB/DEM/PPS,1
PIRANGI,DEPUTADO FEDERAL,DR ELEUSES PAIVA,ELEUSES VIEIRA DE PAIVA,SUPLENTE,DEM,PSDB/DEM/PPS,113
PIRANGI,DEPUTADO FEDERAL,GUILHERME CAMPOS,GUILHERME CAMPOS JUNIOR,MÉDIA,DEM,PSDB/DEM/PPS,101
PIRANGI,DEPUTADO FEDERAL,WALTER IHOSHI,WALTER SHINDI IIHOSHI,SUPLENTE,DEM,PSDB/DEM/PPS,1
PIRANGI,DEPUTADO FEDERAL,IRMÃO DARCY,DARCY FIGUEIRA DOS SANTOS JUNIOR,SUPLENTE,PHS,HUMANISTA CRISTÃO ,1
PIRANGI,DEPUTADO FEDERAL,FÁBIO GALAN,FABIO GALAN JACOBS,SUPLENTE,PHS,HUMANISTA CRISTÃO ,1
PIRANGI,DEPUTADO FEDERAL,MARCELINHO CARIOCA,MARCELO PEREIRA SURCIN,SUPLENTE,PSB,PRESTE ATENÇÃO SÃO PAULO,5
PIRANGI,DEPUTADO FEDERAL,CAPITÃO AUGUSTO,JOSÉ AUGUSTO ROSA,SUPLENTE,PSB,PRESTE ATENÇÃO SÃO PAULO,13
PIRANGI,DEPUTADO FEDERAL,TORINO,PAULO SERGIO TORINO,SUPLENTE,PSB,PRESTE ATENÇÃO SÃO PAULO,3
PIRANGI,DEPUTADO FEDERAL,GABRIEL CHALITA,GABRIEL BENEDITO ISSAAC CHALITA,ELEITO,PSB,PRESTE ATENÇÃO SÃO PAULO,185
PIRANGI,DEPUTADO FEDERAL,CORAUCI,VALDEMAR CORAUCI SOBRINHO,SUPLENTE,PSB,PRESTE ATENÇÃO SÃO PAULO,1
PIRANGI,DEPUTADO FEDERAL,ABELARDO CAMARINHA,JOSE ABELARDO GUIMARAES CAMARINHA,MÉDIA,PSB,PRESTE ATENÇÃO SÃO PAULO,1
PIRANGI,DEPUTADO FEDERAL,JEFFERSON CAMPOS,JEFFERSON ALVES DE CAMPOS,ELEITO,PSB,PRESTE ATENÇÃO SÃO PAULO,37
PIRANGI,DEPUTADO FEDERAL,GETÚLIO DUARTE,GETÚLIO DUARTE FERREIRA,SUPLENTE,PSB,PRESTE ATENÇÃO SÃO PAULO,1
PIRANGI,DEPUTADO FEDERAL,DR. UBIALI,MARCO AURÉLIO UBIALI,SUPLENTE,PSB,PRESTE ATENÇÃO SÃO PAULO,2
PIRANGI,DEPUTADO FEDERAL,GILBERTO ABREU,GILBERTO ANDRADE DE ABREU,SUPLENTE,PV,PARTIDO VERDE,7
PIRANGI,DEPUTADO FEDERAL,DR TALMIR,TALMIR RODRIGUES,SUPLENTE,PV,PARTIDO VERDE,2
PIRANGI,DEPUTADO FEDERAL,VICENTE DA UPA,VICENTE CARVALHO E SILVA,SUPLENTE,PV,PARTIDO VERDE,26
PIRANGI,DEPUTADO FEDERAL,DR. SINVAL MALHEIROS,SINVAL MALHEIROS PINTO JÚNIOR,SUPLENTE,PV,PARTIDO VERDE,477
PIRANGI,DEPUTADO FEDERAL,JULIO CASTILHO,JULIO CESAR CASTILHO,SUPLENTE,PV,PARTIDO VERDE,1
PIRANGI,DEPUTADO FEDERAL,EVANDRO GUSSI,EVANDRO HERRERA BERTONE GUSSI,SUPLENTE,PV,PARTIDO VERDE,6
PIRANGI,DEPUTADO FEDERAL,PENNA,JOSÉ LUIZ DE FRANÇA PENNA,ELEITO,PV,PARTIDO VERDE,1
PIRANGI,DEPUTADO FEDERAL,NATAN SOIHET,NATAN SOIHET,SUPLENTE,PV,PARTIDO VERDE,1
PIRANGI,DEPUTADO FEDERAL,J FARIA,JOSE JESUS APARECIDO DE FARIA,SUPLENTE,PV,PARTIDO VERDE,4
PIRANGI,DEPUTADO FEDERAL,RICARDO IZAR,RICARDO IZAR JUNIOR,ELEITO,PV,PARTIDO VERDE,26
PIRANGI,DEPUTADO FEDERAL,CARLOS SAMPAIO,CARLOS HENRIQUE FOCESI SAMPAIO,ELEITO,PSDB,PSDB/DEM/PPS,3
PIRANGI,DEPUTADO FEDERAL,POPPI,JOÃO HENRIQUE GONÇALVES MARCICANO POPPI,SUPLENTE,PSDB,PSDB/DEM/PPS,2
PIRANGI,DEPUTADO FEDERAL,STANGARLINI,JOSE CARLOS STANGARLINI,SUPLENTE,PSDB,PSDB/DEM/PPS,3
PIRANGI,DEPUTADO FEDERAL,RAUL CHRISTIANO,RAUL CHRISTIANO DE OLIVEIRA SANCHEZ,SUPLENTE,PSDB,PSDB/DEM/PPS,22
PIRANGI,DEPUTADO FEDERAL,LOBBE NETO,ANTONIO ADOLPHO LOBBE NETO,SUPLENTE,PSDB,PSDB/DEM/PPS,835
PIRANGI,DEPUTADO FEDERAL,MANOEL MARCOS (MANÉ),MANOEL MARCOS DE JESUS FERREIRA,SUPLENTE,PSDB,PSDB/DEM/PPS,1
PIRANGI,DEPUTADO FEDERAL,EMANUEL FERNANDES,EMANUEL FERNANDES,ELEITO,PSDB,PSDB/DEM/PPS,1
PIRANGI,DEPUTADO FEDERAL,MARA GABRILLI,MARA CRISTINA GABRILLI,ELEITO,PSDB,PSDB/DEM/PPS,1
PIRANGI,DEPUTADO FEDERAL,CARLOS BRAGA,CARLOS EDUARDO FARACO BRAGA,SUPLENTE,PSDB,PSDB/DEM/PPS,3
PIRANGI,DEPUTADO FEDERAL,LELIS DA ROCHA,LELIS DA ROCHA,SUPLENTE,PSDB,PSDB/DEM/PPS,1
PIRANGI,DEPUTADO FEDERAL,CARLOS ROBERTO,CARLOS ROBERTO DE CAMPOS,SUPLENTE,PSDB,PSDB/DEM/PPS,2
PIRANGI,DEPUTADO FEDERAL,LUCIA SANTUCCI,LUCIA MARIA SANTUCCI,SUPLENTE,PSDB,PSDB/DEM/PPS,1
PIRANGI,DEPUTADO FEDERAL,RENATO AMARY,RENATO FAUVEL AMARY,SUPLENTE,PSDB,PSDB/DEM/PPS,1
PIRANGI,DEPUTADO FEDERAL,TIRSO MEIRELLES,TIRSO DE SALLES MEIRELLES,SUPLENTE,PSDB,PSDB/DEM/PPS,1
PIRANGI,DEPUTADO FEDERAL,EDSON APARECIDO,EDSON APARECIDO DOS SANTOS,ELEITO,PSDB,PSDB/DEM/PPS,348
PIRANGI,DEPUTADO FEDERAL,RICARDO MONTORO,JOSE RICARDO FRANCO MONTORO,SUPLENTE,PSDB,PSDB/DEM/PPS,1
PIRANGI,DEPUTADO FEDERAL,LUIZ FERNANDO MACHADO,LUIZ FERNANDO ARANTES MACHADO,ELEITO,PSDB,PSDB/DEM/PPS,1
PIRANGI,DEPUTADO FEDERAL,VANDERLEI MACRIS,VANDERLEI MACRIS,SUPLENTE,PSDB,PSDB/DEM/PPS,1
PIRANGI,DEPUTADO FEDERAL,DUARTE NOGUEIRA,ANTONIO DUARTE NOGUEIRA JUNIOR,ELEITO,PSDB,PSDB/DEM/PPS,160
PIRANGI,DEPUTADO FEDERAL,JULIO SEMEGHINI,JULIO FRACISCO SEMEGHINI NETO,ELEITO,PSDB,PSDB/DEM/PPS,75
PIRANGI,DEPUTADO FEDERAL,TRIPOLI,JOSÉ RICARDO ALVARENGA TRIPOLI,ELEITO,PSDB,PSDB/DEM/PPS,1
PIRANGI,DEPUTADO FEDERAL,FERNANDO FUAD CHUCRE,FERNANDO BARRANCOS CHUCRE,SUPLENTE,PSDB,PSDB/DEM/PPS,1
PIRANGI,DEPUTADO FEDERAL,VAZ DE LIMA,JOSÉ CARLOS VAZ DE LIMA,ELEITO,PSDB,PSDB/DEM/PPS,7
PIRANGI,DEPUTADO FEDERAL,ALEMÃO DA SÁUDE,CLAUDEMIR SERENO,SUPLENTE,PSDB,PSDB/DEM/PPS,2
PIRANGI,DEPUTADO FEDERAL,WALTER FELDMAN,WALTER MEYER FELDMAN,SUPLENTE,PSDB,PSDB/DEM/PPS,1
PIRANGI,DEPUTADO FEDERAL,THAME,ANTONIO CARLOS DE MENDES THAME,ELEITO,PSDB,PSDB/DEM/PPS,28
PIRANGI,DEPUTADO FEDERAL,BRUNA FURLAN,BRUNA DIAS FURLAN,ELEITO,PSDB,PSDB/DEM/PPS,2
PIRANGI,DEPUTADO FEDERAL,JOSÉ ANIBAL,JOSÉ ANIBAL PERES DE PONTES,ELEITO,PSDB,PSDB/DEM/PPS,8
PIRANGI,DEPUTADO FEDERAL,AKIKO AKI,AKIKO AKIYAMA,SUPLENTE,PSOL,PARTIDO SOCIALISMO E LIBERDADE,3
PIRANGI,DEPUTADO FEDERAL,IVAN VALENTE,IVAN VALENTE,ELEITO,PSOL,PARTIDO SOCIALISMO E LIBERDADE,16
PIRANGI,DEPUTADO FEDERAL,MARIANA CONTI,MARIANA CONTI TAKAHASHI,SUPLENTE,PSOL,PARTIDO SOCIALISMO E LIBERDADE,2
PIRANGI,DEPUTADO FEDERAL,ALDO REBELO,JOSÉ ALDO REBELO FIGUEIREDO,ELEITO,PC DO B,JUNTOS POR SÃO PAULO,31
PIRANGI,DEPUTADO FEDERAL,DELEGADO PROTÓGENES,PROTÓGENES PINHEIRO DE QUEIROZ,MÉDIA,PC DO B,JUNTOS POR SÃO PAULO,10
PIRANGI,DEPUTADO FEDERAL,DR MARCAO DA MANCHA,MARCO ANTONIO NOTARI,SUPLENTE,PT DO B,JUNTOS POR SÃO PAULO,1
PIRANGI,DEPUTADO ESTADUAL,SEBASTIÃO SANTOS,SEBASTIÃO DOS SANTOS FILHO,ELEITO,PRB,SOMOS MAIS SÃO PAULO,27
PIRANGI,DEPUTADO ESTADUAL,ADALBERLITA MORAES,MARIA ADALBERLITA DE LIMA MORAES,SUPLENTE,PP,PARTIDO PROGRESSISTA,1
PIRANGI,DEPUTADO ESTADUAL,QUATI,ANTONIO DOS SANTOS BARBOSA,SUPLENTE,PP,PARTIDO PROGRESSISTA,1
PIRANGI,DEPUTADO ESTADUAL,CURIATI,ANTONIO SALIM CURIATI,ELEITO,PP,PARTIDO PROGRESSISTA,5
PIRANGI,DEPUTADO ESTADUAL,DR. IRINEU,IRINEU CARDOSO DOS SANTOS,SUPLENTE,PP,PARTIDO PROGRESSISTA,1
PIRANGI,DEPUTADO ESTADUAL,LAZARO TAVARES CUNHA,LAZARO TAVARES DA CUNHA,SUPLENTE,PP,PARTIDO PROGRESSISTA,4
PIRANGI,DEPUTADO ESTADUAL,RAFA ZIMBALDI,RAFAEL FERNANDO ZIMBALDI,SUPLENTE,PP,PARTIDO PROGRESSISTA,9
PIRANGI,DEPUTADO ESTADUAL,PAULERA,PAULO ROBERTO AMBROSIO,SUPLENTE,PP,PARTIDO PROGRESSISTA,5
PIRANGI,DEPUTADO ESTADUAL,AURELIO,AURELIO JOSE CLAUDIO,SUPLENTE,PDT,PARTIDO DEMOCRÁTICO TRABALHISTA,98
PIRANGI,DEPUTADO ESTADUAL,DINEI,CLAUDINEI ALEXANDRE PIRES,SUPLENTE,PDT,PARTIDO DEMOCRÁTICO TRABALHISTA,3
PIRANGI,DEPUTADO ESTADUAL,MAJOR OLIMPIO,SERGIO OLIMPIO GOMES,ELEITO,PDT,PARTIDO DEMOCRÁTICO TRABALHISTA,13
PIRANGI,DEPUTADO ESTADUAL,CARLAO MOTORISTA,ANTONIO CARLOS RIBEIRO,SUPLENTE,PDT,PARTIDO DEMOCRÁTICO TRABALHISTA,1
PIRANGI,DEPUTADO ESTADUAL,JOCA VASCONCELOS,JOAO CARLOS MONTE CLARO VASCONCELOS,SUPLENTE,PDT,PARTIDO DEMOCRÁTICO TRABALHISTA,2
PIRANGI,DEPUTADO ESTADUAL,RAFAEL SILVA,RAFAEL ANTONIO DA SILVA,ELEITO,PDT,PARTIDO DEMOCRÁTICO TRABALHISTA,25
PIRANGI,DEPUTADO ESTADUAL,PROFESSOR VENANCIO,ANTONIO CARLOS VENANCIO,SUPLENTE,PDT,PARTIDO DEMOCRÁTICO TRABALHISTA,1
PIRANGI,DEPUTADO ESTADUAL,HELIO BASTOS,HELIO DE ALMEIDA BASTOS,SUPLENTE,PDT,PARTIDO DEMOCRÁTICO TRABALHISTA,19
PIRANGI,DEPUTADO ESTADUAL,CONSTANCIA FELIX,CONSTANCIA BERBERT DUTRA DA SILVA,SUPLENTE,PDT,PARTIDO DEMOCRÁTICO TRABALHISTA,12
PIRANGI,DEPUTADO ESTADUAL,MARCO BRASIL,MARCO AURÉLIO RIBEIRO,SUPLENTE,PDT,PARTIDO DEMOCRÁTICO TRABALHISTA,2
PIRANGI,DEPUTADO ESTADUAL,ANDERSON SILVA,ANDERSON DOMINGOS DA SILVA,SUPLENTE,PT,SOMOS MAIS SÃO PAULO,2
PIRANGI,DEPUTADO ESTADUAL,GALENO AMORIM,GALENO DE AMORIM JUNIOR,SUPLENTE,PT,SOMOS MAIS SÃO PAULO,1
PIRANGI,DEPUTADO ESTADUAL,EDINHO SILVA,EDSON ANTONIO EDINHO DA SILVA,ELEITO,PT,SOMOS MAIS SÃO PAULO,61
PIRANGI,DEPUTADO ESTADUAL,SUB TEN. NEZINHO (RECO),NEZINHO GONÇALVES NUNES,SUPLENTE,PT,SOMOS MAIS SÃO PAULO,1
PIRANGI,DEPUTADO ESTADUAL,DUDU BOLITO,AMARILDO DUDU BOLITO,SUPLENTE,PT,SOMOS MAIS SÃO PAULO,24
PIRANGI,DEPUTADO ESTADUAL,ANTONIO MENTOR,ANTONIO MENTOR DE MELLO SOBRINHO,ELEITO,PT,SOMOS MAIS SÃO PAULO,242
PIRANGI,DEPUTADO ESTADUAL,PADRE JUZEMILDO,JUZEMILDO ALBINO DA SILVA,SUPLENTE,PT,SOMOS MAIS SÃO PAULO,1
PIRANGI,DEPUTADO ESTADUAL,LUIZ CLAUDIO MARCOLINO,LUIZ CLAUDIO MARCOLINO,ELEITO,PT,SOMOS MAIS SÃO PAULO,3
PIRANGI,DEPUTADO ESTADUAL,NATIVIDADE,MARIA DA NATIVIDADE PEREIRA LIMA,SUPLENTE,PT,SOMOS MAIS SÃO PAULO,1
PIRANGI,DEPUTADO ESTADUAL,ROBERTO FELICIO,ROBERTO FELICIO,SUPLENTE,PT,SOMOS MAIS SÃO PAULO,23
PIRANGI,DEPUTADO ESTADUAL,BETH SAHAO,ELISABETH SAHÃO,SUPLENTE,PT,SOMOS MAIS SÃO PAULO,392
PIRANGI,DEPUTADO ESTADUAL,JOÃO PAULO RILLO,JOÃO PAULO RILLO,ELEITO,PT,SOMOS MAIS SÃO PAULO,52
PIRANGI,DEPUTADO ESTADUAL,LINEU NAVARRO,LUIZ ANTONIO NAVARRO MAGALHÃES LUZ,SUPLENTE,PT,SOMOS MAIS SÃO PAULO,1
PIRANGI,DEPUTADO ESTADUAL,FAUSTO FIGUEIRA,FAUSTO FIGUEIRA DE MELLO JUNIOR,SUPLENTE,PT,SOMOS MAIS SÃO PAULO,1
PIRANGI,DEPUTADO ESTADUAL,GILSON PELIZARO,GILSON DONIZETE PELIZARO,SUPLENTE,PT,SOMOS MAIS SÃO PAULO,1
PIRANGI,DEPUTADO ESTADUAL,LÉO ÁQUILLA,JADSON MENDES DE LIMA,SUPLENTE,PTB,PARTIDO TRABALHISTA BRASILEIRO,4
PIRANGI,DEPUTADO ESTADUAL,KLEBER LEITE,CLEVERSON SPERBER,SUPLENTE,PTB,PARTIDO TRABALHISTA BRASILEIRO,1
PIRANGI,DEPUTADO ESTADUAL,CONTE LOPES,ROBERVAL CONTE LOPES LIMA,SUPLENTE,PTB,PARTIDO TRABALHISTA BRASILEIRO,5
PIRANGI,DEPUTADO ESTADUAL,CAMPOS MACHADO,ANTONIO CARLOS DE CAMPOS MACHADO,ELEITO,PTB,PARTIDO TRABALHISTA BRASILEIRO,51
PIRANGI,DEPUTADO ESTADUAL,BALEIA ROSSI,LUIZ FELIPE BALEIA TENUTO ROSSI,ELEITO,PMDB,PARTIDO DO MOVIMENTO DEMOCRÁTICO BRASILEIRO,113
PIRANGI,DEPUTADO ESTADUAL,IBRAIM,IBRAIM ANTONIO ABOU JOKH,SUPLENTE,PMDB,PARTIDO DO MOVIMENTO DEMOCRÁTICO BRASILEIRO,1
PIRANGI,DEPUTADO ESTADUAL,CARUSO,JORGE LUIS CARUSO,ELEITO,PMDB,PARTIDO DO MOVIMENTO DEMOCRÁTICO BRASILEIRO,6
PIRANGI,DEPUTADO ESTADUAL,VANESSA DAMO,VANESSA DAMO OROSCO,ELEITO,PMDB,PARTIDO DO MOVIMENTO DEMOCRÁTICO BRASILEIRO,1
PIRANGI,DEPUTADO ESTADUAL,CAMARGO,DOMINGOS FERREIRA DE CAMARGO,SUPLENTE,PMDB,PARTIDO DO MOVIMENTO DEMOCRÁTICO BRASILEIRO,6
PIRANGI,DEPUTADO ESTADUAL,VALDOMIRO,VALDOMIRO FRANCISCO DE OLIVEIRA,SUPLENTE,PMDB,PARTIDO DO MOVIMENTO DEMOCRÁTICO BRASILEIRO,9
PIRANGI,DEPUTADO ESTADUAL,UEBE REZECK,UEBE REZECK,SUPLENTE,PMDB,PARTIDO DO MOVIMENTO DEMOCRÁTICO BRASILEIRO,1250
PIRANGI,DEPUTADO ESTADUAL,DANILO GARCIA,CICERO DANILO GARCIA SANTANA,SUPLENTE,PMDB,PARTIDO DO MOVIMENTO DEMOCRÁTICO BRASILEIRO,2
PIRANGI,DEPUTADO ESTADUAL,ITAMAR BORGES,ITAMAR FRANCISCO MACHADO BORGES,MÉDIA,PMDB,PARTIDO DO MOVIMENTO DEMOCRÁTICO BRASILEIRO,12
PIRANGI,DEPUTADO ESTADUAL,SOUZA VIGILANTE,JOSÉ CLAUDIVAM DOS SANTOS SOUZA,SUPLENTE,PMDB,PARTIDO DO MOVIMENTO DEMOCRÁTICO BRASILEIRO,1
PIRANGI,DEPUTADO ESTADUAL,OLIVEIRA JUNIOR,ELIO APARECIDO DE OLIVEIRA,SUPLENTE,PSC,HUMANISTA CRISTÃO ,1
PIRANGI,DEPUTADO ESTADUAL,CELSO NASCIMENTO,CELSO BRAZ DO NASCIMENTO,SUPLENTE,PSC,HUMANISTA CRISTÃO ,41
PIRANGI,DEPUTADO ESTADUAL,DR. CLAUDIO MIRANDA,CLAUDIO ERNANI MARCONDES DE MIRANDA,SUPLENTE,PSC,HUMANISTA CRISTÃO ,2
PIRANGI,DEPUTADO ESTADUAL,LEANDRO AMARAL,LEANDRO GODINES DO AMARAL,SUPLENTE,PSC,HUMANISTA CRISTÃO ,1
PIRANGI,DEPUTADO ESTADUAL,PASTOR VIEIRA ROCHA,JOSE VIEIRA ROCHA,SUPLENTE,PSC,HUMANISTA CRISTÃO ,58
PIRANGI,DEPUTADO ESTADUAL,PR. CARLOS CEZAR,CARLOS CEZAR DA SILVA,ELEITO,PSC,HUMANISTA CRISTÃO ,6
PIRANGI,DEPUTADO ESTADUAL,JAIMINHO,JAIME DONIZETE PEREIRA,SUPLENTE,PSC,HUMANISTA CRISTÃO ,3
PIRANGI,DEPUTADO ESTADUAL,ADILSON ROSSI,ADILSON ROSSI,ELEITO,PSC,HUMANISTA CRISTÃO ,3
PIRANGI,DEPUTADO ESTADUAL,RENATO PUPO,RENATO PUPO DE PAULA,SUPLENTE,PSC,HUMANISTA CRISTÃO ,7
PIRANGI,DEPUTADO ESTADUAL,JOÃO BINATO,JOÃO ANTONIO BINATO,SUPLENTE,PSC,HUMANISTA CRISTÃO ,2
PIRANGI,DEPUTADO ESTADUAL,GUSTAVO POZZI,GUSTAVO CAETANO POZZI DA CUNHA,SUPLENTE,PSC,HUMANISTA CRISTÃO ,10
PIRANGI,DEPUTADO ESTADUAL,RODRIGO MORAES,RODRIGO AUGUSTO MORAES,ELEITO,PSC,HUMANISTA CRISTÃO ,17
PIRANGI,DEPUTADO ESTADUAL,BRAZ PASSARINHEIRO,BRAZ ANASTACIO DA SILVA,SUPLENTE,PSC,HUMANISTA CRISTÃO ,1
PIRANGI,DEPUTADO ESTADUAL,WALTER GOMES,WALTER GOMES DE OLIVEIRA,SUPLENTE,PR,SOMOS MAIS SÃO PAULO,1
PIRANGI,DEPUTADO ESTADUAL,JOSUE ROBERTO,JOSUE ROBERTO DA SILVA,SUPLENTE,PR,SOMOS MAIS SÃO PAULO,1
PIRANGI,DEPUTADO ESTADUAL,PATRICIA LIMA,PATRICIA FREITAS LIMA,SUPLENTE,PR,SOMOS MAIS SÃO PAULO,1
PIRANGI,DEPUTADO ESTADUAL,JOSE CARLOS SOARES,JOSE CARLOS SOARES,SUPLENTE,PPS,PARTIDO POPULAR SOCIALISTA,6
PIRANGI,DEPUTADO ESTADUAL,BRAZ,BRAZ ANTUNES MATTOS NETO,SUPLENTE,PPS,PARTIDO POPULAR SOCIALISTA,10
PIRANGI,DEPUTADO ESTADUAL,ADEMIR DA GUIA,ADEMIR DA GUIA,SUPLENTE,PPS,PARTIDO POPULAR SOCIALISTA,14
PIRANGI,DEPUTADO ESTADUAL,DAVI ZAIA,DAVID ZAIA,MÉDIA,PPS,PARTIDO POPULAR SOCIALISTA,2
PIRANGI,DEPUTADO ESTADUAL,PALHACINHO PIMPAO,VAGNER LUIZ PIMPAO BERSA,SUPLENTE,PPS,PARTIDO POPULAR SOCIALISTA,1
PIRANGI,DEPUTADO ESTADUAL,ALEX MANENTE,ALEX SPINELLI MANENTE,ELEITO,PPS,PARTIDO POPULAR SOCIALISTA,1
PIRANGI,DEPUTADO ESTADUAL,GONDIM,LUIZ CARLOS GONDIM TEIXEIRA,ELEITO,PPS,PARTIDO POPULAR SOCIALISTA,85
PIRANGI,DEPUTADO ESTADUAL,ESTEVÃO,STEVEN ERIKSEN BINNIE,SUPLENTE,PPS,PARTIDO POPULAR SOCIALISTA,12
PIRANGI,DEPUTADO ESTADUAL,PROFESSOR ZE MARIA,JOSE MARIA CANCELLIERO,SUPLENTE,PPS,PARTIDO POPULAR SOCIALISTA,3
PIRANGI,DEPUTADO ESTADUAL,JOSE CLAUDIO,JOSE CLAUDIO DE SOUZA,SUPLENTE,PPS,PARTIDO POPULAR SOCIALISTA,5
PIRANGI,DEPUTADO ESTADUAL,MARCELO CYPRIANO,MARCELO DA SILVA CYPRIANO,SUPLENTE,PPS,PARTIDO POPULAR SOCIALISTA,1
