TIETÊ,DEPUTADO FEDERAL,HELIVANE BOTELHO DA SILVEIRA,HELIVANE MARIA BOTELHO DA SILVEIRA MORAES,SUPLENTE,PV,PARTIDO VERDE,2
TIETÊ,DEPUTADO FEDERAL,DEUSDEDIT JR,DEUSDEDIT DE PAULA MIQUELINO JUNIOR,SUPLENTE,PV,PARTIDO VERDE,1
TIETÊ,DEPUTADO FEDERAL,MARIA DOLORES,MARIA DOLORES RODRIGUES JORDAN ORFEI ABE,SUPLENTE,PV,PARTIDO VERDE,2
TIETÊ,DEPUTADO FEDERAL,JAIME ROCHA,JAIME BARTOLOMEU DA ROCHA,SUPLENTE,PV,PARTIDO VERDE,1
TIETÊ,DEPUTADO FEDERAL,JOVINO CÂNDIDO,JOVINO CÂNDIDO DA SILVA,SUPLENTE,PV,PARTIDO VERDE,1
TIETÊ,DEPUTADO FEDERAL,ANA PAULA JUNQUEIRA,ANA PAULA GUIMARAES DE AZEVEDO JUNQUEIRA,SUPLENTE,PV,PARTIDO VERDE,10
TIETÊ,DEPUTADO FEDERAL,EVANDRO GUSSI,EVANDRO HERRERA BERTONE GUSSI,SUPLENTE,PV,PARTIDO VERDE,145
TIETÊ,DEPUTADO FEDERAL,TOFFANO,JOSE PAULO TOFFANO,SUPLENTE,PV,PARTIDO VERDE,6
TIETÊ,DEPUTADO FEDERAL,FAUSTO LOPES,FAUSTO LOPES FILHO,SUPLENTE,PV,PARTIDO VERDE,1
TIETÊ,DEPUTADO FEDERAL,ALE YOUSSEF,ALEXANDRE DE ALMEIDA YOUSSEF,SUPLENTE,PV,PARTIDO VERDE,8
TIETÊ,DEPUTADO FEDERAL,MARCELO ORTIZ,FRANCISCO MARCELO ORTIZ FILHO,SUPLENTE,PV,PARTIDO VERDE,3
TIETÊ,DEPUTADO FEDERAL,PENNA,JOSÉ LUIZ DE FRANÇA PENNA,ELEITO,PV,PARTIDO VERDE,80
TIETÊ,DEPUTADO FEDERAL,ROBERTO DE LUCENA,ROBERTO ALVES DE LUCENA,ELEITO,PV,PARTIDO VERDE,53
TIETÊ,DEPUTADO FEDERAL,DR. ÂNGELO,ANGELO DOMINGOS NUCCI,SUPLENTE,PV,PARTIDO VERDE,2
TIETÊ,DEPUTADO FEDERAL,NATAN SOIHET,NATAN SOIHET,SUPLENTE,PV,PARTIDO VERDE,4
TIETÊ,DEPUTADO FEDERAL,ALTAIR DA ASSOCIACAO,ALTAIR BARBOSA GOUVEIA,SUPLENTE,PV,PARTIDO VERDE,1
TIETÊ,DEPUTADO FEDERAL,PAMPA,ANDRE FELIPPE FALBO FERREIRA,SUPLENTE,PV,PARTIDO VERDE,1
TIETÊ,DEPUTADO FEDERAL,WALTER FELIX,WALTER FÉLIX,SUPLENTE,PV,PARTIDO VERDE,2
TIETÊ,DEPUTADO FEDERAL,JOSÉ ALEXANDRE RIBEIRO,JOSE ALEXANDRE RIBEIRO,SUPLENTE,PV,PARTIDO VERDE,1
TIETÊ,DEPUTADO FEDERAL,DANILO PARO,DANILO JOSÉ PARO,SUPLENTE,PV,PARTIDO VERDE,8
TIETÊ,DEPUTADO FEDERAL,DONIZETI PEREIRA,APARECIDO DONIZETI PEREIRA,SUPLENTE,PV,PARTIDO VERDE,2
TIETÊ,DEPUTADO FEDERAL,DRA LAURISA,LAURISA MARIA CORTELLAZZI GARCIA,SUPLENTE,PV,PARTIDO VERDE,6
TIETÊ,DEPUTADO FEDERAL,CARLINHOS SILVA,ANTONIO CARLOS ALVES DA SILVA,SUPLENTE,PV,PARTIDO VERDE,17
TIETÊ,DEPUTADO FEDERAL,PATRICIA DO MADA,PATRICIA ALVES DE MATOS,SUPLENTE,PV,PARTIDO VERDE,1
TIETÊ,DEPUTADO FEDERAL,DR. GETÚLIO SERPA,GETÚLIO PEREIRA SERPA,SUPLENTE,PV,PARTIDO VERDE,2
TIETÊ,DEPUTADO FEDERAL,RICARDO IZAR,RICARDO IZAR JUNIOR,ELEITO,PV,PARTIDO VERDE,2017
TIETÊ,DEPUTADO FEDERAL,TERESA JAPONESA,TERESA KIYOKO ARAGAKI,SUPLENTE,PV,PARTIDO VERDE,1
TIETÊ,DEPUTADO FEDERAL,BERQUE,CARLOS CESAR BERQUE,SUPLENTE,PV,PARTIDO VERDE,7
TIETÊ,DEPUTADO FEDERAL,DR. RAUL,RAUL APARECIDO GONÇALVES PAULA,SUPLENTE,PV,PARTIDO VERDE,3
TIETÊ,DEPUTADO FEDERAL,REGINA LAURA,REGINA LAURA DE MORAIS SANTOS E MARINHO DE FARIA,SUPLENTE,PV,PARTIDO VERDE,3
TIETÊ,DEPUTADO FEDERAL,LAERTE MOLLETA,LAERTE AMERICO MOLLETA,SUPLENTE,PV,PARTIDO VERDE,4
TIETÊ,DEPUTADO FEDERAL,LUIZA ELUF,LUIZA NAGIB ELUF,SUPLENTE,PV,PARTIDO VERDE,7
TIETÊ,DEPUTADO FEDERAL,DENADAI,EUCLIDES DENADAI FILHO,SUPLENTE,PV,PARTIDO VERDE,1
TIETÊ,DEPUTADO FEDERAL,DEISE NASCIMENTO,DEISE MARA DO NASCIMENTO,SUPLENTE,PV,PARTIDO VERDE,2
TIETÊ,DEPUTADO FEDERAL,VILSON ALVES,VILSON OSCHIN ALVES,SUPLENTE,PV,PARTIDO VERDE,5
TIETÊ,DEPUTADO FEDERAL,AMAURY CAMARGO MONICO,AMAURY CAMARGO MONACO,SUPLENTE,PV,PARTIDO VERDE,1
TIETÊ,DEPUTADO FEDERAL,VERA MOTTA,VERA LÚCIA DA MOTTA,SUPLENTE,PV,PARTIDO VERDE,1
TIETÊ,DEPUTADO FEDERAL,CARLOS SAMPAIO,CARLOS HENRIQUE FOCESI SAMPAIO,ELEITO,PSDB,PSDB/DEM/PPS,64
TIETÊ,DEPUTADO FEDERAL,POPPI,JOÃO HENRIQUE GONÇALVES MARCICANO POPPI,SUPLENTE,PSDB,PSDB/DEM/PPS,1
TIETÊ,DEPUTADO FEDERAL,JOSE LUIZ,JOSE LUIZ SILVA BRUNO,SUPLENTE,PSDB,PSDB/DEM/PPS,1
TIETÊ,DEPUTADO FEDERAL,STANGARLINI,JOSE CARLOS STANGARLINI,SUPLENTE,PSDB,PSDB/DEM/PPS,34
TIETÊ,DEPUTADO FEDERAL,RAUL CHRISTIANO,RAUL CHRISTIANO DE OLIVEIRA SANCHEZ,SUPLENTE,PSDB,PSDB/DEM/PPS,1
TIETÊ,DEPUTADO FEDERAL,LOBBE NETO,ANTONIO ADOLPHO LOBBE NETO,SUPLENTE,PSDB,PSDB/DEM/PPS,21
TIETÊ,DEPUTADO FEDERAL,FELICIDADE,FELICIDADE LOPES PONTES,SUPLENTE,PSDB,PSDB/DEM/PPS,10
TIETÊ,DEPUTADO FEDERAL,MANOEL MARCOS (MANÉ),MANOEL MARCOS DE JESUS FERREIRA,SUPLENTE,PSDB,PSDB/DEM/PPS,2
TIETÊ,DEPUTADO FEDERAL,EMANUEL FERNANDES,EMANUEL FERNANDES,ELEITO,PSDB,PSDB/DEM/PPS,10
TIETÊ,DEPUTADO FEDERAL,MARA GABRILLI,MARA CRISTINA GABRILLI,ELEITO,PSDB,PSDB/DEM/PPS,76
TIETÊ,DEPUTADO FEDERAL,MARCOS ARAUJO,MARCOS ROSA DE ARAUJO,SUPLENTE,PSDB,PSDB/DEM/PPS,1
TIETÊ,DEPUTADO FEDERAL,CARLOS BRAGA,CARLOS EDUARDO FARACO BRAGA,SUPLENTE,PSDB,PSDB/DEM/PPS,6
TIETÊ,DEPUTADO FEDERAL,LELIS DA ROCHA,LELIS DA ROCHA,SUPLENTE,PSDB,PSDB/DEM/PPS,2
TIETÊ,DEPUTADO FEDERAL,CARLOS ROBERTO,CARLOS ROBERTO DE CAMPOS,SUPLENTE,PSDB,PSDB/DEM/PPS,4
TIETÊ,DEPUTADO FEDERAL,DIB,WILLIAM DIB,ELEITO,PSDB,PSDB/DEM/PPS,125
TIETÊ,DEPUTADO FEDERAL,PANNUNZIO,ANTONIO CARLOS PANNUNZIO,SUPLENTE,PSDB,PSDB/DEM/PPS,103
TIETÊ,DEPUTADO FEDERAL,ALBERTO MOURAO,ALBERTO PEREIRA MOURAO,SUPLENTE,PSDB,PSDB/DEM/PPS,15
TIETÊ,DEPUTADO FEDERAL,RENATO AMARY,RENATO FAUVEL AMARY,SUPLENTE,PSDB,PSDB/DEM/PPS,431
TIETÊ,DEPUTADO FEDERAL,DR ANDRE SACCO,ANDRE SACCO JUNIOR,SUPLENTE,PSDB,PSDB/DEM/PPS,3
TIETÊ,DEPUTADO FEDERAL,TIRSO MEIRELLES,TIRSO DE SALLES MEIRELLES,SUPLENTE,PSDB,PSDB/DEM/PPS,36
TIETÊ,DEPUTADO FEDERAL,TERESA SERRANO,MARIA TERESA SERRANO AFONSO,SUPLENTE,PSDB,PSDB/DEM/PPS,1
TIETÊ,DEPUTADO FEDERAL,EDSON APARECIDO,EDSON APARECIDO DOS SANTOS,ELEITO,PSDB,PSDB/DEM/PPS,114
TIETÊ,DEPUTADO FEDERAL,RICARDO MONTORO,JOSE RICARDO FRANCO MONTORO,SUPLENTE,PSDB,PSDB/DEM/PPS,19
TIETÊ,DEPUTADO FEDERAL,LUIZ FERNANDO MACHADO,LUIZ FERNANDO ARANTES MACHADO,ELEITO,PSDB,PSDB/DEM/PPS,1
TIETÊ,DEPUTADO FEDERAL,DR. MARCELO,MARCELO CHEHADE,SUPLENTE,PSDB,PSDB/DEM/PPS,1
TIETÊ,DEPUTADO FEDERAL,VANDERLEI MACRIS,VANDERLEI MACRIS,SUPLENTE,PSDB,PSDB/DEM/PPS,212
TIETÊ,DEPUTADO FEDERAL,DUARTE NOGUEIRA,ANTONIO DUARTE NOGUEIRA JUNIOR,ELEITO,PSDB,PSDB/DEM/PPS,19
TIETÊ,DEPUTADO FEDERAL,JULIO SEMEGHINI,JULIO FRACISCO SEMEGHINI NETO,ELEITO,PSDB,PSDB/DEM/PPS,14
TIETÊ,DEPUTADO FEDERAL,RAFAEL ABUD,RAFAEL ANGELO ABUD,SUPLENTE,PSDB,PSDB/DEM/PPS,1
TIETÊ,DEPUTADO FEDERAL,GIVALDO VIEIRA,GIVALDO RODRIGUES VIEIRA,SUPLENTE,PSDB,PSDB/DEM/PPS,9
TIETÊ,DEPUTADO FEDERAL,TRIPOLI,JOSÉ RICARDO ALVARENGA TRIPOLI,ELEITO,PSDB,PSDB/DEM/PPS,39
TIETÊ,DEPUTADO FEDERAL,FERNANDO FUAD CHUCRE,FERNANDO BARRANCOS CHUCRE,SUPLENTE,PSDB,PSDB/DEM/PPS,1
TIETÊ,DEPUTADO FEDERAL,VAZ DE LIMA,JOSÉ CARLOS VAZ DE LIMA,ELEITO,PSDB,PSDB/DEM/PPS,27
TIETÊ,DEPUTADO FEDERAL,ALEMÃO DA SÁUDE,CLAUDEMIR SERENO,SUPLENTE,PSDB,PSDB/DEM/PPS,1
TIETÊ,DEPUTADO FEDERAL,TIÃO,SEBASTIÃO FERRES ARSENE,SUPLENTE,PSDB,PSDB/DEM/PPS,1
TIETÊ,DEPUTADO FEDERAL,WALTER FELDMAN,WALTER MEYER FELDMAN,SUPLENTE,PSDB,PSDB/DEM/PPS,15
TIETÊ,DEPUTADO FEDERAL,THAME,ANTONIO CARLOS DE MENDES THAME,ELEITO,PSDB,PSDB/DEM/PPS,946
TIETÊ,DEPUTADO FEDERAL,ARNALDO MADEIRA,ARNALDO DE ABREU MADEIRA,SUPLENTE,PSDB,PSDB/DEM/PPS,34
TIETÊ,DEPUTADO FEDERAL,BRUNA FURLAN,BRUNA DIAS FURLAN,ELEITO,PSDB,PSDB/DEM/PPS,489
TIETÊ,DEPUTADO FEDERAL,JOSÉ ANIBAL,JOSÉ ANIBAL PERES DE PONTES,ELEITO,PSDB,PSDB/DEM/PPS,563
TIETÊ,DEPUTADO FEDERAL,NELSON BUGALHO,NELSON ROBERTO BUGALHO,SUPLENTE,PSDB,PSDB/DEM/PPS,6
TIETÊ,DEPUTADO FEDERAL,GILBERTO BORJA,GILBERTO BORJA PINTO,SUPLENTE,PSDB,PSDB/DEM/PPS,1
TIETÊ,DEPUTADO FEDERAL,PROFESSOR CLOVIS PINTO,CLOVIS DA SILVA PINTO,SUPLENTE,PSDB,PSDB/DEM/PPS,1
TIETÊ,DEPUTADO FEDERAL,JAMIL PRUDENCIANO,JAMIL PAULO PRUDENCIANO,SUPLENTE,PSOL,PARTIDO SOCIALISMO E LIBERDADE,1
TIETÊ,DEPUTADO FEDERAL,RAFAEL MOYA,RAFAEL DUARTE MOYA,SUPLENTE,PSOL,PARTIDO SOCIALISMO E LIBERDADE,2
TIETÊ,DEPUTADO FEDERAL,RODRIGO CHIZOLINI,RODRIGO PINTO CHIZOLINI,SUPLENTE,PSOL,PARTIDO SOCIALISMO E LIBERDADE,6
TIETÊ,DEPUTADO FEDERAL,AKIKO AKI,AKIKO AKIYAMA,SUPLENTE,PSOL,PARTIDO SOCIALISMO E LIBERDADE,1
TIETÊ,DEPUTADO FEDERAL,IVAN VALENTE,IVAN VALENTE,ELEITO,PSOL,PARTIDO SOCIALISMO E LIBERDADE,90
TIETÊ,DEPUTADO FEDERAL,PROFESSORA MÁRCIA TAVARES,MÁRCIA TAVARES DO NASCIMENTO,SUPLENTE,PSOL,PARTIDO SOCIALISMO E LIBERDADE,3
TIETÊ,DEPUTADO FEDERAL,MARZENI,MARZENI PEREIRA DA SILVA,SUPLENTE,PSOL,PARTIDO SOCIALISMO E LIBERDADE,1
TIETÊ,DEPUTADO FEDERAL,CARLOS ROCHA,ANTONIO CARLOS ROCHA,SUPLENTE,PSOL,PARTIDO SOCIALISMO E LIBERDADE,1
TIETÊ,DEPUTADO FEDERAL,DR. ABELHA,CARLOS FERNANDO LOPES ABELHA,SUPLENTE,PC DO B,JUNTOS POR SÃO PAULO,1
TIETÊ,DEPUTADO FEDERAL,GUSTAVO PETTA,GUSTAVO LEMOS PETTA,SUPLENTE,PC DO B,JUNTOS POR SÃO PAULO,9
TIETÊ,DEPUTADO FEDERAL,CÉLIO TURINO,CÉLIO ROBERTO TURINO DE MIRANDA,SUPLENTE,PC DO B,JUNTOS POR SÃO PAULO,2
TIETÊ,DEPUTADO FEDERAL,DR. PAULO POLO,PAULO ROBERTO POLO,SUPLENTE,PC DO B,JUNTOS POR SÃO PAULO,1
TIETÊ,DEPUTADO FEDERAL,ALDO REBELO,JOSÉ ALDO REBELO FIGUEIREDO,ELEITO,PC DO B,JUNTOS POR SÃO PAULO,72
TIETÊ,DEPUTADO FEDERAL,DELEGADO PROTÓGENES,PROTÓGENES PINHEIRO DE QUEIROZ,MÉDIA,PC DO B,JUNTOS POR SÃO PAULO,83
TIETÊ,DEPUTADO FEDERAL,JOAO ARAUJO,JOAO LUIS ARAUJO NETO,SUPLENTE,PT DO B,JUNTOS POR SÃO PAULO,47
TIETÊ,DEPUTADO FEDERAL,DR MARCAO DA MANCHA,MARCO ANTONIO NOTARI,SUPLENTE,PT DO B,JUNTOS POR SÃO PAULO,2
TIETÊ,DEPUTADO ESTADUAL,GERSON DEZEMBRO,GERSON DONIZETI DEZEMBRO,SUPLENTE,PRB,SOMOS MAIS SÃO PAULO,2
TIETÊ,DEPUTADO ESTADUAL,CORINTHIANO,RODRIGO GHIRALDELLI,SUPLENTE,PRB,SOMOS MAIS SÃO PAULO,2
TIETÊ,DEPUTADO ESTADUAL,GILMACI SANTOS,GILMACI DOS SANTOS BARBOSA,ELEITO,PRB,SOMOS MAIS SÃO PAULO,4
TIETÊ,DEPUTADO ESTADUAL,SEBASTIÃO SANTOS,SEBASTIÃO DOS SANTOS FILHO,ELEITO,PRB,SOMOS MAIS SÃO PAULO,145
TIETÊ,DEPUTADO ESTADUAL,HAVANIR,HAVANIR TAVARES DE ALMEIDA NIMTZ,SUPLENTE,PRB,SOMOS MAIS SÃO PAULO,8
TIETÊ,DEPUTADO ESTADUAL,MALEK,ROBSON MALEK,SUPLENTE,PP,PARTIDO PROGRESSISTA,2
TIETÊ,DEPUTADO ESTADUAL,CURIATI,ANTONIO SALIM CURIATI,ELEITO,PP,PARTIDO PROGRESSISTA,23
TIETÊ,DEPUTADO ESTADUAL,VALDIR DA SILVA,VALDIR DA SILVA,SUPLENTE,PP,PARTIDO PROGRESSISTA,2
TIETÊ,DEPUTADO ESTADUAL,SIMONY,SIMONY BENELLI GALASSO,SUPLENTE,PP,PARTIDO PROGRESSISTA,2
TIETÊ,DEPUTADO ESTADUAL,MAJOR ROLIM,JOÃO PAULO ROLIM MARQUES,SUPLENTE,PP,PARTIDO PROGRESSISTA,7
TIETÊ,DEPUTADO ESTADUAL,CELSO LEITE,CELSO MARCELINO LEITE,SUPLENTE,PP,PARTIDO PROGRESSISTA,23
TIETÊ,DEPUTADO ESTADUAL,JOÃO ARAUJO,JOÃO ANTONIO DE ARAUJO,SUPLENTE,PP,PARTIDO PROGRESSISTA,1
TIETÊ,DEPUTADO ESTADUAL,DR. IRINEU,IRINEU CARDOSO DOS SANTOS,SUPLENTE,PP,PARTIDO PROGRESSISTA,1
TIETÊ,DEPUTADO ESTADUAL,PASTOR NATANAEL SILVA,NATANAEL ALVES,SUPLENTE,PP,PARTIDO PROGRESSISTA,1
TIETÊ,DEPUTADO ESTADUAL,LAZARO TAVARES CUNHA,LAZARO TAVARES DA CUNHA,SUPLENTE,PP,PARTIDO PROGRESSISTA,1
TIETÊ,DEPUTADO ESTADUAL,RAFA ZIMBALDI,RAFAEL FERNANDO ZIMBALDI,SUPLENTE,PP,PARTIDO PROGRESSISTA,22
TIETÊ,DEPUTADO ESTADUAL,NELSON MANDELA,ADOLPHINO ROSARIO CRUZ,SUPLENTE,PP,PARTIDO PROGRESSISTA,1
TIETÊ,DEPUTADO ESTADUAL,KAKA SEABRA,CARLOS ANTONIO SEABRA,SUPLENTE,PP,PARTIDO PROGRESSISTA,1
TIETÊ,DEPUTADO ESTADUAL,RUSSOMANNO,MOZART ABAETE PERUIBE RUSSOMANNO,SUPLENTE,PP,PARTIDO PROGRESSISTA,11
TIETÊ,DEPUTADO ESTADUAL,AURELIO,AURELIO JOSE CLAUDIO,SUPLENTE,PDT,PARTIDO DEMOCRÁTICO TRABALHISTA,5
TIETÊ,DEPUTADO ESTADUAL,CASSOLA,JAIR CASSOLA,SUPLENTE,PDT,PARTIDO DEMOCRÁTICO TRABALHISTA,8
TIETÊ,DEPUTADO ESTADUAL,PERESSIM,CLAUDIO PERESSIM,SUPLENTE,PDT,PARTIDO DEMOCRÁTICO TRABALHISTA,1
TIETÊ,DEPUTADO ESTADUAL,LUIS YABIKU,LUIS MOKITI YABIKU,SUPLENTE,PDT,PARTIDO DEMOCRÁTICO TRABALHISTA,2
TIETÊ,DEPUTADO ESTADUAL,DINEI,CLAUDINEI ALEXANDRE PIRES,SUPLENTE,PDT,PARTIDO DEMOCRÁTICO TRABALHISTA,33
TIETÊ,DEPUTADO ESTADUAL,ROGERIO NOGUEIRA,ROGERIO NOGUEIRA LOPES CRUZ,ELEITO,PDT,PARTIDO DEMOCRÁTICO TRABALHISTA,23
TIETÊ,DEPUTADO ESTADUAL,JOSE BITTENCOURT,JOSE DOMINGOS BITTENCOURT,ELEITO,PDT,PARTIDO DEMOCRÁTICO TRABALHISTA,3
TIETÊ,DEPUTADO ESTADUAL,JUNIOR PRUDENTE E REGIAO,ADEMIR PEREIRA MONTEIRO JUNIOR,SUPLENTE,PDT,PARTIDO DEMOCRÁTICO TRABALHISTA,1
TIETÊ,DEPUTADO ESTADUAL,MAJOR OLIMPIO,SERGIO OLIMPIO GOMES,ELEITO,PDT,PARTIDO DEMOCRÁTICO TRABALHISTA,48
TIETÊ,DEPUTADO ESTADUAL,MARCOS BERNARDELLI,MARCOS JOSÉ BERNARDELLI,SUPLENTE,PDT,PARTIDO DEMOCRÁTICO TRABALHISTA,1
TIETÊ,DEPUTADO ESTADUAL,JOCA VASCONCELOS,JOAO CARLOS MONTE CLARO VASCONCELOS,SUPLENTE,PDT,PARTIDO DEMOCRÁTICO TRABALHISTA,14
TIETÊ,DEPUTADO ESTADUAL,NICOLACI,RONALD LUIZ NICOLACI FINCATTI,SUPLENTE,PDT,PARTIDO DEMOCRÁTICO TRABALHISTA,2
TIETÊ,DEPUTADO ESTADUAL,RAFAEL SILVA,RAFAEL ANTONIO DA SILVA,ELEITO,PDT,PARTIDO DEMOCRÁTICO TRABALHISTA,9
TIETÊ,DEPUTADO ESTADUAL,TOLOI,LUIZ CARLOS TOLOI JUNIOR,SUPLENTE,PDT,PARTIDO DEMOCRÁTICO TRABALHISTA,10
TIETÊ,DEPUTADO ESTADUAL,TADEU MORAIS,TADEU MORAIS DE SOUSA,SUPLENTE,PDT,PARTIDO DEMOCRÁTICO TRABALHISTA,1
TIETÊ,DEPUTADO ESTADUAL,LEONICE DA PAZ,LEONICE ALVES DA PAZ,SUPLENTE,PDT,PARTIDO DEMOCRÁTICO TRABALHISTA,3
TIETÊ,DEPUTADO ESTADUAL,HELIO BASTOS,HELIO DE ALMEIDA BASTOS,SUPLENTE,PDT,PARTIDO DEMOCRÁTICO TRABALHISTA,1
TIETÊ,DEPUTADO ESTADUAL,CONSTANCIA FELIX,CONSTANCIA BERBERT DUTRA DA SILVA,SUPLENTE,PDT,PARTIDO DEMOCRÁTICO TRABALHISTA,8
TIETÊ,DEPUTADO ESTADUAL,MARCO BRASIL,MARCO AURÉLIO RIBEIRO,SUPLENTE,PDT,PARTIDO DEMOCRÁTICO TRABALHISTA,10
TIETÊ,DEPUTADO ESTADUAL,JOÃO ELIAS,JOÃO ELIAS PEREIRA,SUPLENTE,PDT,PARTIDO DEMOCRÁTICO TRABALHISTA,18
TIETÊ,DEPUTADO ESTADUAL,TELMA DE SOUZA,TELMA SANDRA AUGUSTO DE SOUZA,ELEITO,PT,SOMOS MAIS SÃO PAULO,3
TIETÊ,DEPUTADO ESTADUAL,WAGNER BALIEIRO,WAGNER OCIMAR BALIEIRO,SUPLENTE,PT,SOMOS MAIS SÃO PAULO,2
TIETÊ,DEPUTADO ESTADUAL,GALENO AMORIM,GALENO DE AMORIM JUNIOR,SUPLENTE,PT,SOMOS MAIS SÃO PAULO,2
TIETÊ,DEPUTADO ESTADUAL,VALMIR PRASCIDELLI,VALMIR PRASCIDELLI,SUPLENTE,PT,SOMOS MAIS SÃO PAULO,34
TIETÊ,DEPUTADO ESTADUAL,JURA,JURACY FRANCISCO DE JESUS,SUPLENTE,PT,SOMOS MAIS SÃO PAULO,1
TIETÊ,DEPUTADO ESTADUAL,GERSON BITTENCOURT,GERSON LUIS BITTENCOURT,ELEITO,PT,SOMOS MAIS SÃO PAULO,3
TIETÊ,DEPUTADO ESTADUAL,EDINHO SILVA,EDSON ANTONIO EDINHO DA SILVA,ELEITO,PT,SOMOS MAIS SÃO PAULO,5
TIETÊ,DEPUTADO ESTADUAL,ANA PERUGINI,ANA LUCIA LIPPAUS PERUGINI,ELEITO,PT,SOMOS MAIS SÃO PAULO,266
TIETÊ,DEPUTADO ESTADUAL,TONINHO DO PT,ANTONIO AMARAL JUNIOR,SUPLENTE,PT,SOMOS MAIS SÃO PAULO,6
TIETÊ,DEPUTADO ESTADUAL,ZICO,JOSÉ PRADO DE ANDRADE,MÉDIA,PT,SOMOS MAIS SÃO PAULO,5
TIETÊ,DEPUTADO ESTADUAL,WILSON SANTOS,WILSON SANTOS PEREIRA,SUPLENTE,PT,SOMOS MAIS SÃO PAULO,1
TIETÊ,DEPUTADO ESTADUAL,MARCO AURÉLIO DE SOUZA,MARCO AURÉLIO DE SOUZA,MÉDIA,PT,SOMOS MAIS SÃO PAULO,5
TIETÊ,DEPUTADO ESTADUAL,MARCOS MARTINS,MARCOS LOPES MARTINS,ELEITO,PT,SOMOS MAIS SÃO PAULO,11
TIETÊ,DEPUTADO ESTADUAL,ELI TEODORO,ELI TEODORO,SUPLENTE,PT,SOMOS MAIS SÃO PAULO,2
TIETÊ,DEPUTADO ESTADUAL,SIMÃO PEDRO,SIMÃO PEDRO CHIOVETTI,ELEITO,PT,SOMOS MAIS SÃO PAULO,5
TIETÊ,DEPUTADO ESTADUAL,IVANETE VIEIRA,IVANETE APARECIDA DOS SANTOS,SUPLENTE,PT,SOMOS MAIS SÃO PAULO,1
TIETÊ,DEPUTADO ESTADUAL,GERALDO CRUZ,GERALDO LEITE DA CRUZ,ELEITO,PT,SOMOS MAIS SÃO PAULO,2
TIETÊ,DEPUTADO ESTADUAL,RUI FALCÃO,RUI GOETHE DA COSTA FALCÃO,ELEITO,PT,SOMOS MAIS SÃO PAULO,10
TIETÊ,DEPUTADO ESTADUAL,ANTONIO MENTOR,ANTONIO MENTOR DE MELLO SOBRINHO,ELEITO,PT,SOMOS MAIS SÃO PAULO,224
TIETÊ,DEPUTADO ESTADUAL,PADRE JUZEMILDO,JUZEMILDO ALBINO DA SILVA,SUPLENTE,PT,SOMOS MAIS SÃO PAULO,1
TIETÊ,DEPUTADO ESTADUAL,ADRIANO DIOGO,ADRIANO DIOGO,ELEITO,PT,SOMOS MAIS SÃO PAULO,53
TIETÊ,DEPUTADO ESTADUAL,ESTELA ALMAGRO,ESTELA ALEXANDRE ALMAGRO,SUPLENTE,PT,SOMOS MAIS SÃO PAULO,64
TIETÊ,DEPUTADO ESTADUAL,HAMILTON PEREIRA,HAMILTON PEREIRA,ELEITO,PT,SOMOS MAIS SÃO PAULO,40
TIETÊ,DEPUTADO ESTADUAL,NATIVIDADE,MARIA DA NATIVIDADE PEREIRA LIMA,SUPLENTE,PT,SOMOS MAIS SÃO PAULO,1
TIETÊ,DEPUTADO ESTADUAL,ROBERTO FELICIO,ROBERTO FELICIO,SUPLENTE,PT,SOMOS MAIS SÃO PAULO,65
TIETÊ,DEPUTADO ESTADUAL,RAFAEL AGOSTINI,RAFAEL LUNARDELLI AGOSTINI,SUPLENTE,PT,SOMOS MAIS SÃO PAULO,1
TIETÊ,DEPUTADO ESTADUAL,BETH SAHAO,ELISABETH SAHÃO,SUPLENTE,PT,SOMOS MAIS SÃO PAULO,5
TIETÊ,DEPUTADO ESTADUAL,FRANCISCO FRANÇA,FRANCISCO FRANÇA DA SILVA,SUPLENTE,PT,SOMOS MAIS SÃO PAULO,14
TIETÊ,DEPUTADO ESTADUAL,LELO PAGANI,LUIZ AURELIO PAGANI,SUPLENTE,PT,SOMOS MAIS SÃO PAULO,1
TIETÊ,DEPUTADO ESTADUAL,ALENCAR,ALENCAR SANTANA BRAGA,ELEITO,PT,SOMOS MAIS SÃO PAULO,1
TIETÊ,DEPUTADO ESTADUAL,TIÃOZINHO,SEBASTIÃO MOREIREA ARCANJO,SUPLENTE,PT,SOMOS MAIS SÃO PAULO,21
TIETÊ,DEPUTADO ESTADUAL,PROFESSOR AGNERIO,AGNERIO NERI FERREIRA,SUPLENTE,PT,SOMOS MAIS SÃO PAULO,1
TIETÊ,DEPUTADO ESTADUAL,ISAC REIS,ISAC FRANCO DOS REIS,ELEITO,PT,SOMOS MAIS SÃO PAULO,25
TIETÊ,DEPUTADO ESTADUAL,ANA DO CARMO,ANA MARIA DO CARMO ROSSETO,ELEITO,PT,SOMOS MAIS SÃO PAULO,3
TIETÊ,DEPUTADO ESTADUAL,JOSÉ CANDIDO,JOSÉ DE SOUZA CÂNDIDO,MÉDIA,PT,SOMOS MAIS SÃO PAULO,9
TIETÊ,DEPUTADO ESTADUAL,JOÃO ANTONIO,JOAO ANTONIO DA SILVA FILHO,ELEITO,PT,SOMOS MAIS SÃO PAULO,18
TIETÊ,DEPUTADO ESTADUAL,GALLO,JURANDIR GALLO,SUPLENTE,PT,SOMOS MAIS SÃO PAULO,1
TIETÊ,DEPUTADO ESTADUAL,LINEU NAVARRO,LUIZ ANTONIO NAVARRO MAGALHÃES LUZ,SUPLENTE,PT,SOMOS MAIS SÃO PAULO,5
TIETÊ,DEPUTADO ESTADUAL,ZÉ ARISTEIA,JOSÉ ARISTEIA PEREIRA,SUPLENTE,PT,SOMOS MAIS SÃO PAULO,7
TIETÊ,DEPUTADO ESTADUAL,SÉRGIO DESIDERÁ,SÉRGIO DESIDERÁ,SUPLENTE,PT,SOMOS MAIS SÃO PAULO,1
TIETÊ,DEPUTADO ESTADUAL,CARLOS GRANA,CARLOS ALBERTO GRANA,ELEITO,PT,SOMOS MAIS SÃO PAULO,4
TIETÊ,DEPUTADO ESTADUAL,TARCÍSIO,JOSÉ TARCÍSIO DE OLIVEIRA,SUPLENTE,PT,SOMOS MAIS SÃO PAULO,31
TIETÊ,DEPUTADO ESTADUAL,ZÉ ANTÔNIO,JOSÉ ANTONIO DA SILVA,SUPLENTE,PT,SOMOS MAIS SÃO PAULO,6
TIETÊ,DEPUTADO ESTADUAL,TITO,FRANCISCO DE ASSIS PEREIRA DE CAMPOS,SUPLENTE,PT,SOMOS MAIS SÃO PAULO,10
TIETÊ,DEPUTADO ESTADUAL,LUIZ MOURA,LUIZ DE MOURA PEREIRA,ELEITO,PT,SOMOS MAIS SÃO PAULO,1
TIETÊ,DEPUTADO ESTADUAL,GILSON PELIZARO,GILSON DONIZETE PELIZARO,SUPLENTE,PT,SOMOS MAIS SÃO PAULO,2
TIETÊ,DEPUTADO ESTADUAL,DONISETE BRAGA,DONISETE PEREIRA BRAGA,ELEITO,PT,SOMOS MAIS SÃO PAULO,1
TIETÊ,DEPUTADO ESTADUAL,CARLOS NEDER,CARLOS ALBERTO PLETZ NEDER,SUPLENTE,PT,SOMOS MAIS SÃO PAULO,3
TIETÊ,DEPUTADO ESTADUAL,ADONIAS,ADONIAS FACIO,SUPLENTE,PTB,PARTIDO TRABALHISTA BRASILEIRO,1
TIETÊ,DEPUTADO ESTADUAL,JOTA SILVA,JOAO JORGE FERREIRA DA SILVA,SUPLENTE,PTB,PARTIDO TRABALHISTA BRASILEIRO,13
TIETÊ,DEPUTADO ESTADUAL,LÉO ÁQUILLA,JADSON MENDES DE LIMA,SUPLENTE,PTB,PARTIDO TRABALHISTA BRASILEIRO,24
TIETÊ,DEPUTADO ESTADUAL,CEBOLINHA,JOAO VIANELLE PINTO,SUPLENTE,PTB,PARTIDO TRABALHISTA BRASILEIRO,1
TIETÊ,DEPUTADO ESTADUAL,AMARO MARIANO DA SILVA,AMARO MARIANO DA SILVA,SUPLENTE,PTB,PARTIDO TRABALHISTA BRASILEIRO,1
TIETÊ,DEPUTADO ESTADUAL,CONTE LOPES,ROBERVAL CONTE LOPES LIMA,SUPLENTE,PTB,PARTIDO TRABALHISTA BRASILEIRO,17
TIETÊ,DEPUTADO ESTADUAL,CAMPOS MACHADO,ANTONIO CARLOS DE CAMPOS MACHADO,ELEITO,PTB,PARTIDO TRABALHISTA BRASILEIRO,3287
TIETÊ,DEPUTADO ESTADUAL,VANDO,ORVANDO DA SILVA,SUPLENTE,PTB,PARTIDO TRABALHISTA BRASILEIRO,35
TIETÊ,DEPUTADO ESTADUAL,JUVENCIO MARQUES,JUVENCIO MARQUES DE ALCANTARA,SUPLENTE,PTB,PARTIDO TRABALHISTA BRASILEIRO,9
TIETÊ,DEPUTADO ESTADUAL,GIL FONSECA,GILDO APARECIDO FONSECA,SUPLENTE,PTB,PARTIDO TRABALHISTA BRASILEIRO,1
TIETÊ,DEPUTADO ESTADUAL,ROQUE BARBIERE - ROQUINHO,ROQUE BARBIERE,ELEITO,PTB,PARTIDO TRABALHISTA BRASILEIRO,4
TIETÊ,DEPUTADO ESTADUAL,MATRIX,SAMUEL DOS SANTOS PARREIRA GABRIEL,SUPLENTE,PTB,PARTIDO TRABALHISTA BRASILEIRO,1
TIETÊ,DEPUTADO ESTADUAL,HEROILMA SOARES TAVARES,HEROILMA SOARES TAVARES,MÉDIA,PTB,PARTIDO TRABALHISTA BRASILEIRO,2
TIETÊ,DEPUTADO ESTADUAL,MOISES DA FUNERARIA,MOISES ANTONIO DE LIMA,SUPLENTE,PTB,PARTIDO TRABALHISTA BRASILEIRO,1
TIETÊ,DEPUTADO ESTADUAL,CORONEL EDSON FERRARINI,EDSON FERRARINI,ELEITO,PTB,PARTIDO TRABALHISTA BRASILEIRO,38
TIETÊ,DEPUTADO ESTADUAL,RODRIGO MENDES,RODRIGO CLAUDIONOR MENDES,SUPLENTE,PTB,PARTIDO TRABALHISTA BRASILEIRO,1
TIETÊ,DEPUTADO ESTADUAL,VAL,ENIVALDO RAMOS DE FREITAS,SUPLENTE,PTB,PARTIDO TRABALHISTA BRASILEIRO,4
TIETÊ,DEPUTADO ESTADUAL,ADMAR LUIZ - MARGARIDA,ADMAR LUIZ FERREIRA,SUPLENTE,PTB,PARTIDO TRABALHISTA BRASILEIRO,2
TIETÊ,DEPUTADO ESTADUAL,PROFESSOR LEANDRO MOU,LEANDRO TADEU CAZARROTTI,SUPLENTE,PTB,PARTIDO TRABALHISTA BRASILEIRO,2
TIETÊ,DEPUTADO ESTADUAL,PROFESSORA ALBA LUCENA,ALBA LUCENA FERNANDES GANDIA,SUPLENTE,PTB,PARTIDO TRABALHISTA BRASILEIRO,1
TIETÊ,DEPUTADO ESTADUAL,WALDIR AGNELLO,WALDIR AGNELLO,SUPLENTE,PTB,PARTIDO TRABALHISTA BRASILEIRO,26
TIETÊ,DEPUTADO ESTADUAL,BALEIA ROSSI,LUIZ FELIPE BALEIA TENUTO ROSSI,ELEITO,PMDB,PARTIDO DO MOVIMENTO DEMOCRÁTICO BRASILEIRO,21
TIETÊ,DEPUTADO ESTADUAL,DRA ADRIANA,ADRIANA DI NARDO SILVA,SUPLENTE,PMDB,PARTIDO DO MOVIMENTO DEMOCRÁTICO BRASILEIRO,3
TIETÊ,DEPUTADO ESTADUAL,BEBETTO,ALBERTO FELIPPE HADDAD FILHO,SUPLENTE,PMDB,PARTIDO DO MOVIMENTO DEMOCRÁTICO BRASILEIRO,4
TIETÊ,DEPUTADO ESTADUAL,THIAGO FERRARI,THIAGO DE MORAES FERRARI,SUPLENTE,PMDB,PARTIDO DO MOVIMENTO DEMOCRÁTICO BRASILEIRO,3
TIETÊ,DEPUTADO ESTADUAL,DU TONIN,EDUARDO TONIN,SUPLENTE,PMDB,PARTIDO DO MOVIMENTO DEMOCRÁTICO BRASILEIRO,16
TIETÊ,DEPUTADO ESTADUAL,IBRAIM,IBRAIM ANTONIO ABOU JOKH,SUPLENTE,PMDB,PARTIDO DO MOVIMENTO DEMOCRÁTICO BRASILEIRO,4
TIETÊ,DEPUTADO ESTADUAL,JOSÉ BARROS,JOSÉ BARROS DE CASTRO,SUPLENTE,PMDB,PARTIDO DO MOVIMENTO DEMOCRÁTICO BRASILEIRO,1
TIETÊ,DEPUTADO ESTADUAL,CARUSO,JORGE LUIS CARUSO,ELEITO,PMDB,PARTIDO DO MOVIMENTO DEMOCRÁTICO BRASILEIRO,9
TIETÊ,DEPUTADO ESTADUAL,FABIO BELLO,FABIO BELLO DE OLIVEIRA,SUPLENTE,PMDB,PARTIDO DO MOVIMENTO DEMOCRÁTICO BRASILEIRO,165
TIETÊ,DEPUTADO ESTADUAL,SERGIO BERGAMASCO,ANTONIO SERGIO PIRES BERGAMASCO,SUPLENTE,PMDB,PARTIDO DO MOVIMENTO DEMOCRÁTICO BRASILEIRO,1
TIETÊ,DEPUTADO ESTADUAL,DR. ARNALDO,ARNALDO DONIZETTI DANTAS,SUPLENTE,PMDB,PARTIDO DO MOVIMENTO DEMOCRÁTICO BRASILEIRO,1
TIETÊ,DEPUTADO ESTADUAL,MARQUINHOS SKALA,MARCOS DA SILVA MARQUES,SUPLENTE,PMDB,PARTIDO DO MOVIMENTO DEMOCRÁTICO BRASILEIRO,3
TIETÊ,DEPUTADO ESTADUAL,VANESSA DAMO,VANESSA DAMO OROSCO,ELEITO,PMDB,PARTIDO DO MOVIMENTO DEMOCRÁTICO BRASILEIRO,16
TIETÊ,DEPUTADO ESTADUAL,UEBE REZECK,UEBE REZECK,SUPLENTE,PMDB,PARTIDO DO MOVIMENTO DEMOCRÁTICO BRASILEIRO,4
TIETÊ,DEPUTADO ESTADUAL,HABIB,GEORGES HABIB JARROUGE,SUPLENTE,PMDB,PARTIDO DO MOVIMENTO DEMOCRÁTICO BRASILEIRO,1
TIETÊ,DEPUTADO ESTADUAL,HUBER GAMA,HUBER ARISTOTELES NOGUEIRA DA GAMA,SUPLENTE,PMDB,PARTIDO DO MOVIMENTO DEMOCRÁTICO BRASILEIRO,2
TIETÊ,DEPUTADO ESTADUAL,ITAMAR BORGES,ITAMAR FRANCISCO MACHADO BORGES,MÉDIA,PMDB,PARTIDO DO MOVIMENTO DEMOCRÁTICO BRASILEIRO,9
TIETÊ,DEPUTADO ESTADUAL,JONAS,JONAS PEREIRA DE LIMA,SUPLENTE,PMDB,PARTIDO DO MOVIMENTO DEMOCRÁTICO BRASILEIRO,1
TIETÊ,DEPUTADO ESTADUAL,DRA SILVANA,SILVANA CASSIA RIBEIRO BAPTISTA,SUPLENTE,PMDB,PARTIDO DO MOVIMENTO DEMOCRÁTICO BRASILEIRO,1
TIETÊ,DEPUTADO ESTADUAL,SOUZA VIGILANTE,JOSÉ CLAUDIVAM DOS SANTOS SOUZA,SUPLENTE,PMDB,PARTIDO DO MOVIMENTO DEMOCRÁTICO BRASILEIRO,1
TIETÊ,DEPUTADO ESTADUAL,ANGELA RAMALHO,ANGELA MARIA ANTUNES DE CARVALHO TAVARES,SUPLENTE,PMDB,PARTIDO DO MOVIMENTO DEMOCRÁTICO BRASILEIRO,78
TIETÊ,DEPUTADO ESTADUAL,JOOJI HATO,JOOJI HATO,ELEITO,PMDB,PARTIDO DO MOVIMENTO DEMOCRÁTICO BRASILEIRO,14
TIETÊ,DEPUTADO ESTADUAL,JÂNIO,JÂNIO GONÇALVES DE OLIVEIRA,SUPLENTE,PMDB,PARTIDO DO MOVIMENTO DEMOCRÁTICO BRASILEIRO,4
TIETÊ,DEPUTADO ESTADUAL,TUNICO VIEIRA,ANTONIO JOSÉ VIEIRA JUNIOR,SUPLENTE,PMDB,PARTIDO DO MOVIMENTO DEMOCRÁTICO BRASILEIRO,5
TIETÊ,DEPUTADO ESTADUAL,ALEXANDRE CUNHA,ALEXANDRE EVARISTO CUNHA,SUPLENTE,PMDB,PARTIDO DO MOVIMENTO DEMOCRÁTICO BRASILEIRO,1
TIETÊ,DEPUTADO ESTADUAL,ANA PAULA ROSSI,ANA PAULA ROSSI DE ALMEIDA MAGDESIAN,SUPLENTE,PMDB,PARTIDO DO MOVIMENTO DEMOCRÁTICO BRASILEIRO,5
TIETÊ,DEPUTADO ESTADUAL,DR. JEFERSON RODRIGUES,JEFERSON RODRIGUES,SUPLENTE,PMDB,PARTIDO DO MOVIMENTO DEMOCRÁTICO BRASILEIRO,1
TIETÊ,DEPUTADO ESTADUAL,JAAN TAMMERIK,JAAN FRANCISCO ROMERA TAMMERIK,SUPLENTE,PSC,HUMANISTA CRISTÃO ,5
TIETÊ,DEPUTADO ESTADUAL,APOSTOLO EURIPEDES,EURIPEDES LUIZ DE SOUSA,SUPLENTE,PSC,HUMANISTA CRISTÃO ,1
TIETÊ,DEPUTADO ESTADUAL,ALAN NETO,ANTONIO CARLOS BARBOSA NEVES,SUPLENTE,PSC,HUMANISTA CRISTÃO ,7
TIETÊ,DEPUTADO ESTADUAL,DR. CLAUDIO MIRANDA,CLAUDIO ERNANI MARCONDES DE MIRANDA,SUPLENTE,PSC,HUMANISTA CRISTÃO ,13
TIETÊ,DEPUTADO ESTADUAL,LELIS TRAJANO,LELIS JOSE TRAJANO,SUPLENTE,PSC,HUMANISTA CRISTÃO ,7
TIETÊ,DEPUTADO ESTADUAL,PR. PAGLIARIN,HIDERALDO PAGLIARIN,SUPLENTE,PSC,HUMANISTA CRISTÃO ,10
TIETÊ,DEPUTADO ESTADUAL,JOAQUIM RUESCAS,JOAQUIM RUESCAS NETO,SUPLENTE,PSC,HUMANISTA CRISTÃO ,3
TIETÊ,DEPUTADO ESTADUAL,LEANDRO AMARAL,LEANDRO GODINES DO AMARAL,SUPLENTE,PSC,HUMANISTA CRISTÃO ,3
TIETÊ,DEPUTADO ESTADUAL,PASTOR VIEIRA ROCHA,JOSE VIEIRA ROCHA,SUPLENTE,PSC,HUMANISTA CRISTÃO ,2
TIETÊ,DEPUTADO ESTADUAL,PR. CARLOS CEZAR,CARLOS CEZAR DA SILVA,ELEITO,PSC,HUMANISTA CRISTÃO ,169
TIETÊ,DEPUTADO ESTADUAL,GUIMARÃES,WALTER GUIMARÃES RODRIGUES,SUPLENTE,PSC,HUMANISTA CRISTÃO ,4
TIETÊ,DEPUTADO ESTADUAL,LUIZ LAURO,LUIZ LAURO FERREIRA,SUPLENTE,PSC,HUMANISTA CRISTÃO ,14
TIETÊ,DEPUTADO ESTADUAL,LUIZ BUENO,LUIZ CARLOS BUENO DA SILVA JUNIOR,SUPLENTE,PSC,HUMANISTA CRISTÃO ,18
TIETÊ,DEPUTADO ESTADUAL,ZE INDIO,JOSE FERREIRA DO NASCIMENTO,SUPLENTE,PSC,HUMANISTA CRISTÃO ,3
TIETÊ,DEPUTADO ESTADUAL,RENATO PUPO,RENATO PUPO DE PAULA,SUPLENTE,PSC,HUMANISTA CRISTÃO ,8
TIETÊ,DEPUTADO ESTADUAL,JOÃO BINATO,JOÃO ANTONIO BINATO,SUPLENTE,PSC,HUMANISTA CRISTÃO ,2
TIETÊ,DEPUTADO ESTADUAL,WALTER CORDONI,WALTER CORDONI FILHO,SUPLENTE,PSC,HUMANISTA CRISTÃO ,1
TIETÊ,DEPUTADO ESTADUAL,PAULO CHOCOLATE,PAULO SERGIO VIEIRA NEVES,SUPLENTE,PSC,HUMANISTA CRISTÃO ,1
TIETÊ,DEPUTADO ESTADUAL,CLAUDIO RANA,CLAUDIO RANA,SUPLENTE,PSC,HUMANISTA CRISTÃO ,1
TIETÊ,DEPUTADO ESTADUAL,MARIA DO CARMO PIUNTI,MARIA DO CARMO THOMAZ PIUNTI,SUPLENTE,PSC,HUMANISTA CRISTÃO ,17
TIETÊ,DEPUTADO ESTADUAL,SAID MOURAD,AHMAD SAID MOURAD,SUPLENTE,PSC,HUMANISTA CRISTÃO ,2
TIETÊ,DEPUTADO ESTADUAL,RODRIGO MORAES,RODRIGO AUGUSTO MORAES,ELEITO,PSC,HUMANISTA CRISTÃO ,134
TIETÊ,DEPUTADO ESTADUAL,BRAZ PASSARINHEIRO,BRAZ ANASTACIO DA SILVA,SUPLENTE,PSC,HUMANISTA CRISTÃO ,3
TIETÊ,DEPUTADO ESTADUAL,PAULO CORREA,PAULO HENRIQUE CORREA,SUPLENTE,PR,SOMOS MAIS SÃO PAULO,35
TIETÊ,DEPUTADO ESTADUAL,JOSUE ROBERTO,JOSUE ROBERTO DA SILVA,SUPLENTE,PR,SOMOS MAIS SÃO PAULO,2
