OLÍMPIA,DEPUTADO FEDERAL,JOSÉ ANIBAL,JOSÉ ANIBAL PERES DE PONTES,ELEITO,PSDB,PSDB/DEM/PPS,26
OLÍMPIA,DEPUTADO FEDERAL,NELSON BUGALHO,NELSON ROBERTO BUGALHO,SUPLENTE,PSDB,PSDB/DEM/PPS,2
OLÍMPIA,DEPUTADO FEDERAL,GILBERTO BORJA,GILBERTO BORJA PINTO,SUPLENTE,PSDB,PSDB/DEM/PPS,3
OLÍMPIA,DEPUTADO FEDERAL,PROFESSOR CLOVIS PINTO,CLOVIS DA SILVA PINTO,SUPLENTE,PSDB,PSDB/DEM/PPS,1
OLÍMPIA,DEPUTADO FEDERAL,RODRIGO CHIZOLINI,RODRIGO PINTO CHIZOLINI,SUPLENTE,PSOL,PARTIDO SOCIALISMO E LIBERDADE,1
OLÍMPIA,DEPUTADO FEDERAL,FAUSTO NETO,FAUSTO FRANCISCO DOS SANTOS NETO,SUPLENTE,PSOL,PARTIDO SOCIALISMO E LIBERDADE,4
OLÍMPIA,DEPUTADO FEDERAL,PROFESSORA PATRICIA,PATRICIA ANDREIA CARRETERO,SUPLENTE,PSOL,PARTIDO SOCIALISMO E LIBERDADE,3
OLÍMPIA,DEPUTADO FEDERAL,PEDRO ROBERTO,PEDRO ROBERTO GOMES,SUPLENTE,PSOL,PARTIDO SOCIALISMO E LIBERDADE,17
OLÍMPIA,DEPUTADO FEDERAL,IVAN VALENTE,IVAN VALENTE,ELEITO,PSOL,PARTIDO SOCIALISMO E LIBERDADE,60
OLÍMPIA,DEPUTADO FEDERAL,ADEMIR É FEDERAL,JOSE ADEMIR DA SILVA,SUPLENTE,PSOL,PARTIDO SOCIALISMO E LIBERDADE,3
OLÍMPIA,DEPUTADO FEDERAL,RICARDO DUTRA,RICARDO DUTRA RUBES,SUPLENTE,PSOL,PARTIDO SOCIALISMO E LIBERDADE,1
OLÍMPIA,DEPUTADO FEDERAL,JULIANO ROCHA,JULIANO APARECIDO ROCHA RODRIGUES,SUPLENTE,PSOL,PARTIDO SOCIALISMO E LIBERDADE,4
OLÍMPIA,DEPUTADO FEDERAL,GUSTAVO PETTA,GUSTAVO LEMOS PETTA,SUPLENTE,PC DO B,JUNTOS POR SÃO PAULO,36
OLÍMPIA,DEPUTADO FEDERAL,BENEH SANTOS,BENEDITO HERNELIO DOS SANTOS,SUPLENTE,PC DO B,JUNTOS POR SÃO PAULO,1
OLÍMPIA,DEPUTADO FEDERAL,ALDO REBELO,JOSÉ ALDO REBELO FIGUEIREDO,ELEITO,PC DO B,JUNTOS POR SÃO PAULO,55
OLÍMPIA,DEPUTADO FEDERAL,DELEGADO PROTÓGENES,PROTÓGENES PINHEIRO DE QUEIROZ,MÉDIA,PC DO B,JUNTOS POR SÃO PAULO,21
OLÍMPIA,DEPUTADO FEDERAL,JOAO ARAUJO,JOAO LUIS ARAUJO NETO,SUPLENTE,PT DO B,JUNTOS POR SÃO PAULO,4
OLÍMPIA,DEPUTADO ESTADUAL,GERSON DEZEMBRO,GERSON DONIZETI DEZEMBRO,SUPLENTE,PRB,SOMOS MAIS SÃO PAULO,2
OLÍMPIA,DEPUTADO ESTADUAL,GILMACI SANTOS,GILMACI DOS SANTOS BARBOSA,ELEITO,PRB,SOMOS MAIS SÃO PAULO,7
OLÍMPIA,DEPUTADO ESTADUAL,SEBASTIÃO SANTOS,SEBASTIÃO DOS SANTOS FILHO,ELEITO,PRB,SOMOS MAIS SÃO PAULO,186
OLÍMPIA,DEPUTADO ESTADUAL,HAVANIR,HAVANIR TAVARES DE ALMEIDA NIMTZ,SUPLENTE,PRB,SOMOS MAIS SÃO PAULO,2
OLÍMPIA,DEPUTADO ESTADUAL,MALEK,ROBSON MALEK,SUPLENTE,PP,PARTIDO PROGRESSISTA,3
OLÍMPIA,DEPUTADO ESTADUAL,CURIATI,ANTONIO SALIM CURIATI,ELEITO,PP,PARTIDO PROGRESSISTA,87
OLÍMPIA,DEPUTADO ESTADUAL,CIMATTI NETO,MILTON CIMATTI NETO,SUPLENTE,PP,PARTIDO PROGRESSISTA,1
OLÍMPIA,DEPUTADO ESTADUAL,SIMONY,SIMONY BENELLI GALASSO,SUPLENTE,PP,PARTIDO PROGRESSISTA,3
OLÍMPIA,DEPUTADO ESTADUAL,MARLENE LUCAS,MARLENE LUCAS PEREIRA,SUPLENTE,PP,PARTIDO PROGRESSISTA,1
OLÍMPIA,DEPUTADO ESTADUAL,DIOGO TICLY,DIOGO GAZZE TICLY,SUPLENTE,PP,PARTIDO PROGRESSISTA,33
OLÍMPIA,DEPUTADO ESTADUAL,DR. IRINEU,IRINEU CARDOSO DOS SANTOS,SUPLENTE,PP,PARTIDO PROGRESSISTA,2
OLÍMPIA,DEPUTADO ESTADUAL,FARIA JR,WALDEMAR ALVES FARIA JUNIOR,SUPLENTE,PP,PARTIDO PROGRESSISTA,1
OLÍMPIA,DEPUTADO ESTADUAL,MARIA CLEMENTINA,MARIA CLEMENTINO DE SOUSA,SUPLENTE,PP,PARTIDO PROGRESSISTA,1
OLÍMPIA,DEPUTADO ESTADUAL,BARRETÃO,ARMANDO SERGIO ROSA BARRETO,SUPLENTE,PP,PARTIDO PROGRESSISTA,1
OLÍMPIA,DEPUTADO ESTADUAL,PRADO,ALEXANDRE DO PRADO,SUPLENTE,PP,PARTIDO PROGRESSISTA,1
OLÍMPIA,DEPUTADO ESTADUAL,RAFA ZIMBALDI,RAFAEL FERNANDO ZIMBALDI,SUPLENTE,PP,PARTIDO PROGRESSISTA,2
OLÍMPIA,DEPUTADO ESTADUAL,EDINHO,EDSON JOAQUIM DE FREITAS,SUPLENTE,PP,PARTIDO PROGRESSISTA,2
OLÍMPIA,DEPUTADO ESTADUAL,RUSSOMANNO,MOZART ABAETE PERUIBE RUSSOMANNO,SUPLENTE,PP,PARTIDO PROGRESSISTA,6
OLÍMPIA,DEPUTADO ESTADUAL,PAULERA,PAULO ROBERTO AMBROSIO,SUPLENTE,PP,PARTIDO PROGRESSISTA,110
OLÍMPIA,DEPUTADO ESTADUAL,AURELIO,AURELIO JOSE CLAUDIO,SUPLENTE,PDT,PARTIDO DEMOCRÁTICO TRABALHISTA,52
OLÍMPIA,DEPUTADO ESTADUAL,LUIS YABIKU,LUIS MOKITI YABIKU,SUPLENTE,PDT,PARTIDO DEMOCRÁTICO TRABALHISTA,4
OLÍMPIA,DEPUTADO ESTADUAL,DR RENAN,RENAN MARINO,SUPLENTE,PDT,PARTIDO DEMOCRÁTICO TRABALHISTA,7
OLÍMPIA,DEPUTADO ESTADUAL,DINEI,CLAUDINEI ALEXANDRE PIRES,SUPLENTE,PDT,PARTIDO DEMOCRÁTICO TRABALHISTA,4
OLÍMPIA,DEPUTADO ESTADUAL,GILBERTO DOURADO,GILBERTO RODRIGUES DOURADO,SUPLENTE,PDT,PARTIDO DEMOCRÁTICO TRABALHISTA,1
OLÍMPIA,DEPUTADO ESTADUAL,ROGERIO NOGUEIRA,ROGERIO NOGUEIRA LOPES CRUZ,ELEITO,PDT,PARTIDO DEMOCRÁTICO TRABALHISTA,4
OLÍMPIA,DEPUTADO ESTADUAL,CAPITAO LUCAS,AURO LUCAS,SUPLENTE,PDT,PARTIDO DEMOCRÁTICO TRABALHISTA,1
OLÍMPIA,DEPUTADO ESTADUAL,LUIZ ARRAES,LUIZ DE SOUZA ARRAES,SUPLENTE,PDT,PARTIDO DEMOCRÁTICO TRABALHISTA,8
OLÍMPIA,DEPUTADO ESTADUAL,JOSE BITTENCOURT,JOSE DOMINGOS BITTENCOURT,ELEITO,PDT,PARTIDO DEMOCRÁTICO TRABALHISTA,286
OLÍMPIA,DEPUTADO ESTADUAL,MAJOR OLIMPIO,SERGIO OLIMPIO GOMES,ELEITO,PDT,PARTIDO DEMOCRÁTICO TRABALHISTA,134
OLÍMPIA,DEPUTADO ESTADUAL,THIAGO RODRIGUES,THIAGO RODRIGUES DA COSTA,SUPLENTE,PDT,PARTIDO DEMOCRÁTICO TRABALHISTA,1
OLÍMPIA,DEPUTADO ESTADUAL,MARCOS BERNARDELLI,MARCOS JOSÉ BERNARDELLI,SUPLENTE,PDT,PARTIDO DEMOCRÁTICO TRABALHISTA,2
OLÍMPIA,DEPUTADO ESTADUAL,JOCA VASCONCELOS,JOAO CARLOS MONTE CLARO VASCONCELOS,SUPLENTE,PDT,PARTIDO DEMOCRÁTICO TRABALHISTA,2
OLÍMPIA,DEPUTADO ESTADUAL,AMON VIOLEIRO,AMOMM HEBROM DA HORA DE DEUS SOUZA,SUPLENTE,PDT,PARTIDO DEMOCRÁTICO TRABALHISTA,2
OLÍMPIA,DEPUTADO ESTADUAL,CARLOS HERNANDES,JOSÉ CARLOS SANCHES HERNANDES,SUPLENTE,PDT,PARTIDO DEMOCRÁTICO TRABALHISTA,5
OLÍMPIA,DEPUTADO ESTADUAL,NICOLACI,RONALD LUIZ NICOLACI FINCATTI,SUPLENTE,PDT,PARTIDO DEMOCRÁTICO TRABALHISTA,2
OLÍMPIA,DEPUTADO ESTADUAL,BRUZAROSCO,APARECIDO DE JESUS BRUZAROSCO,SUPLENTE,PDT,PARTIDO DEMOCRÁTICO TRABALHISTA,4
OLÍMPIA,DEPUTADO ESTADUAL,EMERSON LEAL,EMERSON PIRES LEAL,SUPLENTE,PDT,PARTIDO DEMOCRÁTICO TRABALHISTA,1
OLÍMPIA,DEPUTADO ESTADUAL,RAFAEL SILVA,RAFAEL ANTONIO DA SILVA,ELEITO,PDT,PARTIDO DEMOCRÁTICO TRABALHISTA,23
OLÍMPIA,DEPUTADO ESTADUAL,TOLOI,LUIZ CARLOS TOLOI JUNIOR,SUPLENTE,PDT,PARTIDO DEMOCRÁTICO TRABALHISTA,9
OLÍMPIA,DEPUTADO ESTADUAL,TADEU MORAIS,TADEU MORAIS DE SOUSA,SUPLENTE,PDT,PARTIDO DEMOCRÁTICO TRABALHISTA,3
OLÍMPIA,DEPUTADO ESTADUAL,LEONICE DA PAZ,LEONICE ALVES DA PAZ,SUPLENTE,PDT,PARTIDO DEMOCRÁTICO TRABALHISTA,2
OLÍMPIA,DEPUTADO ESTADUAL,HELIO BASTOS,HELIO DE ALMEIDA BASTOS,SUPLENTE,PDT,PARTIDO DEMOCRÁTICO TRABALHISTA,20
OLÍMPIA,DEPUTADO ESTADUAL,MYRYAM ATHIE,MIRIAM ATHIE,SUPLENTE,PDT,PARTIDO DEMOCRÁTICO TRABALHISTA,1
OLÍMPIA,DEPUTADO ESTADUAL,ELIO CANDIDO,ELIO ANTONIO CANDIDO,SUPLENTE,PDT,PARTIDO DEMOCRÁTICO TRABALHISTA,2
OLÍMPIA,DEPUTADO ESTADUAL,CONSTANCIA FELIX,CONSTANCIA BERBERT DUTRA DA SILVA,SUPLENTE,PDT,PARTIDO DEMOCRÁTICO TRABALHISTA,15
OLÍMPIA,DEPUTADO ESTADUAL,MARCO BRASIL,MARCO AURÉLIO RIBEIRO,SUPLENTE,PDT,PARTIDO DEMOCRÁTICO TRABALHISTA,8
OLÍMPIA,DEPUTADO ESTADUAL,JOSE DE ALMEIDA,JOSE MALVINEITE DE ALMEIDA,SUPLENTE,PDT,PARTIDO DEMOCRÁTICO TRABALHISTA,1
OLÍMPIA,DEPUTADO ESTADUAL,ANDERSON SILVA,ANDERSON DOMINGOS DA SILVA,SUPLENTE,PT,SOMOS MAIS SÃO PAULO,3
OLÍMPIA,DEPUTADO ESTADUAL,DR. JORGE PARADA,JORGE EDUARDO PARADA HURTADO,SUPLENTE,PT,SOMOS MAIS SÃO PAULO,2
OLÍMPIA,DEPUTADO ESTADUAL,BETO COELHO,PAULO ROBERTO CABRAL COELHO,SUPLENTE,PT,SOMOS MAIS SÃO PAULO,1
OLÍMPIA,DEPUTADO ESTADUAL,PEDRO BIANGULI,PEDRO CARLOS BIANGULI DE FARIA,SUPLENTE,PT,SOMOS MAIS SÃO PAULO,1
OLÍMPIA,DEPUTADO ESTADUAL,CLAUDILSON PEZAO,CLAUDILSON LEITE PEREIRA,SUPLENTE,PT,SOMOS MAIS SÃO PAULO,1
OLÍMPIA,DEPUTADO ESTADUAL,PROFESSOR CLEITON GOMES,CLEITON GOMES DA SILVA,SUPLENTE,PT,SOMOS MAIS SÃO PAULO,2
OLÍMPIA,DEPUTADO ESTADUAL,GALENO AMORIM,GALENO DE AMORIM JUNIOR,SUPLENTE,PT,SOMOS MAIS SÃO PAULO,6
OLÍMPIA,DEPUTADO ESTADUAL,VALMIR PRASCIDELLI,VALMIR PRASCIDELLI,SUPLENTE,PT,SOMOS MAIS SÃO PAULO,1
OLÍMPIA,DEPUTADO ESTADUAL,GERSON BITTENCOURT,GERSON LUIS BITTENCOURT,ELEITO,PT,SOMOS MAIS SÃO PAULO,1
OLÍMPIA,DEPUTADO ESTADUAL,EDINHO SILVA,EDSON ANTONIO EDINHO DA SILVA,ELEITO,PT,SOMOS MAIS SÃO PAULO,4
OLÍMPIA,DEPUTADO ESTADUAL,RAFAEL MARINHO,RAFAEL DE FIGUEIREDO MARINHO,SUPLENTE,PT,SOMOS MAIS SÃO PAULO,418
OLÍMPIA,DEPUTADO ESTADUAL,ANA PERUGINI,ANA LUCIA LIPPAUS PERUGINI,ELEITO,PT,SOMOS MAIS SÃO PAULO,4
OLÍMPIA,DEPUTADO ESTADUAL,TONINHO DO PT,ANTONIO AMARAL JUNIOR,SUPLENTE,PT,SOMOS MAIS SÃO PAULO,1
OLÍMPIA,DEPUTADO ESTADUAL,ZICO,JOSÉ PRADO DE ANDRADE,MÉDIA,PT,SOMOS MAIS SÃO PAULO,37
OLÍMPIA,DEPUTADO ESTADUAL,MARCOS MARTINS,MARCOS LOPES MARTINS,ELEITO,PT,SOMOS MAIS SÃO PAULO,5
OLÍMPIA,DEPUTADO ESTADUAL,DR. LUIZINHO,LUIS CARLOS LAURINDO,SUPLENTE,PT,SOMOS MAIS SÃO PAULO,3
OLÍMPIA,DEPUTADO ESTADUAL,ELI TEODORO,ELI TEODORO,SUPLENTE,PT,SOMOS MAIS SÃO PAULO,3
OLÍMPIA,DEPUTADO ESTADUAL,SIMÃO PEDRO,SIMÃO PEDRO CHIOVETTI,ELEITO,PT,SOMOS MAIS SÃO PAULO,5
OLÍMPIA,DEPUTADO ESTADUAL,RUI FALCÃO,RUI GOETHE DA COSTA FALCÃO,ELEITO,PT,SOMOS MAIS SÃO PAULO,6
OLÍMPIA,DEPUTADO ESTADUAL,ANTONIO MENTOR,ANTONIO MENTOR DE MELLO SOBRINHO,ELEITO,PT,SOMOS MAIS SÃO PAULO,41
OLÍMPIA,DEPUTADO ESTADUAL,ADRIANO DIOGO,ADRIANO DIOGO,ELEITO,PT,SOMOS MAIS SÃO PAULO,8
OLÍMPIA,DEPUTADO ESTADUAL,EUVANILDE,EUVANILDE RODRIGUES DA SILVA,SUPLENTE,PT,SOMOS MAIS SÃO PAULO,5
OLÍMPIA,DEPUTADO ESTADUAL,LUIZ CLAUDIO MARCOLINO,LUIZ CLAUDIO MARCOLINO,ELEITO,PT,SOMOS MAIS SÃO PAULO,2
OLÍMPIA,DEPUTADO ESTADUAL,RENATO DO GEB,RENATO MORENI AIRES DA SILVA,SUPLENTE,PT,SOMOS MAIS SÃO PAULO,1
OLÍMPIA,DEPUTADO ESTADUAL,NATIVIDADE,MARIA DA NATIVIDADE PEREIRA LIMA,SUPLENTE,PT,SOMOS MAIS SÃO PAULO,5
OLÍMPIA,DEPUTADO ESTADUAL,ROBERTO FELICIO,ROBERTO FELICIO,SUPLENTE,PT,SOMOS MAIS SÃO PAULO,11
OLÍMPIA,DEPUTADO ESTADUAL,RAFAEL AGOSTINI,RAFAEL LUNARDELLI AGOSTINI,SUPLENTE,PT,SOMOS MAIS SÃO PAULO,1
OLÍMPIA,DEPUTADO ESTADUAL,BETH SAHAO,ELISABETH SAHÃO,SUPLENTE,PT,SOMOS MAIS SÃO PAULO,1770
OLÍMPIA,DEPUTADO ESTADUAL,ADINAN ORTOLAN,JOSÉ ADINAN ORTOLAN,SUPLENTE,PT,SOMOS MAIS SÃO PAULO,1
OLÍMPIA,DEPUTADO ESTADUAL,LELO PAGANI,LUIZ AURELIO PAGANI,SUPLENTE,PT,SOMOS MAIS SÃO PAULO,2
OLÍMPIA,DEPUTADO ESTADUAL,ALENCAR,ALENCAR SANTANA BRAGA,ELEITO,PT,SOMOS MAIS SÃO PAULO,9
OLÍMPIA,DEPUTADO ESTADUAL,VERA SABA,VERA LÚCIA SANTOS SABA,SUPLENTE,PT,SOMOS MAIS SÃO PAULO,1
OLÍMPIA,DEPUTADO ESTADUAL,JOÃO PAULO RILLO,JOÃO PAULO RILLO,ELEITO,PT,SOMOS MAIS SÃO PAULO,917
OLÍMPIA,DEPUTADO ESTADUAL,ANA DO CARMO,ANA MARIA DO CARMO ROSSETO,ELEITO,PT,SOMOS MAIS SÃO PAULO,1
OLÍMPIA,DEPUTADO ESTADUAL,MIRANDA,JOSÉ CARLOS MIRANDA,SUPLENTE,PT,SOMOS MAIS SÃO PAULO,3
OLÍMPIA,DEPUTADO ESTADUAL,BETO CANGUSSU,LUIZ ROBERTO ALVES CANGUSSU,SUPLENTE,PT,SOMOS MAIS SÃO PAULO,3
OLÍMPIA,DEPUTADO ESTADUAL,LINEU NAVARRO,LUIZ ANTONIO NAVARRO MAGALHÃES LUZ,SUPLENTE,PT,SOMOS MAIS SÃO PAULO,30
OLÍMPIA,DEPUTADO ESTADUAL,CARLOS GRANA,CARLOS ALBERTO GRANA,ELEITO,PT,SOMOS MAIS SÃO PAULO,2
OLÍMPIA,DEPUTADO ESTADUAL,ELISEU COSTA,ELISEU SILVA COSTA,SUPLENTE,PT,SOMOS MAIS SÃO PAULO,2
OLÍMPIA,DEPUTADO ESTADUAL,MIRIAN SILVA,MIRIAN MARIA SILVA GOTTZENT,SUPLENTE,PT,SOMOS MAIS SÃO PAULO,1
OLÍMPIA,DEPUTADO ESTADUAL,TITO,FRANCISCO DE ASSIS PEREIRA DE CAMPOS,SUPLENTE,PT,SOMOS MAIS SÃO PAULO,4
OLÍMPIA,DEPUTADO ESTADUAL,GILSON PELIZARO,GILSON DONIZETE PELIZARO,SUPLENTE,PT,SOMOS MAIS SÃO PAULO,2
OLÍMPIA,DEPUTADO ESTADUAL,PROFESSOR HERCULANO,JOSÉ HERCULANO DA SILVA,SUPLENTE,PT,SOMOS MAIS SÃO PAULO,1
OLÍMPIA,DEPUTADO ESTADUAL,DONISETE BRAGA,DONISETE PEREIRA BRAGA,ELEITO,PT,SOMOS MAIS SÃO PAULO,2
OLÍMPIA,DEPUTADO ESTADUAL,CARLOS NEDER,CARLOS ALBERTO PLETZ NEDER,SUPLENTE,PT,SOMOS MAIS SÃO PAULO,1
OLÍMPIA,DEPUTADO ESTADUAL,LÉO ÁQUILLA,JADSON MENDES DE LIMA,SUPLENTE,PTB,PARTIDO TRABALHISTA BRASILEIRO,31
OLÍMPIA,DEPUTADO ESTADUAL,CONTE LOPES,ROBERVAL CONTE LOPES LIMA,SUPLENTE,PTB,PARTIDO TRABALHISTA BRASILEIRO,17
OLÍMPIA,DEPUTADO ESTADUAL,CAMPOS MACHADO,ANTONIO CARLOS DE CAMPOS MACHADO,ELEITO,PTB,PARTIDO TRABALHISTA BRASILEIRO,189
OLÍMPIA,DEPUTADO ESTADUAL,VANDO,ORVANDO DA SILVA,SUPLENTE,PTB,PARTIDO TRABALHISTA BRASILEIRO,2
OLÍMPIA,DEPUTADO ESTADUAL,ROQUE BARBIERE - ROQUINHO,ROQUE BARBIERE,ELEITO,PTB,PARTIDO TRABALHISTA BRASILEIRO,8
OLÍMPIA,DEPUTADO ESTADUAL,MOISES DA FUNERARIA,MOISES ANTONIO DE LIMA,SUPLENTE,PTB,PARTIDO TRABALHISTA BRASILEIRO,1
OLÍMPIA,DEPUTADO ESTADUAL,CORONEL EDSON FERRARINI,EDSON FERRARINI,ELEITO,PTB,PARTIDO TRABALHISTA BRASILEIRO,19
OLÍMPIA,DEPUTADO ESTADUAL,DR ANTONIO KHOURI,ANTONIO JOSE SADER KHOURI,SUPLENTE,PTB,PARTIDO TRABALHISTA BRASILEIRO,4
OLÍMPIA,DEPUTADO ESTADUAL,GERSINHO ROMERO,GERSON MOREIRA ROMERO,SUPLENTE,PTB,PARTIDO TRABALHISTA BRASILEIRO,1
OLÍMPIA,DEPUTADO ESTADUAL,PROFESSORA ALBA LUCENA,ALBA LUCENA FERNANDES GANDIA,SUPLENTE,PTB,PARTIDO TRABALHISTA BRASILEIRO,1
OLÍMPIA,DEPUTADO ESTADUAL,WALDIR AGNELLO,WALDIR AGNELLO,SUPLENTE,PTB,PARTIDO TRABALHISTA BRASILEIRO,89
OLÍMPIA,DEPUTADO ESTADUAL,AMELITO FIDELIS,AMELITO FIDELIS DOS SANTOS,SUPLENTE,PTB,PARTIDO TRABALHISTA BRASILEIRO,3
OLÍMPIA,DEPUTADO ESTADUAL,PALHACO PIROLETA,WILSON ARAUJO DE FARIA,SUPLENTE,PTB,PARTIDO TRABALHISTA BRASILEIRO,1
OLÍMPIA,DEPUTADO ESTADUAL,BALEIA ROSSI,LUIZ FELIPE BALEIA TENUTO ROSSI,ELEITO,PMDB,PARTIDO DO MOVIMENTO DEMOCRÁTICO BRASILEIRO,14
OLÍMPIA,DEPUTADO ESTADUAL,DRA ADRIANA,ADRIANA DI NARDO SILVA,SUPLENTE,PMDB,PARTIDO DO MOVIMENTO DEMOCRÁTICO BRASILEIRO,3
OLÍMPIA,DEPUTADO ESTADUAL,REGINALDO NUNES,REGINALDO NUNES BEZERRA,SUPLENTE,PMDB,PARTIDO DO MOVIMENTO DEMOCRÁTICO BRASILEIRO,3
OLÍMPIA,DEPUTADO ESTADUAL,BEBETTO,ALBERTO FELIPPE HADDAD FILHO,SUPLENTE,PMDB,PARTIDO DO MOVIMENTO DEMOCRÁTICO BRASILEIRO,7
OLÍMPIA,DEPUTADO ESTADUAL,THIAGO FERRARI,THIAGO DE MORAES FERRARI,SUPLENTE,PMDB,PARTIDO DO MOVIMENTO DEMOCRÁTICO BRASILEIRO,23
OLÍMPIA,DEPUTADO ESTADUAL,DR. ITAMAR,ITAMAR COPPIO,SUPLENTE,PMDB,PARTIDO DO MOVIMENTO DEMOCRÁTICO BRASILEIRO,2
OLÍMPIA,DEPUTADO ESTADUAL,IBRAIM,IBRAIM ANTONIO ABOU JOKH,SUPLENTE,PMDB,PARTIDO DO MOVIMENTO DEMOCRÁTICO BRASILEIRO,1
OLÍMPIA,DEPUTADO ESTADUAL,CARUSO,JORGE LUIS CARUSO,ELEITO,PMDB,PARTIDO DO MOVIMENTO DEMOCRÁTICO BRASILEIRO,4
OLÍMPIA,DEPUTADO ESTADUAL,FABIO BELLO,FABIO BELLO DE OLIVEIRA,SUPLENTE,PMDB,PARTIDO DO MOVIMENTO DEMOCRÁTICO BRASILEIRO,1
OLÍMPIA,DEPUTADO ESTADUAL,SERGIO BERGAMASCO,ANTONIO SERGIO PIRES BERGAMASCO,SUPLENTE,PMDB,PARTIDO DO MOVIMENTO DEMOCRÁTICO BRASILEIRO,4
OLÍMPIA,DEPUTADO ESTADUAL,MARQUINHOS SKALA,MARCOS DA SILVA MARQUES,SUPLENTE,PMDB,PARTIDO DO MOVIMENTO DEMOCRÁTICO BRASILEIRO,5
OLÍMPIA,DEPUTADO ESTADUAL,VANESSA DAMO,VANESSA DAMO OROSCO,ELEITO,PMDB,PARTIDO DO MOVIMENTO DEMOCRÁTICO BRASILEIRO,1240
OLÍMPIA,DEPUTADO ESTADUAL,CHICO DA ADEGA,FRANCISCO PEREIRA GOMES,SUPLENTE,PMDB,PARTIDO DO MOVIMENTO DEMOCRÁTICO BRASILEIRO,6
OLÍMPIA,DEPUTADO ESTADUAL,PROF. CANDIDO,CANDIDO GARCIA ALONSO,SUPLENTE,PMDB,PARTIDO DO MOVIMENTO DEMOCRÁTICO BRASILEIRO,2
OLÍMPIA,DEPUTADO ESTADUAL,CAMARGO,DOMINGOS FERREIRA DE CAMARGO,SUPLENTE,PMDB,PARTIDO DO MOVIMENTO DEMOCRÁTICO BRASILEIRO,6
OLÍMPIA,DEPUTADO ESTADUAL,VALDOMIRO,VALDOMIRO FRANCISCO DE OLIVEIRA,SUPLENTE,PMDB,PARTIDO DO MOVIMENTO DEMOCRÁTICO BRASILEIRO,28
OLÍMPIA,DEPUTADO ESTADUAL,UEBE REZECK,UEBE REZECK,SUPLENTE,PMDB,PARTIDO DO MOVIMENTO DEMOCRÁTICO BRASILEIRO,2544
OLÍMPIA,DEPUTADO ESTADUAL,DRA MARIA JOSÉ,MARIA JOSE DA SILVA BARBOSA,SUPLENTE,PMDB,PARTIDO DO MOVIMENTO DEMOCRÁTICO BRASILEIRO,1
OLÍMPIA,DEPUTADO ESTADUAL,HABIB,GEORGES HABIB JARROUGE,SUPLENTE,PMDB,PARTIDO DO MOVIMENTO DEMOCRÁTICO BRASILEIRO,1
OLÍMPIA,DEPUTADO ESTADUAL,HUBER GAMA,HUBER ARISTOTELES NOGUEIRA DA GAMA,SUPLENTE,PMDB,PARTIDO DO MOVIMENTO DEMOCRÁTICO BRASILEIRO,1
OLÍMPIA,DEPUTADO ESTADUAL,RICARDO VIEIRA,ANTONIO RICARDO VIEIRA MARTINES,SUPLENTE,PMDB,PARTIDO DO MOVIMENTO DEMOCRÁTICO BRASILEIRO,1
OLÍMPIA,DEPUTADO ESTADUAL,CHICÃO SERRA TALHADA,FRANCISCO BEZERRA DOS SANTOS,SUPLENTE,PMDB,PARTIDO DO MOVIMENTO DEMOCRÁTICO BRASILEIRO,1
OLÍMPIA,DEPUTADO ESTADUAL,ITAMAR BORGES,ITAMAR FRANCISCO MACHADO BORGES,MÉDIA,PMDB,PARTIDO DO MOVIMENTO DEMOCRÁTICO BRASILEIRO,2896
OLÍMPIA,DEPUTADO ESTADUAL,DITINHO MATHEUS,BENEDITO MATHEUS FILHO,SUPLENTE,PMDB,PARTIDO DO MOVIMENTO DEMOCRÁTICO BRASILEIRO,1
OLÍMPIA,DEPUTADO ESTADUAL,KINCAS DE OLIVEIRA,JOAQUIM DE OLIVEIRA,SUPLENTE,PMDB,PARTIDO DO MOVIMENTO DEMOCRÁTICO BRASILEIRO,1
OLÍMPIA,DEPUTADO ESTADUAL,MARIA DO CARMO GUILHERME,MARIA DO CARMO GUILHERME,SUPLENTE,PMDB,PARTIDO DO MOVIMENTO DEMOCRÁTICO BRASILEIRO,2
OLÍMPIA,DEPUTADO ESTADUAL,JOOJI HATO,JOOJI HATO,ELEITO,PMDB,PARTIDO DO MOVIMENTO DEMOCRÁTICO BRASILEIRO,7
OLÍMPIA,DEPUTADO ESTADUAL,TUNICO VIEIRA,ANTONIO JOSÉ VIEIRA JUNIOR,SUPLENTE,PMDB,PARTIDO DO MOVIMENTO DEMOCRÁTICO BRASILEIRO,1
OLÍMPIA,DEPUTADO ESTADUAL,DRA VIVI FERNANDES,VIVIANI FERNANDES DE OLIVEIRA,SUPLENTE,PMDB,PARTIDO DO MOVIMENTO DEMOCRÁTICO BRASILEIRO,1
OLÍMPIA,DEPUTADO ESTADUAL,PESTANA,WAGNER DE OLIVEIRA PESTANA,SUPLENTE,PMDB,PARTIDO DO MOVIMENTO DEMOCRÁTICO BRASILEIRO,1
OLÍMPIA,DEPUTADO ESTADUAL,ANA PAULA ROSSI,ANA PAULA ROSSI DE ALMEIDA MAGDESIAN,SUPLENTE,PMDB,PARTIDO DO MOVIMENTO DEMOCRÁTICO BRASILEIRO,1
OLÍMPIA,DEPUTADO ESTADUAL,MAURO INÁCIO,MAURO INÁCIO ALVES,SUPLENTE,PMDB,PARTIDO DO MOVIMENTO DEMOCRÁTICO BRASILEIRO,1
OLÍMPIA,DEPUTADO ESTADUAL,OLIVEIRA JUNIOR,ELIO APARECIDO DE OLIVEIRA,SUPLENTE,PSC,HUMANISTA CRISTÃO ,3
OLÍMPIA,DEPUTADO ESTADUAL,CELSO NASCIMENTO,CELSO BRAZ DO NASCIMENTO,SUPLENTE,PSC,HUMANISTA CRISTÃO ,55
OLÍMPIA,DEPUTADO ESTADUAL,APOSTOLO EURIPEDES,EURIPEDES LUIZ DE SOUSA,SUPLENTE,PSC,HUMANISTA CRISTÃO ,4
OLÍMPIA,DEPUTADO ESTADUAL,DR. CALE,CARLOS EDUARDO ANTUNES DE OLIVEIRA,SUPLENTE,PSC,HUMANISTA CRISTÃO ,1
OLÍMPIA,DEPUTADO ESTADUAL,LELIS TRAJANO,LELIS JOSE TRAJANO,SUPLENTE,PSC,HUMANISTA CRISTÃO ,2
OLÍMPIA,DEPUTADO ESTADUAL,PASTOR VIEIRA ROCHA,JOSE VIEIRA ROCHA,SUPLENTE,PSC,HUMANISTA CRISTÃO ,40
OLÍMPIA,DEPUTADO ESTADUAL,JAIMINHO,JAIME DONIZETE PEREIRA,SUPLENTE,PSC,HUMANISTA CRISTÃO ,1
OLÍMPIA,DEPUTADO ESTADUAL,SUPER NANY DE JESUS,GISLENE DIAS DE JESUS,SUPLENTE,PSC,HUMANISTA CRISTÃO ,1
OLÍMPIA,DEPUTADO ESTADUAL,LUIZ LAURO,LUIZ LAURO FERREIRA,SUPLENTE,PSC,HUMANISTA CRISTÃO ,1
OLÍMPIA,DEPUTADO ESTADUAL,ADILSON ROSSI,ADILSON ROSSI,ELEITO,PSC,HUMANISTA CRISTÃO ,2
OLÍMPIA,DEPUTADO ESTADUAL,RENATO PUPO,RENATO PUPO DE PAULA,SUPLENTE,PSC,HUMANISTA CRISTÃO ,437
OLÍMPIA,DEPUTADO ESTADUAL,JOÃO BINATO,JOÃO ANTONIO BINATO,SUPLENTE,PSC,HUMANISTA CRISTÃO ,24
OLÍMPIA,DEPUTADO ESTADUAL,PAULO CHOCOLATE,PAULO SERGIO VIEIRA NEVES,SUPLENTE,PSC,HUMANISTA CRISTÃO ,1
OLÍMPIA,DEPUTADO ESTADUAL,CANDIDO,JOELSON CANDIDO DE OLIVEIRA,SUPLENTE,PSC,HUMANISTA CRISTÃO ,1
OLÍMPIA,DEPUTADO ESTADUAL,GUSTAVO POZZI,GUSTAVO CAETANO POZZI DA CUNHA,SUPLENTE,PSC,HUMANISTA CRISTÃO ,5
OLÍMPIA,DEPUTADO ESTADUAL,SAID MOURAD,AHMAD SAID MOURAD,SUPLENTE,PSC,HUMANISTA CRISTÃO ,1
OLÍMPIA,DEPUTADO ESTADUAL,RODRIGO MORAES,RODRIGO AUGUSTO MORAES,ELEITO,PSC,HUMANISTA CRISTÃO ,105
OLÍMPIA,DEPUTADO ESTADUAL,MARCOS NEVES,MARCO AURELIO DOS SANTOS NEVES,ELEITO,PSC,HUMANISTA CRISTÃO ,502
OLÍMPIA,DEPUTADO ESTADUAL,BRAZ PASSARINHEIRO,BRAZ ANASTACIO DA SILVA,SUPLENTE,PSC,HUMANISTA CRISTÃO ,1
OLÍMPIA,DEPUTADO ESTADUAL,WALTER GOMES,WALTER GOMES DE OLIVEIRA,SUPLENTE,PR,SOMOS MAIS SÃO PAULO,11
OLÍMPIA,DEPUTADO ESTADUAL,PAULO CORREA,PAULO HENRIQUE CORREA,SUPLENTE,PR,SOMOS MAIS SÃO PAULO,40
OLÍMPIA,DEPUTADO ESTADUAL,JOSUE ROBERTO,JOSUE ROBERTO DA SILVA,SUPLENTE,PR,SOMOS MAIS SÃO PAULO,1
OLÍMPIA,DEPUTADO ESTADUAL,ZE PEDRO,JOSE PEDRO LEITE DA SILVA,SUPLENTE,PR,SOMOS MAIS SÃO PAULO,21
OLÍMPIA,DEPUTADO ESTADUAL,ALEXANDRE DA FARMACIA,ALEXANDRE JOSE DA CUNHA,SUPLENTE,PR,SOMOS MAIS SÃO PAULO,3
OLÍMPIA,DEPUTADO ESTADUAL,PATRICIA LIMA,PATRICIA FREITAS LIMA,SUPLENTE,PR,SOMOS MAIS SÃO PAULO,20
OLÍMPIA,DEPUTADO ESTADUAL,ROY NELSON,ROY NELSON PINTO,SUPLENTE,PR,SOMOS MAIS SÃO PAULO,1
OLÍMPIA,DEPUTADO ESTADUAL,OSVALDO VERGINIO,OSVALDO VERGINIO DA SILVA,SUPLENTE,PR,SOMOS MAIS SÃO PAULO,1
OLÍMPIA,DEPUTADO ESTADUAL,JOSE JANTALIA,JOSE ANTONIO JANTALIA,SUPLENTE,PR,SOMOS MAIS SÃO PAULO,6
OLÍMPIA,DEPUTADO ESTADUAL,ANDRE DO PRADO,ANDRE LUIS DO PRADO,ELEITO,PR,SOMOS MAIS SÃO PAULO,949
OLÍMPIA,DEPUTADO ESTADUAL,EDUARDO REZEK,EDUARDO PEDROSO REZEK,SUPLENTE,PPS,PARTIDO POPULAR SOCIALISTA,2
OLÍMPIA,DEPUTADO ESTADUAL,JOSE CARLOS SOARES,JOSE CARLOS SOARES,SUPLENTE,PPS,PARTIDO POPULAR SOCIALISTA,6
OLÍMPIA,DEPUTADO ESTADUAL,BRAZ,BRAZ ANTUNES MATTOS NETO,SUPLENTE,PPS,PARTIDO POPULAR SOCIALISTA,13
OLÍMPIA,DEPUTADO ESTADUAL,LIVALDO CAMPANA,LIVALDO CAMPANA,SUPLENTE,PPS,PARTIDO POPULAR SOCIALISTA,2
OLÍMPIA,DEPUTADO ESTADUAL,ADEMIR DA GUIA,ADEMIR DA GUIA,SUPLENTE,PPS,PARTIDO POPULAR SOCIALISTA,27
OLÍMPIA,DEPUTADO ESTADUAL,JOSE ANN,JOSE AN,SUPLENTE,PPS,PARTIDO POPULAR SOCIALISTA,1
OLÍMPIA,DEPUTADO ESTADUAL,DAVI ZAIA,DAVID ZAIA,MÉDIA,PPS,PARTIDO POPULAR SOCIALISTA,30
OLÍMPIA,DEPUTADO ESTADUAL,JOSE MESSINA,JOSE DE LORENZO MESSINA,SUPLENTE,PPS,PARTIDO POPULAR SOCIALISTA,1
OLÍMPIA,DEPUTADO ESTADUAL,MARCOS CHIEN,CHIEN CHIN HUEI,SUPLENTE,PPS,PARTIDO POPULAR SOCIALISTA,1
OLÍMPIA,DEPUTADO ESTADUAL,DR TEDESCHI,ETEVALDO VIANA TEDESCHI,SUPLENTE,PPS,PARTIDO POPULAR SOCIALISTA,1
OLÍMPIA,DEPUTADO ESTADUAL,PALHACINHO PIMPAO,VAGNER LUIZ PIMPAO BERSA,SUPLENTE,PPS,PARTIDO POPULAR SOCIALISTA,1
OLÍMPIA,DEPUTADO ESTADUAL,JOAO OTAVIO BASTOS,JOAO OTAVIO BASTOS JUNQUEIRA,SUPLENTE,PPS,PARTIDO POPULAR SOCIALISTA,1
OLÍMPIA,DEPUTADO ESTADUAL,VITOR SAPIENZA,VITOR SAPIENZA,SUPLENTE,PPS,PARTIDO POPULAR SOCIALISTA,15
OLÍMPIA,DEPUTADO ESTADUAL,ALEX MANENTE,ALEX SPINELLI MANENTE,ELEITO,PPS,PARTIDO POPULAR SOCIALISTA,1
OLÍMPIA,DEPUTADO ESTADUAL,DIRCEU DALBEN,ANTONIO DIRCEU DALBEN,SUPLENTE,PPS,PARTIDO POPULAR SOCIALISTA,1
OLÍMPIA,DEPUTADO ESTADUAL,GONDIM,LUIZ CARLOS GONDIM TEIXEIRA,ELEITO,PPS,PARTIDO POPULAR SOCIALISTA,5
OLÍMPIA,DEPUTADO ESTADUAL,ESTEVÃO,STEVEN ERIKSEN BINNIE,SUPLENTE,PPS,PARTIDO POPULAR SOCIALISTA,344
OLÍMPIA,DEPUTADO ESTADUAL,ELIAS PRIMAVERA,ELIAS JOSE DE LIMA,SUPLENTE,PPS,PARTIDO POPULAR SOCIALISTA,1
OLÍMPIA,DEPUTADO ESTADUAL,PROFESSOR ZE MARIA,JOSE MARIA CANCELLIERO,SUPLENTE,PPS,PARTIDO POPULAR SOCIALISTA,165
OLÍMPIA,DEPUTADO ESTADUAL,JOSE CLAUDIO,JOSE CLAUDIO DE SOUZA,SUPLENTE,PPS,PARTIDO POPULAR SOCIALISTA,1
OLÍMPIA,DEPUTADO ESTADUAL,EURIPINHO ARTILHEIRO DO POVO,OLIMPIO JORGE NABEN,SUPLENTE,PPS,PARTIDO POPULAR SOCIALISTA,26
OLÍMPIA,DEPUTADO ESTADUAL,AZUAITE,AZUAITE MARTINS DE FRANÇA,SUPLENTE,PPS,PARTIDO POPULAR SOCIALISTA,7
OLÍMPIA,DEPUTADO ESTADUAL,ELZO SIGUETA,ELZO SIGUETA,SUPLENTE,PPS,PARTIDO POPULAR SOCIALISTA,4
OLÍMPIA,DEPUTADO ESTADUAL,SERGIO BOCALINI,SERGIO DOS SANTOS BOCALINI,SUPLENTE,PPS,PARTIDO POPULAR SOCIALISTA,4
OLÍMPIA,DEPUTADO ESTADUAL,KITO JUNQUEIRA,HERACLITO GOMES PIZANO,SUPLENTE,PPS,PARTIDO POPULAR SOCIALISTA,1
OLÍMPIA,DEPUTADO ESTADUAL,KIKO SAWAYA,JOAO FRANCISCO SAWAYA DE LIMA,SUPLENTE,PPS,PARTIDO POPULAR SOCIALISTA,1
OLÍMPIA,DEPUTADO ESTADUAL,DARIO SAADI,DARIO JORGE GIOLO SAADI,SUPLENTE,DEM,PSDB/DEM,5
OLÍMPIA,DEPUTADO ESTADUAL,ANDRE SOARES,ANDRE BEZERRA RIBEIRO SOARES,ELEITO,DEM,PSDB/DEM,125
OLÍMPIA,DEPUTADO ESTADUAL,GILSON DE SOUZA,GILSON DE SOUZA,ELEITO,DEM,PSDB/DEM,2
OLÍMPIA,DEPUTADO ESTADUAL,RICARDO MUTRAN,RICARDO JORGE MUTRAN,SUPLENTE,DEM,PSDB/DEM,1
OLÍMPIA,DEPUTADO ESTADUAL,EDMIR CHEDID,EDMIR JOSE ABI CHEDID,ELEITO,DEM,PSDB/DEM,211
OLÍMPIA,DEPUTADO ESTADUAL,ALDO DEMARCHI,JOSE ALDO DEMARCHI,ELEITO,DEM,PSDB/DEM,7
OLÍMPIA,DEPUTADO ESTADUAL,JOAO MELLAO NETO,JOAO MELLAO NETO,SUPLENTE,DEM,PSDB/DEM,17
OLÍMPIA,DEPUTADO ESTADUAL,FERNANDO LUCAS,LUIZ FERNANDO AMARAL LUCAS,SUPLENTE,DEM,PSDB/DEM,967
OLÍMPIA,DEPUTADO ESTADUAL,MACEDO BASTOS,CARLOS ALBERTO MACEDO BASTOS,SUPLENTE,DEM,PSDB/DEM,5
OLÍMPIA,DEPUTADO ESTADUAL,ESTEVAM GALVAO,ESTEVAM GALVAO DE OLIVEIRA,ELEITO,DEM,PSDB/DEM,158
OLÍMPIA,DEPUTADO ESTADUAL,RICARDO SALLES,RICARDO DE AQUINO SALLES,SUPLENTE,DEM,PSDB/DEM,18
OLÍMPIA,DEPUTADO ESTADUAL,MILTON LEITE FILHO,MILTON LEITE DA SILVA FILHO,ELEITO,DEM,PSDB/DEM,7
OLÍMPIA,DEPUTADO ESTADUAL,MILTON VIEIRA,MILTON VIEIRA PINTO,ELEITO,DEM,PSDB/DEM,7
OLÍMPIA,DEPUTADO ESTADUAL,ROBERTO CACCIARI,ROBERTO CACCIARI,SUPLENTE,DEM,PSDB/DEM,15
OLÍMPIA,DEPUTADO ESTADUAL,JOAO BARBOSA,JOAO BARBOSA DE CARVALHO,SUPLENTE,DEM,PSDB/DEM,1
OLÍMPIA,DEPUTADO ESTADUAL,JAIRO PINTO,JAIRO BALDERRAMA PINTO,SUPLENTE,DEM,PSDB/DEM,1
OLÍMPIA,DEPUTADO ESTADUAL,SALLES,RAIMUNDO TARASKEVICIUS SALES,SUPLENTE,DEM,PSDB/DEM,1
OLÍMPIA,DEPUTADO ESTADUAL,GIL ARANTES,GILBERTO MACEDO GIL ARANTES,ELEITO,DEM,PSDB/DEM,85
OLÍMPIA,DEPUTADO ESTADUAL,PROFESSORA VIVIAN PIN,VIVIAN LIGIA PIN,SUPLENTE,DEM,PSDB/DEM,1
OLÍMPIA,DEPUTADO ESTADUAL,LEANDRO DO KLB,LEANDRO FINATO SCORNAVACCA,SUPLENTE,DEM,PSDB/DEM,59
OLÍMPIA,DEPUTADO ESTADUAL,IVAN TESOURINHA STRINGHI,IVAN STRINGHI,SUPLENTE,DEM,PSDB/DEM,2
OLÍMPIA,DEPUTADO ESTADUAL,SARGENTO APARECIDO EX,JOSÉ APARECIDO FERREIRA,SUPLENTE,PHS,HUMANISTA CRISTÃO ,1
OLÍMPIA,DEPUTADO ESTADUAL,PAULO HADICH,PAULO CEZAR JUNQUEIRA HADICH,SUPLENTE,PSB,PARTIDO SOCIALISTA BRASILEIRO,1
OLÍMPIA,DEPUTADO ESTADUAL,NILTON CESAR,NILTON CESAR DOS SANTOS,SUPLENTE,PSB,PARTIDO SOCIALISTA BRASILEIRO,1
OLÍMPIA,DEPUTADO ESTADUAL,BOLÇONE,ORLANDO JOSE BOLÇONE,SUPLENTE,PSB,PARTIDO SOCIALISTA BRASILEIRO,65
OLÍMPIA,DEPUTADO ESTADUAL,DR. GENIVAL,GENIVAL FAUSTO DA SILVA,SUPLENTE,PSB,PARTIDO SOCIALISTA BRASILEIRO,3
OLÍMPIA,DEPUTADO ESTADUAL,ED THOMAS,EDSON TOMAZINI,ELEITO,PSB,PARTIDO SOCIALISTA BRASILEIRO,152
OLÍMPIA,DEPUTADO ESTADUAL,FAETI,LAFAIETE RAMOS DE NOVAES,SUPLENTE,PSB,PARTIDO SOCIALISTA BRASILEIRO,1
OLÍMPIA,DEPUTADO ESTADUAL,DR. ANTONIO COSTA,ANTONIO JOSÉ DA COSTA JÚNIOR,SUPLENTE,PSB,PARTIDO SOCIALISTA BRASILEIRO,1
OLÍMPIA,DEPUTADO ESTADUAL,DR. OSMAR FERES,OSMAR FERES,SUPLENTE,PSB,PARTIDO SOCIALISTA BRASILEIRO,4
OLÍMPIA,DEPUTADO ESTADUAL,SARGENTO OHNO,NELSON MASSOMI OHNO,SUPLENTE,PSB,PARTIDO SOCIALISTA BRASILEIRO,12
OLÍMPIA,DEPUTADO ESTADUAL,HILKIAS,HILKIAS DE OLIVEIRA,SUPLENTE,PSB,PARTIDO SOCIALISTA BRASILEIRO,2
OLÍMPIA,DEPUTADO ESTADUAL,FRANCÉ JUNIOR,ANTONIO FRANCÉ JUNIOR,SUPLENTE,PSB,PARTIDO SOCIALISTA BRASILEIRO,10
OLÍMPIA,DEPUTADO ESTADUAL,DR. JOSÉ RICARDO,JOSÉ RICARDO DIAS,SUPLENTE,PSB,PARTIDO SOCIALISTA BRASILEIRO,35
OLÍMPIA,DEPUTADO ESTADUAL,LUCIANO BATISTA,LUCIANO BATISTA,ELEITO,PSB,PARTIDO SOCIALISTA BRASILEIRO,1
OLÍMPIA,DEPUTADO ESTADUAL,DR. JULIANO PRANDI,JULIANO CARMINE PRANDI,SUPLENTE,PSB,PARTIDO SOCIALISTA BRASILEIRO,6
