CARAPICUÍBA,DEPUTADO ESTADUAL,DR RUBENS,RUBENS YOSHIDA,SUPLENTE,PSDB,PSDB/DEM,4
CARAPICUÍBA,DEPUTADO ESTADUAL,CLÁUDIO FURQUIM,CLÁUDIO SIMÕES FURQUIM LEITE JÚNIOR,SUPLENTE,PSDB,PSDB/DEM,7
CARAPICUÍBA,DEPUTADO ESTADUAL,SONIA IERVOLINO,SONIA ANTONIA CARDAMONE IERVOLINO DE OLIVEIRA,SUPLENTE,PSDB,PSDB/DEM,9
CARAPICUÍBA,DEPUTADO ESTADUAL,IRMÃO SILAS,SILAS SANTOS SILVA,SUPLENTE,PSOL,PARTIDO SOCIALISMO E LIBERDADE,1
CARAPICUÍBA,DEPUTADO ESTADUAL,BIULA,LUIZ MULLER SOUZA FARIA,SUPLENTE,PSOL,PARTIDO SOCIALISMO E LIBERDADE,3
CARAPICUÍBA,DEPUTADO ESTADUAL,LUIZINHO DA FAVELA,LUIZ JOÃO DE SOUZA,SUPLENTE,PSOL,PARTIDO SOCIALISMO E LIBERDADE,1
CARAPICUÍBA,DEPUTADO ESTADUAL,MARCOS ANTÔNIO DA GATUSA,MARCOS ANTÔNIO COUTINHO DA SILVA,SUPLENTE,PSOL,PARTIDO SOCIALISMO E LIBERDADE,1
CARAPICUÍBA,DEPUTADO ESTADUAL,ANDERSON POSTIGO,ANDERSON APARECIDO POSTIGO,SUPLENTE,PSOL,PARTIDO SOCIALISMO E LIBERDADE,2
CARAPICUÍBA,DEPUTADO ESTADUAL,FELIPPÃO,ALOÊ FERNANDES FELIPPE,SUPLENTE,PSOL,PARTIDO SOCIALISMO E LIBERDADE,3
CARAPICUÍBA,DEPUTADO ESTADUAL,JOSÉ MENEZES,JOSÉ DA SILVA MENEZES,SUPLENTE,PSOL,PARTIDO SOCIALISMO E LIBERDADE,1
CARAPICUÍBA,DEPUTADO ESTADUAL,PROFESSOR ALTAIR,ALTAIR LOURENÇO DE LIMA,SUPLENTE,PSOL,PARTIDO SOCIALISMO E LIBERDADE,1
CARAPICUÍBA,DEPUTADO ESTADUAL,ANA CAROLINA CORREIA,ANA CAROLINA CORREIA,SUPLENTE,PSOL,PARTIDO SOCIALISMO E LIBERDADE,3
CARAPICUÍBA,DEPUTADO ESTADUAL,PROF. ISMAEL DANTAS,ISMAEL DANTAS DE AMORIM FILHO,SUPLENTE,PSOL,PARTIDO SOCIALISMO E LIBERDADE,1
CARAPICUÍBA,DEPUTADO ESTADUAL,PROF. SANDRO NUNES,SANDRO APARECIDO NUNES,SUPLENTE,PSOL,PARTIDO SOCIALISMO E LIBERDADE,59
CARAPICUÍBA,DEPUTADO ESTADUAL,JOEDSON VIGILANTE,JOEDSON FERREIRA DA SILVA,SUPLENTE,PSOL,PARTIDO SOCIALISMO E LIBERDADE,2
CARAPICUÍBA,DEPUTADO ESTADUAL,MARCOS EBOE,MARCOS DOS SANTOS,SUPLENTE,PSOL,PARTIDO SOCIALISMO E LIBERDADE,3
CARAPICUÍBA,DEPUTADO ESTADUAL,ADEMILSON MARCENEIRO,ADEMILSOM MIGUEL FERNANDES,SUPLENTE,PSOL,PARTIDO SOCIALISMO E LIBERDADE,6
CARAPICUÍBA,DEPUTADO ESTADUAL,JADIS É VERDADE,JADISON RODRIGUES DE OLIVEIRA,SUPLENTE,PSOL,PARTIDO SOCIALISMO E LIBERDADE,12
CARAPICUÍBA,DEPUTADO ESTADUAL,ALEXANDRE CASTILHO,ALEXANDRE BREVIGLIERI ALVES CASTILHO,SUPLENTE,PSOL,PARTIDO SOCIALISMO E LIBERDADE,69
CARAPICUÍBA,DEPUTADO ESTADUAL,IVAN MARTINS,IVAN LIERTE MARTINS,SUPLENTE,PSOL,PARTIDO SOCIALISMO E LIBERDADE,3
CARAPICUÍBA,DEPUTADO ESTADUAL,GILCELI LIMA,GILCELI LEITE LIMA,SUPLENTE,PSOL,PARTIDO SOCIALISMO E LIBERDADE,1
CARAPICUÍBA,DEPUTADO ESTADUAL,JOÃO AMORIM,JOÃO MIGUEL DE AMORIM,SUPLENTE,PSOL,PARTIDO SOCIALISMO E LIBERDADE,2
CARAPICUÍBA,DEPUTADO ESTADUAL,LAIRTON SANTOS,LAIRTON LUIS DOS SANTOS,SUPLENTE,PSOL,PARTIDO SOCIALISMO E LIBERDADE,1
CARAPICUÍBA,DEPUTADO ESTADUAL,DR. MARCELO ROZATTI,MARCELO ROZATTI,SUPLENTE,PSOL,PARTIDO SOCIALISMO E LIBERDADE,1
CARAPICUÍBA,DEPUTADO ESTADUAL,RAUL MARCELO,RAUL MARCELO DE SOUZA,SUPLENTE,PSOL,PARTIDO SOCIALISMO E LIBERDADE,64
CARAPICUÍBA,DEPUTADO ESTADUAL,RODRIGO GONÇALVEZ,RODRIGO GONÇALVES,SUPLENTE,PSOL,PARTIDO SOCIALISMO E LIBERDADE,1
CARAPICUÍBA,DEPUTADO ESTADUAL,HORÁCIO NETO,HORACIO RAINERI NETO,SUPLENTE,PSOL,PARTIDO SOCIALISMO E LIBERDADE,2
CARAPICUÍBA,DEPUTADO ESTADUAL,EDUARDO AMARAL,EDUARDO GARCIA CARVALHO DO AMARAL,SUPLENTE,PSOL,PARTIDO SOCIALISMO E LIBERDADE,3
CARAPICUÍBA,DEPUTADO ESTADUAL,BONFIM,ANTONIO BONFIM MOREIRA,SUPLENTE,PSOL,PARTIDO SOCIALISMO E LIBERDADE,2
CARAPICUÍBA,DEPUTADO ESTADUAL,ALBERTO TICIANELLI,ALBERTO TICIANELLI,SUPLENTE,PSOL,PARTIDO SOCIALISMO E LIBERDADE,2
CARAPICUÍBA,DEPUTADO ESTADUAL,GUIMARÃES O GUERREIRO,HERALDO LOPES GUIMARÃES,SUPLENTE,PSOL,PARTIDO SOCIALISMO E LIBERDADE,20
CARAPICUÍBA,DEPUTADO ESTADUAL,CARLOS GIANNAZI,CARLOS ALBERTO GIANNASI,ELEITO,PSOL,PARTIDO SOCIALISMO E LIBERDADE,131
CARAPICUÍBA,DEPUTADO ESTADUAL,AGOSTINHO GOMES,AGOSTINHO FERREIRA GOMES,SUPLENTE,PSOL,PARTIDO SOCIALISMO E LIBERDADE,2
CARAPICUÍBA,DEPUTADO ESTADUAL,WANDER,WANDER DE OLIVEIRA VILLALBA,SUPLENTE,PC DO B,PARTIDO COMUNISTA DO BRASIL,5
CARAPICUÍBA,DEPUTADO ESTADUAL,JOSELITO,JOSELITO DE SOUSA LIMA,SUPLENTE,PC DO B,PARTIDO COMUNISTA DO BRASIL,21
CARAPICUÍBA,DEPUTADO ESTADUAL,PAULINHO MOREBEM,PAULO SILVA OLIVEIRA,SUPLENTE,PC DO B,PARTIDO COMUNISTA DO BRASIL,1
CARAPICUÍBA,DEPUTADO ESTADUAL,ELIAS MASCENA,ELIAS GOMES MASCENA,SUPLENTE,PC DO B,PARTIDO COMUNISTA DO BRASIL,2
CARAPICUÍBA,DEPUTADO ESTADUAL,ERLEI ALIADO,ERLEI ROBERTO DE MELO,SUPLENTE,PC DO B,PARTIDO COMUNISTA DO BRASIL,7
CARAPICUÍBA,DEPUTADO ESTADUAL,LUIZA CORDEIRO,LUIZA CORDEIRO DA SILVA,SUPLENTE,PC DO B,PARTIDO COMUNISTA DO BRASIL,4
CARAPICUÍBA,DEPUTADO ESTADUAL,LECI BRANDÃO,LECI BRANDAO DA SILVA,ELEITO,PC DO B,PARTIDO COMUNISTA DO BRASIL,715
CARAPICUÍBA,DEPUTADO ESTADUAL,SIDNEY,SIDNEY LIBERTI,SUPLENTE,PC DO B,PARTIDO COMUNISTA DO BRASIL,1
CARAPICUÍBA,DEPUTADO ESTADUAL,SARAH MUNHOZ,SARAH MUNHOZ,SUPLENTE,PC DO B,PARTIDO COMUNISTA DO BRASIL,37
CARAPICUÍBA,DEPUTADO ESTADUAL,MAURIN DA SORVETERIA,MAURIN ALVES RIBEIRO,SUPLENTE,PC DO B,PARTIDO COMUNISTA DO BRASIL,2
CARAPICUÍBA,DEPUTADO ESTADUAL,ADIB,ADIB ABDOUNI,SUPLENTE,PC DO B,PARTIDO COMUNISTA DO BRASIL,1
CARAPICUÍBA,DEPUTADO ESTADUAL,ALCIDES AMAZONAS,ALCIDES ARAUJO DOS SANTOS,SUPLENTE,PC DO B,PARTIDO COMUNISTA DO BRASIL,13
CARAPICUÍBA,DEPUTADO ESTADUAL,JACIRA COSTA,JACIRA COSTA SILVA,SUPLENTE,PC DO B,PARTIDO COMUNISTA DO BRASIL,28
CARAPICUÍBA,DEPUTADO ESTADUAL,PEDRO BIGARDI,PEDRO ANTONIO BIGARDI,ELEITO,PC DO B,PARTIDO COMUNISTA DO BRASIL,94
CARAPICUÍBA,DEPUTADO ESTADUAL,VICTOR BORGES,VICTOR IVO GERACINO DOS SANTOS BORGES,SUPLENTE,PC DO B,PARTIDO COMUNISTA DO BRASIL,1
CARAPICUÍBA,DEPUTADO ESTADUAL,DAVI RAMOS,DAVI GONÇALVES RAMOS,SUPLENTE,PC DO B,PARTIDO COMUNISTA DO BRASIL,1
CARAPICUÍBA,DEPUTADO ESTADUAL,PINA,MILTON PINA,SUPLENTE,PC DO B,PARTIDO COMUNISTA DO BRASIL,1
CARAPICUÍBA,DEPUTADO ESTADUAL,SAMUEL FERREIRA,SAMUEL SANTOS FERREIRA,SUPLENTE,PC DO B,PARTIDO COMUNISTA DO BRASIL,2
CARAPICUÍBA,DEPUTADO ESTADUAL,QUEIROZ,VALDOMIRO BENTO DE QUEIROZ,SUPLENTE,PC DO B,PARTIDO COMUNISTA DO BRASIL,32
CARAPICUÍBA,DEPUTADO ESTADUAL,BRENO FARIA DO KATINGUELÊ,BRENO APARECIDO FONSECA DE FARIA,SUPLENTE,PC DO B,PARTIDO COMUNISTA DO BRASIL,1
CARAPICUÍBA,DEPUTADO ESTADUAL,GABRIEL BITENCOURT,GABRIEL CESAR BITENCOURT,SUPLENTE,PC DO B,PARTIDO COMUNISTA DO BRASIL,3
CARAPICUÍBA,DEPUTADO ESTADUAL,EDU CAMARGO,CARLOS EDUARDO CAMARGO GÓES,SUPLENTE,PC DO B,PARTIDO COMUNISTA DO BRASIL,2
CARAPICUÍBA,DEPUTADO ESTADUAL,LAÉRCIO SOARES,LAERCIO PEREIRA SOARES,SUPLENTE,PC DO B,PARTIDO COMUNISTA DO BRASIL,2
CARAPICUÍBA,DEPUTADO ESTADUAL,CAJU,RICARDO ALVES DA SILVA,SUPLENTE,PC DO B,PARTIDO COMUNISTA DO BRASIL,7
CARAPICUÍBA,DEPUTADO ESTADUAL,PROFESSOR FLAVIO DELMANTO,FLAVIO DELMANTO,SUPLENTE,PC DO B,PARTIDO COMUNISTA DO BRASIL,17
CARAPICUÍBA,DEPUTADO ESTADUAL,GERCI MOREIRA,GERCI MOREIRA,SUPLENTE,PC DO B,PARTIDO COMUNISTA DO BRASIL,1
CARAPICUÍBA,DEPUTADO ESTADUAL,DR. GAVRANICH,ALEXANDRE GAVRANICH,SUPLENTE,PC DO B,PARTIDO COMUNISTA DO BRASIL,1
CARAPICUÍBA,DEPUTADO ESTADUAL,DITÃO DO CORREIO,BENEDITO GOMES DOS REIS,SUPLENTE,PC DO B,PARTIDO COMUNISTA DO BRASIL,1
CARAPICUÍBA,DEPUTADO ESTADUAL,MANOEL MARUYAMA,SEVERINO MANOEL MARUYAMA SANTOS,SUPLENTE,PC DO B,PARTIDO COMUNISTA DO BRASIL,1
CARAPICUÍBA,DEPUTADO ESTADUAL,TUNICO,ANTONIO CARLOS DE AZEVEDO,SUPLENTE,PC DO B,PARTIDO COMUNISTA DO BRASIL,11
CARAPICUÍBA,DEPUTADO ESTADUAL,ONOFRE GONÇALVES,ONOFRE GONÇALVES DE JESUS,SUPLENTE,PC DO B,PARTIDO COMUNISTA DO BRASIL,12
CARAPICUÍBA,DEPUTADO ESTADUAL,JOSÉ TOMAZ DE SUZANO,JOSÉ TOMAZ DE OLIVEIRA CARNEIRO,SUPLENTE,PC DO B,PARTIDO COMUNISTA DO BRASIL,6
CARAPICUÍBA,DEPUTADO ESTADUAL,ZÉ ROBERTO,JOSE ROBERTO SILVA DOS SANTOS,SUPLENTE,PC DO B,PARTIDO COMUNISTA DO BRASIL,44
CARAPICUÍBA,DEPUTADO ESTADUAL,BLACK,OSVALDO LUIZ MARCONDES CLEMENTE,SUPLENTE,PC DO B,PARTIDO COMUNISTA DO BRASIL,1
CARAPICUÍBA,DEPUTADO ESTADUAL,TAVARES,JOSÉ WALTER TAVARES,SUPLENTE,PC DO B,PARTIDO COMUNISTA DO BRASIL,2
CARAPICUÍBA,DEPUTADO ESTADUAL,JORJÃO,JORGE TAVARES QUINTAS,SUPLENTE,PC DO B,PARTIDO COMUNISTA DO BRASIL,1
CARAPICUÍBA,DEPUTADO ESTADUAL,CAVAZZANA DEOMAR,DEOMAR CAVAZZANA,SUPLENTE,PC DO B,PARTIDO COMUNISTA DO BRASIL,3
CARAPICUÍBA,DEPUTADO ESTADUAL,EDUARDO GONÇALVES,EDUARDO JOSÉ GONÇALVES,SUPLENTE,PC DO B,PARTIDO COMUNISTA DO BRASIL,1
CARAPICUÍBA,DEPUTADO ESTADUAL,HELIFAX,HELIFAX PINTO DE SOUZA,SUPLENTE,PC DO B,PARTIDO COMUNISTA DO BRASIL,153
CARAPICUÍBA,DEPUTADO ESTADUAL,WAGNER RODRIGUES,WAGNER DE SOUZA RODRIGUES,SUPLENTE,PC DO B,PARTIDO COMUNISTA DO BRASIL,1
CARAPICUÍBA,DEPUTADO ESTADUAL,DR. MURISSET,JOSE ROBERTO CARDOSO MURISSET,SUPLENTE,PC DO B,PARTIDO COMUNISTA DO BRASIL,1
CARAPICUÍBA,DEPUTADO ESTADUAL,DITO LEITE,SILVIO ROBERTO PACHECO,SUPLENTE,PC DO B,PARTIDO COMUNISTA DO BRASIL,1
CARAPICUÍBA,DEPUTADO ESTADUAL,FABIO LEITÃO,FABIO JOSE DOS SANTOS,SUPLENTE,PT DO B,SOMOS MAIS SÃO PAULO,17
CARAPICUÍBA,DEPUTADO ESTADUAL,SILVIA RUSSO,SILVIA DE ALMEIDA RUSSO,SUPLENTE,PT DO B,SOMOS MAIS SÃO PAULO,3
CARAPICUÍBA,DEPUTADO ESTADUAL,TONINHO CAMPANHA,ANTONIO LAURO CAMPANHA,SUPLENTE,PT DO B,SOMOS MAIS SÃO PAULO,4
CARAPICUÍBA,DEPUTADO ESTADUAL,MOISES PAPAI NOEL,MOISES FERREIRA DA SILVA,SUPLENTE,PT DO B,SOMOS MAIS SÃO PAULO,1
CARAPICUÍBA,DEPUTADO ESTADUAL,EVANDRO DE LIMA,EVANDRO DE LIMA,SUPLENTE,PT DO B,SOMOS MAIS SÃO PAULO,2
CARAPICUÍBA,DEPUTADO ESTADUAL,FABIO FLORENCIO,FABIO FLORENCIO DE JESUS,SUPLENTE,PT DO B,SOMOS MAIS SÃO PAULO,1
CARAPICUÍBA,DEPUTADO ESTADUAL,ROBERTO CAMARGO,JOSE ROBERTO FRANCO DE CAMARGO,SUPLENTE,PT DO B,SOMOS MAIS SÃO PAULO,4
CARAPICUÍBA,DEPUTADO ESTADUAL,GILVAN CORREIA,GILVAN CORREIA ALVES,SUPLENTE,PT DO B,SOMOS MAIS SÃO PAULO,7
CARAPICUÍBA,DEPUTADO ESTADUAL,JÔ COSTA,JOSEFA ALVES DA COSTA,SUPLENTE,PT DO B,SOMOS MAIS SÃO PAULO,1
CARAPICUÍBA,DEPUTADO ESTADUAL,PAULO CORRÊA JR,PAULO ALVES CORRÊA JUNIOR,SUPLENTE,PT DO B,SOMOS MAIS SÃO PAULO,12
CARAPICUÍBA,DEPUTADO ESTADUAL,MAYRA TELES,MAYRA MARA TELES DA COSTA,SUPLENTE,PT DO B,SOMOS MAIS SÃO PAULO,4
CARAPICUÍBA,PRESIDENTE,DILMA,DILMA VANA ROUSSEFF,2º TURNO,PT,PARA O BRASIL SEGUIR MUDANDO,66942
CARAPICUÍBA,PRESIDENTE,JOSÉ SERRA,JOSÉ SERRA,2º TURNO,PSDB,O BRASIL PODE MAIS,33400
CARAPICUÍBA,GOVERNADOR,GERALDO ALCKMIN,GERALDO JOSE RODRIGUES ALCKMIN FILHO,ELEITO,PSDB,UNIDOS POR SÃO PAULO,45761
CARAPICUÍBA,SENADOR,MARTA SUPLICY,MARTA SUPLICY,ELEITO,PT,UNIÃO PARA MUDAR,61706
CARAPICUÍBA,SENADOR,ALOYSIO NUNES,ALOYSIO NUNES FERREIRA FILHO,ELEITO,PSDB,UNIDOS POR SÃO PAULO,41067
CARAPICUÍBA,DEPUTADO FEDERAL,DR. ELIEZER COSTA,ELIEZER NASCIMENTO DA COSTA,SUPLENTE,PRB,JUNTOS POR SÃO PAULO,4
CARAPICUÍBA,DEPUTADO FEDERAL,CÉSAR CRUZ GARCIA,CESAR CRUZ GARCIA,SUPLENTE,PRB,JUNTOS POR SÃO PAULO,3
CARAPICUÍBA,DEPUTADO FEDERAL,ANTONIO BULHÕES,ANTONIO CARLOS MARTINS DE BULHÕES,ELEITO,PRB,JUNTOS POR SÃO PAULO,1801
CARAPICUÍBA,DEPUTADO FEDERAL,JOSÉ TEOFILO,JOSÉ TEOFILO ALVES CORREA DE OLIVEIRA,SUPLENTE,PRB,JUNTOS POR SÃO PAULO,2
CARAPICUÍBA,DEPUTADO FEDERAL,ALESSANDER VIGNA,ALESSANDER BARREIRA VIGNA,SUPLENTE,PRB,JUNTOS POR SÃO PAULO,71
CARAPICUÍBA,DEPUTADO FEDERAL,ELCIO AMANCIO,ELCIO AMÂNCIO,SUPLENTE,PRB,JUNTOS POR SÃO PAULO,2
CARAPICUÍBA,DEPUTADO FEDERAL,OTONIEL LIMA,OTONIEL CARLOS DE LIMA,MÉDIA,PRB,JUNTOS POR SÃO PAULO,32
CARAPICUÍBA,DEPUTADO FEDERAL,ROSANA STAR,PAULO CEZAR JOSE DE SOUZA LIMA,SUPLENTE,PRB,JUNTOS POR SÃO PAULO,7
CARAPICUÍBA,DEPUTADO FEDERAL,LUIZ SOARES,LUIZ SOARES TEIXEIRA,SUPLENTE,PRB,JUNTOS POR SÃO PAULO,126
CARAPICUÍBA,DEPUTADO FEDERAL,LUCAS ANTUNES,LUCAS ANTUNES,SUPLENTE,PRB,JUNTOS POR SÃO PAULO,1
CARAPICUÍBA,DEPUTADO FEDERAL,PROF. WATASE,SURAHARU WATASE,SUPLENTE,PRB,JUNTOS POR SÃO PAULO,2
CARAPICUÍBA,DEPUTADO FEDERAL,PROF. CHARLES,CHARLES MICHACHI CORRÊA,SUPLENTE,PRB,JUNTOS POR SÃO PAULO,4
CARAPICUÍBA,DEPUTADO FEDERAL,DURVAL MORELLI,DURVAL MORELLI NETO,SUPLENTE,PP,PARTIDO PROGRESSISTA,1
CARAPICUÍBA,DEPUTADO FEDERAL,JEFERSON CAMILLO,JEFERSON CAMILLO DE OLIVEIRA,SUPLENTE,PP,PARTIDO PROGRESSISTA,6
CARAPICUÍBA,DEPUTADO FEDERAL,TCEL JULIO LEMOS,JÚLIO FERNANDO PINHEIRO DE LEMOS,SUPLENTE,PP,PARTIDO PROGRESSISTA,2
CARAPICUÍBA,DEPUTADO FEDERAL,NATAL SOARES,NATALINO JOSE SOARES,SUPLENTE,PP,PARTIDO PROGRESSISTA,1
CARAPICUÍBA,DEPUTADO FEDERAL,MALUF,PAULO SALIM MALUF,ELEITO,PP,PARTIDO PROGRESSISTA,1144
CARAPICUÍBA,DEPUTADO FEDERAL,RUBENEUTON OLIVEIRA LIMA,RUBENEUTON OLIVEIRA LIMA,SUPLENTE,PP,PARTIDO PROGRESSISTA,2
CARAPICUÍBA,DEPUTADO FEDERAL,ANGINHO DOS TECLADOS,ANGELO MARINHO DE ALMEIDA,SUPLENTE,PP,PARTIDO PROGRESSISTA,3
CARAPICUÍBA,DEPUTADO FEDERAL,CARLOS OCTAVIANI,JOSÉ CARLOS OCTAVIANI,SUPLENTE,PP,PARTIDO PROGRESSISTA,2
CARAPICUÍBA,DEPUTADO FEDERAL,DRA CELIA MARIA,CELIA MARIA VIEIRA ALVES,SUPLENTE,PP,PARTIDO PROGRESSISTA,1
CARAPICUÍBA,DEPUTADO FEDERAL,SANAZAR,EDUARDO SANASSAR FONSECA,SUPLENTE,PP,PARTIDO PROGRESSISTA,16
CARAPICUÍBA,DEPUTADO FEDERAL,CAPITÃO GOMES,CARLOS GOMES DA SILVA,SUPLENTE,PP,PARTIDO PROGRESSISTA,7
CARAPICUÍBA,DEPUTADO FEDERAL,RENATO REICHANN,RUY RENATO REICHMANN,SUPLENTE,PP,PARTIDO PROGRESSISTA,2
CARAPICUÍBA,DEPUTADO FEDERAL,BATORÉ,IVANILDO GOMES NOGUEIRA,SUPLENTE,PP,PARTIDO PROGRESSISTA,9
CARAPICUÍBA,DEPUTADO FEDERAL,MANOEL MOREIRA,MANOEL MOREIRA DE ARAUJO FILHO,SUPLENTE,PP,PARTIDO PROGRESSISTA,5
CARAPICUÍBA,DEPUTADO FEDERAL,ADELINA ALCANTARA MACHADO,ADELINA PEREIRA DA SILVEIRA DE ALCANTARA MACHADO,SUPLENTE,PP,PARTIDO PROGRESSISTA,1
CARAPICUÍBA,DEPUTADO FEDERAL,LIBERATO DE VALENTIM GENTIL,LIBERATO ROCHA CALDEIRA,SUPLENTE,PP,PARTIDO PROGRESSISTA,4
CARAPICUÍBA,DEPUTADO FEDERAL,RENATO AMORIM,RENATO AMORIM NOGUEIRA,SUPLENTE,PP,PARTIDO PROGRESSISTA,1
CARAPICUÍBA,DEPUTADO FEDERAL,JOÃO FADEL,JOÃO JORGE FADEL FILHO,SUPLENTE,PP,PARTIDO PROGRESSISTA,12
CARAPICUÍBA,DEPUTADO FEDERAL,MAURICIO MARTINS,MAURICIO LUIS MARTINS,SUPLENTE,PP,PARTIDO PROGRESSISTA,10
CARAPICUÍBA,DEPUTADO FEDERAL,PEDRINHO BARACAT,ASSAD NACLE BARACAT,SUPLENTE,PP,PARTIDO PROGRESSISTA,19
CARAPICUÍBA,DEPUTADO FEDERAL,ALINE CORREA,ALINE LEMOS CORREA DE OLIVEIRA ANDRADE,ELEITO,PP,PARTIDO PROGRESSISTA,47
CARAPICUÍBA,DEPUTADO FEDERAL,ELIAS BITENCOURT,ELIAS DOS SANTOS BITENCOURT,SUPLENTE,PP,PARTIDO PROGRESSISTA,123
CARAPICUÍBA,DEPUTADO FEDERAL,PAULO BASSOLI,PAULO SERGIO BONGATER BASSOLI,SUPLENTE,PP,PARTIDO PROGRESSISTA,14
CARAPICUÍBA,DEPUTADO FEDERAL,PASTOR MARCOS MOTOLO,MARCOS CINTAS MOTOLO,SUPLENTE,PP,PARTIDO PROGRESSISTA,5
CARAPICUÍBA,DEPUTADO FEDERAL,CATARINA RIGINIK,CATARINA BEATRIZ GASPAROTTO RIGINIK,SUPLENTE,PP,PARTIDO PROGRESSISTA,5
CARAPICUÍBA,DEPUTADO FEDERAL,DRA ADRIANA DA COSTA,ADRIANA ALVARES DA COSTA DE PAULA ALVES,SUPLENTE,PP,PARTIDO PROGRESSISTA,9
CARAPICUÍBA,DEPUTADO FEDERAL,BETO MANSUR,PAULO ROBERTO GOMES MANSUR,ELEITO,PP,PARTIDO PROGRESSISTA,3
CARAPICUÍBA,DEPUTADO FEDERAL,ADHEMAR DE BARROS FILHO,ADHEMAR DE BARROS FILHO,SUPLENTE,PP,PARTIDO PROGRESSISTA,5
CARAPICUÍBA,DEPUTADO FEDERAL,LAYRTON INFANTE,LAYRTON INFANTE,SUPLENTE,PP,PARTIDO PROGRESSISTA,2
CARAPICUÍBA,DEPUTADO FEDERAL,MOURAD,MOHAMAD SAID MOURAD,SUPLENTE,PP,PARTIDO PROGRESSISTA,13
CARAPICUÍBA,DEPUTADO FEDERAL,CABO WILSON,WILSON DE OLIVEIRA MORAIS,SUPLENTE,PP,PARTIDO PROGRESSISTA,36
CARAPICUÍBA,DEPUTADO FEDERAL,MISSIONÁRIO JOSÉ OLIMPIO,JOSÉ OLIMPIO SILVEIRA MORAES,ELEITO,PP,PARTIDO PROGRESSISTA,885
CARAPICUÍBA,DEPUTADO FEDERAL,FERNANDO STANCATTI,FERNANDO CESAR STANCATTI MARQUES,SUPLENTE,PP,PARTIDO PROGRESSISTA,12
CARAPICUÍBA,DEPUTADO FEDERAL,PEDRINHO ISHIDA,PEDRO ISHIDA,SUPLENTE,PP,PARTIDO PROGRESSISTA,2
CARAPICUÍBA,DEPUTADO FEDERAL,TUCÃO,JULIO CESAR THEODORO,SUPLENTE,PP,PARTIDO PROGRESSISTA,3
CARAPICUÍBA,DEPUTADO FEDERAL,DR NECHAR,SERGIO ANTONIO NECHAR,SUPLENTE,PP,PARTIDO PROGRESSISTA,1
CARAPICUÍBA,DEPUTADO FEDERAL,DELEGADA GRACIELA,GRACIELA DE LOURDES DAVID AMBROSIO,SUPLENTE,PP,PARTIDO PROGRESSISTA,3
CARAPICUÍBA,DEPUTADO FEDERAL,EDSON REIS,EDSON WAGNER REIS,SUPLENTE,PP,PARTIDO PROGRESSISTA,6
CARAPICUÍBA,DEPUTADO FEDERAL,MARIO YAMASHITA,JOSÉ MARIO YAMASHITA,SUPLENTE,PP,PARTIDO PROGRESSISTA,1
CARAPICUÍBA,DEPUTADO FEDERAL,CARLÃO FELIPE,JOÃO CARLOS FELIPE,SUPLENTE,PP,PARTIDO PROGRESSISTA,3
CARAPICUÍBA,DEPUTADO FEDERAL,PRICILA MENIN,LETEIA PRICILA GOMES,SUPLENTE,PP,PARTIDO PROGRESSISTA,1
CARAPICUÍBA,DEPUTADO FEDERAL,JORGE WILSON,JORGE WILSON GONÇALVES DE MATTOS,SUPLENTE,PP,PARTIDO PROGRESSISTA,3
CARAPICUÍBA,DEPUTADO FEDERAL,DR LÉO KAHN,LEO JUVENAL KAHN DA SILVEIRA,SUPLENTE,PP,PARTIDO PROGRESSISTA,17
CARAPICUÍBA,DEPUTADO FEDERAL,MARCELO MARIANO,MARCELO RICARDO MARIANO,SUPLENTE,PP,PARTIDO PROGRESSISTA,6
CARAPICUÍBA,DEPUTADO FEDERAL,VADÃO,ETIVALDO VADAO GOMES,SUPLENTE,PP,PARTIDO PROGRESSISTA,35
CARAPICUÍBA,DEPUTADO FEDERAL,SARGENTO DARCY,DARCY RODRIGUES,SUPLENTE,PDT,PARTIDO DEMOCRÁTICO TRABALHISTA,6
CARAPICUÍBA,DEPUTADO FEDERAL,CARLITO VIANA,CARLITO VIANA SOARES,SUPLENTE,PDT,PARTIDO DEMOCRÁTICO TRABALHISTA,7
CARAPICUÍBA,DEPUTADO FEDERAL,NHA NHA,VALTER BERGAMINI,SUPLENTE,PDT,PARTIDO DEMOCRÁTICO TRABALHISTA,19
CARAPICUÍBA,DEPUTADO FEDERAL,DR MARIO,MARIO AUGUSTO SANTOS TEIXEIRA,SUPLENTE,PDT,PARTIDO DEMOCRÁTICO TRABALHISTA,6
CARAPICUÍBA,DEPUTADO FEDERAL,ERLON CHAVES,ERLON CHAVES DE CASTRO,SUPLENTE,PDT,PARTIDO DEMOCRÁTICO TRABALHISTA,2
CARAPICUÍBA,DEPUTADO FEDERAL,JOÃO DADO,JOÃO EDUARDO DADO LEITE DE CARVALHO,ELEITO,PDT,PARTIDO DEMOCRÁTICO TRABALHISTA,33
CARAPICUÍBA,DEPUTADO FEDERAL,PAULINHO DA FORÇA,PAULO PEREIRA DA SILVA,ELEITO,PDT,PARTIDO DEMOCRÁTICO TRABALHISTA,2247
CARAPICUÍBA,DEPUTADO FEDERAL,ELISEU DANIEL,ELISEU DANIEL DOS SANTOS,SUPLENTE,PDT,PARTIDO DEMOCRÁTICO TRABALHISTA,17
CARAPICUÍBA,DEPUTADO FEDERAL,GUSTAVO STUPP,LUIZ GUSTAVO ANTUNES STUPP,SUPLENTE,PDT,PARTIDO DEMOCRÁTICO TRABALHISTA,7
CARAPICUÍBA,DEPUTADO FEDERAL,ARMANDO HENRIQUE,ARMANDO HENRIQUE,SUPLENTE,PDT,PARTIDO DEMOCRÁTICO TRABALHISTA,15
CARAPICUÍBA,DEPUTADO FEDERAL,MARTAN,MARCELO MARTIN,SUPLENTE,PDT,PARTIDO DEMOCRÁTICO TRABALHISTA,4
CARAPICUÍBA,DEPUTADO FEDERAL,BOAVENTURA,BOAVENTURA PEREIRA SANTOS,SUPLENTE,PDT,PARTIDO DEMOCRÁTICO TRABALHISTA,17
CARAPICUÍBA,DEPUTADO FEDERAL,KAREN HEINS,KAREN MAYELLEN TONIM HEINS,SUPLENTE,PDT,PARTIDO DEMOCRÁTICO TRABALHISTA,1
CARAPICUÍBA,DEPUTADO FEDERAL,PEDRO BAPTISTINI,PEDRO ANTONIO BAPTISTINI,SUPLENTE,PDT,PARTIDO DEMOCRÁTICO TRABALHISTA,8
CARAPICUÍBA,DEPUTADO FEDERAL,SAULO GOES,SAULO GOES DE ALBUQUERQUE,SUPLENTE,PDT,PARTIDO DEMOCRÁTICO TRABALHISTA,271
CARAPICUÍBA,DEPUTADO FEDERAL,MEDEIROS,LUIZ ANTONIO DE MEDEIROS NETO,SUPLENTE,PDT,PARTIDO DEMOCRÁTICO TRABALHISTA,221
CARAPICUÍBA,DEPUTADO FEDERAL,GILBERTO BENZI,GILBERTO BENZI,SUPLENTE,PDT,PARTIDO DEMOCRÁTICO TRABALHISTA,5
CARAPICUÍBA,DEPUTADO FEDERAL,EDUARDO NASCIMENTO,EDUARDO DUARTE DO NASCIMENTO,SUPLENTE,PDT,PARTIDO DEMOCRÁTICO TRABALHISTA,6
CARAPICUÍBA,DEPUTADO FEDERAL,DR LUIZ CHIAPARINE,LUIZ CARLOS CHIAPARINE,SUPLENTE,PDT,PARTIDO DEMOCRÁTICO TRABALHISTA,46
CARAPICUÍBA,DEPUTADO FEDERAL,NELSINHO DA BAHIA,NELSON FRANCISCO DOS SANTOS,SUPLENTE,PDT,PARTIDO DEMOCRÁTICO TRABALHISTA,105
CARAPICUÍBA,DEPUTADO FEDERAL,MANOEL ANTUNES,MANOEL ANTUNES,SUPLENTE,PDT,PARTIDO DEMOCRÁTICO TRABALHISTA,8
CARAPICUÍBA,DEPUTADO FEDERAL,DEF.BIODIESEL-SILASEDUARDOINKE,SILAS EDUARDO INKE,SUPLENTE,PDT,PARTIDO DEMOCRÁTICO TRABALHISTA,1
CARAPICUÍBA,DEPUTADO FEDERAL,CARLOS HENRIQUE,CARLOS HENRIQUE PINTO,SUPLENTE,PDT,PARTIDO DEMOCRÁTICO TRABALHISTA,14
CARAPICUÍBA,DEPUTADO FEDERAL,MAURICIO SOARES JUNIOR,MAURICIO SOARES DE ALMEIDA JUNIOR,SUPLENTE,PDT,PARTIDO DEMOCRÁTICO TRABALHISTA,1
CARAPICUÍBA,DEPUTADO FEDERAL,DRA DEBORA,DEBORA MARIA MARAGNI PEREIRA DE ABREU,SUPLENTE,PDT,PARTIDO DEMOCRÁTICO TRABALHISTA,9
CARAPICUÍBA,DEPUTADO FEDERAL,ISMAEL NICACIO,ISMAEL JUDÁ DOS SANTOS NICÁCIO,SUPLENTE,PDT,PARTIDO DEMOCRÁTICO TRABALHISTA,2
CARAPICUÍBA,DEPUTADO FEDERAL,SALVADOR ZIMBALDI,SALVADOR ZIMBALDI FILHO,MÉDIA,PDT,PARTIDO DEMOCRÁTICO TRABALHISTA,45
CARAPICUÍBA,DEPUTADO FEDERAL,DRA ZIRVA,ZIRVA DAS GRAÇAS PIRES PEREIRA,SUPLENTE,PDT,PARTIDO DEMOCRÁTICO TRABALHISTA,2
CARAPICUÍBA,DEPUTADO FEDERAL,LINDOLFO DOS SANTOS,LINDOLFO LUIZ DOS SANTOS NETO,SUPLENTE,PDT,PARTIDO DEMOCRÁTICO TRABALHISTA,23
CARAPICUÍBA,DEPUTADO FEDERAL,FERNANDO CHIARELLI,FERNANDO CHIARELLI,SUPLENTE,PDT,PARTIDO DEMOCRÁTICO TRABALHISTA,3
CARAPICUÍBA,DEPUTADO FEDERAL,GILBERTO LOPES,GILBERTO FERREIRA LOPES,SUPLENTE,PDT,PARTIDO DEMOCRÁTICO TRABALHISTA,1
CARAPICUÍBA,DEPUTADO FEDERAL,ITAMAR ALVES,ITAMAR ALVES DE OLIVEIRA,SUPLENTE,PDT,PARTIDO DEMOCRÁTICO TRABALHISTA,2
CARAPICUÍBA,DEPUTADO FEDERAL,WILSON COELHO,WILSON DE SOUZA COELHO,SUPLENTE,PDT,PARTIDO DEMOCRÁTICO TRABALHISTA,21
CARAPICUÍBA,DEPUTADO FEDERAL,INDIO TERENA,RUBENS MAMEDE,SUPLENTE,PDT,PARTIDO DEMOCRÁTICO TRABALHISTA,3
CARAPICUÍBA,DEPUTADO FEDERAL,NEI,RODNEI OLIVEIRA DA SILVA,SUPLENTE,PDT,PARTIDO DEMOCRÁTICO TRABALHISTA,4
CARAPICUÍBA,DEPUTADO FEDERAL,MAGAIVER,EDILSON MAGAIVER FERREIRA DA SILVA,SUPLENTE,PDT,PARTIDO DEMOCRÁTICO TRABALHISTA,1
CARAPICUÍBA,DEPUTADO FEDERAL,VALDEVAN NOVENTA,JOSE VALDEVAM DE JESUS SANTOS,SUPLENTE,PDT,PARTIDO DEMOCRÁTICO TRABALHISTA,79
CARAPICUÍBA,DEPUTADO FEDERAL,FADUL,OSWALDO DOS SANTOS,SUPLENTE,PDT,PARTIDO DEMOCRÁTICO TRABALHISTA,9
CARAPICUÍBA,DEPUTADO FEDERAL,IVANIO BATISTA,IVANIO BATISTA DA SILVA,SUPLENTE,PT,JUNTOS POR SÃO PAULO,19
CARAPICUÍBA,DEPUTADO FEDERAL,VICENTE CANDIDO,VICENTE CANDIDO DA SILVA,ELEITO,PT,JUNTOS POR SÃO PAULO,729
CARAPICUÍBA,DEPUTADO FEDERAL,PROFESSOR JAIR BALESTRA,JAIR DONIZETI BALESTRA,SUPLENTE,PT,JUNTOS POR SÃO PAULO,8
CARAPICUÍBA,DEPUTADO FEDERAL,MARQUINHOS OLÍVIO,MARCOS OLIVIO CONCEIÇÃO,SUPLENTE,PT,JUNTOS POR SÃO PAULO,1
CARAPICUÍBA,DEPUTADO FEDERAL,TOM,SEBASTIÃO SERAFIM DE MOURA SOBRINHO,SUPLENTE,PT,JUNTOS POR SÃO PAULO,5
CARAPICUÍBA,DEPUTADO FEDERAL,GERALDINHO O ILUMINADO,GERALDO ALVES DIONISIO,SUPLENTE,PT,JUNTOS POR SÃO PAULO,1
CARAPICUÍBA,DEPUTADO FEDERAL,IARA BERNARDI,IARA BERNARDI,SUPLENTE,PT,JUNTOS POR SÃO PAULO,50
CARAPICUÍBA,DEPUTADO FEDERAL,LARGUESA,LUIS VANDERLEI LARGUESA,SUPLENTE,PT,JUNTOS POR SÃO PAULO,67
CARAPICUÍBA,DEPUTADO FEDERAL,VACCAREZZA,CANDIDO ELPIDIO DE SOUZA VACCAREZZA,ELEITO,PT,JUNTOS POR SÃO PAULO,360
CARAPICUÍBA,DEPUTADO FEDERAL,GENOINO,JOSÉ GENOÍNO NETO,SUPLENTE,PT,JUNTOS POR SÃO PAULO,1510
CARAPICUÍBA,DEPUTADO FEDERAL,OSMAR LOPES,OSMAR LOPES,SUPLENTE,PT,JUNTOS POR SÃO PAULO,8
CARAPICUÍBA,DEPUTADO FEDERAL,HELCIO SILVA,HELCIO ANTONIO DA SILVA,SUPLENTE,PT,JUNTOS POR SÃO PAULO,13
CARAPICUÍBA,DEPUTADO FEDERAL,CARLINHOS ALMEIDA,CARLOS JOSE DE ALMEIDA,ELEITO,PT,JUNTOS POR SÃO PAULO,8
CARAPICUÍBA,DEPUTADO FEDERAL,MISA BOITO,MARIA EMILIA SEDEH BOITO,SUPLENTE,PT,JUNTOS POR SÃO PAULO,4
CARAPICUÍBA,DEPUTADO FEDERAL,NEWTON LIMA NETO,NEWTON LIMA NETO,ELEITO,PT,JUNTOS POR SÃO PAULO,20
CARAPICUÍBA,DEPUTADO FEDERAL,TEREZINHA RONDELLI,MARIA TEREZINHA RONDELLI,SUPLENTE,PT,JUNTOS POR SÃO PAULO,3
CARAPICUÍBA,DEPUTADO FEDERAL,GERSON SARTORI,GERSON HENRIQUE SARTORI,SUPLENTE,PT,JUNTOS POR SÃO PAULO,16
CARAPICUÍBA,DEPUTADO FEDERAL,FILIPPI,JOSÉ DE FILIPPI JÚNIOR,ELEITO,PT,JUNTOS POR SÃO PAULO,24
CARAPICUÍBA,DEPUTADO FEDERAL,ARLINDO CHINAGLIA,ARLINDO CHIGNALIA JUNIOR,ELEITO,PT,JUNTOS POR SÃO PAULO,960
CARAPICUÍBA,DEPUTADO FEDERAL,JOÃO PAULO CUNHA,JOÃO PAULO CUNHA,ELEITO,PT,JUNTOS POR SÃO PAULO,18410
CARAPICUÍBA,DEPUTADO FEDERAL,ROQUE FERREIRA,ROQUE JOSÉ FERREIRA,SUPLENTE,PT,JUNTOS POR SÃO PAULO,5
CARAPICUÍBA,DEPUTADO FEDERAL,JOÃO BATISTA,JOÃO BATISTA DA SILVA,SUPLENTE,PT,JUNTOS POR SÃO PAULO,2
CARAPICUÍBA,DEPUTADO FEDERAL,PIVATTO,JOSÉ PIVATTO,SUPLENTE,PT,JUNTOS POR SÃO PAULO,16
CARAPICUÍBA,DEPUTADO FEDERAL,RICARDO BERZOINI,RICARDO JOSE RIBEIRO BERZOINI,ELEITO,PT,JUNTOS POR SÃO PAULO,393
CARAPICUÍBA,DEPUTADO FEDERAL,JOSÉ MENTOR,JOSÉ MENTOR GUILHERME DE MELLO NETTO,ELEITO,PT,JUNTOS POR SÃO PAULO,797
CARAPICUÍBA,DEPUTADO FEDERAL,PROF. CARLÃO RAMIRO,CARLOS RAMIRO CASTRO,SUPLENTE,PT,JUNTOS POR SÃO PAULO,185
CARAPICUÍBA,DEPUTADO FEDERAL,FÉLIX SAHÃO,FÉLIX SAHÃO JÚNIOR,SUPLENTE,PT,JUNTOS POR SÃO PAULO,9
CARAPICUÍBA,DEPUTADO FEDERAL,ROGÉRIO PINTO,ROGÉRIO PINTO FERNANDES,SUPLENTE,PT,JUNTOS POR SÃO PAULO,13
CARAPICUÍBA,DEPUTADO FEDERAL,TENENTE PAZ,FRANCISCO JESUS DA PAZ,SUPLENTE,PT,JUNTOS POR SÃO PAULO,3
CARAPICUÍBA,DEPUTADO FEDERAL,RODRIGO VALVERDE,JORGE RODRIGO VALVERDE SANTANA,SUPLENTE,PT,JUNTOS POR SÃO PAULO,4
CARAPICUÍBA,DEPUTADO FEDERAL,VANDERLEI SIRAQUE,VANDERLEI SIRAQUE,SUPLENTE,PT,JUNTOS POR SÃO PAULO,52
CARAPICUÍBA,DEPUTADO FEDERAL,PAULO AFONSO,PAULO AFONSO RIBEIRO,SUPLENTE,PT,JUNTOS POR SÃO PAULO,3
CARAPICUÍBA,DEPUTADO FEDERAL,ELIANA MORAES,ELIANA ALVES DE MORAES,SUPLENTE,PT,JUNTOS POR SÃO PAULO,4
CARAPICUÍBA,DEPUTADO FEDERAL,LUIZ CARLOS GOMES,LUIZ CARLOS GOMES,SUPLENTE,PT,JUNTOS POR SÃO PAULO,409
CARAPICUÍBA,DEPUTADO FEDERAL,DRA. SONIA DARCH,SONIA DARCH DE BRITO,SUPLENTE,PT,JUNTOS POR SÃO PAULO,13
CARAPICUÍBA,DEPUTADO FEDERAL,JILMAR TATTO,JILMAR AUGUSTINHO TATTO,ELEITO,PT,JUNTOS POR SÃO PAULO,1214
CARAPICUÍBA,DEPUTADO FEDERAL,DURVAL ORLATO,DURVAL LOPES ORLATO,SUPLENTE,PT,JUNTOS POR SÃO PAULO,37
CARAPICUÍBA,DEPUTADO FEDERAL,EDSON DA PAZ (O CANTOR),EDSON DA PAZ,SUPLENTE,PT,JUNTOS POR SÃO PAULO,17
CARAPICUÍBA,DEPUTADO FEDERAL,JANIO RIBEIRO,JANIO RIBEIRO,SUPLENTE,PT,JUNTOS POR SÃO PAULO,6
CARAPICUÍBA,DEPUTADO FEDERAL,RUBINHO BASTOS,RUBENS BASTOS DO NASCIMENTO,SUPLENTE,PT,JUNTOS POR SÃO PAULO,411
CARAPICUÍBA,DEPUTADO FEDERAL,ARCELINO ARAUJO,ARCELINO ARAUJO RIBEIRO,SUPLENTE,PT,JUNTOS POR SÃO PAULO,694
CARAPICUÍBA,DEPUTADO FEDERAL,REGINALDO PERNAMBUCANO,REGINALDO CARNEIRO DE MOURA,SUPLENTE,PT,JUNTOS POR SÃO PAULO,20
CARAPICUÍBA,DEPUTADO FEDERAL,CARLOS AQUINO,JOSÉ CARLOS DE AQUINO,SUPLENTE,PT,JUNTOS POR SÃO PAULO,13
CARAPICUÍBA,DEPUTADO FEDERAL,RENATO SIMÕES,RENATO SIMÕES,SUPLENTE,PT,JUNTOS POR SÃO PAULO,60
CARAPICUÍBA,DEPUTADO FEDERAL,PROFESSOR MOREIRA,WAINES MOREIRA ALVES,SUPLENTE,PT,JUNTOS POR SÃO PAULO,4
CARAPICUÍBA,DEPUTADO FEDERAL,DEVANIR RIBEIRO,DEVANIR RIBEIRO,ELEITO,PT,JUNTOS POR SÃO PAULO,1669
CARAPICUÍBA,DEPUTADO FEDERAL,ZARATTINI,CARLOS ALBERTO ROLIM ZARATTINI,ELEITO,PT,JUNTOS POR SÃO PAULO,2921
CARAPICUÍBA,DEPUTADO FEDERAL,DR RONALDO BRESCIANI,RONALDO JOSÉ BRESCIANI,SUPLENTE,PT,JUNTOS POR SÃO PAULO,3
