PALMARES PAULISTA,PRESIDENTE,DILMA,DILMA VANA ROUSSEFF,2º TURNO,PT,PARA O BRASIL SEGUIR MUDANDO,2792
PALMARES PAULISTA,PRESIDENTE,JOSÉ SERRA,JOSÉ SERRA,2º TURNO,PSDB,O BRASIL PODE MAIS,1874
PALMARES PAULISTA,GOVERNADOR,GERALDO ALCKMIN,GERALDO JOSE RODRIGUES ALCKMIN FILHO,ELEITO,PSDB,UNIDOS POR SÃO PAULO,2498
PALMARES PAULISTA,SENADOR,MARTA SUPLICY,MARTA SUPLICY,ELEITO,PT,UNIÃO PARA MUDAR,2298
PALMARES PAULISTA,SENADOR,ALOYSIO NUNES,ALOYSIO NUNES FERREIRA FILHO,ELEITO,PSDB,UNIDOS POR SÃO PAULO,2215
PALMARES PAULISTA,DEPUTADO FEDERAL,ANTONIO BULHÕES,ANTONIO CARLOS MARTINS DE BULHÕES,ELEITO,PRB,JUNTOS POR SÃO PAULO,55
PALMARES PAULISTA,DEPUTADO FEDERAL,MALUF,PAULO SALIM MALUF,ELEITO,PP,PARTIDO PROGRESSISTA,11
PALMARES PAULISTA,DEPUTADO FEDERAL,RENATO REICHANN,RUY RENATO REICHMANN,SUPLENTE,PP,PARTIDO PROGRESSISTA,1
PALMARES PAULISTA,DEPUTADO FEDERAL,LIBERATO DE VALENTIM GENTIL,LIBERATO ROCHA CALDEIRA,SUPLENTE,PP,PARTIDO PROGRESSISTA,3
PALMARES PAULISTA,DEPUTADO FEDERAL,LAURINDO BARNARDES,LAURINDO BERNARDES DE SOUZA,SUPLENTE,PP,PARTIDO PROGRESSISTA,33
PALMARES PAULISTA,DEPUTADO FEDERAL,ALINE CORREA,ALINE LEMOS CORREA DE OLIVEIRA ANDRADE,ELEITO,PP,PARTIDO PROGRESSISTA,1
PALMARES PAULISTA,DEPUTADO FEDERAL,LAYRTON INFANTE,LAYRTON INFANTE,SUPLENTE,PP,PARTIDO PROGRESSISTA,4
PALMARES PAULISTA,DEPUTADO FEDERAL,CABO WILSON,WILSON DE OLIVEIRA MORAIS,SUPLENTE,PP,PARTIDO PROGRESSISTA,1
PALMARES PAULISTA,DEPUTADO FEDERAL,MISSIONÁRIO JOSÉ OLIMPIO,JOSÉ OLIMPIO SILVEIRA MORAES,ELEITO,PP,PARTIDO PROGRESSISTA,26
PALMARES PAULISTA,DEPUTADO FEDERAL,FERNANDO STANCATTI,FERNANDO CESAR STANCATTI MARQUES,SUPLENTE,PP,PARTIDO PROGRESSISTA,1
PALMARES PAULISTA,DEPUTADO FEDERAL,DR NECHAR,SERGIO ANTONIO NECHAR,SUPLENTE,PP,PARTIDO PROGRESSISTA,5
PALMARES PAULISTA,DEPUTADO FEDERAL,VADÃO,ETIVALDO VADAO GOMES,SUPLENTE,PP,PARTIDO PROGRESSISTA,84
PALMARES PAULISTA,DEPUTADO FEDERAL,JOÃO DADO,JOÃO EDUARDO DADO LEITE DE CARVALHO,ELEITO,PDT,PARTIDO DEMOCRÁTICO TRABALHISTA,33
PALMARES PAULISTA,DEPUTADO FEDERAL,PAULINHO DA FORÇA,PAULO PEREIRA DA SILVA,ELEITO,PDT,PARTIDO DEMOCRÁTICO TRABALHISTA,29
PALMARES PAULISTA,DEPUTADO FEDERAL,ELISEU DANIEL,ELISEU DANIEL DOS SANTOS,SUPLENTE,PDT,PARTIDO DEMOCRÁTICO TRABALHISTA,38
PALMARES PAULISTA,DEPUTADO FEDERAL,PEDRO BAPTISTINI,PEDRO ANTONIO BAPTISTINI,SUPLENTE,PDT,PARTIDO DEMOCRÁTICO TRABALHISTA,1
PALMARES PAULISTA,DEPUTADO FEDERAL,SAULO GOES,SAULO GOES DE ALBUQUERQUE,SUPLENTE,PDT,PARTIDO DEMOCRÁTICO TRABALHISTA,1
PALMARES PAULISTA,DEPUTADO FEDERAL,MEDEIROS,LUIZ ANTONIO DE MEDEIROS NETO,SUPLENTE,PDT,PARTIDO DEMOCRÁTICO TRABALHISTA,8
PALMARES PAULISTA,DEPUTADO FEDERAL,EDUARDO NASCIMENTO,EDUARDO DUARTE DO NASCIMENTO,SUPLENTE,PDT,PARTIDO DEMOCRÁTICO TRABALHISTA,1
PALMARES PAULISTA,DEPUTADO FEDERAL,DR LUIZ CHIAPARINE,LUIZ CARLOS CHIAPARINE,SUPLENTE,PDT,PARTIDO DEMOCRÁTICO TRABALHISTA,6
PALMARES PAULISTA,DEPUTADO FEDERAL,NELSINHO DA BAHIA,NELSON FRANCISCO DOS SANTOS,SUPLENTE,PDT,PARTIDO DEMOCRÁTICO TRABALHISTA,1
PALMARES PAULISTA,DEPUTADO FEDERAL,MANOEL ANTUNES,MANOEL ANTUNES,SUPLENTE,PDT,PARTIDO DEMOCRÁTICO TRABALHISTA,56
PALMARES PAULISTA,DEPUTADO FEDERAL,CARLOS HENRIQUE,CARLOS HENRIQUE PINTO,SUPLENTE,PDT,PARTIDO DEMOCRÁTICO TRABALHISTA,41
PALMARES PAULISTA,DEPUTADO FEDERAL,SALVADOR ZIMBALDI,SALVADOR ZIMBALDI FILHO,MÉDIA,PDT,PARTIDO DEMOCRÁTICO TRABALHISTA,2
PALMARES PAULISTA,DEPUTADO FEDERAL,FADUL,OSWALDO DOS SANTOS,SUPLENTE,PDT,PARTIDO DEMOCRÁTICO TRABALHISTA,1
PALMARES PAULISTA,DEPUTADO FEDERAL,LARGUESA,LUIS VANDERLEI LARGUESA,SUPLENTE,PT,JUNTOS POR SÃO PAULO,2
PALMARES PAULISTA,DEPUTADO FEDERAL,VACCAREZZA,CANDIDO ELPIDIO DE SOUZA VACCAREZZA,ELEITO,PT,JUNTOS POR SÃO PAULO,17
PALMARES PAULISTA,DEPUTADO FEDERAL,GENOINO,JOSÉ GENOÍNO NETO,SUPLENTE,PT,JUNTOS POR SÃO PAULO,5
PALMARES PAULISTA,DEPUTADO FEDERAL,NEWTON LIMA NETO,NEWTON LIMA NETO,ELEITO,PT,JUNTOS POR SÃO PAULO,1
PALMARES PAULISTA,DEPUTADO FEDERAL,FILIPPI,JOSÉ DE FILIPPI JÚNIOR,ELEITO,PT,JUNTOS POR SÃO PAULO,1
PALMARES PAULISTA,DEPUTADO FEDERAL,ARLINDO CHINAGLIA,ARLINDO CHIGNALIA JUNIOR,ELEITO,PT,JUNTOS POR SÃO PAULO,7
PALMARES PAULISTA,DEPUTADO FEDERAL,JOÃO PAULO CUNHA,JOÃO PAULO CUNHA,ELEITO,PT,JUNTOS POR SÃO PAULO,2
PALMARES PAULISTA,DEPUTADO FEDERAL,PIVATTO,JOSÉ PIVATTO,SUPLENTE,PT,JUNTOS POR SÃO PAULO,1
PALMARES PAULISTA,DEPUTADO FEDERAL,RICARDO BERZOINI,RICARDO JOSE RIBEIRO BERZOINI,ELEITO,PT,JUNTOS POR SÃO PAULO,4
PALMARES PAULISTA,DEPUTADO FEDERAL,JOSÉ MENTOR,JOSÉ MENTOR GUILHERME DE MELLO NETTO,ELEITO,PT,JUNTOS POR SÃO PAULO,455
PALMARES PAULISTA,DEPUTADO FEDERAL,PROF. CARLÃO RAMIRO,CARLOS RAMIRO CASTRO,SUPLENTE,PT,JUNTOS POR SÃO PAULO,6
PALMARES PAULISTA,DEPUTADO FEDERAL,FÉLIX SAHÃO,FÉLIX SAHÃO JÚNIOR,SUPLENTE,PT,JUNTOS POR SÃO PAULO,331
PALMARES PAULISTA,DEPUTADO FEDERAL,RODRIGO VALVERDE,JORGE RODRIGO VALVERDE SANTANA,SUPLENTE,PT,JUNTOS POR SÃO PAULO,1
PALMARES PAULISTA,DEPUTADO FEDERAL,VANDERLEI SIRAQUE,VANDERLEI SIRAQUE,SUPLENTE,PT,JUNTOS POR SÃO PAULO,18
PALMARES PAULISTA,DEPUTADO FEDERAL,DRA. SONIA DARCH,SONIA DARCH DE BRITO,SUPLENTE,PT,JUNTOS POR SÃO PAULO,1
PALMARES PAULISTA,DEPUTADO FEDERAL,EDSON DA PAZ (O CANTOR),EDSON DA PAZ,SUPLENTE,PT,JUNTOS POR SÃO PAULO,1
PALMARES PAULISTA,DEPUTADO FEDERAL,REGINALDO PERNAMBUCANO,REGINALDO CARNEIRO DE MOURA,SUPLENTE,PT,JUNTOS POR SÃO PAULO,30
PALMARES PAULISTA,DEPUTADO FEDERAL,RENATO SIMÕES,RENATO SIMÕES,SUPLENTE,PT,JUNTOS POR SÃO PAULO,1
PALMARES PAULISTA,DEPUTADO FEDERAL,ZARATTINI,CARLOS ALBERTO ROLIM ZARATTINI,ELEITO,PT,JUNTOS POR SÃO PAULO,3
PALMARES PAULISTA,DEPUTADO FEDERAL,CLAURY,CLAURY SANTOS ALVES DA SILVA,SUPLENTE,PTB,PARTIDO TRABALHISTA BRASILEIRO,6
PALMARES PAULISTA,DEPUTADO FEDERAL,SANTANA,JOSE SANTANA DE ABREU,SUPLENTE,PTB,PARTIDO TRABALHISTA BRASILEIRO,1
PALMARES PAULISTA,DEPUTADO FEDERAL,ROBSON TUMA,ROBSON TUMA,SUPLENTE,PTB,PARTIDO TRABALHISTA BRASILEIRO,5
PALMARES PAULISTA,DEPUTADO FEDERAL,RICARDO OLIVEIRA,RICARDO JOSE DE OLIVEIRA,SUPLENTE,PTB,PARTIDO TRABALHISTA BRASILEIRO,4
PALMARES PAULISTA,DEPUTADO FEDERAL,AMIRAH SABA DA METROPOLITANAFM,AMIRAH SABA,SUPLENTE,PTB,PARTIDO TRABALHISTA BRASILEIRO,1
PALMARES PAULISTA,DEPUTADO FEDERAL,SINVAL DORIGON,SINVAL ROBERTO DORIGON,SUPLENTE,PTB,PARTIDO TRABALHISTA BRASILEIRO,1
PALMARES PAULISTA,DEPUTADO FEDERAL,NELSON MARQUEZELLI,NELSON MARQUEZELLI,ELEITO,PTB,PARTIDO TRABALHISTA BRASILEIRO,3
PALMARES PAULISTA,DEPUTADO FEDERAL,MARCOS CRIPPA,MARCOS ANTONIO CRIPPA,SUPLENTE,PTB,PARTIDO TRABALHISTA BRASILEIRO,100
PALMARES PAULISTA,DEPUTADO FEDERAL,AUREA RODRIGUES,AUREA RODRIGUES MADEIRO,SUPLENTE,PTB,PARTIDO TRABALHISTA BRASILEIRO,1
PALMARES PAULISTA,DEPUTADO FEDERAL,CAJAI,ISRAEL MARQUES CAJAI,SUPLENTE,PTB,PARTIDO TRABALHISTA BRASILEIRO,1
PALMARES PAULISTA,DEPUTADO FEDERAL,PAULO LIMA,PAULO CESAR DE OLIVEIRA LIMA,SUPLENTE,PMDB,PARTIDO DO MOVIMENTO DEMOCRÁTICO BRASILEIRO,4
PALMARES PAULISTA,DEPUTADO FEDERAL,MARCOS TENÓRIO,MARCOS ANTÔNIO FERREIRA TENÓRIO,SUPLENTE,PMDB,PARTIDO DO MOVIMENTO DEMOCRÁTICO BRASILEIRO,4
PALMARES PAULISTA,DEPUTADO FEDERAL,EDUARDO COELHO,EDUARDO JOSÉ PEREIRA COELHO,SUPLENTE,PMDB,PARTIDO DO MOVIMENTO DEMOCRÁTICO BRASILEIRO,2
PALMARES PAULISTA,DEPUTADO FEDERAL,EDINHO ARAUJO,EDSON EDINHO COELHO ARAUJO,ELEITO,PMDB,PARTIDO DO MOVIMENTO DEMOCRÁTICO BRASILEIRO,18
PALMARES PAULISTA,DEPUTADO FEDERAL,LIMA JUNIOR,JULIO CEZAR DA SILVA LIMA JUNIOR,SUPLENTE,PMDB,PARTIDO DO MOVIMENTO DEMOCRÁTICO BRASILEIRO,1
PALMARES PAULISTA,DEPUTADO FEDERAL,GERALDÃO,GERALDO TOMAZ AUGUSTO,SUPLENTE,PMDB,PARTIDO DO MOVIMENTO DEMOCRÁTICO BRASILEIRO,1
PALMARES PAULISTA,DEPUTADO FEDERAL,DR. SAMIR NASSBINE,SAMIR ASSAD NASSBINE,SUPLENTE,PMDB,PARTIDO DO MOVIMENTO DEMOCRÁTICO BRASILEIRO,44
PALMARES PAULISTA,DEPUTADO FEDERAL,CLEBER DELALIBERA,CLEBER DE MOURA DELALIBERA,SUPLENTE,PSC,HUMANISTA CRISTÃO ,3
PALMARES PAULISTA,DEPUTADO FEDERAL,MARCO FELICIANO,MARCO ANTONIO FELICIANO,ELEITO,PSC,HUMANISTA CRISTÃO ,14
PALMARES PAULISTA,DEPUTADO FEDERAL,REGIS DE OLIVEIRA,REGIS FERNANDES DE OLIVEIRA,SUPLENTE,PSC,HUMANISTA CRISTÃO ,1
PALMARES PAULISTA,DEPUTADO FEDERAL,PRICILA LEME,PRICILA HELENA MOYSES LEME,SUPLENTE,PSC,HUMANISTA CRISTÃO ,2
PALMARES PAULISTA,DEPUTADO FEDERAL,JUCA CHAVES,JURANDYR CZACZKES CHAVES,SUPLENTE,PR,JUNTOS POR SÃO PAULO,1
PALMARES PAULISTA,DEPUTADO FEDERAL,AGNALDO TIMOTEO,AGUINALDO TIMOTEO PEREIRA,SUPLENTE,PR,JUNTOS POR SÃO PAULO,1
PALMARES PAULISTA,DEPUTADO FEDERAL,TIRIRICA,FRANCISCO EVERARDO OLIVEIRA SILVA,ELEITO,PR,JUNTOS POR SÃO PAULO,124
PALMARES PAULISTA,DEPUTADO FEDERAL,PR PAULO FREIRE,PAULO ROBERTO FREIRE DA COSTA,ELEITO,PR,JUNTOS POR SÃO PAULO,97
PALMARES PAULISTA,DEPUTADO FEDERAL,MILTON MONTI,MILTON ANTONIO CASQUEL MONTI,ELEITO,PR,JUNTOS POR SÃO PAULO,4
PALMARES PAULISTA,DEPUTADO FEDERAL,VALDEMAR COSTA NETO,VALDEMAR COSTA NETO,ELEITO,PR,JUNTOS POR SÃO PAULO,95
PALMARES PAULISTA,DEPUTADO FEDERAL,SONRISAL,MAURICIO BONATTI,SUPLENTE,PPS,PSDB/DEM/PPS,1
PALMARES PAULISTA,DEPUTADO FEDERAL,WILLIAM WOO,WILLIAM BOSS WOO,SUPLENTE,PPS,PSDB/DEM/PPS,1
PALMARES PAULISTA,DEPUTADO FEDERAL,VALDEMAR ANFRISIO,VALDEMAR ANFRISIO DOS SANTOS,SUPLENTE,PPS,PSDB/DEM/PPS,1
PALMARES PAULISTA,DEPUTADO FEDERAL,ROBERTO FREIRE,ROBERTO JOAO PEREIRA FREIRE,ELEITO,PPS,PSDB/DEM/PPS,1
PALMARES PAULISTA,DEPUTADO FEDERAL,CORONEL EDSON SARDANO,EDSON DE JESUS SARDANO,SUPLENTE,PPS,PSDB/DEM/PPS,1
PALMARES PAULISTA,DEPUTADO FEDERAL,DIMAS RAMALHO,DIMAS EDUARDO RAMALHO,ELEITO,PPS,PSDB/DEM/PPS,279
PALMARES PAULISTA,DEPUTADO FEDERAL,JORGE TADEU,JORGE TADEU MUDALEN,ELEITO,DEM,PSDB/DEM/PPS,6
PALMARES PAULISTA,DEPUTADO FEDERAL,ALEXANDRE LEITE,ALEXANDRE LEITE DA SILVA,MÉDIA,DEM,PSDB/DEM/PPS,2
PALMARES PAULISTA,DEPUTADO FEDERAL,KIKO DO KLB,FRANCO FINATO SCORNAVACCA,SUPLENTE,DEM,PSDB/DEM/PPS,2
PALMARES PAULISTA,DEPUTADO FEDERAL,CRESPO,JOSE ANTONIO CALDINI CRESPO,SUPLENTE,DEM,PSDB/DEM/PPS,1
PALMARES PAULISTA,DEPUTADO FEDERAL,RODRIGO GARCIA,RODRIGO GARCIA,ELEITO,DEM,PSDB/DEM/PPS,36
PALMARES PAULISTA,DEPUTADO FEDERAL,ZULAIÊ COBRA,ZULAIE COBRA RIBEIRO,SUPLENTE,DEM,PSDB/DEM/PPS,2
PALMARES PAULISTA,DEPUTADO FEDERAL,DR ELEUSES PAIVA,ELEUSES VIEIRA DE PAIVA,SUPLENTE,DEM,PSDB/DEM/PPS,223
PALMARES PAULISTA,DEPUTADO FEDERAL,GUILHERME CAMPOS,GUILHERME CAMPOS JUNIOR,MÉDIA,DEM,PSDB/DEM/PPS,1
PALMARES PAULISTA,DEPUTADO FEDERAL,GERALDO DO POSTINHO,GERALDO BENEDITO RODRIGUES,SUPLENTE,PHS,HUMANISTA CRISTÃO ,1
PALMARES PAULISTA,DEPUTADO FEDERAL,MARCELINHO CARIOCA,MARCELO PEREIRA SURCIN,SUPLENTE,PSB,PRESTE ATENÇÃO SÃO PAULO,1
PALMARES PAULISTA,DEPUTADO FEDERAL,CAPITÃO AUGUSTO,JOSÉ AUGUSTO ROSA,SUPLENTE,PSB,PRESTE ATENÇÃO SÃO PAULO,31
PALMARES PAULISTA,DEPUTADO FEDERAL,CHINELO,JOSÉ AVELINO PEREIRA,SUPLENTE,PSB,PRESTE ATENÇÃO SÃO PAULO,1
PALMARES PAULISTA,DEPUTADO FEDERAL,GABRIEL CHALITA,GABRIEL BENEDITO ISSAAC CHALITA,ELEITO,PSB,PRESTE ATENÇÃO SÃO PAULO,39
PALMARES PAULISTA,DEPUTADO FEDERAL,MÁRCIO FRANÇA,MÁRCIO LUIZ FRANÇA GOMES,ELEITO,PSB,PRESTE ATENÇÃO SÃO PAULO,7
PALMARES PAULISTA,DEPUTADO FEDERAL,VALDIR ALVARENGA,VALDIR DE ALVARENGA,SUPLENTE,PSB,PRESTE ATENÇÃO SÃO PAULO,1
PALMARES PAULISTA,DEPUTADO FEDERAL,JEFFERSON CAMPOS,JEFFERSON ALVES DE CAMPOS,ELEITO,PSB,PRESTE ATENÇÃO SÃO PAULO,1
PALMARES PAULISTA,DEPUTADO FEDERAL,DR. UBIALI,MARCO AURÉLIO UBIALI,SUPLENTE,PSB,PRESTE ATENÇÃO SÃO PAULO,16
PALMARES PAULISTA,DEPUTADO FEDERAL,GUILHERME MUSSI,GUILHERME MUSSI FERREIRA,ELEITO,PV,PARTIDO VERDE,22
PALMARES PAULISTA,DEPUTADO FEDERAL,DR. SINVAL MALHEIROS,SINVAL MALHEIROS PINTO JÚNIOR,SUPLENTE,PV,PARTIDO VERDE,1213
PALMARES PAULISTA,DEPUTADO FEDERAL,JULIO CASTILHO,JULIO CESAR CASTILHO,SUPLENTE,PV,PARTIDO VERDE,2
PALMARES PAULISTA,DEPUTADO FEDERAL,EVANDRO GUSSI,EVANDRO HERRERA BERTONE GUSSI,SUPLENTE,PV,PARTIDO VERDE,1
PALMARES PAULISTA,DEPUTADO FEDERAL,WALTER FELIX,WALTER FÉLIX,SUPLENTE,PV,PARTIDO VERDE,1
PALMARES PAULISTA,DEPUTADO FEDERAL,DANILO PARO,DANILO JOSÉ PARO,SUPLENTE,PV,PARTIDO VERDE,4
PALMARES PAULISTA,DEPUTADO FEDERAL,J FARIA,JOSE JESUS APARECIDO DE FARIA,SUPLENTE,PV,PARTIDO VERDE,1
PALMARES PAULISTA,DEPUTADO FEDERAL,DEKKA,JOSÉ SALVADOR DA SILVA,SUPLENTE,PV,PARTIDO VERDE,1
PALMARES PAULISTA,DEPUTADO FEDERAL,CARLINHOS SILVA,ANTONIO CARLOS ALVES DA SILVA,SUPLENTE,PV,PARTIDO VERDE,1
PALMARES PAULISTA,DEPUTADO FEDERAL,RICARDO IZAR,RICARDO IZAR JUNIOR,ELEITO,PV,PARTIDO VERDE,69
PALMARES PAULISTA,DEPUTADO FEDERAL,CARLOS SAMPAIO,CARLOS HENRIQUE FOCESI SAMPAIO,ELEITO,PSDB,PSDB/DEM/PPS,1
PALMARES PAULISTA,DEPUTADO FEDERAL,STANGARLINI,JOSE CARLOS STANGARLINI,SUPLENTE,PSDB,PSDB/DEM/PPS,2
PALMARES PAULISTA,DEPUTADO FEDERAL,RAUL CHRISTIANO,RAUL CHRISTIANO DE OLIVEIRA SANCHEZ,SUPLENTE,PSDB,PSDB/DEM/PPS,29
PALMARES PAULISTA,DEPUTADO FEDERAL,LOBBE NETO,ANTONIO ADOLPHO LOBBE NETO,SUPLENTE,PSDB,PSDB/DEM/PPS,15
PALMARES PAULISTA,DEPUTADO FEDERAL,MANOEL MARCOS (MANÉ),MANOEL MARCOS DE JESUS FERREIRA,SUPLENTE,PSDB,PSDB/DEM/PPS,1
PALMARES PAULISTA,DEPUTADO FEDERAL,EMANUEL FERNANDES,EMANUEL FERNANDES,ELEITO,PSDB,PSDB/DEM/PPS,3
PALMARES PAULISTA,DEPUTADO FEDERAL,CARLOS BRAGA,CARLOS EDUARDO FARACO BRAGA,SUPLENTE,PSDB,PSDB/DEM/PPS,1
PALMARES PAULISTA,DEPUTADO FEDERAL,CARLOS ROBERTO,CARLOS ROBERTO DE CAMPOS,SUPLENTE,PSDB,PSDB/DEM/PPS,2
PALMARES PAULISTA,DEPUTADO FEDERAL,DIB,WILLIAM DIB,ELEITO,PSDB,PSDB/DEM/PPS,2
PALMARES PAULISTA,DEPUTADO FEDERAL,SILVIO TORRES,SILVIO FRANÇA TORRES,SUPLENTE,PSDB,PSDB/DEM/PPS,4
PALMARES PAULISTA,DEPUTADO FEDERAL,EDSON APARECIDO,EDSON APARECIDO DOS SANTOS,ELEITO,PSDB,PSDB/DEM/PPS,536
PALMARES PAULISTA,DEPUTADO FEDERAL,LUIZ FERNANDO MACHADO,LUIZ FERNANDO ARANTES MACHADO,ELEITO,PSDB,PSDB/DEM/PPS,2
PALMARES PAULISTA,DEPUTADO FEDERAL,VANDERLEI MACRIS,VANDERLEI MACRIS,SUPLENTE,PSDB,PSDB/DEM/PPS,3
PALMARES PAULISTA,DEPUTADO FEDERAL,DUARTE NOGUEIRA,ANTONIO DUARTE NOGUEIRA JUNIOR,ELEITO,PSDB,PSDB/DEM/PPS,3
PALMARES PAULISTA,DEPUTADO FEDERAL,JULIO SEMEGHINI,JULIO FRACISCO SEMEGHINI NETO,ELEITO,PSDB,PSDB/DEM/PPS,3
PALMARES PAULISTA,DEPUTADO FEDERAL,RAFAEL ABUD,RAFAEL ANGELO ABUD,SUPLENTE,PSDB,PSDB/DEM/PPS,1
PALMARES PAULISTA,DEPUTADO FEDERAL,GIVALDO VIEIRA,GIVALDO RODRIGUES VIEIRA,SUPLENTE,PSDB,PSDB/DEM/PPS,1
PALMARES PAULISTA,DEPUTADO FEDERAL,FERNANDO FUAD CHUCRE,FERNANDO BARRANCOS CHUCRE,SUPLENTE,PSDB,PSDB/DEM/PPS,24
PALMARES PAULISTA,DEPUTADO FEDERAL,VAZ DE LIMA,JOSÉ CARLOS VAZ DE LIMA,ELEITO,PSDB,PSDB/DEM/PPS,8
PALMARES PAULISTA,DEPUTADO FEDERAL,TIÃO,SEBASTIÃO FERRES ARSENE,SUPLENTE,PSDB,PSDB/DEM/PPS,1
PALMARES PAULISTA,DEPUTADO FEDERAL,THAME,ANTONIO CARLOS DE MENDES THAME,ELEITO,PSDB,PSDB/DEM/PPS,168
PALMARES PAULISTA,DEPUTADO FEDERAL,BRUNA FURLAN,BRUNA DIAS FURLAN,ELEITO,PSDB,PSDB/DEM/PPS,1
PALMARES PAULISTA,DEPUTADO FEDERAL,IVAN VALENTE,IVAN VALENTE,ELEITO,PSOL,PARTIDO SOCIALISMO E LIBERDADE,3
PALMARES PAULISTA,DEPUTADO FEDERAL,PROFESSORA MÁRCIA TAVARES,MÁRCIA TAVARES DO NASCIMENTO,SUPLENTE,PSOL,PARTIDO SOCIALISMO E LIBERDADE,1
PALMARES PAULISTA,DEPUTADO FEDERAL,GUSTAVO PETTA,GUSTAVO LEMOS PETTA,SUPLENTE,PC DO B,JUNTOS POR SÃO PAULO,3
PALMARES PAULISTA,DEPUTADO FEDERAL,BENEH SANTOS,BENEDITO HERNELIO DOS SANTOS,SUPLENTE,PC DO B,JUNTOS POR SÃO PAULO,1
PALMARES PAULISTA,DEPUTADO FEDERAL,ALDO REBELO,JOSÉ ALDO REBELO FIGUEIREDO,ELEITO,PC DO B,JUNTOS POR SÃO PAULO,2
PALMARES PAULISTA,DEPUTADO FEDERAL,DELEGADO PROTÓGENES,PROTÓGENES PINHEIRO DE QUEIROZ,MÉDIA,PC DO B,JUNTOS POR SÃO PAULO,3
PALMARES PAULISTA,DEPUTADO ESTADUAL,SEBASTIÃO SANTOS,SEBASTIÃO DOS SANTOS FILHO,ELEITO,PRB,SOMOS MAIS SÃO PAULO,54
PALMARES PAULISTA,DEPUTADO ESTADUAL,CURIATI,ANTONIO SALIM CURIATI,ELEITO,PP,PARTIDO PROGRESSISTA,5
PALMARES PAULISTA,DEPUTADO ESTADUAL,DIOGO TICLY,DIOGO GAZZE TICLY,SUPLENTE,PP,PARTIDO PROGRESSISTA,1
PALMARES PAULISTA,DEPUTADO ESTADUAL,ANDERSON GRECCO,ANDERSON RODRIGUES GRECCO,SUPLENTE,PP,PARTIDO PROGRESSISTA,1
PALMARES PAULISTA,DEPUTADO ESTADUAL,LUIS YABIKU,LUIS MOKITI YABIKU,SUPLENTE,PDT,PARTIDO DEMOCRÁTICO TRABALHISTA,1
PALMARES PAULISTA,DEPUTADO ESTADUAL,DINEI,CLAUDINEI ALEXANDRE PIRES,SUPLENTE,PDT,PARTIDO DEMOCRÁTICO TRABALHISTA,2
PALMARES PAULISTA,DEPUTADO ESTADUAL,AUREO PRETO,AUREO RODRIGUES DE SOUZA,SUPLENTE,PDT,PARTIDO DEMOCRÁTICO TRABALHISTA,3
PALMARES PAULISTA,DEPUTADO ESTADUAL,MAJOR OLIMPIO,SERGIO OLIMPIO GOMES,ELEITO,PDT,PARTIDO DEMOCRÁTICO TRABALHISTA,6
PALMARES PAULISTA,DEPUTADO ESTADUAL,AMON VIOLEIRO,AMOMM HEBROM DA HORA DE DEUS SOUZA,SUPLENTE,PDT,PARTIDO DEMOCRÁTICO TRABALHISTA,1
PALMARES PAULISTA,DEPUTADO ESTADUAL,NICOLACI,RONALD LUIZ NICOLACI FINCATTI,SUPLENTE,PDT,PARTIDO DEMOCRÁTICO TRABALHISTA,1
PALMARES PAULISTA,DEPUTADO ESTADUAL,BRUZAROSCO,APARECIDO DE JESUS BRUZAROSCO,SUPLENTE,PDT,PARTIDO DEMOCRÁTICO TRABALHISTA,3
PALMARES PAULISTA,DEPUTADO ESTADUAL,RAFAEL SILVA,RAFAEL ANTONIO DA SILVA,ELEITO,PDT,PARTIDO DEMOCRÁTICO TRABALHISTA,5
PALMARES PAULISTA,DEPUTADO ESTADUAL,TADEU MORAIS,TADEU MORAIS DE SOUSA,SUPLENTE,PDT,PARTIDO DEMOCRÁTICO TRABALHISTA,8
PALMARES PAULISTA,DEPUTADO ESTADUAL,HELIO BASTOS,HELIO DE ALMEIDA BASTOS,SUPLENTE,PDT,PARTIDO DEMOCRÁTICO TRABALHISTA,3
PALMARES PAULISTA,DEPUTADO ESTADUAL,CONSTANCIA FELIX,CONSTANCIA BERBERT DUTRA DA SILVA,SUPLENTE,PDT,PARTIDO DEMOCRÁTICO TRABALHISTA,29
PALMARES PAULISTA,DEPUTADO ESTADUAL,PROFESSOR CLEITON GOMES,CLEITON GOMES DA SILVA,SUPLENTE,PT,SOMOS MAIS SÃO PAULO,1
PALMARES PAULISTA,DEPUTADO ESTADUAL,EDINHO SILVA,EDSON ANTONIO EDINHO DA SILVA,ELEITO,PT,SOMOS MAIS SÃO PAULO,1
PALMARES PAULISTA,DEPUTADO ESTADUAL,RAFAEL MARINHO,RAFAEL DE FIGUEIREDO MARINHO,SUPLENTE,PT,SOMOS MAIS SÃO PAULO,1
PALMARES PAULISTA,DEPUTADO ESTADUAL,ELI TEODORO,ELI TEODORO,SUPLENTE,PT,SOMOS MAIS SÃO PAULO,1
PALMARES PAULISTA,DEPUTADO ESTADUAL,ANTONIO MENTOR,ANTONIO MENTOR DE MELLO SOBRINHO,ELEITO,PT,SOMOS MAIS SÃO PAULO,4
PALMARES PAULISTA,DEPUTADO ESTADUAL,PADRE JUZEMILDO,JUZEMILDO ALBINO DA SILVA,SUPLENTE,PT,SOMOS MAIS SÃO PAULO,1
PALMARES PAULISTA,DEPUTADO ESTADUAL,ADRIANO DIOGO,ADRIANO DIOGO,ELEITO,PT,SOMOS MAIS SÃO PAULO,2
PALMARES PAULISTA,DEPUTADO ESTADUAL,LUIZ CLAUDIO MARCOLINO,LUIZ CLAUDIO MARCOLINO,ELEITO,PT,SOMOS MAIS SÃO PAULO,2
PALMARES PAULISTA,DEPUTADO ESTADUAL,NATIVIDADE,MARIA DA NATIVIDADE PEREIRA LIMA,SUPLENTE,PT,SOMOS MAIS SÃO PAULO,2
PALMARES PAULISTA,DEPUTADO ESTADUAL,BETH SAHAO,ELISABETH SAHÃO,SUPLENTE,PT,SOMOS MAIS SÃO PAULO,971
PALMARES PAULISTA,DEPUTADO ESTADUAL,JOÃO PAULO RILLO,JOÃO PAULO RILLO,ELEITO,PT,SOMOS MAIS SÃO PAULO,1199
PALMARES PAULISTA,DEPUTADO ESTADUAL,GALLO,JURANDIR GALLO,SUPLENTE,PT,SOMOS MAIS SÃO PAULO,1
PALMARES PAULISTA,DEPUTADO ESTADUAL,ELISEU COSTA,ELISEU SILVA COSTA,SUPLENTE,PT,SOMOS MAIS SÃO PAULO,1
PALMARES PAULISTA,DEPUTADO ESTADUAL,EDUARDO SIMAO,EDUARDO SIMAO DIAS,SUPLENTE,PT,SOMOS MAIS SÃO PAULO,1
PALMARES PAULISTA,DEPUTADO ESTADUAL,CARLOS NEDER,CARLOS ALBERTO PLETZ NEDER,SUPLENTE,PT,SOMOS MAIS SÃO PAULO,3
PALMARES PAULISTA,DEPUTADO ESTADUAL,LÉO ÁQUILLA,JADSON MENDES DE LIMA,SUPLENTE,PTB,PARTIDO TRABALHISTA BRASILEIRO,1
PALMARES PAULISTA,DEPUTADO ESTADUAL,KLEBER LEITE,CLEVERSON SPERBER,SUPLENTE,PTB,PARTIDO TRABALHISTA BRASILEIRO,2
PALMARES PAULISTA,DEPUTADO ESTADUAL,CAMPOS MACHADO,ANTONIO CARLOS DE CAMPOS MACHADO,ELEITO,PTB,PARTIDO TRABALHISTA BRASILEIRO,86
PALMARES PAULISTA,DEPUTADO ESTADUAL,ROQUE BARBIERE - ROQUINHO,ROQUE BARBIERE,ELEITO,PTB,PARTIDO TRABALHISTA BRASILEIRO,1
PALMARES PAULISTA,DEPUTADO ESTADUAL,VAL,ENIVALDO RAMOS DE FREITAS,SUPLENTE,PTB,PARTIDO TRABALHISTA BRASILEIRO,5
PALMARES PAULISTA,DEPUTADO ESTADUAL,TARDELLI,ROBERTO TARDELLI,SUPLENTE,PTB,PARTIDO TRABALHISTA BRASILEIRO,5
PALMARES PAULISTA,DEPUTADO ESTADUAL,WALDIR AGNELLO,WALDIR AGNELLO,SUPLENTE,PTB,PARTIDO TRABALHISTA BRASILEIRO,8
PALMARES PAULISTA,DEPUTADO ESTADUAL,BALEIA ROSSI,LUIZ FELIPE BALEIA TENUTO ROSSI,ELEITO,PMDB,PARTIDO DO MOVIMENTO DEMOCRÁTICO BRASILEIRO,15
PALMARES PAULISTA,DEPUTADO ESTADUAL,BEBETTO,ALBERTO FELIPPE HADDAD FILHO,SUPLENTE,PMDB,PARTIDO DO MOVIMENTO DEMOCRÁTICO BRASILEIRO,11
PALMARES PAULISTA,DEPUTADO ESTADUAL,CARUSO,JORGE LUIS CARUSO,ELEITO,PMDB,PARTIDO DO MOVIMENTO DEMOCRÁTICO BRASILEIRO,178
PALMARES PAULISTA,DEPUTADO ESTADUAL,FABIO BELLO,FABIO BELLO DE OLIVEIRA,SUPLENTE,PMDB,PARTIDO DO MOVIMENTO DEMOCRÁTICO BRASILEIRO,8
PALMARES PAULISTA,DEPUTADO ESTADUAL,GILBERTO FRANÇA,GILBERTO CAETANO DE FRANÇA,SUPLENTE,PMDB,PARTIDO DO MOVIMENTO DEMOCRÁTICO BRASILEIRO,1
PALMARES PAULISTA,DEPUTADO ESTADUAL,UEBE REZECK,UEBE REZECK,SUPLENTE,PMDB,PARTIDO DO MOVIMENTO DEMOCRÁTICO BRASILEIRO,6
PALMARES PAULISTA,DEPUTADO ESTADUAL,ITAMAR BORGES,ITAMAR FRANCISCO MACHADO BORGES,MÉDIA,PMDB,PARTIDO DO MOVIMENTO DEMOCRÁTICO BRASILEIRO,32
PALMARES PAULISTA,DEPUTADO ESTADUAL,JONAS,JONAS PEREIRA DE LIMA,SUPLENTE,PMDB,PARTIDO DO MOVIMENTO DEMOCRÁTICO BRASILEIRO,1
PALMARES PAULISTA,DEPUTADO ESTADUAL,DRA SILVANA,SILVANA CASSIA RIBEIRO BAPTISTA,SUPLENTE,PMDB,PARTIDO DO MOVIMENTO DEMOCRÁTICO BRASILEIRO,1
PALMARES PAULISTA,DEPUTADO ESTADUAL,MARIA DO CARMO GUILHERME,MARIA DO CARMO GUILHERME,SUPLENTE,PMDB,PARTIDO DO MOVIMENTO DEMOCRÁTICO BRASILEIRO,1
PALMARES PAULISTA,DEPUTADO ESTADUAL,SOUZA VIGILANTE,JOSÉ CLAUDIVAM DOS SANTOS SOUZA,SUPLENTE,PMDB,PARTIDO DO MOVIMENTO DEMOCRÁTICO BRASILEIRO,2
PALMARES PAULISTA,DEPUTADO ESTADUAL,RENATO PUPO,RENATO PUPO DE PAULA,SUPLENTE,PSC,HUMANISTA CRISTÃO ,7
PALMARES PAULISTA,DEPUTADO ESTADUAL,GUSTAVO POZZI,GUSTAVO CAETANO POZZI DA CUNHA,SUPLENTE,PSC,HUMANISTA CRISTÃO ,2
PALMARES PAULISTA,DEPUTADO ESTADUAL,RODRIGO MORAES,RODRIGO AUGUSTO MORAES,ELEITO,PSC,HUMANISTA CRISTÃO ,31
PALMARES PAULISTA,DEPUTADO ESTADUAL,NELSON RODRIGUES,NELSON DOS SANTOS RODRIGUES,SUPLENTE,PSC,HUMANISTA CRISTÃO ,1
PALMARES PAULISTA,DEPUTADO ESTADUAL,ZE PEDRO,JOSE PEDRO LEITE DA SILVA,SUPLENTE,PR,SOMOS MAIS SÃO PAULO,10
PALMARES PAULISTA,DEPUTADO ESTADUAL,ALEXANDRE DA FARMACIA,ALEXANDRE JOSE DA CUNHA,SUPLENTE,PR,SOMOS MAIS SÃO PAULO,8
PALMARES PAULISTA,DEPUTADO ESTADUAL,ANDRE DO PRADO,ANDRE LUIS DO PRADO,ELEITO,PR,SOMOS MAIS SÃO PAULO,1
PALMARES PAULISTA,DEPUTADO ESTADUAL,EDUARDO REZEK,EDUARDO PEDROSO REZEK,SUPLENTE,PPS,PARTIDO POPULAR SOCIALISTA,3
PALMARES PAULISTA,DEPUTADO ESTADUAL,BRAZ,BRAZ ANTUNES MATTOS NETO,SUPLENTE,PPS,PARTIDO POPULAR SOCIALISTA,1
PALMARES PAULISTA,DEPUTADO ESTADUAL,DAVI ZAIA,DAVID ZAIA,MÉDIA,PPS,PARTIDO POPULAR SOCIALISTA,48
PALMARES PAULISTA,DEPUTADO ESTADUAL,PROF DIMAS NOVAIS,DIMAS NOVAIS DE OLIVEIRA,SUPLENTE,PPS,PARTIDO POPULAR SOCIALISTA,1
PALMARES PAULISTA,DEPUTADO ESTADUAL,PALHACINHO PIMPAO,VAGNER LUIZ PIMPAO BERSA,SUPLENTE,PPS,PARTIDO POPULAR SOCIALISTA,17
PALMARES PAULISTA,DEPUTADO ESTADUAL,VITOR SAPIENZA,VITOR SAPIENZA,SUPLENTE,PPS,PARTIDO POPULAR SOCIALISTA,1
PALMARES PAULISTA,DEPUTADO ESTADUAL,GONDIM,LUIZ CARLOS GONDIM TEIXEIRA,ELEITO,PPS,PARTIDO POPULAR SOCIALISTA,2
PALMARES PAULISTA,DEPUTADO ESTADUAL,ESTEVÃO,STEVEN ERIKSEN BINNIE,SUPLENTE,PPS,PARTIDO POPULAR SOCIALISTA,20
PALMARES PAULISTA,DEPUTADO ESTADUAL,PROFESSOR ZE MARIA,JOSE MARIA CANCELLIERO,SUPLENTE,PPS,PARTIDO POPULAR SOCIALISTA,6
PALMARES PAULISTA,DEPUTADO ESTADUAL,JOSE CLAUDIO,JOSE CLAUDIO DE SOUZA,SUPLENTE,PPS,PARTIDO POPULAR SOCIALISTA,1
PALMARES PAULISTA,DEPUTADO ESTADUAL,EURIPINHO ARTILHEIRO DO POVO,OLIMPIO JORGE NABEN,SUPLENTE,PPS,PARTIDO POPULAR SOCIALISTA,4
PALMARES PAULISTA,DEPUTADO ESTADUAL,ANDRE SOARES,ANDRE BEZERRA RIBEIRO SOARES,ELEITO,DEM,PSDB/DEM,8
PALMARES PAULISTA,DEPUTADO ESTADUAL,ULISSES SALES,ULISSES ROBERTO CORNAZZANI SALES,SUPLENTE,DEM,PSDB/DEM,2
PALMARES PAULISTA,DEPUTADO ESTADUAL,EDMIR CHEDID,EDMIR JOSE ABI CHEDID,ELEITO,DEM,PSDB/DEM,5
PALMARES PAULISTA,DEPUTADO ESTADUAL,FERNANDO LUCAS,LUIZ FERNANDO AMARAL LUCAS,SUPLENTE,DEM,PSDB/DEM,3
PALMARES PAULISTA,DEPUTADO ESTADUAL,ESTEVAM GALVAO,ESTEVAM GALVAO DE OLIVEIRA,ELEITO,DEM,PSDB/DEM,1
PALMARES PAULISTA,DEPUTADO ESTADUAL,ROBERTO CACCIARI,ROBERTO CACCIARI,SUPLENTE,DEM,PSDB/DEM,47
PALMARES PAULISTA,DEPUTADO ESTADUAL,LEANDRO DO KLB,LEANDRO FINATO SCORNAVACCA,SUPLENTE,DEM,PSDB/DEM,5
PALMARES PAULISTA,DEPUTADO ESTADUAL,BOLÇONE,ORLANDO JOSE BOLÇONE,SUPLENTE,PSB,PARTIDO SOCIALISTA BRASILEIRO,6
PALMARES PAULISTA,DEPUTADO ESTADUAL,DR. JOSÉ RICARDO,JOSÉ RICARDO DIAS,SUPLENTE,PSB,PARTIDO SOCIALISTA BRASILEIRO,3
PALMARES PAULISTA,DEPUTADO ESTADUAL,ZÉ CABELEIREIRO,JOSÉ ANTONIO CARDOSO DA SILVA,SUPLENTE,PSB,PARTIDO SOCIALISTA BRASILEIRO,1
PALMARES PAULISTA,DEPUTADO ESTADUAL,BACCARIN,SILVIO LUIZ BACCARIN,SUPLENTE,PSB,PARTIDO SOCIALISTA BRASILEIRO,1
PALMARES PAULISTA,DEPUTADO ESTADUAL,FELICIANO,FELICIANO NAHIMY FILHO,ELEITO,PV,PARTIDO VERDE,6
PALMARES PAULISTA,DEPUTADO ESTADUAL,CLEBER GAÚCHO,CLEBER DA ROSA MOREIRA,SUPLENTE,PV,PARTIDO VERDE,1
PALMARES PAULISTA,DEPUTADO ESTADUAL,CAMILO GAVA,JOSÉ CAMILO GAVA NETO,SUPLENTE,PV,PARTIDO VERDE,5
PALMARES PAULISTA,DEPUTADO ESTADUAL,RITA PASSOS,RITA DE CASSIA TRINCA PASSOS,ELEITO,PV,PARTIDO VERDE,69
PALMARES PAULISTA,DEPUTADO ESTADUAL,REINALDO ALGUZ,REINALDO DE SOUZA ALGUZ,ELEITO,PV,PARTIDO VERDE,6
PALMARES PAULISTA,DEPUTADO ESTADUAL,FLAVIO OLIVEIRA,FLAVIO HENRIQUE TEIXEIRA DE OLIVEIRA,SUPLENTE,PV,PARTIDO VERDE,1
PALMARES PAULISTA,DEPUTADO ESTADUAL,PR.JOSÉ PEREIRA,JOSÉ PEREIRA FIRMO,SUPLENTE,PV,PARTIDO VERDE,2
PALMARES PAULISTA,DEPUTADO ESTADUAL,PASTOR DILMO DOS SANTOS,DILMO DOS SANTOS,ELEITO,PV,PARTIDO VERDE,1
PALMARES PAULISTA,DEPUTADO ESTADUAL,SÉRGIO CONTENTE,SERGIO CONTENTE,SUPLENTE,PV,PARTIDO VERDE,6
PALMARES PAULISTA,DEPUTADO ESTADUAL,HELIO RUBENS,HELIO RUBENS GONÇALVES FIGUEIREDO,SUPLENTE,PSDB,PSDB/DEM,19
PALMARES PAULISTA,DEPUTADO ESTADUAL,UBIRAJARA GUIMARÃES,UBIRAJARA PEREIRA GUIMARÃES,SUPLENTE,PSDB,PSDB/DEM,18
PALMARES PAULISTA,DEPUTADO ESTADUAL,MARIA ZEFERINA BALDAIA,MARIA ZEFERINA RODRIGUES BALDAIA,SUPLENTE,PSDB,PSDB/DEM,1
PALMARES PAULISTA,DEPUTADO ESTADUAL,GERALDO VINHOLI,GERALDO ANTONIO VINHOLI,SUPLENTE,PSDB,PSDB/DEM,1008
PALMARES PAULISTA,DEPUTADO ESTADUAL,WELSON GASPARINI,WELSON GASPARINI,SUPLENTE,PSDB,PSDB/DEM,2
PALMARES PAULISTA,DEPUTADO ESTADUAL,MAURO BRAGATO,MAURO BRAGATO,ELEITO,PSDB,PSDB/DEM,1
PALMARES PAULISTA,DEPUTADO ESTADUAL,BRUNO COVAS,BRUNO COVAS LOPES,ELEITO,PSDB,PSDB/DEM,6
PALMARES PAULISTA,DEPUTADO ESTADUAL,CLOVIS CHAVES,CLOVIS LUIZ CHAVES,SUPLENTE,PSDB,PSDB/DEM,24
PALMARES PAULISTA,DEPUTADO ESTADUAL,BORELI,OSWALDO LUIZ OLIVEIRA BORRELLI,SUPLENTE,PSDB,PSDB/DEM,1
