BEBEDOURO,DEPUTADO FEDERAL,CAPITÃO AUGUSTO,JOSÉ AUGUSTO ROSA,SUPLENTE,PSB,PRESTE ATENÇÃO SÃO PAULO,59
BEBEDOURO,DEPUTADO FEDERAL,LUIZA ERUNDINA,LUIZA ERUNDINA DE SOUSA,ELEITO,PSB,PRESTE ATENÇÃO SÃO PAULO,11
BEBEDOURO,DEPUTADO FEDERAL,TORINO,PAULO SERGIO TORINO,SUPLENTE,PSB,PRESTE ATENÇÃO SÃO PAULO,3
BEBEDOURO,DEPUTADO FEDERAL,GABRIEL CHALITA,GABRIEL BENEDITO ISSAAC CHALITA,ELEITO,PSB,PRESTE ATENÇÃO SÃO PAULO,469
BEBEDOURO,DEPUTADO FEDERAL,MÁRCIO FRANÇA,MÁRCIO LUIZ FRANÇA GOMES,ELEITO,PSB,PRESTE ATENÇÃO SÃO PAULO,3
BEBEDOURO,DEPUTADO FEDERAL,CORAUCI,VALDEMAR CORAUCI SOBRINHO,SUPLENTE,PSB,PRESTE ATENÇÃO SÃO PAULO,13
BEBEDOURO,DEPUTADO FEDERAL,RUBINHO CAI CAI,RUBENS ESTEVES ROQUE,SUPLENTE,PSB,PRESTE ATENÇÃO SÃO PAULO,1
BEBEDOURO,DEPUTADO FEDERAL,DRA. ROSIANE FARIAS,ROSIANE MACIEL DE FARIAS,SUPLENTE,PSB,PRESTE ATENÇÃO SÃO PAULO,8
BEBEDOURO,DEPUTADO FEDERAL,TONINHO GARMS,ANTONIO CARLOS GARMS,SUPLENTE,PSB,PRESTE ATENÇÃO SÃO PAULO,1
BEBEDOURO,DEPUTADO FEDERAL,CIDA SANTANA,MARIA APARECIDA SANTANA,SUPLENTE,PSB,PRESTE ATENÇÃO SÃO PAULO,1
BEBEDOURO,DEPUTADO FEDERAL,NILZÃO ART,ERISVALDO GOMES PEREIRA,SUPLENTE,PSB,PRESTE ATENÇÃO SÃO PAULO,3
BEBEDOURO,DEPUTADO FEDERAL,JEFFERSON CAMPOS,JEFFERSON ALVES DE CAMPOS,ELEITO,PSB,PRESTE ATENÇÃO SÃO PAULO,54
BEBEDOURO,DEPUTADO FEDERAL,DR. UBIALI,MARCO AURÉLIO UBIALI,SUPLENTE,PSB,PRESTE ATENÇÃO SÃO PAULO,276
BEBEDOURO,DEPUTADO FEDERAL,VICENTE CAPRINO,VICENTE ANTONIO CAPRINO,SUPLENTE,PSB,PRESTE ATENÇÃO SÃO PAULO,1
BEBEDOURO,DEPUTADO FEDERAL,OTA,IOLANDA KEIKO MIASHIRO OTA,ELEITO,PSB,PRESTE ATENÇÃO SÃO PAULO,16
BEBEDOURO,DEPUTADO FEDERAL,GUILHERME MUSSI,GUILHERME MUSSI FERREIRA,ELEITO,PV,PARTIDO VERDE,24
BEBEDOURO,DEPUTADO FEDERAL,GILBERTO ABREU,GILBERTO ANDRADE DE ABREU,SUPLENTE,PV,PARTIDO VERDE,46
BEBEDOURO,DEPUTADO FEDERAL,WALTER GONZALIS,WALTER GONZALIS,SUPLENTE,PV,PARTIDO VERDE,5
BEBEDOURO,DEPUTADO FEDERAL,DR. NEVTON OLIVEIRA ROCHA,NEVTON OLIVEIRA ROCHA,SUPLENTE,PV,PARTIDO VERDE,8
BEBEDOURO,DEPUTADO FEDERAL,DR TALMIR,TALMIR RODRIGUES,SUPLENTE,PV,PARTIDO VERDE,7
BEBEDOURO,DEPUTADO FEDERAL,VICENTE DA UPA,VICENTE CARVALHO E SILVA,SUPLENTE,PV,PARTIDO VERDE,105
BEBEDOURO,DEPUTADO FEDERAL,EDNA MARTINS,EDNA SANDRA MARTINS,SUPLENTE,PV,PARTIDO VERDE,10
BEBEDOURO,DEPUTADO FEDERAL,RAÍ,RAIMUNDO SOUZA TEIXEIRA,SUPLENTE,PV,PARTIDO VERDE,1
BEBEDOURO,DEPUTADO FEDERAL,DR. SINVAL MALHEIROS,SINVAL MALHEIROS PINTO JÚNIOR,SUPLENTE,PV,PARTIDO VERDE,92
BEBEDOURO,DEPUTADO FEDERAL,DANIEL MARINS,DANIEL MARINS ALESSI,SUPLENTE,PV,PARTIDO VERDE,2
BEBEDOURO,DEPUTADO FEDERAL,JULIO CASTILHO,JULIO CESAR CASTILHO,SUPLENTE,PV,PARTIDO VERDE,2
BEBEDOURO,DEPUTADO FEDERAL,ROBERTO SANTIAGO,JOSE ROBERTO SANTIAGO GOMES,ELEITO,PV,PARTIDO VERDE,111
BEBEDOURO,DEPUTADO FEDERAL,DR INDIO,ALMIR SANTOS,SUPLENTE,PV,PARTIDO VERDE,1
BEBEDOURO,DEPUTADO FEDERAL,SAMBIASE,LUIZ FERNANDO FILIPPI SAMBIASE,SUPLENTE,PV,PARTIDO VERDE,1
BEBEDOURO,DEPUTADO FEDERAL,CESAR CORTEZ,ANTONIO CESAR CORTEZ,SUPLENTE,PV,PARTIDO VERDE,2
BEBEDOURO,DEPUTADO FEDERAL,ZICA,EUSTAQUIO LUCIANO ZICA,SUPLENTE,PV,PARTIDO VERDE,3
BEBEDOURO,DEPUTADO FEDERAL,CHICO SANTA RITA,FRANCISCO JOSE DE SANTA RITA BEHR,SUPLENTE,PV,PARTIDO VERDE,1
BEBEDOURO,DEPUTADO FEDERAL,NUBIA SENNA,NUBIA DE SENA CARNEIRO,SUPLENTE,PV,PARTIDO VERDE,1
BEBEDOURO,DEPUTADO FEDERAL,MARIA DOLORES,MARIA DOLORES RODRIGUES JORDAN ORFEI ABE,SUPLENTE,PV,PARTIDO VERDE,1
BEBEDOURO,DEPUTADO FEDERAL,JAIME ROCHA,JAIME BARTOLOMEU DA ROCHA,SUPLENTE,PV,PARTIDO VERDE,1
BEBEDOURO,DEPUTADO FEDERAL,JOVINO CÂNDIDO,JOVINO CÂNDIDO DA SILVA,SUPLENTE,PV,PARTIDO VERDE,1
BEBEDOURO,DEPUTADO FEDERAL,ANA PAULA JUNQUEIRA,ANA PAULA GUIMARAES DE AZEVEDO JUNQUEIRA,SUPLENTE,PV,PARTIDO VERDE,50
BEBEDOURO,DEPUTADO FEDERAL,MARINO BONACCHI,MARINO MARTINI BONACCHI,SUPLENTE,PV,PARTIDO VERDE,1
BEBEDOURO,DEPUTADO FEDERAL,EVANDRO GUSSI,EVANDRO HERRERA BERTONE GUSSI,SUPLENTE,PV,PARTIDO VERDE,90
BEBEDOURO,DEPUTADO FEDERAL,TOFFANO,JOSE PAULO TOFFANO,SUPLENTE,PV,PARTIDO VERDE,29
BEBEDOURO,DEPUTADO FEDERAL,ALE YOUSSEF,ALEXANDRE DE ALMEIDA YOUSSEF,SUPLENTE,PV,PARTIDO VERDE,12
BEBEDOURO,DEPUTADO FEDERAL,MARCELO ORTIZ,FRANCISCO MARCELO ORTIZ FILHO,SUPLENTE,PV,PARTIDO VERDE,2
BEBEDOURO,DEPUTADO FEDERAL,PENNA,JOSÉ LUIZ DE FRANÇA PENNA,ELEITO,PV,PARTIDO VERDE,33
BEBEDOURO,DEPUTADO FEDERAL,ROBERTO DE LUCENA,ROBERTO ALVES DE LUCENA,ELEITO,PV,PARTIDO VERDE,91
BEBEDOURO,DEPUTADO FEDERAL,DR. ÂNGELO,ANGELO DOMINGOS NUCCI,SUPLENTE,PV,PARTIDO VERDE,2
BEBEDOURO,DEPUTADO FEDERAL,PAMPA,ANDRE FELIPPE FALBO FERREIRA,SUPLENTE,PV,PARTIDO VERDE,2
BEBEDOURO,DEPUTADO FEDERAL,JOSÉ ALEXANDRE RIBEIRO,JOSE ALEXANDRE RIBEIRO,SUPLENTE,PV,PARTIDO VERDE,5
BEBEDOURO,DEPUTADO FEDERAL,DANILO PARO,DANILO JOSÉ PARO,SUPLENTE,PV,PARTIDO VERDE,2
BEBEDOURO,DEPUTADO FEDERAL,J FARIA,JOSE JESUS APARECIDO DE FARIA,SUPLENTE,PV,PARTIDO VERDE,56
BEBEDOURO,DEPUTADO FEDERAL,NICE SOU A DIARISTA,EUNICE SANTANA SANTOS,SUPLENTE,PV,PARTIDO VERDE,1
BEBEDOURO,DEPUTADO FEDERAL,CARLINHOS SILVA,ANTONIO CARLOS ALVES DA SILVA,SUPLENTE,PV,PARTIDO VERDE,38
BEBEDOURO,DEPUTADO FEDERAL,RICARDO IZAR,RICARDO IZAR JUNIOR,ELEITO,PV,PARTIDO VERDE,20
BEBEDOURO,DEPUTADO FEDERAL,BERQUE,CARLOS CESAR BERQUE,SUPLENTE,PV,PARTIDO VERDE,2
BEBEDOURO,DEPUTADO FEDERAL,DR. RAUL,RAUL APARECIDO GONÇALVES PAULA,SUPLENTE,PV,PARTIDO VERDE,2
BEBEDOURO,DEPUTADO FEDERAL,LUIZA ELUF,LUIZA NAGIB ELUF,SUPLENTE,PV,PARTIDO VERDE,7
BEBEDOURO,DEPUTADO FEDERAL,TECO,MARCOS FERREIRA GODOY,SUPLENTE,PV,PARTIDO VERDE,5
BEBEDOURO,DEPUTADO FEDERAL,VILSON ALVES,VILSON OSCHIN ALVES,SUPLENTE,PV,PARTIDO VERDE,1
BEBEDOURO,DEPUTADO FEDERAL,PROFESSOR EVERALDO,EVERALDO SOUZA DOS SANTOS,SUPLENTE,PV,PARTIDO VERDE,1
BEBEDOURO,DEPUTADO FEDERAL,PROF SHIN,SHUY WEN SHIN,SUPLENTE,PV,PARTIDO VERDE,1
BEBEDOURO,DEPUTADO FEDERAL,AMAURY CAMARGO MONICO,AMAURY CAMARGO MONACO,SUPLENTE,PV,PARTIDO VERDE,9
BEBEDOURO,DEPUTADO FEDERAL,HENRIQUE NUNES,HENRIQUE ANTONIO PAIVA NUNES,SUPLENTE,PV,PARTIDO VERDE,6
BEBEDOURO,DEPUTADO FEDERAL,VERA MOTTA,VERA LÚCIA DA MOTTA,SUPLENTE,PV,PARTIDO VERDE,1
BEBEDOURO,DEPUTADO FEDERAL,CARLOS SAMPAIO,CARLOS HENRIQUE FOCESI SAMPAIO,ELEITO,PSDB,PSDB/DEM/PPS,43
BEBEDOURO,DEPUTADO FEDERAL,POPPI,JOÃO HENRIQUE GONÇALVES MARCICANO POPPI,SUPLENTE,PSDB,PSDB/DEM/PPS,2
BEBEDOURO,DEPUTADO FEDERAL,JOSE LUIZ,JOSE LUIZ SILVA BRUNO,SUPLENTE,PSDB,PSDB/DEM/PPS,2
BEBEDOURO,DEPUTADO FEDERAL,STANGARLINI,JOSE CARLOS STANGARLINI,SUPLENTE,PSDB,PSDB/DEM/PPS,5
BEBEDOURO,DEPUTADO FEDERAL,RAUL CHRISTIANO,RAUL CHRISTIANO DE OLIVEIRA SANCHEZ,SUPLENTE,PSDB,PSDB/DEM/PPS,10
BEBEDOURO,DEPUTADO FEDERAL,LOBBE NETO,ANTONIO ADOLPHO LOBBE NETO,SUPLENTE,PSDB,PSDB/DEM/PPS,34
BEBEDOURO,DEPUTADO FEDERAL,FELICIDADE,FELICIDADE LOPES PONTES,SUPLENTE,PSDB,PSDB/DEM/PPS,3
BEBEDOURO,DEPUTADO FEDERAL,MANOEL MARCOS (MANÉ),MANOEL MARCOS DE JESUS FERREIRA,SUPLENTE,PSDB,PSDB/DEM/PPS,6
BEBEDOURO,DEPUTADO FEDERAL,EMANUEL FERNANDES,EMANUEL FERNANDES,ELEITO,PSDB,PSDB/DEM/PPS,38
BEBEDOURO,DEPUTADO FEDERAL,MARA GABRILLI,MARA CRISTINA GABRILLI,ELEITO,PSDB,PSDB/DEM/PPS,37
BEBEDOURO,DEPUTADO FEDERAL,JOÃO PAULO FERRARESSO,JOÃO PAULO CORSETTI FERRARESSO,SUPLENTE,PSDB,PSDB/DEM/PPS,2
BEBEDOURO,DEPUTADO FEDERAL,MARCOS ARAUJO,MARCOS ROSA DE ARAUJO,SUPLENTE,PSDB,PSDB/DEM/PPS,1
BEBEDOURO,DEPUTADO FEDERAL,CARLOS BRAGA,CARLOS EDUARDO FARACO BRAGA,SUPLENTE,PSDB,PSDB/DEM/PPS,4
BEBEDOURO,DEPUTADO FEDERAL,LELIS DA ROCHA,LELIS DA ROCHA,SUPLENTE,PSDB,PSDB/DEM/PPS,2
BEBEDOURO,DEPUTADO FEDERAL,CARLOS ROBERTO,CARLOS ROBERTO DE CAMPOS,SUPLENTE,PSDB,PSDB/DEM/PPS,10
BEBEDOURO,DEPUTADO FEDERAL,DIB,WILLIAM DIB,ELEITO,PSDB,PSDB/DEM/PPS,3
BEBEDOURO,DEPUTADO FEDERAL,PANNUNZIO,ANTONIO CARLOS PANNUNZIO,SUPLENTE,PSDB,PSDB/DEM/PPS,7
BEBEDOURO,DEPUTADO FEDERAL,LUCIA SANTUCCI,LUCIA MARIA SANTUCCI,SUPLENTE,PSDB,PSDB/DEM/PPS,1
BEBEDOURO,DEPUTADO FEDERAL,ALBERTO MOURAO,ALBERTO PEREIRA MOURAO,SUPLENTE,PSDB,PSDB/DEM/PPS,26
BEBEDOURO,DEPUTADO FEDERAL,DR ANDRE SACCO,ANDRE SACCO JUNIOR,SUPLENTE,PSDB,PSDB/DEM/PPS,2
BEBEDOURO,DEPUTADO FEDERAL,SILVIO TORRES,SILVIO FRANÇA TORRES,SUPLENTE,PSDB,PSDB/DEM/PPS,1
BEBEDOURO,DEPUTADO FEDERAL,TIRSO MEIRELLES,TIRSO DE SALLES MEIRELLES,SUPLENTE,PSDB,PSDB/DEM/PPS,33
BEBEDOURO,DEPUTADO FEDERAL,TERESA SERRANO,MARIA TERESA SERRANO AFONSO,SUPLENTE,PSDB,PSDB/DEM/PPS,2
BEBEDOURO,DEPUTADO FEDERAL,EDSON APARECIDO,EDSON APARECIDO DOS SANTOS,ELEITO,PSDB,PSDB/DEM/PPS,264
BEBEDOURO,DEPUTADO FEDERAL,RICARDO MONTORO,JOSE RICARDO FRANCO MONTORO,SUPLENTE,PSDB,PSDB/DEM/PPS,36
BEBEDOURO,DEPUTADO FEDERAL,LUIZ FERNANDO MACHADO,LUIZ FERNANDO ARANTES MACHADO,ELEITO,PSDB,PSDB/DEM/PPS,9
BEBEDOURO,DEPUTADO FEDERAL,DR. MARCELO,MARCELO CHEHADE,SUPLENTE,PSDB,PSDB/DEM/PPS,1
BEBEDOURO,DEPUTADO FEDERAL,VANDERLEI MACRIS,VANDERLEI MACRIS,SUPLENTE,PSDB,PSDB/DEM/PPS,11
BEBEDOURO,DEPUTADO FEDERAL,DUARTE NOGUEIRA,ANTONIO DUARTE NOGUEIRA JUNIOR,ELEITO,PSDB,PSDB/DEM/PPS,456
BEBEDOURO,DEPUTADO FEDERAL,JULIO SEMEGHINI,JULIO FRACISCO SEMEGHINI NETO,ELEITO,PSDB,PSDB/DEM/PPS,113
BEBEDOURO,DEPUTADO FEDERAL,RAFAEL ABUD,RAFAEL ANGELO ABUD,SUPLENTE,PSDB,PSDB/DEM/PPS,9
BEBEDOURO,DEPUTADO FEDERAL,GIVALDO VIEIRA,GIVALDO RODRIGUES VIEIRA,SUPLENTE,PSDB,PSDB/DEM/PPS,4
BEBEDOURO,DEPUTADO FEDERAL,TRIPOLI,JOSÉ RICARDO ALVARENGA TRIPOLI,ELEITO,PSDB,PSDB/DEM/PPS,25
BEBEDOURO,DEPUTADO FEDERAL,FERNANDO FUAD CHUCRE,FERNANDO BARRANCOS CHUCRE,SUPLENTE,PSDB,PSDB/DEM/PPS,4
BEBEDOURO,DEPUTADO FEDERAL,VAZ DE LIMA,JOSÉ CARLOS VAZ DE LIMA,ELEITO,PSDB,PSDB/DEM/PPS,1266
BEBEDOURO,DEPUTADO FEDERAL,ALEMÃO DA SÁUDE,CLAUDEMIR SERENO,SUPLENTE,PSDB,PSDB/DEM/PPS,1
BEBEDOURO,DEPUTADO FEDERAL,TIÃO,SEBASTIÃO FERRES ARSENE,SUPLENTE,PSDB,PSDB/DEM/PPS,1
BEBEDOURO,DEPUTADO FEDERAL,WALTER FELDMAN,WALTER MEYER FELDMAN,SUPLENTE,PSDB,PSDB/DEM/PPS,10
BEBEDOURO,DEPUTADO FEDERAL,THAME,ANTONIO CARLOS DE MENDES THAME,ELEITO,PSDB,PSDB/DEM/PPS,192
BEBEDOURO,DEPUTADO FEDERAL,ARNALDO MADEIRA,ARNALDO DE ABREU MADEIRA,SUPLENTE,PSDB,PSDB/DEM/PPS,15
BEBEDOURO,DEPUTADO FEDERAL,BRUNA FURLAN,BRUNA DIAS FURLAN,ELEITO,PSDB,PSDB/DEM/PPS,29
BEBEDOURO,DEPUTADO FEDERAL,JOSÉ ANIBAL,JOSÉ ANIBAL PERES DE PONTES,ELEITO,PSDB,PSDB/DEM/PPS,306
BEBEDOURO,DEPUTADO FEDERAL,GILBERTO BORJA,GILBERTO BORJA PINTO,SUPLENTE,PSDB,PSDB/DEM/PPS,2
BEBEDOURO,DEPUTADO FEDERAL,JAMIL PRUDENCIANO,JAMIL PAULO PRUDENCIANO,SUPLENTE,PSOL,PARTIDO SOCIALISMO E LIBERDADE,2
BEBEDOURO,DEPUTADO FEDERAL,PROF. NETO,DACIO VIEIRA DE CAMARGO NETO,SUPLENTE,PSOL,PARTIDO SOCIALISMO E LIBERDADE,1
BEBEDOURO,DEPUTADO FEDERAL,FAUSTO NETO,FAUSTO FRANCISCO DOS SANTOS NETO,SUPLENTE,PSOL,PARTIDO SOCIALISMO E LIBERDADE,4
BEBEDOURO,DEPUTADO FEDERAL,JANDUHY ALENCAR,JANDUHY CORDEIRO DE ALENCAR,SUPLENTE,PSOL,PARTIDO SOCIALISMO E LIBERDADE,1
BEBEDOURO,DEPUTADO FEDERAL,JOSÉ CARLOS DOS SANTOS,JOSE CARLOS DOS SANTOS,SUPLENTE,PSOL,PARTIDO SOCIALISMO E LIBERDADE,1
BEBEDOURO,DEPUTADO FEDERAL,PEDRO ROBERTO,PEDRO ROBERTO GOMES,SUPLENTE,PSOL,PARTIDO SOCIALISMO E LIBERDADE,1
BEBEDOURO,DEPUTADO FEDERAL,IVAN VALENTE,IVAN VALENTE,ELEITO,PSOL,PARTIDO SOCIALISMO E LIBERDADE,172
BEBEDOURO,DEPUTADO FEDERAL,PROFESSORA MÁRCIA TAVARES,MÁRCIA TAVARES DO NASCIMENTO,SUPLENTE,PSOL,PARTIDO SOCIALISMO E LIBERDADE,2
BEBEDOURO,DEPUTADO FEDERAL,MARIO CONCEIÇÃO,MARIO CONCEIÇÃO,SUPLENTE,PSOL,PARTIDO SOCIALISMO E LIBERDADE,2
BEBEDOURO,DEPUTADO FEDERAL,ROSELI QUEIROZ,ROSELI QUEIROZ ALMEIDA,SUPLENTE,PSOL,PARTIDO SOCIALISMO E LIBERDADE,1
BEBEDOURO,DEPUTADO FEDERAL,MARIANA CONTI,MARIANA CONTI TAKAHASHI,SUPLENTE,PSOL,PARTIDO SOCIALISMO E LIBERDADE,1
BEBEDOURO,DEPUTADO FEDERAL,DR. ABELHA,CARLOS FERNANDO LOPES ABELHA,SUPLENTE,PC DO B,JUNTOS POR SÃO PAULO,3
BEBEDOURO,DEPUTADO FEDERAL,BENEH SANTOS,BENEDITO HERNELIO DOS SANTOS,SUPLENTE,PC DO B,JUNTOS POR SÃO PAULO,97
BEBEDOURO,DEPUTADO FEDERAL,ALDO REBELO,JOSÉ ALDO REBELO FIGUEIREDO,ELEITO,PC DO B,JUNTOS POR SÃO PAULO,133
BEBEDOURO,DEPUTADO FEDERAL,DELEGADO PROTÓGENES,PROTÓGENES PINHEIRO DE QUEIROZ,MÉDIA,PC DO B,JUNTOS POR SÃO PAULO,67
BEBEDOURO,DEPUTADO FEDERAL,JOAO ARAUJO,JOAO LUIS ARAUJO NETO,SUPLENTE,PT DO B,JUNTOS POR SÃO PAULO,3
BEBEDOURO,DEPUTADO FEDERAL,DR MARCAO DA MANCHA,MARCO ANTONIO NOTARI,SUPLENTE,PT DO B,JUNTOS POR SÃO PAULO,1
BEBEDOURO,DEPUTADO ESTADUAL,CORINTHIANO,RODRIGO GHIRALDELLI,SUPLENTE,PRB,SOMOS MAIS SÃO PAULO,2
BEBEDOURO,DEPUTADO ESTADUAL,GILMACI SANTOS,GILMACI DOS SANTOS BARBOSA,ELEITO,PRB,SOMOS MAIS SÃO PAULO,8
BEBEDOURO,DEPUTADO ESTADUAL,SEBASTIÃO SANTOS,SEBASTIÃO DOS SANTOS FILHO,ELEITO,PRB,SOMOS MAIS SÃO PAULO,224
BEBEDOURO,DEPUTADO ESTADUAL,HAVANIR,HAVANIR TAVARES DE ALMEIDA NIMTZ,SUPLENTE,PRB,SOMOS MAIS SÃO PAULO,2
BEBEDOURO,DEPUTADO ESTADUAL,RICARDO SARAVALLI,RICARDO SARAVALLI,SUPLENTE,PP,PARTIDO PROGRESSISTA,4
BEBEDOURO,DEPUTADO ESTADUAL,MALEK,ROBSON MALEK,SUPLENTE,PP,PARTIDO PROGRESSISTA,4
BEBEDOURO,DEPUTADO ESTADUAL,DR. ARY MACEDO,ARY AUGUSTO REIS DE MACEDO,SUPLENTE,PP,PARTIDO PROGRESSISTA,1
BEBEDOURO,DEPUTADO ESTADUAL,CURIATI,ANTONIO SALIM CURIATI,ELEITO,PP,PARTIDO PROGRESSISTA,32
BEBEDOURO,DEPUTADO ESTADUAL,HALEPLIAN,SYLVIO HALEPLIAN FILHO,SUPLENTE,PP,PARTIDO PROGRESSISTA,2
BEBEDOURO,DEPUTADO ESTADUAL,MIGUEL ROMERO JR,MIGUEL ROMERO JUNIOR,SUPLENTE,PP,PARTIDO PROGRESSISTA,1
BEBEDOURO,DEPUTADO ESTADUAL,MANÉ DO PP,MANOEL DE ALMEIDA,SUPLENTE,PP,PARTIDO PROGRESSISTA,1
BEBEDOURO,DEPUTADO ESTADUAL,SARGENTO REIS,MARIO JOSÉ DOS REIS,SUPLENTE,PP,PARTIDO PROGRESSISTA,4
BEBEDOURO,DEPUTADO ESTADUAL,SIMONY,SIMONY BENELLI GALASSO,SUPLENTE,PP,PARTIDO PROGRESSISTA,5
BEBEDOURO,DEPUTADO ESTADUAL,RAIMUNDO DA AÇÃO,RAIMUNDO SILISTRO DE OLIVEIRA,SUPLENTE,PP,PARTIDO PROGRESSISTA,1
BEBEDOURO,DEPUTADO ESTADUAL,RIBEIRÃO,ANTONIO ALVES DE SOUZA,SUPLENTE,PP,PARTIDO PROGRESSISTA,2
BEBEDOURO,DEPUTADO ESTADUAL,DIOGO TICLY,DIOGO GAZZE TICLY,SUPLENTE,PP,PARTIDO PROGRESSISTA,4
BEBEDOURO,DEPUTADO ESTADUAL,JOÃO ARAUJO,JOÃO ANTONIO DE ARAUJO,SUPLENTE,PP,PARTIDO PROGRESSISTA,4
BEBEDOURO,DEPUTADO ESTADUAL,DR. IRINEU,IRINEU CARDOSO DOS SANTOS,SUPLENTE,PP,PARTIDO PROGRESSISTA,1
BEBEDOURO,DEPUTADO ESTADUAL,MARIA CLEMENTINA,MARIA CLEMENTINO DE SOUSA,SUPLENTE,PP,PARTIDO PROGRESSISTA,1
BEBEDOURO,DEPUTADO ESTADUAL,LAZARO TAVARES CUNHA,LAZARO TAVARES DA CUNHA,SUPLENTE,PP,PARTIDO PROGRESSISTA,1
BEBEDOURO,DEPUTADO ESTADUAL,BARRETÃO,ARMANDO SERGIO ROSA BARRETO,SUPLENTE,PP,PARTIDO PROGRESSISTA,1
BEBEDOURO,DEPUTADO ESTADUAL,ELIAS CAMARGO,ELIAS CAMARGO,SUPLENTE,PP,PARTIDO PROGRESSISTA,1
BEBEDOURO,DEPUTADO ESTADUAL,PRADO,ALEXANDRE DO PRADO,SUPLENTE,PP,PARTIDO PROGRESSISTA,1
BEBEDOURO,DEPUTADO ESTADUAL,RAFA ZIMBALDI,RAFAEL FERNANDO ZIMBALDI,SUPLENTE,PP,PARTIDO PROGRESSISTA,15
BEBEDOURO,DEPUTADO ESTADUAL,EDINHO,EDSON JOAQUIM DE FREITAS,SUPLENTE,PP,PARTIDO PROGRESSISTA,1
BEBEDOURO,DEPUTADO ESTADUAL,RUSSOMANNO,MOZART ABAETE PERUIBE RUSSOMANNO,SUPLENTE,PP,PARTIDO PROGRESSISTA,74
BEBEDOURO,DEPUTADO ESTADUAL,CELSO LIMA,CELSO LIMA,SUPLENTE,PP,PARTIDO PROGRESSISTA,1
BEBEDOURO,DEPUTADO ESTADUAL,PAULERA,PAULO ROBERTO AMBROSIO,SUPLENTE,PP,PARTIDO PROGRESSISTA,14
BEBEDOURO,DEPUTADO ESTADUAL,AURELIO,AURELIO JOSE CLAUDIO,SUPLENTE,PDT,PARTIDO DEMOCRÁTICO TRABALHISTA,2
BEBEDOURO,DEPUTADO ESTADUAL,PEREIRA METALURGICO,JOSÉ PEREIRA DOS SANTOS,SUPLENTE,PDT,PARTIDO DEMOCRÁTICO TRABALHISTA,4
BEBEDOURO,DEPUTADO ESTADUAL,LUIS YABIKU,LUIS MOKITI YABIKU,SUPLENTE,PDT,PARTIDO DEMOCRÁTICO TRABALHISTA,9
BEBEDOURO,DEPUTADO ESTADUAL,DR RENAN,RENAN MARINO,SUPLENTE,PDT,PARTIDO DEMOCRÁTICO TRABALHISTA,7
BEBEDOURO,DEPUTADO ESTADUAL,DINEI,CLAUDINEI ALEXANDRE PIRES,SUPLENTE,PDT,PARTIDO DEMOCRÁTICO TRABALHISTA,13
BEBEDOURO,DEPUTADO ESTADUAL,AUREO PRETO,AUREO RODRIGUES DE SOUZA,SUPLENTE,PDT,PARTIDO DEMOCRÁTICO TRABALHISTA,1
BEBEDOURO,DEPUTADO ESTADUAL,FRANCISCO JUNIOR,FRANCISCO PEREIRA COSTA JUNIOR,SUPLENTE,PDT,PARTIDO DEMOCRÁTICO TRABALHISTA,1
BEBEDOURO,DEPUTADO ESTADUAL,GILBERTO DOURADO,GILBERTO RODRIGUES DOURADO,SUPLENTE,PDT,PARTIDO DEMOCRÁTICO TRABALHISTA,1
BEBEDOURO,DEPUTADO ESTADUAL,ROGERIO NOGUEIRA,ROGERIO NOGUEIRA LOPES CRUZ,ELEITO,PDT,PARTIDO DEMOCRÁTICO TRABALHISTA,16
BEBEDOURO,DEPUTADO ESTADUAL,CAPITAO LUCAS,AURO LUCAS,SUPLENTE,PDT,PARTIDO DEMOCRÁTICO TRABALHISTA,3
BEBEDOURO,DEPUTADO ESTADUAL,LUIZ ARRAES,LUIZ DE SOUZA ARRAES,SUPLENTE,PDT,PARTIDO DEMOCRÁTICO TRABALHISTA,1
BEBEDOURO,DEPUTADO ESTADUAL,JOSE BITTENCOURT,JOSE DOMINGOS BITTENCOURT,ELEITO,PDT,PARTIDO DEMOCRÁTICO TRABALHISTA,4
BEBEDOURO,DEPUTADO ESTADUAL,PASTOR MAURO FERREIRA,MAURO FERREIRA DE SOUZA,SUPLENTE,PDT,PARTIDO DEMOCRÁTICO TRABALHISTA,2
BEBEDOURO,DEPUTADO ESTADUAL,MAJOR OLIMPIO,SERGIO OLIMPIO GOMES,ELEITO,PDT,PARTIDO DEMOCRÁTICO TRABALHISTA,157
BEBEDOURO,DEPUTADO ESTADUAL,CARLAO MOTORISTA,ANTONIO CARLOS RIBEIRO,SUPLENTE,PDT,PARTIDO DEMOCRÁTICO TRABALHISTA,2
BEBEDOURO,DEPUTADO ESTADUAL,CARLOS HERNANDES,JOSÉ CARLOS SANCHES HERNANDES,SUPLENTE,PDT,PARTIDO DEMOCRÁTICO TRABALHISTA,1
BEBEDOURO,DEPUTADO ESTADUAL,NICOLACI,RONALD LUIZ NICOLACI FINCATTI,SUPLENTE,PDT,PARTIDO DEMOCRÁTICO TRABALHISTA,1
BEBEDOURO,DEPUTADO ESTADUAL,BRUZAROSCO,APARECIDO DE JESUS BRUZAROSCO,SUPLENTE,PDT,PARTIDO DEMOCRÁTICO TRABALHISTA,46
BEBEDOURO,DEPUTADO ESTADUAL,EMERSON LEAL,EMERSON PIRES LEAL,SUPLENTE,PDT,PARTIDO DEMOCRÁTICO TRABALHISTA,3
BEBEDOURO,DEPUTADO ESTADUAL,RAFAEL SILVA,RAFAEL ANTONIO DA SILVA,ELEITO,PDT,PARTIDO DEMOCRÁTICO TRABALHISTA,531
BEBEDOURO,DEPUTADO ESTADUAL,NICANOR,NICANOR JOSE DA SILVA,SUPLENTE,PDT,PARTIDO DEMOCRÁTICO TRABALHISTA,1
BEBEDOURO,DEPUTADO ESTADUAL,TOLOI,LUIZ CARLOS TOLOI JUNIOR,SUPLENTE,PDT,PARTIDO DEMOCRÁTICO TRABALHISTA,5
BEBEDOURO,DEPUTADO ESTADUAL,TADEU MORAIS,TADEU MORAIS DE SOUSA,SUPLENTE,PDT,PARTIDO DEMOCRÁTICO TRABALHISTA,2
BEBEDOURO,DEPUTADO ESTADUAL,BRILHANTE,ANTONIO JOSE BRILHANTE,SUPLENTE,PDT,PARTIDO DEMOCRÁTICO TRABALHISTA,1
BEBEDOURO,DEPUTADO ESTADUAL,LEONICE DA PAZ,LEONICE ALVES DA PAZ,SUPLENTE,PDT,PARTIDO DEMOCRÁTICO TRABALHISTA,40
BEBEDOURO,DEPUTADO ESTADUAL,HELIO BASTOS,HELIO DE ALMEIDA BASTOS,SUPLENTE,PDT,PARTIDO DEMOCRÁTICO TRABALHISTA,16764
BEBEDOURO,DEPUTADO ESTADUAL,MYRYAM ATHIE,MIRIAM ATHIE,SUPLENTE,PDT,PARTIDO DEMOCRÁTICO TRABALHISTA,1
BEBEDOURO,DEPUTADO ESTADUAL,ELIO CANDIDO,ELIO ANTONIO CANDIDO,SUPLENTE,PDT,PARTIDO DEMOCRÁTICO TRABALHISTA,1
BEBEDOURO,DEPUTADO ESTADUAL,CONSTANCIA FELIX,CONSTANCIA BERBERT DUTRA DA SILVA,SUPLENTE,PDT,PARTIDO DEMOCRÁTICO TRABALHISTA,2
BEBEDOURO,DEPUTADO ESTADUAL,DR SAMUEL SIQUEIRA,SAMUEL SIQUEIRA,SUPLENTE,PDT,PARTIDO DEMOCRÁTICO TRABALHISTA,1
BEBEDOURO,DEPUTADO ESTADUAL,MARCO BRASIL,MARCO AURÉLIO RIBEIRO,SUPLENTE,PDT,PARTIDO DEMOCRÁTICO TRABALHISTA,4
BEBEDOURO,DEPUTADO ESTADUAL,JOÃO ELIAS,JOÃO ELIAS PEREIRA,SUPLENTE,PDT,PARTIDO DEMOCRÁTICO TRABALHISTA,38
BEBEDOURO,DEPUTADO ESTADUAL,ANDERSON SILVA,ANDERSON DOMINGOS DA SILVA,SUPLENTE,PT,SOMOS MAIS SÃO PAULO,2
BEBEDOURO,DEPUTADO ESTADUAL,DR. JORGE PARADA,JORGE EDUARDO PARADA HURTADO,SUPLENTE,PT,SOMOS MAIS SÃO PAULO,7
BEBEDOURO,DEPUTADO ESTADUAL,TELMA DE SOUZA,TELMA SANDRA AUGUSTO DE SOUZA,ELEITO,PT,SOMOS MAIS SÃO PAULO,1
BEBEDOURO,DEPUTADO ESTADUAL,PEDRO BIANGULI,PEDRO CARLOS BIANGULI DE FARIA,SUPLENTE,PT,SOMOS MAIS SÃO PAULO,1
BEBEDOURO,DEPUTADO ESTADUAL,PROFESSOR CLEITON GOMES,CLEITON GOMES DA SILVA,SUPLENTE,PT,SOMOS MAIS SÃO PAULO,1
BEBEDOURO,DEPUTADO ESTADUAL,GALENO AMORIM,GALENO DE AMORIM JUNIOR,SUPLENTE,PT,SOMOS MAIS SÃO PAULO,162
BEBEDOURO,DEPUTADO ESTADUAL,ENGª MÔNICA BOMBONATO,MÔNICA ESTELA BOMBONATO,SUPLENTE,PT,SOMOS MAIS SÃO PAULO,1
BEBEDOURO,DEPUTADO ESTADUAL,PORTUGUÊS,REINALDO FARTO NUNES,SUPLENTE,PT,SOMOS MAIS SÃO PAULO,1
BEBEDOURO,DEPUTADO ESTADUAL,PAULO MARTINS (GAÚCHO),PAULO CESAR GOMES MARTINS,SUPLENTE,PT,SOMOS MAIS SÃO PAULO,1
BEBEDOURO,DEPUTADO ESTADUAL,JURA,JURACY FRANCISCO DE JESUS,SUPLENTE,PT,SOMOS MAIS SÃO PAULO,4
BEBEDOURO,DEPUTADO ESTADUAL,EDINHO SILVA,EDSON ANTONIO EDINHO DA SILVA,ELEITO,PT,SOMOS MAIS SÃO PAULO,284
BEBEDOURO,DEPUTADO ESTADUAL,SUB TEN. NEZINHO (RECO),NEZINHO GONÇALVES NUNES,SUPLENTE,PT,SOMOS MAIS SÃO PAULO,1
BEBEDOURO,DEPUTADO ESTADUAL,RAFAEL MARINHO,RAFAEL DE FIGUEIREDO MARINHO,SUPLENTE,PT,SOMOS MAIS SÃO PAULO,34
BEBEDOURO,DEPUTADO ESTADUAL,ANA PERUGINI,ANA LUCIA LIPPAUS PERUGINI,ELEITO,PT,SOMOS MAIS SÃO PAULO,7
BEBEDOURO,DEPUTADO ESTADUAL,TONINHO DO PT,ANTONIO AMARAL JUNIOR,SUPLENTE,PT,SOMOS MAIS SÃO PAULO,2
BEBEDOURO,DEPUTADO ESTADUAL,ZICO,JOSÉ PRADO DE ANDRADE,MÉDIA,PT,SOMOS MAIS SÃO PAULO,10
BEBEDOURO,DEPUTADO ESTADUAL,SALETE CAMPARI,FRANCISCO DE SALES RODRIGUES,SUPLENTE,PT,SOMOS MAIS SÃO PAULO,2
BEBEDOURO,DEPUTADO ESTADUAL,MARCOS MARTINS,MARCOS LOPES MARTINS,ELEITO,PT,SOMOS MAIS SÃO PAULO,6
BEBEDOURO,DEPUTADO ESTADUAL,DR. LUIZINHO,LUIS CARLOS LAURINDO,SUPLENTE,PT,SOMOS MAIS SÃO PAULO,1
BEBEDOURO,DEPUTADO ESTADUAL,ELI TEODORO,ELI TEODORO,SUPLENTE,PT,SOMOS MAIS SÃO PAULO,7
BEBEDOURO,DEPUTADO ESTADUAL,SIMÃO PEDRO,SIMÃO PEDRO CHIOVETTI,ELEITO,PT,SOMOS MAIS SÃO PAULO,1
BEBEDOURO,DEPUTADO ESTADUAL,GERALDO CRUZ,GERALDO LEITE DA CRUZ,ELEITO,PT,SOMOS MAIS SÃO PAULO,3
BEBEDOURO,DEPUTADO ESTADUAL,RUI FALCÃO,RUI GOETHE DA COSTA FALCÃO,ELEITO,PT,SOMOS MAIS SÃO PAULO,2
BEBEDOURO,DEPUTADO ESTADUAL,JUSTINO CAMPO BELO,JUSTINO DA SILVA,SUPLENTE,PT,SOMOS MAIS SÃO PAULO,2
BEBEDOURO,DEPUTADO ESTADUAL,DUDU BOLITO,AMARILDO DUDU BOLITO,SUPLENTE,PT,SOMOS MAIS SÃO PAULO,77
BEBEDOURO,DEPUTADO ESTADUAL,ANTONIO MENTOR,ANTONIO MENTOR DE MELLO SOBRINHO,ELEITO,PT,SOMOS MAIS SÃO PAULO,341
BEBEDOURO,DEPUTADO ESTADUAL,ADRIANO DIOGO,ADRIANO DIOGO,ELEITO,PT,SOMOS MAIS SÃO PAULO,5
BEBEDOURO,DEPUTADO ESTADUAL,LUIZ CLAUDIO MARCOLINO,LUIZ CLAUDIO MARCOLINO,ELEITO,PT,SOMOS MAIS SÃO PAULO,246
BEBEDOURO,DEPUTADO ESTADUAL,RENATO DO GEB,RENATO MORENI AIRES DA SILVA,SUPLENTE,PT,SOMOS MAIS SÃO PAULO,1
BEBEDOURO,DEPUTADO ESTADUAL,DENISE ERBELLA,DENISE ELOÁ CUSTÓDIO ERBELLA DE CASTRO,SUPLENTE,PT,SOMOS MAIS SÃO PAULO,4
BEBEDOURO,DEPUTADO ESTADUAL,NATIVIDADE,MARIA DA NATIVIDADE PEREIRA LIMA,SUPLENTE,PT,SOMOS MAIS SÃO PAULO,3
BEBEDOURO,DEPUTADO ESTADUAL,ROBERTO FELICIO,ROBERTO FELICIO,SUPLENTE,PT,SOMOS MAIS SÃO PAULO,88
BEBEDOURO,DEPUTADO ESTADUAL,RAFAEL AGOSTINI,RAFAEL LUNARDELLI AGOSTINI,SUPLENTE,PT,SOMOS MAIS SÃO PAULO,2
BEBEDOURO,DEPUTADO ESTADUAL,BETH SAHAO,ELISABETH SAHÃO,SUPLENTE,PT,SOMOS MAIS SÃO PAULO,270
BEBEDOURO,DEPUTADO ESTADUAL,ADINAN ORTOLAN,JOSÉ ADINAN ORTOLAN,SUPLENTE,PT,SOMOS MAIS SÃO PAULO,12
BEBEDOURO,DEPUTADO ESTADUAL,LELO PAGANI,LUIZ AURELIO PAGANI,SUPLENTE,PT,SOMOS MAIS SÃO PAULO,33
BEBEDOURO,DEPUTADO ESTADUAL,ALENCAR,ALENCAR SANTANA BRAGA,ELEITO,PT,SOMOS MAIS SÃO PAULO,3
BEBEDOURO,DEPUTADO ESTADUAL,VERA SABA,VERA LÚCIA SANTOS SABA,SUPLENTE,PT,SOMOS MAIS SÃO PAULO,1
BEBEDOURO,DEPUTADO ESTADUAL,ISAC REIS,ISAC FRANCO DOS REIS,ELEITO,PT,SOMOS MAIS SÃO PAULO,1
BEBEDOURO,DEPUTADO ESTADUAL,BRENO CORTELLA,BRENO ZANONI CORTELLA,SUPLENTE,PT,SOMOS MAIS SÃO PAULO,3
BEBEDOURO,DEPUTADO ESTADUAL,JOÃO PAULO RILLO,JOÃO PAULO RILLO,ELEITO,PT,SOMOS MAIS SÃO PAULO,179
BEBEDOURO,DEPUTADO ESTADUAL,ANA DO CARMO,ANA MARIA DO CARMO ROSSETO,ELEITO,PT,SOMOS MAIS SÃO PAULO,142
BEBEDOURO,DEPUTADO ESTADUAL,MIRANDA,JOSÉ CARLOS MIRANDA,SUPLENTE,PT,SOMOS MAIS SÃO PAULO,14
BEBEDOURO,DEPUTADO ESTADUAL,BETO CANGUSSU,LUIZ ROBERTO ALVES CANGUSSU,SUPLENTE,PT,SOMOS MAIS SÃO PAULO,128
BEBEDOURO,DEPUTADO ESTADUAL,JOSÉ CANDIDO,JOSÉ DE SOUZA CÂNDIDO,MÉDIA,PT,SOMOS MAIS SÃO PAULO,5
BEBEDOURO,DEPUTADO ESTADUAL,GALLO,JURANDIR GALLO,SUPLENTE,PT,SOMOS MAIS SÃO PAULO,4
BEBEDOURO,DEPUTADO ESTADUAL,LINEU NAVARRO,LUIZ ANTONIO NAVARRO MAGALHÃES LUZ,SUPLENTE,PT,SOMOS MAIS SÃO PAULO,6
BEBEDOURO,DEPUTADO ESTADUAL,MÁRCIO CHAVES,MÁRCIO CHAVES PIRES,SUPLENTE,PT,SOMOS MAIS SÃO PAULO,3
BEBEDOURO,DEPUTADO ESTADUAL,CARLOS GRANA,CARLOS ALBERTO GRANA,ELEITO,PT,SOMOS MAIS SÃO PAULO,5
BEBEDOURO,DEPUTADO ESTADUAL,FAUSTO FIGUEIRA,FAUSTO FIGUEIRA DE MELLO JUNIOR,SUPLENTE,PT,SOMOS MAIS SÃO PAULO,2
BEBEDOURO,DEPUTADO ESTADUAL,ELISEU COSTA,ELISEU SILVA COSTA,SUPLENTE,PT,SOMOS MAIS SÃO PAULO,1
BEBEDOURO,DEPUTADO ESTADUAL,TITO,FRANCISCO DE ASSIS PEREIRA DE CAMPOS,SUPLENTE,PT,SOMOS MAIS SÃO PAULO,1
BEBEDOURO,DEPUTADO ESTADUAL,GILSON PELIZARO,GILSON DONIZETE PELIZARO,SUPLENTE,PT,SOMOS MAIS SÃO PAULO,1
BEBEDOURO,DEPUTADO ESTADUAL,JOTA SILVA,JOAO JORGE FERREIRA DA SILVA,SUPLENTE,PTB,PARTIDO TRABALHISTA BRASILEIRO,3
BEBEDOURO,DEPUTADO ESTADUAL,LÉO ÁQUILLA,JADSON MENDES DE LIMA,SUPLENTE,PTB,PARTIDO TRABALHISTA BRASILEIRO,8
BEBEDOURO,DEPUTADO ESTADUAL,NEY CARLOS,NEI CARLOS DOS SANTOS,SUPLENTE,PTB,PARTIDO TRABALHISTA BRASILEIRO,1
BEBEDOURO,DEPUTADO ESTADUAL,PASTOR LEBA,JOSE LAERCIO LUCAS CORREA,SUPLENTE,PTB,PARTIDO TRABALHISTA BRASILEIRO,2
BEBEDOURO,DEPUTADO ESTADUAL,KLEBER LEITE,CLEVERSON SPERBER,SUPLENTE,PTB,PARTIDO TRABALHISTA BRASILEIRO,1
BEBEDOURO,DEPUTADO ESTADUAL,CONTE LOPES,ROBERVAL CONTE LOPES LIMA,SUPLENTE,PTB,PARTIDO TRABALHISTA BRASILEIRO,12
BEBEDOURO,DEPUTADO ESTADUAL,CAMPOS MACHADO,ANTONIO CARLOS DE CAMPOS MACHADO,ELEITO,PTB,PARTIDO TRABALHISTA BRASILEIRO,270
BEBEDOURO,DEPUTADO ESTADUAL,VANDO,ORVANDO DA SILVA,SUPLENTE,PTB,PARTIDO TRABALHISTA BRASILEIRO,1
BEBEDOURO,DEPUTADO ESTADUAL,HEROILMA SOARES TAVARES,HEROILMA SOARES TAVARES,MÉDIA,PTB,PARTIDO TRABALHISTA BRASILEIRO,3
BEBEDOURO,DEPUTADO ESTADUAL,CORONEL EDSON FERRARINI,EDSON FERRARINI,ELEITO,PTB,PARTIDO TRABALHISTA BRASILEIRO,6
BEBEDOURO,DEPUTADO ESTADUAL,VAL,ENIVALDO RAMOS DE FREITAS,SUPLENTE,PTB,PARTIDO TRABALHISTA BRASILEIRO,2
BEBEDOURO,DEPUTADO ESTADUAL,TARDELLI,ROBERTO TARDELLI,SUPLENTE,PTB,PARTIDO TRABALHISTA BRASILEIRO,4
BEBEDOURO,DEPUTADO ESTADUAL,PROFESSOR LEANDRO MOU,LEANDRO TADEU CAZARROTTI,SUPLENTE,PTB,PARTIDO TRABALHISTA BRASILEIRO,2
BEBEDOURO,DEPUTADO ESTADUAL,PROFESSORA ALBA LUCENA,ALBA LUCENA FERNANDES GANDIA,SUPLENTE,PTB,PARTIDO TRABALHISTA BRASILEIRO,4
BEBEDOURO,DEPUTADO ESTADUAL,WALDIR AGNELLO,WALDIR AGNELLO,SUPLENTE,PTB,PARTIDO TRABALHISTA BRASILEIRO,20
BEBEDOURO,DEPUTADO ESTADUAL,AMELITO FIDELIS,AMELITO FIDELIS DOS SANTOS,SUPLENTE,PTB,PARTIDO TRABALHISTA BRASILEIRO,6
BEBEDOURO,DEPUTADO ESTADUAL,GILBERTO DO PRIMAVERA,GILBERTO WACHTLER,SUPLENTE,PTB,PARTIDO TRABALHISTA BRASILEIRO,1
BEBEDOURO,DEPUTADO ESTADUAL,BALEIA ROSSI,LUIZ FELIPE BALEIA TENUTO ROSSI,ELEITO,PMDB,PARTIDO DO MOVIMENTO DEMOCRÁTICO BRASILEIRO,1282
BEBEDOURO,DEPUTADO ESTADUAL,DRA ADRIANA,ADRIANA DI NARDO SILVA,SUPLENTE,PMDB,PARTIDO DO MOVIMENTO DEMOCRÁTICO BRASILEIRO,3
