OSCAR BRESSANE,PRESIDENTE,DILMA,DILMA VANA ROUSSEFF,2º TURNO,PT,PARA O BRASIL SEGUIR MUDANDO,587
OSCAR BRESSANE,PRESIDENTE,JOSÉ SERRA,JOSÉ SERRA,2º TURNO,PSDB,O BRASIL PODE MAIS,1051
OSCAR BRESSANE,GOVERNADOR,GERALDO ALCKMIN,GERALDO JOSE RODRIGUES ALCKMIN FILHO,ELEITO,PSDB,UNIDOS POR SÃO PAULO,1238
OSCAR BRESSANE,SENADOR,MARTA SUPLICY,MARTA SUPLICY,ELEITO,PT,UNIÃO PARA MUDAR,408
OSCAR BRESSANE,SENADOR,ALOYSIO NUNES,ALOYSIO NUNES FERREIRA FILHO,ELEITO,PSDB,UNIDOS POR SÃO PAULO,1136
OSCAR BRESSANE,DEPUTADO FEDERAL,OTONIEL LIMA,OTONIEL CARLOS DE LIMA,MÉDIA,PRB,JUNTOS POR SÃO PAULO,1
OSCAR BRESSANE,DEPUTADO FEDERAL,MALUF,PAULO SALIM MALUF,ELEITO,PP,PARTIDO PROGRESSISTA,11
OSCAR BRESSANE,DEPUTADO FEDERAL,DRA CELIA MARIA,CELIA MARIA VIEIRA ALVES,SUPLENTE,PP,PARTIDO PROGRESSISTA,1
OSCAR BRESSANE,DEPUTADO FEDERAL,MISSIONÁRIO JOSÉ OLIMPIO,JOSÉ OLIMPIO SILVEIRA MORAES,ELEITO,PP,PARTIDO PROGRESSISTA,10
OSCAR BRESSANE,DEPUTADO FEDERAL,PEDRINHO ISHIDA,PEDRO ISHIDA,SUPLENTE,PP,PARTIDO PROGRESSISTA,1
OSCAR BRESSANE,DEPUTADO FEDERAL,DR NECHAR,SERGIO ANTONIO NECHAR,SUPLENTE,PP,PARTIDO PROGRESSISTA,498
OSCAR BRESSANE,DEPUTADO FEDERAL,VADÃO,ETIVALDO VADAO GOMES,SUPLENTE,PP,PARTIDO PROGRESSISTA,55
OSCAR BRESSANE,DEPUTADO FEDERAL,JOÃO DADO,JOÃO EDUARDO DADO LEITE DE CARVALHO,ELEITO,PDT,PARTIDO DEMOCRÁTICO TRABALHISTA,2
OSCAR BRESSANE,DEPUTADO FEDERAL,PAULINHO DA FORÇA,PAULO PEREIRA DA SILVA,ELEITO,PDT,PARTIDO DEMOCRÁTICO TRABALHISTA,6
OSCAR BRESSANE,DEPUTADO FEDERAL,KAREN HEINS,KAREN MAYELLEN TONIM HEINS,SUPLENTE,PDT,PARTIDO DEMOCRÁTICO TRABALHISTA,2
OSCAR BRESSANE,DEPUTADO FEDERAL,DR LUIZ CHIAPARINE,LUIZ CARLOS CHIAPARINE,SUPLENTE,PDT,PARTIDO DEMOCRÁTICO TRABALHISTA,2
OSCAR BRESSANE,DEPUTADO FEDERAL,MANOEL ANTUNES,MANOEL ANTUNES,SUPLENTE,PDT,PARTIDO DEMOCRÁTICO TRABALHISTA,1
OSCAR BRESSANE,DEPUTADO FEDERAL,CARLOS HENRIQUE,CARLOS HENRIQUE PINTO,SUPLENTE,PDT,PARTIDO DEMOCRÁTICO TRABALHISTA,1
OSCAR BRESSANE,DEPUTADO FEDERAL,DRA DEBORA,DEBORA MARIA MARAGNI PEREIRA DE ABREU,SUPLENTE,PDT,PARTIDO DEMOCRÁTICO TRABALHISTA,1
OSCAR BRESSANE,DEPUTADO FEDERAL,JOSUE TOPA TUDO,JOSUÉ MOREIRA,SUPLENTE,PDT,PARTIDO DEMOCRÁTICO TRABALHISTA,1
OSCAR BRESSANE,DEPUTADO FEDERAL,GERALDINHO O ILUMINADO,GERALDO ALVES DIONISIO,SUPLENTE,PT,JUNTOS POR SÃO PAULO,1
OSCAR BRESSANE,DEPUTADO FEDERAL,VACCAREZZA,CANDIDO ELPIDIO DE SOUZA VACCAREZZA,ELEITO,PT,JUNTOS POR SÃO PAULO,18
OSCAR BRESSANE,DEPUTADO FEDERAL,GENOINO,JOSÉ GENOÍNO NETO,SUPLENTE,PT,JUNTOS POR SÃO PAULO,1
OSCAR BRESSANE,DEPUTADO FEDERAL,ARLINDO CHINAGLIA,ARLINDO CHIGNALIA JUNIOR,ELEITO,PT,JUNTOS POR SÃO PAULO,9
OSCAR BRESSANE,DEPUTADO FEDERAL,JOÃO PAULO CUNHA,JOÃO PAULO CUNHA,ELEITO,PT,JUNTOS POR SÃO PAULO,1
OSCAR BRESSANE,DEPUTADO FEDERAL,JOSÉ MENTOR,JOSÉ MENTOR GUILHERME DE MELLO NETTO,ELEITO,PT,JUNTOS POR SÃO PAULO,12
OSCAR BRESSANE,DEPUTADO FEDERAL,ZARATTINI,CARLOS ALBERTO ROLIM ZARATTINI,ELEITO,PT,JUNTOS POR SÃO PAULO,2
OSCAR BRESSANE,DEPUTADO FEDERAL,CLAURY,CLAURY SANTOS ALVES DA SILVA,SUPLENTE,PTB,PARTIDO TRABALHISTA BRASILEIRO,12
OSCAR BRESSANE,DEPUTADO FEDERAL,ROBSON TUMA,ROBSON TUMA,SUPLENTE,PTB,PARTIDO TRABALHISTA BRASILEIRO,25
OSCAR BRESSANE,DEPUTADO FEDERAL,SINVAL DORIGON,SINVAL ROBERTO DORIGON,SUPLENTE,PTB,PARTIDO TRABALHISTA BRASILEIRO,1
OSCAR BRESSANE,DEPUTADO FEDERAL,NELSON MARQUEZELLI,NELSON MARQUEZELLI,ELEITO,PTB,PARTIDO TRABALHISTA BRASILEIRO,30
OSCAR BRESSANE,DEPUTADO FEDERAL,CELIO DINIZ,CELIO FRANCISCO DINIZ,SUPLENTE,PTB,PARTIDO TRABALHISTA BRASILEIRO,2
OSCAR BRESSANE,DEPUTADO FEDERAL,ISRAEL LACERDA,ISRAEL SAMPAIO DE LACERDA FILHO,SUPLENTE,PTB,PARTIDO TRABALHISTA BRASILEIRO,1
OSCAR BRESSANE,DEPUTADO FEDERAL,PAULO LIMA,PAULO CESAR DE OLIVEIRA LIMA,SUPLENTE,PMDB,PARTIDO DO MOVIMENTO DEMOCRÁTICO BRASILEIRO,24
OSCAR BRESSANE,DEPUTADO FEDERAL,NENÊ MONTANHER,ALCIDES MONTANHER FILHO,SUPLENTE,PMDB,PARTIDO DO MOVIMENTO DEMOCRÁTICO BRASILEIRO,1
OSCAR BRESSANE,DEPUTADO FEDERAL,MORATO,JOSÉ ANTONIO MORATO,SUPLENTE,PMDB,PARTIDO DO MOVIMENTO DEMOCRÁTICO BRASILEIRO,1
OSCAR BRESSANE,DEPUTADO FEDERAL,MARCO FELICIANO,MARCO ANTONIO FELICIANO,ELEITO,PSC,HUMANISTA CRISTÃO ,2
OSCAR BRESSANE,DEPUTADO FEDERAL,SILVIA PALMA,SILVIA ELIANA PALMA,SUPLENTE,PSC,HUMANISTA CRISTÃO ,1
OSCAR BRESSANE,DEPUTADO FEDERAL,PRICILA LEME,PRICILA HELENA MOYSES LEME,SUPLENTE,PSC,HUMANISTA CRISTÃO ,1
OSCAR BRESSANE,DEPUTADO FEDERAL,MANOEL GASPAR,MANOEL FERREIRA DE SOUZA GASPAR,SUPLENTE,PSC,HUMANISTA CRISTÃO ,2
OSCAR BRESSANE,DEPUTADO FEDERAL,TIRIRICA,FRANCISCO EVERARDO OLIVEIRA SILVA,ELEITO,PR,JUNTOS POR SÃO PAULO,24
OSCAR BRESSANE,DEPUTADO FEDERAL,CORONEL EDSON SARDANO,EDSON DE JESUS SARDANO,SUPLENTE,PPS,PSDB/DEM/PPS,5
OSCAR BRESSANE,DEPUTADO FEDERAL,JOSE ONERIO,JOSE ONERIO DA SILVA,SUPLENTE,PPS,PSDB/DEM/PPS,7
OSCAR BRESSANE,DEPUTADO FEDERAL,JORGE TADEU,JORGE TADEU MUDALEN,ELEITO,DEM,PSDB/DEM/PPS,1
OSCAR BRESSANE,DEPUTADO FEDERAL,JORGINHO MALULY,JORGE DE FARIA MALULY,SUPLENTE,DEM,PSDB/DEM/PPS,6
OSCAR BRESSANE,DEPUTADO FEDERAL,RODRIGO GARCIA,RODRIGO GARCIA,ELEITO,DEM,PSDB/DEM/PPS,1
OSCAR BRESSANE,DEPUTADO FEDERAL,CHICO PELUCIO,FRANCISCO PELUCIO,SUPLENTE,DEM,PSDB/DEM/PPS,5
OSCAR BRESSANE,DEPUTADO FEDERAL,WALTER IHOSHI,WALTER SHINDI IIHOSHI,SUPLENTE,DEM,PSDB/DEM/PPS,352
OSCAR BRESSANE,DEPUTADO FEDERAL,DONIZETI,BENEDITO DONIZETI ALVES,SUPLENTE,PHS,HUMANISTA CRISTÃO ,13
OSCAR BRESSANE,DEPUTADO FEDERAL,JONAS DONIZETTE,JONAS DONIZETTE FERREIRA,ELEITO,PSB,PRESTE ATENÇÃO SÃO PAULO,1
OSCAR BRESSANE,DEPUTADO FEDERAL,MARCELINHO CARIOCA,MARCELO PEREIRA SURCIN,SUPLENTE,PSB,PRESTE ATENÇÃO SÃO PAULO,3
OSCAR BRESSANE,DEPUTADO FEDERAL,CAPITÃO AUGUSTO,JOSÉ AUGUSTO ROSA,SUPLENTE,PSB,PRESTE ATENÇÃO SÃO PAULO,92
OSCAR BRESSANE,DEPUTADO FEDERAL,LUIZA ERUNDINA,LUIZA ERUNDINA DE SOUSA,ELEITO,PSB,PRESTE ATENÇÃO SÃO PAULO,1
OSCAR BRESSANE,DEPUTADO FEDERAL,GABRIEL CHALITA,GABRIEL BENEDITO ISSAAC CHALITA,ELEITO,PSB,PRESTE ATENÇÃO SÃO PAULO,26
OSCAR BRESSANE,DEPUTADO FEDERAL,MÁRCIO FRANÇA,MÁRCIO LUIZ FRANÇA GOMES,ELEITO,PSB,PRESTE ATENÇÃO SÃO PAULO,2
OSCAR BRESSANE,DEPUTADO FEDERAL,UNALDO SANTOS,UNALDO FLORES SANTOS,SUPLENTE,PSB,PRESTE ATENÇÃO SÃO PAULO,1
OSCAR BRESSANE,DEPUTADO FEDERAL,VANDIR MOGNON,VANDIR MOGNON,SUPLENTE,PSB,PRESTE ATENÇÃO SÃO PAULO,1
OSCAR BRESSANE,DEPUTADO FEDERAL,ABELARDO CAMARINHA,JOSE ABELARDO GUIMARAES CAMARINHA,MÉDIA,PSB,PRESTE ATENÇÃO SÃO PAULO,229
OSCAR BRESSANE,DEPUTADO FEDERAL,JEFFERSON CAMPOS,JEFFERSON ALVES DE CAMPOS,ELEITO,PSB,PRESTE ATENÇÃO SÃO PAULO,41
OSCAR BRESSANE,DEPUTADO FEDERAL,GRAÇA,MARIA DAS GRAÇAS GONÇALVES OLIVEIRA,SUPLENTE,PSB,PRESTE ATENÇÃO SÃO PAULO,1
OSCAR BRESSANE,DEPUTADO FEDERAL,GETÚLIO DUARTE,GETÚLIO DUARTE FERREIRA,SUPLENTE,PSB,PRESTE ATENÇÃO SÃO PAULO,2
OSCAR BRESSANE,DEPUTADO FEDERAL,NEIDE TAMEIRÃO,NEIDE APARECIDA TAMEIRÃO COSER,SUPLENTE,PSB,PRESTE ATENÇÃO SÃO PAULO,1
OSCAR BRESSANE,DEPUTADO FEDERAL,GUILHERME MUSSI,GUILHERME MUSSI FERREIRA,ELEITO,PV,PARTIDO VERDE,11
OSCAR BRESSANE,DEPUTADO FEDERAL,DR TALMIR,TALMIR RODRIGUES,SUPLENTE,PV,PARTIDO VERDE,4
OSCAR BRESSANE,DEPUTADO FEDERAL,DR. SINVAL MALHEIROS,SINVAL MALHEIROS PINTO JÚNIOR,SUPLENTE,PV,PARTIDO VERDE,2
OSCAR BRESSANE,DEPUTADO FEDERAL,ZICA,EUSTAQUIO LUCIANO ZICA,SUPLENTE,PV,PARTIDO VERDE,1
OSCAR BRESSANE,DEPUTADO FEDERAL,LOBBE NETO,ANTONIO ADOLPHO LOBBE NETO,SUPLENTE,PSDB,PSDB/DEM/PPS,1
OSCAR BRESSANE,DEPUTADO FEDERAL,FELICIDADE,FELICIDADE LOPES PONTES,SUPLENTE,PSDB,PSDB/DEM/PPS,1
OSCAR BRESSANE,DEPUTADO FEDERAL,MANOEL MARCOS (MANÉ),MANOEL MARCOS DE JESUS FERREIRA,SUPLENTE,PSDB,PSDB/DEM/PPS,1
OSCAR BRESSANE,DEPUTADO FEDERAL,DIB,WILLIAM DIB,ELEITO,PSDB,PSDB/DEM/PPS,1
OSCAR BRESSANE,DEPUTADO FEDERAL,RENATO AMARY,RENATO FAUVEL AMARY,SUPLENTE,PSDB,PSDB/DEM/PPS,1
OSCAR BRESSANE,DEPUTADO FEDERAL,EDSON APARECIDO,EDSON APARECIDO DOS SANTOS,ELEITO,PSDB,PSDB/DEM/PPS,85
OSCAR BRESSANE,DEPUTADO FEDERAL,DUARTE NOGUEIRA,ANTONIO DUARTE NOGUEIRA JUNIOR,ELEITO,PSDB,PSDB/DEM/PPS,2
OSCAR BRESSANE,DEPUTADO FEDERAL,TIÃO,SEBASTIÃO FERRES ARSENE,SUPLENTE,PSDB,PSDB/DEM/PPS,1
OSCAR BRESSANE,DEPUTADO FEDERAL,THAME,ANTONIO CARLOS DE MENDES THAME,ELEITO,PSDB,PSDB/DEM/PPS,1
OSCAR BRESSANE,DEPUTADO FEDERAL,JOSÉ ANIBAL,JOSÉ ANIBAL PERES DE PONTES,ELEITO,PSDB,PSDB/DEM/PPS,2
OSCAR BRESSANE,DEPUTADO FEDERAL,NELSON BUGALHO,NELSON ROBERTO BUGALHO,SUPLENTE,PSDB,PSDB/DEM/PPS,2
OSCAR BRESSANE,DEPUTADO FEDERAL,GILBERTO BORJA,GILBERTO BORJA PINTO,SUPLENTE,PSDB,PSDB/DEM/PPS,1
OSCAR BRESSANE,DEPUTADO FEDERAL,SIRINEU BARBOSA,JOSÉ SIRINEU FILGUEIRAS BARBOSA,SUPLENTE,PSDB,PSDB/DEM/PPS,1
OSCAR BRESSANE,DEPUTADO FEDERAL,KAREN MARTINS,KAREN CRISTIN MARTINS,SUPLENTE,PSOL,PARTIDO SOCIALISMO E LIBERDADE,3
OSCAR BRESSANE,DEPUTADO FEDERAL,GUSTAVO PETTA,GUSTAVO LEMOS PETTA,SUPLENTE,PC DO B,JUNTOS POR SÃO PAULO,1
OSCAR BRESSANE,DEPUTADO FEDERAL,CÉLIO TURINO,CÉLIO ROBERTO TURINO DE MIRANDA,SUPLENTE,PC DO B,JUNTOS POR SÃO PAULO,2
OSCAR BRESSANE,DEPUTADO FEDERAL,ALDO REBELO,JOSÉ ALDO REBELO FIGUEIREDO,ELEITO,PC DO B,JUNTOS POR SÃO PAULO,14
OSCAR BRESSANE,DEPUTADO FEDERAL,DELEGADO PROTÓGENES,PROTÓGENES PINHEIRO DE QUEIROZ,MÉDIA,PC DO B,JUNTOS POR SÃO PAULO,3
OSCAR BRESSANE,DEPUTADO FEDERAL,MINEIRINHO,JOSE APARECIDO DA SILVEIRA,SUPLENTE,PT DO B,JUNTOS POR SÃO PAULO,1
OSCAR BRESSANE,DEPUTADO ESTADUAL,DR. MARCELO MACHADO,MARCELO PINTO MACHADO,SUPLENTE,PRB,SOMOS MAIS SÃO PAULO,1
OSCAR BRESSANE,DEPUTADO ESTADUAL,SEBASTIÃO SANTOS,SEBASTIÃO DOS SANTOS FILHO,ELEITO,PRB,SOMOS MAIS SÃO PAULO,1
OSCAR BRESSANE,DEPUTADO ESTADUAL,CURIATI,ANTONIO SALIM CURIATI,ELEITO,PP,PARTIDO PROGRESSISTA,3
OSCAR BRESSANE,DEPUTADO ESTADUAL,VALDIR MARIN,VALDIR SILVEIRA MARIN,SUPLENTE,PP,PARTIDO PROGRESSISTA,17
OSCAR BRESSANE,DEPUTADO ESTADUAL,LUIS YABIKU,LUIS MOKITI YABIKU,SUPLENTE,PDT,PARTIDO DEMOCRÁTICO TRABALHISTA,2
OSCAR BRESSANE,DEPUTADO ESTADUAL,MAJOR OLIMPIO,SERGIO OLIMPIO GOMES,ELEITO,PDT,PARTIDO DEMOCRÁTICO TRABALHISTA,10
OSCAR BRESSANE,DEPUTADO ESTADUAL,RAFAEL SILVA,RAFAEL ANTONIO DA SILVA,ELEITO,PDT,PARTIDO DEMOCRÁTICO TRABALHISTA,1
OSCAR BRESSANE,DEPUTADO ESTADUAL,TOLOI,LUIZ CARLOS TOLOI JUNIOR,SUPLENTE,PDT,PARTIDO DEMOCRÁTICO TRABALHISTA,2
OSCAR BRESSANE,DEPUTADO ESTADUAL,CONSTANCIA FELIX,CONSTANCIA BERBERT DUTRA DA SILVA,SUPLENTE,PDT,PARTIDO DEMOCRÁTICO TRABALHISTA,64
OSCAR BRESSANE,DEPUTADO ESTADUAL,MARCO BRASIL,MARCO AURÉLIO RIBEIRO,SUPLENTE,PDT,PARTIDO DEMOCRÁTICO TRABALHISTA,133
OSCAR BRESSANE,DEPUTADO ESTADUAL,TONINHO DO PT,ANTONIO AMARAL JUNIOR,SUPLENTE,PT,SOMOS MAIS SÃO PAULO,6
OSCAR BRESSANE,DEPUTADO ESTADUAL,ZICO,JOSÉ PRADO DE ANDRADE,MÉDIA,PT,SOMOS MAIS SÃO PAULO,1
OSCAR BRESSANE,DEPUTADO ESTADUAL,MARCOS MARTINS,MARCOS LOPES MARTINS,ELEITO,PT,SOMOS MAIS SÃO PAULO,2
OSCAR BRESSANE,DEPUTADO ESTADUAL,SIMÃO PEDRO,SIMÃO PEDRO CHIOVETTI,ELEITO,PT,SOMOS MAIS SÃO PAULO,1
OSCAR BRESSANE,DEPUTADO ESTADUAL,ESTELA ALMAGRO,ESTELA ALEXANDRE ALMAGRO,SUPLENTE,PT,SOMOS MAIS SÃO PAULO,4
OSCAR BRESSANE,DEPUTADO ESTADUAL,DENISE ERBELLA,DENISE ELOÁ CUSTÓDIO ERBELLA DE CASTRO,SUPLENTE,PT,SOMOS MAIS SÃO PAULO,2
OSCAR BRESSANE,DEPUTADO ESTADUAL,RAFAEL AGOSTINI,RAFAEL LUNARDELLI AGOSTINI,SUPLENTE,PT,SOMOS MAIS SÃO PAULO,1
OSCAR BRESSANE,DEPUTADO ESTADUAL,ADINAN ORTOLAN,JOSÉ ADINAN ORTOLAN,SUPLENTE,PT,SOMOS MAIS SÃO PAULO,4
OSCAR BRESSANE,DEPUTADO ESTADUAL,TOFFOLI,JOSÉ TICIANO DIAS TOFFOLI,SUPLENTE,PT,SOMOS MAIS SÃO PAULO,23
OSCAR BRESSANE,DEPUTADO ESTADUAL,JOTA SILVA,JOAO JORGE FERREIRA DA SILVA,SUPLENTE,PTB,PARTIDO TRABALHISTA BRASILEIRO,1
OSCAR BRESSANE,DEPUTADO ESTADUAL,JOSÉ THEO DE SOUZA,JOSÉ THEODORO DE SOUZA,SUPLENTE,PTB,PARTIDO TRABALHISTA BRASILEIRO,1
OSCAR BRESSANE,DEPUTADO ESTADUAL,CONTE LOPES,ROBERVAL CONTE LOPES LIMA,SUPLENTE,PTB,PARTIDO TRABALHISTA BRASILEIRO,1
OSCAR BRESSANE,DEPUTADO ESTADUAL,CAMPOS MACHADO,ANTONIO CARLOS DE CAMPOS MACHADO,ELEITO,PTB,PARTIDO TRABALHISTA BRASILEIRO,472
OSCAR BRESSANE,DEPUTADO ESTADUAL,VANDO,ORVANDO DA SILVA,SUPLENTE,PTB,PARTIDO TRABALHISTA BRASILEIRO,5
OSCAR BRESSANE,DEPUTADO ESTADUAL,VAL,ENIVALDO RAMOS DE FREITAS,SUPLENTE,PTB,PARTIDO TRABALHISTA BRASILEIRO,1
OSCAR BRESSANE,DEPUTADO ESTADUAL,THIAGO FERRARI,THIAGO DE MORAES FERRARI,SUPLENTE,PMDB,PARTIDO DO MOVIMENTO DEMOCRÁTICO BRASILEIRO,1
OSCAR BRESSANE,DEPUTADO ESTADUAL,CARUSO,JORGE LUIS CARUSO,ELEITO,PMDB,PARTIDO DO MOVIMENTO DEMOCRÁTICO BRASILEIRO,2
OSCAR BRESSANE,DEPUTADO ESTADUAL,VANESSA DAMO,VANESSA DAMO OROSCO,ELEITO,PMDB,PARTIDO DO MOVIMENTO DEMOCRÁTICO BRASILEIRO,9
OSCAR BRESSANE,DEPUTADO ESTADUAL,GILBERTO FRANÇA,GILBERTO CAETANO DE FRANÇA,SUPLENTE,PMDB,PARTIDO DO MOVIMENTO DEMOCRÁTICO BRASILEIRO,1
OSCAR BRESSANE,DEPUTADO ESTADUAL,CELSO NASCIMENTO,CELSO BRAZ DO NASCIMENTO,SUPLENTE,PSC,HUMANISTA CRISTÃO ,34
OSCAR BRESSANE,DEPUTADO ESTADUAL,ADILSON ROSSI,ADILSON ROSSI,ELEITO,PSC,HUMANISTA CRISTÃO ,2
OSCAR BRESSANE,DEPUTADO ESTADUAL,JOÃO BINATO,JOÃO ANTONIO BINATO,SUPLENTE,PSC,HUMANISTA CRISTÃO ,72
OSCAR BRESSANE,DEPUTADO ESTADUAL,RODRIGO MORAES,RODRIGO AUGUSTO MORAES,ELEITO,PSC,HUMANISTA CRISTÃO ,10
OSCAR BRESSANE,DEPUTADO ESTADUAL,BRAZ PASSARINHEIRO,BRAZ ANASTACIO DA SILVA,SUPLENTE,PSC,HUMANISTA CRISTÃO ,1
OSCAR BRESSANE,DEPUTADO ESTADUAL,JOSIAS DINIZ,JOSIAS ANTONIO DINIZ,SUPLENTE,PR,SOMOS MAIS SÃO PAULO,3
OSCAR BRESSANE,DEPUTADO ESTADUAL,DAVI ZAIA,DAVID ZAIA,MÉDIA,PPS,PARTIDO POPULAR SOCIALISTA,4
OSCAR BRESSANE,DEPUTADO ESTADUAL,PROF. NELSON SUSSUMU SHIKICIMA,NELSON SUSSUMU SHIKICIMA,SUPLENTE,PPS,PARTIDO POPULAR SOCIALISTA,3
OSCAR BRESSANE,DEPUTADO ESTADUAL,VITOR SAPIENZA,VITOR SAPIENZA,SUPLENTE,PPS,PARTIDO POPULAR SOCIALISTA,101
OSCAR BRESSANE,DEPUTADO ESTADUAL,GONDIM,LUIZ CARLOS GONDIM TEIXEIRA,ELEITO,PPS,PARTIDO POPULAR SOCIALISTA,1
OSCAR BRESSANE,DEPUTADO ESTADUAL,ULISSES SALES,ULISSES ROBERTO CORNAZZANI SALES,SUPLENTE,DEM,PSDB/DEM,3
OSCAR BRESSANE,DEPUTADO ESTADUAL,EDMIR CHEDID,EDMIR JOSE ABI CHEDID,ELEITO,DEM,PSDB/DEM,11
OSCAR BRESSANE,DEPUTADO ESTADUAL,IVAN TESOURINHA STRINGHI,IVAN STRINGHI,SUPLENTE,DEM,PSDB/DEM,1
OSCAR BRESSANE,DEPUTADO ESTADUAL,TEREZINHA DA PAULINA,TEREZINHA DE JESUS MORAIS VASCONCELOS SILVA,SUPLENTE,PSB,PARTIDO SOCIALISTA BRASILEIRO,1
OSCAR BRESSANE,DEPUTADO ESTADUAL,IRMÃO OZELITO,OZELITO JOSE BENEDITO,SUPLENTE,PSB,PARTIDO SOCIALISTA BRASILEIRO,1
OSCAR BRESSANE,DEPUTADO ESTADUAL,HILKIAS,HILKIAS DE OLIVEIRA,SUPLENTE,PSB,PARTIDO SOCIALISTA BRASILEIRO,1
OSCAR BRESSANE,DEPUTADO ESTADUAL,VINICIUS CAMARINHA,VINICIUS ALMEIDA CAMARINHA,ELEITO,PSB,PARTIDO SOCIALISTA BRASILEIRO,255
OSCAR BRESSANE,DEPUTADO ESTADUAL,ADRIANA RODRIGUES,ADRIANA LARIO RAMALHO RODRIGUES,SUPLENTE,PV,PARTIDO VERDE,4
OSCAR BRESSANE,DEPUTADO ESTADUAL,RITA PASSOS,RITA DE CASSIA TRINCA PASSOS,ELEITO,PV,PARTIDO VERDE,2
OSCAR BRESSANE,DEPUTADO ESTADUAL,BRAZ ALBERTINI,BRAZ AGOSTINHO ALBERTINI,SUPLENTE,PV,PARTIDO VERDE,2
OSCAR BRESSANE,DEPUTADO ESTADUAL,FERNANDO MARREY FERREIRA,FERNANDO MARREY FERREIRA,SUPLENTE,PV,PARTIDO VERDE,1
OSCAR BRESSANE,DEPUTADO ESTADUAL,DR. ULYSSES,ULYSSES MARIO TASSINARI,MÉDIA,PV,PARTIDO VERDE,1
OSCAR BRESSANE,DEPUTADO ESTADUAL,REINALDO ALGUZ,REINALDO DE SOUZA ALGUZ,ELEITO,PV,PARTIDO VERDE,2
OSCAR BRESSANE,DEPUTADO ESTADUAL,ADENOR SILVA,ADENOR FERREIRA DA SILVA,SUPLENTE,PV,PARTIDO VERDE,1
OSCAR BRESSANE,DEPUTADO ESTADUAL,JOSÉ URSILIO,JOSE URSILIO DE SOUZA E SILVA,SUPLENTE,PSDB,PSDB/DEM,12
OSCAR BRESSANE,DEPUTADO ESTADUAL,EVANDRO LOSACCO,EVANDRO LUIZ LOSACCO,SUPLENTE,PSDB,PSDB/DEM,1
OSCAR BRESSANE,DEPUTADO ESTADUAL,PEDRO TOBIAS,PEDRO TOBIAS,ELEITO,PSDB,PSDB/DEM,1
OSCAR BRESSANE,DEPUTADO ESTADUAL,WELSON GASPARINI,WELSON GASPARINI,SUPLENTE,PSDB,PSDB/DEM,3
OSCAR BRESSANE,DEPUTADO ESTADUAL,MAURO BRAGATO,MAURO BRAGATO,ELEITO,PSDB,PSDB/DEM,180
OSCAR BRESSANE,DEPUTADO ESTADUAL,JOÃO CARAMEZ,JOÃO CARLOS CARAMEZ,ELEITO,PSDB,PSDB/DEM,75
OSCAR BRESSANE,DEPUTADO ESTADUAL,BERNARDO ORTIZ JR,JOSE BERNARDO ORTIZ MONTEIRO JUNIOR,SUPLENTE,PSDB,PSDB/DEM,1
OSCAR BRESSANE,DEPUTADO ESTADUAL,JOSE BORANGA,JOSE AURELIO BORANGA,SUPLENTE,PSDB,PSDB/DEM,5
OSCAR BRESSANE,DEPUTADO ESTADUAL,ADOLFO QUINTAS,ADOLFO QUINTAS GONÇALVES NETO,SUPLENTE,PSDB,PSDB/DEM,1
OSCAR BRESSANE,DEPUTADO ESTADUAL,BARROS MUNHOZ,JOSE ANTONIO BARROS MUNHOZ,ELEITO,PSDB,PSDB/DEM,2
OSCAR BRESSANE,DEPUTADO ESTADUAL,PAULO ALEXANDRE BARBOSA,PAULO ALEXANDRE PEREIRA BARBOSA,ELEITO,PSDB,PSDB/DEM,6
OSCAR BRESSANE,DEPUTADO ESTADUAL,JOSE AUGUSTO,JOSE AUGUSTO DA SILVA RAMOS,SUPLENTE,PSDB,PSDB/DEM,3
OSCAR BRESSANE,DEPUTADO ESTADUAL,FERNANDO CAPEZ,FERNANDO CAPEZ,ELEITO,PSDB,PSDB/DEM,6
OSCAR BRESSANE,DEPUTADO ESTADUAL,SARAH MUNHOZ,SARAH MUNHOZ,SUPLENTE,PC DO B,PARTIDO COMUNISTA DO BRASIL,8
OSCAR BRESSANE,DEPUTADO ESTADUAL,SIDINEI GOBETTI,SIDNEY GOBETTI DE SOUZA,SUPLENTE,PC DO B,PARTIDO COMUNISTA DO BRASIL,5
OSCAR BRESSANE,DEPUTADO ESTADUAL,ONOFRE GONÇALVES,ONOFRE GONÇALVES DE JESUS,SUPLENTE,PC DO B,PARTIDO COMUNISTA DO BRASIL,2
