RIO DAS PEDRAS,DEPUTADO FEDERAL,ALEMÃO DA SÁUDE,CLAUDEMIR SERENO,SUPLENTE,PSDB,PSDB/DEM/PPS,1
RIO DAS PEDRAS,DEPUTADO FEDERAL,TIÃO,SEBASTIÃO FERRES ARSENE,SUPLENTE,PSDB,PSDB/DEM/PPS,2
RIO DAS PEDRAS,DEPUTADO FEDERAL,WALTER FELDMAN,WALTER MEYER FELDMAN,SUPLENTE,PSDB,PSDB/DEM/PPS,2
RIO DAS PEDRAS,DEPUTADO FEDERAL,THAME,ANTONIO CARLOS DE MENDES THAME,ELEITO,PSDB,PSDB/DEM/PPS,2828
RIO DAS PEDRAS,DEPUTADO FEDERAL,BRUNA FURLAN,BRUNA DIAS FURLAN,ELEITO,PSDB,PSDB/DEM/PPS,8
RIO DAS PEDRAS,DEPUTADO FEDERAL,JOSÉ ANIBAL,JOSÉ ANIBAL PERES DE PONTES,ELEITO,PSDB,PSDB/DEM/PPS,25
RIO DAS PEDRAS,DEPUTADO FEDERAL,NELSON BUGALHO,NELSON ROBERTO BUGALHO,SUPLENTE,PSDB,PSDB/DEM/PPS,6
RIO DAS PEDRAS,DEPUTADO FEDERAL,PROFESSOR CLOVIS PINTO,CLOVIS DA SILVA PINTO,SUPLENTE,PSDB,PSDB/DEM/PPS,3
RIO DAS PEDRAS,DEPUTADO FEDERAL,SIRINEU BARBOSA,JOSÉ SIRINEU FILGUEIRAS BARBOSA,SUPLENTE,PSDB,PSDB/DEM/PPS,2
RIO DAS PEDRAS,DEPUTADO FEDERAL,RODRIGO CHIZOLINI,RODRIGO PINTO CHIZOLINI,SUPLENTE,PSOL,PARTIDO SOCIALISMO E LIBERDADE,1
RIO DAS PEDRAS,DEPUTADO FEDERAL,AKIKO AKI,AKIKO AKIYAMA,SUPLENTE,PSOL,PARTIDO SOCIALISMO E LIBERDADE,1
RIO DAS PEDRAS,DEPUTADO FEDERAL,IVAN VALENTE,IVAN VALENTE,ELEITO,PSOL,PARTIDO SOCIALISMO E LIBERDADE,56
RIO DAS PEDRAS,DEPUTADO FEDERAL,PROF. MAGNO PERES,MAGNO PERES RODRIGUES,SUPLENTE,PSOL,PARTIDO SOCIALISMO E LIBERDADE,1
RIO DAS PEDRAS,DEPUTADO FEDERAL,DR. ABELHA,CARLOS FERNANDO LOPES ABELHA,SUPLENTE,PC DO B,JUNTOS POR SÃO PAULO,188
RIO DAS PEDRAS,DEPUTADO FEDERAL,GUSTAVO PETTA,GUSTAVO LEMOS PETTA,SUPLENTE,PC DO B,JUNTOS POR SÃO PAULO,4
RIO DAS PEDRAS,DEPUTADO FEDERAL,BEZÃO,ANTONIO ALCEU BEZÃO,SUPLENTE,PC DO B,JUNTOS POR SÃO PAULO,1
RIO DAS PEDRAS,DEPUTADO FEDERAL,ALDO REBELO,JOSÉ ALDO REBELO FIGUEIREDO,ELEITO,PC DO B,JUNTOS POR SÃO PAULO,21
RIO DAS PEDRAS,DEPUTADO FEDERAL,DELEGADO PROTÓGENES,PROTÓGENES PINHEIRO DE QUEIROZ,MÉDIA,PC DO B,JUNTOS POR SÃO PAULO,24
RIO DAS PEDRAS,DEPUTADO FEDERAL,JOAO ARAUJO,JOAO LUIS ARAUJO NETO,SUPLENTE,PT DO B,JUNTOS POR SÃO PAULO,1
RIO DAS PEDRAS,DEPUTADO FEDERAL,DR MARCAO DA MANCHA,MARCO ANTONIO NOTARI,SUPLENTE,PT DO B,JUNTOS POR SÃO PAULO,1
RIO DAS PEDRAS,DEPUTADO ESTADUAL,GILMACI SANTOS,GILMACI DOS SANTOS BARBOSA,ELEITO,PRB,SOMOS MAIS SÃO PAULO,2
RIO DAS PEDRAS,DEPUTADO ESTADUAL,DR. MARCELO MACHADO,MARCELO PINTO MACHADO,SUPLENTE,PRB,SOMOS MAIS SÃO PAULO,1
RIO DAS PEDRAS,DEPUTADO ESTADUAL,SEBASTIÃO SANTOS,SEBASTIÃO DOS SANTOS FILHO,ELEITO,PRB,SOMOS MAIS SÃO PAULO,58
RIO DAS PEDRAS,DEPUTADO ESTADUAL,HAVANIR,HAVANIR TAVARES DE ALMEIDA NIMTZ,SUPLENTE,PRB,SOMOS MAIS SÃO PAULO,1
RIO DAS PEDRAS,DEPUTADO ESTADUAL,RICARDO SARAVALLI,RICARDO SARAVALLI,SUPLENTE,PP,PARTIDO PROGRESSISTA,1
RIO DAS PEDRAS,DEPUTADO ESTADUAL,BARROS PIAUÍ,JUVENAL DE SOUSA BARROS,SUPLENTE,PP,PARTIDO PROGRESSISTA,1
RIO DAS PEDRAS,DEPUTADO ESTADUAL,CURIATI,ANTONIO SALIM CURIATI,ELEITO,PP,PARTIDO PROGRESSISTA,21
RIO DAS PEDRAS,DEPUTADO ESTADUAL,SIMONY,SIMONY BENELLI GALASSO,SUPLENTE,PP,PARTIDO PROGRESSISTA,2
RIO DAS PEDRAS,DEPUTADO ESTADUAL,RIBEIRÃO,ANTONIO ALVES DE SOUZA,SUPLENTE,PP,PARTIDO PROGRESSISTA,1
RIO DAS PEDRAS,DEPUTADO ESTADUAL,MARLENE LUCAS,MARLENE LUCAS PEREIRA,SUPLENTE,PP,PARTIDO PROGRESSISTA,1
RIO DAS PEDRAS,DEPUTADO ESTADUAL,FIALA,FRANCISCO TOMAS FIALA,SUPLENTE,PP,PARTIDO PROGRESSISTA,1
RIO DAS PEDRAS,DEPUTADO ESTADUAL,DR. EDUARDO,EDUARDO DE MORAES,SUPLENTE,PP,PARTIDO PROGRESSISTA,1
RIO DAS PEDRAS,DEPUTADO ESTADUAL,DR. IRINEU,IRINEU CARDOSO DOS SANTOS,SUPLENTE,PP,PARTIDO PROGRESSISTA,2
RIO DAS PEDRAS,DEPUTADO ESTADUAL,MARIA CLEMENTINA,MARIA CLEMENTINO DE SOUSA,SUPLENTE,PP,PARTIDO PROGRESSISTA,2
RIO DAS PEDRAS,DEPUTADO ESTADUAL,RAFA ZIMBALDI,RAFAEL FERNANDO ZIMBALDI,SUPLENTE,PP,PARTIDO PROGRESSISTA,11
RIO DAS PEDRAS,DEPUTADO ESTADUAL,NELSON MANDELA,ADOLPHINO ROSARIO CRUZ,SUPLENTE,PP,PARTIDO PROGRESSISTA,1
RIO DAS PEDRAS,DEPUTADO ESTADUAL,RUSSOMANNO,MOZART ABAETE PERUIBE RUSSOMANNO,SUPLENTE,PP,PARTIDO PROGRESSISTA,3
RIO DAS PEDRAS,DEPUTADO ESTADUAL,AURELIO,AURELIO JOSE CLAUDIO,SUPLENTE,PDT,PARTIDO DEMOCRÁTICO TRABALHISTA,4
RIO DAS PEDRAS,DEPUTADO ESTADUAL,CASSOLA,JAIR CASSOLA,SUPLENTE,PDT,PARTIDO DEMOCRÁTICO TRABALHISTA,1
RIO DAS PEDRAS,DEPUTADO ESTADUAL,PERESSIM,CLAUDIO PERESSIM,SUPLENTE,PDT,PARTIDO DEMOCRÁTICO TRABALHISTA,5
RIO DAS PEDRAS,DEPUTADO ESTADUAL,LUIS YABIKU,LUIS MOKITI YABIKU,SUPLENTE,PDT,PARTIDO DEMOCRÁTICO TRABALHISTA,2
RIO DAS PEDRAS,DEPUTADO ESTADUAL,DINEI,CLAUDINEI ALEXANDRE PIRES,SUPLENTE,PDT,PARTIDO DEMOCRÁTICO TRABALHISTA,6
RIO DAS PEDRAS,DEPUTADO ESTADUAL,FRANCISCO JUNIOR,FRANCISCO PEREIRA COSTA JUNIOR,SUPLENTE,PDT,PARTIDO DEMOCRÁTICO TRABALHISTA,4
RIO DAS PEDRAS,DEPUTADO ESTADUAL,ROGERIO NOGUEIRA,ROGERIO NOGUEIRA LOPES CRUZ,ELEITO,PDT,PARTIDO DEMOCRÁTICO TRABALHISTA,499
RIO DAS PEDRAS,DEPUTADO ESTADUAL,JOSE BITTENCOURT,JOSE DOMINGOS BITTENCOURT,ELEITO,PDT,PARTIDO DEMOCRÁTICO TRABALHISTA,9
RIO DAS PEDRAS,DEPUTADO ESTADUAL,PASTOR MAURO FERREIRA,MAURO FERREIRA DE SOUZA,SUPLENTE,PDT,PARTIDO DEMOCRÁTICO TRABALHISTA,11
RIO DAS PEDRAS,DEPUTADO ESTADUAL,MAJOR OLIMPIO,SERGIO OLIMPIO GOMES,ELEITO,PDT,PARTIDO DEMOCRÁTICO TRABALHISTA,33
RIO DAS PEDRAS,DEPUTADO ESTADUAL,CARLAO MOTORISTA,ANTONIO CARLOS RIBEIRO,SUPLENTE,PDT,PARTIDO DEMOCRÁTICO TRABALHISTA,2
RIO DAS PEDRAS,DEPUTADO ESTADUAL,MARCOS BERNARDELLI,MARCOS JOSÉ BERNARDELLI,SUPLENTE,PDT,PARTIDO DEMOCRÁTICO TRABALHISTA,1
RIO DAS PEDRAS,DEPUTADO ESTADUAL,JOCA VASCONCELOS,JOAO CARLOS MONTE CLARO VASCONCELOS,SUPLENTE,PDT,PARTIDO DEMOCRÁTICO TRABALHISTA,6
RIO DAS PEDRAS,DEPUTADO ESTADUAL,AMON VIOLEIRO,AMOMM HEBROM DA HORA DE DEUS SOUZA,SUPLENTE,PDT,PARTIDO DEMOCRÁTICO TRABALHISTA,1
RIO DAS PEDRAS,DEPUTADO ESTADUAL,NICOLACI,RONALD LUIZ NICOLACI FINCATTI,SUPLENTE,PDT,PARTIDO DEMOCRÁTICO TRABALHISTA,1
RIO DAS PEDRAS,DEPUTADO ESTADUAL,BRUZAROSCO,APARECIDO DE JESUS BRUZAROSCO,SUPLENTE,PDT,PARTIDO DEMOCRÁTICO TRABALHISTA,19
RIO DAS PEDRAS,DEPUTADO ESTADUAL,EMERSON LEAL,EMERSON PIRES LEAL,SUPLENTE,PDT,PARTIDO DEMOCRÁTICO TRABALHISTA,3
RIO DAS PEDRAS,DEPUTADO ESTADUAL,RAFAEL SILVA,RAFAEL ANTONIO DA SILVA,ELEITO,PDT,PARTIDO DEMOCRÁTICO TRABALHISTA,11
RIO DAS PEDRAS,DEPUTADO ESTADUAL,MAURICIO SIQUEIRA,MAURICIO SIQUEIRA,SUPLENTE,PDT,PARTIDO DEMOCRÁTICO TRABALHISTA,1
RIO DAS PEDRAS,DEPUTADO ESTADUAL,TOLOI,LUIZ CARLOS TOLOI JUNIOR,SUPLENTE,PDT,PARTIDO DEMOCRÁTICO TRABALHISTA,1
RIO DAS PEDRAS,DEPUTADO ESTADUAL,PROFESSOR VENANCIO,ANTONIO CARLOS VENANCIO,SUPLENTE,PDT,PARTIDO DEMOCRÁTICO TRABALHISTA,1
RIO DAS PEDRAS,DEPUTADO ESTADUAL,HELIO BASTOS,HELIO DE ALMEIDA BASTOS,SUPLENTE,PDT,PARTIDO DEMOCRÁTICO TRABALHISTA,2
RIO DAS PEDRAS,DEPUTADO ESTADUAL,ELIO CANDIDO,ELIO ANTONIO CANDIDO,SUPLENTE,PDT,PARTIDO DEMOCRÁTICO TRABALHISTA,2
RIO DAS PEDRAS,DEPUTADO ESTADUAL,CONSTANCIA FELIX,CONSTANCIA BERBERT DUTRA DA SILVA,SUPLENTE,PDT,PARTIDO DEMOCRÁTICO TRABALHISTA,233
RIO DAS PEDRAS,DEPUTADO ESTADUAL,SILAS FARIA,SILAS FARIA DE SOUZA,SUPLENTE,PDT,PARTIDO DEMOCRÁTICO TRABALHISTA,31
RIO DAS PEDRAS,DEPUTADO ESTADUAL,VITROLINHA,EUVALDO REIS DOS SANTOS MENEZES,SUPLENTE,PDT,PARTIDO DEMOCRÁTICO TRABALHISTA,2
RIO DAS PEDRAS,DEPUTADO ESTADUAL,MARCO BRASIL,MARCO AURÉLIO RIBEIRO,SUPLENTE,PDT,PARTIDO DEMOCRÁTICO TRABALHISTA,2
RIO DAS PEDRAS,DEPUTADO ESTADUAL,JOÃO ELIAS,JOÃO ELIAS PEREIRA,SUPLENTE,PDT,PARTIDO DEMOCRÁTICO TRABALHISTA,1
RIO DAS PEDRAS,DEPUTADO ESTADUAL,ANDERSON SILVA,ANDERSON DOMINGOS DA SILVA,SUPLENTE,PT,SOMOS MAIS SÃO PAULO,1
RIO DAS PEDRAS,DEPUTADO ESTADUAL,TELMA DE SOUZA,TELMA SANDRA AUGUSTO DE SOUZA,ELEITO,PT,SOMOS MAIS SÃO PAULO,2
RIO DAS PEDRAS,DEPUTADO ESTADUAL,PEDRO BIANGULI,PEDRO CARLOS BIANGULI DE FARIA,SUPLENTE,PT,SOMOS MAIS SÃO PAULO,1
RIO DAS PEDRAS,DEPUTADO ESTADUAL,JURA,JURACY FRANCISCO DE JESUS,SUPLENTE,PT,SOMOS MAIS SÃO PAULO,1
RIO DAS PEDRAS,DEPUTADO ESTADUAL,GERSON BITTENCOURT,GERSON LUIS BITTENCOURT,ELEITO,PT,SOMOS MAIS SÃO PAULO,1
RIO DAS PEDRAS,DEPUTADO ESTADUAL,EDINHO SILVA,EDSON ANTONIO EDINHO DA SILVA,ELEITO,PT,SOMOS MAIS SÃO PAULO,2
RIO DAS PEDRAS,DEPUTADO ESTADUAL,RAFAEL MARINHO,RAFAEL DE FIGUEIREDO MARINHO,SUPLENTE,PT,SOMOS MAIS SÃO PAULO,1
RIO DAS PEDRAS,DEPUTADO ESTADUAL,ANA PERUGINI,ANA LUCIA LIPPAUS PERUGINI,ELEITO,PT,SOMOS MAIS SÃO PAULO,22
RIO DAS PEDRAS,DEPUTADO ESTADUAL,ZICO,JOSÉ PRADO DE ANDRADE,MÉDIA,PT,SOMOS MAIS SÃO PAULO,11
RIO DAS PEDRAS,DEPUTADO ESTADUAL,MARCOS MARTINS,MARCOS LOPES MARTINS,ELEITO,PT,SOMOS MAIS SÃO PAULO,1
RIO DAS PEDRAS,DEPUTADO ESTADUAL,DR. LUIZINHO,LUIS CARLOS LAURINDO,SUPLENTE,PT,SOMOS MAIS SÃO PAULO,1
RIO DAS PEDRAS,DEPUTADO ESTADUAL,ELI TEODORO,ELI TEODORO,SUPLENTE,PT,SOMOS MAIS SÃO PAULO,5
RIO DAS PEDRAS,DEPUTADO ESTADUAL,SIMÃO PEDRO,SIMÃO PEDRO CHIOVETTI,ELEITO,PT,SOMOS MAIS SÃO PAULO,2
RIO DAS PEDRAS,DEPUTADO ESTADUAL,ÉMERSON TAUYL,EMERSON LIMA TAUYL,SUPLENTE,PT,SOMOS MAIS SÃO PAULO,3
RIO DAS PEDRAS,DEPUTADO ESTADUAL,ANTONIO MENTOR,ANTONIO MENTOR DE MELLO SOBRINHO,ELEITO,PT,SOMOS MAIS SÃO PAULO,922
RIO DAS PEDRAS,DEPUTADO ESTADUAL,ADRIANO DIOGO,ADRIANO DIOGO,ELEITO,PT,SOMOS MAIS SÃO PAULO,3
RIO DAS PEDRAS,DEPUTADO ESTADUAL,PROFESSOR MATIAS VIEIRA,MATIAS VIEIRA,SUPLENTE,PT,SOMOS MAIS SÃO PAULO,1
RIO DAS PEDRAS,DEPUTADO ESTADUAL,ESTELA ALMAGRO,ESTELA ALEXANDRE ALMAGRO,SUPLENTE,PT,SOMOS MAIS SÃO PAULO,1
RIO DAS PEDRAS,DEPUTADO ESTADUAL,HAMILTON PEREIRA,HAMILTON PEREIRA,ELEITO,PT,SOMOS MAIS SÃO PAULO,1
RIO DAS PEDRAS,DEPUTADO ESTADUAL,LUIZ CLAUDIO MARCOLINO,LUIZ CLAUDIO MARCOLINO,ELEITO,PT,SOMOS MAIS SÃO PAULO,5
RIO DAS PEDRAS,DEPUTADO ESTADUAL,RENATO DO GEB,RENATO MORENI AIRES DA SILVA,SUPLENTE,PT,SOMOS MAIS SÃO PAULO,2
RIO DAS PEDRAS,DEPUTADO ESTADUAL,DENISE ERBELLA,DENISE ELOÁ CUSTÓDIO ERBELLA DE CASTRO,SUPLENTE,PT,SOMOS MAIS SÃO PAULO,1
RIO DAS PEDRAS,DEPUTADO ESTADUAL,NATIVIDADE,MARIA DA NATIVIDADE PEREIRA LIMA,SUPLENTE,PT,SOMOS MAIS SÃO PAULO,1
RIO DAS PEDRAS,DEPUTADO ESTADUAL,ROBERTO FELICIO,ROBERTO FELICIO,SUPLENTE,PT,SOMOS MAIS SÃO PAULO,314
RIO DAS PEDRAS,DEPUTADO ESTADUAL,BETH SAHAO,ELISABETH SAHÃO,SUPLENTE,PT,SOMOS MAIS SÃO PAULO,3
RIO DAS PEDRAS,DEPUTADO ESTADUAL,ADINAN ORTOLAN,JOSÉ ADINAN ORTOLAN,SUPLENTE,PT,SOMOS MAIS SÃO PAULO,2
RIO DAS PEDRAS,DEPUTADO ESTADUAL,FRANCISCO FRANÇA,FRANCISCO FRANÇA DA SILVA,SUPLENTE,PT,SOMOS MAIS SÃO PAULO,1
RIO DAS PEDRAS,DEPUTADO ESTADUAL,ALENCAR,ALENCAR SANTANA BRAGA,ELEITO,PT,SOMOS MAIS SÃO PAULO,109
RIO DAS PEDRAS,DEPUTADO ESTADUAL,TIÃOZINHO,SEBASTIÃO MOREIREA ARCANJO,SUPLENTE,PT,SOMOS MAIS SÃO PAULO,4
RIO DAS PEDRAS,DEPUTADO ESTADUAL,VERA SABA,VERA LÚCIA SANTOS SABA,SUPLENTE,PT,SOMOS MAIS SÃO PAULO,2
RIO DAS PEDRAS,DEPUTADO ESTADUAL,BRENO CORTELLA,BRENO ZANONI CORTELLA,SUPLENTE,PT,SOMOS MAIS SÃO PAULO,2
RIO DAS PEDRAS,DEPUTADO ESTADUAL,JOÃO PAULO RILLO,JOÃO PAULO RILLO,ELEITO,PT,SOMOS MAIS SÃO PAULO,3
RIO DAS PEDRAS,DEPUTADO ESTADUAL,ANA DO CARMO,ANA MARIA DO CARMO ROSSETO,ELEITO,PT,SOMOS MAIS SÃO PAULO,3
RIO DAS PEDRAS,DEPUTADO ESTADUAL,JOSÉ CANDIDO,JOSÉ DE SOUZA CÂNDIDO,MÉDIA,PT,SOMOS MAIS SÃO PAULO,6
RIO DAS PEDRAS,DEPUTADO ESTADUAL,JOÃO ANTONIO,JOAO ANTONIO DA SILVA FILHO,ELEITO,PT,SOMOS MAIS SÃO PAULO,1
RIO DAS PEDRAS,DEPUTADO ESTADUAL,GALLO,JURANDIR GALLO,SUPLENTE,PT,SOMOS MAIS SÃO PAULO,1
RIO DAS PEDRAS,DEPUTADO ESTADUAL,IRENE,IRENE DOS SANTOS,SUPLENTE,PT,SOMOS MAIS SÃO PAULO,1
RIO DAS PEDRAS,DEPUTADO ESTADUAL,MÁRCIO CHAVES,MÁRCIO CHAVES PIRES,SUPLENTE,PT,SOMOS MAIS SÃO PAULO,1
RIO DAS PEDRAS,DEPUTADO ESTADUAL,SÉRGIO DESIDERÁ,SÉRGIO DESIDERÁ,SUPLENTE,PT,SOMOS MAIS SÃO PAULO,1
RIO DAS PEDRAS,DEPUTADO ESTADUAL,TARCÍSIO,JOSÉ TARCÍSIO DE OLIVEIRA,SUPLENTE,PT,SOMOS MAIS SÃO PAULO,2
RIO DAS PEDRAS,DEPUTADO ESTADUAL,ELISEU COSTA,ELISEU SILVA COSTA,SUPLENTE,PT,SOMOS MAIS SÃO PAULO,2
RIO DAS PEDRAS,DEPUTADO ESTADUAL,TITO,FRANCISCO DE ASSIS PEREIRA DE CAMPOS,SUPLENTE,PT,SOMOS MAIS SÃO PAULO,65
RIO DAS PEDRAS,DEPUTADO ESTADUAL,LUIZ MOURA,LUIZ DE MOURA PEREIRA,ELEITO,PT,SOMOS MAIS SÃO PAULO,3
RIO DAS PEDRAS,DEPUTADO ESTADUAL,PROFESSOR HERCULANO,JOSÉ HERCULANO DA SILVA,SUPLENTE,PT,SOMOS MAIS SÃO PAULO,1
RIO DAS PEDRAS,DEPUTADO ESTADUAL,CARLOS NEDER,CARLOS ALBERTO PLETZ NEDER,SUPLENTE,PT,SOMOS MAIS SÃO PAULO,3
RIO DAS PEDRAS,DEPUTADO ESTADUAL,JOTA SILVA,JOAO JORGE FERREIRA DA SILVA,SUPLENTE,PTB,PARTIDO TRABALHISTA BRASILEIRO,2
RIO DAS PEDRAS,DEPUTADO ESTADUAL,LÉO ÁQUILLA,JADSON MENDES DE LIMA,SUPLENTE,PTB,PARTIDO TRABALHISTA BRASILEIRO,17
RIO DAS PEDRAS,DEPUTADO ESTADUAL,MARILIA,AMARILIA ISABEL VIEIRA,SUPLENTE,PTB,PARTIDO TRABALHISTA BRASILEIRO,1
RIO DAS PEDRAS,DEPUTADO ESTADUAL,CONTE LOPES,ROBERVAL CONTE LOPES LIMA,SUPLENTE,PTB,PARTIDO TRABALHISTA BRASILEIRO,10
RIO DAS PEDRAS,DEPUTADO ESTADUAL,CAMPOS MACHADO,ANTONIO CARLOS DE CAMPOS MACHADO,ELEITO,PTB,PARTIDO TRABALHISTA BRASILEIRO,47
RIO DAS PEDRAS,DEPUTADO ESTADUAL,JUVENCIO MARQUES,JUVENCIO MARQUES DE ALCANTARA,SUPLENTE,PTB,PARTIDO TRABALHISTA BRASILEIRO,1
RIO DAS PEDRAS,DEPUTADO ESTADUAL,CORONEL EDSON FERRARINI,EDSON FERRARINI,ELEITO,PTB,PARTIDO TRABALHISTA BRASILEIRO,3
RIO DAS PEDRAS,DEPUTADO ESTADUAL,VAL,ENIVALDO RAMOS DE FREITAS,SUPLENTE,PTB,PARTIDO TRABALHISTA BRASILEIRO,7
RIO DAS PEDRAS,DEPUTADO ESTADUAL,WALDIR AGNELLO,WALDIR AGNELLO,SUPLENTE,PTB,PARTIDO TRABALHISTA BRASILEIRO,9
RIO DAS PEDRAS,DEPUTADO ESTADUAL,BALEIA ROSSI,LUIZ FELIPE BALEIA TENUTO ROSSI,ELEITO,PMDB,PARTIDO DO MOVIMENTO DEMOCRÁTICO BRASILEIRO,4
RIO DAS PEDRAS,DEPUTADO ESTADUAL,DRA ADRIANA,ADRIANA DI NARDO SILVA,SUPLENTE,PMDB,PARTIDO DO MOVIMENTO DEMOCRÁTICO BRASILEIRO,8
RIO DAS PEDRAS,DEPUTADO ESTADUAL,BEBETTO,ALBERTO FELIPPE HADDAD FILHO,SUPLENTE,PMDB,PARTIDO DO MOVIMENTO DEMOCRÁTICO BRASILEIRO,1
RIO DAS PEDRAS,DEPUTADO ESTADUAL,THIAGO FERRARI,THIAGO DE MORAES FERRARI,SUPLENTE,PMDB,PARTIDO DO MOVIMENTO DEMOCRÁTICO BRASILEIRO,2
RIO DAS PEDRAS,DEPUTADO ESTADUAL,DU TONIN,EDUARDO TONIN,SUPLENTE,PMDB,PARTIDO DO MOVIMENTO DEMOCRÁTICO BRASILEIRO,9
RIO DAS PEDRAS,DEPUTADO ESTADUAL,AMÉRICO CANDIDO,AMÉRICO CANDIDO DA SILVA,SUPLENTE,PMDB,PARTIDO DO MOVIMENTO DEMOCRÁTICO BRASILEIRO,2
RIO DAS PEDRAS,DEPUTADO ESTADUAL,CARUSO,JORGE LUIS CARUSO,ELEITO,PMDB,PARTIDO DO MOVIMENTO DEMOCRÁTICO BRASILEIRO,1
RIO DAS PEDRAS,DEPUTADO ESTADUAL,FABIO BELLO,FABIO BELLO DE OLIVEIRA,SUPLENTE,PMDB,PARTIDO DO MOVIMENTO DEMOCRÁTICO BRASILEIRO,1
RIO DAS PEDRAS,DEPUTADO ESTADUAL,VANESSA DAMO,VANESSA DAMO OROSCO,ELEITO,PMDB,PARTIDO DO MOVIMENTO DEMOCRÁTICO BRASILEIRO,18
RIO DAS PEDRAS,DEPUTADO ESTADUAL,CHICÃO SERRA TALHADA,FRANCISCO BEZERRA DOS SANTOS,SUPLENTE,PMDB,PARTIDO DO MOVIMENTO DEMOCRÁTICO BRASILEIRO,2
RIO DAS PEDRAS,DEPUTADO ESTADUAL,ITAMAR BORGES,ITAMAR FRANCISCO MACHADO BORGES,MÉDIA,PMDB,PARTIDO DO MOVIMENTO DEMOCRÁTICO BRASILEIRO,1
RIO DAS PEDRAS,DEPUTADO ESTADUAL,JONAS,JONAS PEREIRA DE LIMA,SUPLENTE,PMDB,PARTIDO DO MOVIMENTO DEMOCRÁTICO BRASILEIRO,3
RIO DAS PEDRAS,DEPUTADO ESTADUAL,DITINHO MATHEUS,BENEDITO MATHEUS FILHO,SUPLENTE,PMDB,PARTIDO DO MOVIMENTO DEMOCRÁTICO BRASILEIRO,1
RIO DAS PEDRAS,DEPUTADO ESTADUAL,TUNICO VIEIRA,ANTONIO JOSÉ VIEIRA JUNIOR,SUPLENTE,PMDB,PARTIDO DO MOVIMENTO DEMOCRÁTICO BRASILEIRO,1
RIO DAS PEDRAS,DEPUTADO ESTADUAL,ALEXANDRE CUNHA,ALEXANDRE EVARISTO CUNHA,SUPLENTE,PMDB,PARTIDO DO MOVIMENTO DEMOCRÁTICO BRASILEIRO,2
RIO DAS PEDRAS,DEPUTADO ESTADUAL,MOURA ANDRADE,JOAQUIM VICENTE DE MOURA ANDRADE JUNIOR,SUPLENTE,PMDB,PARTIDO DO MOVIMENTO DEMOCRÁTICO BRASILEIRO,2
RIO DAS PEDRAS,DEPUTADO ESTADUAL,REINALDO BRICOLA,REINALDO BRICOLA,SUPLENTE,PSC,HUMANISTA CRISTÃO ,1
RIO DAS PEDRAS,DEPUTADO ESTADUAL,APOSTOLO EURIPEDES,EURIPEDES LUIZ DE SOUSA,SUPLENTE,PSC,HUMANISTA CRISTÃO ,2
RIO DAS PEDRAS,DEPUTADO ESTADUAL,LELIS TRAJANO,LELIS JOSE TRAJANO,SUPLENTE,PSC,HUMANISTA CRISTÃO ,1
RIO DAS PEDRAS,DEPUTADO ESTADUAL,PASTOR VIEIRA ROCHA,JOSE VIEIRA ROCHA,SUPLENTE,PSC,HUMANISTA CRISTÃO ,11
RIO DAS PEDRAS,DEPUTADO ESTADUAL,PR. CARLOS CEZAR,CARLOS CEZAR DA SILVA,ELEITO,PSC,HUMANISTA CRISTÃO ,460
RIO DAS PEDRAS,DEPUTADO ESTADUAL,VANDERLEI GOES,VANDERLEI DE GOES,SUPLENTE,PSC,HUMANISTA CRISTÃO ,1
RIO DAS PEDRAS,DEPUTADO ESTADUAL,JAIMINHO,JAIME DONIZETE PEREIRA,SUPLENTE,PSC,HUMANISTA CRISTÃO ,1
RIO DAS PEDRAS,DEPUTADO ESTADUAL,LUIZ LAURO,LUIZ LAURO FERREIRA,SUPLENTE,PSC,HUMANISTA CRISTÃO ,2
RIO DAS PEDRAS,DEPUTADO ESTADUAL,LUIZ BUENO,LUIZ CARLOS BUENO DA SILVA JUNIOR,SUPLENTE,PSC,HUMANISTA CRISTÃO ,11
RIO DAS PEDRAS,DEPUTADO ESTADUAL,CAPITÃO LIDIO,LIDIO GUARIGLIA COSTA JUNIOR,SUPLENTE,PSC,HUMANISTA CRISTÃO ,3
RIO DAS PEDRAS,DEPUTADO ESTADUAL,ADILSON ROSSI,ADILSON ROSSI,ELEITO,PSC,HUMANISTA CRISTÃO ,1
RIO DAS PEDRAS,DEPUTADO ESTADUAL,JOÃO BINATO,JOÃO ANTONIO BINATO,SUPLENTE,PSC,HUMANISTA CRISTÃO ,44
RIO DAS PEDRAS,DEPUTADO ESTADUAL,PASTOR JOÃO LUIZ NETO,JOÃO LUIZ NETO,SUPLENTE,PSC,HUMANISTA CRISTÃO ,2
RIO DAS PEDRAS,DEPUTADO ESTADUAL,INSTR. VASQUES,ROBERTO VASQUES DE SANTANA,SUPLENTE,PSC,HUMANISTA CRISTÃO ,1
RIO DAS PEDRAS,DEPUTADO ESTADUAL,PAULO CHOCOLATE,PAULO SERGIO VIEIRA NEVES,SUPLENTE,PSC,HUMANISTA CRISTÃO ,1
RIO DAS PEDRAS,DEPUTADO ESTADUAL,PROF. ANTONIO NEME,ANTONIO DIAS NEME,SUPLENTE,PSC,HUMANISTA CRISTÃO ,1
RIO DAS PEDRAS,DEPUTADO ESTADUAL,RODRIGO MORAES,RODRIGO AUGUSTO MORAES,ELEITO,PSC,HUMANISTA CRISTÃO ,178
RIO DAS PEDRAS,DEPUTADO ESTADUAL,BRAZ PASSARINHEIRO,BRAZ ANASTACIO DA SILVA,SUPLENTE,PSC,HUMANISTA CRISTÃO ,4
RIO DAS PEDRAS,DEPUTADO ESTADUAL,NELSON FERNANDES,JOSE NELSON AGUIAR FERNANDES,SUPLENTE,PSC,HUMANISTA CRISTÃO ,1
RIO DAS PEDRAS,DEPUTADO ESTADUAL,WALTER GOMES,WALTER GOMES DE OLIVEIRA,SUPLENTE,PR,SOMOS MAIS SÃO PAULO,2
RIO DAS PEDRAS,DEPUTADO ESTADUAL,PAULO CORREA,PAULO HENRIQUE CORREA,SUPLENTE,PR,SOMOS MAIS SÃO PAULO,1
RIO DAS PEDRAS,DEPUTADO ESTADUAL,ZE PEDRO,JOSE PEDRO LEITE DA SILVA,SUPLENTE,PR,SOMOS MAIS SÃO PAULO,172
RIO DAS PEDRAS,DEPUTADO ESTADUAL,LILI AIMAR,LILIANA MEDEIROS DE ALMEIDA AYMAR BECHARA,SUPLENTE,PR,SOMOS MAIS SÃO PAULO,2
RIO DAS PEDRAS,DEPUTADO ESTADUAL,PATRICIA LIMA,PATRICIA FREITAS LIMA,SUPLENTE,PR,SOMOS MAIS SÃO PAULO,13
RIO DAS PEDRAS,DEPUTADO ESTADUAL,ROY NELSON,ROY NELSON PINTO,SUPLENTE,PR,SOMOS MAIS SÃO PAULO,1
RIO DAS PEDRAS,DEPUTADO ESTADUAL,OSVALDO VERGINIO,OSVALDO VERGINIO DA SILVA,SUPLENTE,PR,SOMOS MAIS SÃO PAULO,3
RIO DAS PEDRAS,DEPUTADO ESTADUAL,ANDRE DO PRADO,ANDRE LUIS DO PRADO,ELEITO,PR,SOMOS MAIS SÃO PAULO,146
RIO DAS PEDRAS,DEPUTADO ESTADUAL,JOSE CARLOS SOARES,JOSE CARLOS SOARES,SUPLENTE,PPS,PARTIDO POPULAR SOCIALISTA,1
RIO DAS PEDRAS,DEPUTADO ESTADUAL,PROFESSOR OSMIR PETRINI,OSMIR ANTONIO PETRINI,SUPLENTE,PPS,PARTIDO POPULAR SOCIALISTA,69
RIO DAS PEDRAS,DEPUTADO ESTADUAL,ADEMIR DA GUIA,ADEMIR DA GUIA,SUPLENTE,PPS,PARTIDO POPULAR SOCIALISTA,29
RIO DAS PEDRAS,DEPUTADO ESTADUAL,DAVI ZAIA,DAVID ZAIA,MÉDIA,PPS,PARTIDO POPULAR SOCIALISTA,11
RIO DAS PEDRAS,DEPUTADO ESTADUAL,MARCOS CHIEN,CHIEN CHIN HUEI,SUPLENTE,PPS,PARTIDO POPULAR SOCIALISTA,1
RIO DAS PEDRAS,DEPUTADO ESTADUAL,ROBSON O BELLO,ROBSON LUIZ CARDOSO,SUPLENTE,PPS,PARTIDO POPULAR SOCIALISTA,2
RIO DAS PEDRAS,DEPUTADO ESTADUAL,JOAO OTAVIO BASTOS,JOAO OTAVIO BASTOS JUNQUEIRA,SUPLENTE,PPS,PARTIDO POPULAR SOCIALISTA,1
RIO DAS PEDRAS,DEPUTADO ESTADUAL,ALEX MANENTE,ALEX SPINELLI MANENTE,ELEITO,PPS,PARTIDO POPULAR SOCIALISTA,3
RIO DAS PEDRAS,DEPUTADO ESTADUAL,JORGE MATOS,JORGE DONIZETTI RIBEIRO DE MATOS,SUPLENTE,PPS,PARTIDO POPULAR SOCIALISTA,1
RIO DAS PEDRAS,DEPUTADO ESTADUAL,DIRCEU DALBEN,ANTONIO DIRCEU DALBEN,SUPLENTE,PPS,PARTIDO POPULAR SOCIALISTA,1
RIO DAS PEDRAS,DEPUTADO ESTADUAL,GONDIM,LUIZ CARLOS GONDIM TEIXEIRA,ELEITO,PPS,PARTIDO POPULAR SOCIALISTA,9
RIO DAS PEDRAS,DEPUTADO ESTADUAL,ESTEVÃO,STEVEN ERIKSEN BINNIE,SUPLENTE,PPS,PARTIDO POPULAR SOCIALISTA,3
RIO DAS PEDRAS,DEPUTADO ESTADUAL,PROFESSOR ZE MARIA,JOSE MARIA CANCELLIERO,SUPLENTE,PPS,PARTIDO POPULAR SOCIALISTA,177
RIO DAS PEDRAS,DEPUTADO ESTADUAL,JOSE CLAUDIO,JOSE CLAUDIO DE SOUZA,SUPLENTE,PPS,PARTIDO POPULAR SOCIALISTA,3
RIO DAS PEDRAS,DEPUTADO ESTADUAL,EURIPINHO ARTILHEIRO DO POVO,OLIMPIO JORGE NABEN,SUPLENTE,PPS,PARTIDO POPULAR SOCIALISTA,1
RIO DAS PEDRAS,DEPUTADO ESTADUAL,ROBERTO MORAIS,ROBERTO TURCHI DE MORAIS,ELEITO,PPS,PARTIDO POPULAR SOCIALISTA,5734
RIO DAS PEDRAS,DEPUTADO ESTADUAL,AZUAITE,AZUAITE MARTINS DE FRANÇA,SUPLENTE,PPS,PARTIDO POPULAR SOCIALISTA,7
RIO DAS PEDRAS,DEPUTADO ESTADUAL,ZEZINHO DA COHAB,JOSE MARTINS DOS SANTOS,SUPLENTE,PPS,PARTIDO POPULAR SOCIALISTA,2
RIO DAS PEDRAS,DEPUTADO ESTADUAL,ELZO SIGUETA,ELZO SIGUETA,SUPLENTE,PPS,PARTIDO POPULAR SOCIALISTA,8
RIO DAS PEDRAS,DEPUTADO ESTADUAL,SERGIO BOCALINI,SERGIO DOS SANTOS BOCALINI,SUPLENTE,PPS,PARTIDO POPULAR SOCIALISTA,2
RIO DAS PEDRAS,DEPUTADO ESTADUAL,KITO JUNQUEIRA,HERACLITO GOMES PIZANO,SUPLENTE,PPS,PARTIDO POPULAR SOCIALISTA,2
RIO DAS PEDRAS,DEPUTADO ESTADUAL,DARIO SAADI,DARIO JORGE GIOLO SAADI,SUPLENTE,DEM,PSDB/DEM,5
RIO DAS PEDRAS,DEPUTADO ESTADUAL,ANDRE SOARES,ANDRE BEZERRA RIBEIRO SOARES,ELEITO,DEM,PSDB/DEM,91
RIO DAS PEDRAS,DEPUTADO ESTADUAL,EDMIR CHEDID,EDMIR JOSE ABI CHEDID,ELEITO,DEM,PSDB/DEM,13
RIO DAS PEDRAS,DEPUTADO ESTADUAL,ALDO DEMARCHI,JOSE ALDO DEMARCHI,ELEITO,DEM,PSDB/DEM,392
RIO DAS PEDRAS,DEPUTADO ESTADUAL,JOAO MELLAO NETO,JOAO MELLAO NETO,SUPLENTE,DEM,PSDB/DEM,2
RIO DAS PEDRAS,DEPUTADO ESTADUAL,FERNANDO LUCAS,LUIZ FERNANDO AMARAL LUCAS,SUPLENTE,DEM,PSDB/DEM,1
RIO DAS PEDRAS,DEPUTADO ESTADUAL,ESTEVAM GALVAO,ESTEVAM GALVAO DE OLIVEIRA,ELEITO,DEM,PSDB/DEM,1
RIO DAS PEDRAS,DEPUTADO ESTADUAL,RICARDO SALLES,RICARDO DE AQUINO SALLES,SUPLENTE,DEM,PSDB/DEM,2
RIO DAS PEDRAS,DEPUTADO ESTADUAL,PAULO BARBOZA FILHO,PAULO EUGENIO MACHADO BARBOZA,SUPLENTE,DEM,PSDB/DEM,1
RIO DAS PEDRAS,DEPUTADO ESTADUAL,SALLES,RAIMUNDO TARASKEVICIUS SALES,SUPLENTE,DEM,PSDB/DEM,3
RIO DAS PEDRAS,DEPUTADO ESTADUAL,GIL ARANTES,GILBERTO MACEDO GIL ARANTES,ELEITO,DEM,PSDB/DEM,29
RIO DAS PEDRAS,DEPUTADO ESTADUAL,JERONIMO MORENO,JERONIMO DE LA CRUZ MORENO,SUPLENTE,DEM,PSDB/DEM,3
RIO DAS PEDRAS,DEPUTADO ESTADUAL,LEANDRO DO KLB,LEANDRO FINATO SCORNAVACCA,SUPLENTE,DEM,PSDB/DEM,39
RIO DAS PEDRAS,DEPUTADO ESTADUAL,PAULO HADICH,PAULO CEZAR JUNQUEIRA HADICH,SUPLENTE,PSB,PARTIDO SOCIALISTA BRASILEIRO,9
RIO DAS PEDRAS,DEPUTADO ESTADUAL,DR. GENIVAL,GENIVAL FAUSTO DA SILVA,SUPLENTE,PSB,PARTIDO SOCIALISTA BRASILEIRO,3
RIO DAS PEDRAS,DEPUTADO ESTADUAL,WALTER HAYASHI,WALTER KATSUNORI HAYASHI,SUPLENTE,PSB,PARTIDO SOCIALISTA BRASILEIRO,1
RIO DAS PEDRAS,DEPUTADO ESTADUAL,FRANCÉ JUNIOR,ANTONIO FRANCÉ JUNIOR,SUPLENTE,PSB,PARTIDO SOCIALISTA BRASILEIRO,1
RIO DAS PEDRAS,DEPUTADO ESTADUAL,DR. JOSÉ RICARDO,JOSÉ RICARDO DIAS,SUPLENTE,PSB,PARTIDO SOCIALISTA BRASILEIRO,17
RIO DAS PEDRAS,DEPUTADO ESTADUAL,DR. JULIANO PRANDI,JULIANO CARMINE PRANDI,SUPLENTE,PSB,PARTIDO SOCIALISTA BRASILEIRO,1
RIO DAS PEDRAS,DEPUTADO ESTADUAL,DR. GUACYRO,GUACYRO JUSTINO ALFREDO,SUPLENTE,PSB,PARTIDO SOCIALISTA BRASILEIRO,1
RIO DAS PEDRAS,DEPUTADO ESTADUAL,BACCARIN,SILVIO LUIZ BACCARIN,SUPLENTE,PSB,PARTIDO SOCIALISTA BRASILEIRO,1
RIO DAS PEDRAS,DEPUTADO ESTADUAL,DAL,SENIVALDO ALVES DA SILVA,SUPLENTE,PSB,PARTIDO SOCIALISTA BRASILEIRO,1
RIO DAS PEDRAS,DEPUTADO ESTADUAL,ROMUALDO,ROMUALDO CONSTANTINO MAGRO JUNIOR,SUPLENTE,PSB,PARTIDO SOCIALISTA BRASILEIRO,2
RIO DAS PEDRAS,DEPUTADO ESTADUAL,GENTIL,ALEXANDRE MARIANO GENTIL,SUPLENTE,PV,PARTIDO VERDE,1
RIO DAS PEDRAS,DEPUTADO ESTADUAL,GIRIBONI,EDSON DE OLIVEIRA GIRIBONI,ELEITO,PV,PARTIDO VERDE,3
RIO DAS PEDRAS,DEPUTADO ESTADUAL,ARTUR DIAN,ARTUR JOSE DIAN,SUPLENTE,PV,PARTIDO VERDE,14
RIO DAS PEDRAS,DEPUTADO ESTADUAL,FIDEL BUSTAMANTE,FIDEL BUSTAMANTE,SUPLENTE,PV,PARTIDO VERDE,1
RIO DAS PEDRAS,DEPUTADO ESTADUAL,FELICIANO,FELICIANO NAHIMY FILHO,ELEITO,PV,PARTIDO VERDE,152
RIO DAS PEDRAS,DEPUTADO ESTADUAL,SANDRA BARROS,SANDRA MARA BENITES DE BARROS,SUPLENTE,PV,PARTIDO VERDE,1
RIO DAS PEDRAS,DEPUTADO ESTADUAL,DORA,DORACI RIBEIRO DE FARIAS,SUPLENTE,PV,PARTIDO VERDE,1
RIO DAS PEDRAS,DEPUTADO ESTADUAL,CHICO SARDELLI,FRANCISCO ANTONIO SARDELLI,ELEITO,PV,PARTIDO VERDE,684
RIO DAS PEDRAS,DEPUTADO ESTADUAL,PAULINHO DO PV,PAULO CARDOSO FILHO,SUPLENTE,PV,PARTIDO VERDE,2
RIO DAS PEDRAS,DEPUTADO ESTADUAL,ROSE FIGUEIRA,ROSEMEIRE APARECIDA ARAÚJO FIGUEIRA LEMES,SUPLENTE,PV,PARTIDO VERDE,1
RIO DAS PEDRAS,DEPUTADO ESTADUAL,ESTEVAM SILVA,ESTEVAM LUIZ ALMEIDA SILVA,SUPLENTE,PV,PARTIDO VERDE,1
RIO DAS PEDRAS,DEPUTADO ESTADUAL,RITA PASSOS,RITA DE CASSIA TRINCA PASSOS,ELEITO,PV,PARTIDO VERDE,5
RIO DAS PEDRAS,DEPUTADO ESTADUAL,PADRE AFONSO,JOSÉ AFONSO LOBATO,ELEITO,PV,PARTIDO VERDE,1
RIO DAS PEDRAS,DEPUTADO ESTADUAL,NAVAL PELA GUARDA MUNICIPAL,MAURICIO DOMINGUES DA SILVA,SUPLENTE,PV,PARTIDO VERDE,17
RIO DAS PEDRAS,DEPUTADO ESTADUAL,PEDRO FIORELLI,PEDRO HENRIQUE TEIXEIRA FIORELLI,SUPLENTE,PV,PARTIDO VERDE,1
RIO DAS PEDRAS,DEPUTADO ESTADUAL,FERNANDO MARREY FERREIRA,FERNANDO MARREY FERREIRA,SUPLENTE,PV,PARTIDO VERDE,2
RIO DAS PEDRAS,DEPUTADO ESTADUAL,BETH DA PET,ELISABETH FERREIRA,SUPLENTE,PV,PARTIDO VERDE,1
RIO DAS PEDRAS,DEPUTADO ESTADUAL,DR. ULYSSES,ULYSSES MARIO TASSINARI,MÉDIA,PV,PARTIDO VERDE,3
RIO DAS PEDRAS,DEPUTADO ESTADUAL,REINALDO ALGUZ,REINALDO DE SOUZA ALGUZ,ELEITO,PV,PARTIDO VERDE,1
RIO DAS PEDRAS,DEPUTADO ESTADUAL,REGINA GONÇALVES,MARIA REGINA GONÇALVES,SUPLENTE,PV,PARTIDO VERDE,1
RIO DAS PEDRAS,DEPUTADO ESTADUAL,LIA,MARIA LUZIA CASSIMIRA CONSTANTINO,SUPLENTE,PV,PARTIDO VERDE,1
RIO DAS PEDRAS,DEPUTADO ESTADUAL,SATIRO,SATIRO CANDIDO,SUPLENTE,PV,PARTIDO VERDE,1
RIO DAS PEDRAS,DEPUTADO ESTADUAL,PEDRO DE SÁ,PEDRO DE SÁ FILHO,SUPLENTE,PV,PARTIDO VERDE,1
RIO DAS PEDRAS,DEPUTADO ESTADUAL,WELTON PEREIRA,WELTON PEREIRA DE JESUS,SUPLENTE,PV,PARTIDO VERDE,1
RIO DAS PEDRAS,DEPUTADO ESTADUAL,PASTOR DILMO DOS SANTOS,DILMO DOS SANTOS,ELEITO,PV,PARTIDO VERDE,862
RIO DAS PEDRAS,DEPUTADO ESTADUAL,MARCOS PAPA,MARCOS ANDRÉ PAPA,SUPLENTE,PV,PARTIDO VERDE,7
RIO DAS PEDRAS,DEPUTADO ESTADUAL,SÉRGIO CONTENTE,SERGIO CONTENTE,SUPLENTE,PV,PARTIDO VERDE,4
RIO DAS PEDRAS,DEPUTADO ESTADUAL,PEDRO CAMELO,PEDRO CAMELO FILHO,SUPLENTE,PV,PARTIDO VERDE,1
RIO DAS PEDRAS,DEPUTADO ESTADUAL,HELIO RUBENS,HELIO RUBENS GONÇALVES FIGUEIREDO,SUPLENTE,PSDB,PSDB/DEM,2
RIO DAS PEDRAS,DEPUTADO ESTADUAL,MARIA ZEFERINA BALDAIA,MARIA ZEFERINA RODRIGUES BALDAIA,SUPLENTE,PSDB,PSDB/DEM,1
RIO DAS PEDRAS,DEPUTADO ESTADUAL,DR ENIO SANTINELLI,ENIO SANTINELLI,SUPLENTE,PSDB,PSDB/DEM,1
RIO DAS PEDRAS,DEPUTADO ESTADUAL,EVANDRO LOSACCO,EVANDRO LUIZ LOSACCO,SUPLENTE,PSDB,PSDB/DEM,4
