BARIRI,DEPUTADO ESTADUAL,ROBERTO ENGLER,ROBERTO CARVALHO ENGLER PINTO,ELEITO,PSDB,PSDB/DEM,2
BARIRI,DEPUTADO ESTADUAL,CELINO,JUSCELINO CARDOSO DE SÁ,ELEITO,PSDB,PSDB/DEM,8
BARIRI,DEPUTADO ESTADUAL,JOSE BORANGA,JOSE AURELIO BORANGA,SUPLENTE,PSDB,PSDB/DEM,1
BARIRI,DEPUTADO ESTADUAL,ADOLFO QUINTAS,ADOLFO QUINTAS GONÇALVES NETO,SUPLENTE,PSDB,PSDB/DEM,3
BARIRI,DEPUTADO ESTADUAL,CARLÃO PIGNATARI,CARLOS EDUARDO PIGNATARI,ELEITO,PSDB,PSDB/DEM,1
BARIRI,DEPUTADO ESTADUAL,DILADOR BORGES,DILADOR BORGES DAMASCENO,SUPLENTE,PSDB,PSDB/DEM,19
BARIRI,DEPUTADO ESTADUAL,ADMIR FERRO,ADMIR DONIZETI FERRO,SUPLENTE,PSDB,PSDB/DEM,3
BARIRI,DEPUTADO ESTADUAL,CARLOS BEZERRA JR.,CARLOS ALBERTO DE QUADROS BEZERRA JUNIOR,ELEITO,PSDB,PSDB/DEM,2
BARIRI,DEPUTADO ESTADUAL,ANALICE FERNANDES,ANALICE FERNANDES,ELEITO,PSDB,PSDB/DEM,1
BARIRI,DEPUTADO ESTADUAL,CAUÊ MACRIS,CAUÊ CASEIRO MACRIS,MÉDIA,PSDB,PSDB/DEM,6
BARIRI,DEPUTADO ESTADUAL,DRA ALINE,ALINE SARAIVA COSTA BEZERRA,SUPLENTE,PSDB,PSDB/DEM,1
BARIRI,DEPUTADO ESTADUAL,CONCCI MARCO,ELIANE CONCEIÇÃO SILVA MENDES,SUPLENTE,PSDB,PSDB/DEM,6
BARIRI,DEPUTADO ESTADUAL,JOÃO SANZOVO,JOÃO SANZOVO NETO,SUPLENTE,PSDB,PSDB/DEM,538
BARIRI,DEPUTADO ESTADUAL,ROBERTO MASSAFERA,ROBERTO MASSAFERA,ELEITO,PSDB,PSDB/DEM,115
BARIRI,DEPUTADO ESTADUAL,VICTOR KOBAYASHI,VICTOR KOBAYASHI,SUPLENTE,PSDB,PSDB/DEM,2
BARIRI,DEPUTADO ESTADUAL,BARROS MUNHOZ,JOSE ANTONIO BARROS MUNHOZ,ELEITO,PSDB,PSDB/DEM,33
BARIRI,DEPUTADO ESTADUAL,CELSO GIGLIO,CELSO ANTONIO GIGLIO,ELEITO,PSDB,PSDB/DEM,5
BARIRI,DEPUTADO ESTADUAL,FARID,JORGE FARID BOULOS BOU CHEBL,SUPLENTE,PSDB,PSDB/DEM,2
BARIRI,DEPUTADO ESTADUAL,PAULO ALEXANDRE BARBOSA,PAULO ALEXANDRE PEREIRA BARBOSA,ELEITO,PSDB,PSDB/DEM,176
BARIRI,DEPUTADO ESTADUAL,ARTUR ORSI,ARTUR CASSEB ORSI,SUPLENTE,PSDB,PSDB/DEM,3
BARIRI,DEPUTADO ESTADUAL,GILSON BARRETO,GILSON ALMEIDA BARRETO,SUPLENTE,PSDB,PSDB/DEM,4
BARIRI,DEPUTADO ESTADUAL,JOSE AUGUSTO,JOSE AUGUSTO DA SILVA RAMOS,SUPLENTE,PSDB,PSDB/DEM,2
BARIRI,DEPUTADO ESTADUAL,ORLANDO MORANDO,ORLANDO MORANDO JUNIOR,ELEITO,PSDB,PSDB/DEM,1
BARIRI,DEPUTADO ESTADUAL,FERNANDO CAPEZ,FERNANDO CAPEZ,ELEITO,PSDB,PSDB/DEM,111
BARIRI,DEPUTADO ESTADUAL,MARCUS NAZARETH PEÇANHA,MARCUS NAZARETH PEÇANHA,SUPLENTE,PSDB,PSDB/DEM,4
BARIRI,DEPUTADO ESTADUAL,JANICE,JANICE MASSABNI MARTINS,SUPLENTE,PSDB,PSDB/DEM,2
BARIRI,DEPUTADO ESTADUAL,MARCOS ZERBINI,MARCOS ANTONIO ZERBINI,ELEITO,PSDB,PSDB/DEM,1
BARIRI,DEPUTADO ESTADUAL,MILTON DALLARI,JOSÉ MILTON DALLARI SOARES,SUPLENTE,PSDB,PSDB/DEM,22
BARIRI,DEPUTADO ESTADUAL,DIOBEL DA DIDOL'S,DIOBEL DE LIMA FERNANDES,SUPLENTE,PSDB,PSDB/DEM,1
BARIRI,DEPUTADO ESTADUAL,VITORIO QUEIROZ,VITORIO DA SILVA QUEIROZ,SUPLENTE,PSOL,PARTIDO SOCIALISMO E LIBERDADE,1
BARIRI,DEPUTADO ESTADUAL,JORGE NELSON,JORGE NELSON DA SILVA AMARAL,SUPLENTE,PSOL,PARTIDO SOCIALISMO E LIBERDADE,1
BARIRI,DEPUTADO ESTADUAL,LAIRTON SANTOS,LAIRTON LUIS DOS SANTOS,SUPLENTE,PSOL,PARTIDO SOCIALISMO E LIBERDADE,2
BARIRI,DEPUTADO ESTADUAL,RAUL MARCELO,RAUL MARCELO DE SOUZA,SUPLENTE,PSOL,PARTIDO SOCIALISMO E LIBERDADE,1
BARIRI,DEPUTADO ESTADUAL,CARLOS GIANNAZI,CARLOS ALBERTO GIANNASI,ELEITO,PSOL,PARTIDO SOCIALISMO E LIBERDADE,6
BARIRI,DEPUTADO ESTADUAL,WANDER,WANDER DE OLIVEIRA VILLALBA,SUPLENTE,PC DO B,PARTIDO COMUNISTA DO BRASIL,5
BARIRI,DEPUTADO ESTADUAL,LECI BRANDÃO,LECI BRANDAO DA SILVA,ELEITO,PC DO B,PARTIDO COMUNISTA DO BRASIL,6
BARIRI,DEPUTADO ESTADUAL,SIDNEY,SIDNEY LIBERTI,SUPLENTE,PC DO B,PARTIDO COMUNISTA DO BRASIL,1
BARIRI,DEPUTADO ESTADUAL,SARAH MUNHOZ,SARAH MUNHOZ,SUPLENTE,PC DO B,PARTIDO COMUNISTA DO BRASIL,21
BARIRI,DEPUTADO ESTADUAL,PEDRO BIGARDI,PEDRO ANTONIO BIGARDI,ELEITO,PC DO B,PARTIDO COMUNISTA DO BRASIL,1
BARIRI,DEPUTADO ESTADUAL,DAVI RAMOS,DAVI GONÇALVES RAMOS,SUPLENTE,PC DO B,PARTIDO COMUNISTA DO BRASIL,6
BARIRI,DEPUTADO ESTADUAL,PRISCILA VAUTIER,PRISCILA VAUTIER,SUPLENTE,PC DO B,PARTIDO COMUNISTA DO BRASIL,4
BARIRI,DEPUTADO ESTADUAL,LAÉRCIO SOARES,LAERCIO PEREIRA SOARES,SUPLENTE,PC DO B,PARTIDO COMUNISTA DO BRASIL,6
BARIRI,DEPUTADO ESTADUAL,PROFESSOR FLAVIO DELMANTO,FLAVIO DELMANTO,SUPLENTE,PC DO B,PARTIDO COMUNISTA DO BRASIL,4
BARIRI,DEPUTADO ESTADUAL,BENASSI,SÉRGIO BENASSI,SUPLENTE,PC DO B,PARTIDO COMUNISTA DO BRASIL,2
BARIRI,DEPUTADO ESTADUAL,DITO LEITE,SILVIO ROBERTO PACHECO,SUPLENTE,PC DO B,PARTIDO COMUNISTA DO BRASIL,6
BARIRI,DEPUTADO ESTADUAL,TONINHO CAMPANHA,ANTONIO LAURO CAMPANHA,SUPLENTE,PT DO B,SOMOS MAIS SÃO PAULO,2
BARIRI,DEPUTADO ESTADUAL,PAULO CORRÊA JR,PAULO ALVES CORRÊA JUNIOR,SUPLENTE,PT DO B,SOMOS MAIS SÃO PAULO,5
