CASTILHO,DEPUTADO ESTADUAL,WALDIR AGNELLO,WALDIR AGNELLO,SUPLENTE,PTB,PARTIDO TRABALHISTA BRASILEIRO,3
CASTILHO,DEPUTADO ESTADUAL,ITALO RENE,ITALO RENE CORREA,SUPLENTE,PTB,PARTIDO TRABALHISTA BRASILEIRO,17
CASTILHO,DEPUTADO ESTADUAL,BALEIA ROSSI,LUIZ FELIPE BALEIA TENUTO ROSSI,ELEITO,PMDB,PARTIDO DO MOVIMENTO DEMOCRÁTICO BRASILEIRO,8
CASTILHO,DEPUTADO ESTADUAL,DRA ADRIANA,ADRIANA DI NARDO SILVA,SUPLENTE,PMDB,PARTIDO DO MOVIMENTO DEMOCRÁTICO BRASILEIRO,2
CASTILHO,DEPUTADO ESTADUAL,CARUSO,JORGE LUIS CARUSO,ELEITO,PMDB,PARTIDO DO MOVIMENTO DEMOCRÁTICO BRASILEIRO,2
CASTILHO,DEPUTADO ESTADUAL,VANESSA DAMO,VANESSA DAMO OROSCO,ELEITO,PMDB,PARTIDO DO MOVIMENTO DEMOCRÁTICO BRASILEIRO,6
CASTILHO,DEPUTADO ESTADUAL,VALDOMIRO,VALDOMIRO FRANCISCO DE OLIVEIRA,SUPLENTE,PMDB,PARTIDO DO MOVIMENTO DEMOCRÁTICO BRASILEIRO,1
CASTILHO,DEPUTADO ESTADUAL,CHICÃO SERRA TALHADA,FRANCISCO BEZERRA DOS SANTOS,SUPLENTE,PMDB,PARTIDO DO MOVIMENTO DEMOCRÁTICO BRASILEIRO,1
CASTILHO,DEPUTADO ESTADUAL,ITAMAR BORGES,ITAMAR FRANCISCO MACHADO BORGES,MÉDIA,PMDB,PARTIDO DO MOVIMENTO DEMOCRÁTICO BRASILEIRO,115
CASTILHO,DEPUTADO ESTADUAL,MARIA DO CARMO GUILHERME,MARIA DO CARMO GUILHERME,SUPLENTE,PMDB,PARTIDO DO MOVIMENTO DEMOCRÁTICO BRASILEIRO,1
CASTILHO,DEPUTADO ESTADUAL,MOURA ANDRADE,JOAQUIM VICENTE DE MOURA ANDRADE JUNIOR,SUPLENTE,PMDB,PARTIDO DO MOVIMENTO DEMOCRÁTICO BRASILEIRO,1
CASTILHO,DEPUTADO ESTADUAL,REGINA MARIANO,MARIA REGINA LEAL MARIANO,SUPLENTE,PMDB,PARTIDO DO MOVIMENTO DEMOCRÁTICO BRASILEIRO,1
CASTILHO,DEPUTADO ESTADUAL,OLIVEIRA JUNIOR,ELIO APARECIDO DE OLIVEIRA,SUPLENTE,PSC,HUMANISTA CRISTÃO ,2
CASTILHO,DEPUTADO ESTADUAL,CELSO NASCIMENTO,CELSO BRAZ DO NASCIMENTO,SUPLENTE,PSC,HUMANISTA CRISTÃO ,49
CASTILHO,DEPUTADO ESTADUAL,APOSTOLO EURIPEDES,EURIPEDES LUIZ DE SOUSA,SUPLENTE,PSC,HUMANISTA CRISTÃO ,3
CASTILHO,DEPUTADO ESTADUAL,DR. CLAUDIO MIRANDA,CLAUDIO ERNANI MARCONDES DE MIRANDA,SUPLENTE,PSC,HUMANISTA CRISTÃO ,4
CASTILHO,DEPUTADO ESTADUAL,ADILSON ROSSI,ADILSON ROSSI,ELEITO,PSC,HUMANISTA CRISTÃO ,2
CASTILHO,DEPUTADO ESTADUAL,MARIA CLELIA MARIN,MARIA CLELIA DILCIA CAPRILES MARIM,SUPLENTE,PSC,HUMANISTA CRISTÃO ,3
CASTILHO,DEPUTADO ESTADUAL,RENATO PUPO,RENATO PUPO DE PAULA,SUPLENTE,PSC,HUMANISTA CRISTÃO ,1
CASTILHO,DEPUTADO ESTADUAL,PAULO CHOCOLATE,PAULO SERGIO VIEIRA NEVES,SUPLENTE,PSC,HUMANISTA CRISTÃO ,10
CASTILHO,DEPUTADO ESTADUAL,MARIA DO CARMO PIUNTI,MARIA DO CARMO THOMAZ PIUNTI,SUPLENTE,PSC,HUMANISTA CRISTÃO ,12
CASTILHO,DEPUTADO ESTADUAL,CANDIDO,JOELSON CANDIDO DE OLIVEIRA,SUPLENTE,PSC,HUMANISTA CRISTÃO ,14
CASTILHO,DEPUTADO ESTADUAL,RODRIGO MORAES,RODRIGO AUGUSTO MORAES,ELEITO,PSC,HUMANISTA CRISTÃO ,57
CASTILHO,DEPUTADO ESTADUAL,MARCOS NEVES,MARCO AURELIO DOS SANTOS NEVES,ELEITO,PSC,HUMANISTA CRISTÃO ,5
CASTILHO,DEPUTADO ESTADUAL,ABEL FOTOGRAFO,ABEL DE OLIVEIRA,SUPLENTE,PSC,HUMANISTA CRISTÃO ,2
CASTILHO,DEPUTADO ESTADUAL,CABO FILHO,JOSE DIAS DA SILVA FILHO,SUPLENTE,PSC,HUMANISTA CRISTÃO ,2
CASTILHO,DEPUTADO ESTADUAL,ZE PEDRO,JOSE PEDRO LEITE DA SILVA,SUPLENTE,PR,SOMOS MAIS SÃO PAULO,15
CASTILHO,DEPUTADO ESTADUAL,PATRICIA LIMA,PATRICIA FREITAS LIMA,SUPLENTE,PR,SOMOS MAIS SÃO PAULO,4
CASTILHO,DEPUTADO ESTADUAL,ROY NELSON,ROY NELSON PINTO,SUPLENTE,PR,SOMOS MAIS SÃO PAULO,1
CASTILHO,DEPUTADO ESTADUAL,ANDRE DO PRADO,ANDRE LUIS DO PRADO,ELEITO,PR,SOMOS MAIS SÃO PAULO,11
CASTILHO,DEPUTADO ESTADUAL,EDUARDO REZEK,EDUARDO PEDROSO REZEK,SUPLENTE,PPS,PARTIDO POPULAR SOCIALISTA,5
CASTILHO,DEPUTADO ESTADUAL,ADEMIR DA GUIA,ADEMIR DA GUIA,SUPLENTE,PPS,PARTIDO POPULAR SOCIALISTA,4
CASTILHO,DEPUTADO ESTADUAL,DAVI ZAIA,DAVID ZAIA,MÉDIA,PPS,PARTIDO POPULAR SOCIALISTA,289
CASTILHO,DEPUTADO ESTADUAL,DR. MILTON FERREIRA,MILTON FERREIRA DA SILVA,SUPLENTE,PPS,PARTIDO POPULAR SOCIALISTA,11
CASTILHO,DEPUTADO ESTADUAL,PROF. NELSON SUSSUMU SHIKICIMA,NELSON SUSSUMU SHIKICIMA,SUPLENTE,PPS,PARTIDO POPULAR SOCIALISTA,1
CASTILHO,DEPUTADO ESTADUAL,JOAO OTAVIO BASTOS,JOAO OTAVIO BASTOS JUNQUEIRA,SUPLENTE,PPS,PARTIDO POPULAR SOCIALISTA,2
CASTILHO,DEPUTADO ESTADUAL,VITOR SAPIENZA,VITOR SAPIENZA,SUPLENTE,PPS,PARTIDO POPULAR SOCIALISTA,2
CASTILHO,DEPUTADO ESTADUAL,ALEX MANENTE,ALEX SPINELLI MANENTE,ELEITO,PPS,PARTIDO POPULAR SOCIALISTA,1
CASTILHO,DEPUTADO ESTADUAL,CICERO FELIX,CICERO FELIX DE SOUZA,SUPLENTE,PPS,PARTIDO POPULAR SOCIALISTA,1
CASTILHO,DEPUTADO ESTADUAL,ESTEVÃO,STEVEN ERIKSEN BINNIE,SUPLENTE,PPS,PARTIDO POPULAR SOCIALISTA,88
CASTILHO,DEPUTADO ESTADUAL,PROFESSOR ZE MARIA,JOSE MARIA CANCELLIERO,SUPLENTE,PPS,PARTIDO POPULAR SOCIALISTA,4
CASTILHO,DEPUTADO ESTADUAL,ROBERTO MORAIS,ROBERTO TURCHI DE MORAIS,ELEITO,PPS,PARTIDO POPULAR SOCIALISTA,1
CASTILHO,DEPUTADO ESTADUAL,ELZO SIGUETA,ELZO SIGUETA,SUPLENTE,PPS,PARTIDO POPULAR SOCIALISTA,16
CASTILHO,DEPUTADO ESTADUAL,DARIO SAADI,DARIO JORGE GIOLO SAADI,SUPLENTE,DEM,PSDB/DEM,2
CASTILHO,DEPUTADO ESTADUAL,ANDRE SOARES,ANDRE BEZERRA RIBEIRO SOARES,ELEITO,DEM,PSDB/DEM,79
CASTILHO,DEPUTADO ESTADUAL,WAGNER NUNES,WAGNER NUNES DA SILVA,SUPLENTE,DEM,PSDB/DEM,1
CASTILHO,DEPUTADO ESTADUAL,EDMIR CHEDID,EDMIR JOSE ABI CHEDID,ELEITO,DEM,PSDB/DEM,5
CASTILHO,DEPUTADO ESTADUAL,ALDO DEMARCHI,JOSE ALDO DEMARCHI,ELEITO,DEM,PSDB/DEM,307
CASTILHO,DEPUTADO ESTADUAL,JOAO MELLAO NETO,JOAO MELLAO NETO,SUPLENTE,DEM,PSDB/DEM,2
CASTILHO,DEPUTADO ESTADUAL,FERNANDO LUCAS,LUIZ FERNANDO AMARAL LUCAS,SUPLENTE,DEM,PSDB/DEM,1
CASTILHO,DEPUTADO ESTADUAL,ESTEVAM GALVAO,ESTEVAM GALVAO DE OLIVEIRA,ELEITO,DEM,PSDB/DEM,23
CASTILHO,DEPUTADO ESTADUAL,MILTON LEITE FILHO,MILTON LEITE DA SILVA FILHO,ELEITO,DEM,PSDB/DEM,16
CASTILHO,DEPUTADO ESTADUAL,GIL ARANTES,GILBERTO MACEDO GIL ARANTES,ELEITO,DEM,PSDB/DEM,52
CASTILHO,DEPUTADO ESTADUAL,JERONIMO MORENO,JERONIMO DE LA CRUZ MORENO,SUPLENTE,DEM,PSDB/DEM,1
CASTILHO,DEPUTADO ESTADUAL,LEANDRO DO KLB,LEANDRO FINATO SCORNAVACCA,SUPLENTE,DEM,PSDB/DEM,13
CASTILHO,DEPUTADO ESTADUAL,ED THOMAS,EDSON TOMAZINI,ELEITO,PSB,PARTIDO SOCIALISTA BRASILEIRO,3
CASTILHO,DEPUTADO ESTADUAL,IRMÃO OZELITO,OZELITO JOSE BENEDITO,SUPLENTE,PSB,PARTIDO SOCIALISTA BRASILEIRO,1
CASTILHO,DEPUTADO ESTADUAL,DR. ANTONIO COSTA,ANTONIO JOSÉ DA COSTA JÚNIOR,SUPLENTE,PSB,PARTIDO SOCIALISTA BRASILEIRO,35
CASTILHO,DEPUTADO ESTADUAL,SARGENTO OHNO,NELSON MASSOMI OHNO,SUPLENTE,PSB,PARTIDO SOCIALISTA BRASILEIRO,2
CASTILHO,DEPUTADO ESTADUAL,HILKIAS,HILKIAS DE OLIVEIRA,SUPLENTE,PSB,PARTIDO SOCIALISTA BRASILEIRO,4
CASTILHO,DEPUTADO ESTADUAL,DR. JOSÉ RICARDO,JOSÉ RICARDO DIAS,SUPLENTE,PSB,PARTIDO SOCIALISTA BRASILEIRO,58
CASTILHO,DEPUTADO ESTADUAL,YVONE BARREIROS,YVONE BARREIROS MOREIRA,SUPLENTE,PSB,PARTIDO SOCIALISTA BRASILEIRO,1
CASTILHO,DEPUTADO ESTADUAL,ELTON ISAAC,ELTON ISAAC DOS SANTOS,SUPLENTE,PSB,PARTIDO SOCIALISTA BRASILEIRO,1
CASTILHO,DEPUTADO ESTADUAL,DR. PAULO MARIANI,PAULO CEZAR MARIANI,SUPLENTE,PSB,PARTIDO SOCIALISTA BRASILEIRO,5
CASTILHO,DEPUTADO ESTADUAL,ADRIANA RODRIGUES,ADRIANA LARIO RAMALHO RODRIGUES,SUPLENTE,PV,PARTIDO VERDE,2
CASTILHO,DEPUTADO ESTADUAL,FELICIANO,FELICIANO NAHIMY FILHO,ELEITO,PV,PARTIDO VERDE,6
CASTILHO,DEPUTADO ESTADUAL,CHICO SARDELLI,FRANCISCO ANTONIO SARDELLI,ELEITO,PV,PARTIDO VERDE,1
CASTILHO,DEPUTADO ESTADUAL,RICARDO CASTILHO,RICARDO RODRIGUES DE CASTILHO,SUPLENTE,PV,PARTIDO VERDE,30
CASTILHO,DEPUTADO ESTADUAL,CAMILO GAVA,JOSÉ CAMILO GAVA NETO,SUPLENTE,PV,PARTIDO VERDE,2
CASTILHO,DEPUTADO ESTADUAL,DR PAULO DE TARSO,PAULO DE TARSO NUNES CHIODE,SUPLENTE,PV,PARTIDO VERDE,1
CASTILHO,DEPUTADO ESTADUAL,RITA PASSOS,RITA DE CASSIA TRINCA PASSOS,ELEITO,PV,PARTIDO VERDE,2
CASTILHO,DEPUTADO ESTADUAL,NAVAL PELA GUARDA MUNICIPAL,MAURICIO DOMINGUES DA SILVA,SUPLENTE,PV,PARTIDO VERDE,1
CASTILHO,DEPUTADO ESTADUAL,ALBA SILVA,ALBA VALERIA DA SILVA,SUPLENTE,PV,PARTIDO VERDE,1
CASTILHO,DEPUTADO ESTADUAL,DR. ULYSSES,ULYSSES MARIO TASSINARI,MÉDIA,PV,PARTIDO VERDE,1
CASTILHO,DEPUTADO ESTADUAL,REINALDO ALGUZ,REINALDO DE SOUZA ALGUZ,ELEITO,PV,PARTIDO VERDE,188
CASTILHO,DEPUTADO ESTADUAL,PROFESSOR RONALDO,JOSÉ RONALDO ALONSO MATHIAS,SUPLENTE,PV,PARTIDO VERDE,1
CASTILHO,DEPUTADO ESTADUAL,REGINA GONÇALVES,MARIA REGINA GONÇALVES,SUPLENTE,PV,PARTIDO VERDE,2
CASTILHO,DEPUTADO ESTADUAL,PASTOR DILMO DOS SANTOS,DILMO DOS SANTOS,ELEITO,PV,PARTIDO VERDE,6
CASTILHO,DEPUTADO ESTADUAL,DR MARCELO DOURADO,MARCELO DOURADO COELHO,SUPLENTE,PV,PARTIDO VERDE,19
CASTILHO,DEPUTADO ESTADUAL,RODRIGO XANDE,RODRIGO XANDE NUNES,SUPLENTE,PV,PARTIDO VERDE,1
CASTILHO,DEPUTADO ESTADUAL,CARLOS ANDRADE,CARLOS ALBERTO APARECIDO DE ANDRADE,SUPLENTE,PV,PARTIDO VERDE,1
CASTILHO,DEPUTADO ESTADUAL,HELIO RUBENS,HELIO RUBENS GONÇALVES FIGUEIREDO,SUPLENTE,PSDB,PSDB/DEM,29
CASTILHO,DEPUTADO ESTADUAL,UBIRAJARA GUIMARÃES,UBIRAJARA PEREIRA GUIMARÃES,SUPLENTE,PSDB,PSDB/DEM,14
CASTILHO,DEPUTADO ESTADUAL,WILLIAM FERRAZ,WILIAN FERRAZ,SUPLENTE,PSDB,PSDB/DEM,3
CASTILHO,DEPUTADO ESTADUAL,EVANDRO LOSACCO,EVANDRO LUIZ LOSACCO,SUPLENTE,PSDB,PSDB/DEM,1463
CASTILHO,DEPUTADO ESTADUAL,FEITOSA,JOSE FRANCISCO SOARES FEITOSA,SUPLENTE,PSDB,PSDB/DEM,1
CASTILHO,DEPUTADO ESTADUAL,PEDRO TOBIAS,PEDRO TOBIAS,ELEITO,PSDB,PSDB/DEM,2
CASTILHO,DEPUTADO ESTADUAL,MILTON FLAVIO,MILTON FLAVIO MARQUES LAUTENSCHLAGER,SUPLENTE,PSDB,PSDB/DEM,120
CASTILHO,DEPUTADO ESTADUAL,GERALDO VINHOLI,GERALDO ANTONIO VINHOLI,SUPLENTE,PSDB,PSDB/DEM,1
CASTILHO,DEPUTADO ESTADUAL,MARIA LÚCIA AMARY,MARIA LÚCIA CARDOSO PINTO AMARY,MÉDIA,PSDB,PSDB/DEM,1
CASTILHO,DEPUTADO ESTADUAL,RAMALHO DA CONSTRUCAO,ANTONIO DE SOUSA RAMALHO,SUPLENTE,PSDB,PSDB/DEM,7
CASTILHO,DEPUTADO ESTADUAL,WELSON GASPARINI,WELSON GASPARINI,SUPLENTE,PSDB,PSDB/DEM,10
CASTILHO,DEPUTADO ESTADUAL,MAURO BRAGATO,MAURO BRAGATO,ELEITO,PSDB,PSDB/DEM,668
CASTILHO,DEPUTADO ESTADUAL,JOÃO CARAMEZ,JOÃO CARLOS CARAMEZ,ELEITO,PSDB,PSDB/DEM,115
CASTILHO,DEPUTADO ESTADUAL,BRUNO COVAS,BRUNO COVAS LOPES,ELEITO,PSDB,PSDB/DEM,23
CASTILHO,DEPUTADO ESTADUAL,CLOVIS CHAVES,CLOVIS LUIZ CHAVES,SUPLENTE,PSDB,PSDB/DEM,88
CASTILHO,DEPUTADO ESTADUAL,JOSE BORANGA,JOSE AURELIO BORANGA,SUPLENTE,PSDB,PSDB/DEM,114
CASTILHO,DEPUTADO ESTADUAL,CÉLIA LEÃO,CÉLIA CAMARGO LEÃO EDELMUTH,ELEITO,PSDB,PSDB/DEM,4
CASTILHO,DEPUTADO ESTADUAL,CARLÃO PIGNATARI,CARLOS EDUARDO PIGNATARI,ELEITO,PSDB,PSDB/DEM,12
CASTILHO,DEPUTADO ESTADUAL,DILADOR BORGES,DILADOR BORGES DAMASCENO,SUPLENTE,PSDB,PSDB/DEM,40
CASTILHO,DEPUTADO ESTADUAL,CARLOS BEZERRA JR.,CARLOS ALBERTO DE QUADROS BEZERRA JUNIOR,ELEITO,PSDB,PSDB/DEM,4
CASTILHO,DEPUTADO ESTADUAL,CARLOS ALBERTO SANTOS,CARLOS ALBERTO DE OLIVEIRA SANTOS,SUPLENTE,PSDB,PSDB/DEM,3
CASTILHO,DEPUTADO ESTADUAL,ANALICE FERNANDES,ANALICE FERNANDES,ELEITO,PSDB,PSDB/DEM,1
CASTILHO,DEPUTADO ESTADUAL,FELIPE AUGUSTO,FELIPE AUGUSTO,SUPLENTE,PSDB,PSDB/DEM,3
CASTILHO,DEPUTADO ESTADUAL,THIAGO LOBO,THIAGO ANTUNES CAVALCA REIS LOBO,SUPLENTE,PSDB,PSDB/DEM,2
CASTILHO,DEPUTADO ESTADUAL,CAUÊ MACRIS,CAUÊ CASEIRO MACRIS,MÉDIA,PSDB,PSDB/DEM,2
CASTILHO,DEPUTADO ESTADUAL,DRA ALINE,ALINE SARAIVA COSTA BEZERRA,SUPLENTE,PSDB,PSDB/DEM,1
CASTILHO,DEPUTADO ESTADUAL,EDISON CANDIDO,EDISON APARECIDO CANDIDO,SUPLENTE,PSDB,PSDB/DEM,7
CASTILHO,DEPUTADO ESTADUAL,CONCCI MARCO,ELIANE CONCEIÇÃO SILVA MENDES,SUPLENTE,PSDB,PSDB/DEM,5
CASTILHO,DEPUTADO ESTADUAL,JOÃO SANZOVO,JOÃO SANZOVO NETO,SUPLENTE,PSDB,PSDB/DEM,10
CASTILHO,DEPUTADO ESTADUAL,EDLEIA MATOS,EDLEIA MATOS DA SILVA,SUPLENTE,PSDB,PSDB/DEM,1
CASTILHO,DEPUTADO ESTADUAL,BARROS MUNHOZ,JOSE ANTONIO BARROS MUNHOZ,ELEITO,PSDB,PSDB/DEM,61
CASTILHO,DEPUTADO ESTADUAL,CELSO GIGLIO,CELSO ANTONIO GIGLIO,ELEITO,PSDB,PSDB/DEM,1
CASTILHO,DEPUTADO ESTADUAL,HELIO NISHIMOTO,HELIO NISHIMOTO,ELEITO,PSDB,PSDB/DEM,4
CASTILHO,DEPUTADO ESTADUAL,PAULO ALEXANDRE BARBOSA,PAULO ALEXANDRE PEREIRA BARBOSA,ELEITO,PSDB,PSDB/DEM,13
CASTILHO,DEPUTADO ESTADUAL,FERNANDO CAPEZ,FERNANDO CAPEZ,ELEITO,PSDB,PSDB/DEM,8
CASTILHO,DEPUTADO ESTADUAL,JOSÉ LUIZ RIBEIRO,JOSÉ LUIZ RIBEIRO,SUPLENTE,PSDB,PSDB/DEM,1
CASTILHO,DEPUTADO ESTADUAL,MILTON DALLARI,JOSÉ MILTON DALLARI SOARES,SUPLENTE,PSDB,PSDB/DEM,46
CASTILHO,DEPUTADO ESTADUAL,CLÁUDIO FURQUIM,CLÁUDIO SIMÕES FURQUIM LEITE JÚNIOR,SUPLENTE,PSDB,PSDB/DEM,1
CASTILHO,DEPUTADO ESTADUAL,JOÃO ALFREDO,JOÃO ALFREDO DE OLIVEIRA,SUPLENTE,PSOL,PARTIDO SOCIALISMO E LIBERDADE,6
CASTILHO,DEPUTADO ESTADUAL,LEANDRO RECIFE,LEANDRO MARTINS COSTA,SUPLENTE,PSOL,PARTIDO SOCIALISMO E LIBERDADE,13
CASTILHO,DEPUTADO ESTADUAL,CARLOS GIANNAZI,CARLOS ALBERTO GIANNASI,ELEITO,PSOL,PARTIDO SOCIALISMO E LIBERDADE,7
CASTILHO,DEPUTADO ESTADUAL,ERLEI ALIADO,ERLEI ROBERTO DE MELO,SUPLENTE,PC DO B,PARTIDO COMUNISTA DO BRASIL,1
CASTILHO,DEPUTADO ESTADUAL,LECI BRANDÃO,LECI BRANDAO DA SILVA,ELEITO,PC DO B,PARTIDO COMUNISTA DO BRASIL,2
CASTILHO,DEPUTADO ESTADUAL,SARAH MUNHOZ,SARAH MUNHOZ,SUPLENTE,PC DO B,PARTIDO COMUNISTA DO BRASIL,6
CASTILHO,DEPUTADO ESTADUAL,DAVI RAMOS,DAVI GONÇALVES RAMOS,SUPLENTE,PC DO B,PARTIDO COMUNISTA DO BRASIL,21
CASTILHO,DEPUTADO ESTADUAL,NIRALDO SIQUEIRA,NIRALDO FERREIRA DE SIQUEIRA,SUPLENTE,PC DO B,PARTIDO COMUNISTA DO BRASIL,2
CASTILHO,DEPUTADO ESTADUAL,EZEQUIAS - VAI CHOVER,EZEQUIAS FELIPPE RODRIGUES,SUPLENTE,PC DO B,PARTIDO COMUNISTA DO BRASIL,6
CASTILHO,DEPUTADO ESTADUAL,CAJU,RICARDO ALVES DA SILVA,SUPLENTE,PC DO B,PARTIDO COMUNISTA DO BRASIL,1
CASTILHO,DEPUTADO ESTADUAL,PROFESSOR FLAVIO DELMANTO,FLAVIO DELMANTO,SUPLENTE,PC DO B,PARTIDO COMUNISTA DO BRASIL,5
CASTILHO,DEPUTADO ESTADUAL,PEDRINHO BENTIVOGLIO,PEDRO RODOLFO MINARI BENTIVOGLIO,SUPLENTE,PC DO B,PARTIDO COMUNISTA DO BRASIL,814
