RANCHARIA,DEPUTADO ESTADUAL,CORONEL JAIR PACA,JAIR PACA DE LIMA,SUPLENTE,PSDB,PSDB/DEM,1
RANCHARIA,DEPUTADO ESTADUAL,JOSE BORANGA,JOSE AURELIO BORANGA,SUPLENTE,PSDB,PSDB/DEM,8
RANCHARIA,DEPUTADO ESTADUAL,ADOLFO QUINTAS,ADOLFO QUINTAS GONÇALVES NETO,SUPLENTE,PSDB,PSDB/DEM,3
RANCHARIA,DEPUTADO ESTADUAL,VITO ARDITO,VITO ARDITO LERARIO,SUPLENTE,PSDB,PSDB/DEM,1
RANCHARIA,DEPUTADO ESTADUAL,DILADOR BORGES,DILADOR BORGES DAMASCENO,SUPLENTE,PSDB,PSDB/DEM,24
RANCHARIA,DEPUTADO ESTADUAL,GAZOTTI,JOSÉ LUIZ GAZOTTI,SUPLENTE,PSDB,PSDB/DEM,2
RANCHARIA,DEPUTADO ESTADUAL,ADMIR FERRO,ADMIR DONIZETI FERRO,SUPLENTE,PSDB,PSDB/DEM,2
RANCHARIA,DEPUTADO ESTADUAL,CASSIO NAVARRO,CASSIO DE CASTRO NAVARRO,SUPLENTE,PSDB,PSDB/DEM,2
RANCHARIA,DEPUTADO ESTADUAL,CARLOS BEZERRA JR.,CARLOS ALBERTO DE QUADROS BEZERRA JUNIOR,ELEITO,PSDB,PSDB/DEM,3
RANCHARIA,DEPUTADO ESTADUAL,ANALICE FERNANDES,ANALICE FERNANDES,ELEITO,PSDB,PSDB/DEM,1
RANCHARIA,DEPUTADO ESTADUAL,DRA MARY,MARY LUCIA FRANCISCO,SUPLENTE,PSDB,PSDB/DEM,1
RANCHARIA,DEPUTADO ESTADUAL,CAUÊ MACRIS,CAUÊ CASEIRO MACRIS,MÉDIA,PSDB,PSDB/DEM,9
RANCHARIA,DEPUTADO ESTADUAL,EDISON CANDIDO,EDISON APARECIDO CANDIDO,SUPLENTE,PSDB,PSDB/DEM,2
RANCHARIA,DEPUTADO ESTADUAL,CONCCI MARCO,ELIANE CONCEIÇÃO SILVA MENDES,SUPLENTE,PSDB,PSDB/DEM,1
RANCHARIA,DEPUTADO ESTADUAL,VICTOR KOBAYASHI,VICTOR KOBAYASHI,SUPLENTE,PSDB,PSDB/DEM,25
RANCHARIA,DEPUTADO ESTADUAL,BARROS MUNHOZ,JOSE ANTONIO BARROS MUNHOZ,ELEITO,PSDB,PSDB/DEM,17
RANCHARIA,DEPUTADO ESTADUAL,CELSO GIGLIO,CELSO ANTONIO GIGLIO,ELEITO,PSDB,PSDB/DEM,3
RANCHARIA,DEPUTADO ESTADUAL,HELIO NISHIMOTO,HELIO NISHIMOTO,ELEITO,PSDB,PSDB/DEM,2
RANCHARIA,DEPUTADO ESTADUAL,PAULO ALEXANDRE BARBOSA,PAULO ALEXANDRE PEREIRA BARBOSA,ELEITO,PSDB,PSDB/DEM,29
RANCHARIA,DEPUTADO ESTADUAL,GILSON BARRETO,GILSON ALMEIDA BARRETO,SUPLENTE,PSDB,PSDB/DEM,38
RANCHARIA,DEPUTADO ESTADUAL,JOSE AUGUSTO,JOSE AUGUSTO DA SILVA RAMOS,SUPLENTE,PSDB,PSDB/DEM,2
RANCHARIA,DEPUTADO ESTADUAL,ORLANDO MORANDO,ORLANDO MORANDO JUNIOR,ELEITO,PSDB,PSDB/DEM,3
RANCHARIA,DEPUTADO ESTADUAL,FERNANDO CAPEZ,FERNANDO CAPEZ,ELEITO,PSDB,PSDB/DEM,37
RANCHARIA,DEPUTADO ESTADUAL,MILTON DALLARI,JOSÉ MILTON DALLARI SOARES,SUPLENTE,PSDB,PSDB/DEM,17
RANCHARIA,DEPUTADO ESTADUAL,PROFª ROSANA,MARIA ROSANA FERRARI NASSAR,SUPLENTE,PSDB,PSDB/DEM,1
RANCHARIA,DEPUTADO ESTADUAL,PROFESSOR ALTAIR,ALTAIR LOURENÇO DE LIMA,SUPLENTE,PSOL,PARTIDO SOCIALISMO E LIBERDADE,1
RANCHARIA,DEPUTADO ESTADUAL,JOÃO ALFREDO,JOÃO ALFREDO DE OLIVEIRA,SUPLENTE,PSOL,PARTIDO SOCIALISMO E LIBERDADE,4
RANCHARIA,DEPUTADO ESTADUAL,DR. MARCELO ROZATTI,MARCELO ROZATTI,SUPLENTE,PSOL,PARTIDO SOCIALISMO E LIBERDADE,11
RANCHARIA,DEPUTADO ESTADUAL,RAUL MARCELO,RAUL MARCELO DE SOUZA,SUPLENTE,PSOL,PARTIDO SOCIALISMO E LIBERDADE,3
RANCHARIA,DEPUTADO ESTADUAL,HORÁCIO NETO,HORACIO RAINERI NETO,SUPLENTE,PSOL,PARTIDO SOCIALISMO E LIBERDADE,1
RANCHARIA,DEPUTADO ESTADUAL,EDUARDO AMARAL,EDUARDO GARCIA CARVALHO DO AMARAL,SUPLENTE,PSOL,PARTIDO SOCIALISMO E LIBERDADE,5
RANCHARIA,DEPUTADO ESTADUAL,CARLOS GIANNAZI,CARLOS ALBERTO GIANNASI,ELEITO,PSOL,PARTIDO SOCIALISMO E LIBERDADE,37
RANCHARIA,DEPUTADO ESTADUAL,WANDER,WANDER DE OLIVEIRA VILLALBA,SUPLENTE,PC DO B,PARTIDO COMUNISTA DO BRASIL,4
RANCHARIA,DEPUTADO ESTADUAL,ERLEI ALIADO,ERLEI ROBERTO DE MELO,SUPLENTE,PC DO B,PARTIDO COMUNISTA DO BRASIL,2
RANCHARIA,DEPUTADO ESTADUAL,LECI BRANDÃO,LECI BRANDAO DA SILVA,ELEITO,PC DO B,PARTIDO COMUNISTA DO BRASIL,10
RANCHARIA,DEPUTADO ESTADUAL,SIDNEY,SIDNEY LIBERTI,SUPLENTE,PC DO B,PARTIDO COMUNISTA DO BRASIL,1
RANCHARIA,DEPUTADO ESTADUAL,SARAH MUNHOZ,SARAH MUNHOZ,SUPLENTE,PC DO B,PARTIDO COMUNISTA DO BRASIL,5
RANCHARIA,DEPUTADO ESTADUAL,MAURIN DA SORVETERIA,MAURIN ALVES RIBEIRO,SUPLENTE,PC DO B,PARTIDO COMUNISTA DO BRASIL,1
RANCHARIA,DEPUTADO ESTADUAL,FRANCISCO DE SALES,FRANCISCO DE SALES VIEIRA DE CARVALHO,SUPLENTE,PC DO B,PARTIDO COMUNISTA DO BRASIL,2
RANCHARIA,DEPUTADO ESTADUAL,ALCIDES AMAZONAS,ALCIDES ARAUJO DOS SANTOS,SUPLENTE,PC DO B,PARTIDO COMUNISTA DO BRASIL,2
RANCHARIA,DEPUTADO ESTADUAL,PEDRO BIGARDI,PEDRO ANTONIO BIGARDI,ELEITO,PC DO B,PARTIDO COMUNISTA DO BRASIL,1
RANCHARIA,DEPUTADO ESTADUAL,JEAN LOPES,JEAN CARLOS SOARES LOPES,SUPLENTE,PC DO B,PARTIDO COMUNISTA DO BRASIL,1
RANCHARIA,DEPUTADO ESTADUAL,DAVI RAMOS,DAVI GONÇALVES RAMOS,SUPLENTE,PC DO B,PARTIDO COMUNISTA DO BRASIL,1
RANCHARIA,DEPUTADO ESTADUAL,QUEIROZ,VALDOMIRO BENTO DE QUEIROZ,SUPLENTE,PC DO B,PARTIDO COMUNISTA DO BRASIL,5
RANCHARIA,DEPUTADO ESTADUAL,CAJU,RICARDO ALVES DA SILVA,SUPLENTE,PC DO B,PARTIDO COMUNISTA DO BRASIL,1
RANCHARIA,DEPUTADO ESTADUAL,PROFESSOR FLAVIO DELMANTO,FLAVIO DELMANTO,SUPLENTE,PC DO B,PARTIDO COMUNISTA DO BRASIL,1
RANCHARIA,DEPUTADO ESTADUAL,DITÃO DO CORREIO,BENEDITO GOMES DOS REIS,SUPLENTE,PC DO B,PARTIDO COMUNISTA DO BRASIL,2
RANCHARIA,DEPUTADO ESTADUAL,HELIFAX,HELIFAX PINTO DE SOUZA,SUPLENTE,PC DO B,PARTIDO COMUNISTA DO BRASIL,4
