BEBEDOURO,PRESIDENTE,DILMA,DILMA VANA ROUSSEFF,2º TURNO,PT,PARA O BRASIL SEGUIR MUDANDO,11659
BEBEDOURO,PRESIDENTE,JOSÉ SERRA,JOSÉ SERRA,2º TURNO,PSDB,O BRASIL PODE MAIS,22250
BEBEDOURO,GOVERNADOR,GERALDO ALCKMIN,GERALDO JOSE RODRIGUES ALCKMIN FILHO,ELEITO,PSDB,UNIDOS POR SÃO PAULO,22030
BEBEDOURO,SENADOR,MARTA SUPLICY,MARTA SUPLICY,ELEITO,PT,UNIÃO PARA MUDAR,10940
BEBEDOURO,SENADOR,ALOYSIO NUNES,ALOYSIO NUNES FERREIRA FILHO,ELEITO,PSDB,UNIDOS POR SÃO PAULO,24751
BEBEDOURO,DEPUTADO FEDERAL,ANTONIO BULHÕES,ANTONIO CARLOS MARTINS DE BULHÕES,ELEITO,PRB,JUNTOS POR SÃO PAULO,237
BEBEDOURO,DEPUTADO FEDERAL,OTONIEL LIMA,OTONIEL CARLOS DE LIMA,MÉDIA,PRB,JUNTOS POR SÃO PAULO,2
BEBEDOURO,DEPUTADO FEDERAL,ROSANA STAR,PAULO CEZAR JOSE DE SOUZA LIMA,SUPLENTE,PRB,JUNTOS POR SÃO PAULO,1
BEBEDOURO,DEPUTADO FEDERAL,LUIZ SOARES,LUIZ SOARES TEIXEIRA,SUPLENTE,PRB,JUNTOS POR SÃO PAULO,2
BEBEDOURO,DEPUTADO FEDERAL,DURVAL MORELLI,DURVAL MORELLI NETO,SUPLENTE,PP,PARTIDO PROGRESSISTA,1
BEBEDOURO,DEPUTADO FEDERAL,JEFERSON CAMILLO,JEFERSON CAMILLO DE OLIVEIRA,SUPLENTE,PP,PARTIDO PROGRESSISTA,1
BEBEDOURO,DEPUTADO FEDERAL,MISSIONÁRIA CICERA BEZERRA,CICERA MARIA BEZERRA DA SILVA,SUPLENTE,PP,PARTIDO PROGRESSISTA,1
BEBEDOURO,DEPUTADO FEDERAL,MALUF,PAULO SALIM MALUF,ELEITO,PP,PARTIDO PROGRESSISTA,407
BEBEDOURO,DEPUTADO FEDERAL,RUBENEUTON OLIVEIRA LIMA,RUBENEUTON OLIVEIRA LIMA,SUPLENTE,PP,PARTIDO PROGRESSISTA,7
BEBEDOURO,DEPUTADO FEDERAL,ANGINHO DOS TECLADOS,ANGELO MARINHO DE ALMEIDA,SUPLENTE,PP,PARTIDO PROGRESSISTA,1
BEBEDOURO,DEPUTADO FEDERAL,CARLOS OCTAVIANI,JOSÉ CARLOS OCTAVIANI,SUPLENTE,PP,PARTIDO PROGRESSISTA,2
BEBEDOURO,DEPUTADO FEDERAL,SANAZAR,EDUARDO SANASSAR FONSECA,SUPLENTE,PP,PARTIDO PROGRESSISTA,5
BEBEDOURO,DEPUTADO FEDERAL,CAPITÃO GOMES,CARLOS GOMES DA SILVA,SUPLENTE,PP,PARTIDO PROGRESSISTA,6
BEBEDOURO,DEPUTADO FEDERAL,LALO,JOSÉ CARLOS TALDIVO,SUPLENTE,PP,PARTIDO PROGRESSISTA,2
BEBEDOURO,DEPUTADO FEDERAL,RENATO REICHANN,RUY RENATO REICHMANN,SUPLENTE,PP,PARTIDO PROGRESSISTA,7
BEBEDOURO,DEPUTADO FEDERAL,BATORÉ,IVANILDO GOMES NOGUEIRA,SUPLENTE,PP,PARTIDO PROGRESSISTA,1
BEBEDOURO,DEPUTADO FEDERAL,ADELINA ALCANTARA MACHADO,ADELINA PEREIRA DA SILVEIRA DE ALCANTARA MACHADO,SUPLENTE,PP,PARTIDO PROGRESSISTA,4
BEBEDOURO,DEPUTADO FEDERAL,LIBERATO DE VALENTIM GENTIL,LIBERATO ROCHA CALDEIRA,SUPLENTE,PP,PARTIDO PROGRESSISTA,6
BEBEDOURO,DEPUTADO FEDERAL,JOÃO FADEL,JOÃO JORGE FADEL FILHO,SUPLENTE,PP,PARTIDO PROGRESSISTA,1
BEBEDOURO,DEPUTADO FEDERAL,MAURICIO MARTINS,MAURICIO LUIS MARTINS,SUPLENTE,PP,PARTIDO PROGRESSISTA,34
BEBEDOURO,DEPUTADO FEDERAL,PEDRINHO BARACAT,ASSAD NACLE BARACAT,SUPLENTE,PP,PARTIDO PROGRESSISTA,1
BEBEDOURO,DEPUTADO FEDERAL,ALINE CORREA,ALINE LEMOS CORREA DE OLIVEIRA ANDRADE,ELEITO,PP,PARTIDO PROGRESSISTA,69
BEBEDOURO,DEPUTADO FEDERAL,ELIAS BITENCOURT,ELIAS DOS SANTOS BITENCOURT,SUPLENTE,PP,PARTIDO PROGRESSISTA,14
BEBEDOURO,DEPUTADO FEDERAL,PAULO BASSOLI,PAULO SERGIO BONGATER BASSOLI,SUPLENTE,PP,PARTIDO PROGRESSISTA,1
BEBEDOURO,DEPUTADO FEDERAL,TELLES,DOMINGOS TELLES SANCHES,SUPLENTE,PP,PARTIDO PROGRESSISTA,2
BEBEDOURO,DEPUTADO FEDERAL,DRA ADRIANA DA COSTA,ADRIANA ALVARES DA COSTA DE PAULA ALVES,SUPLENTE,PP,PARTIDO PROGRESSISTA,2
BEBEDOURO,DEPUTADO FEDERAL,BETO MANSUR,PAULO ROBERTO GOMES MANSUR,ELEITO,PP,PARTIDO PROGRESSISTA,8
BEBEDOURO,DEPUTADO FEDERAL,ADHEMAR DE BARROS FILHO,ADHEMAR DE BARROS FILHO,SUPLENTE,PP,PARTIDO PROGRESSISTA,13
BEBEDOURO,DEPUTADO FEDERAL,LAYRTON INFANTE,LAYRTON INFANTE,SUPLENTE,PP,PARTIDO PROGRESSISTA,17
BEBEDOURO,DEPUTADO FEDERAL,CABO WILSON,WILSON DE OLIVEIRA MORAIS,SUPLENTE,PP,PARTIDO PROGRESSISTA,33
BEBEDOURO,DEPUTADO FEDERAL,MISSIONÁRIO JOSÉ OLIMPIO,JOSÉ OLIMPIO SILVEIRA MORAES,ELEITO,PP,PARTIDO PROGRESSISTA,129
BEBEDOURO,DEPUTADO FEDERAL,FERNANDO STANCATTI,FERNANDO CESAR STANCATTI MARQUES,SUPLENTE,PP,PARTIDO PROGRESSISTA,9
BEBEDOURO,DEPUTADO FEDERAL,MAURICIO HAKA,MAURICIO APARECIDO HAKA,SUPLENTE,PP,PARTIDO PROGRESSISTA,1
BEBEDOURO,DEPUTADO FEDERAL,ERIVAN,FRANCISCO ERIVAN PEREIRA,SUPLENTE,PP,PARTIDO PROGRESSISTA,4
BEBEDOURO,DEPUTADO FEDERAL,TUCÃO,JULIO CESAR THEODORO,SUPLENTE,PP,PARTIDO PROGRESSISTA,5
BEBEDOURO,DEPUTADO FEDERAL,DR NECHAR,SERGIO ANTONIO NECHAR,SUPLENTE,PP,PARTIDO PROGRESSISTA,14
BEBEDOURO,DEPUTADO FEDERAL,DELEGADA GRACIELA,GRACIELA DE LOURDES DAVID AMBROSIO,SUPLENTE,PP,PARTIDO PROGRESSISTA,1
BEBEDOURO,DEPUTADO FEDERAL,JORGE WILSON,JORGE WILSON GONÇALVES DE MATTOS,SUPLENTE,PP,PARTIDO PROGRESSISTA,2
BEBEDOURO,DEPUTADO FEDERAL,CAPITÃO CRIVELARI,LUIZ ANTONIO CRIVELARI,SUPLENTE,PP,PARTIDO PROGRESSISTA,2
BEBEDOURO,DEPUTADO FEDERAL,FARIA LIMA,JOSE ROBERTO FARIA LIMA,SUPLENTE,PP,PARTIDO PROGRESSISTA,1
BEBEDOURO,DEPUTADO FEDERAL,VADÃO,ETIVALDO VADAO GOMES,SUPLENTE,PP,PARTIDO PROGRESSISTA,302
BEBEDOURO,DEPUTADO FEDERAL,PH,PAULO HENRIQUE RIBEIRO SANTANA,SUPLENTE,PDT,PARTIDO DEMOCRÁTICO TRABALHISTA,1
BEBEDOURO,DEPUTADO FEDERAL,JOÃO DADO,JOÃO EDUARDO DADO LEITE DE CARVALHO,ELEITO,PDT,PARTIDO DEMOCRÁTICO TRABALHISTA,140
BEBEDOURO,DEPUTADO FEDERAL,PAULINHO DA FORÇA,PAULO PEREIRA DA SILVA,ELEITO,PDT,PARTIDO DEMOCRÁTICO TRABALHISTA,4335
BEBEDOURO,DEPUTADO FEDERAL,ELISEU DANIEL,ELISEU DANIEL DOS SANTOS,SUPLENTE,PDT,PARTIDO DEMOCRÁTICO TRABALHISTA,14
BEBEDOURO,DEPUTADO FEDERAL,GUSTAVO STUPP,LUIZ GUSTAVO ANTUNES STUPP,SUPLENTE,PDT,PARTIDO DEMOCRÁTICO TRABALHISTA,1
BEBEDOURO,DEPUTADO FEDERAL,ARMANDO HENRIQUE,ARMANDO HENRIQUE,SUPLENTE,PDT,PARTIDO DEMOCRÁTICO TRABALHISTA,6
BEBEDOURO,DEPUTADO FEDERAL,MARTAN,MARCELO MARTIN,SUPLENTE,PDT,PARTIDO DEMOCRÁTICO TRABALHISTA,2
BEBEDOURO,DEPUTADO FEDERAL,KAREN HEINS,KAREN MAYELLEN TONIM HEINS,SUPLENTE,PDT,PARTIDO DEMOCRÁTICO TRABALHISTA,50
BEBEDOURO,DEPUTADO FEDERAL,PEDRO BAPTISTINI,PEDRO ANTONIO BAPTISTINI,SUPLENTE,PDT,PARTIDO DEMOCRÁTICO TRABALHISTA,6
BEBEDOURO,DEPUTADO FEDERAL,SAULO GOES,SAULO GOES DE ALBUQUERQUE,SUPLENTE,PDT,PARTIDO DEMOCRÁTICO TRABALHISTA,1
BEBEDOURO,DEPUTADO FEDERAL,MEDEIROS,LUIZ ANTONIO DE MEDEIROS NETO,SUPLENTE,PDT,PARTIDO DEMOCRÁTICO TRABALHISTA,1
BEBEDOURO,DEPUTADO FEDERAL,GILBERTO BENZI,GILBERTO BENZI,SUPLENTE,PDT,PARTIDO DEMOCRÁTICO TRABALHISTA,2
BEBEDOURO,DEPUTADO FEDERAL,EDUARDO NASCIMENTO,EDUARDO DUARTE DO NASCIMENTO,SUPLENTE,PDT,PARTIDO DEMOCRÁTICO TRABALHISTA,3
BEBEDOURO,DEPUTADO FEDERAL,DR LUIZ CHIAPARINE,LUIZ CARLOS CHIAPARINE,SUPLENTE,PDT,PARTIDO DEMOCRÁTICO TRABALHISTA,24
BEBEDOURO,DEPUTADO FEDERAL,NELSINHO DA BAHIA,NELSON FRANCISCO DOS SANTOS,SUPLENTE,PDT,PARTIDO DEMOCRÁTICO TRABALHISTA,6
BEBEDOURO,DEPUTADO FEDERAL,MANOEL ANTUNES,MANOEL ANTUNES,SUPLENTE,PDT,PARTIDO DEMOCRÁTICO TRABALHISTA,33
BEBEDOURO,DEPUTADO FEDERAL,CARLOS HENRIQUE,CARLOS HENRIQUE PINTO,SUPLENTE,PDT,PARTIDO DEMOCRÁTICO TRABALHISTA,56
BEBEDOURO,DEPUTADO FEDERAL,MAURICIO SOARES JUNIOR,MAURICIO SOARES DE ALMEIDA JUNIOR,SUPLENTE,PDT,PARTIDO DEMOCRÁTICO TRABALHISTA,3
BEBEDOURO,DEPUTADO FEDERAL,DRA DEBORA,DEBORA MARIA MARAGNI PEREIRA DE ABREU,SUPLENTE,PDT,PARTIDO DEMOCRÁTICO TRABALHISTA,184
BEBEDOURO,DEPUTADO FEDERAL,SALVADOR ZIMBALDI,SALVADOR ZIMBALDI FILHO,MÉDIA,PDT,PARTIDO DEMOCRÁTICO TRABALHISTA,85
BEBEDOURO,DEPUTADO FEDERAL,LINDOLFO DOS SANTOS,LINDOLFO LUIZ DOS SANTOS NETO,SUPLENTE,PDT,PARTIDO DEMOCRÁTICO TRABALHISTA,134
BEBEDOURO,DEPUTADO FEDERAL,FERNANDO CHIARELLI,FERNANDO CHIARELLI,SUPLENTE,PDT,PARTIDO DEMOCRÁTICO TRABALHISTA,46
BEBEDOURO,DEPUTADO FEDERAL,GILBERTO LOPES,GILBERTO FERREIRA LOPES,SUPLENTE,PDT,PARTIDO DEMOCRÁTICO TRABALHISTA,1
BEBEDOURO,DEPUTADO FEDERAL,ITAMAR ALVES,ITAMAR ALVES DE OLIVEIRA,SUPLENTE,PDT,PARTIDO DEMOCRÁTICO TRABALHISTA,1
BEBEDOURO,DEPUTADO FEDERAL,WILSON COELHO,WILSON DE SOUZA COELHO,SUPLENTE,PDT,PARTIDO DEMOCRÁTICO TRABALHISTA,2
BEBEDOURO,DEPUTADO FEDERAL,MAGAIVER,EDILSON MAGAIVER FERREIRA DA SILVA,SUPLENTE,PDT,PARTIDO DEMOCRÁTICO TRABALHISTA,1
BEBEDOURO,DEPUTADO FEDERAL,VALDEVAN NOVENTA,JOSE VALDEVAM DE JESUS SANTOS,SUPLENTE,PDT,PARTIDO DEMOCRÁTICO TRABALHISTA,1
BEBEDOURO,DEPUTADO FEDERAL,FADUL,OSWALDO DOS SANTOS,SUPLENTE,PDT,PARTIDO DEMOCRÁTICO TRABALHISTA,1
BEBEDOURO,DEPUTADO FEDERAL,IVANIO BATISTA,IVANIO BATISTA DA SILVA,SUPLENTE,PT,JUNTOS POR SÃO PAULO,4
BEBEDOURO,DEPUTADO FEDERAL,VICENTE CANDIDO,VICENTE CANDIDO DA SILVA,ELEITO,PT,JUNTOS POR SÃO PAULO,65
BEBEDOURO,DEPUTADO FEDERAL,PROFESSOR JAIR BALESTRA,JAIR DONIZETI BALESTRA,SUPLENTE,PT,JUNTOS POR SÃO PAULO,5
BEBEDOURO,DEPUTADO FEDERAL,MARQUINHOS OLÍVIO,MARCOS OLIVIO CONCEIÇÃO,SUPLENTE,PT,JUNTOS POR SÃO PAULO,1
BEBEDOURO,DEPUTADO FEDERAL,IARA BERNARDI,IARA BERNARDI,SUPLENTE,PT,JUNTOS POR SÃO PAULO,8
BEBEDOURO,DEPUTADO FEDERAL,LARGUESA,LUIS VANDERLEI LARGUESA,SUPLENTE,PT,JUNTOS POR SÃO PAULO,16
BEBEDOURO,DEPUTADO FEDERAL,VACCAREZZA,CANDIDO ELPIDIO DE SOUZA VACCAREZZA,ELEITO,PT,JUNTOS POR SÃO PAULO,148
BEBEDOURO,DEPUTADO FEDERAL,GENOINO,JOSÉ GENOÍNO NETO,SUPLENTE,PT,JUNTOS POR SÃO PAULO,80
BEBEDOURO,DEPUTADO FEDERAL,OSMAR LOPES,OSMAR LOPES,SUPLENTE,PT,JUNTOS POR SÃO PAULO,2
BEBEDOURO,DEPUTADO FEDERAL,HELCIO SILVA,HELCIO ANTONIO DA SILVA,SUPLENTE,PT,JUNTOS POR SÃO PAULO,1
BEBEDOURO,DEPUTADO FEDERAL,CARLINHOS ALMEIDA,CARLOS JOSE DE ALMEIDA,ELEITO,PT,JUNTOS POR SÃO PAULO,1
BEBEDOURO,DEPUTADO FEDERAL,MISA BOITO,MARIA EMILIA SEDEH BOITO,SUPLENTE,PT,JUNTOS POR SÃO PAULO,2
BEBEDOURO,DEPUTADO FEDERAL,NEWTON LIMA NETO,NEWTON LIMA NETO,ELEITO,PT,JUNTOS POR SÃO PAULO,232
BEBEDOURO,DEPUTADO FEDERAL,TEREZINHA RONDELLI,MARIA TEREZINHA RONDELLI,SUPLENTE,PT,JUNTOS POR SÃO PAULO,1
BEBEDOURO,DEPUTADO FEDERAL,FILIPPI,JOSÉ DE FILIPPI JÚNIOR,ELEITO,PT,JUNTOS POR SÃO PAULO,5
BEBEDOURO,DEPUTADO FEDERAL,ARLINDO CHINAGLIA,ARLINDO CHIGNALIA JUNIOR,ELEITO,PT,JUNTOS POR SÃO PAULO,279
BEBEDOURO,DEPUTADO FEDERAL,JOÃO PAULO CUNHA,JOÃO PAULO CUNHA,ELEITO,PT,JUNTOS POR SÃO PAULO,7
BEBEDOURO,DEPUTADO FEDERAL,ROQUE FERREIRA,ROQUE JOSÉ FERREIRA,SUPLENTE,PT,JUNTOS POR SÃO PAULO,12
BEBEDOURO,DEPUTADO FEDERAL,PIVATTO,JOSÉ PIVATTO,SUPLENTE,PT,JUNTOS POR SÃO PAULO,3
BEBEDOURO,DEPUTADO FEDERAL,RICARDO BERZOINI,RICARDO JOSE RIBEIRO BERZOINI,ELEITO,PT,JUNTOS POR SÃO PAULO,237
BEBEDOURO,DEPUTADO FEDERAL,JOSÉ MENTOR,JOSÉ MENTOR GUILHERME DE MELLO NETTO,ELEITO,PT,JUNTOS POR SÃO PAULO,364
BEBEDOURO,DEPUTADO FEDERAL,PROF. CARLÃO RAMIRO,CARLOS RAMIRO CASTRO,SUPLENTE,PT,JUNTOS POR SÃO PAULO,40
BEBEDOURO,DEPUTADO FEDERAL,FÉLIX SAHÃO,FÉLIX SAHÃO JÚNIOR,SUPLENTE,PT,JUNTOS POR SÃO PAULO,187
BEBEDOURO,DEPUTADO FEDERAL,ROGÉRIO PINTO,ROGÉRIO PINTO FERNANDES,SUPLENTE,PT,JUNTOS POR SÃO PAULO,1
BEBEDOURO,DEPUTADO FEDERAL,TENENTE PAZ,FRANCISCO JESUS DA PAZ,SUPLENTE,PT,JUNTOS POR SÃO PAULO,6
BEBEDOURO,DEPUTADO FEDERAL,VANDERLEI SIRAQUE,VANDERLEI SIRAQUE,SUPLENTE,PT,JUNTOS POR SÃO PAULO,8
BEBEDOURO,DEPUTADO FEDERAL,PAULO AFONSO,PAULO AFONSO RIBEIRO,SUPLENTE,PT,JUNTOS POR SÃO PAULO,1
BEBEDOURO,DEPUTADO FEDERAL,ELIANA MORAES,ELIANA ALVES DE MORAES,SUPLENTE,PT,JUNTOS POR SÃO PAULO,1
BEBEDOURO,DEPUTADO FEDERAL,REINALDO,REINALDO SANTOS RAMOS,SUPLENTE,PT,JUNTOS POR SÃO PAULO,1
BEBEDOURO,DEPUTADO FEDERAL,LUIZ CARLOS GOMES,LUIZ CARLOS GOMES,SUPLENTE,PT,JUNTOS POR SÃO PAULO,4
BEBEDOURO,DEPUTADO FEDERAL,DRA. SONIA DARCH,SONIA DARCH DE BRITO,SUPLENTE,PT,JUNTOS POR SÃO PAULO,1
BEBEDOURO,DEPUTADO FEDERAL,JILMAR TATTO,JILMAR AUGUSTINHO TATTO,ELEITO,PT,JUNTOS POR SÃO PAULO,1
BEBEDOURO,DEPUTADO FEDERAL,DURVAL ORLATO,DURVAL LOPES ORLATO,SUPLENTE,PT,JUNTOS POR SÃO PAULO,2
BEBEDOURO,DEPUTADO FEDERAL,EDSON DA PAZ (O CANTOR),EDSON DA PAZ,SUPLENTE,PT,JUNTOS POR SÃO PAULO,1
BEBEDOURO,DEPUTADO FEDERAL,JANIO RIBEIRO,JANIO RIBEIRO,SUPLENTE,PT,JUNTOS POR SÃO PAULO,2
BEBEDOURO,DEPUTADO FEDERAL,RUBINHO BASTOS,RUBENS BASTOS DO NASCIMENTO,SUPLENTE,PT,JUNTOS POR SÃO PAULO,5
BEBEDOURO,DEPUTADO FEDERAL,REGINALDO PERNAMBUCANO,REGINALDO CARNEIRO DE MOURA,SUPLENTE,PT,JUNTOS POR SÃO PAULO,6
BEBEDOURO,DEPUTADO FEDERAL,RENATO SIMÕES,RENATO SIMÕES,SUPLENTE,PT,JUNTOS POR SÃO PAULO,110
BEBEDOURO,DEPUTADO FEDERAL,PROFESSOR MOREIRA,WAINES MOREIRA ALVES,SUPLENTE,PT,JUNTOS POR SÃO PAULO,1
BEBEDOURO,DEPUTADO FEDERAL,ZARATTINI,CARLOS ALBERTO ROLIM ZARATTINI,ELEITO,PT,JUNTOS POR SÃO PAULO,7
BEBEDOURO,DEPUTADO FEDERAL,DR RONALDO BRESCIANI,RONALDO JOSÉ BRESCIANI,SUPLENTE,PT,JUNTOS POR SÃO PAULO,1
BEBEDOURO,DEPUTADO FEDERAL,JANETE PIETÁ,JANETE ROCHA PIETÁ,ELEITO,PT,JUNTOS POR SÃO PAULO,2
BEBEDOURO,DEPUTADO FEDERAL,VICENTINHO,VICENTE PAULO DA SILVA,ELEITO,PT,JUNTOS POR SÃO PAULO,225
BEBEDOURO,DEPUTADO FEDERAL,PAULO TEIXEIRA,LUIZ PAULO TEIXEIRA FERREIRA,ELEITO,PT,JUNTOS POR SÃO PAULO,51
BEBEDOURO,DEPUTADO FEDERAL,CLAURY,CLAURY SANTOS ALVES DA SILVA,SUPLENTE,PTB,PARTIDO TRABALHISTA BRASILEIRO,5
BEBEDOURO,DEPUTADO FEDERAL,ALEXANDRE COSTA,ALEXANDRE COSTA,SUPLENTE,PTB,PARTIDO TRABALHISTA BRASILEIRO,4
BEBEDOURO,DEPUTADO FEDERAL,CORONEL GOULART,ANTONIO CARLOS GOULART,SUPLENTE,PTB,PARTIDO TRABALHISTA BRASILEIRO,14
BEBEDOURO,DEPUTADO FEDERAL,VAMPETA,MARCOS ANDRE BATISTA SANTOS,SUPLENTE,PTB,PARTIDO TRABALHISTA BRASILEIRO,9
BEBEDOURO,DEPUTADO FEDERAL,SANTANA,JOSE SANTANA DE ABREU,SUPLENTE,PTB,PARTIDO TRABALHISTA BRASILEIRO,2
BEBEDOURO,DEPUTADO FEDERAL,ROBSON TUMA,ROBSON TUMA,SUPLENTE,PTB,PARTIDO TRABALHISTA BRASILEIRO,10
BEBEDOURO,DEPUTADO FEDERAL,RICARDO OLIVEIRA,RICARDO JOSE DE OLIVEIRA,SUPLENTE,PTB,PARTIDO TRABALHISTA BRASILEIRO,1
BEBEDOURO,DEPUTADO FEDERAL,JORGE MARINGOLO,JORGE ANTONIO MARINGOLO PEREIRA,SUPLENTE,PTB,PARTIDO TRABALHISTA BRASILEIRO,2
BEBEDOURO,DEPUTADO FEDERAL,DR SILNEY BERALDO,SILNEY MARCOS BERALDO,SUPLENTE,PTB,PARTIDO TRABALHISTA BRASILEIRO,21
BEBEDOURO,DEPUTADO FEDERAL,SINVAL DORIGON,SINVAL ROBERTO DORIGON,SUPLENTE,PTB,PARTIDO TRABALHISTA BRASILEIRO,7
BEBEDOURO,DEPUTADO FEDERAL,NELSON MARQUEZELLI,NELSON MARQUEZELLI,ELEITO,PTB,PARTIDO TRABALHISTA BRASILEIRO,374
BEBEDOURO,DEPUTADO FEDERAL,CARLOS BURGHI,CARLOS ALBERTO EBERT BURGHI,SUPLENTE,PTB,PARTIDO TRABALHISTA BRASILEIRO,1
BEBEDOURO,DEPUTADO FEDERAL,MARCOS CRIPPA,MARCOS ANTONIO CRIPPA,SUPLENTE,PTB,PARTIDO TRABALHISTA BRASILEIRO,41
BEBEDOURO,DEPUTADO FEDERAL,CELSO MENDES,CELSO MENDES CÚTALO,SUPLENTE,PTB,PARTIDO TRABALHISTA BRASILEIRO,1
BEBEDOURO,DEPUTADO FEDERAL,MALU PARISI,LUIZA FAUSTINO PEREIRA PARI,SUPLENTE,PTB,PARTIDO TRABALHISTA BRASILEIRO,1
BEBEDOURO,DEPUTADO FEDERAL,CIGANA,GISELA DOS SANTOS,SUPLENTE,PTB,PARTIDO TRABALHISTA BRASILEIRO,1
BEBEDOURO,DEPUTADO FEDERAL,SONIA CRISTIANO,SONIA REGINA CRISTIANO,SUPLENTE,PTB,PARTIDO TRABALHISTA BRASILEIRO,2
BEBEDOURO,DEPUTADO FEDERAL,ARNALDO FARIA DE SÁ,ARNALDO FARIA DE SÁ,ELEITO,PTB,PARTIDO TRABALHISTA BRASILEIRO,136
BEBEDOURO,DEPUTADO FEDERAL,CLAUDIA SARTORI,CLAUDIA SARTORI DONATTI DE SOUZA,SUPLENTE,PTB,PARTIDO TRABALHISTA BRASILEIRO,1
BEBEDOURO,DEPUTADO FEDERAL,PASTORA SUELY LOPES,SUELY CARNEIRO LOPES,SUPLENTE,PTB,PARTIDO TRABALHISTA BRASILEIRO,1
BEBEDOURO,DEPUTADO FEDERAL,FRANK AGUIAR,FRANCINETO LUZ DE AGUIAR,SUPLENTE,PTB,PARTIDO TRABALHISTA BRASILEIRO,1
BEBEDOURO,DEPUTADO FEDERAL,PASTOR JOAO ALMEIDA,JOAO ALMEIDA DOS SANTOS,SUPLENTE,PTB,PARTIDO TRABALHISTA BRASILEIRO,1
BEBEDOURO,DEPUTADO FEDERAL,LUCIA HELENA,LUCIA HELENA PIRES SOARES,SUPLENTE,PTB,PARTIDO TRABALHISTA BRASILEIRO,1
BEBEDOURO,DEPUTADO FEDERAL,REIZINHO,MAURICIO DE JESUS CALISTO,SUPLENTE,PTB,PARTIDO TRABALHISTA BRASILEIRO,3
BEBEDOURO,DEPUTADO FEDERAL,PROFESSORA FATIMA,MARIA DE FATIMA FERREIRA DA SILVA,SUPLENTE,PTB,PARTIDO TRABALHISTA BRASILEIRO,2
BEBEDOURO,DEPUTADO FEDERAL,CUCA BECKER,LUIZ CARLOS BECKER FLEURY MARTINS,SUPLENTE,PTB,PARTIDO TRABALHISTA BRASILEIRO,2
BEBEDOURO,DEPUTADO FEDERAL,PAULO LIMA,PAULO CESAR DE OLIVEIRA LIMA,SUPLENTE,PMDB,PARTIDO DO MOVIMENTO DEMOCRÁTICO BRASILEIRO,97
BEBEDOURO,DEPUTADO FEDERAL,ANA CRISTINA,ANA CRISTINA FERNANDES GIAMPIETRO,SUPLENTE,PMDB,PARTIDO DO MOVIMENTO DEMOCRÁTICO BRASILEIRO,1
BEBEDOURO,DEPUTADO FEDERAL,NENÊ MONTANHER,ALCIDES MONTANHER FILHO,SUPLENTE,PMDB,PARTIDO DO MOVIMENTO DEMOCRÁTICO BRASILEIRO,4
BEBEDOURO,DEPUTADO FEDERAL,MARCOS TENÓRIO,MARCOS ANTÔNIO FERREIRA TENÓRIO,SUPLENTE,PMDB,PARTIDO DO MOVIMENTO DEMOCRÁTICO BRASILEIRO,2
BEBEDOURO,DEPUTADO FEDERAL,PAULINHO SOBRAL,PAULO MENDES SOBRAL,SUPLENTE,PMDB,PARTIDO DO MOVIMENTO DEMOCRÁTICO BRASILEIRO,18
BEBEDOURO,DEPUTADO FEDERAL,BONFÁ,ALVARO BONFA JUNIOR,SUPLENTE,PMDB,PARTIDO DO MOVIMENTO DEMOCRÁTICO BRASILEIRO,1
BEBEDOURO,DEPUTADO FEDERAL,TONY JUPSSON,TONY JUPSSON SANTOS,SUPLENTE,PMDB,PARTIDO DO MOVIMENTO DEMOCRÁTICO BRASILEIRO,2
BEBEDOURO,DEPUTADO FEDERAL,EDUARDO COELHO,EDUARDO JOSÉ PEREIRA COELHO,SUPLENTE,PMDB,PARTIDO DO MOVIMENTO DEMOCRÁTICO BRASILEIRO,42
BEBEDOURO,DEPUTADO FEDERAL,PILTON RIOS,PILTON RIOS DE BARROS FELIX PEREIRA,SUPLENTE,PMDB,PARTIDO DO MOVIMENTO DEMOCRÁTICO BRASILEIRO,3
BEBEDOURO,DEPUTADO FEDERAL,DIEGO MARTINS,DIEGO OLIVEIRA MARTINS,SUPLENTE,PMDB,PARTIDO DO MOVIMENTO DEMOCRÁTICO BRASILEIRO,1
BEBEDOURO,DEPUTADO FEDERAL,EDINHO ARAUJO,EDSON EDINHO COELHO ARAUJO,ELEITO,PMDB,PARTIDO DO MOVIMENTO DEMOCRÁTICO BRASILEIRO,49
BEBEDOURO,DEPUTADO FEDERAL,DR. JAIR,JAIR CESAR DAMATO,SUPLENTE,PMDB,PARTIDO DO MOVIMENTO DEMOCRÁTICO BRASILEIRO,1
BEBEDOURO,DEPUTADO FEDERAL,BOMFIM,LUIZ CARLOS BOMFIM,SUPLENTE,PMDB,PARTIDO DO MOVIMENTO DEMOCRÁTICO BRASILEIRO,2
BEBEDOURO,DEPUTADO FEDERAL,ROLEMBERG,ROLANDO BELTRAMINE ROLEMBERG,SUPLENTE,PMDB,PARTIDO DO MOVIMENTO DEMOCRÁTICO BRASILEIRO,1
BEBEDOURO,DEPUTADO FEDERAL,BOCA NERVOSA,EDMAR MARQUES SILVA,SUPLENTE,PMDB,PARTIDO DO MOVIMENTO DEMOCRÁTICO BRASILEIRO,2
BEBEDOURO,DEPUTADO FEDERAL,REGA,ALBERTO REGA,SUPLENTE,PMDB,PARTIDO DO MOVIMENTO DEMOCRÁTICO BRASILEIRO,1
BEBEDOURO,DEPUTADO FEDERAL,EMIDIO SANTANA,MANOEL EMIDIO DE SANTANA,SUPLENTE,PMDB,PARTIDO DO MOVIMENTO DEMOCRÁTICO BRASILEIRO,1
BEBEDOURO,DEPUTADO FEDERAL,LEONARDO HENRIQUE,LEONARDO HENRIQUE CRAVO,SUPLENTE,PMDB,PARTIDO DO MOVIMENTO DEMOCRÁTICO BRASILEIRO,2
BEBEDOURO,DEPUTADO FEDERAL,LÉO OLIVEIRA,OCIMAR DONIZETI LEO OLIVEIRA,SUPLENTE,PMDB,PARTIDO DO MOVIMENTO DEMOCRÁTICO BRASILEIRO,1037
BEBEDOURO,DEPUTADO FEDERAL,JOÃO DA FARMÁCIA,JOÃO LUIZ ROMANINI,SUPLENTE,PMDB,PARTIDO DO MOVIMENTO DEMOCRÁTICO BRASILEIRO,1
BEBEDOURO,DEPUTADO FEDERAL,MORATO,JOSÉ ANTONIO MORATO,SUPLENTE,PMDB,PARTIDO DO MOVIMENTO DEMOCRÁTICO BRASILEIRO,6
BEBEDOURO,DEPUTADO FEDERAL,EVANDRO MEIRA,EVANDRO ANTONIO DE MEIRA,SUPLENTE,PMDB,PARTIDO DO MOVIMENTO DEMOCRÁTICO BRASILEIRO,2
BEBEDOURO,DEPUTADO FEDERAL,DR. SAMIR NASSBINE,SAMIR ASSAD NASSBINE,SUPLENTE,PMDB,PARTIDO DO MOVIMENTO DEMOCRÁTICO BRASILEIRO,2716
BEBEDOURO,DEPUTADO FEDERAL,DANIEL CALDEIRA,DANIEL CALDEIRA MATEUS,SUPLENTE,PSL,PRESTE ATENÇÃO SÃO PAULO,2
BEBEDOURO,DEPUTADO FEDERAL,SILVIO CANGUEIRO,SILVIO DOS ANJOS CANGUEIRO,SUPLENTE,PSL,PRESTE ATENÇÃO SÃO PAULO,1
BEBEDOURO,DEPUTADO FEDERAL,APOSTOLO LEO,LEONILDIO LIMA DE OLIVEIRA,SUPLENTE,PSL,PRESTE ATENÇÃO SÃO PAULO,1
BEBEDOURO,DEPUTADO FEDERAL,CORONEL GILSON LOPES,GILSON LOPES DA SILVA,SUPLENTE,PSC,HUMANISTA CRISTÃO ,3
BEBEDOURO,DEPUTADO FEDERAL,MISSIONARIA NAZARE,MARIA NAZARE DOS SANTOS SORRILLO,SUPLENTE,PSC,HUMANISTA CRISTÃO ,1
BEBEDOURO,DEPUTADO FEDERAL,CLEBER DELALIBERA,CLEBER DE MOURA DELALIBERA,SUPLENTE,PSC,HUMANISTA CRISTÃO ,63
BEBEDOURO,DEPUTADO FEDERAL,MARCO FELICIANO,MARCO ANTONIO FELICIANO,ELEITO,PSC,HUMANISTA CRISTÃO ,975
BEBEDOURO,DEPUTADO FEDERAL,MARCELO AGUIAR,MARCELO THEODORO DE AGUIAR,ELEITO,PSC,HUMANISTA CRISTÃO ,25
BEBEDOURO,DEPUTADO FEDERAL,ARI BARCELLOS,JOSE DE ARIMATHEA BARCELLOS,SUPLENTE,PSC,HUMANISTA CRISTÃO ,2
BEBEDOURO,DEPUTADO FEDERAL,REGIS DE OLIVEIRA,REGIS FERNANDES DE OLIVEIRA,SUPLENTE,PSC,HUMANISTA CRISTÃO ,50
BEBEDOURO,DEPUTADO FEDERAL,NEY SANTOS,CLAUDINEI ALVES DOS SANTOS,SUPLENTE,PSC,HUMANISTA CRISTÃO ,3
BEBEDOURO,DEPUTADO FEDERAL,PAULA CASTRO,ANA PAULA MACHADO DE CASTRO,SUPLENTE,PSC,HUMANISTA CRISTÃO ,4
BEBEDOURO,DEPUTADO FEDERAL,DR.CARLOS FARIA,CARLOS EDUARDO DA SILVA FARIA,SUPLENTE,PSC,HUMANISTA CRISTÃO ,3
BEBEDOURO,DEPUTADO FEDERAL,WAGNER FIOROTTO,WAGNER MONTEIRO FIOROTTO,SUPLENTE,PSC,HUMANISTA CRISTÃO ,2
BEBEDOURO,DEPUTADO FEDERAL,CICERO FERNANDES,JOSE CICERO FERNANDES DA SILVA,SUPLENTE,PSC,HUMANISTA CRISTÃO ,3
BEBEDOURO,DEPUTADO FEDERAL,PR. LUIZ LEMOS,LUIZ CARLOS LEMOS,SUPLENTE,PSC,HUMANISTA CRISTÃO ,4
BEBEDOURO,DEPUTADO FEDERAL,DANILO MIKILIM,DANILO JOSE DE TOLEDO,SUPLENTE,PSC,HUMANISTA CRISTÃO ,1
BEBEDOURO,DEPUTADO FEDERAL,MAURÃO,JOSE MAURO PEREIRA DE BARROS,SUPLENTE,PSC,HUMANISTA CRISTÃO ,13
BEBEDOURO,DEPUTADO FEDERAL,MIRO FERNANDES,ALDOMIRO FERNANDES,SUPLENTE,PSC,HUMANISTA CRISTÃO ,3
BEBEDOURO,DEPUTADO FEDERAL,LEO,LEONARDO LEANDRO FRANÇA DE OLIVEIRA,SUPLENTE,PSC,HUMANISTA CRISTÃO ,3
BEBEDOURO,DEPUTADO FEDERAL,BUCK,BENEDITO BUCK,SUPLENTE,PSC,HUMANISTA CRISTÃO ,3885
BEBEDOURO,DEPUTADO FEDERAL,OMAR,OMAR ADOLFO CHOUMAN,SUPLENTE,PSC,HUMANISTA CRISTÃO ,9
BEBEDOURO,DEPUTADO FEDERAL,PRICILA LEME,PRICILA HELENA MOYSES LEME,SUPLENTE,PSC,HUMANISTA CRISTÃO ,2
BEBEDOURO,DEPUTADO FEDERAL,DR. CARALAMBOS,CARALAMBOS CONSTANTINO SOTIROPOULOS,SUPLENTE,PSC,HUMANISTA CRISTÃO ,4
BEBEDOURO,DEPUTADO FEDERAL,DOUTORA SUZANA GOMES,SUZANA ELIZABETH FERNANDES GOMES,SUPLENTE,PSC,HUMANISTA CRISTÃO ,2
BEBEDOURO,DEPUTADO FEDERAL,MANOEL GASPAR,MANOEL FERREIRA DE SOUZA GASPAR,SUPLENTE,PSC,HUMANISTA CRISTÃO ,12
BEBEDOURO,DEPUTADO FEDERAL,MAISENA,ROBINSON LUIZ DAMAS,SUPLENTE,PSC,HUMANISTA CRISTÃO ,1
BEBEDOURO,DEPUTADO FEDERAL,MOACYR FERNANDES,MOACYR RODRIGUES FERNANDES,SUPLENTE,PSC,HUMANISTA CRISTÃO ,1
BEBEDOURO,DEPUTADO FEDERAL,JUCA CHAVES,JURANDYR CZACZKES CHAVES,SUPLENTE,PR,JUNTOS POR SÃO PAULO,11
BEBEDOURO,DEPUTADO FEDERAL,AGNALDO TIMOTEO,AGUINALDO TIMOTEO PEREIRA,SUPLENTE,PR,JUNTOS POR SÃO PAULO,3
BEBEDOURO,DEPUTADO FEDERAL,TIRIRICA,FRANCISCO EVERARDO OLIVEIRA SILVA,ELEITO,PR,JUNTOS POR SÃO PAULO,1773
BEBEDOURO,DEPUTADO FEDERAL,PR PAULO FREIRE,PAULO ROBERTO FREIRE DA COSTA,ELEITO,PR,JUNTOS POR SÃO PAULO,204
BEBEDOURO,DEPUTADO FEDERAL,LUCIANA COSTA,LUCIANA DE ALMEIDA COSTA,SUPLENTE,PR,JUNTOS POR SÃO PAULO,69
BEBEDOURO,DEPUTADO FEDERAL,MILTON MONTI,MILTON ANTONIO CASQUEL MONTI,ELEITO,PR,JUNTOS POR SÃO PAULO,2
BEBEDOURO,DEPUTADO FEDERAL,VALDEMAR COSTA NETO,VALDEMAR COSTA NETO,ELEITO,PR,JUNTOS POR SÃO PAULO,147
BEBEDOURO,DEPUTADO FEDERAL,EDGAR EDUCACAO,EDGAR MAURICIO DE SANTANA,SUPLENTE,PPS,PSDB/DEM/PPS,1
BEBEDOURO,DEPUTADO FEDERAL,WILLIAM WOO,WILLIAM BOSS WOO,SUPLENTE,PPS,PSDB/DEM/PPS,5
BEBEDOURO,DEPUTADO FEDERAL,VALDEMAR ANFRISIO,VALDEMAR ANFRISIO DOS SANTOS,SUPLENTE,PPS,PSDB/DEM/PPS,1
BEBEDOURO,DEPUTADO FEDERAL,ROBERTO FREIRE,ROBERTO JOAO PEREIRA FREIRE,ELEITO,PPS,PSDB/DEM/PPS,108
BEBEDOURO,DEPUTADO FEDERAL,CORONEL EDSON SARDANO,EDSON DE JESUS SARDANO,SUPLENTE,PPS,PSDB/DEM/PPS,1
BEBEDOURO,DEPUTADO FEDERAL,DIMAS RAMALHO,DIMAS EDUARDO RAMALHO,ELEITO,PPS,PSDB/DEM/PPS,562
BEBEDOURO,DEPUTADO FEDERAL,ARI FRIEDENBACH,ARI FRIEDENBACH,SUPLENTE,PPS,PSDB/DEM/PPS,45
BEBEDOURO,DEPUTADO FEDERAL,JOSE ONERIO,JOSE ONERIO DA SILVA,SUPLENTE,PPS,PSDB/DEM/PPS,14
BEBEDOURO,DEPUTADO FEDERAL,ARNALDO JARDIM,ARNALDO CALIL PEREIRA JARDIM,ELEITO,PPS,PSDB/DEM/PPS,68
BEBEDOURO,DEPUTADO FEDERAL,DR PACHECO,ANTONIO DE PADUA PACHECO,SUPLENTE,PPS,PSDB/DEM/PPS,1
BEBEDOURO,DEPUTADO FEDERAL,JORGE TADEU,JORGE TADEU MUDALEN,ELEITO,DEM,PSDB/DEM/PPS,469
BEBEDOURO,DEPUTADO FEDERAL,SAMPAIO,ANTONIO SAMPAIO TEIXEIRA,SUPLENTE,DEM,PSDB/DEM/PPS,19
BEBEDOURO,DEPUTADO FEDERAL,RENATO GALENDI,RENATO APARECIDO GALENDI,SUPLENTE,DEM,PSDB/DEM/PPS,2
BEBEDOURO,DEPUTADO FEDERAL,JORGINHO MALULY,JORGE DE FARIA MALULY,SUPLENTE,DEM,PSDB/DEM/PPS,74
BEBEDOURO,DEPUTADO FEDERAL,PROFESSOR BENJAMIN,BENJAMIN RIBEIRO DA SILVA,SUPLENTE,DEM,PSDB/DEM/PPS,3
BEBEDOURO,DEPUTADO FEDERAL,KIKO DO KLB,FRANCO FINATO SCORNAVACCA,SUPLENTE,DEM,PSDB/DEM/PPS,39
BEBEDOURO,DEPUTADO FEDERAL,CRESPO,JOSE ANTONIO CALDINI CRESPO,SUPLENTE,DEM,PSDB/DEM/PPS,2
BEBEDOURO,DEPUTADO FEDERAL,RODRIGO GARCIA,RODRIGO GARCIA,ELEITO,DEM,PSDB/DEM/PPS,419
BEBEDOURO,DEPUTADO FEDERAL,MARCELO PALINKAS,MARCELO PALINKAS,SUPLENTE,DEM,PSDB/DEM/PPS,32
BEBEDOURO,DEPUTADO FEDERAL,ZULAIÊ COBRA,ZULAIE COBRA RIBEIRO,SUPLENTE,DEM,PSDB/DEM/PPS,29
BEBEDOURO,DEPUTADO FEDERAL,LUCIANO ARTIOLI,LUCIANO ARTIOLI MOREIRA,SUPLENTE,DEM,PSDB/DEM/PPS,10
BEBEDOURO,DEPUTADO FEDERAL,RAUL GIL JR,RAUL GIL JUNIOR,SUPLENTE,DEM,PSDB/DEM/PPS,9
BEBEDOURO,DEPUTADO FEDERAL,CHICO PELUCIO,FRANCISCO PELUCIO,SUPLENTE,DEM,PSDB/DEM/PPS,1
BEBEDOURO,DEPUTADO FEDERAL,JUNJI ABE,JUNJI ABE,ELEITO,DEM,PSDB/DEM/PPS,4
BEBEDOURO,DEPUTADO FEDERAL,SALIM REIS,ANTONIO CARLOS DOS REIS,SUPLENTE,DEM,PSDB/DEM/PPS,1
BEBEDOURO,DEPUTADO FEDERAL,ODECIO BRAGA,ODECIO BRAGA DE LOUREDO FILHO,SUPLENTE,DEM,PSDB/DEM/PPS,2
BEBEDOURO,DEPUTADO FEDERAL,MANDIC,ALEKSANDAR CARLOS MANDIC,SUPLENTE,DEM,PSDB/DEM/PPS,2
BEBEDOURO,DEPUTADO FEDERAL,HIRAM JR,HIRAM AYRES MONTEIRO JUNIOR,SUPLENTE,DEM,PSDB/DEM/PPS,1
BEBEDOURO,DEPUTADO FEDERAL,HELIO SECCO,HELIO RODRIGUES SECCO,SUPLENTE,DEM,PSDB/DEM/PPS,3
BEBEDOURO,DEPUTADO FEDERAL,ELI CORREA FILHO,ADRIANO ELI CORREA,ELEITO,DEM,PSDB/DEM/PPS,4
BEBEDOURO,DEPUTADO FEDERAL,DR ELEUSES PAIVA,ELEUSES VIEIRA DE PAIVA,SUPLENTE,DEM,PSDB/DEM/PPS,105
BEBEDOURO,DEPUTADO FEDERAL,GUILHERME CAMPOS,GUILHERME CAMPOS JUNIOR,MÉDIA,DEM,PSDB/DEM/PPS,153
BEBEDOURO,DEPUTADO FEDERAL,WALTER IHOSHI,WALTER SHINDI IIHOSHI,SUPLENTE,DEM,PSDB/DEM/PPS,2
BEBEDOURO,DEPUTADO FEDERAL,PROF HERMES,HERMES RODRIGUES NERY,SUPLENTE,PHS,HUMANISTA CRISTÃO ,1
BEBEDOURO,DEPUTADO FEDERAL,MARIO VIEIRA,MARIO LUIZ VIEIRA,SUPLENTE,PHS,HUMANISTA CRISTÃO ,6
BEBEDOURO,DEPUTADO FEDERAL,CALIXTO,SÉRGIO MORACIR CALIXTO,SUPLENTE,PHS,HUMANISTA CRISTÃO ,2
BEBEDOURO,DEPUTADO FEDERAL,JONAS DONIZETTE,JONAS DONIZETTE FERREIRA,ELEITO,PSB,PRESTE ATENÇÃO SÃO PAULO,3
BEBEDOURO,DEPUTADO FEDERAL,ROGÉRIO EMÍLIO,ROGÉRIO EMÍLIO DE ANDRADE,SUPLENTE,PSB,PRESTE ATENÇÃO SÃO PAULO,1
BEBEDOURO,DEPUTADO FEDERAL,MARCELINHO CARIOCA,MARCELO PEREIRA SURCIN,SUPLENTE,PSB,PRESTE ATENÇÃO SÃO PAULO,51
BEBEDOURO,DEPUTADO FEDERAL,GUSTAVO HERRMANN,GUSTAVO RANZANI HERRMANN,SUPLENTE,PSB,PRESTE ATENÇÃO SÃO PAULO,17
BEBEDOURO,DEPUTADO FEDERAL,SARGENTO FERNANDO,FERNANDO ALCÂNTARA DE FIGUEIREDO,SUPLENTE,PSB,PRESTE ATENÇÃO SÃO PAULO,1
BEBEDOURO,DEPUTADO FEDERAL,ELISEU GABRIEL,ELISEU GABRIEL DE PIERI,SUPLENTE,PSB,PRESTE ATENÇÃO SÃO PAULO,4
BEBEDOURO,DEPUTADO FEDERAL,ADÃO LIMA,ADÃO TIMÓTEO DE LIMA,SUPLENTE,PSB,PRESTE ATENÇÃO SÃO PAULO,1
