ITAÍ,DEPUTADO ESTADUAL,MARCOS BERNARDELLI,MARCOS JOSÉ BERNARDELLI,SUPLENTE,PDT,PARTIDO DEMOCRÁTICO TRABALHISTA,1
ITAÍ,DEPUTADO ESTADUAL,JOCA VASCONCELOS,JOAO CARLOS MONTE CLARO VASCONCELOS,SUPLENTE,PDT,PARTIDO DEMOCRÁTICO TRABALHISTA,59
ITAÍ,DEPUTADO ESTADUAL,BRUZAROSCO,APARECIDO DE JESUS BRUZAROSCO,SUPLENTE,PDT,PARTIDO DEMOCRÁTICO TRABALHISTA,4
ITAÍ,DEPUTADO ESTADUAL,RAFAEL SILVA,RAFAEL ANTONIO DA SILVA,ELEITO,PDT,PARTIDO DEMOCRÁTICO TRABALHISTA,9
ITAÍ,DEPUTADO ESTADUAL,HELIO BASTOS,HELIO DE ALMEIDA BASTOS,SUPLENTE,PDT,PARTIDO DEMOCRÁTICO TRABALHISTA,1
ITAÍ,DEPUTADO ESTADUAL,MYRYAM ATHIE,MIRIAM ATHIE,SUPLENTE,PDT,PARTIDO DEMOCRÁTICO TRABALHISTA,2
ITAÍ,DEPUTADO ESTADUAL,ZE DIAS,JOSE CARLOS FERREIRA DIAS,SUPLENTE,PDT,PARTIDO DEMOCRÁTICO TRABALHISTA,2
ITAÍ,DEPUTADO ESTADUAL,SILAS FARIA,SILAS FARIA DE SOUZA,SUPLENTE,PDT,PARTIDO DEMOCRÁTICO TRABALHISTA,14
ITAÍ,DEPUTADO ESTADUAL,MARCO BRASIL,MARCO AURÉLIO RIBEIRO,SUPLENTE,PDT,PARTIDO DEMOCRÁTICO TRABALHISTA,81
ITAÍ,DEPUTADO ESTADUAL,JOÃO ELIAS,JOÃO ELIAS PEREIRA,SUPLENTE,PDT,PARTIDO DEMOCRÁTICO TRABALHISTA,9
ITAÍ,DEPUTADO ESTADUAL,JOSE DE ALMEIDA,JOSE MALVINEITE DE ALMEIDA,SUPLENTE,PDT,PARTIDO DEMOCRÁTICO TRABALHISTA,2
ITAÍ,DEPUTADO ESTADUAL,ANDERSON SILVA,ANDERSON DOMINGOS DA SILVA,SUPLENTE,PT,SOMOS MAIS SÃO PAULO,1
ITAÍ,DEPUTADO ESTADUAL,TELMA DE SOUZA,TELMA SANDRA AUGUSTO DE SOUZA,ELEITO,PT,SOMOS MAIS SÃO PAULO,1
ITAÍ,DEPUTADO ESTADUAL,GALENO AMORIM,GALENO DE AMORIM JUNIOR,SUPLENTE,PT,SOMOS MAIS SÃO PAULO,1
ITAÍ,DEPUTADO ESTADUAL,GERSON BITTENCOURT,GERSON LUIS BITTENCOURT,ELEITO,PT,SOMOS MAIS SÃO PAULO,1
ITAÍ,DEPUTADO ESTADUAL,EDINHO SILVA,EDSON ANTONIO EDINHO DA SILVA,ELEITO,PT,SOMOS MAIS SÃO PAULO,3
ITAÍ,DEPUTADO ESTADUAL,ANA PERUGINI,ANA LUCIA LIPPAUS PERUGINI,ELEITO,PT,SOMOS MAIS SÃO PAULO,3
ITAÍ,DEPUTADO ESTADUAL,TONINHO DO PT,ANTONIO AMARAL JUNIOR,SUPLENTE,PT,SOMOS MAIS SÃO PAULO,7
ITAÍ,DEPUTADO ESTADUAL,ZICO,JOSÉ PRADO DE ANDRADE,MÉDIA,PT,SOMOS MAIS SÃO PAULO,343
ITAÍ,DEPUTADO ESTADUAL,MARCO AURÉLIO DE SOUZA,MARCO AURÉLIO DE SOUZA,MÉDIA,PT,SOMOS MAIS SÃO PAULO,8
ITAÍ,DEPUTADO ESTADUAL,MARCOS MARTINS,MARCOS LOPES MARTINS,ELEITO,PT,SOMOS MAIS SÃO PAULO,12
ITAÍ,DEPUTADO ESTADUAL,ELI TEODORO,ELI TEODORO,SUPLENTE,PT,SOMOS MAIS SÃO PAULO,1
ITAÍ,DEPUTADO ESTADUAL,SIMÃO PEDRO,SIMÃO PEDRO CHIOVETTI,ELEITO,PT,SOMOS MAIS SÃO PAULO,1
ITAÍ,DEPUTADO ESTADUAL,IVANETE VIEIRA,IVANETE APARECIDA DOS SANTOS,SUPLENTE,PT,SOMOS MAIS SÃO PAULO,24
ITAÍ,DEPUTADO ESTADUAL,GERALDO CRUZ,GERALDO LEITE DA CRUZ,ELEITO,PT,SOMOS MAIS SÃO PAULO,1
ITAÍ,DEPUTADO ESTADUAL,DUDU BOLITO,AMARILDO DUDU BOLITO,SUPLENTE,PT,SOMOS MAIS SÃO PAULO,3
ITAÍ,DEPUTADO ESTADUAL,ESTELA ALMAGRO,ESTELA ALEXANDRE ALMAGRO,SUPLENTE,PT,SOMOS MAIS SÃO PAULO,5
ITAÍ,DEPUTADO ESTADUAL,HAMILTON PEREIRA,HAMILTON PEREIRA,ELEITO,PT,SOMOS MAIS SÃO PAULO,19
ITAÍ,DEPUTADO ESTADUAL,EUVANILDE,EUVANILDE RODRIGUES DA SILVA,SUPLENTE,PT,SOMOS MAIS SÃO PAULO,1
ITAÍ,DEPUTADO ESTADUAL,LUIZ CLAUDIO MARCOLINO,LUIZ CLAUDIO MARCOLINO,ELEITO,PT,SOMOS MAIS SÃO PAULO,194
ITAÍ,DEPUTADO ESTADUAL,RENATO DO GEB,RENATO MORENI AIRES DA SILVA,SUPLENTE,PT,SOMOS MAIS SÃO PAULO,1
ITAÍ,DEPUTADO ESTADUAL,NATIVIDADE,MARIA DA NATIVIDADE PEREIRA LIMA,SUPLENTE,PT,SOMOS MAIS SÃO PAULO,1
ITAÍ,DEPUTADO ESTADUAL,ROBERTO FELICIO,ROBERTO FELICIO,SUPLENTE,PT,SOMOS MAIS SÃO PAULO,3
ITAÍ,DEPUTADO ESTADUAL,BETH SAHAO,ELISABETH SAHÃO,SUPLENTE,PT,SOMOS MAIS SÃO PAULO,2
ITAÍ,DEPUTADO ESTADUAL,ADINAN ORTOLAN,JOSÉ ADINAN ORTOLAN,SUPLENTE,PT,SOMOS MAIS SÃO PAULO,2
ITAÍ,DEPUTADO ESTADUAL,FRANCISCO FRANÇA,FRANCISCO FRANÇA DA SILVA,SUPLENTE,PT,SOMOS MAIS SÃO PAULO,27
ITAÍ,DEPUTADO ESTADUAL,LELO PAGANI,LUIZ AURELIO PAGANI,SUPLENTE,PT,SOMOS MAIS SÃO PAULO,4
ITAÍ,DEPUTADO ESTADUAL,VERA SABA,VERA LÚCIA SANTOS SABA,SUPLENTE,PT,SOMOS MAIS SÃO PAULO,3
ITAÍ,DEPUTADO ESTADUAL,ANA DO CARMO,ANA MARIA DO CARMO ROSSETO,ELEITO,PT,SOMOS MAIS SÃO PAULO,1
ITAÍ,DEPUTADO ESTADUAL,BETO CANGUSSU,LUIZ ROBERTO ALVES CANGUSSU,SUPLENTE,PT,SOMOS MAIS SÃO PAULO,1
ITAÍ,DEPUTADO ESTADUAL,JOSÉ CANDIDO,JOSÉ DE SOUZA CÂNDIDO,MÉDIA,PT,SOMOS MAIS SÃO PAULO,1
ITAÍ,DEPUTADO ESTADUAL,MÁRCIO CHAVES,MÁRCIO CHAVES PIRES,SUPLENTE,PT,SOMOS MAIS SÃO PAULO,1
ITAÍ,DEPUTADO ESTADUAL,ZÉ ARISTEIA,JOSÉ ARISTEIA PEREIRA,SUPLENTE,PT,SOMOS MAIS SÃO PAULO,3
ITAÍ,DEPUTADO ESTADUAL,JOEL FONSECA,JOEL FONSECA COSTA,SUPLENTE,PT,SOMOS MAIS SÃO PAULO,1
ITAÍ,DEPUTADO ESTADUAL,DONISETE BRAGA,DONISETE PEREIRA BRAGA,ELEITO,PT,SOMOS MAIS SÃO PAULO,2
ITAÍ,DEPUTADO ESTADUAL,CARLOS NEDER,CARLOS ALBERTO PLETZ NEDER,SUPLENTE,PT,SOMOS MAIS SÃO PAULO,1004
ITAÍ,DEPUTADO ESTADUAL,DRA NEVES,MARIA DAS NEVES DUARTE,SUPLENTE,PTB,PARTIDO TRABALHISTA BRASILEIRO,1
ITAÍ,DEPUTADO ESTADUAL,LÉO ÁQUILLA,JADSON MENDES DE LIMA,SUPLENTE,PTB,PARTIDO TRABALHISTA BRASILEIRO,7
ITAÍ,DEPUTADO ESTADUAL,CONTE LOPES,ROBERVAL CONTE LOPES LIMA,SUPLENTE,PTB,PARTIDO TRABALHISTA BRASILEIRO,8
ITAÍ,DEPUTADO ESTADUAL,CAMPOS MACHADO,ANTONIO CARLOS DE CAMPOS MACHADO,ELEITO,PTB,PARTIDO TRABALHISTA BRASILEIRO,142
ITAÍ,DEPUTADO ESTADUAL,VANDO,ORVANDO DA SILVA,SUPLENTE,PTB,PARTIDO TRABALHISTA BRASILEIRO,2
ITAÍ,DEPUTADO ESTADUAL,CORONEL EDSON FERRARINI,EDSON FERRARINI,ELEITO,PTB,PARTIDO TRABALHISTA BRASILEIRO,1
ITAÍ,DEPUTADO ESTADUAL,VAL,ENIVALDO RAMOS DE FREITAS,SUPLENTE,PTB,PARTIDO TRABALHISTA BRASILEIRO,102
ITAÍ,DEPUTADO ESTADUAL,WALDIR AGNELLO,WALDIR AGNELLO,SUPLENTE,PTB,PARTIDO TRABALHISTA BRASILEIRO,5
ITAÍ,DEPUTADO ESTADUAL,CABO DALMIR E LARANJA,DALMIR MARCIO MARÇAL,SUPLENTE,PTB,PARTIDO TRABALHISTA BRASILEIRO,7
ITAÍ,DEPUTADO ESTADUAL,BALEIA ROSSI,LUIZ FELIPE BALEIA TENUTO ROSSI,ELEITO,PMDB,PARTIDO DO MOVIMENTO DEMOCRÁTICO BRASILEIRO,7
ITAÍ,DEPUTADO ESTADUAL,DRA ADRIANA,ADRIANA DI NARDO SILVA,SUPLENTE,PMDB,PARTIDO DO MOVIMENTO DEMOCRÁTICO BRASILEIRO,1
ITAÍ,DEPUTADO ESTADUAL,DU TONIN,EDUARDO TONIN,SUPLENTE,PMDB,PARTIDO DO MOVIMENTO DEMOCRÁTICO BRASILEIRO,2
ITAÍ,DEPUTADO ESTADUAL,JOSÉ BARROS,JOSÉ BARROS DE CASTRO,SUPLENTE,PMDB,PARTIDO DO MOVIMENTO DEMOCRÁTICO BRASILEIRO,1
ITAÍ,DEPUTADO ESTADUAL,CARUSO,JORGE LUIS CARUSO,ELEITO,PMDB,PARTIDO DO MOVIMENTO DEMOCRÁTICO BRASILEIRO,6
ITAÍ,DEPUTADO ESTADUAL,VANESSA DAMO,VANESSA DAMO OROSCO,ELEITO,PMDB,PARTIDO DO MOVIMENTO DEMOCRÁTICO BRASILEIRO,27
ITAÍ,DEPUTADO ESTADUAL,CHICO DA ADEGA,FRANCISCO PEREIRA GOMES,SUPLENTE,PMDB,PARTIDO DO MOVIMENTO DEMOCRÁTICO BRASILEIRO,1
ITAÍ,DEPUTADO ESTADUAL,ITAMAR BORGES,ITAMAR FRANCISCO MACHADO BORGES,MÉDIA,PMDB,PARTIDO DO MOVIMENTO DEMOCRÁTICO BRASILEIRO,4
ITAÍ,DEPUTADO ESTADUAL,MARIA DO CARMO GUILHERME,MARIA DO CARMO GUILHERME,SUPLENTE,PMDB,PARTIDO DO MOVIMENTO DEMOCRÁTICO BRASILEIRO,4
ITAÍ,DEPUTADO ESTADUAL,ANGELA RAMALHO,ANGELA MARIA ANTUNES DE CARVALHO TAVARES,SUPLENTE,PMDB,PARTIDO DO MOVIMENTO DEMOCRÁTICO BRASILEIRO,1082
ITAÍ,DEPUTADO ESTADUAL,JOOJI HATO,JOOJI HATO,ELEITO,PMDB,PARTIDO DO MOVIMENTO DEMOCRÁTICO BRASILEIRO,8
ITAÍ,DEPUTADO ESTADUAL,JÂNIO,JÂNIO GONÇALVES DE OLIVEIRA,SUPLENTE,PMDB,PARTIDO DO MOVIMENTO DEMOCRÁTICO BRASILEIRO,1
ITAÍ,DEPUTADO ESTADUAL,BARLETTA,ROBERTO BARLETTA,SUPLENTE,PMDB,PARTIDO DO MOVIMENTO DEMOCRÁTICO BRASILEIRO,4
ITAÍ,DEPUTADO ESTADUAL,PESTANA,WAGNER DE OLIVEIRA PESTANA,SUPLENTE,PMDB,PARTIDO DO MOVIMENTO DEMOCRÁTICO BRASILEIRO,1
ITAÍ,DEPUTADO ESTADUAL,ANA PAULA ROSSI,ANA PAULA ROSSI DE ALMEIDA MAGDESIAN,SUPLENTE,PMDB,PARTIDO DO MOVIMENTO DEMOCRÁTICO BRASILEIRO,1
ITAÍ,DEPUTADO ESTADUAL,OLIVEIRA JUNIOR,ELIO APARECIDO DE OLIVEIRA,SUPLENTE,PSC,HUMANISTA CRISTÃO ,1
ITAÍ,DEPUTADO ESTADUAL,REINALDO BRICOLA,REINALDO BRICOLA,SUPLENTE,PSC,HUMANISTA CRISTÃO ,1
ITAÍ,DEPUTADO ESTADUAL,CELSO NASCIMENTO,CELSO BRAZ DO NASCIMENTO,SUPLENTE,PSC,HUMANISTA CRISTÃO ,18
ITAÍ,DEPUTADO ESTADUAL,APOSTOLO EURIPEDES,EURIPEDES LUIZ DE SOUSA,SUPLENTE,PSC,HUMANISTA CRISTÃO ,4
ITAÍ,DEPUTADO ESTADUAL,LEANDRO AMARAL,LEANDRO GODINES DO AMARAL,SUPLENTE,PSC,HUMANISTA CRISTÃO ,8
ITAÍ,DEPUTADO ESTADUAL,PASTOR VIEIRA ROCHA,JOSE VIEIRA ROCHA,SUPLENTE,PSC,HUMANISTA CRISTÃO ,6
ITAÍ,DEPUTADO ESTADUAL,PR. CARLOS CEZAR,CARLOS CEZAR DA SILVA,ELEITO,PSC,HUMANISTA CRISTÃO ,1
ITAÍ,DEPUTADO ESTADUAL,MARTA LIVIA SUPLICY,MARTA LIVIA BARRAGANA FERNANDES SUPLICY,SUPLENTE,PSC,HUMANISTA CRISTÃO ,33
ITAÍ,DEPUTADO ESTADUAL,CAPITÃO LIDIO,LIDIO GUARIGLIA COSTA JUNIOR,SUPLENTE,PSC,HUMANISTA CRISTÃO ,1
ITAÍ,DEPUTADO ESTADUAL,RENATO PUPO,RENATO PUPO DE PAULA,SUPLENTE,PSC,HUMANISTA CRISTÃO ,4
ITAÍ,DEPUTADO ESTADUAL,JOÃO BINATO,JOÃO ANTONIO BINATO,SUPLENTE,PSC,HUMANISTA CRISTÃO ,3
ITAÍ,DEPUTADO ESTADUAL,CANDIDO,JOELSON CANDIDO DE OLIVEIRA,SUPLENTE,PSC,HUMANISTA CRISTÃO ,83
ITAÍ,DEPUTADO ESTADUAL,SAID MOURAD,AHMAD SAID MOURAD,SUPLENTE,PSC,HUMANISTA CRISTÃO ,2
ITAÍ,DEPUTADO ESTADUAL,RODRIGO MORAES,RODRIGO AUGUSTO MORAES,ELEITO,PSC,HUMANISTA CRISTÃO ,55
ITAÍ,DEPUTADO ESTADUAL,MARCOS NEVES,MARCO AURELIO DOS SANTOS NEVES,ELEITO,PSC,HUMANISTA CRISTÃO ,1
ITAÍ,DEPUTADO ESTADUAL,LEONARDO QUEIROZ,LEONARDO SANTOS QUEIROZ,SUPLENTE,PSC,HUMANISTA CRISTÃO ,2
ITAÍ,DEPUTADO ESTADUAL,JOSUE ROBERTO,JOSUE ROBERTO DA SILVA,SUPLENTE,PR,SOMOS MAIS SÃO PAULO,1
ITAÍ,DEPUTADO ESTADUAL,ZE PEDRO,JOSE PEDRO LEITE DA SILVA,SUPLENTE,PR,SOMOS MAIS SÃO PAULO,21
ITAÍ,DEPUTADO ESTADUAL,LILI AIMAR,LILIANA MEDEIROS DE ALMEIDA AYMAR BECHARA,SUPLENTE,PR,SOMOS MAIS SÃO PAULO,2
ITAÍ,DEPUTADO ESTADUAL,PATRICIA LIMA,PATRICIA FREITAS LIMA,SUPLENTE,PR,SOMOS MAIS SÃO PAULO,216
ITAÍ,DEPUTADO ESTADUAL,JOSIAS DINIZ,JOSIAS ANTONIO DINIZ,SUPLENTE,PR,SOMOS MAIS SÃO PAULO,1
ITAÍ,DEPUTADO ESTADUAL,CLAUDIO SOROCABA I,GERVINO GONCALVES,SUPLENTE,PR,SOMOS MAIS SÃO PAULO,1
ITAÍ,DEPUTADO ESTADUAL,ANDRE DO PRADO,ANDRE LUIS DO PRADO,ELEITO,PR,SOMOS MAIS SÃO PAULO,32
ITAÍ,DEPUTADO ESTADUAL,EDUARDO REZEK,EDUARDO PEDROSO REZEK,SUPLENTE,PPS,PARTIDO POPULAR SOCIALISTA,3
ITAÍ,DEPUTADO ESTADUAL,BRAZ,BRAZ ANTUNES MATTOS NETO,SUPLENTE,PPS,PARTIDO POPULAR SOCIALISTA,1
ITAÍ,DEPUTADO ESTADUAL,TONINHO ALEIXO,ANTONIO ALEIXO DA COSTA,SUPLENTE,PPS,PARTIDO POPULAR SOCIALISTA,1
ITAÍ,DEPUTADO ESTADUAL,ADEMIR DA GUIA,ADEMIR DA GUIA,SUPLENTE,PPS,PARTIDO POPULAR SOCIALISTA,5
ITAÍ,DEPUTADO ESTADUAL,DAVI ZAIA,DAVID ZAIA,MÉDIA,PPS,PARTIDO POPULAR SOCIALISTA,4
ITAÍ,DEPUTADO ESTADUAL,LÊ DE FREITAS,OLEGÁRIO DE FREITAS SIQUEIRA FILHO,SUPLENTE,PPS,PARTIDO POPULAR SOCIALISTA,1
ITAÍ,DEPUTADO ESTADUAL,PROF DIMAS NOVAIS,DIMAS NOVAIS DE OLIVEIRA,SUPLENTE,PPS,PARTIDO POPULAR SOCIALISTA,2
ITAÍ,DEPUTADO ESTADUAL,PROF. NELSON SUSSUMU SHIKICIMA,NELSON SUSSUMU SHIKICIMA,SUPLENTE,PPS,PARTIDO POPULAR SOCIALISTA,2
ITAÍ,DEPUTADO ESTADUAL,VITOR SAPIENZA,VITOR SAPIENZA,SUPLENTE,PPS,PARTIDO POPULAR SOCIALISTA,98
ITAÍ,DEPUTADO ESTADUAL,CICERO FELIX,CICERO FELIX DE SOUZA,SUPLENTE,PPS,PARTIDO POPULAR SOCIALISTA,4
ITAÍ,DEPUTADO ESTADUAL,PROFESSOR ALVARO CAETANO,ALVARO CAETANO DE ALMEIDA,SUPLENTE,PPS,PARTIDO POPULAR SOCIALISTA,1
ITAÍ,DEPUTADO ESTADUAL,ESTEVÃO,STEVEN ERIKSEN BINNIE,SUPLENTE,PPS,PARTIDO POPULAR SOCIALISTA,1
ITAÍ,DEPUTADO ESTADUAL,PROFESSOR ZE MARIA,JOSE MARIA CANCELLIERO,SUPLENTE,PPS,PARTIDO POPULAR SOCIALISTA,5
ITAÍ,DEPUTADO ESTADUAL,ROBERTO MORAIS,ROBERTO TURCHI DE MORAIS,ELEITO,PPS,PARTIDO POPULAR SOCIALISTA,4
ITAÍ,DEPUTADO ESTADUAL,AZUAITE,AZUAITE MARTINS DE FRANÇA,SUPLENTE,PPS,PARTIDO POPULAR SOCIALISTA,1
ITAÍ,DEPUTADO ESTADUAL,ELZO SIGUETA,ELZO SIGUETA,SUPLENTE,PPS,PARTIDO POPULAR SOCIALISTA,144
ITAÍ,DEPUTADO ESTADUAL,SERGIO BOCALINI,SERGIO DOS SANTOS BOCALINI,SUPLENTE,PPS,PARTIDO POPULAR SOCIALISTA,1
ITAÍ,DEPUTADO ESTADUAL,DARIO SAADI,DARIO JORGE GIOLO SAADI,SUPLENTE,DEM,PSDB/DEM,1
ITAÍ,DEPUTADO ESTADUAL,ANDRE SOARES,ANDRE BEZERRA RIBEIRO SOARES,ELEITO,DEM,PSDB/DEM,9
ITAÍ,DEPUTADO ESTADUAL,ULISSES SALES,ULISSES ROBERTO CORNAZZANI SALES,SUPLENTE,DEM,PSDB/DEM,1
ITAÍ,DEPUTADO ESTADUAL,EDMIR CHEDID,EDMIR JOSE ABI CHEDID,ELEITO,DEM,PSDB/DEM,15
ITAÍ,DEPUTADO ESTADUAL,ALDO DEMARCHI,JOSE ALDO DEMARCHI,ELEITO,DEM,PSDB/DEM,138
ITAÍ,DEPUTADO ESTADUAL,JOAO MELLAO NETO,JOAO MELLAO NETO,SUPLENTE,DEM,PSDB/DEM,15
ITAÍ,DEPUTADO ESTADUAL,ESTEVAM GALVAO,ESTEVAM GALVAO DE OLIVEIRA,ELEITO,DEM,PSDB/DEM,2
ITAÍ,DEPUTADO ESTADUAL,RICARDO SALLES,RICARDO DE AQUINO SALLES,SUPLENTE,DEM,PSDB/DEM,9
ITAÍ,DEPUTADO ESTADUAL,MILTON LEITE FILHO,MILTON LEITE DA SILVA FILHO,ELEITO,DEM,PSDB/DEM,1
ITAÍ,DEPUTADO ESTADUAL,SALLES,RAIMUNDO TARASKEVICIUS SALES,SUPLENTE,DEM,PSDB/DEM,3
ITAÍ,DEPUTADO ESTADUAL,GIL ARANTES,GILBERTO MACEDO GIL ARANTES,ELEITO,DEM,PSDB/DEM,122
ITAÍ,DEPUTADO ESTADUAL,ZE TURIN,JOSE ARIVALDO RODRIGUES,SUPLENTE,DEM,PSDB/DEM,6
ITAÍ,DEPUTADO ESTADUAL,LEANDRO DO KLB,LEANDRO FINATO SCORNAVACCA,SUPLENTE,DEM,PSDB/DEM,62
ITAÍ,DEPUTADO ESTADUAL,BAHIA DA ACADEMIA,ALMIRANDO FERREIRA DO NASCIMENTO,SUPLENTE,PSB,PARTIDO SOCIALISTA BRASILEIRO,1
ITAÍ,DEPUTADO ESTADUAL,MARIÂNGELA DUARTE,MARIANGELA DE ARAÚJO GAMA DUARTE,SUPLENTE,PSB,PARTIDO SOCIALISTA BRASILEIRO,1
ITAÍ,DEPUTADO ESTADUAL,TEREZINHA DA PAULINA,TEREZINHA DE JESUS MORAIS VASCONCELOS SILVA,SUPLENTE,PSB,PARTIDO SOCIALISTA BRASILEIRO,143
ITAÍ,DEPUTADO ESTADUAL,PAULO BRIGLIADORI,PAULO JOSÉ BRIGLIADORI,SUPLENTE,PSB,PARTIDO SOCIALISTA BRASILEIRO,1
ITAÍ,DEPUTADO ESTADUAL,ED THOMAS,EDSON TOMAZINI,ELEITO,PSB,PARTIDO SOCIALISTA BRASILEIRO,1
ITAÍ,DEPUTADO ESTADUAL,PROF. MARIO LUIZ GUIDE,MARIO LUIZ GUIDE,SUPLENTE,PSB,PARTIDO SOCIALISTA BRASILEIRO,2
ITAÍ,DEPUTADO ESTADUAL,HILKIAS,HILKIAS DE OLIVEIRA,SUPLENTE,PSB,PARTIDO SOCIALISTA BRASILEIRO,2
ITAÍ,DEPUTADO ESTADUAL,CHICO BEZERRA,FRANCISCO MOACIR BEZERRA DE MELO FILHO,SUPLENTE,PSB,PARTIDO SOCIALISTA BRASILEIRO,1
ITAÍ,DEPUTADO ESTADUAL,FRANCÉ JUNIOR,ANTONIO FRANCÉ JUNIOR,SUPLENTE,PSB,PARTIDO SOCIALISTA BRASILEIRO,1
ITAÍ,DEPUTADO ESTADUAL,DR. JOSÉ RICARDO,JOSÉ RICARDO DIAS,SUPLENTE,PSB,PARTIDO SOCIALISTA BRASILEIRO,11
ITAÍ,DEPUTADO ESTADUAL,YVONE BARREIROS,YVONE BARREIROS MOREIRA,SUPLENTE,PSB,PARTIDO SOCIALISTA BRASILEIRO,5
ITAÍ,DEPUTADO ESTADUAL,BACCARIN,SILVIO LUIZ BACCARIN,SUPLENTE,PSB,PARTIDO SOCIALISTA BRASILEIRO,1
ITAÍ,DEPUTADO ESTADUAL,LEVI MENDES,ANTONIO LEVI MENDES,SUPLENTE,PSB,PARTIDO SOCIALISTA BRASILEIRO,4
ITAÍ,DEPUTADO ESTADUAL,ROMUALDO,ROMUALDO CONSTANTINO MAGRO JUNIOR,SUPLENTE,PSB,PARTIDO SOCIALISTA BRASILEIRO,1
ITAÍ,DEPUTADO ESTADUAL,VINICIUS CAMARINHA,VINICIUS ALMEIDA CAMARINHA,ELEITO,PSB,PARTIDO SOCIALISTA BRASILEIRO,2
ITAÍ,DEPUTADO ESTADUAL,GENTIL,ALEXANDRE MARIANO GENTIL,SUPLENTE,PV,PARTIDO VERDE,11
ITAÍ,DEPUTADO ESTADUAL,GIRIBONI,EDSON DE OLIVEIRA GIRIBONI,ELEITO,PV,PARTIDO VERDE,138
ITAÍ,DEPUTADO ESTADUAL,ADRIANA RODRIGUES,ADRIANA LARIO RAMALHO RODRIGUES,SUPLENTE,PV,PARTIDO VERDE,1
ITAÍ,DEPUTADO ESTADUAL,FELICIANO,FELICIANO NAHIMY FILHO,ELEITO,PV,PARTIDO VERDE,2
ITAÍ,DEPUTADO ESTADUAL,CLEVERSON SILVA,CLEVERSON ALVES DA SILVA,SUPLENTE,PV,PARTIDO VERDE,1
ITAÍ,DEPUTADO ESTADUAL,PROFESSORA EUGENIA,EUGENIA HERALDA DE BARROS SILVA,SUPLENTE,PV,PARTIDO VERDE,1
ITAÍ,DEPUTADO ESTADUAL,PAULINHO DO PV,PAULO CARDOSO FILHO,SUPLENTE,PV,PARTIDO VERDE,1
ITAÍ,DEPUTADO ESTADUAL,RICARDO CASTILHO,RICARDO RODRIGUES DE CASTILHO,SUPLENTE,PV,PARTIDO VERDE,2
ITAÍ,DEPUTADO ESTADUAL,ROSSINI,LUIZ CARLOS ROSSINI,SUPLENTE,PV,PARTIDO VERDE,23
ITAÍ,DEPUTADO ESTADUAL,RITA PASSOS,RITA DE CASSIA TRINCA PASSOS,ELEITO,PV,PARTIDO VERDE,8
ITAÍ,DEPUTADO ESTADUAL,PADRE AFONSO,JOSÉ AFONSO LOBATO,ELEITO,PV,PARTIDO VERDE,1
ITAÍ,DEPUTADO ESTADUAL,BRAZ ALBERTINI,BRAZ AGOSTINHO ALBERTINI,SUPLENTE,PV,PARTIDO VERDE,40
ITAÍ,DEPUTADO ESTADUAL,SERRA,CLOVIS SERRA JUNIOR,SUPLENTE,PV,PARTIDO VERDE,1
ITAÍ,DEPUTADO ESTADUAL,FERNANDO MARREY FERREIRA,FERNANDO MARREY FERREIRA,SUPLENTE,PV,PARTIDO VERDE,17
ITAÍ,DEPUTADO ESTADUAL,DR. ULYSSES,ULYSSES MARIO TASSINARI,MÉDIA,PV,PARTIDO VERDE,40
ITAÍ,DEPUTADO ESTADUAL,REINALDO ALGUZ,REINALDO DE SOUZA ALGUZ,ELEITO,PV,PARTIDO VERDE,61
ITAÍ,DEPUTADO ESTADUAL,REGINA GONÇALVES,MARIA REGINA GONÇALVES,SUPLENTE,PV,PARTIDO VERDE,3
ITAÍ,DEPUTADO ESTADUAL,PASTOR DILMO DOS SANTOS,DILMO DOS SANTOS,ELEITO,PV,PARTIDO VERDE,16
ITAÍ,DEPUTADO ESTADUAL,DENIS MARICATO,DENIS MAURILIO MARICATO,SUPLENTE,PV,PARTIDO VERDE,7
ITAÍ,DEPUTADO ESTADUAL,JESSE LOURES,JESSE LOURES DE MORAES,SUPLENTE,PV,PARTIDO VERDE,2
ITAÍ,DEPUTADO ESTADUAL,SÉRGIO CONTENTE,SERGIO CONTENTE,SUPLENTE,PV,PARTIDO VERDE,3
ITAÍ,DEPUTADO ESTADUAL,MARISA PORRETA,MARISA RODRIGUES CUSTODIO,SUPLENTE,PV,PARTIDO VERDE,6
ITAÍ,DEPUTADO ESTADUAL,PEDRO CAMELO,PEDRO CAMELO FILHO,SUPLENTE,PV,PARTIDO VERDE,1
ITAÍ,DEPUTADO ESTADUAL,HELIO RUBENS,HELIO RUBENS GONÇALVES FIGUEIREDO,SUPLENTE,PSDB,PSDB/DEM,63
ITAÍ,DEPUTADO ESTADUAL,UBIRAJARA GUIMARÃES,UBIRAJARA PEREIRA GUIMARÃES,SUPLENTE,PSDB,PSDB/DEM,20
ITAÍ,DEPUTADO ESTADUAL,WILLIAM FERRAZ,WILIAN FERRAZ,SUPLENTE,PSDB,PSDB/DEM,1
ITAÍ,DEPUTADO ESTADUAL,MARIA ZEFERINA BALDAIA,MARIA ZEFERINA RODRIGUES BALDAIA,SUPLENTE,PSDB,PSDB/DEM,2
ITAÍ,DEPUTADO ESTADUAL,EVANDRO LOSACCO,EVANDRO LUIZ LOSACCO,SUPLENTE,PSDB,PSDB/DEM,307
ITAÍ,DEPUTADO ESTADUAL,PEDRO TOBIAS,PEDRO TOBIAS,ELEITO,PSDB,PSDB/DEM,753
ITAÍ,DEPUTADO ESTADUAL,MILTON FLAVIO,MILTON FLAVIO MARQUES LAUTENSCHLAGER,SUPLENTE,PSDB,PSDB/DEM,666
ITAÍ,DEPUTADO ESTADUAL,GERALDO VINHOLI,GERALDO ANTONIO VINHOLI,SUPLENTE,PSDB,PSDB/DEM,5
ITAÍ,DEPUTADO ESTADUAL,MARIA LÚCIA AMARY,MARIA LÚCIA CARDOSO PINTO AMARY,MÉDIA,PSDB,PSDB/DEM,7
ITAÍ,DEPUTADO ESTADUAL,WELSON GASPARINI,WELSON GASPARINI,SUPLENTE,PSDB,PSDB/DEM,1
ITAÍ,DEPUTADO ESTADUAL,MAURO BRAGATO,MAURO BRAGATO,ELEITO,PSDB,PSDB/DEM,1
ITAÍ,DEPUTADO ESTADUAL,DR. RICARDO MARTINS,RICARDO MARTINS DE SÃO JOSÉ JUNIOR,SUPLENTE,PSDB,PSDB/DEM,2
ITAÍ,DEPUTADO ESTADUAL,JOÃO CARAMEZ,JOÃO CARLOS CARAMEZ,ELEITO,PSDB,PSDB/DEM,28
ITAÍ,DEPUTADO ESTADUAL,BRUNO COVAS,BRUNO COVAS LOPES,ELEITO,PSDB,PSDB/DEM,724
ITAÍ,DEPUTADO ESTADUAL,CLOVIS CHAVES,CLOVIS LUIZ CHAVES,SUPLENTE,PSDB,PSDB/DEM,7
ITAÍ,DEPUTADO ESTADUAL,JOSE BORANGA,JOSE AURELIO BORANGA,SUPLENTE,PSDB,PSDB/DEM,154
ITAÍ,DEPUTADO ESTADUAL,ADOLFO QUINTAS,ADOLFO QUINTAS GONÇALVES NETO,SUPLENTE,PSDB,PSDB/DEM,1
ITAÍ,DEPUTADO ESTADUAL,CARLÃO PIGNATARI,CARLOS EDUARDO PIGNATARI,ELEITO,PSDB,PSDB/DEM,1
ITAÍ,DEPUTADO ESTADUAL,DILADOR BORGES,DILADOR BORGES DAMASCENO,SUPLENTE,PSDB,PSDB/DEM,3
ITAÍ,DEPUTADO ESTADUAL,SAMUEL MOREIRA,SAMUEL MOREIRA DA SILVA JÚNIOR,ELEITO,PSDB,PSDB/DEM,33
ITAÍ,DEPUTADO ESTADUAL,ADMIR FERRO,ADMIR DONIZETI FERRO,SUPLENTE,PSDB,PSDB/DEM,3
ITAÍ,DEPUTADO ESTADUAL,CASSIO NAVARRO,CASSIO DE CASTRO NAVARRO,SUPLENTE,PSDB,PSDB/DEM,1
ITAÍ,DEPUTADO ESTADUAL,CARLOS BEZERRA JR.,CARLOS ALBERTO DE QUADROS BEZERRA JUNIOR,ELEITO,PSDB,PSDB/DEM,35
ITAÍ,DEPUTADO ESTADUAL,MAURICIO PINTERICH,MAURICIO DE OLIVEIRA PINTERICH,SUPLENTE,PSDB,PSDB/DEM,152
ITAÍ,DEPUTADO ESTADUAL,THIAGO LOBO,THIAGO ANTUNES CAVALCA REIS LOBO,SUPLENTE,PSDB,PSDB/DEM,1
ITAÍ,DEPUTADO ESTADUAL,CAUÊ MACRIS,CAUÊ CASEIRO MACRIS,MÉDIA,PSDB,PSDB/DEM,9
ITAÍ,DEPUTADO ESTADUAL,EDISON CANDIDO,EDISON APARECIDO CANDIDO,SUPLENTE,PSDB,PSDB/DEM,2
ITAÍ,DEPUTADO ESTADUAL,JOÃO SANZOVO,JOÃO SANZOVO NETO,SUPLENTE,PSDB,PSDB/DEM,2
ITAÍ,DEPUTADO ESTADUAL,ZÉ AILTON,JOSE AILTON RIBEIRO,SUPLENTE,PSDB,PSDB/DEM,40
ITAÍ,DEPUTADO ESTADUAL,VICTOR KOBAYASHI,VICTOR KOBAYASHI,SUPLENTE,PSDB,PSDB/DEM,2
ITAÍ,DEPUTADO ESTADUAL,BARROS MUNHOZ,JOSE ANTONIO BARROS MUNHOZ,ELEITO,PSDB,PSDB/DEM,6
ITAÍ,DEPUTADO ESTADUAL,CELSO GIGLIO,CELSO ANTONIO GIGLIO,ELEITO,PSDB,PSDB/DEM,17
ITAÍ,DEPUTADO ESTADUAL,FARID,JORGE FARID BOULOS BOU CHEBL,SUPLENTE,PSDB,PSDB/DEM,2
ITAÍ,DEPUTADO ESTADUAL,HELIO NISHIMOTO,HELIO NISHIMOTO,ELEITO,PSDB,PSDB/DEM,2
ITAÍ,DEPUTADO ESTADUAL,PAULO ALEXANDRE BARBOSA,PAULO ALEXANDRE PEREIRA BARBOSA,ELEITO,PSDB,PSDB/DEM,101
ITAÍ,DEPUTADO ESTADUAL,ARTUR ORSI,ARTUR CASSEB ORSI,SUPLENTE,PSDB,PSDB/DEM,3
ITAÍ,DEPUTADO ESTADUAL,GILSON BARRETO,GILSON ALMEIDA BARRETO,SUPLENTE,PSDB,PSDB/DEM,1
ITAÍ,DEPUTADO ESTADUAL,JOSE AUGUSTO,JOSE AUGUSTO DA SILVA RAMOS,SUPLENTE,PSDB,PSDB/DEM,50
ITAÍ,DEPUTADO ESTADUAL,ORLANDO MORANDO,ORLANDO MORANDO JUNIOR,ELEITO,PSDB,PSDB/DEM,2
ITAÍ,DEPUTADO ESTADUAL,FERNANDO CAPEZ,FERNANDO CAPEZ,ELEITO,PSDB,PSDB/DEM,24
ITAÍ,DEPUTADO ESTADUAL,MARCUS NAZARETH PEÇANHA,MARCUS NAZARETH PEÇANHA,SUPLENTE,PSDB,PSDB/DEM,4
ITAÍ,DEPUTADO ESTADUAL,JOSÉ LUIZ RIBEIRO,JOSÉ LUIZ RIBEIRO,SUPLENTE,PSDB,PSDB/DEM,1
ITAÍ,DEPUTADO ESTADUAL,MARCOS ZERBINI,MARCOS ANTONIO ZERBINI,ELEITO,PSDB,PSDB/DEM,1
ITAÍ,DEPUTADO ESTADUAL,MILTON DALLARI,JOSÉ MILTON DALLARI SOARES,SUPLENTE,PSDB,PSDB/DEM,2
ITAÍ,DEPUTADO ESTADUAL,DR RUBENS,RUBENS YOSHIDA,SUPLENTE,PSDB,PSDB/DEM,4
ITAÍ,DEPUTADO ESTADUAL,CLÁUDIO FURQUIM,CLÁUDIO SIMÕES FURQUIM LEITE JÚNIOR,SUPLENTE,PSDB,PSDB/DEM,1
ITAÍ,DEPUTADO ESTADUAL,JOÃO ALFREDO,JOÃO ALFREDO DE OLIVEIRA,SUPLENTE,PSOL,PARTIDO SOCIALISMO E LIBERDADE,28
ITAÍ,DEPUTADO ESTADUAL,RAUL MARCELO,RAUL MARCELO DE SOUZA,SUPLENTE,PSOL,PARTIDO SOCIALISMO E LIBERDADE,7
ITAÍ,DEPUTADO ESTADUAL,CARLOS GIANNAZI,CARLOS ALBERTO GIANNASI,ELEITO,PSOL,PARTIDO SOCIALISMO E LIBERDADE,14
ITAÍ,DEPUTADO ESTADUAL,LECI BRANDÃO,LECI BRANDAO DA SILVA,ELEITO,PC DO B,PARTIDO COMUNISTA DO BRASIL,2
ITAÍ,DEPUTADO ESTADUAL,DAVI RAMOS,DAVI GONÇALVES RAMOS,SUPLENTE,PC DO B,PARTIDO COMUNISTA DO BRASIL,1
ITAÍ,DEPUTADO ESTADUAL,CAJU,RICARDO ALVES DA SILVA,SUPLENTE,PC DO B,PARTIDO COMUNISTA DO BRASIL,1
ITAÍ,DEPUTADO ESTADUAL,PROFESSOR FLAVIO DELMANTO,FLAVIO DELMANTO,SUPLENTE,PC DO B,PARTIDO COMUNISTA DO BRASIL,2
ITAÍ,DEPUTADO ESTADUAL,TAVARES,JOSÉ WALTER TAVARES,SUPLENTE,PC DO B,PARTIDO COMUNISTA DO BRASIL,3
