CARAPICUÍBA,DEPUTADO FEDERAL,POPPI,JOÃO HENRIQUE GONÇALVES MARCICANO POPPI,SUPLENTE,PSDB,PSDB/DEM/PPS,3
CARAPICUÍBA,DEPUTADO FEDERAL,STANGARLINI,JOSE CARLOS STANGARLINI,SUPLENTE,PSDB,PSDB/DEM/PPS,91
CARAPICUÍBA,DEPUTADO FEDERAL,RAUL CHRISTIANO,RAUL CHRISTIANO DE OLIVEIRA SANCHEZ,SUPLENTE,PSDB,PSDB/DEM/PPS,18
CARAPICUÍBA,DEPUTADO FEDERAL,LOBBE NETO,ANTONIO ADOLPHO LOBBE NETO,SUPLENTE,PSDB,PSDB/DEM/PPS,12
CARAPICUÍBA,DEPUTADO FEDERAL,FELICIDADE,FELICIDADE LOPES PONTES,SUPLENTE,PSDB,PSDB/DEM/PPS,12
CARAPICUÍBA,DEPUTADO FEDERAL,MANOEL MARCOS (MANÉ),MANOEL MARCOS DE JESUS FERREIRA,SUPLENTE,PSDB,PSDB/DEM/PPS,5
CARAPICUÍBA,DEPUTADO FEDERAL,EMANUEL FERNANDES,EMANUEL FERNANDES,ELEITO,PSDB,PSDB/DEM/PPS,14
CARAPICUÍBA,DEPUTADO FEDERAL,MARA GABRILLI,MARA CRISTINA GABRILLI,ELEITO,PSDB,PSDB/DEM/PPS,172
CARAPICUÍBA,DEPUTADO FEDERAL,JOÃO PAULO FERRARESSO,JOÃO PAULO CORSETTI FERRARESSO,SUPLENTE,PSDB,PSDB/DEM/PPS,2
CARAPICUÍBA,DEPUTADO FEDERAL,MARCOS ARAUJO,MARCOS ROSA DE ARAUJO,SUPLENTE,PSDB,PSDB/DEM/PPS,7
CARAPICUÍBA,DEPUTADO FEDERAL,CARLOS BRAGA,CARLOS EDUARDO FARACO BRAGA,SUPLENTE,PSDB,PSDB/DEM/PPS,6
CARAPICUÍBA,DEPUTADO FEDERAL,LELIS DA ROCHA,LELIS DA ROCHA,SUPLENTE,PSDB,PSDB/DEM/PPS,5
CARAPICUÍBA,DEPUTADO FEDERAL,CARLOS ROBERTO,CARLOS ROBERTO DE CAMPOS,SUPLENTE,PSDB,PSDB/DEM/PPS,227
CARAPICUÍBA,DEPUTADO FEDERAL,DIB,WILLIAM DIB,ELEITO,PSDB,PSDB/DEM/PPS,33
CARAPICUÍBA,DEPUTADO FEDERAL,PANNUNZIO,ANTONIO CARLOS PANNUNZIO,SUPLENTE,PSDB,PSDB/DEM/PPS,5
CARAPICUÍBA,DEPUTADO FEDERAL,LUCIA SANTUCCI,LUCIA MARIA SANTUCCI,SUPLENTE,PSDB,PSDB/DEM/PPS,2
CARAPICUÍBA,DEPUTADO FEDERAL,ALBERTO MOURAO,ALBERTO PEREIRA MOURAO,SUPLENTE,PSDB,PSDB/DEM/PPS,32
CARAPICUÍBA,DEPUTADO FEDERAL,RENATO AMARY,RENATO FAUVEL AMARY,SUPLENTE,PSDB,PSDB/DEM/PPS,12
CARAPICUÍBA,DEPUTADO FEDERAL,DR ANDRE SACCO,ANDRE SACCO JUNIOR,SUPLENTE,PSDB,PSDB/DEM/PPS,335
CARAPICUÍBA,DEPUTADO FEDERAL,SILVIO TORRES,SILVIO FRANÇA TORRES,SUPLENTE,PSDB,PSDB/DEM/PPS,33
CARAPICUÍBA,DEPUTADO FEDERAL,TIRSO MEIRELLES,TIRSO DE SALLES MEIRELLES,SUPLENTE,PSDB,PSDB/DEM/PPS,12
CARAPICUÍBA,DEPUTADO FEDERAL,TERESA SERRANO,MARIA TERESA SERRANO AFONSO,SUPLENTE,PSDB,PSDB/DEM/PPS,7
CARAPICUÍBA,DEPUTADO FEDERAL,EDSON APARECIDO,EDSON APARECIDO DOS SANTOS,ELEITO,PSDB,PSDB/DEM/PPS,150
CARAPICUÍBA,DEPUTADO FEDERAL,RICARDO MONTORO,JOSE RICARDO FRANCO MONTORO,SUPLENTE,PSDB,PSDB/DEM/PPS,35
CARAPICUÍBA,DEPUTADO FEDERAL,LUIZ FERNANDO MACHADO,LUIZ FERNANDO ARANTES MACHADO,ELEITO,PSDB,PSDB/DEM/PPS,39
CARAPICUÍBA,DEPUTADO FEDERAL,DR. MARCELO,MARCELO CHEHADE,SUPLENTE,PSDB,PSDB/DEM/PPS,7
CARAPICUÍBA,DEPUTADO FEDERAL,VANDERLEI MACRIS,VANDERLEI MACRIS,SUPLENTE,PSDB,PSDB/DEM/PPS,30
CARAPICUÍBA,DEPUTADO FEDERAL,DUARTE NOGUEIRA,ANTONIO DUARTE NOGUEIRA JUNIOR,ELEITO,PSDB,PSDB/DEM/PPS,24
CARAPICUÍBA,DEPUTADO FEDERAL,JULIO SEMEGHINI,JULIO FRACISCO SEMEGHINI NETO,ELEITO,PSDB,PSDB/DEM/PPS,40
CARAPICUÍBA,DEPUTADO FEDERAL,RAFAEL ABUD,RAFAEL ANGELO ABUD,SUPLENTE,PSDB,PSDB/DEM/PPS,8
CARAPICUÍBA,DEPUTADO FEDERAL,GIVALDO VIEIRA,GIVALDO RODRIGUES VIEIRA,SUPLENTE,PSDB,PSDB/DEM/PPS,2
CARAPICUÍBA,DEPUTADO FEDERAL,TRIPOLI,JOSÉ RICARDO ALVARENGA TRIPOLI,ELEITO,PSDB,PSDB/DEM/PPS,187
CARAPICUÍBA,DEPUTADO FEDERAL,FERNANDO FUAD CHUCRE,FERNANDO BARRANCOS CHUCRE,SUPLENTE,PSDB,PSDB/DEM/PPS,6849
CARAPICUÍBA,DEPUTADO FEDERAL,VAZ DE LIMA,JOSÉ CARLOS VAZ DE LIMA,ELEITO,PSDB,PSDB/DEM/PPS,831
CARAPICUÍBA,DEPUTADO FEDERAL,ALEMÃO DA SÁUDE,CLAUDEMIR SERENO,SUPLENTE,PSDB,PSDB/DEM/PPS,6
CARAPICUÍBA,DEPUTADO FEDERAL,TIÃO,SEBASTIÃO FERRES ARSENE,SUPLENTE,PSDB,PSDB/DEM/PPS,2
CARAPICUÍBA,DEPUTADO FEDERAL,WALTER FELDMAN,WALTER MEYER FELDMAN,SUPLENTE,PSDB,PSDB/DEM/PPS,49
CARAPICUÍBA,DEPUTADO FEDERAL,THAME,ANTONIO CARLOS DE MENDES THAME,ELEITO,PSDB,PSDB/DEM/PPS,15
CARAPICUÍBA,DEPUTADO FEDERAL,ARNALDO MADEIRA,ARNALDO DE ABREU MADEIRA,SUPLENTE,PSDB,PSDB/DEM/PPS,32
CARAPICUÍBA,DEPUTADO FEDERAL,BRUNA FURLAN,BRUNA DIAS FURLAN,ELEITO,PSDB,PSDB/DEM/PPS,7942
CARAPICUÍBA,DEPUTADO FEDERAL,JOSÉ ANIBAL,JOSÉ ANIBAL PERES DE PONTES,ELEITO,PSDB,PSDB/DEM/PPS,178
CARAPICUÍBA,DEPUTADO FEDERAL,NELSON BUGALHO,NELSON ROBERTO BUGALHO,SUPLENTE,PSDB,PSDB/DEM/PPS,23
CARAPICUÍBA,DEPUTADO FEDERAL,GILBERTO BORJA,GILBERTO BORJA PINTO,SUPLENTE,PSDB,PSDB/DEM/PPS,12
CARAPICUÍBA,DEPUTADO FEDERAL,PROFESSOR CLOVIS PINTO,CLOVIS DA SILVA PINTO,SUPLENTE,PSDB,PSDB/DEM/PPS,2
CARAPICUÍBA,DEPUTADO FEDERAL,SIRINEU BARBOSA,JOSÉ SIRINEU FILGUEIRAS BARBOSA,SUPLENTE,PSDB,PSDB/DEM/PPS,9
CARAPICUÍBA,DEPUTADO FEDERAL,JAMIL PRUDENCIANO,JAMIL PAULO PRUDENCIANO,SUPLENTE,PSOL,PARTIDO SOCIALISMO E LIBERDADE,5
CARAPICUÍBA,DEPUTADO FEDERAL,CREUSA LIMA,CREUSA LIMA DA SILVA,SUPLENTE,PSOL,PARTIDO SOCIALISMO E LIBERDADE,1
CARAPICUÍBA,DEPUTADO FEDERAL,PROFª Mª DOLORES,MARIA DOLORES FORTES ALVES,SUPLENTE,PSOL,PARTIDO SOCIALISMO E LIBERDADE,1
CARAPICUÍBA,DEPUTADO FEDERAL,PROFESSOR SAULO CARVALHO,SAULO RODRIGUES DE CARVALHO,SUPLENTE,PSOL,PARTIDO SOCIALISMO E LIBERDADE,1
CARAPICUÍBA,DEPUTADO FEDERAL,CABRAL DOS QUIMICOS,WELLINGTON LUIZ CABRAL,SUPLENTE,PSOL,PARTIDO SOCIALISMO E LIBERDADE,1
CARAPICUÍBA,DEPUTADO FEDERAL,ANIVALDO,ANIVALDO LAURINDO FERREIRA,SUPLENTE,PSOL,PARTIDO SOCIALISMO E LIBERDADE,2
CARAPICUÍBA,DEPUTADO FEDERAL,ADILSON RODRIGUES,ADILSON RODRIGUES SANTOS,SUPLENTE,PSOL,PARTIDO SOCIALISMO E LIBERDADE,2
CARAPICUÍBA,DEPUTADO FEDERAL,JOAO SILVERIO,JOAO SILVERIO DE CARVALHO NETO,SUPLENTE,PSOL,PARTIDO SOCIALISMO E LIBERDADE,2
CARAPICUÍBA,DEPUTADO FEDERAL,PROFESSOR ROBERTO CARLOS,ROBERTO CARLOS DE SOUZA,SUPLENTE,PSOL,PARTIDO SOCIALISMO E LIBERDADE,1
CARAPICUÍBA,DEPUTADO FEDERAL,AKIKO AKI,AKIKO AKIYAMA,SUPLENTE,PSOL,PARTIDO SOCIALISMO E LIBERDADE,4
CARAPICUÍBA,DEPUTADO FEDERAL,DRA. JÚLIA,JÚLIA AZZI COLLET E SILVA,SUPLENTE,PSOL,PARTIDO SOCIALISMO E LIBERDADE,5
CARAPICUÍBA,DEPUTADO FEDERAL,ANDRE DO J. CÉLIO,ANDRE MORALE,SUPLENTE,PSOL,PARTIDO SOCIALISMO E LIBERDADE,1
CARAPICUÍBA,DEPUTADO FEDERAL,ARIADNE LIBERATO,ARIADNE LIBERATO ROSA DE OLIVEIRA,SUPLENTE,PSOL,PARTIDO SOCIALISMO E LIBERDADE,4
CARAPICUÍBA,DEPUTADO FEDERAL,FERNANDO BORGES,FERNANDO BORGES CORREIA FILHO,SUPLENTE,PSOL,PARTIDO SOCIALISMO E LIBERDADE,1
CARAPICUÍBA,DEPUTADO FEDERAL,PROFESSORA PATRICIA,PATRICIA ANDREIA CARRETERO,SUPLENTE,PSOL,PARTIDO SOCIALISMO E LIBERDADE,1
CARAPICUÍBA,DEPUTADO FEDERAL,RODRIGO PAIXAO,RODRIGO JOSE PAIXAO,SUPLENTE,PSOL,PARTIDO SOCIALISMO E LIBERDADE,3
CARAPICUÍBA,DEPUTADO FEDERAL,NELSON OLIVEIRA,NELSON OLIVEIRA DE SOUZA,SUPLENTE,PSOL,PARTIDO SOCIALISMO E LIBERDADE,1
CARAPICUÍBA,DEPUTADO FEDERAL,OSMAR VILELA,OSMAR VILELA DOS SANTOS,SUPLENTE,PSOL,PARTIDO SOCIALISMO E LIBERDADE,1
CARAPICUÍBA,DEPUTADO FEDERAL,KAREN MARTINS,KAREN CRISTIN MARTINS,SUPLENTE,PSOL,PARTIDO SOCIALISMO E LIBERDADE,1
CARAPICUÍBA,DEPUTADO FEDERAL,IVAN VALENTE,IVAN VALENTE,ELEITO,PSOL,PARTIDO SOCIALISMO E LIBERDADE,626
CARAPICUÍBA,DEPUTADO FEDERAL,ADEMIR É FEDERAL,JOSE ADEMIR DA SILVA,SUPLENTE,PSOL,PARTIDO SOCIALISMO E LIBERDADE,3
CARAPICUÍBA,DEPUTADO FEDERAL,PROFESSORA MÁRCIA TAVARES,MÁRCIA TAVARES DO NASCIMENTO,SUPLENTE,PSOL,PARTIDO SOCIALISMO E LIBERDADE,20
CARAPICUÍBA,DEPUTADO FEDERAL,RICARDO ALVAREZ,RICARDO ALVAREZ,SUPLENTE,PSOL,PARTIDO SOCIALISMO E LIBERDADE,1
CARAPICUÍBA,DEPUTADO FEDERAL,MARZENI,MARZENI PEREIRA DA SILVA,SUPLENTE,PSOL,PARTIDO SOCIALISMO E LIBERDADE,1
CARAPICUÍBA,DEPUTADO FEDERAL,PROFESSORA RITA,RITA LEITE DINIZ,SUPLENTE,PSOL,PARTIDO SOCIALISMO E LIBERDADE,1
CARAPICUÍBA,DEPUTADO FEDERAL,EDSON MACIEL,EDSON GENARO MACIEL,SUPLENTE,PSOL,PARTIDO SOCIALISMO E LIBERDADE,1
CARAPICUÍBA,DEPUTADO FEDERAL,MARIO CONCEIÇÃO,MARIO CONCEIÇÃO,SUPLENTE,PSOL,PARTIDO SOCIALISMO E LIBERDADE,1
CARAPICUÍBA,DEPUTADO FEDERAL,ROSELI QUEIROZ,ROSELI QUEIROZ ALMEIDA,SUPLENTE,PSOL,PARTIDO SOCIALISMO E LIBERDADE,2
CARAPICUÍBA,DEPUTADO FEDERAL,ANIZIO BATISTA,ANIZIO BATISTA DE OLIVEIRA,SUPLENTE,PSOL,PARTIDO SOCIALISMO E LIBERDADE,1
CARAPICUÍBA,DEPUTADO FEDERAL,HELTON BASTOS,HELTON SARAGOR DE SOUZA,SUPLENTE,PSOL,PARTIDO SOCIALISMO E LIBERDADE,62
CARAPICUÍBA,DEPUTADO FEDERAL,MARIANA CONTI,MARIANA CONTI TAKAHASHI,SUPLENTE,PSOL,PARTIDO SOCIALISMO E LIBERDADE,5
CARAPICUÍBA,DEPUTADO FEDERAL,PROFESSOR DANIEL,DANIEL WELBER GONÇALVES PEREZ,SUPLENTE,PSOL,PARTIDO SOCIALISMO E LIBERDADE,7
CARAPICUÍBA,DEPUTADO FEDERAL,SERGIO CABEÇA,SERGIO DOS SANTOS CABEÇA,SUPLENTE,PSOL,PARTIDO SOCIALISMO E LIBERDADE,1
CARAPICUÍBA,DEPUTADO FEDERAL,DENILCE CRUZ,DENILCE CRUZ PAULIQUEVIS FERNANDES,SUPLENTE,PSOL,PARTIDO SOCIALISMO E LIBERDADE,1
CARAPICUÍBA,DEPUTADO FEDERAL,MATEUS NOVAES,MATEUS NOVAES DIAS,SUPLENTE,PSOL,PARTIDO SOCIALISMO E LIBERDADE,2
CARAPICUÍBA,DEPUTADO FEDERAL,NEIDE REGES,NEIDE REGES LIMA,SUPLENTE,PSOL,PARTIDO SOCIALISMO E LIBERDADE,5
CARAPICUÍBA,DEPUTADO FEDERAL,DR. ABELHA,CARLOS FERNANDO LOPES ABELHA,SUPLENTE,PC DO B,JUNTOS POR SÃO PAULO,16
CARAPICUÍBA,DEPUTADO FEDERAL,GUSTAVO PETTA,GUSTAVO LEMOS PETTA,SUPLENTE,PC DO B,JUNTOS POR SÃO PAULO,163
CARAPICUÍBA,DEPUTADO FEDERAL,SIDNEI MARTINS,SIDNEI ALVES MARTINS,SUPLENTE,PC DO B,JUNTOS POR SÃO PAULO,12
CARAPICUÍBA,DEPUTADO FEDERAL,JUNIOR APRILLANTI,JOSÉ ROBERTO APRILLANTI JUNIOR,SUPLENTE,PC DO B,JUNTOS POR SÃO PAULO,103
CARAPICUÍBA,DEPUTADO FEDERAL,CÉLIO TURINO,CÉLIO ROBERTO TURINO DE MIRANDA,SUPLENTE,PC DO B,JUNTOS POR SÃO PAULO,7
CARAPICUÍBA,DEPUTADO FEDERAL,DR. PAULO POLO,PAULO ROBERTO POLO,SUPLENTE,PC DO B,JUNTOS POR SÃO PAULO,3
CARAPICUÍBA,DEPUTADO FEDERAL,BEZÃO,ANTONIO ALCEU BEZÃO,SUPLENTE,PC DO B,JUNTOS POR SÃO PAULO,3
CARAPICUÍBA,DEPUTADO FEDERAL,BENEH SANTOS,BENEDITO HERNELIO DOS SANTOS,SUPLENTE,PC DO B,JUNTOS POR SÃO PAULO,1
CARAPICUÍBA,DEPUTADO FEDERAL,PADRE PEDRO,PEDRO CÉLIO DAUDT,SUPLENTE,PC DO B,JUNTOS POR SÃO PAULO,1
CARAPICUÍBA,DEPUTADO FEDERAL,ALDO REBELO,JOSÉ ALDO REBELO FIGUEIREDO,ELEITO,PC DO B,JUNTOS POR SÃO PAULO,290
CARAPICUÍBA,DEPUTADO FEDERAL,DELEGADO PROTÓGENES,PROTÓGENES PINHEIRO DE QUEIROZ,MÉDIA,PC DO B,JUNTOS POR SÃO PAULO,334
CARAPICUÍBA,DEPUTADO FEDERAL,JOAO ARAUJO,JOAO LUIS ARAUJO NETO,SUPLENTE,PT DO B,JUNTOS POR SÃO PAULO,239
CARAPICUÍBA,DEPUTADO FEDERAL,DR MARCAO DA MANCHA,MARCO ANTONIO NOTARI,SUPLENTE,PT DO B,JUNTOS POR SÃO PAULO,20
CARAPICUÍBA,DEPUTADO FEDERAL,COCADINHA CRUZ,GERALDO FERREIRA DA CRUZ,SUPLENTE,PT DO B,JUNTOS POR SÃO PAULO,27
CARAPICUÍBA,DEPUTADO FEDERAL,ALBINO MATOS GOMES,ALBINO MATOS GOMES,SUPLENTE,PT DO B,JUNTOS POR SÃO PAULO,1
CARAPICUÍBA,DEPUTADO ESTADUAL,GERSON DEZEMBRO,GERSON DONIZETI DEZEMBRO,SUPLENTE,PRB,SOMOS MAIS SÃO PAULO,3
CARAPICUÍBA,DEPUTADO ESTADUAL,VALDIR OLIVEIRA,VALDIR OLIVEIRA SANTOS,SUPLENTE,PRB,SOMOS MAIS SÃO PAULO,1
CARAPICUÍBA,DEPUTADO ESTADUAL,CORINTHIANO,RODRIGO GHIRALDELLI,SUPLENTE,PRB,SOMOS MAIS SÃO PAULO,1
CARAPICUÍBA,DEPUTADO ESTADUAL,GILMACI SANTOS,GILMACI DOS SANTOS BARBOSA,ELEITO,PRB,SOMOS MAIS SÃO PAULO,786
CARAPICUÍBA,DEPUTADO ESTADUAL,DR. MARCELO MACHADO,MARCELO PINTO MACHADO,SUPLENTE,PRB,SOMOS MAIS SÃO PAULO,1
CARAPICUÍBA,DEPUTADO ESTADUAL,SEBASTIÃO SANTOS,SEBASTIÃO DOS SANTOS FILHO,ELEITO,PRB,SOMOS MAIS SÃO PAULO,3
CARAPICUÍBA,DEPUTADO ESTADUAL,HAVANIR,HAVANIR TAVARES DE ALMEIDA NIMTZ,SUPLENTE,PRB,SOMOS MAIS SÃO PAULO,37
CARAPICUÍBA,DEPUTADO ESTADUAL,ITHAMAR DABRIUS,ITHAMAR DABRIUS JUNIOR,SUPLENTE,PRB,SOMOS MAIS SÃO PAULO,16
CARAPICUÍBA,DEPUTADO ESTADUAL,RICARDO SARAVALLI,RICARDO SARAVALLI,SUPLENTE,PP,PARTIDO PROGRESSISTA,2
CARAPICUÍBA,DEPUTADO ESTADUAL,ALMEIDA,CLESIO VOLDENEI DE OLIVEIRA ALMEIDA,SUPLENTE,PP,PARTIDO PROGRESSISTA,3
CARAPICUÍBA,DEPUTADO ESTADUAL,MALEK,ROBSON MALEK,SUPLENTE,PP,PARTIDO PROGRESSISTA,8
CARAPICUÍBA,DEPUTADO ESTADUAL,DR. ARY MACEDO,ARY AUGUSTO REIS DE MACEDO,SUPLENTE,PP,PARTIDO PROGRESSISTA,1
CARAPICUÍBA,DEPUTADO ESTADUAL,DR. FERRUCIO,FERRUCIO DALL AGLIO,SUPLENTE,PP,PARTIDO PROGRESSISTA,36
CARAPICUÍBA,DEPUTADO ESTADUAL,MOLINA NETO,MAURICIO MOLINA NETO,SUPLENTE,PP,PARTIDO PROGRESSISTA,1
CARAPICUÍBA,DEPUTADO ESTADUAL,ADEILDO NOGUEIRA,ADEILDO NOGUEIRA DA SILVA,SUPLENTE,PP,PARTIDO PROGRESSISTA,2
CARAPICUÍBA,DEPUTADO ESTADUAL,BARROS PIAUÍ,JUVENAL DE SOUSA BARROS,SUPLENTE,PP,PARTIDO PROGRESSISTA,4
CARAPICUÍBA,DEPUTADO ESTADUAL,MARCELO DE BARROS,MARCELO DE BARROS MARTINS,SUPLENTE,PP,PARTIDO PROGRESSISTA,1
CARAPICUÍBA,DEPUTADO ESTADUAL,QUATI,ANTONIO DOS SANTOS BARBOSA,SUPLENTE,PP,PARTIDO PROGRESSISTA,1
CARAPICUÍBA,DEPUTADO ESTADUAL,CURIATI,ANTONIO SALIM CURIATI,ELEITO,PP,PARTIDO PROGRESSISTA,112
CARAPICUÍBA,DEPUTADO ESTADUAL,CIMATTI NETO,MILTON CIMATTI NETO,SUPLENTE,PP,PARTIDO PROGRESSISTA,2
CARAPICUÍBA,DEPUTADO ESTADUAL,MIGUEL ROMERO JR,MIGUEL ROMERO JUNIOR,SUPLENTE,PP,PARTIDO PROGRESSISTA,1
CARAPICUÍBA,DEPUTADO ESTADUAL,DR. SERGIO CHEBEL,SERGIO CABRAL CHEBEL,SUPLENTE,PP,PARTIDO PROGRESSISTA,3
CARAPICUÍBA,DEPUTADO ESTADUAL,JOSE MENINO NETO,JOSE MENINO NETO,SUPLENTE,PP,PARTIDO PROGRESSISTA,1
CARAPICUÍBA,DEPUTADO ESTADUAL,SARGENTO REIS,MARIO JOSÉ DOS REIS,SUPLENTE,PP,PARTIDO PROGRESSISTA,3
CARAPICUÍBA,DEPUTADO ESTADUAL,PEBA,JORGE FERREIRA LIMA,SUPLENTE,PP,PARTIDO PROGRESSISTA,2
CARAPICUÍBA,DEPUTADO ESTADUAL,SIMONY,SIMONY BENELLI GALASSO,SUPLENTE,PP,PARTIDO PROGRESSISTA,8
CARAPICUÍBA,DEPUTADO ESTADUAL,MAJOR ROLIM,JOÃO PAULO ROLIM MARQUES,SUPLENTE,PP,PARTIDO PROGRESSISTA,2
CARAPICUÍBA,DEPUTADO ESTADUAL,RAIMUNDO DA AÇÃO,RAIMUNDO SILISTRO DE OLIVEIRA,SUPLENTE,PP,PARTIDO PROGRESSISTA,1
CARAPICUÍBA,DEPUTADO ESTADUAL,RIBEIRÃO,ANTONIO ALVES DE SOUZA,SUPLENTE,PP,PARTIDO PROGRESSISTA,1
CARAPICUÍBA,DEPUTADO ESTADUAL,MARLENE LUCAS,MARLENE LUCAS PEREIRA,SUPLENTE,PP,PARTIDO PROGRESSISTA,1
CARAPICUÍBA,DEPUTADO ESTADUAL,DIOGO TICLY,DIOGO GAZZE TICLY,SUPLENTE,PP,PARTIDO PROGRESSISTA,13
CARAPICUÍBA,DEPUTADO ESTADUAL,JOSE DIAS,JOSE DIAS DA SILVA,SUPLENTE,PP,PARTIDO PROGRESSISTA,3
CARAPICUÍBA,DEPUTADO ESTADUAL,FIALA,FRANCISCO TOMAS FIALA,SUPLENTE,PP,PARTIDO PROGRESSISTA,2
CARAPICUÍBA,DEPUTADO ESTADUAL,JOÃO ARAUJO,JOÃO ANTONIO DE ARAUJO,SUPLENTE,PP,PARTIDO PROGRESSISTA,1
CARAPICUÍBA,DEPUTADO ESTADUAL,DR. IRINEU,IRINEU CARDOSO DOS SANTOS,SUPLENTE,PP,PARTIDO PROGRESSISTA,2
CARAPICUÍBA,DEPUTADO ESTADUAL,FARIA JR,WALDEMAR ALVES FARIA JUNIOR,SUPLENTE,PP,PARTIDO PROGRESSISTA,61
CARAPICUÍBA,DEPUTADO ESTADUAL,MARIA CLEMENTINA,MARIA CLEMENTINO DE SOUSA,SUPLENTE,PP,PARTIDO PROGRESSISTA,4
CARAPICUÍBA,DEPUTADO ESTADUAL,PASTOR NATANAEL SILVA,NATANAEL ALVES,SUPLENTE,PP,PARTIDO PROGRESSISTA,1
CARAPICUÍBA,DEPUTADO ESTADUAL,LAZARO TAVARES CUNHA,LAZARO TAVARES DA CUNHA,SUPLENTE,PP,PARTIDO PROGRESSISTA,1
CARAPICUÍBA,DEPUTADO ESTADUAL,VALDIR MARIN,VALDIR SILVEIRA MARIN,SUPLENTE,PP,PARTIDO PROGRESSISTA,3
CARAPICUÍBA,DEPUTADO ESTADUAL,ELIAS CAMARGO,ELIAS CAMARGO,SUPLENTE,PP,PARTIDO PROGRESSISTA,1
CARAPICUÍBA,DEPUTADO ESTADUAL,RAFA ZIMBALDI,RAFAEL FERNANDO ZIMBALDI,SUPLENTE,PP,PARTIDO PROGRESSISTA,25
CARAPICUÍBA,DEPUTADO ESTADUAL,ANDRÉ RAFAEL,ANDRE LUIZ DOS SANTOS,SUPLENTE,PP,PARTIDO PROGRESSISTA,1
CARAPICUÍBA,DEPUTADO ESTADUAL,EDINHO,EDSON JOAQUIM DE FREITAS,SUPLENTE,PP,PARTIDO PROGRESSISTA,5
CARAPICUÍBA,DEPUTADO ESTADUAL,NELSON MANDELA,ADOLPHINO ROSARIO CRUZ,SUPLENTE,PP,PARTIDO PROGRESSISTA,1
CARAPICUÍBA,DEPUTADO ESTADUAL,PROFESSORA CLAUDIA OLIVEIRA,CLAUDIA OLIVEIRA RODRIGUES SANTOS,SUPLENTE,PP,PARTIDO PROGRESSISTA,1
CARAPICUÍBA,DEPUTADO ESTADUAL,KAKA SEABRA,CARLOS ANTONIO SEABRA,SUPLENTE,PP,PARTIDO PROGRESSISTA,4
CARAPICUÍBA,DEPUTADO ESTADUAL,RUSSOMANNO,MOZART ABAETE PERUIBE RUSSOMANNO,SUPLENTE,PP,PARTIDO PROGRESSISTA,19
CARAPICUÍBA,DEPUTADO ESTADUAL,PEREIRA METALURGICO,JOSÉ PEREIRA DOS SANTOS,SUPLENTE,PDT,PARTIDO DEMOCRÁTICO TRABALHISTA,9
CARAPICUÍBA,DEPUTADO ESTADUAL,DR ABDALA,ALEXANDRE ABDALA JUNIOR,SUPLENTE,PDT,PARTIDO DEMOCRÁTICO TRABALHISTA,3
CARAPICUÍBA,DEPUTADO ESTADUAL,CASSOLA,JAIR CASSOLA,SUPLENTE,PDT,PARTIDO DEMOCRÁTICO TRABALHISTA,2
CARAPICUÍBA,DEPUTADO ESTADUAL,LUIZ ANTONIO PIRACAIA,LUIZ ANTONIO DA SILVA SOUZA,SUPLENTE,PDT,PARTIDO DEMOCRÁTICO TRABALHISTA,6
CARAPICUÍBA,DEPUTADO ESTADUAL,LUIS YABIKU,LUIS MOKITI YABIKU,SUPLENTE,PDT,PARTIDO DEMOCRÁTICO TRABALHISTA,5
CARAPICUÍBA,DEPUTADO ESTADUAL,CLODOALDO AZEVEDO,CLODOALDO PEREIRA AZEVEDO,SUPLENTE,PDT,PARTIDO DEMOCRÁTICO TRABALHISTA,1
CARAPICUÍBA,DEPUTADO ESTADUAL,DR JUSTINO,LUIZ CARLOS JUSTINO,SUPLENTE,PDT,PARTIDO DEMOCRÁTICO TRABALHISTA,8
CARAPICUÍBA,DEPUTADO ESTADUAL,DINEI,CLAUDINEI ALEXANDRE PIRES,SUPLENTE,PDT,PARTIDO DEMOCRÁTICO TRABALHISTA,69
CARAPICUÍBA,DEPUTADO ESTADUAL,FRANCISCO JUNIOR,FRANCISCO PEREIRA COSTA JUNIOR,SUPLENTE,PDT,PARTIDO DEMOCRÁTICO TRABALHISTA,2
CARAPICUÍBA,DEPUTADO ESTADUAL,GILBERTO DOURADO,GILBERTO RODRIGUES DOURADO,SUPLENTE,PDT,PARTIDO DEMOCRÁTICO TRABALHISTA,10
CARAPICUÍBA,DEPUTADO ESTADUAL,ROGERIO NOGUEIRA,ROGERIO NOGUEIRA LOPES CRUZ,ELEITO,PDT,PARTIDO DEMOCRÁTICO TRABALHISTA,6
CARAPICUÍBA,DEPUTADO ESTADUAL,CAPITAO LUCAS,AURO LUCAS,SUPLENTE,PDT,PARTIDO DEMOCRÁTICO TRABALHISTA,7
CARAPICUÍBA,DEPUTADO ESTADUAL,LUIZ ARRAES,LUIZ DE SOUZA ARRAES,SUPLENTE,PDT,PARTIDO DEMOCRÁTICO TRABALHISTA,34
CARAPICUÍBA,DEPUTADO ESTADUAL,JOSE BITTENCOURT,JOSE DOMINGOS BITTENCOURT,ELEITO,PDT,PARTIDO DEMOCRÁTICO TRABALHISTA,159
CARAPICUÍBA,DEPUTADO ESTADUAL,PASTOR MAURO FERREIRA,MAURO FERREIRA DE SOUZA,SUPLENTE,PDT,PARTIDO DEMOCRÁTICO TRABALHISTA,6
CARAPICUÍBA,DEPUTADO ESTADUAL,MAJOR OLIMPIO,SERGIO OLIMPIO GOMES,ELEITO,PDT,PARTIDO DEMOCRÁTICO TRABALHISTA,350
CARAPICUÍBA,DEPUTADO ESTADUAL,CARLAO MOTORISTA,ANTONIO CARLOS RIBEIRO,SUPLENTE,PDT,PARTIDO DEMOCRÁTICO TRABALHISTA,1
CARAPICUÍBA,DEPUTADO ESTADUAL,MARCOS BERNARDELLI,MARCOS JOSÉ BERNARDELLI,SUPLENTE,PDT,PARTIDO DEMOCRÁTICO TRABALHISTA,2
CARAPICUÍBA,DEPUTADO ESTADUAL,JOCA VASCONCELOS,JOAO CARLOS MONTE CLARO VASCONCELOS,SUPLENTE,PDT,PARTIDO DEMOCRÁTICO TRABALHISTA,9
CARAPICUÍBA,DEPUTADO ESTADUAL,BRIZOLA,KARIUM DE ALMEIDA BRIZOLLA,SUPLENTE,PDT,PARTIDO DEMOCRÁTICO TRABALHISTA,1
CARAPICUÍBA,DEPUTADO ESTADUAL,AMON VIOLEIRO,AMOMM HEBROM DA HORA DE DEUS SOUZA,SUPLENTE,PDT,PARTIDO DEMOCRÁTICO TRABALHISTA,4
CARAPICUÍBA,DEPUTADO ESTADUAL,CARLOS HERNANDES,JOSÉ CARLOS SANCHES HERNANDES,SUPLENTE,PDT,PARTIDO DEMOCRÁTICO TRABALHISTA,2
CARAPICUÍBA,DEPUTADO ESTADUAL,NICOLACI,RONALD LUIZ NICOLACI FINCATTI,SUPLENTE,PDT,PARTIDO DEMOCRÁTICO TRABALHISTA,1
CARAPICUÍBA,DEPUTADO ESTADUAL,BRUZAROSCO,APARECIDO DE JESUS BRUZAROSCO,SUPLENTE,PDT,PARTIDO DEMOCRÁTICO TRABALHISTA,9
CARAPICUÍBA,DEPUTADO ESTADUAL,EMERSON LEAL,EMERSON PIRES LEAL,SUPLENTE,PDT,PARTIDO DEMOCRÁTICO TRABALHISTA,1
CARAPICUÍBA,DEPUTADO ESTADUAL,RAFAEL SILVA,RAFAEL ANTONIO DA SILVA,ELEITO,PDT,PARTIDO DEMOCRÁTICO TRABALHISTA,32
CARAPICUÍBA,DEPUTADO ESTADUAL,MAURICIO SIQUEIRA,MAURICIO SIQUEIRA,SUPLENTE,PDT,PARTIDO DEMOCRÁTICO TRABALHISTA,5
CARAPICUÍBA,DEPUTADO ESTADUAL,NICANOR,NICANOR JOSE DA SILVA,SUPLENTE,PDT,PARTIDO DEMOCRÁTICO TRABALHISTA,1
CARAPICUÍBA,DEPUTADO ESTADUAL,TOLOI,LUIZ CARLOS TOLOI JUNIOR,SUPLENTE,PDT,PARTIDO DEMOCRÁTICO TRABALHISTA,22
CARAPICUÍBA,DEPUTADO ESTADUAL,TADEU MORAIS,TADEU MORAIS DE SOUSA,SUPLENTE,PDT,PARTIDO DEMOCRÁTICO TRABALHISTA,2232
CARAPICUÍBA,DEPUTADO ESTADUAL,PROFESSOR VENANCIO,ANTONIO CARLOS VENANCIO,SUPLENTE,PDT,PARTIDO DEMOCRÁTICO TRABALHISTA,2
CARAPICUÍBA,DEPUTADO ESTADUAL,LEONICE DA PAZ,LEONICE ALVES DA PAZ,SUPLENTE,PDT,PARTIDO DEMOCRÁTICO TRABALHISTA,3
CARAPICUÍBA,DEPUTADO ESTADUAL,HELIO BASTOS,HELIO DE ALMEIDA BASTOS,SUPLENTE,PDT,PARTIDO DEMOCRÁTICO TRABALHISTA,3
CARAPICUÍBA,DEPUTADO ESTADUAL,MYRYAM ATHIE,MIRIAM ATHIE,SUPLENTE,PDT,PARTIDO DEMOCRÁTICO TRABALHISTA,10
CARAPICUÍBA,DEPUTADO ESTADUAL,WENDEL ALVES,WENDEL ALVES DE SOUSA,SUPLENTE,PDT,PARTIDO DEMOCRÁTICO TRABALHISTA,1
CARAPICUÍBA,DEPUTADO ESTADUAL,CONSTANCIA FELIX,CONSTANCIA BERBERT DUTRA DA SILVA,SUPLENTE,PDT,PARTIDO DEMOCRÁTICO TRABALHISTA,3
CARAPICUÍBA,DEPUTADO ESTADUAL,LUCINHA DA NOCA,ANA LUCIA BARBOSA DOS SANTOS,SUPLENTE,PDT,PARTIDO DEMOCRÁTICO TRABALHISTA,1
CARAPICUÍBA,DEPUTADO ESTADUAL,RICARDO BORGES,RICARDO BRANCO BORGES,SUPLENTE,PDT,PARTIDO DEMOCRÁTICO TRABALHISTA,23
CARAPICUÍBA,DEPUTADO ESTADUAL,SILAS FARIA,SILAS FARIA DE SOUZA,SUPLENTE,PDT,PARTIDO DEMOCRÁTICO TRABALHISTA,1
CARAPICUÍBA,DEPUTADO ESTADUAL,VITROLINHA,EUVALDO REIS DOS SANTOS MENEZES,SUPLENTE,PDT,PARTIDO DEMOCRÁTICO TRABALHISTA,4
CARAPICUÍBA,DEPUTADO ESTADUAL,DR SAMUEL SIQUEIRA,SAMUEL SIQUEIRA,SUPLENTE,PDT,PARTIDO DEMOCRÁTICO TRABALHISTA,7
CARAPICUÍBA,DEPUTADO ESTADUAL,MARCO BRASIL,MARCO AURÉLIO RIBEIRO,SUPLENTE,PDT,PARTIDO DEMOCRÁTICO TRABALHISTA,4
CARAPICUÍBA,DEPUTADO ESTADUAL,JOÃO ELIAS,JOÃO ELIAS PEREIRA,SUPLENTE,PDT,PARTIDO DEMOCRÁTICO TRABALHISTA,6
CARAPICUÍBA,DEPUTADO ESTADUAL,CIDINHO,APARECIDO RODRIGUES DOS SANTOS,SUPLENTE,PDT,PARTIDO DEMOCRÁTICO TRABALHISTA,1
CARAPICUÍBA,DEPUTADO ESTADUAL,JOSE DE ALMEIDA,JOSE MALVINEITE DE ALMEIDA,SUPLENTE,PDT,PARTIDO DEMOCRÁTICO TRABALHISTA,1
CARAPICUÍBA,DEPUTADO ESTADUAL,ANDERSON SILVA,ANDERSON DOMINGOS DA SILVA,SUPLENTE,PT,SOMOS MAIS SÃO PAULO,11
CARAPICUÍBA,DEPUTADO ESTADUAL,DR. JORGE PARADA,JORGE EDUARDO PARADA HURTADO,SUPLENTE,PT,SOMOS MAIS SÃO PAULO,2
CARAPICUÍBA,DEPUTADO ESTADUAL,TELMA DE SOUZA,TELMA SANDRA AUGUSTO DE SOUZA,ELEITO,PT,SOMOS MAIS SÃO PAULO,4
CARAPICUÍBA,DEPUTADO ESTADUAL,BETO COELHO,PAULO ROBERTO CABRAL COELHO,SUPLENTE,PT,SOMOS MAIS SÃO PAULO,2
CARAPICUÍBA,DEPUTADO ESTADUAL,PEDRO BIANGULI,PEDRO CARLOS BIANGULI DE FARIA,SUPLENTE,PT,SOMOS MAIS SÃO PAULO,3
CARAPICUÍBA,DEPUTADO ESTADUAL,CLAUDILSON PEZAO,CLAUDILSON LEITE PEREIRA,SUPLENTE,PT,SOMOS MAIS SÃO PAULO,1
CARAPICUÍBA,DEPUTADO ESTADUAL,WAGNER BALIEIRO,WAGNER OCIMAR BALIEIRO,SUPLENTE,PT,SOMOS MAIS SÃO PAULO,1
CARAPICUÍBA,DEPUTADO ESTADUAL,PROFESSOR CLEITON GOMES,CLEITON GOMES DA SILVA,SUPLENTE,PT,SOMOS MAIS SÃO PAULO,3
CARAPICUÍBA,DEPUTADO ESTADUAL,GALENO AMORIM,GALENO DE AMORIM JUNIOR,SUPLENTE,PT,SOMOS MAIS SÃO PAULO,4
CARAPICUÍBA,DEPUTADO ESTADUAL,VALMIR PRASCIDELLI,VALMIR PRASCIDELLI,SUPLENTE,PT,SOMOS MAIS SÃO PAULO,531
CARAPICUÍBA,DEPUTADO ESTADUAL,ENGª MÔNICA BOMBONATO,MÔNICA ESTELA BOMBONATO,SUPLENTE,PT,SOMOS MAIS SÃO PAULO,3
CARAPICUÍBA,DEPUTADO ESTADUAL,PAULO MARTINS (GAÚCHO),PAULO CESAR GOMES MARTINS,SUPLENTE,PT,SOMOS MAIS SÃO PAULO,1
CARAPICUÍBA,DEPUTADO ESTADUAL,JURA,JURACY FRANCISCO DE JESUS,SUPLENTE,PT,SOMOS MAIS SÃO PAULO,12
CARAPICUÍBA,DEPUTADO ESTADUAL,GERSON BITTENCOURT,GERSON LUIS BITTENCOURT,ELEITO,PT,SOMOS MAIS SÃO PAULO,20
CARAPICUÍBA,DEPUTADO ESTADUAL,EDINHO SILVA,EDSON ANTONIO EDINHO DA SILVA,ELEITO,PT,SOMOS MAIS SÃO PAULO,56
CARAPICUÍBA,DEPUTADO ESTADUAL,ENIO TATTO,ENIO FRANCISCO TATTO,ELEITO,PT,SOMOS MAIS SÃO PAULO,205
CARAPICUÍBA,DEPUTADO ESTADUAL,SUB TEN. NEZINHO (RECO),NEZINHO GONÇALVES NUNES,SUPLENTE,PT,SOMOS MAIS SÃO PAULO,3
CARAPICUÍBA,DEPUTADO ESTADUAL,RAFAEL MARINHO,RAFAEL DE FIGUEIREDO MARINHO,SUPLENTE,PT,SOMOS MAIS SÃO PAULO,1
CARAPICUÍBA,DEPUTADO ESTADUAL,ANA PERUGINI,ANA LUCIA LIPPAUS PERUGINI,ELEITO,PT,SOMOS MAIS SÃO PAULO,4
CARAPICUÍBA,DEPUTADO ESTADUAL,TONINHO DO PT,ANTONIO AMARAL JUNIOR,SUPLENTE,PT,SOMOS MAIS SÃO PAULO,1
CARAPICUÍBA,DEPUTADO ESTADUAL,ZICO,JOSÉ PRADO DE ANDRADE,MÉDIA,PT,SOMOS MAIS SÃO PAULO,15
CARAPICUÍBA,DEPUTADO ESTADUAL,SALETE CAMPARI,FRANCISCO DE SALES RODRIGUES,SUPLENTE,PT,SOMOS MAIS SÃO PAULO,7
CARAPICUÍBA,DEPUTADO ESTADUAL,WILSON SANTOS,WILSON SANTOS PEREIRA,SUPLENTE,PT,SOMOS MAIS SÃO PAULO,23
CARAPICUÍBA,DEPUTADO ESTADUAL,MARCO AURÉLIO DE SOUZA,MARCO AURÉLIO DE SOUZA,MÉDIA,PT,SOMOS MAIS SÃO PAULO,9
CARAPICUÍBA,DEPUTADO ESTADUAL,MARCOS MARTINS,MARCOS LOPES MARTINS,ELEITO,PT,SOMOS MAIS SÃO PAULO,604
CARAPICUÍBA,DEPUTADO ESTADUAL,DR. LUIZINHO,LUIS CARLOS LAURINDO,SUPLENTE,PT,SOMOS MAIS SÃO PAULO,25
CARAPICUÍBA,DEPUTADO ESTADUAL,ELI TEODORO,ELI TEODORO,SUPLENTE,PT,SOMOS MAIS SÃO PAULO,26
CARAPICUÍBA,DEPUTADO ESTADUAL,SIMÃO PEDRO,SIMÃO PEDRO CHIOVETTI,ELEITO,PT,SOMOS MAIS SÃO PAULO,38
CARAPICUÍBA,DEPUTADO ESTADUAL,IVANETE VIEIRA,IVANETE APARECIDA DOS SANTOS,SUPLENTE,PT,SOMOS MAIS SÃO PAULO,2
CARAPICUÍBA,DEPUTADO ESTADUAL,GERALDO CRUZ,GERALDO LEITE DA CRUZ,ELEITO,PT,SOMOS MAIS SÃO PAULO,250
CARAPICUÍBA,DEPUTADO ESTADUAL,CLEUSA QUILOMBOLA,CLEUSA SAMPAIO,SUPLENTE,PT,SOMOS MAIS SÃO PAULO,1
CARAPICUÍBA,DEPUTADO ESTADUAL,RUI FALCÃO,RUI GOETHE DA COSTA FALCÃO,ELEITO,PT,SOMOS MAIS SÃO PAULO,419
CARAPICUÍBA,DEPUTADO ESTADUAL,JUSTINO CAMPO BELO,JUSTINO DA SILVA,SUPLENTE,PT,SOMOS MAIS SÃO PAULO,1
CARAPICUÍBA,DEPUTADO ESTADUAL,ANTONIO MENTOR,ANTONIO MENTOR DE MELLO SOBRINHO,ELEITO,PT,SOMOS MAIS SÃO PAULO,28
CARAPICUÍBA,DEPUTADO ESTADUAL,CRISTINA DA USP,CRISTINA SIMOES,SUPLENTE,PT,SOMOS MAIS SÃO PAULO,5
CARAPICUÍBA,DEPUTADO ESTADUAL,ADRIANO DIOGO,ADRIANO DIOGO,ELEITO,PT,SOMOS MAIS SÃO PAULO,16
CARAPICUÍBA,DEPUTADO ESTADUAL,ESTELA ALMAGRO,ESTELA ALEXANDRE ALMAGRO,SUPLENTE,PT,SOMOS MAIS SÃO PAULO,18
CARAPICUÍBA,DEPUTADO ESTADUAL,HAMILTON PEREIRA,HAMILTON PEREIRA,ELEITO,PT,SOMOS MAIS SÃO PAULO,8
CARAPICUÍBA,DEPUTADO ESTADUAL,EUVANILDE,EUVANILDE RODRIGUES DA SILVA,SUPLENTE,PT,SOMOS MAIS SÃO PAULO,1
CARAPICUÍBA,DEPUTADO ESTADUAL,LUIZ CLAUDIO MARCOLINO,LUIZ CLAUDIO MARCOLINO,ELEITO,PT,SOMOS MAIS SÃO PAULO,510
CARAPICUÍBA,DEPUTADO ESTADUAL,RENATO DO GEB,RENATO MORENI AIRES DA SILVA,SUPLENTE,PT,SOMOS MAIS SÃO PAULO,5
CARAPICUÍBA,DEPUTADO ESTADUAL,DENISE ERBELLA,DENISE ELOÁ CUSTÓDIO ERBELLA DE CASTRO,SUPLENTE,PT,SOMOS MAIS SÃO PAULO,8
CARAPICUÍBA,DEPUTADO ESTADUAL,NATIVIDADE,MARIA DA NATIVIDADE PEREIRA LIMA,SUPLENTE,PT,SOMOS MAIS SÃO PAULO,17
CARAPICUÍBA,DEPUTADO ESTADUAL,ROBERTO FELICIO,ROBERTO FELICIO,SUPLENTE,PT,SOMOS MAIS SÃO PAULO,28
CARAPICUÍBA,DEPUTADO ESTADUAL,RAFAEL AGOSTINI,RAFAEL LUNARDELLI AGOSTINI,SUPLENTE,PT,SOMOS MAIS SÃO PAULO,4
CARAPICUÍBA,DEPUTADO ESTADUAL,BETH SAHAO,ELISABETH SAHÃO,SUPLENTE,PT,SOMOS MAIS SÃO PAULO,121
CARAPICUÍBA,DEPUTADO ESTADUAL,PAULINHO MARQUES,PAULO MARQUES DE OLIVEIRA,SUPLENTE,PT,SOMOS MAIS SÃO PAULO,3
CARAPICUÍBA,DEPUTADO ESTADUAL,ADINAN ORTOLAN,JOSÉ ADINAN ORTOLAN,SUPLENTE,PT,SOMOS MAIS SÃO PAULO,1
CARAPICUÍBA,DEPUTADO ESTADUAL,FRANCISCO FRANÇA,FRANCISCO FRANÇA DA SILVA,SUPLENTE,PT,SOMOS MAIS SÃO PAULO,3
CARAPICUÍBA,DEPUTADO ESTADUAL,LELO PAGANI,LUIZ AURELIO PAGANI,SUPLENTE,PT,SOMOS MAIS SÃO PAULO,1
CARAPICUÍBA,DEPUTADO ESTADUAL,ALENCAR,ALENCAR SANTANA BRAGA,ELEITO,PT,SOMOS MAIS SÃO PAULO,161
