VÁRZEA PAULISTA,DEPUTADO FEDERAL,JOSE ONERIO,JOSE ONERIO DA SILVA,SUPLENTE,PPS,PSDB/DEM/PPS,37
VÁRZEA PAULISTA,DEPUTADO FEDERAL,PAULINHO LARISSA SPOSITO,PAULO ROGERIO SPOSITO,SUPLENTE,PPS,PSDB/DEM/PPS,2
VÁRZEA PAULISTA,DEPUTADO FEDERAL,ARNALDO JARDIM,ARNALDO CALIL PEREIRA JARDIM,ELEITO,PPS,PSDB/DEM/PPS,44
VÁRZEA PAULISTA,DEPUTADO FEDERAL,PROF POLLYANA GAMA,POLLYANA FATIMA GAMA SANTOS,SUPLENTE,PPS,PSDB/DEM/PPS,2
VÁRZEA PAULISTA,DEPUTADO FEDERAL,DR PACHECO,ANTONIO DE PADUA PACHECO,SUPLENTE,PPS,PSDB/DEM/PPS,665
VÁRZEA PAULISTA,DEPUTADO FEDERAL,JORGE TADEU,JORGE TADEU MUDALEN,ELEITO,DEM,PSDB/DEM/PPS,218
VÁRZEA PAULISTA,DEPUTADO FEDERAL,RENATO GALENDI,RENATO APARECIDO GALENDI,SUPLENTE,DEM,PSDB/DEM/PPS,1
VÁRZEA PAULISTA,DEPUTADO FEDERAL,ALEXANDRE LEITE,ALEXANDRE LEITE DA SILVA,MÉDIA,DEM,PSDB/DEM/PPS,22
VÁRZEA PAULISTA,DEPUTADO FEDERAL,PROFESSOR BENJAMIN,BENJAMIN RIBEIRO DA SILVA,SUPLENTE,DEM,PSDB/DEM/PPS,8
VÁRZEA PAULISTA,DEPUTADO FEDERAL,KIKO DO KLB,FRANCO FINATO SCORNAVACCA,SUPLENTE,DEM,PSDB/DEM/PPS,62
VÁRZEA PAULISTA,DEPUTADO FEDERAL,CRESPO,JOSE ANTONIO CALDINI CRESPO,SUPLENTE,DEM,PSDB/DEM/PPS,3
VÁRZEA PAULISTA,DEPUTADO FEDERAL,RODRIGO GARCIA,RODRIGO GARCIA,ELEITO,DEM,PSDB/DEM/PPS,8
VÁRZEA PAULISTA,DEPUTADO FEDERAL,MARCELO PALINKAS,MARCELO PALINKAS,SUPLENTE,DEM,PSDB/DEM/PPS,1
VÁRZEA PAULISTA,DEPUTADO FEDERAL,ZULAIÊ COBRA,ZULAIE COBRA RIBEIRO,SUPLENTE,DEM,PSDB/DEM/PPS,11
VÁRZEA PAULISTA,DEPUTADO FEDERAL,LUCIANO ARTIOLI,LUCIANO ARTIOLI MOREIRA,SUPLENTE,DEM,PSDB/DEM/PPS,3
VÁRZEA PAULISTA,DEPUTADO FEDERAL,RAUL GIL JR,RAUL GIL JUNIOR,SUPLENTE,DEM,PSDB/DEM/PPS,20
VÁRZEA PAULISTA,DEPUTADO FEDERAL,CHICO PELUCIO,FRANCISCO PELUCIO,SUPLENTE,DEM,PSDB/DEM/PPS,1
VÁRZEA PAULISTA,DEPUTADO FEDERAL,MANDIC,ALEKSANDAR CARLOS MANDIC,SUPLENTE,DEM,PSDB/DEM/PPS,5
VÁRZEA PAULISTA,DEPUTADO FEDERAL,HIRAM JR,HIRAM AYRES MONTEIRO JUNIOR,SUPLENTE,DEM,PSDB/DEM/PPS,5
VÁRZEA PAULISTA,DEPUTADO FEDERAL,CASCIONE,VICENTE FERNANDES CASCIONE,SUPLENTE,DEM,PSDB/DEM/PPS,3
VÁRZEA PAULISTA,DEPUTADO FEDERAL,ELI CORREA FILHO,ADRIANO ELI CORREA,ELEITO,DEM,PSDB/DEM/PPS,43
VÁRZEA PAULISTA,DEPUTADO FEDERAL,DR ELEUSES PAIVA,ELEUSES VIEIRA DE PAIVA,SUPLENTE,DEM,PSDB/DEM/PPS,13
VÁRZEA PAULISTA,DEPUTADO FEDERAL,GUILHERME CAMPOS,GUILHERME CAMPOS JUNIOR,MÉDIA,DEM,PSDB/DEM/PPS,647
VÁRZEA PAULISTA,DEPUTADO FEDERAL,WALTER IHOSHI,WALTER SHINDI IIHOSHI,SUPLENTE,DEM,PSDB/DEM/PPS,1
VÁRZEA PAULISTA,DEPUTADO FEDERAL,DR ANAMARIA HIRAKAWA,ANAMARIA YAECO HIRAKAWA,SUPLENTE,PHS,HUMANISTA CRISTÃO ,1
VÁRZEA PAULISTA,DEPUTADO FEDERAL,MALUCO BELEZA,OLAIR PRADO DE OLIVEIRA,SUPLENTE,PHS,HUMANISTA CRISTÃO ,22
VÁRZEA PAULISTA,DEPUTADO FEDERAL,DONIZETI,BENEDITO DONIZETI ALVES,SUPLENTE,PHS,HUMANISTA CRISTÃO ,6
VÁRZEA PAULISTA,DEPUTADO FEDERAL,PROF HERMES,HERMES RODRIGUES NERY,SUPLENTE,PHS,HUMANISTA CRISTÃO ,6
VÁRZEA PAULISTA,DEPUTADO FEDERAL,DEBORA GODOI,DÉBORA ANDREA BATISTA GODOI,SUPLENTE,PHS,HUMANISTA CRISTÃO ,1
VÁRZEA PAULISTA,DEPUTADO FEDERAL,JOÃO LIGEIRO,JOÃO MARTINE GUALIUME,SUPLENTE,PHS,HUMANISTA CRISTÃO ,1
VÁRZEA PAULISTA,DEPUTADO FEDERAL,FÁBIO GALAN,FABIO GALAN JACOBS,SUPLENTE,PHS,HUMANISTA CRISTÃO ,1
VÁRZEA PAULISTA,DEPUTADO FEDERAL,JONAS DONIZETTE,JONAS DONIZETTE FERREIRA,ELEITO,PSB,PRESTE ATENÇÃO SÃO PAULO,315
VÁRZEA PAULISTA,DEPUTADO FEDERAL,DENNYS SERRANO,DENNYS HADDAD SERRANO,SUPLENTE,PSB,PRESTE ATENÇÃO SÃO PAULO,1
VÁRZEA PAULISTA,DEPUTADO FEDERAL,MARCELINHO CARIOCA,MARCELO PEREIRA SURCIN,SUPLENTE,PSB,PRESTE ATENÇÃO SÃO PAULO,87
VÁRZEA PAULISTA,DEPUTADO FEDERAL,MARCOS DE PAULA,MARCOS DE PAULA,SUPLENTE,PSB,PRESTE ATENÇÃO SÃO PAULO,1
VÁRZEA PAULISTA,DEPUTADO FEDERAL,GUSTAVO HERRMANN,GUSTAVO RANZANI HERRMANN,SUPLENTE,PSB,PRESTE ATENÇÃO SÃO PAULO,1
VÁRZEA PAULISTA,DEPUTADO FEDERAL,SARGENTO FERNANDO,FERNANDO ALCÂNTARA DE FIGUEIREDO,SUPLENTE,PSB,PRESTE ATENÇÃO SÃO PAULO,8
VÁRZEA PAULISTA,DEPUTADO FEDERAL,IRMÃO JOÃO NOGUEIRA,JOÃO NOGUEIRA DE LIMA,SUPLENTE,PSB,PRESTE ATENÇÃO SÃO PAULO,2
VÁRZEA PAULISTA,DEPUTADO FEDERAL,ELISEU GABRIEL,ELISEU GABRIEL DE PIERI,SUPLENTE,PSB,PRESTE ATENÇÃO SÃO PAULO,8
VÁRZEA PAULISTA,DEPUTADO FEDERAL,ADÃO LIMA,ADÃO TIMÓTEO DE LIMA,SUPLENTE,PSB,PRESTE ATENÇÃO SÃO PAULO,1
VÁRZEA PAULISTA,DEPUTADO FEDERAL,CAPITÃO AUGUSTO,JOSÉ AUGUSTO ROSA,SUPLENTE,PSB,PRESTE ATENÇÃO SÃO PAULO,26
VÁRZEA PAULISTA,DEPUTADO FEDERAL,LUIZA ERUNDINA,LUIZA ERUNDINA DE SOUSA,ELEITO,PSB,PRESTE ATENÇÃO SÃO PAULO,29
VÁRZEA PAULISTA,DEPUTADO FEDERAL,TIO DO DOCE,MANOEL CARDOSO DA SILVA,SUPLENTE,PSB,PRESTE ATENÇÃO SÃO PAULO,16
VÁRZEA PAULISTA,DEPUTADO FEDERAL,CHINELO,JOSÉ AVELINO PEREIRA,SUPLENTE,PSB,PRESTE ATENÇÃO SÃO PAULO,159
VÁRZEA PAULISTA,DEPUTADO FEDERAL,TORINO,PAULO SERGIO TORINO,SUPLENTE,PSB,PRESTE ATENÇÃO SÃO PAULO,2
VÁRZEA PAULISTA,DEPUTADO FEDERAL,GABRIEL CHALITA,GABRIEL BENEDITO ISSAAC CHALITA,ELEITO,PSB,PRESTE ATENÇÃO SÃO PAULO,2329
VÁRZEA PAULISTA,DEPUTADO FEDERAL,TATI ESPONTONE,TATIANE ESPONTONE,SUPLENTE,PSB,PRESTE ATENÇÃO SÃO PAULO,2
VÁRZEA PAULISTA,DEPUTADO FEDERAL,MÁRCIO FRANÇA,MÁRCIO LUIZ FRANÇA GOMES,ELEITO,PSB,PRESTE ATENÇÃO SÃO PAULO,8
VÁRZEA PAULISTA,DEPUTADO FEDERAL,CORAUCI,VALDEMAR CORAUCI SOBRINHO,SUPLENTE,PSB,PRESTE ATENÇÃO SÃO PAULO,1
VÁRZEA PAULISTA,DEPUTADO FEDERAL,RUBINHO CAI CAI,RUBENS ESTEVES ROQUE,SUPLENTE,PSB,PRESTE ATENÇÃO SÃO PAULO,3
VÁRZEA PAULISTA,DEPUTADO FEDERAL,DR. ALEXANDRE,ALEXANDRE SÉRGIO DE OLIVEIRA AZOUBEL,SUPLENTE,PSB,PRESTE ATENÇÃO SÃO PAULO,2
VÁRZEA PAULISTA,DEPUTADO FEDERAL,DRA. ROSIANE FARIAS,ROSIANE MACIEL DE FARIAS,SUPLENTE,PSB,PRESTE ATENÇÃO SÃO PAULO,31
VÁRZEA PAULISTA,DEPUTADO FEDERAL,JOSÉ LEAL,JOSÉ MARTINS LEAL,SUPLENTE,PSB,PRESTE ATENÇÃO SÃO PAULO,2
VÁRZEA PAULISTA,DEPUTADO FEDERAL,TONINHO GARMS,ANTONIO CARLOS GARMS,SUPLENTE,PSB,PRESTE ATENÇÃO SÃO PAULO,1
VÁRZEA PAULISTA,DEPUTADO FEDERAL,VALDIR ALVARENGA,VALDIR DE ALVARENGA,SUPLENTE,PSB,PRESTE ATENÇÃO SÃO PAULO,1
VÁRZEA PAULISTA,DEPUTADO FEDERAL,WALTER SANDRO,WALTER SANDRO PEREIRA DA SILVA,SUPLENTE,PSB,PRESTE ATENÇÃO SÃO PAULO,7
VÁRZEA PAULISTA,DEPUTADO FEDERAL,SANTO PETRONI,SANTO PETRONI,SUPLENTE,PSB,PRESTE ATENÇÃO SÃO PAULO,1
VÁRZEA PAULISTA,DEPUTADO FEDERAL,DRA. ELAINE,ELAINE APARECIDA BELLONI ABISSAMRA,SUPLENTE,PSB,PRESTE ATENÇÃO SÃO PAULO,1
VÁRZEA PAULISTA,DEPUTADO FEDERAL,VANDIR MOGNON,VANDIR MOGNON,SUPLENTE,PSB,PRESTE ATENÇÃO SÃO PAULO,7
VÁRZEA PAULISTA,DEPUTADO FEDERAL,DIRCEU CARDOSO,DIRCEU CARDOSO GONÇALVES,SUPLENTE,PSB,PRESTE ATENÇÃO SÃO PAULO,1
VÁRZEA PAULISTA,DEPUTADO FEDERAL,ABELARDO CAMARINHA,JOSE ABELARDO GUIMARAES CAMARINHA,MÉDIA,PSB,PRESTE ATENÇÃO SÃO PAULO,5
VÁRZEA PAULISTA,DEPUTADO FEDERAL,JEFFERSON CAMPOS,JEFFERSON ALVES DE CAMPOS,ELEITO,PSB,PRESTE ATENÇÃO SÃO PAULO,429
VÁRZEA PAULISTA,DEPUTADO FEDERAL,GRAÇA,MARIA DAS GRAÇAS GONÇALVES OLIVEIRA,SUPLENTE,PSB,PRESTE ATENÇÃO SÃO PAULO,1
VÁRZEA PAULISTA,DEPUTADO FEDERAL,DR. UBIALI,MARCO AURÉLIO UBIALI,SUPLENTE,PSB,PRESTE ATENÇÃO SÃO PAULO,3
VÁRZEA PAULISTA,DEPUTADO FEDERAL,ZÉ AMIGUINHO,JOSÉ WANDERLEY DE ANDRADE,SUPLENTE,PSB,PRESTE ATENÇÃO SÃO PAULO,1
VÁRZEA PAULISTA,DEPUTADO FEDERAL,OTA,IOLANDA KEIKO MIASHIRO OTA,ELEITO,PSB,PRESTE ATENÇÃO SÃO PAULO,54
VÁRZEA PAULISTA,DEPUTADO FEDERAL,GUILHERME MUSSI,GUILHERME MUSSI FERREIRA,ELEITO,PV,PARTIDO VERDE,14
VÁRZEA PAULISTA,DEPUTADO FEDERAL,WALTER GONZALIS,WALTER GONZALIS,SUPLENTE,PV,PARTIDO VERDE,6
VÁRZEA PAULISTA,DEPUTADO FEDERAL,DR TALMIR,TALMIR RODRIGUES,SUPLENTE,PV,PARTIDO VERDE,4
VÁRZEA PAULISTA,DEPUTADO FEDERAL,VICENTE DA UPA,VICENTE CARVALHO E SILVA,SUPLENTE,PV,PARTIDO VERDE,22
VÁRZEA PAULISTA,DEPUTADO FEDERAL,EDNA MARTINS,EDNA SANDRA MARTINS,SUPLENTE,PV,PARTIDO VERDE,1
VÁRZEA PAULISTA,DEPUTADO FEDERAL,RAÍ,RAIMUNDO SOUZA TEIXEIRA,SUPLENTE,PV,PARTIDO VERDE,2
VÁRZEA PAULISTA,DEPUTADO FEDERAL,DR. SINVAL MALHEIROS,SINVAL MALHEIROS PINTO JÚNIOR,SUPLENTE,PV,PARTIDO VERDE,1
VÁRZEA PAULISTA,DEPUTADO FEDERAL,DANIEL MARINS,DANIEL MARINS ALESSI,SUPLENTE,PV,PARTIDO VERDE,101
VÁRZEA PAULISTA,DEPUTADO FEDERAL,JULIO CASTILHO,JULIO CESAR CASTILHO,SUPLENTE,PV,PARTIDO VERDE,5
VÁRZEA PAULISTA,DEPUTADO FEDERAL,ROBERTO SANTIAGO,JOSE ROBERTO SANTIAGO GOMES,ELEITO,PV,PARTIDO VERDE,59
VÁRZEA PAULISTA,DEPUTADO FEDERAL,DR INDIO,ALMIR SANTOS,SUPLENTE,PV,PARTIDO VERDE,2
VÁRZEA PAULISTA,DEPUTADO FEDERAL,CESAR CORTEZ,ANTONIO CESAR CORTEZ,SUPLENTE,PV,PARTIDO VERDE,6
VÁRZEA PAULISTA,DEPUTADO FEDERAL,ZICA,EUSTAQUIO LUCIANO ZICA,SUPLENTE,PV,PARTIDO VERDE,4
VÁRZEA PAULISTA,DEPUTADO FEDERAL,CHICO SANTA RITA,FRANCISCO JOSE DE SANTA RITA BEHR,SUPLENTE,PV,PARTIDO VERDE,5
VÁRZEA PAULISTA,DEPUTADO FEDERAL,PEDRO MANHÃES,PEDRO MANHÃES DE OLIVEIRA,SUPLENTE,PV,PARTIDO VERDE,2
VÁRZEA PAULISTA,DEPUTADO FEDERAL,ENG PAULINHO,PAULO HENRIQUE DO NASCIMENTO,SUPLENTE,PV,PARTIDO VERDE,1
VÁRZEA PAULISTA,DEPUTADO FEDERAL,VITALMO JÚNIOR,JOSÉ VITALMO SOARES JÚNIOR,SUPLENTE,PV,PARTIDO VERDE,3
VÁRZEA PAULISTA,DEPUTADO FEDERAL,MARIA DOLORES,MARIA DOLORES RODRIGUES JORDAN ORFEI ABE,SUPLENTE,PV,PARTIDO VERDE,3
VÁRZEA PAULISTA,DEPUTADO FEDERAL,JAIME ROCHA,JAIME BARTOLOMEU DA ROCHA,SUPLENTE,PV,PARTIDO VERDE,1
VÁRZEA PAULISTA,DEPUTADO FEDERAL,MARTA MACIEL,MARTA FERREIRA MACIEL,SUPLENTE,PV,PARTIDO VERDE,1
VÁRZEA PAULISTA,DEPUTADO FEDERAL,JOVINO CÂNDIDO,JOVINO CÂNDIDO DA SILVA,SUPLENTE,PV,PARTIDO VERDE,2
VÁRZEA PAULISTA,DEPUTADO FEDERAL,ANA PAULA JUNQUEIRA,ANA PAULA GUIMARAES DE AZEVEDO JUNQUEIRA,SUPLENTE,PV,PARTIDO VERDE,7
VÁRZEA PAULISTA,DEPUTADO FEDERAL,MARINO BONACCHI,MARINO MARTINI BONACCHI,SUPLENTE,PV,PARTIDO VERDE,1
VÁRZEA PAULISTA,DEPUTADO FEDERAL,EVANDRO GUSSI,EVANDRO HERRERA BERTONE GUSSI,SUPLENTE,PV,PARTIDO VERDE,210
VÁRZEA PAULISTA,DEPUTADO FEDERAL,FAUSTO LOPES,FAUSTO LOPES FILHO,SUPLENTE,PV,PARTIDO VERDE,4
VÁRZEA PAULISTA,DEPUTADO FEDERAL,ALE YOUSSEF,ALEXANDRE DE ALMEIDA YOUSSEF,SUPLENTE,PV,PARTIDO VERDE,10
VÁRZEA PAULISTA,DEPUTADO FEDERAL,PENNA,JOSÉ LUIZ DE FRANÇA PENNA,ELEITO,PV,PARTIDO VERDE,49
VÁRZEA PAULISTA,DEPUTADO FEDERAL,ROBERTO DE LUCENA,ROBERTO ALVES DE LUCENA,ELEITO,PV,PARTIDO VERDE,490
VÁRZEA PAULISTA,DEPUTADO FEDERAL,DR. ÂNGELO,ANGELO DOMINGOS NUCCI,SUPLENTE,PV,PARTIDO VERDE,2
VÁRZEA PAULISTA,DEPUTADO FEDERAL,NATAN SOIHET,NATAN SOIHET,SUPLENTE,PV,PARTIDO VERDE,6
VÁRZEA PAULISTA,DEPUTADO FEDERAL,ALTAIR DA ASSOCIACAO,ALTAIR BARBOSA GOUVEIA,SUPLENTE,PV,PARTIDO VERDE,5
VÁRZEA PAULISTA,DEPUTADO FEDERAL,PAMPA,ANDRE FELIPPE FALBO FERREIRA,SUPLENTE,PV,PARTIDO VERDE,3
VÁRZEA PAULISTA,DEPUTADO FEDERAL,J FARIA,JOSE JESUS APARECIDO DE FARIA,SUPLENTE,PV,PARTIDO VERDE,1
VÁRZEA PAULISTA,DEPUTADO FEDERAL,DONIZETI PEREIRA,APARECIDO DONIZETI PEREIRA,SUPLENTE,PV,PARTIDO VERDE,1
VÁRZEA PAULISTA,DEPUTADO FEDERAL,DEKKA,JOSÉ SALVADOR DA SILVA,SUPLENTE,PV,PARTIDO VERDE,5
VÁRZEA PAULISTA,DEPUTADO FEDERAL,CARLINHOS SILVA,ANTONIO CARLOS ALVES DA SILVA,SUPLENTE,PV,PARTIDO VERDE,109
VÁRZEA PAULISTA,DEPUTADO FEDERAL,DR. GETÚLIO SERPA,GETÚLIO PEREIRA SERPA,SUPLENTE,PV,PARTIDO VERDE,2
VÁRZEA PAULISTA,DEPUTADO FEDERAL,RICARDO IZAR,RICARDO IZAR JUNIOR,ELEITO,PV,PARTIDO VERDE,40
VÁRZEA PAULISTA,DEPUTADO FEDERAL,TERESA JAPONESA,TERESA KIYOKO ARAGAKI,SUPLENTE,PV,PARTIDO VERDE,2
VÁRZEA PAULISTA,DEPUTADO FEDERAL,BERQUE,CARLOS CESAR BERQUE,SUPLENTE,PV,PARTIDO VERDE,1
VÁRZEA PAULISTA,DEPUTADO FEDERAL,DR. RAUL,RAUL APARECIDO GONÇALVES PAULA,SUPLENTE,PV,PARTIDO VERDE,2
VÁRZEA PAULISTA,DEPUTADO FEDERAL,LAERTE MOLLETA,LAERTE AMERICO MOLLETA,SUPLENTE,PV,PARTIDO VERDE,1
VÁRZEA PAULISTA,DEPUTADO FEDERAL,LUIZA ELUF,LUIZA NAGIB ELUF,SUPLENTE,PV,PARTIDO VERDE,7
VÁRZEA PAULISTA,DEPUTADO FEDERAL,TECO,MARCOS FERREIRA GODOY,SUPLENTE,PV,PARTIDO VERDE,5
VÁRZEA PAULISTA,DEPUTADO FEDERAL,TURQUINHO,SERGIO SALAFIA,SUPLENTE,PV,PARTIDO VERDE,1
VÁRZEA PAULISTA,DEPUTADO FEDERAL,VILSON ALVES,VILSON OSCHIN ALVES,SUPLENTE,PV,PARTIDO VERDE,2
VÁRZEA PAULISTA,DEPUTADO FEDERAL,DR. MÁRCIO PAMPURI,MARCIO CAVALCANTI PAMPURI,SUPLENTE,PV,PARTIDO VERDE,5
VÁRZEA PAULISTA,DEPUTADO FEDERAL,DR. SAULO,VESPASIANO SAULO DA COSTA E SILVA,SUPLENTE,PV,PARTIDO VERDE,2
VÁRZEA PAULISTA,DEPUTADO FEDERAL,JOSE SILVÉRIO,JOSÉ SILVÉRIO GOMES DOMINGOS,SUPLENTE,PV,PARTIDO VERDE,1
VÁRZEA PAULISTA,DEPUTADO FEDERAL,AMAURY CAMARGO MONICO,AMAURY CAMARGO MONACO,SUPLENTE,PV,PARTIDO VERDE,5
VÁRZEA PAULISTA,DEPUTADO FEDERAL,MARCELO SOARES,MARCELO SOARES DE ALMEIDA,SUPLENTE,PV,PARTIDO VERDE,1
VÁRZEA PAULISTA,DEPUTADO FEDERAL,DR. RODRIGO BARROCA,RODRIGO BARROCA OLIVEIRA,SUPLENTE,PV,PARTIDO VERDE,1
VÁRZEA PAULISTA,DEPUTADO FEDERAL,EDUARDO PALHARES,EDUARDO SANTOS PALHARES,SUPLENTE,PV,PARTIDO VERDE,2001
VÁRZEA PAULISTA,DEPUTADO FEDERAL,HENRIQUE NUNES,HENRIQUE ANTONIO PAIVA NUNES,SUPLENTE,PV,PARTIDO VERDE,1
VÁRZEA PAULISTA,DEPUTADO FEDERAL,CARLOS SAMPAIO,CARLOS HENRIQUE FOCESI SAMPAIO,ELEITO,PSDB,PSDB/DEM/PPS,20
VÁRZEA PAULISTA,DEPUTADO FEDERAL,POPPI,JOÃO HENRIQUE GONÇALVES MARCICANO POPPI,SUPLENTE,PSDB,PSDB/DEM/PPS,1
VÁRZEA PAULISTA,DEPUTADO FEDERAL,JOSE LUIZ,JOSE LUIZ SILVA BRUNO,SUPLENTE,PSDB,PSDB/DEM/PPS,1
VÁRZEA PAULISTA,DEPUTADO FEDERAL,STANGARLINI,JOSE CARLOS STANGARLINI,SUPLENTE,PSDB,PSDB/DEM/PPS,53
VÁRZEA PAULISTA,DEPUTADO FEDERAL,RAUL CHRISTIANO,RAUL CHRISTIANO DE OLIVEIRA SANCHEZ,SUPLENTE,PSDB,PSDB/DEM/PPS,4
VÁRZEA PAULISTA,DEPUTADO FEDERAL,LOBBE NETO,ANTONIO ADOLPHO LOBBE NETO,SUPLENTE,PSDB,PSDB/DEM/PPS,32
VÁRZEA PAULISTA,DEPUTADO FEDERAL,FELICIDADE,FELICIDADE LOPES PONTES,SUPLENTE,PSDB,PSDB/DEM/PPS,2
VÁRZEA PAULISTA,DEPUTADO FEDERAL,MANOEL MARCOS (MANÉ),MANOEL MARCOS DE JESUS FERREIRA,SUPLENTE,PSDB,PSDB/DEM/PPS,6
VÁRZEA PAULISTA,DEPUTADO FEDERAL,EMANUEL FERNANDES,EMANUEL FERNANDES,ELEITO,PSDB,PSDB/DEM/PPS,3
VÁRZEA PAULISTA,DEPUTADO FEDERAL,MARA GABRILLI,MARA CRISTINA GABRILLI,ELEITO,PSDB,PSDB/DEM/PPS,37
VÁRZEA PAULISTA,DEPUTADO FEDERAL,JOÃO PAULO FERRARESSO,JOÃO PAULO CORSETTI FERRARESSO,SUPLENTE,PSDB,PSDB/DEM/PPS,1
VÁRZEA PAULISTA,DEPUTADO FEDERAL,MARCOS ARAUJO,MARCOS ROSA DE ARAUJO,SUPLENTE,PSDB,PSDB/DEM/PPS,1
VÁRZEA PAULISTA,DEPUTADO FEDERAL,CARLOS BRAGA,CARLOS EDUARDO FARACO BRAGA,SUPLENTE,PSDB,PSDB/DEM/PPS,6
VÁRZEA PAULISTA,DEPUTADO FEDERAL,LELIS DA ROCHA,LELIS DA ROCHA,SUPLENTE,PSDB,PSDB/DEM/PPS,3
VÁRZEA PAULISTA,DEPUTADO FEDERAL,CARLOS ROBERTO,CARLOS ROBERTO DE CAMPOS,SUPLENTE,PSDB,PSDB/DEM/PPS,13
VÁRZEA PAULISTA,DEPUTADO FEDERAL,DIB,WILLIAM DIB,ELEITO,PSDB,PSDB/DEM/PPS,2
VÁRZEA PAULISTA,DEPUTADO FEDERAL,LUCIA SANTUCCI,LUCIA MARIA SANTUCCI,SUPLENTE,PSDB,PSDB/DEM/PPS,1
VÁRZEA PAULISTA,DEPUTADO FEDERAL,ALBERTO MOURAO,ALBERTO PEREIRA MOURAO,SUPLENTE,PSDB,PSDB/DEM/PPS,5
VÁRZEA PAULISTA,DEPUTADO FEDERAL,RENATO AMARY,RENATO FAUVEL AMARY,SUPLENTE,PSDB,PSDB/DEM/PPS,4
VÁRZEA PAULISTA,DEPUTADO FEDERAL,DR ANDRE SACCO,ANDRE SACCO JUNIOR,SUPLENTE,PSDB,PSDB/DEM/PPS,2
VÁRZEA PAULISTA,DEPUTADO FEDERAL,SILVIO TORRES,SILVIO FRANÇA TORRES,SUPLENTE,PSDB,PSDB/DEM/PPS,3
VÁRZEA PAULISTA,DEPUTADO FEDERAL,TIRSO MEIRELLES,TIRSO DE SALLES MEIRELLES,SUPLENTE,PSDB,PSDB/DEM/PPS,7
VÁRZEA PAULISTA,DEPUTADO FEDERAL,TERESA SERRANO,MARIA TERESA SERRANO AFONSO,SUPLENTE,PSDB,PSDB/DEM/PPS,1
VÁRZEA PAULISTA,DEPUTADO FEDERAL,EDSON APARECIDO,EDSON APARECIDO DOS SANTOS,ELEITO,PSDB,PSDB/DEM/PPS,596
VÁRZEA PAULISTA,DEPUTADO FEDERAL,RICARDO MONTORO,JOSE RICARDO FRANCO MONTORO,SUPLENTE,PSDB,PSDB/DEM/PPS,8
VÁRZEA PAULISTA,DEPUTADO FEDERAL,LUIZ FERNANDO MACHADO,LUIZ FERNANDO ARANTES MACHADO,ELEITO,PSDB,PSDB/DEM/PPS,6311
VÁRZEA PAULISTA,DEPUTADO FEDERAL,DR. MARCELO,MARCELO CHEHADE,SUPLENTE,PSDB,PSDB/DEM/PPS,5
VÁRZEA PAULISTA,DEPUTADO FEDERAL,VANDERLEI MACRIS,VANDERLEI MACRIS,SUPLENTE,PSDB,PSDB/DEM/PPS,9
VÁRZEA PAULISTA,DEPUTADO FEDERAL,DUARTE NOGUEIRA,ANTONIO DUARTE NOGUEIRA JUNIOR,ELEITO,PSDB,PSDB/DEM/PPS,10
VÁRZEA PAULISTA,DEPUTADO FEDERAL,JULIO SEMEGHINI,JULIO FRACISCO SEMEGHINI NETO,ELEITO,PSDB,PSDB/DEM/PPS,4
VÁRZEA PAULISTA,DEPUTADO FEDERAL,RAFAEL ABUD,RAFAEL ANGELO ABUD,SUPLENTE,PSDB,PSDB/DEM/PPS,2
VÁRZEA PAULISTA,DEPUTADO FEDERAL,GIVALDO VIEIRA,GIVALDO RODRIGUES VIEIRA,SUPLENTE,PSDB,PSDB/DEM/PPS,5
VÁRZEA PAULISTA,DEPUTADO FEDERAL,TRIPOLI,JOSÉ RICARDO ALVARENGA TRIPOLI,ELEITO,PSDB,PSDB/DEM/PPS,17
VÁRZEA PAULISTA,DEPUTADO FEDERAL,FERNANDO FUAD CHUCRE,FERNANDO BARRANCOS CHUCRE,SUPLENTE,PSDB,PSDB/DEM/PPS,3
VÁRZEA PAULISTA,DEPUTADO FEDERAL,VAZ DE LIMA,JOSÉ CARLOS VAZ DE LIMA,ELEITO,PSDB,PSDB/DEM/PPS,28
VÁRZEA PAULISTA,DEPUTADO FEDERAL,ALEMÃO DA SÁUDE,CLAUDEMIR SERENO,SUPLENTE,PSDB,PSDB/DEM/PPS,5
VÁRZEA PAULISTA,DEPUTADO FEDERAL,TIÃO,SEBASTIÃO FERRES ARSENE,SUPLENTE,PSDB,PSDB/DEM/PPS,3
VÁRZEA PAULISTA,DEPUTADO FEDERAL,WALTER FELDMAN,WALTER MEYER FELDMAN,SUPLENTE,PSDB,PSDB/DEM/PPS,6
VÁRZEA PAULISTA,DEPUTADO FEDERAL,THAME,ANTONIO CARLOS DE MENDES THAME,ELEITO,PSDB,PSDB/DEM/PPS,49
VÁRZEA PAULISTA,DEPUTADO FEDERAL,ARNALDO MADEIRA,ARNALDO DE ABREU MADEIRA,SUPLENTE,PSDB,PSDB/DEM/PPS,1
VÁRZEA PAULISTA,DEPUTADO FEDERAL,BRUNA FURLAN,BRUNA DIAS FURLAN,ELEITO,PSDB,PSDB/DEM/PPS,47
VÁRZEA PAULISTA,DEPUTADO FEDERAL,JOSÉ ANIBAL,JOSÉ ANIBAL PERES DE PONTES,ELEITO,PSDB,PSDB/DEM/PPS,157
VÁRZEA PAULISTA,DEPUTADO FEDERAL,PROFESSOR CLOVIS PINTO,CLOVIS DA SILVA PINTO,SUPLENTE,PSDB,PSDB/DEM/PPS,2
VÁRZEA PAULISTA,DEPUTADO FEDERAL,JAMIL PRUDENCIANO,JAMIL PAULO PRUDENCIANO,SUPLENTE,PSOL,PARTIDO SOCIALISMO E LIBERDADE,1
VÁRZEA PAULISTA,DEPUTADO FEDERAL,ADILSON RODRIGUES,ADILSON RODRIGUES SANTOS,SUPLENTE,PSOL,PARTIDO SOCIALISMO E LIBERDADE,1
VÁRZEA PAULISTA,DEPUTADO FEDERAL,JOAO SILVERIO,JOAO SILVERIO DE CARVALHO NETO,SUPLENTE,PSOL,PARTIDO SOCIALISMO E LIBERDADE,1
VÁRZEA PAULISTA,DEPUTADO FEDERAL,FABIO DO PSOL,FABIO ANTONIO FERREIRA DA SILVA,SUPLENTE,PSOL,PARTIDO SOCIALISMO E LIBERDADE,1
VÁRZEA PAULISTA,DEPUTADO FEDERAL,AKIKO AKI,AKIKO AKIYAMA,SUPLENTE,PSOL,PARTIDO SOCIALISMO E LIBERDADE,1
VÁRZEA PAULISTA,DEPUTADO FEDERAL,ELISEU SOARES,ELISEU SOARES DE ARAUJO,SUPLENTE,PSOL,PARTIDO SOCIALISMO E LIBERDADE,1
VÁRZEA PAULISTA,DEPUTADO FEDERAL,IVAN VALENTE,IVAN VALENTE,ELEITO,PSOL,PARTIDO SOCIALISMO E LIBERDADE,151
VÁRZEA PAULISTA,DEPUTADO FEDERAL,MARIANA CONTI,MARIANA CONTI TAKAHASHI,SUPLENTE,PSOL,PARTIDO SOCIALISMO E LIBERDADE,1
VÁRZEA PAULISTA,DEPUTADO FEDERAL,PROFESSOR DANIEL,DANIEL WELBER GONÇALVES PEREZ,SUPLENTE,PSOL,PARTIDO SOCIALISMO E LIBERDADE,1
VÁRZEA PAULISTA,DEPUTADO FEDERAL,DR. ABELHA,CARLOS FERNANDO LOPES ABELHA,SUPLENTE,PC DO B,JUNTOS POR SÃO PAULO,10
VÁRZEA PAULISTA,DEPUTADO FEDERAL,GUSTAVO PETTA,GUSTAVO LEMOS PETTA,SUPLENTE,PC DO B,JUNTOS POR SÃO PAULO,43
VÁRZEA PAULISTA,DEPUTADO FEDERAL,SIDNEI MARTINS,SIDNEI ALVES MARTINS,SUPLENTE,PC DO B,JUNTOS POR SÃO PAULO,13
VÁRZEA PAULISTA,DEPUTADO FEDERAL,JUNIOR APRILLANTI,JOSÉ ROBERTO APRILLANTI JUNIOR,SUPLENTE,PC DO B,JUNTOS POR SÃO PAULO,11189
VÁRZEA PAULISTA,DEPUTADO FEDERAL,CÉLIO TURINO,CÉLIO ROBERTO TURINO DE MIRANDA,SUPLENTE,PC DO B,JUNTOS POR SÃO PAULO,28
VÁRZEA PAULISTA,DEPUTADO FEDERAL,DR. PAULO POLO,PAULO ROBERTO POLO,SUPLENTE,PC DO B,JUNTOS POR SÃO PAULO,1
VÁRZEA PAULISTA,DEPUTADO FEDERAL,BEZÃO,ANTONIO ALCEU BEZÃO,SUPLENTE,PC DO B,JUNTOS POR SÃO PAULO,9
VÁRZEA PAULISTA,DEPUTADO FEDERAL,ALDO REBELO,JOSÉ ALDO REBELO FIGUEIREDO,ELEITO,PC DO B,JUNTOS POR SÃO PAULO,68
VÁRZEA PAULISTA,DEPUTADO FEDERAL,DELEGADO PROTÓGENES,PROTÓGENES PINHEIRO DE QUEIROZ,MÉDIA,PC DO B,JUNTOS POR SÃO PAULO,83
VÁRZEA PAULISTA,DEPUTADO FEDERAL,JOAO ARAUJO,JOAO LUIS ARAUJO NETO,SUPLENTE,PT DO B,JUNTOS POR SÃO PAULO,5
VÁRZEA PAULISTA,DEPUTADO FEDERAL,DR MARCAO DA MANCHA,MARCO ANTONIO NOTARI,SUPLENTE,PT DO B,JUNTOS POR SÃO PAULO,45
VÁRZEA PAULISTA,DEPUTADO FEDERAL,COCADINHA CRUZ,GERALDO FERREIRA DA CRUZ,SUPLENTE,PT DO B,JUNTOS POR SÃO PAULO,1
VÁRZEA PAULISTA,DEPUTADO FEDERAL,ALBINO MATOS GOMES,ALBINO MATOS GOMES,SUPLENTE,PT DO B,JUNTOS POR SÃO PAULO,1
VÁRZEA PAULISTA,DEPUTADO ESTADUAL,GERSON DEZEMBRO,GERSON DONIZETI DEZEMBRO,SUPLENTE,PRB,SOMOS MAIS SÃO PAULO,4
VÁRZEA PAULISTA,DEPUTADO ESTADUAL,DENNIS FERRÃO,DENNIS DA SILVA FERRÃO,SUPLENTE,PRB,SOMOS MAIS SÃO PAULO,2
VÁRZEA PAULISTA,DEPUTADO ESTADUAL,WANDEMBERG,WANDEMBERG MARQUES DA SILVA,SUPLENTE,PRB,SOMOS MAIS SÃO PAULO,5
VÁRZEA PAULISTA,DEPUTADO ESTADUAL,WADÃO DJ - JEGUE DENTE DE OURO,OSWALDO MARTINS DE OLIVEIRA,SUPLENTE,PRB,SOMOS MAIS SÃO PAULO,2
VÁRZEA PAULISTA,DEPUTADO ESTADUAL,VALDIR OLIVEIRA,VALDIR OLIVEIRA SANTOS,SUPLENTE,PRB,SOMOS MAIS SÃO PAULO,2
VÁRZEA PAULISTA,DEPUTADO ESTADUAL,GILMACI SANTOS,GILMACI DOS SANTOS BARBOSA,ELEITO,PRB,SOMOS MAIS SÃO PAULO,20
VÁRZEA PAULISTA,DEPUTADO ESTADUAL,SEBASTIÃO SANTOS,SEBASTIÃO DOS SANTOS FILHO,ELEITO,PRB,SOMOS MAIS SÃO PAULO,464
VÁRZEA PAULISTA,DEPUTADO ESTADUAL,HAVANIR,HAVANIR TAVARES DE ALMEIDA NIMTZ,SUPLENTE,PRB,SOMOS MAIS SÃO PAULO,14
VÁRZEA PAULISTA,DEPUTADO ESTADUAL,RICARDO SARAVALLI,RICARDO SARAVALLI,SUPLENTE,PP,PARTIDO PROGRESSISTA,2
VÁRZEA PAULISTA,DEPUTADO ESTADUAL,ADEILDO NOGUEIRA,ADEILDO NOGUEIRA DA SILVA,SUPLENTE,PP,PARTIDO PROGRESSISTA,52
VÁRZEA PAULISTA,DEPUTADO ESTADUAL,ADALBERLITA MORAES,MARIA ADALBERLITA DE LIMA MORAES,SUPLENTE,PP,PARTIDO PROGRESSISTA,1
VÁRZEA PAULISTA,DEPUTADO ESTADUAL,CURIATI,ANTONIO SALIM CURIATI,ELEITO,PP,PARTIDO PROGRESSISTA,50
VÁRZEA PAULISTA,DEPUTADO ESTADUAL,DOUTOR JOSÉ CARLOS,JOSE CARLOS LEITE DE CARVALHO,SUPLENTE,PP,PARTIDO PROGRESSISTA,10
VÁRZEA PAULISTA,DEPUTADO ESTADUAL,DR. SERGIO CHEBEL,SERGIO CABRAL CHEBEL,SUPLENTE,PP,PARTIDO PROGRESSISTA,1
VÁRZEA PAULISTA,DEPUTADO ESTADUAL,SIMONY,SIMONY BENELLI GALASSO,SUPLENTE,PP,PARTIDO PROGRESSISTA,10
VÁRZEA PAULISTA,DEPUTADO ESTADUAL,MAJOR ROLIM,JOÃO PAULO ROLIM MARQUES,SUPLENTE,PP,PARTIDO PROGRESSISTA,1
VÁRZEA PAULISTA,DEPUTADO ESTADUAL,RIBEIRÃO,ANTONIO ALVES DE SOUZA,SUPLENTE,PP,PARTIDO PROGRESSISTA,1
VÁRZEA PAULISTA,DEPUTADO ESTADUAL,DIOGO TICLY,DIOGO GAZZE TICLY,SUPLENTE,PP,PARTIDO PROGRESSISTA,3
VÁRZEA PAULISTA,DEPUTADO ESTADUAL,JOSE DIAS,JOSE DIAS DA SILVA,SUPLENTE,PP,PARTIDO PROGRESSISTA,1
VÁRZEA PAULISTA,DEPUTADO ESTADUAL,DR. EDUARDO,EDUARDO DE MORAES,SUPLENTE,PP,PARTIDO PROGRESSISTA,2
VÁRZEA PAULISTA,DEPUTADO ESTADUAL,JOÃO ARAUJO,JOÃO ANTONIO DE ARAUJO,SUPLENTE,PP,PARTIDO PROGRESSISTA,1
VÁRZEA PAULISTA,DEPUTADO ESTADUAL,DR. IRINEU,IRINEU CARDOSO DOS SANTOS,SUPLENTE,PP,PARTIDO PROGRESSISTA,3
VÁRZEA PAULISTA,DEPUTADO ESTADUAL,MARIA CLEMENTINA,MARIA CLEMENTINO DE SOUSA,SUPLENTE,PP,PARTIDO PROGRESSISTA,7
VÁRZEA PAULISTA,DEPUTADO ESTADUAL,ELIAS CAMARGO,ELIAS CAMARGO,SUPLENTE,PP,PARTIDO PROGRESSISTA,1
VÁRZEA PAULISTA,DEPUTADO ESTADUAL,RAFA ZIMBALDI,RAFAEL FERNANDO ZIMBALDI,SUPLENTE,PP,PARTIDO PROGRESSISTA,13
VÁRZEA PAULISTA,DEPUTADO ESTADUAL,KAKA SEABRA,CARLOS ANTONIO SEABRA,SUPLENTE,PP,PARTIDO PROGRESSISTA,1
VÁRZEA PAULISTA,DEPUTADO ESTADUAL,RUSSOMANNO,MOZART ABAETE PERUIBE RUSSOMANNO,SUPLENTE,PP,PARTIDO PROGRESSISTA,9
VÁRZEA PAULISTA,DEPUTADO ESTADUAL,MIL DE LIMA,EDMIMILSON APARECIDO DE LIMA,SUPLENTE,PP,PARTIDO PROGRESSISTA,83
VÁRZEA PAULISTA,DEPUTADO ESTADUAL,PAULERA,PAULO ROBERTO AMBROSIO,SUPLENTE,PP,PARTIDO PROGRESSISTA,6
VÁRZEA PAULISTA,DEPUTADO ESTADUAL,AURELIO,AURELIO JOSE CLAUDIO,SUPLENTE,PDT,PARTIDO DEMOCRÁTICO TRABALHISTA,13
VÁRZEA PAULISTA,DEPUTADO ESTADUAL,DR ABDALA,ALEXANDRE ABDALA JUNIOR,SUPLENTE,PDT,PARTIDO DEMOCRÁTICO TRABALHISTA,1
VÁRZEA PAULISTA,DEPUTADO ESTADUAL,KLAUDIO CÓFFANI,KLAUDIO COFFANI NUNES,SUPLENTE,PDT,PARTIDO DEMOCRÁTICO TRABALHISTA,2
VÁRZEA PAULISTA,DEPUTADO ESTADUAL,LUIS YABIKU,LUIS MOKITI YABIKU,SUPLENTE,PDT,PARTIDO DEMOCRÁTICO TRABALHISTA,13
VÁRZEA PAULISTA,DEPUTADO ESTADUAL,DINEI,CLAUDINEI ALEXANDRE PIRES,SUPLENTE,PDT,PARTIDO DEMOCRÁTICO TRABALHISTA,72
VÁRZEA PAULISTA,DEPUTADO ESTADUAL,AUREO PRETO,AUREO RODRIGUES DE SOUZA,SUPLENTE,PDT,PARTIDO DEMOCRÁTICO TRABALHISTA,1
VÁRZEA PAULISTA,DEPUTADO ESTADUAL,FRANCISCO JUNIOR,FRANCISCO PEREIRA COSTA JUNIOR,SUPLENTE,PDT,PARTIDO DEMOCRÁTICO TRABALHISTA,3
VÁRZEA PAULISTA,DEPUTADO ESTADUAL,GILBERTO DOURADO,GILBERTO RODRIGUES DOURADO,SUPLENTE,PDT,PARTIDO DEMOCRÁTICO TRABALHISTA,4
VÁRZEA PAULISTA,DEPUTADO ESTADUAL,ROGERIO NOGUEIRA,ROGERIO NOGUEIRA LOPES CRUZ,ELEITO,PDT,PARTIDO DEMOCRÁTICO TRABALHISTA,4
VÁRZEA PAULISTA,DEPUTADO ESTADUAL,CAPITAO LUCAS,AURO LUCAS,SUPLENTE,PDT,PARTIDO DEMOCRÁTICO TRABALHISTA,14
VÁRZEA PAULISTA,DEPUTADO ESTADUAL,LUIZ ARRAES,LUIZ DE SOUZA ARRAES,SUPLENTE,PDT,PARTIDO DEMOCRÁTICO TRABALHISTA,5
VÁRZEA PAULISTA,DEPUTADO ESTADUAL,JOSE BITTENCOURT,JOSE DOMINGOS BITTENCOURT,ELEITO,PDT,PARTIDO DEMOCRÁTICO TRABALHISTA,7
VÁRZEA PAULISTA,DEPUTADO ESTADUAL,MAJOR OLIMPIO,SERGIO OLIMPIO GOMES,ELEITO,PDT,PARTIDO DEMOCRÁTICO TRABALHISTA,66
VÁRZEA PAULISTA,DEPUTADO ESTADUAL,THIAGO RODRIGUES,THIAGO RODRIGUES DA COSTA,SUPLENTE,PDT,PARTIDO DEMOCRÁTICO TRABALHISTA,3
VÁRZEA PAULISTA,DEPUTADO ESTADUAL,CARLAO MOTORISTA,ANTONIO CARLOS RIBEIRO,SUPLENTE,PDT,PARTIDO DEMOCRÁTICO TRABALHISTA,2
VÁRZEA PAULISTA,DEPUTADO ESTADUAL,JOCA VASCONCELOS,JOAO CARLOS MONTE CLARO VASCONCELOS,SUPLENTE,PDT,PARTIDO DEMOCRÁTICO TRABALHISTA,23
VÁRZEA PAULISTA,DEPUTADO ESTADUAL,AMON VIOLEIRO,AMOMM HEBROM DA HORA DE DEUS SOUZA,SUPLENTE,PDT,PARTIDO DEMOCRÁTICO TRABALHISTA,7
VÁRZEA PAULISTA,DEPUTADO ESTADUAL,CARLOS HERNANDES,JOSÉ CARLOS SANCHES HERNANDES,SUPLENTE,PDT,PARTIDO DEMOCRÁTICO TRABALHISTA,3
VÁRZEA PAULISTA,DEPUTADO ESTADUAL,NICOLACI,RONALD LUIZ NICOLACI FINCATTI,SUPLENTE,PDT,PARTIDO DEMOCRÁTICO TRABALHISTA,1
VÁRZEA PAULISTA,DEPUTADO ESTADUAL,BRUZAROSCO,APARECIDO DE JESUS BRUZAROSCO,SUPLENTE,PDT,PARTIDO DEMOCRÁTICO TRABALHISTA,8
VÁRZEA PAULISTA,DEPUTADO ESTADUAL,RAFAEL SILVA,RAFAEL ANTONIO DA SILVA,ELEITO,PDT,PARTIDO DEMOCRÁTICO TRABALHISTA,33
VÁRZEA PAULISTA,DEPUTADO ESTADUAL,TOLOI,LUIZ CARLOS TOLOI JUNIOR,SUPLENTE,PDT,PARTIDO DEMOCRÁTICO TRABALHISTA,4
VÁRZEA PAULISTA,DEPUTADO ESTADUAL,TADEU MORAIS,TADEU MORAIS DE SOUSA,SUPLENTE,PDT,PARTIDO DEMOCRÁTICO TRABALHISTA,75
VÁRZEA PAULISTA,DEPUTADO ESTADUAL,PROFESSOR VENANCIO,ANTONIO CARLOS VENANCIO,SUPLENTE,PDT,PARTIDO DEMOCRÁTICO TRABALHISTA,1
VÁRZEA PAULISTA,DEPUTADO ESTADUAL,LEONICE DA PAZ,LEONICE ALVES DA PAZ,SUPLENTE,PDT,PARTIDO DEMOCRÁTICO TRABALHISTA,2
VÁRZEA PAULISTA,DEPUTADO ESTADUAL,HELIO BASTOS,HELIO DE ALMEIDA BASTOS,SUPLENTE,PDT,PARTIDO DEMOCRÁTICO TRABALHISTA,1
