PEDREIRA,DEPUTADO FEDERAL,JUNIOR APRILLANTI,JOSÉ ROBERTO APRILLANTI JUNIOR,SUPLENTE,PC DO B,JUNTOS POR SÃO PAULO,1
PEDREIRA,DEPUTADO FEDERAL,CÉLIO TURINO,CÉLIO ROBERTO TURINO DE MIRANDA,SUPLENTE,PC DO B,JUNTOS POR SÃO PAULO,19
PEDREIRA,DEPUTADO FEDERAL,ALDO REBELO,JOSÉ ALDO REBELO FIGUEIREDO,ELEITO,PC DO B,JUNTOS POR SÃO PAULO,353
PEDREIRA,DEPUTADO FEDERAL,DELEGADO PROTÓGENES,PROTÓGENES PINHEIRO DE QUEIROZ,MÉDIA,PC DO B,JUNTOS POR SÃO PAULO,20
PEDREIRA,DEPUTADO ESTADUAL,GERSON DEZEMBRO,GERSON DONIZETI DEZEMBRO,SUPLENTE,PRB,SOMOS MAIS SÃO PAULO,4
PEDREIRA,DEPUTADO ESTADUAL,GILMACI SANTOS,GILMACI DOS SANTOS BARBOSA,ELEITO,PRB,SOMOS MAIS SÃO PAULO,5
PEDREIRA,DEPUTADO ESTADUAL,SEBASTIÃO SANTOS,SEBASTIÃO DOS SANTOS FILHO,ELEITO,PRB,SOMOS MAIS SÃO PAULO,98
PEDREIRA,DEPUTADO ESTADUAL,RICARDO SARAVALLI,RICARDO SARAVALLI,SUPLENTE,PP,PARTIDO PROGRESSISTA,3
PEDREIRA,DEPUTADO ESTADUAL,CURIATI,ANTONIO SALIM CURIATI,ELEITO,PP,PARTIDO PROGRESSISTA,17
PEDREIRA,DEPUTADO ESTADUAL,VALDIR DA SILVA,VALDIR DA SILVA,SUPLENTE,PP,PARTIDO PROGRESSISTA,1
PEDREIRA,DEPUTADO ESTADUAL,HALEPLIAN,SYLVIO HALEPLIAN FILHO,SUPLENTE,PP,PARTIDO PROGRESSISTA,1
PEDREIRA,DEPUTADO ESTADUAL,SARGENTO REIS,MARIO JOSÉ DOS REIS,SUPLENTE,PP,PARTIDO PROGRESSISTA,29
PEDREIRA,DEPUTADO ESTADUAL,SIMONY,SIMONY BENELLI GALASSO,SUPLENTE,PP,PARTIDO PROGRESSISTA,4
PEDREIRA,DEPUTADO ESTADUAL,RAIMUNDO DA AÇÃO,RAIMUNDO SILISTRO DE OLIVEIRA,SUPLENTE,PP,PARTIDO PROGRESSISTA,4
PEDREIRA,DEPUTADO ESTADUAL,CELSO LEITE,CELSO MARCELINO LEITE,SUPLENTE,PP,PARTIDO PROGRESSISTA,1
PEDREIRA,DEPUTADO ESTADUAL,JOSE DIAS,JOSE DIAS DA SILVA,SUPLENTE,PP,PARTIDO PROGRESSISTA,40
PEDREIRA,DEPUTADO ESTADUAL,MARIA CLEMENTINA,MARIA CLEMENTINO DE SOUSA,SUPLENTE,PP,PARTIDO PROGRESSISTA,3
PEDREIRA,DEPUTADO ESTADUAL,PRADO,ALEXANDRE DO PRADO,SUPLENTE,PP,PARTIDO PROGRESSISTA,4
PEDREIRA,DEPUTADO ESTADUAL,RAFA ZIMBALDI,RAFAEL FERNANDO ZIMBALDI,SUPLENTE,PP,PARTIDO PROGRESSISTA,41
PEDREIRA,DEPUTADO ESTADUAL,RUSSOMANNO,MOZART ABAETE PERUIBE RUSSOMANNO,SUPLENTE,PP,PARTIDO PROGRESSISTA,29
PEDREIRA,DEPUTADO ESTADUAL,AURELIO,AURELIO JOSE CLAUDIO,SUPLENTE,PDT,PARTIDO DEMOCRÁTICO TRABALHISTA,472
PEDREIRA,DEPUTADO ESTADUAL,ROGERIO ESPERANÇA,ROGERIO ANTONIO ESPERANCA,SUPLENTE,PDT,PARTIDO DEMOCRÁTICO TRABALHISTA,8
PEDREIRA,DEPUTADO ESTADUAL,LUIS YABIKU,LUIS MOKITI YABIKU,SUPLENTE,PDT,PARTIDO DEMOCRÁTICO TRABALHISTA,14
PEDREIRA,DEPUTADO ESTADUAL,DINEI,CLAUDINEI ALEXANDRE PIRES,SUPLENTE,PDT,PARTIDO DEMOCRÁTICO TRABALHISTA,18
PEDREIRA,DEPUTADO ESTADUAL,AUREO PRETO,AUREO RODRIGUES DE SOUZA,SUPLENTE,PDT,PARTIDO DEMOCRÁTICO TRABALHISTA,1
PEDREIRA,DEPUTADO ESTADUAL,ROGERIO NOGUEIRA,ROGERIO NOGUEIRA LOPES CRUZ,ELEITO,PDT,PARTIDO DEMOCRÁTICO TRABALHISTA,45
PEDREIRA,DEPUTADO ESTADUAL,JOSE BITTENCOURT,JOSE DOMINGOS BITTENCOURT,ELEITO,PDT,PARTIDO DEMOCRÁTICO TRABALHISTA,13
PEDREIRA,DEPUTADO ESTADUAL,MAJOR OLIMPIO,SERGIO OLIMPIO GOMES,ELEITO,PDT,PARTIDO DEMOCRÁTICO TRABALHISTA,15
PEDREIRA,DEPUTADO ESTADUAL,CARLAO MOTORISTA,ANTONIO CARLOS RIBEIRO,SUPLENTE,PDT,PARTIDO DEMOCRÁTICO TRABALHISTA,1
PEDREIRA,DEPUTADO ESTADUAL,MARCOS BERNARDELLI,MARCOS JOSÉ BERNARDELLI,SUPLENTE,PDT,PARTIDO DEMOCRÁTICO TRABALHISTA,9
PEDREIRA,DEPUTADO ESTADUAL,JOCA VASCONCELOS,JOAO CARLOS MONTE CLARO VASCONCELOS,SUPLENTE,PDT,PARTIDO DEMOCRÁTICO TRABALHISTA,44
PEDREIRA,DEPUTADO ESTADUAL,AMON VIOLEIRO,AMOMM HEBROM DA HORA DE DEUS SOUZA,SUPLENTE,PDT,PARTIDO DEMOCRÁTICO TRABALHISTA,1
PEDREIRA,DEPUTADO ESTADUAL,NICOLACI,RONALD LUIZ NICOLACI FINCATTI,SUPLENTE,PDT,PARTIDO DEMOCRÁTICO TRABALHISTA,1
PEDREIRA,DEPUTADO ESTADUAL,BRUZAROSCO,APARECIDO DE JESUS BRUZAROSCO,SUPLENTE,PDT,PARTIDO DEMOCRÁTICO TRABALHISTA,1
PEDREIRA,DEPUTADO ESTADUAL,RAFAEL SILVA,RAFAEL ANTONIO DA SILVA,ELEITO,PDT,PARTIDO DEMOCRÁTICO TRABALHISTA,18
PEDREIRA,DEPUTADO ESTADUAL,LEONICE DA PAZ,LEONICE ALVES DA PAZ,SUPLENTE,PDT,PARTIDO DEMOCRÁTICO TRABALHISTA,5
PEDREIRA,DEPUTADO ESTADUAL,HELIO BASTOS,HELIO DE ALMEIDA BASTOS,SUPLENTE,PDT,PARTIDO DEMOCRÁTICO TRABALHISTA,1
PEDREIRA,DEPUTADO ESTADUAL,WENDEL ALVES,WENDEL ALVES DE SOUSA,SUPLENTE,PDT,PARTIDO DEMOCRÁTICO TRABALHISTA,11
PEDREIRA,DEPUTADO ESTADUAL,CONSTANCIA FELIX,CONSTANCIA BERBERT DUTRA DA SILVA,SUPLENTE,PDT,PARTIDO DEMOCRÁTICO TRABALHISTA,42
PEDREIRA,DEPUTADO ESTADUAL,MARCO BRASIL,MARCO AURÉLIO RIBEIRO,SUPLENTE,PDT,PARTIDO DEMOCRÁTICO TRABALHISTA,6
PEDREIRA,DEPUTADO ESTADUAL,ANDERSON SILVA,ANDERSON DOMINGOS DA SILVA,SUPLENTE,PT,SOMOS MAIS SÃO PAULO,5
PEDREIRA,DEPUTADO ESTADUAL,TELMA DE SOUZA,TELMA SANDRA AUGUSTO DE SOUZA,ELEITO,PT,SOMOS MAIS SÃO PAULO,6
PEDREIRA,DEPUTADO ESTADUAL,PEDRO BIANGULI,PEDRO CARLOS BIANGULI DE FARIA,SUPLENTE,PT,SOMOS MAIS SÃO PAULO,4
PEDREIRA,DEPUTADO ESTADUAL,WAGNER BALIEIRO,WAGNER OCIMAR BALIEIRO,SUPLENTE,PT,SOMOS MAIS SÃO PAULO,1
PEDREIRA,DEPUTADO ESTADUAL,PROFESSOR CLEITON GOMES,CLEITON GOMES DA SILVA,SUPLENTE,PT,SOMOS MAIS SÃO PAULO,1
PEDREIRA,DEPUTADO ESTADUAL,GALENO AMORIM,GALENO DE AMORIM JUNIOR,SUPLENTE,PT,SOMOS MAIS SÃO PAULO,3
PEDREIRA,DEPUTADO ESTADUAL,ENGª MÔNICA BOMBONATO,MÔNICA ESTELA BOMBONATO,SUPLENTE,PT,SOMOS MAIS SÃO PAULO,3555
PEDREIRA,DEPUTADO ESTADUAL,JURA,JURACY FRANCISCO DE JESUS,SUPLENTE,PT,SOMOS MAIS SÃO PAULO,3
PEDREIRA,DEPUTADO ESTADUAL,GERSON BITTENCOURT,GERSON LUIS BITTENCOURT,ELEITO,PT,SOMOS MAIS SÃO PAULO,3
PEDREIRA,DEPUTADO ESTADUAL,EDINHO SILVA,EDSON ANTONIO EDINHO DA SILVA,ELEITO,PT,SOMOS MAIS SÃO PAULO,44
PEDREIRA,DEPUTADO ESTADUAL,ANA PERUGINI,ANA LUCIA LIPPAUS PERUGINI,ELEITO,PT,SOMOS MAIS SÃO PAULO,342
PEDREIRA,DEPUTADO ESTADUAL,TONINHO DO PT,ANTONIO AMARAL JUNIOR,SUPLENTE,PT,SOMOS MAIS SÃO PAULO,7
PEDREIRA,DEPUTADO ESTADUAL,ZICO,JOSÉ PRADO DE ANDRADE,MÉDIA,PT,SOMOS MAIS SÃO PAULO,7
PEDREIRA,DEPUTADO ESTADUAL,MARCO AURÉLIO DE SOUZA,MARCO AURÉLIO DE SOUZA,MÉDIA,PT,SOMOS MAIS SÃO PAULO,3
PEDREIRA,DEPUTADO ESTADUAL,MARCOS MARTINS,MARCOS LOPES MARTINS,ELEITO,PT,SOMOS MAIS SÃO PAULO,73
PEDREIRA,DEPUTADO ESTADUAL,DR. LUIZINHO,LUIS CARLOS LAURINDO,SUPLENTE,PT,SOMOS MAIS SÃO PAULO,3
PEDREIRA,DEPUTADO ESTADUAL,ELI TEODORO,ELI TEODORO,SUPLENTE,PT,SOMOS MAIS SÃO PAULO,3
PEDREIRA,DEPUTADO ESTADUAL,SIMÃO PEDRO,SIMÃO PEDRO CHIOVETTI,ELEITO,PT,SOMOS MAIS SÃO PAULO,9
PEDREIRA,DEPUTADO ESTADUAL,ANTONIO MENTOR,ANTONIO MENTOR DE MELLO SOBRINHO,ELEITO,PT,SOMOS MAIS SÃO PAULO,378
PEDREIRA,DEPUTADO ESTADUAL,CRISTINA DA USP,CRISTINA SIMOES,SUPLENTE,PT,SOMOS MAIS SÃO PAULO,1
PEDREIRA,DEPUTADO ESTADUAL,PADRE JUZEMILDO,JUZEMILDO ALBINO DA SILVA,SUPLENTE,PT,SOMOS MAIS SÃO PAULO,7
PEDREIRA,DEPUTADO ESTADUAL,ADRIANO DIOGO,ADRIANO DIOGO,ELEITO,PT,SOMOS MAIS SÃO PAULO,6
PEDREIRA,DEPUTADO ESTADUAL,HAMILTON PEREIRA,HAMILTON PEREIRA,ELEITO,PT,SOMOS MAIS SÃO PAULO,2
PEDREIRA,DEPUTADO ESTADUAL,EUVANILDE,EUVANILDE RODRIGUES DA SILVA,SUPLENTE,PT,SOMOS MAIS SÃO PAULO,1
PEDREIRA,DEPUTADO ESTADUAL,LUIZ CLAUDIO MARCOLINO,LUIZ CLAUDIO MARCOLINO,ELEITO,PT,SOMOS MAIS SÃO PAULO,2
PEDREIRA,DEPUTADO ESTADUAL,NATIVIDADE,MARIA DA NATIVIDADE PEREIRA LIMA,SUPLENTE,PT,SOMOS MAIS SÃO PAULO,4
PEDREIRA,DEPUTADO ESTADUAL,ROBERTO FELICIO,ROBERTO FELICIO,SUPLENTE,PT,SOMOS MAIS SÃO PAULO,9
PEDREIRA,DEPUTADO ESTADUAL,RAFAEL AGOSTINI,RAFAEL LUNARDELLI AGOSTINI,SUPLENTE,PT,SOMOS MAIS SÃO PAULO,1
PEDREIRA,DEPUTADO ESTADUAL,FRANCISCO FRANÇA,FRANCISCO FRANÇA DA SILVA,SUPLENTE,PT,SOMOS MAIS SÃO PAULO,1
PEDREIRA,DEPUTADO ESTADUAL,ALENCAR,ALENCAR SANTANA BRAGA,ELEITO,PT,SOMOS MAIS SÃO PAULO,2
PEDREIRA,DEPUTADO ESTADUAL,TIÃOZINHO,SEBASTIÃO MOREIREA ARCANJO,SUPLENTE,PT,SOMOS MAIS SÃO PAULO,39
PEDREIRA,DEPUTADO ESTADUAL,BRENO CORTELLA,BRENO ZANONI CORTELLA,SUPLENTE,PT,SOMOS MAIS SÃO PAULO,1
PEDREIRA,DEPUTADO ESTADUAL,JOSÉ CANDIDO,JOSÉ DE SOUZA CÂNDIDO,MÉDIA,PT,SOMOS MAIS SÃO PAULO,1
PEDREIRA,DEPUTADO ESTADUAL,GALLO,JURANDIR GALLO,SUPLENTE,PT,SOMOS MAIS SÃO PAULO,2
PEDREIRA,DEPUTADO ESTADUAL,LINEU NAVARRO,LUIZ ANTONIO NAVARRO MAGALHÃES LUZ,SUPLENTE,PT,SOMOS MAIS SÃO PAULO,1
PEDREIRA,DEPUTADO ESTADUAL,ZÉ ARISTEIA,JOSÉ ARISTEIA PEREIRA,SUPLENTE,PT,SOMOS MAIS SÃO PAULO,1
PEDREIRA,DEPUTADO ESTADUAL,TITO,FRANCISCO DE ASSIS PEREIRA DE CAMPOS,SUPLENTE,PT,SOMOS MAIS SÃO PAULO,2
PEDREIRA,DEPUTADO ESTADUAL,GILSON PELIZARO,GILSON DONIZETE PELIZARO,SUPLENTE,PT,SOMOS MAIS SÃO PAULO,1
PEDREIRA,DEPUTADO ESTADUAL,PROFESSOR HERCULANO,JOSÉ HERCULANO DA SILVA,SUPLENTE,PT,SOMOS MAIS SÃO PAULO,65
PEDREIRA,DEPUTADO ESTADUAL,CARLOS NEDER,CARLOS ALBERTO PLETZ NEDER,SUPLENTE,PT,SOMOS MAIS SÃO PAULO,1
PEDREIRA,DEPUTADO ESTADUAL,LÉO ÁQUILLA,JADSON MENDES DE LIMA,SUPLENTE,PTB,PARTIDO TRABALHISTA BRASILEIRO,7
PEDREIRA,DEPUTADO ESTADUAL,LUIZ LAZARINI,LUIZ CARLOS LAZARINI,SUPLENTE,PTB,PARTIDO TRABALHISTA BRASILEIRO,4
PEDREIRA,DEPUTADO ESTADUAL,DR ANEZIO,ANEZIO VIEIRA DA SILVA,SUPLENTE,PTB,PARTIDO TRABALHISTA BRASILEIRO,5
PEDREIRA,DEPUTADO ESTADUAL,CONTE LOPES,ROBERVAL CONTE LOPES LIMA,SUPLENTE,PTB,PARTIDO TRABALHISTA BRASILEIRO,7
PEDREIRA,DEPUTADO ESTADUAL,CAMPOS MACHADO,ANTONIO CARLOS DE CAMPOS MACHADO,ELEITO,PTB,PARTIDO TRABALHISTA BRASILEIRO,12
PEDREIRA,DEPUTADO ESTADUAL,HEROILMA SOARES TAVARES,HEROILMA SOARES TAVARES,MÉDIA,PTB,PARTIDO TRABALHISTA BRASILEIRO,1
PEDREIRA,DEPUTADO ESTADUAL,CORONEL EDSON FERRARINI,EDSON FERRARINI,ELEITO,PTB,PARTIDO TRABALHISTA BRASILEIRO,32
PEDREIRA,DEPUTADO ESTADUAL,MIGUELZINHO,MIGUEL PEREIRA DE SOUZA,SUPLENTE,PTB,PARTIDO TRABALHISTA BRASILEIRO,1
PEDREIRA,DEPUTADO ESTADUAL,JOSE FERRO,JOSE FERREIRA FERRO DA SILVA,SUPLENTE,PTB,PARTIDO TRABALHISTA BRASILEIRO,1
PEDREIRA,DEPUTADO ESTADUAL,GERSINHO ROMERO,GERSON MOREIRA ROMERO,SUPLENTE,PTB,PARTIDO TRABALHISTA BRASILEIRO,11
PEDREIRA,DEPUTADO ESTADUAL,VAL,ENIVALDO RAMOS DE FREITAS,SUPLENTE,PTB,PARTIDO TRABALHISTA BRASILEIRO,1
PEDREIRA,DEPUTADO ESTADUAL,CIDO ESPANHA,APARECIDO ESPANHA,SUPLENTE,PTB,PARTIDO TRABALHISTA BRASILEIRO,3
PEDREIRA,DEPUTADO ESTADUAL,WALDIR AGNELLO,WALDIR AGNELLO,SUPLENTE,PTB,PARTIDO TRABALHISTA BRASILEIRO,2
PEDREIRA,DEPUTADO ESTADUAL,ITALO RENE,ITALO RENE CORREA,SUPLENTE,PTB,PARTIDO TRABALHISTA BRASILEIRO,1
PEDREIRA,DEPUTADO ESTADUAL,GILBERTO DO PRIMAVERA,GILBERTO WACHTLER,SUPLENTE,PTB,PARTIDO TRABALHISTA BRASILEIRO,2
PEDREIRA,DEPUTADO ESTADUAL,BALEIA ROSSI,LUIZ FELIPE BALEIA TENUTO ROSSI,ELEITO,PMDB,PARTIDO DO MOVIMENTO DEMOCRÁTICO BRASILEIRO,28
PEDREIRA,DEPUTADO ESTADUAL,DRA ADRIANA,ADRIANA DI NARDO SILVA,SUPLENTE,PMDB,PARTIDO DO MOVIMENTO DEMOCRÁTICO BRASILEIRO,15
PEDREIRA,DEPUTADO ESTADUAL,BEBETTO,ALBERTO FELIPPE HADDAD FILHO,SUPLENTE,PMDB,PARTIDO DO MOVIMENTO DEMOCRÁTICO BRASILEIRO,3
PEDREIRA,DEPUTADO ESTADUAL,THIAGO FERRARI,THIAGO DE MORAES FERRARI,SUPLENTE,PMDB,PARTIDO DO MOVIMENTO DEMOCRÁTICO BRASILEIRO,18
PEDREIRA,DEPUTADO ESTADUAL,DR. ITAMAR,ITAMAR COPPIO,SUPLENTE,PMDB,PARTIDO DO MOVIMENTO DEMOCRÁTICO BRASILEIRO,1
PEDREIRA,DEPUTADO ESTADUAL,DU TONIN,EDUARDO TONIN,SUPLENTE,PMDB,PARTIDO DO MOVIMENTO DEMOCRÁTICO BRASILEIRO,1
PEDREIRA,DEPUTADO ESTADUAL,IBRAIM,IBRAIM ANTONIO ABOU JOKH,SUPLENTE,PMDB,PARTIDO DO MOVIMENTO DEMOCRÁTICO BRASILEIRO,1
PEDREIRA,DEPUTADO ESTADUAL,CARUSO,JORGE LUIS CARUSO,ELEITO,PMDB,PARTIDO DO MOVIMENTO DEMOCRÁTICO BRASILEIRO,10
PEDREIRA,DEPUTADO ESTADUAL,SERGIO BERGAMASCO,ANTONIO SERGIO PIRES BERGAMASCO,SUPLENTE,PMDB,PARTIDO DO MOVIMENTO DEMOCRÁTICO BRASILEIRO,239
PEDREIRA,DEPUTADO ESTADUAL,VANESSA DAMO,VANESSA DAMO OROSCO,ELEITO,PMDB,PARTIDO DO MOVIMENTO DEMOCRÁTICO BRASILEIRO,3
PEDREIRA,DEPUTADO ESTADUAL,CAMARGO,DOMINGOS FERREIRA DE CAMARGO,SUPLENTE,PMDB,PARTIDO DO MOVIMENTO DEMOCRÁTICO BRASILEIRO,4
PEDREIRA,DEPUTADO ESTADUAL,VALDOMIRO,VALDOMIRO FRANCISCO DE OLIVEIRA,SUPLENTE,PMDB,PARTIDO DO MOVIMENTO DEMOCRÁTICO BRASILEIRO,1
PEDREIRA,DEPUTADO ESTADUAL,UEBE REZECK,UEBE REZECK,SUPLENTE,PMDB,PARTIDO DO MOVIMENTO DEMOCRÁTICO BRASILEIRO,1
PEDREIRA,DEPUTADO ESTADUAL,ITAMAR BORGES,ITAMAR FRANCISCO MACHADO BORGES,MÉDIA,PMDB,PARTIDO DO MOVIMENTO DEMOCRÁTICO BRASILEIRO,21
PEDREIRA,DEPUTADO ESTADUAL,MARIA DO CARMO GUILHERME,MARIA DO CARMO GUILHERME,SUPLENTE,PMDB,PARTIDO DO MOVIMENTO DEMOCRÁTICO BRASILEIRO,1
PEDREIRA,DEPUTADO ESTADUAL,SOUZA VIGILANTE,JOSÉ CLAUDIVAM DOS SANTOS SOUZA,SUPLENTE,PMDB,PARTIDO DO MOVIMENTO DEMOCRÁTICO BRASILEIRO,2
PEDREIRA,DEPUTADO ESTADUAL,JOOJI HATO,JOOJI HATO,ELEITO,PMDB,PARTIDO DO MOVIMENTO DEMOCRÁTICO BRASILEIRO,6
PEDREIRA,DEPUTADO ESTADUAL,ALEXANDRE CUNHA,ALEXANDRE EVARISTO CUNHA,SUPLENTE,PMDB,PARTIDO DO MOVIMENTO DEMOCRÁTICO BRASILEIRO,2
PEDREIRA,DEPUTADO ESTADUAL,APOSTOLO EURIPEDES,EURIPEDES LUIZ DE SOUSA,SUPLENTE,PSC,HUMANISTA CRISTÃO ,1
PEDREIRA,DEPUTADO ESTADUAL,ALAN NETO,ANTONIO CARLOS BARBOSA NEVES,SUPLENTE,PSC,HUMANISTA CRISTÃO ,2
PEDREIRA,DEPUTADO ESTADUAL,DR. CLAUDIO MIRANDA,CLAUDIO ERNANI MARCONDES DE MIRANDA,SUPLENTE,PSC,HUMANISTA CRISTÃO ,2
PEDREIRA,DEPUTADO ESTADUAL,LELIS TRAJANO,LELIS JOSE TRAJANO,SUPLENTE,PSC,HUMANISTA CRISTÃO ,2
PEDREIRA,DEPUTADO ESTADUAL,PASTOR VIEIRA ROCHA,JOSE VIEIRA ROCHA,SUPLENTE,PSC,HUMANISTA CRISTÃO ,54
PEDREIRA,DEPUTADO ESTADUAL,PR. CARLOS CEZAR,CARLOS CEZAR DA SILVA,ELEITO,PSC,HUMANISTA CRISTÃO ,74
PEDREIRA,DEPUTADO ESTADUAL,JAIMINHO,JAIME DONIZETE PEREIRA,SUPLENTE,PSC,HUMANISTA CRISTÃO ,5
PEDREIRA,DEPUTADO ESTADUAL,LUIZ LAURO,LUIZ LAURO FERREIRA,SUPLENTE,PSC,HUMANISTA CRISTÃO ,155
PEDREIRA,DEPUTADO ESTADUAL,LUIZ BUENO,LUIZ CARLOS BUENO DA SILVA JUNIOR,SUPLENTE,PSC,HUMANISTA CRISTÃO ,3
PEDREIRA,DEPUTADO ESTADUAL,ZE INDIO,JOSE FERREIRA DO NASCIMENTO,SUPLENTE,PSC,HUMANISTA CRISTÃO ,5
PEDREIRA,DEPUTADO ESTADUAL,JOÃO BINATO,JOÃO ANTONIO BINATO,SUPLENTE,PSC,HUMANISTA CRISTÃO ,45
PEDREIRA,DEPUTADO ESTADUAL,PASTOR JOÃO LUIZ NETO,JOÃO LUIZ NETO,SUPLENTE,PSC,HUMANISTA CRISTÃO ,20
PEDREIRA,DEPUTADO ESTADUAL,ATALAIA,JOSE ROBERTO DE OLIVEIRA,SUPLENTE,PSC,HUMANISTA CRISTÃO ,3
PEDREIRA,DEPUTADO ESTADUAL,DELTA BARBOZA TOMASI,DELTA BARBOZA TOMASI,SUPLENTE,PSC,HUMANISTA CRISTÃO ,2
PEDREIRA,DEPUTADO ESTADUAL,GUSTAVO POZZI,GUSTAVO CAETANO POZZI DA CUNHA,SUPLENTE,PSC,HUMANISTA CRISTÃO ,4
PEDREIRA,DEPUTADO ESTADUAL,SAID MOURAD,AHMAD SAID MOURAD,SUPLENTE,PSC,HUMANISTA CRISTÃO ,13
PEDREIRA,DEPUTADO ESTADUAL,RODRIGO MORAES,RODRIGO AUGUSTO MORAES,ELEITO,PSC,HUMANISTA CRISTÃO ,55
PEDREIRA,DEPUTADO ESTADUAL,BRAZ PASSARINHEIRO,BRAZ ANASTACIO DA SILVA,SUPLENTE,PSC,HUMANISTA CRISTÃO ,2
PEDREIRA,DEPUTADO ESTADUAL,NELSON FERNANDES,JOSE NELSON AGUIAR FERNANDES,SUPLENTE,PSC,HUMANISTA CRISTÃO ,6
PEDREIRA,DEPUTADO ESTADUAL,WALTER GOMES,WALTER GOMES DE OLIVEIRA,SUPLENTE,PR,SOMOS MAIS SÃO PAULO,1
PEDREIRA,DEPUTADO ESTADUAL,ZE PEDRO,JOSE PEDRO LEITE DA SILVA,SUPLENTE,PR,SOMOS MAIS SÃO PAULO,28
PEDREIRA,DEPUTADO ESTADUAL,LILI AIMAR,LILIANA MEDEIROS DE ALMEIDA AYMAR BECHARA,SUPLENTE,PR,SOMOS MAIS SÃO PAULO,1
PEDREIRA,DEPUTADO ESTADUAL,ALEXANDRE DA FARMACIA,ALEXANDRE JOSE DA CUNHA,SUPLENTE,PR,SOMOS MAIS SÃO PAULO,2
PEDREIRA,DEPUTADO ESTADUAL,PATRICIA LIMA,PATRICIA FREITAS LIMA,SUPLENTE,PR,SOMOS MAIS SÃO PAULO,14
PEDREIRA,DEPUTADO ESTADUAL,JOSIAS DINIZ,JOSIAS ANTONIO DINIZ,SUPLENTE,PR,SOMOS MAIS SÃO PAULO,1
PEDREIRA,DEPUTADO ESTADUAL,ROY NELSON,ROY NELSON PINTO,SUPLENTE,PR,SOMOS MAIS SÃO PAULO,1
PEDREIRA,DEPUTADO ESTADUAL,ANDRE DO PRADO,ANDRE LUIS DO PRADO,ELEITO,PR,SOMOS MAIS SÃO PAULO,2
PEDREIRA,DEPUTADO ESTADUAL,EDUARDO REZEK,EDUARDO PEDROSO REZEK,SUPLENTE,PPS,PARTIDO POPULAR SOCIALISTA,1
PEDREIRA,DEPUTADO ESTADUAL,JOSE CARLOS SOARES,JOSE CARLOS SOARES,SUPLENTE,PPS,PARTIDO POPULAR SOCIALISTA,6
PEDREIRA,DEPUTADO ESTADUAL,MAURICIO MIYA,MAURICIO MIYAZAKI,SUPLENTE,PPS,PARTIDO POPULAR SOCIALISTA,2
PEDREIRA,DEPUTADO ESTADUAL,TONINHO ALEIXO,ANTONIO ALEIXO DA COSTA,SUPLENTE,PPS,PARTIDO POPULAR SOCIALISTA,1
PEDREIRA,DEPUTADO ESTADUAL,ADEMIR DA GUIA,ADEMIR DA GUIA,SUPLENTE,PPS,PARTIDO POPULAR SOCIALISTA,51
PEDREIRA,DEPUTADO ESTADUAL,VERA DIAS,VERA LUCIA ROSA DIAS,SUPLENTE,PPS,PARTIDO POPULAR SOCIALISTA,1
PEDREIRA,DEPUTADO ESTADUAL,DAVI ZAIA,DAVID ZAIA,MÉDIA,PPS,PARTIDO POPULAR SOCIALISTA,904
PEDREIRA,DEPUTADO ESTADUAL,JOSE MESSINA,JOSE DE LORENZO MESSINA,SUPLENTE,PPS,PARTIDO POPULAR SOCIALISTA,5
PEDREIRA,DEPUTADO ESTADUAL,ELIAS CARVALHO,ELIAS FERNANDES DE CARVALHO,SUPLENTE,PPS,PARTIDO POPULAR SOCIALISTA,7
PEDREIRA,DEPUTADO ESTADUAL,RUTH CAMACHO,RUTH MYRIAN FERRUFINO CAMACHO KADLUBA,SUPLENTE,PPS,PARTIDO POPULAR SOCIALISTA,1
PEDREIRA,DEPUTADO ESTADUAL,DR. TÚLIO,TULIO JOSE TOMASS DO COUTO,SUPLENTE,PPS,PARTIDO POPULAR SOCIALISTA,2
PEDREIRA,DEPUTADO ESTADUAL,VERONEZZI,JOSE CARLOS VERONEZZI,SUPLENTE,PPS,PARTIDO POPULAR SOCIALISTA,1
PEDREIRA,DEPUTADO ESTADUAL,PALHACINHO PIMPAO,VAGNER LUIZ PIMPAO BERSA,SUPLENTE,PPS,PARTIDO POPULAR SOCIALISTA,1
PEDREIRA,DEPUTADO ESTADUAL,JOAO OTAVIO BASTOS,JOAO OTAVIO BASTOS JUNQUEIRA,SUPLENTE,PPS,PARTIDO POPULAR SOCIALISTA,2
PEDREIRA,DEPUTADO ESTADUAL,VITOR SAPIENZA,VITOR SAPIENZA,SUPLENTE,PPS,PARTIDO POPULAR SOCIALISTA,7
PEDREIRA,DEPUTADO ESTADUAL,JORGE MATOS,JORGE DONIZETTI RIBEIRO DE MATOS,SUPLENTE,PPS,PARTIDO POPULAR SOCIALISTA,2
PEDREIRA,DEPUTADO ESTADUAL,MIRO LEITÃO,ANTONIO ARGEMIRO ALVES LEITÃO,SUPLENTE,PPS,PARTIDO POPULAR SOCIALISTA,2
PEDREIRA,DEPUTADO ESTADUAL,DIRCEU DALBEN,ANTONIO DIRCEU DALBEN,SUPLENTE,PPS,PARTIDO POPULAR SOCIALISTA,1
PEDREIRA,DEPUTADO ESTADUAL,GONDIM,LUIZ CARLOS GONDIM TEIXEIRA,ELEITO,PPS,PARTIDO POPULAR SOCIALISTA,4
PEDREIRA,DEPUTADO ESTADUAL,ESTEVÃO,STEVEN ERIKSEN BINNIE,SUPLENTE,PPS,PARTIDO POPULAR SOCIALISTA,3
PEDREIRA,DEPUTADO ESTADUAL,PROFESSOR ZE MARIA,JOSE MARIA CANCELLIERO,SUPLENTE,PPS,PARTIDO POPULAR SOCIALISTA,51
PEDREIRA,DEPUTADO ESTADUAL,ROBERTO MORAIS,ROBERTO TURCHI DE MORAIS,ELEITO,PPS,PARTIDO POPULAR SOCIALISTA,11
PEDREIRA,DEPUTADO ESTADUAL,OSMAR SANTOS,OSMAR PINHEIRO DOS SANTOS,SUPLENTE,PPS,PARTIDO POPULAR SOCIALISTA,5
PEDREIRA,DEPUTADO ESTADUAL,DARIO SAADI,DARIO JORGE GIOLO SAADI,SUPLENTE,DEM,PSDB/DEM,187
PEDREIRA,DEPUTADO ESTADUAL,MARCOS FERRAZ,ANTONIO MARCOS MARCONDES FERRAZ,SUPLENTE,DEM,PSDB/DEM,2
PEDREIRA,DEPUTADO ESTADUAL,ANDRE SOARES,ANDRE BEZERRA RIBEIRO SOARES,ELEITO,DEM,PSDB/DEM,24
PEDREIRA,DEPUTADO ESTADUAL,GILSON DE SOUZA,GILSON DE SOUZA,ELEITO,DEM,PSDB/DEM,11
PEDREIRA,DEPUTADO ESTADUAL,MURINGA AMORIM,SHIRLEY PEREJON AMORIM,SUPLENTE,DEM,PSDB/DEM,1
PEDREIRA,DEPUTADO ESTADUAL,RICARDO MUTRAN,RICARDO JORGE MUTRAN,SUPLENTE,DEM,PSDB/DEM,5
PEDREIRA,DEPUTADO ESTADUAL,EDMIR CHEDID,EDMIR JOSE ABI CHEDID,ELEITO,DEM,PSDB/DEM,418
PEDREIRA,DEPUTADO ESTADUAL,ALDO DEMARCHI,JOSE ALDO DEMARCHI,ELEITO,DEM,PSDB/DEM,23
PEDREIRA,DEPUTADO ESTADUAL,JOAO MELLAO NETO,JOAO MELLAO NETO,SUPLENTE,DEM,PSDB/DEM,37
PEDREIRA,DEPUTADO ESTADUAL,FERNANDO LUCAS,LUIZ FERNANDO AMARAL LUCAS,SUPLENTE,DEM,PSDB/DEM,11
PEDREIRA,DEPUTADO ESTADUAL,RICARDO SALLES,RICARDO DE AQUINO SALLES,SUPLENTE,DEM,PSDB/DEM,6
PEDREIRA,DEPUTADO ESTADUAL,LEANDRO DO KLB,LEANDRO FINATO SCORNAVACCA,SUPLENTE,DEM,PSDB/DEM,46
PEDREIRA,DEPUTADO ESTADUAL,EDUARDO BETTIN,CARLOS EDUARDO DA FONSECA BETTIN,SUPLENTE,PHS,HUMANISTA CRISTÃO ,1
PEDREIRA,DEPUTADO ESTADUAL,CHIQUINHO TEXAS,FRANCISCO DANTAS DE LIMA,SUPLENTE,PHS,HUMANISTA CRISTÃO ,1
PEDREIRA,DEPUTADO ESTADUAL,PAULO HADICH,PAULO CEZAR JUNQUEIRA HADICH,SUPLENTE,PSB,PARTIDO SOCIALISTA BRASILEIRO,185
PEDREIRA,DEPUTADO ESTADUAL,BAHIA DA ACADEMIA,ALMIRANDO FERREIRA DO NASCIMENTO,SUPLENTE,PSB,PARTIDO SOCIALISTA BRASILEIRO,1
PEDREIRA,DEPUTADO ESTADUAL,TADEU,IROAN TADEU PORTO DE LIMA,SUPLENTE,PSB,PARTIDO SOCIALISTA BRASILEIRO,2
PEDREIRA,DEPUTADO ESTADUAL,DR. VLAMIR,VLAMIR SÉRGIO D'EMILIO LANDUCCI,SUPLENTE,PSB,PARTIDO SOCIALISTA BRASILEIRO,3
PEDREIRA,DEPUTADO ESTADUAL,DR. GENIVAL,GENIVAL FAUSTO DA SILVA,SUPLENTE,PSB,PARTIDO SOCIALISTA BRASILEIRO,2
PEDREIRA,DEPUTADO ESTADUAL,ED THOMAS,EDSON TOMAZINI,ELEITO,PSB,PARTIDO SOCIALISTA BRASILEIRO,3
PEDREIRA,DEPUTADO ESTADUAL,FAETI,LAFAIETE RAMOS DE NOVAES,SUPLENTE,PSB,PARTIDO SOCIALISTA BRASILEIRO,1
PEDREIRA,DEPUTADO ESTADUAL,RIBAMELO,JOSÉ RIBAMAR DE MELO SOBRINHO,SUPLENTE,PSB,PARTIDO SOCIALISTA BRASILEIRO,1
PEDREIRA,DEPUTADO ESTADUAL,UILSON LEITE,UILSON ROBERTO LEITE,SUPLENTE,PSB,PARTIDO SOCIALISTA BRASILEIRO,3
PEDREIRA,DEPUTADO ESTADUAL,HILKIAS,HILKIAS DE OLIVEIRA,SUPLENTE,PSB,PARTIDO SOCIALISTA BRASILEIRO,1
PEDREIRA,DEPUTADO ESTADUAL,CHICO BEZERRA,FRANCISCO MOACIR BEZERRA DE MELO FILHO,SUPLENTE,PSB,PARTIDO SOCIALISTA BRASILEIRO,2
PEDREIRA,DEPUTADO ESTADUAL,DR. JOSÉ RICARDO,JOSÉ RICARDO DIAS,SUPLENTE,PSB,PARTIDO SOCIALISTA BRASILEIRO,8
PEDREIRA,DEPUTADO ESTADUAL,YVONE BARREIROS,YVONE BARREIROS MOREIRA,SUPLENTE,PSB,PARTIDO SOCIALISTA BRASILEIRO,56
PEDREIRA,DEPUTADO ESTADUAL,LUCIANO BATISTA,LUCIANO BATISTA,ELEITO,PSB,PARTIDO SOCIALISTA BRASILEIRO,10
PEDREIRA,DEPUTADO ESTADUAL,GUILHERME NONATO,GUILHERME DE SÁ CAVALCANTE,SUPLENTE,PSB,PARTIDO SOCIALISTA BRASILEIRO,1
PEDREIRA,DEPUTADO ESTADUAL,DAVID BUENO,DAVID JOSE BUENO GOMES,SUPLENTE,PSB,PARTIDO SOCIALISTA BRASILEIRO,2
PEDREIRA,DEPUTADO ESTADUAL,BACCARIN,SILVIO LUIZ BACCARIN,SUPLENTE,PSB,PARTIDO SOCIALISTA BRASILEIRO,5
PEDREIRA,DEPUTADO ESTADUAL,AGUINALDO FERREIRA,AGUINALDO FERREIRA,SUPLENTE,PSB,PARTIDO SOCIALISTA BRASILEIRO,1
PEDREIRA,DEPUTADO ESTADUAL,ARLY DE LARA ROMEO,ARLY DE LARA ROMEO,SUPLENTE,PSB,PARTIDO SOCIALISTA BRASILEIRO,56
PEDREIRA,DEPUTADO ESTADUAL,DRA. DORA,MARIA AUXILIADORA ZANIN,SUPLENTE,PSB,PARTIDO SOCIALISTA BRASILEIRO,174
PEDREIRA,DEPUTADO ESTADUAL,GENTIL,ALEXANDRE MARIANO GENTIL,SUPLENTE,PV,PARTIDO VERDE,8
PEDREIRA,DEPUTADO ESTADUAL,ARTUR DIAN,ARTUR JOSE DIAN,SUPLENTE,PV,PARTIDO VERDE,1
PEDREIRA,DEPUTADO ESTADUAL,ENGENHEIRO MÁRCIO,MARCIO MEDEIROS,SUPLENTE,PV,PARTIDO VERDE,1
PEDREIRA,DEPUTADO ESTADUAL,ADRIANA RODRIGUES,ADRIANA LARIO RAMALHO RODRIGUES,SUPLENTE,PV,PARTIDO VERDE,18
PEDREIRA,DEPUTADO ESTADUAL,FELICIANO,FELICIANO NAHIMY FILHO,ELEITO,PV,PARTIDO VERDE,375
PEDREIRA,DEPUTADO ESTADUAL,HENRIQUE CONTI,JOSE HENRIQUE CONTI,SUPLENTE,PV,PARTIDO VERDE,29
PEDREIRA,DEPUTADO ESTADUAL,PAULLO VIEIRA,PAULO ROBERTO AMARAL VIEIRA,SUPLENTE,PV,PARTIDO VERDE,3
PEDREIRA,DEPUTADO ESTADUAL,LAIS LATORRE,LAIS MENDES LATORRE SOARES,SUPLENTE,PV,PARTIDO VERDE,1
PEDREIRA,DEPUTADO ESTADUAL,SANDRA BARROS,SANDRA MARA BENITES DE BARROS,SUPLENTE,PV,PARTIDO VERDE,14
PEDREIRA,DEPUTADO ESTADUAL,DRA BETE,MARIA ELISABETE MARCONDES GUIMARAES,SUPLENTE,PV,PARTIDO VERDE,1
PEDREIRA,DEPUTADO ESTADUAL,CHICO SARDELLI,FRANCISCO ANTONIO SARDELLI,ELEITO,PV,PARTIDO VERDE,819
PEDREIRA,DEPUTADO ESTADUAL,PAULINHO ZACCARIOTTO,PAULO SERGIO ZACCARIOTTO,SUPLENTE,PV,PARTIDO VERDE,4
PEDREIRA,DEPUTADO ESTADUAL,PAULINHO DO PV,PAULO CARDOSO FILHO,SUPLENTE,PV,PARTIDO VERDE,4
PEDREIRA,DEPUTADO ESTADUAL,RICARDO CASTILHO,RICARDO RODRIGUES DE CASTILHO,SUPLENTE,PV,PARTIDO VERDE,2
PEDREIRA,DEPUTADO ESTADUAL,JOAO SOAREZ,JOAO CARLOS RIBEIRO SOARES,SUPLENTE,PV,PARTIDO VERDE,1
PEDREIRA,DEPUTADO ESTADUAL,CLAUDINHO GASPAR,CLAUDIO GASPAR DOTTORI,SUPLENTE,PV,PARTIDO VERDE,1
PEDREIRA,DEPUTADO ESTADUAL,ROSSINI,LUIZ CARLOS ROSSINI,SUPLENTE,PV,PARTIDO VERDE,11
PEDREIRA,DEPUTADO ESTADUAL,MARCIO SANTOS,MARCIO DOS SANTOS SILVA,SUPLENTE,PV,PARTIDO VERDE,3
PEDREIRA,DEPUTADO ESTADUAL,DR PAULO DE TARSO,PAULO DE TARSO NUNES CHIODE,SUPLENTE,PV,PARTIDO VERDE,3
PEDREIRA,DEPUTADO ESTADUAL,RITA PASSOS,RITA DE CASSIA TRINCA PASSOS,ELEITO,PV,PARTIDO VERDE,3
PEDREIRA,DEPUTADO ESTADUAL,NAVAL PELA GUARDA MUNICIPAL,MAURICIO DOMINGUES DA SILVA,SUPLENTE,PV,PARTIDO VERDE,14
PEDREIRA,DEPUTADO ESTADUAL,BETO TRICOLI,JOSE ROBERTO TRICOLI,ELEITO,PV,PARTIDO VERDE,107
PEDREIRA,DEPUTADO ESTADUAL,PEDRO FIORELLI,PEDRO HENRIQUE TEIXEIRA FIORELLI,SUPLENTE,PV,PARTIDO VERDE,8
PEDREIRA,DEPUTADO ESTADUAL,MAYLA PORTO,MAYLA YARA PORTO,SUPLENTE,PV,PARTIDO VERDE,1
PEDREIRA,DEPUTADO ESTADUAL,BRAZ ALBERTINI,BRAZ AGOSTINHO ALBERTINI,SUPLENTE,PV,PARTIDO VERDE,1
PEDREIRA,DEPUTADO ESTADUAL,SERRA,CLOVIS SERRA JUNIOR,SUPLENTE,PV,PARTIDO VERDE,1
PEDREIRA,DEPUTADO ESTADUAL,VALMIR OLHO DE LOBO,VALMIR GOMES DE MELO,SUPLENTE,PV,PARTIDO VERDE,1
PEDREIRA,DEPUTADO ESTADUAL,MÁRCIA MONTEZ,MÁRCIA REGINA MONTEZ HALASZ,SUPLENTE,PV,PARTIDO VERDE,2
PEDREIRA,DEPUTADO ESTADUAL,DR. DOMINGOS,DOMINGOS EZENILDO MATOS DOS SANTOS,SUPLENTE,PV,PARTIDO VERDE,1
PEDREIRA,DEPUTADO ESTADUAL,REINALDO ALGUZ,REINALDO DE SOUZA ALGUZ,ELEITO,PV,PARTIDO VERDE,5
PEDREIRA,DEPUTADO ESTADUAL,PELE PROBLEMA,CARLOS ALBERTO ROSA,SUPLENTE,PV,PARTIDO VERDE,1
PEDREIRA,DEPUTADO ESTADUAL,PEDRO DE SÁ,PEDRO DE SÁ FILHO,SUPLENTE,PV,PARTIDO VERDE,1
PEDREIRA,DEPUTADO ESTADUAL,WELTON PEREIRA,WELTON PEREIRA DE JESUS,SUPLENTE,PV,PARTIDO VERDE,1
PEDREIRA,DEPUTADO ESTADUAL,PASTOR DILMO DOS SANTOS,DILMO DOS SANTOS,ELEITO,PV,PARTIDO VERDE,27
PEDREIRA,DEPUTADO ESTADUAL,MARCOS PAPA,MARCOS ANDRÉ PAPA,SUPLENTE,PV,PARTIDO VERDE,2
PEDREIRA,DEPUTADO ESTADUAL,SÉRGIO CONTENTE,SERGIO CONTENTE,SUPLENTE,PV,PARTIDO VERDE,30
PEDREIRA,DEPUTADO ESTADUAL,HELIO RUBENS,HELIO RUBENS GONÇALVES FIGUEIREDO,SUPLENTE,PSDB,PSDB/DEM,39
PEDREIRA,DEPUTADO ESTADUAL,PROFESSOR BETO VARUSSA,JOSÉ ROBERTO VARUSSA,SUPLENTE,PSDB,PSDB/DEM,1
PEDREIRA,DEPUTADO ESTADUAL,EVANDRO LOSACCO,EVANDRO LUIZ LOSACCO,SUPLENTE,PSDB,PSDB/DEM,12
PEDREIRA,DEPUTADO ESTADUAL,PEDRO TOBIAS,PEDRO TOBIAS,ELEITO,PSDB,PSDB/DEM,3
PEDREIRA,DEPUTADO ESTADUAL,MARIA LÚCIA AMARY,MARIA LÚCIA CARDOSO PINTO AMARY,MÉDIA,PSDB,PSDB/DEM,1
PEDREIRA,DEPUTADO ESTADUAL,WELSON GASPARINI,WELSON GASPARINI,SUPLENTE,PSDB,PSDB/DEM,5
PEDREIRA,DEPUTADO ESTADUAL,MAURO BRAGATO,MAURO BRAGATO,ELEITO,PSDB,PSDB/DEM,4
PEDREIRA,DEPUTADO ESTADUAL,DR. RICARDO MARTINS,RICARDO MARTINS DE SÃO JOSÉ JUNIOR,SUPLENTE,PSDB,PSDB/DEM,1
PEDREIRA,DEPUTADO ESTADUAL,JOÃO CARAMEZ,JOÃO CARLOS CARAMEZ,ELEITO,PSDB,PSDB/DEM,654
PEDREIRA,DEPUTADO ESTADUAL,BRUNO COVAS,BRUNO COVAS LOPES,ELEITO,PSDB,PSDB/DEM,25
PEDREIRA,DEPUTADO ESTADUAL,CLOVIS CHAVES,CLOVIS LUIZ CHAVES,SUPLENTE,PSDB,PSDB/DEM,1
PEDREIRA,DEPUTADO ESTADUAL,CELINO,JUSCELINO CARDOSO DE SÁ,ELEITO,PSDB,PSDB/DEM,8
PEDREIRA,DEPUTADO ESTADUAL,ARY FOSSEN,ARY FOSSEN,ELEITO,PSDB,PSDB/DEM,3
PEDREIRA,DEPUTADO ESTADUAL,CÉLIA LEÃO,CÉLIA CAMARGO LEÃO EDELMUTH,ELEITO,PSDB,PSDB/DEM,644
PEDREIRA,DEPUTADO ESTADUAL,BUCK JACINTHO,ANTONIO JOÃO COIMBRA JACINTHO,SUPLENTE,PSDB,PSDB/DEM,2
PEDREIRA,DEPUTADO ESTADUAL,ADOLFO QUINTAS,ADOLFO QUINTAS GONÇALVES NETO,SUPLENTE,PSDB,PSDB/DEM,1
PEDREIRA,DEPUTADO ESTADUAL,SÔNIA DELFINO,SÔNIA MARIA DELFINO,SUPLENTE,PSDB,PSDB/DEM,2
PEDREIRA,DEPUTADO ESTADUAL,FORDINHO,ANTONIO CARLOS DE FARIA,SUPLENTE,PSDB,PSDB/DEM,5
