IBIRAREMA,PRESIDENTE,DILMA,DILMA VANA ROUSSEFF,2º TURNO,PT,PARA O BRASIL SEGUIR MUDANDO,1041
IBIRAREMA,PRESIDENTE,JOSÉ SERRA,JOSÉ SERRA,2º TURNO,PSDB,O BRASIL PODE MAIS,1918
IBIRAREMA,GOVERNADOR,GERALDO ALCKMIN,GERALDO JOSE RODRIGUES ALCKMIN FILHO,ELEITO,PSDB,UNIDOS POR SÃO PAULO,2468
IBIRAREMA,SENADOR,MARTA SUPLICY,MARTA SUPLICY,ELEITO,PT,UNIÃO PARA MUDAR,681
IBIRAREMA,SENADOR,ALOYSIO NUNES,ALOYSIO NUNES FERREIRA FILHO,ELEITO,PSDB,UNIDOS POR SÃO PAULO,2247
IBIRAREMA,DEPUTADO FEDERAL,ANTONIO BULHÕES,ANTONIO CARLOS MARTINS DE BULHÕES,ELEITO,PRB,JUNTOS POR SÃO PAULO,2
IBIRAREMA,DEPUTADO FEDERAL,OTONIEL LIMA,OTONIEL CARLOS DE LIMA,MÉDIA,PRB,JUNTOS POR SÃO PAULO,7
IBIRAREMA,DEPUTADO FEDERAL,MALUF,PAULO SALIM MALUF,ELEITO,PP,PARTIDO PROGRESSISTA,27
IBIRAREMA,DEPUTADO FEDERAL,RUBENEUTON OLIVEIRA LIMA,RUBENEUTON OLIVEIRA LIMA,SUPLENTE,PP,PARTIDO PROGRESSISTA,2
IBIRAREMA,DEPUTADO FEDERAL,DRA CELIA MARIA,CELIA MARIA VIEIRA ALVES,SUPLENTE,PP,PARTIDO PROGRESSISTA,1
IBIRAREMA,DEPUTADO FEDERAL,BATORÉ,IVANILDO GOMES NOGUEIRA,SUPLENTE,PP,PARTIDO PROGRESSISTA,1
IBIRAREMA,DEPUTADO FEDERAL,PEDRINHO BARACAT,ASSAD NACLE BARACAT,SUPLENTE,PP,PARTIDO PROGRESSISTA,1
IBIRAREMA,DEPUTADO FEDERAL,ALINE CORREA,ALINE LEMOS CORREA DE OLIVEIRA ANDRADE,ELEITO,PP,PARTIDO PROGRESSISTA,3
IBIRAREMA,DEPUTADO FEDERAL,ELIAS BITENCOURT,ELIAS DOS SANTOS BITENCOURT,SUPLENTE,PP,PARTIDO PROGRESSISTA,1
IBIRAREMA,DEPUTADO FEDERAL,CATARINA RIGINIK,CATARINA BEATRIZ GASPAROTTO RIGINIK,SUPLENTE,PP,PARTIDO PROGRESSISTA,2
IBIRAREMA,DEPUTADO FEDERAL,MISSIONÁRIO JOSÉ OLIMPIO,JOSÉ OLIMPIO SILVEIRA MORAES,ELEITO,PP,PARTIDO PROGRESSISTA,12
IBIRAREMA,DEPUTADO FEDERAL,DR NECHAR,SERGIO ANTONIO NECHAR,SUPLENTE,PP,PARTIDO PROGRESSISTA,132
IBIRAREMA,DEPUTADO FEDERAL,VADÃO,ETIVALDO VADAO GOMES,SUPLENTE,PP,PARTIDO PROGRESSISTA,1
IBIRAREMA,DEPUTADO FEDERAL,PAULINHO DA FORÇA,PAULO PEREIRA DA SILVA,ELEITO,PDT,PARTIDO DEMOCRÁTICO TRABALHISTA,7
IBIRAREMA,DEPUTADO FEDERAL,DR LUIZ CHIAPARINE,LUIZ CARLOS CHIAPARINE,SUPLENTE,PDT,PARTIDO DEMOCRÁTICO TRABALHISTA,2
IBIRAREMA,DEPUTADO FEDERAL,SALVADOR ZIMBALDI,SALVADOR ZIMBALDI FILHO,MÉDIA,PDT,PARTIDO DEMOCRÁTICO TRABALHISTA,20
IBIRAREMA,DEPUTADO FEDERAL,LINDOLFO DOS SANTOS,LINDOLFO LUIZ DOS SANTOS NETO,SUPLENTE,PDT,PARTIDO DEMOCRÁTICO TRABALHISTA,1
IBIRAREMA,DEPUTADO FEDERAL,WILSON COELHO,WILSON DE SOUZA COELHO,SUPLENTE,PDT,PARTIDO DEMOCRÁTICO TRABALHISTA,1
IBIRAREMA,DEPUTADO FEDERAL,IVANIO BATISTA,IVANIO BATISTA DA SILVA,SUPLENTE,PT,JUNTOS POR SÃO PAULO,2
IBIRAREMA,DEPUTADO FEDERAL,VACCAREZZA,CANDIDO ELPIDIO DE SOUZA VACCAREZZA,ELEITO,PT,JUNTOS POR SÃO PAULO,6
IBIRAREMA,DEPUTADO FEDERAL,GENOINO,JOSÉ GENOÍNO NETO,SUPLENTE,PT,JUNTOS POR SÃO PAULO,1
IBIRAREMA,DEPUTADO FEDERAL,ARLINDO CHINAGLIA,ARLINDO CHIGNALIA JUNIOR,ELEITO,PT,JUNTOS POR SÃO PAULO,115
IBIRAREMA,DEPUTADO FEDERAL,JOÃO PAULO CUNHA,JOÃO PAULO CUNHA,ELEITO,PT,JUNTOS POR SÃO PAULO,1
IBIRAREMA,DEPUTADO FEDERAL,PROF. CARLÃO RAMIRO,CARLOS RAMIRO CASTRO,SUPLENTE,PT,JUNTOS POR SÃO PAULO,1
IBIRAREMA,DEPUTADO FEDERAL,FÉLIX SAHÃO,FÉLIX SAHÃO JÚNIOR,SUPLENTE,PT,JUNTOS POR SÃO PAULO,7
IBIRAREMA,DEPUTADO FEDERAL,VANDERLEI SIRAQUE,VANDERLEI SIRAQUE,SUPLENTE,PT,JUNTOS POR SÃO PAULO,2
IBIRAREMA,DEPUTADO FEDERAL,JILMAR TATTO,JILMAR AUGUSTINHO TATTO,ELEITO,PT,JUNTOS POR SÃO PAULO,4
IBIRAREMA,DEPUTADO FEDERAL,CARLOS AQUINO,JOSÉ CARLOS DE AQUINO,SUPLENTE,PT,JUNTOS POR SÃO PAULO,1
IBIRAREMA,DEPUTADO FEDERAL,DEVANIR RIBEIRO,DEVANIR RIBEIRO,ELEITO,PT,JUNTOS POR SÃO PAULO,1
IBIRAREMA,DEPUTADO FEDERAL,ZARATTINI,CARLOS ALBERTO ROLIM ZARATTINI,ELEITO,PT,JUNTOS POR SÃO PAULO,2
IBIRAREMA,DEPUTADO FEDERAL,VICENTINHO,VICENTE PAULO DA SILVA,ELEITO,PT,JUNTOS POR SÃO PAULO,1
IBIRAREMA,DEPUTADO FEDERAL,CLAURY,CLAURY SANTOS ALVES DA SILVA,SUPLENTE,PTB,PARTIDO TRABALHISTA BRASILEIRO,137
IBIRAREMA,DEPUTADO FEDERAL,VAMPETA,MARCOS ANDRE BATISTA SANTOS,SUPLENTE,PTB,PARTIDO TRABALHISTA BRASILEIRO,1
IBIRAREMA,DEPUTADO FEDERAL,ROBSON TUMA,ROBSON TUMA,SUPLENTE,PTB,PARTIDO TRABALHISTA BRASILEIRO,2
IBIRAREMA,DEPUTADO FEDERAL,RICARDO OLIVEIRA,RICARDO JOSE DE OLIVEIRA,SUPLENTE,PTB,PARTIDO TRABALHISTA BRASILEIRO,1
IBIRAREMA,DEPUTADO FEDERAL,NELSON MARQUEZELLI,NELSON MARQUEZELLI,ELEITO,PTB,PARTIDO TRABALHISTA BRASILEIRO,22
IBIRAREMA,DEPUTADO FEDERAL,WALDOMIRO RAMOS,WALDOMIRO CARLOS RAMOS,SUPLENTE,PTB,PARTIDO TRABALHISTA BRASILEIRO,1
IBIRAREMA,DEPUTADO FEDERAL,SATURNINO DE BRITO,SATURNINO DE SALES SANTOS,SUPLENTE,PTB,PARTIDO TRABALHISTA BRASILEIRO,1
IBIRAREMA,DEPUTADO FEDERAL,ARNALDO FARIA DE SÁ,ARNALDO FARIA DE SÁ,ELEITO,PTB,PARTIDO TRABALHISTA BRASILEIRO,5
IBIRAREMA,DEPUTADO FEDERAL,CELIO DINIZ,CELIO FRANCISCO DINIZ,SUPLENTE,PTB,PARTIDO TRABALHISTA BRASILEIRO,3
IBIRAREMA,DEPUTADO FEDERAL,PAULINHO SOBRAL,PAULO MENDES SOBRAL,SUPLENTE,PMDB,PARTIDO DO MOVIMENTO DEMOCRÁTICO BRASILEIRO,1
IBIRAREMA,DEPUTADO FEDERAL,EDINHO ARAUJO,EDSON EDINHO COELHO ARAUJO,ELEITO,PMDB,PARTIDO DO MOVIMENTO DEMOCRÁTICO BRASILEIRO,2
IBIRAREMA,DEPUTADO FEDERAL,PÉ VERMELHO,LOURENCO MOREIRA DA SILVA,SUPLENTE,PMDB,PARTIDO DO MOVIMENTO DEMOCRÁTICO BRASILEIRO,1
IBIRAREMA,DEPUTADO FEDERAL,SARGENTO SEVERO,LUCIANO APARECIDO SEVERO,SUPLENTE,PSL,PRESTE ATENÇÃO SÃO PAULO,2
IBIRAREMA,DEPUTADO FEDERAL,PROFESSOR DOUGLAS CARBONNE,DOUGLAS ALBERTO SANTOS,SUPLENTE,PSL,PRESTE ATENÇÃO SÃO PAULO,1
IBIRAREMA,DEPUTADO FEDERAL,CORONEL GILSON LOPES,GILSON LOPES DA SILVA,SUPLENTE,PSC,HUMANISTA CRISTÃO ,4
IBIRAREMA,DEPUTADO FEDERAL,MISSIONARIA NAZARE,MARIA NAZARE DOS SANTOS SORRILLO,SUPLENTE,PSC,HUMANISTA CRISTÃO ,4
IBIRAREMA,DEPUTADO FEDERAL,MARCO FELICIANO,MARCO ANTONIO FELICIANO,ELEITO,PSC,HUMANISTA CRISTÃO ,47
IBIRAREMA,DEPUTADO FEDERAL,REGIS DE OLIVEIRA,REGIS FERNANDES DE OLIVEIRA,SUPLENTE,PSC,HUMANISTA CRISTÃO ,21
IBIRAREMA,DEPUTADO FEDERAL,SILVIA PALMA,SILVIA ELIANA PALMA,SUPLENTE,PSC,HUMANISTA CRISTÃO ,5
IBIRAREMA,DEPUTADO FEDERAL,DR.CARLOS FARIA,CARLOS EDUARDO DA SILVA FARIA,SUPLENTE,PSC,HUMANISTA CRISTÃO ,10
IBIRAREMA,DEPUTADO FEDERAL,WAGNER FIOROTTO,WAGNER MONTEIRO FIOROTTO,SUPLENTE,PSC,HUMANISTA CRISTÃO ,1
IBIRAREMA,DEPUTADO FEDERAL,PR. LUIZ LEMOS,LUIZ CARLOS LEMOS,SUPLENTE,PSC,HUMANISTA CRISTÃO ,4
IBIRAREMA,DEPUTADO FEDERAL,MIRO FERNANDES,ALDOMIRO FERNANDES,SUPLENTE,PSC,HUMANISTA CRISTÃO ,1
IBIRAREMA,DEPUTADO FEDERAL,LEO,LEONARDO LEANDRO FRANÇA DE OLIVEIRA,SUPLENTE,PSC,HUMANISTA CRISTÃO ,2
IBIRAREMA,DEPUTADO FEDERAL,ALEXANDRE DUARTE,LUIS ALEXANDRE DUARTE,SUPLENTE,PSC,HUMANISTA CRISTÃO ,1
IBIRAREMA,DEPUTADO FEDERAL,MANOEL GASPAR,MANOEL FERREIRA DE SOUZA GASPAR,SUPLENTE,PSC,HUMANISTA CRISTÃO ,117
IBIRAREMA,DEPUTADO FEDERAL,AGNALDO TIMOTEO,AGUINALDO TIMOTEO PEREIRA,SUPLENTE,PR,JUNTOS POR SÃO PAULO,11
IBIRAREMA,DEPUTADO FEDERAL,TIRIRICA,FRANCISCO EVERARDO OLIVEIRA SILVA,ELEITO,PR,JUNTOS POR SÃO PAULO,91
IBIRAREMA,DEPUTADO FEDERAL,PR PAULO FREIRE,PAULO ROBERTO FREIRE DA COSTA,ELEITO,PR,JUNTOS POR SÃO PAULO,29
IBIRAREMA,DEPUTADO FEDERAL,LUCIANA COSTA,LUCIANA DE ALMEIDA COSTA,SUPLENTE,PR,JUNTOS POR SÃO PAULO,2
IBIRAREMA,DEPUTADO FEDERAL,MILTON MONTI,MILTON ANTONIO CASQUEL MONTI,ELEITO,PR,JUNTOS POR SÃO PAULO,375
IBIRAREMA,DEPUTADO FEDERAL,VALDEMAR COSTA NETO,VALDEMAR COSTA NETO,ELEITO,PR,JUNTOS POR SÃO PAULO,30
IBIRAREMA,DEPUTADO FEDERAL,ROBERTO FREIRE,ROBERTO JOAO PEREIRA FREIRE,ELEITO,PPS,PSDB/DEM/PPS,1
IBIRAREMA,DEPUTADO FEDERAL,MARCOS DA FOTO,SIUSAKU HIRASHIMA,SUPLENTE,PPS,PSDB/DEM/PPS,1
IBIRAREMA,DEPUTADO FEDERAL,ARNALDO JARDIM,ARNALDO CALIL PEREIRA JARDIM,ELEITO,PPS,PSDB/DEM/PPS,5
IBIRAREMA,DEPUTADO FEDERAL,JORGE TADEU,JORGE TADEU MUDALEN,ELEITO,DEM,PSDB/DEM/PPS,8
IBIRAREMA,DEPUTADO FEDERAL,JORGINHO MALULY,JORGE DE FARIA MALULY,SUPLENTE,DEM,PSDB/DEM/PPS,7
IBIRAREMA,DEPUTADO FEDERAL,PROFESSOR BENJAMIN,BENJAMIN RIBEIRO DA SILVA,SUPLENTE,DEM,PSDB/DEM/PPS,12
IBIRAREMA,DEPUTADO FEDERAL,KIKO DO KLB,FRANCO FINATO SCORNAVACCA,SUPLENTE,DEM,PSDB/DEM/PPS,3
IBIRAREMA,DEPUTADO FEDERAL,RAUL GIL JR,RAUL GIL JUNIOR,SUPLENTE,DEM,PSDB/DEM/PPS,1
IBIRAREMA,DEPUTADO FEDERAL,MANDIC,ALEKSANDAR CARLOS MANDIC,SUPLENTE,DEM,PSDB/DEM/PPS,1
IBIRAREMA,DEPUTADO FEDERAL,DR ELEUSES PAIVA,ELEUSES VIEIRA DE PAIVA,SUPLENTE,DEM,PSDB/DEM/PPS,8
IBIRAREMA,DEPUTADO FEDERAL,WALTER IHOSHI,WALTER SHINDI IIHOSHI,SUPLENTE,DEM,PSDB/DEM/PPS,179
IBIRAREMA,DEPUTADO FEDERAL,JONAS DONIZETTE,JONAS DONIZETTE FERREIRA,ELEITO,PSB,PRESTE ATENÇÃO SÃO PAULO,1
IBIRAREMA,DEPUTADO FEDERAL,ROGÉRIO EMÍLIO,ROGÉRIO EMÍLIO DE ANDRADE,SUPLENTE,PSB,PRESTE ATENÇÃO SÃO PAULO,1
IBIRAREMA,DEPUTADO FEDERAL,MARCELINHO CARIOCA,MARCELO PEREIRA SURCIN,SUPLENTE,PSB,PRESTE ATENÇÃO SÃO PAULO,5
IBIRAREMA,DEPUTADO FEDERAL,SARGENTO FERNANDO,FERNANDO ALCÂNTARA DE FIGUEIREDO,SUPLENTE,PSB,PRESTE ATENÇÃO SÃO PAULO,1
IBIRAREMA,DEPUTADO FEDERAL,ADÃO LIMA,ADÃO TIMÓTEO DE LIMA,SUPLENTE,PSB,PRESTE ATENÇÃO SÃO PAULO,6
IBIRAREMA,DEPUTADO FEDERAL,CAPITÃO AUGUSTO,JOSÉ AUGUSTO ROSA,SUPLENTE,PSB,PRESTE ATENÇÃO SÃO PAULO,464
IBIRAREMA,DEPUTADO FEDERAL,TIO DO DOCE,MANOEL CARDOSO DA SILVA,SUPLENTE,PSB,PRESTE ATENÇÃO SÃO PAULO,1
IBIRAREMA,DEPUTADO FEDERAL,TORINO,PAULO SERGIO TORINO,SUPLENTE,PSB,PRESTE ATENÇÃO SÃO PAULO,1
IBIRAREMA,DEPUTADO FEDERAL,GABRIEL CHALITA,GABRIEL BENEDITO ISSAAC CHALITA,ELEITO,PSB,PRESTE ATENÇÃO SÃO PAULO,52
IBIRAREMA,DEPUTADO FEDERAL,MÁRCIO FRANÇA,MÁRCIO LUIZ FRANÇA GOMES,ELEITO,PSB,PRESTE ATENÇÃO SÃO PAULO,2
IBIRAREMA,DEPUTADO FEDERAL,DR. ALEXANDRE,ALEXANDRE SÉRGIO DE OLIVEIRA AZOUBEL,SUPLENTE,PSB,PRESTE ATENÇÃO SÃO PAULO,41
IBIRAREMA,DEPUTADO FEDERAL,CARMEM FRANCO,CARMEM MADALENA PEREIRA FRANCO,SUPLENTE,PSB,PRESTE ATENÇÃO SÃO PAULO,1
IBIRAREMA,DEPUTADO FEDERAL,SANTO PETRONI,SANTO PETRONI,SUPLENTE,PSB,PRESTE ATENÇÃO SÃO PAULO,1
IBIRAREMA,DEPUTADO FEDERAL,DRA. ELAINE,ELAINE APARECIDA BELLONI ABISSAMRA,SUPLENTE,PSB,PRESTE ATENÇÃO SÃO PAULO,6
IBIRAREMA,DEPUTADO FEDERAL,ABELARDO CAMARINHA,JOSE ABELARDO GUIMARAES CAMARINHA,MÉDIA,PSB,PRESTE ATENÇÃO SÃO PAULO,472
IBIRAREMA,DEPUTADO FEDERAL,JEFFERSON CAMPOS,JEFFERSON ALVES DE CAMPOS,ELEITO,PSB,PRESTE ATENÇÃO SÃO PAULO,34
IBIRAREMA,DEPUTADO FEDERAL,GRAÇA,MARIA DAS GRAÇAS GONÇALVES OLIVEIRA,SUPLENTE,PSB,PRESTE ATENÇÃO SÃO PAULO,2
IBIRAREMA,DEPUTADO FEDERAL,GETÚLIO DUARTE,GETÚLIO DUARTE FERREIRA,SUPLENTE,PSB,PRESTE ATENÇÃO SÃO PAULO,9
IBIRAREMA,DEPUTADO FEDERAL,DR. UBIALI,MARCO AURÉLIO UBIALI,SUPLENTE,PSB,PRESTE ATENÇÃO SÃO PAULO,8
IBIRAREMA,DEPUTADO FEDERAL,GUILHERME MUSSI,GUILHERME MUSSI FERREIRA,ELEITO,PV,PARTIDO VERDE,3
IBIRAREMA,DEPUTADO FEDERAL,DR. NEVTON OLIVEIRA ROCHA,NEVTON OLIVEIRA ROCHA,SUPLENTE,PV,PARTIDO VERDE,1
IBIRAREMA,DEPUTADO FEDERAL,DANIEL MARINS,DANIEL MARINS ALESSI,SUPLENTE,PV,PARTIDO VERDE,6
IBIRAREMA,DEPUTADO FEDERAL,ANA PAULA JUNQUEIRA,ANA PAULA GUIMARAES DE AZEVEDO JUNQUEIRA,SUPLENTE,PV,PARTIDO VERDE,1
IBIRAREMA,DEPUTADO FEDERAL,EVANDRO GUSSI,EVANDRO HERRERA BERTONE GUSSI,SUPLENTE,PV,PARTIDO VERDE,3
IBIRAREMA,DEPUTADO FEDERAL,PENNA,JOSÉ LUIZ DE FRANÇA PENNA,ELEITO,PV,PARTIDO VERDE,105
IBIRAREMA,DEPUTADO FEDERAL,ROBERTO DE LUCENA,ROBERTO ALVES DE LUCENA,ELEITO,PV,PARTIDO VERDE,5
IBIRAREMA,DEPUTADO FEDERAL,PROFESSORA LALA TAVARES,IRAIDES TAVARES DE ALMEIDA,SUPLENTE,PV,PARTIDO VERDE,1
IBIRAREMA,DEPUTADO FEDERAL,DR. RAUL,RAUL APARECIDO GONÇALVES PAULA,SUPLENTE,PV,PARTIDO VERDE,1
IBIRAREMA,DEPUTADO FEDERAL,CARLOS SAMPAIO,CARLOS HENRIQUE FOCESI SAMPAIO,ELEITO,PSDB,PSDB/DEM/PPS,2
IBIRAREMA,DEPUTADO FEDERAL,STANGARLINI,JOSE CARLOS STANGARLINI,SUPLENTE,PSDB,PSDB/DEM/PPS,5
IBIRAREMA,DEPUTADO FEDERAL,RAUL CHRISTIANO,RAUL CHRISTIANO DE OLIVEIRA SANCHEZ,SUPLENTE,PSDB,PSDB/DEM/PPS,2
IBIRAREMA,DEPUTADO FEDERAL,LOBBE NETO,ANTONIO ADOLPHO LOBBE NETO,SUPLENTE,PSDB,PSDB/DEM/PPS,14
IBIRAREMA,DEPUTADO FEDERAL,CARLOS BRAGA,CARLOS EDUARDO FARACO BRAGA,SUPLENTE,PSDB,PSDB/DEM/PPS,2
IBIRAREMA,DEPUTADO FEDERAL,CARLOS ROBERTO,CARLOS ROBERTO DE CAMPOS,SUPLENTE,PSDB,PSDB/DEM/PPS,4
IBIRAREMA,DEPUTADO FEDERAL,DIB,WILLIAM DIB,ELEITO,PSDB,PSDB/DEM/PPS,109
IBIRAREMA,DEPUTADO FEDERAL,SILVIO TORRES,SILVIO FRANÇA TORRES,SUPLENTE,PSDB,PSDB/DEM/PPS,8
IBIRAREMA,DEPUTADO FEDERAL,TIRSO MEIRELLES,TIRSO DE SALLES MEIRELLES,SUPLENTE,PSDB,PSDB/DEM/PPS,14
IBIRAREMA,DEPUTADO FEDERAL,TERESA SERRANO,MARIA TERESA SERRANO AFONSO,SUPLENTE,PSDB,PSDB/DEM/PPS,1
IBIRAREMA,DEPUTADO FEDERAL,EDSON APARECIDO,EDSON APARECIDO DOS SANTOS,ELEITO,PSDB,PSDB/DEM/PPS,161
IBIRAREMA,DEPUTADO FEDERAL,RICARDO MONTORO,JOSE RICARDO FRANCO MONTORO,SUPLENTE,PSDB,PSDB/DEM/PPS,5
IBIRAREMA,DEPUTADO FEDERAL,VANDERLEI MACRIS,VANDERLEI MACRIS,SUPLENTE,PSDB,PSDB/DEM/PPS,28
IBIRAREMA,DEPUTADO FEDERAL,DUARTE NOGUEIRA,ANTONIO DUARTE NOGUEIRA JUNIOR,ELEITO,PSDB,PSDB/DEM/PPS,2
IBIRAREMA,DEPUTADO FEDERAL,JULIO SEMEGHINI,JULIO FRACISCO SEMEGHINI NETO,ELEITO,PSDB,PSDB/DEM/PPS,2
IBIRAREMA,DEPUTADO FEDERAL,VAZ DE LIMA,JOSÉ CARLOS VAZ DE LIMA,ELEITO,PSDB,PSDB/DEM/PPS,45
IBIRAREMA,DEPUTADO FEDERAL,WALTER FELDMAN,WALTER MEYER FELDMAN,SUPLENTE,PSDB,PSDB/DEM/PPS,1
IBIRAREMA,DEPUTADO FEDERAL,THAME,ANTONIO CARLOS DE MENDES THAME,ELEITO,PSDB,PSDB/DEM/PPS,33
IBIRAREMA,DEPUTADO FEDERAL,BRUNA FURLAN,BRUNA DIAS FURLAN,ELEITO,PSDB,PSDB/DEM/PPS,3
IBIRAREMA,DEPUTADO FEDERAL,JOSÉ ANIBAL,JOSÉ ANIBAL PERES DE PONTES,ELEITO,PSDB,PSDB/DEM/PPS,5
IBIRAREMA,DEPUTADO FEDERAL,NELSON BUGALHO,NELSON ROBERTO BUGALHO,SUPLENTE,PSDB,PSDB/DEM/PPS,1
IBIRAREMA,DEPUTADO FEDERAL,ALDO REBELO,JOSÉ ALDO REBELO FIGUEIREDO,ELEITO,PC DO B,JUNTOS POR SÃO PAULO,39
IBIRAREMA,DEPUTADO FEDERAL,DELEGADO PROTÓGENES,PROTÓGENES PINHEIRO DE QUEIROZ,MÉDIA,PC DO B,JUNTOS POR SÃO PAULO,1
IBIRAREMA,DEPUTADO ESTADUAL,GILMACI SANTOS,GILMACI DOS SANTOS BARBOSA,ELEITO,PRB,SOMOS MAIS SÃO PAULO,3
IBIRAREMA,DEPUTADO ESTADUAL,SEBASTIÃO SANTOS,SEBASTIÃO DOS SANTOS FILHO,ELEITO,PRB,SOMOS MAIS SÃO PAULO,7
IBIRAREMA,DEPUTADO ESTADUAL,CURIATI,ANTONIO SALIM CURIATI,ELEITO,PP,PARTIDO PROGRESSISTA,3
IBIRAREMA,DEPUTADO ESTADUAL,CIMATTI NETO,MILTON CIMATTI NETO,SUPLENTE,PP,PARTIDO PROGRESSISTA,58
IBIRAREMA,DEPUTADO ESTADUAL,DR. SERGIO CHEBEL,SERGIO CABRAL CHEBEL,SUPLENTE,PP,PARTIDO PROGRESSISTA,1
IBIRAREMA,DEPUTADO ESTADUAL,JOÃO ARAUJO,JOÃO ANTONIO DE ARAUJO,SUPLENTE,PP,PARTIDO PROGRESSISTA,1
IBIRAREMA,DEPUTADO ESTADUAL,DINEI,CLAUDINEI ALEXANDRE PIRES,SUPLENTE,PDT,PARTIDO DEMOCRÁTICO TRABALHISTA,2
IBIRAREMA,DEPUTADO ESTADUAL,ROGERIO NOGUEIRA,ROGERIO NOGUEIRA LOPES CRUZ,ELEITO,PDT,PARTIDO DEMOCRÁTICO TRABALHISTA,2
IBIRAREMA,DEPUTADO ESTADUAL,CAPITAO LUCAS,AURO LUCAS,SUPLENTE,PDT,PARTIDO DEMOCRÁTICO TRABALHISTA,1
IBIRAREMA,DEPUTADO ESTADUAL,MAJOR OLIMPIO,SERGIO OLIMPIO GOMES,ELEITO,PDT,PARTIDO DEMOCRÁTICO TRABALHISTA,12
IBIRAREMA,DEPUTADO ESTADUAL,JOCA VASCONCELOS,JOAO CARLOS MONTE CLARO VASCONCELOS,SUPLENTE,PDT,PARTIDO DEMOCRÁTICO TRABALHISTA,1
IBIRAREMA,DEPUTADO ESTADUAL,BRUZAROSCO,APARECIDO DE JESUS BRUZAROSCO,SUPLENTE,PDT,PARTIDO DEMOCRÁTICO TRABALHISTA,38
IBIRAREMA,DEPUTADO ESTADUAL,RAFAEL SILVA,RAFAEL ANTONIO DA SILVA,ELEITO,PDT,PARTIDO DEMOCRÁTICO TRABALHISTA,4
IBIRAREMA,DEPUTADO ESTADUAL,MARCO BRASIL,MARCO AURÉLIO RIBEIRO,SUPLENTE,PDT,PARTIDO DEMOCRÁTICO TRABALHISTA,9
IBIRAREMA,DEPUTADO ESTADUAL,JOÃO ELIAS,JOÃO ELIAS PEREIRA,SUPLENTE,PDT,PARTIDO DEMOCRÁTICO TRABALHISTA,1
IBIRAREMA,DEPUTADO ESTADUAL,ANDERSON SILVA,ANDERSON DOMINGOS DA SILVA,SUPLENTE,PT,SOMOS MAIS SÃO PAULO,1
IBIRAREMA,DEPUTADO ESTADUAL,JURA,JURACY FRANCISCO DE JESUS,SUPLENTE,PT,SOMOS MAIS SÃO PAULO,1
IBIRAREMA,DEPUTADO ESTADUAL,GERSON BITTENCOURT,GERSON LUIS BITTENCOURT,ELEITO,PT,SOMOS MAIS SÃO PAULO,21
IBIRAREMA,DEPUTADO ESTADUAL,EDINHO SILVA,EDSON ANTONIO EDINHO DA SILVA,ELEITO,PT,SOMOS MAIS SÃO PAULO,1
IBIRAREMA,DEPUTADO ESTADUAL,ENIO TATTO,ENIO FRANCISCO TATTO,ELEITO,PT,SOMOS MAIS SÃO PAULO,2
IBIRAREMA,DEPUTADO ESTADUAL,TONINHO DO PT,ANTONIO AMARAL JUNIOR,SUPLENTE,PT,SOMOS MAIS SÃO PAULO,130
IBIRAREMA,DEPUTADO ESTADUAL,BETH SAHAO,ELISABETH SAHÃO,SUPLENTE,PT,SOMOS MAIS SÃO PAULO,20
IBIRAREMA,DEPUTADO ESTADUAL,JOÃO PAULO RILLO,JOÃO PAULO RILLO,ELEITO,PT,SOMOS MAIS SÃO PAULO,1
IBIRAREMA,DEPUTADO ESTADUAL,CARLOS NEDER,CARLOS ALBERTO PLETZ NEDER,SUPLENTE,PT,SOMOS MAIS SÃO PAULO,1
IBIRAREMA,DEPUTADO ESTADUAL,LÉO ÁQUILLA,JADSON MENDES DE LIMA,SUPLENTE,PTB,PARTIDO TRABALHISTA BRASILEIRO,7
IBIRAREMA,DEPUTADO ESTADUAL,CAMPOS MACHADO,ANTONIO CARLOS DE CAMPOS MACHADO,ELEITO,PTB,PARTIDO TRABALHISTA BRASILEIRO,104
IBIRAREMA,DEPUTADO ESTADUAL,VANDO,ORVANDO DA SILVA,SUPLENTE,PTB,PARTIDO TRABALHISTA BRASILEIRO,1
IBIRAREMA,DEPUTADO ESTADUAL,CORONEL EDSON FERRARINI,EDSON FERRARINI,ELEITO,PTB,PARTIDO TRABALHISTA BRASILEIRO,6
IBIRAREMA,DEPUTADO ESTADUAL,VAL,ENIVALDO RAMOS DE FREITAS,SUPLENTE,PTB,PARTIDO TRABALHISTA BRASILEIRO,17
IBIRAREMA,DEPUTADO ESTADUAL,WALDIR AGNELLO,WALDIR AGNELLO,SUPLENTE,PTB,PARTIDO TRABALHISTA BRASILEIRO,2
IBIRAREMA,DEPUTADO ESTADUAL,BALEIA ROSSI,LUIZ FELIPE BALEIA TENUTO ROSSI,ELEITO,PMDB,PARTIDO DO MOVIMENTO DEMOCRÁTICO BRASILEIRO,1
IBIRAREMA,DEPUTADO ESTADUAL,BEBETTO,ALBERTO FELIPPE HADDAD FILHO,SUPLENTE,PMDB,PARTIDO DO MOVIMENTO DEMOCRÁTICO BRASILEIRO,2
IBIRAREMA,DEPUTADO ESTADUAL,CARUSO,JORGE LUIS CARUSO,ELEITO,PMDB,PARTIDO DO MOVIMENTO DEMOCRÁTICO BRASILEIRO,2
IBIRAREMA,DEPUTADO ESTADUAL,VANESSA DAMO,VANESSA DAMO OROSCO,ELEITO,PMDB,PARTIDO DO MOVIMENTO DEMOCRÁTICO BRASILEIRO,11
IBIRAREMA,DEPUTADO ESTADUAL,UEBE REZECK,UEBE REZECK,SUPLENTE,PMDB,PARTIDO DO MOVIMENTO DEMOCRÁTICO BRASILEIRO,1
IBIRAREMA,DEPUTADO ESTADUAL,ITAMAR BORGES,ITAMAR FRANCISCO MACHADO BORGES,MÉDIA,PMDB,PARTIDO DO MOVIMENTO DEMOCRÁTICO BRASILEIRO,1
IBIRAREMA,DEPUTADO ESTADUAL,ANA PAULA ROSSI,ANA PAULA ROSSI DE ALMEIDA MAGDESIAN,SUPLENTE,PMDB,PARTIDO DO MOVIMENTO DEMOCRÁTICO BRASILEIRO,2
IBIRAREMA,DEPUTADO ESTADUAL,CELSO NASCIMENTO,CELSO BRAZ DO NASCIMENTO,SUPLENTE,PSC,HUMANISTA CRISTÃO ,36
IBIRAREMA,DEPUTADO ESTADUAL,APOSTOLO EURIPEDES,EURIPEDES LUIZ DE SOUSA,SUPLENTE,PSC,HUMANISTA CRISTÃO ,68
IBIRAREMA,DEPUTADO ESTADUAL,DR. CALE,CARLOS EDUARDO ANTUNES DE OLIVEIRA,SUPLENTE,PSC,HUMANISTA CRISTÃO ,1
IBIRAREMA,DEPUTADO ESTADUAL,PR. CARLOS CEZAR,CARLOS CEZAR DA SILVA,ELEITO,PSC,HUMANISTA CRISTÃO ,3
IBIRAREMA,DEPUTADO ESTADUAL,JAIMINHO,JAIME DONIZETE PEREIRA,SUPLENTE,PSC,HUMANISTA CRISTÃO ,3
IBIRAREMA,DEPUTADO ESTADUAL,JOÃO BINATO,JOÃO ANTONIO BINATO,SUPLENTE,PSC,HUMANISTA CRISTÃO ,292
IBIRAREMA,DEPUTADO ESTADUAL,PASTOR JOÃO LUIZ NETO,JOÃO LUIZ NETO,SUPLENTE,PSC,HUMANISTA CRISTÃO ,1
IBIRAREMA,DEPUTADO ESTADUAL,CANDIDO,JOELSON CANDIDO DE OLIVEIRA,SUPLENTE,PSC,HUMANISTA CRISTÃO ,2
IBIRAREMA,DEPUTADO ESTADUAL,SAID MOURAD,AHMAD SAID MOURAD,SUPLENTE,PSC,HUMANISTA CRISTÃO ,1
IBIRAREMA,DEPUTADO ESTADUAL,RODRIGO MORAES,RODRIGO AUGUSTO MORAES,ELEITO,PSC,HUMANISTA CRISTÃO ,12
IBIRAREMA,DEPUTADO ESTADUAL,BRAZ PASSARINHEIRO,BRAZ ANASTACIO DA SILVA,SUPLENTE,PSC,HUMANISTA CRISTÃO ,1
IBIRAREMA,DEPUTADO ESTADUAL,ZE PEDRO,JOSE PEDRO LEITE DA SILVA,SUPLENTE,PR,SOMOS MAIS SÃO PAULO,1
IBIRAREMA,DEPUTADO ESTADUAL,PATRICIA LIMA,PATRICIA FREITAS LIMA,SUPLENTE,PR,SOMOS MAIS SÃO PAULO,3
IBIRAREMA,DEPUTADO ESTADUAL,JOSIAS DINIZ,JOSIAS ANTONIO DINIZ,SUPLENTE,PR,SOMOS MAIS SÃO PAULO,1
IBIRAREMA,DEPUTADO ESTADUAL,ROY NELSON,ROY NELSON PINTO,SUPLENTE,PR,SOMOS MAIS SÃO PAULO,5
IBIRAREMA,DEPUTADO ESTADUAL,ANDRE DO PRADO,ANDRE LUIS DO PRADO,ELEITO,PR,SOMOS MAIS SÃO PAULO,36
IBIRAREMA,DEPUTADO ESTADUAL,EDMILSON MORATO,EDMILSON GONCALVES,SUPLENTE,PPS,PARTIDO POPULAR SOCIALISTA,1
IBIRAREMA,DEPUTADO ESTADUAL,TERRY,JOSE AUGUSTO NOVAES DE BARROS,SUPLENTE,PPS,PARTIDO POPULAR SOCIALISTA,1
IBIRAREMA,DEPUTADO ESTADUAL,VITOR SAPIENZA,VITOR SAPIENZA,SUPLENTE,PPS,PARTIDO POPULAR SOCIALISTA,10
IBIRAREMA,DEPUTADO ESTADUAL,GONDIM,LUIZ CARLOS GONDIM TEIXEIRA,ELEITO,PPS,PARTIDO POPULAR SOCIALISTA,216
IBIRAREMA,DEPUTADO ESTADUAL,ESTEVÃO,STEVEN ERIKSEN BINNIE,SUPLENTE,PPS,PARTIDO POPULAR SOCIALISTA,15
IBIRAREMA,DEPUTADO ESTADUAL,PROFESSOR ZE MARIA,JOSE MARIA CANCELLIERO,SUPLENTE,PPS,PARTIDO POPULAR SOCIALISTA,7
IBIRAREMA,DEPUTADO ESTADUAL,ANDRE SOARES,ANDRE BEZERRA RIBEIRO SOARES,ELEITO,DEM,PSDB/DEM,4
IBIRAREMA,DEPUTADO ESTADUAL,EDMIR CHEDID,EDMIR JOSE ABI CHEDID,ELEITO,DEM,PSDB/DEM,1
IBIRAREMA,DEPUTADO ESTADUAL,JOAO MELLAO NETO,JOAO MELLAO NETO,SUPLENTE,DEM,PSDB/DEM,4
IBIRAREMA,DEPUTADO ESTADUAL,FERNANDO LUCAS,LUIZ FERNANDO AMARAL LUCAS,SUPLENTE,DEM,PSDB/DEM,2
IBIRAREMA,DEPUTADO ESTADUAL,GIL ARANTES,GILBERTO MACEDO GIL ARANTES,ELEITO,DEM,PSDB/DEM,1
IBIRAREMA,DEPUTADO ESTADUAL,LEANDRO DO KLB,LEANDRO FINATO SCORNAVACCA,SUPLENTE,DEM,PSDB/DEM,1
IBIRAREMA,DEPUTADO ESTADUAL,FAETI,LAFAIETE RAMOS DE NOVAES,SUPLENTE,PSB,PARTIDO SOCIALISTA BRASILEIRO,1
IBIRAREMA,DEPUTADO ESTADUAL,ALEXANDRE OLIVEIRA,ALEXANDRE OLIVEIRA,SUPLENTE,PSB,PARTIDO SOCIALISTA BRASILEIRO,2
IBIRAREMA,DEPUTADO ESTADUAL,FRANCÉ JUNIOR,ANTONIO FRANCÉ JUNIOR,SUPLENTE,PSB,PARTIDO SOCIALISTA BRASILEIRO,2
IBIRAREMA,DEPUTADO ESTADUAL,TECA MARQUES,TEREZA MAGALHÃES MARQUES,SUPLENTE,PSB,PARTIDO SOCIALISTA BRASILEIRO,1
IBIRAREMA,DEPUTADO ESTADUAL,VINICIUS CAMARINHA,VINICIUS ALMEIDA CAMARINHA,ELEITO,PSB,PARTIDO SOCIALISTA BRASILEIRO,722
IBIRAREMA,DEPUTADO ESTADUAL,DR PAULO CÉSAR (PC),PAULO CESAR DA SILVA FERREIRA,SUPLENTE,PV,PARTIDO VERDE,2
IBIRAREMA,DEPUTADO ESTADUAL,CAMILO GAVA,JOSÉ CAMILO GAVA NETO,SUPLENTE,PV,PARTIDO VERDE,36
IBIRAREMA,DEPUTADO ESTADUAL,ROSANGELA MELLO,ROSANGELA DE MELLO,SUPLENTE,PV,PARTIDO VERDE,1
IBIRAREMA,DEPUTADO ESTADUAL,RITA PASSOS,RITA DE CASSIA TRINCA PASSOS,ELEITO,PV,PARTIDO VERDE,9
IBIRAREMA,DEPUTADO ESTADUAL,CLODOALDO GAZZETTA,CLODOALDO ARMANDO GAZZETTA,SUPLENTE,PV,PARTIDO VERDE,2
IBIRAREMA,DEPUTADO ESTADUAL,BRAZ ALBERTINI,BRAZ AGOSTINHO ALBERTINI,SUPLENTE,PV,PARTIDO VERDE,3
IBIRAREMA,DEPUTADO ESTADUAL,DR. ULYSSES,ULYSSES MARIO TASSINARI,MÉDIA,PV,PARTIDO VERDE,1
IBIRAREMA,DEPUTADO ESTADUAL,REINALDO ALGUZ,REINALDO DE SOUZA ALGUZ,ELEITO,PV,PARTIDO VERDE,11
IBIRAREMA,DEPUTADO ESTADUAL,LIA,MARIA LUZIA CASSIMIRA CONSTANTINO,SUPLENTE,PV,PARTIDO VERDE,1
IBIRAREMA,DEPUTADO ESTADUAL,WILLIAM FERRAZ,WILIAN FERRAZ,SUPLENTE,PSDB,PSDB/DEM,1
IBIRAREMA,DEPUTADO ESTADUAL,EVANDRO LOSACCO,EVANDRO LUIZ LOSACCO,SUPLENTE,PSDB,PSDB/DEM,17
IBIRAREMA,DEPUTADO ESTADUAL,PEDRO TOBIAS,PEDRO TOBIAS,ELEITO,PSDB,PSDB/DEM,114
IBIRAREMA,DEPUTADO ESTADUAL,MILTON FLAVIO,MILTON FLAVIO MARQUES LAUTENSCHLAGER,SUPLENTE,PSDB,PSDB/DEM,19
IBIRAREMA,DEPUTADO ESTADUAL,GERALDO VINHOLI,GERALDO ANTONIO VINHOLI,SUPLENTE,PSDB,PSDB/DEM,3
IBIRAREMA,DEPUTADO ESTADUAL,PROF. ADEMIR,JOSÉ ADEMIR DA SILVA,SUPLENTE,PSDB,PSDB/DEM,5
IBIRAREMA,DEPUTADO ESTADUAL,HEITOR SERTAO,HEITOR SERTÃO,SUPLENTE,PSDB,PSDB/DEM,1
IBIRAREMA,DEPUTADO ESTADUAL,RAMALHO DA CONSTRUCAO,ANTONIO DE SOUSA RAMALHO,SUPLENTE,PSDB,PSDB/DEM,3
IBIRAREMA,DEPUTADO ESTADUAL,WELSON GASPARINI,WELSON GASPARINI,SUPLENTE,PSDB,PSDB/DEM,8
IBIRAREMA,DEPUTADO ESTADUAL,MAURO BRAGATO,MAURO BRAGATO,ELEITO,PSDB,PSDB/DEM,740
IBIRAREMA,DEPUTADO ESTADUAL,JOÃO CARAMEZ,JOÃO CARLOS CARAMEZ,ELEITO,PSDB,PSDB/DEM,1
IBIRAREMA,DEPUTADO ESTADUAL,BRUNO COVAS,BRUNO COVAS LOPES,ELEITO,PSDB,PSDB/DEM,2
IBIRAREMA,DEPUTADO ESTADUAL,JOSE BORANGA,JOSE AURELIO BORANGA,SUPLENTE,PSDB,PSDB/DEM,2
IBIRAREMA,DEPUTADO ESTADUAL,ADOLFO QUINTAS,ADOLFO QUINTAS GONÇALVES NETO,SUPLENTE,PSDB,PSDB/DEM,1
IBIRAREMA,DEPUTADO ESTADUAL,DILADOR BORGES,DILADOR BORGES DAMASCENO,SUPLENTE,PSDB,PSDB/DEM,68
IBIRAREMA,DEPUTADO ESTADUAL,CAUÊ MACRIS,CAUÊ CASEIRO MACRIS,MÉDIA,PSDB,PSDB/DEM,14
IBIRAREMA,DEPUTADO ESTADUAL,EDISON CANDIDO,EDISON APARECIDO CANDIDO,SUPLENTE,PSDB,PSDB/DEM,2
IBIRAREMA,DEPUTADO ESTADUAL,CONCCI MARCO,ELIANE CONCEIÇÃO SILVA MENDES,SUPLENTE,PSDB,PSDB/DEM,2
IBIRAREMA,DEPUTADO ESTADUAL,BARROS MUNHOZ,JOSE ANTONIO BARROS MUNHOZ,ELEITO,PSDB,PSDB/DEM,9
IBIRAREMA,DEPUTADO ESTADUAL,PAULO ALEXANDRE BARBOSA,PAULO ALEXANDRE PEREIRA BARBOSA,ELEITO,PSDB,PSDB/DEM,20
IBIRAREMA,DEPUTADO ESTADUAL,FERNANDO CAPEZ,FERNANDO CAPEZ,ELEITO,PSDB,PSDB/DEM,6
IBIRAREMA,DEPUTADO ESTADUAL,RAUL MARCELO,RAUL MARCELO DE SOUZA,SUPLENTE,PSOL,PARTIDO SOCIALISMO E LIBERDADE,1
IBIRAREMA,DEPUTADO ESTADUAL,EDUARDO AMARAL,EDUARDO GARCIA CARVALHO DO AMARAL,SUPLENTE,PSOL,PARTIDO SOCIALISMO E LIBERDADE,4
IBIRAREMA,DEPUTADO ESTADUAL,CARLOS GIANNAZI,CARLOS ALBERTO GIANNASI,ELEITO,PSOL,PARTIDO SOCIALISMO E LIBERDADE,15
IBIRAREMA,DEPUTADO ESTADUAL,LECI BRANDÃO,LECI BRANDAO DA SILVA,ELEITO,PC DO B,PARTIDO COMUNISTA DO BRASIL,1
