AMERICANA,PRESIDENTE,DILMA,DILMA VANA ROUSSEFF,2º TURNO,PT,PARA O BRASIL SEGUIR MUDANDO,21873
AMERICANA,PRESIDENTE,JOSÉ SERRA,JOSÉ SERRA,2º TURNO,PSDB,O BRASIL PODE MAIS,23819
AMERICANA,GOVERNADOR,GERALDO ALCKMIN,GERALDO JOSE RODRIGUES ALCKMIN FILHO,ELEITO,PSDB,UNIDOS POR SÃO PAULO,28439
AMERICANA,SENADOR,MARTA SUPLICY,MARTA SUPLICY,ELEITO,PT,UNIÃO PARA MUDAR,19701
AMERICANA,SENADOR,ALOYSIO NUNES,ALOYSIO NUNES FERREIRA FILHO,ELEITO,PSDB,UNIDOS POR SÃO PAULO,31973
AMERICANA,DEPUTADO FEDERAL,DR. ELIEZER COSTA,ELIEZER NASCIMENTO DA COSTA,SUPLENTE,PRB,JUNTOS POR SÃO PAULO,5
AMERICANA,DEPUTADO FEDERAL,ANTONIO BULHÕES,ANTONIO CARLOS MARTINS DE BULHÕES,ELEITO,PRB,JUNTOS POR SÃO PAULO,1
AMERICANA,DEPUTADO FEDERAL,ALESSANDER VIGNA,ALESSANDER BARREIRA VIGNA,SUPLENTE,PRB,JUNTOS POR SÃO PAULO,2
AMERICANA,DEPUTADO FEDERAL,OTONIEL LIMA,OTONIEL CARLOS DE LIMA,MÉDIA,PRB,JUNTOS POR SÃO PAULO,361
AMERICANA,DEPUTADO FEDERAL,RATINHO,SEBASTIÃO MARTINS DE AZEVEDO,SUPLENTE,PRB,JUNTOS POR SÃO PAULO,2
AMERICANA,DEPUTADO FEDERAL,DURVAL MORELLI,DURVAL MORELLI NETO,SUPLENTE,PP,PARTIDO PROGRESSISTA,1
AMERICANA,DEPUTADO FEDERAL,JEFERSON CAMILLO,JEFERSON CAMILLO DE OLIVEIRA,SUPLENTE,PP,PARTIDO PROGRESSISTA,7
AMERICANA,DEPUTADO FEDERAL,MISSIONÁRIA CICERA BEZERRA,CICERA MARIA BEZERRA DA SILVA,SUPLENTE,PP,PARTIDO PROGRESSISTA,1
AMERICANA,DEPUTADO FEDERAL,PAULA AGUIAR,PAULA APARECIDA RODRIGUES DE AGUIAR,SUPLENTE,PP,PARTIDO PROGRESSISTA,2
AMERICANA,DEPUTADO FEDERAL,TCEL JULIO LEMOS,JÚLIO FERNANDO PINHEIRO DE LEMOS,SUPLENTE,PP,PARTIDO PROGRESSISTA,2
AMERICANA,DEPUTADO FEDERAL,MALUF,PAULO SALIM MALUF,ELEITO,PP,PARTIDO PROGRESSISTA,470
AMERICANA,DEPUTADO FEDERAL,RUBENEUTON OLIVEIRA LIMA,RUBENEUTON OLIVEIRA LIMA,SUPLENTE,PP,PARTIDO PROGRESSISTA,6
AMERICANA,DEPUTADO FEDERAL,ANGINHO DOS TECLADOS,ANGELO MARINHO DE ALMEIDA,SUPLENTE,PP,PARTIDO PROGRESSISTA,24
AMERICANA,DEPUTADO FEDERAL,CARLOS OCTAVIANI,JOSÉ CARLOS OCTAVIANI,SUPLENTE,PP,PARTIDO PROGRESSISTA,3
AMERICANA,DEPUTADO FEDERAL,SANAZAR,EDUARDO SANASSAR FONSECA,SUPLENTE,PP,PARTIDO PROGRESSISTA,1
AMERICANA,DEPUTADO FEDERAL,CAPITÃO GOMES,CARLOS GOMES DA SILVA,SUPLENTE,PP,PARTIDO PROGRESSISTA,32
AMERICANA,DEPUTADO FEDERAL,LALO,JOSÉ CARLOS TALDIVO,SUPLENTE,PP,PARTIDO PROGRESSISTA,4
AMERICANA,DEPUTADO FEDERAL,RENATO REICHANN,RUY RENATO REICHMANN,SUPLENTE,PP,PARTIDO PROGRESSISTA,3
AMERICANA,DEPUTADO FEDERAL,BATORÉ,IVANILDO GOMES NOGUEIRA,SUPLENTE,PP,PARTIDO PROGRESSISTA,4
AMERICANA,DEPUTADO FEDERAL,MANOEL MOREIRA,MANOEL MOREIRA DE ARAUJO FILHO,SUPLENTE,PP,PARTIDO PROGRESSISTA,6
AMERICANA,DEPUTADO FEDERAL,ADELINA ALCANTARA MACHADO,ADELINA PEREIRA DA SILVEIRA DE ALCANTARA MACHADO,SUPLENTE,PP,PARTIDO PROGRESSISTA,6
AMERICANA,DEPUTADO FEDERAL,LIBERATO DE VALENTIM GENTIL,LIBERATO ROCHA CALDEIRA,SUPLENTE,PP,PARTIDO PROGRESSISTA,11
AMERICANA,DEPUTADO FEDERAL,LAURINDO BARNARDES,LAURINDO BERNARDES DE SOUZA,SUPLENTE,PP,PARTIDO PROGRESSISTA,29
AMERICANA,DEPUTADO FEDERAL,JOÃO FADEL,JOÃO JORGE FADEL FILHO,SUPLENTE,PP,PARTIDO PROGRESSISTA,9
AMERICANA,DEPUTADO FEDERAL,MAURICIO MARTINS,MAURICIO LUIS MARTINS,SUPLENTE,PP,PARTIDO PROGRESSISTA,10
AMERICANA,DEPUTADO FEDERAL,PEDRINHO BARACAT,ASSAD NACLE BARACAT,SUPLENTE,PP,PARTIDO PROGRESSISTA,1
AMERICANA,DEPUTADO FEDERAL,ALINE CORREA,ALINE LEMOS CORREA DE OLIVEIRA ANDRADE,ELEITO,PP,PARTIDO PROGRESSISTA,2532
AMERICANA,DEPUTADO FEDERAL,ELIAS BITENCOURT,ELIAS DOS SANTOS BITENCOURT,SUPLENTE,PP,PARTIDO PROGRESSISTA,1
AMERICANA,DEPUTADO FEDERAL,PAULO BASSOLI,PAULO SERGIO BONGATER BASSOLI,SUPLENTE,PP,PARTIDO PROGRESSISTA,3
AMERICANA,DEPUTADO FEDERAL,PASTOR MARCOS MOTOLO,MARCOS CINTAS MOTOLO,SUPLENTE,PP,PARTIDO PROGRESSISTA,2
AMERICANA,DEPUTADO FEDERAL,TELLES,DOMINGOS TELLES SANCHES,SUPLENTE,PP,PARTIDO PROGRESSISTA,1
AMERICANA,DEPUTADO FEDERAL,CATARINA RIGINIK,CATARINA BEATRIZ GASPAROTTO RIGINIK,SUPLENTE,PP,PARTIDO PROGRESSISTA,4
AMERICANA,DEPUTADO FEDERAL,DRA ADRIANA DA COSTA,ADRIANA ALVARES DA COSTA DE PAULA ALVES,SUPLENTE,PP,PARTIDO PROGRESSISTA,5
AMERICANA,DEPUTADO FEDERAL,BETO MANSUR,PAULO ROBERTO GOMES MANSUR,ELEITO,PP,PARTIDO PROGRESSISTA,9
AMERICANA,DEPUTADO FEDERAL,LAYRTON INFANTE,LAYRTON INFANTE,SUPLENTE,PP,PARTIDO PROGRESSISTA,4
AMERICANA,DEPUTADO FEDERAL,MISSIONÁRIO JOSÉ OLIMPIO,JOSÉ OLIMPIO SILVEIRA MORAES,ELEITO,PP,PARTIDO PROGRESSISTA,308
AMERICANA,DEPUTADO FEDERAL,FERNANDO STANCATTI,FERNANDO CESAR STANCATTI MARQUES,SUPLENTE,PP,PARTIDO PROGRESSISTA,12
AMERICANA,DEPUTADO FEDERAL,ERIVAN,FRANCISCO ERIVAN PEREIRA,SUPLENTE,PP,PARTIDO PROGRESSISTA,3
AMERICANA,DEPUTADO FEDERAL,TUCÃO,JULIO CESAR THEODORO,SUPLENTE,PP,PARTIDO PROGRESSISTA,1
AMERICANA,DEPUTADO FEDERAL,DR NECHAR,SERGIO ANTONIO NECHAR,SUPLENTE,PP,PARTIDO PROGRESSISTA,1
AMERICANA,DEPUTADO FEDERAL,DELEGADA GRACIELA,GRACIELA DE LOURDES DAVID AMBROSIO,SUPLENTE,PP,PARTIDO PROGRESSISTA,2
AMERICANA,DEPUTADO FEDERAL,MARIO YAMASHITA,JOSÉ MARIO YAMASHITA,SUPLENTE,PP,PARTIDO PROGRESSISTA,1
AMERICANA,DEPUTADO FEDERAL,NETO BELUCI,ALCIDES BELUCI NETO,SUPLENTE,PP,PARTIDO PROGRESSISTA,2
AMERICANA,DEPUTADO FEDERAL,CAPITÃO CRIVELARI,LUIZ ANTONIO CRIVELARI,SUPLENTE,PP,PARTIDO PROGRESSISTA,1166
AMERICANA,DEPUTADO FEDERAL,DR LÉO KAHN,LEO JUVENAL KAHN DA SILVEIRA,SUPLENTE,PP,PARTIDO PROGRESSISTA,9
AMERICANA,DEPUTADO FEDERAL,FARIA LIMA,JOSE ROBERTO FARIA LIMA,SUPLENTE,PP,PARTIDO PROGRESSISTA,2
AMERICANA,DEPUTADO FEDERAL,VADÃO,ETIVALDO VADAO GOMES,SUPLENTE,PP,PARTIDO PROGRESSISTA,73
AMERICANA,DEPUTADO FEDERAL,PH,PAULO HENRIQUE RIBEIRO SANTANA,SUPLENTE,PDT,PARTIDO DEMOCRÁTICO TRABALHISTA,5
AMERICANA,DEPUTADO FEDERAL,KIM,MARCO ANTONIO ALVES JORGE,SUPLENTE,PDT,PARTIDO DEMOCRÁTICO TRABALHISTA,4479
AMERICANA,DEPUTADO FEDERAL,SARGENTO DARCY,DARCY RODRIGUES,SUPLENTE,PDT,PARTIDO DEMOCRÁTICO TRABALHISTA,7
AMERICANA,DEPUTADO FEDERAL,NHA NHA,VALTER BERGAMINI,SUPLENTE,PDT,PARTIDO DEMOCRÁTICO TRABALHISTA,7
AMERICANA,DEPUTADO FEDERAL,DR MARIO,MARIO AUGUSTO SANTOS TEIXEIRA,SUPLENTE,PDT,PARTIDO DEMOCRÁTICO TRABALHISTA,2
AMERICANA,DEPUTADO FEDERAL,ERLON CHAVES,ERLON CHAVES DE CASTRO,SUPLENTE,PDT,PARTIDO DEMOCRÁTICO TRABALHISTA,3
AMERICANA,DEPUTADO FEDERAL,JOÃO DADO,JOÃO EDUARDO DADO LEITE DE CARVALHO,ELEITO,PDT,PARTIDO DEMOCRÁTICO TRABALHISTA,67
AMERICANA,DEPUTADO FEDERAL,PAULINHO DA FORÇA,PAULO PEREIRA DA SILVA,ELEITO,PDT,PARTIDO DEMOCRÁTICO TRABALHISTA,166
AMERICANA,DEPUTADO FEDERAL,ELISEU DANIEL,ELISEU DANIEL DOS SANTOS,SUPLENTE,PDT,PARTIDO DEMOCRÁTICO TRABALHISTA,39
AMERICANA,DEPUTADO FEDERAL,BARBOSA,ANTONIO CARLOS BARBOSA,SUPLENTE,PDT,PARTIDO DEMOCRÁTICO TRABALHISTA,2
AMERICANA,DEPUTADO FEDERAL,GUSTAVO STUPP,LUIZ GUSTAVO ANTUNES STUPP,SUPLENTE,PDT,PARTIDO DEMOCRÁTICO TRABALHISTA,3
AMERICANA,DEPUTADO FEDERAL,ARMANDO HENRIQUE,ARMANDO HENRIQUE,SUPLENTE,PDT,PARTIDO DEMOCRÁTICO TRABALHISTA,2
AMERICANA,DEPUTADO FEDERAL,MARTAN,MARCELO MARTIN,SUPLENTE,PDT,PARTIDO DEMOCRÁTICO TRABALHISTA,2
AMERICANA,DEPUTADO FEDERAL,BOAVENTURA,BOAVENTURA PEREIRA SANTOS,SUPLENTE,PDT,PARTIDO DEMOCRÁTICO TRABALHISTA,1
AMERICANA,DEPUTADO FEDERAL,KAREN HEINS,KAREN MAYELLEN TONIM HEINS,SUPLENTE,PDT,PARTIDO DEMOCRÁTICO TRABALHISTA,938
AMERICANA,DEPUTADO FEDERAL,PEDRO BAPTISTINI,PEDRO ANTONIO BAPTISTINI,SUPLENTE,PDT,PARTIDO DEMOCRÁTICO TRABALHISTA,33
AMERICANA,DEPUTADO FEDERAL,SAULO GOES,SAULO GOES DE ALBUQUERQUE,SUPLENTE,PDT,PARTIDO DEMOCRÁTICO TRABALHISTA,2
AMERICANA,DEPUTADO FEDERAL,MEDEIROS,LUIZ ANTONIO DE MEDEIROS NETO,SUPLENTE,PDT,PARTIDO DEMOCRÁTICO TRABALHISTA,122
AMERICANA,DEPUTADO FEDERAL,GILBERTO BENZI,GILBERTO BENZI,SUPLENTE,PDT,PARTIDO DEMOCRÁTICO TRABALHISTA,3
AMERICANA,DEPUTADO FEDERAL,EDUARDO NASCIMENTO,EDUARDO DUARTE DO NASCIMENTO,SUPLENTE,PDT,PARTIDO DEMOCRÁTICO TRABALHISTA,3
AMERICANA,DEPUTADO FEDERAL,DR LUIZ CHIAPARINE,LUIZ CARLOS CHIAPARINE,SUPLENTE,PDT,PARTIDO DEMOCRÁTICO TRABALHISTA,20
AMERICANA,DEPUTADO FEDERAL,NELSINHO DA BAHIA,NELSON FRANCISCO DOS SANTOS,SUPLENTE,PDT,PARTIDO DEMOCRÁTICO TRABALHISTA,3
AMERICANA,DEPUTADO FEDERAL,MANOEL ANTUNES,MANOEL ANTUNES,SUPLENTE,PDT,PARTIDO DEMOCRÁTICO TRABALHISTA,9
AMERICANA,DEPUTADO FEDERAL,CARLOS HENRIQUE,CARLOS HENRIQUE PINTO,SUPLENTE,PDT,PARTIDO DEMOCRÁTICO TRABALHISTA,28
AMERICANA,DEPUTADO FEDERAL,MAURICIO SOARES JUNIOR,MAURICIO SOARES DE ALMEIDA JUNIOR,SUPLENTE,PDT,PARTIDO DEMOCRÁTICO TRABALHISTA,1
AMERICANA,DEPUTADO FEDERAL,DRA DEBORA,DEBORA MARIA MARAGNI PEREIRA DE ABREU,SUPLENTE,PDT,PARTIDO DEMOCRÁTICO TRABALHISTA,3
AMERICANA,DEPUTADO FEDERAL,SALVADOR ZIMBALDI,SALVADOR ZIMBALDI FILHO,MÉDIA,PDT,PARTIDO DEMOCRÁTICO TRABALHISTA,268
AMERICANA,DEPUTADO FEDERAL,LINDOLFO DOS SANTOS,LINDOLFO LUIZ DOS SANTOS NETO,SUPLENTE,PDT,PARTIDO DEMOCRÁTICO TRABALHISTA,21
AMERICANA,DEPUTADO FEDERAL,FERNANDO CHIARELLI,FERNANDO CHIARELLI,SUPLENTE,PDT,PARTIDO DEMOCRÁTICO TRABALHISTA,2
AMERICANA,DEPUTADO FEDERAL,GILBERTO LOPES,GILBERTO FERREIRA LOPES,SUPLENTE,PDT,PARTIDO DEMOCRÁTICO TRABALHISTA,1
AMERICANA,DEPUTADO FEDERAL,ITAMAR ALVES,ITAMAR ALVES DE OLIVEIRA,SUPLENTE,PDT,PARTIDO DEMOCRÁTICO TRABALHISTA,1
AMERICANA,DEPUTADO FEDERAL,NEI,RODNEI OLIVEIRA DA SILVA,SUPLENTE,PDT,PARTIDO DEMOCRÁTICO TRABALHISTA,1
AMERICANA,DEPUTADO FEDERAL,JOSUE TOPA TUDO,JOSUÉ MOREIRA,SUPLENTE,PDT,PARTIDO DEMOCRÁTICO TRABALHISTA,1
AMERICANA,DEPUTADO FEDERAL,SARGENTO ERNALDO,ERNALDO CESAR MARCONDES,SUPLENTE,PDT,PARTIDO DEMOCRÁTICO TRABALHISTA,1
AMERICANA,DEPUTADO FEDERAL,MAGAIVER,EDILSON MAGAIVER FERREIRA DA SILVA,SUPLENTE,PDT,PARTIDO DEMOCRÁTICO TRABALHISTA,1
AMERICANA,DEPUTADO FEDERAL,FADUL,OSWALDO DOS SANTOS,SUPLENTE,PDT,PARTIDO DEMOCRÁTICO TRABALHISTA,1
AMERICANA,DEPUTADO FEDERAL,IVANIO BATISTA,IVANIO BATISTA DA SILVA,SUPLENTE,PT,JUNTOS POR SÃO PAULO,8
AMERICANA,DEPUTADO FEDERAL,VICENTE CANDIDO,VICENTE CANDIDO DA SILVA,ELEITO,PT,JUNTOS POR SÃO PAULO,21
AMERICANA,DEPUTADO FEDERAL,PROFESSOR JAIR BALESTRA,JAIR DONIZETI BALESTRA,SUPLENTE,PT,JUNTOS POR SÃO PAULO,3
AMERICANA,DEPUTADO FEDERAL,MARQUINHOS OLÍVIO,MARCOS OLIVIO CONCEIÇÃO,SUPLENTE,PT,JUNTOS POR SÃO PAULO,3
AMERICANA,DEPUTADO FEDERAL,GERALDINHO O ILUMINADO,GERALDO ALVES DIONISIO,SUPLENTE,PT,JUNTOS POR SÃO PAULO,1
AMERICANA,DEPUTADO FEDERAL,IARA BERNARDI,IARA BERNARDI,SUPLENTE,PT,JUNTOS POR SÃO PAULO,7
AMERICANA,DEPUTADO FEDERAL,LARGUESA,LUIS VANDERLEI LARGUESA,SUPLENTE,PT,JUNTOS POR SÃO PAULO,623
AMERICANA,DEPUTADO FEDERAL,VACCAREZZA,CANDIDO ELPIDIO DE SOUZA VACCAREZZA,ELEITO,PT,JUNTOS POR SÃO PAULO,29
AMERICANA,DEPUTADO FEDERAL,GENOINO,JOSÉ GENOÍNO NETO,SUPLENTE,PT,JUNTOS POR SÃO PAULO,88
AMERICANA,DEPUTADO FEDERAL,OSMAR LOPES,OSMAR LOPES,SUPLENTE,PT,JUNTOS POR SÃO PAULO,100
AMERICANA,DEPUTADO FEDERAL,HELCIO SILVA,HELCIO ANTONIO DA SILVA,SUPLENTE,PT,JUNTOS POR SÃO PAULO,2
AMERICANA,DEPUTADO FEDERAL,CARLINHOS ALMEIDA,CARLOS JOSE DE ALMEIDA,ELEITO,PT,JUNTOS POR SÃO PAULO,1
AMERICANA,DEPUTADO FEDERAL,MISA BOITO,MARIA EMILIA SEDEH BOITO,SUPLENTE,PT,JUNTOS POR SÃO PAULO,1
AMERICANA,DEPUTADO FEDERAL,NEWTON LIMA NETO,NEWTON LIMA NETO,ELEITO,PT,JUNTOS POR SÃO PAULO,31
AMERICANA,DEPUTADO FEDERAL,TEREZINHA RONDELLI,MARIA TEREZINHA RONDELLI,SUPLENTE,PT,JUNTOS POR SÃO PAULO,798
AMERICANA,DEPUTADO FEDERAL,GERSON SARTORI,GERSON HENRIQUE SARTORI,SUPLENTE,PT,JUNTOS POR SÃO PAULO,2
AMERICANA,DEPUTADO FEDERAL,FILIPPI,JOSÉ DE FILIPPI JÚNIOR,ELEITO,PT,JUNTOS POR SÃO PAULO,5
AMERICANA,DEPUTADO FEDERAL,ARLINDO CHINAGLIA,ARLINDO CHIGNALIA JUNIOR,ELEITO,PT,JUNTOS POR SÃO PAULO,37
AMERICANA,DEPUTADO FEDERAL,JOÃO PAULO CUNHA,JOÃO PAULO CUNHA,ELEITO,PT,JUNTOS POR SÃO PAULO,14
AMERICANA,DEPUTADO FEDERAL,ROQUE FERREIRA,ROQUE JOSÉ FERREIRA,SUPLENTE,PT,JUNTOS POR SÃO PAULO,1
AMERICANA,DEPUTADO FEDERAL,JOÃO BATISTA,JOÃO BATISTA DA SILVA,SUPLENTE,PT,JUNTOS POR SÃO PAULO,2
AMERICANA,DEPUTADO FEDERAL,PIVATTO,JOSÉ PIVATTO,SUPLENTE,PT,JUNTOS POR SÃO PAULO,37
AMERICANA,DEPUTADO FEDERAL,RICARDO BERZOINI,RICARDO JOSE RIBEIRO BERZOINI,ELEITO,PT,JUNTOS POR SÃO PAULO,22
AMERICANA,DEPUTADO FEDERAL,JOSÉ MENTOR,JOSÉ MENTOR GUILHERME DE MELLO NETTO,ELEITO,PT,JUNTOS POR SÃO PAULO,4476
AMERICANA,DEPUTADO FEDERAL,PROF. CARLÃO RAMIRO,CARLOS RAMIRO CASTRO,SUPLENTE,PT,JUNTOS POR SÃO PAULO,75
AMERICANA,DEPUTADO FEDERAL,FÉLIX SAHÃO,FÉLIX SAHÃO JÚNIOR,SUPLENTE,PT,JUNTOS POR SÃO PAULO,4
AMERICANA,DEPUTADO FEDERAL,ROGÉRIO PINTO,ROGÉRIO PINTO FERNANDES,SUPLENTE,PT,JUNTOS POR SÃO PAULO,4
AMERICANA,DEPUTADO FEDERAL,TENENTE PAZ,FRANCISCO JESUS DA PAZ,SUPLENTE,PT,JUNTOS POR SÃO PAULO,8
AMERICANA,DEPUTADO FEDERAL,RODRIGO VALVERDE,JORGE RODRIGO VALVERDE SANTANA,SUPLENTE,PT,JUNTOS POR SÃO PAULO,2
AMERICANA,DEPUTADO FEDERAL,VANDERLEI SIRAQUE,VANDERLEI SIRAQUE,SUPLENTE,PT,JUNTOS POR SÃO PAULO,15
AMERICANA,DEPUTADO FEDERAL,PAULO AFONSO,PAULO AFONSO RIBEIRO,SUPLENTE,PT,JUNTOS POR SÃO PAULO,1
AMERICANA,DEPUTADO FEDERAL,LUIZ CARLOS GOMES,LUIZ CARLOS GOMES,SUPLENTE,PT,JUNTOS POR SÃO PAULO,1
AMERICANA,DEPUTADO FEDERAL,JILMAR TATTO,JILMAR AUGUSTINHO TATTO,ELEITO,PT,JUNTOS POR SÃO PAULO,10
AMERICANA,DEPUTADO FEDERAL,DURVAL ORLATO,DURVAL LOPES ORLATO,SUPLENTE,PT,JUNTOS POR SÃO PAULO,2
AMERICANA,DEPUTADO FEDERAL,JANIO RIBEIRO,JANIO RIBEIRO,SUPLENTE,PT,JUNTOS POR SÃO PAULO,2
AMERICANA,DEPUTADO FEDERAL,RUBINHO BASTOS,RUBENS BASTOS DO NASCIMENTO,SUPLENTE,PT,JUNTOS POR SÃO PAULO,1
AMERICANA,DEPUTADO FEDERAL,ARCELINO ARAUJO,ARCELINO ARAUJO RIBEIRO,SUPLENTE,PT,JUNTOS POR SÃO PAULO,1
AMERICANA,DEPUTADO FEDERAL,RENATO SIMÕES,RENATO SIMÕES,SUPLENTE,PT,JUNTOS POR SÃO PAULO,123
AMERICANA,DEPUTADO FEDERAL,PROFESSOR MOREIRA,WAINES MOREIRA ALVES,SUPLENTE,PT,JUNTOS POR SÃO PAULO,1
AMERICANA,DEPUTADO FEDERAL,DEVANIR RIBEIRO,DEVANIR RIBEIRO,ELEITO,PT,JUNTOS POR SÃO PAULO,13
AMERICANA,DEPUTADO FEDERAL,ZARATTINI,CARLOS ALBERTO ROLIM ZARATTINI,ELEITO,PT,JUNTOS POR SÃO PAULO,194
AMERICANA,DEPUTADO FEDERAL,DR RONALDO BRESCIANI,RONALDO JOSÉ BRESCIANI,SUPLENTE,PT,JUNTOS POR SÃO PAULO,3
AMERICANA,DEPUTADO FEDERAL,MARIA LUCIA PRANDI,MARIA LUCIA PRANDI GOMES,SUPLENTE,PT,JUNTOS POR SÃO PAULO,6
AMERICANA,DEPUTADO FEDERAL,ANGELO BARRETO,ANGELO RAFAEL BARRETO,SUPLENTE,PT,JUNTOS POR SÃO PAULO,8
AMERICANA,DEPUTADO FEDERAL,JANETE PIETÁ,JANETE ROCHA PIETÁ,ELEITO,PT,JUNTOS POR SÃO PAULO,3
AMERICANA,DEPUTADO FEDERAL,VALDECI CHIRANHA,VALDECI FERREIRA DA SILVA,SUPLENTE,PT,JUNTOS POR SÃO PAULO,3
AMERICANA,DEPUTADO FEDERAL,VICENTINHO,VICENTE PAULO DA SILVA,ELEITO,PT,JUNTOS POR SÃO PAULO,39
AMERICANA,DEPUTADO FEDERAL,DOUGLAS MOREIRA,DOUGLAS SIMAS MOREIRA,SUPLENTE,PT,JUNTOS POR SÃO PAULO,1
AMERICANA,DEPUTADO FEDERAL,PAULO TEIXEIRA,LUIZ PAULO TEIXEIRA FERREIRA,ELEITO,PT,JUNTOS POR SÃO PAULO,36
AMERICANA,DEPUTADO FEDERAL,CLAURY,CLAURY SANTOS ALVES DA SILVA,SUPLENTE,PTB,PARTIDO TRABALHISTA BRASILEIRO,4
AMERICANA,DEPUTADO FEDERAL,ALEXANDRE COSTA,ALEXANDRE COSTA,SUPLENTE,PTB,PARTIDO TRABALHISTA BRASILEIRO,1
AMERICANA,DEPUTADO FEDERAL,CORONEL GOULART,ANTONIO CARLOS GOULART,SUPLENTE,PTB,PARTIDO TRABALHISTA BRASILEIRO,1
AMERICANA,DEPUTADO FEDERAL,VAMPETA,MARCOS ANDRE BATISTA SANTOS,SUPLENTE,PTB,PARTIDO TRABALHISTA BRASILEIRO,3
AMERICANA,DEPUTADO FEDERAL,NADUR,ADALBERTO NADUR,SUPLENTE,PTB,PARTIDO TRABALHISTA BRASILEIRO,7
AMERICANA,DEPUTADO FEDERAL,SANTANA,JOSE SANTANA DE ABREU,SUPLENTE,PTB,PARTIDO TRABALHISTA BRASILEIRO,1
AMERICANA,DEPUTADO FEDERAL,ROBSON TUMA,ROBSON TUMA,SUPLENTE,PTB,PARTIDO TRABALHISTA BRASILEIRO,13
AMERICANA,DEPUTADO FEDERAL,CARLINHOS SARAIVA,CARLOS HENRIQUE DA FONSECA,SUPLENTE,PTB,PARTIDO TRABALHISTA BRASILEIRO,18
AMERICANA,DEPUTADO FEDERAL,DR SILNEY BERALDO,SILNEY MARCOS BERALDO,SUPLENTE,PTB,PARTIDO TRABALHISTA BRASILEIRO,836
AMERICANA,DEPUTADO FEDERAL,OBAMA BRASIL,ANANIAS RODRIGUES DA SILVA,SUPLENTE,PTB,PARTIDO TRABALHISTA BRASILEIRO,1
AMERICANA,DEPUTADO FEDERAL,PROF CLAUDIO ZANUTIM,CLAUDIO ZANUTIM MORAES,SUPLENTE,PTB,PARTIDO TRABALHISTA BRASILEIRO,3
AMERICANA,DEPUTADO FEDERAL,AMIRAH SABA DA METROPOLITANAFM,AMIRAH SABA,SUPLENTE,PTB,PARTIDO TRABALHISTA BRASILEIRO,1
AMERICANA,DEPUTADO FEDERAL,SINVAL DORIGON,SINVAL ROBERTO DORIGON,SUPLENTE,PTB,PARTIDO TRABALHISTA BRASILEIRO,8
AMERICANA,DEPUTADO FEDERAL,NELSON MARQUEZELLI,NELSON MARQUEZELLI,ELEITO,PTB,PARTIDO TRABALHISTA BRASILEIRO,198
AMERICANA,DEPUTADO FEDERAL,CARLOS BURGHI,CARLOS ALBERTO EBERT BURGHI,SUPLENTE,PTB,PARTIDO TRABALHISTA BRASILEIRO,4
AMERICANA,DEPUTADO FEDERAL,DR MOYSES,JOAO MOYSES ABUJADI,SUPLENTE,PTB,PARTIDO TRABALHISTA BRASILEIRO,2
AMERICANA,DEPUTADO FEDERAL,CIDA ALVES,MARIA APARECIDA ALVES DA ROCHA,SUPLENTE,PTB,PARTIDO TRABALHISTA BRASILEIRO,1
AMERICANA,DEPUTADO FEDERAL,LUIZ MIELLI,JOSÉ FERNANDO DE SOUSA MIELLI,SUPLENTE,PTB,PARTIDO TRABALHISTA BRASILEIRO,1
AMERICANA,DEPUTADO FEDERAL,SATURNINO DE BRITO,SATURNINO DE SALES SANTOS,SUPLENTE,PTB,PARTIDO TRABALHISTA BRASILEIRO,1
AMERICANA,DEPUTADO FEDERAL,MALU PARISI,LUIZA FAUSTINO PEREIRA PARI,SUPLENTE,PTB,PARTIDO TRABALHISTA BRASILEIRO,2
AMERICANA,DEPUTADO FEDERAL,BRESSAN,ANTONIO BRESSAN FILHO,SUPLENTE,PTB,PARTIDO TRABALHISTA BRASILEIRO,1
AMERICANA,DEPUTADO FEDERAL,CIGANA,GISELA DOS SANTOS,SUPLENTE,PTB,PARTIDO TRABALHISTA BRASILEIRO,1
AMERICANA,DEPUTADO FEDERAL,SONIA CRISTIANO,SONIA REGINA CRISTIANO,SUPLENTE,PTB,PARTIDO TRABALHISTA BRASILEIRO,4
AMERICANA,DEPUTADO FEDERAL,ARNALDO FARIA DE SÁ,ARNALDO FARIA DE SÁ,ELEITO,PTB,PARTIDO TRABALHISTA BRASILEIRO,97
AMERICANA,DEPUTADO FEDERAL,TIM,ADILSON FERNANDES VARELA,SUPLENTE,PTB,PARTIDO TRABALHISTA BRASILEIRO,1
AMERICANA,DEPUTADO FEDERAL,CLAUDIA SARTORI,CLAUDIA SARTORI DONATTI DE SOUZA,SUPLENTE,PTB,PARTIDO TRABALHISTA BRASILEIRO,2
AMERICANA,DEPUTADO FEDERAL,DRª NILCE SEGALLA,NILCE SEGALLA,SUPLENTE,PTB,PARTIDO TRABALHISTA BRASILEIRO,8
AMERICANA,DEPUTADO FEDERAL,CARLOS JUNG,CARLOS ALBERTO JUNG SANTOS,SUPLENTE,PTB,PARTIDO TRABALHISTA BRASILEIRO,1
AMERICANA,DEPUTADO FEDERAL,PASTORA SUELY LOPES,SUELY CARNEIRO LOPES,SUPLENTE,PTB,PARTIDO TRABALHISTA BRASILEIRO,2
AMERICANA,DEPUTADO FEDERAL,WALTER CAVEANHA,WALTER CAVEANHA,SUPLENTE,PTB,PARTIDO TRABALHISTA BRASILEIRO,4
AMERICANA,DEPUTADO FEDERAL,FRANK AGUIAR,FRANCINETO LUZ DE AGUIAR,SUPLENTE,PTB,PARTIDO TRABALHISTA BRASILEIRO,2
AMERICANA,DEPUTADO FEDERAL,SONIA GARCIA,MARIA SONIA REIS LIMA,SUPLENTE,PTB,PARTIDO TRABALHISTA BRASILEIRO,1
AMERICANA,DEPUTADO FEDERAL,LUCIA HELENA,LUCIA HELENA PIRES SOARES,SUPLENTE,PTB,PARTIDO TRABALHISTA BRASILEIRO,1
AMERICANA,DEPUTADO FEDERAL,DR ANDRE ROCHA,ANDRE LUIS ROCHA,SUPLENTE,PTB,PARTIDO TRABALHISTA BRASILEIRO,85
AMERICANA,DEPUTADO FEDERAL,DR BENTO MACHADO,BENTO FRANCISCO MACHADO,SUPLENTE,PTB,PARTIDO TRABALHISTA BRASILEIRO,2
AMERICANA,DEPUTADO FEDERAL,PADRE FERNANDO,LAUDINEY FERNANDO SILVA FRAGA,SUPLENTE,PTB,PARTIDO TRABALHISTA BRASILEIRO,24
AMERICANA,DEPUTADO FEDERAL,IVAN GUALBERTO,VANTUIL VIEIRA GUALBERTO,SUPLENTE,PTB,PARTIDO TRABALHISTA BRASILEIRO,2
AMERICANA,DEPUTADO FEDERAL,DR SEGURA,JOSE APARECIDO SEGURA RUIZ,SUPLENTE,PTB,PARTIDO TRABALHISTA BRASILEIRO,1
AMERICANA,DEPUTADO FEDERAL,CORREA NETO,ARNALDO CORREA NETO,SUPLENTE,PTB,PARTIDO TRABALHISTA BRASILEIRO,1
AMERICANA,DEPUTADO FEDERAL,VANDERLEI TRISTÃO / TICO,VANDERLEI MARTINS TRISTÃO,SUPLENTE,PTB,PARTIDO TRABALHISTA BRASILEIRO,2
AMERICANA,DEPUTADO FEDERAL,PAULO LIMA,PAULO CESAR DE OLIVEIRA LIMA,SUPLENTE,PMDB,PARTIDO DO MOVIMENTO DEMOCRÁTICO BRASILEIRO,7
AMERICANA,DEPUTADO FEDERAL,CARVALHO SALES,JEFFERSON CARVALHO SALES,SUPLENTE,PMDB,PARTIDO DO MOVIMENTO DEMOCRÁTICO BRASILEIRO,1
AMERICANA,DEPUTADO FEDERAL,VANDERLEI JUELI,VANDERLEI JUELI,SUPLENTE,PMDB,PARTIDO DO MOVIMENTO DEMOCRÁTICO BRASILEIRO,4
AMERICANA,DEPUTADO FEDERAL,DR. ALMÉRIO,ALMÉRIO AGUIAR MELO FILHO,SUPLENTE,PMDB,PARTIDO DO MOVIMENTO DEMOCRÁTICO BRASILEIRO,8
AMERICANA,DEPUTADO FEDERAL,ANA CRISTINA,ANA CRISTINA FERNANDES GIAMPIETRO,SUPLENTE,PMDB,PARTIDO DO MOVIMENTO DEMOCRÁTICO BRASILEIRO,2
AMERICANA,DEPUTADO FEDERAL,NENÊ RÉSTIO,ANGELO ROBERTO RESTIO,SUPLENTE,PMDB,PARTIDO DO MOVIMENTO DEMOCRÁTICO BRASILEIRO,103
AMERICANA,DEPUTADO FEDERAL,MARCOS TENÓRIO,MARCOS ANTÔNIO FERREIRA TENÓRIO,SUPLENTE,PMDB,PARTIDO DO MOVIMENTO DEMOCRÁTICO BRASILEIRO,2
AMERICANA,DEPUTADO FEDERAL,PAULINHO SOBRAL,PAULO MENDES SOBRAL,SUPLENTE,PMDB,PARTIDO DO MOVIMENTO DEMOCRÁTICO BRASILEIRO,2
AMERICANA,DEPUTADO FEDERAL,BONFÁ,ALVARO BONFA JUNIOR,SUPLENTE,PMDB,PARTIDO DO MOVIMENTO DEMOCRÁTICO BRASILEIRO,1
AMERICANA,DEPUTADO FEDERAL,TONY JUPSSON,TONY JUPSSON SANTOS,SUPLENTE,PMDB,PARTIDO DO MOVIMENTO DEMOCRÁTICO BRASILEIRO,1
AMERICANA,DEPUTADO FEDERAL,EDUARDO COELHO,EDUARDO JOSÉ PEREIRA COELHO,SUPLENTE,PMDB,PARTIDO DO MOVIMENTO DEMOCRÁTICO BRASILEIRO,95
AMERICANA,DEPUTADO FEDERAL,PILTON RIOS,PILTON RIOS DE BARROS FELIX PEREIRA,SUPLENTE,PMDB,PARTIDO DO MOVIMENTO DEMOCRÁTICO BRASILEIRO,2
AMERICANA,DEPUTADO FEDERAL,DIEGO MARTINS,DIEGO OLIVEIRA MARTINS,SUPLENTE,PMDB,PARTIDO DO MOVIMENTO DEMOCRÁTICO BRASILEIRO,1
AMERICANA,DEPUTADO FEDERAL,JOSÉ DE ANCHIETA,JOSÉ DE ANCHIETA FONTES,SUPLENTE,PMDB,PARTIDO DO MOVIMENTO DEMOCRÁTICO BRASILEIRO,1
AMERICANA,DEPUTADO FEDERAL,EDINHO ARAUJO,EDSON EDINHO COELHO ARAUJO,ELEITO,PMDB,PARTIDO DO MOVIMENTO DEMOCRÁTICO BRASILEIRO,31
AMERICANA,DEPUTADO FEDERAL,SERGIO KOBRA,SERGIO MARTINS DOS SANTOS JUNIOR,SUPLENTE,PMDB,PARTIDO DO MOVIMENTO DEMOCRÁTICO BRASILEIRO,1
AMERICANA,DEPUTADO FEDERAL,DR. AJURICABA,AJURICABA DE SOUZA MENEZES,SUPLENTE,PMDB,PARTIDO DO MOVIMENTO DEMOCRÁTICO BRASILEIRO,2
AMERICANA,DEPUTADO FEDERAL,ROLEMBERG,ROLANDO BELTRAMINE ROLEMBERG,SUPLENTE,PMDB,PARTIDO DO MOVIMENTO DEMOCRÁTICO BRASILEIRO,3
AMERICANA,DEPUTADO FEDERAL,REGA,ALBERTO REGA,SUPLENTE,PMDB,PARTIDO DO MOVIMENTO DEMOCRÁTICO BRASILEIRO,4
AMERICANA,DEPUTADO FEDERAL,DR. CÉSAR,LUIZ CESAR REGINATO,SUPLENTE,PMDB,PARTIDO DO MOVIMENTO DEMOCRÁTICO BRASILEIRO,1
AMERICANA,DEPUTADO FEDERAL,JOSÉ CARLOS,JOSÉ CARLOS DA SILVA,SUPLENTE,PMDB,PARTIDO DO MOVIMENTO DEMOCRÁTICO BRASILEIRO,3
AMERICANA,DEPUTADO FEDERAL,PAULINHO DO GUINCHO,AUDALIO PAULO DA SILVA,SUPLENTE,PMDB,PARTIDO DO MOVIMENTO DEMOCRÁTICO BRASILEIRO,1
AMERICANA,DEPUTADO FEDERAL,DR. SAMIR NASSBINE,SAMIR ASSAD NASSBINE,SUPLENTE,PMDB,PARTIDO DO MOVIMENTO DEMOCRÁTICO BRASILEIRO,5
AMERICANA,DEPUTADO FEDERAL,DANIEL CALDEIRA,DANIEL CALDEIRA MATEUS,SUPLENTE,PSL,PRESTE ATENÇÃO SÃO PAULO,1
AMERICANA,DEPUTADO FEDERAL,SARGENTO SEVERO,LUCIANO APARECIDO SEVERO,SUPLENTE,PSL,PRESTE ATENÇÃO SÃO PAULO,13
AMERICANA,DEPUTADO FEDERAL,PAULO DONATO,PAULO ROBERTO DONATO,SUPLENTE,PSL,PRESTE ATENÇÃO SÃO PAULO,2
AMERICANA,DEPUTADO FEDERAL,LINDALVA MARIA,LINDALVA MARIA DIAS DE JESUS,SUPLENTE,PSL,PRESTE ATENÇÃO SÃO PAULO,1
AMERICANA,DEPUTADO FEDERAL,GLEDSON TIGRÃO,GLEDSON MARQUES PESSOA,SUPLENTE,PSL,PRESTE ATENÇÃO SÃO PAULO,1
AMERICANA,DEPUTADO FEDERAL,ROBERTO SIQUEIRA,ROBERTO SIQUEIRA GOMES,SUPLENTE,PSL,PRESTE ATENÇÃO SÃO PAULO,27
AMERICANA,DEPUTADO FEDERAL,CORONEL GILSON LOPES,GILSON LOPES DA SILVA,SUPLENTE,PSC,HUMANISTA CRISTÃO ,3
AMERICANA,DEPUTADO FEDERAL,MISSIONARIA NAZARE,MARIA NAZARE DOS SANTOS SORRILLO,SUPLENTE,PSC,HUMANISTA CRISTÃO ,19
AMERICANA,DEPUTADO FEDERAL,CLEBER DELALIBERA,CLEBER DE MOURA DELALIBERA,SUPLENTE,PSC,HUMANISTA CRISTÃO ,2
AMERICANA,DEPUTADO FEDERAL,MARCO FELICIANO,MARCO ANTONIO FELICIANO,ELEITO,PSC,HUMANISTA CRISTÃO ,394
AMERICANA,DEPUTADO FEDERAL,MARCELO AGUIAR,MARCELO THEODORO DE AGUIAR,ELEITO,PSC,HUMANISTA CRISTÃO ,191
AMERICANA,DEPUTADO FEDERAL,CHICO NETO,FRANCISCO DA COSTA NETO,SUPLENTE,PSC,HUMANISTA CRISTÃO ,7
AMERICANA,DEPUTADO FEDERAL,ARI BARCELLOS,JOSE DE ARIMATHEA BARCELLOS,SUPLENTE,PSC,HUMANISTA CRISTÃO ,1
AMERICANA,DEPUTADO FEDERAL,ANTONIO SANDOVAL,ANTONIO RODRIGUES SANDOVAL,SUPLENTE,PSC,HUMANISTA CRISTÃO ,1
AMERICANA,DEPUTADO FEDERAL,REGIS DE OLIVEIRA,REGIS FERNANDES DE OLIVEIRA,SUPLENTE,PSC,HUMANISTA CRISTÃO ,120
AMERICANA,DEPUTADO FEDERAL,SILVIA PALMA,SILVIA ELIANA PALMA,SUPLENTE,PSC,HUMANISTA CRISTÃO ,3
AMERICANA,DEPUTADO FEDERAL,NEY SANTOS,CLAUDINEI ALVES DOS SANTOS,SUPLENTE,PSC,HUMANISTA CRISTÃO ,70
AMERICANA,DEPUTADO FEDERAL,DALVAN,JOÃO GOMES DE ALMEIDA,SUPLENTE,PSC,HUMANISTA CRISTÃO ,28
AMERICANA,DEPUTADO FEDERAL,CICERO FERNANDES,JOSE CICERO FERNANDES DA SILVA,SUPLENTE,PSC,HUMANISTA CRISTÃO ,1
AMERICANA,DEPUTADO FEDERAL,MARCOS CUNHA,MARCOS DE ALMEIDA CUNHA,SUPLENTE,PSC,HUMANISTA CRISTÃO ,2
AMERICANA,DEPUTADO FEDERAL,DR. LEONARDO LOURENÇO,LEONARDO JOSE OLIVEIRA LOURENÇO,SUPLENTE,PSC,HUMANISTA CRISTÃO ,4
AMERICANA,DEPUTADO FEDERAL,PR. LUIZ LEMOS,LUIZ CARLOS LEMOS,SUPLENTE,PSC,HUMANISTA CRISTÃO ,2
AMERICANA,DEPUTADO FEDERAL,MAURÃO,JOSE MAURO PEREIRA DE BARROS,SUPLENTE,PSC,HUMANISTA CRISTÃO ,1
AMERICANA,DEPUTADO FEDERAL,OMAR,OMAR ADOLFO CHOUMAN,SUPLENTE,PSC,HUMANISTA CRISTÃO ,1
AMERICANA,DEPUTADO FEDERAL,PRICILA LEME,PRICILA HELENA MOYSES LEME,SUPLENTE,PSC,HUMANISTA CRISTÃO ,8
AMERICANA,DEPUTADO FEDERAL,DR. SANDOVAL,SANDOVAL DE CASTRO DOURADO,SUPLENTE,PSC,HUMANISTA CRISTÃO ,4
AMERICANA,DEPUTADO FEDERAL,DR. CARALAMBOS,CARALAMBOS CONSTANTINO SOTIROPOULOS,SUPLENTE,PSC,HUMANISTA CRISTÃO ,1
AMERICANA,DEPUTADO FEDERAL,RENE DO RAP,RENE ROSA,SUPLENTE,PSC,HUMANISTA CRISTÃO ,1
AMERICANA,DEPUTADO FEDERAL,MANOEL GASPAR,MANOEL FERREIRA DE SOUZA GASPAR,SUPLENTE,PSC,HUMANISTA CRISTÃO ,1
AMERICANA,DEPUTADO FEDERAL,JUCA CHAVES,JURANDYR CZACZKES CHAVES,SUPLENTE,PR,JUNTOS POR SÃO PAULO,32
AMERICANA,DEPUTADO FEDERAL,AGNALDO TIMOTEO,AGUINALDO TIMOTEO PEREIRA,SUPLENTE,PR,JUNTOS POR SÃO PAULO,15
AMERICANA,DEPUTADO FEDERAL,TIRIRICA,FRANCISCO EVERARDO OLIVEIRA SILVA,ELEITO,PR,JUNTOS POR SÃO PAULO,1600
AMERICANA,DEPUTADO FEDERAL,PR PAULO FREIRE,PAULO ROBERTO FREIRE DA COSTA,ELEITO,PR,JUNTOS POR SÃO PAULO,319
AMERICANA,DEPUTADO FEDERAL,LUCIANA COSTA,LUCIANA DE ALMEIDA COSTA,SUPLENTE,PR,JUNTOS POR SÃO PAULO,12
AMERICANA,DEPUTADO FEDERAL,MILTON MONTI,MILTON ANTONIO CASQUEL MONTI,ELEITO,PR,JUNTOS POR SÃO PAULO,10
AMERICANA,DEPUTADO FEDERAL,VALDEMAR COSTA NETO,VALDEMAR COSTA NETO,ELEITO,PR,JUNTOS POR SÃO PAULO,28
AMERICANA,DEPUTADO FEDERAL,EDGAR EDUCACAO,EDGAR MAURICIO DE SANTANA,SUPLENTE,PPS,PSDB/DEM/PPS,4
AMERICANA,DEPUTADO FEDERAL,SONRISAL,MAURICIO BONATTI,SUPLENTE,PPS,PSDB/DEM/PPS,1
AMERICANA,DEPUTADO FEDERAL,WILLIAM WOO,WILLIAM BOSS WOO,SUPLENTE,PPS,PSDB/DEM/PPS,9
AMERICANA,DEPUTADO FEDERAL,ROBERTO FREIRE,ROBERTO JOAO PEREIRA FREIRE,ELEITO,PPS,PSDB/DEM/PPS,146
AMERICANA,DEPUTADO FEDERAL,CORONEL EDSON SARDANO,EDSON DE JESUS SARDANO,SUPLENTE,PPS,PSDB/DEM/PPS,11
