LUTÉCIA,PRESIDENTE,DILMA,DILMA VANA ROUSSEFF,2º TURNO,PT,PARA O BRASIL SEGUIR MUDANDO,882
LUTÉCIA,PRESIDENTE,JOSÉ SERRA,JOSÉ SERRA,2º TURNO,PSDB,O BRASIL PODE MAIS,676
LUTÉCIA,GOVERNADOR,GERALDO ALCKMIN,GERALDO JOSE RODRIGUES ALCKMIN FILHO,ELEITO,PSDB,UNIDOS POR SÃO PAULO,913
LUTÉCIA,SENADOR,MARTA SUPLICY,MARTA SUPLICY,ELEITO,PT,UNIÃO PARA MUDAR,918
LUTÉCIA,SENADOR,ALOYSIO NUNES,ALOYSIO NUNES FERREIRA FILHO,ELEITO,PSDB,UNIDOS POR SÃO PAULO,800
LUTÉCIA,DEPUTADO FEDERAL,OTONIEL LIMA,OTONIEL CARLOS DE LIMA,MÉDIA,PRB,JUNTOS POR SÃO PAULO,1
LUTÉCIA,DEPUTADO FEDERAL,DURVAL MORELLI,DURVAL MORELLI NETO,SUPLENTE,PP,PARTIDO PROGRESSISTA,3
LUTÉCIA,DEPUTADO FEDERAL,MALUF,PAULO SALIM MALUF,ELEITO,PP,PARTIDO PROGRESSISTA,3
LUTÉCIA,DEPUTADO FEDERAL,CAPITÃO GOMES,CARLOS GOMES DA SILVA,SUPLENTE,PP,PARTIDO PROGRESSISTA,1
LUTÉCIA,DEPUTADO FEDERAL,PEDRINHO BARACAT,ASSAD NACLE BARACAT,SUPLENTE,PP,PARTIDO PROGRESSISTA,1
LUTÉCIA,DEPUTADO FEDERAL,ALINE CORREA,ALINE LEMOS CORREA DE OLIVEIRA ANDRADE,ELEITO,PP,PARTIDO PROGRESSISTA,1
LUTÉCIA,DEPUTADO FEDERAL,PAULO BASSOLI,PAULO SERGIO BONGATER BASSOLI,SUPLENTE,PP,PARTIDO PROGRESSISTA,11
LUTÉCIA,DEPUTADO FEDERAL,CLAUDIO SABINO,CLAUDIO SABINO,SUPLENTE,PP,PARTIDO PROGRESSISTA,1
LUTÉCIA,DEPUTADO FEDERAL,ADHEMAR DE BARROS FILHO,ADHEMAR DE BARROS FILHO,SUPLENTE,PP,PARTIDO PROGRESSISTA,1
LUTÉCIA,DEPUTADO FEDERAL,CABO WILSON,WILSON DE OLIVEIRA MORAIS,SUPLENTE,PP,PARTIDO PROGRESSISTA,1
LUTÉCIA,DEPUTADO FEDERAL,MISSIONÁRIO JOSÉ OLIMPIO,JOSÉ OLIMPIO SILVEIRA MORAES,ELEITO,PP,PARTIDO PROGRESSISTA,11
LUTÉCIA,DEPUTADO FEDERAL,SILVIA MARIA,SILVIA MARIA DOS SANTOS PEREIRA,SUPLENTE,PP,PARTIDO PROGRESSISTA,2
LUTÉCIA,DEPUTADO FEDERAL,DR NECHAR,SERGIO ANTONIO NECHAR,SUPLENTE,PP,PARTIDO PROGRESSISTA,539
LUTÉCIA,DEPUTADO FEDERAL,CAPITÃO CRIVELARI,LUIZ ANTONIO CRIVELARI,SUPLENTE,PP,PARTIDO PROGRESSISTA,1
LUTÉCIA,DEPUTADO FEDERAL,VADÃO,ETIVALDO VADAO GOMES,SUPLENTE,PP,PARTIDO PROGRESSISTA,45
LUTÉCIA,DEPUTADO FEDERAL,JOÃO DADO,JOÃO EDUARDO DADO LEITE DE CARVALHO,ELEITO,PDT,PARTIDO DEMOCRÁTICO TRABALHISTA,1
LUTÉCIA,DEPUTADO FEDERAL,PAULINHO DA FORÇA,PAULO PEREIRA DA SILVA,ELEITO,PDT,PARTIDO DEMOCRÁTICO TRABALHISTA,3
LUTÉCIA,DEPUTADO FEDERAL,DR LUIZ CHIAPARINE,LUIZ CARLOS CHIAPARINE,SUPLENTE,PDT,PARTIDO DEMOCRÁTICO TRABALHISTA,1
LUTÉCIA,DEPUTADO FEDERAL,MANOEL ANTUNES,MANOEL ANTUNES,SUPLENTE,PDT,PARTIDO DEMOCRÁTICO TRABALHISTA,2
LUTÉCIA,DEPUTADO FEDERAL,SALVADOR ZIMBALDI,SALVADOR ZIMBALDI FILHO,MÉDIA,PDT,PARTIDO DEMOCRÁTICO TRABALHISTA,2
LUTÉCIA,DEPUTADO FEDERAL,JOSUE TOPA TUDO,JOSUÉ MOREIRA,SUPLENTE,PDT,PARTIDO DEMOCRÁTICO TRABALHISTA,1
LUTÉCIA,DEPUTADO FEDERAL,VICENTE CANDIDO,VICENTE CANDIDO DA SILVA,ELEITO,PT,JUNTOS POR SÃO PAULO,1
LUTÉCIA,DEPUTADO FEDERAL,PROFESSOR JAIR BALESTRA,JAIR DONIZETI BALESTRA,SUPLENTE,PT,JUNTOS POR SÃO PAULO,1
LUTÉCIA,DEPUTADO FEDERAL,VACCAREZZA,CANDIDO ELPIDIO DE SOUZA VACCAREZZA,ELEITO,PT,JUNTOS POR SÃO PAULO,1
LUTÉCIA,DEPUTADO FEDERAL,ARLINDO CHINAGLIA,ARLINDO CHIGNALIA JUNIOR,ELEITO,PT,JUNTOS POR SÃO PAULO,23
LUTÉCIA,DEPUTADO FEDERAL,JOÃO PAULO CUNHA,JOÃO PAULO CUNHA,ELEITO,PT,JUNTOS POR SÃO PAULO,8
LUTÉCIA,DEPUTADO FEDERAL,RICARDO BERZOINI,RICARDO JOSE RIBEIRO BERZOINI,ELEITO,PT,JUNTOS POR SÃO PAULO,1
LUTÉCIA,DEPUTADO FEDERAL,JOSÉ MENTOR,JOSÉ MENTOR GUILHERME DE MELLO NETTO,ELEITO,PT,JUNTOS POR SÃO PAULO,13
LUTÉCIA,DEPUTADO FEDERAL,PROF. CARLÃO RAMIRO,CARLOS RAMIRO CASTRO,SUPLENTE,PT,JUNTOS POR SÃO PAULO,2
LUTÉCIA,DEPUTADO FEDERAL,ROGÉRIO PINTO,ROGÉRIO PINTO FERNANDES,SUPLENTE,PT,JUNTOS POR SÃO PAULO,1
LUTÉCIA,DEPUTADO FEDERAL,JILMAR TATTO,JILMAR AUGUSTINHO TATTO,ELEITO,PT,JUNTOS POR SÃO PAULO,1
LUTÉCIA,DEPUTADO FEDERAL,JANIO RIBEIRO,JANIO RIBEIRO,SUPLENTE,PT,JUNTOS POR SÃO PAULO,1
LUTÉCIA,DEPUTADO FEDERAL,RENATO SIMÕES,RENATO SIMÕES,SUPLENTE,PT,JUNTOS POR SÃO PAULO,6
LUTÉCIA,DEPUTADO FEDERAL,DEVANIR RIBEIRO,DEVANIR RIBEIRO,ELEITO,PT,JUNTOS POR SÃO PAULO,59
LUTÉCIA,DEPUTADO FEDERAL,ZARATTINI,CARLOS ALBERTO ROLIM ZARATTINI,ELEITO,PT,JUNTOS POR SÃO PAULO,4
LUTÉCIA,DEPUTADO FEDERAL,MARIA LUCIA PRANDI,MARIA LUCIA PRANDI GOMES,SUPLENTE,PT,JUNTOS POR SÃO PAULO,2
LUTÉCIA,DEPUTADO FEDERAL,ROBSON TUMA,ROBSON TUMA,SUPLENTE,PTB,PARTIDO TRABALHISTA BRASILEIRO,1
LUTÉCIA,DEPUTADO FEDERAL,NELSON MARQUEZELLI,NELSON MARQUEZELLI,ELEITO,PTB,PARTIDO TRABALHISTA BRASILEIRO,8
LUTÉCIA,DEPUTADO FEDERAL,SATURNINO DE BRITO,SATURNINO DE SALES SANTOS,SUPLENTE,PTB,PARTIDO TRABALHISTA BRASILEIRO,1
LUTÉCIA,DEPUTADO FEDERAL,CELIO DINIZ,CELIO FRANCISCO DINIZ,SUPLENTE,PTB,PARTIDO TRABALHISTA BRASILEIRO,8
LUTÉCIA,DEPUTADO FEDERAL,PAULO LIMA,PAULO CESAR DE OLIVEIRA LIMA,SUPLENTE,PMDB,PARTIDO DO MOVIMENTO DEMOCRÁTICO BRASILEIRO,5
LUTÉCIA,DEPUTADO FEDERAL,MORATO,JOSÉ ANTONIO MORATO,SUPLENTE,PMDB,PARTIDO DO MOVIMENTO DEMOCRÁTICO BRASILEIRO,1
LUTÉCIA,DEPUTADO FEDERAL,DR. SAMIR NASSBINE,SAMIR ASSAD NASSBINE,SUPLENTE,PMDB,PARTIDO DO MOVIMENTO DEMOCRÁTICO BRASILEIRO,3
LUTÉCIA,DEPUTADO FEDERAL,SARGENTO SEVERO,LUCIANO APARECIDO SEVERO,SUPLENTE,PSL,PRESTE ATENÇÃO SÃO PAULO,1
LUTÉCIA,DEPUTADO FEDERAL,CLEBER DELALIBERA,CLEBER DE MOURA DELALIBERA,SUPLENTE,PSC,HUMANISTA CRISTÃO ,1
LUTÉCIA,DEPUTADO FEDERAL,MARCO FELICIANO,MARCO ANTONIO FELICIANO,ELEITO,PSC,HUMANISTA CRISTÃO ,2
LUTÉCIA,DEPUTADO FEDERAL,REGIS DE OLIVEIRA,REGIS FERNANDES DE OLIVEIRA,SUPLENTE,PSC,HUMANISTA CRISTÃO ,5
LUTÉCIA,DEPUTADO FEDERAL,MANOEL GASPAR,MANOEL FERREIRA DE SOUZA GASPAR,SUPLENTE,PSC,HUMANISTA CRISTÃO ,8
LUTÉCIA,DEPUTADO FEDERAL,AGNALDO TIMOTEO,AGUINALDO TIMOTEO PEREIRA,SUPLENTE,PR,JUNTOS POR SÃO PAULO,1
LUTÉCIA,DEPUTADO FEDERAL,TIRIRICA,FRANCISCO EVERARDO OLIVEIRA SILVA,ELEITO,PR,JUNTOS POR SÃO PAULO,35
LUTÉCIA,DEPUTADO FEDERAL,PR PAULO FREIRE,PAULO ROBERTO FREIRE DA COSTA,ELEITO,PR,JUNTOS POR SÃO PAULO,8
LUTÉCIA,DEPUTADO FEDERAL,ROBERTO FREIRE,ROBERTO JOAO PEREIRA FREIRE,ELEITO,PPS,PSDB/DEM/PPS,2
LUTÉCIA,DEPUTADO FEDERAL,JOSE ONERIO,JOSE ONERIO DA SILVA,SUPLENTE,PPS,PSDB/DEM/PPS,3
LUTÉCIA,DEPUTADO FEDERAL,DR PACHECO,ANTONIO DE PADUA PACHECO,SUPLENTE,PPS,PSDB/DEM/PPS,1
LUTÉCIA,DEPUTADO FEDERAL,JORGE TADEU,JORGE TADEU MUDALEN,ELEITO,DEM,PSDB/DEM/PPS,1
LUTÉCIA,DEPUTADO FEDERAL,JORGINHO MALULY,JORGE DE FARIA MALULY,SUPLENTE,DEM,PSDB/DEM/PPS,24
LUTÉCIA,DEPUTADO FEDERAL,ZULAIÊ COBRA,ZULAIE COBRA RIBEIRO,SUPLENTE,DEM,PSDB/DEM/PPS,1
LUTÉCIA,DEPUTADO FEDERAL,MANDIC,ALEKSANDAR CARLOS MANDIC,SUPLENTE,DEM,PSDB/DEM/PPS,2
LUTÉCIA,DEPUTADO FEDERAL,DR ELEUSES PAIVA,ELEUSES VIEIRA DE PAIVA,SUPLENTE,DEM,PSDB/DEM/PPS,4
LUTÉCIA,DEPUTADO FEDERAL,WALTER IHOSHI,WALTER SHINDI IIHOSHI,SUPLENTE,DEM,PSDB/DEM/PPS,423
LUTÉCIA,DEPUTADO FEDERAL,JONAS DONIZETTE,JONAS DONIZETTE FERREIRA,ELEITO,PSB,PRESTE ATENÇÃO SÃO PAULO,1
LUTÉCIA,DEPUTADO FEDERAL,CAPITÃO AUGUSTO,JOSÉ AUGUSTO ROSA,SUPLENTE,PSB,PRESTE ATENÇÃO SÃO PAULO,36
LUTÉCIA,DEPUTADO FEDERAL,GABRIEL CHALITA,GABRIEL BENEDITO ISSAAC CHALITA,ELEITO,PSB,PRESTE ATENÇÃO SÃO PAULO,26
LUTÉCIA,DEPUTADO FEDERAL,TATI ESPONTONE,TATIANE ESPONTONE,SUPLENTE,PSB,PRESTE ATENÇÃO SÃO PAULO,1
LUTÉCIA,DEPUTADO FEDERAL,DR. ALEXANDRE,ALEXANDRE SÉRGIO DE OLIVEIRA AZOUBEL,SUPLENTE,PSB,PRESTE ATENÇÃO SÃO PAULO,4
LUTÉCIA,DEPUTADO FEDERAL,ABELARDO CAMARINHA,JOSE ABELARDO GUIMARAES CAMARINHA,MÉDIA,PSB,PRESTE ATENÇÃO SÃO PAULO,121
LUTÉCIA,DEPUTADO FEDERAL,JEFFERSON CAMPOS,JEFFERSON ALVES DE CAMPOS,ELEITO,PSB,PRESTE ATENÇÃO SÃO PAULO,53
LUTÉCIA,DEPUTADO FEDERAL,GETÚLIO DUARTE,GETÚLIO DUARTE FERREIRA,SUPLENTE,PSB,PRESTE ATENÇÃO SÃO PAULO,5
LUTÉCIA,DEPUTADO FEDERAL,NEIDE TAMEIRÃO,NEIDE APARECIDA TAMEIRÃO COSER,SUPLENTE,PSB,PRESTE ATENÇÃO SÃO PAULO,1
LUTÉCIA,DEPUTADO FEDERAL,ZICA,EUSTAQUIO LUCIANO ZICA,SUPLENTE,PV,PARTIDO VERDE,1
LUTÉCIA,DEPUTADO FEDERAL,EVANDRO GUSSI,EVANDRO HERRERA BERTONE GUSSI,SUPLENTE,PV,PARTIDO VERDE,48
LUTÉCIA,DEPUTADO FEDERAL,JOSÉ ALEXANDRE RIBEIRO,JOSE ALEXANDRE RIBEIRO,SUPLENTE,PV,PARTIDO VERDE,1
LUTÉCIA,DEPUTADO FEDERAL,RICARDO IZAR,RICARDO IZAR JUNIOR,ELEITO,PV,PARTIDO VERDE,3
LUTÉCIA,DEPUTADO FEDERAL,AMAURY CAMARGO MONICO,AMAURY CAMARGO MONACO,SUPLENTE,PV,PARTIDO VERDE,2
LUTÉCIA,DEPUTADO FEDERAL,CARLOS SAMPAIO,CARLOS HENRIQUE FOCESI SAMPAIO,ELEITO,PSDB,PSDB/DEM/PPS,1
LUTÉCIA,DEPUTADO FEDERAL,LOBBE NETO,ANTONIO ADOLPHO LOBBE NETO,SUPLENTE,PSDB,PSDB/DEM/PPS,7
LUTÉCIA,DEPUTADO FEDERAL,EMANUEL FERNANDES,EMANUEL FERNANDES,ELEITO,PSDB,PSDB/DEM/PPS,1
LUTÉCIA,DEPUTADO FEDERAL,MARA GABRILLI,MARA CRISTINA GABRILLI,ELEITO,PSDB,PSDB/DEM/PPS,1
LUTÉCIA,DEPUTADO FEDERAL,DIB,WILLIAM DIB,ELEITO,PSDB,PSDB/DEM/PPS,35
LUTÉCIA,DEPUTADO FEDERAL,SILVIO TORRES,SILVIO FRANÇA TORRES,SUPLENTE,PSDB,PSDB/DEM/PPS,1
LUTÉCIA,DEPUTADO FEDERAL,TIRSO MEIRELLES,TIRSO DE SALLES MEIRELLES,SUPLENTE,PSDB,PSDB/DEM/PPS,4
LUTÉCIA,DEPUTADO FEDERAL,EDSON APARECIDO,EDSON APARECIDO DOS SANTOS,ELEITO,PSDB,PSDB/DEM/PPS,19
LUTÉCIA,DEPUTADO FEDERAL,LUIZ FERNANDO MACHADO,LUIZ FERNANDO ARANTES MACHADO,ELEITO,PSDB,PSDB/DEM/PPS,7
LUTÉCIA,DEPUTADO FEDERAL,VAZ DE LIMA,JOSÉ CARLOS VAZ DE LIMA,ELEITO,PSDB,PSDB/DEM/PPS,2
LUTÉCIA,DEPUTADO FEDERAL,TIÃO,SEBASTIÃO FERRES ARSENE,SUPLENTE,PSDB,PSDB/DEM/PPS,1
LUTÉCIA,DEPUTADO FEDERAL,THAME,ANTONIO CARLOS DE MENDES THAME,ELEITO,PSDB,PSDB/DEM/PPS,1
LUTÉCIA,DEPUTADO FEDERAL,SIRINEU BARBOSA,JOSÉ SIRINEU FILGUEIRAS BARBOSA,SUPLENTE,PSDB,PSDB/DEM/PPS,3
LUTÉCIA,DEPUTADO FEDERAL,JAMIL PRUDENCIANO,JAMIL PAULO PRUDENCIANO,SUPLENTE,PSOL,PARTIDO SOCIALISMO E LIBERDADE,1
LUTÉCIA,DEPUTADO FEDERAL,IVAN VALENTE,IVAN VALENTE,ELEITO,PSOL,PARTIDO SOCIALISMO E LIBERDADE,1
LUTÉCIA,DEPUTADO FEDERAL,DR. ABELHA,CARLOS FERNANDO LOPES ABELHA,SUPLENTE,PC DO B,JUNTOS POR SÃO PAULO,1
LUTÉCIA,DEPUTADO FEDERAL,CÉLIO TURINO,CÉLIO ROBERTO TURINO DE MIRANDA,SUPLENTE,PC DO B,JUNTOS POR SÃO PAULO,1
LUTÉCIA,DEPUTADO FEDERAL,ALDO REBELO,JOSÉ ALDO REBELO FIGUEIREDO,ELEITO,PC DO B,JUNTOS POR SÃO PAULO,7
LUTÉCIA,DEPUTADO ESTADUAL,ZEZINHO CACHOEIRA,JOSÉ FRANCISCO DE SÁ FILHO,SUPLENTE,PRB,SOMOS MAIS SÃO PAULO,1
LUTÉCIA,DEPUTADO ESTADUAL,CURIATI,ANTONIO SALIM CURIATI,ELEITO,PP,PARTIDO PROGRESSISTA,1
LUTÉCIA,DEPUTADO ESTADUAL,VALDIR MARIN,VALDIR SILVEIRA MARIN,SUPLENTE,PP,PARTIDO PROGRESSISTA,493
LUTÉCIA,DEPUTADO ESTADUAL,LUIS YABIKU,LUIS MOKITI YABIKU,SUPLENTE,PDT,PARTIDO DEMOCRÁTICO TRABALHISTA,1
LUTÉCIA,DEPUTADO ESTADUAL,MAJOR OLIMPIO,SERGIO OLIMPIO GOMES,ELEITO,PDT,PARTIDO DEMOCRÁTICO TRABALHISTA,3
LUTÉCIA,DEPUTADO ESTADUAL,BRUZAROSCO,APARECIDO DE JESUS BRUZAROSCO,SUPLENTE,PDT,PARTIDO DEMOCRÁTICO TRABALHISTA,1
LUTÉCIA,DEPUTADO ESTADUAL,RAFAEL SILVA,RAFAEL ANTONIO DA SILVA,ELEITO,PDT,PARTIDO DEMOCRÁTICO TRABALHISTA,3
LUTÉCIA,DEPUTADO ESTADUAL,TOLOI,LUIZ CARLOS TOLOI JUNIOR,SUPLENTE,PDT,PARTIDO DEMOCRÁTICO TRABALHISTA,1
LUTÉCIA,DEPUTADO ESTADUAL,MARCO BRASIL,MARCO AURÉLIO RIBEIRO,SUPLENTE,PDT,PARTIDO DEMOCRÁTICO TRABALHISTA,236
LUTÉCIA,DEPUTADO ESTADUAL,CIDINHO,APARECIDO RODRIGUES DOS SANTOS,SUPLENTE,PDT,PARTIDO DEMOCRÁTICO TRABALHISTA,2
LUTÉCIA,DEPUTADO ESTADUAL,GALENO AMORIM,GALENO DE AMORIM JUNIOR,SUPLENTE,PT,SOMOS MAIS SÃO PAULO,1
LUTÉCIA,DEPUTADO ESTADUAL,VALMIR PRASCIDELLI,VALMIR PRASCIDELLI,SUPLENTE,PT,SOMOS MAIS SÃO PAULO,8
LUTÉCIA,DEPUTADO ESTADUAL,PORTUGUÊS,REINALDO FARTO NUNES,SUPLENTE,PT,SOMOS MAIS SÃO PAULO,16
LUTÉCIA,DEPUTADO ESTADUAL,EDINHO SILVA,EDSON ANTONIO EDINHO DA SILVA,ELEITO,PT,SOMOS MAIS SÃO PAULO,13
LUTÉCIA,DEPUTADO ESTADUAL,TONINHO DO PT,ANTONIO AMARAL JUNIOR,SUPLENTE,PT,SOMOS MAIS SÃO PAULO,21
LUTÉCIA,DEPUTADO ESTADUAL,ZICO,JOSÉ PRADO DE ANDRADE,MÉDIA,PT,SOMOS MAIS SÃO PAULO,2
LUTÉCIA,DEPUTADO ESTADUAL,MARCOS MARTINS,MARCOS LOPES MARTINS,ELEITO,PT,SOMOS MAIS SÃO PAULO,1
LUTÉCIA,DEPUTADO ESTADUAL,ADRIANO DIOGO,ADRIANO DIOGO,ELEITO,PT,SOMOS MAIS SÃO PAULO,1
LUTÉCIA,DEPUTADO ESTADUAL,RENATO DO GEB,RENATO MORENI AIRES DA SILVA,SUPLENTE,PT,SOMOS MAIS SÃO PAULO,1
LUTÉCIA,DEPUTADO ESTADUAL,DENISE ERBELLA,DENISE ELOÁ CUSTÓDIO ERBELLA DE CASTRO,SUPLENTE,PT,SOMOS MAIS SÃO PAULO,16
LUTÉCIA,DEPUTADO ESTADUAL,ROBERTO FELICIO,ROBERTO FELICIO,SUPLENTE,PT,SOMOS MAIS SÃO PAULO,1
LUTÉCIA,DEPUTADO ESTADUAL,TOFFOLI,JOSÉ TICIANO DIAS TOFFOLI,SUPLENTE,PT,SOMOS MAIS SÃO PAULO,1
LUTÉCIA,DEPUTADO ESTADUAL,CARLOS NEDER,CARLOS ALBERTO PLETZ NEDER,SUPLENTE,PT,SOMOS MAIS SÃO PAULO,5
LUTÉCIA,DEPUTADO ESTADUAL,CONTE LOPES,ROBERVAL CONTE LOPES LIMA,SUPLENTE,PTB,PARTIDO TRABALHISTA BRASILEIRO,1
LUTÉCIA,DEPUTADO ESTADUAL,CAMPOS MACHADO,ANTONIO CARLOS DE CAMPOS MACHADO,ELEITO,PTB,PARTIDO TRABALHISTA BRASILEIRO,7
LUTÉCIA,DEPUTADO ESTADUAL,WANESSA BOMFIM,WANESSA SOUSA BOMFIM,SUPLENTE,PTB,PARTIDO TRABALHISTA BRASILEIRO,1
LUTÉCIA,DEPUTADO ESTADUAL,WALDIR AGNELLO,WALDIR AGNELLO,SUPLENTE,PTB,PARTIDO TRABALHISTA BRASILEIRO,3
LUTÉCIA,DEPUTADO ESTADUAL,BALEIA ROSSI,LUIZ FELIPE BALEIA TENUTO ROSSI,ELEITO,PMDB,PARTIDO DO MOVIMENTO DEMOCRÁTICO BRASILEIRO,7
LUTÉCIA,DEPUTADO ESTADUAL,DRA ADRIANA,ADRIANA DI NARDO SILVA,SUPLENTE,PMDB,PARTIDO DO MOVIMENTO DEMOCRÁTICO BRASILEIRO,1
LUTÉCIA,DEPUTADO ESTADUAL,VANESSA DAMO,VANESSA DAMO OROSCO,ELEITO,PMDB,PARTIDO DO MOVIMENTO DEMOCRÁTICO BRASILEIRO,1
LUTÉCIA,DEPUTADO ESTADUAL,CELSO NASCIMENTO,CELSO BRAZ DO NASCIMENTO,SUPLENTE,PSC,HUMANISTA CRISTÃO ,39
LUTÉCIA,DEPUTADO ESTADUAL,JOÃO BINATO,JOÃO ANTONIO BINATO,SUPLENTE,PSC,HUMANISTA CRISTÃO ,17
LUTÉCIA,DEPUTADO ESTADUAL,RODRIGO MORAES,RODRIGO AUGUSTO MORAES,ELEITO,PSC,HUMANISTA CRISTÃO ,10
LUTÉCIA,DEPUTADO ESTADUAL,MISSIONARIA ZEZA,MARIA JOSE DA SILVA,SUPLENTE,PSC,HUMANISTA CRISTÃO ,1
LUTÉCIA,DEPUTADO ESTADUAL,ZE PEDRO,JOSE PEDRO LEITE DA SILVA,SUPLENTE,PR,SOMOS MAIS SÃO PAULO,1
LUTÉCIA,DEPUTADO ESTADUAL,EDUARDO REZEK,EDUARDO PEDROSO REZEK,SUPLENTE,PPS,PARTIDO POPULAR SOCIALISTA,38
LUTÉCIA,DEPUTADO ESTADUAL,DAVI ZAIA,DAVID ZAIA,MÉDIA,PPS,PARTIDO POPULAR SOCIALISTA,7
LUTÉCIA,DEPUTADO ESTADUAL,VITOR SAPIENZA,VITOR SAPIENZA,SUPLENTE,PPS,PARTIDO POPULAR SOCIALISTA,114
LUTÉCIA,DEPUTADO ESTADUAL,CICERO FELIX,CICERO FELIX DE SOUZA,SUPLENTE,PPS,PARTIDO POPULAR SOCIALISTA,1
LUTÉCIA,DEPUTADO ESTADUAL,PROFESSOR ZE MARIA,JOSE MARIA CANCELLIERO,SUPLENTE,PPS,PARTIDO POPULAR SOCIALISTA,3
LUTÉCIA,DEPUTADO ESTADUAL,ROBERTO MORAIS,ROBERTO TURCHI DE MORAIS,ELEITO,PPS,PARTIDO POPULAR SOCIALISTA,1
LUTÉCIA,DEPUTADO ESTADUAL,ANDRE SOARES,ANDRE BEZERRA RIBEIRO SOARES,ELEITO,DEM,PSDB/DEM,1
LUTÉCIA,DEPUTADO ESTADUAL,EDMIR CHEDID,EDMIR JOSE ABI CHEDID,ELEITO,DEM,PSDB/DEM,5
LUTÉCIA,DEPUTADO ESTADUAL,ALDO DEMARCHI,JOSE ALDO DEMARCHI,ELEITO,DEM,PSDB/DEM,3
LUTÉCIA,DEPUTADO ESTADUAL,JOAO MELLAO NETO,JOAO MELLAO NETO,SUPLENTE,DEM,PSDB/DEM,2
LUTÉCIA,DEPUTADO ESTADUAL,FERNANDO LUCAS,LUIZ FERNANDO AMARAL LUCAS,SUPLENTE,DEM,PSDB/DEM,2
LUTÉCIA,DEPUTADO ESTADUAL,IVAN TESOURINHA STRINGHI,IVAN STRINGHI,SUPLENTE,DEM,PSDB/DEM,2
LUTÉCIA,DEPUTADO ESTADUAL,ED THOMAS,EDSON TOMAZINI,ELEITO,PSB,PARTIDO SOCIALISTA BRASILEIRO,1
LUTÉCIA,DEPUTADO ESTADUAL,DR. JOSÉ RICARDO,JOSÉ RICARDO DIAS,SUPLENTE,PSB,PARTIDO SOCIALISTA BRASILEIRO,3
LUTÉCIA,DEPUTADO ESTADUAL,VINICIUS CAMARINHA,VINICIUS ALMEIDA CAMARINHA,ELEITO,PSB,PARTIDO SOCIALISTA BRASILEIRO,122
LUTÉCIA,DEPUTADO ESTADUAL,ADRIANA RODRIGUES,ADRIANA LARIO RAMALHO RODRIGUES,SUPLENTE,PV,PARTIDO VERDE,1
LUTÉCIA,DEPUTADO ESTADUAL,CAMILO GAVA,JOSÉ CAMILO GAVA NETO,SUPLENTE,PV,PARTIDO VERDE,14
LUTÉCIA,DEPUTADO ESTADUAL,ROSANGELA MELLO,ROSANGELA DE MELLO,SUPLENTE,PV,PARTIDO VERDE,1
LUTÉCIA,DEPUTADO ESTADUAL,REINALDO ALGUZ,REINALDO DE SOUZA ALGUZ,ELEITO,PV,PARTIDO VERDE,81
LUTÉCIA,DEPUTADO ESTADUAL,DENIS MARICATO,DENIS MAURILIO MARICATO,SUPLENTE,PV,PARTIDO VERDE,5
LUTÉCIA,DEPUTADO ESTADUAL,UBIRAJARA GUIMARÃES,UBIRAJARA PEREIRA GUIMARÃES,SUPLENTE,PSDB,PSDB/DEM,2
LUTÉCIA,DEPUTADO ESTADUAL,RAMALHO DA CONSTRUCAO,ANTONIO DE SOUSA RAMALHO,SUPLENTE,PSDB,PSDB/DEM,1
LUTÉCIA,DEPUTADO ESTADUAL,WELSON GASPARINI,WELSON GASPARINI,SUPLENTE,PSDB,PSDB/DEM,5
LUTÉCIA,DEPUTADO ESTADUAL,MAURO BRAGATO,MAURO BRAGATO,ELEITO,PSDB,PSDB/DEM,214
LUTÉCIA,DEPUTADO ESTADUAL,BRUNO COVAS,BRUNO COVAS LOPES,ELEITO,PSDB,PSDB/DEM,1
LUTÉCIA,DEPUTADO ESTADUAL,CORONEL JAIR PACA,JAIR PACA DE LIMA,SUPLENTE,PSDB,PSDB/DEM,1
LUTÉCIA,DEPUTADO ESTADUAL,JOSE BORANGA,JOSE AURELIO BORANGA,SUPLENTE,PSDB,PSDB/DEM,7
LUTÉCIA,DEPUTADO ESTADUAL,DILADOR BORGES,DILADOR BORGES DAMASCENO,SUPLENTE,PSDB,PSDB/DEM,3
LUTÉCIA,DEPUTADO ESTADUAL,NÉVIO DÁRTORA,NÉVIO LUIZ ARANHA DÁRTORA,SUPLENTE,PSDB,PSDB/DEM,1
LUTÉCIA,DEPUTADO ESTADUAL,BARROS MUNHOZ,JOSE ANTONIO BARROS MUNHOZ,ELEITO,PSDB,PSDB/DEM,3
LUTÉCIA,DEPUTADO ESTADUAL,PAULO ALEXANDRE BARBOSA,PAULO ALEXANDRE PEREIRA BARBOSA,ELEITO,PSDB,PSDB/DEM,2
LUTÉCIA,DEPUTADO ESTADUAL,JOSE AUGUSTO,JOSE AUGUSTO DA SILVA RAMOS,SUPLENTE,PSDB,PSDB/DEM,45
LUTÉCIA,DEPUTADO ESTADUAL,FERNANDO CAPEZ,FERNANDO CAPEZ,ELEITO,PSDB,PSDB/DEM,4
LUTÉCIA,DEPUTADO ESTADUAL,LUIZINHO DA FAVELA,LUIZ JOÃO DE SOUZA,SUPLENTE,PSOL,PARTIDO SOCIALISMO E LIBERDADE,5
LUTÉCIA,DEPUTADO ESTADUAL,WANDER,WANDER DE OLIVEIRA VILLALBA,SUPLENTE,PC DO B,PARTIDO COMUNISTA DO BRASIL,1
LUTÉCIA,DEPUTADO ESTADUAL,PROFESSOR FLAVIO DELMANTO,FLAVIO DELMANTO,SUPLENTE,PC DO B,PARTIDO COMUNISTA DO BRASIL,1
