ITAÍ,PRESIDENTE,DILMA,DILMA VANA ROUSSEFF,2º TURNO,PT,PARA O BRASIL SEGUIR MUDANDO,5477
ITAÍ,PRESIDENTE,JOSÉ SERRA,JOSÉ SERRA,2º TURNO,PSDB,O BRASIL PODE MAIS,5134
ITAÍ,GOVERNADOR,GERALDO ALCKMIN,GERALDO JOSE RODRIGUES ALCKMIN FILHO,ELEITO,PSDB,UNIDOS POR SÃO PAULO,6233
ITAÍ,SENADOR,MARTA SUPLICY,MARTA SUPLICY,ELEITO,PT,UNIÃO PARA MUDAR,4989
ITAÍ,SENADOR,ALOYSIO NUNES,ALOYSIO NUNES FERREIRA FILHO,ELEITO,PSDB,UNIDOS POR SÃO PAULO,5130
ITAÍ,DEPUTADO FEDERAL,DR. ELIEZER COSTA,ELIEZER NASCIMENTO DA COSTA,SUPLENTE,PRB,JUNTOS POR SÃO PAULO,1
ITAÍ,DEPUTADO FEDERAL,ANTONIO BULHÕES,ANTONIO CARLOS MARTINS DE BULHÕES,ELEITO,PRB,JUNTOS POR SÃO PAULO,2
ITAÍ,DEPUTADO FEDERAL,OTONIEL LIMA,OTONIEL CARLOS DE LIMA,MÉDIA,PRB,JUNTOS POR SÃO PAULO,40
ITAÍ,DEPUTADO FEDERAL,LUCAS ANTUNES,LUCAS ANTUNES,SUPLENTE,PRB,JUNTOS POR SÃO PAULO,2
ITAÍ,DEPUTADO FEDERAL,MALUF,PAULO SALIM MALUF,ELEITO,PP,PARTIDO PROGRESSISTA,193
ITAÍ,DEPUTADO FEDERAL,ANGINHO DOS TECLADOS,ANGELO MARINHO DE ALMEIDA,SUPLENTE,PP,PARTIDO PROGRESSISTA,1
ITAÍ,DEPUTADO FEDERAL,CARLOS OCTAVIANI,JOSÉ CARLOS OCTAVIANI,SUPLENTE,PP,PARTIDO PROGRESSISTA,1
ITAÍ,DEPUTADO FEDERAL,LALO,JOSÉ CARLOS TALDIVO,SUPLENTE,PP,PARTIDO PROGRESSISTA,2
ITAÍ,DEPUTADO FEDERAL,MANOEL MOREIRA,MANOEL MOREIRA DE ARAUJO FILHO,SUPLENTE,PP,PARTIDO PROGRESSISTA,5
ITAÍ,DEPUTADO FEDERAL,ADELINA ALCANTARA MACHADO,ADELINA PEREIRA DA SILVEIRA DE ALCANTARA MACHADO,SUPLENTE,PP,PARTIDO PROGRESSISTA,1
ITAÍ,DEPUTADO FEDERAL,JOÃO FADEL,JOÃO JORGE FADEL FILHO,SUPLENTE,PP,PARTIDO PROGRESSISTA,336
ITAÍ,DEPUTADO FEDERAL,ALINE CORREA,ALINE LEMOS CORREA DE OLIVEIRA ANDRADE,ELEITO,PP,PARTIDO PROGRESSISTA,43
ITAÍ,DEPUTADO FEDERAL,ELIAS BITENCOURT,ELIAS DOS SANTOS BITENCOURT,SUPLENTE,PP,PARTIDO PROGRESSISTA,6
ITAÍ,DEPUTADO FEDERAL,PAULO BASSOLI,PAULO SERGIO BONGATER BASSOLI,SUPLENTE,PP,PARTIDO PROGRESSISTA,43
ITAÍ,DEPUTADO FEDERAL,TELLES,DOMINGOS TELLES SANCHES,SUPLENTE,PP,PARTIDO PROGRESSISTA,3
ITAÍ,DEPUTADO FEDERAL,BETO MANSUR,PAULO ROBERTO GOMES MANSUR,ELEITO,PP,PARTIDO PROGRESSISTA,2
ITAÍ,DEPUTADO FEDERAL,ADHEMAR DE BARROS FILHO,ADHEMAR DE BARROS FILHO,SUPLENTE,PP,PARTIDO PROGRESSISTA,1
ITAÍ,DEPUTADO FEDERAL,CABO WILSON,WILSON DE OLIVEIRA MORAIS,SUPLENTE,PP,PARTIDO PROGRESSISTA,2
ITAÍ,DEPUTADO FEDERAL,MISSIONÁRIO JOSÉ OLIMPIO,JOSÉ OLIMPIO SILVEIRA MORAES,ELEITO,PP,PARTIDO PROGRESSISTA,58
ITAÍ,DEPUTADO FEDERAL,FERNANDO STANCATTI,FERNANDO CESAR STANCATTI MARQUES,SUPLENTE,PP,PARTIDO PROGRESSISTA,4
ITAÍ,DEPUTADO FEDERAL,TUCÃO,JULIO CESAR THEODORO,SUPLENTE,PP,PARTIDO PROGRESSISTA,87
ITAÍ,DEPUTADO FEDERAL,DR NECHAR,SERGIO ANTONIO NECHAR,SUPLENTE,PP,PARTIDO PROGRESSISTA,22
ITAÍ,DEPUTADO FEDERAL,MARCELO MARIANO,MARCELO RICARDO MARIANO,SUPLENTE,PP,PARTIDO PROGRESSISTA,1
ITAÍ,DEPUTADO FEDERAL,VADÃO,ETIVALDO VADAO GOMES,SUPLENTE,PP,PARTIDO PROGRESSISTA,5
ITAÍ,DEPUTADO FEDERAL,PH,PAULO HENRIQUE RIBEIRO SANTANA,SUPLENTE,PDT,PARTIDO DEMOCRÁTICO TRABALHISTA,1
ITAÍ,DEPUTADO FEDERAL,ERLON CHAVES,ERLON CHAVES DE CASTRO,SUPLENTE,PDT,PARTIDO DEMOCRÁTICO TRABALHISTA,3
ITAÍ,DEPUTADO FEDERAL,PAULINHO DA FORÇA,PAULO PEREIRA DA SILVA,ELEITO,PDT,PARTIDO DEMOCRÁTICO TRABALHISTA,189
ITAÍ,DEPUTADO FEDERAL,ARMANDO HENRIQUE,ARMANDO HENRIQUE,SUPLENTE,PDT,PARTIDO DEMOCRÁTICO TRABALHISTA,1
ITAÍ,DEPUTADO FEDERAL,MARTAN,MARCELO MARTIN,SUPLENTE,PDT,PARTIDO DEMOCRÁTICO TRABALHISTA,1
ITAÍ,DEPUTADO FEDERAL,KAREN HEINS,KAREN MAYELLEN TONIM HEINS,SUPLENTE,PDT,PARTIDO DEMOCRÁTICO TRABALHISTA,2
ITAÍ,DEPUTADO FEDERAL,PEDRO BAPTISTINI,PEDRO ANTONIO BAPTISTINI,SUPLENTE,PDT,PARTIDO DEMOCRÁTICO TRABALHISTA,1
ITAÍ,DEPUTADO FEDERAL,SAULO GOES,SAULO GOES DE ALBUQUERQUE,SUPLENTE,PDT,PARTIDO DEMOCRÁTICO TRABALHISTA,6
ITAÍ,DEPUTADO FEDERAL,MEDEIROS,LUIZ ANTONIO DE MEDEIROS NETO,SUPLENTE,PDT,PARTIDO DEMOCRÁTICO TRABALHISTA,8
ITAÍ,DEPUTADO FEDERAL,EDUARDO NASCIMENTO,EDUARDO DUARTE DO NASCIMENTO,SUPLENTE,PDT,PARTIDO DEMOCRÁTICO TRABALHISTA,1
ITAÍ,DEPUTADO FEDERAL,DR LUIZ CHIAPARINE,LUIZ CARLOS CHIAPARINE,SUPLENTE,PDT,PARTIDO DEMOCRÁTICO TRABALHISTA,11
ITAÍ,DEPUTADO FEDERAL,NELSINHO DA BAHIA,NELSON FRANCISCO DOS SANTOS,SUPLENTE,PDT,PARTIDO DEMOCRÁTICO TRABALHISTA,2
ITAÍ,DEPUTADO FEDERAL,MANOEL ANTUNES,MANOEL ANTUNES,SUPLENTE,PDT,PARTIDO DEMOCRÁTICO TRABALHISTA,2
ITAÍ,DEPUTADO FEDERAL,SALVADOR ZIMBALDI,SALVADOR ZIMBALDI FILHO,MÉDIA,PDT,PARTIDO DEMOCRÁTICO TRABALHISTA,87
ITAÍ,DEPUTADO FEDERAL,LINDOLFO DOS SANTOS,LINDOLFO LUIZ DOS SANTOS NETO,SUPLENTE,PDT,PARTIDO DEMOCRÁTICO TRABALHISTA,2
ITAÍ,DEPUTADO FEDERAL,ITAMAR ALVES,ITAMAR ALVES DE OLIVEIRA,SUPLENTE,PDT,PARTIDO DEMOCRÁTICO TRABALHISTA,1
ITAÍ,DEPUTADO FEDERAL,WILSON COELHO,WILSON DE SOUZA COELHO,SUPLENTE,PDT,PARTIDO DEMOCRÁTICO TRABALHISTA,3
ITAÍ,DEPUTADO FEDERAL,JOSUE TOPA TUDO,JOSUÉ MOREIRA,SUPLENTE,PDT,PARTIDO DEMOCRÁTICO TRABALHISTA,2
ITAÍ,DEPUTADO FEDERAL,IVANIO BATISTA,IVANIO BATISTA DA SILVA,SUPLENTE,PT,JUNTOS POR SÃO PAULO,2
ITAÍ,DEPUTADO FEDERAL,IARA BERNARDI,IARA BERNARDI,SUPLENTE,PT,JUNTOS POR SÃO PAULO,6
ITAÍ,DEPUTADO FEDERAL,LARGUESA,LUIS VANDERLEI LARGUESA,SUPLENTE,PT,JUNTOS POR SÃO PAULO,3
ITAÍ,DEPUTADO FEDERAL,VACCAREZZA,CANDIDO ELPIDIO DE SOUZA VACCAREZZA,ELEITO,PT,JUNTOS POR SÃO PAULO,29
ITAÍ,DEPUTADO FEDERAL,GENOINO,JOSÉ GENOÍNO NETO,SUPLENTE,PT,JUNTOS POR SÃO PAULO,13
ITAÍ,DEPUTADO FEDERAL,HELCIO SILVA,HELCIO ANTONIO DA SILVA,SUPLENTE,PT,JUNTOS POR SÃO PAULO,5
ITAÍ,DEPUTADO FEDERAL,NEWTON LIMA NETO,NEWTON LIMA NETO,ELEITO,PT,JUNTOS POR SÃO PAULO,4
ITAÍ,DEPUTADO FEDERAL,FILIPPI,JOSÉ DE FILIPPI JÚNIOR,ELEITO,PT,JUNTOS POR SÃO PAULO,1
ITAÍ,DEPUTADO FEDERAL,ARLINDO CHINAGLIA,ARLINDO CHIGNALIA JUNIOR,ELEITO,PT,JUNTOS POR SÃO PAULO,27
ITAÍ,DEPUTADO FEDERAL,JOÃO PAULO CUNHA,JOÃO PAULO CUNHA,ELEITO,PT,JUNTOS POR SÃO PAULO,5
ITAÍ,DEPUTADO FEDERAL,PIVATTO,JOSÉ PIVATTO,SUPLENTE,PT,JUNTOS POR SÃO PAULO,1
ITAÍ,DEPUTADO FEDERAL,RICARDO BERZOINI,RICARDO JOSE RIBEIRO BERZOINI,ELEITO,PT,JUNTOS POR SÃO PAULO,183
ITAÍ,DEPUTADO FEDERAL,JOSÉ MENTOR,JOSÉ MENTOR GUILHERME DE MELLO NETTO,ELEITO,PT,JUNTOS POR SÃO PAULO,1
ITAÍ,DEPUTADO FEDERAL,PROF. CARLÃO RAMIRO,CARLOS RAMIRO CASTRO,SUPLENTE,PT,JUNTOS POR SÃO PAULO,14
ITAÍ,DEPUTADO FEDERAL,FÉLIX SAHÃO,FÉLIX SAHÃO JÚNIOR,SUPLENTE,PT,JUNTOS POR SÃO PAULO,9
ITAÍ,DEPUTADO FEDERAL,TENENTE PAZ,FRANCISCO JESUS DA PAZ,SUPLENTE,PT,JUNTOS POR SÃO PAULO,1
ITAÍ,DEPUTADO FEDERAL,VANDERLEI SIRAQUE,VANDERLEI SIRAQUE,SUPLENTE,PT,JUNTOS POR SÃO PAULO,2
ITAÍ,DEPUTADO FEDERAL,LUIZ CARLOS GOMES,LUIZ CARLOS GOMES,SUPLENTE,PT,JUNTOS POR SÃO PAULO,1
ITAÍ,DEPUTADO FEDERAL,JILMAR TATTO,JILMAR AUGUSTINHO TATTO,ELEITO,PT,JUNTOS POR SÃO PAULO,3
ITAÍ,DEPUTADO FEDERAL,DURVAL ORLATO,DURVAL LOPES ORLATO,SUPLENTE,PT,JUNTOS POR SÃO PAULO,1
ITAÍ,DEPUTADO FEDERAL,EDSON DA PAZ (O CANTOR),EDSON DA PAZ,SUPLENTE,PT,JUNTOS POR SÃO PAULO,1
ITAÍ,DEPUTADO FEDERAL,JANIO RIBEIRO,JANIO RIBEIRO,SUPLENTE,PT,JUNTOS POR SÃO PAULO,1
ITAÍ,DEPUTADO FEDERAL,RUBINHO BASTOS,RUBENS BASTOS DO NASCIMENTO,SUPLENTE,PT,JUNTOS POR SÃO PAULO,4
ITAÍ,DEPUTADO FEDERAL,ARCELINO ARAUJO,ARCELINO ARAUJO RIBEIRO,SUPLENTE,PT,JUNTOS POR SÃO PAULO,1
ITAÍ,DEPUTADO FEDERAL,DEVANIR RIBEIRO,DEVANIR RIBEIRO,ELEITO,PT,JUNTOS POR SÃO PAULO,280
ITAÍ,DEPUTADO FEDERAL,MARIA LUCIA PRANDI,MARIA LUCIA PRANDI GOMES,SUPLENTE,PT,JUNTOS POR SÃO PAULO,2
ITAÍ,DEPUTADO FEDERAL,ANGELO BARRETO,ANGELO RAFAEL BARRETO,SUPLENTE,PT,JUNTOS POR SÃO PAULO,1
ITAÍ,DEPUTADO FEDERAL,VICENTINHO,VICENTE PAULO DA SILVA,ELEITO,PT,JUNTOS POR SÃO PAULO,3
ITAÍ,DEPUTADO FEDERAL,PAULO TEIXEIRA,LUIZ PAULO TEIXEIRA FERREIRA,ELEITO,PT,JUNTOS POR SÃO PAULO,903
ITAÍ,DEPUTADO FEDERAL,CLAURY,CLAURY SANTOS ALVES DA SILVA,SUPLENTE,PTB,PARTIDO TRABALHISTA BRASILEIRO,12
ITAÍ,DEPUTADO FEDERAL,VAMPETA,MARCOS ANDRE BATISTA SANTOS,SUPLENTE,PTB,PARTIDO TRABALHISTA BRASILEIRO,1
ITAÍ,DEPUTADO FEDERAL,WANDA CORRÊA,VANDERLEIA APARECIDA CORREA,SUPLENTE,PTB,PARTIDO TRABALHISTA BRASILEIRO,82
ITAÍ,DEPUTADO FEDERAL,SANTANA,JOSE SANTANA DE ABREU,SUPLENTE,PTB,PARTIDO TRABALHISTA BRASILEIRO,1
ITAÍ,DEPUTADO FEDERAL,ESTER,ESTER DA SILVA,SUPLENTE,PTB,PARTIDO TRABALHISTA BRASILEIRO,1
ITAÍ,DEPUTADO FEDERAL,ROBSON TUMA,ROBSON TUMA,SUPLENTE,PTB,PARTIDO TRABALHISTA BRASILEIRO,16
ITAÍ,DEPUTADO FEDERAL,DR SILNEY BERALDO,SILNEY MARCOS BERALDO,SUPLENTE,PTB,PARTIDO TRABALHISTA BRASILEIRO,1
ITAÍ,DEPUTADO FEDERAL,VITOR DO SUPER JOSÉ,VITOR FRANCISCO DA SILVA,SUPLENTE,PTB,PARTIDO TRABALHISTA BRASILEIRO,1
ITAÍ,DEPUTADO FEDERAL,NELSON MARQUEZELLI,NELSON MARQUEZELLI,ELEITO,PTB,PARTIDO TRABALHISTA BRASILEIRO,11
ITAÍ,DEPUTADO FEDERAL,WALDOMIRO RAMOS,WALDOMIRO CARLOS RAMOS,SUPLENTE,PTB,PARTIDO TRABALHISTA BRASILEIRO,4
ITAÍ,DEPUTADO FEDERAL,DR MOYSES,JOAO MOYSES ABUJADI,SUPLENTE,PTB,PARTIDO TRABALHISTA BRASILEIRO,1
ITAÍ,DEPUTADO FEDERAL,SONIA CRISTIANO,SONIA REGINA CRISTIANO,SUPLENTE,PTB,PARTIDO TRABALHISTA BRASILEIRO,1
ITAÍ,DEPUTADO FEDERAL,ARNALDO FARIA DE SÁ,ARNALDO FARIA DE SÁ,ELEITO,PTB,PARTIDO TRABALHISTA BRASILEIRO,33
ITAÍ,DEPUTADO FEDERAL,FRANK AGUIAR,FRANCINETO LUZ DE AGUIAR,SUPLENTE,PTB,PARTIDO TRABALHISTA BRASILEIRO,1
ITAÍ,DEPUTADO FEDERAL,TENENTE SÉRGIO,LUIZ SERGIO DE SOUZA,SUPLENTE,PTB,PARTIDO TRABALHISTA BRASILEIRO,1
ITAÍ,DEPUTADO FEDERAL,PAULO LIMA,PAULO CESAR DE OLIVEIRA LIMA,SUPLENTE,PMDB,PARTIDO DO MOVIMENTO DEMOCRÁTICO BRASILEIRO,4
ITAÍ,DEPUTADO FEDERAL,NENÊ MONTANHER,ALCIDES MONTANHER FILHO,SUPLENTE,PMDB,PARTIDO DO MOVIMENTO DEMOCRÁTICO BRASILEIRO,3
ITAÍ,DEPUTADO FEDERAL,BONFÁ,ALVARO BONFA JUNIOR,SUPLENTE,PMDB,PARTIDO DO MOVIMENTO DEMOCRÁTICO BRASILEIRO,1
ITAÍ,DEPUTADO FEDERAL,TONY JUPSSON,TONY JUPSSON SANTOS,SUPLENTE,PMDB,PARTIDO DO MOVIMENTO DEMOCRÁTICO BRASILEIRO,1
ITAÍ,DEPUTADO FEDERAL,EDUARDO COELHO,EDUARDO JOSÉ PEREIRA COELHO,SUPLENTE,PMDB,PARTIDO DO MOVIMENTO DEMOCRÁTICO BRASILEIRO,6
ITAÍ,DEPUTADO FEDERAL,PILTON RIOS,PILTON RIOS DE BARROS FELIX PEREIRA,SUPLENTE,PMDB,PARTIDO DO MOVIMENTO DEMOCRÁTICO BRASILEIRO,1
ITAÍ,DEPUTADO FEDERAL,SINIVAL,SINIVAL JOSE INACIO,SUPLENTE,PMDB,PARTIDO DO MOVIMENTO DEMOCRÁTICO BRASILEIRO,1
ITAÍ,DEPUTADO FEDERAL,EDINHO ARAUJO,EDSON EDINHO COELHO ARAUJO,ELEITO,PMDB,PARTIDO DO MOVIMENTO DEMOCRÁTICO BRASILEIRO,2
ITAÍ,DEPUTADO FEDERAL,DR. JAIR,JAIR CESAR DAMATO,SUPLENTE,PMDB,PARTIDO DO MOVIMENTO DEMOCRÁTICO BRASILEIRO,6
ITAÍ,DEPUTADO FEDERAL,RINALDO,RINALDO ALVES PEREIRA,SUPLENTE,PMDB,PARTIDO DO MOVIMENTO DEMOCRÁTICO BRASILEIRO,1
ITAÍ,DEPUTADO FEDERAL,GERALDÃO,GERALDO TOMAZ AUGUSTO,SUPLENTE,PMDB,PARTIDO DO MOVIMENTO DEMOCRÁTICO BRASILEIRO,3
ITAÍ,DEPUTADO FEDERAL,RICARDO HOLZ,RICARDO HOLZ VIDAL DOS SANTOS,SUPLENTE,PMDB,PARTIDO DO MOVIMENTO DEMOCRÁTICO BRASILEIRO,4
ITAÍ,DEPUTADO FEDERAL,VALÉRIA,VALÉRIA BENTO,SUPLENTE,PMDB,PARTIDO DO MOVIMENTO DEMOCRÁTICO BRASILEIRO,1
ITAÍ,DEPUTADO FEDERAL,TATIANA QUEIROZ,MARIA TATIANA QUEIROZ,SUPLENTE,PSL,PRESTE ATENÇÃO SÃO PAULO,10
ITAÍ,DEPUTADO FEDERAL,ROBERTO SIQUEIRA,ROBERTO SIQUEIRA GOMES,SUPLENTE,PSL,PRESTE ATENÇÃO SÃO PAULO,2
ITAÍ,DEPUTADO FEDERAL,CORONEL GILSON LOPES,GILSON LOPES DA SILVA,SUPLENTE,PSC,HUMANISTA CRISTÃO ,2
ITAÍ,DEPUTADO FEDERAL,MARCO FELICIANO,MARCO ANTONIO FELICIANO,ELEITO,PSC,HUMANISTA CRISTÃO ,43
ITAÍ,DEPUTADO FEDERAL,MARCELO AGUIAR,MARCELO THEODORO DE AGUIAR,ELEITO,PSC,HUMANISTA CRISTÃO ,5
ITAÍ,DEPUTADO FEDERAL,CHICO NETO,FRANCISCO DA COSTA NETO,SUPLENTE,PSC,HUMANISTA CRISTÃO ,2
ITAÍ,DEPUTADO FEDERAL,REGIS DE OLIVEIRA,REGIS FERNANDES DE OLIVEIRA,SUPLENTE,PSC,HUMANISTA CRISTÃO ,44
ITAÍ,DEPUTADO FEDERAL,DR.CARLOS FARIA,CARLOS EDUARDO DA SILVA FARIA,SUPLENTE,PSC,HUMANISTA CRISTÃO ,2
ITAÍ,DEPUTADO FEDERAL,DALVAN,JOÃO GOMES DE ALMEIDA,SUPLENTE,PSC,HUMANISTA CRISTÃO ,1
ITAÍ,DEPUTADO FEDERAL,MARCOS CUNHA,MARCOS DE ALMEIDA CUNHA,SUPLENTE,PSC,HUMANISTA CRISTÃO ,1
ITAÍ,DEPUTADO FEDERAL,MIRO FERNANDES,ALDOMIRO FERNANDES,SUPLENTE,PSC,HUMANISTA CRISTÃO ,1
ITAÍ,DEPUTADO FEDERAL,LEO,LEONARDO LEANDRO FRANÇA DE OLIVEIRA,SUPLENTE,PSC,HUMANISTA CRISTÃO ,2
ITAÍ,DEPUTADO FEDERAL,PRICILA LEME,PRICILA HELENA MOYSES LEME,SUPLENTE,PSC,HUMANISTA CRISTÃO ,1
ITAÍ,DEPUTADO FEDERAL,TONINHO CORREDOR,ANTONIO CICERO DA SILVA,SUPLENTE,PSC,HUMANISTA CRISTÃO ,6
ITAÍ,DEPUTADO FEDERAL,MANOEL GASPAR,MANOEL FERREIRA DE SOUZA GASPAR,SUPLENTE,PSC,HUMANISTA CRISTÃO ,6
ITAÍ,DEPUTADO FEDERAL,JUCA CHAVES,JURANDYR CZACZKES CHAVES,SUPLENTE,PR,JUNTOS POR SÃO PAULO,3
ITAÍ,DEPUTADO FEDERAL,AGNALDO TIMOTEO,AGUINALDO TIMOTEO PEREIRA,SUPLENTE,PR,JUNTOS POR SÃO PAULO,1
ITAÍ,DEPUTADO FEDERAL,TIRIRICA,FRANCISCO EVERARDO OLIVEIRA SILVA,ELEITO,PR,JUNTOS POR SÃO PAULO,642
ITAÍ,DEPUTADO FEDERAL,PR PAULO FREIRE,PAULO ROBERTO FREIRE DA COSTA,ELEITO,PR,JUNTOS POR SÃO PAULO,151
ITAÍ,DEPUTADO FEDERAL,LUCIANA COSTA,LUCIANA DE ALMEIDA COSTA,SUPLENTE,PR,JUNTOS POR SÃO PAULO,5
ITAÍ,DEPUTADO FEDERAL,MILTON MONTI,MILTON ANTONIO CASQUEL MONTI,ELEITO,PR,JUNTOS POR SÃO PAULO,2562
ITAÍ,DEPUTADO FEDERAL,VALDEMAR COSTA NETO,VALDEMAR COSTA NETO,ELEITO,PR,JUNTOS POR SÃO PAULO,47
ITAÍ,DEPUTADO FEDERAL,ROBERTO FREIRE,ROBERTO JOAO PEREIRA FREIRE,ELEITO,PPS,PSDB/DEM/PPS,21
ITAÍ,DEPUTADO FEDERAL,CORONEL EDSON SARDANO,EDSON DE JESUS SARDANO,SUPLENTE,PPS,PSDB/DEM/PPS,1
ITAÍ,DEPUTADO FEDERAL,ARI FRIEDENBACH,ARI FRIEDENBACH,SUPLENTE,PPS,PSDB/DEM/PPS,7
ITAÍ,DEPUTADO FEDERAL,JOSE ONERIO,JOSE ONERIO DA SILVA,SUPLENTE,PPS,PSDB/DEM/PPS,7
ITAÍ,DEPUTADO FEDERAL,ARNALDO JARDIM,ARNALDO CALIL PEREIRA JARDIM,ELEITO,PPS,PSDB/DEM/PPS,4
ITAÍ,DEPUTADO FEDERAL,ANTENOR TOKO,ANTENOR DOS SANTOS TOKO,SUPLENTE,PPS,PSDB/DEM/PPS,1
ITAÍ,DEPUTADO FEDERAL,JORGE TADEU,JORGE TADEU MUDALEN,ELEITO,DEM,PSDB/DEM/PPS,5
ITAÍ,DEPUTADO FEDERAL,RENATO GALENDI,RENATO APARECIDO GALENDI,SUPLENTE,DEM,PSDB/DEM/PPS,1
ITAÍ,DEPUTADO FEDERAL,JORGINHO MALULY,JORGE DE FARIA MALULY,SUPLENTE,DEM,PSDB/DEM/PPS,74
ITAÍ,DEPUTADO FEDERAL,ALEXANDRE LEITE,ALEXANDRE LEITE DA SILVA,MÉDIA,DEM,PSDB/DEM/PPS,2
ITAÍ,DEPUTADO FEDERAL,PROFESSOR BENJAMIN,BENJAMIN RIBEIRO DA SILVA,SUPLENTE,DEM,PSDB/DEM/PPS,22
ITAÍ,DEPUTADO FEDERAL,KIKO DO KLB,FRANCO FINATO SCORNAVACCA,SUPLENTE,DEM,PSDB/DEM/PPS,24
ITAÍ,DEPUTADO FEDERAL,CRESPO,JOSE ANTONIO CALDINI CRESPO,SUPLENTE,DEM,PSDB/DEM/PPS,11
ITAÍ,DEPUTADO FEDERAL,RODRIGO GARCIA,RODRIGO GARCIA,ELEITO,DEM,PSDB/DEM/PPS,123
ITAÍ,DEPUTADO FEDERAL,ZULAIÊ COBRA,ZULAIE COBRA RIBEIRO,SUPLENTE,DEM,PSDB/DEM/PPS,3
ITAÍ,DEPUTADO FEDERAL,RAUL GIL JR,RAUL GIL JUNIOR,SUPLENTE,DEM,PSDB/DEM/PPS,4
ITAÍ,DEPUTADO FEDERAL,JUNJI ABE,JUNJI ABE,ELEITO,DEM,PSDB/DEM/PPS,2
ITAÍ,DEPUTADO FEDERAL,SALIM REIS,ANTONIO CARLOS DOS REIS,SUPLENTE,DEM,PSDB/DEM/PPS,1
ITAÍ,DEPUTADO FEDERAL,MANDIC,ALEKSANDAR CARLOS MANDIC,SUPLENTE,DEM,PSDB/DEM/PPS,13
ITAÍ,DEPUTADO FEDERAL,HIRAM JR,HIRAM AYRES MONTEIRO JUNIOR,SUPLENTE,DEM,PSDB/DEM/PPS,4
ITAÍ,DEPUTADO FEDERAL,ELI CORREA FILHO,ADRIANO ELI CORREA,ELEITO,DEM,PSDB/DEM/PPS,6
ITAÍ,DEPUTADO FEDERAL,DR ELEUSES PAIVA,ELEUSES VIEIRA DE PAIVA,SUPLENTE,DEM,PSDB/DEM/PPS,2
ITAÍ,DEPUTADO FEDERAL,WALTER IHOSHI,WALTER SHINDI IIHOSHI,SUPLENTE,DEM,PSDB/DEM/PPS,1
ITAÍ,DEPUTADO FEDERAL,CACIQUE DARÃ,ANTONISIO LULU,SUPLENTE,PHS,HUMANISTA CRISTÃO ,1
ITAÍ,DEPUTADO FEDERAL,JONAS DONIZETTE,JONAS DONIZETTE FERREIRA,ELEITO,PSB,PRESTE ATENÇÃO SÃO PAULO,1
ITAÍ,DEPUTADO FEDERAL,MARCELINHO CARIOCA,MARCELO PEREIRA SURCIN,SUPLENTE,PSB,PRESTE ATENÇÃO SÃO PAULO,42
ITAÍ,DEPUTADO FEDERAL,SARGENTO FERNANDO,FERNANDO ALCÂNTARA DE FIGUEIREDO,SUPLENTE,PSB,PRESTE ATENÇÃO SÃO PAULO,2
ITAÍ,DEPUTADO FEDERAL,IRMÃO JOÃO NOGUEIRA,JOÃO NOGUEIRA DE LIMA,SUPLENTE,PSB,PRESTE ATENÇÃO SÃO PAULO,2
ITAÍ,DEPUTADO FEDERAL,CAPITÃO AUGUSTO,JOSÉ AUGUSTO ROSA,SUPLENTE,PSB,PRESTE ATENÇÃO SÃO PAULO,35
ITAÍ,DEPUTADO FEDERAL,LUIZA ERUNDINA,LUIZA ERUNDINA DE SOUSA,ELEITO,PSB,PRESTE ATENÇÃO SÃO PAULO,4
ITAÍ,DEPUTADO FEDERAL,GABRIEL CHALITA,GABRIEL BENEDITO ISSAAC CHALITA,ELEITO,PSB,PRESTE ATENÇÃO SÃO PAULO,258
ITAÍ,DEPUTADO FEDERAL,MÁRCIO FRANÇA,MÁRCIO LUIZ FRANÇA GOMES,ELEITO,PSB,PRESTE ATENÇÃO SÃO PAULO,7
ITAÍ,DEPUTADO FEDERAL,ENGENHEIRO CLÁUDIO,CLÁUDIO DA SILVEIRA FARIA,SUPLENTE,PSB,PRESTE ATENÇÃO SÃO PAULO,2
ITAÍ,DEPUTADO FEDERAL,DR. ALEXANDRE,ALEXANDRE SÉRGIO DE OLIVEIRA AZOUBEL,SUPLENTE,PSB,PRESTE ATENÇÃO SÃO PAULO,28
ITAÍ,DEPUTADO FEDERAL,JOSÉ LEAL,JOSÉ MARTINS LEAL,SUPLENTE,PSB,PRESTE ATENÇÃO SÃO PAULO,1
ITAÍ,DEPUTADO FEDERAL,TONINHO GARMS,ANTONIO CARLOS GARMS,SUPLENTE,PSB,PRESTE ATENÇÃO SÃO PAULO,3
ITAÍ,DEPUTADO FEDERAL,VANDIR MOGNON,VANDIR MOGNON,SUPLENTE,PSB,PRESTE ATENÇÃO SÃO PAULO,1
ITAÍ,DEPUTADO FEDERAL,ABELARDO CAMARINHA,JOSE ABELARDO GUIMARAES CAMARINHA,MÉDIA,PSB,PRESTE ATENÇÃO SÃO PAULO,1
ITAÍ,DEPUTADO FEDERAL,JEFFERSON CAMPOS,JEFFERSON ALVES DE CAMPOS,ELEITO,PSB,PRESTE ATENÇÃO SÃO PAULO,19
ITAÍ,DEPUTADO FEDERAL,DR. UBIALI,MARCO AURÉLIO UBIALI,SUPLENTE,PSB,PRESTE ATENÇÃO SÃO PAULO,5
ITAÍ,DEPUTADO FEDERAL,OTA,IOLANDA KEIKO MIASHIRO OTA,ELEITO,PSB,PRESTE ATENÇÃO SÃO PAULO,11
ITAÍ,DEPUTADO FEDERAL,GUILHERME MUSSI,GUILHERME MUSSI FERREIRA,ELEITO,PV,PARTIDO VERDE,218
ITAÍ,DEPUTADO FEDERAL,DR TALMIR,TALMIR RODRIGUES,SUPLENTE,PV,PARTIDO VERDE,2
ITAÍ,DEPUTADO FEDERAL,EDNA MARTINS,EDNA SANDRA MARTINS,SUPLENTE,PV,PARTIDO VERDE,1
ITAÍ,DEPUTADO FEDERAL,JULIO CASTILHO,JULIO CESAR CASTILHO,SUPLENTE,PV,PARTIDO VERDE,1
ITAÍ,DEPUTADO FEDERAL,ROBERTO SANTIAGO,JOSE ROBERTO SANTIAGO GOMES,ELEITO,PV,PARTIDO VERDE,11
ITAÍ,DEPUTADO FEDERAL,CESAR CORTEZ,ANTONIO CESAR CORTEZ,SUPLENTE,PV,PARTIDO VERDE,22
ITAÍ,DEPUTADO FEDERAL,CHICO SANTA RITA,FRANCISCO JOSE DE SANTA RITA BEHR,SUPLENTE,PV,PARTIDO VERDE,1
ITAÍ,DEPUTADO FEDERAL,PEDRO MANHÃES,PEDRO MANHÃES DE OLIVEIRA,SUPLENTE,PV,PARTIDO VERDE,1
ITAÍ,DEPUTADO FEDERAL,ENG PAULINHO,PAULO HENRIQUE DO NASCIMENTO,SUPLENTE,PV,PARTIDO VERDE,1
ITAÍ,DEPUTADO FEDERAL,ANA PAULA JUNQUEIRA,ANA PAULA GUIMARAES DE AZEVEDO JUNQUEIRA,SUPLENTE,PV,PARTIDO VERDE,1
ITAÍ,DEPUTADO FEDERAL,MARINO BONACCHI,MARINO MARTINI BONACCHI,SUPLENTE,PV,PARTIDO VERDE,1
ITAÍ,DEPUTADO FEDERAL,EVANDRO GUSSI,EVANDRO HERRERA BERTONE GUSSI,SUPLENTE,PV,PARTIDO VERDE,49
ITAÍ,DEPUTADO FEDERAL,TOFFANO,JOSE PAULO TOFFANO,SUPLENTE,PV,PARTIDO VERDE,3
ITAÍ,DEPUTADO FEDERAL,ALE YOUSSEF,ALEXANDRE DE ALMEIDA YOUSSEF,SUPLENTE,PV,PARTIDO VERDE,10
ITAÍ,DEPUTADO FEDERAL,PENNA,JOSÉ LUIZ DE FRANÇA PENNA,ELEITO,PV,PARTIDO VERDE,6
ITAÍ,DEPUTADO FEDERAL,ROBERTO DE LUCENA,ROBERTO ALVES DE LUCENA,ELEITO,PV,PARTIDO VERDE,12
ITAÍ,DEPUTADO FEDERAL,ALTAIR DA ASSOCIACAO,ALTAIR BARBOSA GOUVEIA,SUPLENTE,PV,PARTIDO VERDE,1
ITAÍ,DEPUTADO FEDERAL,DONIZETI PEREIRA,APARECIDO DONIZETI PEREIRA,SUPLENTE,PV,PARTIDO VERDE,1
ITAÍ,DEPUTADO FEDERAL,RICARDO IZAR,RICARDO IZAR JUNIOR,ELEITO,PV,PARTIDO VERDE,2
ITAÍ,DEPUTADO FEDERAL,LAERTE MOLLETA,LAERTE AMERICO MOLLETA,SUPLENTE,PV,PARTIDO VERDE,1
ITAÍ,DEPUTADO FEDERAL,CARLOS SAMPAIO,CARLOS HENRIQUE FOCESI SAMPAIO,ELEITO,PSDB,PSDB/DEM/PPS,7
ITAÍ,DEPUTADO FEDERAL,POPPI,JOÃO HENRIQUE GONÇALVES MARCICANO POPPI,SUPLENTE,PSDB,PSDB/DEM/PPS,3
ITAÍ,DEPUTADO FEDERAL,STANGARLINI,JOSE CARLOS STANGARLINI,SUPLENTE,PSDB,PSDB/DEM/PPS,50
ITAÍ,DEPUTADO FEDERAL,RAUL CHRISTIANO,RAUL CHRISTIANO DE OLIVEIRA SANCHEZ,SUPLENTE,PSDB,PSDB/DEM/PPS,5
ITAÍ,DEPUTADO FEDERAL,LOBBE NETO,ANTONIO ADOLPHO LOBBE NETO,SUPLENTE,PSDB,PSDB/DEM/PPS,5
ITAÍ,DEPUTADO FEDERAL,FELICIDADE,FELICIDADE LOPES PONTES,SUPLENTE,PSDB,PSDB/DEM/PPS,1
ITAÍ,DEPUTADO FEDERAL,MANOEL MARCOS (MANÉ),MANOEL MARCOS DE JESUS FERREIRA,SUPLENTE,PSDB,PSDB/DEM/PPS,12
ITAÍ,DEPUTADO FEDERAL,EMANUEL FERNANDES,EMANUEL FERNANDES,ELEITO,PSDB,PSDB/DEM/PPS,4
ITAÍ,DEPUTADO FEDERAL,MARA GABRILLI,MARA CRISTINA GABRILLI,ELEITO,PSDB,PSDB/DEM/PPS,13
ITAÍ,DEPUTADO FEDERAL,MARCOS ARAUJO,MARCOS ROSA DE ARAUJO,SUPLENTE,PSDB,PSDB/DEM/PPS,5
ITAÍ,DEPUTADO FEDERAL,CARLOS BRAGA,CARLOS EDUARDO FARACO BRAGA,SUPLENTE,PSDB,PSDB/DEM/PPS,5
ITAÍ,DEPUTADO FEDERAL,LELIS DA ROCHA,LELIS DA ROCHA,SUPLENTE,PSDB,PSDB/DEM/PPS,3
ITAÍ,DEPUTADO FEDERAL,DIB,WILLIAM DIB,ELEITO,PSDB,PSDB/DEM/PPS,15
ITAÍ,DEPUTADO FEDERAL,PANNUNZIO,ANTONIO CARLOS PANNUNZIO,SUPLENTE,PSDB,PSDB/DEM/PPS,1014
ITAÍ,DEPUTADO FEDERAL,LUCIA SANTUCCI,LUCIA MARIA SANTUCCI,SUPLENTE,PSDB,PSDB/DEM/PPS,3
ITAÍ,DEPUTADO FEDERAL,RENATO AMARY,RENATO FAUVEL AMARY,SUPLENTE,PSDB,PSDB/DEM/PPS,70
ITAÍ,DEPUTADO FEDERAL,TIRSO MEIRELLES,TIRSO DE SALLES MEIRELLES,SUPLENTE,PSDB,PSDB/DEM/PPS,55
ITAÍ,DEPUTADO FEDERAL,EDSON APARECIDO,EDSON APARECIDO DOS SANTOS,ELEITO,PSDB,PSDB/DEM/PPS,21
ITAÍ,DEPUTADO FEDERAL,RICARDO MONTORO,JOSE RICARDO FRANCO MONTORO,SUPLENTE,PSDB,PSDB/DEM/PPS,8
ITAÍ,DEPUTADO FEDERAL,VANDERLEI MACRIS,VANDERLEI MACRIS,SUPLENTE,PSDB,PSDB/DEM/PPS,8
ITAÍ,DEPUTADO FEDERAL,DUARTE NOGUEIRA,ANTONIO DUARTE NOGUEIRA JUNIOR,ELEITO,PSDB,PSDB/DEM/PPS,70
ITAÍ,DEPUTADO FEDERAL,JULIO SEMEGHINI,JULIO FRACISCO SEMEGHINI NETO,ELEITO,PSDB,PSDB/DEM/PPS,8
ITAÍ,DEPUTADO FEDERAL,GIVALDO VIEIRA,GIVALDO RODRIGUES VIEIRA,SUPLENTE,PSDB,PSDB/DEM/PPS,1
ITAÍ,DEPUTADO FEDERAL,TRIPOLI,JOSÉ RICARDO ALVARENGA TRIPOLI,ELEITO,PSDB,PSDB/DEM/PPS,3
ITAÍ,DEPUTADO FEDERAL,FERNANDO FUAD CHUCRE,FERNANDO BARRANCOS CHUCRE,SUPLENTE,PSDB,PSDB/DEM/PPS,2
ITAÍ,DEPUTADO FEDERAL,VAZ DE LIMA,JOSÉ CARLOS VAZ DE LIMA,ELEITO,PSDB,PSDB/DEM/PPS,14
ITAÍ,DEPUTADO FEDERAL,ALEMÃO DA SÁUDE,CLAUDEMIR SERENO,SUPLENTE,PSDB,PSDB/DEM/PPS,2
ITAÍ,DEPUTADO FEDERAL,WALTER FELDMAN,WALTER MEYER FELDMAN,SUPLENTE,PSDB,PSDB/DEM/PPS,6
ITAÍ,DEPUTADO FEDERAL,THAME,ANTONIO CARLOS DE MENDES THAME,ELEITO,PSDB,PSDB/DEM/PPS,358
ITAÍ,DEPUTADO FEDERAL,ARNALDO MADEIRA,ARNALDO DE ABREU MADEIRA,SUPLENTE,PSDB,PSDB/DEM/PPS,66
ITAÍ,DEPUTADO FEDERAL,BRUNA FURLAN,BRUNA DIAS FURLAN,ELEITO,PSDB,PSDB/DEM/PPS,310
ITAÍ,DEPUTADO FEDERAL,JOSÉ ANIBAL,JOSÉ ANIBAL PERES DE PONTES,ELEITO,PSDB,PSDB/DEM/PPS,383
ITAÍ,DEPUTADO FEDERAL,NELSON BUGALHO,NELSON ROBERTO BUGALHO,SUPLENTE,PSDB,PSDB/DEM/PPS,2
ITAÍ,DEPUTADO FEDERAL,GILBERTO BORJA,GILBERTO BORJA PINTO,SUPLENTE,PSDB,PSDB/DEM/PPS,2
ITAÍ,DEPUTADO FEDERAL,PROFESSOR SAULO CARVALHO,SAULO RODRIGUES DE CARVALHO,SUPLENTE,PSOL,PARTIDO SOCIALISMO E LIBERDADE,1
ITAÍ,DEPUTADO FEDERAL,RODRIGO CHIZOLINI,RODRIGO PINTO CHIZOLINI,SUPLENTE,PSOL,PARTIDO SOCIALISMO E LIBERDADE,5
ITAÍ,DEPUTADO FEDERAL,AKIKO AKI,AKIKO AKIYAMA,SUPLENTE,PSOL,PARTIDO SOCIALISMO E LIBERDADE,1
ITAÍ,DEPUTADO FEDERAL,IVAN VALENTE,IVAN VALENTE,ELEITO,PSOL,PARTIDO SOCIALISMO E LIBERDADE,31
ITAÍ,DEPUTADO FEDERAL,PROFESSORA MÁRCIA TAVARES,MÁRCIA TAVARES DO NASCIMENTO,SUPLENTE,PSOL,PARTIDO SOCIALISMO E LIBERDADE,1
ITAÍ,DEPUTADO FEDERAL,GUSTAVO PETTA,GUSTAVO LEMOS PETTA,SUPLENTE,PC DO B,JUNTOS POR SÃO PAULO,2
ITAÍ,DEPUTADO FEDERAL,CÉLIO TURINO,CÉLIO ROBERTO TURINO DE MIRANDA,SUPLENTE,PC DO B,JUNTOS POR SÃO PAULO,1
ITAÍ,DEPUTADO FEDERAL,ALDO REBELO,JOSÉ ALDO REBELO FIGUEIREDO,ELEITO,PC DO B,JUNTOS POR SÃO PAULO,29
ITAÍ,DEPUTADO FEDERAL,DELEGADO PROTÓGENES,PROTÓGENES PINHEIRO DE QUEIROZ,MÉDIA,PC DO B,JUNTOS POR SÃO PAULO,9
ITAÍ,DEPUTADO ESTADUAL,GERSON DEZEMBRO,GERSON DONIZETI DEZEMBRO,SUPLENTE,PRB,SOMOS MAIS SÃO PAULO,2
ITAÍ,DEPUTADO ESTADUAL,WANDEMBERG,WANDEMBERG MARQUES DA SILVA,SUPLENTE,PRB,SOMOS MAIS SÃO PAULO,5
ITAÍ,DEPUTADO ESTADUAL,GILMACI SANTOS,GILMACI DOS SANTOS BARBOSA,ELEITO,PRB,SOMOS MAIS SÃO PAULO,6
ITAÍ,DEPUTADO ESTADUAL,SEBASTIÃO SANTOS,SEBASTIÃO DOS SANTOS FILHO,ELEITO,PRB,SOMOS MAIS SÃO PAULO,41
ITAÍ,DEPUTADO ESTADUAL,HAVANIR,HAVANIR TAVARES DE ALMEIDA NIMTZ,SUPLENTE,PRB,SOMOS MAIS SÃO PAULO,1
ITAÍ,DEPUTADO ESTADUAL,RICARDO SARAVALLI,RICARDO SARAVALLI,SUPLENTE,PP,PARTIDO PROGRESSISTA,1
ITAÍ,DEPUTADO ESTADUAL,MALEK,ROBSON MALEK,SUPLENTE,PP,PARTIDO PROGRESSISTA,2
ITAÍ,DEPUTADO ESTADUAL,DR. FERRUCIO,FERRUCIO DALL AGLIO,SUPLENTE,PP,PARTIDO PROGRESSISTA,1
ITAÍ,DEPUTADO ESTADUAL,QUATI,ANTONIO DOS SANTOS BARBOSA,SUPLENTE,PP,PARTIDO PROGRESSISTA,4
ITAÍ,DEPUTADO ESTADUAL,CURIATI,ANTONIO SALIM CURIATI,ELEITO,PP,PARTIDO PROGRESSISTA,645
ITAÍ,DEPUTADO ESTADUAL,CIMATTI NETO,MILTON CIMATTI NETO,SUPLENTE,PP,PARTIDO PROGRESSISTA,40
ITAÍ,DEPUTADO ESTADUAL,HALEPLIAN,SYLVIO HALEPLIAN FILHO,SUPLENTE,PP,PARTIDO PROGRESSISTA,1
ITAÍ,DEPUTADO ESTADUAL,DR. SERGIO CHEBEL,SERGIO CABRAL CHEBEL,SUPLENTE,PP,PARTIDO PROGRESSISTA,2
ITAÍ,DEPUTADO ESTADUAL,JOSE MENINO NETO,JOSE MENINO NETO,SUPLENTE,PP,PARTIDO PROGRESSISTA,1
ITAÍ,DEPUTADO ESTADUAL,SIMONY,SIMONY BENELLI GALASSO,SUPLENTE,PP,PARTIDO PROGRESSISTA,4
ITAÍ,DEPUTADO ESTADUAL,MAJOR ROLIM,JOÃO PAULO ROLIM MARQUES,SUPLENTE,PP,PARTIDO PROGRESSISTA,8
ITAÍ,DEPUTADO ESTADUAL,JOSE DIAS,JOSE DIAS DA SILVA,SUPLENTE,PP,PARTIDO PROGRESSISTA,1
ITAÍ,DEPUTADO ESTADUAL,FIALA,FRANCISCO TOMAS FIALA,SUPLENTE,PP,PARTIDO PROGRESSISTA,1
ITAÍ,DEPUTADO ESTADUAL,JOÃO ARAUJO,JOÃO ANTONIO DE ARAUJO,SUPLENTE,PP,PARTIDO PROGRESSISTA,2
ITAÍ,DEPUTADO ESTADUAL,DR. IRINEU,IRINEU CARDOSO DOS SANTOS,SUPLENTE,PP,PARTIDO PROGRESSISTA,133
ITAÍ,DEPUTADO ESTADUAL,ELIAS CAMARGO,ELIAS CAMARGO,SUPLENTE,PP,PARTIDO PROGRESSISTA,69
ITAÍ,DEPUTADO ESTADUAL,RICARDO BALDIM,RICARDO DE MORAES BALDIM,SUPLENTE,PP,PARTIDO PROGRESSISTA,1
ITAÍ,DEPUTADO ESTADUAL,RAFA ZIMBALDI,RAFAEL FERNANDO ZIMBALDI,SUPLENTE,PP,PARTIDO PROGRESSISTA,13
ITAÍ,DEPUTADO ESTADUAL,NELSON MANDELA,ADOLPHINO ROSARIO CRUZ,SUPLENTE,PP,PARTIDO PROGRESSISTA,1
ITAÍ,DEPUTADO ESTADUAL,RUSSOMANNO,MOZART ABAETE PERUIBE RUSSOMANNO,SUPLENTE,PP,PARTIDO PROGRESSISTA,1
ITAÍ,DEPUTADO ESTADUAL,AURELIO,AURELIO JOSE CLAUDIO,SUPLENTE,PDT,PARTIDO DEMOCRÁTICO TRABALHISTA,2
ITAÍ,DEPUTADO ESTADUAL,PEREIRA METALURGICO,JOSÉ PEREIRA DOS SANTOS,SUPLENTE,PDT,PARTIDO DEMOCRÁTICO TRABALHISTA,2
ITAÍ,DEPUTADO ESTADUAL,LUIS YABIKU,LUIS MOKITI YABIKU,SUPLENTE,PDT,PARTIDO DEMOCRÁTICO TRABALHISTA,3
ITAÍ,DEPUTADO ESTADUAL,DINEI,CLAUDINEI ALEXANDRE PIRES,SUPLENTE,PDT,PARTIDO DEMOCRÁTICO TRABALHISTA,101
ITAÍ,DEPUTADO ESTADUAL,AUREO PRETO,AUREO RODRIGUES DE SOUZA,SUPLENTE,PDT,PARTIDO DEMOCRÁTICO TRABALHISTA,2
ITAÍ,DEPUTADO ESTADUAL,ROGERIO NOGUEIRA,ROGERIO NOGUEIRA LOPES CRUZ,ELEITO,PDT,PARTIDO DEMOCRÁTICO TRABALHISTA,15
ITAÍ,DEPUTADO ESTADUAL,JOSE BITTENCOURT,JOSE DOMINGOS BITTENCOURT,ELEITO,PDT,PARTIDO DEMOCRÁTICO TRABALHISTA,12
ITAÍ,DEPUTADO ESTADUAL,MAJOR OLIMPIO,SERGIO OLIMPIO GOMES,ELEITO,PDT,PARTIDO DEMOCRÁTICO TRABALHISTA,23
