MIRASSOL,DEPUTADO FEDERAL,HENRIQUE NUNES,HENRIQUE ANTONIO PAIVA NUNES,SUPLENTE,PV,PARTIDO VERDE,3
MIRASSOL,DEPUTADO FEDERAL,CARLOS SAMPAIO,CARLOS HENRIQUE FOCESI SAMPAIO,ELEITO,PSDB,PSDB/DEM/PPS,7
MIRASSOL,DEPUTADO FEDERAL,STANGARLINI,JOSE CARLOS STANGARLINI,SUPLENTE,PSDB,PSDB/DEM/PPS,13
MIRASSOL,DEPUTADO FEDERAL,RAUL CHRISTIANO,RAUL CHRISTIANO DE OLIVEIRA SANCHEZ,SUPLENTE,PSDB,PSDB/DEM/PPS,9
MIRASSOL,DEPUTADO FEDERAL,LOBBE NETO,ANTONIO ADOLPHO LOBBE NETO,SUPLENTE,PSDB,PSDB/DEM/PPS,10
MIRASSOL,DEPUTADO FEDERAL,FELICIDADE,FELICIDADE LOPES PONTES,SUPLENTE,PSDB,PSDB/DEM/PPS,1
MIRASSOL,DEPUTADO FEDERAL,MANOEL MARCOS (MANÉ),MANOEL MARCOS DE JESUS FERREIRA,SUPLENTE,PSDB,PSDB/DEM/PPS,4
MIRASSOL,DEPUTADO FEDERAL,EMANUEL FERNANDES,EMANUEL FERNANDES,ELEITO,PSDB,PSDB/DEM/PPS,76
MIRASSOL,DEPUTADO FEDERAL,MARA GABRILLI,MARA CRISTINA GABRILLI,ELEITO,PSDB,PSDB/DEM/PPS,6
MIRASSOL,DEPUTADO FEDERAL,JOÃO PAULO FERRARESSO,JOÃO PAULO CORSETTI FERRARESSO,SUPLENTE,PSDB,PSDB/DEM/PPS,1
MIRASSOL,DEPUTADO FEDERAL,LELIS DA ROCHA,LELIS DA ROCHA,SUPLENTE,PSDB,PSDB/DEM/PPS,3
MIRASSOL,DEPUTADO FEDERAL,CARLOS ROBERTO,CARLOS ROBERTO DE CAMPOS,SUPLENTE,PSDB,PSDB/DEM/PPS,15
MIRASSOL,DEPUTADO FEDERAL,DIB,WILLIAM DIB,ELEITO,PSDB,PSDB/DEM/PPS,39
MIRASSOL,DEPUTADO FEDERAL,ALBERTO MOURAO,ALBERTO PEREIRA MOURAO,SUPLENTE,PSDB,PSDB/DEM/PPS,23
MIRASSOL,DEPUTADO FEDERAL,RENATO AMARY,RENATO FAUVEL AMARY,SUPLENTE,PSDB,PSDB/DEM/PPS,1
MIRASSOL,DEPUTADO FEDERAL,TIRSO MEIRELLES,TIRSO DE SALLES MEIRELLES,SUPLENTE,PSDB,PSDB/DEM/PPS,38
MIRASSOL,DEPUTADO FEDERAL,EDSON APARECIDO,EDSON APARECIDO DOS SANTOS,ELEITO,PSDB,PSDB/DEM/PPS,59
MIRASSOL,DEPUTADO FEDERAL,RICARDO MONTORO,JOSE RICARDO FRANCO MONTORO,SUPLENTE,PSDB,PSDB/DEM/PPS,13
MIRASSOL,DEPUTADO FEDERAL,DR. MARCELO,MARCELO CHEHADE,SUPLENTE,PSDB,PSDB/DEM/PPS,2
MIRASSOL,DEPUTADO FEDERAL,VANDERLEI MACRIS,VANDERLEI MACRIS,SUPLENTE,PSDB,PSDB/DEM/PPS,1
MIRASSOL,DEPUTADO FEDERAL,DUARTE NOGUEIRA,ANTONIO DUARTE NOGUEIRA JUNIOR,ELEITO,PSDB,PSDB/DEM/PPS,9
MIRASSOL,DEPUTADO FEDERAL,JULIO SEMEGHINI,JULIO FRACISCO SEMEGHINI NETO,ELEITO,PSDB,PSDB/DEM/PPS,339
MIRASSOL,DEPUTADO FEDERAL,RAFAEL ABUD,RAFAEL ANGELO ABUD,SUPLENTE,PSDB,PSDB/DEM/PPS,4
MIRASSOL,DEPUTADO FEDERAL,GIVALDO VIEIRA,GIVALDO RODRIGUES VIEIRA,SUPLENTE,PSDB,PSDB/DEM/PPS,3
MIRASSOL,DEPUTADO FEDERAL,TRIPOLI,JOSÉ RICARDO ALVARENGA TRIPOLI,ELEITO,PSDB,PSDB/DEM/PPS,19
MIRASSOL,DEPUTADO FEDERAL,FERNANDO FUAD CHUCRE,FERNANDO BARRANCOS CHUCRE,SUPLENTE,PSDB,PSDB/DEM/PPS,6
MIRASSOL,DEPUTADO FEDERAL,VAZ DE LIMA,JOSÉ CARLOS VAZ DE LIMA,ELEITO,PSDB,PSDB/DEM/PPS,4768
MIRASSOL,DEPUTADO FEDERAL,ALEMÃO DA SÁUDE,CLAUDEMIR SERENO,SUPLENTE,PSDB,PSDB/DEM/PPS,2
MIRASSOL,DEPUTADO FEDERAL,TIÃO,SEBASTIÃO FERRES ARSENE,SUPLENTE,PSDB,PSDB/DEM/PPS,2
MIRASSOL,DEPUTADO FEDERAL,WALTER FELDMAN,WALTER MEYER FELDMAN,SUPLENTE,PSDB,PSDB/DEM/PPS,7
MIRASSOL,DEPUTADO FEDERAL,THAME,ANTONIO CARLOS DE MENDES THAME,ELEITO,PSDB,PSDB/DEM/PPS,13
MIRASSOL,DEPUTADO FEDERAL,BRUNA FURLAN,BRUNA DIAS FURLAN,ELEITO,PSDB,PSDB/DEM/PPS,32
MIRASSOL,DEPUTADO FEDERAL,JOSÉ ANIBAL,JOSÉ ANIBAL PERES DE PONTES,ELEITO,PSDB,PSDB/DEM/PPS,9
MIRASSOL,DEPUTADO FEDERAL,NELSON BUGALHO,NELSON ROBERTO BUGALHO,SUPLENTE,PSDB,PSDB/DEM/PPS,4
MIRASSOL,DEPUTADO FEDERAL,GILBERTO BORJA,GILBERTO BORJA PINTO,SUPLENTE,PSDB,PSDB/DEM/PPS,1
MIRASSOL,DEPUTADO FEDERAL,JAMIL PRUDENCIANO,JAMIL PAULO PRUDENCIANO,SUPLENTE,PSOL,PARTIDO SOCIALISMO E LIBERDADE,1
MIRASSOL,DEPUTADO FEDERAL,RAFAEL MOYA,RAFAEL DUARTE MOYA,SUPLENTE,PSOL,PARTIDO SOCIALISMO E LIBERDADE,1
MIRASSOL,DEPUTADO FEDERAL,ADILSON RODRIGUES,ADILSON RODRIGUES SANTOS,SUPLENTE,PSOL,PARTIDO SOCIALISMO E LIBERDADE,3
MIRASSOL,DEPUTADO FEDERAL,FAUSTO NETO,FAUSTO FRANCISCO DOS SANTOS NETO,SUPLENTE,PSOL,PARTIDO SOCIALISMO E LIBERDADE,5
MIRASSOL,DEPUTADO FEDERAL,ARIADNE LIBERATO,ARIADNE LIBERATO ROSA DE OLIVEIRA,SUPLENTE,PSOL,PARTIDO SOCIALISMO E LIBERDADE,1
MIRASSOL,DEPUTADO FEDERAL,RODRIGO PAIXAO,RODRIGO JOSE PAIXAO,SUPLENTE,PSOL,PARTIDO SOCIALISMO E LIBERDADE,1
MIRASSOL,DEPUTADO FEDERAL,PEDRO ROBERTO,PEDRO ROBERTO GOMES,SUPLENTE,PSOL,PARTIDO SOCIALISMO E LIBERDADE,61
MIRASSOL,DEPUTADO FEDERAL,ELISEU SOARES,ELISEU SOARES DE ARAUJO,SUPLENTE,PSOL,PARTIDO SOCIALISMO E LIBERDADE,1
MIRASSOL,DEPUTADO FEDERAL,IVAN VALENTE,IVAN VALENTE,ELEITO,PSOL,PARTIDO SOCIALISMO E LIBERDADE,98
MIRASSOL,DEPUTADO FEDERAL,PROFESSORA MÁRCIA TAVARES,MÁRCIA TAVARES DO NASCIMENTO,SUPLENTE,PSOL,PARTIDO SOCIALISMO E LIBERDADE,1
MIRASSOL,DEPUTADO FEDERAL,DR. ABELHA,CARLOS FERNANDO LOPES ABELHA,SUPLENTE,PC DO B,JUNTOS POR SÃO PAULO,3
MIRASSOL,DEPUTADO FEDERAL,GUSTAVO PETTA,GUSTAVO LEMOS PETTA,SUPLENTE,PC DO B,JUNTOS POR SÃO PAULO,3
MIRASSOL,DEPUTADO FEDERAL,CÉLIO TURINO,CÉLIO ROBERTO TURINO DE MIRANDA,SUPLENTE,PC DO B,JUNTOS POR SÃO PAULO,7
MIRASSOL,DEPUTADO FEDERAL,DR. PAULO POLO,PAULO ROBERTO POLO,SUPLENTE,PC DO B,JUNTOS POR SÃO PAULO,1
MIRASSOL,DEPUTADO FEDERAL,BENEH SANTOS,BENEDITO HERNELIO DOS SANTOS,SUPLENTE,PC DO B,JUNTOS POR SÃO PAULO,2
MIRASSOL,DEPUTADO FEDERAL,ALDO REBELO,JOSÉ ALDO REBELO FIGUEIREDO,ELEITO,PC DO B,JUNTOS POR SÃO PAULO,27
MIRASSOL,DEPUTADO FEDERAL,DELEGADO PROTÓGENES,PROTÓGENES PINHEIRO DE QUEIROZ,MÉDIA,PC DO B,JUNTOS POR SÃO PAULO,34
MIRASSOL,DEPUTADO FEDERAL,JOAO ARAUJO,JOAO LUIS ARAUJO NETO,SUPLENTE,PT DO B,JUNTOS POR SÃO PAULO,3
MIRASSOL,DEPUTADO FEDERAL,DR MARCAO DA MANCHA,MARCO ANTONIO NOTARI,SUPLENTE,PT DO B,JUNTOS POR SÃO PAULO,5
MIRASSOL,DEPUTADO FEDERAL,COCADINHA CRUZ,GERALDO FERREIRA DA CRUZ,SUPLENTE,PT DO B,JUNTOS POR SÃO PAULO,1
MIRASSOL,DEPUTADO FEDERAL,ALBINO MATOS GOMES,ALBINO MATOS GOMES,SUPLENTE,PT DO B,JUNTOS POR SÃO PAULO,1
MIRASSOL,DEPUTADO ESTADUAL,GERSON DEZEMBRO,GERSON DONIZETI DEZEMBRO,SUPLENTE,PRB,SOMOS MAIS SÃO PAULO,1
MIRASSOL,DEPUTADO ESTADUAL,GILMACI SANTOS,GILMACI DOS SANTOS BARBOSA,ELEITO,PRB,SOMOS MAIS SÃO PAULO,12
MIRASSOL,DEPUTADO ESTADUAL,SEBASTIÃO SANTOS,SEBASTIÃO DOS SANTOS FILHO,ELEITO,PRB,SOMOS MAIS SÃO PAULO,564
MIRASSOL,DEPUTADO ESTADUAL,HAVANIR,HAVANIR TAVARES DE ALMEIDA NIMTZ,SUPLENTE,PRB,SOMOS MAIS SÃO PAULO,4
MIRASSOL,DEPUTADO ESTADUAL,ZEZINHO CACHOEIRA,JOSÉ FRANCISCO DE SÁ FILHO,SUPLENTE,PRB,SOMOS MAIS SÃO PAULO,14
MIRASSOL,DEPUTADO ESTADUAL,RICARDO SARAVALLI,RICARDO SARAVALLI,SUPLENTE,PP,PARTIDO PROGRESSISTA,2
MIRASSOL,DEPUTADO ESTADUAL,DR. LUCAS DE PAULA,LUCAS DE PAULA,SUPLENTE,PP,PARTIDO PROGRESSISTA,5
MIRASSOL,DEPUTADO ESTADUAL,RICARDO PELISSER,RICARDO PELISSER DOS SANTOS,SUPLENTE,PP,PARTIDO PROGRESSISTA,1
MIRASSOL,DEPUTADO ESTADUAL,MALEK,ROBSON MALEK,SUPLENTE,PP,PARTIDO PROGRESSISTA,2
MIRASSOL,DEPUTADO ESTADUAL,VALDIR PINHEIRO,VALDIR PINHEIRO,SUPLENTE,PP,PARTIDO PROGRESSISTA,13
MIRASSOL,DEPUTADO ESTADUAL,CURIATI,ANTONIO SALIM CURIATI,ELEITO,PP,PARTIDO PROGRESSISTA,29
MIRASSOL,DEPUTADO ESTADUAL,SIMONY,SIMONY BENELLI GALASSO,SUPLENTE,PP,PARTIDO PROGRESSISTA,10
MIRASSOL,DEPUTADO ESTADUAL,DIOGO TICLY,DIOGO GAZZE TICLY,SUPLENTE,PP,PARTIDO PROGRESSISTA,5
MIRASSOL,DEPUTADO ESTADUAL,JOÃO ARAUJO,JOÃO ANTONIO DE ARAUJO,SUPLENTE,PP,PARTIDO PROGRESSISTA,1
MIRASSOL,DEPUTADO ESTADUAL,MARIA CLEMENTINA,MARIA CLEMENTINO DE SOUSA,SUPLENTE,PP,PARTIDO PROGRESSISTA,2
MIRASSOL,DEPUTADO ESTADUAL,LAZARO TAVARES CUNHA,LAZARO TAVARES DA CUNHA,SUPLENTE,PP,PARTIDO PROGRESSISTA,2
MIRASSOL,DEPUTADO ESTADUAL,BARRETÃO,ARMANDO SERGIO ROSA BARRETO,SUPLENTE,PP,PARTIDO PROGRESSISTA,1
MIRASSOL,DEPUTADO ESTADUAL,RAFA ZIMBALDI,RAFAEL FERNANDO ZIMBALDI,SUPLENTE,PP,PARTIDO PROGRESSISTA,5
MIRASSOL,DEPUTADO ESTADUAL,EDINHO,EDSON JOAQUIM DE FREITAS,SUPLENTE,PP,PARTIDO PROGRESSISTA,2
MIRASSOL,DEPUTADO ESTADUAL,RUSSOMANNO,MOZART ABAETE PERUIBE RUSSOMANNO,SUPLENTE,PP,PARTIDO PROGRESSISTA,4
MIRASSOL,DEPUTADO ESTADUAL,MIL DE LIMA,EDMIMILSON APARECIDO DE LIMA,SUPLENTE,PP,PARTIDO PROGRESSISTA,1
MIRASSOL,DEPUTADO ESTADUAL,PAULERA,PAULO ROBERTO AMBROSIO,SUPLENTE,PP,PARTIDO PROGRESSISTA,380
MIRASSOL,DEPUTADO ESTADUAL,AURELIO,AURELIO JOSE CLAUDIO,SUPLENTE,PDT,PARTIDO DEMOCRÁTICO TRABALHISTA,60
MIRASSOL,DEPUTADO ESTADUAL,PERESSIM,CLAUDIO PERESSIM,SUPLENTE,PDT,PARTIDO DEMOCRÁTICO TRABALHISTA,8
MIRASSOL,DEPUTADO ESTADUAL,LUIS YABIKU,LUIS MOKITI YABIKU,SUPLENTE,PDT,PARTIDO DEMOCRÁTICO TRABALHISTA,7
MIRASSOL,DEPUTADO ESTADUAL,DR RENAN,RENAN MARINO,SUPLENTE,PDT,PARTIDO DEMOCRÁTICO TRABALHISTA,103
MIRASSOL,DEPUTADO ESTADUAL,DINEI,CLAUDINEI ALEXANDRE PIRES,SUPLENTE,PDT,PARTIDO DEMOCRÁTICO TRABALHISTA,13
MIRASSOL,DEPUTADO ESTADUAL,AUREO PRETO,AUREO RODRIGUES DE SOUZA,SUPLENTE,PDT,PARTIDO DEMOCRÁTICO TRABALHISTA,1
MIRASSOL,DEPUTADO ESTADUAL,GILBERTO DOURADO,GILBERTO RODRIGUES DOURADO,SUPLENTE,PDT,PARTIDO DEMOCRÁTICO TRABALHISTA,3
MIRASSOL,DEPUTADO ESTADUAL,ROGERIO NOGUEIRA,ROGERIO NOGUEIRA LOPES CRUZ,ELEITO,PDT,PARTIDO DEMOCRÁTICO TRABALHISTA,1
MIRASSOL,DEPUTADO ESTADUAL,CAPITAO LUCAS,AURO LUCAS,SUPLENTE,PDT,PARTIDO DEMOCRÁTICO TRABALHISTA,1
MIRASSOL,DEPUTADO ESTADUAL,JOSE BITTENCOURT,JOSE DOMINGOS BITTENCOURT,ELEITO,PDT,PARTIDO DEMOCRÁTICO TRABALHISTA,75
MIRASSOL,DEPUTADO ESTADUAL,MAJOR OLIMPIO,SERGIO OLIMPIO GOMES,ELEITO,PDT,PARTIDO DEMOCRÁTICO TRABALHISTA,225
MIRASSOL,DEPUTADO ESTADUAL,CARLAO MOTORISTA,ANTONIO CARLOS RIBEIRO,SUPLENTE,PDT,PARTIDO DEMOCRÁTICO TRABALHISTA,1
MIRASSOL,DEPUTADO ESTADUAL,JOCA VASCONCELOS,JOAO CARLOS MONTE CLARO VASCONCELOS,SUPLENTE,PDT,PARTIDO DEMOCRÁTICO TRABALHISTA,8
MIRASSOL,DEPUTADO ESTADUAL,AMON VIOLEIRO,AMOMM HEBROM DA HORA DE DEUS SOUZA,SUPLENTE,PDT,PARTIDO DEMOCRÁTICO TRABALHISTA,4
MIRASSOL,DEPUTADO ESTADUAL,CARLOS HERNANDES,JOSÉ CARLOS SANCHES HERNANDES,SUPLENTE,PDT,PARTIDO DEMOCRÁTICO TRABALHISTA,5
MIRASSOL,DEPUTADO ESTADUAL,NICOLACI,RONALD LUIZ NICOLACI FINCATTI,SUPLENTE,PDT,PARTIDO DEMOCRÁTICO TRABALHISTA,2
MIRASSOL,DEPUTADO ESTADUAL,BRUZAROSCO,APARECIDO DE JESUS BRUZAROSCO,SUPLENTE,PDT,PARTIDO DEMOCRÁTICO TRABALHISTA,34
MIRASSOL,DEPUTADO ESTADUAL,EMERSON LEAL,EMERSON PIRES LEAL,SUPLENTE,PDT,PARTIDO DEMOCRÁTICO TRABALHISTA,18
MIRASSOL,DEPUTADO ESTADUAL,RAFAEL SILVA,RAFAEL ANTONIO DA SILVA,ELEITO,PDT,PARTIDO DEMOCRÁTICO TRABALHISTA,22
MIRASSOL,DEPUTADO ESTADUAL,NICANOR,NICANOR JOSE DA SILVA,SUPLENTE,PDT,PARTIDO DEMOCRÁTICO TRABALHISTA,4
MIRASSOL,DEPUTADO ESTADUAL,TOLOI,LUIZ CARLOS TOLOI JUNIOR,SUPLENTE,PDT,PARTIDO DEMOCRÁTICO TRABALHISTA,9
MIRASSOL,DEPUTADO ESTADUAL,TADEU MORAIS,TADEU MORAIS DE SOUSA,SUPLENTE,PDT,PARTIDO DEMOCRÁTICO TRABALHISTA,1
MIRASSOL,DEPUTADO ESTADUAL,HELIO BASTOS,HELIO DE ALMEIDA BASTOS,SUPLENTE,PDT,PARTIDO DEMOCRÁTICO TRABALHISTA,3
MIRASSOL,DEPUTADO ESTADUAL,MYRYAM ATHIE,MIRIAM ATHIE,SUPLENTE,PDT,PARTIDO DEMOCRÁTICO TRABALHISTA,1
MIRASSOL,DEPUTADO ESTADUAL,ELIO CANDIDO,ELIO ANTONIO CANDIDO,SUPLENTE,PDT,PARTIDO DEMOCRÁTICO TRABALHISTA,1
MIRASSOL,DEPUTADO ESTADUAL,WENDEL ALVES,WENDEL ALVES DE SOUSA,SUPLENTE,PDT,PARTIDO DEMOCRÁTICO TRABALHISTA,1
MIRASSOL,DEPUTADO ESTADUAL,CONSTANCIA FELIX,CONSTANCIA BERBERT DUTRA DA SILVA,SUPLENTE,PDT,PARTIDO DEMOCRÁTICO TRABALHISTA,5
MIRASSOL,DEPUTADO ESTADUAL,MARCO BRASIL,MARCO AURÉLIO RIBEIRO,SUPLENTE,PDT,PARTIDO DEMOCRÁTICO TRABALHISTA,2
MIRASSOL,DEPUTADO ESTADUAL,JOÃO ELIAS,JOÃO ELIAS PEREIRA,SUPLENTE,PDT,PARTIDO DEMOCRÁTICO TRABALHISTA,2
MIRASSOL,DEPUTADO ESTADUAL,PAULO BARBOSA,PAULO ROBERTO BARBOSA,SUPLENTE,PDT,PARTIDO DEMOCRÁTICO TRABALHISTA,6
MIRASSOL,DEPUTADO ESTADUAL,JOSE DE ALMEIDA,JOSE MALVINEITE DE ALMEIDA,SUPLENTE,PDT,PARTIDO DEMOCRÁTICO TRABALHISTA,1
MIRASSOL,DEPUTADO ESTADUAL,ANDERSON SILVA,ANDERSON DOMINGOS DA SILVA,SUPLENTE,PT,SOMOS MAIS SÃO PAULO,4
MIRASSOL,DEPUTADO ESTADUAL,TELMA DE SOUZA,TELMA SANDRA AUGUSTO DE SOUZA,ELEITO,PT,SOMOS MAIS SÃO PAULO,4
MIRASSOL,DEPUTADO ESTADUAL,PEDRO BIANGULI,PEDRO CARLOS BIANGULI DE FARIA,SUPLENTE,PT,SOMOS MAIS SÃO PAULO,1
MIRASSOL,DEPUTADO ESTADUAL,WAGNER BALIEIRO,WAGNER OCIMAR BALIEIRO,SUPLENTE,PT,SOMOS MAIS SÃO PAULO,2
MIRASSOL,DEPUTADO ESTADUAL,PROFESSOR CLEITON GOMES,CLEITON GOMES DA SILVA,SUPLENTE,PT,SOMOS MAIS SÃO PAULO,3
MIRASSOL,DEPUTADO ESTADUAL,VALMIR PRASCIDELLI,VALMIR PRASCIDELLI,SUPLENTE,PT,SOMOS MAIS SÃO PAULO,4
MIRASSOL,DEPUTADO ESTADUAL,PORTUGUÊS,REINALDO FARTO NUNES,SUPLENTE,PT,SOMOS MAIS SÃO PAULO,4
MIRASSOL,DEPUTADO ESTADUAL,JURA,JURACY FRANCISCO DE JESUS,SUPLENTE,PT,SOMOS MAIS SÃO PAULO,1
MIRASSOL,DEPUTADO ESTADUAL,EDINHO SILVA,EDSON ANTONIO EDINHO DA SILVA,ELEITO,PT,SOMOS MAIS SÃO PAULO,17
MIRASSOL,DEPUTADO ESTADUAL,RAFAEL MARINHO,RAFAEL DE FIGUEIREDO MARINHO,SUPLENTE,PT,SOMOS MAIS SÃO PAULO,7
MIRASSOL,DEPUTADO ESTADUAL,TONINHO DO PT,ANTONIO AMARAL JUNIOR,SUPLENTE,PT,SOMOS MAIS SÃO PAULO,1
MIRASSOL,DEPUTADO ESTADUAL,ZICO,JOSÉ PRADO DE ANDRADE,MÉDIA,PT,SOMOS MAIS SÃO PAULO,3
MIRASSOL,DEPUTADO ESTADUAL,SALETE CAMPARI,FRANCISCO DE SALES RODRIGUES,SUPLENTE,PT,SOMOS MAIS SÃO PAULO,2
MIRASSOL,DEPUTADO ESTADUAL,MARCO AURÉLIO DE SOUZA,MARCO AURÉLIO DE SOUZA,MÉDIA,PT,SOMOS MAIS SÃO PAULO,6
MIRASSOL,DEPUTADO ESTADUAL,MARCOS MARTINS,MARCOS LOPES MARTINS,ELEITO,PT,SOMOS MAIS SÃO PAULO,5
MIRASSOL,DEPUTADO ESTADUAL,ELI TEODORO,ELI TEODORO,SUPLENTE,PT,SOMOS MAIS SÃO PAULO,3
MIRASSOL,DEPUTADO ESTADUAL,IVANETE VIEIRA,IVANETE APARECIDA DOS SANTOS,SUPLENTE,PT,SOMOS MAIS SÃO PAULO,1
MIRASSOL,DEPUTADO ESTADUAL,RUI FALCÃO,RUI GOETHE DA COSTA FALCÃO,ELEITO,PT,SOMOS MAIS SÃO PAULO,2
MIRASSOL,DEPUTADO ESTADUAL,ANTONIO MENTOR,ANTONIO MENTOR DE MELLO SOBRINHO,ELEITO,PT,SOMOS MAIS SÃO PAULO,44
MIRASSOL,DEPUTADO ESTADUAL,PADRE JUZEMILDO,JUZEMILDO ALBINO DA SILVA,SUPLENTE,PT,SOMOS MAIS SÃO PAULO,2
MIRASSOL,DEPUTADO ESTADUAL,ADRIANO DIOGO,ADRIANO DIOGO,ELEITO,PT,SOMOS MAIS SÃO PAULO,5
MIRASSOL,DEPUTADO ESTADUAL,HAMILTON PEREIRA,HAMILTON PEREIRA,ELEITO,PT,SOMOS MAIS SÃO PAULO,1
MIRASSOL,DEPUTADO ESTADUAL,EUVANILDE,EUVANILDE RODRIGUES DA SILVA,SUPLENTE,PT,SOMOS MAIS SÃO PAULO,1
MIRASSOL,DEPUTADO ESTADUAL,LUIZ CLAUDIO MARCOLINO,LUIZ CLAUDIO MARCOLINO,ELEITO,PT,SOMOS MAIS SÃO PAULO,2
MIRASSOL,DEPUTADO ESTADUAL,RENATO DO GEB,RENATO MORENI AIRES DA SILVA,SUPLENTE,PT,SOMOS MAIS SÃO PAULO,3
MIRASSOL,DEPUTADO ESTADUAL,NATIVIDADE,MARIA DA NATIVIDADE PEREIRA LIMA,SUPLENTE,PT,SOMOS MAIS SÃO PAULO,3
MIRASSOL,DEPUTADO ESTADUAL,ROBERTO FELICIO,ROBERTO FELICIO,SUPLENTE,PT,SOMOS MAIS SÃO PAULO,29
MIRASSOL,DEPUTADO ESTADUAL,ROSANA GASPAR,ROSANA EMILIA GASPAR,SUPLENTE,PT,SOMOS MAIS SÃO PAULO,1
MIRASSOL,DEPUTADO ESTADUAL,BETH SAHAO,ELISABETH SAHÃO,SUPLENTE,PT,SOMOS MAIS SÃO PAULO,604
MIRASSOL,DEPUTADO ESTADUAL,PAULINHO MARQUES,PAULO MARQUES DE OLIVEIRA,SUPLENTE,PT,SOMOS MAIS SÃO PAULO,5
MIRASSOL,DEPUTADO ESTADUAL,ADINAN ORTOLAN,JOSÉ ADINAN ORTOLAN,SUPLENTE,PT,SOMOS MAIS SÃO PAULO,1
MIRASSOL,DEPUTADO ESTADUAL,ALENCAR,ALENCAR SANTANA BRAGA,ELEITO,PT,SOMOS MAIS SÃO PAULO,6
MIRASSOL,DEPUTADO ESTADUAL,ISAC REIS,ISAC FRANCO DOS REIS,ELEITO,PT,SOMOS MAIS SÃO PAULO,1
MIRASSOL,DEPUTADO ESTADUAL,BRENO CORTELLA,BRENO ZANONI CORTELLA,SUPLENTE,PT,SOMOS MAIS SÃO PAULO,3
MIRASSOL,DEPUTADO ESTADUAL,JOÃO PAULO RILLO,JOÃO PAULO RILLO,ELEITO,PT,SOMOS MAIS SÃO PAULO,5755
MIRASSOL,DEPUTADO ESTADUAL,ANA DO CARMO,ANA MARIA DO CARMO ROSSETO,ELEITO,PT,SOMOS MAIS SÃO PAULO,6
MIRASSOL,DEPUTADO ESTADUAL,MIRANDA,JOSÉ CARLOS MIRANDA,SUPLENTE,PT,SOMOS MAIS SÃO PAULO,4
MIRASSOL,DEPUTADO ESTADUAL,BETO CANGUSSU,LUIZ ROBERTO ALVES CANGUSSU,SUPLENTE,PT,SOMOS MAIS SÃO PAULO,3
MIRASSOL,DEPUTADO ESTADUAL,JOÃO ANTONIO,JOAO ANTONIO DA SILVA FILHO,ELEITO,PT,SOMOS MAIS SÃO PAULO,1
MIRASSOL,DEPUTADO ESTADUAL,GALLO,JURANDIR GALLO,SUPLENTE,PT,SOMOS MAIS SÃO PAULO,1
MIRASSOL,DEPUTADO ESTADUAL,FERNANDO ESCODEIRO,LUIZ FERNANDO ESCODEIRO,SUPLENTE,PT,SOMOS MAIS SÃO PAULO,3
MIRASSOL,DEPUTADO ESTADUAL,CARLOS GRANA,CARLOS ALBERTO GRANA,ELEITO,PT,SOMOS MAIS SÃO PAULO,3
MIRASSOL,DEPUTADO ESTADUAL,ELISEU COSTA,ELISEU SILVA COSTA,SUPLENTE,PT,SOMOS MAIS SÃO PAULO,144
MIRASSOL,DEPUTADO ESTADUAL,DONISETE BRAGA,DONISETE PEREIRA BRAGA,ELEITO,PT,SOMOS MAIS SÃO PAULO,2
MIRASSOL,DEPUTADO ESTADUAL,EDUARDO SIMAO,EDUARDO SIMAO DIAS,SUPLENTE,PT,SOMOS MAIS SÃO PAULO,3
MIRASSOL,DEPUTADO ESTADUAL,CARLOS NEDER,CARLOS ALBERTO PLETZ NEDER,SUPLENTE,PT,SOMOS MAIS SÃO PAULO,5
MIRASSOL,DEPUTADO ESTADUAL,MIOTTO,SEBASTIAO MIOTTO FILHO,SUPLENTE,PTB,PARTIDO TRABALHISTA BRASILEIRO,3
MIRASSOL,DEPUTADO ESTADUAL,LÉO ÁQUILLA,JADSON MENDES DE LIMA,SUPLENTE,PTB,PARTIDO TRABALHISTA BRASILEIRO,16
MIRASSOL,DEPUTADO ESTADUAL,DR GARDEZAN,JOSE ROBERTO GARDEZAN,SUPLENTE,PTB,PARTIDO TRABALHISTA BRASILEIRO,1
MIRASSOL,DEPUTADO ESTADUAL,CEBOLINHA,JOAO VIANELLE PINTO,SUPLENTE,PTB,PARTIDO TRABALHISTA BRASILEIRO,2
MIRASSOL,DEPUTADO ESTADUAL,CONTE LOPES,ROBERVAL CONTE LOPES LIMA,SUPLENTE,PTB,PARTIDO TRABALHISTA BRASILEIRO,11
MIRASSOL,DEPUTADO ESTADUAL,CAMPOS MACHADO,ANTONIO CARLOS DE CAMPOS MACHADO,ELEITO,PTB,PARTIDO TRABALHISTA BRASILEIRO,30
MIRASSOL,DEPUTADO ESTADUAL,JUVENCIO MARQUES,JUVENCIO MARQUES DE ALCANTARA,SUPLENTE,PTB,PARTIDO TRABALHISTA BRASILEIRO,1
MIRASSOL,DEPUTADO ESTADUAL,GIL FONSECA,GILDO APARECIDO FONSECA,SUPLENTE,PTB,PARTIDO TRABALHISTA BRASILEIRO,2
MIRASSOL,DEPUTADO ESTADUAL,DANIEL MACEDO AZEVEDO,DANIEL MACEDO DE AZEVEDO,SUPLENTE,PTB,PARTIDO TRABALHISTA BRASILEIRO,4
MIRASSOL,DEPUTADO ESTADUAL,ROQUE BARBIERE - ROQUINHO,ROQUE BARBIERE,ELEITO,PTB,PARTIDO TRABALHISTA BRASILEIRO,22
MIRASSOL,DEPUTADO ESTADUAL,CORONEL EDSON FERRARINI,EDSON FERRARINI,ELEITO,PTB,PARTIDO TRABALHISTA BRASILEIRO,7
MIRASSOL,DEPUTADO ESTADUAL,JOSE FERRO,JOSE FERREIRA FERRO DA SILVA,SUPLENTE,PTB,PARTIDO TRABALHISTA BRASILEIRO,1
MIRASSOL,DEPUTADO ESTADUAL,PROFESSOR MARCELO,MARCELO MIYAZAKI,SUPLENTE,PTB,PARTIDO TRABALHISTA BRASILEIRO,1
MIRASSOL,DEPUTADO ESTADUAL,GERSINHO ROMERO,GERSON MOREIRA ROMERO,SUPLENTE,PTB,PARTIDO TRABALHISTA BRASILEIRO,5
MIRASSOL,DEPUTADO ESTADUAL,PROFª SILVIA RENÇÃO,SILVIA REGINA RENÇÃO DOMINGOS,SUPLENTE,PTB,PARTIDO TRABALHISTA BRASILEIRO,1
MIRASSOL,DEPUTADO ESTADUAL,PROFESSORA ALBA LUCENA,ALBA LUCENA FERNANDES GANDIA,SUPLENTE,PTB,PARTIDO TRABALHISTA BRASILEIRO,6
MIRASSOL,DEPUTADO ESTADUAL,WALDIR AGNELLO,WALDIR AGNELLO,SUPLENTE,PTB,PARTIDO TRABALHISTA BRASILEIRO,147
MIRASSOL,DEPUTADO ESTADUAL,MUÇÃO,DJALMA LOPES DE SOUZA,SUPLENTE,PTB,PARTIDO TRABALHISTA BRASILEIRO,1
MIRASSOL,DEPUTADO ESTADUAL,AMELITO FIDELIS,AMELITO FIDELIS DOS SANTOS,SUPLENTE,PTB,PARTIDO TRABALHISTA BRASILEIRO,31
MIRASSOL,DEPUTADO ESTADUAL,BALEIA ROSSI,LUIZ FELIPE BALEIA TENUTO ROSSI,ELEITO,PMDB,PARTIDO DO MOVIMENTO DEMOCRÁTICO BRASILEIRO,35
MIRASSOL,DEPUTADO ESTADUAL,DRA ADRIANA,ADRIANA DI NARDO SILVA,SUPLENTE,PMDB,PARTIDO DO MOVIMENTO DEMOCRÁTICO BRASILEIRO,2
MIRASSOL,DEPUTADO ESTADUAL,REGINALDO NUNES,REGINALDO NUNES BEZERRA,SUPLENTE,PMDB,PARTIDO DO MOVIMENTO DEMOCRÁTICO BRASILEIRO,4
MIRASSOL,DEPUTADO ESTADUAL,THIAGO FERRARI,THIAGO DE MORAES FERRARI,SUPLENTE,PMDB,PARTIDO DO MOVIMENTO DEMOCRÁTICO BRASILEIRO,4
MIRASSOL,DEPUTADO ESTADUAL,DU TONIN,EDUARDO TONIN,SUPLENTE,PMDB,PARTIDO DO MOVIMENTO DEMOCRÁTICO BRASILEIRO,3
MIRASSOL,DEPUTADO ESTADUAL,CARUSO,JORGE LUIS CARUSO,ELEITO,PMDB,PARTIDO DO MOVIMENTO DEMOCRÁTICO BRASILEIRO,11
MIRASSOL,DEPUTADO ESTADUAL,MARQUINHOS SKALA,MARCOS DA SILVA MARQUES,SUPLENTE,PMDB,PARTIDO DO MOVIMENTO DEMOCRÁTICO BRASILEIRO,7
MIRASSOL,DEPUTADO ESTADUAL,VANESSA DAMO,VANESSA DAMO OROSCO,ELEITO,PMDB,PARTIDO DO MOVIMENTO DEMOCRÁTICO BRASILEIRO,8
MIRASSOL,DEPUTADO ESTADUAL,CHICO DA ADEGA,FRANCISCO PEREIRA GOMES,SUPLENTE,PMDB,PARTIDO DO MOVIMENTO DEMOCRÁTICO BRASILEIRO,4
MIRASSOL,DEPUTADO ESTADUAL,CAMARGO,DOMINGOS FERREIRA DE CAMARGO,SUPLENTE,PMDB,PARTIDO DO MOVIMENTO DEMOCRÁTICO BRASILEIRO,2
MIRASSOL,DEPUTADO ESTADUAL,VALDOMIRO,VALDOMIRO FRANCISCO DE OLIVEIRA,SUPLENTE,PMDB,PARTIDO DO MOVIMENTO DEMOCRÁTICO BRASILEIRO,18
MIRASSOL,DEPUTADO ESTADUAL,UEBE REZECK,UEBE REZECK,SUPLENTE,PMDB,PARTIDO DO MOVIMENTO DEMOCRÁTICO BRASILEIRO,235
MIRASSOL,DEPUTADO ESTADUAL,HABIB,GEORGES HABIB JARROUGE,SUPLENTE,PMDB,PARTIDO DO MOVIMENTO DEMOCRÁTICO BRASILEIRO,1
MIRASSOL,DEPUTADO ESTADUAL,GETULIO GOMES,GETULIO GOMES DA SILVA,SUPLENTE,PMDB,PARTIDO DO MOVIMENTO DEMOCRÁTICO BRASILEIRO,1
MIRASSOL,DEPUTADO ESTADUAL,ITAMAR BORGES,ITAMAR FRANCISCO MACHADO BORGES,MÉDIA,PMDB,PARTIDO DO MOVIMENTO DEMOCRÁTICO BRASILEIRO,700
MIRASSOL,DEPUTADO ESTADUAL,PALAMEDE,PALAMEDE DE JESUS CONSALTER JUNIOR,SUPLENTE,PMDB,PARTIDO DO MOVIMENTO DEMOCRÁTICO BRASILEIRO,3
MIRASSOL,DEPUTADO ESTADUAL,JONAS,JONAS PEREIRA DE LIMA,SUPLENTE,PMDB,PARTIDO DO MOVIMENTO DEMOCRÁTICO BRASILEIRO,5
MIRASSOL,DEPUTADO ESTADUAL,PR. BORGES,MARTINHO JOSÉ BORGES,SUPLENTE,PMDB,PARTIDO DO MOVIMENTO DEMOCRÁTICO BRASILEIRO,3
MIRASSOL,DEPUTADO ESTADUAL,MARIA DO CARMO GUILHERME,MARIA DO CARMO GUILHERME,SUPLENTE,PMDB,PARTIDO DO MOVIMENTO DEMOCRÁTICO BRASILEIRO,1
MIRASSOL,DEPUTADO ESTADUAL,ANGELA RAMALHO,ANGELA MARIA ANTUNES DE CARVALHO TAVARES,SUPLENTE,PMDB,PARTIDO DO MOVIMENTO DEMOCRÁTICO BRASILEIRO,1
MIRASSOL,DEPUTADO ESTADUAL,JOOJI HATO,JOOJI HATO,ELEITO,PMDB,PARTIDO DO MOVIMENTO DEMOCRÁTICO BRASILEIRO,10
MIRASSOL,DEPUTADO ESTADUAL,WENDERSON OLIVEIRA,WENDERSON OLIVEIRA DA SILVA,SUPLENTE,PMDB,PARTIDO DO MOVIMENTO DEMOCRÁTICO BRASILEIRO,1
MIRASSOL,DEPUTADO ESTADUAL,ANA PAULA ROSSI,ANA PAULA ROSSI DE ALMEIDA MAGDESIAN,SUPLENTE,PMDB,PARTIDO DO MOVIMENTO DEMOCRÁTICO BRASILEIRO,1
MIRASSOL,DEPUTADO ESTADUAL,COUTINHO JUNIOR,OSWALDO BARBOSA COUTINHO JUNIOR,SUPLENTE,PMDB,PARTIDO DO MOVIMENTO DEMOCRÁTICO BRASILEIRO,2
MIRASSOL,DEPUTADO ESTADUAL,OLIVEIRA JUNIOR,ELIO APARECIDO DE OLIVEIRA,SUPLENTE,PSC,HUMANISTA CRISTÃO ,1
MIRASSOL,DEPUTADO ESTADUAL,CELSO NASCIMENTO,CELSO BRAZ DO NASCIMENTO,SUPLENTE,PSC,HUMANISTA CRISTÃO ,254
MIRASSOL,DEPUTADO ESTADUAL,IVAN MELO,IVAN DE BARROS MELO,SUPLENTE,PSC,HUMANISTA CRISTÃO ,1
MIRASSOL,DEPUTADO ESTADUAL,ALAN NETO,ANTONIO CARLOS BARBOSA NEVES,SUPLENTE,PSC,HUMANISTA CRISTÃO ,1
MIRASSOL,DEPUTADO ESTADUAL,DR. CLAUDIO MIRANDA,CLAUDIO ERNANI MARCONDES DE MIRANDA,SUPLENTE,PSC,HUMANISTA CRISTÃO ,10
MIRASSOL,DEPUTADO ESTADUAL,LELIS TRAJANO,LELIS JOSE TRAJANO,SUPLENTE,PSC,HUMANISTA CRISTÃO ,1
MIRASSOL,DEPUTADO ESTADUAL,MERCIDES JUNIOR,MERCIDES FRANC PEREIRA DO CARMO,SUPLENTE,PSC,HUMANISTA CRISTÃO ,5
MIRASSOL,DEPUTADO ESTADUAL,JOAQUIM RUESCAS,JOAQUIM RUESCAS NETO,SUPLENTE,PSC,HUMANISTA CRISTÃO ,2
MIRASSOL,DEPUTADO ESTADUAL,PASTOR VIEIRA ROCHA,JOSE VIEIRA ROCHA,SUPLENTE,PSC,HUMANISTA CRISTÃO ,9
MIRASSOL,DEPUTADO ESTADUAL,PR. CARLOS CEZAR,CARLOS CEZAR DA SILVA,ELEITO,PSC,HUMANISTA CRISTÃO ,2
MIRASSOL,DEPUTADO ESTADUAL,GUIMARÃES,WALTER GUIMARÃES RODRIGUES,SUPLENTE,PSC,HUMANISTA CRISTÃO ,2
MIRASSOL,DEPUTADO ESTADUAL,JAIMINHO,JAIME DONIZETE PEREIRA,SUPLENTE,PSC,HUMANISTA CRISTÃO ,3
MIRASSOL,DEPUTADO ESTADUAL,LUIZ LAURO,LUIZ LAURO FERREIRA,SUPLENTE,PSC,HUMANISTA CRISTÃO ,2
MIRASSOL,DEPUTADO ESTADUAL,LUIZ BUENO,LUIZ CARLOS BUENO DA SILVA JUNIOR,SUPLENTE,PSC,HUMANISTA CRISTÃO ,1
MIRASSOL,DEPUTADO ESTADUAL,CAPITÃO LIDIO,LIDIO GUARIGLIA COSTA JUNIOR,SUPLENTE,PSC,HUMANISTA CRISTÃO ,2
MIRASSOL,DEPUTADO ESTADUAL,ADILSON ROSSI,ADILSON ROSSI,ELEITO,PSC,HUMANISTA CRISTÃO ,8
MIRASSOL,DEPUTADO ESTADUAL,MARIA CLELIA MARIN,MARIA CLELIA DILCIA CAPRILES MARIM,SUPLENTE,PSC,HUMANISTA CRISTÃO ,1
MIRASSOL,DEPUTADO ESTADUAL,RENATO PUPO,RENATO PUPO DE PAULA,SUPLENTE,PSC,HUMANISTA CRISTÃO ,613
MIRASSOL,DEPUTADO ESTADUAL,JOÃO BINATO,JOÃO ANTONIO BINATO,SUPLENTE,PSC,HUMANISTA CRISTÃO ,5
MIRASSOL,DEPUTADO ESTADUAL,WALTER CORDONI,WALTER CORDONI FILHO,SUPLENTE,PSC,HUMANISTA CRISTÃO ,1
MIRASSOL,DEPUTADO ESTADUAL,ATALAIA,JOSE ROBERTO DE OLIVEIRA,SUPLENTE,PSC,HUMANISTA CRISTÃO ,2
MIRASSOL,DEPUTADO ESTADUAL,CANDIDO,JOELSON CANDIDO DE OLIVEIRA,SUPLENTE,PSC,HUMANISTA CRISTÃO ,62
MIRASSOL,DEPUTADO ESTADUAL,GUSTAVO POZZI,GUSTAVO CAETANO POZZI DA CUNHA,SUPLENTE,PSC,HUMANISTA CRISTÃO ,7
MIRASSOL,DEPUTADO ESTADUAL,SAID MOURAD,AHMAD SAID MOURAD,SUPLENTE,PSC,HUMANISTA CRISTÃO ,14
MIRASSOL,DEPUTADO ESTADUAL,RODRIGO MORAES,RODRIGO AUGUSTO MORAES,ELEITO,PSC,HUMANISTA CRISTÃO ,126
MIRASSOL,DEPUTADO ESTADUAL,IVONE,IVONE APARECIDA LUCIA SILVA,SUPLENTE,PSC,HUMANISTA CRISTÃO ,1
MIRASSOL,DEPUTADO ESTADUAL,NELSON RODRIGUES,NELSON DOS SANTOS RODRIGUES,SUPLENTE,PSC,HUMANISTA CRISTÃO ,11
MIRASSOL,DEPUTADO ESTADUAL,NELSON FERNANDES,JOSE NELSON AGUIAR FERNANDES,SUPLENTE,PSC,HUMANISTA CRISTÃO ,3
MIRASSOL,DEPUTADO ESTADUAL,WALTER GOMES,WALTER GOMES DE OLIVEIRA,SUPLENTE,PR,SOMOS MAIS SÃO PAULO,2
MIRASSOL,DEPUTADO ESTADUAL,ANTONIO CARLOS DE MORAES,ANTONIO CARLOS DE MORAES,SUPLENTE,PR,SOMOS MAIS SÃO PAULO,1
MIRASSOL,DEPUTADO ESTADUAL,PAULO CORREA,PAULO HENRIQUE CORREA,SUPLENTE,PR,SOMOS MAIS SÃO PAULO,1
MIRASSOL,DEPUTADO ESTADUAL,JOSUE ROBERTO,JOSUE ROBERTO DA SILVA,SUPLENTE,PR,SOMOS MAIS SÃO PAULO,2
MIRASSOL,DEPUTADO ESTADUAL,ZE PEDRO,JOSE PEDRO LEITE DA SILVA,SUPLENTE,PR,SOMOS MAIS SÃO PAULO,37
MIRASSOL,DEPUTADO ESTADUAL,LILI AIMAR,LILIANA MEDEIROS DE ALMEIDA AYMAR BECHARA,SUPLENTE,PR,SOMOS MAIS SÃO PAULO,2
MIRASSOL,DEPUTADO ESTADUAL,ALEXANDRE DA FARMACIA,ALEXANDRE JOSE DA CUNHA,SUPLENTE,PR,SOMOS MAIS SÃO PAULO,1
MIRASSOL,DEPUTADO ESTADUAL,PATRICIA LIMA,PATRICIA FREITAS LIMA,SUPLENTE,PR,SOMOS MAIS SÃO PAULO,7
MIRASSOL,DEPUTADO ESTADUAL,JOSIAS DINIZ,JOSIAS ANTONIO DINIZ,SUPLENTE,PR,SOMOS MAIS SÃO PAULO,1
MIRASSOL,DEPUTADO ESTADUAL,JOSE JANTALIA,JOSE ANTONIO JANTALIA,SUPLENTE,PR,SOMOS MAIS SÃO PAULO,3
MIRASSOL,DEPUTADO ESTADUAL,ANDRE DO PRADO,ANDRE LUIS DO PRADO,ELEITO,PR,SOMOS MAIS SÃO PAULO,14
MIRASSOL,DEPUTADO ESTADUAL,EDUARDO REZEK,EDUARDO PEDROSO REZEK,SUPLENTE,PPS,PARTIDO POPULAR SOCIALISTA,16
MIRASSOL,DEPUTADO ESTADUAL,JOSE CARLOS SOARES,JOSE CARLOS SOARES,SUPLENTE,PPS,PARTIDO POPULAR SOCIALISTA,8
MIRASSOL,DEPUTADO ESTADUAL,PROFESSOR OSMIR PETRINI,OSMIR ANTONIO PETRINI,SUPLENTE,PPS,PARTIDO POPULAR SOCIALISTA,4
MIRASSOL,DEPUTADO ESTADUAL,SERGIO MORETTI,SERGIO MORETTI,SUPLENTE,PPS,PARTIDO POPULAR SOCIALISTA,4
MIRASSOL,DEPUTADO ESTADUAL,MAURICIO MIYA,MAURICIO MIYAZAKI,SUPLENTE,PPS,PARTIDO POPULAR SOCIALISTA,1
MIRASSOL,DEPUTADO ESTADUAL,BRAZ,BRAZ ANTUNES MATTOS NETO,SUPLENTE,PPS,PARTIDO POPULAR SOCIALISTA,3
MIRASSOL,DEPUTADO ESTADUAL,ADEMIR DA GUIA,ADEMIR DA GUIA,SUPLENTE,PPS,PARTIDO POPULAR SOCIALISTA,18
MIRASSOL,DEPUTADO ESTADUAL,DAVI ZAIA,DAVID ZAIA,MÉDIA,PPS,PARTIDO POPULAR SOCIALISTA,67
MIRASSOL,DEPUTADO ESTADUAL,MARCOS CHIEN,CHIEN CHIN HUEI,SUPLENTE,PPS,PARTIDO POPULAR SOCIALISTA,1
MIRASSOL,DEPUTADO ESTADUAL,DR TEDESCHI,ETEVALDO VIANA TEDESCHI,SUPLENTE,PPS,PARTIDO POPULAR SOCIALISTA,51
