PEDREIRA,DEPUTADO ESTADUAL,SAMUEL MOREIRA,SAMUEL MOREIRA DA SILVA JÚNIOR,ELEITO,PSDB,PSDB/DEM,3
PEDREIRA,DEPUTADO ESTADUAL,GAZOTTI,JOSÉ LUIZ GAZOTTI,SUPLENTE,PSDB,PSDB/DEM,2
PEDREIRA,DEPUTADO ESTADUAL,ADMIR FERRO,ADMIR DONIZETI FERRO,SUPLENTE,PSDB,PSDB/DEM,1
PEDREIRA,DEPUTADO ESTADUAL,CASSIO NAVARRO,CASSIO DE CASTRO NAVARRO,SUPLENTE,PSDB,PSDB/DEM,3
PEDREIRA,DEPUTADO ESTADUAL,CARLOS BEZERRA JR.,CARLOS ALBERTO DE QUADROS BEZERRA JUNIOR,ELEITO,PSDB,PSDB/DEM,15
PEDREIRA,DEPUTADO ESTADUAL,NÉVIO DÁRTORA,NÉVIO LUIZ ARANHA DÁRTORA,SUPLENTE,PSDB,PSDB/DEM,3
PEDREIRA,DEPUTADO ESTADUAL,MAURICIO PINTERICH,MAURICIO DE OLIVEIRA PINTERICH,SUPLENTE,PSDB,PSDB/DEM,16
PEDREIRA,DEPUTADO ESTADUAL,ANALICE FERNANDES,ANALICE FERNANDES,ELEITO,PSDB,PSDB/DEM,2
PEDREIRA,DEPUTADO ESTADUAL,CREUSA CAMARGO,CREUSA APARECIDA FRANCO DE CAMARGO,SUPLENTE,PSDB,PSDB/DEM,1
PEDREIRA,DEPUTADO ESTADUAL,FELIPE AUGUSTO,FELIPE AUGUSTO,SUPLENTE,PSDB,PSDB/DEM,6
PEDREIRA,DEPUTADO ESTADUAL,THIAGO LOBO,THIAGO ANTUNES CAVALCA REIS LOBO,SUPLENTE,PSDB,PSDB/DEM,3
PEDREIRA,DEPUTADO ESTADUAL,CAUÊ MACRIS,CAUÊ CASEIRO MACRIS,MÉDIA,PSDB,PSDB/DEM,5
PEDREIRA,DEPUTADO ESTADUAL,EDISON CANDIDO,EDISON APARECIDO CANDIDO,SUPLENTE,PSDB,PSDB/DEM,7
PEDREIRA,DEPUTADO ESTADUAL,CONCCI MARCO,ELIANE CONCEIÇÃO SILVA MENDES,SUPLENTE,PSDB,PSDB/DEM,8
PEDREIRA,DEPUTADO ESTADUAL,JOÃO SANZOVO,JOÃO SANZOVO NETO,SUPLENTE,PSDB,PSDB/DEM,2
PEDREIRA,DEPUTADO ESTADUAL,ZÉ AILTON,JOSE AILTON RIBEIRO,SUPLENTE,PSDB,PSDB/DEM,1
PEDREIRA,DEPUTADO ESTADUAL,VICTOR KOBAYASHI,VICTOR KOBAYASHI,SUPLENTE,PSDB,PSDB/DEM,660
PEDREIRA,DEPUTADO ESTADUAL,LUIZA FLEMING,LUIZA ASSIS FLEMING,SUPLENTE,PSDB,PSDB/DEM,1
PEDREIRA,DEPUTADO ESTADUAL,BARROS MUNHOZ,JOSE ANTONIO BARROS MUNHOZ,ELEITO,PSDB,PSDB/DEM,4677
PEDREIRA,DEPUTADO ESTADUAL,CELSO GIGLIO,CELSO ANTONIO GIGLIO,ELEITO,PSDB,PSDB/DEM,7
PEDREIRA,DEPUTADO ESTADUAL,FARID,JORGE FARID BOULOS BOU CHEBL,SUPLENTE,PSDB,PSDB/DEM,1
PEDREIRA,DEPUTADO ESTADUAL,HELIO NISHIMOTO,HELIO NISHIMOTO,ELEITO,PSDB,PSDB/DEM,6
PEDREIRA,DEPUTADO ESTADUAL,KATIA SOLIS,KATIA CRISTINA BELISARIO SOLIS,SUPLENTE,PSDB,PSDB/DEM,20
PEDREIRA,DEPUTADO ESTADUAL,PAULO ALEXANDRE BARBOSA,PAULO ALEXANDRE PEREIRA BARBOSA,ELEITO,PSDB,PSDB/DEM,257
PEDREIRA,DEPUTADO ESTADUAL,ARTUR ORSI,ARTUR CASSEB ORSI,SUPLENTE,PSDB,PSDB/DEM,14
PEDREIRA,DEPUTADO ESTADUAL,JOSE AUGUSTO,JOSE AUGUSTO DA SILVA RAMOS,SUPLENTE,PSDB,PSDB/DEM,1
PEDREIRA,DEPUTADO ESTADUAL,ORLANDO MORANDO,ORLANDO MORANDO JUNIOR,ELEITO,PSDB,PSDB/DEM,2
PEDREIRA,DEPUTADO ESTADUAL,FERNANDO CAPEZ,FERNANDO CAPEZ,ELEITO,PSDB,PSDB/DEM,53
PEDREIRA,DEPUTADO ESTADUAL,MILTON DALLARI,JOSÉ MILTON DALLARI SOARES,SUPLENTE,PSDB,PSDB/DEM,226
PEDREIRA,DEPUTADO ESTADUAL,DR RUBENS,RUBENS YOSHIDA,SUPLENTE,PSDB,PSDB/DEM,1
PEDREIRA,DEPUTADO ESTADUAL,IRMÃO SILAS,SILAS SANTOS SILVA,SUPLENTE,PSOL,PARTIDO SOCIALISMO E LIBERDADE,1
PEDREIRA,DEPUTADO ESTADUAL,BIULA,LUIZ MULLER SOUZA FARIA,SUPLENTE,PSOL,PARTIDO SOCIALISMO E LIBERDADE,2
PEDREIRA,DEPUTADO ESTADUAL,PROFESSOR EUCIMAR,EUCIMAR OLIVEIRA DE ALMEIDA,SUPLENTE,PSOL,PARTIDO SOCIALISMO E LIBERDADE,3
PEDREIRA,DEPUTADO ESTADUAL,RAUL MARCELO,RAUL MARCELO DE SOUZA,SUPLENTE,PSOL,PARTIDO SOCIALISMO E LIBERDADE,5
PEDREIRA,DEPUTADO ESTADUAL,GUIMARÃES O GUERREIRO,HERALDO LOPES GUIMARÃES,SUPLENTE,PSOL,PARTIDO SOCIALISMO E LIBERDADE,1
PEDREIRA,DEPUTADO ESTADUAL,CARLOS GIANNAZI,CARLOS ALBERTO GIANNASI,ELEITO,PSOL,PARTIDO SOCIALISMO E LIBERDADE,34
PEDREIRA,DEPUTADO ESTADUAL,WANDER,WANDER DE OLIVEIRA VILLALBA,SUPLENTE,PC DO B,PARTIDO COMUNISTA DO BRASIL,17
PEDREIRA,DEPUTADO ESTADUAL,ERLEI ALIADO,ERLEI ROBERTO DE MELO,SUPLENTE,PC DO B,PARTIDO COMUNISTA DO BRASIL,7
PEDREIRA,DEPUTADO ESTADUAL,LECI BRANDÃO,LECI BRANDAO DA SILVA,ELEITO,PC DO B,PARTIDO COMUNISTA DO BRASIL,16
PEDREIRA,DEPUTADO ESTADUAL,SARAH MUNHOZ,SARAH MUNHOZ,SUPLENTE,PC DO B,PARTIDO COMUNISTA DO BRASIL,3
PEDREIRA,DEPUTADO ESTADUAL,MAURIN DA SORVETERIA,MAURIN ALVES RIBEIRO,SUPLENTE,PC DO B,PARTIDO COMUNISTA DO BRASIL,1
PEDREIRA,DEPUTADO ESTADUAL,ALCIDES AMAZONAS,ALCIDES ARAUJO DOS SANTOS,SUPLENTE,PC DO B,PARTIDO COMUNISTA DO BRASIL,2
PEDREIRA,DEPUTADO ESTADUAL,JACIRA COSTA,JACIRA COSTA SILVA,SUPLENTE,PC DO B,PARTIDO COMUNISTA DO BRASIL,3
PEDREIRA,DEPUTADO ESTADUAL,EDISON CARDOSO DE SÁ,EDISON CARDOSO DE SÁ,SUPLENTE,PC DO B,PARTIDO COMUNISTA DO BRASIL,579
PEDREIRA,DEPUTADO ESTADUAL,PEDRO BIGARDI,PEDRO ANTONIO BIGARDI,ELEITO,PC DO B,PARTIDO COMUNISTA DO BRASIL,5
PEDREIRA,DEPUTADO ESTADUAL,FAUD SALOMÃO,FAUD SALOMÃO NETO,SUPLENTE,PC DO B,PARTIDO COMUNISTA DO BRASIL,1
PEDREIRA,DEPUTADO ESTADUAL,ROBERTO CARLOS BIANCHINI,ROBERTO CARLOS BIANCHINI,SUPLENTE,PC DO B,PARTIDO COMUNISTA DO BRASIL,13
PEDREIRA,DEPUTADO ESTADUAL,GABRIEL BITENCOURT,GABRIEL CESAR BITENCOURT,SUPLENTE,PC DO B,PARTIDO COMUNISTA DO BRASIL,3
PEDREIRA,DEPUTADO ESTADUAL,AMÂNCIO,AMÂNCIO JOSÉ DE LIMA FILHO,SUPLENTE,PC DO B,PARTIDO COMUNISTA DO BRASIL,1
PEDREIRA,DEPUTADO ESTADUAL,PROFESSOR FLAVIO DELMANTO,FLAVIO DELMANTO,SUPLENTE,PC DO B,PARTIDO COMUNISTA DO BRASIL,7
PEDREIRA,DEPUTADO ESTADUAL,BENASSI,SÉRGIO BENASSI,SUPLENTE,PC DO B,PARTIDO COMUNISTA DO BRASIL,4
PEDREIRA,DEPUTADO ESTADUAL,DR. BITTAR,JOSÉ EDUARDO FUSER BITTAR,SUPLENTE,PC DO B,PARTIDO COMUNISTA DO BRASIL,1
