TATUÍ,DEPUTADO ESTADUAL,JULIA ELIZABETH FONSECA,JULIA ELIZABETH FONSECA,SUPLENTE,PV,PARTIDO VERDE,1
TATUÍ,DEPUTADO ESTADUAL,HAMILTON LOMBARDI,HAMILTON LOMBARDI SOARES,SUPLENTE,PV,PARTIDO VERDE,2
TATUÍ,DEPUTADO ESTADUAL,ESTEVAM SILVA,ESTEVAM LUIZ ALMEIDA SILVA,SUPLENTE,PV,PARTIDO VERDE,1
TATUÍ,DEPUTADO ESTADUAL,VALDECK RIBEIRO,VALDECK RIBEIRO DOS SANTOS,SUPLENTE,PV,PARTIDO VERDE,1
TATUÍ,DEPUTADO ESTADUAL,ROSSINI,LUIZ CARLOS ROSSINI,SUPLENTE,PV,PARTIDO VERDE,2
TATUÍ,DEPUTADO ESTADUAL,DR PAULO DE TARSO,PAULO DE TARSO NUNES CHIODE,SUPLENTE,PV,PARTIDO VERDE,5
TATUÍ,DEPUTADO ESTADUAL,RITA PASSOS,RITA DE CASSIA TRINCA PASSOS,ELEITO,PV,PARTIDO VERDE,170
TATUÍ,DEPUTADO ESTADUAL,PADRE AFONSO,JOSÉ AFONSO LOBATO,ELEITO,PV,PARTIDO VERDE,13
TATUÍ,DEPUTADO ESTADUAL,NAVAL PELA GUARDA MUNICIPAL,MAURICIO DOMINGUES DA SILVA,SUPLENTE,PV,PARTIDO VERDE,45
TATUÍ,DEPUTADO ESTADUAL,BETO TRICOLI,JOSE ROBERTO TRICOLI,ELEITO,PV,PARTIDO VERDE,2
TATUÍ,DEPUTADO ESTADUAL,PEDRO FIORELLI,PEDRO HENRIQUE TEIXEIRA FIORELLI,SUPLENTE,PV,PARTIDO VERDE,19
TATUÍ,DEPUTADO ESTADUAL,CLODOALDO GAZZETTA,CLODOALDO ARMANDO GAZZETTA,SUPLENTE,PV,PARTIDO VERDE,2
TATUÍ,DEPUTADO ESTADUAL,BRAZ ALBERTINI,BRAZ AGOSTINHO ALBERTINI,SUPLENTE,PV,PARTIDO VERDE,16
TATUÍ,DEPUTADO ESTADUAL,SERRA,CLOVIS SERRA JUNIOR,SUPLENTE,PV,PARTIDO VERDE,1
TATUÍ,DEPUTADO ESTADUAL,ALBA SILVA,ALBA VALERIA DA SILVA,SUPLENTE,PV,PARTIDO VERDE,3
TATUÍ,DEPUTADO ESTADUAL,ROBERTO SOBRAL,ROBERTO GONZAGA SOBRAL,SUPLENTE,PV,PARTIDO VERDE,3
TATUÍ,DEPUTADO ESTADUAL,GILSON FICO,GILSON FICO,SUPLENTE,PV,PARTIDO VERDE,4
TATUÍ,DEPUTADO ESTADUAL,FERNANDO MARREY FERREIRA,FERNANDO MARREY FERREIRA,SUPLENTE,PV,PARTIDO VERDE,10
TATUÍ,DEPUTADO ESTADUAL,MÁRCIA MONTEZ,MÁRCIA REGINA MONTEZ HALASZ,SUPLENTE,PV,PARTIDO VERDE,5
TATUÍ,DEPUTADO ESTADUAL,PROFESSOR MARCEL FERRADA,MARCEL ARISTIDES FERRADA SILVA,SUPLENTE,PV,PARTIDO VERDE,2
TATUÍ,DEPUTADO ESTADUAL,CRISTINA DIAS,SELMA CRISTINA DIAS DA SILVA,SUPLENTE,PV,PARTIDO VERDE,1
TATUÍ,DEPUTADO ESTADUAL,DR. ULYSSES,ULYSSES MARIO TASSINARI,MÉDIA,PV,PARTIDO VERDE,37
TATUÍ,DEPUTADO ESTADUAL,REINALDO ALGUZ,REINALDO DE SOUZA ALGUZ,ELEITO,PV,PARTIDO VERDE,7
TATUÍ,DEPUTADO ESTADUAL,FLAVIO OLIVEIRA,FLAVIO HENRIQUE TEIXEIRA DE OLIVEIRA,SUPLENTE,PV,PARTIDO VERDE,2
TATUÍ,DEPUTADO ESTADUAL,JUNIOR RAAD,ANTONIOS YOUSSIF RAAD JUNIOR,SUPLENTE,PV,PARTIDO VERDE,1
TATUÍ,DEPUTADO ESTADUAL,SERGIO GEGERS,SERGIO DE CARVALHO GEGERS,SUPLENTE,PV,PARTIDO VERDE,1
TATUÍ,DEPUTADO ESTADUAL,PELE PROBLEMA,CARLOS ALBERTO ROSA,SUPLENTE,PV,PARTIDO VERDE,1
TATUÍ,DEPUTADO ESTADUAL,REGINA GONÇALVES,MARIA REGINA GONÇALVES,SUPLENTE,PV,PARTIDO VERDE,12
TATUÍ,DEPUTADO ESTADUAL,LIA,MARIA LUZIA CASSIMIRA CONSTANTINO,SUPLENTE,PV,PARTIDO VERDE,1
TATUÍ,DEPUTADO ESTADUAL,DOUGLAS SILVA,DOUGLAS DE OLIVEIRA SILVA,SUPLENTE,PV,PARTIDO VERDE,1
TATUÍ,DEPUTADO ESTADUAL,SATIRO,SATIRO CANDIDO,SUPLENTE,PV,PARTIDO VERDE,3
TATUÍ,DEPUTADO ESTADUAL,PEDRO DE SÁ,PEDRO DE SÁ FILHO,SUPLENTE,PV,PARTIDO VERDE,1
TATUÍ,DEPUTADO ESTADUAL,WELTON PEREIRA,WELTON PEREIRA DE JESUS,SUPLENTE,PV,PARTIDO VERDE,1
TATUÍ,DEPUTADO ESTADUAL,PROFESSOR EMERSON LIMA,EMERSON LIMA DOS SANTOS,SUPLENTE,PV,PARTIDO VERDE,17
TATUÍ,DEPUTADO ESTADUAL,NAGOYA,RONALDO RAMOS FAUSTINO,SUPLENTE,PV,PARTIDO VERDE,1
TATUÍ,DEPUTADO ESTADUAL,PASTOR DILMO DOS SANTOS,DILMO DOS SANTOS,ELEITO,PV,PARTIDO VERDE,213
TATUÍ,DEPUTADO ESTADUAL,DR MARCELO DOURADO,MARCELO DOURADO COELHO,SUPLENTE,PV,PARTIDO VERDE,2
TATUÍ,DEPUTADO ESTADUAL,ADENOR SILVA,ADENOR FERREIRA DA SILVA,SUPLENTE,PV,PARTIDO VERDE,8
TATUÍ,DEPUTADO ESTADUAL,JESSE LOURES,JESSE LOURES DE MORAES,SUPLENTE,PV,PARTIDO VERDE,20
TATUÍ,DEPUTADO ESTADUAL,PROFESSORA ANDREA,ANDREA ANA DIAS,SUPLENTE,PV,PARTIDO VERDE,1
TATUÍ,DEPUTADO ESTADUAL,DEBORAH VERISSIMO,DEBORAH ESTER VERISSIMO CAMARGO,SUPLENTE,PV,PARTIDO VERDE,3
TATUÍ,DEPUTADO ESTADUAL,MARCOS PAPA,MARCOS ANDRÉ PAPA,SUPLENTE,PV,PARTIDO VERDE,2
TATUÍ,DEPUTADO ESTADUAL,DOUTOR KIM,SEONG SOO KIM,SUPLENTE,PV,PARTIDO VERDE,6
TATUÍ,DEPUTADO ESTADUAL,ELIANE MIRANDA,ELIANE MARIA MIRANDA,SUPLENTE,PV,PARTIDO VERDE,1
TATUÍ,DEPUTADO ESTADUAL,CARLOS ANDRADE,CARLOS ALBERTO APARECIDO DE ANDRADE,SUPLENTE,PV,PARTIDO VERDE,4
TATUÍ,DEPUTADO ESTADUAL,SÉRGIO CONTENTE,SERGIO CONTENTE,SUPLENTE,PV,PARTIDO VERDE,4
TATUÍ,DEPUTADO ESTADUAL,DR FLAVIO,FLAVIO ISAIAS RODRIGUES,SUPLENTE,PV,PARTIDO VERDE,4
TATUÍ,DEPUTADO ESTADUAL,ELENICE GALVÃO,ELENICE APARECIDA ALVES GALVAO,SUPLENTE,PV,PARTIDO VERDE,1
TATUÍ,DEPUTADO ESTADUAL,RICARDO BURJATO,RICARDO BURJATO,SUPLENTE,PV,PARTIDO VERDE,1
TATUÍ,DEPUTADO ESTADUAL,MARISA PORRETA,MARISA RODRIGUES CUSTODIO,SUPLENTE,PV,PARTIDO VERDE,1
TATUÍ,DEPUTADO ESTADUAL,HELIO RUBENS,HELIO RUBENS GONÇALVES FIGUEIREDO,SUPLENTE,PSDB,PSDB/DEM,16
TATUÍ,DEPUTADO ESTADUAL,PROFESSOR BETO VARUSSA,JOSÉ ROBERTO VARUSSA,SUPLENTE,PSDB,PSDB/DEM,6
TATUÍ,DEPUTADO ESTADUAL,IVONE FERNANDES,IVONE FERNANDES DIAS DO NASCIMENTO,SUPLENTE,PSDB,PSDB/DEM,2
TATUÍ,DEPUTADO ESTADUAL,JOSÉ URSILIO,JOSE URSILIO DE SOUZA E SILVA,SUPLENTE,PSDB,PSDB/DEM,1
TATUÍ,DEPUTADO ESTADUAL,MARIA HELENA LYA,MARIA HELENA DA SILVA RAMALHO,SUPLENTE,PSDB,PSDB/DEM,1
TATUÍ,DEPUTADO ESTADUAL,UBIRAJARA GUIMARÃES,UBIRAJARA PEREIRA GUIMARÃES,SUPLENTE,PSDB,PSDB/DEM,21
TATUÍ,DEPUTADO ESTADUAL,WILLIAM FERRAZ,WILIAN FERRAZ,SUPLENTE,PSDB,PSDB/DEM,1
TATUÍ,DEPUTADO ESTADUAL,MARIA ZEFERINA BALDAIA,MARIA ZEFERINA RODRIGUES BALDAIA,SUPLENTE,PSDB,PSDB/DEM,5
TATUÍ,DEPUTADO ESTADUAL,VALDIR CAMPOS,VALDIR CAMPOS COSTA,SUPLENTE,PSDB,PSDB/DEM,2
TATUÍ,DEPUTADO ESTADUAL,DR ENIO SANTINELLI,ENIO SANTINELLI,SUPLENTE,PSDB,PSDB/DEM,4
TATUÍ,DEPUTADO ESTADUAL,EVANDRO LOSACCO,EVANDRO LUIZ LOSACCO,SUPLENTE,PSDB,PSDB/DEM,659
TATUÍ,DEPUTADO ESTADUAL,FEITOSA,JOSE FRANCISCO SOARES FEITOSA,SUPLENTE,PSDB,PSDB/DEM,6
TATUÍ,DEPUTADO ESTADUAL,MARCONES,MARCONES EDSON VICTOR,SUPLENTE,PSDB,PSDB/DEM,1
TATUÍ,DEPUTADO ESTADUAL,PROF MIGUEL HEREDIA,MIGUEL ANDERSON HEREDIA DE SÁ,SUPLENTE,PSDB,PSDB/DEM,1
TATUÍ,DEPUTADO ESTADUAL,PEDRO TOBIAS,PEDRO TOBIAS,ELEITO,PSDB,PSDB/DEM,1277
TATUÍ,DEPUTADO ESTADUAL,MILTON FLAVIO,MILTON FLAVIO MARQUES LAUTENSCHLAGER,SUPLENTE,PSDB,PSDB/DEM,147
TATUÍ,DEPUTADO ESTADUAL,GERALDO VINHOLI,GERALDO ANTONIO VINHOLI,SUPLENTE,PSDB,PSDB/DEM,6
TATUÍ,DEPUTADO ESTADUAL,MARIA LÚCIA AMARY,MARIA LÚCIA CARDOSO PINTO AMARY,MÉDIA,PSDB,PSDB/DEM,373
TATUÍ,DEPUTADO ESTADUAL,TÂNIA FERRAZ,TÂNIA MARIA FERRAZ MARGONI,SUPLENTE,PSDB,PSDB/DEM,1
TATUÍ,DEPUTADO ESTADUAL,HEITOR SERTAO,HEITOR SERTÃO,SUPLENTE,PSDB,PSDB/DEM,7
TATUÍ,DEPUTADO ESTADUAL,RAMALHO DA CONSTRUCAO,ANTONIO DE SOUSA RAMALHO,SUPLENTE,PSDB,PSDB/DEM,14
TATUÍ,DEPUTADO ESTADUAL,WELSON GASPARINI,WELSON GASPARINI,SUPLENTE,PSDB,PSDB/DEM,36
TATUÍ,DEPUTADO ESTADUAL,MAURO BRAGATO,MAURO BRAGATO,ELEITO,PSDB,PSDB/DEM,5
TATUÍ,DEPUTADO ESTADUAL,DR. RICARDO MARTINS,RICARDO MARTINS DE SÃO JOSÉ JUNIOR,SUPLENTE,PSDB,PSDB/DEM,1
TATUÍ,DEPUTADO ESTADUAL,JOÃO CARAMEZ,JOÃO CARLOS CARAMEZ,ELEITO,PSDB,PSDB/DEM,12
TATUÍ,DEPUTADO ESTADUAL,BRUNO COVAS,BRUNO COVAS LOPES,ELEITO,PSDB,PSDB/DEM,101
TATUÍ,DEPUTADO ESTADUAL,BERNARDO ORTIZ JR,JOSE BERNARDO ORTIZ MONTEIRO JUNIOR,SUPLENTE,PSDB,PSDB/DEM,12
TATUÍ,DEPUTADO ESTADUAL,CLOVIS CHAVES,CLOVIS LUIZ CHAVES,SUPLENTE,PSDB,PSDB/DEM,2
TATUÍ,DEPUTADO ESTADUAL,ROBERTO ENGLER,ROBERTO CARVALHO ENGLER PINTO,ELEITO,PSDB,PSDB/DEM,4
TATUÍ,DEPUTADO ESTADUAL,CELINO,JUSCELINO CARDOSO DE SÁ,ELEITO,PSDB,PSDB/DEM,21
TATUÍ,DEPUTADO ESTADUAL,ARY FOSSEN,ARY FOSSEN,ELEITO,PSDB,PSDB/DEM,9
TATUÍ,DEPUTADO ESTADUAL,CORONEL JAIR PACA,JAIR PACA DE LIMA,SUPLENTE,PSDB,PSDB/DEM,7
TATUÍ,DEPUTADO ESTADUAL,RICARDO TEIXEIRA,RICARDO TEIXEIRA,SUPLENTE,PSDB,PSDB/DEM,4
TATUÍ,DEPUTADO ESTADUAL,JOSE BORANGA,JOSE AURELIO BORANGA,SUPLENTE,PSDB,PSDB/DEM,299
TATUÍ,DEPUTADO ESTADUAL,WILMA MALTA,WILMA DE FREITAS MALTA,SUPLENTE,PSDB,PSDB/DEM,2
TATUÍ,DEPUTADO ESTADUAL,CÉLIA LEÃO,CÉLIA CAMARGO LEÃO EDELMUTH,ELEITO,PSDB,PSDB/DEM,21
TATUÍ,DEPUTADO ESTADUAL,ADOLFO QUINTAS,ADOLFO QUINTAS GONÇALVES NETO,SUPLENTE,PSDB,PSDB/DEM,22
TATUÍ,DEPUTADO ESTADUAL,BORELI,OSWALDO LUIZ OLIVEIRA BORRELLI,SUPLENTE,PSDB,PSDB/DEM,2
TATUÍ,DEPUTADO ESTADUAL,VITO ARDITO,VITO ARDITO LERARIO,SUPLENTE,PSDB,PSDB/DEM,4
TATUÍ,DEPUTADO ESTADUAL,CARLÃO PIGNATARI,CARLOS EDUARDO PIGNATARI,ELEITO,PSDB,PSDB/DEM,20
TATUÍ,DEPUTADO ESTADUAL,DILADOR BORGES,DILADOR BORGES DAMASCENO,SUPLENTE,PSDB,PSDB/DEM,2
TATUÍ,DEPUTADO ESTADUAL,FORDINHO,ANTONIO CARLOS DE FARIA,SUPLENTE,PSDB,PSDB/DEM,27
TATUÍ,DEPUTADO ESTADUAL,SAMUEL MOREIRA,SAMUEL MOREIRA DA SILVA JÚNIOR,ELEITO,PSDB,PSDB/DEM,16398
TATUÍ,DEPUTADO ESTADUAL,GAZOTTI,JOSÉ LUIZ GAZOTTI,SUPLENTE,PSDB,PSDB/DEM,1
TATUÍ,DEPUTADO ESTADUAL,ADMIR FERRO,ADMIR DONIZETI FERRO,SUPLENTE,PSDB,PSDB/DEM,28
TATUÍ,DEPUTADO ESTADUAL,CASSIO NAVARRO,CASSIO DE CASTRO NAVARRO,SUPLENTE,PSDB,PSDB/DEM,43
TATUÍ,DEPUTADO ESTADUAL,CARLOS BEZERRA JR.,CARLOS ALBERTO DE QUADROS BEZERRA JUNIOR,ELEITO,PSDB,PSDB/DEM,566
TATUÍ,DEPUTADO ESTADUAL,CARLOS ALBERTO SANTOS,CARLOS ALBERTO DE OLIVEIRA SANTOS,SUPLENTE,PSDB,PSDB/DEM,15
TATUÍ,DEPUTADO ESTADUAL,NÉVIO DÁRTORA,NÉVIO LUIZ ARANHA DÁRTORA,SUPLENTE,PSDB,PSDB/DEM,1
TATUÍ,DEPUTADO ESTADUAL,MAURICIO PINTERICH,MAURICIO DE OLIVEIRA PINTERICH,SUPLENTE,PSDB,PSDB/DEM,12
TATUÍ,DEPUTADO ESTADUAL,ANALICE FERNANDES,ANALICE FERNANDES,ELEITO,PSDB,PSDB/DEM,26
TATUÍ,DEPUTADO ESTADUAL,DRA MARY,MARY LUCIA FRANCISCO,SUPLENTE,PSDB,PSDB/DEM,2
TATUÍ,DEPUTADO ESTADUAL,FELIPE AUGUSTO,FELIPE AUGUSTO,SUPLENTE,PSDB,PSDB/DEM,7
TATUÍ,DEPUTADO ESTADUAL,THIAGO LOBO,THIAGO ANTUNES CAVALCA REIS LOBO,SUPLENTE,PSDB,PSDB/DEM,14
TATUÍ,DEPUTADO ESTADUAL,CAUÊ MACRIS,CAUÊ CASEIRO MACRIS,MÉDIA,PSDB,PSDB/DEM,547
TATUÍ,DEPUTADO ESTADUAL,EDISON CANDIDO,EDISON APARECIDO CANDIDO,SUPLENTE,PSDB,PSDB/DEM,8
TATUÍ,DEPUTADO ESTADUAL,CONCCI MARCO,ELIANE CONCEIÇÃO SILVA MENDES,SUPLENTE,PSDB,PSDB/DEM,20
TATUÍ,DEPUTADO ESTADUAL,JOÃO SANZOVO,JOÃO SANZOVO NETO,SUPLENTE,PSDB,PSDB/DEM,9
TATUÍ,DEPUTADO ESTADUAL,ROBERTO MASSAFERA,ROBERTO MASSAFERA,ELEITO,PSDB,PSDB/DEM,4
TATUÍ,DEPUTADO ESTADUAL,ZÉ AILTON,JOSE AILTON RIBEIRO,SUPLENTE,PSDB,PSDB/DEM,423
TATUÍ,DEPUTADO ESTADUAL,VICTOR KOBAYASHI,VICTOR KOBAYASHI,SUPLENTE,PSDB,PSDB/DEM,22
TATUÍ,DEPUTADO ESTADUAL,LUIZA FLEMING,LUIZA ASSIS FLEMING,SUPLENTE,PSDB,PSDB/DEM,1
TATUÍ,DEPUTADO ESTADUAL,OLAVO DONATO,JOÃO OLAVO DE DONATO,SUPLENTE,PSDB,PSDB/DEM,1
TATUÍ,DEPUTADO ESTADUAL,BARROS MUNHOZ,JOSE ANTONIO BARROS MUNHOZ,ELEITO,PSDB,PSDB/DEM,20
TATUÍ,DEPUTADO ESTADUAL,CELSO GIGLIO,CELSO ANTONIO GIGLIO,ELEITO,PSDB,PSDB/DEM,44
TATUÍ,DEPUTADO ESTADUAL,HELIO NISHIMOTO,HELIO NISHIMOTO,ELEITO,PSDB,PSDB/DEM,14
TATUÍ,DEPUTADO ESTADUAL,PASTOR OTACÍLIO,OTACÍLIO JÚLIO DE OLIVEIRA,SUPLENTE,PSDB,PSDB/DEM,1
TATUÍ,DEPUTADO ESTADUAL,KATIA SOLIS,KATIA CRISTINA BELISARIO SOLIS,SUPLENTE,PSDB,PSDB/DEM,3
TATUÍ,DEPUTADO ESTADUAL,PAULO ALEXANDRE BARBOSA,PAULO ALEXANDRE PEREIRA BARBOSA,ELEITO,PSDB,PSDB/DEM,651
TATUÍ,DEPUTADO ESTADUAL,ARTUR ORSI,ARTUR CASSEB ORSI,SUPLENTE,PSDB,PSDB/DEM,4
TATUÍ,DEPUTADO ESTADUAL,GILSON BARRETO,GILSON ALMEIDA BARRETO,SUPLENTE,PSDB,PSDB/DEM,23
TATUÍ,DEPUTADO ESTADUAL,JOÃO NILTON DO UNIÃO SERV,JOÃO NILTON GONÇALVES,SUPLENTE,PSDB,PSDB/DEM,1
TATUÍ,DEPUTADO ESTADUAL,JOSE AUGUSTO,JOSE AUGUSTO DA SILVA RAMOS,SUPLENTE,PSDB,PSDB/DEM,12
TATUÍ,DEPUTADO ESTADUAL,ORLANDO MORANDO,ORLANDO MORANDO JUNIOR,ELEITO,PSDB,PSDB/DEM,5
TATUÍ,DEPUTADO ESTADUAL,FERNANDO CAPEZ,FERNANDO CAPEZ,ELEITO,PSDB,PSDB/DEM,158
TATUÍ,DEPUTADO ESTADUAL,MARCUS NAZARETH PEÇANHA,MARCUS NAZARETH PEÇANHA,SUPLENTE,PSDB,PSDB/DEM,2
TATUÍ,DEPUTADO ESTADUAL,THIAGO SATURNINO,THIAGO SATURNINO BARBOSA BELLO,SUPLENTE,PSDB,PSDB/DEM,1
TATUÍ,DEPUTADO ESTADUAL,JANICE,JANICE MASSABNI MARTINS,SUPLENTE,PSDB,PSDB/DEM,5
TATUÍ,DEPUTADO ESTADUAL,JOSÉ LUIZ RIBEIRO,JOSÉ LUIZ RIBEIRO,SUPLENTE,PSDB,PSDB/DEM,139
TATUÍ,DEPUTADO ESTADUAL,MARCOS ZERBINI,MARCOS ANTONIO ZERBINI,ELEITO,PSDB,PSDB/DEM,1
TATUÍ,DEPUTADO ESTADUAL,MILTON DALLARI,JOSÉ MILTON DALLARI SOARES,SUPLENTE,PSDB,PSDB/DEM,87
TATUÍ,DEPUTADO ESTADUAL,DIOBEL DA DIDOL'S,DIOBEL DE LIMA FERNANDES,SUPLENTE,PSDB,PSDB/DEM,14
TATUÍ,DEPUTADO ESTADUAL,PROFª ROSANA,MARIA ROSANA FERRARI NASSAR,SUPLENTE,PSDB,PSDB/DEM,13
TATUÍ,DEPUTADO ESTADUAL,DR RUBENS,RUBENS YOSHIDA,SUPLENTE,PSDB,PSDB/DEM,2
TATUÍ,DEPUTADO ESTADUAL,CLÁUDIO FURQUIM,CLÁUDIO SIMÕES FURQUIM LEITE JÚNIOR,SUPLENTE,PSDB,PSDB/DEM,4
TATUÍ,DEPUTADO ESTADUAL,SONIA IERVOLINO,SONIA ANTONIA CARDAMONE IERVOLINO DE OLIVEIRA,SUPLENTE,PSDB,PSDB/DEM,1
TATUÍ,DEPUTADO ESTADUAL,IRMÃO SILAS,SILAS SANTOS SILVA,SUPLENTE,PSOL,PARTIDO SOCIALISMO E LIBERDADE,1
TATUÍ,DEPUTADO ESTADUAL,BIULA,LUIZ MULLER SOUZA FARIA,SUPLENTE,PSOL,PARTIDO SOCIALISMO E LIBERDADE,1
TATUÍ,DEPUTADO ESTADUAL,LUIZINHO DA FAVELA,LUIZ JOÃO DE SOUZA,SUPLENTE,PSOL,PARTIDO SOCIALISMO E LIBERDADE,1
TATUÍ,DEPUTADO ESTADUAL,PAULO ZEMUNER,PAULO ALEXANDRE ZEMUNER DO SANTOS,SUPLENTE,PSOL,PARTIDO SOCIALISMO E LIBERDADE,1
TATUÍ,DEPUTADO ESTADUAL,WILLAMS ARIS,WILLAMS ALVES DA SILVA,SUPLENTE,PSOL,PARTIDO SOCIALISMO E LIBERDADE,2
TATUÍ,DEPUTADO ESTADUAL,PROFESSOR ALTAIR,ALTAIR LOURENÇO DE LIMA,SUPLENTE,PSOL,PARTIDO SOCIALISMO E LIBERDADE,3
TATUÍ,DEPUTADO ESTADUAL,JORGE NELSON,JORGE NELSON DA SILVA AMARAL,SUPLENTE,PSOL,PARTIDO SOCIALISMO E LIBERDADE,1
TATUÍ,DEPUTADO ESTADUAL,ANA CAROLINA CORREIA,ANA CAROLINA CORREIA,SUPLENTE,PSOL,PARTIDO SOCIALISMO E LIBERDADE,1
TATUÍ,DEPUTADO ESTADUAL,JOÃO ALFREDO,JOÃO ALFREDO DE OLIVEIRA,SUPLENTE,PSOL,PARTIDO SOCIALISMO E LIBERDADE,19
TATUÍ,DEPUTADO ESTADUAL,RAUL MARCELO,RAUL MARCELO DE SOUZA,SUPLENTE,PSOL,PARTIDO SOCIALISMO E LIBERDADE,181
TATUÍ,DEPUTADO ESTADUAL,EDUARDO AMARAL,EDUARDO GARCIA CARVALHO DO AMARAL,SUPLENTE,PSOL,PARTIDO SOCIALISMO E LIBERDADE,1
TATUÍ,DEPUTADO ESTADUAL,GUIMARÃES O GUERREIRO,HERALDO LOPES GUIMARÃES,SUPLENTE,PSOL,PARTIDO SOCIALISMO E LIBERDADE,4
TATUÍ,DEPUTADO ESTADUAL,CARLOS GIANNAZI,CARLOS ALBERTO GIANNASI,ELEITO,PSOL,PARTIDO SOCIALISMO E LIBERDADE,101
TATUÍ,DEPUTADO ESTADUAL,PROFESSOR WILSON,WILSON FERREIRA DA SILVA JUNIOR,SUPLENTE,PSOL,PARTIDO SOCIALISMO E LIBERDADE,1
TATUÍ,DEPUTADO ESTADUAL,WANDER,WANDER DE OLIVEIRA VILLALBA,SUPLENTE,PC DO B,PARTIDO COMUNISTA DO BRASIL,21
TATUÍ,DEPUTADO ESTADUAL,JOSELITO,JOSELITO DE SOUSA LIMA,SUPLENTE,PC DO B,PARTIDO COMUNISTA DO BRASIL,14
TATUÍ,DEPUTADO ESTADUAL,ERLEI ALIADO,ERLEI ROBERTO DE MELO,SUPLENTE,PC DO B,PARTIDO COMUNISTA DO BRASIL,15
TATUÍ,DEPUTADO ESTADUAL,LUIZA CORDEIRO,LUIZA CORDEIRO DA SILVA,SUPLENTE,PC DO B,PARTIDO COMUNISTA DO BRASIL,2
TATUÍ,DEPUTADO ESTADUAL,LECI BRANDÃO,LECI BRANDAO DA SILVA,ELEITO,PC DO B,PARTIDO COMUNISTA DO BRASIL,81
TATUÍ,DEPUTADO ESTADUAL,SARAH MUNHOZ,SARAH MUNHOZ,SUPLENTE,PC DO B,PARTIDO COMUNISTA DO BRASIL,42
TATUÍ,DEPUTADO ESTADUAL,MAURIN DA SORVETERIA,MAURIN ALVES RIBEIRO,SUPLENTE,PC DO B,PARTIDO COMUNISTA DO BRASIL,5
TATUÍ,DEPUTADO ESTADUAL,JACIRA COSTA,JACIRA COSTA SILVA,SUPLENTE,PC DO B,PARTIDO COMUNISTA DO BRASIL,15
TATUÍ,DEPUTADO ESTADUAL,PEDRO BIGARDI,PEDRO ANTONIO BIGARDI,ELEITO,PC DO B,PARTIDO COMUNISTA DO BRASIL,2
TATUÍ,DEPUTADO ESTADUAL,DAVI RAMOS,DAVI GONÇALVES RAMOS,SUPLENTE,PC DO B,PARTIDO COMUNISTA DO BRASIL,36
TATUÍ,DEPUTADO ESTADUAL,GABRIEL BITENCOURT,GABRIEL CESAR BITENCOURT,SUPLENTE,PC DO B,PARTIDO COMUNISTA DO BRASIL,218
TATUÍ,DEPUTADO ESTADUAL,CAJU,RICARDO ALVES DA SILVA,SUPLENTE,PC DO B,PARTIDO COMUNISTA DO BRASIL,17
TATUÍ,DEPUTADO ESTADUAL,PROFESSOR FLAVIO DELMANTO,FLAVIO DELMANTO,SUPLENTE,PC DO B,PARTIDO COMUNISTA DO BRASIL,9
TATUÍ,DEPUTADO ESTADUAL,DITÃO DO CORREIO,BENEDITO GOMES DOS REIS,SUPLENTE,PC DO B,PARTIDO COMUNISTA DO BRASIL,1
TATUÍ,DEPUTADO ESTADUAL,MANOEL MARUYAMA,SEVERINO MANOEL MARUYAMA SANTOS,SUPLENTE,PC DO B,PARTIDO COMUNISTA DO BRASIL,1
TATUÍ,DEPUTADO ESTADUAL,ZÉ ROBERTO,JOSE ROBERTO SILVA DOS SANTOS,SUPLENTE,PC DO B,PARTIDO COMUNISTA DO BRASIL,2
TATUÍ,DEPUTADO ESTADUAL,TAVARES,JOSÉ WALTER TAVARES,SUPLENTE,PC DO B,PARTIDO COMUNISTA DO BRASIL,2
TATUÍ,DEPUTADO ESTADUAL,JORJÃO,JORGE TAVARES QUINTAS,SUPLENTE,PC DO B,PARTIDO COMUNISTA DO BRASIL,1
TATUÍ,DEPUTADO ESTADUAL,JESOMAR LOBO,JESOMAR ALVES LOBO,SUPLENTE,PC DO B,PARTIDO COMUNISTA DO BRASIL,1
TATUÍ,DEPUTADO ESTADUAL,HELIFAX,HELIFAX PINTO DE SOUZA,SUPLENTE,PC DO B,PARTIDO COMUNISTA DO BRASIL,21
TATUÍ,DEPUTADO ESTADUAL,VALERIO,VALERIO ANTONIO GALANTE,SUPLENTE,PC DO B,PARTIDO COMUNISTA DO BRASIL,10
TATUÍ,DEPUTADO ESTADUAL,DR. BITTAR,JOSÉ EDUARDO FUSER BITTAR,SUPLENTE,PC DO B,PARTIDO COMUNISTA DO BRASIL,1
TATUÍ,DEPUTADO ESTADUAL,FABIO LEITÃO,FABIO JOSE DOS SANTOS,SUPLENTE,PT DO B,SOMOS MAIS SÃO PAULO,2
TATUÍ,DEPUTADO ESTADUAL,NICANOR BARBOSA,NICANOR OLIVEIRA BARBOSA,SUPLENTE,PT DO B,SOMOS MAIS SÃO PAULO,1
TATUÍ,DEPUTADO ESTADUAL,TONINHO CAMPANHA,ANTONIO LAURO CAMPANHA,SUPLENTE,PT DO B,SOMOS MAIS SÃO PAULO,9
TATUÍ,DEPUTADO ESTADUAL,EVANDRO DE LIMA,EVANDRO DE LIMA,SUPLENTE,PT DO B,SOMOS MAIS SÃO PAULO,1
TATUÍ,DEPUTADO ESTADUAL,PAULO CORRÊA JR,PAULO ALVES CORRÊA JUNIOR,SUPLENTE,PT DO B,SOMOS MAIS SÃO PAULO,35
