PEDREIRA,PRESIDENTE,DILMA,DILMA VANA ROUSSEFF,2º TURNO,PT,PARA O BRASIL SEGUIR MUDANDO,7943
PEDREIRA,PRESIDENTE,JOSÉ SERRA,JOSÉ SERRA,2º TURNO,PSDB,O BRASIL PODE MAIS,11491
PEDREIRA,GOVERNADOR,GERALDO ALCKMIN,GERALDO JOSE RODRIGUES ALCKMIN FILHO,ELEITO,PSDB,UNIDOS POR SÃO PAULO,12381
PEDREIRA,SENADOR,MARTA SUPLICY,MARTA SUPLICY,ELEITO,PT,UNIÃO PARA MUDAR,7414
PEDREIRA,SENADOR,ALOYSIO NUNES,ALOYSIO NUNES FERREIRA FILHO,ELEITO,PSDB,UNIDOS POR SÃO PAULO,12945
PEDREIRA,DEPUTADO FEDERAL,DR. ELIEZER COSTA,ELIEZER NASCIMENTO DA COSTA,SUPLENTE,PRB,JUNTOS POR SÃO PAULO,4
PEDREIRA,DEPUTADO FEDERAL,CÉSAR CRUZ GARCIA,CESAR CRUZ GARCIA,SUPLENTE,PRB,JUNTOS POR SÃO PAULO,1
PEDREIRA,DEPUTADO FEDERAL,ANTONIO BULHÕES,ANTONIO CARLOS MARTINS DE BULHÕES,ELEITO,PRB,JUNTOS POR SÃO PAULO,1
PEDREIRA,DEPUTADO FEDERAL,ELCIO AMANCIO,ELCIO AMÂNCIO,SUPLENTE,PRB,JUNTOS POR SÃO PAULO,1
PEDREIRA,DEPUTADO FEDERAL,OTONIEL LIMA,OTONIEL CARLOS DE LIMA,MÉDIA,PRB,JUNTOS POR SÃO PAULO,100
PEDREIRA,DEPUTADO FEDERAL,MALUF,PAULO SALIM MALUF,ELEITO,PP,PARTIDO PROGRESSISTA,155
PEDREIRA,DEPUTADO FEDERAL,RUBENEUTON OLIVEIRA LIMA,RUBENEUTON OLIVEIRA LIMA,SUPLENTE,PP,PARTIDO PROGRESSISTA,2
PEDREIRA,DEPUTADO FEDERAL,ANGINHO DOS TECLADOS,ANGELO MARINHO DE ALMEIDA,SUPLENTE,PP,PARTIDO PROGRESSISTA,1
PEDREIRA,DEPUTADO FEDERAL,CAPITÃO GOMES,CARLOS GOMES DA SILVA,SUPLENTE,PP,PARTIDO PROGRESSISTA,1
PEDREIRA,DEPUTADO FEDERAL,BATORÉ,IVANILDO GOMES NOGUEIRA,SUPLENTE,PP,PARTIDO PROGRESSISTA,3
PEDREIRA,DEPUTADO FEDERAL,MANOEL MOREIRA,MANOEL MOREIRA DE ARAUJO FILHO,SUPLENTE,PP,PARTIDO PROGRESSISTA,2
PEDREIRA,DEPUTADO FEDERAL,MAURICIO MARTINS,MAURICIO LUIS MARTINS,SUPLENTE,PP,PARTIDO PROGRESSISTA,1
PEDREIRA,DEPUTADO FEDERAL,PEDRINHO BARACAT,ASSAD NACLE BARACAT,SUPLENTE,PP,PARTIDO PROGRESSISTA,15
PEDREIRA,DEPUTADO FEDERAL,ALINE CORREA,ALINE LEMOS CORREA DE OLIVEIRA ANDRADE,ELEITO,PP,PARTIDO PROGRESSISTA,76
PEDREIRA,DEPUTADO FEDERAL,DRA ADRIANA DA COSTA,ADRIANA ALVARES DA COSTA DE PAULA ALVES,SUPLENTE,PP,PARTIDO PROGRESSISTA,1
PEDREIRA,DEPUTADO FEDERAL,BETO MANSUR,PAULO ROBERTO GOMES MANSUR,ELEITO,PP,PARTIDO PROGRESSISTA,7
PEDREIRA,DEPUTADO FEDERAL,ADHEMAR DE BARROS FILHO,ADHEMAR DE BARROS FILHO,SUPLENTE,PP,PARTIDO PROGRESSISTA,1
PEDREIRA,DEPUTADO FEDERAL,MISSIONÁRIO JOSÉ OLIMPIO,JOSÉ OLIMPIO SILVEIRA MORAES,ELEITO,PP,PARTIDO PROGRESSISTA,61
PEDREIRA,DEPUTADO FEDERAL,FERNANDO STANCATTI,FERNANDO CESAR STANCATTI MARQUES,SUPLENTE,PP,PARTIDO PROGRESSISTA,1
PEDREIRA,DEPUTADO FEDERAL,JORGE WILSON,JORGE WILSON GONÇALVES DE MATTOS,SUPLENTE,PP,PARTIDO PROGRESSISTA,5
PEDREIRA,DEPUTADO FEDERAL,CAPITÃO CRIVELARI,LUIZ ANTONIO CRIVELARI,SUPLENTE,PP,PARTIDO PROGRESSISTA,1
PEDREIRA,DEPUTADO FEDERAL,PH,PAULO HENRIQUE RIBEIRO SANTANA,SUPLENTE,PDT,PARTIDO DEMOCRÁTICO TRABALHISTA,14
PEDREIRA,DEPUTADO FEDERAL,ERLON CHAVES,ERLON CHAVES DE CASTRO,SUPLENTE,PDT,PARTIDO DEMOCRÁTICO TRABALHISTA,1
PEDREIRA,DEPUTADO FEDERAL,JOÃO DADO,JOÃO EDUARDO DADO LEITE DE CARVALHO,ELEITO,PDT,PARTIDO DEMOCRÁTICO TRABALHISTA,2
PEDREIRA,DEPUTADO FEDERAL,PAULINHO DA FORÇA,PAULO PEREIRA DA SILVA,ELEITO,PDT,PARTIDO DEMOCRÁTICO TRABALHISTA,48
PEDREIRA,DEPUTADO FEDERAL,ELISEU DANIEL,ELISEU DANIEL DOS SANTOS,SUPLENTE,PDT,PARTIDO DEMOCRÁTICO TRABALHISTA,3
PEDREIRA,DEPUTADO FEDERAL,GUSTAVO STUPP,LUIZ GUSTAVO ANTUNES STUPP,SUPLENTE,PDT,PARTIDO DEMOCRÁTICO TRABALHISTA,3
PEDREIRA,DEPUTADO FEDERAL,ARMANDO HENRIQUE,ARMANDO HENRIQUE,SUPLENTE,PDT,PARTIDO DEMOCRÁTICO TRABALHISTA,5
PEDREIRA,DEPUTADO FEDERAL,KAREN HEINS,KAREN MAYELLEN TONIM HEINS,SUPLENTE,PDT,PARTIDO DEMOCRÁTICO TRABALHISTA,19
PEDREIRA,DEPUTADO FEDERAL,SAULO GOES,SAULO GOES DE ALBUQUERQUE,SUPLENTE,PDT,PARTIDO DEMOCRÁTICO TRABALHISTA,4
PEDREIRA,DEPUTADO FEDERAL,MEDEIROS,LUIZ ANTONIO DE MEDEIROS NETO,SUPLENTE,PDT,PARTIDO DEMOCRÁTICO TRABALHISTA,5
PEDREIRA,DEPUTADO FEDERAL,GILBERTO BENZI,GILBERTO BENZI,SUPLENTE,PDT,PARTIDO DEMOCRÁTICO TRABALHISTA,1
PEDREIRA,DEPUTADO FEDERAL,DR LUIZ CHIAPARINE,LUIZ CARLOS CHIAPARINE,SUPLENTE,PDT,PARTIDO DEMOCRÁTICO TRABALHISTA,11
PEDREIRA,DEPUTADO FEDERAL,NELSINHO DA BAHIA,NELSON FRANCISCO DOS SANTOS,SUPLENTE,PDT,PARTIDO DEMOCRÁTICO TRABALHISTA,2
PEDREIRA,DEPUTADO FEDERAL,MANOEL ANTUNES,MANOEL ANTUNES,SUPLENTE,PDT,PARTIDO DEMOCRÁTICO TRABALHISTA,1
PEDREIRA,DEPUTADO FEDERAL,DEF.BIODIESEL-SILASEDUARDOINKE,SILAS EDUARDO INKE,SUPLENTE,PDT,PARTIDO DEMOCRÁTICO TRABALHISTA,1
PEDREIRA,DEPUTADO FEDERAL,CARLOS HENRIQUE,CARLOS HENRIQUE PINTO,SUPLENTE,PDT,PARTIDO DEMOCRÁTICO TRABALHISTA,46
PEDREIRA,DEPUTADO FEDERAL,DRA DEBORA,DEBORA MARIA MARAGNI PEREIRA DE ABREU,SUPLENTE,PDT,PARTIDO DEMOCRÁTICO TRABALHISTA,4
PEDREIRA,DEPUTADO FEDERAL,SALVADOR ZIMBALDI,SALVADOR ZIMBALDI FILHO,MÉDIA,PDT,PARTIDO DEMOCRÁTICO TRABALHISTA,74
PEDREIRA,DEPUTADO FEDERAL,DRA ZIRVA,ZIRVA DAS GRAÇAS PIRES PEREIRA,SUPLENTE,PDT,PARTIDO DEMOCRÁTICO TRABALHISTA,1
PEDREIRA,DEPUTADO FEDERAL,LINDOLFO DOS SANTOS,LINDOLFO LUIZ DOS SANTOS NETO,SUPLENTE,PDT,PARTIDO DEMOCRÁTICO TRABALHISTA,1
PEDREIRA,DEPUTADO FEDERAL,FERNANDO CHIARELLI,FERNANDO CHIARELLI,SUPLENTE,PDT,PARTIDO DEMOCRÁTICO TRABALHISTA,1
PEDREIRA,DEPUTADO FEDERAL,IVANIO BATISTA,IVANIO BATISTA DA SILVA,SUPLENTE,PT,JUNTOS POR SÃO PAULO,10
PEDREIRA,DEPUTADO FEDERAL,VICENTE CANDIDO,VICENTE CANDIDO DA SILVA,ELEITO,PT,JUNTOS POR SÃO PAULO,2
PEDREIRA,DEPUTADO FEDERAL,MARQUINHOS OLÍVIO,MARCOS OLIVIO CONCEIÇÃO,SUPLENTE,PT,JUNTOS POR SÃO PAULO,2
PEDREIRA,DEPUTADO FEDERAL,GERALDINHO O ILUMINADO,GERALDO ALVES DIONISIO,SUPLENTE,PT,JUNTOS POR SÃO PAULO,1
PEDREIRA,DEPUTADO FEDERAL,IARA BERNARDI,IARA BERNARDI,SUPLENTE,PT,JUNTOS POR SÃO PAULO,4
PEDREIRA,DEPUTADO FEDERAL,LARGUESA,LUIS VANDERLEI LARGUESA,SUPLENTE,PT,JUNTOS POR SÃO PAULO,7
PEDREIRA,DEPUTADO FEDERAL,VACCAREZZA,CANDIDO ELPIDIO DE SOUZA VACCAREZZA,ELEITO,PT,JUNTOS POR SÃO PAULO,253
PEDREIRA,DEPUTADO FEDERAL,GENOINO,JOSÉ GENOÍNO NETO,SUPLENTE,PT,JUNTOS POR SÃO PAULO,23
PEDREIRA,DEPUTADO FEDERAL,CARLINHOS ALMEIDA,CARLOS JOSE DE ALMEIDA,ELEITO,PT,JUNTOS POR SÃO PAULO,2
PEDREIRA,DEPUTADO FEDERAL,MISA BOITO,MARIA EMILIA SEDEH BOITO,SUPLENTE,PT,JUNTOS POR SÃO PAULO,1
PEDREIRA,DEPUTADO FEDERAL,NEWTON LIMA NETO,NEWTON LIMA NETO,ELEITO,PT,JUNTOS POR SÃO PAULO,3
PEDREIRA,DEPUTADO FEDERAL,TEREZINHA RONDELLI,MARIA TEREZINHA RONDELLI,SUPLENTE,PT,JUNTOS POR SÃO PAULO,12
PEDREIRA,DEPUTADO FEDERAL,FILIPPI,JOSÉ DE FILIPPI JÚNIOR,ELEITO,PT,JUNTOS POR SÃO PAULO,1
PEDREIRA,DEPUTADO FEDERAL,ARLINDO CHINAGLIA,ARLINDO CHIGNALIA JUNIOR,ELEITO,PT,JUNTOS POR SÃO PAULO,415
PEDREIRA,DEPUTADO FEDERAL,JOÃO PAULO CUNHA,JOÃO PAULO CUNHA,ELEITO,PT,JUNTOS POR SÃO PAULO,1
PEDREIRA,DEPUTADO FEDERAL,PIVATTO,JOSÉ PIVATTO,SUPLENTE,PT,JUNTOS POR SÃO PAULO,243
PEDREIRA,DEPUTADO FEDERAL,RICARDO BERZOINI,RICARDO JOSE RIBEIRO BERZOINI,ELEITO,PT,JUNTOS POR SÃO PAULO,6
PEDREIRA,DEPUTADO FEDERAL,JOSÉ MENTOR,JOSÉ MENTOR GUILHERME DE MELLO NETTO,ELEITO,PT,JUNTOS POR SÃO PAULO,15
PEDREIRA,DEPUTADO FEDERAL,PROF. CARLÃO RAMIRO,CARLOS RAMIRO CASTRO,SUPLENTE,PT,JUNTOS POR SÃO PAULO,17
PEDREIRA,DEPUTADO FEDERAL,FÉLIX SAHÃO,FÉLIX SAHÃO JÚNIOR,SUPLENTE,PT,JUNTOS POR SÃO PAULO,46
PEDREIRA,DEPUTADO FEDERAL,ROGÉRIO PINTO,ROGÉRIO PINTO FERNANDES,SUPLENTE,PT,JUNTOS POR SÃO PAULO,1
PEDREIRA,DEPUTADO FEDERAL,TENENTE PAZ,FRANCISCO JESUS DA PAZ,SUPLENTE,PT,JUNTOS POR SÃO PAULO,7
PEDREIRA,DEPUTADO FEDERAL,RODRIGO VALVERDE,JORGE RODRIGO VALVERDE SANTANA,SUPLENTE,PT,JUNTOS POR SÃO PAULO,2
PEDREIRA,DEPUTADO FEDERAL,LUIZ CARLOS GOMES,LUIZ CARLOS GOMES,SUPLENTE,PT,JUNTOS POR SÃO PAULO,2
PEDREIRA,DEPUTADO FEDERAL,DURVAL ORLATO,DURVAL LOPES ORLATO,SUPLENTE,PT,JUNTOS POR SÃO PAULO,12
PEDREIRA,DEPUTADO FEDERAL,RENATO SIMÕES,RENATO SIMÕES,SUPLENTE,PT,JUNTOS POR SÃO PAULO,185
PEDREIRA,DEPUTADO FEDERAL,DEVANIR RIBEIRO,DEVANIR RIBEIRO,ELEITO,PT,JUNTOS POR SÃO PAULO,3
PEDREIRA,DEPUTADO FEDERAL,ZARATTINI,CARLOS ALBERTO ROLIM ZARATTINI,ELEITO,PT,JUNTOS POR SÃO PAULO,8
PEDREIRA,DEPUTADO FEDERAL,JANETE PIETÁ,JANETE ROCHA PIETÁ,ELEITO,PT,JUNTOS POR SÃO PAULO,26
PEDREIRA,DEPUTADO FEDERAL,VALDECI CHIRANHA,VALDECI FERREIRA DA SILVA,SUPLENTE,PT,JUNTOS POR SÃO PAULO,1
PEDREIRA,DEPUTADO FEDERAL,VICENTINHO,VICENTE PAULO DA SILVA,ELEITO,PT,JUNTOS POR SÃO PAULO,1
PEDREIRA,DEPUTADO FEDERAL,PAULO TEIXEIRA,LUIZ PAULO TEIXEIRA FERREIRA,ELEITO,PT,JUNTOS POR SÃO PAULO,1
PEDREIRA,DEPUTADO FEDERAL,CLAURY,CLAURY SANTOS ALVES DA SILVA,SUPLENTE,PTB,PARTIDO TRABALHISTA BRASILEIRO,4
PEDREIRA,DEPUTADO FEDERAL,VAMPETA,MARCOS ANDRE BATISTA SANTOS,SUPLENTE,PTB,PARTIDO TRABALHISTA BRASILEIRO,4
PEDREIRA,DEPUTADO FEDERAL,SANTANA,JOSE SANTANA DE ABREU,SUPLENTE,PTB,PARTIDO TRABALHISTA BRASILEIRO,1
PEDREIRA,DEPUTADO FEDERAL,ROBSON TUMA,ROBSON TUMA,SUPLENTE,PTB,PARTIDO TRABALHISTA BRASILEIRO,2
PEDREIRA,DEPUTADO FEDERAL,SINVAL DORIGON,SINVAL ROBERTO DORIGON,SUPLENTE,PTB,PARTIDO TRABALHISTA BRASILEIRO,8
PEDREIRA,DEPUTADO FEDERAL,NELSON MARQUEZELLI,NELSON MARQUEZELLI,ELEITO,PTB,PARTIDO TRABALHISTA BRASILEIRO,47
PEDREIRA,DEPUTADO FEDERAL,WALDOMIRO RAMOS,WALDOMIRO CARLOS RAMOS,SUPLENTE,PTB,PARTIDO TRABALHISTA BRASILEIRO,1
PEDREIRA,DEPUTADO FEDERAL,DR MOYSES,JOAO MOYSES ABUJADI,SUPLENTE,PTB,PARTIDO TRABALHISTA BRASILEIRO,1
PEDREIRA,DEPUTADO FEDERAL,SONIA CRISTIANO,SONIA REGINA CRISTIANO,SUPLENTE,PTB,PARTIDO TRABALHISTA BRASILEIRO,3
PEDREIRA,DEPUTADO FEDERAL,ARNALDO FARIA DE SÁ,ARNALDO FARIA DE SÁ,ELEITO,PTB,PARTIDO TRABALHISTA BRASILEIRO,40
PEDREIRA,DEPUTADO FEDERAL,DRª NILCE SEGALLA,NILCE SEGALLA,SUPLENTE,PTB,PARTIDO TRABALHISTA BRASILEIRO,1
PEDREIRA,DEPUTADO FEDERAL,FRANK AGUIAR,FRANCINETO LUZ DE AGUIAR,SUPLENTE,PTB,PARTIDO TRABALHISTA BRASILEIRO,2
PEDREIRA,DEPUTADO FEDERAL,PASTOR JOAO ALMEIDA,JOAO ALMEIDA DOS SANTOS,SUPLENTE,PTB,PARTIDO TRABALHISTA BRASILEIRO,1
PEDREIRA,DEPUTADO FEDERAL,EMELLY OLIVEIRA,EMELLY PAGLIARI CARDOSO ALVES DE OLIVEIRA,SUPLENTE,PTB,PARTIDO TRABALHISTA BRASILEIRO,1
PEDREIRA,DEPUTADO FEDERAL,PAULO LIMA,PAULO CESAR DE OLIVEIRA LIMA,SUPLENTE,PMDB,PARTIDO DO MOVIMENTO DEMOCRÁTICO BRASILEIRO,122
PEDREIRA,DEPUTADO FEDERAL,ANA CRISTINA,ANA CRISTINA FERNANDES GIAMPIETRO,SUPLENTE,PMDB,PARTIDO DO MOVIMENTO DEMOCRÁTICO BRASILEIRO,1
PEDREIRA,DEPUTADO FEDERAL,NENÊ RÉSTIO,ANGELO ROBERTO RESTIO,SUPLENTE,PMDB,PARTIDO DO MOVIMENTO DEMOCRÁTICO BRASILEIRO,1
PEDREIRA,DEPUTADO FEDERAL,MARCOS TENÓRIO,MARCOS ANTÔNIO FERREIRA TENÓRIO,SUPLENTE,PMDB,PARTIDO DO MOVIMENTO DEMOCRÁTICO BRASILEIRO,3
PEDREIRA,DEPUTADO FEDERAL,PAULINHO SOBRAL,PAULO MENDES SOBRAL,SUPLENTE,PMDB,PARTIDO DO MOVIMENTO DEMOCRÁTICO BRASILEIRO,1
PEDREIRA,DEPUTADO FEDERAL,EDUARDO COELHO,EDUARDO JOSÉ PEREIRA COELHO,SUPLENTE,PMDB,PARTIDO DO MOVIMENTO DEMOCRÁTICO BRASILEIRO,71
PEDREIRA,DEPUTADO FEDERAL,DR. PAULO VALENTIM,PAULO JORGE VALENTIM,SUPLENTE,PMDB,PARTIDO DO MOVIMENTO DEMOCRÁTICO BRASILEIRO,1
PEDREIRA,DEPUTADO FEDERAL,EDINHO ARAUJO,EDSON EDINHO COELHO ARAUJO,ELEITO,PMDB,PARTIDO DO MOVIMENTO DEMOCRÁTICO BRASILEIRO,2
PEDREIRA,DEPUTADO FEDERAL,DR. AJURICABA,AJURICABA DE SOUZA MENEZES,SUPLENTE,PMDB,PARTIDO DO MOVIMENTO DEMOCRÁTICO BRASILEIRO,2
PEDREIRA,DEPUTADO FEDERAL,LEONEL NA HORA,LEONEL HERNANDEZ JUNIOR,SUPLENTE,PMDB,PARTIDO DO MOVIMENTO DEMOCRÁTICO BRASILEIRO,2
PEDREIRA,DEPUTADO FEDERAL,JB SILVA,JOÃO BATISTA SILVA,SUPLENTE,PMDB,PARTIDO DO MOVIMENTO DEMOCRÁTICO BRASILEIRO,1
PEDREIRA,DEPUTADO FEDERAL,DR. CÉSAR,LUIZ CESAR REGINATO,SUPLENTE,PMDB,PARTIDO DO MOVIMENTO DEMOCRÁTICO BRASILEIRO,3
PEDREIRA,DEPUTADO FEDERAL,RICARDO HOLZ,RICARDO HOLZ VIDAL DOS SANTOS,SUPLENTE,PMDB,PARTIDO DO MOVIMENTO DEMOCRÁTICO BRASILEIRO,1
PEDREIRA,DEPUTADO FEDERAL,GLEDSON TIGRÃO,GLEDSON MARQUES PESSOA,SUPLENTE,PSL,PRESTE ATENÇÃO SÃO PAULO,2
PEDREIRA,DEPUTADO FEDERAL,CORONEL GILSON LOPES,GILSON LOPES DA SILVA,SUPLENTE,PSC,HUMANISTA CRISTÃO ,1
PEDREIRA,DEPUTADO FEDERAL,MARCO FELICIANO,MARCO ANTONIO FELICIANO,ELEITO,PSC,HUMANISTA CRISTÃO ,78
PEDREIRA,DEPUTADO FEDERAL,MARCELO AGUIAR,MARCELO THEODORO DE AGUIAR,ELEITO,PSC,HUMANISTA CRISTÃO ,5
PEDREIRA,DEPUTADO FEDERAL,ARI BARCELLOS,JOSE DE ARIMATHEA BARCELLOS,SUPLENTE,PSC,HUMANISTA CRISTÃO ,2
PEDREIRA,DEPUTADO FEDERAL,REGIS DE OLIVEIRA,REGIS FERNANDES DE OLIVEIRA,SUPLENTE,PSC,HUMANISTA CRISTÃO ,15
PEDREIRA,DEPUTADO FEDERAL,SILVIA PALMA,SILVIA ELIANA PALMA,SUPLENTE,PSC,HUMANISTA CRISTÃO ,3
PEDREIRA,DEPUTADO FEDERAL,NEY SANTOS,CLAUDINEI ALVES DOS SANTOS,SUPLENTE,PSC,HUMANISTA CRISTÃO ,1
PEDREIRA,DEPUTADO FEDERAL,DALVAN,JOÃO GOMES DE ALMEIDA,SUPLENTE,PSC,HUMANISTA CRISTÃO ,3
PEDREIRA,DEPUTADO FEDERAL,ROSEMAR BARACK OBAMA,ROSEMAR LUIZ DA ROSA LOPES,SUPLENTE,PSC,HUMANISTA CRISTÃO ,2
PEDREIRA,DEPUTADO FEDERAL,PR. LUIZ LEMOS,LUIZ CARLOS LEMOS,SUPLENTE,PSC,HUMANISTA CRISTÃO ,1
PEDREIRA,DEPUTADO FEDERAL,QUEIROZ PIRIQUITA,LUIS CARLOS DE QUEIROZ,SUPLENTE,PSC,HUMANISTA CRISTÃO ,1
PEDREIRA,DEPUTADO FEDERAL,MAURÃO,JOSE MAURO PEREIRA DE BARROS,SUPLENTE,PSC,HUMANISTA CRISTÃO ,1
PEDREIRA,DEPUTADO FEDERAL,OMAR,OMAR ADOLFO CHOUMAN,SUPLENTE,PSC,HUMANISTA CRISTÃO ,7
PEDREIRA,DEPUTADO FEDERAL,DR. SANDOVAL,SANDOVAL DE CASTRO DOURADO,SUPLENTE,PSC,HUMANISTA CRISTÃO ,1
PEDREIRA,DEPUTADO FEDERAL,MANOEL GASPAR,MANOEL FERREIRA DE SOUZA GASPAR,SUPLENTE,PSC,HUMANISTA CRISTÃO ,2
PEDREIRA,DEPUTADO FEDERAL,JUCA CHAVES,JURANDYR CZACZKES CHAVES,SUPLENTE,PR,JUNTOS POR SÃO PAULO,4
PEDREIRA,DEPUTADO FEDERAL,AGNALDO TIMOTEO,AGUINALDO TIMOTEO PEREIRA,SUPLENTE,PR,JUNTOS POR SÃO PAULO,6
PEDREIRA,DEPUTADO FEDERAL,TIRIRICA,FRANCISCO EVERARDO OLIVEIRA SILVA,ELEITO,PR,JUNTOS POR SÃO PAULO,926
PEDREIRA,DEPUTADO FEDERAL,PR PAULO FREIRE,PAULO ROBERTO FREIRE DA COSTA,ELEITO,PR,JUNTOS POR SÃO PAULO,200
PEDREIRA,DEPUTADO FEDERAL,LUCIANA COSTA,LUCIANA DE ALMEIDA COSTA,SUPLENTE,PR,JUNTOS POR SÃO PAULO,5
PEDREIRA,DEPUTADO FEDERAL,MILTON MONTI,MILTON ANTONIO CASQUEL MONTI,ELEITO,PR,JUNTOS POR SÃO PAULO,9
PEDREIRA,DEPUTADO FEDERAL,VALDEMAR COSTA NETO,VALDEMAR COSTA NETO,ELEITO,PR,JUNTOS POR SÃO PAULO,3
PEDREIRA,DEPUTADO FEDERAL,LINDOMAR DE OLIVEIRA,LINDOMAR CUSTODIA DE OLIVEIRA,SUPLENTE,PPS,PSDB/DEM/PPS,1
PEDREIRA,DEPUTADO FEDERAL,VALDEMAR ANFRISIO,VALDEMAR ANFRISIO DOS SANTOS,SUPLENTE,PPS,PSDB/DEM/PPS,1
PEDREIRA,DEPUTADO FEDERAL,ROBERTO FREIRE,ROBERTO JOAO PEREIRA FREIRE,ELEITO,PPS,PSDB/DEM/PPS,62
PEDREIRA,DEPUTADO FEDERAL,DIMAS RAMALHO,DIMAS EDUARDO RAMALHO,ELEITO,PPS,PSDB/DEM/PPS,45
PEDREIRA,DEPUTADO FEDERAL,MARCOS DA FOTO,SIUSAKU HIRASHIMA,SUPLENTE,PPS,PSDB/DEM/PPS,1
PEDREIRA,DEPUTADO FEDERAL,ARI FRIEDENBACH,ARI FRIEDENBACH,SUPLENTE,PPS,PSDB/DEM/PPS,23
PEDREIRA,DEPUTADO FEDERAL,JOSE ONERIO,JOSE ONERIO DA SILVA,SUPLENTE,PPS,PSDB/DEM/PPS,19
PEDREIRA,DEPUTADO FEDERAL,ARNALDO JARDIM,ARNALDO CALIL PEREIRA JARDIM,ELEITO,PPS,PSDB/DEM/PPS,1597
PEDREIRA,DEPUTADO FEDERAL,JORGE TADEU,JORGE TADEU MUDALEN,ELEITO,DEM,PSDB/DEM/PPS,29
PEDREIRA,DEPUTADO FEDERAL,JORGINHO MALULY,JORGE DE FARIA MALULY,SUPLENTE,DEM,PSDB/DEM/PPS,7
PEDREIRA,DEPUTADO FEDERAL,ALEXANDRE LEITE,ALEXANDRE LEITE DA SILVA,MÉDIA,DEM,PSDB/DEM/PPS,2
PEDREIRA,DEPUTADO FEDERAL,PROFESSOR BENJAMIN,BENJAMIN RIBEIRO DA SILVA,SUPLENTE,DEM,PSDB/DEM/PPS,2
PEDREIRA,DEPUTADO FEDERAL,KIKO DO KLB,FRANCO FINATO SCORNAVACCA,SUPLENTE,DEM,PSDB/DEM/PPS,17
PEDREIRA,DEPUTADO FEDERAL,RODRIGO GARCIA,RODRIGO GARCIA,ELEITO,DEM,PSDB/DEM/PPS,1
PEDREIRA,DEPUTADO FEDERAL,ZULAIÊ COBRA,ZULAIE COBRA RIBEIRO,SUPLENTE,DEM,PSDB/DEM/PPS,7
PEDREIRA,DEPUTADO FEDERAL,LUCIANO ARTIOLI,LUCIANO ARTIOLI MOREIRA,SUPLENTE,DEM,PSDB/DEM/PPS,5
PEDREIRA,DEPUTADO FEDERAL,RAUL GIL JR,RAUL GIL JUNIOR,SUPLENTE,DEM,PSDB/DEM/PPS,2
PEDREIRA,DEPUTADO FEDERAL,JUNJI ABE,JUNJI ABE,ELEITO,DEM,PSDB/DEM/PPS,7
PEDREIRA,DEPUTADO FEDERAL,MANDIC,ALEKSANDAR CARLOS MANDIC,SUPLENTE,DEM,PSDB/DEM/PPS,1
PEDREIRA,DEPUTADO FEDERAL,ELI CORREA FILHO,ADRIANO ELI CORREA,ELEITO,DEM,PSDB/DEM/PPS,7
PEDREIRA,DEPUTADO FEDERAL,DR ELEUSES PAIVA,ELEUSES VIEIRA DE PAIVA,SUPLENTE,DEM,PSDB/DEM/PPS,9
PEDREIRA,DEPUTADO FEDERAL,GUILHERME CAMPOS,GUILHERME CAMPOS JUNIOR,MÉDIA,DEM,PSDB/DEM/PPS,391
PEDREIRA,DEPUTADO FEDERAL,MALUCO BELEZA,OLAIR PRADO DE OLIVEIRA,SUPLENTE,PHS,HUMANISTA CRISTÃO ,3
PEDREIRA,DEPUTADO FEDERAL,PROF HERMES,HERMES RODRIGUES NERY,SUPLENTE,PHS,HUMANISTA CRISTÃO ,3
PEDREIRA,DEPUTADO FEDERAL,MANOEL ALELUIA,MANOEL ALELUIA DE SOUZA FILHO,SUPLENTE,PHS,HUMANISTA CRISTÃO ,1
PEDREIRA,DEPUTADO FEDERAL,MARCOS NEBLINA,MARCOS ANDRÉ SILVA,SUPLENTE,PHS,HUMANISTA CRISTÃO ,1
PEDREIRA,DEPUTADO FEDERAL,JONAS DONIZETTE,JONAS DONIZETTE FERREIRA,ELEITO,PSB,PRESTE ATENÇÃO SÃO PAULO,11935
PEDREIRA,DEPUTADO FEDERAL,DENNYS SERRANO,DENNYS HADDAD SERRANO,SUPLENTE,PSB,PRESTE ATENÇÃO SÃO PAULO,3
PEDREIRA,DEPUTADO FEDERAL,MARCELINHO CARIOCA,MARCELO PEREIRA SURCIN,SUPLENTE,PSB,PRESTE ATENÇÃO SÃO PAULO,34
PEDREIRA,DEPUTADO FEDERAL,MARCOS DE PAULA,MARCOS DE PAULA,SUPLENTE,PSB,PRESTE ATENÇÃO SÃO PAULO,1
PEDREIRA,DEPUTADO FEDERAL,GUSTAVO HERRMANN,GUSTAVO RANZANI HERRMANN,SUPLENTE,PSB,PRESTE ATENÇÃO SÃO PAULO,2
PEDREIRA,DEPUTADO FEDERAL,SARGENTO FERNANDO,FERNANDO ALCÂNTARA DE FIGUEIREDO,SUPLENTE,PSB,PRESTE ATENÇÃO SÃO PAULO,1
PEDREIRA,DEPUTADO FEDERAL,ELISEU GABRIEL,ELISEU GABRIEL DE PIERI,SUPLENTE,PSB,PRESTE ATENÇÃO SÃO PAULO,5
PEDREIRA,DEPUTADO FEDERAL,CAPITÃO AUGUSTO,JOSÉ AUGUSTO ROSA,SUPLENTE,PSB,PRESTE ATENÇÃO SÃO PAULO,6
PEDREIRA,DEPUTADO FEDERAL,LUIZA ERUNDINA,LUIZA ERUNDINA DE SOUSA,ELEITO,PSB,PRESTE ATENÇÃO SÃO PAULO,11
PEDREIRA,DEPUTADO FEDERAL,TORINO,PAULO SERGIO TORINO,SUPLENTE,PSB,PRESTE ATENÇÃO SÃO PAULO,1
PEDREIRA,DEPUTADO FEDERAL,GABRIEL CHALITA,GABRIEL BENEDITO ISSAAC CHALITA,ELEITO,PSB,PRESTE ATENÇÃO SÃO PAULO,549
PEDREIRA,DEPUTADO FEDERAL,PAULO ROGÉRIO MARTINS,PAULO ROGÉRIO MARTINS,SUPLENTE,PSB,PRESTE ATENÇÃO SÃO PAULO,2
PEDREIRA,DEPUTADO FEDERAL,MÁRCIO FRANÇA,MÁRCIO LUIZ FRANÇA GOMES,ELEITO,PSB,PRESTE ATENÇÃO SÃO PAULO,13
PEDREIRA,DEPUTADO FEDERAL,DR. ALEXANDRE,ALEXANDRE SÉRGIO DE OLIVEIRA AZOUBEL,SUPLENTE,PSB,PRESTE ATENÇÃO SÃO PAULO,2
PEDREIRA,DEPUTADO FEDERAL,DRA. ROSIANE FARIAS,ROSIANE MACIEL DE FARIAS,SUPLENTE,PSB,PRESTE ATENÇÃO SÃO PAULO,1
PEDREIRA,DEPUTADO FEDERAL,SANTO PETRONI,SANTO PETRONI,SUPLENTE,PSB,PRESTE ATENÇÃO SÃO PAULO,1
PEDREIRA,DEPUTADO FEDERAL,DRA. ELAINE,ELAINE APARECIDA BELLONI ABISSAMRA,SUPLENTE,PSB,PRESTE ATENÇÃO SÃO PAULO,1
PEDREIRA,DEPUTADO FEDERAL,DR. CLÓVIS,CLÓVES LISBOA MEDEIROS,SUPLENTE,PSB,PRESTE ATENÇÃO SÃO PAULO,1
PEDREIRA,DEPUTADO FEDERAL,JEFFERSON CAMPOS,JEFFERSON ALVES DE CAMPOS,ELEITO,PSB,PRESTE ATENÇÃO SÃO PAULO,66
PEDREIRA,DEPUTADO FEDERAL,DR. UBIALI,MARCO AURÉLIO UBIALI,SUPLENTE,PSB,PRESTE ATENÇÃO SÃO PAULO,6
PEDREIRA,DEPUTADO FEDERAL,OTA,IOLANDA KEIKO MIASHIRO OTA,ELEITO,PSB,PRESTE ATENÇÃO SÃO PAULO,52
PEDREIRA,DEPUTADO FEDERAL,GUILHERME MUSSI,GUILHERME MUSSI FERREIRA,ELEITO,PV,PARTIDO VERDE,14
PEDREIRA,DEPUTADO FEDERAL,GILBERTO ABREU,GILBERTO ANDRADE DE ABREU,SUPLENTE,PV,PARTIDO VERDE,1
PEDREIRA,DEPUTADO FEDERAL,WALTER GONZALIS,WALTER GONZALIS,SUPLENTE,PV,PARTIDO VERDE,10
PEDREIRA,DEPUTADO FEDERAL,DR TALMIR,TALMIR RODRIGUES,SUPLENTE,PV,PARTIDO VERDE,10
PEDREIRA,DEPUTADO FEDERAL,VICENTE DA UPA,VICENTE CARVALHO E SILVA,SUPLENTE,PV,PARTIDO VERDE,56
PEDREIRA,DEPUTADO FEDERAL,DR. SINVAL MALHEIROS,SINVAL MALHEIROS PINTO JÚNIOR,SUPLENTE,PV,PARTIDO VERDE,3
PEDREIRA,DEPUTADO FEDERAL,DANIEL MARINS,DANIEL MARINS ALESSI,SUPLENTE,PV,PARTIDO VERDE,1
PEDREIRA,DEPUTADO FEDERAL,JULIO CASTILHO,JULIO CESAR CASTILHO,SUPLENTE,PV,PARTIDO VERDE,4
PEDREIRA,DEPUTADO FEDERAL,ROBERTO SANTIAGO,JOSE ROBERTO SANTIAGO GOMES,ELEITO,PV,PARTIDO VERDE,79
PEDREIRA,DEPUTADO FEDERAL,CESAR CORTEZ,ANTONIO CESAR CORTEZ,SUPLENTE,PV,PARTIDO VERDE,5
PEDREIRA,DEPUTADO FEDERAL,ZICA,EUSTAQUIO LUCIANO ZICA,SUPLENTE,PV,PARTIDO VERDE,333
PEDREIRA,DEPUTADO FEDERAL,CHICO SANTA RITA,FRANCISCO JOSE DE SANTA RITA BEHR,SUPLENTE,PV,PARTIDO VERDE,1
PEDREIRA,DEPUTADO FEDERAL,PEDRO MANHÃES,PEDRO MANHÃES DE OLIVEIRA,SUPLENTE,PV,PARTIDO VERDE,11
PEDREIRA,DEPUTADO FEDERAL,ENG PAULINHO,PAULO HENRIQUE DO NASCIMENTO,SUPLENTE,PV,PARTIDO VERDE,1
PEDREIRA,DEPUTADO FEDERAL,DEUSDEDIT JR,DEUSDEDIT DE PAULA MIQUELINO JUNIOR,SUPLENTE,PV,PARTIDO VERDE,1
PEDREIRA,DEPUTADO FEDERAL,MARIA DOLORES,MARIA DOLORES RODRIGUES JORDAN ORFEI ABE,SUPLENTE,PV,PARTIDO VERDE,1
PEDREIRA,DEPUTADO FEDERAL,JOVINO CÂNDIDO,JOVINO CÂNDIDO DA SILVA,SUPLENTE,PV,PARTIDO VERDE,1
PEDREIRA,DEPUTADO FEDERAL,ANA PAULA JUNQUEIRA,ANA PAULA GUIMARAES DE AZEVEDO JUNQUEIRA,SUPLENTE,PV,PARTIDO VERDE,5
PEDREIRA,DEPUTADO FEDERAL,EVANDRO GUSSI,EVANDRO HERRERA BERTONE GUSSI,SUPLENTE,PV,PARTIDO VERDE,2
PEDREIRA,DEPUTADO FEDERAL,FAUSTO LOPES,FAUSTO LOPES FILHO,SUPLENTE,PV,PARTIDO VERDE,2
PEDREIRA,DEPUTADO FEDERAL,ALE YOUSSEF,ALEXANDRE DE ALMEIDA YOUSSEF,SUPLENTE,PV,PARTIDO VERDE,10
PEDREIRA,DEPUTADO FEDERAL,MARCELO ORTIZ,FRANCISCO MARCELO ORTIZ FILHO,SUPLENTE,PV,PARTIDO VERDE,3
PEDREIRA,DEPUTADO FEDERAL,PENNA,JOSÉ LUIZ DE FRANÇA PENNA,ELEITO,PV,PARTIDO VERDE,6
PEDREIRA,DEPUTADO FEDERAL,ROBERTO DE LUCENA,ROBERTO ALVES DE LUCENA,ELEITO,PV,PARTIDO VERDE,48
PEDREIRA,DEPUTADO FEDERAL,DR. ÂNGELO,ANGELO DOMINGOS NUCCI,SUPLENTE,PV,PARTIDO VERDE,2
PEDREIRA,DEPUTADO FEDERAL,PAMPA,ANDRE FELIPPE FALBO FERREIRA,SUPLENTE,PV,PARTIDO VERDE,4
PEDREIRA,DEPUTADO FEDERAL,CARLINHOS SILVA,ANTONIO CARLOS ALVES DA SILVA,SUPLENTE,PV,PARTIDO VERDE,1
PEDREIRA,DEPUTADO FEDERAL,RICARDO IZAR,RICARDO IZAR JUNIOR,ELEITO,PV,PARTIDO VERDE,11
PEDREIRA,DEPUTADO FEDERAL,BERQUE,CARLOS CESAR BERQUE,SUPLENTE,PV,PARTIDO VERDE,1
PEDREIRA,DEPUTADO FEDERAL,VILSON ALVES,VILSON OSCHIN ALVES,SUPLENTE,PV,PARTIDO VERDE,2
PEDREIRA,DEPUTADO FEDERAL,ANDERSON MENDONCA,ANDERSON APARECIDO MENDONCA,SUPLENTE,PV,PARTIDO VERDE,5
PEDREIRA,DEPUTADO FEDERAL,AMAURY CAMARGO MONICO,AMAURY CAMARGO MONACO,SUPLENTE,PV,PARTIDO VERDE,2
PEDREIRA,DEPUTADO FEDERAL,EDUARDO PALHARES,EDUARDO SANTOS PALHARES,SUPLENTE,PV,PARTIDO VERDE,42
PEDREIRA,DEPUTADO FEDERAL,CARLOS SAMPAIO,CARLOS HENRIQUE FOCESI SAMPAIO,ELEITO,PSDB,PSDB/DEM/PPS,830
PEDREIRA,DEPUTADO FEDERAL,STANGARLINI,JOSE CARLOS STANGARLINI,SUPLENTE,PSDB,PSDB/DEM/PPS,5
PEDREIRA,DEPUTADO FEDERAL,RAUL CHRISTIANO,RAUL CHRISTIANO DE OLIVEIRA SANCHEZ,SUPLENTE,PSDB,PSDB/DEM/PPS,3
PEDREIRA,DEPUTADO FEDERAL,LOBBE NETO,ANTONIO ADOLPHO LOBBE NETO,SUPLENTE,PSDB,PSDB/DEM/PPS,10
PEDREIRA,DEPUTADO FEDERAL,FELICIDADE,FELICIDADE LOPES PONTES,SUPLENTE,PSDB,PSDB/DEM/PPS,7
PEDREIRA,DEPUTADO FEDERAL,MANOEL MARCOS (MANÉ),MANOEL MARCOS DE JESUS FERREIRA,SUPLENTE,PSDB,PSDB/DEM/PPS,1
PEDREIRA,DEPUTADO FEDERAL,EMANUEL FERNANDES,EMANUEL FERNANDES,ELEITO,PSDB,PSDB/DEM/PPS,4
PEDREIRA,DEPUTADO FEDERAL,MARA GABRILLI,MARA CRISTINA GABRILLI,ELEITO,PSDB,PSDB/DEM/PPS,12
PEDREIRA,DEPUTADO FEDERAL,JOÃO PAULO FERRARESSO,JOÃO PAULO CORSETTI FERRARESSO,SUPLENTE,PSDB,PSDB/DEM/PPS,8
PEDREIRA,DEPUTADO FEDERAL,CARLOS BRAGA,CARLOS EDUARDO FARACO BRAGA,SUPLENTE,PSDB,PSDB/DEM/PPS,9
PEDREIRA,DEPUTADO FEDERAL,LELIS DA ROCHA,LELIS DA ROCHA,SUPLENTE,PSDB,PSDB/DEM/PPS,1
PEDREIRA,DEPUTADO FEDERAL,CARLOS ROBERTO,CARLOS ROBERTO DE CAMPOS,SUPLENTE,PSDB,PSDB/DEM/PPS,4
PEDREIRA,DEPUTADO FEDERAL,DIB,WILLIAM DIB,ELEITO,PSDB,PSDB/DEM/PPS,31
PEDREIRA,DEPUTADO FEDERAL,ALBERTO MOURAO,ALBERTO PEREIRA MOURAO,SUPLENTE,PSDB,PSDB/DEM/PPS,3
PEDREIRA,DEPUTADO FEDERAL,RENATO AMARY,RENATO FAUVEL AMARY,SUPLENTE,PSDB,PSDB/DEM/PPS,4
PEDREIRA,DEPUTADO FEDERAL,SILVIO TORRES,SILVIO FRANÇA TORRES,SUPLENTE,PSDB,PSDB/DEM/PPS,9
PEDREIRA,DEPUTADO FEDERAL,TIRSO MEIRELLES,TIRSO DE SALLES MEIRELLES,SUPLENTE,PSDB,PSDB/DEM/PPS,5
PEDREIRA,DEPUTADO FEDERAL,TERESA SERRANO,MARIA TERESA SERRANO AFONSO,SUPLENTE,PSDB,PSDB/DEM/PPS,1
PEDREIRA,DEPUTADO FEDERAL,EDSON APARECIDO,EDSON APARECIDO DOS SANTOS,ELEITO,PSDB,PSDB/DEM/PPS,16
PEDREIRA,DEPUTADO FEDERAL,RICARDO MONTORO,JOSE RICARDO FRANCO MONTORO,SUPLENTE,PSDB,PSDB/DEM/PPS,4
PEDREIRA,DEPUTADO FEDERAL,LUIZ FERNANDO MACHADO,LUIZ FERNANDO ARANTES MACHADO,ELEITO,PSDB,PSDB/DEM/PPS,2
PEDREIRA,DEPUTADO FEDERAL,DR. MARCELO,MARCELO CHEHADE,SUPLENTE,PSDB,PSDB/DEM/PPS,11
PEDREIRA,DEPUTADO FEDERAL,VANDERLEI MACRIS,VANDERLEI MACRIS,SUPLENTE,PSDB,PSDB/DEM/PPS,9
PEDREIRA,DEPUTADO FEDERAL,DUARTE NOGUEIRA,ANTONIO DUARTE NOGUEIRA JUNIOR,ELEITO,PSDB,PSDB/DEM/PPS,59
PEDREIRA,DEPUTADO FEDERAL,JULIO SEMEGHINI,JULIO FRACISCO SEMEGHINI NETO,ELEITO,PSDB,PSDB/DEM/PPS,22
PEDREIRA,DEPUTADO FEDERAL,GIVALDO VIEIRA,GIVALDO RODRIGUES VIEIRA,SUPLENTE,PSDB,PSDB/DEM/PPS,6
PEDREIRA,DEPUTADO FEDERAL,TRIPOLI,JOSÉ RICARDO ALVARENGA TRIPOLI,ELEITO,PSDB,PSDB/DEM/PPS,30
PEDREIRA,DEPUTADO FEDERAL,VAZ DE LIMA,JOSÉ CARLOS VAZ DE LIMA,ELEITO,PSDB,PSDB/DEM/PPS,14
PEDREIRA,DEPUTADO FEDERAL,ALEMÃO DA SÁUDE,CLAUDEMIR SERENO,SUPLENTE,PSDB,PSDB/DEM/PPS,4
PEDREIRA,DEPUTADO FEDERAL,WALTER FELDMAN,WALTER MEYER FELDMAN,SUPLENTE,PSDB,PSDB/DEM/PPS,5
PEDREIRA,DEPUTADO FEDERAL,THAME,ANTONIO CARLOS DE MENDES THAME,ELEITO,PSDB,PSDB/DEM/PPS,35
PEDREIRA,DEPUTADO FEDERAL,BRUNA FURLAN,BRUNA DIAS FURLAN,ELEITO,PSDB,PSDB/DEM/PPS,5
PEDREIRA,DEPUTADO FEDERAL,JOSÉ ANIBAL,JOSÉ ANIBAL PERES DE PONTES,ELEITO,PSDB,PSDB/DEM/PPS,6
PEDREIRA,DEPUTADO FEDERAL,GILBERTO BORJA,GILBERTO BORJA PINTO,SUPLENTE,PSDB,PSDB/DEM/PPS,1
PEDREIRA,DEPUTADO FEDERAL,PROFESSOR CLOVIS PINTO,CLOVIS DA SILVA PINTO,SUPLENTE,PSDB,PSDB/DEM/PPS,2
PEDREIRA,DEPUTADO FEDERAL,RAFAEL MOYA,RAFAEL DUARTE MOYA,SUPLENTE,PSOL,PARTIDO SOCIALISMO E LIBERDADE,2
PEDREIRA,DEPUTADO FEDERAL,HENRIQUE PADOVANI,HENRIQUE PADOVANI,SUPLENTE,PSOL,PARTIDO SOCIALISMO E LIBERDADE,1
PEDREIRA,DEPUTADO FEDERAL,RODRIGO PAIXAO,RODRIGO JOSE PAIXAO,SUPLENTE,PSOL,PARTIDO SOCIALISMO E LIBERDADE,1
PEDREIRA,DEPUTADO FEDERAL,IVAN VALENTE,IVAN VALENTE,ELEITO,PSOL,PARTIDO SOCIALISMO E LIBERDADE,57
PEDREIRA,DEPUTADO FEDERAL,ANIZIO BATISTA,ANIZIO BATISTA DE OLIVEIRA,SUPLENTE,PSOL,PARTIDO SOCIALISMO E LIBERDADE,1
PEDREIRA,DEPUTADO FEDERAL,MARIANA CONTI,MARIANA CONTI TAKAHASHI,SUPLENTE,PSOL,PARTIDO SOCIALISMO E LIBERDADE,7
PEDREIRA,DEPUTADO FEDERAL,ZENI,AUZENI MESSIAS SILVA,SUPLENTE,PSOL,PARTIDO SOCIALISMO E LIBERDADE,1
PEDREIRA,DEPUTADO FEDERAL,DR. ABELHA,CARLOS FERNANDO LOPES ABELHA,SUPLENTE,PC DO B,JUNTOS POR SÃO PAULO,2
PEDREIRA,DEPUTADO FEDERAL,GUSTAVO PETTA,GUSTAVO LEMOS PETTA,SUPLENTE,PC DO B,JUNTOS POR SÃO PAULO,5
PEDREIRA,DEPUTADO FEDERAL,SIDNEI MARTINS,SIDNEI ALVES MARTINS,SUPLENTE,PC DO B,JUNTOS POR SÃO PAULO,5
