LAGOINHA,PRESIDENTE,DILMA,DILMA VANA ROUSSEFF,2º TURNO,PT,PARA O BRASIL SEGUIR MUDANDO,891
LAGOINHA,PRESIDENTE,JOSÉ SERRA,JOSÉ SERRA,2º TURNO,PSDB,O BRASIL PODE MAIS,2359
LAGOINHA,GOVERNADOR,GERALDO ALCKMIN,GERALDO JOSE RODRIGUES ALCKMIN FILHO,ELEITO,PSDB,UNIDOS POR SÃO PAULO,2835
LAGOINHA,SENADOR,MARTA SUPLICY,MARTA SUPLICY,ELEITO,PT,UNIÃO PARA MUDAR,784
LAGOINHA,SENADOR,ALOYSIO NUNES,ALOYSIO NUNES FERREIRA FILHO,ELEITO,PSDB,UNIDOS POR SÃO PAULO,2427
LAGOINHA,DEPUTADO FEDERAL,ANTONIO BULHÕES,ANTONIO CARLOS MARTINS DE BULHÕES,ELEITO,PRB,JUNTOS POR SÃO PAULO,1
LAGOINHA,DEPUTADO FEDERAL,OTONIEL LIMA,OTONIEL CARLOS DE LIMA,MÉDIA,PRB,JUNTOS POR SÃO PAULO,3
LAGOINHA,DEPUTADO FEDERAL,TCEL JULIO LEMOS,JÚLIO FERNANDO PINHEIRO DE LEMOS,SUPLENTE,PP,PARTIDO PROGRESSISTA,3
LAGOINHA,DEPUTADO FEDERAL,MALUF,PAULO SALIM MALUF,ELEITO,PP,PARTIDO PROGRESSISTA,81
LAGOINHA,DEPUTADO FEDERAL,CAPITÃO GOMES,CARLOS GOMES DA SILVA,SUPLENTE,PP,PARTIDO PROGRESSISTA,2
LAGOINHA,DEPUTADO FEDERAL,MAURICIO MARTINS,MAURICIO LUIS MARTINS,SUPLENTE,PP,PARTIDO PROGRESSISTA,2
LAGOINHA,DEPUTADO FEDERAL,CABO WILSON,WILSON DE OLIVEIRA MORAIS,SUPLENTE,PP,PARTIDO PROGRESSISTA,7
LAGOINHA,DEPUTADO FEDERAL,PEDRINHO ISHIDA,PEDRO ISHIDA,SUPLENTE,PP,PARTIDO PROGRESSISTA,1
LAGOINHA,DEPUTADO FEDERAL,CARLITO VIANA,CARLITO VIANA SOARES,SUPLENTE,PDT,PARTIDO DEMOCRÁTICO TRABALHISTA,3
LAGOINHA,DEPUTADO FEDERAL,JOÃO DADO,JOÃO EDUARDO DADO LEITE DE CARVALHO,ELEITO,PDT,PARTIDO DEMOCRÁTICO TRABALHISTA,3
LAGOINHA,DEPUTADO FEDERAL,PAULINHO DA FORÇA,PAULO PEREIRA DA SILVA,ELEITO,PDT,PARTIDO DEMOCRÁTICO TRABALHISTA,9
LAGOINHA,DEPUTADO FEDERAL,ARMANDO HENRIQUE,ARMANDO HENRIQUE,SUPLENTE,PDT,PARTIDO DEMOCRÁTICO TRABALHISTA,1
LAGOINHA,DEPUTADO FEDERAL,MEDEIROS,LUIZ ANTONIO DE MEDEIROS NETO,SUPLENTE,PDT,PARTIDO DEMOCRÁTICO TRABALHISTA,3
LAGOINHA,DEPUTADO FEDERAL,DR LUIZ CHIAPARINE,LUIZ CARLOS CHIAPARINE,SUPLENTE,PDT,PARTIDO DEMOCRÁTICO TRABALHISTA,1
LAGOINHA,DEPUTADO FEDERAL,SALVADOR ZIMBALDI,SALVADOR ZIMBALDI FILHO,MÉDIA,PDT,PARTIDO DEMOCRÁTICO TRABALHISTA,9
LAGOINHA,DEPUTADO FEDERAL,SARGENTO ERNALDO,ERNALDO CESAR MARCONDES,SUPLENTE,PDT,PARTIDO DEMOCRÁTICO TRABALHISTA,1
LAGOINHA,DEPUTADO FEDERAL,LARGUESA,LUIS VANDERLEI LARGUESA,SUPLENTE,PT,JUNTOS POR SÃO PAULO,2
LAGOINHA,DEPUTADO FEDERAL,VACCAREZZA,CANDIDO ELPIDIO DE SOUZA VACCAREZZA,ELEITO,PT,JUNTOS POR SÃO PAULO,3
LAGOINHA,DEPUTADO FEDERAL,GENOINO,JOSÉ GENOÍNO NETO,SUPLENTE,PT,JUNTOS POR SÃO PAULO,3
LAGOINHA,DEPUTADO FEDERAL,CARLINHOS ALMEIDA,CARLOS JOSE DE ALMEIDA,ELEITO,PT,JUNTOS POR SÃO PAULO,62
LAGOINHA,DEPUTADO FEDERAL,ARLINDO CHINAGLIA,ARLINDO CHIGNALIA JUNIOR,ELEITO,PT,JUNTOS POR SÃO PAULO,1
LAGOINHA,DEPUTADO FEDERAL,JOÃO PAULO CUNHA,JOÃO PAULO CUNHA,ELEITO,PT,JUNTOS POR SÃO PAULO,12
LAGOINHA,DEPUTADO FEDERAL,RICARDO BERZOINI,RICARDO JOSE RIBEIRO BERZOINI,ELEITO,PT,JUNTOS POR SÃO PAULO,53
LAGOINHA,DEPUTADO FEDERAL,PROF. CARLÃO RAMIRO,CARLOS RAMIRO CASTRO,SUPLENTE,PT,JUNTOS POR SÃO PAULO,3
LAGOINHA,DEPUTADO FEDERAL,FÉLIX SAHÃO,FÉLIX SAHÃO JÚNIOR,SUPLENTE,PT,JUNTOS POR SÃO PAULO,19
LAGOINHA,DEPUTADO FEDERAL,TENENTE PAZ,FRANCISCO JESUS DA PAZ,SUPLENTE,PT,JUNTOS POR SÃO PAULO,4
LAGOINHA,DEPUTADO FEDERAL,VANDERLEI SIRAQUE,VANDERLEI SIRAQUE,SUPLENTE,PT,JUNTOS POR SÃO PAULO,1
LAGOINHA,DEPUTADO FEDERAL,JILMAR TATTO,JILMAR AUGUSTINHO TATTO,ELEITO,PT,JUNTOS POR SÃO PAULO,4
LAGOINHA,DEPUTADO FEDERAL,EDSON DA PAZ (O CANTOR),EDSON DA PAZ,SUPLENTE,PT,JUNTOS POR SÃO PAULO,1
LAGOINHA,DEPUTADO FEDERAL,RUBINHO BASTOS,RUBENS BASTOS DO NASCIMENTO,SUPLENTE,PT,JUNTOS POR SÃO PAULO,3
LAGOINHA,DEPUTADO FEDERAL,ZARATTINI,CARLOS ALBERTO ROLIM ZARATTINI,ELEITO,PT,JUNTOS POR SÃO PAULO,1
LAGOINHA,DEPUTADO FEDERAL,VICENTINHO,VICENTE PAULO DA SILVA,ELEITO,PT,JUNTOS POR SÃO PAULO,4
LAGOINHA,DEPUTADO FEDERAL,CLAURY,CLAURY SANTOS ALVES DA SILVA,SUPLENTE,PTB,PARTIDO TRABALHISTA BRASILEIRO,1
LAGOINHA,DEPUTADO FEDERAL,VAMPETA,MARCOS ANDRE BATISTA SANTOS,SUPLENTE,PTB,PARTIDO TRABALHISTA BRASILEIRO,1
LAGOINHA,DEPUTADO FEDERAL,NELSON MARQUEZELLI,NELSON MARQUEZELLI,ELEITO,PTB,PARTIDO TRABALHISTA BRASILEIRO,2
LAGOINHA,DEPUTADO FEDERAL,ARNALDO FARIA DE SÁ,ARNALDO FARIA DE SÁ,ELEITO,PTB,PARTIDO TRABALHISTA BRASILEIRO,9
LAGOINHA,DEPUTADO FEDERAL,PASTOR JOAO ALMEIDA,JOAO ALMEIDA DOS SANTOS,SUPLENTE,PTB,PARTIDO TRABALHISTA BRASILEIRO,2
LAGOINHA,DEPUTADO FEDERAL,EMELLY OLIVEIRA,EMELLY PAGLIARI CARDOSO ALVES DE OLIVEIRA,SUPLENTE,PTB,PARTIDO TRABALHISTA BRASILEIRO,1
LAGOINHA,DEPUTADO FEDERAL,MARCOS TENÓRIO,MARCOS ANTÔNIO FERREIRA TENÓRIO,SUPLENTE,PMDB,PARTIDO DO MOVIMENTO DEMOCRÁTICO BRASILEIRO,1
LAGOINHA,DEPUTADO FEDERAL,PAULINHO SOBRAL,PAULO MENDES SOBRAL,SUPLENTE,PMDB,PARTIDO DO MOVIMENTO DEMOCRÁTICO BRASILEIRO,2
LAGOINHA,DEPUTADO FEDERAL,TONY JUPSSON,TONY JUPSSON SANTOS,SUPLENTE,PMDB,PARTIDO DO MOVIMENTO DEMOCRÁTICO BRASILEIRO,1
LAGOINHA,DEPUTADO FEDERAL,MISSIONARIA NAZARE,MARIA NAZARE DOS SANTOS SORRILLO,SUPLENTE,PSC,HUMANISTA CRISTÃO ,1
LAGOINHA,DEPUTADO FEDERAL,MARCO FELICIANO,MARCO ANTONIO FELICIANO,ELEITO,PSC,HUMANISTA CRISTÃO ,3
LAGOINHA,DEPUTADO FEDERAL,TENENTE ORLANDO,ORLANDO BENEDITO DE LIMA,SUPLENTE,PSC,HUMANISTA CRISTÃO ,65
LAGOINHA,DEPUTADO FEDERAL,REGIS DE OLIVEIRA,REGIS FERNANDES DE OLIVEIRA,SUPLENTE,PSC,HUMANISTA CRISTÃO ,70
LAGOINHA,DEPUTADO FEDERAL,DALVAN,JOÃO GOMES DE ALMEIDA,SUPLENTE,PSC,HUMANISTA CRISTÃO ,1
LAGOINHA,DEPUTADO FEDERAL,DUDA VILELA,CARLOS EDUARDO VILELA,SUPLENTE,PSC,HUMANISTA CRISTÃO ,6
LAGOINHA,DEPUTADO FEDERAL,DANILO MIKILIM,DANILO JOSE DE TOLEDO,SUPLENTE,PSC,HUMANISTA CRISTÃO ,128
LAGOINHA,DEPUTADO FEDERAL,TONHO BAIANO,JOSE ANTONIO OLIVEIRA DOS SANTOS,SUPLENTE,PSC,HUMANISTA CRISTÃO ,1
LAGOINHA,DEPUTADO FEDERAL,AGNALDO TIMOTEO,AGUINALDO TIMOTEO PEREIRA,SUPLENTE,PR,JUNTOS POR SÃO PAULO,2
LAGOINHA,DEPUTADO FEDERAL,TIRIRICA,FRANCISCO EVERARDO OLIVEIRA SILVA,ELEITO,PR,JUNTOS POR SÃO PAULO,96
LAGOINHA,DEPUTADO FEDERAL,PR PAULO FREIRE,PAULO ROBERTO FREIRE DA COSTA,ELEITO,PR,JUNTOS POR SÃO PAULO,7
LAGOINHA,DEPUTADO FEDERAL,VALDEMAR COSTA NETO,VALDEMAR COSTA NETO,ELEITO,PR,JUNTOS POR SÃO PAULO,376
LAGOINHA,DEPUTADO FEDERAL,ROBERTO FREIRE,ROBERTO JOAO PEREIRA FREIRE,ELEITO,PPS,PSDB/DEM/PPS,29
LAGOINHA,DEPUTADO FEDERAL,JOSE ONERIO,JOSE ONERIO DA SILVA,SUPLENTE,PPS,PSDB/DEM/PPS,4
LAGOINHA,DEPUTADO FEDERAL,ARNALDO JARDIM,ARNALDO CALIL PEREIRA JARDIM,ELEITO,PPS,PSDB/DEM/PPS,3
LAGOINHA,DEPUTADO FEDERAL,PROF POLLYANA GAMA,POLLYANA FATIMA GAMA SANTOS,SUPLENTE,PPS,PSDB/DEM/PPS,35
LAGOINHA,DEPUTADO FEDERAL,DOUTOR LIMA,FRANCISCO ALVES DE LIMA,SUPLENTE,PPS,PSDB/DEM/PPS,140
LAGOINHA,DEPUTADO FEDERAL,JORGINHO MALULY,JORGE DE FARIA MALULY,SUPLENTE,DEM,PSDB/DEM/PPS,1
LAGOINHA,DEPUTADO FEDERAL,ALEXANDRE LEITE,ALEXANDRE LEITE DA SILVA,MÉDIA,DEM,PSDB/DEM/PPS,62
LAGOINHA,DEPUTADO FEDERAL,PROFESSOR BENJAMIN,BENJAMIN RIBEIRO DA SILVA,SUPLENTE,DEM,PSDB/DEM/PPS,1
LAGOINHA,DEPUTADO FEDERAL,KIKO DO KLB,FRANCO FINATO SCORNAVACCA,SUPLENTE,DEM,PSDB/DEM/PPS,5
LAGOINHA,DEPUTADO FEDERAL,RODRIGO GARCIA,RODRIGO GARCIA,ELEITO,DEM,PSDB/DEM/PPS,2
LAGOINHA,DEPUTADO FEDERAL,RAUL GIL JR,RAUL GIL JUNIOR,SUPLENTE,DEM,PSDB/DEM/PPS,7
LAGOINHA,DEPUTADO FEDERAL,JUNJI ABE,JUNJI ABE,ELEITO,DEM,PSDB/DEM/PPS,25
LAGOINHA,DEPUTADO FEDERAL,MANDIC,ALEKSANDAR CARLOS MANDIC,SUPLENTE,DEM,PSDB/DEM/PPS,6
LAGOINHA,DEPUTADO FEDERAL,DR ELEUSES PAIVA,ELEUSES VIEIRA DE PAIVA,SUPLENTE,DEM,PSDB/DEM/PPS,2
LAGOINHA,DEPUTADO FEDERAL,WALTER IHOSHI,WALTER SHINDI IIHOSHI,SUPLENTE,DEM,PSDB/DEM/PPS,1
LAGOINHA,DEPUTADO FEDERAL,PROF HERMES,HERMES RODRIGUES NERY,SUPLENTE,PHS,HUMANISTA CRISTÃO ,2
LAGOINHA,DEPUTADO FEDERAL,EDSON PENNA,EDSON PENNA FRANCISCO,SUPLENTE,PSB,PRESTE ATENÇÃO SÃO PAULO,1
LAGOINHA,DEPUTADO FEDERAL,MARCELINHO CARIOCA,MARCELO PEREIRA SURCIN,SUPLENTE,PSB,PRESTE ATENÇÃO SÃO PAULO,4
LAGOINHA,DEPUTADO FEDERAL,CAPITÃO AUGUSTO,JOSÉ AUGUSTO ROSA,SUPLENTE,PSB,PRESTE ATENÇÃO SÃO PAULO,8
LAGOINHA,DEPUTADO FEDERAL,LUIZA ERUNDINA,LUIZA ERUNDINA DE SOUSA,ELEITO,PSB,PRESTE ATENÇÃO SÃO PAULO,1
LAGOINHA,DEPUTADO FEDERAL,TIO DO DOCE,MANOEL CARDOSO DA SILVA,SUPLENTE,PSB,PRESTE ATENÇÃO SÃO PAULO,1
LAGOINHA,DEPUTADO FEDERAL,TORINO,PAULO SERGIO TORINO,SUPLENTE,PSB,PRESTE ATENÇÃO SÃO PAULO,240
LAGOINHA,DEPUTADO FEDERAL,GABRIEL CHALITA,GABRIEL BENEDITO ISSAAC CHALITA,ELEITO,PSB,PRESTE ATENÇÃO SÃO PAULO,86
LAGOINHA,DEPUTADO FEDERAL,DRA. ROSIANE FARIAS,ROSIANE MACIEL DE FARIAS,SUPLENTE,PSB,PRESTE ATENÇÃO SÃO PAULO,1
LAGOINHA,DEPUTADO FEDERAL,JEFFERSON CAMPOS,JEFFERSON ALVES DE CAMPOS,ELEITO,PSB,PRESTE ATENÇÃO SÃO PAULO,1
LAGOINHA,DEPUTADO FEDERAL,GRAÇA,MARIA DAS GRAÇAS GONÇALVES OLIVEIRA,SUPLENTE,PSB,PRESTE ATENÇÃO SÃO PAULO,60
LAGOINHA,DEPUTADO FEDERAL,DR. UBIALI,MARCO AURÉLIO UBIALI,SUPLENTE,PSB,PRESTE ATENÇÃO SÃO PAULO,3
LAGOINHA,DEPUTADO FEDERAL,OTA,IOLANDA KEIKO MIASHIRO OTA,ELEITO,PSB,PRESTE ATENÇÃO SÃO PAULO,3
LAGOINHA,DEPUTADO FEDERAL,MIGUEL SAMPAIO,MIGUEL SAMPAIO JUNIOR,SUPLENTE,PSB,PRESTE ATENÇÃO SÃO PAULO,23
LAGOINHA,DEPUTADO FEDERAL,GUILHERME MUSSI,GUILHERME MUSSI FERREIRA,ELEITO,PV,PARTIDO VERDE,62
LAGOINHA,DEPUTADO FEDERAL,VICENTE DA UPA,VICENTE CARVALHO E SILVA,SUPLENTE,PV,PARTIDO VERDE,2
LAGOINHA,DEPUTADO FEDERAL,ROBERTO SANTIAGO,JOSE ROBERTO SANTIAGO GOMES,ELEITO,PV,PARTIDO VERDE,1
LAGOINHA,DEPUTADO FEDERAL,NUBIA SENNA,NUBIA DE SENA CARNEIRO,SUPLENTE,PV,PARTIDO VERDE,1
LAGOINHA,DEPUTADO FEDERAL,ALE YOUSSEF,ALEXANDRE DE ALMEIDA YOUSSEF,SUPLENTE,PV,PARTIDO VERDE,1
LAGOINHA,DEPUTADO FEDERAL,MARCELO ORTIZ,FRANCISCO MARCELO ORTIZ FILHO,SUPLENTE,PV,PARTIDO VERDE,171
LAGOINHA,DEPUTADO FEDERAL,PENNA,JOSÉ LUIZ DE FRANÇA PENNA,ELEITO,PV,PARTIDO VERDE,5
LAGOINHA,DEPUTADO FEDERAL,DR. ÂNGELO,ANGELO DOMINGOS NUCCI,SUPLENTE,PV,PARTIDO VERDE,3
LAGOINHA,DEPUTADO FEDERAL,WALTER FELIX,WALTER FÉLIX,SUPLENTE,PV,PARTIDO VERDE,1
LAGOINHA,DEPUTADO FEDERAL,RICARDO IZAR,RICARDO IZAR JUNIOR,ELEITO,PV,PARTIDO VERDE,6
LAGOINHA,DEPUTADO FEDERAL,HENRIQUE NUNES,HENRIQUE ANTONIO PAIVA NUNES,SUPLENTE,PV,PARTIDO VERDE,256
LAGOINHA,DEPUTADO FEDERAL,WALTER MELLO,WALTER CASTRO DE MELLO,SUPLENTE,PSDB,PSDB/DEM/PPS,1
LAGOINHA,DEPUTADO FEDERAL,STANGARLINI,JOSE CARLOS STANGARLINI,SUPLENTE,PSDB,PSDB/DEM/PPS,1
LAGOINHA,DEPUTADO FEDERAL,RAUL CHRISTIANO,RAUL CHRISTIANO DE OLIVEIRA SANCHEZ,SUPLENTE,PSDB,PSDB/DEM/PPS,1
LAGOINHA,DEPUTADO FEDERAL,LOBBE NETO,ANTONIO ADOLPHO LOBBE NETO,SUPLENTE,PSDB,PSDB/DEM/PPS,4
LAGOINHA,DEPUTADO FEDERAL,FELICIDADE,FELICIDADE LOPES PONTES,SUPLENTE,PSDB,PSDB/DEM/PPS,2
LAGOINHA,DEPUTADO FEDERAL,MANOEL MARCOS (MANÉ),MANOEL MARCOS DE JESUS FERREIRA,SUPLENTE,PSDB,PSDB/DEM/PPS,9
LAGOINHA,DEPUTADO FEDERAL,EMANUEL FERNANDES,EMANUEL FERNANDES,ELEITO,PSDB,PSDB/DEM/PPS,43
LAGOINHA,DEPUTADO FEDERAL,MARA GABRILLI,MARA CRISTINA GABRILLI,ELEITO,PSDB,PSDB/DEM/PPS,1
LAGOINHA,DEPUTADO FEDERAL,LELIS DA ROCHA,LELIS DA ROCHA,SUPLENTE,PSDB,PSDB/DEM/PPS,4
LAGOINHA,DEPUTADO FEDERAL,CARLOS ROBERTO,CARLOS ROBERTO DE CAMPOS,SUPLENTE,PSDB,PSDB/DEM/PPS,2
LAGOINHA,DEPUTADO FEDERAL,DIB,WILLIAM DIB,ELEITO,PSDB,PSDB/DEM/PPS,3
LAGOINHA,DEPUTADO FEDERAL,ALBERTO MOURAO,ALBERTO PEREIRA MOURAO,SUPLENTE,PSDB,PSDB/DEM/PPS,68
LAGOINHA,DEPUTADO FEDERAL,RENATO AMARY,RENATO FAUVEL AMARY,SUPLENTE,PSDB,PSDB/DEM/PPS,1
LAGOINHA,DEPUTADO FEDERAL,SILVIO TORRES,SILVIO FRANÇA TORRES,SUPLENTE,PSDB,PSDB/DEM/PPS,5
LAGOINHA,DEPUTADO FEDERAL,EDSON APARECIDO,EDSON APARECIDO DOS SANTOS,ELEITO,PSDB,PSDB/DEM/PPS,68
LAGOINHA,DEPUTADO FEDERAL,RICARDO MONTORO,JOSE RICARDO FRANCO MONTORO,SUPLENTE,PSDB,PSDB/DEM/PPS,362
LAGOINHA,DEPUTADO FEDERAL,LUIZ FERNANDO MACHADO,LUIZ FERNANDO ARANTES MACHADO,ELEITO,PSDB,PSDB/DEM/PPS,32
LAGOINHA,DEPUTADO FEDERAL,VANDERLEI MACRIS,VANDERLEI MACRIS,SUPLENTE,PSDB,PSDB/DEM/PPS,3
LAGOINHA,DEPUTADO FEDERAL,DUARTE NOGUEIRA,ANTONIO DUARTE NOGUEIRA JUNIOR,ELEITO,PSDB,PSDB/DEM/PPS,3
LAGOINHA,DEPUTADO FEDERAL,RAFAEL ABUD,RAFAEL ANGELO ABUD,SUPLENTE,PSDB,PSDB/DEM/PPS,1
LAGOINHA,DEPUTADO FEDERAL,GIVALDO VIEIRA,GIVALDO RODRIGUES VIEIRA,SUPLENTE,PSDB,PSDB/DEM/PPS,1
LAGOINHA,DEPUTADO FEDERAL,TRIPOLI,JOSÉ RICARDO ALVARENGA TRIPOLI,ELEITO,PSDB,PSDB/DEM/PPS,5
LAGOINHA,DEPUTADO FEDERAL,VAZ DE LIMA,JOSÉ CARLOS VAZ DE LIMA,ELEITO,PSDB,PSDB/DEM/PPS,73
LAGOINHA,DEPUTADO FEDERAL,ARNALDO MADEIRA,ARNALDO DE ABREU MADEIRA,SUPLENTE,PSDB,PSDB/DEM/PPS,3
LAGOINHA,DEPUTADO FEDERAL,JOSÉ ANIBAL,JOSÉ ANIBAL PERES DE PONTES,ELEITO,PSDB,PSDB/DEM/PPS,14
LAGOINHA,DEPUTADO FEDERAL,GILBERTO BORJA,GILBERTO BORJA PINTO,SUPLENTE,PSDB,PSDB/DEM/PPS,1
LAGOINHA,DEPUTADO FEDERAL,IVAN VALENTE,IVAN VALENTE,ELEITO,PSOL,PARTIDO SOCIALISMO E LIBERDADE,9
LAGOINHA,DEPUTADO FEDERAL,CÉLIO TURINO,CÉLIO ROBERTO TURINO DE MIRANDA,SUPLENTE,PC DO B,JUNTOS POR SÃO PAULO,83
LAGOINHA,DEPUTADO FEDERAL,ALDO REBELO,JOSÉ ALDO REBELO FIGUEIREDO,ELEITO,PC DO B,JUNTOS POR SÃO PAULO,4
LAGOINHA,DEPUTADO FEDERAL,DELEGADO PROTÓGENES,PROTÓGENES PINHEIRO DE QUEIROZ,MÉDIA,PC DO B,JUNTOS POR SÃO PAULO,1
LAGOINHA,DEPUTADO ESTADUAL,CURIATI,ANTONIO SALIM CURIATI,ELEITO,PP,PARTIDO PROGRESSISTA,2
LAGOINHA,DEPUTADO ESTADUAL,DR. SERGIO CHEBEL,SERGIO CABRAL CHEBEL,SUPLENTE,PP,PARTIDO PROGRESSISTA,1
LAGOINHA,DEPUTADO ESTADUAL,CELSO LEITE,CELSO MARCELINO LEITE,SUPLENTE,PP,PARTIDO PROGRESSISTA,1
LAGOINHA,DEPUTADO ESTADUAL,FARIA JR,WALDEMAR ALVES FARIA JUNIOR,SUPLENTE,PP,PARTIDO PROGRESSISTA,1
LAGOINHA,DEPUTADO ESTADUAL,RUSSOMANNO,MOZART ABAETE PERUIBE RUSSOMANNO,SUPLENTE,PP,PARTIDO PROGRESSISTA,3
LAGOINHA,DEPUTADO ESTADUAL,AURELIO,AURELIO JOSE CLAUDIO,SUPLENTE,PDT,PARTIDO DEMOCRÁTICO TRABALHISTA,2
LAGOINHA,DEPUTADO ESTADUAL,DR RENAN,RENAN MARINO,SUPLENTE,PDT,PARTIDO DEMOCRÁTICO TRABALHISTA,2
LAGOINHA,DEPUTADO ESTADUAL,DINEI,CLAUDINEI ALEXANDRE PIRES,SUPLENTE,PDT,PARTIDO DEMOCRÁTICO TRABALHISTA,1
LAGOINHA,DEPUTADO ESTADUAL,JOSE BITTENCOURT,JOSE DOMINGOS BITTENCOURT,ELEITO,PDT,PARTIDO DEMOCRÁTICO TRABALHISTA,3
LAGOINHA,DEPUTADO ESTADUAL,MAJOR OLIMPIO,SERGIO OLIMPIO GOMES,ELEITO,PDT,PARTIDO DEMOCRÁTICO TRABALHISTA,10
LAGOINHA,DEPUTADO ESTADUAL,NICOLACI,RONALD LUIZ NICOLACI FINCATTI,SUPLENTE,PDT,PARTIDO DEMOCRÁTICO TRABALHISTA,1
LAGOINHA,DEPUTADO ESTADUAL,RAFAEL SILVA,RAFAEL ANTONIO DA SILVA,ELEITO,PDT,PARTIDO DEMOCRÁTICO TRABALHISTA,1
LAGOINHA,DEPUTADO ESTADUAL,HELIO BASTOS,HELIO DE ALMEIDA BASTOS,SUPLENTE,PDT,PARTIDO DEMOCRÁTICO TRABALHISTA,1
LAGOINHA,DEPUTADO ESTADUAL,PAULO BARBOSA,PAULO ROBERTO BARBOSA,SUPLENTE,PDT,PARTIDO DEMOCRÁTICO TRABALHISTA,1
LAGOINHA,DEPUTADO ESTADUAL,DR. JOÃO CARLOS,JOÃO CARLOS FRANÇA DE PAULA SANTOS,SUPLENTE,PT,SOMOS MAIS SÃO PAULO,18
LAGOINHA,DEPUTADO ESTADUAL,BETO COELHO,PAULO ROBERTO CABRAL COELHO,SUPLENTE,PT,SOMOS MAIS SÃO PAULO,11
LAGOINHA,DEPUTADO ESTADUAL,WAGNER BALIEIRO,WAGNER OCIMAR BALIEIRO,SUPLENTE,PT,SOMOS MAIS SÃO PAULO,1
LAGOINHA,DEPUTADO ESTADUAL,JURA,JURACY FRANCISCO DE JESUS,SUPLENTE,PT,SOMOS MAIS SÃO PAULO,2
LAGOINHA,DEPUTADO ESTADUAL,EDINHO SILVA,EDSON ANTONIO EDINHO DA SILVA,ELEITO,PT,SOMOS MAIS SÃO PAULO,68
LAGOINHA,DEPUTADO ESTADUAL,ENIO TATTO,ENIO FRANCISCO TATTO,ELEITO,PT,SOMOS MAIS SÃO PAULO,2
LAGOINHA,DEPUTADO ESTADUAL,MARCO AURÉLIO DE SOUZA,MARCO AURÉLIO DE SOUZA,MÉDIA,PT,SOMOS MAIS SÃO PAULO,2
LAGOINHA,DEPUTADO ESTADUAL,CRISTINA DA USP,CRISTINA SIMOES,SUPLENTE,PT,SOMOS MAIS SÃO PAULO,1
LAGOINHA,DEPUTADO ESTADUAL,EUVANILDE,EUVANILDE RODRIGUES DA SILVA,SUPLENTE,PT,SOMOS MAIS SÃO PAULO,1
LAGOINHA,DEPUTADO ESTADUAL,LUIZ CLAUDIO MARCOLINO,LUIZ CLAUDIO MARCOLINO,ELEITO,PT,SOMOS MAIS SÃO PAULO,2
LAGOINHA,DEPUTADO ESTADUAL,ROBERTO FELICIO,ROBERTO FELICIO,SUPLENTE,PT,SOMOS MAIS SÃO PAULO,44
LAGOINHA,DEPUTADO ESTADUAL,BETH SAHAO,ELISABETH SAHÃO,SUPLENTE,PT,SOMOS MAIS SÃO PAULO,1
LAGOINHA,DEPUTADO ESTADUAL,VERA SABA,VERA LÚCIA SANTOS SABA,SUPLENTE,PT,SOMOS MAIS SÃO PAULO,98
LAGOINHA,DEPUTADO ESTADUAL,ANA DO CARMO,ANA MARIA DO CARMO ROSSETO,ELEITO,PT,SOMOS MAIS SÃO PAULO,1
LAGOINHA,DEPUTADO ESTADUAL,CARLOS GRANA,CARLOS ALBERTO GRANA,ELEITO,PT,SOMOS MAIS SÃO PAULO,8
LAGOINHA,DEPUTADO ESTADUAL,CAMPOS MACHADO,ANTONIO CARLOS DE CAMPOS MACHADO,ELEITO,PTB,PARTIDO TRABALHISTA BRASILEIRO,33
LAGOINHA,DEPUTADO ESTADUAL,CORONEL EDSON FERRARINI,EDSON FERRARINI,ELEITO,PTB,PARTIDO TRABALHISTA BRASILEIRO,3
LAGOINHA,DEPUTADO ESTADUAL,WALDIR AGNELLO,WALDIR AGNELLO,SUPLENTE,PTB,PARTIDO TRABALHISTA BRASILEIRO,1
LAGOINHA,DEPUTADO ESTADUAL,BALEIA ROSSI,LUIZ FELIPE BALEIA TENUTO ROSSI,ELEITO,PMDB,PARTIDO DO MOVIMENTO DEMOCRÁTICO BRASILEIRO,4
LAGOINHA,DEPUTADO ESTADUAL,DR. ITAMAR,ITAMAR COPPIO,SUPLENTE,PMDB,PARTIDO DO MOVIMENTO DEMOCRÁTICO BRASILEIRO,2
LAGOINHA,DEPUTADO ESTADUAL,VANESSA DAMO,VANESSA DAMO OROSCO,ELEITO,PMDB,PARTIDO DO MOVIMENTO DEMOCRÁTICO BRASILEIRO,4
LAGOINHA,DEPUTADO ESTADUAL,CHICO DA ADEGA,FRANCISCO PEREIRA GOMES,SUPLENTE,PMDB,PARTIDO DO MOVIMENTO DEMOCRÁTICO BRASILEIRO,2
LAGOINHA,DEPUTADO ESTADUAL,CIDA FERREIRA,MARIA APARECIDA FERREIRA,SUPLENTE,PMDB,PARTIDO DO MOVIMENTO DEMOCRÁTICO BRASILEIRO,5
LAGOINHA,DEPUTADO ESTADUAL,DR. CALE,CARLOS EDUARDO ANTUNES DE OLIVEIRA,SUPLENTE,PSC,HUMANISTA CRISTÃO ,66
LAGOINHA,DEPUTADO ESTADUAL,MERCIDES JUNIOR,MERCIDES FRANC PEREIRA DO CARMO,SUPLENTE,PSC,HUMANISTA CRISTÃO ,1
LAGOINHA,DEPUTADO ESTADUAL,LEANDRO AMARAL,LEANDRO GODINES DO AMARAL,SUPLENTE,PSC,HUMANISTA CRISTÃO ,42
LAGOINHA,DEPUTADO ESTADUAL,GUIMARÃES,WALTER GUIMARÃES RODRIGUES,SUPLENTE,PSC,HUMANISTA CRISTÃO ,1
LAGOINHA,DEPUTADO ESTADUAL,GUSTAVO POZZI,GUSTAVO CAETANO POZZI DA CUNHA,SUPLENTE,PSC,HUMANISTA CRISTÃO ,5
LAGOINHA,DEPUTADO ESTADUAL,SAID MOURAD,AHMAD SAID MOURAD,SUPLENTE,PSC,HUMANISTA CRISTÃO ,13
LAGOINHA,DEPUTADO ESTADUAL,CESAR NASCIMENTO-RADIO CAPITAL,SEBASTIÃO PEREIRA NASCIMENTO,SUPLENTE,PSC,HUMANISTA CRISTÃO ,2
LAGOINHA,DEPUTADO ESTADUAL,EDUARDO MARTINS,EDUARDO MARTINS BATISTA,SUPLENTE,PSC,HUMANISTA CRISTÃO ,1
LAGOINHA,DEPUTADO ESTADUAL,NELSON FERNANDES,JOSE NELSON AGUIAR FERNANDES,SUPLENTE,PSC,HUMANISTA CRISTÃO ,10
LAGOINHA,DEPUTADO ESTADUAL,WALTER GOMES,WALTER GOMES DE OLIVEIRA,SUPLENTE,PR,SOMOS MAIS SÃO PAULO,1
LAGOINHA,DEPUTADO ESTADUAL,ZE PEDRO,JOSE PEDRO LEITE DA SILVA,SUPLENTE,PR,SOMOS MAIS SÃO PAULO,1
LAGOINHA,DEPUTADO ESTADUAL,LILI AIMAR,LILIANA MEDEIROS DE ALMEIDA AYMAR BECHARA,SUPLENTE,PR,SOMOS MAIS SÃO PAULO,1
LAGOINHA,DEPUTADO ESTADUAL,ALEXANDRE DA FARMACIA,ALEXANDRE JOSE DA CUNHA,SUPLENTE,PR,SOMOS MAIS SÃO PAULO,56
LAGOINHA,DEPUTADO ESTADUAL,PATRICIA LIMA,PATRICIA FREITAS LIMA,SUPLENTE,PR,SOMOS MAIS SÃO PAULO,2
LAGOINHA,DEPUTADO ESTADUAL,JOSIAS DINIZ,JOSIAS ANTONIO DINIZ,SUPLENTE,PR,SOMOS MAIS SÃO PAULO,1
LAGOINHA,DEPUTADO ESTADUAL,ROY NELSON,ROY NELSON PINTO,SUPLENTE,PR,SOMOS MAIS SÃO PAULO,1
LAGOINHA,DEPUTADO ESTADUAL,ANDRE DO PRADO,ANDRE LUIS DO PRADO,ELEITO,PR,SOMOS MAIS SÃO PAULO,329
LAGOINHA,DEPUTADO ESTADUAL,OSMAR UNGARI FILHO MEDICO CAPI,OSMAR UNGARI FILHO,SUPLENTE,PPS,PARTIDO POPULAR SOCIALISTA,1
LAGOINHA,DEPUTADO ESTADUAL,JOSE MESSINA,JOSE DE LORENZO MESSINA,SUPLENTE,PPS,PARTIDO POPULAR SOCIALISTA,2
LAGOINHA,DEPUTADO ESTADUAL,GONDIM,LUIZ CARLOS GONDIM TEIXEIRA,ELEITO,PPS,PARTIDO POPULAR SOCIALISTA,200
LAGOINHA,DEPUTADO ESTADUAL,PROFESSOR ZE MARIA,JOSE MARIA CANCELLIERO,SUPLENTE,PPS,PARTIDO POPULAR SOCIALISTA,3
LAGOINHA,DEPUTADO ESTADUAL,MYRIAM ALCKMIN,MYRIAM ALCKMIN RAMOS NOGUEIRA,SUPLENTE,PPS,PARTIDO POPULAR SOCIALISTA,96
LAGOINHA,DEPUTADO ESTADUAL,RICARDO MUTRAN,RICARDO JORGE MUTRAN,SUPLENTE,DEM,PSDB/DEM,5
LAGOINHA,DEPUTADO ESTADUAL,ULISSES SALES,ULISSES ROBERTO CORNAZZANI SALES,SUPLENTE,DEM,PSDB/DEM,52
LAGOINHA,DEPUTADO ESTADUAL,EDMIR CHEDID,EDMIR JOSE ABI CHEDID,ELEITO,DEM,PSDB/DEM,62
LAGOINHA,DEPUTADO ESTADUAL,ESTEVAM GALVAO,ESTEVAM GALVAO DE OLIVEIRA,ELEITO,DEM,PSDB/DEM,3
LAGOINHA,DEPUTADO ESTADUAL,MILTON VIEIRA,MILTON VIEIRA PINTO,ELEITO,DEM,PSDB/DEM,3
LAGOINHA,DEPUTADO ESTADUAL,ZE LUIZ,JOSE LUIZ NODAR RIBEIRO,SUPLENTE,DEM,PSDB/DEM,1
LAGOINHA,DEPUTADO ESTADUAL,JOAO BARBOSA,JOAO BARBOSA DE CARVALHO,SUPLENTE,DEM,PSDB/DEM,1
LAGOINHA,DEPUTADO ESTADUAL,SALLES,RAIMUNDO TARASKEVICIUS SALES,SUPLENTE,DEM,PSDB/DEM,2
LAGOINHA,DEPUTADO ESTADUAL,GIL ARANTES,GILBERTO MACEDO GIL ARANTES,ELEITO,DEM,PSDB/DEM,108
LAGOINHA,DEPUTADO ESTADUAL,ZE LOUQUINHO,JOSE LUIZ RODRIGUES,SUPLENTE,DEM,PSDB/DEM,50
LAGOINHA,DEPUTADO ESTADUAL,LEANDRO DO KLB,LEANDRO FINATO SCORNAVACCA,SUPLENTE,DEM,PSDB/DEM,10
LAGOINHA,DEPUTADO ESTADUAL,EDUARDO BETTIN,CARLOS EDUARDO DA FONSECA BETTIN,SUPLENTE,PHS,HUMANISTA CRISTÃO ,1
LAGOINHA,DEPUTADO ESTADUAL,DR. GENNARI,MARCELO GENNARI BORATTO,SUPLENTE,PSB,PARTIDO SOCIALISTA BRASILEIRO,1
LAGOINHA,DEPUTADO ESTADUAL,JEFFERSON CABRAL,JEFFERSON FERNANDO RIBEIRO CABRAL,SUPLENTE,PSB,PARTIDO SOCIALISTA BRASILEIRO,1
LAGOINHA,DEPUTADO ESTADUAL,ED THOMAS,EDSON TOMAZINI,ELEITO,PSB,PARTIDO SOCIALISTA BRASILEIRO,1
LAGOINHA,DEPUTADO ESTADUAL,YVONE BARREIROS,YVONE BARREIROS MOREIRA,SUPLENTE,PSB,PARTIDO SOCIALISTA BRASILEIRO,5
LAGOINHA,DEPUTADO ESTADUAL,ARTUR DIAN,ARTUR JOSE DIAN,SUPLENTE,PV,PARTIDO VERDE,1
LAGOINHA,DEPUTADO ESTADUAL,MARIA CRISTINA DI CIESCO,MARIA CRISTINA MESA MUNARIN DI CIESCO,SUPLENTE,PV,PARTIDO VERDE,1
LAGOINHA,DEPUTADO ESTADUAL,PADRE AFONSO,JOSÉ AFONSO LOBATO,ELEITO,PV,PARTIDO VERDE,262
LAGOINHA,DEPUTADO ESTADUAL,JUNIOR RAAD,ANTONIOS YOUSSIF RAAD JUNIOR,SUPLENTE,PV,PARTIDO VERDE,3
LAGOINHA,DEPUTADO ESTADUAL,HELIO RUBENS,HELIO RUBENS GONÇALVES FIGUEIREDO,SUPLENTE,PSDB,PSDB/DEM,1
LAGOINHA,DEPUTADO ESTADUAL,UBIRAJARA GUIMARÃES,UBIRAJARA PEREIRA GUIMARÃES,SUPLENTE,PSDB,PSDB/DEM,12
LAGOINHA,DEPUTADO ESTADUAL,EVANDRO LOSACCO,EVANDRO LUIZ LOSACCO,SUPLENTE,PSDB,PSDB/DEM,4
LAGOINHA,DEPUTADO ESTADUAL,FEITOSA,JOSE FRANCISCO SOARES FEITOSA,SUPLENTE,PSDB,PSDB/DEM,1
LAGOINHA,DEPUTADO ESTADUAL,GERALDO VINHOLI,GERALDO ANTONIO VINHOLI,SUPLENTE,PSDB,PSDB/DEM,1
LAGOINHA,DEPUTADO ESTADUAL,MARIA LÚCIA AMARY,MARIA LÚCIA CARDOSO PINTO AMARY,MÉDIA,PSDB,PSDB/DEM,1
LAGOINHA,DEPUTADO ESTADUAL,TÂNIA FERRAZ,TÂNIA MARIA FERRAZ MARGONI,SUPLENTE,PSDB,PSDB/DEM,1
LAGOINHA,DEPUTADO ESTADUAL,RAMALHO DA CONSTRUCAO,ANTONIO DE SOUSA RAMALHO,SUPLENTE,PSDB,PSDB/DEM,64
LAGOINHA,DEPUTADO ESTADUAL,WELSON GASPARINI,WELSON GASPARINI,SUPLENTE,PSDB,PSDB/DEM,1
LAGOINHA,DEPUTADO ESTADUAL,JOÃO CARAMEZ,JOÃO CARLOS CARAMEZ,ELEITO,PSDB,PSDB/DEM,42
LAGOINHA,DEPUTADO ESTADUAL,BRUNO COVAS,BRUNO COVAS LOPES,ELEITO,PSDB,PSDB/DEM,27
LAGOINHA,DEPUTADO ESTADUAL,BERNARDO ORTIZ JR,JOSE BERNARDO ORTIZ MONTEIRO JUNIOR,SUPLENTE,PSDB,PSDB/DEM,500
LAGOINHA,DEPUTADO ESTADUAL,CLOVIS CHAVES,CLOVIS LUIZ CHAVES,SUPLENTE,PSDB,PSDB/DEM,3
LAGOINHA,DEPUTADO ESTADUAL,CELINO,JUSCELINO CARDOSO DE SÁ,ELEITO,PSDB,PSDB/DEM,4
LAGOINHA,DEPUTADO ESTADUAL,ADOLFO QUINTAS,ADOLFO QUINTAS GONÇALVES NETO,SUPLENTE,PSDB,PSDB/DEM,1
LAGOINHA,DEPUTADO ESTADUAL,VITO ARDITO,VITO ARDITO LERARIO,SUPLENTE,PSDB,PSDB/DEM,141
LAGOINHA,DEPUTADO ESTADUAL,FORDINHO,ANTONIO CARLOS DE FARIA,SUPLENTE,PSDB,PSDB/DEM,1
LAGOINHA,DEPUTADO ESTADUAL,SAMUEL MOREIRA,SAMUEL MOREIRA DA SILVA JÚNIOR,ELEITO,PSDB,PSDB/DEM,363
LAGOINHA,DEPUTADO ESTADUAL,THIAGO LOBO,THIAGO ANTUNES CAVALCA REIS LOBO,SUPLENTE,PSDB,PSDB/DEM,1
LAGOINHA,DEPUTADO ESTADUAL,CAUÊ MACRIS,CAUÊ CASEIRO MACRIS,MÉDIA,PSDB,PSDB/DEM,4
LAGOINHA,DEPUTADO ESTADUAL,EDISON CANDIDO,EDISON APARECIDO CANDIDO,SUPLENTE,PSDB,PSDB/DEM,3
LAGOINHA,DEPUTADO ESTADUAL,ROBERTO MASSAFERA,ROBERTO MASSAFERA,ELEITO,PSDB,PSDB/DEM,2
LAGOINHA,DEPUTADO ESTADUAL,BARROS MUNHOZ,JOSE ANTONIO BARROS MUNHOZ,ELEITO,PSDB,PSDB/DEM,8
LAGOINHA,DEPUTADO ESTADUAL,HELIO NISHIMOTO,HELIO NISHIMOTO,ELEITO,PSDB,PSDB/DEM,11
LAGOINHA,DEPUTADO ESTADUAL,PAULO ALEXANDRE BARBOSA,PAULO ALEXANDRE PEREIRA BARBOSA,ELEITO,PSDB,PSDB/DEM,21
LAGOINHA,DEPUTADO ESTADUAL,ORLANDO MORANDO,ORLANDO MORANDO JUNIOR,ELEITO,PSDB,PSDB/DEM,1
LAGOINHA,DEPUTADO ESTADUAL,FERNANDO CAPEZ,FERNANDO CAPEZ,ELEITO,PSDB,PSDB/DEM,5
LAGOINHA,DEPUTADO ESTADUAL,MILTON DALLARI,JOSÉ MILTON DALLARI SOARES,SUPLENTE,PSDB,PSDB/DEM,1
LAGOINHA,DEPUTADO ESTADUAL,GUIMARÃES O GUERREIRO,HERALDO LOPES GUIMARÃES,SUPLENTE,PSOL,PARTIDO SOCIALISMO E LIBERDADE,1
LAGOINHA,DEPUTADO ESTADUAL,CARLOS GIANNAZI,CARLOS ALBERTO GIANNASI,ELEITO,PSOL,PARTIDO SOCIALISMO E LIBERDADE,1
LAGOINHA,DEPUTADO ESTADUAL,ERLEI ALIADO,ERLEI ROBERTO DE MELO,SUPLENTE,PC DO B,PARTIDO COMUNISTA DO BRASIL,1
LAGOINHA,DEPUTADO ESTADUAL,LECI BRANDÃO,LECI BRANDAO DA SILVA,ELEITO,PC DO B,PARTIDO COMUNISTA DO BRASIL,1
LAGOINHA,DEPUTADO ESTADUAL,DAVI RAMOS,DAVI GONÇALVES RAMOS,SUPLENTE,PC DO B,PARTIDO COMUNISTA DO BRASIL,2
LAGOINHA,DEPUTADO ESTADUAL,PROFESSOR FLAVIO DELMANTO,FLAVIO DELMANTO,SUPLENTE,PC DO B,PARTIDO COMUNISTA DO BRASIL,1
LAGOINHA,DEPUTADO ESTADUAL,BLACK,OSVALDO LUIZ MARCONDES CLEMENTE,SUPLENTE,PC DO B,PARTIDO COMUNISTA DO BRASIL,1
LAGOINHA,DEPUTADO ESTADUAL,LU PRADO,LUCIANE PRADO,SUPLENTE,PT DO B,SOMOS MAIS SÃO PAULO,4
