ANGATUBA,DEPUTADO ESTADUAL,TADEU MORAIS,TADEU MORAIS DE SOUSA,SUPLENTE,PDT,PARTIDO DEMOCRÁTICO TRABALHISTA,1
ANGATUBA,DEPUTADO ESTADUAL,TONHÃO SOM DE CRISTAL,ANTONIO DELBUCIO NETO,SUPLENTE,PDT,PARTIDO DEMOCRÁTICO TRABALHISTA,3
ANGATUBA,DEPUTADO ESTADUAL,CONSTANCIA FELIX,CONSTANCIA BERBERT DUTRA DA SILVA,SUPLENTE,PDT,PARTIDO DEMOCRÁTICO TRABALHISTA,10
ANGATUBA,DEPUTADO ESTADUAL,JOÃO ELIAS,JOÃO ELIAS PEREIRA,SUPLENTE,PDT,PARTIDO DEMOCRÁTICO TRABALHISTA,1
ANGATUBA,DEPUTADO ESTADUAL,ANDERSON SILVA,ANDERSON DOMINGOS DA SILVA,SUPLENTE,PT,SOMOS MAIS SÃO PAULO,1
ANGATUBA,DEPUTADO ESTADUAL,DR. JORGE PARADA,JORGE EDUARDO PARADA HURTADO,SUPLENTE,PT,SOMOS MAIS SÃO PAULO,9
ANGATUBA,DEPUTADO ESTADUAL,TELMA DE SOUZA,TELMA SANDRA AUGUSTO DE SOUZA,ELEITO,PT,SOMOS MAIS SÃO PAULO,1
ANGATUBA,DEPUTADO ESTADUAL,VALMIR PRASCIDELLI,VALMIR PRASCIDELLI,SUPLENTE,PT,SOMOS MAIS SÃO PAULO,1
ANGATUBA,DEPUTADO ESTADUAL,JURA,JURACY FRANCISCO DE JESUS,SUPLENTE,PT,SOMOS MAIS SÃO PAULO,5
ANGATUBA,DEPUTADO ESTADUAL,EDINHO SILVA,EDSON ANTONIO EDINHO DA SILVA,ELEITO,PT,SOMOS MAIS SÃO PAULO,2
ANGATUBA,DEPUTADO ESTADUAL,ENIO TATTO,ENIO FRANCISCO TATTO,ELEITO,PT,SOMOS MAIS SÃO PAULO,2
ANGATUBA,DEPUTADO ESTADUAL,ANA PERUGINI,ANA LUCIA LIPPAUS PERUGINI,ELEITO,PT,SOMOS MAIS SÃO PAULO,20
ANGATUBA,DEPUTADO ESTADUAL,ZICO,JOSÉ PRADO DE ANDRADE,MÉDIA,PT,SOMOS MAIS SÃO PAULO,2
ANGATUBA,DEPUTADO ESTADUAL,MARCO AURÉLIO DE SOUZA,MARCO AURÉLIO DE SOUZA,MÉDIA,PT,SOMOS MAIS SÃO PAULO,1
ANGATUBA,DEPUTADO ESTADUAL,MARCOS MARTINS,MARCOS LOPES MARTINS,ELEITO,PT,SOMOS MAIS SÃO PAULO,1
ANGATUBA,DEPUTADO ESTADUAL,ELI TEODORO,ELI TEODORO,SUPLENTE,PT,SOMOS MAIS SÃO PAULO,1
ANGATUBA,DEPUTADO ESTADUAL,SIMÃO PEDRO,SIMÃO PEDRO CHIOVETTI,ELEITO,PT,SOMOS MAIS SÃO PAULO,1
ANGATUBA,DEPUTADO ESTADUAL,GERALDO CRUZ,GERALDO LEITE DA CRUZ,ELEITO,PT,SOMOS MAIS SÃO PAULO,2
ANGATUBA,DEPUTADO ESTADUAL,RUI FALCÃO,RUI GOETHE DA COSTA FALCÃO,ELEITO,PT,SOMOS MAIS SÃO PAULO,2
ANGATUBA,DEPUTADO ESTADUAL,DUDU BOLITO,AMARILDO DUDU BOLITO,SUPLENTE,PT,SOMOS MAIS SÃO PAULO,1
ANGATUBA,DEPUTADO ESTADUAL,ADRIANO DIOGO,ADRIANO DIOGO,ELEITO,PT,SOMOS MAIS SÃO PAULO,2
ANGATUBA,DEPUTADO ESTADUAL,HAMILTON PEREIRA,HAMILTON PEREIRA,ELEITO,PT,SOMOS MAIS SÃO PAULO,23
ANGATUBA,DEPUTADO ESTADUAL,LUIZ CLAUDIO MARCOLINO,LUIZ CLAUDIO MARCOLINO,ELEITO,PT,SOMOS MAIS SÃO PAULO,1
ANGATUBA,DEPUTADO ESTADUAL,NATIVIDADE,MARIA DA NATIVIDADE PEREIRA LIMA,SUPLENTE,PT,SOMOS MAIS SÃO PAULO,1
ANGATUBA,DEPUTADO ESTADUAL,ROBERTO FELICIO,ROBERTO FELICIO,SUPLENTE,PT,SOMOS MAIS SÃO PAULO,2
ANGATUBA,DEPUTADO ESTADUAL,FRANCISCO FRANÇA,FRANCISCO FRANÇA DA SILVA,SUPLENTE,PT,SOMOS MAIS SÃO PAULO,757
ANGATUBA,DEPUTADO ESTADUAL,ISAC REIS,ISAC FRANCO DOS REIS,ELEITO,PT,SOMOS MAIS SÃO PAULO,4
ANGATUBA,DEPUTADO ESTADUAL,BRENO CORTELLA,BRENO ZANONI CORTELLA,SUPLENTE,PT,SOMOS MAIS SÃO PAULO,1
ANGATUBA,DEPUTADO ESTADUAL,ANA DO CARMO,ANA MARIA DO CARMO ROSSETO,ELEITO,PT,SOMOS MAIS SÃO PAULO,5
ANGATUBA,DEPUTADO ESTADUAL,JOSÉ CANDIDO,JOSÉ DE SOUZA CÂNDIDO,MÉDIA,PT,SOMOS MAIS SÃO PAULO,2
ANGATUBA,DEPUTADO ESTADUAL,IRENE,IRENE DOS SANTOS,SUPLENTE,PT,SOMOS MAIS SÃO PAULO,1
ANGATUBA,DEPUTADO ESTADUAL,LUIZ MOURA,LUIZ DE MOURA PEREIRA,ELEITO,PT,SOMOS MAIS SÃO PAULO,2
ANGATUBA,DEPUTADO ESTADUAL,CARLOS NEDER,CARLOS ALBERTO PLETZ NEDER,SUPLENTE,PT,SOMOS MAIS SÃO PAULO,8
ANGATUBA,DEPUTADO ESTADUAL,MUG,EVERALDO ERNESTO DOS SANTOS,SUPLENTE,PTB,PARTIDO TRABALHISTA BRASILEIRO,1
ANGATUBA,DEPUTADO ESTADUAL,LÉO ÁQUILLA,JADSON MENDES DE LIMA,SUPLENTE,PTB,PARTIDO TRABALHISTA BRASILEIRO,2
ANGATUBA,DEPUTADO ESTADUAL,MARIA DOS ANJOS,MARIA DOS ANJOS SANTANA,SUPLENTE,PTB,PARTIDO TRABALHISTA BRASILEIRO,1
ANGATUBA,DEPUTADO ESTADUAL,CAMPOS MACHADO,ANTONIO CARLOS DE CAMPOS MACHADO,ELEITO,PTB,PARTIDO TRABALHISTA BRASILEIRO,33
ANGATUBA,DEPUTADO ESTADUAL,VANDO,ORVANDO DA SILVA,SUPLENTE,PTB,PARTIDO TRABALHISTA BRASILEIRO,1
ANGATUBA,DEPUTADO ESTADUAL,CORONEL EDSON FERRARINI,EDSON FERRARINI,ELEITO,PTB,PARTIDO TRABALHISTA BRASILEIRO,1
ANGATUBA,DEPUTADO ESTADUAL,DR ANTONIO KHOURI,ANTONIO JOSE SADER KHOURI,SUPLENTE,PTB,PARTIDO TRABALHISTA BRASILEIRO,1
ANGATUBA,DEPUTADO ESTADUAL,GERSINHO ROMERO,GERSON MOREIRA ROMERO,SUPLENTE,PTB,PARTIDO TRABALHISTA BRASILEIRO,27
ANGATUBA,DEPUTADO ESTADUAL,VAL,ENIVALDO RAMOS DE FREITAS,SUPLENTE,PTB,PARTIDO TRABALHISTA BRASILEIRO,3
ANGATUBA,DEPUTADO ESTADUAL,WALDIR AGNELLO,WALDIR AGNELLO,SUPLENTE,PTB,PARTIDO TRABALHISTA BRASILEIRO,1
ANGATUBA,DEPUTADO ESTADUAL,MARCOS CUNHA,MARCOS BATISTA DA CUNHA,SUPLENTE,PTB,PARTIDO TRABALHISTA BRASILEIRO,1
ANGATUBA,DEPUTADO ESTADUAL,BALEIA ROSSI,LUIZ FELIPE BALEIA TENUTO ROSSI,ELEITO,PMDB,PARTIDO DO MOVIMENTO DEMOCRÁTICO BRASILEIRO,2
ANGATUBA,DEPUTADO ESTADUAL,DRA ADRIANA,ADRIANA DI NARDO SILVA,SUPLENTE,PMDB,PARTIDO DO MOVIMENTO DEMOCRÁTICO BRASILEIRO,1
ANGATUBA,DEPUTADO ESTADUAL,AMÉRICO CANDIDO,AMÉRICO CANDIDO DA SILVA,SUPLENTE,PMDB,PARTIDO DO MOVIMENTO DEMOCRÁTICO BRASILEIRO,1
ANGATUBA,DEPUTADO ESTADUAL,CARUSO,JORGE LUIS CARUSO,ELEITO,PMDB,PARTIDO DO MOVIMENTO DEMOCRÁTICO BRASILEIRO,102
ANGATUBA,DEPUTADO ESTADUAL,FABIO BELLO,FABIO BELLO DE OLIVEIRA,SUPLENTE,PMDB,PARTIDO DO MOVIMENTO DEMOCRÁTICO BRASILEIRO,1
ANGATUBA,DEPUTADO ESTADUAL,SERGIO BERGAMASCO,ANTONIO SERGIO PIRES BERGAMASCO,SUPLENTE,PMDB,PARTIDO DO MOVIMENTO DEMOCRÁTICO BRASILEIRO,1
ANGATUBA,DEPUTADO ESTADUAL,PROF. CANDIDO,CANDIDO GARCIA ALONSO,SUPLENTE,PMDB,PARTIDO DO MOVIMENTO DEMOCRÁTICO BRASILEIRO,5
ANGATUBA,DEPUTADO ESTADUAL,ITAMAR BORGES,ITAMAR FRANCISCO MACHADO BORGES,MÉDIA,PMDB,PARTIDO DO MOVIMENTO DEMOCRÁTICO BRASILEIRO,10
ANGATUBA,DEPUTADO ESTADUAL,ANGELA RAMALHO,ANGELA MARIA ANTUNES DE CARVALHO TAVARES,SUPLENTE,PMDB,PARTIDO DO MOVIMENTO DEMOCRÁTICO BRASILEIRO,425
ANGATUBA,DEPUTADO ESTADUAL,CIDA FERREIRA,MARIA APARECIDA FERREIRA,SUPLENTE,PMDB,PARTIDO DO MOVIMENTO DEMOCRÁTICO BRASILEIRO,5
ANGATUBA,DEPUTADO ESTADUAL,PESTANA,WAGNER DE OLIVEIRA PESTANA,SUPLENTE,PMDB,PARTIDO DO MOVIMENTO DEMOCRÁTICO BRASILEIRO,2
ANGATUBA,DEPUTADO ESTADUAL,OLIVEIRA JUNIOR,ELIO APARECIDO DE OLIVEIRA,SUPLENTE,PSC,HUMANISTA CRISTÃO ,1
ANGATUBA,DEPUTADO ESTADUAL,REINALDO BRICOLA,REINALDO BRICOLA,SUPLENTE,PSC,HUMANISTA CRISTÃO ,3
ANGATUBA,DEPUTADO ESTADUAL,PR. PAGLIARIN,HIDERALDO PAGLIARIN,SUPLENTE,PSC,HUMANISTA CRISTÃO ,6
ANGATUBA,DEPUTADO ESTADUAL,LEANDRO AMARAL,LEANDRO GODINES DO AMARAL,SUPLENTE,PSC,HUMANISTA CRISTÃO ,16
ANGATUBA,DEPUTADO ESTADUAL,PR. CARLOS CEZAR,CARLOS CEZAR DA SILVA,ELEITO,PSC,HUMANISTA CRISTÃO ,141
ANGATUBA,DEPUTADO ESTADUAL,LUIZ LAURO,LUIZ LAURO FERREIRA,SUPLENTE,PSC,HUMANISTA CRISTÃO ,3
ANGATUBA,DEPUTADO ESTADUAL,DR. PAULO DUARTE,PAULO FERNANDES DUARTE,SUPLENTE,PSC,HUMANISTA CRISTÃO ,1
ANGATUBA,DEPUTADO ESTADUAL,JOÃO BINATO,JOÃO ANTONIO BINATO,SUPLENTE,PSC,HUMANISTA CRISTÃO ,4
ANGATUBA,DEPUTADO ESTADUAL,ATALAIA,JOSE ROBERTO DE OLIVEIRA,SUPLENTE,PSC,HUMANISTA CRISTÃO ,3
ANGATUBA,DEPUTADO ESTADUAL,CANDIDO,JOELSON CANDIDO DE OLIVEIRA,SUPLENTE,PSC,HUMANISTA CRISTÃO ,42
ANGATUBA,DEPUTADO ESTADUAL,SAID MOURAD,AHMAD SAID MOURAD,SUPLENTE,PSC,HUMANISTA CRISTÃO ,279
ANGATUBA,DEPUTADO ESTADUAL,RODRIGO MORAES,RODRIGO AUGUSTO MORAES,ELEITO,PSC,HUMANISTA CRISTÃO ,93
ANGATUBA,DEPUTADO ESTADUAL,LEONARDO QUEIROZ,LEONARDO SANTOS QUEIROZ,SUPLENTE,PSC,HUMANISTA CRISTÃO ,6
ANGATUBA,DEPUTADO ESTADUAL,DE MARCO,JOSE APARECIDO DE MARCO,SUPLENTE,PSC,HUMANISTA CRISTÃO ,2
ANGATUBA,DEPUTADO ESTADUAL,MISSIONARIA ZEZA,MARIA JOSE DA SILVA,SUPLENTE,PSC,HUMANISTA CRISTÃO ,3
ANGATUBA,DEPUTADO ESTADUAL,WALTER GOMES,WALTER GOMES DE OLIVEIRA,SUPLENTE,PR,SOMOS MAIS SÃO PAULO,1
ANGATUBA,DEPUTADO ESTADUAL,ZE PEDRO,JOSE PEDRO LEITE DA SILVA,SUPLENTE,PR,SOMOS MAIS SÃO PAULO,1
ANGATUBA,DEPUTADO ESTADUAL,PATRICIA LIMA,PATRICIA FREITAS LIMA,SUPLENTE,PR,SOMOS MAIS SÃO PAULO,12
ANGATUBA,DEPUTADO ESTADUAL,CLAUDIO SOROCABA I,GERVINO GONCALVES,SUPLENTE,PR,SOMOS MAIS SÃO PAULO,1
ANGATUBA,DEPUTADO ESTADUAL,ANDRE DO PRADO,ANDRE LUIS DO PRADO,ELEITO,PR,SOMOS MAIS SÃO PAULO,7
ANGATUBA,DEPUTADO ESTADUAL,EDUARDO REZEK,EDUARDO PEDROSO REZEK,SUPLENTE,PPS,PARTIDO POPULAR SOCIALISTA,16
ANGATUBA,DEPUTADO ESTADUAL,JOSE CARLOS SOARES,JOSE CARLOS SOARES,SUPLENTE,PPS,PARTIDO POPULAR SOCIALISTA,11
ANGATUBA,DEPUTADO ESTADUAL,JOSIVAN DA SILVA CORREIA,JOSIVAN DA SILVA CORREIA,SUPLENTE,PPS,PARTIDO POPULAR SOCIALISTA,1
ANGATUBA,DEPUTADO ESTADUAL,TONINHO ALEIXO,ANTONIO ALEIXO DA COSTA,SUPLENTE,PPS,PARTIDO POPULAR SOCIALISTA,1
ANGATUBA,DEPUTADO ESTADUAL,ADEMIR DA GUIA,ADEMIR DA GUIA,SUPLENTE,PPS,PARTIDO POPULAR SOCIALISTA,4
ANGATUBA,DEPUTADO ESTADUAL,DAVI ZAIA,DAVID ZAIA,MÉDIA,PPS,PARTIDO POPULAR SOCIALISTA,2
ANGATUBA,DEPUTADO ESTADUAL,DR. MILTON FERREIRA,MILTON FERREIRA DA SILVA,SUPLENTE,PPS,PARTIDO POPULAR SOCIALISTA,3
ANGATUBA,DEPUTADO ESTADUAL,JOAO OTAVIO BASTOS,JOAO OTAVIO BASTOS JUNQUEIRA,SUPLENTE,PPS,PARTIDO POPULAR SOCIALISTA,2
ANGATUBA,DEPUTADO ESTADUAL,VITOR SAPIENZA,VITOR SAPIENZA,SUPLENTE,PPS,PARTIDO POPULAR SOCIALISTA,19
ANGATUBA,DEPUTADO ESTADUAL,ALEX MANENTE,ALEX SPINELLI MANENTE,ELEITO,PPS,PARTIDO POPULAR SOCIALISTA,126
ANGATUBA,DEPUTADO ESTADUAL,DIRCEU DALBEN,ANTONIO DIRCEU DALBEN,SUPLENTE,PPS,PARTIDO POPULAR SOCIALISTA,7
ANGATUBA,DEPUTADO ESTADUAL,GONDIM,LUIZ CARLOS GONDIM TEIXEIRA,ELEITO,PPS,PARTIDO POPULAR SOCIALISTA,36
ANGATUBA,DEPUTADO ESTADUAL,ESTEVÃO,STEVEN ERIKSEN BINNIE,SUPLENTE,PPS,PARTIDO POPULAR SOCIALISTA,3
ANGATUBA,DEPUTADO ESTADUAL,ROBERTO MORAIS,ROBERTO TURCHI DE MORAIS,ELEITO,PPS,PARTIDO POPULAR SOCIALISTA,11
ANGATUBA,DEPUTADO ESTADUAL,ELZO SIGUETA,ELZO SIGUETA,SUPLENTE,PPS,PARTIDO POPULAR SOCIALISTA,125
ANGATUBA,DEPUTADO ESTADUAL,DR REYNALDO DE BARROS,REYNALDO DE BARROS FRESCA JUNIOR,SUPLENTE,PPS,PARTIDO POPULAR SOCIALISTA,1
ANGATUBA,DEPUTADO ESTADUAL,NICOLAU AMARAL,NICOLAU LIMA DO AMARAL,SUPLENTE,PPS,PARTIDO POPULAR SOCIALISTA,2
ANGATUBA,DEPUTADO ESTADUAL,ANDRE SOARES,ANDRE BEZERRA RIBEIRO SOARES,ELEITO,DEM,PSDB/DEM,7
ANGATUBA,DEPUTADO ESTADUAL,ULISSES SALES,ULISSES ROBERTO CORNAZZANI SALES,SUPLENTE,DEM,PSDB/DEM,4
ANGATUBA,DEPUTADO ESTADUAL,EDMIR CHEDID,EDMIR JOSE ABI CHEDID,ELEITO,DEM,PSDB/DEM,19
ANGATUBA,DEPUTADO ESTADUAL,JOAO MELLAO NETO,JOAO MELLAO NETO,SUPLENTE,DEM,PSDB/DEM,5
ANGATUBA,DEPUTADO ESTADUAL,ESTEVAM GALVAO,ESTEVAM GALVAO DE OLIVEIRA,ELEITO,DEM,PSDB/DEM,46
ANGATUBA,DEPUTADO ESTADUAL,RICARDO SALLES,RICARDO DE AQUINO SALLES,SUPLENTE,DEM,PSDB/DEM,4
ANGATUBA,DEPUTADO ESTADUAL,MILTON LEITE FILHO,MILTON LEITE DA SILVA FILHO,ELEITO,DEM,PSDB/DEM,12
ANGATUBA,DEPUTADO ESTADUAL,GIL ARANTES,GILBERTO MACEDO GIL ARANTES,ELEITO,DEM,PSDB/DEM,8
ANGATUBA,DEPUTADO ESTADUAL,LEANDRO DO KLB,LEANDRO FINATO SCORNAVACCA,SUPLENTE,DEM,PSDB/DEM,60
ANGATUBA,DEPUTADO ESTADUAL,BAHIA DA ACADEMIA,ALMIRANDO FERREIRA DO NASCIMENTO,SUPLENTE,PSB,PARTIDO SOCIALISTA BRASILEIRO,2
ANGATUBA,DEPUTADO ESTADUAL,MARIÂNGELA DUARTE,MARIANGELA DE ARAÚJO GAMA DUARTE,SUPLENTE,PSB,PARTIDO SOCIALISTA BRASILEIRO,2
ANGATUBA,DEPUTADO ESTADUAL,JANAINA MARTINS,JANAINA PEREIRA MARTINS,SUPLENTE,PSB,PARTIDO SOCIALISTA BRASILEIRO,2
ANGATUBA,DEPUTADO ESTADUAL,TEREZINHA DA PAULINA,TEREZINHA DE JESUS MORAIS VASCONCELOS SILVA,SUPLENTE,PSB,PARTIDO SOCIALISTA BRASILEIRO,78
ANGATUBA,DEPUTADO ESTADUAL,PAULO BRIGLIADORI,PAULO JOSÉ BRIGLIADORI,SUPLENTE,PSB,PARTIDO SOCIALISTA BRASILEIRO,1
ANGATUBA,DEPUTADO ESTADUAL,HILKIAS,HILKIAS DE OLIVEIRA,SUPLENTE,PSB,PARTIDO SOCIALISTA BRASILEIRO,2
ANGATUBA,DEPUTADO ESTADUAL,FRANCÉ JUNIOR,ANTONIO FRANCÉ JUNIOR,SUPLENTE,PSB,PARTIDO SOCIALISTA BRASILEIRO,1
ANGATUBA,DEPUTADO ESTADUAL,DR. JOSÉ RICARDO,JOSÉ RICARDO DIAS,SUPLENTE,PSB,PARTIDO SOCIALISTA BRASILEIRO,8
ANGATUBA,DEPUTADO ESTADUAL,YVONE BARREIROS,YVONE BARREIROS MOREIRA,SUPLENTE,PSB,PARTIDO SOCIALISTA BRASILEIRO,6
ANGATUBA,DEPUTADO ESTADUAL,LUCIANO BATISTA,LUCIANO BATISTA,ELEITO,PSB,PARTIDO SOCIALISTA BRASILEIRO,12
ANGATUBA,DEPUTADO ESTADUAL,ELTON ISAAC,ELTON ISAAC DOS SANTOS,SUPLENTE,PSB,PARTIDO SOCIALISTA BRASILEIRO,1
ANGATUBA,DEPUTADO ESTADUAL,KAREN MARIA,KAREN MARIA DA SILVA,SUPLENTE,PSB,PARTIDO SOCIALISTA BRASILEIRO,3
ANGATUBA,DEPUTADO ESTADUAL,GENTIL,ALEXANDRE MARIANO GENTIL,SUPLENTE,PV,PARTIDO VERDE,13
ANGATUBA,DEPUTADO ESTADUAL,GIRIBONI,EDSON DE OLIVEIRA GIRIBONI,ELEITO,PV,PARTIDO VERDE,4382
ANGATUBA,DEPUTADO ESTADUAL,ARTUR DIAN,ARTUR JOSE DIAN,SUPLENTE,PV,PARTIDO VERDE,25
ANGATUBA,DEPUTADO ESTADUAL,FIDEL BUSTAMANTE,FIDEL BUSTAMANTE,SUPLENTE,PV,PARTIDO VERDE,7
ANGATUBA,DEPUTADO ESTADUAL,ENGENHEIRO MÁRCIO,MARCIO MEDEIROS,SUPLENTE,PV,PARTIDO VERDE,1
ANGATUBA,DEPUTADO ESTADUAL,ADRIANA RODRIGUES,ADRIANA LARIO RAMALHO RODRIGUES,SUPLENTE,PV,PARTIDO VERDE,2
ANGATUBA,DEPUTADO ESTADUAL,FELICIANO,FELICIANO NAHIMY FILHO,ELEITO,PV,PARTIDO VERDE,56
ANGATUBA,DEPUTADO ESTADUAL,RAUL FELIX,RAUL SOARES FELIX,SUPLENTE,PV,PARTIDO VERDE,1
ANGATUBA,DEPUTADO ESTADUAL,LAIS LATORRE,LAIS MENDES LATORRE SOARES,SUPLENTE,PV,PARTIDO VERDE,5
ANGATUBA,DEPUTADO ESTADUAL,PROFESSORA EUGENIA,EUGENIA HERALDA DE BARROS SILVA,SUPLENTE,PV,PARTIDO VERDE,1
ANGATUBA,DEPUTADO ESTADUAL,CHICO SARDELLI,FRANCISCO ANTONIO SARDELLI,ELEITO,PV,PARTIDO VERDE,3
ANGATUBA,DEPUTADO ESTADUAL,PAULINHO ZACCARIOTTO,PAULO SERGIO ZACCARIOTTO,SUPLENTE,PV,PARTIDO VERDE,1
ANGATUBA,DEPUTADO ESTADUAL,PAULINHO DO PV,PAULO CARDOSO FILHO,SUPLENTE,PV,PARTIDO VERDE,1
ANGATUBA,DEPUTADO ESTADUAL,RICARDO CASTILHO,RICARDO RODRIGUES DE CASTILHO,SUPLENTE,PV,PARTIDO VERDE,14
ANGATUBA,DEPUTADO ESTADUAL,CAMILO GAVA,JOSÉ CAMILO GAVA NETO,SUPLENTE,PV,PARTIDO VERDE,1
ANGATUBA,DEPUTADO ESTADUAL,ROSANGELA MELLO,ROSANGELA DE MELLO,SUPLENTE,PV,PARTIDO VERDE,23
ANGATUBA,DEPUTADO ESTADUAL,RITA PASSOS,RITA DE CASSIA TRINCA PASSOS,ELEITO,PV,PARTIDO VERDE,4
ANGATUBA,DEPUTADO ESTADUAL,PADRE AFONSO,JOSÉ AFONSO LOBATO,ELEITO,PV,PARTIDO VERDE,135
ANGATUBA,DEPUTADO ESTADUAL,MANELAO,MANOEL DA SILVA FILHO,SUPLENTE,PV,PARTIDO VERDE,4
ANGATUBA,DEPUTADO ESTADUAL,BRAZ ALBERTINI,BRAZ AGOSTINHO ALBERTINI,SUPLENTE,PV,PARTIDO VERDE,81
ANGATUBA,DEPUTADO ESTADUAL,MÁRCIA MONTEZ,MÁRCIA REGINA MONTEZ HALASZ,SUPLENTE,PV,PARTIDO VERDE,5
ANGATUBA,DEPUTADO ESTADUAL,EDSON RODRIGUES,EDSON DE CASTRO RODRIGUES,SUPLENTE,PV,PARTIDO VERDE,1
ANGATUBA,DEPUTADO ESTADUAL,DR. ULYSSES,ULYSSES MARIO TASSINARI,MÉDIA,PV,PARTIDO VERDE,5
ANGATUBA,DEPUTADO ESTADUAL,REINALDO ALGUZ,REINALDO DE SOUZA ALGUZ,ELEITO,PV,PARTIDO VERDE,24
ANGATUBA,DEPUTADO ESTADUAL,PELE PROBLEMA,CARLOS ALBERTO ROSA,SUPLENTE,PV,PARTIDO VERDE,1
ANGATUBA,DEPUTADO ESTADUAL,REGINA GONÇALVES,MARIA REGINA GONÇALVES,SUPLENTE,PV,PARTIDO VERDE,16
ANGATUBA,DEPUTADO ESTADUAL,PASTOR DILMO DOS SANTOS,DILMO DOS SANTOS,ELEITO,PV,PARTIDO VERDE,15
ANGATUBA,DEPUTADO ESTADUAL,WALCINYR BRAGATTO,WALCINYR BRAGATTO,SUPLENTE,PV,PARTIDO VERDE,2
ANGATUBA,DEPUTADO ESTADUAL,JESSE LOURES,JESSE LOURES DE MORAES,SUPLENTE,PV,PARTIDO VERDE,4
ANGATUBA,DEPUTADO ESTADUAL,SÉRGIO CONTENTE,SERGIO CONTENTE,SUPLENTE,PV,PARTIDO VERDE,1
ANGATUBA,DEPUTADO ESTADUAL,MARISA PORRETA,MARISA RODRIGUES CUSTODIO,SUPLENTE,PV,PARTIDO VERDE,1
ANGATUBA,DEPUTADO ESTADUAL,HELIO RUBENS,HELIO RUBENS GONÇALVES FIGUEIREDO,SUPLENTE,PSDB,PSDB/DEM,2
ANGATUBA,DEPUTADO ESTADUAL,PROFESSOR BETO VARUSSA,JOSÉ ROBERTO VARUSSA,SUPLENTE,PSDB,PSDB/DEM,16
ANGATUBA,DEPUTADO ESTADUAL,UBIRAJARA GUIMARÃES,UBIRAJARA PEREIRA GUIMARÃES,SUPLENTE,PSDB,PSDB/DEM,10
ANGATUBA,DEPUTADO ESTADUAL,EVANDRO LOSACCO,EVANDRO LUIZ LOSACCO,SUPLENTE,PSDB,PSDB/DEM,29
ANGATUBA,DEPUTADO ESTADUAL,PEDRO TOBIAS,PEDRO TOBIAS,ELEITO,PSDB,PSDB/DEM,1
ANGATUBA,DEPUTADO ESTADUAL,MILTON FLAVIO,MILTON FLAVIO MARQUES LAUTENSCHLAGER,SUPLENTE,PSDB,PSDB/DEM,30
ANGATUBA,DEPUTADO ESTADUAL,GERALDO VINHOLI,GERALDO ANTONIO VINHOLI,SUPLENTE,PSDB,PSDB/DEM,4
ANGATUBA,DEPUTADO ESTADUAL,MARIA LÚCIA AMARY,MARIA LÚCIA CARDOSO PINTO AMARY,MÉDIA,PSDB,PSDB/DEM,311
ANGATUBA,DEPUTADO ESTADUAL,WELSON GASPARINI,WELSON GASPARINI,SUPLENTE,PSDB,PSDB/DEM,3
ANGATUBA,DEPUTADO ESTADUAL,MAURO BRAGATO,MAURO BRAGATO,ELEITO,PSDB,PSDB/DEM,1
ANGATUBA,DEPUTADO ESTADUAL,JOÃO CARAMEZ,JOÃO CARLOS CARAMEZ,ELEITO,PSDB,PSDB/DEM,826
ANGATUBA,DEPUTADO ESTADUAL,BRUNO COVAS,BRUNO COVAS LOPES,ELEITO,PSDB,PSDB/DEM,87
ANGATUBA,DEPUTADO ESTADUAL,BERNARDO ORTIZ JR,JOSE BERNARDO ORTIZ MONTEIRO JUNIOR,SUPLENTE,PSDB,PSDB/DEM,1
ANGATUBA,DEPUTADO ESTADUAL,CELINO,JUSCELINO CARDOSO DE SÁ,ELEITO,PSDB,PSDB/DEM,6
ANGATUBA,DEPUTADO ESTADUAL,CORONEL ERNESTO,ERNESTO CARLOS DA COSTA,SUPLENTE,PSDB,PSDB/DEM,1
ANGATUBA,DEPUTADO ESTADUAL,CORONEL JAIR PACA,JAIR PACA DE LIMA,SUPLENTE,PSDB,PSDB/DEM,3
ANGATUBA,DEPUTADO ESTADUAL,JOSE BORANGA,JOSE AURELIO BORANGA,SUPLENTE,PSDB,PSDB/DEM,319
ANGATUBA,DEPUTADO ESTADUAL,ADOLFO QUINTAS,ADOLFO QUINTAS GONÇALVES NETO,SUPLENTE,PSDB,PSDB/DEM,1
ANGATUBA,DEPUTADO ESTADUAL,SAMUEL MOREIRA,SAMUEL MOREIRA DA SILVA JÚNIOR,ELEITO,PSDB,PSDB/DEM,9
ANGATUBA,DEPUTADO ESTADUAL,CASSIO NAVARRO,CASSIO DE CASTRO NAVARRO,SUPLENTE,PSDB,PSDB/DEM,1
ANGATUBA,DEPUTADO ESTADUAL,LILYAN MARINHO,LILYAN MARIA DE ALMEIDA MARINHO,SUPLENTE,PSDB,PSDB/DEM,1
ANGATUBA,DEPUTADO ESTADUAL,CARLOS BEZERRA JR.,CARLOS ALBERTO DE QUADROS BEZERRA JUNIOR,ELEITO,PSDB,PSDB/DEM,8
ANGATUBA,DEPUTADO ESTADUAL,CARLOS ALBERTO SANTOS,CARLOS ALBERTO DE OLIVEIRA SANTOS,SUPLENTE,PSDB,PSDB/DEM,2
ANGATUBA,DEPUTADO ESTADUAL,MAURICIO PINTERICH,MAURICIO DE OLIVEIRA PINTERICH,SUPLENTE,PSDB,PSDB/DEM,3
ANGATUBA,DEPUTADO ESTADUAL,CAUÊ MACRIS,CAUÊ CASEIRO MACRIS,MÉDIA,PSDB,PSDB/DEM,4
ANGATUBA,DEPUTADO ESTADUAL,JOÃO SANZOVO,JOÃO SANZOVO NETO,SUPLENTE,PSDB,PSDB/DEM,1
ANGATUBA,DEPUTADO ESTADUAL,ZÉ AILTON,JOSE AILTON RIBEIRO,SUPLENTE,PSDB,PSDB/DEM,80
ANGATUBA,DEPUTADO ESTADUAL,VICTOR KOBAYASHI,VICTOR KOBAYASHI,SUPLENTE,PSDB,PSDB/DEM,4
ANGATUBA,DEPUTADO ESTADUAL,BARROS MUNHOZ,JOSE ANTONIO BARROS MUNHOZ,ELEITO,PSDB,PSDB/DEM,5
ANGATUBA,DEPUTADO ESTADUAL,CELSO GIGLIO,CELSO ANTONIO GIGLIO,ELEITO,PSDB,PSDB/DEM,5
ANGATUBA,DEPUTADO ESTADUAL,PAULO ALEXANDRE BARBOSA,PAULO ALEXANDRE PEREIRA BARBOSA,ELEITO,PSDB,PSDB/DEM,93
ANGATUBA,DEPUTADO ESTADUAL,ARTUR ORSI,ARTUR CASSEB ORSI,SUPLENTE,PSDB,PSDB/DEM,1
ANGATUBA,DEPUTADO ESTADUAL,JOÃO NILTON DO UNIÃO SERV,JOÃO NILTON GONÇALVES,SUPLENTE,PSDB,PSDB/DEM,1
ANGATUBA,DEPUTADO ESTADUAL,JOSE AUGUSTO,JOSE AUGUSTO DA SILVA RAMOS,SUPLENTE,PSDB,PSDB/DEM,178
ANGATUBA,DEPUTADO ESTADUAL,ORLANDO MORANDO,ORLANDO MORANDO JUNIOR,ELEITO,PSDB,PSDB/DEM,3
ANGATUBA,DEPUTADO ESTADUAL,FERNANDO CAPEZ,FERNANDO CAPEZ,ELEITO,PSDB,PSDB/DEM,7
ANGATUBA,DEPUTADO ESTADUAL,MILTON DALLARI,JOSÉ MILTON DALLARI SOARES,SUPLENTE,PSDB,PSDB/DEM,5
ANGATUBA,DEPUTADO ESTADUAL,MESTRE DEL CAPOEIRA,FERNANDO DOS SANTOS RAMOS,SUPLENTE,PSOL,PARTIDO SOCIALISMO E LIBERDADE,1
ANGATUBA,DEPUTADO ESTADUAL,PROFESSOR BALTAZAR,BALTAZAR ASTONI SENA,SUPLENTE,PSOL,PARTIDO SOCIALISMO E LIBERDADE,2
ANGATUBA,DEPUTADO ESTADUAL,LUIZ CARLOS CORUJA,LUIZ CARLOS DE SOUSA,SUPLENTE,PSOL,PARTIDO SOCIALISMO E LIBERDADE,3
ANGATUBA,DEPUTADO ESTADUAL,TONINHO DA ELÉTRICA,JOSE ANTONIO ARAUJO PEREIRA,SUPLENTE,PSOL,PARTIDO SOCIALISMO E LIBERDADE,1
ANGATUBA,DEPUTADO ESTADUAL,GILCELI LIMA,GILCELI LEITE LIMA,SUPLENTE,PSOL,PARTIDO SOCIALISMO E LIBERDADE,1
ANGATUBA,DEPUTADO ESTADUAL,MARCOS BOER,MARCOS BOER,SUPLENTE,PSOL,PARTIDO SOCIALISMO E LIBERDADE,1
ANGATUBA,DEPUTADO ESTADUAL,TONINHO DA ANGAVEL,ANTONIO FRANCISCO DE OLIVEIRA,SUPLENTE,PSOL,PARTIDO SOCIALISMO E LIBERDADE,1219
ANGATUBA,DEPUTADO ESTADUAL,RAUL MARCELO,RAUL MARCELO DE SOUZA,SUPLENTE,PSOL,PARTIDO SOCIALISMO E LIBERDADE,16
ANGATUBA,DEPUTADO ESTADUAL,CARLOS GIANNAZI,CARLOS ALBERTO GIANNASI,ELEITO,PSOL,PARTIDO SOCIALISMO E LIBERDADE,13
ANGATUBA,DEPUTADO ESTADUAL,WANDER,WANDER DE OLIVEIRA VILLALBA,SUPLENTE,PC DO B,PARTIDO COMUNISTA DO BRASIL,1
ANGATUBA,DEPUTADO ESTADUAL,LECI BRANDÃO,LECI BRANDAO DA SILVA,ELEITO,PC DO B,PARTIDO COMUNISTA DO BRASIL,2
ANGATUBA,DEPUTADO ESTADUAL,SARAH MUNHOZ,SARAH MUNHOZ,SUPLENTE,PC DO B,PARTIDO COMUNISTA DO BRASIL,1
ANGATUBA,DEPUTADO ESTADUAL,FRANCISCO DE SALES,FRANCISCO DE SALES VIEIRA DE CARVALHO,SUPLENTE,PC DO B,PARTIDO COMUNISTA DO BRASIL,2
ANGATUBA,DEPUTADO ESTADUAL,DAVI RAMOS,DAVI GONÇALVES RAMOS,SUPLENTE,PC DO B,PARTIDO COMUNISTA DO BRASIL,1
ANGATUBA,DEPUTADO ESTADUAL,PINA,MILTON PINA,SUPLENTE,PC DO B,PARTIDO COMUNISTA DO BRASIL,1
ANGATUBA,DEPUTADO ESTADUAL,NIRALDO SIQUEIRA,NIRALDO FERREIRA DE SIQUEIRA,SUPLENTE,PC DO B,PARTIDO COMUNISTA DO BRASIL,1
ANGATUBA,DEPUTADO ESTADUAL,GABRIEL BITENCOURT,GABRIEL CESAR BITENCOURT,SUPLENTE,PC DO B,PARTIDO COMUNISTA DO BRASIL,4
ANGATUBA,DEPUTADO ESTADUAL,DR. CRIS,CRISTIANO MARTINS DIAS,SUPLENTE,PC DO B,PARTIDO COMUNISTA DO BRASIL,4
ANGATUBA,DEPUTADO ESTADUAL,HELIFAX,HELIFAX PINTO DE SOUZA,SUPLENTE,PC DO B,PARTIDO COMUNISTA DO BRASIL,3
ANGATUBA,DEPUTADO ESTADUAL,DR. BITTAR,JOSÉ EDUARDO FUSER BITTAR,SUPLENTE,PC DO B,PARTIDO COMUNISTA DO BRASIL,1
