GUARACI,DEPUTADO ESTADUAL,CARLOS GIANNAZI,CARLOS ALBERTO GIANNASI,ELEITO,PSOL,PARTIDO SOCIALISMO E LIBERDADE,2
GUARACI,DEPUTADO ESTADUAL,ERLEI ALIADO,ERLEI ROBERTO DE MELO,SUPLENTE,PC DO B,PARTIDO COMUNISTA DO BRASIL,1
GUARACI,DEPUTADO ESTADUAL,SARAH MUNHOZ,SARAH MUNHOZ,SUPLENTE,PC DO B,PARTIDO COMUNISTA DO BRASIL,1
GUARACI,DEPUTADO ESTADUAL,MAURIN DA SORVETERIA,MAURIN ALVES RIBEIRO,SUPLENTE,PC DO B,PARTIDO COMUNISTA DO BRASIL,8
GUARACI,DEPUTADO ESTADUAL,ALCIDES AMAZONAS,ALCIDES ARAUJO DOS SANTOS,SUPLENTE,PC DO B,PARTIDO COMUNISTA DO BRASIL,1
GUARACI,DEPUTADO ESTADUAL,VICTOR BORGES,VICTOR IVO GERACINO DOS SANTOS BORGES,SUPLENTE,PC DO B,PARTIDO COMUNISTA DO BRASIL,1
GUARACI,DEPUTADO ESTADUAL,DAVI RAMOS,DAVI GONÇALVES RAMOS,SUPLENTE,PC DO B,PARTIDO COMUNISTA DO BRASIL,2
GUARACI,DEPUTADO ESTADUAL,PAULO CORRÊA JR,PAULO ALVES CORRÊA JUNIOR,SUPLENTE,PT DO B,SOMOS MAIS SÃO PAULO,23
