PALMITAL,DEPUTADO ESTADUAL,BRUZAROSCO,APARECIDO DE JESUS BRUZAROSCO,SUPLENTE,PDT,PARTIDO DEMOCRÁTICO TRABALHISTA,7
PALMITAL,DEPUTADO ESTADUAL,RAFAEL SILVA,RAFAEL ANTONIO DA SILVA,ELEITO,PDT,PARTIDO DEMOCRÁTICO TRABALHISTA,5
PALMITAL,DEPUTADO ESTADUAL,TOLOI,LUIZ CARLOS TOLOI JUNIOR,SUPLENTE,PDT,PARTIDO DEMOCRÁTICO TRABALHISTA,5
PALMITAL,DEPUTADO ESTADUAL,TADEU MORAIS,TADEU MORAIS DE SOUSA,SUPLENTE,PDT,PARTIDO DEMOCRÁTICO TRABALHISTA,4
PALMITAL,DEPUTADO ESTADUAL,CONSTANCIA FELIX,CONSTANCIA BERBERT DUTRA DA SILVA,SUPLENTE,PDT,PARTIDO DEMOCRÁTICO TRABALHISTA,2
PALMITAL,DEPUTADO ESTADUAL,MARCO BRASIL,MARCO AURÉLIO RIBEIRO,SUPLENTE,PDT,PARTIDO DEMOCRÁTICO TRABALHISTA,42
PALMITAL,DEPUTADO ESTADUAL,JOÃO ELIAS,JOÃO ELIAS PEREIRA,SUPLENTE,PDT,PARTIDO DEMOCRÁTICO TRABALHISTA,6
PALMITAL,DEPUTADO ESTADUAL,ANDERSON SILVA,ANDERSON DOMINGOS DA SILVA,SUPLENTE,PT,SOMOS MAIS SÃO PAULO,2
PALMITAL,DEPUTADO ESTADUAL,WAGNER BALIEIRO,WAGNER OCIMAR BALIEIRO,SUPLENTE,PT,SOMOS MAIS SÃO PAULO,2
PALMITAL,DEPUTADO ESTADUAL,VALMIR PRASCIDELLI,VALMIR PRASCIDELLI,SUPLENTE,PT,SOMOS MAIS SÃO PAULO,12
PALMITAL,DEPUTADO ESTADUAL,PORTUGUÊS,REINALDO FARTO NUNES,SUPLENTE,PT,SOMOS MAIS SÃO PAULO,46
PALMITAL,DEPUTADO ESTADUAL,PAULO MARTINS (GAÚCHO),PAULO CESAR GOMES MARTINS,SUPLENTE,PT,SOMOS MAIS SÃO PAULO,2
PALMITAL,DEPUTADO ESTADUAL,JURA,JURACY FRANCISCO DE JESUS,SUPLENTE,PT,SOMOS MAIS SÃO PAULO,8
PALMITAL,DEPUTADO ESTADUAL,GERSON BITTENCOURT,GERSON LUIS BITTENCOURT,ELEITO,PT,SOMOS MAIS SÃO PAULO,2
PALMITAL,DEPUTADO ESTADUAL,EDINHO SILVA,EDSON ANTONIO EDINHO DA SILVA,ELEITO,PT,SOMOS MAIS SÃO PAULO,2
PALMITAL,DEPUTADO ESTADUAL,ENIO TATTO,ENIO FRANCISCO TATTO,ELEITO,PT,SOMOS MAIS SÃO PAULO,841
PALMITAL,DEPUTADO ESTADUAL,ANA PERUGINI,ANA LUCIA LIPPAUS PERUGINI,ELEITO,PT,SOMOS MAIS SÃO PAULO,1
PALMITAL,DEPUTADO ESTADUAL,TONINHO DO PT,ANTONIO AMARAL JUNIOR,SUPLENTE,PT,SOMOS MAIS SÃO PAULO,34
PALMITAL,DEPUTADO ESTADUAL,ZICO,JOSÉ PRADO DE ANDRADE,MÉDIA,PT,SOMOS MAIS SÃO PAULO,5
PALMITAL,DEPUTADO ESTADUAL,SALETE CAMPARI,FRANCISCO DE SALES RODRIGUES,SUPLENTE,PT,SOMOS MAIS SÃO PAULO,1
PALMITAL,DEPUTADO ESTADUAL,MARCOS MARTINS,MARCOS LOPES MARTINS,ELEITO,PT,SOMOS MAIS SÃO PAULO,4
PALMITAL,DEPUTADO ESTADUAL,ELI TEODORO,ELI TEODORO,SUPLENTE,PT,SOMOS MAIS SÃO PAULO,5
PALMITAL,DEPUTADO ESTADUAL,SIMÃO PEDRO,SIMÃO PEDRO CHIOVETTI,ELEITO,PT,SOMOS MAIS SÃO PAULO,1
PALMITAL,DEPUTADO ESTADUAL,IVANETE VIEIRA,IVANETE APARECIDA DOS SANTOS,SUPLENTE,PT,SOMOS MAIS SÃO PAULO,3
PALMITAL,DEPUTADO ESTADUAL,GERALDO CRUZ,GERALDO LEITE DA CRUZ,ELEITO,PT,SOMOS MAIS SÃO PAULO,1
PALMITAL,DEPUTADO ESTADUAL,RUI FALCÃO,RUI GOETHE DA COSTA FALCÃO,ELEITO,PT,SOMOS MAIS SÃO PAULO,2
PALMITAL,DEPUTADO ESTADUAL,ADRIANO DIOGO,ADRIANO DIOGO,ELEITO,PT,SOMOS MAIS SÃO PAULO,1
PALMITAL,DEPUTADO ESTADUAL,HAMILTON PEREIRA,HAMILTON PEREIRA,ELEITO,PT,SOMOS MAIS SÃO PAULO,5
PALMITAL,DEPUTADO ESTADUAL,LUIZ CLAUDIO MARCOLINO,LUIZ CLAUDIO MARCOLINO,ELEITO,PT,SOMOS MAIS SÃO PAULO,15
PALMITAL,DEPUTADO ESTADUAL,ROBERTO FELICIO,ROBERTO FELICIO,SUPLENTE,PT,SOMOS MAIS SÃO PAULO,15
PALMITAL,DEPUTADO ESTADUAL,RAFAEL AGOSTINI,RAFAEL LUNARDELLI AGOSTINI,SUPLENTE,PT,SOMOS MAIS SÃO PAULO,1
PALMITAL,DEPUTADO ESTADUAL,BETH SAHAO,ELISABETH SAHÃO,SUPLENTE,PT,SOMOS MAIS SÃO PAULO,7
PALMITAL,DEPUTADO ESTADUAL,LELO PAGANI,LUIZ AURELIO PAGANI,SUPLENTE,PT,SOMOS MAIS SÃO PAULO,2
PALMITAL,DEPUTADO ESTADUAL,ISAC REIS,ISAC FRANCO DOS REIS,ELEITO,PT,SOMOS MAIS SÃO PAULO,35
PALMITAL,DEPUTADO ESTADUAL,BRENO CORTELLA,BRENO ZANONI CORTELLA,SUPLENTE,PT,SOMOS MAIS SÃO PAULO,1
PALMITAL,DEPUTADO ESTADUAL,ANA DO CARMO,ANA MARIA DO CARMO ROSSETO,ELEITO,PT,SOMOS MAIS SÃO PAULO,2
PALMITAL,DEPUTADO ESTADUAL,GALLO,JURANDIR GALLO,SUPLENTE,PT,SOMOS MAIS SÃO PAULO,1
PALMITAL,DEPUTADO ESTADUAL,IRENE,IRENE DOS SANTOS,SUPLENTE,PT,SOMOS MAIS SÃO PAULO,2
PALMITAL,DEPUTADO ESTADUAL,FERNANDO ESCODEIRO,LUIZ FERNANDO ESCODEIRO,SUPLENTE,PT,SOMOS MAIS SÃO PAULO,1
PALMITAL,DEPUTADO ESTADUAL,TOFFOLI,JOSÉ TICIANO DIAS TOFFOLI,SUPLENTE,PT,SOMOS MAIS SÃO PAULO,1
PALMITAL,DEPUTADO ESTADUAL,CARLOS NEDER,CARLOS ALBERTO PLETZ NEDER,SUPLENTE,PT,SOMOS MAIS SÃO PAULO,3
PALMITAL,DEPUTADO ESTADUAL,LÉO ÁQUILLA,JADSON MENDES DE LIMA,SUPLENTE,PTB,PARTIDO TRABALHISTA BRASILEIRO,2
PALMITAL,DEPUTADO ESTADUAL,CONTE LOPES,ROBERVAL CONTE LOPES LIMA,SUPLENTE,PTB,PARTIDO TRABALHISTA BRASILEIRO,7
PALMITAL,DEPUTADO ESTADUAL,CAMPOS MACHADO,ANTONIO CARLOS DE CAMPOS MACHADO,ELEITO,PTB,PARTIDO TRABALHISTA BRASILEIRO,32
PALMITAL,DEPUTADO ESTADUAL,VANDO,ORVANDO DA SILVA,SUPLENTE,PTB,PARTIDO TRABALHISTA BRASILEIRO,1
PALMITAL,DEPUTADO ESTADUAL,CORONEL EDSON FERRARINI,EDSON FERRARINI,ELEITO,PTB,PARTIDO TRABALHISTA BRASILEIRO,6
PALMITAL,DEPUTADO ESTADUAL,VAL,ENIVALDO RAMOS DE FREITAS,SUPLENTE,PTB,PARTIDO TRABALHISTA BRASILEIRO,116
PALMITAL,DEPUTADO ESTADUAL,BALEIA ROSSI,LUIZ FELIPE BALEIA TENUTO ROSSI,ELEITO,PMDB,PARTIDO DO MOVIMENTO DEMOCRÁTICO BRASILEIRO,4
PALMITAL,DEPUTADO ESTADUAL,DRA ADRIANA,ADRIANA DI NARDO SILVA,SUPLENTE,PMDB,PARTIDO DO MOVIMENTO DEMOCRÁTICO BRASILEIRO,1
PALMITAL,DEPUTADO ESTADUAL,BEBETTO,ALBERTO FELIPPE HADDAD FILHO,SUPLENTE,PMDB,PARTIDO DO MOVIMENTO DEMOCRÁTICO BRASILEIRO,32
PALMITAL,DEPUTADO ESTADUAL,CARUSO,JORGE LUIS CARUSO,ELEITO,PMDB,PARTIDO DO MOVIMENTO DEMOCRÁTICO BRASILEIRO,171
PALMITAL,DEPUTADO ESTADUAL,FABIO BELLO,FABIO BELLO DE OLIVEIRA,SUPLENTE,PMDB,PARTIDO DO MOVIMENTO DEMOCRÁTICO BRASILEIRO,1
PALMITAL,DEPUTADO ESTADUAL,MARQUINHOS SKALA,MARCOS DA SILVA MARQUES,SUPLENTE,PMDB,PARTIDO DO MOVIMENTO DEMOCRÁTICO BRASILEIRO,1
PALMITAL,DEPUTADO ESTADUAL,VANESSA DAMO,VANESSA DAMO OROSCO,ELEITO,PMDB,PARTIDO DO MOVIMENTO DEMOCRÁTICO BRASILEIRO,73
PALMITAL,DEPUTADO ESTADUAL,CAMARGO,DOMINGOS FERREIRA DE CAMARGO,SUPLENTE,PMDB,PARTIDO DO MOVIMENTO DEMOCRÁTICO BRASILEIRO,1
PALMITAL,DEPUTADO ESTADUAL,UEBE REZECK,UEBE REZECK,SUPLENTE,PMDB,PARTIDO DO MOVIMENTO DEMOCRÁTICO BRASILEIRO,10
PALMITAL,DEPUTADO ESTADUAL,ITAMAR BORGES,ITAMAR FRANCISCO MACHADO BORGES,MÉDIA,PMDB,PARTIDO DO MOVIMENTO DEMOCRÁTICO BRASILEIRO,13
PALMITAL,DEPUTADO ESTADUAL,ANGELA RAMALHO,ANGELA MARIA ANTUNES DE CARVALHO TAVARES,SUPLENTE,PMDB,PARTIDO DO MOVIMENTO DEMOCRÁTICO BRASILEIRO,1
PALMITAL,DEPUTADO ESTADUAL,JOOJI HATO,JOOJI HATO,ELEITO,PMDB,PARTIDO DO MOVIMENTO DEMOCRÁTICO BRASILEIRO,16
PALMITAL,DEPUTADO ESTADUAL,JÂNIO,JÂNIO GONÇALVES DE OLIVEIRA,SUPLENTE,PMDB,PARTIDO DO MOVIMENTO DEMOCRÁTICO BRASILEIRO,26
PALMITAL,DEPUTADO ESTADUAL,ANA PAULA ROSSI,ANA PAULA ROSSI DE ALMEIDA MAGDESIAN,SUPLENTE,PMDB,PARTIDO DO MOVIMENTO DEMOCRÁTICO BRASILEIRO,20
PALMITAL,DEPUTADO ESTADUAL,OLIVEIRA JUNIOR,ELIO APARECIDO DE OLIVEIRA,SUPLENTE,PSC,HUMANISTA CRISTÃO ,2
PALMITAL,DEPUTADO ESTADUAL,REINALDO BRICOLA,REINALDO BRICOLA,SUPLENTE,PSC,HUMANISTA CRISTÃO ,3
PALMITAL,DEPUTADO ESTADUAL,CELSO NASCIMENTO,CELSO BRAZ DO NASCIMENTO,SUPLENTE,PSC,HUMANISTA CRISTÃO ,129
PALMITAL,DEPUTADO ESTADUAL,APOSTOLO EURIPEDES,EURIPEDES LUIZ DE SOUSA,SUPLENTE,PSC,HUMANISTA CRISTÃO ,1
PALMITAL,DEPUTADO ESTADUAL,DR. CALE,CARLOS EDUARDO ANTUNES DE OLIVEIRA,SUPLENTE,PSC,HUMANISTA CRISTÃO ,1
PALMITAL,DEPUTADO ESTADUAL,PR. CARLOS CEZAR,CARLOS CEZAR DA SILVA,ELEITO,PSC,HUMANISTA CRISTÃO ,5
PALMITAL,DEPUTADO ESTADUAL,JAIMINHO,JAIME DONIZETE PEREIRA,SUPLENTE,PSC,HUMANISTA CRISTÃO ,1
PALMITAL,DEPUTADO ESTADUAL,ADILSON ROSSI,ADILSON ROSSI,ELEITO,PSC,HUMANISTA CRISTÃO ,2
PALMITAL,DEPUTADO ESTADUAL,MARIA CLELIA MARIN,MARIA CLELIA DILCIA CAPRILES MARIM,SUPLENTE,PSC,HUMANISTA CRISTÃO ,1
PALMITAL,DEPUTADO ESTADUAL,RENATO PUPO,RENATO PUPO DE PAULA,SUPLENTE,PSC,HUMANISTA CRISTÃO ,1
PALMITAL,DEPUTADO ESTADUAL,JOÃO BINATO,JOÃO ANTONIO BINATO,SUPLENTE,PSC,HUMANISTA CRISTÃO ,1500
PALMITAL,DEPUTADO ESTADUAL,RENATO LOPES,RENATO LOPES DA SILVA,SUPLENTE,PSC,HUMANISTA CRISTÃO ,1
PALMITAL,DEPUTADO ESTADUAL,MARIA DO CARMO PIUNTI,MARIA DO CARMO THOMAZ PIUNTI,SUPLENTE,PSC,HUMANISTA CRISTÃO ,4
PALMITAL,DEPUTADO ESTADUAL,CANDIDO,JOELSON CANDIDO DE OLIVEIRA,SUPLENTE,PSC,HUMANISTA CRISTÃO ,29
PALMITAL,DEPUTADO ESTADUAL,RODRIGO MORAES,RODRIGO AUGUSTO MORAES,ELEITO,PSC,HUMANISTA CRISTÃO ,98
PALMITAL,DEPUTADO ESTADUAL,BRAZ PASSARINHEIRO,BRAZ ANASTACIO DA SILVA,SUPLENTE,PSC,HUMANISTA CRISTÃO ,15
PALMITAL,DEPUTADO ESTADUAL,NELSON FERNANDES,JOSE NELSON AGUIAR FERNANDES,SUPLENTE,PSC,HUMANISTA CRISTÃO ,4
PALMITAL,DEPUTADO ESTADUAL,PRIMO,PRIMO ALEXANDRE MANGIALARGO,SUPLENTE,PSC,HUMANISTA CRISTÃO ,1
PALMITAL,DEPUTADO ESTADUAL,PAULO CORREA,PAULO HENRIQUE CORREA,SUPLENTE,PR,SOMOS MAIS SÃO PAULO,2
PALMITAL,DEPUTADO ESTADUAL,ZE PEDRO,JOSE PEDRO LEITE DA SILVA,SUPLENTE,PR,SOMOS MAIS SÃO PAULO,16
PALMITAL,DEPUTADO ESTADUAL,PATRICIA LIMA,PATRICIA FREITAS LIMA,SUPLENTE,PR,SOMOS MAIS SÃO PAULO,1
PALMITAL,DEPUTADO ESTADUAL,JOSIAS DINIZ,JOSIAS ANTONIO DINIZ,SUPLENTE,PR,SOMOS MAIS SÃO PAULO,6
PALMITAL,DEPUTADO ESTADUAL,ROY NELSON,ROY NELSON PINTO,SUPLENTE,PR,SOMOS MAIS SÃO PAULO,2
PALMITAL,DEPUTADO ESTADUAL,OSVALDO VERGINIO,OSVALDO VERGINIO DA SILVA,SUPLENTE,PR,SOMOS MAIS SÃO PAULO,74
PALMITAL,DEPUTADO ESTADUAL,ANDRE DO PRADO,ANDRE LUIS DO PRADO,ELEITO,PR,SOMOS MAIS SÃO PAULO,36
PALMITAL,DEPUTADO ESTADUAL,CLEO,CLEONICE MOREIRA DE SOUZA MONIZ,SUPLENTE,PPS,PARTIDO POPULAR SOCIALISTA,1
PALMITAL,DEPUTADO ESTADUAL,ADEMIR DA GUIA,ADEMIR DA GUIA,SUPLENTE,PPS,PARTIDO POPULAR SOCIALISTA,3
PALMITAL,DEPUTADO ESTADUAL,DAVI ZAIA,DAVID ZAIA,MÉDIA,PPS,PARTIDO POPULAR SOCIALISTA,5
PALMITAL,DEPUTADO ESTADUAL,TERRY,JOSE AUGUSTO NOVAES DE BARROS,SUPLENTE,PPS,PARTIDO POPULAR SOCIALISTA,2
PALMITAL,DEPUTADO ESTADUAL,MARCOS CHIEN,CHIEN CHIN HUEI,SUPLENTE,PPS,PARTIDO POPULAR SOCIALISTA,1
PALMITAL,DEPUTADO ESTADUAL,VITOR SAPIENZA,VITOR SAPIENZA,SUPLENTE,PPS,PARTIDO POPULAR SOCIALISTA,660
PALMITAL,DEPUTADO ESTADUAL,EDINHO RIBEIRO,ED WILSON CARVALHO RIBEIRO,SUPLENTE,PPS,PARTIDO POPULAR SOCIALISTA,1
PALMITAL,DEPUTADO ESTADUAL,GONDIM,LUIZ CARLOS GONDIM TEIXEIRA,ELEITO,PPS,PARTIDO POPULAR SOCIALISTA,229
PALMITAL,DEPUTADO ESTADUAL,ESTEVÃO,STEVEN ERIKSEN BINNIE,SUPLENTE,PPS,PARTIDO POPULAR SOCIALISTA,2
PALMITAL,DEPUTADO ESTADUAL,PROFESSOR ZE MARIA,JOSE MARIA CANCELLIERO,SUPLENTE,PPS,PARTIDO POPULAR SOCIALISTA,12
PALMITAL,DEPUTADO ESTADUAL,MARCELO CYPRIANO,MARCELO DA SILVA CYPRIANO,SUPLENTE,PPS,PARTIDO POPULAR SOCIALISTA,1
PALMITAL,DEPUTADO ESTADUAL,ANDRE SOARES,ANDRE BEZERRA RIBEIRO SOARES,ELEITO,DEM,PSDB/DEM,22
PALMITAL,DEPUTADO ESTADUAL,ULISSES SALES,ULISSES ROBERTO CORNAZZANI SALES,SUPLENTE,DEM,PSDB/DEM,4
PALMITAL,DEPUTADO ESTADUAL,EDMIR CHEDID,EDMIR JOSE ABI CHEDID,ELEITO,DEM,PSDB/DEM,12
PALMITAL,DEPUTADO ESTADUAL,ALDO DEMARCHI,JOSE ALDO DEMARCHI,ELEITO,DEM,PSDB/DEM,3
PALMITAL,DEPUTADO ESTADUAL,JOAO MELLAO NETO,JOAO MELLAO NETO,SUPLENTE,DEM,PSDB/DEM,13
PALMITAL,DEPUTADO ESTADUAL,FERNANDO LUCAS,LUIZ FERNANDO AMARAL LUCAS,SUPLENTE,DEM,PSDB/DEM,5
PALMITAL,DEPUTADO ESTADUAL,ESTEVAM GALVAO,ESTEVAM GALVAO DE OLIVEIRA,ELEITO,DEM,PSDB/DEM,5
PALMITAL,DEPUTADO ESTADUAL,RICARDO SALLES,RICARDO DE AQUINO SALLES,SUPLENTE,DEM,PSDB/DEM,4
PALMITAL,DEPUTADO ESTADUAL,TOMAZELLA,GERALDO TOMAZELA FILHO,SUPLENTE,DEM,PSDB/DEM,3
PALMITAL,DEPUTADO ESTADUAL,GIL ARANTES,GILBERTO MACEDO GIL ARANTES,ELEITO,DEM,PSDB/DEM,130
PALMITAL,DEPUTADO ESTADUAL,ZE TURIN,JOSE ARIVALDO RODRIGUES,SUPLENTE,DEM,PSDB/DEM,11
PALMITAL,DEPUTADO ESTADUAL,LEANDRO DO KLB,LEANDRO FINATO SCORNAVACCA,SUPLENTE,DEM,PSDB/DEM,17
PALMITAL,DEPUTADO ESTADUAL,IVAN TESOURINHA STRINGHI,IVAN STRINGHI,SUPLENTE,DEM,PSDB/DEM,2
PALMITAL,DEPUTADO ESTADUAL,DR. VLAMIR,VLAMIR SÉRGIO D'EMILIO LANDUCCI,SUPLENTE,PSB,PARTIDO SOCIALISTA BRASILEIRO,1
PALMITAL,DEPUTADO ESTADUAL,PAULO CELEGATO,PAULO RUBENS CELEGATO,SUPLENTE,PSB,PARTIDO SOCIALISTA BRASILEIRO,3
PALMITAL,DEPUTADO ESTADUAL,ED THOMAS,EDSON TOMAZINI,ELEITO,PSB,PARTIDO SOCIALISTA BRASILEIRO,9
PALMITAL,DEPUTADO ESTADUAL,IRMÃO OZELITO,OZELITO JOSE BENEDITO,SUPLENTE,PSB,PARTIDO SOCIALISTA BRASILEIRO,1
PALMITAL,DEPUTADO ESTADUAL,ALEXANDRE OLIVEIRA,ALEXANDRE OLIVEIRA,SUPLENTE,PSB,PARTIDO SOCIALISTA BRASILEIRO,1
PALMITAL,DEPUTADO ESTADUAL,HILKIAS,HILKIAS DE OLIVEIRA,SUPLENTE,PSB,PARTIDO SOCIALISTA BRASILEIRO,4
PALMITAL,DEPUTADO ESTADUAL,YVONE BARREIROS,YVONE BARREIROS MOREIRA,SUPLENTE,PSB,PARTIDO SOCIALISTA BRASILEIRO,4
PALMITAL,DEPUTADO ESTADUAL,DAVID BUENO,DAVID JOSE BUENO GOMES,SUPLENTE,PSB,PARTIDO SOCIALISTA BRASILEIRO,1
PALMITAL,DEPUTADO ESTADUAL,DR FRANCISCO,FRANCISCO MARCIO DE CARVALHO,SUPLENTE,PSB,PARTIDO SOCIALISTA BRASILEIRO,5
PALMITAL,DEPUTADO ESTADUAL,GERALDO FORTE,GERALDO DOS SANTOS,SUPLENTE,PSB,PARTIDO SOCIALISTA BRASILEIRO,1
PALMITAL,DEPUTADO ESTADUAL,VINICIUS CAMARINHA,VINICIUS ALMEIDA CAMARINHA,ELEITO,PSB,PARTIDO SOCIALISTA BRASILEIRO,194
PALMITAL,DEPUTADO ESTADUAL,DRA. DORA,MARIA AUXILIADORA ZANIN,SUPLENTE,PSB,PARTIDO SOCIALISTA BRASILEIRO,1
PALMITAL,DEPUTADO ESTADUAL,GIRIBONI,EDSON DE OLIVEIRA GIRIBONI,ELEITO,PV,PARTIDO VERDE,1
PALMITAL,DEPUTADO ESTADUAL,ADRIANA RODRIGUES,ADRIANA LARIO RAMALHO RODRIGUES,SUPLENTE,PV,PARTIDO VERDE,9
PALMITAL,DEPUTADO ESTADUAL,FELICIANO,FELICIANO NAHIMY FILHO,ELEITO,PV,PARTIDO VERDE,5
PALMITAL,DEPUTADO ESTADUAL,DR PAULO CÉSAR (PC),PAULO CESAR DA SILVA FERREIRA,SUPLENTE,PV,PARTIDO VERDE,1
PALMITAL,DEPUTADO ESTADUAL,SANDRA BARROS,SANDRA MARA BENITES DE BARROS,SUPLENTE,PV,PARTIDO VERDE,1
PALMITAL,DEPUTADO ESTADUAL,CAMILO GAVA,JOSÉ CAMILO GAVA NETO,SUPLENTE,PV,PARTIDO VERDE,451
PALMITAL,DEPUTADO ESTADUAL,FERNANDO ZONA SUL,FERNANDO PEREIRA DE SOUZA,SUPLENTE,PV,PARTIDO VERDE,1
PALMITAL,DEPUTADO ESTADUAL,JULIA ELIZABETH FONSECA,JULIA ELIZABETH FONSECA,SUPLENTE,PV,PARTIDO VERDE,1
PALMITAL,DEPUTADO ESTADUAL,CLAUDINHO GASPAR,CLAUDIO GASPAR DOTTORI,SUPLENTE,PV,PARTIDO VERDE,1
PALMITAL,DEPUTADO ESTADUAL,MARIA CRISTINA DI CIESCO,MARIA CRISTINA MESA MUNARIN DI CIESCO,SUPLENTE,PV,PARTIDO VERDE,1
PALMITAL,DEPUTADO ESTADUAL,DR PAULO DE TARSO,PAULO DE TARSO NUNES CHIODE,SUPLENTE,PV,PARTIDO VERDE,9
PALMITAL,DEPUTADO ESTADUAL,RITA PASSOS,RITA DE CASSIA TRINCA PASSOS,ELEITO,PV,PARTIDO VERDE,21
PALMITAL,DEPUTADO ESTADUAL,CLODOALDO GAZZETTA,CLODOALDO ARMANDO GAZZETTA,SUPLENTE,PV,PARTIDO VERDE,3
PALMITAL,DEPUTADO ESTADUAL,BRAZ ALBERTINI,BRAZ AGOSTINHO ALBERTINI,SUPLENTE,PV,PARTIDO VERDE,25
PALMITAL,DEPUTADO ESTADUAL,FERNANDO MARREY FERREIRA,FERNANDO MARREY FERREIRA,SUPLENTE,PV,PARTIDO VERDE,6
PALMITAL,DEPUTADO ESTADUAL,MÁRCIA MONTEZ,MÁRCIA REGINA MONTEZ HALASZ,SUPLENTE,PV,PARTIDO VERDE,1
PALMITAL,DEPUTADO ESTADUAL,DR. ULYSSES,ULYSSES MARIO TASSINARI,MÉDIA,PV,PARTIDO VERDE,1
PALMITAL,DEPUTADO ESTADUAL,DR. DOMINGOS,DOMINGOS EZENILDO MATOS DOS SANTOS,SUPLENTE,PV,PARTIDO VERDE,1
PALMITAL,DEPUTADO ESTADUAL,REINALDO ALGUZ,REINALDO DE SOUZA ALGUZ,ELEITO,PV,PARTIDO VERDE,114
PALMITAL,DEPUTADO ESTADUAL,GENÁRIO NASCIMENTO,GENÁRIO NASCIMENTO DA CRUZ,SUPLENTE,PV,PARTIDO VERDE,3
PALMITAL,DEPUTADO ESTADUAL,PASTOR DILMO DOS SANTOS,DILMO DOS SANTOS,ELEITO,PV,PARTIDO VERDE,16
PALMITAL,DEPUTADO ESTADUAL,DENIS MARICATO,DENIS MAURILIO MARICATO,SUPLENTE,PV,PARTIDO VERDE,8
PALMITAL,DEPUTADO ESTADUAL,JESSE LOURES,JESSE LOURES DE MORAES,SUPLENTE,PV,PARTIDO VERDE,2
PALMITAL,DEPUTADO ESTADUAL,CARLOS ANDRADE,CARLOS ALBERTO APARECIDO DE ANDRADE,SUPLENTE,PV,PARTIDO VERDE,2
PALMITAL,DEPUTADO ESTADUAL,GORDINHO DA PAZ,ARTUR DA SILVA MERENCIO,SUPLENTE,PV,PARTIDO VERDE,1
PALMITAL,DEPUTADO ESTADUAL,HELIO RUBENS,HELIO RUBENS GONÇALVES FIGUEIREDO,SUPLENTE,PSDB,PSDB/DEM,1
PALMITAL,DEPUTADO ESTADUAL,JOSÉ URSILIO,JOSE URSILIO DE SOUZA E SILVA,SUPLENTE,PSDB,PSDB/DEM,2
PALMITAL,DEPUTADO ESTADUAL,UBIRAJARA GUIMARÃES,UBIRAJARA PEREIRA GUIMARÃES,SUPLENTE,PSDB,PSDB/DEM,14
PALMITAL,DEPUTADO ESTADUAL,MARIA ZEFERINA BALDAIA,MARIA ZEFERINA RODRIGUES BALDAIA,SUPLENTE,PSDB,PSDB/DEM,3
PALMITAL,DEPUTADO ESTADUAL,FÁBIO AURICCHIO,FABIO LUIZ AURICCHIO,SUPLENTE,PSDB,PSDB/DEM,1
PALMITAL,DEPUTADO ESTADUAL,EVANDRO LOSACCO,EVANDRO LUIZ LOSACCO,SUPLENTE,PSDB,PSDB/DEM,19
PALMITAL,DEPUTADO ESTADUAL,PEDRO TOBIAS,PEDRO TOBIAS,ELEITO,PSDB,PSDB/DEM,11
PALMITAL,DEPUTADO ESTADUAL,MILTON FLAVIO,MILTON FLAVIO MARQUES LAUTENSCHLAGER,SUPLENTE,PSDB,PSDB/DEM,34
PALMITAL,DEPUTADO ESTADUAL,GERALDO VINHOLI,GERALDO ANTONIO VINHOLI,SUPLENTE,PSDB,PSDB/DEM,4
PALMITAL,DEPUTADO ESTADUAL,PROF. ADEMIR,JOSÉ ADEMIR DA SILVA,SUPLENTE,PSDB,PSDB/DEM,3
PALMITAL,DEPUTADO ESTADUAL,HEITOR SERTAO,HEITOR SERTÃO,SUPLENTE,PSDB,PSDB/DEM,4
PALMITAL,DEPUTADO ESTADUAL,RAMALHO DA CONSTRUCAO,ANTONIO DE SOUSA RAMALHO,SUPLENTE,PSDB,PSDB/DEM,17
PALMITAL,DEPUTADO ESTADUAL,WELSON GASPARINI,WELSON GASPARINI,SUPLENTE,PSDB,PSDB/DEM,46
PALMITAL,DEPUTADO ESTADUAL,MAURO BRAGATO,MAURO BRAGATO,ELEITO,PSDB,PSDB/DEM,3695
PALMITAL,DEPUTADO ESTADUAL,JOÃO CARAMEZ,JOÃO CARLOS CARAMEZ,ELEITO,PSDB,PSDB/DEM,4
PALMITAL,DEPUTADO ESTADUAL,BRUNO COVAS,BRUNO COVAS LOPES,ELEITO,PSDB,PSDB/DEM,11
PALMITAL,DEPUTADO ESTADUAL,MILTON MORATO,MILTON LUIZ RODRIGUES MORATO,SUPLENTE,PSDB,PSDB/DEM,1
PALMITAL,DEPUTADO ESTADUAL,JOSE BORANGA,JOSE AURELIO BORANGA,SUPLENTE,PSDB,PSDB/DEM,17
PALMITAL,DEPUTADO ESTADUAL,ADOLFO QUINTAS,ADOLFO QUINTAS GONÇALVES NETO,SUPLENTE,PSDB,PSDB/DEM,5
PALMITAL,DEPUTADO ESTADUAL,VITO ARDITO,VITO ARDITO LERARIO,SUPLENTE,PSDB,PSDB/DEM,2
PALMITAL,DEPUTADO ESTADUAL,DILADOR BORGES,DILADOR BORGES DAMASCENO,SUPLENTE,PSDB,PSDB/DEM,2
PALMITAL,DEPUTADO ESTADUAL,ADMIR FERRO,ADMIR DONIZETI FERRO,SUPLENTE,PSDB,PSDB/DEM,1
PALMITAL,DEPUTADO ESTADUAL,CARLOS ALBERTO SANTOS,CARLOS ALBERTO DE OLIVEIRA SANTOS,SUPLENTE,PSDB,PSDB/DEM,1
PALMITAL,DEPUTADO ESTADUAL,MAURICIO PINTERICH,MAURICIO DE OLIVEIRA PINTERICH,SUPLENTE,PSDB,PSDB/DEM,1
PALMITAL,DEPUTADO ESTADUAL,ANALICE FERNANDES,ANALICE FERNANDES,ELEITO,PSDB,PSDB/DEM,3
PALMITAL,DEPUTADO ESTADUAL,FELIPE AUGUSTO,FELIPE AUGUSTO,SUPLENTE,PSDB,PSDB/DEM,1
PALMITAL,DEPUTADO ESTADUAL,CAUÊ MACRIS,CAUÊ CASEIRO MACRIS,MÉDIA,PSDB,PSDB/DEM,2
PALMITAL,DEPUTADO ESTADUAL,EDISON CANDIDO,EDISON APARECIDO CANDIDO,SUPLENTE,PSDB,PSDB/DEM,1
PALMITAL,DEPUTADO ESTADUAL,CONCCI MARCO,ELIANE CONCEIÇÃO SILVA MENDES,SUPLENTE,PSDB,PSDB/DEM,3
PALMITAL,DEPUTADO ESTADUAL,JOÃO SANZOVO,JOÃO SANZOVO NETO,SUPLENTE,PSDB,PSDB/DEM,5
PALMITAL,DEPUTADO ESTADUAL,ROBERTO MASSAFERA,ROBERTO MASSAFERA,ELEITO,PSDB,PSDB/DEM,24
PALMITAL,DEPUTADO ESTADUAL,BARROS MUNHOZ,JOSE ANTONIO BARROS MUNHOZ,ELEITO,PSDB,PSDB/DEM,13
PALMITAL,DEPUTADO ESTADUAL,CELSO GIGLIO,CELSO ANTONIO GIGLIO,ELEITO,PSDB,PSDB/DEM,5
PALMITAL,DEPUTADO ESTADUAL,PAULO ALEXANDRE BARBOSA,PAULO ALEXANDRE PEREIRA BARBOSA,ELEITO,PSDB,PSDB/DEM,18
PALMITAL,DEPUTADO ESTADUAL,JOSE AUGUSTO,JOSE AUGUSTO DA SILVA RAMOS,SUPLENTE,PSDB,PSDB/DEM,11
PALMITAL,DEPUTADO ESTADUAL,FERNANDO CAPEZ,FERNANDO CAPEZ,ELEITO,PSDB,PSDB/DEM,51
PALMITAL,DEPUTADO ESTADUAL,JOSÉ LUIZ RIBEIRO,JOSÉ LUIZ RIBEIRO,SUPLENTE,PSDB,PSDB/DEM,1
PALMITAL,DEPUTADO ESTADUAL,MARCOS ZERBINI,MARCOS ANTONIO ZERBINI,ELEITO,PSDB,PSDB/DEM,4
PALMITAL,DEPUTADO ESTADUAL,MILTON DALLARI,JOSÉ MILTON DALLARI SOARES,SUPLENTE,PSDB,PSDB/DEM,2
PALMITAL,DEPUTADO ESTADUAL,DIOBEL DA DIDOL'S,DIOBEL DE LIMA FERNANDES,SUPLENTE,PSDB,PSDB/DEM,1
PALMITAL,DEPUTADO ESTADUAL,CLÁUDIO FURQUIM,CLÁUDIO SIMÕES FURQUIM LEITE JÚNIOR,SUPLENTE,PSDB,PSDB/DEM,7
PALMITAL,DEPUTADO ESTADUAL,JOÃO DAS CABRAS,JOÃO EVANGELISTA ALVES VIEIRA,SUPLENTE,PSOL,PARTIDO SOCIALISMO E LIBERDADE,1
PALMITAL,DEPUTADO ESTADUAL,JORGE NELSON,JORGE NELSON DA SILVA AMARAL,SUPLENTE,PSOL,PARTIDO SOCIALISMO E LIBERDADE,4
PALMITAL,DEPUTADO ESTADUAL,RAUL MARCELO,RAUL MARCELO DE SOUZA,SUPLENTE,PSOL,PARTIDO SOCIALISMO E LIBERDADE,1
PALMITAL,DEPUTADO ESTADUAL,GUIMARÃES O GUERREIRO,HERALDO LOPES GUIMARÃES,SUPLENTE,PSOL,PARTIDO SOCIALISMO E LIBERDADE,1
PALMITAL,DEPUTADO ESTADUAL,CARLOS GIANNAZI,CARLOS ALBERTO GIANNASI,ELEITO,PSOL,PARTIDO SOCIALISMO E LIBERDADE,45
PALMITAL,DEPUTADO ESTADUAL,WANDER,WANDER DE OLIVEIRA VILLALBA,SUPLENTE,PC DO B,PARTIDO COMUNISTA DO BRASIL,1
PALMITAL,DEPUTADO ESTADUAL,ERLEI ALIADO,ERLEI ROBERTO DE MELO,SUPLENTE,PC DO B,PARTIDO COMUNISTA DO BRASIL,4
PALMITAL,DEPUTADO ESTADUAL,LECI BRANDÃO,LECI BRANDAO DA SILVA,ELEITO,PC DO B,PARTIDO COMUNISTA DO BRASIL,5
PALMITAL,DEPUTADO ESTADUAL,SIDNEY,SIDNEY LIBERTI,SUPLENTE,PC DO B,PARTIDO COMUNISTA DO BRASIL,1
PALMITAL,DEPUTADO ESTADUAL,SARAH MUNHOZ,SARAH MUNHOZ,SUPLENTE,PC DO B,PARTIDO COMUNISTA DO BRASIL,7
PALMITAL,DEPUTADO ESTADUAL,ALCIDES AMAZONAS,ALCIDES ARAUJO DOS SANTOS,SUPLENTE,PC DO B,PARTIDO COMUNISTA DO BRASIL,1
PALMITAL,DEPUTADO ESTADUAL,PEDRO BIGARDI,PEDRO ANTONIO BIGARDI,ELEITO,PC DO B,PARTIDO COMUNISTA DO BRASIL,4
PALMITAL,DEPUTADO ESTADUAL,JEAN LOPES,JEAN CARLOS SOARES LOPES,SUPLENTE,PC DO B,PARTIDO COMUNISTA DO BRASIL,2
PALMITAL,DEPUTADO ESTADUAL,GABRIEL BITENCOURT,GABRIEL CESAR BITENCOURT,SUPLENTE,PC DO B,PARTIDO COMUNISTA DO BRASIL,1
PALMITAL,DEPUTADO ESTADUAL,CAJU,RICARDO ALVES DA SILVA,SUPLENTE,PC DO B,PARTIDO COMUNISTA DO BRASIL,1
PALMITAL,DEPUTADO ESTADUAL,PROFESSOR FLAVIO DELMANTO,FLAVIO DELMANTO,SUPLENTE,PC DO B,PARTIDO COMUNISTA DO BRASIL,5
PALMITAL,DEPUTADO ESTADUAL,ONOFRE GONÇALVES,ONOFRE GONÇALVES DE JESUS,SUPLENTE,PC DO B,PARTIDO COMUNISTA DO BRASIL,1
PALMITAL,DEPUTADO ESTADUAL,BENASSI,SÉRGIO BENASSI,SUPLENTE,PC DO B,PARTIDO COMUNISTA DO BRASIL,1
PALMITAL,DEPUTADO ESTADUAL,DITO LEITE,SILVIO ROBERTO PACHECO,SUPLENTE,PC DO B,PARTIDO COMUNISTA DO BRASIL,8
PALMITAL,DEPUTADO ESTADUAL,ABEL ALMEIDA,ABEL OLIVEIRA DE ALMEIDA,SUPLENTE,PT DO B,SOMOS MAIS SÃO PAULO,1
PALMITAL,DEPUTADO ESTADUAL,MANOEL RUFINO,MANOEL RUFINO FILHO,SUPLENTE,PT DO B,SOMOS MAIS SÃO PAULO,3
PALMITAL,DEPUTADO ESTADUAL,PAULO CORRÊA JR,PAULO ALVES CORRÊA JUNIOR,SUPLENTE,PT DO B,SOMOS MAIS SÃO PAULO,4
